,0
100,。後援：キャッチボールのできる公園づくり推進会ほか。問同センター☎６０‐１８６３子育て支援事業予約欄の◎は事前に申込み，☆は当日，直接会場へ。保育園であそぼう特に表記のない事業は保育園に入所し
101,があったりすることもあります。ですから、森の案内人の会ではできるだけ申込まれたグループなどが希望する場所について得意なメンバーが案内できるように配慮しています。森
102,ばＬＡＮアダプタ（百二十一ページ参照）は自分で準備しておきましょう。２回線をつなげる電話で申込んだ日から開通まで、普通は１週間から２週間ぐらいかかります。開通日になったらまず
103,は問題なしです。ただ、申込みの際また、ドコモまで行かなくてはいけないので、先に申込んで、半月くらい様子みて解約でもいいかも。日割り計算だった気がし
104,幼児は保護者と一緒に参加してください。○申込みが必要な行事は、本人が直接申込んでください。※…中学・高校生の夜間利用日を設けています。《詳細は各児童会館まで、お問い合わせください》
105,として受け取れるというシステムです。興味のある方は『ニコニコぼいす』＋『新オプション』で申込んではいかがでしょうか？●最高日給二万二千円！すでに六千名以上が参加！●メインのビジネスを
106,８年間付き合っている彼が結婚を申込んできました。一昨日、指輪を受け取って欲しいって言われたのですが迷っています
107,彼女は頭を振った。見たことも聞いたこともない人物からチャットを申込まれることもある。おそらくゲーム内で知り合っただれかで、なにか確認したいことでもあったのだろう
108,た。それにもかかわらず、昨年６月になって突然、病院側が高額での示談を申込んできたんです。止血用のクリップが外れて出血性ショックを起こしたことへの謝罪という意味
109,所灘区民ホール５階大ホール￥二千円、団体・グループ四千円申区民ホールで配布する申込書に記入のうえ、４月二十五日金までに申込んでください（先着順）問灘区民ホール☎８０２‐８５５５ＦＡＸ８０２‐９８１１保健・福祉区民健康講座と健康相談日４月二十五日金十三：００〜十五：００
110,＝二十人（六十歳以上のかた）・受講料＝千円◎申込方法＝記入例を参考に往復はがきで申込む。・申込締切＝５月８日（木）必着・受講決定＝締切日以降にはがきで連絡します。
111,に頰杖をついている女の子たちの姿が、私には気になった。取材を申込んでみるが、たいていは断ってくる。ようやく気軽に応じてくれた女の子の二人組は、
112,搬入をお願いします。※粗大ごみを自分で搬入できない場合は、粗大ごみ受付センター（有料）に申込んでください。西部クリーンセンター川部町九百三十‐１☎八百八十五．二七二七※日曜日・祝日・年末年始（十二月二十八日〜１月４日）は
113,か？「何日前に手付け」というのではないのが一般的です。出発の一ヶ月以上前に申込んだ場合は、申込んでから３日から７日以内に予約金（以降航空券代金になる）を支払い
114,種の負けん気を抱き、こっそりと先生から受験方法を聞き出し、両親に黙って申込んだ。ところがこの時はフランス語がわからなかったので合格しなかった。仕方なく父の意
115,で空き状況の確認や利用の申込みが可能となれば，これまで平日に直接申込むことができなかった社会人なども利用が可能となり，スポーツ活動を行いやすくなる。このよう
116,のかもしれないが常田さんはそうではなかった。そこに魅力を感じてお手伝いを申込んだ。月一回の展示換え、８月は二十四日に決まった。
117,アメリカは、そういう国に対して、港を開き、アメリカ船を入港させてもらえるよう申込むためのアプローチをしなければならないのです。つまり、アメリカは日本にお願いする立場だったということ
118,、会員七千五百円申込み／十二月８日（月）までに、市ワンダーフォーゲル協会■■さん（☎■■■■■■■■■■■■■）に申込んだ後、指定の銀行口座へ参加費を入金。周知会／十二月９日（火）午後６時
119,あて先を明記して、〒２６０‐８７２２千葉市役所高齢福祉課へ。＊家族、友人などと一緒に申込む場合はその旨明記。問い合わせ高齢福祉課☎（二百四十五）五千百六十九ＦＡＸ（二百四十五）五千五百四十八Ｅメールｋｏｒｅｉ．ＨＷＳ＠ｃｉｔｙ．ｃｈｉｂａ．ｌｇ．ｊｐ
120,ＦＣ優先予約で申込んだ７月十九日の秋川さんのコンサートチケット確保確定しました。先程ＦＣから来た下記メールにて申込んだ方全員の当選のお知らせでした。ＦＣで申込まれた方おめでとうございました。
121,申込む・雑誌の付録や書店などでプロバイダが提供しているＣＤ‐ＲＯＭ（シーディー・ロム）を利用して申込む・ウィンドウズにあらかじめ用意されている「インターネット接続ウィザード」を利用して申込む「インターネット接続ウィザード」を利用する
122,、使った方にお聞きしたいのですが、買い！な商品ですか？友達に「申込んだけど品切れだった」と言ったら、「うちらの年齢層が使うものじゃないんじゃないの
123,初めて門弟にした高崎の小泉某のもとに止宿していたとき、周作に試合を申込んだものがいた。周作は、快く承諾して立合った。一人は力自慢で
124,セットになったもので、税込み表示価格です。１泊２日料金以下の金額は全て、２名で申込んだ場合の東京駅からの往復の新幹線普通車指定席での料金と１泊とリフト１日券（蔵王は
125,以前韓国に行って旅行会社で北韓の金剛山ツアーがあったので申込もうと思ったらイルポニンはダメだといわれました。獨島のツアーもダメらしいです。
126,窓口で加入を拒否された。第四点が、任意加入の大学生が国民年金への加入を申込むと、あなたは学生だから加入しなくてもよいと断られた。あるいは五番目として、大学生
127,市役所（四十五小間）申込方法往復ハガキに郵便番号、住所、氏名、電話番号、出店品目を記入し申込む申込期限８月十一日（月）必着※応募多数の場合は抽選申込み・問い合わせ産業観光課「フリーマーケット」係■
128,。八十年代のことだが、保守党のキース・ベスト議員が民営化されたブリティッシュ・テレコムの株式を二重に申込んでいたことが発覚した。株式公開の条件は、申込みを一人一株に限るというもの
129,の赤ちゃんに、もれなく純金の記念メダルを贈りつづけている。生年月日を証明する住民票を添えて申込むだけで、かならず純金メダルが貰えるのだ。言うまでもないが、もちろん無料である。二月
130,６ヶ月間保管されます。万全を期すなら、最後に申込んだ日より６〜７ヶ月間待ってから申込むと良いかと・・・
131,医療機関で交付します）、保険証等をお持ちになり、医療機関の一般診療時間内に受診して下さい。※健康課に申込む必要はありません。※検診日時が決められている医療機関がありますので、ご注意下さい。
132,はがき（〒１６０・００１６東京都新宿区信濃町三十五信濃町煉瓦館メディカス、ぜんそくフォーラム係）かＦＡＸ（０１２０・６０２７５３）で申込む。６月９日午後１時半、茨城県つくば市のつくば国際会議場（申込み５月二十五日必着）▽同十六日午後１時半
133,「そいつがいい。視聴者が喜ぶ」とアシスタントディレクターが応じた。「ミスター・セックスアピールがデートを申込む図。数万人のボストン市民の前でひざまずいて申込むのにご婦人は美しい顔に笑みを
134,が表示されないと意味無いので・・・通常のナンバーディスプレイと思いますのでＮＴＴの申込んだ分ならあなたのもつＮＴＴ番号にかけた分しか表示されず０５０の番号
135,更新手続き完了！ＪＳＢＡ会員の皆様、来年度の更新手続きはお済みですかぁ〜〜？ワタシは携帯から申込んでコンビニ決済にて完了です。
136,たのに。ヨンジュンさんが久々の来日だから、大阪に行くんだけど、ツアーで申込むから間に合わないわ。チソン、ごめんね」〇２００８年５月三十一日（土）チソン〜
137,ないとわかりませんよ。調停自体は簡単です。家裁に申込みの方法を聞いて申込めば、すぐにあなたと浮気男に呼出がかかります。心配しなくても、夫婦が
138,、各グループごとに行われます。入会希望のかたは、公開日時に見学のうえ、直接グループに申込んでください。いきいきだよりまちの話題あれこれ動物たちとのふれあい十二月十四日（金）、動物たち
139,導入して、その恩恵を実感できるＰＣの最低限のスペックを教えて下さい。ＮＴＴのＢフレッツに申込んだときに推奨はＸＰと言われ、当時九十八だった私は断念しました。
140,から、さっき電話がかかってきましたーーー！非通知でなくて、番号有り。申込んでおきながらびっくりです！とっさの事で、録音できませんでしたー（笑
141,で、どうしろとおっしゃるんです、このわしに？」「コファンさんは以前ジェラルドに申込まれた、スラメトリジャディ通りのあの土地と営業権を三億ルピアで譲ってくれと」「そういう
142,離婚させられた。三番目が、障害者になって早い時期に国民年金への加入を申込むと、窓口で加入を拒否された。第四点が、任意加入の大学生が国民年金への
143,入院棟の受付へ行って、こちらの素性を明らかにして五十公野への面会を申込んだ。受付係の面に当惑の色が塗られた。受付係は三人にちょっと待つ
144,住宅ローンの借り換えってありますが、申込む場合に審査あるんですよね？借り換えで審査が通らない場合ってありますか？
145,か？申込んだらすぐに取引に使えるところを知りたいです（ない？）インターネットから申込んでそれで即取引できるわけではありません。申込み用紙が郵送できますのでそれと共
146,有難う御座います。Ｔシャツの件ですが激龍隊隊員さんでなくても。注文宜しいです。どしどし申込み受付ます。色は白と黒の２種類です。サイズはＭ・Ｌ・ＬＬです。写真は背中
147,報告がもたらされたので、金軍は力まかせの攻撃を断念し、欽宗皇帝からの和平の申込みに応じることにした。「責任をとって帝（徽宗）は退位あそばされた。
148,種類は、普通預金でよろしいのでしょうか？どうぞよろしくお願いします。口座種類は普通預金。ネットから申込んだなら支店名は、本店（四百）です。店舗で申込んだなら申込みをした
149,一方で、ルージンが真摯にもしきたりを守って、まず初めに親の方へ申込んだことに、彼女は気分を良くしていた。「とうとう言ってきた
150,ついたのである。ある日―。北風は、太陽にもう一度の勝負を申込みました。いつもニコニコとして朗らかな太陽は、何の疑いもなくこれ
151,を設けています。この制度を利用する場合、排水設備等計画確認申請書を提出するときに、同時に申込むことが必要です。水洗便所等改造資金融資あっせん制度対象市内に住所を有する個人で、排水設備工事を行う家屋
152,ましたか？当たりました。Ｅトレ歴４年、６ポイントでネクサスが当たりました。５株申込んで１株当たりました。
153,ウィルスバスター二千四を使用されていれば、ヤフーメールなどのＷＥＢメールもチェックしてくれますので、ヤフーメールウイルスチェックサービスを申込む必要はありません。もしも、ウィルスバスター二千四より古いものを使用されているのなら
154,、事前に身体障害者手帳と印鑑を持参のうえ、障害福祉課☎９２４‐２３８１へ。※当日会場での申込み可バレンタインチョコ作り教室日時…２月十日（日）午前十時〜正午対象…十八歳以上の身体障害者手帳を
155,てください。また、疾患のある人や妊娠中の人は、必ず主治医の許可の下申込んでください。※申込多数の場合は抽選とします。申問【市】健康推進課（保健相談センター
156,、結婚、還暦を迎えた人に記念の樹木を贈ります。希望者はぜひ、申込んでください。期日＝十月二十六日（日）場所＝敷島公園ばら園対象＝次のいずれかに該当する
157,送料は鈴木はり灸院で負担します。希望の方は鈴木はり灸院へメールｓｕｚｕｋｉ−ｈａｒｉ＠ｍａｉｌ．ｗｂｓ．ｎｅ．ｊｐで申込んでください。がん克服の冊子無料配布（がんばれ百二十八万部）もご覧ください。二千八／十一／０２（日）特別講座（鍼灸治療研修会）
158,のみ）…運転免許証のように、本人確認の際の身分証明書として使用できます。どうやって申込むの？●申請場所…市民課（市役所本館１階）、行政センター、支所、滑石・黒崎・池島・村松の各事務所●申請
159,。そして、そうした補償以外にも利点がある。いざ現地に到着して現地ツアーに申込むのに支障がない。また、レンタカーも、カードがあればすんなりレンタルできるのだ。
160,別業界の信販系でなら他社の申込み履歴（借り入れ状況ではなく）位は分からないだろうと今度、申込んでみようかと思うんですが、どうなんでしょうか、バレますか！？信用情報機関はいくつ
161,提出すれば取得することができます。登記事項証明書申請書の記入例５インターネットで登記情報を入手するには民事法務協会に申込み、ＩＤとパスワードを取得して請求■インターネットで登記情報を見ようテレビや新聞等で「
162,で，母子健康手帳とバスタオルを持参。申・問電話または直接健康課へ。＊「もく浴体験クラス」を別途申込み，併せての受講をお勧めします。■ペンギン学級１回目：平成二十一年２月７日（土）
163,吉良側が自分の知行地（三河湾の吉良地方）で真似しようとしてその製法の伝授を申込み、浅野家からすげなく断わられたので、その腹いせに内匠頭をいじめたのであろう―との
164,〒６５７‐８５７０（住所不要）区役所まちづくり課へ。郵送または持参。６月９日月必着。ペアで申込んでください※大会中の事故の責任は負いません問■■☎■■■■■■■■保健・福祉区民健康講座と健康相談日
165,を明記し、〒６５０‐８５１５神戸市中央区東川崎町一ノ二ノ二ＨＤＣ神戸ビル五階ＮＨＫ神戸放送局「はなのキャンパストーク」係に申込む。十月二十七日必着。定員三百人（多数の場合抽選）ＮＨＫ神戸放送局☎０７８・３７１・８５２７ブラック・ジャックに託した
166,の会員が集まっている。エフエービジョンはサービス開始と同時に、ＮＨＫに対して受信料の支払いを申込んだ。満を持しての意思表明、ということだったのだろう。春日弁護士も「こちらから
167,か？その場合、術後どれくらいを予定していいのでしょうか？結論から言えば、申込んでみないとわからない、というのが正直な所です。告知内容は１最近３ヶ月以内
168,．．．ゆうちょ銀行または郵便局の貯金窓口で、送金額の現金と所定の料金を添えて申込みます。送金額を記載した普通為替証書を発行してくれるので、所定の受取人欄に受取人のお名前を
169,そのまえにまず更新で不十分だった説明文を追加して入札者から入札の取り消しを申込まれたらすんなり受ければいいだけであってもし何も言ってこない場合は相手
170,〕画家→教員〈雪八十三〉［百四］支那人のくせに結婚を申込むなんて―。娘→父〈古戦二百四十六〉当時は中国を「支那
171,の受診】受診希望日の１週間前までに、弘前市医師会健診センター（野田２丁目、☎三十九．六六一一）へ直接申込んでください。【指定医療機関での受診】特定健診は市の指定医療機関でも受診できます。申込み
172,が、マリーはやくざのロランの女だった。嫉妬したロランはマンダに決闘を申込むが、マンダが勝利しロランは死ぬ。マンダは警察に追われる身になるのだった
173,５歳の子供）でも口座の開設は可能でしょうか？私娘の口座を申込んでみましたちなみに七歳です未成年はだめといわれ受け付けられませんでした以上
174,町民生部保険環境課国保医療係☎８１‐１８３６家庭で不要になったパソコンはメーカーに直接回収を申込みましょう家庭での使用済パソコンを有益な資源として、再利用するために、平成十五年十月１日から
175,の帰結として運送契約における運送人の責任法制の国際的な統一を求めることになる。すなわち、運送契約を申込もうとする者は契約の相手方である運送人の法的責任がどのようなものであるかが各国
176,のですが相手チームがこれまた人数が揃っていない・・・向こうから試合お願いしますって申込んでおいて？？なんじゃそりゃ？？試合途中からメンバーがきたらしくしかしもたもた準備してる
177,・書類締切＝６月十四日（土）必着※応募書類郵送希望のかたは募集要項希望と明記し百二十円切手を同封し申込んでください（６月８日（日）まで）◎問い合わせ先＝松下美術館☎（五十五）三千三百五十、〒
178,広がらないんですよ」。痴呆性老人や知的発達障害者の介護・支援に携わるボランティア団体や施設に取材を申込むと十中八九、「世話される人々の写真はダメ」。たとえＯＫでも「顔
179,？よろしくお願いします。言えば、引き取られませんよ。私も、最初はデュアル申込んで２台持ってたのですが、嵩張るし、電波も変わらないし、私の行動範囲内
180,て、提出をお願いします。なお、ステージ設置協力金をいただきますので、ご了承のうえ、申込んでください。■協力金村内の方千円村外の方二千円●おまつりパレード出場者募集■受付期間
181,◇申込み当日、現地で申込んでください。（ただし、団体の場合は前日までに申込んでください）◆問い合わせ各浄化センターへ夏だ！祭りだ！さあ、楽しもう！▼
182,）は「もっとうまく人前で話ができるようになりたい」と、この講座に申込んだ。その思いを強くしたのが、以前勤めていた情報技術（ＩＴ）関連会社
183,ば、送ってもらったり、一緒に食事に行ったりしないでしょう。正式に交際を申込んだら良いと思います。
184,日十：三十〜十一：三十【場所】児童館クラブ室【対象】小学生以上初心者でも可【申込】電話申込み可◆英語に親しもう【内容】元英語教師の方と楽しみながら英語を好きになろう。
185,プレゼントＳＳＬ対応の人は「ここ」、非ＳＳＬ対応の方は「こちら」をクリックして申込んでください。締め切りは２月十日（火曜）です！プレゼントには紙面に掲載されたキーワード
186,供給して副業的な家内工業に製織させること）を業とする石川藤八が早々に事業化を申込み、乙川村（現、半田市）に工場を建設した。この工場に、佐吉の発明し
187,●リサイクル講座開催のお知らせ（平成二十年度７月〜９月）６月三十日（月）までに申込み１石鹸つくり／７月十五日、８月十九日、９月十六日の火曜日９：００〜十五：００／粉石鹸作り／各回十五人
188,／分十九：００〜８：００三十円／分）くらいがいいでしょう。あと、パケット対応機ならハッピーパケットを申込みましょう。
189,と締まったお尻には長い脚が続く。そんな青年が、いきなりアンジィーにダンスを申込んできたのである。フランが同席していれば、そんなことは起こり得なかった。まず
190,２人で行くなら１Ａｉｔｅｒｎａｔｉｖｅｓｅｌｅｃｔｉｏｎ（チェック欄□２つ）では、カテ１のみを申込む場合は上だけ、そうでない場合は２つともチェック。ＡｄｄｒｅｓｓｓｕｐｐｌｅｍｅｎｔはＡｉｃｈｉ‐
191,五百円の商品券をもらえるチャンスを設けました。しかし、それを知った人が自ら申込まないともらえないようになっているあたり、情報流出の責任の重さをあまり感じてない
192,、オンラインで申込んだ場合、月間の最大利用限度額は五千円です。カルレの場合、オンラインで申込んでもＩＤ・パスワードは後日郵送される仕組みです。■ピープルを使って登録するカルレのほか
193,いつ申込んだのか、どんなきっかけで申込んだのか、全く記憶にないが、愛読書の
194,）で。国内外の作品の上映と制作者によるトークセッションほか。￥各回千二百円（二十八日までに申込むと千円）、フリーパス三千円、二十九日は２回千五百円。申事前に電話で。各回先着六十名。
195,必要事項を書き、会費を添えて金融機関（郵便局を除く）、交通安全課、または各総合支所市民生活課へ申込んでください。会費１人年額五百円ガスや水道の申込はお早めに料金課（ガス）
196,を目に見えて避けるようになった。パットンがそのことについてラングリーに談判を申込もうとすると、かつては常に彼の電話に答えていた人物は不在だった
197,だ船が小松開作に入港した。ことの次第を弁明し、当路の要人に面会を申込んだ。会見場所は金屋矢田部弥左衛門方で大島側の代表は、遠田粂之進・楢崎忠三郎・林半七の三人であった。矢田部家奥十畳
198,希望する対象者は、渋川保健センター（第二庁舎・☎二十五千三百二十一）へ電話か直接窓口で申込んでください。◆検診期限平成二十一年１月三十一日（土）◆指定歯科医院別表のとおり◆個人負担金
199,方には、公庫の行方が決定付けられる前にでも、できるだけ早く住宅公庫ローンを申込むようにしたいし、そうでない方は早期の解約に取り組みたい（つみたてくん開始から一年
200,です。他に貝類のお鍋と茶碗蒸しが付きます。今回はチビも一人前扱いで、申込んだからです。浴衣も寝具も一人前に用意して頂いた。食事量は十分すぎる程の量
201,ない間に、命の洗濯をさせてもらうつもりでね。町内会のバス旅行を申込んだんだよ」「弱ったな」とはいったものの、実をいうと
202,ではないようですが、勝手に名前、住所を使われ、闇金融に融資を申込んだのがいて、その人は、その対応で大変なようです。
