,0
0,幼児は保護者と一緒に参加してください。○申込みが必要な行事は、本人が直接申込んでください。東区体育館受講生募集のおしらせ☎７５１‐５２５０注意受講料のほかに毎回施設利用料が掛かり
1,毎週木曜の八時に。素晴らしい楽しみ！ジョージアがいなかったら、日誌の書き方講座になんか申込まなかっただろう。いとこはわたしをおだててしたくないことをさせる名人で、
2,が続いて、ギプス姿で車椅子をあやつる所作も覚え、東京への転落を主治医に申込み、なんとか旅先から東京へ戻りたいと願っていた時、東京の厚生年金病院のベッドが
3,あらかじめ電話予約のうえ、健診当日に自己負担金および、市から送る健診票を持参してください。（まだ申込んでいない場合は、健康増進課までご連絡ください。健診票を送ります。）【申込み・問合せ】健康増進課
4,か普通のプロスポーツクラブみたいになってきたなぁ！！一応今の所、このツアーに申込む予定でいます。二十一日が卒園式で飲み会なもんで、寝坊と遅刻とかし
5,たせいか、参加希望者も、転んで困るよりもその前に対処したいという目的で申込むことが多いんです。こうした予防医学の実践的取り組みは、医療機関から発信されるべき。この
6,言われてもそう簡単にはいかない。だいいち、そんな惨めな自分に交際を申込む和彦の神経が理解できなかった。「好きなんだよ」「だから、どうして
7,ような方法があります。・資料を取り寄せて電話やＦＡＸで申込む・郵送で申込む・雑誌の付録や書店などでプロバイダが提供しているＣＤ‐ＲＯＭ（シーディー・ロム）を利用して申込む
8,ホームページを開き、［初めての方へ口座開設のご案内］をクリックします２個人で申込む場合は［個人のお客様］、法人で申込む場合は［法人のお客様］をクリック
9,た社長の方が好感もてますが。）ヤフーＢＢに加入してなくても、申込んだだけでも情報流出の可能性があるということで、そういう人にも五百円の
10,）記入してください。特に記載のないものは、はがき１枚につき１人、締切日消印有効。○申込む内容（講座名等）○〒住所○氏名（フリガナ）○電話・ファクス番号○その他必要事項市議会第３回定例会
11,、勘でいくしかないのか？小泉さんのボールペン、何人の方がいただけるのかしら？申込むのか？私（笑）詳細はｈｔｔｐ：／／ｗｗｗ．ｋａｗａｍｕｒａ−ｆｃ．ｃｏｍ／ｍｅｍｂｅｒｓ／ｉｎｆｏ／ｉｎｄｅｘ．ｐｈｐＲＫＭＥＳＳＡＧＥツアーが終わりました
12,その情報が、思わぬところで役に立った。実は健は、指定券を申込むとき、差額の六千円を小遣いから負担する覚悟で、“デュエット”を希望しておいた。
13,超音波（エコー）検診、乳房レントゲン検査（マンモグラフィ）検査》等＊今年度、市の乳がん検診を申込まれた方は、今から問診票兼受診券が郵送されます。（日程については、
14,。会場はかでる２．７、４階大会議室（中央区北２西７）。参加費３千円。申込み、問い合わせは５日までに同センターの前田さん☎二百七十一．〇六八三へ。☆詳細は前記連絡先か北海道地域活動振興協会☎
15,に住所・氏名（返信用にも記入）、電話番号を書いて、中央公民館へ。直接窓口で申込む場合は返信用はがきを持参。／申込期限＝十一月二十二日（土）必着／申込み・問い合わせ＝中央公民館（
16,口座振替申込は３月中に平成二十年度の第１期から固定資産税の口座振替を希望する場合は、３月中に申込んでください。４月以降になると、固定資産税の第１期の振替に間に合いません。申込期限と振替
17,それらの問題に関心がある人申込電話またはＥメールで、開催日の３日前までに申込んでください。すべての講座に出席を希望する人は、第１回目の申込時にお知らせください。《Ｅメール
18,の口座］などの空欄に記入します。個人申込みの場合は４カ所、カバードワラントの取引を申込む場合は５カ所に捺印します。カバードワラントとは、決められた期限までに、その企業
19,の細則文例には、次のようなものがあります。１駐車場の使用を申込む者には別に定める「自動車駐車場使用申込書」（資料編を参照）に必要事項を記載のうえ
20,栄養士、保健師が相談に応じます。申込み・問い合わせ各保健センターへ７月の成人検診◆すでに集団検診を申込んでいる人には、検診日が近づいたら「受診票」を郵送します。これから申込む人
21,。事前にドイツの地図をダウンロードして開催都市をチェックしておきましょう。シングルチケット（試合単位）を申込まれるなら、北部とか南部というように絞った方がいいです。シングルの
22,ためには、先に電話回線をひかないと無理ですか？月末に引っ越すので先に申込んでおこうと思ったのですが、入居してからでないと電話回線の工事は出来ません
23,は、さまざまな配食サービス事業者の中から嗜好に合いそうな事業者を選択し、その事業者に申込みます。苦情などがあれば、行政か公共的機関が設置する苦情窓口に相談することになります。
24,ます。保険会社によっては出来るのでしょうか？契約の内容にもよりますが、２月中に申込んだ場合、通常では、契約日が３月１日〜となります。３月中に申込んだ
25,ですね。したがって、この話を最初に聞きつけた業者系の人方は予約数量を過大に申込んだわけです。これは例ですけれども、十俵とれるところは十三俵出せるというよう
26,、もう１公演は友達って感じなんだけど、私が２公演ともしかも、４枚と３枚で申込んだから、超貧乏＞＜凹みますね！！でも、いつかは返ってくるから、いっ
27,に受からないとお仕事はできません。でも限定三十名のお仕事なので、すぐに申込んでいただかないと・・・」やべー！！！！と思って、すぐ断りまし
28,。ところが、偶然は重なるもので、裕子はその二日後、ある写真週刊誌からインタビューを申込まれた。「あの人は今」というテーマで、十五年前の連続幼女殺人事件を再構成し、危うく
29,募集します（左下の表参照）。出演を希望する方は、申込用紙を請求の上、申込んでください。▽対象区内在住・在勤（在学）で、約２．５ｋｍの行列コース（約３時間）を歩き通せる
30,二十六日、午後１時半〜３時半●訪問相談５日・十二日※庭木の出張診断です。電話で申込んでください。【弘前城植物園…今月見られる花】スモークツリー、ヘメロカリス、アジサイ、ノウゼンカズラなど●休館日
31,受診してください。定員▶胃がん検診…いずれも五十五人▶肺がん検診…いずれも八十人◎いずれも申込み多数の場合は抽選です。費用▶胃がん検診…千円▶肺がん検診…五百円（喀痰検査…
32,なものにするためにセミナーを開催します。事前の予約が必要ですので、早めに申込んでください。定員▼各三十人（申込み順）料金▼無料■セミナー１職業ふれあいセミナー「製造・企画・販売業」講師
33,は明後日だ」ジョンはそう云い、久我山側の招待客らしい着物姿の女性に、ダンスを申込み、輪の申に入って行った。「ケーン、来てくれて嬉しいよ」
34,六十二アドマイヤサンデーの七：千三百七十口五十六ソニンクの０７：八百九十二口四十ホワットケイティーディドの七：五百三十四口申込んだ馬が全馬抽選に・・。がっくしです。抽選結果がくるまで落ち着きませんね。
35,３オークション入場券の登録オークションの入場には入場券（無料）が必要。あらかじめシンワアートオークションに申込んでおくか、下見会場、オークション当日に受付で発行手続きをします。身分証明書や印鑑など、特別
36,ない子だとね。達夫くんはおまえのことを好きらしいが、どうも結婚を申込むところまでは決心がつかんらしい。それというのも、おまえの本当の気持ちがつかめ
37,住所、氏名、年齢、性別、電話番号、子どもは学年を記入したはがきか電話で申込む。二十日必着。同海の家＝０９２（６０３）２７００。来月４日から「美術クラブ展」須恵「第十一回須恵美術クラブ展」
38,の信用機関に登録されますので６ヶ月（だったかな？）の間にクレジットカードを申込んでも断られる確立が高いです。理由は他が断ったから何かあると
39,戸建住宅を購入された個人の方。マンション購入は対象外）●同一の記念で再度申込むことはできません●交付樹林＝エゴノキ、ハナミズキ、ドウダンツツジ、ユスラウメ等●交付本数＝
40,ては、２月二十一日（木）までに現在通学・通園している小学校・幼稚園・保育園へ、会費を添えて申込んでください。この日以降については、Ｂ＆Ｇ海洋センターへお問い合わせください。※申込後の会費の
41,記入し、８月二十二日（必着）までに同センターへ。重複申込みは無効。複数のコースを申込む場合は、コースごとに別のはがきでお申込みください。◎教室に通えない方のための
42,アルバムは作れますか？撮影はプロのカメラマンです。自分はアルバムを含むプランを申込んだつもりだったのに、式場の手違いで撮影のみのプランに変わっていました
43,など開催に関するすべての作業は使用者が行うものとします。２使用予定日の１ヶ月前までに申込んでください。３平成二十一年度使用分については、来年の２月より受付を開始します。その
44,と思ったんですか。それとも私なら一緒にネパールに住んでくれそうだから結婚を申込んだのですか？」とっさに思いついたにしては、いい質問だった。
45,▷申込方法町内の児童・生徒は、各学校に備えてある申込書に参加料を添えて学校に申込んでください。▷申込期限５月十三日（火）（必着）▷申込・問合先陸上競技協会理事長■■■■さん（緑陽台北区
46,☎０７４７‐２２‐８６３１）４宇陀川浄化センター（宇陀市榛原区福地／☎０７４５‐８２‐５７２５）◇申込み当日、現地で申込んでください。（ただし、団体の場合は前日までに申込んでください）◆問い合わせ各浄化センターへ
47,を記載のうえ使用する１ヶ月前に理事長に申込むものとする。４駐車場の使用を申込む者は、「自動車駐車場使用申込書」を理事長に提出し、同時に車検証を呈示するものとする。
48,構築しでいる。患者がこのシステムを利用したい場合は、かかりつけ医に相談して登録を申込む。登録された患者は、「登録票」を提示して二十四時間連携在宅医療支援システムを利用する仕組みである。その
49,。十月号の掲載申込み締め切りは９月１日（月）です。製作の都合上、平成二十一年１月号掲載分から申込み締め切りが早まり前々月二十日（土曜・日曜・祝日にあたる場合はその前の平日）になります。
50,送料は鈴木はり灸院で負担します。希望の方は鈴木はり灸院へメールｓｕｚｕｋｉ−ｈａｒｉ＠ｍａｉｌ．ｗｂｓ．ｎｅ．ｊｐで申込んでください。がん克服の冊子無料配布（がんばれ百二十八万部）もご覧ください。二千八／７／十三（日）基礎講座４（鍼灸治療研修会
51,講習会名、講習日、住所、氏名、電話番号を記入のうえ、東谷山フルーツパークまで◎インターネットでも申込み可。東谷山フルーツパークホームページ（ｈｔｔｐ：／／ｗｗｗ．ｃｈａｎｃｅ．ｎｅ．ｊｐ／／ｔｏｇｏｋｕ‐１／）「講習会」より【締切】４／二十（日）当日消印有効◆園内観察会
52,が多い。そんな相談をａｕショップでしていたのだが、ＥＺナビウォークというサービスを見つけて申込んだ。要するにカーナビのような感じで徒歩の案内をしてくれる。便利そうな
53,。十二日のオプショナル・ツアーは，ワシントン観光とナイヤガラ観光とに分かれた。私達夫婦は，ナイヤガラを申込んでおいた。大都会ニューヨークから自然美豊かなナイヤガラまでの移動は，バスの旅だった
54,喫煙ルームを希望できますか？」答えは「Ｎｏ！」でした。多くの方が申込まれるので、ご希望には添えないとの理由でした。まぁ〜、そーよね。
55,観覧には入場整理券（１枚で２人まで有効）が必要です。次の方法で申込んでください。※１才以上のお子さんから人数に含みます。※整理券は先着順に発送・発券し
56,満期後の再固定手数料・毎月＆ボーナスの割合などです。また、調印の際には・契約書の金額が申込んだ金額に相違ないか・印鑑証明の住所と契約書の住所に相違ないか・ローン
57,まで黙っていて、すましている洋子を不快に思った。「すみません。取材を申込んだとき、現場の部長さんに、とお願いして、ご迷惑をおかけしないようにって思い
58,十一一刀流を開祖して、初めて他流試合を申込んできた典膳のいる上総の国に来た。二十九歳になっていた。一刀斎
59,六十五瀬谷スポーツセンター（☎３０２‐３３０１ＦＡＸ３０１‐９４４２）へ郵送または直接。ホームページ（ｈｔｔｐ：／／ｗｗｗ．ｙｓｐｃ．ｏｒ．ｊｐ／ｓｅｙａ＿ｓｃ／）からの申込み可＊多数抽選＊市内在住・在勤・在学の初参加者を優先＊Ａ・Ｂ・Ｒ／Ｅ１・２／Ｌ
60,者は、別に定める「自動車駐車場使用申込書」に必要事項を記載のうえ使用する１ヶ月前に理事長に申込むものとする。４駐車場の使用を申込む者は、「自動車駐車場使用申込書」を理事長に
61,美智代さんの考え方に同調する意見を述べている。今回本誌が改めて昭和大学藤が丘病院へ取材を申込んだところ、「現在は捜査中のため、コメントは控えます」という答えが
62,平成二十年度国家公務員中途採用者選考試験試験の区分行政事務／税務／機械／土木／林業／皇宮護衛官／刑務官／入国警備官申込むことができる「試験の区分」は１つに限る受験資格昭和四十三年４月２日〜五十四年４月１日生まれの
63,時給八百二十円（看護師は時給千二百五十円）※交通費を別途支給します。申込方法電話で次に申込んでください（随時受け付け）※面接を行い選考します。受付開始日６月二十一日（土）から申込み・問い合わせ
64,申込む場合、定員になり次第締切。はがきの場合、応募多数は抽選。●はがきで申込む場合は、必要事項（郵便番号、住所、氏名、ふりがな、年齢、電話番号）を明記。
65,ことを発見した。が、私はひしやげた鼻を持つたその男に决闘を申込む勇気を持たなかつた。彼は、重量拳闘の選手で、力瘤で出来上つてゐた
66,たのだ」長太郎は不思議そうに柿崎を見た。クリスマスイブに美都子に結婚を申込んで以来、美都子からは何の連絡もなかったのは事実であった。そして仕事納め
67,から新しく保育園に入園を希望する乳幼児、イ現在入園中で引き続き入園を希望する乳幼児、ウ既に申込んでいるが、まだ入園が決まっていない乳幼児【必要書類】アは、所定の申込書と
68,閣議をおえて大統領が自室に引き揚げるのを、グルー国務次官が追って、面談を申込んだ。「何千何百というアメリカ兵の生命を救おうとするならば、どうしてもこのことを
69,ってるトコが多いらしく判別がつかないことこの上ないですｗフェスタに偽ハンドル名で申込むなんて、さいていだぜ！ねめん以下（※）だな！（※『以下』
70,。●小原宿本陣相模湖駅から桂橋経由三ヶ木行バスで「小原」下車。見学は無料だが事前に相模湖町教育委員会に申込む。☎０４２６‐８４‐３２１１。観光ポイント■高尾山首都圏の有数な観光地で知られる高尾山は標高約六百メートル
71,自治会長に申込み、自治会チームに加わってください。自治会長は７月三十一日（木）までにスポーツ振興課へ申込んでください。◎チーム編成と出場数＝１自治会で次の条件のチームをそれぞれ１チーム編成。ただし、
72,。映画は息子が生きていた証し―賢一さんと一緒に、ご自身も献体を申込まれていますね。神山賢一が病気にならなければ、そんなこと、思いつかなかっ
73,の趣向や哲学はほぼ混じりけ無く繁栄されるといっても過言ではなく自分が取材を申込むにあたって優先したのは「骨太なマイノリティ」。あるじゃない全国区じゃないけれど、知る
74,ならできた。テニスの経験が役に立ったようだ。練習試合も、あちこちに申込み、日・時の都合をつけては、試合回数をふやした。この方法は相手校のコーチ
75,二百人※無料。■申込方法十二月二十四日（水）まで、ＦＡＸ・郵送・電話のいずれかで申込んでください※託児室有（就学前のお子さん。十二月二十二日（月）まで要予約）。暮らし
76,幼児は保護者と一緒に参加してください。○申込みが必要な行事は、本人が直接申込んでください。東区のパノラマ大きな大きなこいのぼり４月二十八日、区役所の窓に、ちあふる・
77,郵便局から確認の電話があると思いますので電話を携帯などに転送しておけば、申込めば保管期間を延長してくれますよ。
78,国のキャリアといいますと電電公社と国際電電でございますが、その辺に仮に申込まれましても、あくまでもまず技術基準の審査というのがございまして、そこで
79,あれば、本冊閲読と共に宜しく就て其伝を受くべく、仔細は直接右に申込まるべし、敢て責任を以て紹介の労を取る。「中庸常識談」沼津斯道会印行、
80,ます。これでは誤った判断をするしかないわけで、契約をすると消費者が申込んでからそういうものを知らせても、後の祭りじゃないか。よくテレビで
81,ます・自薦・他薦は問いませんが、他薦の場合は本人の了承を得てから申込んでください申込み〒３２５‐８５０１那須塩原市共懇社百八‐２那須塩原市商工観光課内「頼朝さん」「政子さん」係問い合わせ
82,、この他にも重要なデータ・ファイルの違法コピーのようなケースもあります。オンライン情報サービスを申込むと、そのサービス提供会社が提供するデータの保護について、かなり慎重であるのがわかります。データ
83,ながら、わたしは何度も自問した。どうして、こんな素晴らしい演奏家に、もっと早くインタヴューを申込まなかったのだろう？そういえば、以前、サッカー元日本代表監督の岡田武史さんと話したとき、こんな
84,で申込んで１日周遊ツアーに参加しましたよ。ミニバンですので人数制限があり、現地で申込んでも希望のコースが定員になってる場合があるので、その日すぐに出発出来る
85,にしたルサンヌ・マッカンの『千片の金』（千九百八十一）にも、白人男性に結婚を申込まれた主人公が異人種間結婚禁止法の下で、愛する人の市民権が剝脱されることを恐れて
86,用意しなければならない（添書登山と称している）というものだった。学会員は、以前は学会組織を通じて申込めばよかったのだが、要するに創価学会を通しての登山は認めないということである。
87,に申込み、在住校区チームに加わってください。校区代表者は、９月５日（金）までにスポーツ振興課へ申込んでください。◎チーム編成＝小・中学生一人、高校生以上〜三十歳未満一人、三十歳以上〜五十歳未満一人、五十歳以上５人
88,ている。私は児童・思春期精神科の治療についての基本的な考え方を取材するために、齋藤氏にインタビューを申込んだ。―児童思春期精神科と言うのは一般にどんな治療を行なう場なのでしょう。「私
89,ありましたらお願いします。その会社だったかどうか忘れましたが、現地で申込んで１日周遊ツアーに参加しましたよ。ミニバンですので人数制限があり、現地で申込んで
90,ます」という表現は、日常会話でもよく使われている。たとえば、旅行社にイタリア旅行を申込む場合、旅行に行くことをすでに決めているにもかかわらず、「イタリアに行きたいと思います
91,保険証は９月に発送。配達記録郵便を希望する人は８月二十九日（金）までに国保年金課へ申込んでください。なお、すでに配達記録郵便で受け取っている場合は、引き続きこの郵便で送付します。配達記録郵便
92,やその他のリスク関連指標にもとづいて保険料を課するのではなくて，民間保険業者に地域ごとの一律保険料―申込んできた者すべてに同じ保険料―の適用を義務づける場合などである。しかしながら，地域一律の保険料設定
93,を抱いている写真だ。おそらくフィンの妻だろうが、彼が女性と結婚を申込むほどのつき合いをしていたことに、ケイトは驚かずにはいられなかった
94,れるらしいんですが、なかなか人があつまらなくてだめになっているらしいんです。わたしが申込みましたらちょうど実施人数になるということで、なんとかいくことができました。梅棹マリという
95,答えると、「そこで、一つ頼みがあるんだが」と、前借の件を申込んだという。保さんは、ずいぶん手の込んだ演技だと思ったが、断る
96,も右記以前の生年月日もしくは十八歳未満の世帯（ホ）小学校就学前の子どもがいる世帯など単身で申込む場合上記１３４５の申込資格に加え６昭和三十一年４月１日以前に生まれた人７身体障害者手帳（１級〜
97,な車種で貴方が借り入れたい金額以上の見積もりを作成して貰って、取引のある銀行に申込みましょう！過去の借り入れがあっても無くても、返済遅滞などなければ、年間収入の
98,乳、子宮、前立腺）、肝炎検査逗葉地区の医療機関で受けられます。直接医療機関へ申込んでください。（実施医療機関は、市民健康課か逗葉医師会☎０４６‐８７１‐３４０５でご案内します）＊医療機関で検診を
99,リサイクル講座・ちびっ子資源循環フェスタ開催／７月二十六日（土）／小学生（保護者同伴）／７月十日（木）までに申込み１万華鏡作り教室／十：００〜十二：００／抽選二十人／持ち物：はさみほか２デコパージュ作り教室／十：００〜十二：００
