,0
309,相談も受け付けます。希望する日の１か月前から前日までに、予約専用電話（☎５６７‐１３８３）で申込んでください。▶問合せ保険年金課か同事務所へ十一月は児童虐待防止推進月間〜助けての小さなサイン
310,ヌ・フニクの娘メロヴェを欲しいというのなら、しかるべきひとを間にたててわが父に申込み、正式な手続きを踏むのが、礼儀というものだ。違うか」「違い
311,は、青い幻のように揺れていた。一緒に来てください、と男は申込んだ。いけません、と女は答えた。あたしは一生、この街から
312,たからと前置きして、「あんたが大阪の女友だち第一号だ。どうぞよろしく」と申込まれました。ただし、「色気は抜きですよ」と付け加えられました。
313,。あのときは彼から別れを告げられると信じていた。ところが、結婚を申込まれるなんて。ディランはベッドの足のほうに立ち、ベッドの柱にもたれかかった
314,乳、子宮、前立腺）、肝炎検査逗葉地区の医療機関で受けられます。直接医療機関へ申込んでください。（実施医療機関は、市民健康課か逗葉医師会☎０４６‐８７１‐３４０５でご案内します）＊医療機関で検診を
315,なその課題を提出した直後に、更にバージョンアップしたコースの案内が来てたけど申込んでみようかな音を上げそうだけどとりあえず、残りあと２回分！
316,今日ＰＭ９時から下和田さん率いる「ブリキ」のチケット申込み開始でした。早速申込みしあとは返事待ちです。十二月十三日に行われるのですが、１回しかないようでちょっと
317,再建外科佐武利彦先生■申込み横浜市大センター病院のＨＰから。９月５日申込み開始。定員二百名ずいぶん時間が短いんだね〜〜先生喋り足りないのでは・・・。
318,行います。※カラオケ・ヨガ・太極拳は、複数の教室がありますが、それぞれ１つの教室しか申込むことができません。※同じ教室に何枚申込んでも、１枚として扱います。そのほか
319,・・・・・・・・・・・・・・利用明細のオクＩＤをクリックすると申込み日時、メッセージ、入金日が記載されていますよ。
320,見たいのですが、私の住んでいるマンションはケーブルテレビがひかれていて、それを申込むとＢＳとかＣＳも一緒についてきてなんだかお金をとられるみたいなんです。本来
321,平川公民館対象市内在住または在勤の成人費用千円（テキスト代として）申込方法電話で申込んでください。（申込み先着順）申込先・問い合わせ市民会館☎（六十二）三千百三十五百目木公園まつりスポーツ大会結果（５／十一開催）ゲートボール優勝
322,メディケアさざなみ見学十一：二十〜十一：三十さざなみ苑見学十二：００市民総合福祉会館到着・解散定員二十五人（先着順）申込方法電話または直接申込んでください。申問商工観光課☎（二十三）八千四百六十若者の消費者トラブルに注意！！夏
323,に電話で申込み、休日の８時四十五分から二十一時までに受け取ってください。なお、印鑑登録証明書を申込んだ方は、印鑑登録証（カード）を持参してください１引っ越しのときは市外の場合転出届
324,）もしていないのですが・・・郵便局の窓口で「郵便貯金ホームサービス」というのを申込めばパソコンでもケータイでも確認できます。通帳と届出印を持っていけばＯＫです
325,をまっすぐに見つめた。説明は一度ですませたい。「あなたに結婚を申込まれたとき」キャシーは話しはじめた。「わけあってわたしの財産管理を続ける必要が
326,商品や為替などは自分に知識がないので考えませんでした）かと思い申込んだのですが（この時点では少なくともＨＰ上では他に利率の良い定期ものはなかっ
327,凝らそうという人たちである。豪華旅行を好むタイプは間違いなく「Ａ社の二十五万円のパック旅行」を申込むが、後者の人たちは出来る限り安いパック旅行を探そうとする。こうした顧客を
328,て、もういいだろうと連絡したけど、もう少し待ってと言われた。申込んでいた港区西麻布の公団の抽選に当たった。入居手続きを終え、松本まで幸子を
329,（参加希望者全員）、電話番号（代表者）、希望の乗車場所、返信用の宛名を記入して、申込んでください。申込期限６月十一日（水）当日消印有効申込先・問い合わせ郷土博物館「自然と歴史の散策会」担当社教連協
330,いきさつで会員になったのか、いまだにさっぱりわけがわからなかった。入会を申込んでさえいなかった。彼の詩は何人かの批評家に受けが悪かったし
331,に三軒の貸家を建てた。六畳・四畳半・台所・風呂・便所という間取りの一戸建てだった。佐藤千代は建設中に申込んできた第一号の店子だった。家賃一万二千円、敷金三月分。千代は、宮武町
332,八千万円，普通保証で２億円まで信用保証協会の百％保証を受けられます。市が認定し，金融機関で申込みます。業種確認は中小企業庁ホームページｈｔｔｐ：／／ｗｗｗ．ｃｈｕｓｈｏ．ｍｅｔｉ．ｇｏ．ｊｐ／で。申・問生活経済課☎６０‐１８３２募集■都民住宅（東京都施行型）入居者中堅所得者向け賃貸住宅
333,にもまだ届いてないみたいです。。。それと、Ｊチケ。９月になって申込んだ分。いつ届くんだ！！！来週になったら仕事が忙しくなって定時に
334,なっている抽選チケット戦線はクレジット応募した方がよく当たると聞きました。しか〜し、今回私が申込んだのは現金払い・・・と言う事はやっぱり関係ないのではという結論に達しまし
335,申込方法▼申込書に必要事項を記入し、有田秋まつり実行委員会（町企画商工観光課内）へ提出していただくか、ＦＡＸで申込んでください。申込用紙は役場、東出張所、または福祉保健センターの窓口にあります。詳しくは▼有田秋まつり実行委員会
336,（金）建設住宅課（市役所３階）申込方法必要書類（要印鑑）を添え、期間内に申込んでください。別府市在住の人は、受付時点での住民票・所得証明書の提出が不要です。詳しくはお問合せください
337,いずれも申込みは午前９時から電話か直接民芸館。※１度に１人（組）まで申込み可絞り染め教室（２回コース）●とき３月十三日、二十七日の木曜日１午前十時〜正午
338,、申込用紙を提出後に審査があってそれにパスしてからでないとだめですか？申込んだらすぐに取引に使えるところを知りたいです（ない？）インターネットから申込んでそれ
339,てきたら、デュアルネットワークサービスを申込もうかと思っています。それとも、変更と同時にデュアルネットワークサービスを申込んでしまった方がいいのでしょうか？よろしくお願いします。言えば、引き取られませんよ
340,恥ずかしいし・・・。どうしたらいいんでしょうか？朝日放送の「探偵ナイトスクープ」って番組に申込めば解決できると思います。以前解けない知恵の輪を見事解いてました。それ
341,か、近くにあるという人の方が少ないね。全然問題ないよ。ネット上から申込めば、本店の口座が簡単に作れるよ。
342,￥七千二百円申下記に電話された人に募集要項を郵送します。必要事項を記入のうえ、申込んでください問神戸大学工学研究科総務係☎８０３‐６３３３ＦＡＸ８０３‐６３９６手話入門講座受講生手話の基本的な知識や技術を身に付け
343,れるものを感じた。パリに戻ったレオポールは熱烈なラブ・レターを書き、結婚を申込んだ。ソフィー・トレビュシェは、レオポールがいま一つ好みのタイプではないと感じてはいたが、
344,。この申込み履歴は信用情報機関のデータベースの６ヶ月間保管されます。万全を期すなら、最後に申込んだ日より６〜７ヶ月間待ってから申込むと良いかと・・・
345,なってくれるみたい。クリスマスの十二月二十五日まで、スノーマンと仲良くみんなを待っているので、記念撮影申込んだら、きっと快く受けてくれるはずだよ♪元淵江公園も凄いけど、ローカルエリアのホキマビーチも忘れ
346,を特定する本人確認のために使用するものです。・取引パスワード（第２認証方法）ＷＥＢサイト・モバイルサイトにログイン後、定期預金申込み、外貨預金取引などのお取引きやお客さま情報変更など、お手続きの際に必要なものです。・認証番号表
347,サークルの紹介や会員募集等の情報展問中央市民センター☎二百九十五．〇八〇二仙台市土地開発公社所有地をお売りします募集期間内に最も早く申込んだ方に売却します。●募集期間＝９月十八日（木）〜十月三十一日（金）
348,迷っています。また、こちらにはエステ付きプランがあったのですが、エステは現地で申込むのと、日本でプランについているのを申込むのと、どちらがお得でしょうか
349,以下同じ。）の場合において、厚生労働大臣が指定する機関は、同項の書面の交付を申込んだ者が同項に規定する技能講習以外の技能講習を修了しているときは、その技能講習を行った
350,５月中に案内・受診券などを入れた封筒を送付しています。同封の申込書で健診受け付け日までに申込んでください。＊社会保険などに加入の人は、右記のとおりはがきに記入し、申込んでください
351,ヤフーゆうパックを落札者（受取人）側から申込む裏技を知っているエライ人はいませんか？とてもハイレベルな裏技だけど、この
352,はまだ早い！二千一年十二月のファイナルドロー（対戦組合せ）決定後に行われる「第二次販売」に申込もう。今回以上に高倍率の激戦必至の状況だが、どうしても見たい人は再チャレンジすべし！音楽
353,の愛用者であろう。しかも、『週刊金曜日』に掲載した段階では「千円でサンプルを申込む」と嘘を書いていたのだ。なんという嘘つき！説明を受けた人はみんな
354,言うのが正しいのですか？教えてください（＾＾♪「申す」は謙譲語でも、「申込む」は、謙譲語ではありません。よって「お申込み下さい」は問題ありません
355,が出ます。※市内小学校３〜６年生に募集要項（申込書）を配布しますので、その用紙で申込んでください。◆担当■■■■■名護剣道教室では現在、会員募集中です。基礎からやさしく指導し
356,送料は鈴木はり灸院で負担します。希望の方は鈴木はり灸院へメールｓｕｚｕｋｉ‐ｈａｒｉ＠ｍａｉｌ．ｗｂｓ．ｎｅ．ｊｐで申込んでください。がん克服の冊子無料配布（がんばれ百二十八万部）もご覧ください。二千八／４／６（日）基礎講座１
357,ない）取引はガイドラインに違反してますし、禁止行為です。また、高値で即決を申込んで早期終了させ、商品を確保できた時点で値引きなどを強要する悪質な人もいます
358,。休日に交付を希望する場合は、直前の開庁日の十六時三十分までに電話で申込み、休日の８時四十五分から二十一時までに受け取ってください。なお、印鑑登録証明書を申込んだ方は
359,が散漫。書類の整理にも間違いが５月デートを申込むと九割はＯＫとなる日だ６月先輩の引き立てが
360,。【旅行積立】取り扱っている旅行会社（ＪＴＢ、ＪＲ東日本ほか）に月払い、一時払いなどで申込みます。半年から５年間積み立て、満期になれば払い込んだ金額に１．５〜３％上乗せした額の
361,てみたいが、英語が不安だというという人は、日本の代理店を通して申込むのが安心だろう。出発に向けて、日本語でのきめ細かなアドバイスがもらえるのが
362,はおられるのでしょうか。どうすれば、手に入るのでしょうか。約３年、毎月３回線分申込んで過去一度当選したことがありますあと、インターネット販売のほうも一度（こちらは先月で終わっ
363,なんですけど、ＡＤＳＬのほうがキャンペーン値引きが大きいので初期投資が少なく済みます。電話加入権不要タイプに申込む前に、オークションなどで電話加入権の相場を確かめてみましょう。買ったほうが得な
364,だけ国民が被害を受けて、みんな各県、地域で提訴をする、あるいは生活センターに申込むとか救済措置を要望しているわけですから、これに迅速に手を打つことが行政
365,加えて、子どもの名前と年齢を書き十月１日（水）まで（必着）に申込んでください。今日から始めるウエストサイズダウン教室問健康生きがい課健康づくりに役立つ運動と食事のコツを学び、
366,オークションに参加するには興味のある分野のオークションカタログを講読します。クリスティーズジャパンを通して申込むと、ロンドンからカタログが送られてきます。下見ができない場合は、コンディションレポート
367,という法律によって「団体交渉権」が労働組合に認められています。組合に会社が団体交渉を申込まれた場合には，会社は正当な理由なしにこれを拒否したり，無視することは
368,も、ドールに始まり、ドールに終わりそうです。早速、金針水晶さんの幼サイズウイッグの受注を申込んでみました。ショコラピンクがとっても素敵なので届くのが楽しみです。ボークスのウイッグ福袋は
369,でもいいです）ときどき、海外のツアーに１人で参加しています。ツアー一つを申込めば手配が済み、ホテル選びの手間がなく空港とホテルの間の送迎などが付く
370,のには直接的な支障はありません。しかし、今後ＮＴＴで新規に電話回線を申込む時に大変不利になります。今は、固定電話が無いとクレジット審査の際に不利
371,た。しかし、母の入院が長期化したので、いよいよ市の高齢福祉課にヘルパーを申込んで家事などの援助をお願いするしかないなと思ったが、祖母と父が「他人
372,たらしいよ。天政食堂で手伝ってるきゅうり顔のお姉さんがいるだろう。あのお姉さんに交際を申込んで断られたんだって。レーニンに聞いたよ」「またか。いい気味
373,午前９時三十分〜午後４時に、年齢を証明するものを持参し、本人が直接窓口で申込んでください。申込み多数の場合は抽選。会場東老人福祉センター（北四十一東十四）☎７４１‐１０００
374,ぴあでチケットを買いたいので電話で申込もうと思ったのですがつながらなかったり、チケット取れなかったりするんでしょうか？？（ラッシュボール
375,に出かけていった。インド行きの便を変えてもらうためである。当初、一行が申込んだのは、一月三十一日の朝にコロンボを発って、夜にはインドのデリー
376,は既に申込み済みだったんですが、ここんとこずっと落選だったので、マミーにも申込んでもらいました。超ギリで申込みできました＾＾；ハラハラしました。。。時間がなくて
377,申込んでしまった。バタフライが見よう見まねで二十五ｍ泳げるようになったため、つい喜んで申込んだ。いささか無謀であったと反省している。それで年の始めから、平泳ぎ、バタフライ
378,たがるものだ。そういう男には、娘はやれないと言って、破談を申込んだのだった。しかし世間では、必ずしもそうは取らなかった。家がらがよい
379,私たちは食材を求めるにもまったく苦労しなかった。一週間単位で必要なおかずを選んで申込むと、そのとおりに配達された。もちろんお金を支払っていたが、市場や他
380,…どの頂金を相殺するかは自分で決めることかできます。できるだけ早く破たん金融機関に申込んだ方がいいでしょう。その際には金利の低い預金から相殺すると有利になる
381,の後半（土）にディズニーランドに行く計画を立てています。そこで、ガイドツアーを申込んでみようと思うのですが、やはり朝早く並ばないと予約は取れませんか？昨年
382,ようです。機種はパナソニックのＣＹ−ＥＴ八百七Ｄ（アンテナ一体型）です。私は、３月十三日に申込みやっと一昨日手元に届きました。それを昨日、近くの指定工場に持ち込み無料取り付けしてもらった
383,に申込み、在住校区チームに加わってください。校区代表者は、９月５日（金）までにスポーツ振興課へ申込んでください。◎チーム編成＝三十歳未満（学生を除く）一人、三十歳代二人、四十歳以上二人、年齢フリー４人
384,肉離れの影響で十月ほとんど走れなかったが、中海マラソンには申込んでいたので走ってきました。ゆっくり走っても１時間四十分くらいかなと思っ
385,練馬女性センターえーる☎三千九百九十六．九〇〇七へ※保育室（１歳以上の未就学児対象）を利用したい方は、併せて申込んでください。区民の方によるまちづくり活動の中間報告会練馬まちづくりセンターは、区民主体のまちづくり活動に対し、費用の
386,、下記のような手順でリサイクルを実施いたします。１パソコンのメーカーに直接回収を申込みます。※“ＰＣリサイクル”開始前に購入したものは、回収再資源化料金がかかります。２パソコンを簡易梱包し、
387,で身分証明書と印鑑があれば作れます。ついでに「郵貯インターネットホームサービス」の申込書をもらって申込んでおくと便利ですよ。（一週間程で利用できると思います）ネットでぱるる送金ができ
388,ね」付合い始めて三月余りたった九月の初め、奈緒子は明月の口から、結婚を申込まれた。「もうしばらく、考えさせてください」と、奈緒子は答えた。
389,１電話で、住所、氏名、電話番号、出すごみの種類（品目）、個数などを申込んでください。２受付者が次の項目をお知らせします。手数料▶ごみの品目ごとに
390,にしたいのですが、可能ですか？違約金取られる可能性があります。年間契約割引を申込んでいればさらに解約金がかかります。
391,先日ＦＣ優先予約で申込んだ７月十九日の秋川さんのコンサートチケット確保確定しました。先程ＦＣから来た下記メールにて申込んだ方全員
392,。ｇ国会図書館の登録制度これを利用すれば，自宅や職場からインターネットによって複写を申込むサービスなどを受けることができる。１学校の図書館で調べる・自分で調べる・司書の
393,、性別、電話番号、講座名を書いて、滑石公民館へ郵送するか窓口でお申込みください。窓口で申込む場合は返信用のはがきを１枚持参してください。申込み多数の場合は抽選。申込期限＝十二月
394,の仕入れ資金などに必要な短期運転資金を低利で融資していますので、希望する事業主は早めに申込んでください。融資対象市内に店舗、工場または事業所などがあり、１年以上継続して同一業種に
395,阿呆が一人、というのがもっぱらの噂。だとすれば、そのどちらかに結婚を申込む人こそ賢いわけだ。それに、昔から言うじゃないか、阿呆に三福あり
396,十五日、午前十時〜正午●訪問相談十四日・二十一日※庭木の出張診断です。電話で申込んでください。【弘前城植物園…今月見られる花】ハナショウブ、バラ、スイレン、ヒトツバタゴ（ナンジャモンジャ）
397,ランチ、マリンスポーツが組み込まれたパック・ツアーを利用するのが手軽だが、とりあえず送迎のみを申込み、島に行ってからスケジュールを見て好きなマリンスポーツに参加するという方法もある。
398,と経費の支払い要介護高齢者はケアプランの作成を通じて、それ以外の高齢者は直接、事業者に申込みます。利用者は、先に見た利用者負担額を配食サービス事業者に支払い、事業者は市町村に
399,‐二十六）へ。なお、申込みは１枚のはがきで１人のみです。来館で申込む場合は返信用のはがきを持参してください。９月十五日（祝）敬老会送迎バスを運行問い合わせ／
400,のほうが話し易い。だがいざ切り出すとなると緊張する。クラブの女性にデートを申込むだけなのに、硬くなるとはどういうことなのか。相手はまだ東京
401,プラス、ローソン、チケットナビ・・・、更にラジオ先行、テレビ番組内先行、プロモーター先行等など、あらゆる先行に申込んで、当たった中で一番よい席を選んでいます。（残ったのはファンサイト等
402,をご覧になり、希望にあった方を選んで各機関の職員に申し出てください。インターネット・電話で申込むこともできます。２直接交渉が可能な講師の場合は、住所・電話番号などの情報を職員
403,、六十五歳の誕生日後に健診日程をお知らせします。※レディース検診は、２月末まで受診できます。直接申込んでください。●場所山形検診センター（山形市蔵王成沢）☎６８８‐６５１１予防接種手帳について予防接種手帳は、出生届
404,、彼とムスリムたちとの関係に当惑し、真相を知ろうとマルコムを探し出し、インタビューを申込んだ。マルコムは、イライジャから破門を仄めかされていたのにもかかわらず、マイアミ
405,に申込んでください。＊社会保険などに加入の人は、右記のとおりはがきに記入し、申込んでください。健康教室（脳卒中・認知症予防）申込み９月二十二日（月）から市民健康課へこどもの保健コーナー
406,ＮＴＴで加入電話ライトを申込んだのですが、ＮＴＴの方から「ＭＷ（プッシュ、ナンバーＤ等）はどうします
407,「それはむしろ都合がいいんじゃないかな。ぼくもきみに妻になってくれと申込むつもりなどないから」青みがかった灰色の目が冷ややかに光っている。「ぼくは少し
408,で何メガぐらいのスピードが必要なんでしょうか？３メガ以上のスピードが望ましいです。ＢＢＴＶを申込んだら信号状態を調べてからセットトップボックス（チューナーみたいなもの）が送られてきます。
409,（四十五小間）申込方法往復ハガキに、郵便番号、住所、氏名、電話番号、出店品目を記入し申込む申込期限十月十日（金）必着申込み・問い合わせ産業観光課「フリーマーケット」係■内線１３４５土岐川観察館へ行こうチャレンジ自然散策
