,0
203,撮影が近所で行われています。が！行けません。今回、エキストラには申込んでいないです↓↓今週末は、イヨイヨ芽以ちゃんが出演の舞台が始まります。今週は・
204,お聞きして決定します。▼お子さんが生まれる前は、申込みできません。▼平成十九年度に申込まれた方で、入所できなかった方（空き待ちの方を含む）も新たに申込み
205,ません」これは勝利宣言とも受け取れよう。実は今回、主だった大手芸能プロダクションに取材を申込んだのだが、すべて見事に断られてしまった。あるプロダクションからは、「ウチ
206,（☎七百二十八．三二一〇）へ年に一度は健康診断を受けましょう予約制ですので、電話で申込んでください。▼総合健康診断（人間ドック）※誕生月受診票（２万円の補助）が使用できます※毎月第２土曜日
207,）、敬老の日に文化センターで敬老会を行います（申込みは締め切りました）。申込まれた人には、既に案内のはがきをお送りしています。なお、「午前の
208,それに、このマルドナードという女はどうも気に入らない。前にも取材を申込まれたのだ。それが今度は、私の頭越しにことを運んだ。彼女の
209,二十五室、トイレ付きが６室。全室に飲料品入り冷蔵庫を設置。夕・朝食ともレストランが基本。予約時に申込めば部屋出しも可能。洞爺湖での漁業権のほか、自家菜園も所有し、旬の食材を
210,。申込みができるのはＮＴＴ東日本会社、西日本会社の加入電話／ＩＳＤＮ契約者本人にかぎり、また、オンラインで申込む際には、利用者本人のメールアドレスが必要になります。なお、オンラインで申込んだ場合、
211,○十円かかるけどね〜作りたいけど、使いすぎが心配なら、利用限度額を低くして申込めば？
212,金銭の贈与又は資産の買取りに限る。）を行うことを、併せて当該加入機構に申込むことができる。４前条第二項及び第三項の規定は、前項の資金援助について準用する。この場合
213,母校訪問に参加する予定でいた。それが急に出席できなくなったのだ。「申込んどったベッドの空いてさ、原爆病院に明日、入院しなっとげなさ。」
214,マスターは、カウンターへ身を乗り出し、そっと、「紹介してくれないか？」と申込んだ。「ああいうのがタイプでね。気の強そうなところが何
215,事なのですが、やはり無理なのでしょうか？そうなると電話を引いてＡＤＳＬを申込むかＪＣＯＭが入っている住宅らしいのでＪＣＯＭネットがいいのか悩んでます。ＪＣＯＭは評判
216,健康な方◇三万千五百円◇四十名◇主催／豊島区スキー協会申はがき、ファクス（記入例参照。１枚で複数名申込み可）で、十二月十五日（必着）までに「〒１８０‐００２２武蔵野市■■■■
217,の証よ。ホント、これで二千円なんて信じられない」ネットで前日までに申込めば、百分制限で千七百円だって！ココはディナー代わりに使えるわね。パスタとサラダに
218,やっていて、子供達も夢中で見ていました。他にもここは体験を申込まなくても色々見て遊ぶことができます。年間パスを持っているので、今年は行きまくりたい
219,月）です＊市税口座振替キャンペーン実施中＊７月三十一日（木）まで◇…期間中、新規に口座振替を申込んだ方に『足利三名所入場券』を差し上げます。消費生活センターからＮｏ．二百十一自己破産したらどうなるの
220,」「もうミーハーなんだから…」そんなわけで鈴世は聖ポーリア学園の編入試験を申込むことに決まったんだけど、「きゃっ、名門校、名門校」おかあさんはまだ試験
221,イーバンクを申込んでもう２週間・・・いったいどのくらいかかるものなんでしょうか？早く来ないかなぁ
222,なのである。そうして安吾はその曲馬に一生をかける気で、本気で入団を申込んだわけである。話が少しわかりにくくなってきたから、女の話に変える。
223,？私がたまたまウンが悪かったのか。。。。今日明日の支払いでは、申込んでも間に合いませんよ。今回はあきらめて振り込み手数料はらいましょう！
224,の都合で早く終了する場合がある」って書いてあった・・・脅迫か？でも申込んでしまいました。イヴのシーンなら、どこを取ってももうすっかり頭に叩き込まれ
225,「入場券」は他人への譲渡はできません。※確実に当日参加できる人のみ申込んでください。４会場及び周辺には駐車場がありません。車では来場しないでください。
226,も、さらにツインの同室に入る破目になった。フロントで別々の部屋を申込んだのだが、料金を前払いで要求されると、「私の方はもっと安い
227,ようになったので自由形ばかりでは芸がないということで、バタフライと百ｍ個人メドレーを申込んでしまった。バタフライが見よう見まねで二十五ｍ泳げるようになったため、つい喜んで申込ん
228,（祝）に延期）◎参加資格と申込方法＝市内に住む人。在住地域の自治会長に申込み、自治会チームに加わってください。自治会長は９月５日（金）までにスポーツ振興課へ申込んでください。
229,の仲間と待ち合わせて歩いてましたが、某新聞やら某テレビやらから三回くらい取材を申込まれました。我々はいかにも「その手の人」に見られるんでしょうかね。
230,で広報情報課（ＦＡＸ二十四六千五百四十一）へ※前号が送付されている読者は、改めて申込む必要はありませんが、住所などに変更があった場合は広報情報課へ連絡を
231,保険をかけていないから、私からは一銭も出てません。（あ！申込むときの手数料は私からでした・・・（笑））保険はいいの？
232,ないのでしょうか？学校の授業用に、「手作り乾電池キット」が用意されてるので、学校単位で申込んで、特別授業が受けられます。（参考ＵＲＬなど）家で作れる簡単な電池は、
233,で浜松駅へ向かう行程の周遊券で、「同一市内駅最寄駅相互間」を盾に東名館山下からの周遊船車券を申込んできても拒むことはできないでしょう。理由は２つあります。ひとつは浜松駅
234,けれども、ぜひ自動発動ができるようなそうしたシステムの変更を御検討いただければありがたい、申込んでいただきたいな、そんなふうに思うところであります。セーフガードは以上にさせていただきまし
235,９月十三日十九時からＳＭＡＰ東京公演を申込まれた人の抽選結果が案内されてますが。。。。みんなどうだったか
236,※）だな！（※『以下』はそれ自身も含みます）とまぁ猫とんかつさんは申込んでないので応援だけしておきます。くそう、おれにもちーむでこ（※）
237,】・受講料＝二百円・申込方法＝６月６日（金）までに直接、または電話で申込んでください。◎申込・問い合わせ先＝メディアセンター☎（六十四）０９１９「きりしま歴史散歩」参加者募集今年度は全十回の史跡めぐりを実施します
238,二十八歳男です。２歳年上の看護婦さんにお見合いを申込まれましたので、ＯＫしました。うらやましいですか？べつに普通です。。。。
239,へお問い合わせください。セット検診、女性の健康診査は、受診希望日の１週間前までに電話で弘前市保健センターへ申込んでください。なお、市の各種健診は、年度内（４月１日〜３月三十一日）に１回
240,、千九百九十五年に厚生省（当時）や日本医師会などが出資して設立された財団法人。審査を申込んだ病院を「病院の理念と組織的基盤」「患者の満足と安心」など、６領域
241,ＹＨＯＯのフリーメールでは、ドメイン名が、＠ｙａｈｏｏ．ｃｏ．ｊｐですが、ＹＡＨＯＯＢＢのプロバイダに申込むと、アウトルックを使用できるメールのアドレスのドメイン名はどうなるのでしょうか？教えてください。よろしく
242,は午前十時から、夜の講座は午後６時からです。市民プラザ・ゆう窓口へ受講料を添えて申込んでください（託児なし）。全講座の対象は、市内在住・在勤の方です。老後の生き方・暮らし方講座
243,でしょうか。音質も今までと全く変わりませんよ。今日のチラシに電話相談して申込むと２千円だかの商品券がもらえるとありましたよ〜。はやまっちゃったかなぁ
244,レイ」と、彼はいった。「ぼくはもう一度だけきみの農場の買取りを申込むことにした。ブルースタインが今日の午後きみあての手紙で値段を提示しておいたよ」彼
245,という方法もある。申込みは前日で十分だから、ホテルに着いてからツアーデスクで申込めばよい。アクティビティは、大声で騒ぎたいならバナナボート、ジェットスキー、バナナスプリツトも人気だ。体験ダイビング
246,。変な質問ですみません。まだ利用した事がないので・・・。ＨＰから申込むと担当のドライバーさんの携帯にメールが入る仕組みになっているみたいです。だから、電話
247,講座担当（〒７６１‐０１１３屋島西町二千三百六十六‐１☎八百四十四．三五一六）へ。※来館またはホームページでも申込み可。休日・夜間における市税、国民健康保険料（税）、長寿医療保険料、保育料の納付と納付相談市役所
248,が応じた。「ミスター・セックスアピールがデートを申込む図。数万人のボストン市民の前でひざまずいて申込むのにご婦人は美しい顔に笑みを浮かべるのみ」「さあ、やれよ、スティーブ
249,（申込順）※保育室（対１歳以上の未就学児）を利用したい方は、併せて申込んでください。中国料理教室時十二月十三日（土）Ａ正午〜午後２時三十分Ｂ午後３時三十分〜６時所勤労福祉会館内水ギョーザ
250,「タランテッラ」を踊ってくれ、とコリンナに申しこんでいるところだった。コリンナの友人たちも申込んでいた。彼女はすんなりと受けた。女性が受けないで断るしきたりに慣れている
251,スカパーでサッカーのチャンピオンズリーグセットを申込もうと思ってます。「ｃｈ百八十二〜ｃｈ百八十五パーフェクトチョイス」と書いてあるのですが、チャンピオンズリーグの
252,（テキスト代含む）◇申込み８月二十五日〜９月５日までに、下水道課にある受験申込書で申込んでください（受付時間は平日の９時〜十六時）。郵送による受付はしません。◆
253,を誤らないようにする必要がある。対策３避けようがなければライセンスを申込むもはや、他人の知的財産権の侵害を避けることができないとなれば、その権利者にライセンス
254,何人でも関係なく観光船に乗れます。金剛山も行って来ました。韓国で申込みました。書類や注意事項などの説明が全て韓国語でしか行われませんので、
255,秘書養成学校へ手紙を出して、マルゴットとペーターとわたしのために、速記の通信講座を申込んでくれたんです。まあ楽しみにしててください―来年には、そろって速記の名人
256,ますよ。私の患者は今、フィリピンのマニラから来ています」ただし、申込めばだれでも参加できる、というわけではない。研究の目的や条件に合わなければ参加でき
257,申込むだけできちんと封筒の中をみていなかったら、なんと帰りのチャ−タ−便
258,が、男女間の密接な交際のニュアンスの強い言葉である。数カ月後に教授にインターコースを申込んだ男性が研究室にあらわれた。学生たちは笑いを嚙み殺していたが、私には
259,では、出身校ひとまとめで受験申込みをするので、一括近くの実施会場。浪人の時は個々に申込むので、地域によって浪人を集めるところと現役生の間にいれるところとがある。予備生
260,の上、封書またはメールにて対馬観光物産協会（〒８１７‐００２１長崎県対馬市厳原町今屋敷六百六十八）まで申込む（作成費は無料）。問合せ先：対馬観光物産協会☎０９２０・５２・１５６６ｔｓｕｓｈｉｍａ＠ｌｉｍｅ．ｏｃｎ．ｎｅ．ｊｐ（Ｅ‐ｍａｉｌ）ｃｏｌｕｍｎ対馬の
261,が続きました。富士重工宇都宮製作所が国産ジェット機第１号を完成し、また、これまで電話局にいったん申込まなければつながらなかった宇都宮・東京間の電話が、即時に通話できるようになり（三十二年）、
262,たしすごくよかったです！来月、またあの会場に行けますように☆彡ってまだ申込んでないんだけど。そして無性に聞きたくなってＢＧＭはロマネスク。大阪から帰る時
263,磯子まつりのホームページ（ｈｔｔｐ：／／ｗｗｗ．ｉｓｏｇｏ‐ｆｅｓ．ｃｏｍ）で配布する「区民提案イベント企画書」に必要事項を記入し、郵送またはＦＡＸで申込んでください【締め切り】（必着）●補助金を希望する場合は５月三十日（金）まで
264,千九百六十三（昭和三十八）年夏、デンマークのコペンハーゲンで国際老年学会が開催され、動脈硬化に関する演題を申込んだところ採択されたので、初めてヨーロッパを訪れた。たまたま実弟が西ドイツ・デュッセルドルフの銀行の
265,安堵感が交錯する。これを逆に利用し、抜かれそうな重要テーマは数日でも早く申込む高等戦略も可能だ。■民間系記者クラブの問題点とは？一方、最近、民間クラブの機能
266,群馬県に住んでいます。犯罪歴はありません。三十八歳の公務員です。当日行って申込むだけです。下記を参考にしてみてください。
267,かなりの強運の持ち主と言えそう。「何が何でも絶対見てやる」と意気込んで申込んだ人も、「とりあえず」と軽い気持ちで申込んだ人も、条件はみな平等
268,のための新居を建てる土地が決まりました。土地の売買契約の締結、ローンの申込み、新居の設計と、不動産屋、銀行、建築事務所などを走り回る日々が続きました。
269,ための初期費用（８Ｍｂｐｓで電話と共用にする場合の標準的な費用）１電話で申込むと送られてくるものＡ．スプリッタＢ．モデム（レンタル）Ｃ．説明書とＣＤ‐ＲＯＭ
270,３図参照）。市外通話の接続状況についてみると待時接続が中心であり，二十年代においては通話を申込んでから接続まで何時間も待たされる状況であった。その後，三十七年に東京―
271,対１歳以上の未就学児）を利用したい方は、十二月９日（火）までに併せて申込んでください。１楽しく節約〜人もモノも生かす工夫時十二月十二日（金）午前
272,クレジットカードを申込むときに４桁の暗証番号を登録したのですが、１回も暗証番号を使う場面がありませ
273,で安くて、アフターケアーが良い保険会社を探してますどこがお勧めですか？ネットから申込むつもりです安いと言えば「外資系」ですよね。ウチはチューリッヒで、ネットから
274,（売り手）と消費者（買い手）の間の契約である。消費者は，買いたいと申込み，売り手がそれを承諾すると，それで売買取引の契約が成立する。契約とは
275,未成年がインターネットを申込むには。インターネットを申込みたいと思います。ＡＤＳＬを行いたいため、電話がない
276,二千円（２日分の昼食代と保険料含む）。宿泊場所など詳細は要問い合わせ。９月二十八日までに申込む。車山高原観光協会０２６６・６８・２６２６。◆新潟県・どぶろく試飲と田舎料理味覚と紅葉を訪ねて十月二十九日から１泊２日、
277,ない人が申込んでいる」といっています。そんなことはありません。実際に申込んでいる人の多くは、施設入所の必要性の高い人です。そもそも、今申込んでも
278,■■■■さんが相談に応じます。▽申込方法事前の予約が必要ですので、電話で申込んでください。▽開設日程毎月、第４月曜午後１時三十分〜３時三十分※相談日が祝日の
279,何処もよく書いてあって悩んでしまいます。ちなみに、私は二十一歳の女で一人で申込むつもりです。ここはやめておいた方が良いとか、お勧めの教習所がありまし
280,、私がいま申し上げました国際法上の原則に即しないということで韓国に抗議を申込んで、それを撤回させたという例は二、三ございます。○国務大臣（鳩山威一郎君）本協定
281,を支払うというのだからと被害者の慾心をそゝり遂に資本金を出し合つて勝負を申込み、忠兵衛が二千五百円、お引きが二千円、客（被害者）が五百円、合計五千円を出し合つ
282,聞きたい事（任意）を記入し、７月十四日までに、ファクスや市のホームページから申込んでください。※電話でも受け付けます。▽問い合わせ・申込先広報広聴課広聴係（☎内線５５２、ファクス三十五．〇〇八〇
283,手続き済みなら、必ず入金されます。今週中には確認できるでしょう。ご自身も郵便局のホームサービスに申込んでおけば、ネットで残高照会や送金ができるようになるので、いちいち記帳に行く手間
284,］さんか【参加】●町のマラソン大会に参加する。○参加する人は、一週間前までに申込んでください。○話し合いに参加する。いみなかまに入る。さんこう【参考】●この本
285,もらい必要事項を記入して返信するか、オンラインサインアップといって、パソコンから直接電話回線を使って申込む方法の２通りがある。まず、パソコンとモデムを接続。モデムと電話回線の接続
286,という人が集まってきた。「今日、インドの男性から僕にインターコースを申込む手紙を受け取ったんだけど、どうすればよいかね」教授の言葉に学生たちは
287,には批評家のハンスリックもオペラに来ていた。彼はテノールのアロイス・アンダーを通じて会見を申込んだ。ワーグナーはハンスリックに、まるで見知らぬ人であるかのように冷たく挨拶したので
288,※利用日数は２泊まで。食事なしの利用はできません。※はがき記入の不備、重複申込み、返信用はがきのないもの、私製往復はがきでの申込み、期限を過ぎて到着したものは無効
289,「この会社はな、商業ビルやマンションのデベロッパーだ。例の所に融資を申込んだわけだ。今度小田急線の新百合ヶ丘と町田に大型マンションを建てるらしいよ。俺は会社
290,、「○○日出発なら実施されますけど」と教えて頂けます。最少催行人数１人であるなら、あなた自身が申込めばツアーの実施が確定されると言うことです。
291,＝生涯学習課（☎７５７‐８９１８）「うつ病」の家族教室参加を希望する人は事前に申込んでください。●日時＝１十一月十九日（水）２十一月二十六日（水）３十二月十一日（木）
292,お知恵を貸して下さい。小額ではありますが、今まで母親に借金を申込まれ、あげるつもりでつい合計百万円に上ってしまいました。自分の貯金は減る一方
293,会場「リーブラ」「新川甘い！」人に資金を貸して、自分が資金ショート！借り入れを申込む。３人に声をかけた。２人に断られた。当たり前だ、１人はやはり
294,不動産業界で働いている方、「ドラフト」の意味を教えて下さい。賃貸物件を客が申込み、オーナーが審査して契約にいたるまでの段階に出てくる言葉だと思うのですが。その
295,わかった。そうすると、小林の場合は、うまいことをして、あとは申込まなかったんだ…」「たぶんね」「それなら、なんとなく納得できる。
296,でも対応しています。お店にある「デジカメプリント」注文書に、プリントしたい写真番号を記入して申込みます。プリントサイズは、Ｌサイズ相当の八十九×百十九ｍｍと２Ｌサイズ相当の百二十七×百六十九ｍｍ、六切、四切
297,夏休みのレジャー先取り企画読んだ瞬間、申込め！！ひと月後には空の上！？「穴場ポイント、すき間ツアーを見極めろ」「
298,ここでネイチャーゲームのリーダー養成を体験してみよう。ネイチャーゲームの指導者になるためにはまず、日本ネイチャーゲーム協会に申込む。協会では全国各地で年に五十五回から六十回の講習会をおこなっている。＊１日本ネイチャーゲーム協会
299,をして中央フロアの様子をながめているかのどちらかだった。私たちが取材を申込むとニヤリと笑って「マスコミさんは嫌いでねぇ」と言った。できれば私もお医者サマ
300,契約者に還元するもの。いわば長期契約者に対する優遇措置です。▼診査…生命保険で医師扱いの契約を申込んだ場合に、会社の指定する医師が問診や検診をすること。診査が必要ない
301,な解決策がありますか。勧誘電話は確かに以前は多かったのですが、ＮＴＴに申込んで非通知拒否にするとかなり減りましたよ。私が思うに非通知でかけてくる
302,日もあります。◆医療機関検診を受ける場合は「受診券」が必要です。これから申込む人は各保健センターへ申込んでください。◆特定健診を受ける人は、保健証と特定健診受診券を持参してください
303,１歳以上・有の場合は子どもの名前〈ふりがな〉・生年月日・性別）・複数の講座を申込む場合は優先順位を明記し、〒３７１‐００２３本町二丁目十二‐１・中央公民館「後期はぐはぐ教室係」（☎２１０‐２１９９）へ
304,そこで家老の松井康之が家康の近臣本多正信と親しかったのを頼りに家康に借用を申込んだところ、家康は風邪ぎみにもかかわらず自ら松井と面談したうえ、鎧櫃を取り寄せ
305,特定健診・健康診査巡回スケジュール参照」）受診料＝無料（年度内に１回）申込方法＝事前に後期高齢者医療室に電話などで申込み、受診券を受け取った後、受診希望の医療機関へ予約してください。■年金からの保険料の
306,と考へてゐた。然るに昨日の午後五時頃に社会党の方から倒閣運動の共同戦線を申込むに至つて党内の強硬論が一斉に台頭して、どうにもならなくなつた」（百一頁
307,られない乱暴な話だが、とにかく予備校に行くことになり、彼女は即、代々木ゼミに申込んで、猛勉強開始となった。受験勉強が彼女のアポストラートになった。いくら彼女が優秀
308,も知識も足りないものばかりの私は、たまたま春季スクールの記事を見つけ、それに申込みました。色々あるスクール。どれも中身は同じかとは思います。でも、
