,compound unit,context,segmented,split units,the unit is split,compound unit form,unexpected segmentation,unexpected joining
0,地場,いい悪いは別にしまして、なってまいりました。そういたしますと、地場でできる野菜の時期というのは限られるわけでございますので、広域的に全国的に,"['いい悪い', 'は', '別に', 'し', 'まして', '、', 'なって', 'まいり', 'ました', '。', 'そう', 'いたし', 'ます', 'と', '、', '地場', 'で', 'できる', '野菜', 'の', '時期', 'と', 'いう', 'の', 'は', '限ら', 'れる', 'わけで', 'ございます', 'ので', '、', '広域', '的に', '全国', '的に']",['地場'],NO,地場,NO,NO
1,地場,食べよう』午前十一時三十分〜午後１時●旬の食材料理コーナー参加無料親子を対象に地場の旬の野菜、果物、魚を食材にバラエティ豊かな料理方法の体験と試食。,"['食べよう', '』', '午前', '十一', '時', '三十', '分', '〜', '午後', '１', '時', '●', '旬', 'の', '食', '材', '料理', 'コーナー', '参加', '無料', '親子', 'を', '対象', 'に', '地場', 'の', '旬', 'の', '野菜', '、', '果物', '、', '魚', 'を', '食', '材', 'に', 'バラエティ', '豊かな', '料理', '方法', 'の', '体験', 'と', '試食', '。']",['地場'],NO,地場,NO,NO
2,地場,格好でやっていくことが、結果として、全体的には、そういうさっき出た、地場という言葉が出ましたけれども、そういう点でいうならば、みんな負の,"['格好', 'で', 'やって', 'いく', 'こと', 'が', '、', '結果', 'と', 'して', '、', '全体', '的に', 'は', '、', 'そういう', 'さっき', '出た', '、', '地場', 'と', 'いう', '言葉', 'が', '出', 'ました', 'けれども', '、', 'そういう', '点', 'で', 'いう', 'ならば', '、', 'みんな', '負', 'の']",['地場'],NO,地場,NO,NO
3,地場,も回復しているのだ、こういうことになるわけなのでございます。それに対して、では本当の地場の、地域で営業活動をされている中小企業の皆さんたちはどうなのか。私は,"['も', '回復', 'して', 'いる', 'のだ', '、', 'こういう', 'こと', 'に', 'なる', 'わけな', 'ので', 'ございます', '。', 'それ', 'に', '対して', '、', 'で', 'は', '本当の', '地場', 'の', '、', '地域', 'で', '営業', '活動', 'を', 'さ', 'れて', 'いる', '中小', '企業', 'の', '皆さん', 'たち', 'は', 'どう', 'な', 'の', 'か', '。', '私', 'は']",['地場'],NO,地場,NO,NO
4,地場,たにせよ、事情は変わらないんだ。この地域は、海上交易で巨富を蓄えるので、地場の海運に影響のある重要な決断の基礎は、天候だ。天気予報に関する最新鋭の,"['たに', 'せよ', '、', '事情', 'は', '変わら', 'ない', 'んだ', '。', 'この', '地域', 'は', '、', '海上', '交易', 'で', '巨', '富', 'を', '蓄える', 'ので', '、', '地場', 'の', '海運', 'に', '影響', 'の', 'ある', '重要な', '決断', 'の', '基礎', 'は', '、', '天候', 'だ', '。', '天気', '予報', 'に', '関する', '最', '新鋭の']",['地場'],NO,地場,NO,NO
5,地場,で、地方団体の中で、あるいは自治省でも考えられることですが、たとえば中小企業あるいは地場の企業へ官公需の優先発注であるとか、あるいは公共事業の中へ失業者を吸収するとか,"['で', '、', '地方', '団体', 'の', '中', 'で', '、', 'あるいは', '自治', '省', 'でも', '考え', 'られる', 'こと', 'です', 'が', '、', 'たとえば', '中小', '企業', 'あるいは', '地場', 'の', '企業', 'へ', '官公需', 'の', '優先', '発注', 'である', 'と', 'か', '、', 'あるいは', '公共', '事業', 'の', '中', 'へ', '失業', '者', 'を', '吸収', 'する', 'と', 'か']",['地場'],NO,地場,NO,NO
6,地場,行政施策として廃屋の農家住宅を転用し「農家民宿」を設置する。経営は農家の主婦であり、地場の農産物ばかりであり、石畳の家庭料理のみであるが、年間をとおして千二百人の宿泊客を,"['行政', '施策', 'と', 'して', '廃屋', 'の', '農家', '住宅', 'を', '転用', 'し', '「', '農家', '民宿', '」', 'を', '設置', 'する', '。', '経営', 'は', '農家', 'の', '主婦', 'であり', '、', '地場', 'の', '農産物', 'ばかり', 'であり', '、', '石畳', 'の', '家庭', '料理', 'のみ', 'である', 'が', '、', '年間', 'を', 'とおして', '千二百', '人', 'の', '宿泊', '客', 'を']",['地場'],NO,地場,NO,NO
7,地場,ます。○棚橋分科員どうもありがとうございました。最後に、一番重要な中小企業対策、特に地場の、地域の中小企業振興政策について大臣のお考えをお伺いしたいと思っております。ただいま景気は,"['ます', '。', '○', '棚橋', '分科', '員', 'どうも', 'ありがとう', 'ございました', '。', '最後に', '、', '一', '番', '重要な', '中小', '企業', '対策', '、', '特に', '地場', 'の', '、', '地域', 'の', '中小', '企業', '振興', '政策', 'に', 'ついて', '大臣', 'の', 'お', '考え', 'を', 'お伺い', 'し', 'たい', 'と', '思って', 'おり', 'ます', '。', 'ただいま', '景気', 'は']",['地場'],NO,地場,NO,NO
8,地場,（６）（ジバ）産業の発展を支援する。地場（７）外国製品を（ユニュウ）する。輸入,"['（', '６', '）', '（', 'ジバ', '）', '産業', 'の', '発展', 'を', '支援', 'する', '。', '地場', '（', '７', '）', '外国', '製品', 'を', '（', 'ユニュウ', '）', 'する', '。', '輸入']",['地場'],NO,地場,NO,NO
9,地場,という機能、これはすぐれて社会的機能を持っていると思いますね。メーンバンクというか地場の銀行という力がかなりそこに働いておると。地域的な要請というものがあって,"['と', 'いう', '機能', '、', 'これ', 'は', 'すぐれて', '社会', '的', '機能', 'を', '持って', 'いる', 'と', '思い', 'ます', 'ね', '。', 'メーンバンク', 'と', 'いう', 'か', '地場', 'の', '銀行', 'と', 'いう', '力', 'が', 'かなり', 'そこ', 'に', '働いて', 'おる', 'と', '。', '地域', '的な', '要請', 'と', 'いう', 'もの', 'が', 'あって']",['地場'],NO,地場,NO,NO
10,地場,が動きだすと、いつのまにか新聞、雑誌の記者が集まってきた。地場の証券新聞や、相当な経済雑誌までが、日満興業を書きはじめた。“体質改善完了の日満興業、,"['が', '動き', 'だす', 'と', '、', 'いつのまにか', '新聞', '、', '雑誌', 'の', '記者', 'が', '集まって', 'きた', '。', '地場', 'の', '証券', '新聞', 'や', '、', '相当な', '経済', '雑誌', 'まで', 'が', '、', '日', '満', '興業', 'を', '書き', 'はじめた', '。', '“', '体質', '改善', '完了', 'の', '日', '満', '興業', '、']",['地場'],NO,地場,NO,NO
11,地場,を向けてほしい」あの時…これなら、県産材でも低コストの住宅を提供でき、地場の業者だからこその売り物になると考えた。企業紹介社名株式会社寺島製材所代表者名代表取締役,"['を', '向けて', 'ほしい', '」', 'あの', '時', '…', 'これ', 'なら', '、', '県産材', 'でも', '低', 'コスト', 'の', '住宅', 'を', '提供', 'でき', '、', '地場', 'の', '業者', 'だ', 'から', 'こそ', 'の', '売り物', 'に', 'なる', 'と', '考えた', '。', '企業', '紹介', '社名', '株式', '会社', '寺島', '製材', '所', '代表', '者', '名', '代表', '取締', '役']",['地場'],NO,地場,NO,NO
12,地場,ことを、東京都における三つの具体的実例に即して御説明させていただきます。まず初めに、地場の土木工事業を営む中小企業の例であります。この会社は、大手ゼネコンの下請体質からの脱却,"['こと', 'を', '、', '東京', '都', 'に', 'おける', '三', 'つ', 'の', '具体', '的', '実例', 'に', '即して', '御', '説明', 'さ', 'せて', 'いただき', 'ます', '。', 'まず', '初め', 'に', '、', '地場', 'の', '土木', '工事', '業', 'を', '営む', '中小', '企業', 'の', '例', 'で', 'あり', 'ます', '。', 'この', '会社', 'は', '、', '大手', 'ゼネコン', 'の', '下請', '体質', 'から', 'の', '脱却']",['地場'],NO,地場,NO,NO
13,地場,れたことがあります。群馬県が錚々たる政治家を輩出したのも、養蚕と製糸産業が地場に根付き、相当な政治資金の調達をおこなうことができたことも、大きかったと思います,"['れた', 'こと', 'が', 'あり', 'ます', '。', '群馬', '県', 'が', '錚々たる', '政治', '家', 'を', '輩出', 'した', 'の', 'も', '、', '養蚕', 'と', '製糸', '産業', 'が', '地場', 'に', '根付き', '、', '相当な', '政治', '資金', 'の', '調達', 'を', 'おこなう', 'こと', 'が', 'できた', 'こと', 'も', '、', '大きかった', 'と', '思い', 'ます']",['地場'],NO,地場,NO,NO
14,地場,や有機栽培のものを積極的に取り入れて使用していますまた、夏から秋にかけて地場の野菜を農家の方から直接仕入れて美味しいだけではなく、お客さまに安心して食べて,"['や', '有機', '栽培', 'の', 'もの', 'を', '積極', '的に', '取り入れて', '使用', 'して', 'い', 'ます', 'また', '、', '夏', 'から', '秋', 'に', 'かけて', '地場', 'の', '野菜', 'を', '農家', 'の', '方', 'から', '直接', '仕入れて', '美味しい', 'だけ', 'で', 'は', 'なく', '、', 'お', '客', 'さま', 'に', '安心', 'して', '食べて']",['地場'],NO,地場,NO,NO
15,地場,ことでございます。また、地方取引所の問題の解決の仕方いかんによりましては、地場の証券会社の経営の問題にも響いてくるという問題もございます。その辺のところ,"['こと', 'で', 'ございます', '。', 'また', '、', '地方', '取引', '所', 'の', '問題', 'の', '解決', 'の', '仕方', 'いかん', 'に', 'より', 'まして', 'は', '、', '地場', 'の', '証券', '会社', 'の', '経営', 'の', '問題', 'に', 'も', '響いて', 'くる', 'と', 'いう', '問題', 'も', 'ございます', '。', 'その辺', 'の', 'ところ']",['地場'],NO,地場,NO,NO
16,地場,たフラップの数々である。その存在感は倉庫スペースという均質な空間の中に、強力な地場を発生し空間を独特なものに変えている。コンピューターの中のクリーンな世界と、,"['た', 'フラップ', 'の', '数々', 'である', '。', 'その', '存在', '感', 'は', '倉庫', 'スペース', 'と', 'いう', '均質な', '空間', 'の', '中', 'に', '、', '強力な', '地場', 'を', '発生', 'し', '空間', 'を', '独特な', 'もの', 'に', '変えて', 'いる', '。', 'コンピューター', 'の', '中', 'の', 'クリーンな', '世界', 'と', '、']",['地場'],NO,地場,NO,NO
17,地場,。最初の転職は、実務経験のイロハを身につけるためと宅地建物取引主任者資格を活かすために地場の不動産業へ転職し、主に不動産仲介業に従事しました。大手企業に入り業務の一部を任さ,"['。', '最初の', '転職', 'は', '、', '実務', '経験', 'の', 'イロハ', 'を', '身', 'に', 'つける', 'ため', 'と', '宅地', '建物', '取引', '主任', '者', '資格', 'を', '活かす', 'ため', 'に', '地場', 'の', '不動', '産業', 'へ', '転職', 'し', '、', '主に', '不動産', '仲介', '業', 'に', '従事', 'し', 'ました', '。', '大手', '企業', 'に', '入り', '業務', 'の', '一部', 'を', '任さ']",['地場'],NO,地場,NO,NO
18,地場,私どもでは、国公法二十八条の社会一般の情勢に適応するという概念の中にはそれぞれの地場の給与も反映させるということも当然含まれておると考えておりますから、地場賃金の,"['私', 'ども', 'で', 'は', '、', '国', '公', '法', '二十八', '条', 'の', '社会', '一般', 'の', '情勢', 'に', '適応', 'する', 'と', 'いう', '概念', 'の', '中', 'に', 'は', 'それぞれ', 'の', '地場', 'の', '給与', 'も', '反映', 'さ', 'せる', 'と', 'いう', 'こと', 'も', '当然', '含ま', 'れて', 'おる', 'と', '考えて', 'おり', 'ます', 'から', '、', '地場', '賃金', 'の']",['地場'],NO,地場,NO,NO
19,地場,私どもでは、国公法二十八条の社会一般の情勢に適応するという概念の中にはそれぞれの地場の給与も反映させるということも当然含まれておると考えておりますから、地場賃金の,"['私', 'ども', 'で', 'は', '、', '国', '公', '法', '二十八', '条', 'の', '社会', '一般', 'の', '情勢', 'に', '適応', 'する', 'と', 'いう', '概念', 'の', '中', 'に', 'は', 'それぞれ', 'の', '地場', 'の', '給与', 'も', '反映', 'さ', 'せる', 'と', 'いう', 'こと', 'も', '当然', '含ま', 'れて', 'おる', 'と', '考えて', 'おり', 'ます', 'から', '、', '地場', '賃金', 'の']",['地場'],NO,地場,NO,NO
20,地場,に向けての計画づくりに着手をされました。先日は産業復興会議という名前でそれぞれ地場の業者の方々の代表も含めた御論議の末の結論を私どもにお届けをいただき,"['に', '向けて', 'の', '計画', 'づくり', 'に', '着手', 'を', 'さ', 'れ', 'ました', '。', '先日', 'は', '産業', '復興', '会議', 'と', 'いう', '名前', 'で', 'それぞれ', '地場', 'の', '業者', 'の', '方々', 'の', '代表', 'も', '含めた', '御', '論議', 'の', '末', 'の', '結論', 'を', '私', 'ども', 'に', 'お', '届け', 'を', 'いただき']",['地場'],NO,地場,NO,NO
21,地場,たいわば今度の調査の総論的な部分については、全く同感でございます。できるだけ地場に野菜産地をつくってその地場野菜を供給していくということは、流通経費も非常に少なくて,"['たいわ', 'ば', '今度', 'の', '調査', 'の', '総論', '的な', '部分', 'に', 'ついて', 'は', '、', '全く', '同感', 'で', 'ございます', '。', 'できる', 'だけ', '地場', 'に', '野菜', '産地', 'を', 'つくって', 'その', '地場', '野菜', 'を', '供給', 'して', 'いく', 'と', 'いう', 'こと', 'は', '、', '流通', '経費', 'も', '非常に', '少なくて']",['地場'],NO,地場,NO,NO
22,地場,たいわば今度の調査の総論的な部分については、全く同感でございます。できるだけ地場に野菜産地をつくってその地場野菜を供給していくということは、流通経費も非常に少なくて,"['たいわ', 'ば', '今度', 'の', '調査', 'の', '総論', '的な', '部分', 'に', 'ついて', 'は', '、', '全く', '同感', 'で', 'ございます', '。', 'できる', 'だけ', '地場', 'に', '野菜', '産地', 'を', 'つくって', 'その', '地場', '野菜', 'を', '供給', 'して', 'いく', 'と', 'いう', 'こと', 'は', '、', '流通', '経費', 'も', '非常に', '少なくて']",['地場'],NO,地場,NO,NO
23,地場,は、都市近郊の地場野菜産地が都市化の進展によりまして徐々に宅地化、工場用地化して、地場の野菜供給が非常に困難になってきたという点が第一点でございます。第二点は,"['は', '、', '都市', '近郊', 'の', '地場', '野菜', '産地', 'が', '都市', '化', 'の', '進展', 'に', 'より', 'まして', '徐々に', '宅地', '化', '、', '工場', '用地', '化', 'して', '、', '地場', 'の', '野菜', '供給', 'が', '非常に', '困難に', 'なって', 'きた', 'と', 'いう', '点', 'が', '第', '一', '点', 'で', 'ございます', '。', '第', '二', '点', 'は']",['地場'],NO,地場,NO,NO
24,地場,は、都市近郊の地場野菜産地が都市化の進展によりまして徐々に宅地化、工場用地化して、地場の野菜供給が非常に困難になってきたという点が第一点でございます。第二点は,"['は', '、', '都市', '近郊', 'の', '地場', '野菜', '産地', 'が', '都市', '化', 'の', '進展', 'に', 'より', 'まして', '徐々に', '宅地', '化', '、', '工場', '用地', '化', 'して', '、', '地場', 'の', '野菜', '供給', 'が', '非常に', '困難に', 'なって', 'きた', 'と', 'いう', '点', 'が', '第', '一', '点', 'で', 'ございます', '。', '第', '二', '点', 'は']",['地場'],NO,地場,NO,NO
25,地場,回天記念館，徳山市美術館。念仏・武内踊り（無形文化財）等がある。徳山みかげを利用した日本一の巨大モニュメント，地場の巨峰ワインが有名。素材型の石油コンビナートがある。／目下テレトピア・ニューメディアコミュニティ構想の取組，徳山駅周辺地区再開発，文化会館大規模改修,"['回', '天', '記念', '館', '，', '徳', '山市', '美術', '館', '。', '念仏', '・', '武', '内', '踊り', '（', '無形', '文化', '財', '）', '等', 'が', 'ある', '。', '徳山', 'み', 'かげ', 'を', '利用', 'した', '日本', '一', 'の', '巨大', 'モニュメント', '，', '地場', 'の', '巨峰', 'ワイン', 'が', '有名', '。', '素材', '型', 'の', '石油', 'コンビナート', 'が', 'ある', '。', '／', '目下', 'テレトピア', '・', 'ニューメディアコミュニティ', '構想', 'の', '取組', '，', '徳山', '駅', '周辺', '地区', '再', '開発', '，', '文化', '会館', '大', '規模', '改修']",['地場'],NO,地場,NO,NO
26,地場,た。しかし一方で、ＩＴ化に対しては非常に敏感でした。なぜなら、地場の中堅ゼネコンである同社が、将来の生き残りのためにＩＴ化に対応することは必須という考え,"['た', '。', 'しかし', '一方', 'で', '、', 'ＩＴ', '化', 'に', '対して', 'は', '非常に', '敏感でした', '。', 'なぜなら', '、', '地場', 'の', '中堅', 'ゼネコン', 'である', '同', '社', 'が', '、', '将来', 'の', '生き残り', 'の', 'ため', 'に', 'ＩＴ', '化', 'に', '対応', 'する', 'こと', 'は', '必須', 'と', 'いう', '考え']",['地場'],NO,地場,NO,NO
27,地場,？「マックスバリュー」です。実は、このマックスバリュー、静岡のヤオハンや山口のマミーなど、地場で有力なスーパーを次々と買収して店が増えているので、「店内放送でよく聴く,"['？', '「', 'マックスバリュー', '」', 'です', '。', '実は', '、', 'この', 'マックスバリュー', '、', '静岡', 'の', 'ヤオハン', 'や', '山口', 'の', 'マミー', 'など', '、', '地場', 'で', '有力な', 'スーパー', 'を', '次々', 'と', '買収', 'して', '店', 'が', '増えて', 'いる', 'ので', '、', '「', '店', '内', '放送', 'で', 'よく', '聴く']",['地場'],NO,地場,NO,NO
28,地場,＋八十七三千三十一本日は朝から、次なる浮上では千円突破、と地場の証券筋が強気していた。朝は八百八十円で寄り、その後は八百六十円台まで下げてい,"['＋', '八十七三千三十一', '本日', 'は', '朝', 'から', '、', '次', 'なる', '浮上', 'で', 'は', '千', '円', '突破', '、', 'と', '地場', 'の', '証券', '筋', 'が', '強気', 'して', 'いた', '。', '朝', 'は', '八百八十', '円', 'で', '寄り', '、', 'その後', 'は', '八百六十', '円', '台', 'まで', '下げて', 'い']",['地場'],NO,地場,NO,NO
29,地場,を中心に値段が高く，近代的な経営手法を取り入れる余地が大きいと見られている。地場の小売業に勝る商品力を維持するためには，ＳＣＭ（ＳｕｐｐｌｙＣｈａｉｎＭａｎａｇｅｍｅｎｔ）の構築,"['を', '中心', 'に', '値段', 'が', '高く', '，', '近代', '的な', '経営', '手法', 'を', '取り入れる', '余地', 'が', '大きい', 'と', '見', 'られて', 'いる', '。', '地場', 'の', '小売', '業', 'に', '勝る', '商品', '力', 'を', '維持', 'する', 'ため', 'に', 'は', '，', 'ＳＣＭ', '（', 'ＳｕｐｐｌｙＣｈａｉｎＭａｎａｇｅｍｅｎｔ', '）', 'の', '構築']",['地場'],NO,地場,NO,NO
30,地場,のは確実。このままでは大手でも苦しくなる一方だ。それだけに、地場の業者は、特徴のある家づくりをしなければ、もっと厳しい状況に追い込まれてしまう,"['の', 'は', '確実', '。', 'このまま', 'で', 'は', '大手', 'でも', '苦しく', 'なる', '一方', 'だ', '。', 'それだけに', '、', '地場', 'の', '業者', 'は', '、', '特徴', 'の', 'ある', '家', 'づくり', 'を', 'し', 'なければ', '、', 'もっと', '厳しい', '状況', 'に', '追い', '込ま', 'れて', 'しまう']",['地場'],NO,地場,NO,NO
31,地場,廻った際はピンときませんでしたが先入観を捨て検討してみたい。現在、地場でご協力いただけそうな業者様で管理会社様としての候補。検討していきたい。１．〇〇コーポ主任様,"['廻った', '際', 'は', 'ピンと', 'き', 'ませ', 'ん', 'でした', 'が', '先入観', 'を', '捨て', '検討', 'して', 'み', 'たい', '。', '現在', '、', '地場', 'で', 'ご', '協力', 'いただけ', 'そうな', '業者', '様', 'で', '管理', '会社', '様', 'と', 'して', 'の', '候補', '。', '検討', 'して', 'いき', 'たい', '。', '１', '．', '〇〇', 'コーポ', '主任', '様']",['地場'],NO,地場,NO,NO
32,地場,を考えて相続対策と安定した事業収入を確保するということからこの事業は始まった。地場の大地主さんということから地域からいろいろな提案もあったようだが、あくまでしっかりと,"['を', '考えて', '相続', '対策', 'と', '安定', 'した', '事業', '収入', 'を', '確保', 'する', 'と', 'いう', 'こと', 'から', 'この', '事業', 'は', '始まった', '。', '地場', 'の', '大', '地主', 'さん', 'と', 'いう', 'こと', 'から', '地域', 'から', 'いろいろな', '提案', 'も', 'あった', 'ようだ', 'が', '、', 'あくまで', 'しっかり', 'と']",['地場'],NO,地場,NO,NO
33,地場,逆に強い動きが発生。買い戻し効果などから、さらに一段高も期待されるとして、地場、マスコミは注目している。やるものがないから、この手の取り組み株が一番とする,"['逆に', '強い', '動き', 'が', '発生', '。', '買い戻し', '効果', 'など', 'から', '、', 'さらに', '一段高', 'も', '期待', 'さ', 'れる', 'と', 'して', '、', '地場', '、', 'マスコミ', 'は', '注目', 'して', 'いる', '。', 'やる', 'もの', 'が', 'ない', 'から', '、', 'この', '手', 'の', '取り組み', '株', 'が', '一', '番', 'と', 'する']",['地場'],NO,地場,NO,NO
34,地場,た、あの証券会社と金融会社は自分の口座だろう？」「客の一人に、地場の人間がいるんです。その客の紹介です。それに、いろいろなところに顔,"['た', '、', 'あの', '証券', '会社', 'と', '金融', '会社', 'は', '自分', 'の', '口座', 'だろう', '？', '」', '「', '客', 'の', '一', '人', 'に', '、', '地場', 'の', '人間', 'が', 'いる', 'んです', '。', 'その', '客', 'の', '紹介', 'です', '。', 'それ', 'に', '、', 'いろいろな', 'ところ', 'に', '顔']",['地場'],NO,地場,NO,NO
35,地場,銀行という力がかなりそこに働いておると。地域的な要請というものがあって、地場であるということの作用がかなり強いんじゃないかと思います。この点については私も,"['銀行', 'と', 'いう', '力', 'が', 'かなり', 'そこ', 'に', '働いて', 'おる', 'と', '。', '地域', '的な', '要請', 'と', 'いう', 'もの', 'が', 'あって', '、', '地場', 'である', 'と', 'いう', 'こと', 'の', '作用', 'が', 'かなり', '強い', 'んじゃ', 'ない', 'か', 'と', '思い', 'ます', '。', 'この', '点', 'に', 'ついて', 'は', '私', 'も']",['地場'],NO,地場,NO,NO
36,地場,宮崎県の「ミヤ」と韓国語で音をさす「ソリ」をくっつけた商品名は、地場の技術力と韓国ＩＴの融合を象徴する。カラオケは全国約五十万台、約九千億円のビッグな市場,"['宮崎', '県', 'の', '「', 'ミヤ', '」', 'と', '韓国', '語', 'で', '音', 'を', 'さす', '「', 'ソリ', '」', 'を', 'くっつけた', '商品', '名', 'は', '、', '地場', 'の', '技術', '力', 'と', '韓国', 'ＩＴ', 'の', '融合', 'を', '象徴', 'する', '。', 'カラオケ', 'は', '全国', '約', '五十万', '台', '、', '約', '九千億', '円', 'の', 'ビッグな', '市場']",['地場'],NO,地場,NO,NO
