37,地場,提供できる。しかも、同じ規格のまとまった材料を必要とする大手業者には扱いづらいため、地場の業者だからこそ売り物になると考えた」その結果、同社の住宅の,"['提供', 'できる', '。', 'しかも', '、', '同じ', '規格', 'の', 'まとまった', '材料', 'を', '必要', 'と', 'する', '大手', '業者', 'に', 'は', '扱い', 'づらい', 'ため', '、', '地場', 'の', '業者', 'だ', 'から', 'こそ', '売り物', 'に', 'なる', 'と', '考えた', '」', 'その', '結果', '、', '同', '社', 'の', '住宅', 'の']",['地場'],NO,地場,NO,NO
38,地場,は私どもの調べではおよそそのうちの半分、ちょうど半分ぐらいがいわゆるその地方の地場の業者の方というふうに考えておりますので、そういう意味では相当その地方,"['は', '私', 'ども', 'の', '調べ', 'で', 'は', 'およそ', 'その', 'うち', 'の', '半分', '、', 'ちょうど', '半分', 'ぐらい', 'が', 'いわゆる', 'その', '地方', 'の', '地場', 'の', '業者', 'の', '方', 'と', 'いう', 'ふうに', '考えて', 'おり', 'ます', 'ので', '、', 'そういう', '意味', 'で', 'は', '相当', 'その', '地方']",['地場'],NO,地場,NO,NO
39,地場,、感謝しています。妻への完全な説得はできないまま、わずか５〜６名程度の地場の不動産業者へ転職しました。給与や福利厚生等の労働環境は何一つとっても以前と,"['、', '感謝', 'して', 'い', 'ます', '。', '妻', 'へ', 'の', '完全な', '説得', 'は', 'でき', 'ない', 'まま', '、', 'わずか', '５', '〜', '６', '名', '程度', 'の', '地場', 'の', '不動産', '業者', 'へ', '転職', 'し', 'ました', '。', '給与', 'や', '福利', '厚生', '等', 'の', '労働', '環境', 'は', '何一つ', 'とっても', '以前', 'と']",['地場'],NO,地場,NO,NO
40,地場,その大量販売に要するコストが、生産コストを上回るため、大手はハウスメーカー全体としての生産性は、地場の遅れた生産性にあえぐ中小零細住宅建設業者に近似した状態になっている。日本の住宅産業が,"['その', '大量', '販売', 'に', '要する', 'コスト', 'が', '、', '生産', 'コスト', 'を', '上回る', 'ため', '、', '大手', 'は', 'ハウスメーカー', '全体', 'と', 'して', 'の', '生産', '性', 'は', '、', '地場', 'の', '遅れた', '生産', '性', 'に', 'あえぐ', '中小', '零細', '住宅', '建設', '業者', 'に', '近似', 'した', '状態', 'に', 'なって', 'いる', '。', '日本', 'の', '住宅', '産業', 'が']",['地場'],NO,地場,NO,NO
41,地場,地下１階。京都駅前とはいえ穴場的なスポットだ。京野菜、湯葉、生麩、豆腐など京の地場の食材をふんだんに使った家庭料理は、京都弁でまさに「ほっこり」できるやさしい味。,"['地下', '１', '階', '。', '京都', '駅前', 'と', 'は', 'いえ', '穴場', '的な', 'スポット', 'だ', '。', '京', '野菜', '、', '湯', '葉', '、', '生', '麩', '、', '豆腐', 'など', '京', 'の', '地場', 'の', '食', '材', 'を', 'ふんだんに', '使った', '家庭', '料理', 'は', '、', '京都', '弁', 'で', 'まさに', '「', 'ほっこり', '」', 'できる', 'やさしい', '味', '。']",['地場'],NO,地場,NO,NO
42,地場,ますと資格のある人が少ないということがございまして、それで思ったような地場の地元業者を使えないといううらみがございます。そういう点は先生もう一番よく御承知,"['ます', 'と', '資格', 'の', 'ある', '人', 'が', '少ない', 'と', 'いう', 'こと', 'が', 'ございまして', '、', 'それ', 'で', '思った', 'ような', '地場', 'の', '地元', '業者', 'を', '使え', 'ない', 'と', 'いう', 'うらみ', 'が', 'ございます', '。', 'そういう', '点', 'は', '先生', 'もう', '一', '番', 'よく', '御', '承知']",['地場'],NO,地場,NO,NO
43,地場,十軒も残ればいいところじゃないですか」かつて長い年月をかけて形成された地場の産地も、衰退していくさまはあっけないほど、もろい。「なにしろ後継者がいませ,"['十', '軒', 'も', '残れば', 'いい', 'ところ', 'じゃ', 'ない', 'です', 'か', '」', 'かつて', '長い', '年月', 'を', 'かけて', '形成', 'さ', 'れた', '地場', 'の', '産地', 'も', '、', '衰退', 'して', 'いく', 'さま', 'は', 'あっけない', 'ほど', '、', 'もろい', '。', '「', 'なにしろ', '後継', '者', 'が', 'い', 'ませ']",['地場'],NO,地場,NO,NO
44,地場,、関西や他の地域でも東京ドームを例えに使ったりするのでしょうか？他に地場ならではの物を例えに使っているのでしょうか？その場合はどの様なもの,"['、', '関西', 'や', '他の', '地域', 'でも', '東京', 'ドーム', 'を', '例え', 'に', '使ったり', 'する', 'のでしょう', 'か', '？', '他', 'に', '地場', 'ならでは', 'の', '物', 'を', '例え', 'に', '使って', 'いる', 'のでしょう', 'か', '？', 'その', '場合', 'は', 'どの様な', 'もの']",['地場'],NO,地場,NO,NO
45,地場,た（＠゜▽゜＠）今年は恵比寿グルメ＆ファッションに力を入れましたが、私は一般の人と違い地場の良さや雰囲気の良さやスタッフの性格をスピリチュアルな世界で感じて居心地の良い,"['た', '（', '＠', '゜', '▽', '゜', '＠', '）', '今年', 'は', '恵比寿', 'グルメ', '＆', 'ファッション', 'に', '力', 'を', '入れ', 'ました', 'が', '、', '私', 'は', '一般', 'の', '人', 'と', '違い', '地場', 'の', '良', 'さ', 'や', '雰囲気', 'の', '良', 'さ', 'や', 'スタッフ', 'の', '性格', 'を', 'スピリチュアルな', '世界', 'で', '感じて', '居心地', 'の', '良い']",['地場'],NO,地場,NO,NO
46,地場,商業関係者は大変な関心を持って見ておるわけでございます。やはり商業というのは地場でやっておられる方もたくさんおるわけでございまして、そういった方々との,"['商業', '関係', '者', 'は', '大変な', '関心', 'を', '持って', '見て', 'おる', 'わけで', 'ございます', '。', 'やはり', '商業', 'と', 'いう', 'の', 'は', '地場', 'で', 'やって', 'おら', 'れる', '方', 'も', 'たくさん', 'おる', 'わけで', 'ございまして', '、', 'そういった', '方々', 'と', 'の']",['地場'],NO,地場,NO,NO
47,地場,続く中で、大企業がよくなっても中小企業はよくならない、特に、地域、地場の中小企業はなかなか厳しい状態にあるというのが私の認識でございます。私の,"['続く', '中', 'で', '、', '大', '企業', 'が', 'よく', 'なって', 'も', '中小', '企業', 'は', 'よく', 'なら', 'ない', '、', '特に', '、', '地域', '、', '地場', 'の', '中小', '企業', 'は', 'なかなか', '厳しい', '状態', 'に', 'ある', 'と', 'いう', 'の', 'が', '私', 'の', '認識', 'で', 'ございます', '。', '私', 'の']",['地場'],NO,地場,NO,NO
48,地場,のではないのかなと思っております。○谷口委員考えられるのは、証券会社の小さい、地場の証券会社が、これは、資本金五億以下で負債も二百億に至らないというような,"['ので', 'は', 'ない', 'の', 'か', 'な', 'と', '思って', 'おり', 'ます', '。', '○', '谷口', '委員', '考え', 'られる', 'の', 'は', '、', '証券', '会社', 'の', '小さい', '、', '地場', 'の', '証券', '会社', 'が', '、', 'これ', 'は', '、', '資本', '金', '五億', '以下', 'で', '負債', 'も', '二百億', 'に', '至ら', 'ない', 'と', 'いう', 'ような']",['地場'],NO,地場,NO,NO
49,地場,な産業には、地方経済の活性化という観点からも重要な役割が期待されている。地場の食材を利用する食品産業や、農村環境を活かしたツーリズムがその代表である。さらに異業種から,"['な', '産業', 'に', 'は', '、', '地方', '経済', 'の', '活性', '化', 'と', 'いう', '観点', 'から', 'も', '重要な', '役割', 'が', '期待', 'さ', 'れて', 'いる', '。', '地場', 'の', '食', '材', 'を', '利用', 'する', '食品', '産業', 'や', '、', '農村', '環境', 'を', '活かした', 'ツーリズム', 'が', 'その', '代表', 'である', '。', 'さらに', '異', '業種', 'から']",['地場'],NO,地場,NO,NO
50,地場,（三．三平方メートル）単価が三十万円を切る商品も提供しており「大手メーカーとの差別化を図り、地場の業者が生き残るためには、必ず県産材利用が大きな武器になる」と意気込む。千九百三十五年,"['（', '三', '．', '三', '平方メートル', '）', '単価', 'が', '三十万', '円', 'を', '切る', '商品', 'も', '提供', 'して', 'おり', '「', '大手', 'メーカー', 'と', 'の', '差別', '化', 'を', '図り', '、', '地場', 'の', '業者', 'が', '生き残る', 'ため', 'に', 'は', '、', '必ず', '県産材', '利用', 'が', '大きな', '武器', 'に', 'なる', '」', 'と', '意気込む', '。', '千九百三十五', '年']",['地場'],NO,地場,NO,NO
