384,登場,の東京オリンピック（三十九年）と佐藤の大阪万国博（四十五年）は、二人が「経済大国日本」の登場を全世界に向けてアピールする二大イベントだったと思う。同時にまたこの二大イベントは、敗者,"['の', '東京', 'オリンピック', '（', '三十九', '年', '）', 'と', '佐藤', 'の', '大阪', '万国', '博', '（', '四十五', '年', '）', 'は', '、', '二', '人', 'が', '「', '経済', '大国', '日本', '」', 'の', '登場', 'を', '全', '世界', 'に', '向けて', 'アピール', 'する', '二', '大', 'イベント', 'だった', 'と', '思う', '。', '同時に', 'また', 'この', '二', '大', 'イベント', 'は', '、', '敗者']",['登場'],NO,登場,NO,NO
385,登場,山田里志さんが３冊目を出します。私のちっぽけな体験談もまたしても何故か登場（笑）３月二十五日からアマゾン予約で本屋は３月三十日から１週間程度で並ぶ予定です。,"['山田', '里', '志', 'さん', 'が', '３', '冊', '目', 'を', '出し', 'ます', '。', '私', 'の', 'ちっぽけな', '体験', '談', 'も', 'またしても', '何故', 'か', '登場', '（', '笑', '）', '３', '月', '二十五', '日', 'から', 'アマゾン', '予約', 'で', '本屋', 'は', '３', '月', '三十', '日', 'から', '１', '週間', '程度', 'で', '並ぶ', '予定', 'です', '。']",['登場'],NO,登場,NO,NO
386,登場,はみりんのモロミにブドウ糖、味の素などを混ぜ、ショウチュウで処理した「合成みりん」も登場、素人眼には見分けのつかぬほど技術の進んだところを見せている。産地,"['は', 'みりん', 'の', 'モロミ', 'に', 'ブドウ', '糖', '、', '味', 'の', '素', 'など', 'を', '混ぜ', '、', 'ショウチュウ', 'で', '処理', 'した', '「', '合成', 'みりん', '」', 'も', '登場', '、', '素人', '眼', 'に', 'は', '見分け', 'の', 'つか', 'ぬ', 'ほど', '技術', 'の', '進んだ', 'ところ', 'を', '見せて', 'いる', '。', '産地']",['登場'],NO,登場,NO,NO
387,登場,新作。￥一万九千八百／ネペンテスＨＯＷＮＡＴＵＲＡＬ注目の新鋭ブランドからはベーシックに遊び心を加えたプルオーバーシャツが登場。￥一万千八百／ＲａｙＬｉｎｅ＆Ｃｏ．ＨＹＳＴＥＲＩＣＧＬＡＭＯＵＲ太めのボーダーがカジュアルライクな〈ヒステリックグラマー〉。比翼仕立て,"['新作', '。', '￥', '一万九千八百', '／', 'ネペンテス', 'ＨＯＷＮＡＴＵＲＡＬ', '注目', 'の', '新鋭', 'ブランド', 'から', 'は', 'ベーシックに', '遊び心', 'を', '加えた', 'プルオーバーシャツ', 'が', '登場', '。', '￥', '一万千八百', '／', 'ＲａｙＬｉｎｅ', '＆', 'Ｃｏ', '．', 'ＨＹＳＴＥＲＩＣＧＬＡＭＯＵＲ', '太', 'めの', 'ボーダー', 'が', 'カジュアルライク', 'な', '〈', 'ヒステリックグラマー', '〉', '。', '比', '翼', '仕立て']",['登場'],NO,登場,NO,NO
388,登場,も現われている。猿とミュータントたちの対立が冷戦の縮図であることは、核兵器の登場によっていっそう明確になる。ミュータントたちは神を崇めている。核兵器という神だ。二十世紀の,"['も', '現われて', 'いる', '。', '猿', 'と', 'ミュータント', 'たち', 'の', '対立', 'が', '冷戦', 'の', '縮図', 'である', 'こと', 'は', '、', '核', '兵器', 'の', '登場', 'に', 'よって', 'いっそう', '明確に', 'なる', '。', 'ミュータント', 'たち', 'は', '神', 'を', '崇めて', 'いる', '。', '核', '兵器', 'と', 'いう', '神', 'だ', '。', '二十', '世紀', 'の']",['登場'],NO,登場,NO,NO
389,登場,なるとは思うので。ね。ここでおなじみ良心的中古車屋スティック荒井氏が何と八十九年のベントレー・ターボＲに乗って登場。昨日お客さんのところから買い取ってきたばかりだという。礼一郎と荒井氏はひとしきり,"['なる', 'と', 'は', '思う', 'ので', '。', 'ね', '。', 'ここ', 'で', 'おなじみ', '良心', '的中', '古', '車', '屋', 'スティック', '荒井', '氏', 'が', '何と', '八十九', '年', 'の', 'ベントレー', '・', 'ターボ', 'Ｒ', 'に', '乗って', '登場', '。', '昨日', 'お', '客', 'さん', 'の', 'ところ', 'から', '買い取って', 'きた', 'ばかりだ', 'と', 'いう', '。', '礼', '一郎', 'と', '荒井', '氏', 'は', 'ひとしきり']",['登場'],NO,登場,NO,NO
390,登場,あった「メルローズアンファミーユ」が、二千二年春から生活提案型ブランド「メルローズクレール」として登場。新ブランドは、時代に敏感でおしゃれな感性をもつ家族のためのブランドとして、,"['あった', '「', 'メルローズアンファミーユ', '」', 'が', '、', '二千二', '年', '春', 'から', '生活', '提案', '型', 'ブランド', '「', 'メルローズクレール', '」', 'と', 'して', '登場', '。', '新', 'ブランド', 'は', '、', '時代', 'に', '敏感で', 'おしゃれな', '感性', 'を', 'もつ', '家族', 'の', 'ため', 'の', 'ブランド', 'と', 'して', '、']",['登場'],NO,登場,NO,NO
391,登場,犯人が愛するロンドンのガス灯に似た自らの姿を主張しだす。森谷帝二邸映画冒頭のパーティーシーンに登場。十七世紀に隆盛を極めた。イギリスの田園邸宅そのままの趣で、広々とし,"['犯人', 'が', '愛する', 'ロンドン', 'の', 'ガス', '灯', 'に', '似た', '自ら', 'の', '姿', 'を', '主張', 'し', 'だす', '。', '森谷', '帝', '二', '邸', '映画', '冒頭', 'の', 'パーティー', 'シーン', 'に', '登場', '。', '十七', '世紀', 'に', '隆盛', 'を', '極めた', '。', 'イギリス', 'の', '田園', '邸宅', 'そのまま', 'の', '趣', 'で', '、', '広々', 'と', 'し']",['登場'],NO,登場,NO,NO
392,登場,。ここでやっと、ＣＢＸ四百Ｆの登場です。ホンダファンにとっては待ちに待ったバイクの登場です。この辺くらいから、バイクブームが訪れた様な気がします。四百ｃｃの,"['。', 'ここ', 'で', 'やっ', 'と', '、', 'ＣＢＸ', '四百', 'Ｆ', 'の', '登場', 'です', '。', 'ホンダファン', 'に', 'とって', 'は', '待ちに待った', 'バイク', 'の', '登場', 'です', '。', 'この', '辺', 'くらい', 'から', '、', 'バイク', 'ブーム', 'が', '訪れた', '様', 'な', '気', 'が', 'し', 'ます', '。', '四百', 'ｃｃ', 'の']",['登場'],NO,登場,NO,NO
393,登場,。ここでやっと、ＣＢＸ四百Ｆの登場です。ホンダファンにとっては待ちに待ったバイクの登場です。この辺くらいから、バイクブームが訪れた様な気がします。四百ｃｃの,"['。', 'ここ', 'で', 'やっ', 'と', '、', 'ＣＢＸ', '四百', 'Ｆ', 'の', '登場', 'です', '。', 'ホンダファン', 'に', 'とって', 'は', '待ちに待った', 'バイク', 'の', '登場', 'です', '。', 'この', '辺', 'くらい', 'から', '、', 'バイク', 'ブーム', 'が', '訪れた', '様', 'な', '気', 'が', 'し', 'ます', '。', '四百', 'ｃｃ', 'の']",['登場'],NO,登場,NO,NO
394,登場,雑な上に、襟元がむにゅうにゅうな事になってる。来週は十年後雲雀さんの登場なんだぜ！,"['雑な', '上', 'に', '、', '襟', '元', 'が', 'むにゅう', 'にゅう', 'な', '事', 'に', 'なって', 'る', '。', '来週', 'は', '十', '年', '後', '雲雀', 'さん', 'の', '登場', 'な', 'んだ', 'ぜ', '！']",['登場'],NO,登場,NO,NO
395,登場,が◎。￥一万八千（プーマジャパン）スペインの、コワルスキーからはアンティークひび割れ加工のレザースニーカーが登場。上品かつワイルドで応用がきく一足。￥一万六千八百／ＫＯＷＡＬＳＫＩ（ＲＯＳＥＢＵＤ）ハイカット,"['が', '◎。￥', '一万八千', '（', 'プーマジャパン', '）', 'スペイン', 'の', '、', 'コワルスキー', 'から', 'は', 'アンティーク', 'ひび割れ', '加工', 'の', 'レザースニーカー', 'が', '登場', '。', '上品', 'かつ', 'ワイルドで', '応用', 'が', 'きく', '一足', '。', '￥', '一万六千八百', '／', 'ＫＯＷＡＬＳＫＩ', '（', 'ＲＯＳＥＢＵＤ', '）', 'ハイカット']",['登場'],NO,登場,NO,NO
396,登場,殺到した。（写真提供＝共同通信社）国内一般販売有効申込数千五百四十五万九千七百五枚平均倍率七十三倍日本代表が登場、もしくは登場の可能性がある試合の倍率●予選リーグ６月４日（火）埼玉百九十三倍日本代表の初戦６月,"['殺到', 'した', '。', '（', '写真', '提供', '＝', '共同', '通信', '社', '）', '国', '内', '一般', '販売', '有効', '申込', '数', '千五百四十五万九千七百五', '枚', '平均', '倍率', '七十三', '倍', '日本', '代表', 'が', '登場', '、', 'もしくは', '登場', 'の', '可能', '性', 'が', 'ある', '試合', 'の', '倍率', '●', '予選', 'リーグ', '６', '月', '４', '日', '（', '火', '）', '埼玉', '百九十三', '倍', '日本', '代表', 'の', '初戦', '６', '月']",['登場'],NO,登場,NO,NO
397,登場,殺到した。（写真提供＝共同通信社）国内一般販売有効申込数千五百四十五万九千七百五枚平均倍率七十三倍日本代表が登場、もしくは登場の可能性がある試合の倍率●予選リーグ６月４日（火）埼玉百九十三倍日本代表の初戦６月,"['殺到', 'した', '。', '（', '写真', '提供', '＝', '共同', '通信', '社', '）', '国', '内', '一般', '販売', '有効', '申込', '数', '千五百四十五万九千七百五', '枚', '平均', '倍率', '七十三', '倍', '日本', '代表', 'が', '登場', '、', 'もしくは', '登場', 'の', '可能', '性', 'が', 'ある', '試合', 'の', '倍率', '●', '予選', 'リーグ', '６', '月', '４', '日', '（', '火', '）', '埼玉', '百九十三', '倍', '日本', '代表', 'の', '初戦', '６', '月']",['登場'],NO,登場,NO,NO
398,登場,に開催された「タミヤ・クラシックＲＣカーミーティング」には本誌スタッフのスマイリー荒川も往年の名車イグレスを持って登場。さて、どこにいるのかな？▼Ｆ‐１＆ル・マンクラスのドライバーズスタンド。総勢,"['に', '開催', 'さ', 'れた', '「', 'タミヤ', '・', 'クラシック', 'ＲＣ', 'カーミーティング', '」', 'に', 'は', '本誌', 'スタッフ', 'の', 'スマイリー', '荒川', 'も', '往年', 'の', '名', '車', 'イグレス', 'を', '持って', '登場', '。', 'さて', '、', 'どこ', 'に', 'いる', 'の', 'か', 'な', '？', '▼', 'Ｆ', '‐', '１', '＆', 'ル', '・', 'マンクラス', 'の', 'ドライバーズスタンド', '。', '総勢']",['登場'],NO,登場,NO,NO
399,登場,ふるまっていたけど、そういう奴こそ悪巧みしてるんだよな（・∀・）このエストラードの息子まで登場・・・もうすぐ表舞台に出るとかナレが・・・・・どんな活躍を,"['ふるまって', 'いた', 'けど', '、', 'そういう', '奴', 'こそ', '悪巧み', 'して', 'る', 'んだ', 'よ', 'な', '（', '・', '∀', '・', '）', 'この', 'エストラード', 'の', '息子', 'まで', '登場', '・', '・', '・', 'もう', 'すぐ', '表', '舞台', 'に', '出る', 'と', 'か', 'ナレ', 'が', '・・・・・', 'どんな', '活躍', 'を']",['登場'],NO,登場,NO,NO
400,登場,」といった海外の時計メーカーから、ダイバーズウオッチやファッション時計などを加工したカジュアルな商品が次々と登場。通勤などの日常的な場面で身につける女性も多いという。近鉄百貨店阿倍野本店で,"['」', 'と', 'いった', '海外', 'の', '時計', 'メーカー', 'から', '、', 'ダイバーズウオッチ', 'や', 'ファッション', '時計', 'など', 'を', '加工', 'した', 'カジュアルな', '商品', 'が', '次々', 'と', '登場', '。', '通勤', 'など', 'の', '日常', '的な', '場面', 'で', '身', 'に', 'つける', '女性', 'も', '多い', 'と', 'いう', '。', '近鉄', '百貨店', '阿倍野', '本店', 'で']",['登場'],NO,登場,NO,NO
401,登場,は自主的なものではなく、金融機関主導のなかば強制的な企業再編となるからである。◆メガバンクの登場とゼネコン処理わが国の金融機関は、地価、株式の高騰を前提とした投機,"['は', '自主', '的な', 'もの', 'で', 'は', 'なく', '、', '金融', '機関', '主導', 'の', 'なかば', '強制', '的な', '企業', '再編', 'と', 'なる', 'から', 'である', '。', '◆', 'メガバンク', 'の', '登場', 'と', 'ゼネコン', '処理', 'わが国', 'の', '金融', '機関', 'は', '、', '地価', '、', '株式', 'の', '高騰', 'を', '前提', 'と', 'した', '投機']",['登場'],NO,登場,NO,NO
402,登場,バークスより！！キッス最新盤、ＤＭＣ効果で世界に先駆けて登場強力新譜のリリースが目白押しだったりもする８月。ちょっと唐突気味にキッスの最新版ベスト・アルバム、『地獄烈伝,"['バークス', 'より', '！', '！', 'キッス', '最新', '盤', '、', 'ＤＭＣ', '効果', 'で', '世界', 'に', '先駆けて', '登場', '強力', '新譜', 'の', 'リリース', 'が', '目白押し', 'だったり', 'も', 'する', '８', '月', '。', 'ちょっと', '唐突', '気味に', 'キッス', 'の', '最新', '版', 'ベスト', '・', 'アルバム', '、', '『', '地獄', '烈伝']",['登場'],NO,登場,NO,NO
403,登場,などの新しい青春歌謡も出てくる。そういう時期に、美空ひばりという不思議な少女歌手の登場というのもありました。『悲しき口笛』は、たぶん私が高校にはいった,"['など', 'の', '新しい', '青春', '歌謡', 'も', '出て', 'くる', '。', 'そういう', '時期', 'に', '、', '美空ひばり', 'と', 'いう', '不思議な', '少女', '歌手', 'の', '登場', 'と', 'いう', 'の', 'も', 'あり', 'ました', '。', '『', '悲しき', '口笛', '』', 'は', '、', 'たぶん', '私', 'が', '高校', 'に', 'は', 'いった']",['登場'],NO,登場,NO,NO
404,登場,持っているのは彼ひとりだろう。雪は次第に小降りとなり、いよいよチームＡＣＰの登場である。バイク百五十台（サイドカー六台と三輪三台を含む）が通過しただけではコース,"['持って', 'いる', 'の', 'は', '彼', 'ひと', 'り', 'だろう', '。', '雪', 'は', '次第に', '小', '降り', 'と', 'なり', '、', 'いよいよ', 'チーム', 'ＡＣＰ', 'の', '登場', 'である', '。', 'バイク', '百五十', '台', '（', 'サイドカー', '六', '台', 'と', '三輪', '三', '台', 'を', '含む', '）', 'が', '通過', 'した', 'だけ', 'で', 'は', 'コース']",['登場'],NO,登場,NO,NO
405,登場,チャンバラスター、そして専門殺陣師の登場「殺陣田村」の登場により、人々の殺陣に対する要求も、迫力があり、スピーディーなものが求められる傾向,"['チャンバラスター', '、', 'そして', '専門', '殺陣', '師', 'の', '登場', '「', '殺陣', '田村', '」', 'の', '登場', 'に', 'より', '、', '人々', 'の', '殺陣', 'に', '対する', '要求', 'も', '、', '迫力', 'が', 'あり', '、', 'スピーディーな', 'もの', 'が', '求め', 'られる', '傾向']",['登場'],NO,登場,NO,NO
406,登場,チャンバラスター、そして専門殺陣師の登場「殺陣田村」の登場により、人々の殺陣に対する要求も、迫力があり、スピーディーなものが求められる傾向,"['チャンバラスター', '、', 'そして', '専門', '殺陣', '師', 'の', '登場', '「', '殺陣', '田村', '」', 'の', '登場', 'に', 'より', '、', '人々', 'の', '殺陣', 'に', '対する', '要求', 'も', '、', '迫力', 'が', 'あり', '、', 'スピーディーな', 'もの', 'が', '求め', 'られる', '傾向']",['登場'],NO,登場,NO,NO
407,登場,あった１冊☆巻末の、書き下ろし新作「曜日女」のクォリティも高し！（＾＾）↑日曜の朝に登場、日曜女ことサンデー。左は主人公の耳雄。↑夕方になると憂鬱になってしまうサンデー。,"['あった', '１', '冊', '☆', '巻末', 'の', '、', '書き下ろし', '新作', '「', '曜日', '女', '」', 'の', 'クォリティ', 'も', '高し', '！', '（', '＾＾）↑', '日曜', 'の', '朝', 'に', '登場', '、', '日曜', '女', 'こと', 'サンデー', '。', '左', 'は', '主人公', 'の', '耳', '雄', '。↑', '夕方', 'に', 'なる', 'と', '憂鬱に', 'なって', 'しまう', 'サンデー', '。']",['登場'],NO,登場,NO,NO
408,登場,でクリアする。←月の石を守る千年前の魔物デモルト。■コミックス第十六巻Ｐ．八十一ほかで登場。ＮＯ．二十ツァオロン＆玄宗自分の意志で戦いを楽しむ玄宗と、千年前の魔物,"['で', 'クリア', 'する', '。←', '月', 'の', '石', 'を', '守る', '千', '年', '前', 'の', '魔物', 'デモルト', '。', '■', 'コミックス', '第', '十六', '巻', 'Ｐ', '．', '八十一', 'ほか', 'で', '登場', '。', 'ＮＯ', '．', '二十', 'ツァオロン', '＆', '玄宗', '自分', 'の', '意志', 'で', '戦い', 'を', '楽しむ', '玄宗', 'と', '、', '千', '年', '前', 'の', '魔物']",['登場'],NO,登場,NO,NO
409,登場,のプレミアにもシルバーのボーダーとデニムのスタイルに、ヴィヴィッドな小物をきかせて登場。このアイデア、そのまま真似したい！→ヴィヴィッドなピンクのキャスケットと、Ｕネックの衿もと,"['の', 'プレミア', 'に', 'も', 'シルバー', 'の', 'ボーダー', 'と', 'デニム', 'の', 'スタイル', 'に', '、', 'ヴィヴィッド', 'な', '小物', 'を', 'きか', 'せて', '登場', '。', 'この', 'アイデア', '、', 'そのまま', '真似', 'し', 'たい', '！→', 'ヴィヴィッド', 'な', 'ピンク', 'の', 'キャスケット', 'と', '、', 'Ｕ', 'ネック', 'の', '衿', 'もと']",['登場'],NO,登場,NO,NO
410,登場,格好の教授。自分ではコスプレ好きを否定するが…。■コミックス第５巻Ｐ．百六十八ほかで登場。ＮＯ．四十六ワイフ清麿の先生の奥さん。名前は中田サバエ。入手条件ナオミちゃん＆雷句先生を,"['格好の', '教授', '。', '自分', 'で', 'は', 'コスプレ', '好き', 'を', '否定', 'する', 'が', '…。■', 'コミックス', '第', '５', '巻', 'Ｐ', '．', '百六十八', 'ほか', 'で', '登場', '。', 'ＮＯ', '．', '四十六', 'ワイフ', '清麿', 'の', '先生', 'の', '奥さん', '。', '名前', 'は', '中田', 'サバエ', '。', '入手', '条件', 'ナオミ', 'ちゃん', '＆', '雷', '句', '先生', 'を']",['登場'],NO,登場,NO,NO
411,登場,。雌しべをもつ生殖器官、これが花である。花をもつ植物が被子植物であり、その登場は恐竜の絶滅も近づきつつあった今から一億数千万年前である。花の誕生まで、陸上植物の,"['。', '雌しべ', 'を', 'もつ', '生殖', '器官', '、', 'これ', 'が', '花', 'である', '。', '花', 'を', 'もつ', '植物', 'が', '被', '子', '植物', 'であり', '、', 'その', '登場', 'は', '恐竜', 'の', '絶滅', 'も', '近づき', 'つつ', 'あった', '今', 'から', '一億', '数', '千万', '年', '前', 'である', '。', '花', 'の', '誕生', 'まで', '、', '陸上', '植物', 'の']",['登場'],NO,登場,NO,NO
412,登場,予選会、午後から決勝大会が行われ、日ごろ鍛えたのど自慢たちが粋な着物姿で次々に登場。,"['予選', '会', '、', '午後', 'から', '決勝', '大会', 'が', '行わ', 'れ', '、', '日ごろ', '鍛えた', 'のど', '自慢', 'たち', 'が', '粋な', '着物', '姿', 'で', '次々', 'に', '登場', '。']",['登場'],NO,登場,NO,NO
413,登場,の森美しい月夜、妖精達の合唱が聞こえる。ハーンの姿をしたファルスタッフが登場。フルート、ライヒ両夫人も登場する。寄り添う２人を抱えたファルスタッフは上機嫌。そこへ妖精達が,"['の', '森', '美しい', '月夜', '、', '妖精', '達', 'の', '合唱', 'が', '聞こえる', '。', 'ハーン', 'の', '姿', 'を', 'した', 'ファルスタッフ', 'が', '登場', '。', 'フルート', '、', 'ライヒ', '両', '夫人', 'も', '登場', 'する', '。', '寄り添う', '２', '人', 'を', '抱えた', 'ファルスタッフ', 'は', '上機嫌', '。', 'そこ', 'へ', '妖精', '達', 'が']",['登場'],NO,登場,NO,NO
414,登場,の森美しい月夜、妖精達の合唱が聞こえる。ハーンの姿をしたファルスタッフが登場。フルート、ライヒ両夫人も登場する。寄り添う２人を抱えたファルスタッフは上機嫌。そこへ妖精達が,"['の', '森', '美しい', '月夜', '、', '妖精', '達', 'の', '合唱', 'が', '聞こえる', '。', 'ハーン', 'の', '姿', 'を', 'した', 'ファルスタッフ', 'が', '登場', '。', 'フルート', '、', 'ライヒ', '両', '夫人', 'も', '登場', 'する', '。', '寄り添う', '２', '人', 'を', '抱えた', 'ファルスタッフ', 'は', '上機嫌', '。', 'そこ', 'へ', '妖精', '達', 'が']",['登場'],NO,登場,NO,NO
415,登場,仮面ライダースイングキーホルダーから響鬼紅の登場です。赤いね〜。真っ赤やね。,"['仮面', 'ライダースイングキーホルダー', 'から', '響', '鬼', '紅', 'の', '登場', 'です', '。', '赤い', 'ね', '〜', '。', '真っ赤', 'や', 'ね', '。']",['登場'],NO,登場,NO,NO
416,登場,気を遣う。そんな中、最近では歯科医ならぬ、歯のエステサロンが次々に登場。なかでも元ＮＡＳＡの科学者が開発した美白ケア法で人気を呼んでいるのが、デンタルスパ,"['気', 'を', '遣う', '。', 'そんな', '中', '、', '最近', 'で', 'は', '歯科', '医', 'なら', 'ぬ', '、', '歯', 'の', 'エステサロン', 'が', '次々', 'に', '登場', '。', 'なか', 'でも', '元', 'ＮＡＳＡ', 'の', '科学', '者', 'が', '開発', 'した', '美', '白', 'ケア', '法', 'で', '人気', 'を', '呼んで', 'いる', 'の', 'が', '、', 'デンタルスパ']",['登場'],NO,登場,NO,NO
417,登場,の群集の発見があったのも十分に理由がある。（中略）近代群集社会の登場とともに、第三項排除効果は局所的封じこめを脱して世界的（地域的規模）に遍在する。近現代社会（,"['の', '群', '集', 'の', '発見', 'が', 'あった', 'の', 'も', '十分に', '理由', 'が', 'ある', '。', '（', '中略', '）', '近代', '群', '集', '社会', 'の', '登場', 'と', 'ともに', '、', '第', '三', '項', '排除', '効果', 'は', '局所', '的', '封じ', 'こめ', 'を', '脱して', '世界', '的', '（', '地域', '的', '規模', '）', 'に', '遍', '在', 'する', '。', '近', '現代', '社会', '（']",['登場'],NO,登場,NO,NO
418,登場,佐々木裕子）十ＦａｍｉｌｙＲｅｓｔａｕｒａｎｔファミリーレストラン●ガストｔｏｐｉｃ１秋冬テイストを盛り込んだ洋食３品が期間限定で登場！ガストでは、十／二十五から新メニューを販売。ハンバーグやスパゲティ、リゾットといったオーソドックスな,"['佐々木', '裕子', '）', '十', 'ＦａｍｉｌｙＲｅｓｔａｕｒａｎｔ', 'ファミリーレストラン', '●', 'ガスト', 'ｔｏｐｉｃ', '１', '秋冬', 'テイスト', 'を', '盛り込んだ', '洋食', '３', '品', 'が', '期間', '限定', 'で', '登場', '！', 'ガスト', 'で', 'は', '、', '十', '／', '二十五', 'から', '新', 'メニュー', 'を', '販売', '。', 'ハンバーグ', 'や', 'スパゲティ', '、', 'リゾット', 'と', 'いった', 'オーソドックスな']",['登場'],NO,登場,NO,NO
419,登場,の人、になっていたりして・・転居先で別の子供達が、お兄さんの登場を待っているかも！,"['の', '人', '、', 'に', 'なって', 'いたり', 'して', '・', '・', '転居', '先', 'で', '別の', '子供', '達', 'が', '、', 'お', '兄さん', 'の', '登場', 'を', '待って', 'いる', 'かも', '！']",['登場'],NO,登場,NO,NO
