,compound unit,context,segmented,split units,the unit is split,compound unit form,unexpected segmentation,unexpected joining
0,説教師,たワット・タイラーＷａｔＴｙｌｅｒの有名な農民一揆が起こっているが，ボールはウィクリフの教えを説く説教師であったのである．フスとフス戦争ウィクリフよりさらにラディカルな運動に発展したのが，,"['た', 'ワット', '・', 'タイラー', 'ＷａｔＴｙｌｅｒ', 'の', '有名な', '農民', '一揆', 'が', '起こって', 'いる', 'が', '，', 'ボール', 'は', 'ウィクリフ', 'の', '教え', 'を', '説く', '説', '教師', 'であった', 'のである', '．', 'フス', 'と', 'フス', '戦争', 'ウィクリフ', 'より', 'さらに', 'ラディカル', 'な', '運動', 'に', '発展', 'した', 'の', 'が', '，']","['説', '教師']",YES,説教師,YES,NO
1,説教師,言及することによって、教会に対する王の優位を常に主張しつづけた。有名な神学者であり説教師でもあったランスロット・アンドルーズは、旧約聖書を同じ目的で使い、火薬事件の記念式での演説,"['言及', 'する', 'こと', 'に', 'よって', '、', '教会', 'に', '対する', '王', 'の', '優位', 'を', '常に', '主張', 'し', 'つづけた', '。', '有名な', '神学', '者', 'であり', '説', '教師', 'で', 'も', 'あった', 'ランスロット', '・', 'アンドルーズ', 'は', '、', '旧約', '聖書', 'を', '同じ', '目的', 'で', '使い', '、', '火薬', '事件', 'の', '記念', '式', 'で', 'の', '演説']","['説', '教師']",YES,説教師,YES,NO
2,説教師,。作者の故郷）のへんまで行くつもりなんだ」トムはジョン伯父ととっつぁんと説教師が、テントの柱に防水布を張っているのを、そしてまた、なかにひざまずいた,"['。', '作者', 'の', '故郷', '）', 'の', 'へん', 'まで', '行く', 'つもりな', 'んだ', '」', 'トム', 'は', 'ジョン', '伯父', 'と', 'とっつ', 'ぁん', 'と', '説教', '師', 'が', '、', 'テント', 'の', '柱', 'に', '防水', '布', 'を', '張って', 'いる', 'の', 'を', '、', 'そして', 'また', '、', 'なか', 'に', 'ひざまずいた']","['説教', '師']",YES,説教師,NO,NO
3,説教師,ようにそっけなかった。この事典、男の人たちが検閲したんじゃないの？ヒルデガルトは説教師で著述家で医者で博物学者で作曲家だった。そればかりか、「中世の女性は,"['ように', 'そっけなかった', '。', 'この', '事典', '、', '男', 'の', '人', 'たち', 'が', '検閲', 'した', 'んじゃ', 'ない', 'の', '？', 'ヒルデガルト', 'は', '説', '教師', 'で', '著述', '家', 'で', '医者', 'で', '博物', '学', '者', 'で', '作曲', '家', 'だった', '。', 'そればかりか', '、', '「', '中世', 'の', '女性', 'は']","['説', '教師']",YES,説教師,YES,NO
4,説教師,馬丁の裏部屋には気をつけたほうがいいですね。さもないと、その説教師というのにいきなりやりこめられることになるでしょうから。」「ご心配にはおよびませ,"['馬', '丁', 'の', '裏', '部屋', 'に', 'は', '気', 'を', 'つけた', 'ほう', 'が', 'いい', 'です', 'ね', '。', 'さも', 'ない', 'と', '、', 'その', '説教', '師', 'と', 'いう', 'の', 'に', 'いきなり', 'やり', 'こめ', 'られる', 'こと', 'に', 'なる', 'でしょう', 'から', '。', '」', '「', 'ご', '心配', 'に', 'は', 'および', 'ませ']","['説教', '師']",YES,説教師,NO,NO
5,説教師,終わり、反キリスト到来の報に人々は無関心のままである。千四百年代に最も説得力のあった説教師のひとり、サン・ベルナルディーノ・デリ・アルビッツェスキ・ダ・シエナ（千三百八十―千四百四十四年）を取り上げてみると、その人気の秘密は、倫理,"['終わり', '、', '反', 'キリスト', '到来', 'の', '報', 'に', '人々', 'は', '無関心', 'の', 'まま', 'である', '。', '千四百', '年', '代', 'に', '最も', '説得', '力', 'の', 'あった', '説', '教師', 'の', 'ひと', 'り', '、', 'サン', '・', 'ベルナルディーノ', '・', 'デリ', '・', 'アルビッツェスキ', '・', 'ダ', '・', 'シエナ', '（', '千三百八十', '―', '千四百四十四', '年', '）', 'を', '取り', '上げて', 'みる', 'と', '、', 'その', '人気', 'の', '秘密', 'は', '、', '倫理']","['説', '教師']",YES,説教師,YES,NO
6,説教師,という関連記事が載っていたが、それを書いた若い記者はさいわい勉強不足で、説教師のババと私とコンラッド・フレッチャー殺しとの結びつきに気づいていなかった。まったく近ごろの若者と,"['と', 'いう', '関連', '記事', 'が', '載って', 'いた', 'が', '、', 'それ', 'を', '書いた', '若い', '記者', 'は', 'さいわい', '勉強', '不足', 'で', '、', '説', '教師', 'の', 'ババ', 'と', '私', 'と', 'コンラッド', '・', 'フレッチャー', '殺し', 'と', 'の', '結びつき', 'に', '気づいて', 'い', 'なかった', '。', 'まったく', '近ごろ', 'の', '若者', 'と']","['説', '教師']",YES,説教師,YES,NO
7,説教師,フーガのうねりのうちに、とどろきわたるようになったのである。中世末期になると、説教師の言葉に加えて、この思想の新しい表現形態が登場した。すなわち、木版画であって,"['フーガ', 'の', 'うねり', 'の', 'うち', 'に', '、', 'とどろき', 'わたる', 'ように', 'なった', 'のである', '。', '中世', '末期', 'に', 'なる', 'と', '、', '説', '教師', 'の', '言葉', 'に', '加えて', '、', 'この', '思想', 'の', '新しい', '表現', '形態', 'が', '登場', 'した', '。', 'すなわち', '、', '木版', '画', 'であって']","['説', '教師']",YES,説教師,YES,NO
8,説教師,と人差し指でその名刺をつまんで立っていた。何者なの、この人？説教師？ラジオ番組でそういうのをやっているのかもね―生活を改めろ、と,"['と', '人差し指', 'で', 'その', '名刺', 'を', 'つまんで', '立って', 'いた', '。', '何者', 'な', 'の', '、', 'この', '人', '？', '説', '教師', '？', 'ラジオ', '番組', 'で', 'そういう', 'の', 'を', 'やって', 'いる', 'の', 'かも', 'ね', '―', '生活', 'を', '改めろ', '、', 'と']","['説', '教師']",YES,説教師,YES,NO
9,説教師,た。ジョン・バニヤンは『天路歴程』の著者として有名だが、彼もまたそうした説教師の一人だった。しかしそのような考え方はそうした人々に限られたもの,"['た', '。', 'ジョン', '・', 'バニヤン', 'は', '『', '天路歴程', '』', 'の', '著者', 'と', 'して', '有名だ', 'が', '、', '彼', 'も', 'また', 'そうした', '説教', '師', 'の', '一', '人', 'だった', '。', 'しかし', 'そのような', '考え', '方', 'は', 'そうした', '人々', 'に', '限ら', 'れた', 'もの']","['説教', '師']",YES,説教師,NO,NO
10,説教師,二輪馬車でイルチェスターまで迎えにゆくんだ。おとなも赤ん坊みたいに水で洗うバプティストの説教師なんだ。母さんはそれを聞きにゆくんだよ。うちの父さんみたいな酔っぱらい,"['二輪', '馬車', 'で', 'イルチェスター', 'まで', '迎え', 'に', 'ゆく', 'んだ', '。', 'おとな', 'も', '赤ん坊', 'みたいに', '水', 'で', '洗う', 'バプティスト', 'の', '説', '教師', 'な', 'んだ', '。', '母さん', 'は', 'それ', 'を', '聞き', 'に', 'ゆく', 'んだ', 'よ', '。', 'うち', 'の', '父さん', 'みたいな', '酔っぱらい']","['説', '教師']",YES,説教師,YES,NO
11,説教師,抑制すべき新たな文書の公布、という形をとることが少なくなかった。他方、説教師のほうは、有力と見なした聴衆を前にして、しばしばその権力を行使する,"['抑制', 'す', 'べき', '新たな', '文書', 'の', '公布', '、', 'と', 'いう', '形', 'を', 'とる', 'こと', 'が', '少なく', 'なかった', '。', '他方', '、', '説', '教師', 'の', 'ほう', 'は', '、', '有力', 'と', '見なした', '聴衆', 'を', '前', 'に', 'して', '、', 'しばしば', 'その', '権力', 'を', '行使', 'する']","['説', '教師']",YES,説教師,YES,NO
12,説教師,た現象は多くのソウル・シンガーのステージ・アクトの一部となった。会衆の応答を得る説教師の率直な呼びかけが教会の礼拝の一部をなすいっぽう、より複雑なゴスペル・スタイルが練習,"['た', '現象', 'は', '多く', 'の', 'ソウル', '・', 'シンガー', 'の', 'ステージ', '・', 'アクト', 'の', '一部', 'と', 'なった', '。', '会', '衆', 'の', '応答', 'を', '得る', '説', '教師', 'の', '率直な', '呼びかけ', 'が', '教会', 'の', '礼拝', 'の', '一部', 'を', 'なす', 'いっぽう', '、', 'より', '複雑な', 'ゴスペル', '・', 'スタイル', 'が', '練習']","['説', '教師']",YES,説教師,YES,NO
13,説教師,ディドロによれば、この幸せな島は自由恋愛を謳歌している。だからといって、キリスト教の説教師が予言するように汚らわしい、みだらな状態に陥るようなことはない。それどころか、怯え,"['ディドロ', 'に', 'よれば', '、', 'この', '幸せな', '島', 'は', '自由', '恋愛', 'を', '謳歌', 'して', 'いる', '。', 'だからといって', '、', 'キリスト教', 'の', '説', '教師', 'が', '予言', 'する', 'ように', '汚らわしい', '、', 'みだらな', '状態', 'に', '陥る', 'ような', 'こと', 'は', 'ない', '。', 'それどころか', '、', '怯え']","['説', '教師']",YES,説教師,YES,NO
14,説教師,心を見透しているようで、あなた、パンクをやらしておくのはもったいないわ。宗教家―説教師にでもなったほうがいいんじゃない？」キッドは顔をしかめた。,"['心', 'を', '見', '透', 'して', 'いる', 'ようで', '、', 'あなた', '、', 'パンク', 'を', 'やら', 'して', 'おく', 'の', 'は', 'もったいない', 'わ', '。', '宗教', '家', '―', '説', '教師', 'に', 'でも', 'なった', 'ほう', 'が', 'いい', 'んじゃ', 'ない', '？', '」', 'キッド', 'は', '顔', 'を', 'しかめた', '。']","['説', '教師']",YES,説教師,YES,NO
15,説教師,コンセンサスなのだ。自国のサイロが核兵器でいっぱいでありながら、核兵器の保有を批判する説教師は、まさに、他の国々にみずからの例にならえと強要していることになる。端的に,"['コンセンサス', 'な', 'のだ', '。', '自国', 'の', 'サイロ', 'が', '核', '兵器', 'で', 'いっぱいであり', 'ながら', '、', '核', '兵器', 'の', '保有', 'を', '批判', 'する', '説教', '師', 'は', '、', 'まさに', '、', '他の', '国々', 'に', 'みずから', 'の', '例', 'に', 'ならえ', 'と', '強要', 'して', 'いる', 'こと', 'に', 'なる', '。', '端的に']","['説教', '師']",YES,説教師,NO,NO
16,説教師,、アイルランド人、それにスコットランド系北アイルランドの自由農民であり、瘦せていて、そばかすだらけの者たち、歌手、説教師、闘士、曾祖父アンドリュー・マキンレー“ドック”フェルのようなウイスキー・メーカー、そして、いく人かの叔父,"['、', 'アイルランド', '人', '、', 'それ', 'に', 'スコットランド', '系', '北', 'アイルランド', 'の', '自由', '農民', 'であり', '、', '瘦', 'せて', 'いて', '、', 'そば', 'かす', 'だらけ', 'の', '者', 'たち', '、', '歌手', '、', '説', '教師', '、', '闘士', '、', '曾祖', '父', 'アンドリュー', '・', 'マキンレー', '“', 'ドック', '”', 'フェル', 'の', 'ような', 'ウイスキー', '・', 'メーカー', '、', 'そして', '、', 'いく', '人', 'か', 'の', '叔父']","['説', '教師']",YES,説教師,YES,NO
17,説教師,をもとめることを重視した。これに対して，紀元前１世紀ごろから，一般民衆ならびにその指導者であった説教師の間で，自分の悟りをもとめるという自利とともに慈悲の利他行を重んじ，,"['を', 'もとめる', 'こと', 'を', '重視', 'した', '。', 'これ', 'に', '対して', '，', '紀元', '前', '１', '世紀', 'ごろ', 'から', '，', '一般', '民衆', 'ならびに', 'その', '指導', '者', 'であった', '説', '教師', 'の', '間', 'で', '，', '自分', 'の', '悟り', 'を', 'もとめる', 'と', 'いう', '自', '利', 'と', 'ともに', '慈悲', 'の', '利', '他', '行', 'を', '重んじ', '，']","['説', '教師']",YES,説教師,YES,NO
18,説教師,が、時がたつにつれてムハンマドの言葉に帰せられていったこともあろう。また、説教師が、自分の説教を権威づけるためにハディースを偽造したこともある。だが、このような,"['が', '、', '時', 'が', 'たつ', 'に', 'つれて', 'ムハンマド', 'の', '言葉', 'に', '帰せ', 'られて', 'いった', 'こと', 'も', 'あろう', '。', 'また', '、', '説', '教師', 'が', '、', '自分', 'の', '説教', 'を', '権威', 'づ', 'ける', 'ため', 'に', 'ハディース', 'を', '偽造', 'した', 'こと', 'も', 'ある', '。', 'だが', '、', 'このような']","['説', '教師']",YES,説教師,YES,NO
19,説教師,ところなんだ」フレンシイはその間、ネイサンを瞶めていました。「おい、説教師の子供。うちの親父が言っていたぞ、お前の親父は夏まで続かない,"['ところ', 'な', 'んだ', '」', 'フレンシイ', 'は', 'その', '間', '、', 'ネイサン', 'を', '瞶めて', 'い', 'ました', '。', '「', 'おい', '、', '説', '教師', 'の', '子供', '。', 'うち', 'の', '親父', 'が', '言って', 'いた', 'ぞ', '、', 'お前', 'の', '親父', 'は', '夏', 'まで', '続か', 'ない']","['説', '教師']",YES,説教師,YES,NO
20,説教師,わざとらしく元気よさを装いながら、ウルフが尋ねた。「母さんの気に入っている説教師のことさ」とロビーが口をはさんだ。「ミスタ・マンリーの友だちのビアード爺さんが二輪馬車,"['わざと', 'らしく', '元気', 'よ', 'さ', 'を', '装い', 'ながら', '、', 'ウルフ', 'が', '尋ねた', '。', '「', '母さん', 'の', '気', 'に', '入って', 'いる', '説教', '師', 'の', 'こと', 'さ', '」', 'と', 'ロビー', 'が', '口', 'を', 'はさんだ', '。', '「', 'ミスタ', '・', 'マンリー', 'の', '友だち', 'の', 'ビアード', '爺さん', 'が', '二輪', '馬車']","['説教', '師']",YES,説教師,NO,NO
21,説教師,である．その主要な支持基盤となった中層以下の都市民は，千四百二十一年後半から翌年初頭にかけて説教師ジェリフスキーが指導したプラハにおいて一時的に進出した．終末論の影響を受けた彼らは君主制,"['である', '．', 'その', '主要な', '支持', '基盤', 'と', 'なった', '中層', '以下', 'の', '都市', '民', 'は', '，', '千四百二十一', '年', '後半', 'から', '翌年', '初頭', 'に', 'かけて', '説', '教師', 'ジェリフスキー', 'が', '指導', 'した', 'プラハ', 'に', 'おいて', '一時的に', '進出', 'した', '．', '終末', '論', 'の', '影響', 'を', '受けた', '彼', 'ら', 'は', '君主', '制']","['説', '教師']",YES,説教師,YES,NO
22,説教師,。また彼は、既成の修道士がホィットフィールドへの説教壇の提供を拒否すると、あらゆる説教師が利用できる会議堂の建設資金を寄付している。こうした敬虔主義と合理主義との協調関係は、,"['。', 'また', '彼', 'は', '、', '既成', 'の', '修道', '士', 'が', 'ホィットフィールド', 'へ', 'の', '説教', '壇', 'の', '提供', 'を', '拒否', 'する', 'と', '、', 'あらゆる', '説', '教師', 'が', '利用', 'できる', '会議', '堂', 'の', '建設', '資金', 'を', '寄付', 'して', 'いる', '。', 'こうした', '敬虔', '主義', 'と', '合理', '主義', 'と', 'の', '協調', '関係', 'は', '、']","['説', '教師']",YES,説教師,YES,NO
23,説教師,ことが、その表情からはっきり見て取れた。彼女は、イルチェスターからやってくる説教師にたいする取りとめのない礼讃の言葉を並べた。部屋じゅう、その高名な人物とかかわる,"['こと', 'が', '、', 'その', '表情', 'から', 'はっきり', '見て取れた', '。', '彼女', 'は', '、', 'イルチェスター', 'から', 'やってくる', '説', '教師', 'に', 'たいする', '取りとめ', 'の', 'ない', '礼', '讃', 'の', '言葉', 'を', '並べた', '。', '部屋', 'じゅう', '、', 'その', '高名な', '人物', 'と', 'かかわる']","['説', '教師']",YES,説教師,YES,NO
24,説教師,、あっても輸入盤はあまり手に入らなかった。千九百六十二年正月には《ファンクの説教師》と言われたピアニストのホレス・シルバー・クインテットが初来日した。シルバーと言えば、彼の『,"['、', 'あって', 'も', '輸入', '盤', 'は', 'あまり', '手', 'に', '入ら', 'なかった', '。', '千九百六十二', '年', '正月', 'に', 'は', '《', 'ファンク', 'の', '説', '教師', '》', 'と', '言わ', 'れた', 'ピアニスト', 'の', 'ホレス', '・', 'シルバー', '・', 'クインテット', 'が', '初', '来', '日', 'した', '。', 'シルバー', 'と', '言えば', '、', '彼', 'の', '『']","['説', '教師']",YES,説教師,YES,NO
25,説教師,は廃止されたが、イギリス人の生活からは消え去らなかった。イギリスの最も有名な説教師の一人ジョアンナ・サウスコットは、千七百五十年に生まれたが、神の声を聞きはじめたときにメソジスト派,"['は', '廃止', 'さ', 'れた', 'が', '、', 'イギリス', '人', 'の', '生活', 'から', 'は', '消え', '去ら', 'なかった', '。', 'イギリス', 'の', '最も', '有名な', '説', '教師', 'の', '一', '人', 'ジョアンナ', '・', 'サウスコット', 'は', '、', '千七百五十', '年', 'に', '生まれた', 'が', '、', '神', 'の', '声', 'を', '聞き', 'はじめた', 'とき', 'に', 'メソジスト', '派']","['説', '教師']",YES,説教師,YES,NO
26,説教師,あれほんとのこと言っとるんじゃとしたら―さっきの男がじゃ？」説教師がこたえた。「ありゃあほんとのこと言っとるじゃよ。あの男にすりゃあほんとのことをじゃ。,"['あれ', 'ほんとの', 'こと', '言っ', 'とる', 'んじゃ', 'と', 'したら', '―', 'さっき', 'の', '男', 'が', 'じゃ', '？', '」', '説教', '師', 'が', 'こたえた', '。', '「', 'ありゃ', 'あ', 'ほんとの', 'こと', '言っ', 'とる', 'じゃ', 'よ', '。', 'あの', '男', 'に', 'すり', 'ゃあ', 'ほんと', 'の', 'こと', 'を', 'じゃ', '。']","['説教', '師']",YES,説教師,NO,NO
27,説教師,あらかじめおこなうこと）をおこなわれることになった。そのついでに安居院の聖覚を唱導（説教師）として、聖道の諸宗のほかに、別して浄土宗があるわけがない理由を述べ,"['あらかじめ', 'おこなう', 'こと', '）', 'を', 'おこなわ', 'れる', 'こと', 'に', 'なった', '。', 'その', 'ついで', 'に', '安居', '院', 'の', '聖', '覚', 'を', '唱', '導', '（', '説教', '師', '）', 'と', 'して', '、', '聖', '道', 'の', '諸', '宗', 'の', 'ほか', 'に', '、', '別', 'して', '浄土宗', 'が', 'ある', 'わけ', 'が', 'ない', '理由', 'を', '述べ']","['説教', '師']",YES,説教師,NO,NO
28,説教師,礼拝の音楽の演奏にはいりこんだことだ。そうした行為に熱をいれすぎた説教師が、礼拝中に卒倒することも珍しくなく、そうした現象は多くのソウル・シンガーのステージ・アクト,"['礼拝', 'の', '音楽', 'の', '演奏', 'に', 'はいり', 'こんだ', 'こと', 'だ', '。', 'そうした', '行為', 'に', '熱', 'を', 'いれ', 'すぎた', '説教', '師', 'が', '、', '礼拝', '中', 'に', '卒倒', 'する', 'こと', 'も', '珍しく', 'なく', '、', 'そうした', '現象', 'は', '多く', 'の', 'ソウル', '・', 'シンガー', 'の', 'ステージ', '・', 'アクト']","['説教', '師']",YES,説教師,NO,NO
29,説教師,二十積荷の上の家族たち―子供たちとコニーと「シャロンのバラ」と説教師は、からだじゅうがこわばり、ひきつったようになっていた。彼らはベイカーズフィールドの検死官の,"['二十', '積荷', 'の', '上', 'の', '家族', 'たち', '―', '子供', 'たち', 'と', 'コニー', 'と', '「', 'シャロン', 'の', 'バラ', '」', 'と', '説教', '師', 'は', '、', 'からだ', 'じゅう', 'が', 'こわばり', '、', 'ひきつった', 'ように', 'なって', 'いた', '。', '彼', 'ら', 'は', 'ベイカーズフィールド', 'の', '検死', '官', 'の']","['説教', '師']",YES,説教師,NO,NO
30,説教師,伝統は教会の礼拝で実施されたが、そこでは聖書からの句を読みあげる説教師がいて、会衆はその説教師が読みあげる句の真理への信仰を述べる、あるいは,"['伝統', 'は', '教会', 'の', '礼拝', 'で', '実施', 'さ', 'れた', 'が', '、', 'そこ', 'で', 'は', '聖書', 'から', 'の', '句', 'を', '読み', 'あげる', '説', '教師', 'が', 'いて', '、', '会', '衆', 'は', 'その', '説教', '師', 'が', '読み', 'あげる', '句', 'の', '真理', 'へ', 'の', '信仰', 'を', '述べる', '、', 'あるいは']","['説', '教師']",YES,説教師,YES,NO
31,説教師,伝統は教会の礼拝で実施されたが、そこでは聖書からの句を読みあげる説教師がいて、会衆はその説教師が読みあげる句の真理への信仰を述べる、あるいは,"['伝統', 'は', '教会', 'の', '礼拝', 'で', '実施', 'さ', 'れた', 'が', '、', 'そこ', 'で', 'は', '聖書', 'から', 'の', '句', 'を', '読み', 'あげる', '説', '教師', 'が', 'いて', '、', '会', '衆', 'は', 'その', '説教', '師', 'が', '読み', 'あげる', '句', 'の', '真理', 'へ', 'の', '信仰', 'を', '述べる', '、', 'あるいは']","['説教', '師']",YES,説教師,NO,NO
32,説教師,をもって応じたものだった。コール＝アンド＝レスポンスはまた賛美歌にもとりいれられ、説教師かリード・シンガーがヴァースを歌うと合唱団はその賛美歌のリフレインをもって応じたのだった。「,"['を', 'もって', '応じた', 'もの', 'だった', '。', 'コール', '＝', 'アンド', '＝', 'レスポンス', 'は', 'また', '賛美', '歌', 'に', 'も', 'とりいれ', 'られ', '、', '説', '教師', 'か', 'リード', '・', 'シンガー', 'が', 'ヴァース', 'を', '歌う', 'と', '合唱', '団', 'は', 'その', '賛美', '歌', 'の', 'リフレイン', 'を', 'もって', '応じた', 'のだった', '。', '「']","['説', '教師']",YES,説教師,YES,NO
33,説教師,カトリックの司祭たちにとってのキリストは」と彼は思った、「ミスタ・ビアードの連れてくる説教師にとってのイエスとはまったくべつの神だ。そのどちらが、いまの場合、ぼく,"['カトリック', 'の', '司祭', 'たち', 'に', 'とって', 'の', 'キリスト', 'は', '」', 'と', '彼', 'は', '思った', '、', '「', 'ミスタ', '・', 'ビアード', 'の', '連れて', 'くる', '説教', '師', 'に', 'とって', 'の', 'イエス', 'と', 'は', 'まったく', 'べつの', '神', 'だ', '。', 'その', 'どちら', 'が', '、', 'いま', 'の', '場合', '、', 'ぼく']","['説教', '師']",YES,説教師,NO,NO
34,説教師,たが、そこでは聖書からの句を読みあげる説教師がいて、会衆はその説教師が読みあげる句の真理への信仰を述べる、あるいはその句の次の一節をもって応じ,"['たが', '、', 'そこ', 'で', 'は', '聖書', 'から', 'の', '句', 'を', '読み', 'あげる', '説', '教師', 'が', 'いて', '、', '会', '衆', 'は', 'その', '説教', '師', 'が', '読み', 'あげる', '句', 'の', '真理', 'へ', 'の', '信仰', 'を', '述べる', '、', 'あるいは', 'その', '句', 'の', '次の', '一節', 'を', 'もって', '応じ']","['説', '教師']",YES,説教師,YES,NO
