,0
99,、利用者の利便性の向上が図られたところであるが、引き続き既存施設の能力増強についての取り組みもなされている。一方、国内航空に関しては、首都圏の空港における利用者が、平成
100,エレベーターを降りてからの行き先表示」など、指摘を受けたものも多く、今後の取り組みの課題が見つかりました。「職員の応対について」の質問にも
101,少なくとも相当厳しい法的な規制、それから経済的な手法、それから国民のまたは業界団体の自主的な取り組み、このような最低三つぐらいの手順や手法を総動員しながら取り組んでいかないと、とても
102,関与する割合が低い実態にあるが、最近では、「棚田オーナー制度」等非農家・都市住民も参加した保全の取り組みもみられるなど、「棚田」という我が国特有の伝統的景観を地域を越えて保全する
103,の育成と下層動植物の多様性の確保をはかったり、檮原産木の販路拡大を進めたりする新しい取り組みに力を入れるようになった。自治体として画期的な取り組みと言えるのは、
104,ことは、みんなの願いです。子どもたち一人一人の成長のために、地域ではさまざまな取り組みが行われています。今月は手稲区で行われている青少年育成活動についてご紹介します。
105,法整備づくりが進み，企業の環境への取り組みが活発化している。企業の環境への取り組みを示すものとして，環境マネジメントシステムの国際規格ＩＳＯ一万四千一の認証を取得する企業が急増している。平成十四年２月末現在
106,取り扱うための一つの方法として考えることができる。私は、この文脈で都市を概念的に説明する取り組みにまさに光をあてるスケーリングの分析的研究が、生態学者の間でいくつかおこなわれていること
107,に就農できるよう支援を強化するため，最近，独自の体制，制度を設ける県，市町村等の取り組みが各地でみられる。例えば，北海道においては，酪農を対象として，農地保有合理化法人
108,受けられるために、地域密着型サービス拠点の整備を進めています。問高齢施策推進課☎五千四百三十二‐二千四百八ＦＡＸ五千四百三十二‐三千二十一取り組み「福祉人材育成・研修センター」で、人材の発掘や就労の支援、介護従事者の専門性向上など人材の確保
109,の目標に対して、基本的な考え方、それについて、まず生産者及び消費者の両面にわたる国民参加型の取り組みが重要であるとの考え方であります。その具体的な実践方法、その具体的な問題をどう
110,と思います。将来は学校や公民館にも場所を移してさらに地域に密着した取り組みを計画中です」何ができるかな？子供たちの放課後を取り戻そう「子どもの居場所づくり」
111,。この催しは、より多くの方に北海道の安全・安心でおいしい水産物や地域マリンビジョンの取り組みを知ってもらおうと北海道開発局の呼び掛けにより開催されたもので、地域マリンビジョンを策定している地域の
112,の人権の擁護を図る手だてになるかが最大の課題となる。その重要な取り組みのひとつとして，法律関係の専門家と心の専門家との連携と連携に便宜な手続き
113,二酸化炭素の排出を減らすためにはどうすればいいのでしょうか。今月号では、家庭でできる取り組みをご紹介します。家庭で行う温暖化対策は、省エネ・省資源など家計費の節減につながるものも
114,）地域経済に占める中小企業の地位各地域において，地域経済の活性化を図るために種々の取り組みが行われている今日，地場・産地産業をはじめ地域に密着した企業活動を展開している中小企業の重要性について
115,しｗｗマスコミの授業で今日は映画について取り上げていた、、映画館でも新しい取り組みがされているみたいな・・・その新しい取り組みを特集していたＴＶ番組を先生が
116,（昭和六十一年７月公益法人指導監督連絡会議決定）等の基準やこれらの運用に関する指針等により、各所管官庁で統一的な取り組みが行われてきた。また、このほか、「公益法人の設立許可について」（平成
117,、鶴見小野駅周辺の再整備について検討調査を進めます。【都市整備局】鶴見区の防災の取り組みについては表面をご覧ください・防災キャラバン隊活動事業・災害時要援護者救援システムづくり事業・家具転倒防止器具取り付け事業・まるごとまちごとハザードマップｉｎ鶴見・（地域別）鶴見川洪水ハザードマップ作成事業
118,が「重要伝統的建造群保存地区」として文化庁から指定されたことが、その後の内子町のさまざまな取り組みに大きな影響を及ぼした。第二に、内子町市街地の活性化を町周辺部の活性化に展開し
119,」についても「そう思う」とする割合が高く（七十二．八％），土地の有効利用の取り組みへの参加については基本的に肯定的である。しかしながら，実際には，土地の有効利用
120,の世界的な発明も生まれています。創業のメッカを目指すものづくり都市として、さらに発展するための取り組みを紹介します。◆市政トピックスはままつ冬の蛍フェスタ二千七（十一／十七〜１／十四）消防出初式（１／５
121,を出した。しかし，火山の有効な活用の方法について，住民全体で考え，その取り組みを実現させている。レポート例●資料１千九百九十一年台風第十九号の進路と家屋の被害千九百九十一年
122,製造現場における労働者の持つ技能や改善・提案の力であり、最近の国内生産回帰の動きや技能伝承・継承の取り組みは、こうした我が国の労働者が持つ能力への評価の現れである面も
123,。事務用品を扱うＫ社では、環境に配慮した製品の開発のため様々な取り組みを進めています。その取り組みの一つとして、スギやヒノキ、カラマツなど間伐材を材料
124,働き、暮らすことができる世田谷らしいワーク・ライフ・バランス推進のあり方について検討してまいります。地域活性化に向けた取り組み「地域の絆」の構築に向けて十一月にシンポジウムを開催し、地域の活性化
125,調査研究を行っています。第３節健やかに子供を育て・守るための環境づくり〜地域における取り組み〜１新子どもプランの推進平成十一年６月の生涯学習審議会答申「生活体験・自然体験が日本の子どもの心
126,申合せを行うこと等により農薬や化学肥料の削減に取り組んでいる事例がみられる。これらの取り組みを行っている集団を対象にした農林水産省「環境と調和した農業の推進に関する実態調査
127,の売色風景をそのままに映したかのような情景で、陰子と客との取り組みを、廊下で遊女と客とが覗きながら一儀を働くといった図だ。廊下の
128,機械設備のエネルギー利用効率が低いことも指摘されている。一方、環境保全のための行政の取り組み、規制等に関しては、環境監視及び管理に関する法・規制・制度や組織は整備されつつあるものの、管理や
129,ついてお知らせしましたが、今月号は私たちにできる取り組みを紹介します。家庭でできる取り組みを考えるすぐできる十の取り組み私たちの生活を見直し、二酸化炭素の排出を減らすために
130,首相官邸の地球温暖化対策への取り組みに、政府内から不満の声が出ている。温暖化対策の推進役を果たしてきた関係４閣僚会合
131,として，河川や海岸に特有の自然と触れ合うことのできる機能を十分にいかした取り組みを推進するため，自然体験・環境教育の場等としての身近な水辺環境の整備等を実施している。警察
132,、「代表者の相談役」、「代表者の諫言役」の割合は低くなり、「新しい取り組みの担当」の割合が高くなっている（第３‐２‐十八図）。経営者と
133,情報の共有・発信をより早く行うことのできるシステムなどを備えるほか、地域の防災活動の取り組みなどを発信していきます。問危機管理室（☎三百二十二．六二三七、ＦＡＸ三百二十二．六〇三一）意見募集の方法▶閲覧場所
134,、生涯学習の果たす役割はますます重要になってきています。生涯学習のあり方や地域社会の取り組みについて考えるため、多くの皆さんの積極的な参加をお待ちしています。問い合わせ
135,達成に向けた取り組みが進むよう促すとともに、国・地方公共団体等の特定事業主における社会全体の牽引役としての取り組みを促す。○結婚や出産後も育児をしながら働くことができるようにするための取り組み
136,を実現しようとする主張が力を増している。もちろん、千九百九十年代ＥＵのサステイナビリティへ向けた取り組みがまやかしだったということにはならない。都市と農村を統合的にとらえて、
137,努めます。今年度は、５施設で指定管理者による管理運営の開始と、導入施設の拡大の取り組みを進めます。また、ごみ収集業務の民間委託の拡大、市営バス事業の民間移譲に向けて取り組みます
138,な推進に努めている。また，各種の広報啓発活動や青少年育成国民運動の支援等を行い，国民的な取り組みの活性化を図っている。この章では，こうした内閣府が講じている施策など
139,のための適切な対応への一層の充実を図ることができる。なお、以上の取り組みを行うに際しては、社内のシステム部門と法務部門との共同作業が不可欠になること
140,過去、そういったケースがあったのかなかったのか、あるいは今後どういう取り組みをされるのか、特に、南野法務大臣だから、この点についてお伺いをしたいと
141,ています。二千年７月の九州・沖縄サミット外相会合の際に、わが国は紛争予防のための開発協力による取り組みを「アクション・フロム・ジャパン」としてまとめました。そこでは紛争予防、紛争発生時の緊急人道支援、紛争後の
142,。昨年十二月二十四日に、企画課長を事務局長に十五人態勢で実施本部を設立。全国で最も早い取り組みという。【毎日新聞・大賀英作】
143,を次代の社員に継承し、発展させる機会を提供することは今後欠かすことのできない取り組みだ。それには遺伝子をしっかりと認識し、継承・進化させるコミュニケーションの機会を持つことが
144,１休眠法人数の推移（注）各年十月１日現在（所管不明法人の調査及びその整理への取り組み）所管不明法人については、その実態数を把握するため、平成７年度に、総理府が「所管不明公益法人調査
145,せることは，裁判所の職責放棄，医療界による裁判支配につながりかねない。５）弁護士・弁護士会としての取り組み（１）専門弁護士の要請前記のとおり，東京地裁は，医療過誤訴訟の集中部を設け
146,及び経済産業省と共同で「産業事故災害防止対策推進関係省庁連絡会議」を開催し、産業事故災害の防止について、以下のような取り組みを行っており、共通的な事故防止対策のとりまとめを平成十五年中を目途に行うこととしている
147,などについては未だ評価するには至らないが，参加している農家の特に若手の後継者の取り組みは検討に値する。大島は面積約七十ｈａの海底火山の噴火によって形成された火山砕屑丘と
148,には、個々の子どもや親の判断に委ねられているという状況のなかで、取り組みが行われているのである。こうした基本的条件が、及川さんに子どもたちにとっての楽しい場
149,を提供する組織の違いによって異なってくると考えられる。すなわち、東京都で行われている取り組みのように高齢者の権利保護や苦情処理であれば、地域や市町村など高齢者が住む身近な
150,また、学校給食費、保育料、市営住宅の家賃などの滞納対策につきましては、引き続き取り組みを強化してまいります。大部分が国有地であります、土浦第三中学校の校地につきまし
151,発見をされた、こういうことで、それ以降、学校、教育委員会としての事実確認の取り組みを行うとともに、学校内でかかる人権を侵害する落書きが生じないよう主体的に取り組む、そう
152,ている。以上のように，各大学においては，教育機能の充実強化のための様々な取り組みが進められているが，高等教育の大衆化と学生の多様化が一層進展すると考えられる二十一世紀
153,、連続して効果が上がるような取り組みを続けていかねばなりません。この取り組みに対して段階的に期限と達成度をそれぞれ設定していくことになります。こうしてプロジェクトの最終終了
154,人との顔が見える関係を築いてくれます。このため、「地産地消」の取り組みが各地で活発に行われています。伊勢市地産地消の店観光振興基本計画が策定されました観光企画課
155,た。望ましい姿がさまざまであるように，今後，様々な形で土地の有効利用の取り組みがみられるものと見込まれるが，主体としての地域の住民とそれを支える地方公共団体
156,の検証を行いながら、着実に計画を推進していきます。■基本目標の施策方針と主な取り組み基本目標１個性が輝き、創造性あふれる人づくり１子どもの豊かな感性の育成◆
157,平成十二年５月に開催された「観光産業振興フォーラム」において，「訪日外国人倍増に向けた取り組みに関する緊急提言」が採択された。●概ね二千七年を目途に訪日外国人数を八百万人に倍増させる
158,が訪れる。青山学院大教授（環境法）の平松紘さんは「世界的に見てもユニークな取り組み。自然環境の保護と観光を両立させている点も評価できる。日本も島国で、環境
159,役割を果たしていきます」とのこと。ごみ収集福祉サービス（愛称「まごころ収集」）などの新たな取り組みを進めている「まち美化事務所」は、暮らしの頼れる「ごみ」のエキスパート。的確な
160,に、みどり率（※）三十三％の達成をめざす「世田谷みどり三十三」の実現に向けた取り組みを進めています。事業をより多くのみなさんに知っていただくため、現在シンボルマークの原案
161,持続可能な発展を目指して，社会との良好な関係を保ちつつ，環境保全への取り組みを効率的かつ効果的に推進していくことを目的として，事業活動における環境保全のための
162,があった場合も届出が必要です。十二月は地球温暖化防止月間問生活環境課☎９２４‐２７３１▼一人ひとりが取り組みを“寒い時には着る”ことで“過度に暖房に頼らない”『
163,、小さな町や村はどのように生き残ればいいのか。合併に揺れる熊本県清和村の取り組みなど、地方自治体の自立への闘いを追う。◇ＢＢＣ地球伝説（ＢＳ朝日後８・００）
164,観光展の開催・参加，観光ミッションの派遣など外国人旅行者の誘致活動及び受入体制整備などのほか，国際コンベンション振興への取り組みが一層活発に行われた。６観光関係団体の活動我が国における観光関係団体は，
165,公民館ではさまざまな教育・文化・スポーツ活動が展開されています。こうした皆さんの自主的な取り組みや活動をつなげ、広げ、そして深めながら、これからの公民館を考えていくために「
166,、幼稚園など二十二団体もゴーヤーで緑のカーテンを育てています。緑のカーテンの取り組みは区ホームページでも公開していますので、ぜひご覧ください。育て方や各団体の活動を展示
167,検討を行っている。（５）消防防災分野における申請・届出等手続の電子化の取り組み申請・届出等手続の電子化の取り組みについては、平成十一年に策定された「経済新生対策（平成十一年十一月十一日経済対策閣僚会議）」及び「
168,ものをつくるということですね。それから、食品産業事業者サイドにおいては、販路開拓や新製品の開発の取り組みを通しまして農業サイドとの連携を強化していかなきゃいかぬと思っています。それから
169,地球温暖化の原因、影響、対策についてお知らせしましたが、今月号は私たちにできる取り組みを紹介します。家庭でできる取り組みを考えるすぐできる十の取り組み私たちの生活を
170,抱いた檮原町と檮原町森林組合は、一体となって森林保護と林業振興に取り組んだのだ。その取り組みの主なものを拾ってみると、次のとおりだ。▽千九百九十三年間伐・主伐などに従事する
171,第１‐２‐独十一表）。第１‐２‐独十一表ドイツの国際競争力強化への取り組みドイツ政府は千九百九十三年９月に国際競争力の改善を目標とした報告書を閣議決定した。この
172,ＰＴＡや地域の自転車組合の人たちによる自転車点検や、学校独自の自転車通学許可証の発行など、さまざまな取り組みを行っています。新しい都市づくり高松市では、平成十九年８月に香川県などととも
173,警察に相談区の取り組み（毎月１日号に掲載）Ｖｏｌ．７（仮称）防犯カメラ条例制定への取り組み安全・安心まちづくりを、より一層推進する観点から、防犯カメラの有用性を踏まえつつ、公共の場所
174,を行うなど、男女共同参画社会の実現に向けた取り組みを行っています。今回、その取り組みをより効果的に進めるために策定した「れいんぼうプラン（男女共同参画基本計画）」の概要についてお知らせし
175,見逃せない事柄であります。そこで、我が災害対策委員会においてもそうですが、政府部内の取り組みにおいても、国土庁と環境庁との間での所管分担で柔軟な対応が必要であると
176,の先生のレポートをもとに討論をやりました。レポーターの先生は、学級の取り組みを報告しながら、そのなかで一人の子の指導について問題提起しました。その子は
177,によって、ここ十年ほどの間に町並み景観が生まれ変り、結果として歴史的景観が再生・整備されてきた取り組みである。これは、伊勢神宮の建造物が、二十年に１度の式年遷宮によって伝統技術を継承しながら
178,市民の皆さんのご意見を募集します。問財政課（☎五百四．二〇七五、ＦＡＸ五百四．二〇九九）これまでの取り組み広島市は、平成十五年十月に財政非常事態を宣言。十六年４月に策定した「第２次財政健全化計画」
179,なくては学級の生活が成り立っていかないという中での役割の自覚と、その取り組みに対する行動を行うことによる達成感が、それも子どもたち自身の手によって評価が行われる中
180,拡大に対する、意図的な「防衛線」が張り巡らされているようにも見える。その実態と取り組みの効果の把握は、実態調査の課題であろう。以上、考察の対象とした
181,を放鳥京丹波町猟友会が十一月十一日、町内各地区でキジの放鳥を行いました。この取り組みは、京都府猟友会が鳥獣保護と増殖を目的に、府内市区町村の猟友会を通じて毎年実施。今年は
182,ことができるかどうかが大きな不安であったのだが、このように承継の前に新しい取り組みを実行し成果をあげることでそうした不安は事前に解消され、円滑に事業
183,水が飲めるウォータークーラーを学校に設置して、冷たい水を飲みたいと、そのような取り組みを全校でやっているそうですが、何か自分の身にもう一度戻ってくる
184,全国ネット化等、を必然的なものにします。それは、先に述べたいくつかの取り組みのような、学校田や稲作りを通しての農家と学校・子どもとの交流、野菜づくり農家と
185,のない加盟店には厳しく接すべき」と答えた企業も四十四．四％あった。本部の取り組みに相応の努力で応えてほしいとの思いがある。特に全店売上高三百億円未満の中小チェーンでは
186,充実・強化が図られるとともに、市町村及び都道府県行動計画に位置づけられることにより、真に実効性のある取り組みが進められることが重要である。また、地域により少子化の状況は様々であり、
187,した。児童もさることながら先生の方が燃えて「ドングリ独楽まわし大会への児童の取り組みの楽しげな様子、保護者の支援のすばらしさ等はもちろん総合的学習の在り方にも大きな示唆を
188,国民の命と健康、財産をしっかりと守ることでありますし、この立場での取り組みを強めることであります。改めてこの機会にこの検討とか研究をする、こういう
189,かその他いろいろの御協力を得ながら、どのような形で大阪としてのエイズ問題の取り組みをまとめていこうかという準備がされていたということもあったかと思いますし、
190,の菊川町、小笠町、大東町でもう既に洪水ハザードマップを作成し、水害時における被害を最小限に食いとめる取り組みを実施しております。このような流域におけるソフト対策がこういう急流河川でも必要だと
191,の設定等のハード・ソフト両面における施策を進める必要がある。２外国人がひとり歩きしやすい街をめざす取り組み（１）現状における問題点国際観光振興会の６年の調査によると、「訪日外国人客が日本旅行中に
192,の森林保全によるＣＯ２削減の仕組みづくり区では、家庭や事業所における省エネルギーの取り組みを支援・促進するさまざまな事業に加え、区も一事業者として率先して省エネルギーや新エネルギーの導入等に
193,児童生徒の確かな「学び」と豊かな「育ち」を推進していくために、さまざまな取り組みを展開しています。新しい学習指導要領も公示され、次代を担う子どもたちの「教育」
194,それ故、遼寧省の本交流会議に対しての期待は大きい。遼寧社会科学院趙軍山氏及び遼寧省経済貿易委員会よりの資料により本交流会議に対する取り組みと展望をみると次の点を指摘することが出来る。二十七）神奈川県前掲書『抄録
195,見いだし、伝建地区保存条例に定められた景観づくりのルールにもとづき、町並みの保全・整備が進められている取り組みである。一方、後者は、すでに多くの建造物が更新されてしまい、町並みとしては
196,第３節大量に排出される廃棄物への取り組み１今後の廃棄物対策（１）廃棄物処理の現状我が国においては、生活環境の保全
