,0
197,ます．来年度，総務省と経済産業省が共同でボット対策に乗り出すという政策があるのです．この取り組みで実施されるのは以下であるということが報道されています．１ボットの検体
198,ここでは，世界的に高まる国際規格取得への動きを紹介するとともに，我が国中小企業の国際規格に対する取り組みを見ていくことにする。１世界的に高まる国際規格取得への動き近年，経済のグローバル化
199,運用する仕組みづくりができたのが福島県二本松市竹田根崎地区の取り組みです。２竹田根崎地区の概況と取り組みの背景福島県二本松市は、中通り地方の郡山市と福島市のほぼ中間に位置する人口約３万六千人の
200,一つに挙げられた。千九百七十九年にはＬＲＴＡＰが採択され，汚染物質の削減について国際的な取り組みが開始された。また北米でも千九百八十年にカナダと米国の間で「越境大気汚染に関する
201,以下の施策を推進した。（ア）かんしょ１需要の拡大に向けた取り組みを促進するため、シンポジウムやイベント等の開催を通じて、新しい品種や加工食品、かんしょの栄養性・機能性等の
202,２子どもの心の診療体制の整備の推進３高齢者へのいきいき活動支援訪問事業の実施●社会的な取り組みで自殺を防ぐ１相談機関のネットワーク体制の整備２精神保健福祉に関する相談３多重債務・法的問題への対応４中小企業の経営
203,については、降雨減衰対策や高画質化の要請に配慮すること（２）新たな技術を活用した取り組みを行う事業者への割当て上記追加割当てを行った上でなお割当てが可能な場合には
204,てごみの分別をしてきた大きな成果です。ごみの分別は、一人一人の取り組みを始めとして、地域や学校、ＮＰＯでの活動にまで広がっています。
205,添って話します。１地域でできる高齢者虐待の防止２介護を快互に３介護施設における虐待防止への取り組み■定員二百人※無料。■申込方法十二月二十四日（水）まで、ＦＡＸ・郵送・電話の
206,｟欠席｠届留置電報取扱｟所｠取扱｟注意｠取入口取替品取り組み取消処分｟麻薬｠取締法取締役取立金取立訴訟取次｟店｠取付工事
207,は、企業が長期的に株主の利益を最大するような企業経営を行うよう、株主議決権行使等の取り組みを適切に行っているか。・事務処理体制運用実績を報告する体制等が十分に整備されている
208,中で解決していく自律的な方法で対処するしかない。ＯＤＡはこうした途上国自身の主体的な取り組みを促す役割が求められる。こうした考え方を前提とした場合、ＯＤＡ
209,における関係行政機関，文化団体，国際交流関係団体の連携の強化が図られなければならない。１文化振興への取り組みの始まり戦後，社会の各分野において様々な変革があったが，文化の分野
210,取り組む諸国ではないかと私は思っておりますし、こういった問題についての大臣の取り組みの決意を伺って、質問を終わりたいと思います。○国務大臣（野沢太三君）アメリカ
211,○子どもを生み、育てることの意義、子どもや家庭の大切さについて理解を深める取り組みを推進する。○安心して子どもを生み、育てることができる社会の形成について理解を深める
212,た課題となっています。（２）「リレバン機能強化計画」の反省に対する金融庁の取り組み金融庁は地域金融機関に対して，個々の実情を踏まえた数値目標を新たに入れたリレバン機能強化計画
213,新行政改革推進計画」および「平成二十年度行政改革について」の全文は、ホームページｈｔｔｐ：／／ｗｗｗ．ｃｉｔｙ．ｃｈｉｂａ．ｊｐ／ｓｏｍｕ／ｓｏｍｕ／ｇｙｏｓｅｉ／でご覧になれます。主な取り組み事務事業の見直し１敬老事業の見直し高齢者を取り巻く環境の変化に伴い、七十歳以上の
214,の目標年次までに達成すべき指標や達成のための行動スケジュールを盛り込んだ行動指針等を策定するなど取り組みの強化を図っており，キーテクノロジーの確立普及の早期実現が大いに期待されている。表Ⅲ‐
215,な顕在化した定型業務プロセスをアウトソーサに委託するという手順を踏んでおり、ＢＰＲの実施は全庁的な取り組みとなるため、両事例とも行財政改革と歩調を合わせ、長期に渡り計画的に実施していると思わ
216,施設における保温用カーテンの導入，地域特性に応じた品目・作型の選定，自然エネルギーの利用の推進等の取り組みにより，引き続き一層の省エネルギー等に努めていくことが必要である。図Ⅱ‐十三農業部門
217,が行き交う地域の学校・教育的な風土づくり」を基本理念として、子どもたちの幸せのためにさまざまな取り組みを展開しています。学校・家庭・地域の連携事業では、メロン学習や防災学習、地域の踊りや
218,た。そして、３つの基本目標を実現していくために、十二の施策方針と三十七の主な取り組みを通じて、市民との共働により施策を進めていきます。あわせて、学識経験者などで構成する
219,て防犯活動に取り組む「青色防犯パトロール」。和知地区で行われてきた地域の安心・安全を目指した取り組みがこのたび、町内全域に広がりました。青色防犯パトロールとは近年、犯罪の増加や
220,拡大する必要があります。主な２事業を紹介します●磯子発地球にやさしいプロジェクト（エコライフ行動推進事業等）《取り組み》１年間を通じて、広報よこはまに啓発コラムを掲載します２区内保育園・幼稚園・小学校での環境教室を開催します３各市立保育園で年間計画
221,。二十年度の本市の予算は「魅力創生予算」としていますが、こうした取り組みにより、姫路の魅力にさらなる磨きを掛けながら、力強く風格のある都市を目指して
222,大礼をお祝いする気持ちを、何か形に残るものにしようというものであった。この取り組みは、全国で一万二千四百余件、その経費は五千八百万円余に達したといわれている（前掲『
223,、特別管理廃棄物についての保管基準・処理基準をそれ以外の廃棄物と区別して設ける、などである。こうした取り組みはあくまで廃棄物が発生した後の対処であることを考えれば、廃棄物の発生との
224,ある子どもで特別の教育的支援を必要とする者について、上述のような小・中学校での取り組みに加えて幼稚園、高等学校、高等教育の各段階において適切な対応を図ることが重要である
225,（「ワムネット」登録情報）で割り戻したもの。（ケアプランの質の確保・向上を目指した厚生労働省としての取り組み）そこで、厚生労働省としても、ケアマネジャー（介護支援専門員）の資質の向上を中心と
226,シングルは「独身者」を意味する英語である。山田氏はこのパラサイト・シングルを親から引き離し自立させる取り組みこそ急務であると主張して、国や企業は若者が夫婦共働きで家事や育児を分担し
227,を選んだのです。しかし現実はさほど甘くはなく、本格的な「難治性痛み治療」への取り組みの第一歩は、「肩こり」の治療からスタートせざるを得ませんでした。私
228,の要因があるので、受け入れられなくて何度もパニックを起こしていた。劇の取り組みも、繰り返すうちに自分の出番やセリフは覚えられるのだが、劇の雰囲気や
229,については、流通業務団地整備事業特別会計において経営健全化基準を上回っており、今後、経営健全化に向けた取り組みを進めていくことになります。米子市の状況健全化判断比率って何ですか？健全化判断比率は、財政状況
230,を行います。ゴーヤーの成長記録や栽培方法、各団体の活動、区が行う環境への取り組みなどを紹介します。最終日の三十日には区役所で育ったゴーヤーの収穫体験なども行い
231,応じたきめ細かな対応が求められることから、身近な地方自治体である市町村を主な実施主体として取り組みを進めていくことが適切であり、また、そのために、国は指針を示し、
232,を占め、入会希望者は増加傾向にあります。児童館を中心に地域が一体となった取り組みを検討委員会は、子どもたちを取り巻く環境などを踏まえて、児童館・留守家庭子ども会の現状を検討。
233,，たい肥等について品質表示が義務付けられることとなっている。また，今後，有機性資源の循環利用への取り組みを効率的・効果的に推進していくためには，これまでの農業者，食品産業事業者，消費者等のそれぞれ単独の
234,促進することを目的とし、鉱物とエネルギー資源に関するデータベースの構築、鉱業に関する環境問題への取り組みを行う。２ＡＰＥＣエネルギーアクションプログラムＥＷＧは、３Ｅイニシアティブ（エネルギー・セキュリティ、環境保全及び経済成長を同時に
235,、「積極的にチャンスを生かす、チャレンジする」等、全般的に仕事に対する女子の前向きな取り組みを求めており、女子が職業人としての意識向上に一層努めることも期待される。第Ⅱ‐二十八図
236,、国際機関等すべての主体が参加して、公平な役割分担の下での連携・協働〔パートナーシップ〕による取り組みを行っていくことが必要です。前掲の環境教育等の推進や社会経済のグリーン化は、各主体それぞれ
237,とどまっているが、ＳＣＭへの取り組みの第一歩といってよいだろう。このような取り組みを可能にしたのが、「情報共有」である。情報共有は、この事例で明らか
238,の最後ではなく、午後の最初に全校踊りとして位置付けていました。今日まで、その取り組みが継承されている訳として、次の３点が挙げられます。一つには、地域
239,十二年２月１日以前の１年間における開催集落の割合である。（地域住民が主体となった地域資源保全の取り組みの推進が必要である）農村には、現在でも農業生産活動に由来する伝統芸能、棚田等
240,が、本県では「野生生物保護実績発表大会」、「学校関係緑化コンクール」等の開催、小・中学生の自主的な環境保全活動の取り組みである「こどもエコクラブ活動」の支援、小・中学生を対象に川や海の汚濁の原因が生活排水
241,（十九店舗）で、レジ袋の有料化が始まります。『飛騨市におけるレジ袋削減に向けた取り組みに関する協定』が９月十四日、飛騨市住民団体（飛騨市レジ袋削減協議会）と参加事業者、岐阜県ならびに飛騨市によって締結され
242,になって、地球規模の環境問題に関心が高まり、自然環境保全のために国境を越えた取り組みが求められるようになった。千九百九十四年時点でＥＵ域内の国境の総延長は約一万ｋｍに達し、
243,に送り出してきた。「九十年前後、バイオブームが下火になって東レのバイオへの取り組みが一時的に停滞したこともありましたが、他社と共に蛋白工学研究所やバイオマテリアル研究所の設立に
244,）排出を抑制することになり、地球温暖化の防止につながります。次のような取り組みを行い、生活習慣の見直しを図りましょう。●買い物には、マイバッグや風呂敷などを
245,江戸前期の千七百十七（享保二）年から毎年行われているという。以前は青年による取り組みだったが、出場者減で千九百八十一年からは近隣の小中学校に参加を呼び掛けている。小学校
246,セーフコミュニティで最も大切なものです。地域で積極的に勉強会セーフコミュニティは、地域での取り組みが何より重要です。市民の皆さんに理解を深め共に取り組んでもらうため市内の防犯団体
247,。行政と町民の協働関係をつくり、施策の点検、見直しを行い、今後の取り組みの方向性を検討するため、有識者、民間団体、関係行政機関の代表十六名からなる「壬生町男女共同参画推進委員会」並びに
248,縁組みのことを牧之が問うたのに対し、市右衛門が「昔昔より聟も娵も取り組みは此秋山切りにて、里よりは迎えず。万一女抔が里へ出て里
249,位置づけ、直接的な関係組織の協力を得つつ、反対の国民世論の拡大に向けての取り組みを重視する。２独立行政法人の導入や公務員制度改悪反対、情報公開と行政の民主化を共通の課題
250,に、子どもたちのいたずら心、遊び心、創意性などが育っていくのです。第三は、この取り組みは、夕食会を企画・計画し、実際に準備していくことを二年生だけで話しあい、すすめていること
251,繰り返し使えるリユースカップが利用されたり、ホテルやレストランなどの生ごみをたい肥やバイオガスとして利活用する取り組みが進展するなど、あらゆるサービスにおいて環境への配慮が組み込まれます。給食サービス会社のＥ社
252,」の検討を始めています。今回は、平成十八年度からの検討状況と今後の取り組みをお知らせします。※問い合わせ政策企画課（☎二千九百九十八‐九千二十七・ＦＡＸ２９９４‐０７０６）これまでの取り組み後期基本計画への
253,は公用車の台数を年々統合整備し減らしていますが、なお一層の経費節減と環境への取り組みのため、公用バイクを１台導入し、７月十四日から使用を始めました。バイクは
254,となるものです。めざすべき将来像・基本目標を設定し、その実現に向けて推進すべき基本的な取り組みを示しています。現在の第四次市総合計画は、「基本構想」、「基本計画」、「
255,に直接関わってくる深刻な問題」と述べております。さらに、温暖化防止の「第一の取り組みは、エネルギー効率の改善のための制度の整備です。二酸化炭素の削減のために厳格
256,、毎日十五分程度の散歩をする計画を立てる３３か月後、医療機関から手紙が届く。今後の取り組みのアドバイスを受ける４６か月後、再度医療機関を訪れ身体状況を確認。目標達成状況などを評価。体重
257,の建設に取り組みます廃棄物対策監■■■■これまで、ごみ問題について、各分野での取り組みや実情などさまざまな角度から掲載してきました。廃棄物（ごみ）は、古代
258,」を地域で守っていこう、と宮古上布の継承について、行政も一体となった取り組みもある。また、六十代以上の年配者らが健康づくりにと始めた琉球舞踊の講座や、若者ら
259,ず経営の基本方針の柱の一つに環境対策を据えて、様々な環境保護に積極的な取り組みを行い社会に貢献している。また千九百九十六年に国際規格として発行されたＩＳＯ一万四千一の取得を
260,運動を継続していかなければならない。ア検討会の取り組みの重要性検討会を重視しここでの取り組みに全力を尽くすべきである。現在，司法改革の諸課題は，推進本部事務局が検討会での
261,企業会計方式を導入したり、本庁と出先機関を対象にＩＳＯ一万四千の認証を取得するなど効率行政の取り組みが目立っている。３位に入った神奈川県横須賀市（同七十六．三八、ＡＡ）も前回調査の
262,行い、省エネルギー対策に取り組む○高効率型の機器・設備を導入するなど、事業所・店舗の省エネルギー化に取り組む区民・事業者共通の取り組み○自動車を使用するときは、アイドリングストップ（停車時エンジン停止）などを心掛ける区の取り組み○区民・事業者が
263,資源化，再利用は十分とは言い難く，地域の実情に応じた資源化，再利用への取り組みが期待される。一般廃棄物の処理は，各市町村における歴史的社会的背景等の相違からさまざまな事業形態が
264,）、長期営農継続農地制度と三鷹の農業（長期営農継続農地にかかわる納税義務の免除制度の実施、東京都農業育成特別事業への取り組み）昭和六十年〜平成二年度狂乱地価と土地基本法（公示地価にみる住宅地価の動向、地価急上昇のなか
265,振興や市街地、農産漁村地域の活性化等、市民と議会、行政が一体となった創造的な取り組みを積極的に推進し復興に努めてまいる所存であります。さらに、昨年の地震で
266,■サプライチェーン・マネジメントとは何かロジスティクスとともに、サプライチェーン・マネジメント（以下ＳＣＭと略称する）への取り組みも興味深いものである。言うまでもなく、ＳＣＭは究極と言ってよいくらいの効率的な仕組み
267,果たす必要があることは当然であり，消費者や投資家などに向けて，環境への取り組みについて情報提供することは重要になってきている。環境会計は，こうした各企業の環境保全へ
268,て中入り後に相撲を取るのでしたら、４時二十分ごろになるかもしれません。十両上位だと幕内で取り組みが組まれることもありますので・・・
269,なければならないし、その場合の環境資産マネジメントのあり方を解明する必要がある。この点で注目すべき取り組みがヨーロッパで進められてきた。環境的持続可能性を基本としつつ経済的・社会的要素を政策的にも実践
270,てくるということもあります。インターネットがこれからのキーとなる！出版業界のインターネットへの取り組みをお話しする前に、インターネットそのものについて、少し学習しておきましょう。インターネットが急速な
271,ございますが、一例を申し上げますと、新年度の予算といたしまして、地域に対する取り組みを強化するという観点から、廃棄物をゼロにすることを目指しますゼロ・エミッション構想を基本構想として位置づけ
272,日本弁護士連合会の責務」を定め，「日本弁護士連合会」は「司法制度改革の実現のために必要な取り組みを行うよう努めるものとする」と日弁連を司法制度改革の主体的な担い手として規定している。
273,ので参照されたい。１．戦後復興から貿易・資本自由化へ（終戦〜六十年代）（貿易体制確立への取り組み）「食糧及び工業原料等の不足が輸入によって賄われない限り我が国の国民経済は
274,総合的な取り組み（１）精神障害者に係る保健，医療，福祉の総合的かつ計画的な取り組みを促進。（２）退院・社会復帰を可能にするサービス基盤の整備。４アジア太平洋地域における
275,はできていないので、卸売業者との間の取り組みにとどまっているが、ＳＣＭへの取り組みの第一歩といってよいだろう。このような取り組みを可能にしたのが
276,「非核平和都市宣言」以来、世界の恒久平和と核兵器の廃絶を願って、平和推進のためのさまざまな取り組みを行っています。一羽の折り鶴コーナー６月中旬から７月末まで市役所のロビーに設置した折り鶴コーナー
277,宝島“天草”の創造」をキャッチフレーズに、暮らしやすい生活環境づくりや地域づくりなどへの積極的な取り組みが高く評価されました。天草市が２年連続で産地賞受賞〜全国お茶まつり滋賀大会〜全国茶品評会・釜炒り製玉緑茶の部で
278,の負担ができるだけ少なくて，しかも効果が大きな方法が求められる。また職員全体の取り組みとし，定期的におこなう業務として位置づけることも必要である。たいていの図書館では除架
279,た活動を要求する等の動きが顕在化しつつある。こうした状況を考えると、環境保全に対する取り組みについて社会の信頼を得られるよう、環境への配慮を行うことが企業の存続
280,，国民の自主防犯行動を積極的に支援していく。また，ボランティア活動や職域防犯団体等の組織的な取り組みを積極的に支援していくことが必要である。警察は，独自に地域安全に資する目標を
281,の面白さを伝え、子どもたちの「不思議に思うことを自ら探求していく心」をはぐくむ取り組みを進めていきます。問経済労働局企画課☎（二百）三千七百十四、ＦＡＸ（二百）三千九百二十。
282,を強化し，実効性のある使用過程車の騒音規制を行うこととしている。（スパイクタイヤ公害への取り組み）自動車公害の一つとして，近年，積雪寒冷地域におけるスパイクタイヤの使用による道路粉じんの増加等が問題化し
283,このように中小企業における「右腕」の役割について見ていくと、中小企業では「新しい取り組みの担当」としての役割を果たすことが多い若い「右腕」や、「代表者の
284,このような状況になれば，エレクトロニクス産業への負の影響は少なくない．省電力化の取り組みが今後ますます重要となる．一方，生産にかかわる負荷では，ＩＴを支える
285,、図書館などで閲覧できるほか、広聴広報課で配布しています。市ホームページ（トップ→市政の取り組み→行政改革→市民の声報告書）でも見ることができます。よりよい浜松のため、あなた
286,に基づいて行う、２次医療圏（人口三十万人規模）単位での医療機能の強化、医師確保などの取り組みを支援する「地域医療再生基金」が創設（三千百億円）されます。具体的な事業としては
287,ための地域中核機関としての取り組みが期待されるところであり，国や地方公共団体においてもこのような取り組みを引き続き支援していくことが重要である。表Ⅲ‐４‐１自主的な広域資源管理の
288,防ぐため、区では「高齢者地域見守り支援事業」を実施し、今年度モデル地域の皆さんと共にさまざまな取り組みを行っています。そのひとつとして、地域に住む人々のつながりを再確認し、地域力アップ
289,大切な役割を担っていることを、もう一度考えてみましょう。子どもを守るネットワークの取り組み子どもたちが安全に安心して過ごすことのできるまちづくりを目指して、市内すべての小学校区で
290,伝えることで、キャリア教育に踏み出そうとしている小学校に希望を与え、本校の実践を取り組みの参考にして欲しいと願い、本書の発刊を決意したのである。本書が、
291,の持ち主で、激しやすく、反抗的なところもあった。そのため入団当初は、プレーに対する取り組みも百点満点とは言えなかった。それでも、私と話を続けていくうちに、そんな
