,0
388,配慮をきめ細かく行うとともに，国においては，地方公共団体等の先進的な取り組みの紹介や優れた取り組みの顕彰や，望ましい公開・活用の在り方を示すためのパイロット事業などを行うことが必要です。
389,られました。この計画は、平成二十年度から二十六年度までの、まちづくりの具体的な取り組みを示すもの。参加者からは「農業分野で、生産調整や販売戦略についての記述が
390,を設けることで、子どもたちに食への興味をはぐくんでいます。▼学校での取り組み小・中学校では、給食を通して広く食育を学んでもらおうと、手稲区特産の大浜みやこかぼちゃを
391,新世紀道路整備ネットワーク事業」を新たに創設して、幹線道路や生活道路の整備に取り組んでいる。こうした取り組みを通じて平成二十一年度までには県内のすべての市町村役場（隠岐地域を除く）から高速道路のインターチェンジ
392,便益（生態系の維持保存、地球温暖化防止、水源の涵養、木材生産等）を踏まえ、違法伐採問題への取り組みを含め、森林の持続可能な経営を促進。（ニ）生物多様性：絶滅の危機に瀕する生物種
393,，観光施設の割引という特典は市や県が行うなど，官民一体となったまちづくりの取り組みとしても注目されている。松山市は，この「坂の上の雲」フィールドミュージアム構想を
394,進行将来都市像やまちづくりの目標を実現するため、行政経営の視点に立って、次の取り組みを展開します。・選択と集中による実効性ある施策を展開。限られた財源
395,再編・淘汰を迫られる状況にある中で、企業の経営基盤の強化に向けた様々な取り組みが円滑に進められるよう、行政が環境整備を進めることが重要である。行政の
396,日本独自の仕様により独自の世界を形成してきた傾向が強いため、世界標準に向けた取り組みが必要であることは確かである。●カード業界従来はクレジットカード業界を指していたが、最近
397,作られている．１医療保険制度の沿革明治末期に始まったわが国の医療保障への取り組みは，民間企業での仕組みづくりから始まり，千九百二十二（大正十一）年に健康保険法が制定され
398,安全」と「安心」のギャップを埋めていく上でも重要であり、関係機関においてもさらなる取り組みが求められている。図１‐３‐４エネメイト事業における施設見学会図１‐３‐
399,や安全規則を守る，危険を予知してその原因をとりのぞくなど，働く人自身の積極的な取り組みも重要です。２職業病は，重い荷物をもち上げたり無理な姿勢を続けたり
400,活動自体に対する支援の必要性のほか，研究開発の成果を実用化するための方策として，実利用を促進する取り組みの必要性などが挙げられている。本報告書を受け，総務省と厚生労働省は連携を図り
401,。こうした日韓間の成熟した関係づくりに向けて、日韓双方の経済協会では具体的な取り組みを開始している。いずれにしても、今の中国、韓国は、政治家に会っても
402,非常に長く、一言では収まらない。そこで、平成五年から現在までの主な取り組みを年表にしたものが、次ページの表である。豊後高田市では平成年代に入り、
403,。「北陵中教育宣言」とは、あいさつ、授業・家庭学習、思いやりの心の３つを大切にする取り組みです。この中の思いやりの心を身に付けるために、本校の特色ある活動
404,ため、内閣総理大臣を本部長とする食料・農業・農村政策推進本部を中心として、食料自給率の向上に向けた取り組みを始め、政府一体となって実効性のある施策の推進を図る。２施策の
405,を回収・飼料化し、その飼料で育てられた畜産物を半年に１回、家庭に還元するなどの取り組みをしています。学校（給食）と協力したリサイクル作業（新潟県長岡市）（循環型社会基本計画第２章
406,を与える地球環境問題の解決のためには、各国ごとの努力に加え、グローバル及び地域的な取り組みが不可欠である。地球環境の破壊は、現時点では目に見えない場合でも、
407,５‐５母性保護・両立支援・介護休業を十点満点に補正した場合の平均値（産業別）ファミリーフレンドリー得点と労働組合の取り組み●ファミリーフレンドリー得点を左右する要因分析それでは、このファミリーフレンドリー得点はどのような要因で左右されるのだろうか
408,場づくり，農山漁村高齢者対策優良活動地域表彰等「農山漁村いきいき高齢者月間」（毎年十月）を中心とした高齢者対策に関する啓発活動等への取り組みを引き続き推進したほか，新たに高齢者によるモデル的な農業関連活動への取り組みを支援した。
409,から揺るがす行為であるだけに、医学教育における保険診療についての教育を徹底するとともに、日本医師会等医療団体での取り組みの強化は欠かせないのではないか。不正と同一視される過剰請求不正請求と混同されるのに
410,あきらめ顔。それでも、「（日本政府は）制裁強化を含め、北に解決を促す独自の取り組みをどうしていくのか」。滋さんは、そう問いかけている。＊ランキングに参加し
411,られるよう、仕事と家庭・地域社会が両立できる環境づくりや意識啓発を進めます。そして子育てを社会全体の取り組みとしてとらえ、多様な需要に対応した保育サービスの整備などに努めます。また
412,上記追加割当てを行った上でなお割当てが可能な場合には、新たな技術を活用した取り組みを行う放送事業者に対して優先的に割り当てることが適当である（３）現在の受信機での視聴
413,、そのそれぞれについて具体的な評価がなされることになる。ＳＵＮ評価システムのひとつの特徴は、取り組みの「アウトプット」と「アウトカム」という二つの視点が区別されているということである。
414,ような中にあって、多くの緑を有する本町の自然保護や、環境問題への取り組みの大切さを再確認したところでございます。さて、地方自治体の財政状況をみますと
415,。先取り精神とそれを許容する浜松の風土が培われていたのである。ただし先駆的な取り組みはすべてが成功するわけではない。失敗することもままある。しかし成功しなくてもそれに
416,の資質の向上や過去のＰＫＯから得られる教訓・反省を今後のＰＫＯに役立てようとする取り組みが行われている。国連平和維持活動（ＰＫＯ）（九十七年２月現在）（注１）ＵＮＡＭＩＣは
417,内容的にもある程度使いこなしている状態に達しつつある一方で、特に高齢者等に対して引き続き積極的な取り組みが必要であることを示唆していると考えられる。その具体的な取り組みについては、インターネット活用に
418,ことがわかる。ここでは、建設行政との関わりに注目しながら、こうした取り組みの一端を具体的に見ていくこととしよう。神戸地方簡易裁判所（桜の里づくり―福島県三春町）
419,の再生は望めません。もはやトドの駆除に依存する被害対策は限界で、総合的な取り組みが必要であります。これらの施策を効果的に実行するには、水産行政だけでは対応
420,〜市では、高齢社会総合計画を改定するにあたり、５つの基本目標と６つの重点的な取り組みを掲げ、高齢者福祉、介護保険事業を推進していきます。健康案内●予防接種予防接種ポリオポリオ（急性灰白髄炎）の
421,、気づいたら４時二十分！あら、大変！と、急いで帰宅しました。お気に入り力士の取り組みが始まってしまうから。あーーー琴欧州昨日残念だった！今日は応援してる人皆勝ってくれ
422,の対応の方向性を教職員がしっかりと理解し受けとめる臨時職員会議になってこそ、信用回復への取り組みの第一歩が開かれることになるのだと思います。■Ａ教諭への対応まず最初
423,迎えるのはかなり時間がかかるということでございますが、そういうことが一つの取り組み。それから二点目は、まさに先生がおっしゃったとおり、間伐の促進でございます。これ
424,使われています。また、再生品の利活用など暮らしのなかで負担なく持続的に行える取り組みを推進しています。マイバッグの利用（兵庫県）（循環型社会基本計画第２章第２節「暮らしに対する意識と
425,て、美術や音楽などの授業の扱われ方に失望した…実際の社会で進歩的な取り組みがされている分野であるにもかかわらず、それらの授業からは、個人の自由な表現や
426,を深めることに役立てる。●二千一年の高齢者保護サービス（ＥＰＳ）の結果１依頼者との取り組みとカウンセリング高齢者保護サービス（ＥＰＳ）は二千年末に、「グリーン・テレホン」と呼ばれるフリーダイヤルの電話相談窓口
427,を経て七十九年電気工学科教授。八十七年情報工学科教授、九十七年より同大大学院工学研究科情報メディア工学講座教授。日本のＩＴ社会実現への取り組みを世界に宣言する場ともなった二千年七月の沖縄サミット。その際、画期的なシステム
428,認識の相違や利害の対立を調整し、もって全地球的、長期的な観点から適切な取り組みを行っていくことが必要である。こうした中、国際社会は、九十二年６月に
429,どうするのか」。家族は、流れを止められなかった日本政府に、独自の取り組みを問いかけた。拉致被害者家族会の飯塚繁雄代表（七十）は集会参加で訪れた奈良市で「われわれ
430,たこのような個人情報の保護問題に対しては、現在、法的な側面からも積極的に取り組みが進められています。九十年、ＯＥＣＤが「プライバシーの保護と個人データの国境を
431,雇用管理の改善等を促す。（エ）パートタイム労働者の能力活用に関する業種別使用者会議の開催企業の取り組みの好事例の紹介，情報交換等を行うことにより，パートタイム労働者の能力活用を図るための環境整備を行う
432,にとどまらず子どもの育ちにも資するものとなり、今後我が国においても同様の取り組みが求められていくものと思われる。（未来の「親」を育てる）兄弟数
433,ものづくりにおける技能の承継と求められる能力に関する調査」（二千四年）（２）技能者育成強化の取り組みものづくり力の現場を支える技能者について、育成強化の取り組み動向を分析・紹介する。１現在実施している
434,‐２‐十二表，第１‐２‐十四表）。昨今，ＥＵでも標準化に関する取り組みが活発化してきている（第１‐２‐十八表）。このような地域内での規格は
435,醸成のためには、安全の確保はもとより、安全性を中心とする情報公開への取り組みの一層の充実、わかり易い情報の提供について、原子力関係者の努力が重要である。３
436,ます。さらに新たな視点で、市民のみなさんと協働作業で、箕面発の地球環境を守る取り組みが創造できればと思っています。箕面市長■■■■■みのおウォーキングデイ対象…市内在住の
437,の中央銀行は、オーストリアにおける紙券発行の独占を侵害したとして訴訟を起こし、この取り組みを妨害しようとします。ウンターグッゲンベルガーは法廷に立たされることになります。町は、労働証明書が
438,な雇用形態の労働者が増加していること、限定勤務地制度の導入やコース別雇用管理での多様化、弾力化の取り組みがみられることなど、雇用管理の多様化が進むとともに、雇用管理の方向が大きな流れとして
439,大きな影響を与えていることがうかがえます。このような中、各地域での主な取り組みを見てみましょう。Ⅰグリーンツーリズム過疎化や高齢化が進む中山間地域。この限られた農村人口
440,た公正な処遇」の実現に向けた取り組みが重要である。ここではこれらの取り組みについて分析する。まず、一般労働者、パートタイム労働者別の年齢階級別の年間賃金について試算したところ、一般労働者とパートタイム労働者
441,（木）十四時〜十六時二十分会場文化会館小ホール地域住民の皆さんとの協働によるセーフコミュニティの取り組みを通じ、健康で安心・安全に暮らせるまちづくりを進推します。大会には、国内で
442,を通じて選別していこうという動きが現れている。京都に多い中小企業に、どう環境にやさしい取り組みを促すのか。市のリーダーシップに注目が集まっている。（社会報道部矢ヶ村尚幸）
443,比較すると４．４％の増額となっております。主な増額の要因は、まちづくり交付金事業及び中間処理施設整備事業の取り組みによるものであります。国の地方財政計画において、地方財政規模は前年度比０．３％の増額と
444,が示された．神奈川県歯科医師会では，現在，フッ化物洗口剤を取り扱う薬局を増加するように働きかける取り組みを行っており，前述した薬剤師会のアンケート調査では９．１％の薬局が「今後取り扱う予定」
445,の拡大阻止に象徴されるような各般の構造改革に取り組んでまいりました。こうした取り組みにより、昨年は、日本経済が長い低迷から脱し、その先にある成長の姿が
446,た。そこで，これまでの行政主導の村おこし運動の反省と，旧村単位での有限会社設立の取り組みを通して台頭してきた地域意識を受けて，住民主体の村おこし運動を展開していくこととし
447,して化学肥料及び農薬の使用の低減を図るための取り組み及び地力の増進を図るための取り組みを推進する。（ア）持続的な農業生産の転換促進土づくりを基本として化学肥料・農薬の
448,それぞれの主体の立場から見てみると、単独では解決できず、他の主体による取り組みも同時に求められる問題が多いことが分かる。リサイクルは、社会全体としては必要かつ
449,十五年８月に総務省内に設置された総務大臣を本部長とする「地上デジタル放送推進本部」において、総合的な取り組みを推進２マスメディア集中排除原則の緩和放送による表現の自由ができるだけ多くの者によって
450,て環境保全活動に積極的に取り組むことが重要である。こうした観点から環境保全への取り組みが企業の目的としてとらえられるようになっているため、今後はいかに環境保全を事業目的の
451,近年，一代雑種品種の開発・普及が進んでいるが，五十三年の種苗法の成立もあって民間の取り組みは一層活発化した。五十九年には，育種も民間との共同研究の対象となり，
452,学校週５日制の円滑な定着を図るためには，特に次のような点に配慮して取り組みを進めていく必要がある。（ア）学校の教育課程の一層の改善・充実各学校
453,子育てのための住宅及び生活環境の整備住まいづくり、まちづくりにおいても、少子化に対応した取り組みができるよう、家族向け住宅の供給、子供の遊び場や通学路など安全な生活環境の整備等を
454,は，簡易保険において，学資保険，成人保険及び育英年金付学資保険を提供している。（５）児童虐待への取り組みの推進関係府省庁，関係団体（二十三団体）等による児童虐待対策協議会において，国レベルのネットワークの構築を
455,は国際経済の不安定化を招来しかねないことから、国際社会は、グローバルな政治・経済問題として債務救済への取り組みを強化しており、わが国としても従来からこの面で積極的な貢献を行ってきてい
456,は地域の人たちと協力してゴーヤーによる緑のカーテン作りを進めています。今回はその取り組みを紹介します。区内四十七カ所で行われています区では区内に緑のカーテン
457,十月三十一日（金）午前十時（受付開始：９時三十分）〜午後４時三十分参加自治体等の取り組みの発表次の分科会テーマにそって、子どもに関する取り組みについて報告・検討します。１
458,「大学の実力教育力向上への取り組み」調査なるものがこの程行われ，大学の卒業率，退学率などのデータが明らか
459,なりました。日本でも、一部の施設などで本人の心のうちに迫る取り組みが行われるようになってきました。私たち「家族の会」でも、
460,を楽しむランチルームでの給食などさまざまな取り組みを行っています。また、これらの取り組みはパネル展を開催し、皆さんに紹介しています。お知らせ食育ＢＯＯＫ配布中ていね食育ネットワークが作成し
461,、結果（後述する定量的な運用結果）は重要な要素ですが、過程（後述する定性的な取り組み）も重視すべきであるというのは、こうしたことがあるからなのです。年金制度の
462,必要であるという観点から，農産物直売施設や市民農園・学童農園・観光農園の開設・普及，都市農業が果たしている役割のＰＲ等の取り組みを推進してきており，都市及びその周辺地域で営まれる農業が地域と調和し，住民の
463,地方に定着させるための各地域における構想の具体化の検討であり，地方の特色を生かした取り組みが地域経済活性化のため既に数地域で積極的に行われ，国際マリン都市の形成や中小漁村のネットワークづくり等が
464,５年間）で、今後は、このプランに基づき男女共同参画事業を進めていきます。男女共同参画の取り組みについては、主に公募で集まった市民と行政との協働で実施しています
465,を活用し、行政と住民・事業者とのコミュニケーションを高め、地方行政への住民の参画拡大を図る取り組みがなされている。中央区（東京都）では、電子メールやネットニュース、電子掲示板等を用いる
466,第２節環境改善が遅れている分野への取り組みの強化１窒素酸化物対策二酸化窒素に係る環境基準を達成するため、これまで、ボイラー等固定発生源の排出規制
467,、普及の拡大などが盛り込まれた。ウ我が国の状況と環境保全型農業への取り組み我が国では、環境保全効果の高い水田が農地の中心であることもあり、これまで、
468,よりやんちゃな朝青龍が優勝した方がやっぱり盛り上がる。ジムのサウナでみていたけど取り組みが終わるまでずっとみていたのでのぼせそうになりました。お年玉年賀状の当選者を
469,照合するものです。３について企業の労働時間対策の中には、労働時間短縮に向けての取り組みとしながら、労働者の適正な申告を阻害することを意図しているものもあります。
470,方針とし国際経済協力にも活動領域を広げつつある。金洙槿及び京畿道の交流会議資料により本交流会議に対する取り組みと展望を見ることにする。三十四）同上ｐｐ．四十四―五十、金洙槿前掲論文、ｐ
471,ほか、共同研究の推進など人的交流も促進する観点から円滑な運用が図られるよう積極的な取り組みが行われている。国立試験研究機関にあっては、民間等との共同研究を一層推進すること
472,の白書の内容は、それを超えた、国民の「安心・安全」への積極的な取り組みを要請している。刑事司法に限らず、公共の利益とは何かなどについての考え方も、
473,治療が可能な疾患なので、乳がん検診の受診者の増加をはかる必要があります《取り組み》１保健活動推進員、ＮＰＯ関係者、ＰＴＡ関係者等の活動を通して、直接個人に乳がん検診の受診を働きかけるほか
474,いうのだろうか、ちょっとしたブームであった。環境家計簿をつければ、個人的には省エネの取り組みに一歩前進したとの気持ちが持て、その気持ちが、どこかエネルギー使いすぎに対する免罪符に
475,の生存と発展のために極めて重要な問題であるとの認識が高まり，世界的な取り組みが進められてきている。地球環境問題には，地球温暖化，オゾン層の破壊，酸性雨，海洋汚染等
476,食品衛生法の対象は食中毒などに限られる。このため、今回のような死亡事故を防止する取り組みが「生産者重視から消費者の安全を重視する行政への転換の象徴」（中堅）と
477,このほか，三鷹市の状況については，松田博雄ほか編・三鷹市の子ども「家庭支援ネットワーク―地域における子育て支援の取り組み（ミネルヴァ書房，二千三）に詳しい。以下の叙述もこれによる。なお，ホームページ（
478,コラムケーススタディ・インタビュー「協働の社会」に向けた取り組み二千二年十一月十五日に、東久留米市の市民プラザで開催された「協働のまちづくり推進懇談会報告書の報告会および
479,におけるまちづくりのモデルとして位置付け，基礎調査の実施，住民への説明，まちづくり構想の提案等の取り組みを開始した。区の当初の提案は住民の反対により取り下げとなったが，
480,の育林作業を行う村育樹祭を今年も開催します。私たちの財産である大芝高原を守り育てるこの取り組みにつきましてご理解をいただき、ご参加いただきますようよろしくお願いします。日時十月十九日（
481,ｄ．，ＳｕｓｔａｉｎａｂｌｅＣｏｍｍｕｎｉｔｉｅｓｉｎＥｕｒｏｐｅ，Ｅａｒｔｈｓｃａｎ，二千一参照。ヨーロッパの都市レベルにおける取り組みは、サステイナブル・シティ報告書（次節参照）とオールボー憲章（ＴｈｅＡａｌｂｏｒｇＣｈａｒｔｅｒ）によって促進された。
482,を踏まえて，地域に育まれるあらゆる多様な活動主体の力を地域防災力向上に活かす方向で取り組みを強化する事例が増えている。東京都板橋区は，そういう観点から，区の防災対策
483,というように、地域と警察署、町が一体となって、交通事故防止に向けた取り組みを行っていきますので、みなさんのご協力をお願いします。担当／総務課安全対策班☎三四‐一一一一
484,ているが，新設住宅着工戸数の伸びよりもかなり低いものとなっており，木材需要拡大への一層の取り組みが必要となっている。このようなことから，最近では，林業界，木材産業界
485,）（１）法律制定の背景循環型社会の形成のためには、再生品等の供給面の取り組みを強化することに加え、その再生品等に対する需要が確保されることが重要です。これまで
