,0
331,。その最中、九月三十日に東海村ＪＣＯの臨界事故が発生している。関西電力は製造記録の不正は次年度実施計画の３号炉用燃料のみで、運搬した４号炉用は問題ないと説明し、国も輸入燃料体検査に
332,ゴルフカップやテニス大会を主催し、いくつか美術館も運営している。東京地検特捜部が、その三笠食品に不正な絵画取引の疑いがあるとして強制捜査に入ったのは先々月のことだっ
333,と述べられている―少なくとも遠近法的警告のかたちで。コーゴンやクビーのような、ナチスの不正を強く確信していた人たちによって特に取り上げられなくとも、この詩が、人びとにとっての
334,欠陥があったと客から苦情が入る。工事の決算書を調べた耕一は、不正の事実を突き止めて常務の沢入（清水）に報告するが、会社側は欠陥住宅は存在し
335,の許可のない業者」が、不法投棄や汚泥の放置などの「その業務に関し不正又は不誠実な行為をするおそれ」（廃棄物処理法七条二項四号ハ）がある、とは断定でき
336,・・とらないお店（消費税を）が良心的なのでしょうか？それとも、とるお店が不正なことをしているのでしょうか？以前は年間三千万円以上のお店が納税する事になってい
337,か？いいや、ぼくは帰らなくては。ローランスの凡庸な戦術など―不正といってもいいほどの戦術など―何もかもお見通しなのだとわからせなければ
338,ても、あるいは職員にしてもあるわけですね。これを、住民がその不正について、これは後で一号請求の問題と四号訴訟の問題との議論もちょっとさせていただき
339,大前提）胎児は罪のない人間である。（小前提）ゆえに、胎児を殺すことは不正である。（結論）この三段論法に対抗できなければ、明らかに中絶擁護は不可能なのだ
340,規定する業務を適正かつ確実に実施することができないと認められるとき。二指定に関し不正の行為があったとき。三この章の規定又は当該規定に基づく命令若しくは処分
341,ユーザである「クラッカー」を増やすことにも貢献してきました。クラッカーは、サーバに対して不正なアクセスを繰り返したり、セキュリティホールを突いてサーバを乗っ取ったりします。また、通信
342,戦略であった。しかし、食肉事業部は、自己の部門収益の確保に苦心するあまり、偽装工作という不正に及んだのである。加えて、各事業部を統括する機能が働かず、本社と事業部と
343,聖人君子ということにはならないが、患者の病気の治療に責任をもつ医師の不正であるだけに批判はことさら強いし、信頼して受診していた患者にすればいう言葉
344,、「厳正中立」ではなく、「厳正非中立」であったという。―正義と不正が対立するとき、中立はない、中立は悪と不正に味方することで、『東京毎日新聞
345,、昭和三十年の指紋制度導入以降におきましては、指紋の表示されている成人の登録証明書を不正に入手して使用したという例が発見されていないということでありまして、事ほど
346,が，デバイスドライバの動作をエミュレートしてＯＳ上で動作したときの様子を再現し，ドライバが不正な処理を行なわないかを調べるツールのようだ。エラー処理など，実際の動作で
347,談としては、完成後百年もたたない元文四年（千七百三十九）の三代目のときに、不正があったとして兄弟は請負を免職になり、庄右衛門は江戸払いになってしまっ
348,ピエロＤ先生、先生はいつもわたしたちに不正を認めたら全体が悪くなる。小さな不正でも見逃すなとおっしゃっております。教師そう出川さん、そのとおりよ。ピエロＤ
349,が、これがやっぱり現実の住民の方々とお話ししていると非常に分かりにくい。何で不正をした、これはある種の政策判断の問題じゃないんですよ。さっき自民党の森元委員
350,られた者二前号に該当する者を除くほか、義肢装具士の業務に関し犯罪又は不正の行為があつた者三心身の障害により義肢装具士の業務を適正に行うことができ
351,を深めたと思う」と話した。フリートークの形式で５時間近く協議。昨年は不正なスカウト活動で巨人、横浜、阪神オーナーが辞任した経緯もあり、アマチュア選手との接触で
352,第十七条の十七第三項又は第十七条の二十の規定による命令に違反したとき。四不正の手段により分析機関の登録を受けたとき。（公示）第十七条の二十四経済産業大臣は
353,正当な理由がないのに第十九条第二項各号の規定による請求を拒んだとき。六不正の手段により登録を受けたとき。（公示）第二十八条文部科学大臣は、次に掲げる場合
354,大平大蔵大臣とのいろいろな話し合いをやったときもこのことは否定されなかったが、不正に対してはそれを公表して社会の批判を受ける、社会的制裁を受けるというのが社会的な
355,た。しかし、獲得することは失うことより、魂にとってはずっと危険なのだ。不正な手段、姑息な方法によって獲得をもくろんだり、他人からむしりとるようなやり方で獲得し
356,衣食を失う人々を生むものとして認められなかったのである。彼は、まさに誰が不正を被った人の数を数えられ、多数の人々が殺されるのを恐怖しない
357,首長やあるいは機関職員の汚職であるとか不正、これを歯止めを掛けていく、そういう不正が行われないように抑止的な効果を持つような制度という意味で、今回の
358,に住民監査請求が出ているわけです。そして、それはこういう不正を働いたから、不正を働いたと思うから、地方団体がその職員から金を取りなさいという住民監査請求していると。
359,もとづくものであって、彼がみずから任務と使命として引き受けた事柄が、いかなる邪悪と不正をふくんでいるか、彼がそのことを自覚していなかったのは確かである、と
360,結果はただ日本軍と在留日本人に一そう多くのぎせいをもたらすのみであった。かくて天皇制ファシストの不正の戦争は、史上空前の大敗北で終わった。（井上清編『日本歴史講座７現代篇』河出書房
361,たとき。二第九十七条第一項又は第二項の規定による命令に違反したとき。三不正な手段により第八十六条第一項の登録又はその更新を受けたとき。３総務大臣は、
362,奥さんの願いをかなえてあげなきゃ。それで名雲とかいう人は、どんなふうに不正を働いているわけ？」「単純なのから複雑なのまで、いろいろさ」
363,，塩酸ペチジンとフェンタニルがある。塩酸ペチジンが使われ始めたころは麻薬ではなかったが，不正に使われるようになって社会問題となったため，麻薬に指定された。フェンタニル
364,ウソをついてきたことになる。芦刈本部長ウソをついたことはない。旭川の問題について「不正はない」と申し上げたが、これは当時の幹部らに聴取した結果を踏まえて
365,を消しそこなったキリルに追われながら、ボーンはついに悪夢の真相にたどりつき、ＣＩＡ内部の不正をも暴いて、再び姿を隠す。前作も絡む謎解きサスペンスと、キレのいい
366,から引き落とされていた場合には、カード会社のカード盗難保険が適用になり、買物などで不正に利用されてしまった額が戻ってきます。その際、カード会社に届け出た
367,の禁止）第十三条試験委員は、試験の問題の作成及び採点について、厳正を保持し不正の行為のないようにしなければならない。（受験資格）第十四条試験は、次の各号
368,関白秀次朱印で氏郷遺領は遺児秀行に遺領相続を認められたが、六月三日になると家老の不正があったとして、その秀行の知行はにわかに没収された。この遺領相続
369,出し入れすること）でやってきた経営が、ガラス張りにならざるをえません。「不正」も「むだ使い」も全部数字に出てくるからです。Ｍさんはそれをいちいち
370,というのも、カードをたくさん持っていると、紛失や盗難などで、第三者に不正に使用されてしまうなど、カード犯罪に巻き込まれる恐れがあるからです。クレジットカードに関するトラブル
371,抑止するという点にあるわけであります。すなわち、私どもの違反調査等から、他人の外国人登録証明書を不正に入手してこれを行使しておったというような事例が今でも毎年三十件程度確認さ
372,と母から質問されたスタッフの感想が書いてある。―私が「スイス銀行の不正の記事でしょうか」と答えると「違います。加藤シヅエのところにいて、それ
373,が重要である。内部告発がなければ、消費者被害が発生し、社会問題になったあとでなければ不正は判明しない。実際、この種の不正があいついで発覚し、大きな社会問題となっている
374,か？少なくとも募金で小銭を出す事ぐらいはできます。また、テレビに向かって不正を追求したりもできます。
375,ペアに小差で敗れて２位だったカナダのペアも優勝（２位なし）とし、不正にかかわったフランスの審判を資格停止とする異例の措置が十五日に決定した。フィギュアスケート
376,。「いやあ、近来にない見物であった。梁山泊が義を唱え、世の不正に、体当りの戦いを挑んでおるのを、かねがね破邪降魔、仏力の顕現と愚僧
377,」と確信していたのだ。その理由はこうだ。ソウル在任中、日本企業がからんだ不正は時折あったが、いずれも賄賂・リベート額が数十万、数百万円単位で小さかった。日本国内の贈収賄事件
378,認定されたものも「不正」と考えれば処分できるはずである。しかし、厚生労働省は不正をかなり狭く解釈し、富士見産婦人科病院のようなケースでさえ、不正にはあたらないと判断し
379,問題の内容はそういう金の買収によるところから発したことでしょう。それを不正だと思っておる善良な漁民たちが、何だこのやろうと言ったのでしょう。このやろう
380,ある。新聞が独自の取材力を発揮して、隠された事実を掘り起こし、権力の不正や腐敗を暴いていくことだ。調査報道といえば、その代表的なケースに、
381,、嫌いだったんです。父は、さもあたりまえのように、自分に都合よければ不正も必要だとか、世の中には正しいことばかり通用しない、っていうんです。
382,のみ。だから昔から田中角栄も竹下登も法務大臣ポストを自派から出して、自分のところの不正を食い止めようとしていたのである。その手法を踏襲したのは小沢一郎で、細川内閣で
383,すれば、後で企業の監査係がログを調べ、個々の取引をつき合わせて、不正がないかどうかを確認できます。時代や場所によっても事情は異なるでしょうが、
384,監督官庁から出張してくる官吏の対応の手伝いを依頼され、その官庁に納入する製品の不正に眼をつぶらせるために、その官吏を「洲崎あたりで昼遊び」させるのに立ち会う有様を
385,「手加減」が必要とされない場合もありうると思われる。ただ，「不正」の点が実際に問題となるのは，多くは，むしろ公務執行についてである。
386,から五年を経過しない者（以下「暴力団員等」という。）七貸金業に関し不正又は不誠実な行為をするおそれがあると認めるに足りる相当の理由がある者として
387,で、この会計士ＶａｌＳｍｉｔｈ（仮名）の話について詳しく説明している。管理者による不正を防止する方法はいくつかありますが、まず重要なのは職務の分離です。
388,、当座預金など決済性預金の全額）については数日以内に引き出せるといわれています。一人で不正に何人分もの預金を引き出すことができないように、この間に破たんした金融機関は預金保険機構
389,火の手があがっているのです、彼らは社会学者がそう呼んでいるように、恐るべき経済の不正によって「下層階級」としてそこに閉じこめられるという悲劇的諸条件のなかに住んでいるのですから
390,先生はうなずいた。「でも、ドラマはいろいろな可能性を考えさせてくれるよ。不正を暴くという態度で臨むのは、一本調子すぎるのではないかね」先生はそう答えながら
391,」になる、ということである。「最高の正義」であるが故に「最高の不正」である、ということであり、この事を「自らの没落」において「経験」せざるを得なくなる、
392,増えてくるような気がします。１打１打の記録なんかもきちんと残せますので、不正もできないし（笑）、ホームで慣れ親しんだ「地上波コース」だけではなく、「衛星コース
393,た。○消費者の方に食品表示ウォッチャーとなってもらい、普段の買い物の中で不正な表示を監視していただいています。○消費者の皆さんが不審な
394,による分業を排除するものである。ロールズの原初状態における契約者たちが、現在の社会的役割のジェンダーバイアスを不正の源泉と認識しないことには、いかなる理由もないように思われる。ロールズ自身は
395,許すから人間が許さないわけにはいかないというようなものでなく、私は正しい、お前は不正、私は立派、お前は駄目、でも私はお前を許すというのではない。罪
396,によって、服部家の人々は守られた。そのプラス面があるから、兄も神谷氏も不正を見て見ぬふりをしたのです。その感覚もまた、まともな人間の
397,を及ぼすおそれがあるとき。（適正な取得）第十七条個人情報取扱事業者は、偽りその他不正の手段により個人情報を取得してはならない。（取得に際しての利用目的の通知等）第十八条個人情報取扱事業者は
398,・ノ）ノっえ！＜参考ＹａｈｏｏＮＥＷＳ＞もともと・・・公務員による不正などの行為などが、広まっている事から民からも大いなる不満が、日々に生じ
399,ね。したがって、施設の建設工事あるいは医療機器などの購入に当たっても当然業者の介入に伴う不正があってはならない。これは老婆心で言うわけではありませんけれども、こういう
400,がある。それもできなければ、浄化槽法三十六条二号ホの欠格要件（「その業務に関し不正又は不誠実な行為をするおそれ」がある者〈廃棄物処理法七条四号ハ〉に相当する）に
401,が、『死にいたる病』でもソクラテスを弾劾する。ソクラテスは、人間が不正を行うのは無知からであるとしたが、キルケゴールによれば、人間はたとえ正しいこと
402,人もいると思います。テレビ会社やアンテナ工事業者を装い、地上デジタル放送を受信する費用などと不正に請求する悪質な業者もいると聞きます。地デジに関して分からないことがあれば、
403,経営が一部の特別利害関係者に偏って行われることがないよう、また関係会社を利用した不正がないよう、会社と特別利害関係者との取引の有無や内容や関係会社との取引の
404,から、なくさないように大切に保管する必要があります。他人に貸したり、不正に使用することは禁じられています。また、保険証に記載されている内容を勝手
405,と茂木さま私は不正検定が実際にあったか知りません重要です受けていなく不正で合格できるとそれを疑いもなく信じそれは良くないので受けなくその
406,、厚生労働大臣が医師免許の取り消しや診療停止の処分を行える対象に「医事に関し犯罪または不正の行為のあった者」を含めている。「不正の行為」をどうとらえるか
407,流すなど、あの手この手のトリックを使って市況を操作している悪徳業者や山師的起業家の不正を暴きたてた。彼はいう。「政治家まで株式取引業者に変わり、尊貴の人が株式取引
408,、この波瀾に富む興味深い大小説の中に、あるかぎりの彼の人間愛と社会の不正への怒りとが注ぎこまれているという感じである。もちろん、作品の文学約価値ということから
409,貧富の格差及び地域格差の是正に配慮する。（十五）我が国の政府開発援助を巡って不正や腐敗を惹起しないよう十分配慮する。５．内外の理解と支持を得る方法
410,について準用する。第二十二条試験委員は、試験の問題の作成及び採点について、厳正を保持し不正の行為のないようにしなければならない。（受験の停止等）第二十三条指定試験機関が試験事務を
411,用いた挑発を力ではねつける場合などに多い），この場合は，「不正」な侵害がないので，挑発者がその反応に対し更に反撃する行為は，当然，正当防衛
412,関し必要な事項は、国家公安委員会規則で定める。（不正利得の徴収）第十五条偽りその他不正の手段により犯罪被害者等給付金（仮給付金を含む。以下この項及び第十九条において同じ。）の支給
413,後半、非常に不人気だった、あのニクソンに対してさえ、アメリカ国民は、別荘の取得方法の不正を追求したものの、休みをとり過ぎるといった、みみっちい非難の声を、一度として浴びせた
414,わけでございますけれども、一方では、小型変圧器というものを使いまして電力を不正に使用している、こういう事実がございますので、きょうはその点について質問をさ
415,だ。たしかに、利益を追求することを第一にした極端な場合は、不正と紙一重かもしれない。筆者が知っているケースでは、すべての患者の病名が二十前後
416,、特にパリではいまだかつてなかったような、新しい種類の不当な収奪が、不正な徴収が行なわれた。それはフランデルンの戦いのための出費だと言われ
417,電子決済環境を整備する一環として，ＪＩＰＰＡが発行しモールのホームページに表示されるロゴマークについて，偽造等による不正な掲載を回避することをねらいとして，ロゴマーク防護システムを導入している。暗号，電子透かし技術により，ロゴマーク自体
418,それだけに止まるのであれば、それは相対的な不正であっても、「最高の」不正ではないであろう。それは、配分するもの無くして為された「両分の同じ重さで均衡」
419,であるから、法はかかる規範の一つである。ところが、法はその強制を正＝不正を介して個人実在へ下命し、その実現を外的権力によって強制することを特色とする。したがって
420,は胥吏の不正はいわば必要悪として存続した。また徴税を請け負う郷紳の中には不正な人物が多く、劣紳といわれる彼らもこの包攬を利用して銭糧のごまかし
421,かけて五十件の問い合わせがあったという。レジやＰＯＳシステム記録などを照合した結果、不正が濃厚だったケースが３件あった。再度お客様にご確認をお願いしたという。
422,なくしている。してみれば、これこそ、「人倫的実体」全体に対する不正として、「最高の不正」とされなければならないであろう。以上によって明らかのように、この「最高の不正
423,うちに他人によって、住所変更されてしまっても大変です。大切な戸籍や住民票などが不正に扱われ、事件に巻き込まれることがないようにするために、戸籍法や住民基本台帳法の
424,●道路特別財源を官僚と族議員にしたいように使わせ国民の血税で私腹を肥やす不正を改めようとはしない自民党公明党の醜さに国民の多くは拒否権を行使する意思表示をし
425,点も配慮していくべきではないか。ましていわんや日中友好を促進するという立場であれば、やはり不正は不正としてきちっと対処する、これが法治国家でありますが、学びたいという人はどんどん入っ
426,１生きとし生きるものは、生命を大切にしなければならない。２盗みや不正を犯してならない。３夫婦の道を乱してはならない。４うそ偽りを言っ
427,に使うため、やむを得ず正規でない手続きを取っていた。―巨額の不正をどう考えているか。芦刈本部長大変な額。これほど広範に行われ、
428,賄賂を収受し、又は要求し、若しくは約束したときは、三年以下の懲役に処する。よって不正の行為をし、又は相当の行為をしないときは、七年以下の懲役に処する
429,対応しているソフトは、入力日の情報を記憶させる仕組みになっている。つまり、後から不正に改ざんできない作りだってこと。弥生会計二百電子データ保存する場合は、「入力した記録の
430,。実際に高額商品を中心に、数量検査が行なわれる。食い違いが目に余れば、不正（密輸入）行為と見なされ、警告または営業停止を含む行政処分を受ける。実際何社か
431,れ、すべての制度が不正な国家であった。彼によれば、そのような不正が政府によって改革されなかったために、変革は不可避的に暴力的となったのである。（
432,、たぶん彼らがものごとの理由を論理的な結論が出るまで考え抜くからだろう。世の中の不正、暴力、妊娠中絶、銃の取り締まり、核戦争、公害、動物の権利といったさまざまな倫理的
433,なと思ったりした。どんどん分肢し錯綜していく街路には澱のように犯罪と不正とが溜りやすいというのがいつに変わらぬ公的人間の感覚である。現に反抗的市民が不法集会を
434,四号訴訟の問題との議論もちょっとさせていただきたいと思っていますけれども、こういう不正を住民が事前に差止めするということは事の性格上難しいと思うんですね。制度と
435,、又はその要求若しくは約束をしたときは、三年以下の懲役に処する。これによつて不正の行為をし、又は相当の行為をしなかつたときは、五年以下の懲役に
436,の三つの管理の良否で異なってくることが多い。前記の例は特殊な不正のパターンだが、他には医業収入を除外するために、これに直接対応する材料仕入れ分を除外する
437,ロイター＝と、オハイオ州の集会で支持者らの声援に応えるケリー氏＝ＡＰ、いずれも三十日不正防げＦＢＩも厳戒【ワシントン＝樫山幸夫】米大統領選は、混戦のまま二日に投票日
438,踏み外し、出来心で罪を重ねた場合と違って、今回、組織を挙げての不正と、そして証拠隠滅が行われたとしたら、まさに組織犯罪として厳正に処罰されるべきではないか
439,至ったとき。三第八十六条又は前条の規定による命令に違反したとき。四不正の手段により第十六条第一項第二号ロの指定を受けたとき。（準用）第百条第四十条第二項
