,0
115,聖書』のなかにまったく見当たらないのである．数十年前のエルズワース・ハンティントンやそのほかの環境決定論者たちの不注意な発言により，自らの学問的評価が傷つけられたことを知る地理学者として，実際にパレスチナ地方
116,に潜沈する前に爆撃し機銃掃射できたのだった。実際、この空母十一個群が大西洋で作戦し、不注意なＵボートへの「ハンター・キラー」として驚異的な戦果をあげた。千九百四十三年春から戦争末期にかけ
117,レギュラーメンバーは各自、自覚を持ってしっかりと行動してほしいと願ってます。特にちょっとした不注意で怪我をしていることが散見されますので、なんともいえませんね。
118,ために水平にすると、スチーヴとグッドウィンが大声でたしなめる。僕は二度とその不注意な行為をくり返さなかった。足跡を追って薄暗くなった湿地帯を五、六分飛ぶ。
119,は子供に教えられるはずがない。そして、そういう子に限って、自分の不注意で何か事故を起こしても、親が悪い、社会が悪いと暴れるように
120,も現物なく、耳のかわりに鼻の先で聞かれ、「それはあなたの不注意ヨ」との一言でチョン。何ともやるせない気持ちになったがその通りで
121,。しかし、物理法則や金属疲労が原因して飛行機の翼が取れたり、あるいは整備技師の不注意のためにエンジンが故障したりして、飛行機が墜落し、二百人の人たちが死んだ
122,地面に置いておくと、冷えて蒸気が水滴になってごはんが水っぽくなるし、不注意でけとばされることもある。あたたかく安定した場所にしばらく置いてむらそう。十すすをふきとる
123,の子で、常に自分を非難される立場に置こうとし、幼い頃長男の不注意から妹に軽いケガをさせた罪をかぶっていた。この家庭に、妹
124,の保護を解除する「調査書くん」にはたくさんの関数が使われていますので、不注意な操作による関数の上書きを避けるため、あらかじめ、ワークシートは保護されています。
125,ある。漏電，短絡，せん絡その他電気的異常状態からおきる火災は火元不始末や発熱器具の取扱いの不注意からおきる火災と違って，その予防には，電気的専門知識が要求されるので，ぼや程度を
126,低くなった。実際、図３．２を見れば分かるように、教室での不注意は読字・読解成績に関するほとんどの変数に影響を与えている。不注意を原因とする変化量には
127,、本来、心理的な状況を指し、結果の発生することを知るべきでありながら、不注意のためそれを知りえないで、ある行為をするという心理状態である。しかし、その後
128,家庭での読書活動に直接、否定的な影響を与えることが分かった。そのため、不注意のレベルが高いほど、読字・読解成績のスコアが低くなった。実際、図３．２
129,分かるように、教室での不注意は読字・読解成績に関するほとんどの変数に影響を与えている。不注意を原因とする変化量には、十三．四％（７〜８歳集団）から二十二．九％（十二〜十四歳）と幅が
130,が、ここに出てくるＢさんは犯罪者というわけではありません。ただ、不注意から交通事故を起こしてしまったのです。三十代半ばのＢさんは、プロのオペラ歌手です。しかし
131,ている。ロウとロウ（千九百九十二）も、構造化方程式モデルを用いて教室での読字・読解成績と不注意の相関関係に関する２つのモデルを検証し、同じような結果を得ている。１つめのモデル
132,大審院判例が「診査医の過失の有無の判断については、普通開業医が通常発見できる疾病を不注意により見落したか否かを標準とすべきである」と判示していることは、上記
133,といったものを見たことがないはずです。が、じつはそういう場所にこそ「不注意な人物」や「可燃物」があふれかえっているのではないでしょうか。それゆえ私は、「
134,が難しい。○他の人がしていることをさえぎったり，じゃましたりする。不注意については，必要なところへ注意をみずから向けることの困難，注意を持続させること
135,も発見されないもの、言い換えれば買主が瑕疵を知らず、かつ知らないことに不注意のないことである。したがって、買主が取引界で要求される普通の注意を払えば発見できる
136,、それでもいつまで保つか分からない。冗談ではない。賀茂は焦った。自分の不注意で、友人の命を失わせるなんてことになれば、寝覚めが悪すぎる。かと
137,秘書アリスンのことは、もう耳にたこができるほど聞かされている。そのアリスンが不注意にもスキーで脚を骨折し、二カ月も仕事を休むことになったのは、フィンにとって
138,に「標準的治療」という言葉を使ってはなりません。この点わたしにも、不注意な点がありました。これまでの、わたしの著作を読まれた人の
139,たような日ぶくれができている背中もある。急に気を許すと、太陽は不注意な者たちに敬意を払いはしない。錨地のむこう側に並んだ大型船へ、
140,な一球でタイムリー、鳥谷に３ランを浴びた。大舞台で緊張しているのは分かるが不注意だった。決戦となる明日の試合は、攻撃では犠打や進塁打がしっかり出来る
141,を担いでもらわねばならんのだ。それから、その者どもは許してやれ。おまえの不注意も咎めはせぬ。（退場）クロタルドありがたき幸せに存じます。（傍白
142,はじめて中央学校に入学できると定めている。しかしこの条項は公教育制度全体と矛盾している。おそらくこれは不注意によるものであり、何らかの状況の結果であろう。さらにこの欠点を正すことは容易
143,なりました。●全国の人口二万五千人規模の地域と比較するとほぼ同じ出火率であるが、不注意による火災が大半であり一人ひとりの防火に対する認識が重要です。会津美里消防署では、ＡＥＤを
144,落し物と忘れ物の違いは何ですか？？？教えてください。落し物・・・不注意からどこかへ落としてなくした金品。遺失物。忘れ物・・・うっかりして物を
145,、その婦人があわてた様子で言った。「いや、任せてください。こっちの不注意で―」と言いかけた片山は、言葉を切った。片山の手に、小型の
146,不注意は読字・読解成績に直接否定的な影響を与えるという仮説だった。２つめのモデルは、不注意と読字・読解成績の間に相互的な因果関係を想定しつつ、これら２つの変数に対する家庭の背景要因
147,なって交通事故を起こしたときに加算する点数のことで、事故の程度や運転者の不注意の程度に応じて（別表２参照）点数が定められています。さらに交通事故の際
148,したことをも確実にしていないと嘘を吹き込まれ、（結局担当者の不注意だったと後で発覚したが、その人から詫びの一言もなかった。
149,の切りも復活してしまいました。失敗２（うっかりミス）失敗２この黒１も不注意でした。白２の点が急所の証明です。問題十三黒番ポイントは
150,小倉支部昭和四十六年判決は診査医の「過失の有無は、普通一般の開業医が通常発見しうる病状を不注意により看過したか否かによって決すべきものと解するのが相当である」と判示している
151,には、やさしくいたわるような表情しか見られなかった。「あなたを、ぼくの不注意からこんな危険な目にあわせてしまったというのに、軍人として寝ずの番も
152,に当るものと思われる。私はここに我が国としては、先方の故意または不注意の無理を十分防ぎうる交渉の余地を持つと考える」（昭和二十年九月八日）と
153,に吹きつけられるほうが被る量は遥かに甚大なのは当然だ。賀茂の不注意だ。このままでは律子も呪いの教室の犠牲者の仲間入りである。しかも、これ
154,はあるマスたちが引き上げられた。あとになって、誰かの思慮を欠いた不注意から、上流にある牛乳工場の汚水が流れ出したことがわかった。ほんのわずかの時間
155,あり、そちらから、保険屋さんに言ってほしいといわれました。私も、私の不注意の事故だったので、その旨、保険屋さんに、お願いしました。ところが、保険屋さんより
156,を）、『遭わない』、『起こさない』よう、注意すべきです。社員の不注意が原因でも、労災が発生すれば、会社は行政から、厳しく指導されかなりの
157,に反応する。走ったり、追いかけたりするのは本能で、しつけもせずに、不注意に散歩すれば、事故のもとになる。しつけと運動を十分にさせられる人
158,ことを秘かに期待していた。どんな悪臭でもよかった。ふと子供の頃不注意で死なせた十姉妹のケージの臭いが思い出された。ケージにしみついた十姉妹の
159,したとしよう。感情的になり、がみがみ怒りたい場合もある。しかし、相手が不注意や予測の甘さのために失敗したことがわかって、「しまった」と思っ
160,もっと問題である。「神の」は付かないという注意に接したはずなのに不注意でか故意にかそれを無視したのもあり、専門とする経済学史の解説本の
161,と安全対策家庭内事故は，住空間の構成や設備計画の不備により発生する場合と，居住者の不注意からおこるものがあり，特に４歳までの乳幼児と高齢者に多い。家庭内事故を未然に
162,。ＬＰガス等の消費先における火災，爆発，中毒等の災害の特徴としては，消費者の不注意が原因となる場合が多いので，消防機関は，日常の予防査察を通じ，一般家庭等に対し
163,ことに興味があると，他の事が目に入らないようにみえる。○不注意な間違いをする。○必要な物をよくなくす。不注意から生じやすい内容である。
164,わけです。しかし、道路上にくぼみ等があってもいろいろな状況からもっぱら運転者側の不注意によるものだと認められる場合には、この営造物責任は発生しません。この点、
165,事例をみると多様な要因が複雑に絡み合い，発生するものもあれば，単純な不注意や無知から起こるものもあることがわかる。しかし，いずれの理由によるものであって
166,にするので、撮影中はそのことについては抵抗感はありませんでした。むしろ、不注意で自分が事故に遭わないように安全確保することで精一杯だったのですが…※
167,よ。やはり人生の中で仕事をかわったり失業したりいろいろな場面では、必ずしも不注意というだけではない理由で払えないときもあるわけですね。後で振り返っ
168,ても、それらは人生に当てられたのではない。むしろ反対である。力の不足や不注意や遺伝的に受けている錯誤のために、現に私達に与えられている無数の富なる
169,及んだ。軍平はけしからん、と見られていましたから、子どもの頃から不注意なことはしないと決めていましたよ。ある日、父に「燃やしなさい」
170,昨年の暮れに不注意から追突事故を起こしたＡＸＩＳのカウルを交換します。割れてしまったカウルを取り外し。ネットオークション
171,「話して聞かせてよ」ジョンヴィーヴが言った。彼はこまごまと物語った。不注意と不運。火事。ウェンドが死に、そのショックでカリリィがものを言わなくなった
172,グループ内でも極めて零細かつ生産性の乏しい別の会社であったことが判明した、という不注意が原因のものもある。以上のような状況から、新規に取引を開始する
173,。「帰りのバスの中で聞いた話で確信したんだけど、静男先生は不注意で転落死したとは信じられないの。現場にはきっと誰かが一緒にい
174,としての適格を欠くことを認識するか、通常の生産者の注意義務をもってすればこれを不注意で認識しなかったことなどの特段の事情のある場合を除き、対象馬が競走馬として
175,〈別れ〉〈祈り〉〈救い〉●ソル「少女と恥じらい」〜〈私の不注意な目〉〈慎重な女性たち〉●ガルシア「新しい可愛らしいコップ」〜〈リル・リル〉〈
176,何かの縁だ、矢部。天地自然の摂理は覆すことはできぬ。それは不注意の過失とは別の問題だ。さて、大坂のことだが、事の委細
177,たい」彼は闇のむこう側で待っていてくれるだろうか？自分のうっかりした不注意が子供たちの破滅を招いたのだけれど、彼は許してくれるだろうか？あの
178,置いとくのが悪いのよ」と言われてしまった。この問題は、私の不注意という審判が下されたのだった。どうにも腑に落ちなかったが、我が家で最も
179,書かれている。金子勝『反経済学』千九百九十九年、新書館も、その良き意図にもかかわらず、同様の不注意を含む。（二十一）佐伯啓思『アダム・スミスの誤算』千九百九十九年、ＰＨＰ新書。この人は
180,水路を行き来しても、何も見つけられなかったのだ。友人が手がかりを残すほど不注意ではないということはわかっていた。警部補は救命胴衣を脱ぎ、シャツの内側に手を
181,わたしが擦ったバンパー！彼もう直したかしら？そうよ！わたしの不注意なんだから弁償しなきゃ！そうよ！）自分に言い訳しながら書かれている番号
182,に密輸・違法行為がなく輸出額の大きな工場（Ａ分類）については全額免除、過去二年間に違反行為（不注意によるミスを含む）のあった工場（Ｃ分類）については減免なし、過去二年間に密輸行為
183,クロードにメガフォンを渡そうとするが、みな焦っているので、メガフォンをうまく扱えない。不注意から、メガフォンが急にサイレンのように鳴り出してしまった。みなびっくりして飛び上がる。メガフォン
184,寝ているでしょうよ。また、馬の水飼場にはいり込み、公衆水飲み場に隠れて、家畜や不注意な子どもたちにやすやすと飲まれるように待機しているでしょう。地にしみ込み、何千もの思いがけ
185,」と短く答えて、家を出た。少し前、相手方の一方的な不注意によるが、軽い接触事故を起こしてから、マイカーによる通勤は控えている。駅
186,に注意深く運転すれば、通行可能だった。もっぱら気になるのは雪ではなく、ほかの不注意なドライバーだった。始終バックミラーを見て、ほかの車に追いつかれたら、できれ
187,からの眺めにも満足して下山した、そこまでは良かったのですが、誰かさんの不注意な言葉で主久と友生が大喧嘩。あおりを食って、私と英行さんがそれこそ
188,ず、親からの援助が必要になる場合もある。私は大学院在籍時に、不注意で左下肢の筋断裂のため、股の付け根から足先まで一ヵ月と少し石膏ギブスで固定せざるを得ない
189,耳にしみこませ、わが懐の奥ふかく蔵う心持です。だから、私は自身の不注意などの原因で弱くなったりしてはすまない、一層そう思います。…
190,て車に君は見えてない（佐伯区長賞なぎさ公園小学校五年■■■■■さん）不注意が未来をうばうその一瞬（広島西交通安全協会会長賞五日市南小学校六年■■■■■さん）叫びたい
191,を起こすような人は運転に向いていないでしょうか？ちなみにその事故は百％自分の不注意でした・・・いえ、そんなことはありませんよ。ゴールド免許を持っていて
192,ていたのですが、最後まで見てしまいました。皆さんのご意見はどうですか？不注意で・・・という回答が多いようですが、彼女はこれが２回目です。千九百九十七年
193,を確かめたいためだけではなかった。とにかく詫びたかった。心から主治医としての不注意と未熟さをあやまりたい。軽井沢の大蔵名誉教授を訪ねてからずっと反省してきたことだ
194,。短編を寄せ集める単調さを打開するための第二の手法は、「一度獲得した宝物を不注意でなくす」とか、「いんちきの宝物をつかまされたことを知って、それ
195,年齢集団に分けられた。教師による評価、自己報告評価、学力テストを用いて、教室での不注意、家庭の背景要因（社会経済的状況など）、読字・読解成績を評価した。この研究結果は、読字・読解成績
196,ともに裏づけるものだった。最初のモデルで仮定されたように、教室での不注意は、読字・読解成績、生徒の読書に対する姿勢、家庭での読書活動に直接、否定的な影響
197,により検査できない旨を説明し，患者の理解が得られたインシデントの直接要因や背景不注意その他：（記述式）眼科外来診察室が暗室であるため，眼球結膜黄染，顔色がはっきりわからなかった
198,」。内偵が始まりもしないのに、容疑者の会社に顔を出すのは不注意だったのではないか？「社長の遠藤淳が慌てておるんです。よく考えてみると
199,だ。熱心に犯人を捜し続ける能力を持っていた。ところが今、ぼくのとんでもない不注意が原因で…」「ホームズ、そんなに自分を責めるな。きみのせいで
200,判決は、結論としては、診査医の過失の有無は、普通開業医が発見しうべき疾病を不注意により看過したかどうかを標準とすべきであると述べたものである。（
201,そして幼かった里美は思い出しては泣いた。最初のうち、その異臭は飼育に関して不注意だった自分への責めそのものだった。だがしばらくすると、いとおしかった小さな生きもの
202,損害賠償義務（「不法行為」に基づく損害賠償責任）を負担する（民七百九条）。過失とは単なる不注意又は軽率性を指すのではなく、一定の注意義務違反をいう。過失責任は、事故被害に関して民法が定める
203,がある。―仮説２ＡＤＨＤが学習面の問題を引き起こすＡＤＨＤの主な行動（不注意、衝動性、過活動）のせいで、子どもがアカデミックスキルを獲得する能力や、一貫したやり方
204,が（家族の社会経済的状況、読書に対する姿勢、家庭での読書活動など）、なかでも不注意は読字・読解成績に直接否定的な影響を与えるという仮説だった。２つめのモデルは、不注意
205,今日から新しい年度。新しいスタートをきる日です。昨日、チョッとした自分の不注意でブルーな気持ちになってますけど…なにわともあれ、去年より頑張って良いて一年
206,に野焼きと不埓な侵入者の脅威にさらされている。森に隣接する地域では、不注意な野焼きと過放牧が際限ない荒廃を引き起こしている。水源地がその保護植生を失うとき、
207,ました。現在、十七才。健康にすくすく育ってくれて良かったです。全く私の不注意でした。
208,が挙げた勝ち越し点は、文字通り息の根を止めた。今季ほとんど出番がなかったＭＦペナントの不注意なパスミスからのカウンター攻撃。ビドゥカの動きに後手を踏んだセンターバックのリュズニーは、本来
209,くるように頼みます。そこまで素早く行なったら、次に、「私の不注意でご迷惑をお掛けいたしました。大変申し訳ございません」と、周りのお客様に向かっ
210,についてみると、船舶からのものが百七十七件と約７割を占めており、そのほとんどが取扱不注意によるものでした。油以外の汚染についてみると、陸上からのものが六十九件と約７割
211,ことを暴露するというスカーペロスのあまりにも都合のよすぎる記憶力は、単なる悪気のない不注意として片づけられる。「二度めの警察の訪問のときに…」ネルソンが日付を
212,と、氏の理解とはまったく反対の記述を詳細にしているのである。これも不注意によるものとはいえ、かなり致命的な読み落としである。また氏は「人間の最高の価値
213,に集中できないせいで、与えられた課題の成績が低いことがある。さらに、不注意と行動抑制の問題のせいで、生徒の学習に対するアベイラビリティ（有用性）が損なわれ（
214,て、首を振る。「い、いや、そんなことはないでしょう。わたしが不注意だったんです」「そうかしら…。失礼なことを伺いますけど、誰か
215,を子細に調べた。新聞はマルセル・ポーメルの死を四分の一ページで掲載している。用心深く、《不注意による転落》という仮説にとどめていた。よく言ったもんだ！幸運にも
216,になりません。本人に全く悪気のない善良な人であっても、ちょっとした不注意や認識不足で感染し、知らずにウィルスをばら撒いている事は大いにあるのです。まあ、
217,出動の為と云ひ得る。重傷者九十一名中、男七十五名、女十六名、軽傷千七百名、これらは不注意となまいきから起るのである。（「東海中学職員会議議事録」『愛知県史資料編三十四教育』０４）筆者
218,を占めたのは、こんろや電気配線などからの出火と放火です。油断や不注意ですべてを灰にしてしまう火災、火の怖さを認識し次のことに注意しましょう
219,のは「小児科」「皮膚科」「外科」「形成外科」どれでしょうか？私の不注意で１歳の娘に火傷を負わせてしまいました。救急（外科）で応急処置は
220,取締役の経営判断そのものを対象として、その前提となった事実の認識について不注意な誤りがなかったかどうか、また、その事実に基づく意思決定の過程が通常
221,・子どもや高齢者の心身の特性により避けることができないもの・本人や周囲の人の不注意・入浴前の飲酒などの行動や生活習慣・安全性が配慮されていない住宅のつくりや
222,。《不注意》○学校での勉強で，細かいところまで注意を払わなかったり，不注意な間違いをしたりする。○課題やあそびの活動で注意を集中し続けることが難しい
223,への反応として一時的に生じているのではないことをいっている。（２）「不注意」「多動性」「衝動性」のうちのいくつかが７歳以前に存在し，社会性や学校生活
224,ような工法上の工夫をしたり，墜落防止の安全ネットを設置しておけば，たとえ作業者が不注意や錯覚による不安全な行動をおこしても，事故に結びつかず，災害もおこらない
225,流れ落ちていた。イモ虫の大群を抜け、洞窟の下に開いていた穴に不注意にも落ち込んだと思ったら、そこは下水道のように水の流れるパイプのよう
226,できないが、変数間の相対的影響を評価することはできる。以上の研究から、ＡＤＨＤ関連行動（不注意、衝動性など）は学業成績に直接否定的な影響を与え、ＡＤＨＤ症状のレベルが高いほど
