,0
340,が楽しいと思うことを、他人にやってもらおうとするから、甘えが出て、不満が出る。会社でミスったことを社長に叱られたのを、今朝出掛け
341,が話し掛けてきた。「本気ですか。そんなものを詳しく調べるなんて」「不満か？」「だって、荒唐無稽がすぎますよ。怪談と事件が結びつくなんて」
342,！コイツ？？？？？」って思っちゃいますよ。普通は。その価格に不満があるなら、入札しない、あるいは、キャンセルのお願いを言って来られると思います
343,ません。けれども、民衆の信仰はどうでしょうか？侵略者天智天皇に対して、かなり不満を抱いていたようなので、必ず入鹿を丁重に祭っていたはずです。
344,前述した挑戦状への〈反感〉の他、〈人物過多の不満〉と〈サスペンス不足の不満〉など（「不連続殺人事件」を評す」、「探偵作家クラブ会報」千九百四十八．九）、マイナス面だけが伝え
345,がケンカの脅威よりはるかに厄介なのである。護身手段としての組み技について最もよくある不満はたぶん複数を相手にしたら通用しないということだろう。その理由として、相手を
346,が共同でスペインを支配するようになって以来，自分たちが権力から遠ざけられたという不満を持っていた。そして女王が死んだ今こそ，自分たちの地位をとりもどすチャンスが
347,ない。それらは、どんどん外へ拡散するのだ。佐助にいわせれば、人々の不満もまた、有望な国民エネルギーというべきであり、それが破壊衝動へ向かえば負のエネルギー
348,た後にわいてくるはずの感動がなかった。むしろ、旅館の施設やサービスに不満を覚え、このままでは中国からの観光客を呼び込めないと思うようになった
349,遅漏になるので、私の方が乾いて受け入れ不可になっちゃいます。私はとっても不満なのですが、指摘すると主人がますます気にしてしまいそうで言えません。せめて
350,た。選挙法改正法案成立の時点までたち戻ってみよう。われわれは愚かにも、この改革によってわれわれの不満の種は除去されるだろうと期待した。その後の七年間、われわれは中流諸階級の正義感
351,で、結局。ぼくらは新たな課題を背負い込まされたわけだ」央儀もまた不満そうに言う。「いいじゃ無いか」一石が吞気そうに言う。
352,から問題はない」と考えているすれば、それは大きな間違いです。普段の小さな不満は、ほとんど表に出てこないことが多いということを忘れてはいけませ
353,。ヘンリの吝嗇さ、彼女自身の財政的堅実さ、彼女のサラァへの愛情、葬式に対する彼女の不満、『偉大なる一切』―ここから列車はヘンリのほうへ向って走るのである。
354,に移してもらいたい、そしてまた五．一五メモを公表してもらいたいということで強い調子でワインバーガー国防長官に不満の表明をされたという新聞報道がなされているわけでございますが、これに対して
355,。「お前は引っ込んでいろ俺が相手になってやるとレッドキング」「ちょっとギガスは不満そうです」「いいから引っ込んでいろというレッドキングです」ここでいきなりレッドキングがギガスを
356,『学校経営』という雑誌に載った教員のアンケートの中に、「教職の社会的評価に対して不満に思っていることを一つだけ聞かせてください」という問いがありました。それに対して
357,また、自分で事業を起こそうと考えるぐらいですから、今の仕事に少なからず不満を持っている方もいるでしょう。バシッと辞表をたたき付けて辞めるのは、さぞや
358,も地元の政治勢力が集まる地方評議会などへの事前説明が十分になされていないとの不満が出ているという。選挙によって国政を主導することになる統一イラク連合はシーア派十六団体の連合体であり
359,が生まれてからは頂点に達して…。テレビで佐々さんを知り、思いきってこの不満を何とかできないものか、とご相談しました」１１列に並んだキッチン。
360,孫たちが彼の部屋に遊びにきて、散らかし放しにして出て行くのが不満でならなかったが、〈孫だって人間だ。頭から抑えつけようと思うの
361,である。本家ＩＲＡは武装解除を条件に、全政党会議に参加が認められた。それを不満に思ったリアルＩＲＡは、千九百九十八年の八月に北アイルランド、オマーで、アイルランド紛争史上最大の死傷者を出し
362,のですか？」「表面的には、なにも…」孫武は言外に、不満があることを窺わせた。伍子胥は、諸樊の長男が、軍権を司っている
363,に同意しない、いわゆる心配はありませんとこう言うと、非常に韓国としては不満というか認識不足だということでありますが、脅威があるかないかということは
364,電話線を通るアナログ信号を、パソコンが分るデジタル信号に変換する装置がモデムです。この性能に不満があるとき、より性能のよいモデムに替えるより、最近ではＩＳＤＮに替える人
365,たとえばレーンチェンジといった場面では、足腰の弱さを感じさせる。しかし、それ以外で目立った不満はなかった。アッパーボディに対して、足元が貧弱に見えるルックスを除くと、「このグレード
366,このような空気は表面に現われることはない。困窮の度合は静かに深まり、同時に不満が高まってゆく。しかし王には、国中にみなぎる不穏な空気、特に貢租に対して向け
367,項に基づき公表された目録又は本条（４）項に基づき公表された訂正目録に不満のある者は、最初の公表から三十五日以内、又は第二の公表から十五日以内に、地区
368,の州を持つにいたったものの、あらゆる面で中央政府による差別や抑圧を感じて不満を募らせていった。不満のなかでも大きな要因となったのは、
369,仕え方は、更に申し分がなかった。源四郎の好みや癖をたちまちのみこみ、少しも不満を抱かせなかった。源四郎がそれを褒めると、可愛い笑顔を見せた。
370,、したでもよい。一言謝ってくれれば、笑って許すのに、道代は内心不満だった。さらに三日経ち、五日経った。道代の不満は不快に変わった
371,の熱意は希薄なのだが大学への要望を聞けば、教育の現状への不満と学生生活や就職への要求をほぼ均等に訴えている（複数回答三まで）。つまり
372,、かつて統一戦線政策対象にされていたパンチェン・ラマ十世も中共がチベット文化を破壊することに対して非常に不満を持っており、チベット民族・宗教の絶滅政策を非難し、周恩来前総理宛に「７万言書」を送った例を
373,邪】な誘いを振り払ったヒント：正しくないこと横道２、【熱り】たって不満をぶつけたヒント：激しく怒って興奮する３、鰯ヒント：暖流に乗って回遊し、
374,、すべての症状、病気について医師から十分に説明のないことが患者さんにとって最大の不満だと思われます。そのような患者さんの気持ちがよく表れていると思いますので
375,ていった。（現在血肉を分けた子が信じられぬのか）その不満が熱湯のように胸にあふれてくるのである。その怒りは大玄関でさらに加わった
376,計測というかたちが取られることになったのだ。これには参加者側からも、いろいろと不満が出た（旗振りスタートは、スタートタイミングがつかみにくい）が、結局決勝トーナメント時までには東京から
377,が必要だったことか……。でも取っておいたんだよ。うちの嫁に不満をいわせないようにね。それなのに今、おまえさんは、自分は流行
378,は激化し、１年を通して続いた。与党ジンバブエ・アフリカ民族同盟愛国戦線は土地分配と人種間の不平等さから募った不満を利用して、殺害や拷問などの暴力を助長した。こうした政治がらみの人権侵害
379,、歌うアジズ自身がその詩の哀調に圧倒される。ばかばかしい陰謀、噂話、浅薄な不満などは静まって、不滅となった言葉が、冷やかな部屋じゅうに溢れた。戦い
380,が３馬身ほど遅れた。６Ｆ八十三秒５の時計は決して遅くないが、ラスト１Ｆ十四秒５は不満の残る内容。ただ「十五−十五より速いペースになると苦しくなるみたい。ちょっと太いみたい
381,理解してくれず、「よくあること」、「気のもちよう」と励まされるのも不満である。このような事情で、自分から精神科の外来を訪れた。不安の
382,許しましょう（笑）。じゃあぼくがこの作品を弁護する側に立ちますね。いろいろ不満もあるけど、要するに、作者の志の高さを買うわけ。英米風のリーガル・サスペンスが今
383,としての観点から松崎氏に対して組合運動にばかり力を注いで党派の拡大に熱心でないという不満を抱いた。そこで、幹部を派遣し、国鉄内の他のメンバーに「松崎批判」
384,て、もっと濃い暗さになるのを見つめていた。よしのの日常生活に、特に不満があるわけではない。「けれども…」と、よしのは、自分自身に反問してみる。
385,努めているが，政策的配慮から現実的な解決を指向する傾向があるため，絶対反対派の住民に不満を残すことがある。第３‐十七表住民運動の種類及び件数（四十七年十月〜四十八年９月）（備考
386,のために高額の賦課金割当が再び公示されると、拙劣な用兵も手伝って不安と不満が燃えあがり、公然たる反抗に拡大する。この不幸に見舞われた人々の一人はこう
387,マスコミに煽られたのではなく、小泉首相がマスコミとマスコミに影響されて公務員や議員に不満を持っている国民を巧みに操っただけです。政治に関心がなく知識のない
388,の被害で最大の効果をもたらす効率的な自分流のストレス発散手段を編み出している。不平や不満といった一連のマイナス感情をめんめんと自分の中に溜め込み、知らず知らずのうちに
389,社会王義革命と位置づける説もあろうが、「当初朝廷から海賊追討官に任命されたがその軍功見返りに不満を持ち、当時の社会不安に便乗して朝廷に叛旗を翻した」とする見方が
390,の不毛に苛立っている。が、憎しみが直接それへと向けられることはない。人々の不満の向けられるのは、寧ろ天である。私は幾度か、村の女達が天
391,た、多くの無党派層は増税に納得して投票したのだとおもいますが、多くは不満のようです。それでは、なぜ投票したのでしょうか？政治に詳しい方、解説よろしくお願いし
392,、自分の歩んできた人生に対して、幸せに感じることができる人と、何もかも不満であると思う人がいるらしい。幸せだと思う人は、さらに幸せになり
393,が横づけになっている。「ちょっと、ちがいますね」編集部のＨさんは、不満そうだった。私もどうも先入主を濃厚にしすぎた。播淡汽船といえば、
394,」と主張するかもしれない。たしかに妻はさまざまな場面で、自分がいまの夫婦生活に不満を抱いているとさんざん言ってきただろうし、夫たちもそれはわかっている。だが
395,家長の赴任は、国府方の南北の連絡を断ち切ることになった。多賀国府の顕家に不満の武士たちが、家長のもとへ参集しはじめる。相馬郡の相馬重胤たちだ。奥州にも“公武水火
396,満足の傾向にある。一方不満についてみると，「やや不満」が十六．五％，「不満」が四十七．一％と合わせて六十三．六％と，ほぼ３人に２人が不満を感じている。この
397,御霊会の震源は敗死者遺族や共鳴する没落貴族にあったとしても、これを社会の王権への不満と結びつけ、右のような独特な法会にしたてる役割をになったのは、
398,ますが、この程度の歌になればまた私どもの要求するところもだんだん高くなるので不満のほうがまず目につく次第であります。「ま遠くに梟のなく」という
399,患者さんもいます。合わない入れ歯の悩みは深刻で、かなりの人が入れ歯に不満をもっていることがわかります。訴えのなかでとくに多いのは、痛くて
400,もの人を得度させ、崇道を祀る僧とした。この早良親王の怨霊が不満をもつ社会底辺とどのように結びついていったかはあきらかでない。思うに、この
401,な。見て見ぬふりをしろ」と命じているのだ。配下の者が不満を抱くのは当然といえた。「…石島殿への斟酌ですか」
402,た声音だが、本人は穣を非難しているつもりなのだろう。幼い顔つきに精いっぱいの不満をたたえている。「あっ、芳坊、そこにいたのか？」「
403,のほぼすべての生命が絶滅するという考えに言及した発言だった。しかし、まだ不満だったオスターホルムは、導師をさらにせっついた。そしてヘンダーソンは六か月後、アトランタで開かれ
404,何ひとつ解決はしない。すべての環境をみな引き受けて自らが重心となり、不満や矛盾を未来に申し送らぬことこそが、選ばれた人間の道であろう。王道
405,からお客様もあからさまには言わないが、同業他社の訪問頻度を引き合いに、Ｔ工業への不満をそれとなく匂わせる。本題からはそれるが、電話応対のまずさなども、この
406,五、藤原広嗣の乱藤原式家の嫡男藤原広嗣（宇合の男）は時勢に対して不満であった。とりわけ新参者の真備や玄昉に対して強く反感を持っていたことがわかる。
407,地対空ミサイル攻撃を受けて墜落、米兵十五人が死亡、二十一人が負傷した。米軍のイラク占領に不満を持つ勢力による攻撃とみられる。（２面に関連記事）イラク戦争が始まって以降
408,教育は、ビジネス環境の次に重視されている項目であり、子供のいる家族の約４分１が不満としている。近年の外国人居住者の増加等に比べ、インターナショナルスクールが少ないことが最大の原因
409,「大郎さん得意の論法でしょ？男女は同権にして人民は平等なり。公平から不満生ぜず。不公平から不平出ず。不平満ちれば国家疲弊す」「弁士中止。保安条例違反により
410,ではあるものの、実際の活動で阿房の儒林が中心になりがちなことに強い不満をもっている。現在もなお、天山の儒林からは「自分達は天山の儒林であっ
411,ような怒りによりかかって、人間の心理や事情を考えない人たちにも同様の不満を感じる。たとえば、動物の肉を食べるのはいやだと言って菜食主義を貫く
412,思っています。市民の皆さんやいろんな活動をされている人が、行政に対して不満を持つことはたくさんあります。その一つに、ルール作りに市民が参画していない
413,での多数決で決定されたときに，自分の意見が反映されていないことが不満の中心と思われるので，正当な手続きを経て決まったことには不満で
414,ていたのに、ブローデルがわれわれ派遣団を牛耳りたいと思っているのが私には不満であったので、派遣団が必ずしも非常に友好的ではなかったことをブローデルも私も忘れて
415,わけ。んでヘタすると社長との給料差がほとんど無くなっちゃったりするの。そりゃ社長は不満じゃん？「なんで一般社員とワシの給料が近い額なんだ！！」ってね
416,で述べられた不満（賃金が低い，能力が顧慮されていない）２番めの不満は，その意味が，生態的，社会的に決定されており，そのため，時，場所
417,。落ち葉掃除や樋詰まりを避けるために、落葉広葉樹を植栽しないばかりか近隣の人にまで不満を持つ人たちもいるが、そのような人たちは戸建て住宅ではなく、都心のマンションに住む
418,も悪くはねえだろう」「それを望んでるんですか？旦那は」不満そうな口ぶりで、志乃が問い返した。「人は誰も楽な生き方を
419,消費量が伸びた背景には、水道水の安全性に対する不安や味や臭いなどへの不満があるようです。ボトル水を買う動機は「おいしい」「トリハロメタンがない」「身体
420,拍手喝采する傾向が出てきました。それは長年の自民党政治で、いわゆるＢ層の人々に不満が鬱積しているからです。かれらはエリート達がいじめられているのをみて、うっぷんを
421,は前述したとおり。白ｃでｄとノビ、黒ｅ、白ｆなら白大甘で、黒に不満はありません。９図十図９図に続いて白は１と切り返してかわして
422,。これまで価格が高い、料金の内容が不透明、時間がかかるなどユーザーの不満が高まっていた車検制度は、九十五年７月に施行された改正車両法によって大幅に改正された
423,異教徒のキリスト教徒がイスラーム教徒の国に進出することは、イラン国民を苛立たせた。彼らの不満は発火点に達していたのである。この民衆の不満の代弁者は、直接経済的打撃を蒙っ
424,のための刺激であると同時に同じような立場にいる子ども同士だから言える不安や不満をぶつけられる相手であり，人に対する思いやりの心を育てる（駒松，千九百八十三）。友達
425,暑さで、頭はボーとしてくるし、なんでこの時期にやるのかと不満をどこかにぶつけたいくらいでした。実際試験終了後に、一人の受験生が試験官になぜ
426,でも私は１回のＨで満足したいのです…。かといって私が物足りなく不満に感じている事など口が裂けても絶対に言えないし…もし言ったところ
427,に従事している古参の従業員よりも安いという現象が生じた。これが若い従業員の不満の種となり、退職する者も出始めた。これには社長も頭をかかえ、
428,た。「すごい。サッカーボール二百キロぐらい蹴れますね」すると彼は、なぜか不満そうにした。そして、「胸も、筋肉質ですよ」と言いつつ、私
429,）を特徴としたフランス社会においては強くはみられなかったこうした不満は，ひとたび政治的な動員がなされればワイマールの民主主義を掘り崩しかねない危険性を秘めていた
430,、思いどおりにならなくなったことが、母親にとって深刻な不満になります。不満が、苦悩となります。そして、自分は日本一不幸な母親、ということになります。
431,３分論批判に踏みきって，対中関係は急速に冷却したが，これは，中国の対欧米姿勢に対する不満とチトー大統領の訪中に対する怒りによるものと考えられる。（チ）ユーゴスラヴィア八十五歳を
432,ます。偶然ショップの目玉商品だったので、いい商品を安くつけられました！！不満な点は、オンダッシュナビ（画面がしまえない形）の後付は、配線がむき出しに
433,餌をやりたければ、自分の家に連れて行ってやって欲しいわ」真美は不満そうに頰を脹らませた。彼女の苦情には次のような事情がある
434,・・公務員による不正などの行為などが、広まっている事から民からも大いなる不満が、日々に生じていたとのこと。・・・（。−｀ω−）ん〜♪放置し
435,の炉辺〉のものだ。しかし、住んでいるのはふたりだけだから、なんの不満もないがね」あちこちでざわめきがあがり、フレベクは彫り師ラネクをにらみつけた。この
436,。経済問題については、ソ連国民が日々必要な様々な物資が不足しており、国民の不満が高まっている。当面は西側先進国からの援助で凌げるとしても、長期的には、一日も
437,のため依然として厳しい状況にある。また、通勤の長時間化・長距離化が、通勤者の不満をさらに増幅させている。通勤混雑対策として、鉄道整備とあわせて時差通勤を強力に促進する必要
438,最近ヤフーの知恵袋の規制が始まり不満の投稿が多いです。何故ですか。今の方が良い。。。。。
439,の全体的な満足感は，「どちらかといえば，不満だ」が四十九％，「不満だ」が二十三％で，不満感を持っている人は合わせて七十二％と多い。政治へ
440,経営して、下に人がつくようになったときに、今のお前と同じ不満を抱かないように自分自身が会社を運営していけるか？よっぽどのカリスマ性があるか、
441,東方の信仰と厄介に結びついていたし、プラクシテレスのモデルだったフリュネーが聖職者側の不満の対象となったのも、道徳的な理由というよりは、彼女の肉体美が
442,対策」と説明しました。厚生省は、保険料の徴収開始を契機に、制度に対する不満が爆発することを恐れ、「三段階の広報戦略」と「窓口対応の体制整備」を指示しまし
443,を拒否したそれまでは何の問題も無く指示に従ってきたのに何が不満か待遇か給与か仕方がないドライバを再インストールしたダメでした悪い事にそれまで
444,な入り口に立ったらしいと、麻也子は満足のため息を漏らした。ただひとつの不満は、野村がタクシーチケットをくれなかったことだ。
445,し、今の状況で進んでいきますと、どうも非常に何かお互いに不満を持ってやめるという形になりかねないと思います。今後、この点どう進めていく
446,と私が振り返るのはもう少し先のことになる。日系ものが多すぎる、という不満の声が劇団内でくすぶっていたのもこの頃だったと思われる。だが、マコ
447,ＫＥＮにすら「ダーダはパソコンばっかり」と言われてもやめることはない。それを不満に思ったこともあったけど、言えば「俺は働いてるんだ」と逆ギレするし、
448,いったりする者がいるので、せっかくのいい書斎があっても困ってしまう」という不満を記した一節がありますが、ものを書いたり、何かを考えるときに
449,さ、と自嘲する人もいました。今になって考えてみると、彼らの不満の根本的な理由は、自分の仕事ができないこと、つまり、仕事の人として
450,て、皆が平等に「貧困のユートピア」に甘んじていた時代はそうした不満に耐ええても、今日のように「改革・開放」体制下でモノ・カネ主義が蔓延していると、これらの
451,さんざん大人扱いしておいて、大人になったらなったで、未だに子ども扱いされる。スコットの不満はピークに達しているはずである。このまま行けば国際救助隊脱退なんてことになるかも…
452,に処罰されるべきではないかと考えます。率直に言って、防衛庁には検察当局に対して不満があるのではないでしょうか。日常業務を背任と決めつけられてはかなわないと。調本本部が
