,0
0,入れないように、仮囲いをしなかった、工事屋さんも不注意だが・・・。ここまで、入るかな・・・普通。コンクリートは、
1,の対極という位置付けで読んでいるわけです。◆死ぬより辛い生後４ヵ月半の子どもを不注意から死なせてしまった母親は、子どもを命より大切に思う夫と３人で死ぬ
2,、ちょっとかゆいんです。美容師さんにもいいずらくて。。。理容師で美容師です。美容師の不注意ですね、綿棒を水で湿らせて軽く拭いてみてください。耳の中は皮膚
3,、「訳し忘れ、改行の無視、原文にない改行、簡単な名詞の誤りといった、不注意による単純なミスから、単語・成句の意味の誤解、時制の理解不足によるものまで誤訳の
4,使用による傷や汚れなどの修繕費はすでに家賃に含まれており、借主の故意や不注意によって生じた傷や汚れについてのみ、借主に原状回復義務が発生するとされてい
5,ました。「この娘は私の姪に当ります。この娘に親の不注意で四歳の時、こんな火傷をさせてしまって、ずい分医者にもかけました
6,や性交を見せる、ポルノグラフィーの被写体を強要するなど養育放棄（ネグレクト）保護者としての重大な不注意や無関心例病気になっても病院に連れて行かない、乳幼児を家に残し
7,たインゲの顔を除いて、彼がいた痕跡は皆無だった。彼は不注意だったことがない。後始末にはいつも細心の注意をはらっていた。影さながら
8,不特定の光との間に、これほどにも熟達した画家にあっては単なる不注意としては説明しがたい奇妙な矛盾を作り出すことで、こうした含意をさらに強調していると
9,、他方で新たな無数の危険を生み出した。これらの危険のうち、みずからの不注意や不可抗力による場合を原因とするものについては、他人を責めることはできないため
10,が、この問題にいくらか光を投げかけている。これらの研究から、ＡＤＨＤ関連行動（特に不注意と衝動性）は学業成績に強い否定的影響を与えることが示された。この関係は相互的
11,から足先まで一ヵ月と少し石膏ギブスで固定せざるを得ない状態になってしまったことがあった。自分の不注意のためとは言え、バイトに行かなければ大学院の学費、生活費を払うことができないという状況
12,。問い合わせは札幌友の会☎０１１・６１２・５９３５へ。ペットと暮らせば犬の家出自分の不注意を後悔清水敏子よく新聞の掲示板に「尋ね犬」や「探しています」
13,は言えないわ。代わりの品を置いていったのだから。日記帳はわたしが不注意に落としたのよ。あの人はそれを返してくれただけ」ルークは両手
14,ていたのです。皆さんに大変御迷惑をかけて申し訳がありません。何卒私の不注意と粗忽を許して下さい」そう云って同級生の前で頭を下げた時、
15,中でするように、いわば鳥のようになり―くつくつ笑い、大声で笑い、不注意に、枝の間からのぞいた。待て！止めた！止めた！一月
16,は縦糸と横糸のようにはっきりと食い違っていた。彼の行為は、確かに不注意ではあったとしても、どんなにひどく言っても部分的露出にすぎず、時ならぬ聖スウィジン
17,（重過失がある場合）には、無効を主張することはできません。なお、不注意（過失）で勘違いした場合でも、重過失さえなければ無効を主張できます。署名
18,思います。いつでも掃除をする事で初心にかえり油断や不注意を無くせるように思えます。龍前住研で得た貴重な経験は自分が
19,。移送は計画通り行われた。細い棒で突かれた間抜けな看守だけは、不注意の報いを受けることになったが。二、三日手のひらが痛むくらいなら安い授業料だ。
20,、健康保険証までなくしてしまうところだった。現金は多くは持ち歩かないことにしているから、不注意の反省としてあきらめるしかないが、持ち歩き用のアドレスブックなど、また作るには大変な手間
21,損害賠償ハ別段ノ意思表示ナキトキハ金銭ヲ以テ其額ヲ定ム四百十八条〔債権者に不注意があれば賠償額はけずられる〕債務不履行（↓四百十五条）について、債権者のほうに
22,た。赤い円でかこまれた取引が三つあった。「この男はちょっと不注意だな。怪しい取引はすべて、金額が一万ポンドになっている。だから簡単に見つけられる
23,印刷されません。左図のように修正されました。修正が終わったら不注意による関数の上書きを避けるために、ワークシートを保護するようにしましょう。ただし、パスワードは
24,少なくありません。いわゆる「ひき逃げ」です。ひき逃げの場合には、事故自体は不注意から発生していても、その後の行為はやってはいけないことと知りながら行なっているため
25,は、心理的側面をあまり重視しなくなっている。たとえば、我妻説は、「過失とは、不注意即ち注意の欠如であるが、その標準となる注意の程度は行為者自身の平常の注意程度
26,なかったことだったので、撮り損ねてしまった。奇蹟は起きたが、僕の不注意、肉体的疲労のせいで、撮り逃したんだ。二時間も経てば、反射神経は鈍るし、
27,に全力をあげて立ち向かう戦略である。それに対して、こういった危険は、みずからの不注意で招いただけのことで、決して「危機」ではない。単に自分の「
28,発生し、または損害の範囲が拡大したときは、損害賠償の金額を決めるとき、その不注意が考慮される。したがって賠償額がけずられたり、場合によってはゼロになることもある。第四百十八条
29,貴女が無視されたことは甚だ遺憾であります。この規則が建造物内における不注意な人物や可燃物の存在を管理する目的で定められたものであることをよく認識され
30,あれば賠償額はけずられる〕債務不履行（↓四百十五条）について、債権者のほうにも不注意があったため損害が発生し、または損害の範囲が拡大したときは、損害賠償の
31,）を全部食べてしまい、朝方私の布団の上で吐いていました。。。不注意は重々承知してます（ーー；）仕事に出てきましたが心配です。一人暮らしで勤務先
32,」と思っているときに、ただ頭から文句を言っても効果はない。不注意や予測の甘さがどうして起こったのかを、ともに考える中から再発を防ぐ
33,（４）の判断基準をあげ，それぞれに解説を加える。（１）以下の「不注意」「多動性」「衝動性」に関する設問に該当する項目が多く，少なくとも，その状態が
34,をえず］不得已とも書く。しかたない。やむなく。不念［ふねん］不注意。過失。不意［ゆくりなし］思いがけなく。偶然に。ふと。不斜
35,はどっちなんだ！」と、到底納得できないだろう。しかし、人間にありがちな不注意（違反）が原因で事故を起こし、その結果が重大だった人と、酒
36,季節になるため、細菌性の食中毒が多く発生します。食中毒は、ちょっとした油断や不注意で起こります。意外と家庭で発生する場合も多いので、家庭でも食中毒予防の三原則
37,長所が自然に醸成される機会に恵まれます。ただし一方で、家庭や学校の不注意から、「叱られ型」が身についてしまい、自分の価値観を自分で決めてしまって
38,でしょうか。この規則が定められた理由として、あなたは「建造物内における不注意な人物や可燃物の存在を管理する目的」をあげておられます。さらに、この理由
39,ことは、このシロは新羅ということを、わざわざ書いてあったのである。それを不注意にも白い色と考えて疑わなかったから、全然新羅の話だとは気づか
40,価値観に惑わされ、真の愛情を家族に伝えることを忘れています。親の不注意によって、子どもが死亡した事件を新聞で拾い上げてご覧なさい。それでも周囲の人々は言う
41,非がある。どうして謝れようか」というわけだ。裏を返せば、乗務員の不注意からミスが起きた場合でも、「いいよ、いいんだよ」ですますよう
42,もしないで、なにかことが起こると、いつもわたしの「ミス」「不注意」にする。アラスカで過ごしたこの二年の間に、わたしはすっかり「だめ人間」
43,乾燥し、１年で最も山火事が起きやすい季節です。山火事の多くは、火の不始末や不注意によって起きています。火の取扱いには十分に注意し、貴重な森林資源を山火事から
44,のことは心配しないでくれ。たまたま一緒に連れて来た若いのが、波乗りの不注意で流されてしまっただけなんだ。潮の流れを読めなかったらしい、本人の
45,及ぼす影響の方が、より明確に現れるようだ。実際、ある研究結果では、不注意は、読字・読解成績を左右する最も大きな要因の１つとされている（Ｒｏｗｅ＆Ｒｏｗｅ，千九百九十二
46,昨日、私の不注意から、まぶたの上を植物用の支柱で指し、表面の皮膚をめくるくらいの傷
47,が、日本は含まれておらず、日本政府は強い不快感を示した。アメリカは〈不注意によるミスだった〉として、日本など２ヵ国を追加した改定版資料を二十七日に発表した。
48,ｉＰｏｄを自分の不注意で落としてしまい、画面にヒビが入ってしまったんですけど、この場合は保証が効く
49,には学生など勤労実態のない人が加入していたケースもあり、「不勉強」「不注意」では説明がつかない。さらに、かつて財形商品のうち、住宅財形だけが営業成績へ
50,から、なけなしの金を出してしてもらった古賀液の注射は、田舎の医師の不注意から静脈を外れて、激烈な熱を引起した。そしてＵ氏は無資産の老母と
51,これは証明できていない。もし証明できないのなら、中国政府および朝日新聞は、故意かまたは不注意で日本に濡れ衣を着せたことになる。繰り返すが、中国人が「南京大虐殺」をすぐ
52,、風呂場で水に浸けたりしているうちに、不注意で溺死させた」「不注意ですか」「頭のおかしくなった人を、正気に戻そうとしていた
53,も同じだろうと思う。そして私たちは、下山ルートについてこの後、もう一つ重大な不注意を重ねたのである。雪雲に追われるように下りを急ぎ、吊尾根分岐点から八本歯の鞍部
54,ウィーン博覧会の会場に２台の発電機が並べられており，そのうち１台が稼動していた。不注意な職工が，止まっている発電機の針金を動いている発電機につなぐと，止まっていた
55,。第２種，第３種方式で注意すべきことは，送風機の近傍に換気口を設けたり，不注意に近傍の開口部を開放した場合に，短絡を起こして，送風機と近傍開口部の間
56,と行動抑制の問題のせいで、生徒の学習に対するアベイラビリティ（有用性）が損なわれ（不注意のため、講義の重要なポイントを聞きのがすなど）、その結果、成績不振が悪化する可能性
57,を知っていたので出来るだけ良い環境で数ヶ月飼ってきましたが、人間の不注意とはいえ、電気コードをかみちぎったり、振る舞いも全然可愛くありません。自分が可愛いと思え
58,を述べる程度にし、すぐにお詫びに入る。言い訳はせず、二度と不注意のないことを誓うこと。子どもが友達の家で粗相をした場合は
59,に胸をなで下ろした。７月はリーグ月間ＭＶＰを獲得するなど絶好調で星野ジャパンに合流。それが不注意ともいえる風邪での離脱は、日の丸を背負う一員として体調管理不足を指摘されても
60,のが悪いって言うんだべか」「そうは言ってないよ。本人の不注意で起こったことだから欠課になっても仕方ないでしょ、って言ってるだけだよ
61,フレームなし（レンズだけのツーポイントタイプ）の眼鏡を５年間使用していました。不注意から壊してしまったので、取り急ぎ同じ条件でセルフレームの眼鏡をフィッティングなしで作ったのですが
62,て歩行中、Ｂの運転する自動車にはねられ、怪我をし、入院した。Ｂが不注意であることは明らかであり、ＡはＢに対して損害賠償を請求できるが、Ａは、
63,１）アカデミックスキルの問題のせいで、ＡＤＨＤ関連行動が現れる、（２）ＡＤＨＤの行動症状（不注意、衝動性、過活動）のせいで、アカデミックスキルの獲得や成績に問題が生じる、（
64,が詐欺に当たるのは確実」と述べながら、「しかし原告（被害者）にも不注意があったから、過失相殺により、弁償額は七割とするのが妥当」という考えを
65,の取りようがありません」と言うための布石としか思えない。「客の不注意を当社のせいにされるのは迷惑だ」とホレ、喉まで出そうに
66,を消していたのだ。友介が高校生の時である。自殺する理由はまったく見当たらず、不注意で海に落ちたとしか考えられなかった。昼食時に姿を見られていて
67,用心森の恵みを未来まで」山火事の原因のほとんどが、ちょっとした不注意から発生しています。特に春先は空気が乾燥しているので、火の後始末には
68,かの解決法は与えてくれるでしょう！しかし、生でされてもあなたは自分の不注意でもあるって事を前提に考えた方がいいと思いますよ！不倫相手が
69,職権証拠調べをなすことは、行き過ぎた職権主義となろう。ただし、検察官の立証行為にあきらかな不注意があるような場合には、検察官に立証をうながす限度での義務はある（
70,。それ故に、失敗の原因を省ることはできる。ところが、ボタン操作の失敗は不注意という言葉でしか対応できない。しかも、子どもでも誤らないミスとして処理される。その
71,ｍｅｇａ‐（ｍｅｇｏ‐）は百万を表します．重複略語を用いるときは，不注意に語を重複させてはいけません．略語や記号が意味している語に注意し
72,。フレイザーは静かに立っていた。グレイは若く経験不足ではあっても、不注意ではない。それに、人間というものがわかっていないわけではない。囚人の頭が心
73,現在では考えられないような事例である。しかし、注射液のガソリンはともかく、不注意の重なり合った事故の本質的な部分では、同じようなところもあると思われる
74,仕方，衣服の選択や着脱などの基本的な日常生活の技能を習得していない。不注意，多動，衝動性から生じる行動の特性で，わざとやっているわけではない。同時にいくつ
75,とＡＤＨＤの関係として１つ考えられるのは、アカデミックスキルの障害のせいで、最終的に不注意や衝動性、及びそれらに関連する行動上の問題が現れるというものである。この仮説を最も
76,は相互的なものである可能性があるが（つまり、読字・読解成績のレベルが、教室での不注意に影響を与える可能性もある）、ＡＤＨＤが成績に及ぼす影響の方が、より
77,、道路に落ちてきた岩石により自動車が転倒した場合などは、たんなる運転者の不注意にとどまらない事故であるといえます。そこで、このような場合には公の
78,の問題が関与しているように思われる。そういう意味でいま改めて、「礼儀正しい不注意」や「自由に移動する視点」が視覚を支配していた時代に想いを馳せること
79,、物に対する権利ではないから物権でもない。しかし、Ｂの運転する自動車がＢの不注意で私に怪我をさせたときには、私はＢに対して損害賠償を
80,大丈夫なんでしょうか？私も犬を飼っているのですが、まったく同じです。私の不注意なのは分ってはいるのですが、我が家の犬は激烈にいやしくてバックの
81,資質などについて売主が知っていたのにこれを告げずに売却したときや、不注意でこれに気がつかず売却したときは、瑕疵担保責任を負う場合がありうることも
82,ある，２：しばしばある，３：非常にしばしばある，の４段階で回答）〈不注意〉１．学校での勉強で，細かいところまで注意を払わなかったり，不注意な
83,十一人であるから三人がまだ不明である。重傷の九十一人も大変な事故数であるが、「不注意と生意気」を理由にしている点に、県官僚の無責任ぶりが表現されている。
84,愛の祈りは情愛のこもった調子で先導されます。司祭が決まりきったものとして不注意に始めなければ、信者は祈りの言葉に注意をはらいます。司祭の先導の
85,に対してご丁寧な返事を頂きました。父親として感謝いたしております。私の不注意で車の車検証の名義が妻の名前のままで前回の車検を済ませてい
86,に対する警告なのである。とはいえこのような多くのお守りにもかかわらず、油断で、あるいは不注意で、依然としてさらわれる者はいる。マン島には、「フェアリッシュ」
87,のヒコーキや竹馬、それから小さな鳥）竹ひごや木を小刀でけずっている時に、不注意のせいで指がすべって小刀の刃がてのひらをすっぱりと切って流れることもあるし
88,守るために隣近所の協力体制をつくる火災の原因は、放火を除きほとんどの場合、不注意や不始末で、日頃の心がけで防ぐことが可能です。もし火災が発生してしまったら
89,の固定、スポットライトの固定、展示台の安定等々を忘れないこと。地震時や子供の不注意から作品が守られること。●作品が運ばれるルート安全のためルートは最短
90,た。それで頭を冷やすため、風呂場で水に浸けたりしているうちに、不注意で溺死させた」「不注意ですか」「頭のおかしくなった人を
91,か。」「戦場だぞ、パッパカ。」と、マート＝ブランカは自分の不注意を点検するような顔でいいました。「武器の使用は、各自の判断で
92,）というインターネット・サイトもリストにある。このサイトでは、「十年から二十年以内にモンサント社は不注意にも無意識のうちに、大規模な飢饉や世界戦争を起こし、現在の文明を破壊し
93,朝を迎え、何も手につかず食事ものどを通らず、ただ自分の不注意が招いたことに涙が出るばかり。新聞の掲示板にも載せ、多くの
94,は、いまだになくなってはいなかった。そのとき、ドリッズトは、自分の不注意にくちびるをかんだ。苦手な昼間だったとはいえ、茶色い夏毛におおわれた
95,の男にはとても考えられないことだったが、はしけからの荷揚げ作業時、おのれの不注意から重いなにかの荷がサイクスの右足に落下するという事故が起きた。激痛に
96,要するに酸素ガスと亜酸化窒素ガスの誤選択であるが，どうして起こったのか考えてみた．筆者の不注意であることは間違いないが，誤選択した原因は複数あった．当該麻酔器は旧式であり，当然
97,で心臓の手術をした。順調に回復していたのだが、私の悪童さながらの不注意により、心拍停止が十時間余も続き、死線をさ迷っていたのである。名医須磨久善先生（現・葉山ハートセンター院長）により
98,作戦会議に初めから呼んでいたらよかったかも知れません、呼ばなかったのは不注意でしたと申し上げた。これに対して別の人達はこう言った。「いや、侯爵
99,があるだけだった。スタートの号砲の十分ほど前、若いクルーの一人が不注意で落水したものの、直ぐに救助して、集団の風上側から絶好のスタートを切った
100,、できればスピードを落とすことが推奨されているという程度の意味なのだ。ところがインド一番の不注意な運転手でも、衝突回避の巧みな技を見せる。ぎりぎりのところで怒りとブレーキ
101,、父親に運行供用責任を追求できる場合もあります。また、父親の監督義務の懈怠（不注意）と加害者である未成年者の不法行為との間に相当因果関係が認められるときには、加害者
102,ところがしばらくすると、女は起きあがった。それを見たハンターは安堵のあまり、不注意に足を踏み替えた。音をたてるなんて彼らしくない。自己嫌悪に陥って顔をしかめ
103,駐車場から突然飛び出してきた乗用車に突っ込んだのだ。事故の原因は、乗用車側の不注意によるものと断定され、示談に応じた結果、百九十八万円という損害賠償金を手にしてい
104,生き生きとした美しいアリスの姿が、月の光に浮かびあがった。「あなたが不注意な人だというのはわかっているわ。でもそれは、あなたご自身のことになったとき
105,、国保または後期高齢者医療が相手側に請求することになります。第三者行為とは？事故などが本人の不注意によるものではなく、本人以外の行為によって発生した（加害者などがいる）ものをいいます
106,のでコンビニ等で払ってくれということで振込用紙（はがき）が郵送されてきましたが、不注意で期日までに支払いできませんでした。３日前が期日でした。今からこの期限
107,のなかにおける高齢者の事故原因は、日本の家の構造からくるものと、高齢者の不注意からくるものの複合と考えられる。安全・快適に暮らそうとするなら、それなりの創意と
108,衡平の観点からみて保険者を保護することが相当でないと考えられるような保険者の不注意を指す」と述べている。その後の判例でも、これと同趣旨のことを
109,もっと難しくなるかと思われる。故意に偏った報道や、検閲、果ては不注意によってテレビや新聞・雑誌が私たちの現実観をいかに歪めてしまうか、これについて書かれたもの
110,なるほど、そういうことだったのか。でも、いくら夕方でうす暗かったにしても、ずいぶん不注意な人だなあ。」祐也が半分は感心、半分はあきれたようすで言い
111,だった。悲鳴とうめきと苦情が不思議に重なる日でもあった。看護婦たちの不注意もなぜか多かった。血液を採取する患者を間違えたり、急に必要になった
112,に出勤するために、手順、方法など段取りよくしなくてはならないし、自分の不注意で同僚に迷惑をかけることのないように、健康管理には気を遣う。
113,から控除すべきか否かも問題となる。損害賠償額の減額は被害者「側」の過失（単なる不注意）が損害発生又は拡大に寄与した場合にも行われる。これを過失相殺という（民
114,うち、失火による火災が３万八千九百十五件（六十八．九％）で、火災の大半は火気の取扱いの不注意や不始末から発生している。第二十五表出火原因別出火件数（１）「こんろ」による火災が首位
