,0
225,はすっかり「壊れたら買い換えればいいじゃないか」の世の中である。いわゆる「通俗科学」に対する不満も述べられているが、これは現代ではすっかり改善されているだろう。断水の日
226,今回のメンバー入りはならなかった。これだけ活躍しているのになぜだ？？？？不満が残る結果です・・・。
227,」を合わせると五十七％だった。一方「不満だ」と「どちらかといえば不満だ」を合わせると三十九％で，選挙結果には「満足」と感じている人の方
228,たのだと感じ、文化にたいして敵意を持つようになる」（「文化への不満」、『フロイト著作集』第三巻、人文書院、四百六十三ページ）。２脱セクシュアリティ化される子ども「子どもらしさ」
229,、全然危なくありません」空になったグラスを突き出して恵理は、ますます不満そうな口振りになる。「そうすると恵理は、俺と危ない関係になり
230,てくれてもいいじゃないか。気遣ってくれる素振りくらいみせてくれてもいいじゃないか。そんな不満が、僕の中にはもう長いことくすぶっていたのだった。こんなこと絶対口
231,御苦労さまです」と言いたくなりますが、同時にこの人の御主人が彼女への不満をじっと耐えているだろうと想像せざるをえません。なぜなら彼女の心の大きな
232,と思っている人がいる。人からいい人だと言われているのかもしれないが、不満が積もり積もって最後は身体に出たり、行動に出て、キッチン・ドリンカーになったりする
233,は、自分の依頼人に言い渡された実刑判決が重すぎると考えているらしく、その美貌に不満の色を露にしながら、固く唇を結んでいた。Ⅳ悪霊のワードプロセッサ
234,、ケアマネジャーはケアプラン作成などの事務作業に忙しく、利用者と事業者の間に立って不平や不満を解消する余裕はない」と指摘する。そこで同財団では、国のモデル事業の一環
235,た。また，柑橘に対する不満として，高学歴者からは比較的，「包装単位」への不満が高く表れている。中卒者以下では「表面と中身の違い」や「貯蔵期間（腐敗果実
236,いう。「加えて、正規軍には定年がないため、ポスト不足から将官クラスにも不満が生じている。金総書記が軍の視察をひんぱんに行うのも、不満を抑えるため
237,日夜そばにいて躾をなすのが武家の慣いというものであろうに、と一旦不満を募らせるとますます心は波立ってくるのであった。篤姫は、ひとまず下らせた
238,のもこの間の内部対立の反映である。千九百八十九年三月、同盟内部に残っている官僚主義的性格に不満を抱くアナトーリイ・プリスターフキン（小説『金色の雲が宿った』の作者）らを中心と
239,女房が縁側から見守るという、まさに絵に書いたような光景だ。僕はまったく不満がなかった。子供も小学校の低学年だったから、こういう生活がいかに子供達
240,夫に対する不満を実家の母にもらしたら、「あんたは、相手（夫）に多くを求めすぎ
241,ダブって別スレ立ててしまいました。ちなみに今は「疑問」ではあるものの「不満」ではありません。育った環境により二人で答えを出せば良いんだな、
242,から、彼らの戦略爆撃が無差別化し、その「目標変更」がはっきりするのである。ハンセルの手法に不満をもったアーノルドの司令部は、まずハンセルを更迭し、カーチス・Ｅ・ルメイ少将を起用する。ハンセルはグアム
243,解決のために独創性を発揮してくれるものと信じている。「生成たちは冷たい」と不満を口にしていた生徒も、まもなく「先生、何もいわないで
244,頭越しに中米への戦艦ニュージャージーの派遣に踏み切った。このことに対してシュルツ国務長官はレーガン大統領に強い不満を表明した。クラーク補佐官は、カリフォルニア時代からレーガンの側近であった人物であり、これと
245,満足（二十三％）、その他〈分析〉約半数が「仕方ない」と答えたが、不満の具体的な内容については、「金額が少ない」「配分が不公平」「職業あっせんが
246,で行われ、抵抗の様態も多様なものである。中でも中央政府の指示収穫地価に対する不満は、米価低落による金納の苦痛を加速し、千八百七十六（明治９）年に、茨城・三重など
247,ないといい、いつも能力以上の要求をします。テストや成績について、いつも不満を示し、「これしかできないの！」がきまり文句になっています。
248,な物の見方を身につけ、西欧に感化されて、やがて宮廷の現状に不満を抱くようになるのではないかと危惧したためであった。たしかに最後の部分について
249,ません。結果として、ロバートの言うように「充分に情報をくれない」という不満が双方に蓄積するはずです。異文化環境では、時にはしつこく自らの立場を
250,ました」ゲーリングが鷹揚に手をふり、ついで従僕をさがらせた。ゼークトが不満を押しころしたように退出していった。「そのことはもういい。それより空閑
251,結局国民の納税である「アメリカではこれまで多くの国内暴動が有った。国民の不満特に差別された人々や貧困層の人々の不満が爆発した時には、暴動が
252,確かにそうかもしれない。ただし、冴木インヴェスティゲイションの周囲をのぞいてだ。「不満か？」親父が、僕の手のバドワイザーをすいとつかみ、プルトップをつまん
253,意味で世界が広がったのかなと思います。だから私自身としてはゲームには不満はありません。こんな回答で、よろしいでしょうか？
254,部は最近じゃんけんで負けたほうが攻め役です。このところじゃんけん負け続けで不満が爆発しそうです。どうしたら勝てますか？交代制にすればどうですか？
255,なかった。わたしは、工事の進捗状況と問題点を知りたかったのである。工事関係者が不満に思う点はないか、なにかわたしに伝えることはないか、実際のところ
256,としてボランティア介護相談員を育成している。ただ、堀田氏は、こうも言う。「以前は不満があっても口にすることすらできなかった。苦情が出てきたのは
257,ミスタ・イシクラ、正直いってこれは日本でもいちばん安物の棺なんだろう」若手社員の不満を代弁する格好で、ヒュームはそういって石倉に迫ってくるんです。「そう
258,まき散らす権利はない。くれぐれも癇癪を起こさないように。相手を責めたり、不満や軽蔑を態度で示すことは暴言を吐くにも等しい。暴言を吐いて他人
259,定時総会方式というのが、毎年毎年定時総会で自己株式取得枠を決議しなくてはいけない、これは大変だという不満が経済界からありましたので、今年の改正で、いわば定款方式という形、定款で
260,原因なら、剛平が闘えばいいのだ。悪平が勝手にことをおこしてしまったのも不満だった。ケンカに勝てば悪平と剛平だけが得をし、負ければ祐太は
261,、中学生らしき女の子が二人、寂しく、花火をやっているのが見えた。なーんの不満もない読谷やちむん紀行那覇空港に降り立つと、十月の終わりだというのに日差しが
262,やはりなｗメイドガイは今日が最終回でした…いや全く終わらないし、何とも不満が残りましたがね。変な敵が出てきたけど謎のまんまだし
263,二十四時間拘束されているわたしとしては一言二言でもいい、会話がほしい。これではいささか不満である。それでも、わたしの半年も切っていなかった髪の毛をきれいに散髪してくれた。
264,（上）白２から７まで（白６つぐ＝２の右）。これが不満と見ての研究手順か。当然の黒二十一に白二十二の手筋を放ち、
265,初級どまりで上級への道がなく物足りない、資格や免許の取得に結びつかないなど不満がうっせきしている。その意味で、放送大学は特定の科目や科目群を選択的に履習できるなど
266,特にキヤノンですよね。トップメーカーとして、どうしてなくしちゃったのというのは、非常に不満に思いますね。そのわりにＦ‐１復刻の票が少ないのは不思議ですけど。竹中
267,な口調で話し始めた。「だからそんな言い方をされるんですね」将軍は不満そうな表情で話を続けた。「わたしにはベルリンに残してきた妻
268,の交渉の中でシングル・アンダーテーキング、つまり一括方式というものがとられて、農業問題については極めて不満であるけれども、しかし全体として一括これはイエス・ノー、こういう状況になれば、我が
269,なり、運転席の前に大きな拭き残しが出たり、シートが助手席用となったりと、不満は多い。
270,まずロールについて基本的な考え方の説明を受けた。「ロールが大きい」という不満を耳にすることがある。確かにロールをすることで不安を感じることも
271,が主に精神的に不満や欲求が大きくて消化しきれないときに見ました。肉体的な不満を抱えてるときはほとんど見ませんでしたね。。。そういうときはその
272,ことは、相手を思いやる事と協力性。これは互いにもっていないと喧嘩や不満がつのるばかりですよ。毎日一緒にいるからこそ、互いに負担を感じる存在で
273,とへつらいのまなざしであり、意趣を晴らす機会である。中国では、一般の人民が不満を吐きだす場がほとんどない。国全体が、まるで釜のなかで蒸気圧がどんどん上がるよう
274,教室はあまり感情的にならぬよう客観的に見るよう努めました。ドラゴン桜は長谷川・山下が不満でしたが、原作が好きなので全部見ました。見ていないものをつまら
275,ではＦトヨタ育ちのルーキーふたりが自己最高位を更新。３横溝＆モンティンのスリーボンド勢はパフォーマンス的には不満が残る週末となったが第十四戦で表彰台に。最終ラップ２コーナーでのアクシデント。オリベイラ（
276,やっぱり参加する側としては、当日それと知らずに「えー！！」という不満の声を少しでも減らす為に、コミックマーケット準備会からの緊急のお知らせ私もリンク貼っ
277,かはわからないのだが、いつもそうだ。よいところはだいたい忘れてしまって、不満のあるところだけよく覚えている。なんとなく不思議なものだ。とにかくそのよう
278,そうしていたが、どういうわけか、今朝はしおりさんが遅刻してきたと、不満に思っていたようだ。「人を悪く言ってはいけない」と私は言って
279,割合は全体の五十％で，不満な人は四十％弱となつている。施設別に何が不満かを聞くと，五十二年の調査では，病院（七十二％），保育所（８％）
280,には、外国人、ホームシック、どこから見てもインテリ、いまの生活と仕事に不満、そう思ったのよ。でも見込み違いだったわね。葛藤がないんですもの！
281,で見ると，町村が他の都市規模のものと比べて低くなつている。また，不満だとする者に，その内容を聞くと，１（収集に）来る回数が
282,たということでしょうか。けれどもその後政府が取った方針は、武士たちの不満をガス抜きしようとした西郷版「征韓論」よりも、ずっと血なまぐさいものでした。まずヨーロッパに
283,いうことになりますね。そのようなルールが明記されてないのが、この知恵袋の不満なところです。
284,や造形的な意図に対して脱帽しながら、一方では認めがたい自分の虚ろな眼差しの表現に対する不満、さらには憤りを抱いている自分がいた。二つの相反する感情がゴッホから言葉
285,な哀れさ！スラム育ちという経歴がハレーの羨望を明確に説明している。ハレーの不満は日毎にはっきりと膨らんでいる。これで、その理由がわかった！ハレーの
286,て、戦前の日本を現在のネガとしてだけ理想化していることがはっきりうかがえる。現状に対する不満が、統一した像もないナショナリズムの支持を拡大していると言えよう。私はそう
287,だった。ウルフォウィッツ自身も昨年秋、日本でイージス艦派遣が政治の波間に沈んだことに強い不満を抱き続けており、イージス復活のチャンスを探っていた。二人はイージス艦の派遣に言及して
288,に連れ帰り、二時間後に病院へ運んだようです。こういった女性の対応を不満に思います。なぜすぐ病院へ連れて行ってくれなかったのでしょう。命にかかわる場合
289,に乗車。いずれもＥ二百三十一でしたが、どうもコンプレッサーからの除湿音が激しい。不満を抱きつつ大宮へ。ここからはこれに乗ります。朝に倉賀野で撮った
290,た三十三万二千余町歩のうち民地編入はわずかに三千余町歩、他はあげて官地となり、農民の不満は濫伐・放火の抵抗となってあらわれ、資源を破壊し災害原因となった。しかし政府は
291,、荷物を濡らしてしまうだろう…」誰もが心身ともに疲れ果てていたが、不満を言う者はなかった。彼らは家屋を建てるのにふさわしい場所を求めて、
292,父の残した言葉を引用している。定職もなく病弱で、上級学校に進学できなかった不満を口にし、社会体制の悪を批判する寺島に、百姓の父は「自分の
293,出させたら、後は用済みのように扱う。ロシア人も２、３年で入れ替え、日本人技術者も不満を言って辞めていく人が多い」「しかも大リストラのせいで、愛社精神は薄れ
294,するが寸前で呪いが発動し、皇帝の兵士諸共陶器になってしまう・・・設定が大変不満だぁ、中途半端な歴史に解釈に。皇帝ってたら始皇帝になるはずだが？
295,も決して捏造したものではない。手紙には、女性ならだれでも抱いてしかるべき不満もつづられていた。それは、すべての手紙のなかで一番悲しい手紙だった
296,また前節で述べたように、あくまで広東貿易制度を固守せんとする清国側と、それを不満とする会社管貨人をも含めた現地在留イギリス人との間に、異常な緊張状態が醸し出されている
297,もは色んな体位してるけどたまにバックだけ、ってならイイですがそれだけで終わるなら不満ですネ。バックって、顔も見えないし、男だけ気持ち良かったらイイの？
298,の造営や貨幣の発行にも着手した。しかし公家優位の政治や恩賞に武家の不満が高まり、護良親王と尊氏の対立が激化、北条氏一族の反乱が各地で頻発するなか、
299,親から『百姓に学問がいるもんか、ばか者！』と言われ、それを不満に思っていました。母は顔立ちが美しいのに、ちいさいころから病弱という不運
300,ことでおかしな差別が生まれたようですもちろん過酷な労働を強いられた農民達の不満をもっとひどい境遇にいる差別民とくらべて溜飲を下げるという意味も大きかった
301,上昇をみせ（第Ⅰ‐１‐五十一図参照），特に住居費の上昇は著しく，国民の不満が高まった。このような状況に対して政府は，金融引締め，物価統制等を行ったが
302,の中に落着かないまま曖昧にうなずいた。すると彼は、ぼくのその曖昧さに不満なのか、ちょっと身をのり出してぼくの顔をのぞきこんできた。「ほんと
303,単なる交通手段にとどまらず，自動車等の運転に伴うスリルやスピード感が，欲求の充足や不満の解消手段として魅力あるものになっており，暴走族の存在や道路交通法違反の違反態様において，成人
304,て、恐ろしさにおののき、しかし三年間これという命綱の準備はできていないということに不満を持っております。大森、蒲田、以前はこうした夜の発着に反対を
305,弁護にまわり、自分も政府の再建や環境保護といった大事な問題をめぐるスタッフたちの態度に不満を感じていると述べた。大統領は気のない返事をした。「ロシア
306,せっかく、いい体勢になっているので、もっと速く出られるようにならないと」と不満を漏らすように、好調時の動きには戻っていない。「あと一歩が出
307,は、「その日に撮影したフィルムも見せてもらえず、アイドル扱いされたんだ」と不満そうだったが、それでも名優シドニー・ポワチエとの共演にいたく感激もしていた。監督リチャード・ベンジャミン。
308,何も知らない。なのに、やらなきゃならないって訳だ」アドリアン・モーリスの不満は、もっともに思えた。マリエールは困って、うつむきながら本当のことを言った
309,なえ」「もうちっと後でな」「そうかぇ」鐐之助は不満そうだったが、平太夫はいつものように遅めに連れて行った。
310,が沸きません。原因はなんでしょう。若い世代の皆さんは、今のゲームに不満がありますか？それとも大満足？ついていけないだけなのかなぁ・・。
311,か考えてみましょう。いら立ちの原因は子ども以外にあることが多いのです。現状への不満があるのなら、それを改善していく努力を惜しまないように。●夫婦間のトラブルは
312,、「正しく教えられないと分からないのが部落問題です。さまざまな差別はストレスや不満などからも起こります。家庭や地域の居心地の良さは子どもの人権感覚をはぐくみます
313,，自らは介護を必要と思っているが自立と判定された場合などの不安，不満が残る。医療保険福祉審議会老人保健福祉部会は，介護保険で自己負担が高額になった場合に費用が
314,部屋ですが、「引っ越そうと思う」と大家さんに告げたところ「どうして！何が不満なの！」とすごい剣幕でした。なぜ、って・・・・。ダストシュートを
315,のもとに成立した詩なのか不明であるが、末尾には何か慎庵の不満をなだめるような口吻が感じられて、玉山が藩儒として重用されることに不満を
316,発言中のやじなど、会話の基本中の基本ができていない人がいた」と不満を口にした。また「冷静に話し合えない姿を子どもに見せたくは
317,はじめの二冊の『ものぐさ精神分析』とその続とを読んで、やや不十分というか不満というか、そんなところもあったのですが、それはともかくとして、岸田さん
318,第１章でみたとおりであるが、個人に対するアンケート調査でも、休業取得後の人事上の取扱いに対する不満は「特になかった」とする割合が多数を占める（図３‐５）。
319,にとってはハズレです！満足感なし！お店の批評をするつもりはないのですが今回はかなり不満なので書きました！美味しいお店探しは他人を信じてはいけないですね！
320,の中に隠してから、腰を下ろして一休みした。そしたら、トムが不満そうな顔でこう言ったよ―「ちぇっ、今度の仕事はまったく楽すぎて
321,劣るのでしょうけど、今でも、不満が全くありません。初めて乗ったときに不満を感じなかったため、いまだに不満がないんです。（だから七千九百も触らないよう
322,に、主賓の席に坐らせる。「さあ、美砂さんも。紙谷さんの横じゃ不満でしょうが」それでまた爆笑がわく。笑いのなかで、紙谷と美砂は
323,二人の関係が疎遠なのに、余り深入りした話題にまで入り込むと、相手の不満を昂じさせ、危害を加えられるはめになる。他人が余りしたくないと
324,下だ、パーセル！先に行くんだ」「なぜ？」長身の男は不満をあらわに、「やっとここまできたのに」「点検ロボットのやつ、おれたち
325,たのはどうしてでしょうか？選手もある程度身分が高くなるとマッチメーカーや経営方針などに不満が生じならば自分でやりやすいように団体を作った方がいいという訳。昔
326,」祐美があっさり答えたので桜井は憮然。男として警戒されないのも少々不満なのだ。そんな桜井、またエサだけ取られて魚を逃がしてしまった。そして
327,家庭が、大事な原点が社会教育の一部に小さく書かれているとか、いろいろな不満が個人的にはないわけではないのです。そういうことが一つ。第二点は、まず価値
328,ない妊娠をし、子どもが生まれ、生まれてからは、夫が育児に非協力的で不満に思っていた、と話してくれました。シンヤくんの場合は、三つの理由
329,が、休暇の取得が連続三カ月に限られているところに、もう少し改善できないかという不満があります。これは、もちろん三カ月でなしに六カ月とか一年だったらいいのは
330,にいって１ｓｔ版、ゼータ版と全部揃えたんだけど、この「シャアコレクション」は個人的には不満だねぇ。ガンダムシリーズ史上、ＮＯ．１の人気を誇る「シャア」だからねぇ・・・
331,はここまでと区切りをつけて横に置く全部をこなそうとする無理は不満の心を生んでしまう多忙に心を亡ぼされないように自分の時間は自分が
332,に来るので予定が立たない」など、あまりにも古典的な“婚家への不満”が書き連ねられていた。彼女の場合、おそらく途中から自分の人生に入り込ん
333,か？配偶者への不満が外へ目を向けさせる場合もありますが、そんな不満はないのに、素敵な人に出会ってときめいてしまう場合もあるでしょうから・・
334,消費者からみた介護保険Ｑ＆Ａ』中央法規出版，千九百九十八年，二百四十七ページ。このような利用者被害に対しては，不満や不服を申し立てる相談窓口の設置や利用者のところへアウトリーチしていくオンブズマンの導入などが必要
335,♪う〜む、カッチョヨス・・・。いつもの小池画伯のパッケージにはなんの不満もないのですが（・・・というか世界最高峰のパッケージアートだと思ってますよ
336,不満の多くもここに集約され、不自由さを訴えるケースが多いようです。留学生の不満の多くは、また中国人自身の不満の種であることも多く、したがって中国政府もこの問題
337,は女に言い寄られて魔が差しただけで、恋愛感情はなく、奥さんにも不満が無いとして・・・２回目もやれば直らないでしょうね。今回のは
338,た。強化されたのは青年部員だけではない。当局に協調的な姿勢の執行部に不満をもった組合員が、調教などで「十日会」「木曜会」という集まりをもつよう
339,が目を回してしまうような処があった。スナイプス兄貴のアクションも少なくて、不満だったなー。作品の舞台はルーマニア／ブカレストということになっていたのだけど、
