,0
113,とアルバイトを両立させがんばっていたのだが、学園のアルバイト代の保管の仕方にだんだん不満を言うようになった。京子にしてみれば、自分で稼いだアルバイト代はすべて
114,で不満とする者が多くなつている。四十七年と比べると，高校，大学等で不満が高まり，小・中学校等で低まつている。このことは，人々のニーズが義務教育施設の整備水準の
115,のあいだ尚書を勤めたが、未だに宰相にはなれない。その口ぶりには不満の響きが聞きとれた。「陳孚恩は単なる抜貢（十二年ごとに各省の学生を選抜し
116,が悪い。まず、活動の中に、「業績という概念」が存在しないことが不満であった。ボランティア活動では、組織の中で、誰が優秀な人材なの
117,あなたは，今月行われた衆議院選挙の結果に，全体として満足していますか。それとも不満ですか。これから読み上げる４つの中から１つ選んでお答えください。―自民の議席増の
118,雅子妃の体調が悪いという相談は以前から受けていました。外国に行けないから不満だとか、遊びに行けないから不満という低レベルの話ではないと思うんですね。
119,で、三庁統合するのは、沖縄振興開発を中途半端に終わらず結果になるということで強い不満、反発が出たことは御承知のとおりです。私どもも沖縄開発庁のこれまで果たしてき
120,よく契約にサインさせるしたたかなやりかただった。また、彼が提示した金額が不満で、契約書を細かく引き裂いて送り返してきた選手に、前の提示額より五百ドル減額した
121,を隠すという強いストレス状態に家族を置き、かつ患者の絶望や苛立ち、医療者への不満の解消など、患者の心理的精神的な支えとなることを家族に期待するなど、大きな負担
122,左辺は白にと二手かけさせている。黒１．３と新天地をめざして黒に不満はありません。あとは推移によって、黒ａやｂを狙います。【失敗定石】
123,話、不公平の感は禁じえないところだ。しかし、そのことだけを取り上げて不満をいうのは早計である。というのも、この州の人間にだけはとくに許さ
124,に慎重過ぎる保守的な性質である。田舎びとがだんだんと抱くようになって来た現状に対する不満や、さらに、これを進めて、現在ある秩序を打破して、新しい時代を展開さ
125,建設的な反省もない。これでは仕事ができるわけがなかろう。誰でも不満がある。奥さんにグチをこぼして気分がスッキリするならそれもいいだろう。酒を
126,てしまったのであった。天平宝字八年（七百六十四）九月、こうした太上天皇のやり方に不満を持った藤原恵美朝臣押勝は密かに兵を起こす計画を立てた。しかしその企てはたちまち
127,た人物像として、彼をすんなり受け入れることができる。いつも不機嫌そうで、何かに対して不満で、それでいて、心の奥に、純情のカケラをキラめかせている。
128,・・人それぞれって事です。私は現在四十二歳です。あなたも彼の事を不満に思うのなら、次を探してみたら？まだまだ、相手はたくさん居ますよ。
129,は良い子で陰で陰湿ないじめをする子が居ます。多分何かが不満で、解消しているのかそれが楽しいのかは本人にしか解りません。大人
130,を終えて帰宅し、母親に「ゴールキーパーは嫌だ。サッカーをやめたい」などと不満を漏らした。これに対して母親が「やめたらみんなに迷惑がかかる」などと言っ
131,過食をしてしまう「イヤなことがあると／不満なことがあると／思い通りにならないことがあると、過食をしてしまう」と悩む
132,、千八百九年にスウェーデンで始まった制度です。一般には行政の事務執行に対する利用者の不満や苦情をオンブズマンが受け付け、行政から独立した第三者機関として中立的な立場でその問題の
133,から自分の人生に入り込んできた姑や義理の姉、いわゆる小姑に対して不快や不満といったネガティブな感情を抱くこともあったのに、「“上流”の結婚なら義理ママと
134,は、プール、プールとせがみ、プールはできたが、ちいさいプールで、ぼくは不満だったが、小学校一年生になった年の夏から、ほとんど毎日、ぼくは汽車
135,に、ほえるようになるのだ。ただし、ほえるには体力も必要だから、あまり不満のないイヌは必要以上にほえないし、注意すればすぐにやめるのがふつうだ。
136,、肝心のルートのことについての地域住民への説得なり何なりは全く後回しじゃないかという不満があるわけでございますので、ここのところだけちょっと正確に、はっきり整理してお答えいただき
137,ことになっているが、ロシアは、他の共和国から自国の資源を「搾取」されていることを不満に思っている。ソ連邦の中核であるロシア共和国もまた、ソ連邦の解体への流れを勢いづけ
138,、枝管など専有部分が年平均４．２％と高い伸び率を示すと予想する。画一的な住環境への不満、インテリアやバリアフリー、シックハウス対策など、より快適性の高い空間に対するニーズの高まりとともに
139,殺人までおこなう兵士たちもいた。まるで占領軍のようにふるまう政府軍への恐れと不満と怒りがつのり、これではパンロン協定と憲法で保証された自治権など、何の
140,みんなで話し合って決まったことでも、自分の意見が反対なら、あくまで決定に不満をもらしても良いということになったら、民主主義は消滅する。集団のなかで民主教育
141,半年もすると飽きてしまい、週に１回か２回すればよくなってしまい、彼女は不満になってしまいます。女性は月日が経っても、同じ彼で飽きたりしない
142,住民が二十六．八％と合わせて三十三．三％，つまり３人に１人が満足の傾向にある。一方不満についてみると，「やや不満」が二十．四％，「不満」が二十八．五％と合わせて約半数
143,信長は得意の鮒、鯰のつかみどりをやろうというのである。八右衛門が思わず不満を顔にあらわすのを構わず、信長は座を立った。「伝左衛門、
144,ね」フィリップがクロンショーを下宿に連れて来てしまったことについても、アップジョンは不満を言った。「あのままソーホーに置いておけばよかったのに。あのみすぼらしい屋根裏部屋
145,にはなりません。問題は、不平不満というのは、そのほとんどが個人的な不満であるのもかかわらず、それを言う人は、大抵の場合、正直には言わ
146,た調査では、調査対象のうち収入が少ない人ほど、劇場の入場料が高すぎるという不満が多かったという結果が示されている。同じ研究報告で、舞台芸術に足を運ばない
147,た（プリモ・デ・リベラ将軍の独裁政、千九百二十三〜三十年）。やがて国王アルフォンソ十三世（在位、千八百八十六〜千九百三十一年）に対する不満が公然と語られるようになった。こうした政治的に不安定な状態を打開する
148,その他にもアリアを歌うシーンがあるが、もっとアリアを聴きたい向きには不満が残ったかも。改めてカラスのＣＤをお勧めしたい例えば「永遠のデイーバ」など
149,は電信会社の待遇や、仕事の内容に不満があるわけではなかったが、何も不満がないということは、そこで進歩が止まってしまうということである。考えようによれ
150,なると、権力者あるいは権力追求者が採用する常とう手段は「敵を外に求める」「国民の不満を外国に向ける」というもの。すでに有力政治家の中には、自分達の無能を棚
151,、『サーフィン型学校が子どもを救う！』（平凡社新書）という本で、今の学校システムに対する不満と、先の提言をベースにしたこれからの社会に合致した学校システムの見取り図
152,かなり不満な取引だったのですが、非常に酔いをつけ、コメントで「取引内容は十点満点で
153,は妻に家にいてほしかった。しかし妻は、自分の仕事が夫を不満に追いやっている、と知りながらもやめられなかった、とオオハラ・レイコは言っている。「
154,とうまくやっていく方法はあるんでしょうか」ある若手の社員に、このような不満をもらす人がいました。この人にアドバイスをしてあげるとするなら
155,た時は感動しました。七千九百に比べれば当然劣るのでしょうけど、今でも、不満が全くありません。初めて乗ったときに不満を感じなかったため、いまだに
156,自分に対する言葉遣いによって自尊心が傷つけられることへの辛さとのアンビバレントな感情があり，不満をいうべきか否かの戸惑いがあった。しかし，生活支援員とのかかわりのなか
157,心打たれた和歌観を聞いてみたい気がする。兼好はその頃の歌について不満を述べている。それは「表現に巧みと思わせる所があっても、表現
158,て寝るか」余雄はしきりと目をこする。「まだ早いじゃないか」宋世平は不満そうだった。店を出ると周囲から熱風が吹きつけ、三人は店に押し戻さ
159,ため，いったん休戦して明と講和の交渉が行われましたが，その内容に不満を持った秀吉は，再び出兵を命じました。日本軍ははじめから苦戦し，秀吉
160,進みましたが、少しつつ今の仕事に疑問を感じてきています。いろいろな不満を言ったらキリが無いですが、なによりも自分のやりがいを感じることができないということ
161,「ああ。ショーン・コネリーの００７さ。あ奴の黒ずくめに憧れたんだ」グレンジャーが少し不満そうな顔をした。「奴はイギリスのスパイだぜ。アメリカじゃない。
162,とか破廉恥な事するのかな？見たけど酷いねー虐待って性生活の不満が多くの原因らしいのは事実だね。
163,一人となっている。ペンシルヴァニア鉄道へ転職したときに、カーネギー少年は電信会社から「待遇に不満なら、今すぐ昇格と昇給をしよう」と言われている。しかし、カーネギーの言葉
164,、オーケストラの演奏に適さないホールがいかに多いかということであった。音響面での不満もないわけではなかったが、それ以前に、演奏する立場に対してまるで配慮がなされていない
165,は、内政の安定化に努めたが、九十年以降政治の腐敗、経済困難等に起因する国民の不満が高まり、公務員給与、学生奨学金の遅配をきっかけに公務員、学生等のスト・デモが頻発した。
166,の男じゃねえッ！」「では二人で共謀して殺ったか。何が不満だった？王にそこの男との関係を見咎められでもしたか
167,がましってもんだ。ベースボールにフットボール、バスケット。それでやつらに金をくれてやりゃ、不満も解消するってわけだ。筋肉を動かしてる間は脳味噌も使わない。戦争がおっぱ
168,が見つかったらしい。当面、突発的な決裂はなさそうだ。しかし、フランス国内には不満が増大し、万事が早急な決断を皇帝に促す方向に動いている。―全て
169,下に「様」をつけて書かれているから、すぐ先輩であることがわかる。不満もあったのであろう。こんな記述が見える。三月十日（日）雨暖がらん
170,ほっとした。３小さな文句を言葉で出す大切さささいなことだが、これを不満として口に出すことがどんなに大切か。過食症にかかる子どもは「ま、いい
171,，情報公開の理念と個人情報保護の理念の衝突を念頭に，行政機関は「公開することによって不満や不快の念を抱く者が出るか」を，具体的に主張，立証できなければ
172,もわかると、その現実を受け入れられず、怒りっぽくなったり、何をやっても不満に思えてしまう。どんなに理性的な人でも、死を前にして取り乱さない
173,て不満に思ったこと（複数回答）は，図１‐二十八のとおりである。「不満に思ったことはない」は三十六％と３分の１以上である。図１‐二十八過去の宿泊観光レクリエーションで
174,素晴らしいリーダーと見られていますか？●チームについてＱ十「チーム内にグチや不満などほとんどない」と胸を張れますか？Ｑ十一チームリーダーは、チームが何
175,たわけでもあるまい。それどころか、最近になると、輸入促進運動自体に対する不安と不満が現われてさえいる。輸入と競合関係にある業種の集中した地方から、「もう
176,あるが、彼が国防相に就任する際に意図的に階級を特進させたことが軍内で不満を惹起した、と伝えられている。軍人の閣僚登用は、実際には八十年代半ばから
177,で外国人排斥を信じていた士族は、新政府の西洋化運動や旧来の身分制度を廃止する政策に不満を募らせる。かくして日本が近代化へとひた走る中、政府に反乱を起こす士族
178,では、いくら娘盗賊団の首領とてむげには抵抗もできない。仕方なくおキキは不満そうな表情で、キラキラ輝く“石”の詰った箱をさしだした。金貸し
179,能力ある人の不満は、自分自身の不甲斐なさに向けられ、能力のない人の不満は、自分以外の人間や環境に対して向けられる人気を高めるなら結果を出すだけでなく、
180,。社会は、可能なかぎり、貧困、病気、犯罪を少なくし、不平等や不満を是正すべきだとは思います。その方が、社会はスムーズにゆくからです
181,マスメディアに対するさまざまな不信や不満を増幅させていく原因をつくる。目立った不信、不満の声は、過度の敬語の使用、聞えてこない天皇や皇族、その関係者らの
182,印象を与えかねない。それより「三カ月」と短期間に絞って、現状にどれほど不満があっても、そんなことはきれいさっぱり忘れ、いま自分に与えられた仕事に
183,は，銀行家など一部の富裕層のみが優遇され，選挙権をもたない中小資本家や労働者の不満が強くなった。千八百四十八年２月，選挙法改正の要求が拒否されると，パリで革命が
184,その劇団は、潜在的な「顧客」たちの多くはその公演に来なかったと私に不満をぶちまけた。明らかに反エスタブリッシュメント的な演目は、非エスタブリッシュメントあるいは脱エスタブリッシュメントの客を大勢集めるという
185,か？言えないということは私が差別してるのでしょうか？彼女は彼女なりに煮え切らない不満があるのでしょうが、言いたくても言えないあなたの気持ちも解ります。伝えなく
186,に、家族みんなをワンサイクルで養わなくてはならないプレッシャーの中、何か相手に不満を言われると、切れてそんな発言もうっかり言ってしまうかもしれないなとも思います。共稼ぎ
187,まで、いろいろな現場を経験したが、「自分で取材先を選べない」ことに不満がつのっていった。この頃から海外取材を夢見て、食事を弁当にして資金を
188,。幸せを呼ぶ口角が上がった唇「へ」の字の口もとは、何か不満があったり、不幸せな表情に見えてしまいます。リップをぬるときは、口角を
189,（評議員会で）反対に回るという無用な結果を見せつけられて、あきれた」と不満をぶちまけた。臼田は続けて「昨日も自民党の青木幹事長と参議院の問題を
190,、東條内閣を非難する声が強くなっており、東條に協調しすぎるとして、嶋田にも不満が集まっているのは知っていた。「お話の次第は、私にとって寝耳に
191,、黒人の権利となるとそれは概して黒人男性のための権利を意味している」と不満を表明した。女性の運動のなかでは、黒人女性の存在は明確ではなかったが
192,みたいに若くもないし、そっちの方の探求心も旺盛ではないから、別にそれで不満だったとか、未練が残るとかいうことはないさ。未練が残るとすれば
193,女友達（現在、大学生）とご飯に行きました。彼女は、現在の彼氏に対して不満があるらしく、話をされ、それに対して「どう思う？」と聞かれた
194,いつも、そう思って進んできたんだよ。止まって、不平を言ったり不満を持ったり、うかれたり。そんな場合じゃないんだよ、みたいな気持ち。いつだ
195,したいけど、やっぱり違うのか…。考えてみてください。海外に行っても不満なこといっぱいあるよ。ハワイに行ったって、日本人のおかげであれだけ観光資源が成り立っ
196,竹内参考人にお尋ねをいたしたいと思うわけでありますが、竹内参考人は、不満である、その不満であることは不十分であるからだ、こういうように言われておるわけでございまして
197,を吐露した手紙を、ジョニーはどういう気持ちで読み通したのか！彼の不満、怒り、憂鬱、そしてそれらへの決着をつけた事態に僕が関与したこと
198,た事情は抜きにしても、ＣＶＣＣに対する一般の評価について、私にはおおいに不満があるのです。まえにもすこしふれましたが、自動車の世界というのは保守的
199,身辺にはべらせ、政務もこのふたりにまかせきりにしていたので、臣下の不満はつのる一方であった。かくて翌年一月、決起した重臣たちが太子哲を擁して宮中
200,を見るなり、私は思わず由香里の頰をぶってしまった。由香里、何が不満なの？５月７日学校の会議室で、校長先生を始め、諸先生方に、由香里とＥさん
201,は無縁ではない、という点です。このようなヨーロッパ中心主義による一方的な抑圧・隠蔽がイスラム諸国に大きな不満を蓄積することになっていきます。その一つが犬の「血統管理」というイギリスによる独断専行です
202,に耐ええても、今日のように「改革・開放」体制下でモノ・カネ主義が蔓延していると、これらの不満は抑えようがなくなる。しかも貧富の差の拡大は、中国社会の伝統としての「均霑思想
203,かね」「あ、高校の日本史で習いましたよ、日露戦争の講和条約に不満だと、この日比谷公園で暴動が起きたのじゃなかったですか」「そんな
204,ともに，基礎的なニーズから高次のニーズへ移行していることを意味している。また，不満の高い幼稚園や高校について，その内容を見ると，幼稚園は「施設がない。
205,千八百三十九年に北部政治同盟の評議会がゼネストを呼びかけて掲げたプラカードには、議会改革後の政権に対する不満が並べ立てられている。（十六）３ａｎｄ４ＷｉｌｌｉａｍⅣｃａｐ
206,た。「明日は第四条件を討議する。その内容はいえない」記者たちは、不満のうめき声をひびかせ、帰ってきたロシヤ代表団のほうに移動した。秘書コロストウェツがつかまり
207,たブレット・オグルよりも長く記憶された。ビーマンはそのことを知っていたし、不満はなかった。しかし九十四年のトーナメントをプロモーションするにあたって、ＣＢＳは九十三年の愉快な
208,はいくらでもできます。一度、ノートでもＰＣでもいいから、あなたの不満や後悔してる事とかを書き出してみたら？そうする事で気持ちの整理がつき
209,のこの領域での反応をニクシュ氏が説明した。「いまのアメリカ側の韓国に対する不満や怒りは、米韓同盟という安全保障上の基準から発すると同時に、北朝鮮の人権弾圧への対応という
210,、「弁護団はデューデリジェンス（資産の適正評価手続き）の結果さえ明らかにしていない」と不満をもらす。こうしたなか、会社更生法の適用申請への移行が囁かれ始めている
211,左図参照）。この図から分かるとおり、公平に扱われているのなら社員は不満をもらさない。ひどい人事を行っても、ひどい罰則を与えても、それが
212,の再開を認められたが，当該備蓄場が極めて杜撰なものであったことが住民の不満を増幅させた。（百五）小島延夫「日本企業の公害輸出初めて裁かれる―マレーシアＡＲＥ事件住民勝訴判決（
213,」と反発している。大統領が謝罪しても無意味だとの突き放した見方もあり、不満は簡単に収まりそうもない。「（五日のアラブ諸国向けの）インタビューの際に
214,参加したときは雨フリーパスもらったが・・・まったく乗り物にのることもなくみんな不満が爆発？？？雨降ったときのことをまったく考えてないお粗末な企画会社だけ
215,ところが、そうした執行部の意識と一般教員の意識にすき間ができており、それが不満につながっていた。十分な説明があれば埋まっていたはずだ。学長が
216,とはいうものの、妥協の産物であるノーマルカーに走りの質を求める僕らが不満を覚えるのは当然だ。そこで国政氏のスーパーノーマルコンセプトが登場する。オーナーが持つ
217,例えば、「自分を買いかぶるなよ。何様だと思っているんだ。今の仕事に不満があるって？安定したいい仕事じゃないか、おまえのおやじだって満足してた
218,はずがない、と決めつけているからです。こういう諦観的思考があるために、現実に不満をいだきながらも問題意識が高まらず、よって向上心も育たないのです。こうして
219,ことについて「核の問題を動かす一つの手段として分からなくもないが、われわれは不満だということははっきり申し上げている」と述べ、米国の対応に不快感を表明した。
220,な画素数は必要ないですが、６切以上に伸ばす私にとっては六百万画素のキャノン十Ｄでも不満があります。また、色作りの性能は日々進歩しているようです、同じメーカーの同じ
221,の創造』）の中で描き出した、郊外に住む中流家庭の専業主婦たちが抱く不安と不満を、日本の専業主婦たちが自覚するのは、もっと後のことである。＊４ベティ・フリーダン
222,また、労働時間や仕事の内容面では満足度が比較的高いものの、賃金や昇給・昇格では不満もかなりあるようである（付属統計表第八十四表）。さらに、（財）雇用情報センター「パートタイム労働者等の人事・賃金制度に関するアンケート調査
223,からはそういう声がもれ出る。彼らは納得いく説明が幕府からなされないことに不満を募らせていた。対馬と連絡を取りつつピリピリしている長州のもとへ、
224,の中で、米国が圧倒的な戦力を持つイスラエルの過剰報復を放置していることに深い不満を募らせている。また、国内には現政府を倒し、イスラムによる支配を成し遂げようという
