,0
226,に対して順次または同時に損害賠償を請求することができます。しかし、一人がすべてを賠償すれば残り全員が責任を免れます。問題は、共同不法行為者のうちの一人と示談したとき、
227,成る傾向が有り、悪質な検査業者もいますので注意下さい（当社建築士は検査員の資格を全員に持たせています）でも建物品質で大切なのは会社の健全な経営状態です
228,段階的に進行する自然で連続的なアプローチによって、一人一人の意識改革を促す内容だ。初めに全員の目標を定めてもらい、皆の前でそれを発表し公約とする。プログラムの内容
229,東（祥）委員具体的に質問します。ここで十四省庁がかかわっているわけですが、全員にお越しいただくわけにはいきませんでしたので、厚生省、法務省、文部省に具体的な
230,（ル）為す術もなく地に堕ちるというのも知らずに（全員）彼は何処に征くのだろうか？（プゥピェイニエレフエレフ）（ル
231,「ゴルフは、当たり前になってしまった。それに、四人でコースをまわる場合、全員会社の人間っていうのが多い。それに、ゴルフ場に行くのに、平均一時間半
232,．のトップ）がオーボエあるいはピアノからＡの音を取り、そのコンマスの音に全員が合わせます。実際のところ弦の奏者はかなり多いので舞台裏でチューナーで合わせて
233,なかった。反米デモの際にはデモ隊の到着を待って老若男女関わらず通行人のほぼ全員が立ち止まって拍手を送り、国歌を合唱するなど、はるかに厳粛な雰囲気であり、ぼく
234,「香港在住支那人有力者調査表」（千九百四十年二月）参照。半島ホテルに召集された香港の有力者百四十一人の全員の名前と職業は注に譲らざるを得ないが、金融機関の支配人か弁護士、
235,順調なスタートを切った。彼女の眼識は、まず廷臣たちの人選に表れた。全員が狂信的なカトリックでもプロテスタントでもなく、エリザベスと同じくルネサンス的教養の高い穏健派のヒューマニスト
236,聴衆は一様に驚きをもってステージの環に注目していた。環が歌い終わると、全員が起立して拍手。外国では、このようにして一流の芸術家に対する感動と
237,詰め込む。プロデューサーは、各局ほぼ八十人前後であり、そのうちの三割強がドラマ部門にいる。その全員に配り、バラエティ部門の主なプロデューサーにも渡しておこうとすると、いつも大荷物になる
238,ようでデイルームには高齢者の方がたくさんいたのに〜〜幸子はんとともに全員〜〜お部屋に退散です〜〜マナーを心得ない親たち・・・もう少し配慮考え
239,評価する観点を話しあい，作成した観点別評価シートをもとにそれぞれ評価した。評価の結果については全員で話しあい，Ｗｅｂページを改善した。ひかるさんたちは，Ｗｅｂページを完成させ，生徒会に提出した
240,これはもっぱら冷徹な医学用語にみちていた。彼女は遺体をつぎつぎ診たのち、全員の死亡を確認した。死後硬直はすでに緩和しつつあり、死亡時はおそらく十二時間以上前にさかのぼると推定さ
241,た。決勝のレースを従業員らは店舗奥にあるテレビで観戦。偉業の瞬間、全員でハイタッチをして歓喜の輪を作った。さらに２軒隣にある米穀店２階で即席
242,の住民異動に関する手続きはできませんのでご注意ください。利用できる業務●証明書発行業務１住民基本台帳関係＝住民票（全員、個人）２戸籍関係＝現在戸籍の全部事項証明（戸籍謄本）と個人事項証明（戸籍抄本）３印鑑登録関係＝
243,を、みなとても楽しみにしているのです。また“市原ぞうの国”の動物たちは全員、“フレンドリー・アニマルズ”という動物プロダクションの“所属タレント”でもあるので、テレビやＣＭやイベント出演
244,を、『ぜんざい屋事件』という。慶応元年正月八日のことである。逃げ散ったグループの全員を、新選組は手配して行方を追っていたのだ。そのうちの中井庄五郎と片岡源馬が
245,。地域猫はその地域で飼っている猫ですから、いわばその地域に住んでる方は全員地域猫の飼い主さんになるわけです。
246,の思い出を寸劇した発表があり、会場は笑いにつつまれました。最後に全員でキャンドルサービスを行い、「スマイル西小」の伝統の灯が、私たち在校生にしっかり受け継がれ、
247,たのも幸いした。こうして、午後十二時頃には全く火は消えて、全員ようやく安镹することができた。思えば朝食後、昼食もせず、水ばかり飲んでいたので
248,。そこへ中居くんが現れ、岡村を連れ出し、コンサート前に出演者一同で組む円陣に参加、全員が手を岡村の頭に乗せ、気合を入れて本番に臨みます。岡村
249,、しかしすでに諭旨が下っているので、もう一度上奏しなければならない。そこで彼は恒例の全員の進見が終わったあとで再び単独面会を申し出た。お目にかかると、恭王
250,。そのときゴラーブ卿が言った。「誰かの足音がしますぞ」全員耳をそばだてた。階下のほうから響いてくる足音は間違いなくサイモン・アストンのものだった
251,速い人が得点が高く，順番に低くなるように数字を記入しておきます。全員がゴールしたら組ごとに紙を集め，審判員が合計して優劣をつけます。あまり得点差
252,ようだ。そこで私は、新井さんに状況説明として、ひと言事実を告げた。確かに全員がしゃべりながら仕事をしている。しかし、一番しゃべっているのは小林さんであることを。
253,から女性の声がかけられた。「死にたいのなら死ねばいいわ」全員が声のほうを見る。屋上にしつらえられた給水タンクの上に、別の女生徒
254,が、死んだらどうなるかと尋ねたときの、「死んだら終わりです」という全員のストレートな答えに反映されているのかどうかはわからない。ただ、死後の
255,なポジションを占める、この男の存在には、二階堂ならずとも、捜査陣はほとんど全員、期待していたのである。ところが、この小林が殺されたことによって、別の
256,の要件をすべて満たす方です。１世帯主が国民健康保険の被保険者である。２世帯の被保険者が全員六十五歳以上七十五歳未満である。３年金の受給額が年額十八万円以上である。４国民健康保険税が介護保険料と合わせて年金額の
257,に会えるだろう）』を歌ったのですが、歌詞が本人と重なったのか、全員が涙ぐむという一幕もあったそうです。四海はしんみりとこう言いました。
258,・・今はアニメの時間じゃなくて現社の時間ですよｗｗで、生徒は全員ポカーンとしてましたｗｗｗそりゃそんなに非一般常識なアニメ行ってたらそうなるわｗｗｗ
259,。「敵機接近！」見張員の声が開け放たれたドアから流れ込んできた。全員、上空を見上げた。敵の哨戒機が高度をとっていた。これで、
260,男子４人女子３人計７人）調理実習直後に作文を書かせると効果的である。全員が同一の体験をしているので、イラストを見て、容易に思い出しながら書くことができる
261,面積を出す公式を言ってごらんなさい」「では，念のために，最後は全員で言ってみましょう。さんはい」ここまで「詰め」をするとよい。§
262,、演歌の間をすり抜けるようにして。ブルーコメッツも、ブルージーンズと同じように全員ミュージシャンで、それまで尾藤イサオ、鹿内タカシなどのバック演奏をしていた。ブルーコメッツのメンバー
263,であった。ほとんどの子が学級の上位を占め、クラス委員を四人選ぶのに、全員沖縄学童が当選し、教師、地元学童とも面喰ったこともあるほどであった。その他、沖縄学童は
264,は、ベルが鳴る。特別の訓示があるときは、そのとき、スピーカーを通じて、全員に伝えられる。みな直立する。訓示のないときは、ベルが鳴り終わるのを待っ
265,が含まれていた。彼らはこの喚問によって、議会侮辱罪に問われた。下院本会議は全員を賛成多数で採決し、その告発状をワシントン連邦地裁に送った。翌年のはじめ、連邦地裁は、
266,気になれないのは、この法案を策定した人間も、反対している人間も、全員が、「ほんとうに日本の国家主権が危機的な状況」（それはとりあえず「アメリカを
267,会費：１人五百円申込み：９月二十日（土）（必着）までに、往復ハガキ（全員の氏名を記入）で庵原生涯学習交流館へどうぞだがしや未来考〜だがしや楽校のススメ〜とき
268,全校マラソンにかならず参加した。自分は最後尾を走り、落伍しそうになる者を励ましながら全員ゴールインさせ、生徒に好い印象も与えたのである。そして宇治山田中学のあとに赴任した学校
269,はどの程度か？検証時の設定・プレイ環境・チームは十年以上連続で日本一になっており、選手は全員ＳかＡランク・リードＳとリードＣの捕手をそれぞれスタメンで１年間起用する・捕手以外のスタメンと
270,会計監査を除く役員によって構成し、構成員の過半数の出席をもって成立し、その決定は原則として全員一致とする。但し、幹事が都合により出席できない場合は、当該労組からの代理出席を
271,必要であれば赤色に変える。アンドンは工場のどこにいても見える。工場の全員がそのアンドンを気にしながら仕事をしている。「アンドンが見える」ということ
272,ことを主張し、もしこの新しい案が実際にＡＢＦ案として文部省などへ提案されるなら、全員がＡＢＦを脱会すると主張した。その理由は、表面上はこの案がアンケート形式で会員
273,でも、そのくらいの危険は覚悟しないと」そこでジェラルドはハッラを放し、全員でぞろぞろと橋を渡って家の中に入った。ジェラルドは、二人のドリグを
274,ほどのスピードを出したことはない。だが、落ち着かなければならない。無理にハンドルを奪いとろうとすれば、全員あの世行きになる。「ああ、あんたの言うとおりだ」カストロは言った。「
275,とのＣＬ予選３回戦ファーストレグについて、次のように振り返った。「水曜の試合では、全員のコラボレーションが気に入った。選手たちは適切な距離を保ち、いい準備をし
276,・・で、本当にみんな信じたんだよね？は：イヤ、別にまだ全員信じたわけじゃ・・・ぜ：え！？は：だって何もしない
277,ような、きょとんとした顔をする。さらに彼らは、筆者の日本側の家族は全員日本に住んでいると知ると、それはなぜかと聞きたがる。イギリスに住んでい
278,もこだわりながら、最後まで熱心に仕上げる姿が見られました。その後、全員が体育館に移動し、地域の皆さんから飛行地点の確認や、飛ばし方の指導を受けて
279,）そのことは評価に書く方がいいのでしょうか？書かないほうが良いです！全員にオマケしてくれているとは限りません。メールで感謝の気持ちを伝えてみては
280,なかでちらちら光るのが見えた。われわれはターゲットの建物のきわに達し、全員が壁にへばりついた。グレンは手前の角に目を向けている。そこを曲がり
281,心配」と憂慮する。別の地方では主催者が開催を予定したが候補者が全員そろわないので断念したケースもあるが、大阪の場合は主催者が現れないというそれ
282,夕食後のあわただしさはいったん落ち着く。この時間になると付添さんたちは近所の銭湯に出かける。全員が出払ってしまうといざというとき困るので、互いに時間を融通しあって出かける。親しいものどうし
283,をするので「スペランカー」と呼ばれていた多村が相変わらず怪我してるし。選手が全員ベストな状態でシーズンに望めばかなり上位にいけるはずなのに、今のところ
284,で、私は何度も夜中に起こされた。「デスクたちは、なんと事件直後から、全員、レイプの件は知っていた」（企画報道室記者からの私宛メール）にもかかわらず、
285,手掛かりはメダルだけ。しかし、そんな女性はどこにもいない。「ほな、全員揃うたことやし、行きまひょか」とぼけた関西弁が聞こえ、思わず振り向く
286,の措置を講ずることとしております。さらに、創業の活性化等のため、出資者の全員が有限責任社員であり、内部関係については組合的規律が適用される新たな会社類型の新設を行うことと
287,学校の先生、未来わがまち会議のメンバーの協力を得て、１時間目は講堂で全員集まり講習を受け筆記テスト、そして答え合わせを行い、その後は各学年単位で運動場に集まり実技指導
288,中に、委員が今御指摘のとおり、「東通から調本の退職者に顧問料等名下に全員の提供を受けさせるなどの目的」があった、こういう記載がございます。
289,。しかしＮＰＨについてはまだ分からないことも多いし、症状などは個人差があり、全員がこのような症状を示すとは限らないので素人が識別するのは危険だと
290,よ！君は約束したんだ！！」たしかにシュローダーは約束した。チームの全員がそれを聞いている。しかしシュローダーの情けなさそうな顔は、言葉の説明をはるか
291,部下も同じように、手にした鎖を回しはじめた。二十名の部下は全員、一本の鎖しか回していないが、雛杜だけはさらに左手でもう一本の鎖
292,平成十一年度）昨年度の私のクラスの算数テストは，平均点九十点以上がほとんどであった。全員が八十点以上のテストもあった。向山型算数の授業をすると，子どもの力が
293,していたが、腹が減ってきたのでシュラフを片付け炊事にかかる。今日も全員食欲旺盛。昨日の事を反芻しながらゆっくりと朝食を楽しむ。撤収の前にお世話
294,てくれば、気がついた兵が大きい声で「上官！」と叫んで全員が不動の姿勢をとる。食事を運んでくる兵は、盆を目よりも
295,に従いましてその過半数の同意を要しますし、また処分につきましては全員の同意を要するという民法の規定が適用されますので、地上権を設定しなくても
296,×２分１＝百五十点である。ところが、何らかの事情で別の場の均衡が変化し全員が♡を出すように変わってしまったとしよう。あなたの得点は、別の場
297,、定年に達した日の属する月末をもって退職とする。２．定年後、希望すれば全員六十五歳の誕生日まで嘱託として定年退職日の翌日に再雇用する。ただし、嘱託は１年毎に更新し、
298,蟻巣川の研究室へ唯野が入っていった時はすでに、助教授の水戸を除いて全員が揃っていた。さすがに主任教授の研究室は広くて、唯野の部屋などとは
299,はがきに住所、氏名、電話番号、出店品目を書いて郵送。結果は、９月中旬までに全員にはがきで通知申同事務局（☎八百三十．一一一三北野町中三千二百九十四の１、北野町商工会内、☎七十八．三三一一、ＦＡＸ七十八．四八七三）
300,た。代表的なものが、「ランブイエでの和平交渉に参加したアルバニア人指導者たちがセルビア兵に全員銃殺された」との報道。私の知る限りセルビア人官憲たちのコソボにおける対応は表向き尊大
301,に家に帰るのか」これも留吉だった。そうしたいが、全員でというわけにもいくまい。五十男は百治を呼び、「とりあえず二人だけ
302,が埋まっているバスだったのに停留所にバスが止まり、おじいさんが乗ってきたら全員がいっせいに立ち上がる・・・（席を譲るため）・・・というほのぼの。ＢＧＭ
303,昭和四十年）国連経済社会理事会で、アメリカの国連大使（当時）のアドレイ・スティブンソンが、「私たちは、全員が共に小さな宇宙船に乗って旅行している乗客で、わずかな空気と土に依存し
304,無料）申込み：９月二十九日（月）（必着）までに、ホームページか往復ハガキ（全員の氏名、子の月齢・性別も記入）で女性会館へどうぞ◆今から目指せる、おシゴト発見！
305,主婦の皆さん！！夏休みは家庭内戦争ですか？？全員、捕虜にしました。夏休みは強制労働です・・・・・・
306,の男が撃った。別室に連れさられていた三人の男の配下は、全員、始末された、と聞いている。三人の男の死体処理も将軍グループが行なった。
307,つかんで逮捕し，駅事務所まで同行した。事例十六５逮捕時の状況市川警部捕が「全員を賭博の現行犯人として逮捕する。」と言いながら近づくと，全員が立ち上がり逃走の気配
308,に働く若い女性たちの紹介記事に溢れている。勿論、ヘアー丸出しの女も多い。ただ、全員が明るく写っていた。本番と呼ばれているセックス行為がない場合でも、若い
309,が多い子に殴る蹴るを５分くらい続けたり、中三の時の公民の授業で全員のお父さんの職業を公表したり・・体罰以外にもかなりびどい事されてた
310,宗教を信じる場合も、すでにめずらしくなくなってきています。それについて、家族の全員が、先祖の宗派と違う宗教で、別々に葬式や年忌をやることになったら、
311,といった純和風のスタイルを崩さない。タラちゃんがたまにベビーベッドを使うことを除いては、全員が布団である。しかも夏であっても冬であっても、同じような布団で、
312,、早く！ぐずぐずしてちゃだめ！あいつを殺っちゃおう！ああいうやつらは全員ぶっ殺そうよ！」みな大笑いだった―屈辱感に打ちのめされていたマディさえ。マディ
313,ます！」クリスティーンの抑え気味の叫び声がその場の緊張をほぐし、ＣＩＣにいる全員がこわばっていた身体をゆるめて、生きていることに驚きを感じつつ笑みをもらし
314,寄り道して高橋一係長の茶碗に入れ、先ほどの指示を伝え、二係に戻って来て全員についで回った。九時に一分前、岩崎が立ち上がる。高橋一係長も、松村二係長も
315,、ホアが大規模な襲撃隊を送ってくるという情報を入手した。ファリムの戦士は全員、裸になって剣と槍と盾をつかみ、戦いの歌を高らかに歌い
316,の法制審議会答申がベースだが民法の改正内容を姓の問題に限定。子の姓は全員同じにするが、夫婦に子の姓の決定に時間的余裕を持たせる狙いから第一子
317,知っていてかけをするのは、りっぱな人間のやることではありませんから。」全員がほれぼれとダマーズさんを見た。ダマーズさんはついに真犯人をつきとめたらしい。チャールズ卿が全員
318,高い壁で囲まれ、本国から輸送した監視カメラなど最新警備機器を備え付ける。約二十人の大使館職員は全員敷地内に住むことになるという。先月、軍警察が爆弾テロ襲撃にあったイタリアは、バグダッド
319,行き過ぎた段階で、ここより前に敵は１人もいないことになる…乗客が全員一箇所に押し込められ、奴らの行動の自由度が復活してからでは遅い。オダケンは
320,一日となる。ロナウジーニョと彼の兄でもあるアシス代理人、そしてミランのガッリアーニ副会長は全員、十四日にバルセロナに到着するのだ。海を越えた電話での話し合いを経て
321,「自分も見たいです」「俺も」「わしも」と、ほぼ全員が配車センターの見学に行く。戻ってくると、「すごいな、普通タクシーの
322,バベル周囲に配置された敵の人員は全部で三百五十二名。確証はありませんが、全員が『フルブルー』構成員であると思われます」バベルの外周、不可視境界線から僅かに百メートルを
323,両側から支え、必死で部屋まで連れ帰った。「酔い止めだ」海士長が、全員に錠剤を配った。「念のため、四人とも飲んでおくように
324,各人の特性というものを吞み込めていないせいかもしれない。今鏡家の人たちは（それが全員ではなかったが）畝傍の場合と同じく淡泊だった。良く言えば冷静なのだが
325,はひどく気分を害したようだった。ブリンク夫人は言った。「今夜の交霊会は全員の気持ちが揃わないようね、ドーズさん。やめにしましょうか」やめたとしても、
326,ゴトンと、大きく汽車が揺れ、小さな田舎駅に停まると、七十一連隊第二大隊の一千余名は、全員下車した。「忠どん、こや、何ちゅう駅や」新吉は、眼ざとく、
327,で再度クリアしても隠しキャラは増えないので注意。コンティニュー可なので、気長にやれば全員そろう●強力なタッグ必殺技「メテオタッグコンボ」を繰り出せる１特定の組み合わせのタッグで、コマンドを
328,『アメリカのチェリーヒル地区で、千九百八十八年から九十二年にかけてヤコブ病の患者が十三人発生し、全員死亡した』というニュースに対する、アメリカ政府の反応、対応、または、マスコミ・市民の反応がどう
329,から身を起こした。「正確な飛行時間と宇宙飛行歴を教えてくれ、ミキ・ハヤマ」全員の視線が集中するのを感じながら、美紀はガルベスに顔を向けた。「
330,実行させる装置に必要な機能およびその装置名を示そう．解答身長の平均値は，全員の身長を合計した後，人数で割ることにより求めることができる．図２．二十一に，電卓
331,どよめいた。百五十人ほど入る小講堂はぎっしり満員である。拍手までちらほらと起こる。全員が、何かの勘違いでもしたかのように、きらきら光る目をし
332,思えば全員集合をたくさん保存録画しておけば良かったと後悔しています当時の幼さでは、全員集合の終了、保存録画の大切さは考えられなかった・・・・・・
333,は、皆さん馴れない作業に悪戦苦闘でしたが、ベテランの方の手ほどきをうけながら全員が作り上げることができました。最近、手作り草履は健康的な室内履きとして注目されています、
334,ＪＡＬＭＡの文字を入れている）。現在、Ｋ・Ｖ・デシカン所長以下医師二十人、看護婦八人を含むスタッフ百二十人は全員インド人で構成されている。入院患者は約五十人、通院患者は年間延べ約二万人。多い日には二百人以上
335,最終学歴をみると、小学校卒業が五十七人で約七十％を占めている。三十代、四十代の海女は全員小学校卒業である。学校教育を受けていない海女は二十一人（約二十七％）であるが、その約七十％（
