,0
0,メディアだということになる。情報社会のマスメディアに芸術の真の批評行為など存在しないのだ。全員がひもつき。自作自演、自画自賛。私たちは第一章「メディア人の劇中劇」を思いだす。マスメディア
1,非常識な人が多いみたいですね。応援することを否定はしないが、だったら全員に同じ態度で接しろっつうの！
2,から、私に任せて」スミ江は改めてベランダの孝雄と、車座になっている全員の顔を見渡す。「探査機の持ってる『落ちる前』と『落ちる最中』
3,「出席します。ありがとうございます」「よし、諸君、仕事に戻ろう」全員いま一度テッドに祝いの言葉をかけ、彼のオフィスをあとにした。デイヴ
4,が、それぞれシングルを一本、そしてマーフィーが、二塁打を一本…たったこれだけだ。全員がほぼ完璧に抑え込まれている。これでは、打順を組み替えるための資料にはなり得
5,三十分〜午後３時（荒天時は十八日（月））。無料。▼申込往復はがきに全員の住所・氏名・電話番号、イベント名を書いて〒５７３‐０１２１津田北町２‐二十五‐３津田生涯学習市民センターへ（１枚２人まで）。２月
6,するのですが、遠方の招待客は、大阪三十五名、名古屋７名、東京十名と多いので全員に全額は厳しいです。みなさんの考える失礼に当らない最低ラインはどのくらいですか。
7,当たり、あたり一面血の海となった。コリンはキングマン一家殺人事件を思い出し、水着姿の男たちは全員、血まみれとなり、コリンの父親はみんなに一歩退くようにどなり、アーブが甲板
8,。リーダーとして、リーダーシップが本当に効果を発揮し、他の人たちの共感を呼び、全員の方向付けと動機付けに役立っているかどうかを知らなくてはならない。そのためには、社員
9,、ヘビの牙を砕くのを見回った。どうもお気に入りらしいマルフォイを除いて、ほとんど全員が注意を受けた。マルフォイが角ナメクジを完璧にゆでたからみんな見るように、
10,。食糧難時代には、食糧確保にあらゆる努力もした。感謝と奉仕の信念で、全員が結ばれていることにもよるのだろう。肥料を生産している朝日化学では私は
11,告ぐ！すべての船はただちに海岸へ戻りなさい！すべての船は海岸へ戻りなさい。全員、港を離れなさい。アテンシオン！アテンシオン！」水上飛行機の左手約五メートル、大きな銀色の
12,国民健康保険税が公的年金から天引き（特別徴収）されます。●対象者１世帯内の被保険者（国民健康保険加入者）全員が六十五歳以上七十五歳未満の世帯２世帯主（世帯主が国民健康保険に加入しているかたのみ）の公的年金受給額が年額
13,のほうが大きいの。父はあの通り、自分のペンションに来る男の人を全員、疑ってかかる癖がついちゃった」「僕も疑われているみたいだね
14,でありますが、組織でも動いているものです。全員の、全員のための、全員による行動目標を忘れてはならないのです。さて、もう少し味わってみましょう。十六．荀子
15,ホウ統（進撃時脳内ＢＧＭ「大地の呼応」：『ジェネレーションオブカオスⅣ』）諸葛亮「よし、全員揃ったようですね。それでは早速出撃しますよ」馬超「蜀のため、これから
16,あきらめるな！あきらめるな！絶対、絶対、あきらめるな！」を、チームの全員が大声で頻繁に合唱するようになっていたのだ。ある頃から、それは
17,打ち負かし、降参させることになる。一方通行の交渉は勝者と敗者を生み、結果的には全員が負けることになってしまう（敗者がしぶしぶ承諾したり、その見返りを要求したりすれば、結果的
18,ブロンズ新社…第５弾。待ちに待った誕生日、ジャッキーは熱を出してしまい…。ついに全員の名前が判明！『くまのがっこうジャッキーのちいさなおはなし』あいはらひろゆき／文千百五十五円ブロンズ新社
19,！」「まかせておけ！」とみんな叫んだ。「もししるしがなかったら、全員リンチだ！」おれは今度こそ恐ろしくなった、ほんとに。でも、もう逃げ
20,、法律の定めるところによりまして、証人に宣誓を求めることにいたします。全員起立を願います。○佐藤委員長議院証言法第五条の三の規定によりまして尋問中の撮影
21,みせてもらわねばならない」「明朝午前七時、われわれは武器を捨て、村の広場に全員集合します。それをご確認の上、閣下の使者をお寄越しください。わが司令官ヒル大佐が佩刀を
22,か？」といわれ、スタッフはその不徳を恥じたのか、翌日には全員に花を配った。見ていると、全員がすんなりと受け取った。何か
23,の壁際に、再登場した山内明日嬢が立つという布陣。握手会は、枚数関係なく全員が山内明日嬢の左隣に立ちまして２ショットチェキを撮影してから対面で握手という進行で
24,。そこがこの記事のメインテーマである。この店には十二人の職人がいるが、全員元サラリーマン。それも平均年齢六十七歳というから驚きだ。社長であるＷさんは、十六年前に
25,後郷社長。チーフの伊藤喜富さん（三十九歳）。そして河本武基さん（三十三歳）と守田利文さん（三十四歳）。全員、親身になって相談に応じてくれる。●塩でいただく絶品寿司『たつみ寿司』５
26,声もあるようですから・・・。２年前に設立したＩＴ関連の会社（役員は全員三十代前半）でも、履歴書は手書きが当然、でしたが。
27,からともなく出ましてね。これが次第に大きくなって、秋田市議会は全員一致で、私に知事に出なさいということを決めてしまいました。また、そのころ
28,ところか・・・ちょうどいい。いいテストマッチになる。」そう呟いて、小野田は全員に向かって言った。「次の試合、涼風と田島が先発バッテリーでいく。武藤
29,「制服向上委員会（ＳＫＩ）のメンバーが全員ＡＶに出る」と言ったら、あなたは見たいですか？やっぱり学校でエッチするんでしょう
30,。山田先生が今まとめて下さっているので、ある程度出来ましたらお送りします。あと、全員の似顔絵をイラストにします。とりあえず社主の下書きが出来ましたのでお送ります。
31,軍隊にいた。なかのふたりが休暇で家にいた以外は、叔父たちも全員戦争に出ていた。「ベイスン」に着くと、叔母が書いてきたとおり
32,に見えた。カウンターのなかにいたニック・キャシディがステレオのスイッチを消すと、全員が花嫁を見た。デイジーが背筋をのばすと、リックは高校時代の彼女が
33,ない、とフランスでもいいます。白衣もそうで、お医者さんと看護婦さんは、全員が美男美女に見えるものです。世界の有名人の髪型やメーキャップを担当し、“ヘア
34,発表した。カナダ・ケベック州の製造工場も同時期に閉鎖し、従業員約千四百人は早期退職制度などを利用して全員削減する方針。両車種はライバル、フォード・モーターのマスタングに対抗するため千九百六十六年に投入。ガソリンを
35,を越え、滑りやすい草地を横切っていかなければならなかった。マーフィーは修道女たちに手を貸して、全員堤防を越えさせた。年配の修道女はいやいや彼に手を預けた。若いほう
36,ものについて河川管理者の判断にゆだねることとしたものでございます。一級河川百九水系は当然全員聞きます。二級河川、全国に二千七百十八ございます。この中に大変小さな河川もございます
37,数、およそ三十名。これが個人参加組の首位集団である。誰かが速度を上げると、全員が申し合わせたようにその速度に従う。その結果、集団は一団となったまま
38,ますので、精神面・環境面で負担がかかるかとも思います。しかし、全ての面で全員がスタートラインに立ち、同じ立場で活動できるようにしていただけることと期待しています。
39,は腰痛持ちだし、ハヤシもお世辞にもアクション向きの人材とは言い難い。ケンカが始まったら全員腰抜かすのがオチだろう。ここはやっぱりミスター・キョンガにフィルムをあきらめてもらうのが一番だ
40,ように、気持ちを和らげることがわたしの主な仕事だった。一回りして、およそ全員に示唆したところで、「ヒムン」と、呼ぶ声がした。もちろん、
41,踏み入れた。中では大勢の男女がワイワイガヤガヤやっていたが、この人たちは全員が同業者だ。ジェニファーは人を搔き分けながら進んでいくうちに、何人もの友人や
42,１人に有利になる順番を決めたと判断されれば、それに同意したプレーヤーは全員が競技失格（十‐２）。２腹痛で打順を変えてもらった状況オナー
43,したため、県に補助金の上乗せをしてもらい、さらに同ＮＰＯ法人の基金を取り崩して全員に盲導犬を行き渡らせた。盲導犬１匹につき百八十万円ほどの資金が必要で、基金
44,、そういうことです。」ロジャーはいささかひややかにいった。チタウィック氏をのぞく全員が、なんとなくめいわくそうな顔をしていた。
45,みつかる前に、政府軍がやってくるのを監視する。ホアキンには病人を残して全員で引き揚げてくるように言ってやった。犬は落ち着きがなかったが、われわれを
46,理由でシャンパーニュのボトルが開けられる。一期分の仕事が終わると、シェフとアシスタントが全員集合し、「お疲れさま」とシャンパーニュ。招待シェフとして、外部のシェフにデモをしてもらった
47,おもいっきり大きくイキをすいこむとしゅんかん「キャア」とするどいこえをはっしました。すると、全員がまさにまっすぐ大空にむかって飛びたつような、おどりをおどります。そこへガイドが
48,Ｋ五で未帰還、戦死となった搭乗員の人物像はいかなるものであったのだろうか。全員について詳述することは困難であるが、これまでに筆者が調査し得た「横顔」について記し
49,。「今の追いかけっこはいい運動になったよ」彼はその場にいる全員を次々と指さした。「チェルサ、ぼくの家族を紹介しよう。ジョセフにブリアナ、この
50,を出した現場にいたわけでもないのに、予定をキャンセルして短時間で全員が集まった椎野たちも凄いと思った。彼らを本気で支援しようと思ったのは
51,母親から生まれた娘は乳房が大きい）。一方、ミームはひとりから全員へ、全員からひとりへと移っていく（ジョルジュ・シムノンは無数の女とセックスをした。たとえ
52,―と思ったようだ。「そうなのです。その時間には、われわれも全員がレストランに降りてきて、私と弟は父のテーブルに坐りましたし
53,ので、仲間の背中を射つ者も次々に出る始末だ。約三秒後、敵は全員が倒れた。そのうち一人は、影山に利き腕の右肘の骨と左の膝
54,、全体の人口は、四千八百七十人とのことである。昔、村の男たちはほとんど全員が職業的な音楽家だった。もともと彼らが演奏したのは、いわゆるラウタール（村の
55,ニューマンはイザベルと共に隠れた。両側に機関銃を持った兵士が立っている。全員が、ニューマンとイザベルのいる側の、あるビルを見つめている。その入口に見覚え
56,また、やつらの笑い声。敵は、もちろんヘルメットをかぶってる。けど、暑いから全員、シールドは、はずしている。笑い声が、爆音の中できこえた。ちくしょう。
57,。「宗教兵隊だな」と思った。朝早くに起きて、全員でお祈りし、全員で勉強し、それからどこかへ出発していった。カラシニコフはぶら下げているものの、とても兵隊に
58,ヘアーディメンション青山店パート４白を基調にした明るい店内には、総勢十一人のヘアスタイリスト。この全員がメーク対応が可能。ただし、メークはサロンの営業時間前の早朝に実施。平日なら９〜十一時
59,のう。（皆をふり返って）ここはこのままいくしかあるまい。よいな。全員無言のままうなずく。雷の音。道場の方から「ふみ」の唱和の声
60,に北から攻めてくるゴグ」のことを、なんとなく知っている。（全員にたしかめたわけではもちろんない。しかし、私が聞いたかぎりでは、たいてい
61,大会でした。エースが決めてくれる…キャプテンが指示を出して何とかしてくれる…そんな全員バレーにはほど遠いチームから脱却する良い時間になってほしいと思ってました。完敗の
62,に、労を犒って十金を手渡す。居残る未亡人出身の金鈴と呉良の二人を除く全員が、十金という大金を懐に、悦び勇んで城門を出ると、それぞれの家に
63,上がるとともに，男性であることを受け入れるのです。逆に小学校までの女子のほとんど全員が女性を描き，以後青年期にかけて男子を描く割合が上昇し，大学生では
64,の高齢者について調査を行い、データベース化したうえで、要介護・要支援レベルになるとみられる人については全員について仮のケアプランを作成してしまうという周到さでした。居宅サービス提供事業者の新規参入を待たずに
65,六年一造であることからすると、生後最初の戸籍登載時には全員が満六歳未満、二度目の登載に際しては全員が満六歳以上であるから、実態としては戸籍に二度登載された者に支給することを意味する
66,集落を代表して苦情を警察署に伝えると、幹部から「『文句を言うやつは全員逮捕していいと上から指示されているんだ』と脅された」という。
67,地上権又は賃借権を有する者及び当該土地について権利の移転等を受けようとする者は、その全員の合意により、前条第二項各号に掲げる事項を内容とする協定を締結した場合において、
68,、川岸の木々が猛烈な勢いでうしろへ流れるほどになっていた。「全員、櫂をとれ！」船頭を務めるフーンの娘が叫んだ。白毛が生えそろった
69,、子供を学校にやらないことを「布教」してるんだから。登録するなんて、「さあ、全員取り締まってください」というのと同じことだ。セクトのなかには、外国から資金
70,だけど、ぼくがそのさそいにのらなかったので、ノンセクトはぼく一人だけ。あとは全員さまざまなセクトのメンバーでした。そのころ駒場は共産党と新左翼が激しいヘゲモニー争いを展開し
71,、その口座から引き落とすようになっている不正小切手で家畜を買い、男たちを殺した。全員が二十二口径ライフルで射殺された。ミズーリにはまた、もっとも若い男の死刑囚がいる
72,。２ある一人から順番に、１・２・３、１・２・３のくり返しで、番号をつけ、全員に番号がついたら、番号に果物の名前をつけます。たとえば１バナナ２リンゴ
73,んですが・・・。だいたい、メンバーが７名くらい。今回のメンバー・・・ほぼ全員受身のひとばかり。誰が動くの！？って感じ。みんな自分から動くタイプではない
74,ようなものをもうすこし持っている。青く緑青がふいてくるものもあるので、全員整列、一つずつ布でしっかり磨いてやる必要に迫られる日もある。麻薬に
75,を観るといった、はっきりした目的がないと外出をしたがらない。平均して全員の二、三割ぐらいしか外出せず、居室で、テレビ、ラジカセ、マンガ、プラモデルといった
76,ていたのに「いまから南朝鮮の映画を見よう」と言ったりする。すると、全員、公館の隣にある映写室に移動して映画を見ることになる。金正日のこうした
77,。如水に富来城攻めを思いとどまらせたのは、ほかならぬその静寂だった。「全員が討ち死にを覚悟していなければ、ああはいかぬ」不審顔の栗山善助に老人は教訓
78,やはりこの日は、・女子サッカーでしょうね。とにかく全員で守る（フォワードでも玉を取りにいく）サッカーがやり切れているのが、この
79,・・・・・・・・・・・・・・・・・イギリス海軍によって、全員無事救助されました・・・・・・・・・・・・・・・
80,たので、もう一度やってみようという気になった。翌朝、ほかの子供たちは全員村に出かけていた。私は買い物なんか行きたくなかった。ひとりでもう一匹パイクを
81,（小雨決行）▷ところ柳町河川敷グランド▷参加料一人二百円（幼児は無料）▷表彰全員に記録証を授与（大会新記録を樹立した人には賞状を授与します）▷持ち物
82,このとりきめに異議をとなえるものはいなかった」と、彼は報告している。「全員が驚嘆すべき気丈さと辛抱強さを示し、この提案を受けいれたようだった」水
83,カミルの説明によると…ひかるがボールを蹴った瞬間時間が止まり、その場にいた全員の動きが止まる。そのすきにボールにだけ魔法をかけて進ませる。ボールが
84,資産割額が免除されるとともに、均等割が半額となります。更に、世帯内の国保加入者が、全員旧被扶養者のみであった場合には、平等割も半額となります。※被用者保険とは
85,、派遣されている会社の中で最年少、たったひとりの二十代です。社内は六十〜三十代まで全員で二十人くらいの外資系企業です。私の事をみなさん、かわいがってくれているのはよく
86,の成績だけはＥＭＴの大きな例外である。投資会社は証券アナリストをひとりだけ残し、あとは全員クビにして、代わりにバリューラインのサービスを使えばパフォーマンスは上がるだろう」とまで
87,がつけられず二十四時間働いている感じです・・・６時半は無理でも後の全員は一緒に朝食をとる。大人の分もお弁当を作ってしまう。掃除の時間を
88,様々な調査データを検討し、この問題について話し合ったが、反発する者はいなかった。全員が、テレビ中毒は依存状態のひとつの症状だと考えた。私自身はテレビの存在
89,することもできる。また、生活記録を通して、生徒の頑張りをフィードバックすることができる。全員の生活記録に毎日、目を通している。そして、できるだけ良い面を赤ペンでコメントする
90,は、辛かった。漁のおこなわれた夜には、富大夫の家に刃刺が全員集まって打合せがおこなわれる。富大夫は、刃刺一人一人に、それぞれの舟の動きをきびしく
91,ところが、南大門をくぐろうとした三人はたちまち東寺の僧侶どもに取り囲まれた。全員が憎悪を剝き出しにして、三人に詰め寄ってくる。「何をする！
92,「早く何とかしてやらなくては」私はしゃくりあげながら犬たちに駆け寄った。全員がさらに近づくと、それを知ったアンとダンは地面に尻をつき、洗い熊
93,にその戦場に足を踏み入れないからね。ボスが戦場に来た時は、全員が見事にその気配を察知して動くからなぁ。分からないだろうな。今日の噛み付き
94,の何人かが反対するなかでの退院だったので、スティーブも含めて、アップル社の全員がはらはらしていた。スティーブはそれまでにも、「そいつはウォズのやり方じゃないな
95,が言った。「このままだと絶対、臭いに気づかれる」最後のふたり以外の全員に向かって言う。「ほかのみんなは小路から出ろ」「五…四…
96,五その他必要な事項３協定については、協定区域内の農用地に係る農用地所有者等の全員の合意がなければならない。４協定の内容は、法令に基づき策定され
97,ことができる。「おいしいね」と空腹が手伝って舌鼓を打つ。すむとまた、全員が一礼して声を合わせる。「ごちそうさまでした」家でも、これが終わる
98,んです。関のいいところはトラブル、危機に強いことでしょう。うちのキャディは全員、優秀です。普通の時は誰がサービスを担当しても、それほどの差
99,のブラインドタッチの教育を行うために、平均で三十ワード／分（百五十字／分）のスピードで勿論全員がブラインドタッチで打てることを知りびっくりして自分もブラインドタッチを習いたいと言い出し、十三時間の
100,てください。メリット真剣に辛いと思っている悩みを、叩かれるのを覚悟で書いたら全員が温かい言葉をくれて泣けました。自分が思っているよりずっと自分が辛かった
101,れる音。窓の外には人影が。嫌な予感がして、全員が立ち上がる。その時、寝室のふすまが開いた。「…お嬢さん、綺麗
102,が証明される前祝いだといって、台所から勝手に赤ワインとグラスを運び入れて、全員に乾杯と万歳三唱を強要するし、磯部は磯部で、カレー皿をスプーンでたたきながら、
103,たのち、千二百人の突撃隊を上陸させて残っていた守備兵を蹴散らした。守備兵は全員降伏した。指令官ドン・マルティン・デ・ヴァルガスは深手を負いながらも勇敢に戦ったが、ついにこの大海賊の
104,の？（笑）実物をお借りして来ました。手に取ってご覧ください。（ストローを全員に提示する）山本●自分でストローを切っているんですか？切り口がギザギザです
105,て来た。四番機と全く同じ行動である。機長の紺野兵曹長が、大きな腕で全員を抱きかかえる様にしてかばい、火の中に立っている。まるで仁王様だ。
106,は前回すでに「議長」をつとめた経験者。当然、今度の航海でも彼は全員の投票で「議長」に選ばれました。「議長」は、船内での
107,、今回のキャンプでは個人面談を行なっているそうですね。小林そうなんです。全員やるつもりなんですが、ひとり三十分くらいかかるんですよ。１日５人とすると、２時間半
108,、この私がこの席で見た舞台に感動しているだけなのに、会場の全員が同じように感動しているという事態を私は疑うことができない点。二十歳の頃
109,さあ！みんな筏に戻るんだ！」とかれは大声でいった。たちまち全員が乗りこんだその筏は、人間あざらしによって沖へ押し出された。かれらは筏のまわり
110,だなあ。あと一時間だ、頑張ろう」と誰かが言う。この辺までは全員元気であった。さらに一時間歩く。ヘトヘトになる。Ｋ機長を始め全員山道に
111,ことを口実に、住民を集め、一万人前後の罪のない青年を海岸に連行し、全員を機関銃で殺したとのことだった。それが事実だと確認した中島氏は
112,そしてそれからほぼ一年間しか彼は生きられなかった。４翌日は全く平常どおりに全員が机に並んだ。進藤と武藤も最終の列車で東京へ戻り、ほんの少し
