,0
336,である。当時そこに住んでいた日本人一万七千人は殺害されたり強姦されたりして、全員が島から追い出された。四島はまぎれもなく日本固有の領土であるから、日本政府が
337,、最も気になるのが店員の接客行動です。そこで、幹部は店員が全員きちんと定位置についているように、正しい客待ち姿勢をとり続けるように、店に来た客
338,大きい部分に属する人間だけが助かるのは、やはり不合理と言うべきだろう。滅びるなら全員が滅びればいい。助かるなら、立場の弱い順から助かるべきだ。自然の摂理が
339,、左ストレートに膝打ち、さらに単なる足蹴りで、忽ち六人の悪党を平らげてしまった。全員伸びたことを遠目で確認した南は、さも今駆けつけたように飛び出していった
340,ます、と藤代は言って、電話を切った。律子が受話器を置くと、全員が怪訝そうな表情で律子を見守っていた。「藤代さん。…辞めるそうです
341,に当たるには、トップが何を考え、何をしようとしているのかを全員が十分に承知しておかなくてはならない。そのためには、「情報の共有」が絶対に
342,ば、私は協力を惜しまない」スコットはそう言って立ち去った。再び全員を乗せたペペロンチーノ号は、もう一度さっきの氷山をめざした。「あの氷山の中
343,に、あの両手を横にグッと突き出したガッツポーズを見せてくれるに違いありません。全員攻撃、全員守備と言う鳥栖らしさは、今節も健在です。前節、湘南に破れた鬱憤
344,細かくは↓カレンダーでみてください。但し新入生が本を借りられるようになるのは全員のデータ入力に時間がかかるので４月の中旬だったかも。（入館は可）
345,、結集力をもたらします。そしてそれをまた評価していきます。翌週、「３班さんは全員着席していたね」「５班さんには、もう教科書を読んでいる人がいるよ」
346,「…で、ヨーウィーの脚を使って全員始末しておきました。体の方に無理はありますが、精神状態はあれくらいの
347,投手陣の再構築１年目。先発には大黒柱の三浦大輔を筆頭に斉藤隆、土肥義弘、セドリックなど全員が万全とまではいかないものの、頭数に不足はなし。左右のバランスも整っ
348,作る手法を考案、■■容疑者に三千万円を渡していた。買収工作は代議員約百四十人のほぼ全員を対象に、有力代議員には五百万―二百万円、一般の代議員には三十万円を渡していた。
349,これはさつ子にかぎったことではない。院内銀山の女房たちは、おしなべて酒好きである。もちろん全員というわけではなく、中には体質的に酒を受けつけないとか、女だてらにという考え
350,二十二その時ぼくらは全員、足場の上の鉄扉を見詰めていた。女はボウガンをかかえて便器の正面
351,も察してやれば、その桜より竜四郎に小坂に栗林に田中など、ここの全員がわがことのように、喜ぶに違いないのだった。その辺が常人には
352,育児関連の教室やサークルに出かけていくと、男性は自分だけ、他の参加者は全員母親ということがほとんどであり、孤立してしまうようだ。公園で子どもを遊ばせるいわゆる「
353,の気配を示したが，周囲を警察官が囲んでいたので観念したのか，全員逃走することなく素直に逮捕に応じた。事例十七５逮捕時の状況本職は
354,一緒に遊ぶグループの一員程度の人です。私は彼を恋愛対象に見れないし、全員友達としていつまでもグループで遊びたいから特別に２人であそんだりしたくないんです
355,は言ったとおりにすればいいのよ。明日電話をちょうだい」シュネッカーのチーム以外は全員、空の車庫にいたが、弾道学の専門家たちには追加の照明が必要だっ
356,に壊れぬようアルミの器を並べるのだが、このときばかりはほとんど不動だった全員が活気を見せる。食事が済むと、ほとんどが元の壁際へ行き、元の
357,のに、おれたちがここでいちばん狭苦しい炉辺に押しこめられてるんだから！」たちまち全員が自分の意見を口にしようとして、あたりは騒然とした雰囲気に
358,勢力を駆逐できる］との楽観的な報告ばかりを、受けていたのだ。会議出席者の全員が、沈鬱な表情になり、誰もが沈黙して言葉すら出なかった。
359,は三振だった。もっとも、打てなかったのは彼ばかりではない。天使たちのほぼ全員がガーストンにバッティングをさせてもらえず、結局私たちは、ヤンキーズに一勝しかできない
360,。「ちょっと言い過ぎたかな…」、そう思って一人一人の表情を見回した。全員が険しい表情をしている。リーダー格のコンピュータ技師が静かに、しかし怒りを込めて
361,は省く」との方針が部長から示された。「センセーショナルに扱わず」は全員がうなずいたが、部分掲載については意見が相次いだ。「書くなら、すべて書か
362,とポールの両エースに、それぞれ三回ずつを投げさせたが、彼らを含めたほぼ全員が全く締まらないプレーをくり返していた。十一対十というスコアで、どうにか勝つに
363,福祉の向上を図るため，本来退職手当共済制度になじまない職員を除き，経営者が使用する職員の全員について加入させることがこの制度の趣旨に合致するものであり，このような目的で国
364,を出すらしいです。何十何百の集団で寝ていますから一羽でも異常に気付けば全員が騒ぎます。地震も予兆があれば当然騒ぐでしょう。しかし総体的に見ておかしい
365,大学の卒業式では全員が式の最中に卒業証書をもらうわけじゃないですよね？どうやってひとりひとり配られ
366,道のまんなかに立つ子供たちの後ろ姿。しかも、かなり小さい子たちであるように見える。全員帽子をかぶっている。いかにも北ヨーロッパ的な、澄んだ青空とひきしまった大気、ほそくとがった
367,加わり４本の矢となったとき、二千二年京子の復活劇が生まれた。温かい家庭、全員が力を合わせられる家族、当たり前のようだが、それがなくては闘えない
368,、最終学年には、それぞれの生徒が、できれば、三分野すべてを等しく身につけ、全員が等しく、三分野に対応する専科学校に入学する準備を整えることにある。したがって学科目は
369,（１）総会は、代議員定数の過半数の出席で成立し、議決は原則として全員一致とする。（２）拡大幹事会は、代表委員定数の過半数の出席で成立し、議決
370,人々が一つの台詞（せりふ）を朗誦する表現形式。２デモ・集会などでスローガンを全員で一斉に叫ぶ示威行為。ｂｙ若隠居
371,でいたこと４空が自由にどこまでも続いていたことくじらぐもに学級の全員が乗れるように自分の乗り場所に置くようにする。○くじらぐもの挿絵に、自分
372,たいと思っているのに、そういう行動をされると幻滅してしまします。全員の分を買ってくるの？いや大変ねうちの場合海外旅行など長期で
373,説明する。知事は、そのあと課長以外の職員に質問をするのである。職員はその間全員が起立をして緊張していた。職員を育てようとする意識は強く、少数者の
374,響いた。「動くな。われわれは、ブランデンブルク師団の、コマンド部隊だ。抵抗すると、全員蜂の巣にするぞ」それを聞いたゲシュタポの男たちの体が、目に見え
375,３）用例の説明…森下４発見したこと・研究の苦労・感想…全員５終わりのあいさつ…小山３発表の練習をしよう。発表
376,の生徒がピクニックに行った二日間だけで（八十人の子供が参加する大ピクニックでは、全員を一度に輸送することは不可能だったので、三日に分けて行ったのだ）、
377,で、三か条はいずれも信心の策励についてのものである。こうして教団を構成する全員が、まず協力一致の心構えを醸成した上で、つぎに具体的な財政改革への対処法である
378,行われたのである。伸一が、会場に姿を現した時には、既に全員がそろっていた。「どうも、お待たせしてすいません。正本堂の購入資材の検討で
379,抜きなくしてもぅてん−−−−！』って。おばちゃん以外の店の全員が、心で、『何でやね〜ん！』って、叫んだ声が僕の
380,。谷底に何故落ちない？？スター、スターいらないの？全員）あ〜〜〜、イエーイ！←８−１クリア！凄すぎ！さいとう）あとでサインもらってもいい
381,そういうわけにはいかない。そうなった時、彼女は絶大な支配力を発揮するのだ。もちろん全員を知るはずもないが、私が見る限りの高峰の周辺の人は、実
382,目にされる。シュトライヒャーが語り終えると聴衆は立ち上がって右手を挙げるが、それは全員ではなく、ばらばらと立つ感じなので、その演説者はあまり敬意を受けていないような印象
383,。土俵の周囲に集まり、四股を踏む二十人ほどの力士の姿が見える。全員、膝が隠れるほどの長さの、飾りまわしを締めている。近藤重蔵が言う。
384,、それに課長秘書をやっているみずえ警部補とを、帝国ホテルの十八階のレストランへ呼んだ。全員が丸テーブルに座る。「今年はお正月早々、死体での実習で、二人ともまことに
385,、歯磨き粉一袋が全部の持ち物だったので、簡単にすんだ。班長の指示で全員、臨時組に配属された。工場の中には、電気ミシンが七、八十台
386,渡るか、である。前者の場合、へたをすると追い払われる。あるいは一行の全員拘束ということになる。後者をとったとすると、最悪の場合は戦闘である。
387,は、「新入者め、ひどい目にあわせてやる」と息巻いた。二十名の新入者は全員が未達成者食になってしまった。工場に行けば食事はたくさん出ると聞かされていた
388,の落とした事件です。しかも、犯人の家族は被害者家族を脅したうえに、犯人は全員生きていて、家庭と自分の子までいる奴もいます。日本の司法の
389,なかった場合は、各自がキリストとの語らいを持った沈黙後に歌うことができます。全員による歌は長いものでなくても、すべての個々の祈りを一つにまとめるでしょう。
390,六時間後。キノコの効き目は切れてきたが、パーティーはまだ終わらない。羊たちが全員、醒めてきたのを確認して、今度は羊飼いをしていた僕やスケマツが
391,を深く考えない一徹と、ヤクザ社会の政治的判断というものがよく分からない万季とは、全員「邦山の怪我が思ったほど酷くなかったのは単に運がよかったからだ
392,合ってたのかな？＊ＭＣ→飛ばし。＊ｓｈａｒｅ→貴久君が歌ったあと全員で歌いサビは成亮君。日曜日、歌う前に小山君が「聞いて下さい。ゆっくり
393,。山田先生が今まとめて下さっているので、ある程度出来ましたらお送りします。あと、全員の似顔絵をイラストにします。とりあえず社主の下書きが出来ましたのでお送ります。
394,た。「オワ、立ち上がって大丈夫？」という声が飛ぶなか、立ち上がった全員が幹事とジャンケン。勝てば着席できるが、最後まで負け続けたら、次回の幹事をし
395,闇に葬るつもりかもしれないね」「―」「メキシコ政府ったって、議員の全員がこのことを知ってるわけじゃない。政府の一部と、軍部の一部だけさ、
396,今の宇宙が終わってからできる『次世代の宇宙』なんです」この場の全員がそれぞれの頭で考えている。ウーノとサーノに対して『魔女のナカユビ』で感じ
397,で死ぬという者もいます。大義のために殺すとなるとこれはもう全員がそうです。われわれから見るとバカバカしい大義でも、彼らにとっては神聖そのものな
398,下位ブロックで全勝を果たし、Ａブロック復帰を使命とされた吉田は、上級生をいったん、全員退部させ、心機を一転させようと考えたのだろう。が、寝耳の水の池田ら
399,。ウクライナ人シチェルビツキー、カザフ人クナーエフ、それに政治局員候補のアゼルバイジャン人アリーエフ、グルジア人シェワルナゼ、ウズベク人ラシードフ、白ロシア人キセリョフは、全員が共産党第一書記である。政治局入りしたのは、彼らの共和国の利益を守るためであると共に
400,リズムを取りながら。所定の位置に着くと前進をとめ、足踏みに切り替えて、全員の入場が終了するまで足踏みを続けた。秋雪の完璧な行進姿に、手のひらだけを
401,のウェイトレスにも及ぶ。そして、研修の後、夜の九時ころまで合評会となり、全員の前でサービスのよしあしを注意されるのだ。総支配人の加藤氏は厳しいので有名な人
402,には、いましばらく休んでもらおう。クリスはここにいて作戦室の運営だ」全員がうなずいた。クリスは、じっと爪を眺めている。リーオンが、地図を一枚
403,ね、とんちんかんなことをなさるのです」と女将さんは笑った。話しかけてみると、全員が澤の屋という旅館に泊まっている個人旅行者だと言った。誘い合って夕食にここ
404,支払われるのは６位まで」としているのに対し、『レーシング・オン』は予選通過者には全員支払われるとして計算している点が異なる。八十七年当時はそうだったが、あとで
405,日の読経は、平易な言葉で記されている「真言宗在家勤行次第」を参列者に配布して全員でお経をお唱えするという私のやり方も、無理なく行なえます。纐纈さんのお通夜
406,、反論を許さぬ口調で宣言した。だれ一人異論をさしはさむ者はなく、全員が射るような視線で楓と、その後ろにたたずむ玄斎を見つめていた。
407,来られた中村先生に、私どもは改めて考え及ばずの感を深うした。先生は全員に行き渡ってなお余りある、十数人分の軍手を用意してこられたのである。成る程、
408,は、直径が四十ｃｍ位の幾つかの段がある円板状の台の上に、全員が外を向いて乗っていました。その円板は６対の異なった動物の足首
409,神社五十五年５月、基地拡張計画案を知った住民はすぐに反対同盟を結成した。町議会も全員一致で反対を決議。砂川闘争は宮崎伝左衛門町長を筆頭に「町ぐるみ」の闘いになっていっ
410,？と思うような話の飛び具合（な気がする）。いつの間にか全員彼氏いるし？この１週間、どっかで放送されたのかいな？？？
411,と見る。スミ江は調理台の正面から廊下に通じる小窓を数センチ開く。そして、全員の視線を受け止めるように振り返ると流し台にもたれかかりタバコに火をつけた。吸った
412,火災が起きたため死傷者が集中した。ただし、２階部分は焼失を免れ、コクピット・クルーは全員が生存していて救出された。切り離された形の尾部では火がすぐ消し止め
413,「積雪」などかなり緊張した内容の交信が無線でなされる。ところが、昨夜は全員ぐっすり眠っていたため、それらはすべてなし。何も情報を得られない補給飛行機はただ
414,をぐるりと見回した。「モルデカイ、おまえはここに残って警戒していてくれ。さあ、全員、行くぞ」
415,，相補的に働く姿勢が大切である。また，守秘義務に留意しながら，仕事に関する情報を全員で共有できるようにする努力も求められる。連携・協力を実りあるものとするには，
416,！殺された！」子どもたちから、ミュラー先生、マイヤー先生、園長先生、医者まで、全員がぎょっとして集まってきた。みなは、だれが殺されたのかわからず
417,へ向かった。道路がファレアルウポ森林と交差する所で、私たちは車を止めた。全員が車から降り、困難な年月を経て、今日やっと危機から脱することができた森林
418,、１割のまま据え置かれます）３月下旬に現役並みの所得がある人も含め、全員に新しい「国民健康保険高齢受給者証」を郵送しますので差し替えてください。３退職者医療制度の対象年齢が六十五歳未満になります
419,未熟さの出るのがいちばんこわい。憲法や教育基本法を持ち出さなくても、子どもは全員、教育を受ける機会を与えられていますね。学校の教員は全体の奉仕者
420,・・・・ランチはたこ焼きにしました。おじさんが勝手に役割分担をして全員で作りました。今までなかなか美味しいのを作れなかったので色んなレシピを参考に
421,です。０期の食道ガンであれば、手術を受けた患者の５年生存率は百パーセント、つまり全員が治癒します。しかし、この段階でガンに気づき、治療を行える人はさほど多く
422,。玄関先では供廻の者がすでに準備を終えていた。悪天候なので、全員、雨合羽を着て、刀には雪水を防ぐための柄袋をつけていた。
423,たら、もう消えたもおんなじだ、と二人に説明してやした」「全員乗り移ってから、どこに運んだ」と、ヴィクトルが聞いた。ドミートリは帽子
424,についてです。私と社長はタバコを吸わないのですが、他の周りの社員は全員吸います。職場は社長の自宅を間借りしている感じで、８畳ほどの狭い部屋です
425,はライダーマンとモモレンジャーの方が良いと思います。ここまで来たら、ゴレンジャーは全員出すと思いますが、人気のあるアオレンジャーはピンで登場し、ミドの下で台座
426,現実にはまずありえないことだろうとは思うけど。何故って、幹部の連中は全員一丸になって、揉み消そうとするだろうから。そりゃあ、幹部ぐらいになったら、政界
427,なんか、ワタシのシッポかんだのよ。クウ２ねえ、でもおかしいわ…？全員なにが、おかしいんだ？クウ２あんなにつっつかれたのに、どこも
428,も田中兵曹も乗っている。心配していた急所の集合槽をやられている。炎のため全員が前席に集って来ている。熱さのため、苦しまぎれに天蓋が開けられた。
429,た村をゲリラと内通していたと疑う。村人に記念写真をとるという名目で、全員集め機関銃で打ち殺す。さらに、折り重なった死体を銃剣で刺し殺す。死体を集めガソリンで
430,話し合う声を聞いたところでは、三陟南側の高い峠に人民軍敗残兵が立て籠もっているので、全員、徒歩行軍による北上になりそうだということだった。柔道選手みたいに胸が厚いその
431,言ったらすわるんだよ。さんはい。あいうえお、自分の速さで、さんはい。全員あいうえお、かきくけこ、（もっと速く）さしすせそ、たちつてと、（もっと速く）なにぬねの、
432,を擦り付けることだからね。当時の朝廷の人々からしてみれば、我々庶民なんて、全員がそんなレベルだったということなんだよ」「そんな…」「いや、
433,は夜になると城に引きとっていたのだが、その夜は幕舎を張って全員泊りこみで、交替で夜どおし働き、翌日の昼を少し過ぎた頃にやっとおわった
434,は、当該事業の全部を譲り受けた者又は相続人（相続人が二人以上ある場合において、その全員の協議により電気通信役務利用放送の業務を行う事業を承継すべき相続人を定めたときは、その
435,除架はどうしても必要な業務であり，図書館が活動しているかぎりつづけなければならないものである。担当者の全員が納得するような除架を実施するためには，客観的でしかもシンプルな除架基準をあらかじめ設定しておけ
436,どうぞ…そのとおりです、不審の者、発見できません、どうぞ…そのとおりです、全員四名です、どうぞ…了解しました、失礼します、どうぞ…」「菰野さんに連絡し
437,は少々緊張の面持ちでしたが、母国語でのあいさつの披露やブラジルのサンバを全員で踊りだすと、会場はおおいに盛り上がりました。そのあと、各クラスに分かれて一緒
438,は、ぼくたちに、しばらくのあいだ、ホールへいっているように指示した。たぶん、全員の持ち物をしらべるのだろうと、中谷君がおしえてくれた。ホールのベンチにこしかけている
439,を制作していたが、彼の回想によれば、百人近くの人がいた動画課では全員が「ガロ」を予約購読しており、発売日になると、皆がいっせいに読み始めて、
440,適用すべき時期だと、判断された。所長代理と戒護課長の合意でそれを決定し、全員をあつめた。「解散ではない。一時解放である…」と、徳宮所長代理は条文第二項の
441,鞘を払っていた。勤皇浪士は抵抗するより逃げようとするので、おのずと逃げ腰で、全員斬殺された（八、九名、あるいは約三十名という説もある）。一名だけ屋根伝いに
442,第一に、コンピューターを利用して資料を入手し、ボーレン街の北七十七丁目と七十八丁目に住んでいる全員を調べあげる。そうした場所の駐車場を、フラーは利用している。彼女自身が監視してい
443,である。シーク教徒は頭文字で五つのＫを宗教上の義務としている。男は全員、Ｋｅｓ（髪やひげ）を伸ばし、それをとくためにＫａｎｇｈａ（くし）を
444,の悩み」は、「子どもの結婚のこと」（四十七．二％）であった。また、全員（三百十四名）に「結婚や結婚関連のことを、子どもと話をしているか」
445,挙げると怖いということで挙げない知事さんが何人かいるんじゃないか、もしかすると全員かもしれません。ぜひとも、その辺、この考え方をしっかり都道府県知事に伝えて、しっかりとした
446,どんな人なんでしょう。注意力が無い為簡単な事も出来ない。周りの人間が全員出来る事が出来ない人。
447,の初めに最後の執行委員会が開かれた。最後の執行委員会といっても、井関以外のメンバーは全員再選を期していたから、一期で身を引く井関の送別会のようなものだっ
448,。一名死亡三名が今なお行方不明早く全員が発見されることを祈ります。
449,ヴァジームさんと男二人がもどってきやした。旦那が金を数えてて、そのあと全員タクシーに乗ったわけで」「ヴァジームといっしょにいた男たちの特徴を言っ
450,てゆかざるをえないからだ。車長たちが了解したことを確認したパウルは全員に乗車を命じた。丘陵の後方で機関音が大きくなったのは彼が
451,ことかもしれいが、なんと言っても水彩の友人藤見千鈴は家族を全員亡くしたわけだし、やろうと思えばしてあげられることはいくらでもある
