,0
113,られるのだ。まるで舞台を見ているような気分になる。出演、沖ノ島住民、全員が主役。《港の雑貨屋で、何かを買った島人が、袋を
114,もあるオカマを膝の上に乗せようなどという男はひとりもいないのだから、全員が乗り込めるわけがない。結局ジャムひとりがはじきだされ、彼はバイクでタクシーの後ろ
115,になれば他の部分にも拡がるおそれがあろう。したがって治療儀礼には必ずビレック家族の全員が出席し、そろってシャーマンの健康管理の世話にならなければならない。「花の別れ」
116,は、ダイビング器材をフルセット無料でレンタルできるから、水着とタオルさえあればＯＫだ。スタッフは全員がＰＡＤＩのライセンス保持者で、グアムの海を知り尽くしたベテランばかり。滞在プランに余裕がない
117,とか「何のこと、タータって」と言い出し、とうとう「タータ、タータ」と全員で彼女をはやしたててしまったのです。次の日から、この女の子は幼稚園に行くの
118,ヤッツケ俳句は、ぼくを除いていい句はまずない（ナンちゃって）。全員、器用にハシと鉛筆を使い分けて、季題に挑戦。ナベの肉がどんどんなくなっ
119,ています。最後の指令を持っている人を立たせて制限時間内に（何十秒か）全員が手をつないでその人を囲むこと！二重に囲むこと！（ふたつの輪
120,を十年間続けることができたら、二百四十人と出会えることになる。そして十年経ったとき、紹介した全員に声をかけて、みなさんが一同に集える場を設けることができれば、素晴らしいと考え
121,を，斜め線で消して十五に，８を６と直しなさい。できあがった先生問題を全員で読ませる。違っていたら言い直しをさせる。この先生問題を，黒板に書い
122,美術に造詣が深く、職場の彼女のオフィスからもれるモーツァルトやベートーヴェンの音色を知る全員から慕われている女性だった。ディアナはテーブルに戻り、腰を下ろして、
123,穴は確かに大きいが、機動力を駆使した“つなぐ野球”を徹底させながら、全員で埋めていこうというのが牛島監督の戦略だ。昨シーズン、リーグトップのチーム打率．２７９を残しながら最下位
124,はいり、コクピットに行った。コクピットのサイド・ウィンドウをこじ開けて、グロイツマッハーに命じた。「全員、気をつけをさせろ」芝居がかった仕草によって、以前に植えつけられた規律
125,□七十五歳以上の健康保険の制度が変わります４月から七十五歳以上（になる）の方は、全員が現在加入している国民健康保険や社会保険（被扶養者を含む）から、後期高齢者医療制度の保険に加入すること
126,れている場合は、代表取締役●複数の取締役が共同して会社を代表している場合は全員が申請することになります。３登記すべき事項新本店の所在地と本店移転の年月日になり
127,ジョン！…」私は振り返った。「まあ、俺も含めて、チームの全員が、少しは力になれたかもしれないな…」ビルが感慨深げに言ってきた
128,てきません。チャイムが鳴って３分もしたころやっと先頭集団がやってき、全員がそろったときはゆうに５分は経っていました。ニコパチ効果で学級のふんい気は明るい
129,もなく、今度は米軍の上陸に備えてリンガエン湾に向えという命令が出た。全員歩きながら眠るほど疲れきった体のまま、部隊は北に向った。
130,「足腰たたねえようにぶちのめしてやれ！」中の二、三人がわめくと同時に、全員が木刀や棍棒をかざしていっせいに打ってかかった。「やめろ、人ちがいだ
131,てもいいんです。そしてこのレポ原宿キャットストリートにある、ＢＡＣＣＨＵＳ。スタイリッシュな店内だけれど、スタッフは全員アットホーム主義。気取らずにいける雰囲気と抜群のセンスに、遠方から通うファンも多いほど
132,赤道祭の経験のない者たち全員の力試しをした。泡だらけの顎ひげと乱暴な床屋が全員を大混乱におとしいれ、そのあとでバリントン＝パーヴィスの黒あざが現われたのだった。中尉に
133,廊下で一人ずつの肩を叩いて送り出した。二係は岩崎警視を除いて、全員がいなくなってしまった。他の係が不思議がっている。岩崎は管理官兼任だ
134,午後にあたしたちここにいるの？」「…」舞香の素朴な疑問は、全員の意思によって黙殺されることになった。今更、彼等の仕事の不自然さを問うたところ
135,れるのは，この問題に携わる理論家の数だけ，高温超伝導の理論がある（つまり全員違うことをいっている）ということである。異なる理論を唱える物理屋の間での論争
136,の薬物担当職員は大いに歓迎してくれたものだ。だが、分室の職員は違った。全員が私よりも勤務実績も仕事の実績もない。困った上司が来たぞ…
137,言った。「手遅れだ」息を切らせながら、モルダーが答えた。全員が、窓の外を見ていた。スピニーの懐中電灯が地面に転がっていた
138,。その中の何人かに「普段、ファンデーションはつけないの」と尋ねると、全員がとんでもないという顔で「ノー」と言う。「アイシャドウと口紅はつけて
139,だ？！）」…ってちょっと！全部男じゃん！みたいなぁぁ（嗚咽）。全員大好きだけどそれはちょっとさぁ…。一応、女なわけだし！●最近、
140,は藁にもすがる思いで大統領の注意を惹こうとしたが、検察長官を除く全員がテーブルの上手を見てうなずいていた。「ほかに評議会が検討しなければならない緊急
141,さて、妹可愛さに「黒の騎士団は全員”特区日本”に参加せよ」と今までになく驚天動地な発言をしたゼロでし
142,ある場合は、その者が遺産の六分の一を受ける。兄弟姉妹が多い場合、かれらは全員で三分の一の分け前を得る。これは、遺言と債務を果たした後のことで
143,。私の会社（東京）は大阪人の社長に変わったとたん、ものすごい経費削減、そして全員の給料を大幅に引き下げました。大阪人の下で働くのは初めてですが、
144,は断れる決断力を培ってくれます。ある消費者団体では、消費者展のテーマを決めるために全員で新聞の切抜きを始めました。各自の切抜きを元に話合いをして「
145,２敗本ブレーブス：ジョンソン（１）開幕ロースターが決定した翌日で、今日は全員マイナーの選手が出場。打線は全員マイナーではありましたが、ブレーブスの
146,。。。まず、３日。前任校で卒業させたクラスの保護者と飲み会。久しぶりに全員そろって、２次会まで。６時から始まって、十二時に解散。ママたち、大丈夫だった
147,は僕を含めて４人（男２名、女２名）いるのですが、僕を含む全員がそう感じた時があります。中には、本気で転職を考えている
148,近づいたことがあるか―大きいやつだ」「まあな」「あそこの捕虜を全員脱出させたい―手伝ってくれ」「馬鹿いっちゃ困る」ルーベンシュタインが肩越しに
149,に長いことつきあってくれてた奴（やつ）らがいる」午前６時０５分■「全員一斉送信でメールをくれるそのメンバーの中にまだ入っていることが、少し嬉（
150,ね。さすがはＫ・Ｃ、蜘蛛に負けない素早さと攻撃力を持っていた。グレーンベレーは全員退場かと思いましたが、しぶとくバート軍曹が付いてくるようだ。別に構わない
151,異例なのだが、献身的な女性たちの一団がたえずイエスの近くにいて、全員の世話までしていた。強力な布陣である。堂々たる宣教の一軍団が形成され
152,を示すのである。朝昼の食事の内容は適宜なものとし、ともに平等に全員に行き渡らせる。食事を質素にするのは法食の二輪がともにうまく運ばれ
153,みなさんはどう思いますか？あのね、Ａ型が何人いると思ってんの？？全員がそうじゃないし、他の血液型にもムッツリスケベいるだろうよ？！だいたい人を４種類
154,。日本人同様、ブランド物が好きなイタリア人でさえ、ここに来るヒトを見る限り、まるで全員が家に置き忘れてきたみたいな感じなのである。ブランド物のバッグに代わって
155,あろうはずがなく、空しく徒労に終わってしまった。そしてそこで一晩泊り、憲兵たちも全員交替になったが、われわれを現地の分遣隊に引き継いで帰隊する憲兵たちのうちでも
156,では新田の侍一人たりとも失いたくない」「さればといって、全員が病気になるわけにもまいりますまい」船田入道が言った。「それ
157,にしても、おいらたちが邪魔だったので、排除しようとしたにちがいねえ。けど、さいわい全員無事だ。それがわかれば、敵は次なる手を打ってくるにちがいねえ
158,の起きようはずはございません」生徒の良きところを信じる、それを守る。全員一丸となって、そのような空気を本校に作っていきたいと、かように考え
159,代用）を置いておき，鬼は鬼の面をつけます。その間に他の全員は逃げて，鬼ごっこが始まります。２大移動室外・Ａ人数二十人以上。用具と準備
160,来ないと後悔する。来ればわかる」理由を事前に言えなかったが、とにかく全員をかき集めて、新西はその日を迎えた。六十年安保の時代に創刊鹿児島新報の
161,の大使館員とその家族、六歳以下の児童を除き、指紋押印は台湾国内に居住する外国人には全員に実施されている。近年銃撃事件など、外国人によると思われる犯罪が増える傾向にあり
162,肩にかかっていた。オーケストラでは第一ヴァイオリンを弾き、その他の時間には、全員から求められ、せがまれる会計係であった彼は、どこに行くときも、留っている
163,見せる準備をした。ボールトが言った。「これから男が五人出てくる。全員一列に並んでいて―」「面通しくらい知ってるよ」ベンが途中で口
164,ました」―〈先生〉じゃ、今日は終わりにしようか。「引きこもりのほぼ全員が軽い多重人格」相談室を出た彼女を待ち構えていたのは、先生の妻
165,もう一枚、写真を…」「また向こうに戻られる計画は…？」全員がいっぺんに話しかけてきた。ダナはただ圧倒されて、呆然と立ち尽くしていた。
166,四十五分に渡る話し合いを行い、ロナウジーニョ側はあらためてミランへの移籍希望を伝えている。両者は全員がなるべく納得できる形での合意を目指し、バルセロナは「クラブが受け取った２つのオファー
167,○細野委員局長、もう少し趣旨を理解して答弁をしてください。ある年齢の該当者を全員データとして持ってきたんですね。どうなんですか、それは。○宇田川政府参考人七尾市
168,だと思っていなかったことが遅れの原因であると推認する。手を汚す仕事に全員が積極的でなく、「被告人ら相互に触れたくないとの心情」があったので、
169,乗っていた企画書を取り上げた。「当面、うちは全面的に黒崎戒に賭ける。全員が、黒崎戒を売るために動くということだ。ドラマ、バラエティの仕事はもちろん、映画
170,。子どもは、視写する。指示一詩を読みましょう。・一斉音読（二回）・全員立って、各自微音読（二回）発問一作者は、男ですか、それとも女
171,。山田川の橋のそばの山本さんの家の土間で熱いお茶をよばれた。全員がそこでかんじきをつけ、雪山を行く支度をした。上田の集落から
172,は地味な作戦が多かったですからね」司令部の会議にかけてみたところ、全員が閻錫山の討伐に賛成だった。仕方なく賛成した向きも当然ある。軍隊は
173,一人分の荷物はできるだけ軽くする工夫をして下さい」と小倉さん。たとえば夏ミカンを全員が一個ずつ持つのではなく、三人で一個にする。食器やコンロなども一人一人が持つ
174,よ。遊びに行けよ。その方が楽しいで。」すると，忘れた連中が全員やってきて，口々に「すみませんでした。」「もう次からは忘れませ
175,告知はするでしょう。あったら、病院のロビーにパンフレットを置いておけば、患者さんが全員加入してくれるかも。その保険会社の代理店になったら、儲かりますよ。無診査で加入できる
176,の点についてはともかく、救護及び危険防止の各義務の履行については、分担しても、全員の力を合わせる場合と変わらない措置を講じることができるときは、当事者間の協議により、
177,バス代・現地リフト代などを含む。申３月３日（必着）までに往復ハガキ（１枚３人まで）に全員の氏名、学校名・学年（年齢）、電話番号、性別、身長、靴のサイズ、利き足、
178,、しばらくしてから笠木が苦しみ出したというわけじゃ。つまり、矢尾を除けば全員に毒を入れる機会はあったわけじゃ。尤も、そうはいっても中杉が一番
179,方（六十五歳以上で一定の障がいがあり、広域連合の認定を受けた方含む）は全員「後期高齢者医療制度」の被保険者です３月中に保険証をお送りします４月１日から病院にかかるとき
180,は過労のため入院中ということで、名代と称して神代宗教授があぐらをかいている。全員の前に置かれた焙じ茶の湯飲みがまるで似合わない、ぎこちない沈黙に包まれた
181,保証の限りではない。現に、研究室の人間を使って実験をしてみたところ、ほとんど全員が平然とその板を踏んでしまったのであるが、後にあらためて調査した結果、中
182,握りしめられていた。「そしてあのとき」僕は一呼吸してから続けた。「全員が茶室に入るまでにはずいぶん時間がかかった。あくまでも本式に則ったご婦人方
183,時間代休”という形であてがっているので、表向きは遅刻にはならないです。朝礼に全員遅れずに出席していますが、その方だけは朝礼が終わってから出社してきている
184,ビタミン、ミネラル、ホルモン、そして蛋白、炭水化物、脂肪、アミノ酸などの栄養分）は、全員が東京駅から中央線で新宿駅へ行ってしまうわけではない。なかには山の手線でぐるっと
185,三年で、国内線には比較的若いスチュワーデスが多いことを考えれば、すでに中堅クラスだ。全員が折り紙つきの“上海美人”だ。上海でのトレーニングは、上海市内中心部の瑞金大厦二十四階に
186,ね。それから、私の次の売り込み相手は警察になるだろうともね」すでに全員が私をじっと見ていた。その内の半分は、確実に、どうやったら
187,」。スゴイ！３英代表Ｒ・サビン氏「ＳＦマンガは未来でなく今をよく映してるね〜」。全員かなりのマンガ通好評連載ケータイ刑事第８話「着身」【今月の重要参考人】芸大生山口典子さんついに登場、ケータイ電話
188,根拠があったわけではない。しいていえば、直感のようなものだ。子供たちの全員が、日本人としての特徴をそなえている―そんな気がした。そのことを
189,！〉「ドロシー、すべての部署の責任者を今日の三時に集合させなさい。全員です」「はい、マダム」会議室に入って来る幹部一人一人の顔を見ながら
190,と思う。当時としては、重厚ながら極めて進歩的な担当教師であった渡辺英男先生が、私たちクラスの全員に「将来どんな職業に就きたいか、順次に答えよ」と質問したことがある。かねて
191,みなで六本木のディスコへ急行だ」一斉に丸テーブルから立ち上がり、ナプキンをほうり投げ、全員足早にレストランを飛び出して行った。捜一にいる限りは、正月から休む暇
192,て来てくれた。やっと、夕方になって救援列車が来た。私たち一家は全員、疲れはてて、北京駅に着いた。故宮（紫禁城）の近くの旅館だった
193,た群読を、月曜日は一班、火曜日は二班、水曜日は三班…というように全員でやれば、創造的・持続的なとりくみとしても生かすことができるのです。ところで、この群読で思い出す
194,の抱える問題点を把握することができるとともに，会社方針の浸透が図れる，方針の達成のために全員の努力が向けられる，皆の問題解決能力の向上が図られる，役員・経営幹部・管理者など広い視野で
195,短く、変化にとぼしい田園暮らしの一喜一憂をそのまま反映していた。面接に応じたほぼ全員が安息日の朝、教会でフレッチャー家の人々を最後に見かけており、そのうちの数名
196,声がかかった。「失礼致します。柴彰殿から面会の申し入れが」その場の全員が顔を見合わせた。…全商連の情報の速さと正確さは州府を遥かにしのぐ
197,泳げるものではない。どんな生徒でも遅刻をして良いか悪いかという問いには全員が正解をするし、なぜ悪いかも理解できるだろう。でもできない生徒は必ずいる
198,ていただきたい。これが、実は、きのうも同業者十数名に電話かけたのですけれども、全員が絶対にそれは負債の部はだめだと言っているのですよ。提案者、ひとつ
199,れた方は十二名でございますが、入院された方につきましては既に全員退院されておるところでございます。それから二つ目の御質問でございますが、当省あるいはガス事業者
200,のですが、この邸の使用人はだいじょうぶですか。侍女、家令、召使、門番、全員を一度点検されたほうがいい。あなたは、皇族の中の、反楊家の急先鋒
201,、それを求める被災者が二十人いるとする。この場合、パンを全部半分にして全員に配るのか、子どもや老人を優先にするのか、全員の抽選にし
202,は、間違いなく奥女中の中にいる。不届き者の仕置は女性の場合、こうして全員に及ぶ。一人が違う行動をとろうものならば、その罰は全員に及ぶのだ
203,ご連絡を下さいませ。（注文時のＥ−メールまで。）また、宅急便の受付番号を先程、全員にご連絡致しました。今回は、ライが頑張ってくれたおかげで、飛の宣伝ポスターを
204,翌朝、朝食のテーブルに、ハリー、ハーマイオニー、ネビル宛の三通の手紙が届いた。全員同じことが書いてあった。処罰は今夜十一時に行います。玄関ホールでミスター・フィルチが
205,学制発布からほぼ十年が経過しても、なかなか就学率が上がっていかない状況の中で、全員就学を親の責任として義務づけた条文の重さははかりしれない。また「教育の
206,な場面で活躍した。選手・役員・関係者・ボランティアスタッフなど、施設や会場にアクセスするためのＩＤカードを持つ者全員にメールアドレスが与えられ、施設や会場に設置されたＰＣからウェブメールのような形
207,いう有名な話です。大きなかぶ（なければ座布団等で代用）を中心に，全員が輪になって座ります。始めに鬼が出ていって，「うんとこしょ，
208,をもっていることは知っていた。いつか、新聞に書いていたっけ。学校で全員が哲学の授業を受けるべきだって。そのエッセイには、「哲学を必須課目に
209,が終了して近くの料理屋へ行きその日の打ち上げ酒宴となった。関係者が加わるから全員で十人ぐらいの顔ぶれになる。そこは街の真ん中のいわゆる高級料理店といったところだが
210,は、当該事業の全部を譲り受けた者又は相続人（相続人が二人以上ある場合において、その全員の同意により事業を継続すべき相続人を選定したときは、その者）、合併後存続する
211,上下がある。ひとつのゾディアックに八人〜十人が乗る。キャアキャア、怖いといいつつ全員が無事に乗り移り、無線機を携行したドライバーがエンジンを始動させて、ホーン岬に向かっ
212,世界の楽しみはない、と言った。私がまた競馬映画を作る場合には、全員がいっせいに反対方向に逃げる、と騎手らしい冗談で私をからかった。騎手たちがパドック
213,向っているのか、私には分らなかった。ひとつだけいえるのは、彼女たちは全員、この写真を見るかもしれない両親のことなど、全く念頭にはない、
214,言い返した。「こっちだってギリギリでやっているんだ」公開飛行に向けて、全員徹夜で作業に当たってきた。肉体的にも、精神的にも、疲れはピークに
215,政経学部から七十八年に入社したという。「もう君の希望していたところはどこも全員内定している。でもそんなところに行かなくてよかったじゃないか。君はウチにき
216,成員がこぞって被排除項を抑圧し、はずかしめ、汚すことに協力させられる。（中略）全員一致はつねに暴力的である。（中略）第三項排除効果のなかでは、人間の群集化は
217,「面従腹背」の部下しかいないということだ。どれだけ側近がいようとも、全員がイエスマンばかりだ。金正日の命令であっても、その通り実行できるとは限らない
218,集まりの空気が、会議を前進させていくためにふさわしくない空気だということを全員に認識してもらうことである。会議を成功させるためには、ブレーキになるものをオープンに
219,迫る。宙攻は超低空で斜面を這うがごとく飛ぶ。「着陸しまーす」全員は、身をかがめて衝撃に備える。一号機は、斜面に腹をこすりつけて
220,た。この日の審査は、全犬種審査員の小生が委嘱されました。ハンドラーは全員アマチュアということなので、午前中はハンドリングの講習を１頭ずつ行ないます。ハンドラーは、
221,関係が明らかになっています。日本人のナルコレプシーの患者さんのＨＬＡを調べたところ、ほぼ全員がある特定の型をもつことがわかったのです。もっとも、日本人の１割強の
222,十フィート。五フィート。トリメインは歩調を落とした。いつの間にか警官たちが全員立ちあがり、じっとこちらを見つめている。そうしようと思えば、ハンディは易々そのなかの
223,くり色の鳥がとまりました。句会の仲間にその鳥の所在を伝え、全員が確認した直後、何と、一同の目の前で、翡翠がすばやく魚を捕らえる
224,は、記念品として生駒の特産品（写真）を贈ります。また、寄附していただいたかた全員に「広報いこま」を送り、寄附の状況や使途などを報告します。寄附をする
225,。二子々孫々の絶滅中国の一般庶民は、いま金儲けに懸命になっている。全員が拝金主義者になってしまった原因は、「改革開放」後に解き放たれた経済的活力のためだけではなく
