,0
0,からアイロンをかけます。地直しをしたあと，型紙を布の方向に合わせ，各部に必要な縫いしろの分量を考えて配置し，裁ち切り線にしるしをつけてから裁断します
1,では、三項目であったが、これらは、いずれも、日本語と韓国語に共通して各部のなかでももっとも多くの慣用句を生み出すものばかりである。そうして、例えば、「
2,〔貞一〕大佐、馬奈木〔敬信〕中佐等とともにすみやかに処理すべき必要を進言す。すなわち陸軍の各部が各別に行動し軍の意思が一途にいでざるよう考えらる。よろしく各責任者は官邸
3,その横幅を目一杯使いドライバーを包み込む様に埋め込まれた多連メーターパネル。各部にちりばめられたクロームパーツ・・・今じゃすっかり見なくなった三角窓・
4,．このようなズレを緩和する目的で，いったんＭｓ点近傍の温度に保った熱浴に投入保持し，各部が同じ温度になってから改めて焼入れする操作をマルテンパと称する．通常熱浴から引き上げて
5,という行為に働き、結果、全身で叩っ斬るという演技が生み出される。また、各部の形状的な解釈は、手足等一連の動作が流れるような自然さを生むべく、応力設定を
6,ずあんまり先走ったことはよそう。ポツポツいこうじゃないか。とにかく落ち着いてやりたいから、各部でもそういう方針でやってもらいたい」と、ざっくばらんに私の編集に対する心構えと
7,ものである。マンジャロッティーの感性と力学的な冷静な判断が、椅子の構造上必要な各部を一体化して、３次元曲面での構成を実現化させている。スプーンを曲げたような独特
8,。細部の形は、粘土で実際に作りながら決めていきます。輪郭と各部の大きさ・位置は雑誌などで、作るイメージの顔と似たようなものを探して
9,力いっぱい叩っ斬る」演技としました。まあ、これも前作の再挑戦として、関節や各部の解釈を、新しい解釈で色々と試してみたかったってことですね。ちなみにこの
10,、メルセデスエンジンに大きな負担をかけることになってしまった。あまりにも過激にコンパクト化したマシンは各部で不具合が生じ、尖った性格のマシンになってしまったのだ。リヤサスペンションにも特殊
11,にして二千番弱のものが、Ｍ符号付きであった。ニコンＳの時代になると、各部の工作は格段に良くなってくる。ボディーの砂型鋳物にも加工の跡がなくなり、
12,千九百六十四年（昭和三十九年）「団結の年」は、会長山本伸一が各部の友に贈った、四首の和歌で幕を開いた。黎明の我等が
13,は当然の装備▲徹底した防水対策はタイロッドにタミヤのラバーバッグを使用。さらにスポンジを各部に追加して万全▲アンダーカウルはシャシーへきっちりとネジ４本で固定して、脱落などの
14,。原稿をセットしようスキャナの接続とソフトウェアのインストールが終わったら、次に、スキャナの各部の名称と機能を確認して、原稿をセットするまでを学習しましょう。スキャナ各部の名前と
15,の殺害を暗闇の中に設定したので、こうした照明器具が自分の身体の各部に必要であった。この地方では、夜間川漁をするとき懐中電燈一個を手拭など
16,「うんっ」あたしは、力いっぱいうなずく。もう、春もおわりにさしかかり、各部の新入部員の争奪戦も、とっくに静まっているころよ。いまさら、入部なんて、ね
17,バランスをうまくとる６‐２緊張度のチェックリスト仕事の前日や当日に、体の各部や心に注意を払って３段階評価する。左に答えが片寄っていれば緊張が高まっている
18,に掛かっている。マティスの牧歌的な裸婦像が、ここにまた登場している。デュシャンは、各部を分ける黒い線、ほぼ三角形の構図、そして木の梢など、マティスの作品から
19,に重要視される傾向がある．建築史上では，古い建物の調査を行う場合，各部の寸法を計測しながら図面化していく．図面化することで建物の特長を顕在化することになる．つまり，
20,ところ市民会館小ホール前◆内容創作こけし作家の作品鑑賞、絵付け体験◆講師渋川こけし人形会の皆さん◆定員各部十五人（先着順）◆参加料五百円（材料費・当日集めます）◆持参するもの筆記用具、ぞうきん
21,と二番目のオペラ『火の飢饉』作品五十である。『英雄の生涯』はその各部の区分を見ると、これまでの意味における交響詩よりは、古典的な交響曲に近い
22,下がったことを週刊誌が伝えると、その週刊誌の切りぬきが、どこからともなく各部の部屋に張りだされる、というような陰微な出来事もあったのです。新しい
23,余録英語のコリドー（ｃｏｒｒｉｄｏｒ）は建物の各部をつなぐ廊下、回廊のことだ。都市と港を結ぶ細長い地帯を回廊地域、指定さ
24,には目標がいかに達成されたかを評価する目標管理制度を導入しています。平成二十年度の各部の目標をお知らせします。※部や課の前年度の目標やその成果は市ホームページに
25,顔の上にはいくつものツボが重なり合っている図１の方法で全身の各部を分類し、１年十二か月の月日の流れに組み込み、そこへ図１と同じように
26,もちろん、司会進行について」五時限目にある部活紹介は、東ビ大附属の毎年恒例行事である。各部が体育館でさまざまなパフォーマンスを行い、持ち時間内で新入生たちへＰＲを行っていく。新入生にとって
27,（漫画家。代々木アニメーション学院講師、代表作「トップ屋ジョー」）ほか。［賞］大賞（各部１人）、優秀賞（各部２人）、佳作（各部５人）等。記念品と賞状を進呈［発表・授賞式］平成二十一年
28,でも理解できるよう編集している。また、各部ごとに設けているガイド・ラインを読んでいただければ、各部の狙いと大まかな流れは掴むことができると思う。
29,あるように見られる。一方、先の図で表しているものは、いわば、各部のなかでももっとも句例の多いものを中心としての指摘であるが、その
30,出力は七百四十八の九十七ｐｓから百三ｐｓにアップしている。カウルをこうして外してみると、各部がユニット化されたお陰で整備性が大きく向上していることがよくわかる。また、ステップは
31,釘見「通常攻略」の「釘調整」と同じように、丸い光を移動させて各部の釘を確認できる。もちろん直せないので、どういう状態になっているかを確認するだけ
32,各部に区分しなければならない（施規五十一）。３負債の部は，流動負債および固定負債の各部に区分しなければならない（施規七十六）。４施行規則第四十三条に規定する引当金は，３にかかわらず，
33,の部。内容８ホール２ラウンド（全十六ホール）を行います。競技時間は１時間半程度です。各部の上位入賞者には賞品を差し上げます。参加料一般五百円、小学生三百円（当日ご持参ください）。申込
34,Ｂ６、葉酸、リボフラビン、Ｃがかなり不足ぎみとのことである。ビタミンは人体の各部ではたらくでは、ビタミンが人体のどの箇所でどのように活躍しているのか、
35,，卵殻，卵白および卵黄の３つの部分から構成され（図２‐三十），各部の割合はそれぞれおよそ十％，六十％，三十％という数値を示している．卵殻は，
36,では，まったく同じ量のＤＮＡを含む体細胞がふえていく。表１ウシの各部の細胞中のＤＮＡ量（単位：ｐｇ）ボアパン（千九百四十八）＊ｐｇ（ピコグラム）：
37,）ほか。［賞］大賞（各部１人）、優秀賞（各部２人）、佳作（各部５人）等。記念品と賞状を進呈［発表・授賞式］平成二十一年１月中旬。入賞者のみご連絡します
38,。作図では目や鼻などの細部の形はあまり問題ではなく、輪郭や各部の大きさと位置が重要です。デッサンが上手くいってなくても、顔のバランス
39,ようになっているので，少し調節すればよい。しぼりは，見やすい明るさに調節する。光学顕微鏡の各部の名称とはたらき調節ねじ…回してピントを合わせる。鏡台接眼レンズ鏡筒…中は空洞レボルバー
40,場合共有である要役地・承役地が分割または一部譲渡された場合には，地役権は，その各部のために（要役地の場合），またはその各部の上に（承役地の場合）
41,持ち、全五十部から成るが、イウエをいかに分類したかは不明である。次に、各部を、乾坤・時候・気形・支体・態芸・生植・食服・器財・光彩・数量・虚押・複用の十二門に意義分類する。序文に「専擬海蔵略韻分二十六之門」とあることによって
42,良くなる。ただしその半面、大きくしすぎると中間域がなくなってしまう。ともあれ、インマニの各部の寸法などによって、効率良く吸気できる回転域を変えることができるわけだ。純正よりも高回転で
43,ジェミュール」と名付けた極小で多数の粒子の存在を想定している。そして，体の各部にはそれぞれ固有のジェミュールがあり，それらは自己増殖し，体液を通じて移動が可能であり生殖細胞
44,を■■市長から、財政状況については■■副市長から説明があり、各地域における政策などは各部の部長から説明がありました。その後、市民の皆様との熱心な質疑応答
45,について、主なものを紹介します。それぞれの役割について確認しておきましょう。ＯｕｔｌｏｏｋＥｘｐｒｅｓｓの各部の名称と役割ＯｕｔｌｏｏｋＥｘｐｒｅｓｓのウィンドウは、フォルダ一覧、メッセージ一覧、連絡先、プレビューという４つ
46,たらやればいいことだし。エンジンオイルも交換したし、ギアオイルも替えたし、各部のネジを増し締めしたし、グリスアップもしたし、ワックスもかけたし、
47,ｏｎＥ五百クラスアップを実感させる６．１モデルＳＰＥＣＩＦＩＣＡＴＩＯＮＳ１６．１リッター化が図られたＶ８ユニット。各部のフリクションロス化とブラバス独自のエンジンマネージメントにより、完全制御される２ブラバスの現行コンプリートモデルにはモノブロックⅥマルチが
48,、林業政策、福島県の状態が私は心配になってきたので、農林省の各局、各部がどうなっているか調べていただいて、後刻私に説明に来てくださることをお願いして
49,写真３‐３‐１‐１顔の作図デッサンに自信がない方はとりあえず各部の大きさ、位置、輪郭を決める程度でもよいでしょう。曲線がうまくかけない
50,説明する。日々のＷｉｎｄｏｗｓ九十八の操作で必ず使うものなので，用語はともかく各部の働きは覚えておく必要がある。１スタートボタンアプリケーションを起動したり，Ｗｉｎｄｏｗｓ
51,各部に区分し，固定資産の部は，さらに有形固定資産，無形固定資産および投資その他の資産の各部に区分しなければならない（施規五十一）。３負債の部は，流動負債および固定負債の各部
52,必要がある。また，直流領域まで使用できるものはほとんどないので，汎用分析システムとして使用するには各部の機能を詳細に確認する必要がある。参考文献
53,３報告・統制システムの導入―の３つを柱にしている。権限の分散化は議会側と各部（責任者）の間での成果契約に基づく。各部の責任者はこの契約に基づいて
54,がいえる。ⅤではＣセグメントのクルマがここまで来たか、と驚かされるほど各部のフィニッシュレベルが向上している。なかでもボディのチリは、より詰められた感が
55,に総員の九割を占めり」（「満洲国人事行政指導方針要綱」）と報告されている。また、各部における状況についても、「各部ともに比率に数倍する日人を採用せり」（千九百三十五年
56,‐１の構造．ネジとナットの締め付けの際には，必ずロックワッシャーを追加して各部の導通を図ることまとめ作業の注意点図８を参考にケースを加工したら，ロータリースイッチ
57,もつ二次胚が形成された。このことから，シュペーマンは，移植した原口背唇がまわりの各部に働きかけ，その部分の予定運命を変えて二次胚を形成したものと考えた。
58,、トルクレンチも適正に数値を計測できない。グリスを塗ってから、トルクレンチで締めつける。各部を規定トルクで締め付け、作業完了↑クランプの２本のボルトを均等に締めつける。ここのボルト
59,角膜を誘導する（三次誘導）。このように，誘導が連鎖的に起こることによって胚の各部がつぎつぎと分化し，複雑な器官が形成される。５内胚葉による誘導原口背唇による
60,はヴァータというドーシャを強くもっているからです。そしてそのヴァータが、今現在、体の各部において多少バランスを失っています。それが、消化管であり、首や肩であり、子宮である
61,［表の削除］を選んで消すことができます。Ｃｏｌｕｍｎ表の呼び方表の各部には、それぞれ右図のような呼び名があります。この呼び名で操作説明を行うので
62,、しっかり確認を。心配な場合は一旦ＩＣを外しておいて電源を入れ、各部の電圧を計ってみればいい。４ピンにテスターの黒、８ピンにテスターの赤を当てれ
63,統括することになった。そして経営健全化計画の計画自体の策定とその実施の実務上の責任者となり、各部との調整にあたっていた。四月九日の支店長会議の翌日、午前八時半より本店
64,（数字自体が発明の構成上の必須要件の１つである場合）を除き，設計図面のように各部の寸法まで記載することは必要でない。もっとも，発明の構成がきわめて具体的で，
65,に運ばれたとするなら、ものの数分で正常な思考能力を失い、身体の各部が凍傷を起こし、一日で死に至るだろう。八千メートル級の山の頂上は、あらゆる
66,は相関があると述べている。お茶の道具の茶入れや釜、茶碗等には、各部に名称が付けられている。口造り、咽喉（のど）、肩、胴等と呼ばれ
67,ともに、市場に浸透しつつある。入念な造りを可能にしたのは、各部のユニット化で部品点数を大幅に削減できたからだ。スッキリした造りでありながら、コストダウンも
68,とし、一旦各部から総務庁へ提示される行政事項が同庁各機関に依って再検討され、国務院会議を通じて再び各部に放射され実行に移る、いわゆる総務庁中心主義の行政組織は過渡期における最も理想的な方法で、
69,心を知る人は、誰もいなかったといってよい。式次第は、各部の代表抱負に移った。学生部長の渡吾郎、女子部長の谷時枝、男子部長の谷田昇一、そして
70,ピグメント印画法を想定していると思われる「印画に於ける技術及技巧による画面の全部又は各部に於ける描写の疎密の度の変更」や空に雲を焼きこむような部分的モンタージュ
71,東京に出張したことになっていた」と明言。証言によると、各課の裏金はいったん、各部の筆頭課（刑事部の場合は刑事企画課）に集め、筆頭課は「課費」と称して
72,振った。これが、夜明けまえの数時間というものだった。この時間、肉体の各部は潮が引ききった状態にある。昔から軍隊が奇襲に対してもっとも弱点をさらす
73,逆上と云う者である。でこの逆上を癒やすには血液を従前の如く体内の各部へ平均に分配しなければならん。そうするには逆かさに上った奴を下
74,られているものだ。仏塔の建築様式も基本的にこれに則っている。塔を構成する各部の名称の一例（奈良・薬師寺三重塔）仏塔鑑賞の手引き仏塔を知る場合、どこを見るか
75,なり、頭は山の頂となり、骨は岩となりました。同時に各部がだん〳〵大きくなつて、終にアトラスは一つの山となりました。而して（こんな
76,祈は、ようやく自分が現在置かれている状況を漠然とながら覚ると、体の各部を確かめてみた。が、ざっと見たところどこにも異常はない。もしや
77,各部の名称である。図２‐３ソバの形態図２‐４ソバの各部の名前（菅原，千九百七十四）１地上部にくらべて根の発達は劣る
78,の脳神経核、伝導路の中継核、上行と下行線維からできている（図十八）。脳幹の各部におけるこれらの構造間の関係を良く理解するために、脳幹を錐体交叉、内側毛帯交叉、オリーブの中心部
79,はっきりしてきます。そして、その成長や変化があまりにも急激なために、身体の各部のつり合いや身体と心のバランスがとれず、いわゆる無器用時代を迎えているのです。
80,を使用した。エンジニアはコンピュータ端末の前で設計を確認し、さまざまな角度から部品の各部を見ることができた。どの部品についても作業の履歴を遡って確認し、実験結果を呼び出し
81,と、いろいろな病気が快復したという事実が証明するものである。すなわち、からだの各部の固有の働きと、その機能が神経系の健全な状態に依存しているとするなら
82,“凛”とした一筋の気が体の中心を縦に通り、身体の各部が統一された感じになると表現しています。次の段階では、丹田
83,バンド（ベルト）のかかる線のこと。同じ格の部位が治療点になる全身の各部を１年十二か月の月日の流れに沿って考える全身の各部位を１年十二か月に分類する
84,２章顔は身体の各部とこのように対応している身体の各ブロックはこのように対応する人体のどんな小さな部分も
85,（ドイツ語で「小さいソプラニーノ」の意味），最も大きいコントラバスがあります。構造と各部の名称ホール番号と指番号▽ホール番号と，そのトーンホールをふさぐ指の番号は同じです。
86,見える持ち方を意識してみましょう。持つところ・弾くところに名前はあるの？図で各部の名称を見てみましょうギターの各部の名称です。弾き方の説明の中に
87,の厚みは急速に増加するが，部位ごとに発達速度が異なるために，折れ曲がり等の変形によって，各部の相対的な大きさ・形が著しく変化する。特に頭側（前方）の神経管は袋状に拡大し，
88,でごらんの通り。タイヤなんて余裕のヨッチャンです。特徴的な左側ピラーレスデザイン。強度を確保するために各部の補強で重量的にはターボないと走らないっす。ドアは直角まで開くの
89,「Ｇ快」・出展作品の状況：ガンキャノンを解体、製作開始♪（各部に金属パーツ使用！！）○企画主催「Ｒａｌ」・出展作品の状況：
90,が必要となってくるでしょうか。はじめてパソコンに触る方もいると思いますので、各部の名前と役割を確認しておきましょう。パソコン各部の名前をおぼえておく電子メールをする
91,ダンパーの耐久性低下に関しては、グリップ向上によってタイヤからの入力が増大し、それを支えるサスペンションの各部により大きなストレスがかかることになります。同時に、インチアップによってバネ下重量も増大しますから、
92,一方、資料Ⅰの身体語彙慣用句一覧のなかでは、句例の提示は省略しているが、各部のなかには、これらの主な身体語彙項目以外にも、句例そのものは多くないにしろ、
93,方形パルスがある。この波形の周期と衝撃係数を求めよ。３．図２のパルス波の各部の名称を（）に記入せよ。図２４．図３の回路でスイッチＳを
94,様相を一括して図にまとめて表すと、次の通りである。以上は、各部のなかでも、両国語に共通して比較的豊富な用例を見せる、いくつかの主な
95,、七十六参照）。次に包みを裏返し、「のの字がけ」（図２）を各部がきちんと張っているようにかけていきます。巻きはじめの小さな輪に動端を通し、
96,対象高校生以上（弓道部のある学校の生徒を除く）料金２千円開講日納入定員各部二十人申し込み順持ち物白足袋申込用紙配布１２３＝白鳥アリーナ、沼ノ端スケートセンター、総合体育館、日吉体育館
97,年次計画を作成。議会側がそれを承認すると、必要な予算や権限が与えられる。各部の責任者は１年に３回、成果がどの程度上がっているかなど、契約内容の途中経過を
98,のキットは、基本的にすべて『谷折り』だ。５折り曲げたデッキは、後端や各部の梁をハンダづけして『口』の字型に組む。ただし、矢印で示す梁は
99,食品部、ギフト詰め合わせの進物部などの主力事業部の他に、海外、アミノ酸、医薬、化成の各部がつくられた。その後開発された大きい商品の中には、七十八年の中華合わせ調味料
100,「臨時總会ハ留学界ノ代表機関タルモ目下ノ状況ヲ見ルニ總務部交際部ニ人無ク庶務、会計、文牘ノ各部ニ僅カ一人宛ヲ剰スノミナリシモ此二十三輩ハ阮湘、龔德柏、呉一峰等ノ私党ニシテ仮リニ総会ト
101,図１では２つの月に分割されています。月日の巡りと身体の各部を矢印に沿って見ていくと、十二月十五日に位置する頭頂の百会というツボから、
102,さまざまなくふうがされていました。ここで大鎧のクイズです。■大鎧の各部の名称Ｑ１胸の前についている栴檀板（右の胸）と鳩尾板（
103,この方法によることが多い。５資本の部は，資本金，資本剰余金および利益剰余金の各部に区分しなければならない（施規八十八）。（２）損益計算書の項目区分記載上のポイントは
104,羽を広げると七十ｃｍになる。トンボなど昆虫は，酸素を気管でからだの各部に送っている。この方法の場合，現在の酸素濃度では，こんなに大きなトンボは
105,などについて学ぶ。■この章で学ぶこと■１パルスの波形と応答パルス波形の各部の名称や，パルスの種類などについて学ぶ。また，パルスがＣＲ回路に加わったとき
106,分割してインダクタンスで直列に連結して全体に遅延回路を作るという手法です．遅延回路によって，各部からの音放射の時間的遅れを作り，点音源的な音放射をするようにして，部屋の
107,最小回転半径：５．４ｍボディカラー：ロイヤルネイビーブルーパールＲｏｏｔｓｏｆＳ二千▲Ｓ六百はＳ五百の各部を手直ししてパワーアップしたモデル▲最高速度百六十ｋｍ／ｈを誇るＳ八百▲Ｓ五百はホンダ初の４輪乗用車
108,説明をすれば＝マルクス・レーニン主義内では思想の共存はない。云々。吉田書記局や各部につたえたか。宮本書記局も満場一致でやった。吉田では、蔵原が
