,0
109,ました（＾ｏ＾）。古くてサビサビの反対側のネジも外して新しいボルトで固定します。各部のネジもチェックしてオイルを注して完了です。で、未だ来客には時間が
110,危ないいうので、クシタニで加工してあげたのが最初です」。膝のバンクセンサーや各部のシャーリングも、早い時期から実用化に成功していた▲鈴鹿サーキットでのレース前、クシタニの
111,弾くところに名前はあるの？図で各部の名称を見てみましょうギターの各部の名称です。弾き方の説明の中にも名前が出てきますので、覚えておい
112,甘味は舌先に，苦味は舌根に，酸味は舌側縁に，塩味は舌尖などの各部に感じる。辛味と渋味は，触覚や痛覚がまじった複雑な感覚である。
113,にまわる、あるいは逆ひねりと言われる“あれ”です。この法則をうまく利用すると、各部の動かし方により腰の向きを変えず脚部のみ動かすといったこともできます。ロングターンの
114,名たんていカゲマン」）、江波じょうじ（漫画家。代々木アニメーション学院講師、代表作「トップ屋ジョー」）ほか。［賞］大賞（各部１人）、優秀賞（各部２人）、佳作（各部５人）等。記念品と賞状を
115,、瞳孔の拡大、縮小などの中枢であり、小脳は、筋肉運動を調節し、体の各部の平衡感覚の中枢をつかさどる。延髄は、呼吸運動、血液循環の調節の中枢、咀嚼
116,扱いにくく，メインテナンスも特別であるかの印象を受けるかも知れない．しかし，こまめに接して，各部の点検を確実に行っていれば，少なくとも無用なトラブルからは回避できるだろう．つまり，
117,テーピングを実施する．１．テーピングの目的テーピングｔａｐｉｎｇは粘着性のあるテープを身体の各部に巻いて，運動器官の保護や補強を行う技術である．我が国では二十世紀の
118,触る方もいると思いますので、各部の名前と役割を確認しておきましょう。パソコン各部の名前をおぼえておく電子メールをするには、「ウィンドウズ」が使えるようになっ
119,た古海忠之によれば日系対満系の比率は財政部、実業部は五対五、司法部四対六（以上の各部はのち六対四に変更）、民政部、文教部、外交部、軍政部三対七、地方官庁、
120,を指定しています。Ｑ＊０８０イメージマップを作るにはイメージマップとは、画像の各部にリンクを割り当てるものです。ｍａｐ要素にｎａｍｅ属性を定義し、ｍａｐ要素の子要素のａｒｅａ要素で、
121,ＰＩＣ十六Ｆ八十七ＸのＡ‐Ｄコンバータ図１‐六十七は，ＰＩＣ十六Ｆ八百七十七のＡ‐Ｄコンバータのブロック図と各部の説明です．このＡ‐Ｄコンバータの分解能は十ビット（千二十四分１）ですが，これは比較的粗い
122,が、指に切れ込みを入れ、呪符を０．３ｍｍプラ板で製作して持たせたくらい。あと各部を少々リタッチしてます。スミ入れが一部流れていない部分があるのが心苦しいですが
123,数アンペアと少なく，スリップ・リング（ｓｌｉｐｒｉｎｇ）がロータに設けられている。次に各部の構造について述べる。図３‐十四オルタネータの構造１ステータ（ｓｔａｔｏｒ固定子）
124,などが、他のソフトとは多少異なっています。また、キーバインドやその表記方法、各部の呼び方なども馴染みのない用語が用いられます。本章では、まず基本的
125,ます。そして、主に次の３本の冠動脈が心臓を取り巻いて、枝分かれしながら心筋の各部に入り込んで、必要な栄養分を供給しています。主な枝は、図表２の
126,に表すと、次頁の通りである。右の表は、上の段に、各部のなかでもっとも句例の多い日本語の項目を順に並べ、下の段には
127,なっているかをチェック。土井さんが宇宙で使う電動ドライバーなどを手に、パレットの各部を実際にさわって検査したところ、接着剤がはみ出した約二ミリのトゲが見つかり、直ちに削り取っ
128,地面を蹴る力を強くすればスピードが上がるスピードを増すには、身体の各部の中でも特に「足」が鍵になります。足で地面を蹴る力
129,記載しなければならない（施規五十）。２資産の部は，流動資産，固定資産および繰延資産の各部に区分し，固定資産の部は，さらに有形固定資産，無形固定資産および投資その他の資産の各部
130,」（「満洲国人事行政指導方針要綱」）と報告されている。また、各部における状況についても、「各部ともに比率に数倍する日人を採用せり」（千九百三十五年五月、関東軍参謀長より軍務局長宛電報）という
131,１貸借対照表には，資産の部，負債の部および資本の部を設け，各部にはその部の合計額を記載しなければならない（施規五十）。２資産の部は
132,内側（ブラックホールに近い側）の方で温度が高くなっている。降着円盤からは、各部のそれぞれの温度に相当する熱放射が放射され、その重ね合わせが全体的な連続光放射となる。
133,が隠れている。人間存在のヒエラルキーの最高の状態である天使性が、人間喜劇という体系―その各部はのちに組み合わされることになる―の上に君臨しているのだ。バルザックがすでに千八百三十二年からその
134,研究が行われた。しかし、自動車用エンジンとしては、エンジンの大きさに対する出力の低さ、各部の耐久性、出力の制御方法、コストなど課題が多く、現在では開発は下火に
135,合印をつけます。しるしは細く，くっきりとつけるようにします。ミシン縫い各部をミシンで縫い合わせる前にしつけ糸で仮に縫っておくと布がずれません。ミシン
136,感じたり、イメージすることであり、日常の生活の中で体験していることを、身体の各部に記憶させたものを使っている（蘇らせている）にすぎない。「コップが
137,百九十六に達し、魚がマイクロアトールに寄りついていることを示している。魚はマイクロアトールの各部を、区別なく利用しているわけではない。マイクロアトールの部位によって出現する魚類が異なっている。その
138,からトルク感があって、小回りも利き街乗りには最適のバイクかと。短所…各部が錆びやすいらしい。教習車として乗ったことがあります。
139,また「満洲国の政治組織の中で、最も特異的な存在」（賴永五朗「国務院と各部を語る」『創造』千九百三十九年十月刊「躍進満洲国の全貌」）として喧伝されたのである。
140,が違います。いろいろな条件によって異なる火加減をマイコンに記憶させておき、釜の各部に取りつけたセンサで温度を細かくチェックしてファジィ制御（六十六頁）を行っているということで
141,。権限の分散化は議会側と各部（責任者）の間での成果契約に基づく。各部の責任者はこの契約に基づいて、どの程度のコストでどのような成果を上げる
142,―どうして自分が失神しなくてはならないのかよくわからなかったけれど―転倒にそなえて体の各部の筋肉をひきしめた。しかし何秒かたっても私は倒れなかったし、
143,を行ったプロポユニットからのみ制御が可能である．図５‐２：新ラジコンシステム（プロポ版）各部の名称図５‐３：新ラジコンシステム（プロポ版）受信ユニットの名称受信ユニット接続例次に新ラジコンシステムの
144,徐々に深部へと移っていく。７回目ぐらいまでは体の各部分をフリーにし、各部がたがいの動作を制限しあっている状態から解放する。そして、最後の３回で、体全体に
145,であるが，実際には図２のような波形になる。図２に方形パルスの各部の名称を示す。図１いろいろなパルス図２方形パルス波の各部の名称
146,。で、母親と一緒にすごすご帰る一年ぺの根性をたたきなおそうとして、何度か各部の連中が集まり、怒鳴りつけたわけ。けっしてなぐりはしなかった。それを一年生
147,学術の成果を国民に還元するための活動として、主催講演会等を開催している。また、このほか各部や研究連絡委員会等が中心になり、学・協会との連携の下に、各種の学術上の問題
148,状態のことを指しています。この「トップ」の時点で、その他すべての各部がリリースのための準備を終了していなければなりません。遠くへ飛ばそうとする
149,がある。彼は巨大な図体を持ち黒い千貫の重量を持つ彼の身体の各部はことごとく測定されてあり彼の導管と車輪と無数のねじとは隈なく磨かれてある
150,もらわないと、企業としてはペイしないということになる。そこで以前、私は各部の部長を全員呼んで、「なんとか８を９にできないか。全部員が８時間
151,高めた人事としました。三つ目に、部次長ポストについては、従来、各部に専任次長が配置されていましたが、課長兼務の次長配置で済む部については
152,ご自身自ら、アタマでご自身の体をバラバラに分け縛り付けて居られるから、体の各部は益々酷き有り様と鳴りて居るのぞ。日本が世界のヒナ型申すは
153,の写真を、隼子は社内報で発見した。先週である。新年度になった四月はじめ、各部の新入社員が紹介されていた。自分が大勢の中のひとりになってしまう都会
154,建国匆々の国家としてよりよき行政的効果を挙げるためには分散主義より集中主義を可とし、一旦各部から総務庁へ提示される行政事項が同庁各機関に依って再検討され、国務院会議を通じて再び各部に放射され実行
155,は貧困の代名詞的存在であった。３、ソバの形態と生育の特徴（１）各部の形態と特徴図２‐３はソバの形態を示したものである。草丈
156,た物質）は、粒子から離れて血液やリンパ液の流れにのって、からだの各部に移動して、それぞれの場所でなんらかの作用を及ぼすことも考えられる。心配
157,の下端からのぞくことができ、必殺仕掛人が一発刺せるところとしても知られています。脳幹の各部の名称とその由来視床：視神経が通る床。英語ではタラムス、その語源は
158,市長の政策的予算と、義務的経費（人件費、扶助費、公債費）を除いた予算額を事前に各部に配分し、担当部署の考えを尊重して予算編成を行いました。■一般会計は十三％の
159,画面の説明Ｗｉｎｄｏｗｓ九十八の操作において重要な，Ｗｉｎｄｏｗｓ九十八画面の各部の名称とその働きについて説明する。日々のＷｉｎｄｏｗｓ九十八の操作で必ず使うもの
160,。認証工場であり技術力は高い’八十一ＦＬＨ￥百六十五万ほぼフル・ノーマルのフォルムを維持しつつ、各部にしっかりとメンテを施し、安心して乗れる１台。きれいなブルーのカラーリングが印象的だ
161,（原書では、第一部一〜二百九頁、第二部二百十〜三百頁、第三部三百〜三百六十頁）、物語の舞台としては各部にそれぞれ南ア、ニース、南アが割り当てられている。しかし、三部構成といっても頁数を見れば
162,整理部に送る。４整理部では、編集各部から上がってきた原稿を客観評価し、各部にとらわれない独自の判断で見出しを付け、最終的な紙面作りを行う。５校閲部
163,．９）．この分類方法は，純粋に形態学的なものでしたが，脳の各部の機能が明らかにされるにつれ，大脳皮質の機能的な区分けともよく一致することがわかり
164,手を引っ込める反応を起こすのに使われる。このように脊髄は、体の各部で起こった出来事について、感覚ニューロンの軸索を伝導してきたインパルスから知り、それに的確
165,が詳しく説明をしてくれる。第二次世界大戦中に海に沈んだ米軍戦闘機は、プロペラ、比翼など各部がそのままの形をとどめているし、全長百二十ｍの沈船スエヒロ丸は、いまでは魚
166,農林水産省といたしましては、昭和六十年に東北農業試験場にヤマセ対策研究官というのを設置いたしまして、各部の間の連携をとって試験研究を進めるようにしたわけでございますが、
167,を表したものである。両国語において、目立って句例の多い項目の順位は、各部の下位のほうで多少の変動は見られるものの、やはり共通して出揃っているという特徴
168,に変化するかを調べた。このような染色法を局所生体染色といい，これによって胚の各部が将来どのような組織や器官に分化するかという予定運命が明らかにされた。
169,に方形パルスの各部の名称を示す。図１いろいろなパルス図２方形パルス波の各部の名称図３（ａ）において，スイッチＳをオンにして一定時間後にオフに
170,ハ必ス之ヲ設ケ」るよう求めたが、それは「畢竟身体ノ各部ヲシテ体質ノ費耗ヲ均一ニシ又随テ其発育ヲ均一ナラシメントスル」ものと意味づけている
171,ます（写真下の抜く方向は間違いです）。決して間違わないように。◆さあ、各部の徒長毛を抜いていこう！背中の一番高い所から、粗目ナイフで徒長毛を抜き始めます。
172,に特筆されるのが、空間の分解であった。彼の絵は、分解された各部が固有の消失点をもち、それらの各部分が継ぎ目なく全体を構成していた。端的
173,種子から発生した幼根が主根となり多くの分枝根が発生する。図２‐４は各部の名称である。図２‐３ソバの形態図２‐４ソバの各部
174,など、それぞれの特性を比較できる基本的な指針になることは言うまでもない。ちなみに、各部のなかで高い類似率を占めているものを順に示すと、大体、次の通り
175,体の方々にゆきわたっている．このことから軸索の働きは神経系の命令を体の各部に伝え，これらを調節・支配している．現在では神経を伝わる信号は電気的なもの
176,所ではないでしょうか。輸送途中でチェーンケースなどが凹むなど考えられますので、梱包前に、各部の写真を撮っておくことも重要です。
177,活躍すること間違いなしだ。キャロムショットＣＡＲＯＭバーチャルスチールモデルガンＳＡＡシビリアン２ｎｄモデル価格：￥四万五千クラフトアップル製コルトＳＡＡをベースに、主に質感にこだわって各部を徹底的に改修したカスタムガン。５段階の研摩で完全な平面出しを行った後に十五時間
178,、自転車は初体験だったそうたが、たしかにウェッジシェイプのライトユニットをはじめエッジの効いた各部のディテールは、彼らしいといえば彼らしい。しかし、このころからデコチャリのマーケット
179,と称して一定額を各課に分配し、これを各課次席が裏帳簿で管理する。一方、各部は、筆頭課に残った金から自分の部で使う裏金を「部費」として取り
180,場合には，地役権は，その各部のために（要役地の場合），またはその各部の上に（承役地の場合）存在する（二百八十二条２項）。ⅲ取得時効の特則
181,十九アイコンアプリケーションを実行するときにクリックする絵ボタン。４ウィンドウの操作ウィンドウの各部の名前を覚えたら，実際にマウスで操作してみよう。ここでは，マイコンピュータのウィンドウ
182,と人差し指）で抜くフィンガー＆サムワークと、ナイフを使用して抜く方法があります。体の各部、どういう順番で抜いてゆけばいいのか？基本的には、順番に決まり
183,電気抵抗をはかってもよい。３電圧計の＋端子の導線の先を移動させて導電紙の各部にふれ，負極側から正極側に向かってしだいに電位が上昇しているようすを観察する。４
184,（＞）ボタンをクリックする。いいね〜っ。ＳＢ６Ｒ！ビデオではＳＢ６Ｒの各部を紹介して、走行シーンを見せてくれる。このビデオのナレーションと風景はドイツかな？
185,だ記事の内容はこうだ。道警ぐるみの捜査用報償費不正支出疑惑をめぐり、道警本部の刑事部など各部で、カラ出張や報償費などで裏金をねん出し、一部を総務部に「上納」していた疑いが
