,0
121,に聞いてください（←謎の無理なお願い）かに道楽デカかったです。かにを無性に食べたくなりました（←謎の告白）づぼらやデカかったです（パートⅡ）
122,日に少しずつ気温が下がってきて、快適指数が高い秋晴れの日が続くと、無性に温泉に行きたくなる。温泉といえば思い出すのは、ちょうど１年前のオミ隊長
123,おもいますか？ちなみに、僕は、家のほうです。当然、家。でも、無性にあげパンが食べたくなる時が有る！きっと解ってくれる筈。
124,若い野球選手のでっけえ引き締まったケツを見ていると、無性に顔をうずめたくなってくる僕は変態でしょうか？消えろ。。。。。
125,認めないわけにはいかない。しかし、あわになったんだと思うと、無性に悲しく、恐ろしい。もう、まぶしい太陽の光に、目を細めることもない。
126,たとき、メンバーの後ろで寂しそうな目をして笑っていて、それが無性に気になったんです。でその後しばらく、何でもいいからジニのことを知り
127,。三十年も経ったのに、なぜ不意にそんなものを思いだしたのだろうか。無性に会いたくなった。初恋の人に。「乗って帰れますか？」
128,てしまいそうなのだ。「外からこの部屋の灯りを見上げながら歩いていたら、無性に嬉しくなってな。灯りがついていて、その中で待っているやつがいる
129,私が２時間も縛られていなければならないのか滑稽で仕方がなくなる。そして無性に腹も立ってくる。監督がやって来た。私がコントみたいな柄
130,、智津香は一旦立ち止まった。自分がとてつもなくはしたない顔をしているのではないかと無性に気になり、鼻の周囲を掌で覆って眼を閉じ、息を整え
131,なんかもう知らない、バカバカバカバカバカッッ！…バティスト様―…。ミミは無性にバティストに会いたくなった。ミミのことを大好きで、愛していると言ってくれ
132,それはどんなクセなのか、どうして恥ずかしいのか、教えてください。足の爪を無性に噛みたくなります。おかげで体は柔らかいです。
133,は、なんとなくもう決ったみたいなムードになってしまって…」奈緒子は無性な焦りを覚えた。「明月さんのこと、この間兄に尋ねてみたら、
134,。体によくないとは思いつつ、なつかしの味だからなのか、たまに無性に食べたくなってしまう。小、野菜、にんにく、からめ、脂で注文。大学時代は
135,ことはチェーンソウを持つと何か自分とは別の力が働いて無性に振り回したくなります。心配なのは動いてる物を切りたくなったらどう
136,子もあれば、教室を動き回っている子もいる。呆然として見ていたが、無性に腹が立ってきて、すぐ校長室に駆けて行き、文句を言った。「
137,今朝ある女性のブログを訪問したらラーメンの記事が書かれていました。何か無性に食べたくなってしまいました。本日は予定外の仕事が入り帰りが遅く
138,昔流行った「ビックリマンチョコ」ですが、社会人の今になって無性に集めたくなったんですがやっぱヘッド（第１弾〜第８弾）ものは相場高いのでしょうか
139,近年、夏本番になると無性にライギョが釣りたくなって、毎年８月をライギョ強化月間にしています。子供の頃
140,です」相手はやさしく振動した。突っこんで考えざるを得なくなった今、ミンタカ人がアンタレス人同様、無性なのがわかった。連れを雌と思ったのは看護人の様相を呈してい
141,売ってくるな！黙ってウォッカでも飲んで倒れていろ！」と私は無性に腹が立ったが、日本人であるために侮蔑されたことよりも、中年の男
142,この間、何気に…と言うか、無性にカップ麺が食べたくなったので、思わず、家族分も足して、数個いっき購入ｗ最近
143,先週のとある日、無性にガッツリ何かが食べたくなった私は高円寺の佐世保バーガー屋さんに行ってみました（＾Ｏ＾）
144,高級ウイスキーも、今はただ酔うための道具だった。「真珠美…真珠美…」無性に会いたい。あの可愛い、どこか儚げな顔が見たい。恭は心
145,三十一歳主婦ですが、今までは子供はいらないって思ってました。なぜか、無性に自分の子供が欲しいって思いました。でもそんな思いも叶わず、子供を
146,前から好きじゃなかったが、アーティストとコラボしたり、ご当地になったりして無性に可愛く思えているキティちゃん。世界の人気者、中国でもニセモノが公然と出回るよう
147,思い、きっぱりと忘れることにしたという。きっかけは禎蔵と巡り合ったことで、はじめは無性に敵意を覚えたが、考えてみれば似たような境遇の二人が争う理由
148,カプチーノみたい。この写真を見て、お抹茶が無性に飲みたくなっちゃいました。＾＾茶道検定を受けるつもりはありませんが、
149,生れながらに縁覚となることが定まっている者不定性―いずれとも定まっていない者無性―いずれの可能性もないものこの一乗主義・悉有仏性説は、円仁以後、台密の発展においては、
150,幼いころ、理由は無いのに無性に怖かったＣＭってありますか？わたしは二十〜三十年前ですが日曜日の朝の野球番組で
151,。あんなところへ行って藁にもすがるような気分になっていた自分に無性に腹がたってきた。結婚以来、夫を信じ、夫に頼りきってきただけ
152,」は使用禁止なんてバラ掘も出て来たりして・・・・ああぁ〜〜無性に「私を食べなさい！」を試したくなった。今週の週末は南西のダム
153,見てみたり……。価格コムのＥ−１のクチコミを見てみたり……。無性に欲しい気持ちが高まってきて。かろうじて思いとどまることができました。Ｅ−１って、すごく
154,積んだ私の船が、知らない人に連れられていく様子を思うだけで、無性に腹だたしくなってくる。そんな気持ちに勘づかれないように、何事もないような顔
155,転んだらえらいことになるだろう。「順子」彼は小声で言った。無性に逢いたかった。あいつに話しても無駄なのはわかっている。大笑いされる
156,今日もスーパーファミコンばかりやってました。最近ゲームを全くやっていなかったので無性にやりたくなったもんで・・・。それと今日は高校野球佐賀県予選で我が出身校
157,機を手に入れることができた。ハンプシャーへ戻る列車に乗ったとき、彼は無性にフリックに会いたがっている自分に気がついた。彼女のことがとても好もしく思わ
158,なった。仏教会で開催される古びた日本映画鑑賞の夕べにも欠かさず行く。最近、無性に日本食が食べたくなって、日本料理屋に行くこともあるし、東京の親戚からいろいろ送っ
159,旦那の事で、無性に腹が立つことがあった時は、イライラして止まらないので、物に当たっ
160,ですね。贅沢な料理はさんざん食べちゃったから、そういったシンプルなものが無性に欲しくて（笑）。おちそれはまさしく食の“隠居”状態ですね（笑）
161,撮影／高柳茂、ＷＥＳＴ、本誌・五十嵐美弥庭を掘り返し花壇をつくっちゃったヒロミ四十３年前、無性に植物を育ててみたくなって、中庭を掘り返して自分で花壇をつくってしまった
162,どうも、何故か最近無性にモンハンしたくなってきました。ｙｕ−ｓｕｋｅです。最近よくＣＭやってるからまた熱が
163,ブログ仲間のパン子さんのブログに出されていたパンがとっても美味しそうで無性に食パンが食べたくなり、初めて食パンに挑戦してみました。二次発酵がしすぎてオーブン
164,気持ちに少し余裕がでてきた。そんな時に昔の記憶が呼び起こされて、無性に動物の相手がしたいと思った。そこで新たにチャレンジしたのが
165,。ただ、正月だけは話が別だ。正月をはさんだ年末年始だけは、無性に日本が恋しくなる。そういう日本人が大勢いるという証拠に、年末になる
166,に決まってるのよ。あたし、少し心細くなっていたのかな。なんだか無性にサキに会いたくなった。サキはいったい、なにをしてるのだろう？
167,ない。この分では、今日は帰ってこないかもしれない。そう思うと、無性に会いたくなる。迷った末、仕事場を出て衿子の部屋へ行くことにし
168,た。みんな蜂の子のことをよく知つてゐるのです。私はハチキチですから無性に鼻の高い気持でした。実際、私は小さいときからハチキチでした。
169,禁煙始めて二十七時間経過しました。特に吸いたいとは思わないのですが、無性に眠いです。とにかく眠くて、集中できません。これが禁断症状なのでしょうか？それ
170,無性に眠いです（＞＿＜）明日はカットの料金を確認して予約しなくちゃー実はまだ決めかねて
171,年を経るごとにきつくなってきました。中休み？観たいな感じでラーメンが無性に食べたくなり行きました。・・・・メニューを見てビックリ・・・・
172,か、何となく、不安で―。だから、涼しげな崇の顔が、無性に憎らしい。つまり殆ど、八つ当りの状態である。それも解っている。感情が
173,に行くんだろうな。お酒に問題があったときには満足が壊れていたから無性に寂しくなったりよくしてた。いまの平安に感謝。
174,た。草道を踏む足音をきいただけで、山頭火は素足で庭にとびおり、無性にうれしくてしょうがないとばかりに、おろおろと出迎えてくれたのです。初対面な
175,サクサクのコーンにバニラアイストッピングは、サクサククッキーとチョコレート♪時々、無性に食べたくなるんですよね、ジャイアントコーンｏ（＾−＾）ｏ
176,最近無性にフィルム一眼が欲しいと言う願望が強まっています！！友人は、コンパクトフィルム→コンデジ
177,たくなりました（←謎の告白）づぼらやデカかったです（パートⅡ）ふぐも無性に食べたくなりました（←謎の告白：パートⅡ）グリコくいだおれ太郎同様、写真を
178,の素人なので、どのような変化があるのか分からない。しかし、ラーメンが無性に食べたくなることは事実である。第五に、ラーメンには、作る人だけ
179,痛みはまったく感じなかった。ただ人工呼吸をやってもらうのがこの上なく楽で、無性に有難かった。少しでも手を休まれると途端に息が苦しくなるので、
180,んだあニーハイを履くそれをかあいい男の子に着せる←最近男に無性に女装させたい←病気自分はあんまり来ても似合わないからねえハヤテ君と
181,は思いきり、足元の雪を蹴飛ばした。周りには誰もいないのに、無性に恥ずかしくなってしまい、顔が火照ってきた。（何言ってるのかしら、セロニア
182,利用したとしか思えない広告。―そういうことがいくつも重なって、何だか無性にハラが立ち、それで学校を抜け出してヤケ食いに走ったのだということを
183,になりました。南京町で老酒を飲みながら遅い食事を済ませると、何だか無性に海が見たくなった。中国人の店主は、それなら須磨の海岸がいい
184,なかでのように、座席に沈みこんだ浅黒い顔などをはっきりと思いだした。あの無性な渇きが、いまは彼の脚に滴ってゆくようだった。女は問い返さ
185,と逆に、空腹を感じて低血糖を補うような食べ物、たとえば甘いものなどを無性に食べたくなることが。インシュリンは、脂肪をどんどん増やしてしまうし、おなかもすか
186,を酌む様子はなかった。彼女は気持ちが荒れた。母親を見ていると、無性に腹が立った。そして、喧嘩をして飛び出すことが多くなった。彼女
187,から降ってきた。「待ちくたびれたよ。こんなとこでじっとしてるとさ、無性に人恋しくてね…」《セイ》―聖―が、椎の木の枝
188,行ったのですが、長い間離れて暮らし、小さくなった父親の背中を見たら無性に涙が溢れてきました。訳もわからず泣いた事を覚えています。
189,無性に甘い物が食べたくて（飲みたくて）でも、コンビニも行きたくない時
190,からかけているの、アレック？」「グロスターに来ているんだよ」エリザベスは無性に彼に会いたくなった。一刻も早く自分の意志を彼に伝えてやりたかっ
191,「勿論じゃ」「二、三匹はおるでしょう」「焼いてくれぬか。無性に食いたくなった」「父上の蛇好きも変わりませぬな」「
192,十本ぐらい吸って畳にすりつけて消した。寒気がますます高じてくるうち、突然無性に腹がたってきた。―この建物だって、どうせ税金でつくったもの
193,ＣＲＪさんの記事です。中でも「空港」が大好きで、この曲を聴くと無性に旅行に行きたくなります（笑♪〜何も〜知らずに〜あなたは〜
194,も出来ると思うから、今は欲しくないんですよ。出来ないと脳が認識したら無性にほしくなる生き物なんです。自分が妊娠できないから、不妊治療してる人の気持ちがわかっ
195,でもコンビニに行くと超新発売もんで興味ありありです。お酒が残っていたりすると無性に食べたくなったりします。食べる割合は月１〜３回ぐらいでしょうか。
196,やるかな．．．．私達にはそれが得策かと．．．雑炊が無性に食べたかったのは言うまでもなく．．．
197,会話をしても面白くなく、ときどき無性に落ち込んだかと思うと配慮がたらないような至らなさもあり、学や
198,確認したり・・・とか。でも、時々マクドナルドやケンタッキーなどのようなジャンクフードが無性に食べたくなる事があります。子供の為には控えた方が良いと言う
199,なにかがすっと抜けて、躰の内側に乾いた空洞がひろがった。幸治は無性に寂しくなって、隠れているみんなに一刻も早く出てきてほしかった。母屋
200,ほんの些細なことなんだけど、無性にイライラしてしまった。今日は仕事が忙しくて職場で晩ご飯食べる時間が無かったので
201,棟居はそんな会い方に忸怩たるものをおぼえているが、捜査が壁に打ち当たると、無性に桐子に会いたくなる。会いたいことはいつも変わりないが、会う時間が
202,、この夫妻のような誠実さと愛情が、現実に息づいて健在であることが、無性にうれしく感じられるこの頃である。雨上がりの桜の樹に、また白い花々が開き始め
203,Ｚ−八十Ｂを手放して以来、手元に残っている『ドリームランド５インチディスク版／マイクロキャビン』が無性にやりたくなりました…。古い機種でも、メンテをしっかりやれば長持ちします
204,で運ばれているところだった。白い布がかぶせてあるのを見て、なんだか無性に腹がたった。「達也っ」俺は駆けよろうとした。達也の
205,ね。だって、香菜を殺しておいてのうのうとしている人がいると思うと、無性に腹が立つじゃない」公平は無言で洋子を見つめた。やがて、視線を
206,ばかりを食べているとダメですね〜（＊´Д｀）＝з食べるなと言われると、無性に食べたくなるんです…カレーが！（←カラいもの代表？ｗ）でね、
207,」は使えるが「ミス馬鹿」は使えない。どうも人が遊んているときほど無性に仕事をしたくなる性分らしく、昨日は睡眠３時間ほどで覚醒し、６時まえだというの
208,○「親しい人、または気になっていた人が亡くなりますねェ。と、無性に美術館歩きをするんですよ。いちばん心が落ち着くんです」○「尊厳死とか安楽死
209,笑った。静かな、それだけに危険な、壮絶な笑いだった。「無性に腹が立ってきたな」「だろうな」「おまえがいなくなれ
210,、眠気もあまりありません。しかし夕食を終え、夜の九時頃になると、無性に眠たくなり、そのまま寝てしまいました。翌日、四日目の朝、とても爽快
211,、県道を医者へ走った。兄ちゃんの叫びが、背中を迫って来た。無性に腹が立って、切なくなって、涙が出てきた。涙は、後
212,行った。何か話があったんじゃないのか」「人を殺すと、無性に好きな人に会いたくなるもんらしい」真に迫った言い方。中堂は
213,ウェラーの調子」も、比べて、楽しめたり。それが・・終わってしまうと、無性に、さびしかった。「１，２箇所だけ見て、お別れ」と・・「追っかけて、
214,皆さんはつわりの時、どんな食べ物が無性に食べたくなりましたか？私は「カキフライ」。つわりなんてものは、すごく
215,っス。」ポチ「ん〜まぁ、傍に居るとうざったいけどしばらく逢えないと何だか無性に寂しいしねぇ。」ビール「へ〜〜〜い。あっそうだ、早速、
216,頑張ります！【日本ブログ村】にランキング登録ちう♪下記のリンク先をポチッとしてくれると無性にこうくんが喜びます＾＾一日一回のクリック、どうぞご支援宜しくお願いします＜（＿
217,入ってると満点だったようです・・・・アタシの昼はこんな感じおいなりさんて無性に食べたくなるのよねそれと家は鯵の塩焼きの日は炊き込みが食べ
218,紫苑様だ。こころしてお守りするんだぞ』と言われたとき、俺は反発するどころか無性に嬉しかった。だが、おまえがいなくなって俺はまた伊集院家に仕える意味が
219,組んだ事件の後ですぐ、足に一発ぶち込まれてな。以来、わしゃ、無性に死ぬのが怖くなってな。こうでもしなきゃ、他人と口もきけん
220,たから、ぼくはまず身体を固くしてそれに備えたんだ。そのとたん、無性におかしくなってしまった。あれほど憧れていた宇宙にいまから行けるなんて、笑わず
