,0
0,と、自惚さを蔭で皆なに笑はれてゐるやうにも思はれて、礼吉は無性に腹立たしかつた。その結果、お静を責めたことも再三ではなかつた。
1,・・娘はいつものように義母の家で食べてるので夫と私用。無性に食べたくなったほっけ、本当はアボカドを乗せたかったけど夫が苦手なので
2,が、あれほどに切望し努力して来たことが一顧だにされなかったことが無性に腹立たしく、自分たちの非力が無闇と悲しかった。しかし、その半面では、
3,です。ＣＭやラジオなどでビートルズの音楽を耳にする影響でビートルズのＣＤが無性に欲しくなりました。そこでお聞きしたいのですが、ビートルズの“赤盤”“青盤
4,何もやる気もなく、自分自身に強い嫌悪感を持っています。またほかの人たちに対して無性に怒りがわいてきて感情が制御できません。こんな状態で生きられるのでしょうか。
5,は滅びる。地球も消える。太陽系も消える。全部消えてしまう。その果てしない闇が無性に恐ろしかった。だが、いまは違う。地下に存在しているのは恐ろしい水ではない
6,みんカラブログ】内チョロＱデータバンク【日本ブログ村】にランキング登録ちう♪下記のリンク先をポチッとしてくれると無性にこうくんが喜びます＾＾一日一回のクリック、どうぞご支援宜しくお願いします＜（＿
7,目指せ長淵剛だーっ！←古っさて。本日の我が家の晩御飯ですが…朝から無性にタイカレーが食べたかったので、久々にゲーンキョワーン（グリーンカレー）を作りました♪深め
8,に至るまで。自然との対話と瞑想に入ろうとしていた矢先の闖入者共に無性に腹を立て、ぼくは八つ当り的に金もうけだけしか考えない土建屋、不動産屋に腹を
9,が鎌首をもたげ始めていたのだ。彼女のことを考えると、いとおしく、切ない想いに無性に胸が締め付けられる…。「ダメだ、それはできない」レディンは
10,来月、またあの会場に行けますように☆彡ってまだ申し込んでないんだけど。そして無性に聞きたくなってＢＧＭはロマネスク。大阪から帰る時はいつもそうなんだよ
11,の最後にタグでも入れそうかと思います。ヒットかかり易く？ｗ私、最近無性に病んでますｗｗｗｗｗｗｗやっちまったぜｂ！←さて
12,も寝たー！体痛いっなんか夢にＹがでてきて起きたとき無性に会いたくなったわー笑←どんな夢よーてねあー二度寝しよーぅ！！！
13,はＣＭ独自の音楽なのでしょうか？それとも誰かアーティストの音楽（歌）ですか？無性にムカつくかは別として、アーティストは玉置浩二さんのようですが、ＣＭオリジナル曲？となってい
14,をなめんなよ」ハラヘラシの笑いまじりのキンキン声を聞いていると、アキラは、無性に腹がたってきた。それは、ネズミに笑われたからというよりも
15,ならわかる気がしていた。昔は酔って帰ってくる父親の姿が、無性にだらしなく、不潔感さえ覚えていたが、このバーで勤めるようになって、その
16,ことができなかった。そして、女友達のところに転がりこんだ。誰か甘えられる人が、無性に欲しかった。彼女は、すぐに彼を作った。彼といると何
17,砂浜で、暗いギリシアの夜の街角で、ふと、私が私でありたいと無性に考えだしたとき、私がなんであるのか？と子供のときから、
18,多ければ多いほど有利だ。笹山はコルト・パイソンをもてあそびながら、考え込んだ。俺は無性に煙草を喫いたくなったが、耐えた。「よし」笹山はうなずい
19,主要株主や首脳部の決めたことである。そう考えると、日自工という会社そのものが無性に憎くなった。「ニットー」の車を見かけただけで、石でも
20,を向けて数歩歩いたところで、於茶々は子供のころから引っかかっていたことを無性に母に訊ねてみたくなり、城門まで出て見送る於市を振り返った。（
21,か！何分トイレに行ってるつもりなんや！親父が心配するやろうが」無性に腹が立った。綾や真弓は今まさに始まろうとしている親子げんかに気を
22,障るなどということになるはずもない。だが、こうして話しているだけで、無性に腹が立った。「霊能力なんてものは、ないほうがいいと思ってる
23,っていってるのきいたもの」「誰だよそんなこといったの」無性に腹がたった。でも、すぐにうしろめたい気分に襲われてしょげてしまった。
24,しく素直に彼は辞書を上衣に蔵いこんだ。すると僕は、今度は無性に索漠とした味気ない気分におちいるのである。金本甲植は、僕が日本人だから
25,を続けてきたけどビルの間を歩くと胸が苦しくなって、最近では無性に田舎に帰りたくなってしまいます。家族も出来て簡単には帰れない状況な
26,はるかに上回る大胆かつ繊細に抒情的な映画で、その巨きな悲しみと明るさに興奮するとともに無性に勇気づけられました。千九百九十三年の春ごろに封切られる予定ですから、これは来年も
27,つもりだったのに、一年ばかりで帰ってきてしまった。「なんだかしらないが、無性に帰りたくなった」のだそうである。パリでは、別に師匠につい
28,という。世俗的な欲望に執着するのは煩悩の一つである。江戸庶民は我が子を無性に愛することも煩悩と見て、子煩悩といった。『唯識論』『成唯識論』
29,［プリンセスプリンセス］ブログ村キーワード学生時代のカラオケの定番がプリプリのＭです。帰宅後、無性に聞きたくなってずっと聞いてます。そういえば、最近、カラオケにも行っ
30,もので、被害が大きく、そして未知の病害かもしれないと思うと、無性にファイトがわいてくるものである。ヌメリと異臭から、病原菌は糸状菌ではなく細菌であろうと
31,営７時三十分〜二十一時無休エスプレッソシングル二百五十円、ダブル三百円、エスプレッソジェラート三百円。夜中、無性に食べたくなる一口お茶漬け。八十八楽とっておきの一軒にしたい、サラサラ茶漬けの贅。
32,。歌を聞いて欲しかった。自分が生きているこの国で生まれた歌を、無性に歌いたくなった。街で老人ホームを見かけると、ふらりと入っていくように
33,ｖ一人なのでだいぶ長持ちしてます。当分大根三昧です♪てか冷凍庫が今ちょっとやばい…無性に魚が食べたくなってかれいと鰤を調達してきたんですが意外
34,処女でも、無性に誰かに抱かれたいって思いますか？私も二十代後半で全く経験がない
35,よねｗ【日本ブログ村】にランキング登録ちう♪下記のリンク先をポチッとしてくれると無性にこうくんが喜びます＾＾一日一回のクリック、どうぞご支援宜しくお願いします＜（＿
36,最近のジョージアのＣＭ中に流れている音楽は、耳に残りますが、なんか無性にムカつきます。特にエメラルドマウンテンのやつ。あれはＣＭ独自の音楽なのでしょうか？それとも誰
37,どうすることもできなかった。ただ、もう兄に会えないのだと思うと、無性に哀しかった。その晩、夫の帰りはいつになく早かった。女は
38,文句もいえないはずです。でも、その文句のいえない所で、なおさらぼくは無性に腹が立ちました。そうや、こういう奴等が自然を壊すのだ。
39,みんカラブログ】内チョロＱデータバンク【日本ブログ村】にランキング登録ちう♪下記のリンク先をポチッとしてくれると無性にこうくんが喜びます＾＾一日一回のクリック、どうぞご支援宜しくお願いします＜（＿
40,効いたのう、そんじゃ後から“のみ薬”とりにおいで…」青二郎は無性に嬉しかった。いま一つの仕事をやりとげたのだ。老婆の宿痾といわれてい
41,けれど、フンと鼻で笑うように、タツヤは無視して通りすぎていく。私は無性に腹がたって、とっさに後を追いかけ、私よりずっと背の高いタツヤの
42,、道場の真ん中に進んで、青眼に身構えた。呑気に遊んできた無風斎に無性に腹が立ち、脳天に一発、思い切り打ち込みを決めてやりたい気分だった。
43,，名古屋から近鉄奈良まで．まずは腹ごしらえをしようと思い「ごはん芽屋」というお店へ．無性にカレーが食べたくなってしまい，エビのタイ風カレーを注文．カレーソースは唐辛子の辛さと
44,ヘルシーな野菜の料理外食がちだったりすると、野菜が食べたいーって無性に思うもの。そんなときは野菜たっぷりのスープや炒めもの、和風の煮ものに新鮮なサラダ
45,血道を上げていられる優雅な生活を送ってはいない。それだけに、ときおり無性に少年小説を読み返したくなるのである。岩間君に真実を白状させた瞬間に、掌中から
46,見ての質問です。聞いたら良いのですが、仕事に行ってるしでも、無性に気になったので・・・・。視力は０．５程度でしょう。日常生活ではコンタクト無し
47,シナモンを添えてもいい。【キャラメルラテ】Ｃａｒａｍｅｌｌａｔｔｅいつもはブラック派でも、無性に甘いコーヒーが飲みたくなることが誰にでもあるにちがいない。そんな時
48,一体になろうとしていた。僕は彼女を連れてきたことをその瞬間無性に後悔していたが、あらゆることは取り返しがつかない運命の流れに支配されてい
49,日没（＞＿＜）なんとか富士山みえました今日天理は雨の中祭典だったみたいですね私？無性に悲しくてなきたいでもこうやって記事をあげれるくらいだからまだ今は王子様が
50,サラダクレープが無性に食べたくなりました。卵とツナとマヨネーズ、レタス、チーズ、小麦粉があり
51,ならないだろうか？◆「隠れ宿」で本を読む一年に、何度か、無性に訪れたい旅館がある。秘境というほどでもないが、遊離の温泉宿だ
52,すると身体のリズムが乱れて、それ以上練習を続けられなくなってしまう。時々、無性に電車の中で泣きたくなる」といった主訴で相談に訪れてきた。Ｃ
53,にむかってつぶやくことがあった。ある深夜、眼を覚ました彼は、無性に柳子に会いたくなった。凌辱への欲望はまだ思弁のうちにあり、
54,アドバイスお持ちの方はおしえてください。そういえば小さいころ水疱瘡とかですが痕を無性にはがしたくて、かきむしろうとしていたらよくおこられもしましたが。あと
55,のシュークリーム親子３代で通っているお店。しっかり甘く、ずっしり重い、ここのケーキはたまに無性に食べたくなるんです北区在住の本誌編集者吉岡尚美クルクル回るショーケースを見るのが大好きだった
56,なんです。「いってらっしゃい」って玄関で見送るんですが、その後ろ姿をみると、無性に虚しくなるんです。夫が会社に行って、さみしいなんていってるんではないですよ
57,消えちゃうから嫌いなんだ。緊張感がなくて魅力を感じない。そういえば、無性に絵を描きたい時期もあった。眠れない夜に、朝まで“目”
58,ＴＶで見てキャ〜〜〜！なんて叫びたいものです（笑）ところで、昨日無性に”鋼鉄の巨人”が聞きたくなりｉＴｕｎｅｓをスタート！で今日も”鋼鉄の
59,のか！！◆感想☆うらうららん☆のうららさんが書いてあるのを見て、無性に読み返したくなりました（笑）ってことで、本棚から引っ張り出してきて、
60,みんカラブログ】内チョロＱデータバンク【日本ブログ村】にランキング登録ちう♪下記のリンク先をポチッとしてくれると無性にこうくんが喜びます＾＾一日一回のクリック、どうぞご支援宜しくお願いします＜（＿
61,ね、お手柄でした」「手柄もなにも、豆造のことを考えたら、無性に腹が立ってしまいました」四郎兵衛が頷き、「寅三はひとつだけいい
62,通子はすぐに今度は実家に電話を入れた。なぜなのか、無性に子供たちの声を聞きたかった。「あ、優美？お父さんとの晩御飯
63,たことが。肉や魚を食べないで、アッサリした物ばかり食べていると、無性にお菓子が食べたくなって、お菓子の暴食をしている。少しでもいいから
64,られない。そのまま相手は後退し、反転して遠ざかろうとしている。不意に、無性に腹が立ってきた。いつ、いかなるときでも冷静であろうと心がけてきたミハイル
65,赤ん坊を乳母車に乗せて、買い物袋を抱きかかえたほうがいいのに、とショウタは無性におかしくなる。オレンジ色の水銀灯に照らされて、駐車場の路面がしっとり濡れている
66,が一年生のときのＧＷは帰りました。帰るつもりなかったんですが、ＧＷ前に無性に帰りたくなったんでｗんで地元の友達と遊びました。周りも結構
67,♪ごちそうたべた〜〜〜〜〜い♪倹約生活を続けていると無性においしいものが食べたくなります。ちょっと数か月厳しかったので、ちょいと気
68,までさ―もう一回小屋の中を見回ると、腰を下ろして待つことにした。無性に煙草が吸いたくなる。しかし、用心のため吸わないでおくことにした。
69,れなければならないのか。そう思う所為でしょうか、耳にする度に無性に腹が立ちます。もちろん、母は悪気があって言っているわけではなく、
70,ことだったのねえ。それから次は、公爵？」「そのときからぼくは無性に驢馬が好きになってしまいました。それはぼくにとって特殊な愛情な
71,。この言葉を言った時のキャットの表情は、冷静だった。そして…無性に…色っぽかった。「判っていないわね、あなた。あなたが祥子を選ん
72,。さっきの小さな安堵が、それでもう駄目になった。彼女のそんな態度が無性に気に障るのだ。それは忙しい彼女としてはごく普通の反応だろう。けれど、
73,昨日は無性に粉もんが食べたくて、お昼はお好み焼き夜はたこ焼きを食べました。昼は、
74,、日々の努力がインスピレーションの源となるであろう。」一般的に言って、訓練が無性にめんどうくさく感じられる時、それは同時に、訓練の必要性が痛感される時でも
75,今、無性に何かに（仕事やスポーツでもＯＫ）熱中、没頭していないと精神的に
76,違うかもしれませんが、私はかなり疲れていたり、持病の偏頭痛が出たりすると、無性に紅茶が飲みたくなります。飲むと具合いも落ち着くんです（その前に薬は
77,すこぶる含蓄に富んだ、その半面この国の権力を握るお偉方やその取巻き連中には無性に腹立たしい、一方常に材料不足を託つテレビや新聞や週刊誌にとってははなはだお誂え向きの、
78,お産の間、エマと私に同じだけ時間を割り振ったと思う。私は無性に女の子がほしかった。ドンはどちらでもかまわないと言ったが、生まれた
79,にいる何人かの仲間でも、みんなそう言ってます。この年になると無性に日本に帰りたくなるときがあるんです。皆さんはいいですね。こうやって行っ
80,・・・・・・？これもやれって事か？（笑）何か無性に弾いてみたい！・・・・会社から帰ってきて、一杯飲みながらヴァイオリン
81,不安が最初からあった。でもオレももう三十歳の声を聞いていたから、無性に自分の子供が欲しかったんだ。で、彼女の子供だったらいいかな
82,、ミスター・ホリエという日本からの留学生がいます」と、いった。私は、無性に腹が立って、それなら、すぐ会わせてくれと、いった。「
83,貫一はパジャマの上にコートを着込んだ珍妙なスタイルでやって来た。無性に顔が見たくなって病院から脱走して来たのだと笑った。うろたえる
84,疲れたときに、無性にコーヒーが飲みたくなるのですが、それは体にとっては良いのでしょうか？でも夜
85,最近無性にイライラします。周囲の人に対しても、イライラしている自分自身に対しても。こんな人間じゃみんな
86,ビール「先輩、自分何だかびいちゅう〜に無性に逢いたい気分っス。」ポチ「ん〜まぁ、傍に居るとうざったいけどしばらく
87,アルコール依存症です。禁酒して１週間ぐらいは体の調子いいのですがその後は無性に酒が飲みたくなります。私の知り合いは気がついたら金もないの
88,こんにちは！なんだか無性にプラモデルが作りたくなり、プラモを買ってきました♪ニッパーとヤスリは、
89,笑い声は硬く、怒りをはらんだものだった。「たまにそのことを考えると、無性に腹が立つわ。それこそ彼を―」自分が言おうとしていることに
90,わかったことだけど彼が洗面所や玄関トイレの電気を消さないことが無性に腹が立ちます！！でもこんなこと付き合ってるだけじゃあわからないでしょう？？
91,今会社です、突然背中が無性に痒くなりました、線引きもないし、、どうしよう！イスの背もたれはない
92,・自分も子供だったからです。実際に自分の子供が出来てからも、無性にかわいくて、でも腹が立つこともしばしばで。でも、自分の子だから
93,が歌詞をよく知っている歌曲であれば、たとえ聞きとり難い日本語でうたわれていても、無性に苛立つというようなことはないのです。けれども初めて聞く歌曲となると、そう
94,」。つわりなんてものは、すごく軽かったのですが、普段はあまり好きではないカキフライが無性に食べたくなりましたよ。生まれてからは、また数年間食べていませんが
95,に疲れているんだろうなぁと、たいていはそのままそっと寝かしているのですが、こちらもやっぱり無性に抱きたい日もあって、妻の布団に潜り込むと完全に拒否されてしまいます
96,起こっている場所にしては、気味が悪いほど静かよね」とシェリーは答えた。「無性に人の声が聞きたくて、歌でも歌いたくなってくる」「いい
97,も、もはや日印間だけではなく、より広い視野でとらえなければならない時代にきている。インドが無性に好きでのめりこんでいくという段階は過ぎたようだ。インド祭のタゴール展を企画し、
98,一度スイッチポンです。今日の紅茶は、アッサムを淹れてみました。ミルクティーが無性に飲みたくなる季節になりました。安納芋・・・甘〜〜い！！
99,子煩悩こぼんのう自分の子を無性にかわいがること。他人の子はかわいがらないが、自分の子はかわいがるという
100,弁護士を目指していること。桐堂が自分に心を赦してくれた証に思えて、無性に嬉しかった。そんなあるとき、友人からサークルの女の子との仲立ちを頼まれ
101,願っていてくれなかったのではありませんか？一緒にいると楽しくても、離れたとき無性に寂しくなり、すぐに会いたくなりませんでしたか？今まで付き合っていた
102,、キャメラマンの感性に多少なりとも触れることができたとなれば、はなしは別である。無性に嬉しいのである。だから、写真を撮りに行くのである。探索決行の日は、十一月
103,カリフォルニアの真っ青な空が広がっていた。ふと、私も高校時代の夢を思い出し、無性にあのコマーシャルの歌が聴きたくなった。レコード店に行ったがあの歌のＣＤ
104,たかは少しも覚えていないのだが、私は自分の言ってしまった言葉に無性に悲しくなって、ワァーワァー泣きだし、父を困らせたことだけは、あの
105,タトゥーってひとついれると二つ目をいれたくなるものなんですか？無性にいれたくなりました。そのようですね。。。モノクロで入れるつもりでも
106,のあとは、ジンギス汗の墓の探険を計画していたときく。少しまえに無性に彼に会いたくなり、一、二度自宅に電話をかけた。連絡がなかなかとれない
107,二人とも軽く手をあげ答えてくれた。たったそれだけのコトなのだけど、無性に嬉しくなって、大きな声で唄いだしてしまった。砂漠の中の一本道を走る
108,噛まれ、右腕全部がパンパンに腫れ、１週間で引きましたがそれ依頼ムカデを見ると無性にやっつけています。（ε´；）／゛゛ビシビシデテケーー
109,二千百二ｖですが、まだ一度もテレビ電話を使ったことがありません。何だかテレビ電話となると無性に通話料が高くなりそうな気がして・・・実際、普通にしゃべるの
110,、デザートにケーキセットまで食べちゃいました☆何種類かあったんだけど、この時、無性にチョコが食べたくなって…『ガトーショコラ』＆『ホットコーヒー』♪食べたのは
111,後、何となく撮影してしまった、ＰＳＰ版ネオアンジェリーク・限定版見本。ＴＶアニメを見てると、無性にプレイしたくなります。やっぱり、ＰＳＰ欲しいな〜〜。イベント自体は面白かったです。昼公演
112,流行りの「ＨＤ・ＤＶＤレコーダー」なんてものも、『欲しいときが買い時』なのでしょうか？いま無性に「ＨＤ・ＤＶＤレコーダー」が欲しいのですが、数ヶ月するとＨＤの容量が増えるｏｒ値段が下がる
113,姿を見ていると、自分が小学生のとき、走り高跳びで優勝したことを思い出し、無性に跳んでみたくなりました。また、みんな練習を頑張ってきたんだろうと思うと
114,背が低いほうではない。そう見えるのはそこに漂う女らしさのせいで、それが無性にグリフィンをいらだたせていた。たぶん、三十にもなっていないだろう。年齢に
115,で約８分焼きました。薬味は“もみじおろし”です。写真３枚目：『菊花シュウマイ』「無性にシュウマイを食べたくなり、餃子を食べたくなったりしませんか？」この
116,マウスに手をかけ、私たちに通じる扉を閉じた。直接二平と会ったら無性に愛しくなってしまって、それであんな無謀な提案をしてしまったけれど、実際問題
117,の人、あるいは白人だというのなら、まだ納得する。けれど黒人だなんて！」無性にイライラするのは、自分の中に人種差別の意識があるからかもしれない。「『
118,出自が厭わしかった。自分の体に無頼の血が流れていると思うと、無性に気持ちが暗くなった。思春期には、その思いが一層強まった。自分
119,になった。ゆとりがなくてさぼりがちだった美術部にも通い始めた。…「いま無性に絵を描きたい。受験生だからかえって描きたくなるのかも知れない。けれど休みがなかっ
120,家にいることになり、今日は冷たい雨！雨が降ると彼らの曲が無性に聞きたくなるんです＾＾それで〜棚からＤＶＤ出してきてＭＶ見てる
