,0
233,で見えなくなったけど大きいのはうっすらピンクが残ってる・・それでも、これ以上は無理と諦めたまぁ、ほとんど目立たないし大丈夫だろうでも、乾いたらクッキリ〜なんての
234,糊で讃美歌集に貼りつけると、今度はしおりが要らなくなったとき取れなくなる。無理に剝がせば歌集が破れてしまう。「使うときには貼りついて、用がすん
235,んですが・・・・。詳しい方教えていただけませんか？私にはちょっと無理でしたので、一応経理学校に３ヶ月ほど通いました。確かにパソコンの会計ソフトを使えば
236,は子供の頃、日曜ごとに教会に行くことを強制されました。そのように無理強いされたので、彼は教会と牧師に対して反感をもつようになりました
237,文科系の学問研究に，このような即効性のある「ご利益」を期待することは，本来無理な話であるし，あまりに即効性を期待する人をみると，正直なところ，その
238,「気でも狂ったのか？遅すぎる。今から、上に登るのは無理だ。立ちあがれば、やつらに見つかってしまう」モーの言うとおりだった。自動車は
239,に襲われることがある。そんな症状が出たときは、早々に対処する。方法は「無理をしてでも外へ出る」「できるだけ日光を浴びる」「可能な限り
240,美味しかった駄菓子も、大人には甘すぎたり、酸っぱすぎたりと、大苦戦です。三人が無理と思ったときに、有野さんが変わりに食べる「有野カード」。５種類食べるのですが、最後
241,シーンはこの時間の遅れに苛立った。いかにも男の子らしく、彼は我慢できなくなり、無理に急ごうとした。やがて、ペギー・スーは彼の太ももに亀裂が走っているのに
242,のでしょうか？ディカプリオよりはかなり男前と思いますが・・・。私もハリウッドは無理だと思います…。アジアでウケる顔立ちと、ハリウッドを含めた海外でウケる顔立ち
243,にいろいろチェックしたいこともあるんですよ！せめて十日前ぐらいにしてもらわないと〜←きっと無理だ。しかし本当に撮影をやるつもりでいるのかね〜？←ｓａｎｇｗｏｏのダンスシーン
244,で入って飲むとなると、いろいろな可能性を考えてしまう。緊張するなという方が無理だ。坂田がすわったのは、正面のステージに最も近い、左手いちばん奥
245,変化がある訳ないか？なんかひょろひょろ感が気になります。やはりこの時季じゃ無理なんかな？日当たりかなぁ〜にほんブログ村オヤジ日記ブログガーデニングブログセンター
246,か物ですか？」「はい」「しかし金なんかありませんよ。無理な話です」と言ふと、相手はまた一杯ひつかけてから、「いや
247,ハードディスクのフォーマット形式はＮＴＦＳだと思いますが、下記のような制限があります。無理にＷＭＰを使うよりも、別の再生ソフトが、フリーでいくらでもあるので、
248,頑張っているが我慢の限界だ」とか「自分はしっかりやっているのにこれ以上は無理だ」などの切実な感情が見え隠れする状況がある。このときリーダーは，能率と
249,聞かないようにしておいて、ここで勉強しろって言うことを聞けっていうのは無理な話なんです。今の女子大生は言葉が乱れてますけど、ある女子大生で
250,ぅ〜頼むから早く首すわってくれぇ（Ｔ−Ｔ）今日は皮膚科に行く予定だったが無理だわ（´Д｀）疲れすぎた…
251,な感觸をもたらして居るのである。彼の藝術に蒼枯とか枯淡を求めるのは無理である。彼の感覚は枯れることを知らない豊かさに溢れて居るのである。とにかく、
252,、運転手がいます。ところがその運転手が四、五日まえから風邪をひいていて、無理をすると肺炎を惹き起こす心配があると医者がいうもんですから」「お邸
253,「曙」はどぉなっちゃうんでしょうか？総合では無理と悟り、プロレス転向です。だけど、１回くらい勝ったシーンを見たいのは私だけ
254,親が本気で向かう姿勢を見せると、子どもも変わるということです。ただし、無理強いはダメですよ。こんなに工夫したんだから食べろ、食べろと言われたら、
255,ように感じられたからだ。技術が人に向いていない限り、どこかで無理が生じたり、ひずみが出たりする。せっかくの治療薬が人を不幸にしかねない
256,ことをした。この手の中にようやくつかんだものを。だが、まあ、無理をせんのも老人の知恵だ。よろしい。この娘はつれて行くがいい
257,：頭いい△：別にいいと思う・８：バカ△：馬鹿すぎんのは無理９：先生×：無理十：初めて会った人×：めっちゃきついやろ十一
258,んだけど、でもそのイメージが間違っていることもあって、何十枚も描いてから「これは無理だ」とわかることもあります。いつもできるまでできるかどうかわからない。…作品
259,楽しい。大丈夫なら、膝を曲げないで踊ろうかな、と思ったけど、やっぱり無理だった〜。お膝で、お花も休憩中。
260,ない。「じゃあ月曜まであきらめて下さい。週末にあの男を捜そうとする方が無理だ」「お願いです。人の命がかかっているんです」「それなら警察
261,気がする。私がしっかりしないとね。いつか絶対謝るよ。おかあさん、あまり無理をしないで下さい。私、これから楽しく明るく生きる事にしたよ。心配しない
262,十人で四万人になるでぇｗｗｗ早く集まれｗ←無理キャッｗｗ
263,役に移るが，僧服姿に衣装を変えることで，役の移行は観客にとっても無理なく理解される．Ｓｅｄｉｃｙｏｎ（煽動）は最初はヴァイスのはでな衣装を着ている
264,たら、素敵な恋人と巡り逢えるかも知れないけど、母と一緒ではそれも無理だし。夏にはあの人と海へ行く予定だった。だったで秋
265,あったのですがまた最近ありません。こんなんでふたりめが欲しいと思うのは無理でしょうか？そういう状態じゃ、二人目は難しいですね。それより、旦那さん、浮気し
266,事情について聞かれる激スルーです生まれて初めて流れ星見ましたすごく綺麗でしたお願い事なんて無理です、高速っすよ深夜からギター激しいの聴いてテンソン上がった十月三十日木曜日朝から
267,その後、児童虐待に関する様々なセミナーを受けてきた。これで気づくなというほうが無理だった。デントンは青ざめた顔で後ずさった。「くそっ」あの子供が耐えた
268,をすれば、伝統的な手法にのっとって作曲をしたいという衝動が強まるのも無理はない。彼はサキソフォン・コンチェルトを書き、アビイ・ロードで同じアメリカ人のデヴィッド・サンボーンとレコーディングするという形で
269,ニコニコお仕事の日です夕べ土砂降りだったし今日も雨になるって。。。お散歩は無理だけどじいちゃんばあちゃんたちと触れ合ってきたいと思いますがんばれば週末のお楽しみはもっと楽しくなる
270,、還暦のとき大病をして「若いときと同じように考え、行動するのは無理だ」と、思うようになった。しばらくたって、妻が思いもしなかっ
271,ました。住民票の氏が新姓に変わっているのであればおそらく、旧姓での印鑑登録は無理なのでは？私は結婚を機に姓が変わった際、今後何がある
272,そのひとつひとつがＰｈｏｔｏｓｈｏｐやＩｌｌｕｓｔｒａｔｏｒなどで作成された、データサイズの大きなオブジェクトなのだから無理もない。また、総データ量が増加すれば、動作が重くなるうえに貼り込んだ画像を
273,、まだわからないですね。僕は現役を退いて、絶対テニスのコーチだけは無理だと思っていました。ボブとかアルバロを見ていて、コーチ業は、自分
274,させてしまいます、、、。良い保管方法を教えて下さい、、、。やっぱり冷凍は無理でしょうか？？？？？？大葉を冷蔵庫に入れて保存してる方が多いと
275,最新のエアコンなら省エネだろうけど備え付けのエアコンは型も古いし微妙な設定なんて到底無理ですからね〜＿｜￣｜○それから。うちね、天井が低いから電気点けるだけで部屋が
276,聖母像を見つけてくれませんか」「聖母像？私がですか。それは無理です。私はつまらん古本屋の主人です。切支丹の予備知識も何もありません
277,あれば、引き続き御指南下さい。ていうか、そろそろ気付けよ、彼氏！一緒に買い物行くの無理であれば、なおさらはっきり言わないと無理ですよ。気づかない彼なら、あなたがはっきり
278,今では、イライラしたり底の見えない不安にとらわれたりしたときには、無理に抑えず「本当はどんな気持ちなのか」と自分に問いかけることにしているそうです
279,を行います。十：００声を出しながら、深呼吸。手足をゆっくり動かしながら健康体操。無理なく体をほぐします。十：三十２チームにわかれて物送りゲーム。ボールやペットボトル、人形を
280,外見も中味も、姑にそっくりで、そのように育てられていない人には無理なことだった。隆男と次弟とは口もきかない。それは年上の
281,古賀は妻に、母と同じ理想像を求めていたのだ。若い千代子にそれは無理な注文というものである。妻との趣味嗜好あるいは生活スタイルの違いがあったことが
282,高校２年生です。先生と２者面談をしたとき「国公立は無理」といわれました・・。「いまから頑張っても？」ときいたら
283,かつ活動しやすい状態にするという意味もあります。ただし、はさみを使い危険なので、無理のない範囲でするように。ブラッシングをし、被毛を調えます。金ぐしを使い
284,てもいいのではないでしょうか。「親だから…」「大人なんだから…」なんて無理をせず、もっと子どもの心でわが子と接してみたらいかがでしょうか。きっと
285,工夫があれば観光資源として脚光を浴びる気がします。（バブルの頃じゃないと無理かな）海の底の道
286,あのような美しい青になるのでしょうか？それとも、もっと違う原因があるのですか？無理です。海水の透明度が全く違います。沖縄の海は綺麗というのには
287,オーストリアの将校を？息子の肖像画を前に皇帝が涙する姿に、側近らは無理もないと思うのだった。ポリーヌが現れたのは、そんな時だった。
288,言葉遣いも折り目正しい。矢口は困ったとおもったが、具合の悪い老人を無理に追い立てることもならず、しばらく門前に置いてやることにした。それから数時間後、
289,。なお、この場所は陸橋の上ですが、この陸橋は徒歩以外での侵入は無理です。その代わり通る人は少ないです。
290,だ。その真ん中に、マーラが〈デッドアイ〉で鉢合わせした三人組がいるのだから、無理もない。三人組の一人―短い黒髪に細長い顔をした男がニタニタ笑いながら
291,クリフは大声で笑った。「終わったあとはみんなあんたに群がっていたな。無理もないよ。あれは大傑作だ！映画化の権利を売ってもらえなかったら、わたし
292,流れていく便器の水を眺めながら、貴子は自分に言い聞かせた。忘れよう。ううん、無理。忘れるんだ。でも。忘れてみせる。ようやく血の味から解放され、鎖
293,必ずしもうまくいくものとは限らないと思います。他人なんだから無理なものは無理ですよ。両親の面倒は見なきゃいけないだろうけど、そのことと一緒に住む
294,歪み、それが自分自身でもよくわかるために嫌で堪らなくなり、必死に背伸びしている無理がたたったものと最後には痛感して疲弊する。そして自分自身を見失う。過剰な階級意識
295,れた質問や回答はどうやってさがすのですか？もう一度見たいのですが。無理でしぃ〜その辺、仕様変更して欲しいでしぃ〜せめて本人だけでも閲覧出来る様に
296,し、『源氏物語』を読み通した人などほとんどいないのですから、そうなるのも無理はありません。私が学院を始めるにあたって考えたことはそのこと
297,。「店を継ぐんじゃなかったのかって、あわてて訊きました。無理強いするつもりはなかったですけれども、なにしろ直澄が子供のころからずっとそのつもり
298,それがさ、薄いのか分かんないけど、すごいビービー鳴るわけ；汗絶対に無理！って思って、今まで使ってた薄いリードで演奏したよー。こっちの
299,死んだと教えたら、機嫌をそこねて黙りこんでしまいました。まあ、子供だから無理もありませんよ。とくにあの子は口数が少ないんです。あまり話しません」
300,顔色もさえない育江であった。諦める事にもようやくなれて来た。運命だと無理に自分に言いきかせ、つとめて冷静に出来るだけ考えないように努力した。青木克己の
301,。土地はありますが、千万円の予算で立てられる家はあるのでしょうか。やっぱ無理ですかね、、、もし出来たらどの位の？？家を建てるのには
302,た。先週までなら入れましたが、もう、あそこまで大きくなると僕には無理です。二番前のキッカーをパスして、三番目のテーブルのようなキッカーを数回試しまし
303,料理を食べるために、家事を全部男の手に取り戻そうではないか。それが無理な場合は、歯磨きをやめ、自分の下着はせめて犬用の毛布と一緒に洗おう
304,、見ときー」「そうかー、じゃあ、行っといでー」「やっぱり無理やったわー。でも、勝ったー！」…アメリカは勝ったというけど、
305,ば、ハイカムを入れることが前提なのでＮＶＣＳは邪魔になる。その場合は、無理にＳ十四やＳ十五のエンジンを探す事もないだろう。シルビア＆百八十ＳＸに搭載さ
306,今後は当選回数別に意見を集約していく方針を示した。参院選候補の派閥離脱塩川財務相「今回は無理」塩川財務相は二十日、フジテレビの報道番組に出演し、小泉首相（自民党総裁）が検討を
307,てるからね＾＾えっ・・・・・いや〜・・・・天ちゃん＞＜３匹は無理だから＞＜ミケの上に乗ってるよ＞＜・・・・踏んではない
308,は、人間の飽くなき「欲」である。しかし、社交の場では、無理をして気取る必要はないが、さまざまな欲をできるだけ押さえる努力をして
309,血を啜るように、趙浚の口が、鼻が、喉が鳴った。無理もない。この地で口にできる甘味といえば、短い秋の間に収穫できる
310,登山道、指導標ともによく整備されている。ただし、歩行距離が二十ｋｍ近くあるため、くれぐれも無理は禁物。小仏峠から東に下れば、四十分ほどで京王バス高尾駅行きの小仏バス停に出られる。
311,言おうかと思ったのですが、友人に相談するにも感情的になって取り乱してしまうので無理そうなのですが、どうにか静かにしてもらう方法はないでしょうか？自分で言う
312,二十歳未満）等を行うとともに、低所得者に配慮しつつ、他の公費負担医療との均衡から、無理のない範囲の患者負担を求めることとするものである。４母子家庭等の自立支援母子家庭
313,ていまして、時間があります。しかも、若さの特権で朝一の始発電車なんで無理ですから、昼頃に二子玉川園駅まで行って写した開業記念飾りがついた電車の写真があり
314,日本は積極的ではなかった。高空でＢ十七に追いつくのは、日本の戦闘機には無理であった。Ｂ十七の日本本土空襲を防ぐには、その基地となりそうな中国大陸
315,ますが、高速道路のオービスなどで時速四百ｋｍの車を撮影することは可能ですか？無理。高速道路用オービスは二百Ｋチョッとで限界です。ちなみに、急減速、急加速中はオービス写真を撮れません
316,の家も同じことを言ってましたが、なんだかんだで大きな金額は無理でも出してくれるつもりではいたようです・・・。平坦な道を歩い
317,ませんか？猫にも相性があるので、仲良くなるのが難しい場合は、無理に仲良くさせないで距離をあけるのがいいそうです。
318,。気持ちの問題なら、好きな音楽を流しながら作業するとか…（職場では無理ですが…）休憩するのが一番ですけどね！あとは軽く「ノビ」をし
319,も取り込めますが、２．０のスペックが欲しいということですよね？ＯＳが九十八以下なら無理です。二千かＸＰなら、２．０対応のＵＳＢボード（ノートならカード）を買って付ければ
320,かもしれない（コンピューターリセット）その他センサー系。ＡＴなら変速機かコンピューター？オートバックスでは無理だと思う。車検には補償もあると思うので、とりあえず相談を。（何
321,と、友人さんとの間の取り引きは別の物ですから、誰に相談しても無理だと思いますよ。出来る範囲としたら、「転売不可となった補償」ではなく
322,ます。風向きのせいか、電車の振動が近くに感じます。昨日午後から少し無理をして、疲労困憊のまま今日を迎えました。もう少し、休みます。
323,理解力にすぐれ、洞察力にも秀でていた。自慢の息子だった。だからこそ、無理をしてでも大学へやったのだ。ところが兄はそこで反体制運動のグループに
324,深夜、彼とコンビニへ行き、市販のクッキーを買い込んで代わりにしました。無理な計画でした。（東京／宏子）●成功会場の下見前に、まずネット情報
325,のお構いもいたしませんで―」「とんでもございません。その節は、無理なお願いをしました」そう言って、ささやかな東京土産をさし出し、紀美子の
326,二人いったいどんな話してたんだろ？私もＰちゃんと電話でお話したいな（無理だけどね笑）昨日は部屋の掃除もした。掃除は嫌いだ
327,を経営することについては異議ありませんけれども、こういうような数字を出すために無理に合理化なるものを進めるとするなら、私はこれはもう断固として反対せ
328,、相手が時間を無理矢理作って会いにきてくれてました。やろうと思えば無理じゃないとおもいます。
329,頂部より五ｃｍ上あたりが目安です。張り終わったあとは、できれば高所にのぼって、無理ならば三脚にでも乗って上から覗いてみます。人の目線ではまんべんなく
330,その活動を継続する強い意志をもっていることを前提とします。２通学距離や方法に無理がなく、長期的に見ても、児童生徒の負担過重とならないこと【申請手続きの期間
331,最下位。というか左回りは全然ダメみたいです。今回は右回りに戻って大外から無理なく追走なら好勝負。勢いが止まった感もあるのであまり強く推せませんが。
332,か？パソコンから送ってくる友人もいるので、「Ｉモードメールだけ受信」という設定は無理です。特定のアドレスだけ受信拒否にしようとしても相手のアドレスは「ＩＭＳ」としか書い
333,ますので市役所に聞いてみてください。その時点で勤務証明などがないと４月の入園は無理でしょう。途中入園もあまり期待できませんね。どこかしらとりあえずパートでも勤務証明がもらえます
334,余計に取られるのは・・・ねぇ？←まだ、学生の身ですから、無理なんですよ、ふふふ。計画性のない私達、乙ｗ皆に言いたいことは・
335,の趣旨があるわけで、高齢者ということで直ちにこの規定を準用することは法律上は無理ではないかというふうに考えております。それからもう一つ、執行停止という規定を考えてみます
336,どんな人？」希味子は即座に訊いた。「さあ。そこまでは無理です。光が屈折しているから浅いように見えますがね。ここは水際から、
337,自分が安住の地を求め、クランを作り、その頭領に収まるなんて、最初から無理があったのではないか。ジェイは左手奥のカウンターがある方へ向かっている。
338,，妊娠三十週目の四肢の複合奇形と仮死状態での出産の原因をｈａｌｏｐｅｒｉｄｏｌに帰するのは無理がある。因みにその文献では併用薬の催奇性について言及していない。動物実験の報告の
339,ねクロスは変えるお金が無いので上手に巾木をはがして下さいと下出に頼みましょうどうしても無理なら安く交渉してくるはずです。
340,もそうである。だが、写真をとるために靴をはいたと考えるのは少し無理がある。撮影のためなら靴だけではなく、帽子とか洋服も身につけて
341,ないはずの思考を読んでしまうという失敗もあります。ベビーサインも、赤ちゃんの成長に無理なく合ったものでなければなりません。そのあたりもこの『プレイブック』では
342,と考えているのですが、これも難しいでしょうか？どうかご意見聞かせてください。絶対無理です。ＣＰＵはぎりぎりセーフですが、メモリは最低百二十八ＭＢ必要です。お使いのマシンは
343,外国から魚を買込んでいるというのは信じ難いが実状なのである。組合長さんが嘆くのも無理がない。漁協を出て、再びホテルの社長さんの車にのせて頂くと
344,。とくに肉体面にはっきりとあらわれてくるのが特徴ですが、経済面、愛情面でも無理な行動はやめ、冷静に、自分も周囲もかえりみる小休止の日です。天王星人
345,は？なので、計画的な行動や指示が難しかったんだと思います。質問者さんも、無理のきかない体で頑張ったのに、それを考えてくれず、暴言はかれた
346,です。十ミリも有ると手持ちの道具だと不可能だと思いますよ。アクリルは無理に穴を開けようとすると割れますし数ミリ程度ならニードルを熱して溶かしながら開けるって
347,『銀葉亭』は、人が死んで転生するとこから話が始まるから、ほのぼのはちょっと無理だと思うんですよ。『水の都』の番外編ってどうでしょう？」「
348,かと思う。五十％超のアメリカを抜こうといっても、人材や予算からみて無理な話で、やはり日本は二十％のシェアをいかに二十五％に高めるかを考えなければならない。
349,だけ踊らされたと思う経営者の愚痴だけで、事は解決するのか」、「無理に貸し付けたぶん、貸し倒れが発生したんだ」と言う人もいるが、銀行は
350,を確かめました前方に肩車がいるので、見るだけなら見られますが写真は無理です三百ｍｍレンズでも遠かったです今日はマニュアルフォーカス（ＭＦ）の練習をしようと思っ
