,0
0,たんですが（このド阿呆チキンが）あまり過激なのは無理です私には無理です（爆）改めて昨夜観てみたんですがちょっとウルッときちまったじゃねえ
1,ことは出来ます。ＵＳＢとかで。リムーバブルメディアにＸＰ（ＯＳ）をインストールしたいなら無理です。質問を理解できる範囲で、精一杯誠意を持って回答しました。
2,ような社会生活の中では、１枚の名刺で自分の人的情報をすべて表現することは無理というものです。従って、自分の関わる内容別に複数の名刺を作ることが必要です
3,ように、そもそも経常赤字国であるアメリカが強いドルを維持することには、経済常識的に考えて無理がある。アメリカがドル高政策をはっきり打ち出したのは九十五年前後であったが、それ以前は、
4,なことを頼まれて困惑している様子が手にとるようにわかる。「やっぱり、無理でしょうか」半ばあきらめながら念をおすと、斯波がぽつりとつぶやいた。「やっ
5,運動やストレッチングで我慢して患部に負担を掛けないことです。痛みが引いたら絶対無理をせず徐々に慣らしていってください。このときは違和感を感じたらそれ以上走らない
6,は、確かにかつてのものとは異なる。誰もが不安感を抱いたことは無理もないことだろう。デビューから１年少々が経過した今、このムルシエラゴに何を感じる
7,。まるで特注の迷彩服みたいにすっかり周囲に溶け込んでいた訳だ。見分けろという方が無理だった。違和感が引くと好奇心が湧いた。少女は両手を広げ体を
8,、こんな部屋が地下一階から三階まであるんですか！」と悲鳴をあげた。無理もない、寸法を計って図面上に記録していくのはアシスタントの仕事だからだ。
9,あるはずです。もっとも、資産の適正額をすべての企業に一律に算出するのは無理でしょう。業種によっても、その企業の特殊性によっても、異なってくるからです。しかし
10,した。「食べに来られないってことはないんじゃないですか」「無理だよ、俺がどれだけもらってると思ってんだ」「お克さんですよ」
11,は皆、業者の作ったＳＥＯ対策ずみだからね。彼らは定期的に、メンテナンスしているので無理ですよ。僕もにもしないでいると、必ず下に落ちます。上に
12,も人を優先して考えてしまうということ最後に短気で直ぐ口に出す性格を無理に抑えているということだこれら三つがバラバラに起こる分にはまったく問題ない
13,られるのでしょうから、ひざの痛みの再発を予防するために、グルコン食品を飲み続けてください。そして、無理をせず、少しでも痛みがあるときは走る回数や距離をへらすなど、
14,者には、どんなささいなことでも切実な問題だ。だから、ある程度の無理はかなえてやる必要があるんだ」上杉院長は答えながら、怒りのやり場に困っ
15,メールアドレスを使いたいのですが。出来るのでしょうか。前のプロバイダでもらってるアドレスだったら無理ですヤフーメールとかならもちろん継続して使えますけど…ただ、たまに会費０円の「コンテンツ会員
16,のような物つけて簡単に理由つけて運動するようにしないと中高年のメタボには無理でしょうね。学者さんだから説得力ありますが運動嫌いな人向けに筋トレの重要性といて
17,、土屋課長は「報酬が十倍にならないと採算は合わず、民間企業の参入は無理だ」と打ち明ける。だが、介護施設の新たな活用方法を示した同村の試みは
18,が遠くなるほど、体重がかかって、とくにひじへの負担が大きくなります。無理のない範囲で位置を決めましょう。ポイント２手をつく位置★手の幅
19,、顔はしわしわ、生理は止まってしかも必ずリバウンドする・・・これを覚悟しないと無理です。それでいいならなにも食べなければ減りますよ。人間の身体は飢餓状態
20,李氏へのビザ発給について「前内閣が十分な国民合意を得ないまま決定した。今後は無理と言わざるを得ない」と伝えた。田中外相の父、故田中角栄元首相は日中国交正常化を実現。中国
21,生物学的な加齢、これはもうどうしようもない。どだい、若返りや不老というものは無理な話であって、生物は生まれた瞬間から老化を始めているのである。その終結点が
22,衰えたところで、ほとんど不便は感じない。徹夜する元気がなくなったから、急ぎの仕事は無理だが、いまは長篇を三ヵ月から四ヵ月かけて訳していく仕事が中心なので、
23,大きさや形の制約のせいで、造形上のデフォルメがとても重要です。実際には無理な形や姿勢をとらせておいて、それを不自然に見せないというのが
24,をゲットするには、魅力ある条件と長い時間がかかりそうだ。ケリー・リン、ダニエル・ウー略奪は無理！？台湾の女優・林熙蕾（ケリー・リン）が、呉彦祖（ダニエル・ウー）との食事シーンをパパラッチ
25,ないとできないのですが、毎日や週に数回の注射に病院に通うのは無理ということから、糖尿病のインスリンの注射と同じように数年前から自己注射（医師ではなく、
26,二種類のタイプがいます。オールラウンドプレーヤーというのは、まあすべての戦法を指しこなせるのは無理としても、自分が先手のときと後手のときとそれぞれ二種類以上は得意な戦法が
27,、そんな北浦といつまでも話を合わせて行かれるのだろうが、あたしでは、無理だ。ノンノが好きだと感じているのは、今の北浦だった。ノンノ
28,られぬ気分である。電話だけでは足らず、佐平次に足を運んだ。無理な注文とはわかっていたが、おかみはそれはいわず、ただひたすらに「
29,までに着きますかね〜？佐川の時間指定はいいかげんって聞きますけど。。無理です。朝一に出しても、翌日十四時にはまず届きません。早くて十八時以降
30,はお断りなんだ。きみだろ？チャンスはないね、百万年待っても、ぜったい無理」「そういうことなら」とハルーンは落ち着き払って言いました。「これなし
31,ば、株価も予測可能になり、株式市場は必要なくなるでしょう。わたしは、予言は無理だと思っています。
32,たいと思っているのかもしれない。公演の期間中ずっと、みずからタクトを振るというのはもちろん無理な話だが、ふたりの指揮者に任せたと言いながらも、祐太郎はぎりぎりまで
33,を忘れてはなりません。〈情実依存型〉一部の経営者にみられるタイプ。無理な融資案件であっても過去の取引実績や支店幹部との親交を言い立て、情実にすがって
34,二千年。武士はＦ３に参戦しながらも厳しい現実を目のあたりにし「もうフォーミュラ・ニッポンは無理」と感じていた。しかし開幕戦を眺めていてある考えがよぎった。「最後
35,中の会社が手を挙げてくれるかどうか、これは一たん伺う。しかしながら、それでも無理だ、どこの会社も無理である、こういうときには、恐らく条件の中で
36,良策があった。「すみやかに救援をさし向けるべきです」「私では無理です。軍師からお願いします」「何をおっしゃいます。私が呉将を動かすこと
37,、貴方だけでも参列されてはどうでしょう？日本国内ならともかく、彼の場合は無理に行かなくてもいいと思います。
38,も聞く事はできるんでしょうか？ダメでしょう、たぶん。ラジオは短波放送受信できないと全レースは無理でしょう。ソニーの小型のたんぱ専用なら今なら千円台で買えたと思いましたが。
39,論理だけで、人びとの暮らしのあり方を決めようとすれば、社会生活の様式に大きな無理やひずみを引き起こす。長い間、市場経済以外の社会関係が支配的であった日本の農村では
40,遅れていることが理由です。しかし、焦りは禁物です。一気にしようとしても物理的に無理です。優先順位もありますが、一応明日からマルチがけをします。モロッコ豆もキュウリも
41,・・何も水分がない・・・からだ・・・＾＾；ぐすん・・・無理っす＾＾；採血・・・４本・・・午前で・・・終了・・・
42,が乗っているＨＰなどありませんか？自分でやるとママのような夜会巻きは無理かと思います。私は仕事上ヘアーメイクさんにやってもらってます。ヘアーメイクのできる美容院で
43,は思い出そうとするように、目を細めた。それからかぶりを振った。「無理でしょうね。鍵の置かれていたテーブルは、扉からかなり離れてましたから
44,どうやっても、無理ですよ。。。殿〜。馳せ参じたい気持ちはヤマヤマですが。仕事始めに休めませ
45,、それとも伝聞か、そこらへんが、わざとかも知れないが、ぼやけている。―無理もないな…。と、トマトジュースをのみながら、田宮は思った―。「
46,はペチャンコに。ただし、スチール缶には２種類があり、頑丈な種類のほうには無理ですのであしからず。スチール缶は体重百ｋｇの人がのっても大丈夫スチール缶には
47,」（Ｎ総）のおばぁ・古波蔵ハナさんを演じた、平良とみさんではないでしょうか。急テンポでちょっと無理と矛盾があってもいつも変わらぬペースで演技を続けていたおばぁはスゴイ
48,開幕戦は甲子園ではできないのでしょうか？（ナイターでも無理なんでしょうか？）無理です。高校野球が優先です。それは、高校野球の方が歴史が長いからです。
49,使用可能でしょうか？また取り付けに何か特殊なことがあるんでしょうか？モバイル用だから無理。モバイル用のマザボを買いましょう。
50,「じゃあ、あんたたちは犯罪行為をしていないのか。あんたたちの利益のために、無理な職務遂行を強要されて命を落としたり、負傷したり、退職してしまった警察官がいったい
51,と思いますが、また、別のいい人が出来ますよ。別に彼女の事無理に忘れることはないと思いますよ。ほんとに好きだった女性だったら忘れるの
52,から入っているゲームなどをもう１台の子供用パソコンにコピーする事は可能でしょうか？これは無理では？標準で入っているゲームソフトだったら、インターネットで探せばかなり同じ物あるいは同等
53,が済んだようで、もういつもの野口に戻っている。「はっきり言って無理ね。国民感情を数字で示すのは難しい」「そうでしょうね」さすがの
54,モデル農村の村民に対する「高度情報化農村」についてのアンケート調査」（十二年１月調査）によれば、地域住民が無理なく情報機器を使えるようになるためには「使いやすい機器の開発」（六十．八％）、「
55,のに４番に据えないと機嫌が悪くなるベテラン選手・・・そりゃ、この２人を無理に使ってムードが悪くなるより、若手がチャンスを生かしたプレーをした方
56,人々に定着してもらい、一方では税収面の増益を図るというような面で多少無理はなかったのかな、あるいは時代の要請であったのかなと思いました
57,男、泣き叫ぶ女。そんな状況を日常としていたら、小坂がそう願うのも無理のないことかもしれないと、俺は思った。「望んで就いた仕事ですし
58,てください」制作スタッフは、あわてた。「先生、予算的にこれ以上直すのは、無理です」が、手塚は、間髪入れずいった。「わたしが、全部
59,か…」「ごめんね。でも、もう無理なの。わかって」「無理って、そんなことないっ。そうだ、赤ちゃん。その子、俺の子として育てれ
60,放題だ。あんたが、人を斬りたいのはよくわかる。だが、江戸では無理だ」「もちろん、行く。試衛館のみんなもいくだろうな」「わしが
61,、開始価格は変えられないんでしょうか？そうですね。一旦取り消さないとＹａｈｏｏでは無理です。別のサイトでは、開始してからでも価格やカテゴリの変更が出来る
62,あるのですが、数学は中１の範囲を入学までに一通り終わらしておくと良いです。無理なら１学期分くらい。だまされたと思ってやってみてください（＾＾）簡単だから大丈夫だと
63,ないです。出来れば２年くらい寝かしたかったのにな〜・・・←呑ん兵衛には無理だと思う（笑）ってか、うなぎと梅って「食べ合わせ」悪いとか
64,が、ときおり通りを行き交い、国境警備員は、事務所の長椅子に横たわっている。昼前、無理な姿勢をずっとつづけて体中が痛くなり、思い切ってデッキに出ようかと考え始めた
65,からいわれてきた。自分を食いつぶしてしまうとのたとえから、株式用語では赤字会社が無理をして配当金をだすことを「タコ配」と呼ぶ。しかし、実際に、
66,という事で朝、いつもの時間には出られませんでした。「まだ無理。後もうちょっと。。。」と言ってズルズル時間が経っていきました。でも
67,で移動する現代の単身赴任がその事実をよく物語っている。虎之助は今日明日の移転が無理であるのを悟った。彼はまいの目を盗んで押入れの隅に放り込んで
68,思ったよりも小説が書き進められません。夏ごろに新刊として出したいのですが、無理かもしれません。思い入れがあるだけに面白く書こう、こういう表現にしよう、などと思っている
69,の部分へと、金ぐしを通していきます。毛玉などでうまく通らない場合は、無理をしないで、少しずつとかしていくように。簡単なトリミング危ないから
70,というのは、先にも述べた東京、山手の成立事情から考えて実際には無理な話で、下町育ち、さらには関東地方の出身者にまで採用の枠は広げられた
71,試合とかだと。同じチームの人にまわってきたパスを。自分が無理に奪ったりはしないでしょう。敵からボールを奪うのはありでも。それ
72,サラリーマンと自営業者等との間で連帯意識がなければ、同一の制度にすることには無理がある。所得捕捉の問題を避ける方法所得捕捉の問題を避ける年金制度がないわけではない
73,を心がけます。話題も天気がいいですね〜とか軽い話題でいいのです。無理に仲良くなろうとすると相手もそれを察知して警戒します。仲良くなって下着や
74,腹が立つ。情けない。ムシャクシャする。うっすらと髭を生やした自分の顔が無理にも笑みを浮かべている表情を想像し、井原は羞恥で寒気と吐き気を覚える。
75,たんです」と菩薩のように安らかな表情を見せたのだった。それも無理はない。なにしろ彼女は小学生の頃から自らの内に潜むサディズムを少なからず
76,見上げたら、熱気球が数機ふわふわ漂っていった。この国の人たちはゆったり落ち着いて、無理なく自分のペースで楽しんでいる。慌ただしいアジアから来ると、いつもそれがうらやましくて
77,のようなものはやや不安。登山靴使用を勧める。遭難はまずないと思うが、無理のない計画が必要。小学生でも登山可能。ただ、幼児はやめておいたほうが
78,と存じますけれども、実現しない差益に大きな課税をするというととは事実上無理なことでございます。そういう御主張があることを存じておりますけれども、これ
79,椎間板ヘルニアの軽いものでもあれば、クッション装置としての椎間板の役割が十分に果たせず、ちょっと無理をすればすぐぎっくり腰を起こしてしまうのです。高齢者にはかならず起こるすり切れ現象としての変形性脊椎症も
80,で夜のうちにおはようと言っとこうか４谷川知子にきみが怒るのも無理はないさぼくはいちばん醜いぼくを愛せと言ってるしかもしらふでにっちもさっちも
81,。その責任は実は親にあるんですけどね。あなたは、講師でしょう？学力的に無理であるということを、教室の責任者に早い目に伝えておき、親に伝えて
82,楽しいと思う。●告白して振られたら、すぐに諦める？？文貴が相手なら無理だな。しの−かに文貴はやらん！【お付き合い】●どんな異性と付き合い
83,交渉を成立させてきたばかりなのだ。しかも、予約で満席だったところを、無理を言って９人分空けてもらった（もう、料理も頼んじゃったし、そろそろ移動してもらい
84,ているのは、その隔壁のむこうだ。隔壁自体は、ギガボルトシステムを使っても破壊は無理だろう。なんとしても隔壁を開いて、アンジー本体のコントロールパネルを操作して、スパイラル・アイランド各部への
85,にあった活動を紹介している。ボランティア活動をはじめるには，まず，できることを無理のない範囲からとりかかる，活動時間やプライバシーを守るなどの基本的ルールを守る，活動のようす
86,わ。カケルとなじみがエッチな雰囲気になってドキドキしましたが、さすがにちょっと無理があるわな。それよりもなじみまでアキカンのオーナーになってしまったねぇ。
87,で、これはテクニックが必要であり、それを身につけるのは独学ではとても無理です。製図試験に合格するには、第一に製図指定要件事項を想定した間取りをパターン化して数多く
88,持って清々しい顔のディン君♪可愛いなぁ〜。疲れると甘えるモカでも重いから長時間は無理です。こういう光景はうちでもよく見かけます。パパさん熱烈大歓迎中の一家ワル子＆ワル男もよく見え
89,が見え、月明かりもあり天候が良好でヘッドランプも持っているなどの場合は少しばかり無理をして夜間の行動をしても良いかもしれませんが、自分の居場所さえもわからず天候
90,、親のつけてくれた名前は気にいらないと思っても、やはり改名は無理です。ただし、まったく改名の可能性がないわけではありません。戸籍法で
91,「シリアルＡＴＡ」と言うのが気になり聞いてみました。ご存知の方お願いします。無理でしょうね。シリアルＡＴＡはＩＤＥとはコネクタが違います。
92,外まで逃走するのは可能になると思います。でも、聖具保管室を突破するのはまったく無理でしょうね。では次に、反対側の廊下のことを話します。独房の
93,。ちなみに、大昔、うなぎでも、骨、喉に刺さりました。ご飯では無理だったぁ…。なんでだろ…。
94,があるのでこうしてきたのだが、やはりこれが良くないように感じる。無理に正面に出ることによって、まだ覚え切れていない笛のモーションの遅さに付いていけ
95,交渉して利子だけの返済にしてもらいました。ローンを返済しながらのやりくりはとても無理でした。私たちはギリギリの所まできていました。正直なところ、無一文に
96,のある程度の長さになる。それ以上長く本紙を仕上げた場合は、三段表装は無理で、「丸表装」に仕上げないとかからないことになる。床板に花器なり、香爐
97,ますか。そうなったら働きます」「乳児保育はまだやってないので、いまは無理ですけど、ね」「働くのはすきですから。働けるようになったら」「
98,義理の両親との同居は難しいですよね〜？？同居するなら舅さんを立てない限り無理でしょうね。あなたがいろいろ言いたいことを我慢せずにやってきた環境で育った
99,モシモは頭をふって、両腕を大きく広げました。「不可能だね。無理だよ。メニューにはありません。夢でもだめ。お話の海流のある
100,。戦後の学制改革はじめ、社会条件の変化もあり、現在同じような組織の形成は無理であろうが、先輩、後輩関係を含む「良き人間関係」の重要さは、増えこそすれ減る
101,どっちでもいい民衆がたくさんいるのでは？そう推測した。こういうネタを無理に報道する必要はないだろう。各国のジャーナリストはそう考えたのではないか？ここは
102,でなかなか攻撃ができないときが多々散見されましたので・・・すぐには無理かもしれませんが、中学でも役に立つ練習ですから、意識して練習して行きたいと
103,ことはできないんだ」「やってみるのよ。あなたならできるの」「無理だよ。動かない指があってピアノを弾けるわけがないだろ」さくらは
104,てその中に入って行かなければわからない。その通りです。このキレネ人シモンも、無理にその愛の中に引きずり込まれてしまった。十字架の重さそのものを味わわされた
105,から、中国人が直接海上ルートでやってきて水耕稲作をはじめた」とする方が無理ないように思える。一方、形質人類学による弥生時代の人骨の調査で、縄文人には
106,しかし朝からものすごい雨・・・しかも、夕方からの降水確率七十％・・・これは無理だと思いお昼前に中止の連絡を野球が中止ならトレできると思い昨日の記事
107,ではないのかな？恥ずかしいのかもしれませんね。あなたから手をつないでいくか、それが無理なら腕をくんでみては？腕組みは女性からしないと出来ないアプローチだし
108,わからない。だが、超魔を敵とすることだけは間違いない。「君では無理だ！」と千剣破。結界への突入で随分数は減ったが、依然
109,インターネットで官僚、公務員から解放される、革命はおこせないものか？インターネットでは無理ですよね。公務員の一人ひとりの自覚が必要なんですが・・・・・・
110,ば、二十五年で二倍という自然増加率にはならないであろう。それは不可能ではないとしても、かなり無理な想定である。実際過去の記録を見ても、二十八‰以上の人口増加率を長期間にわたって持続し
111,从＊´ヮ｀）を安心させられるよ（＾−＾）正直、直接、触れることは無理だけどこの前も、結構大きなゴキブリが夜に出てきて床にいた
112,３つと好相性のジョッキーだ。福永の場合は人気上位の馬で好走することが多く、無理な穴狙いは避けたほうが無難。幸個人の１番人気での成績は阪神、京都の
113,が夢になるかもしれません。「こういうことができたらいいな」とか、「最高だけど無理だろうな」と考えるものが夢なのです。具体的なステップや実現可能なプランが
114,の天才は別格として、普通の人間にはいきなりグッドアイデアを出そうとしても、無理な話です。無理に頑張っても、かえって肩に力が入るばかりで発想力は
115,＝成果指標を設定する。原則的には、１目標につき１指標に絞り込めるとよい。しかし、無理に絞り込むと戦略目標の趣旨が損なわれてしまう場合には、複数の指標を設定すること
