,0
116,はどうやってやるのですか？下顎挙上の状態で両手の親指で鼻をつまんでかなり無理のある姿勢で口を密着させるの？素人には出来ないような・・・
117,光」は光秀の「光」だという話にもなる。この辺はさすがに無理があるが、家康が信長に殺されかけたのが本当だとすると、
118,必要に応じて五〜八名の捜査員を配置した。捜査員は車に潜伏するか、それが無理な場合には、近くの家や倉庫、橋の下等に隠れた。配置に
119,。ただ、ここにきて疲れが出たということは、やはりその行動に無理があったのではないでしょうか。まずは、心身の疲れをとってください。よく眠るために
120,も大きな存在感があると実感した。だが、セイント・ピーターズ教会のように早朝から開けるという無理をしてまで人を集めなければならない今とちがって、かつて教会がまさに町を支配し
121,や観客の歓声が自分にだけ向けられているという快感」を忘れろというのは無理な要求なのだろうが、しかしそれを「断ち切って出発する」ことができない者は
122,、付き添いとして同じ部屋に寝泊まりする程度や。それも、学校始まったら毎日泊まるのは無理やし。そうなったら由香、寂しがらへんやろか…。由香、いつまで家で
123,で損をするのはあなただけですよ。もうあの土地を五頭建設に転売することは無理です」「なんだと」「その転売によってあなたにいくら入るかわかりませ
124,で、も一回お願いします」道子はすでに泣き声だ。けれども、「もう無理だよ」と医師は首を横に振った。「ノブ…ノブ」
125,多少小さくなって、前のブラは使えますよね？？（アンダーバストは痩せなきゃ無理と承知ですが・・）１歳の子がいますが今はもちろん妊娠前のブラ
126,ラトーヤにはお声がかからなかった。両親には、彼女たちに協力を求めるのは無理だとわかっていたからだ。ジャネットは、Ａ＆Ｍのニューアルバムのレコーディングに没頭していた
127,、境川を渡って小田急を越えた先の海岸にあるので、駅名には少し無理があるような気もする。突如、海から上がったばかりと見えるサーフボードを持っ
128,を考えて行動するところがあった。子供らしく素直な感情を出して甘えることができず、無理をしてがんばってしまったようである。風邪で休んだのがきっかけ？四年生の
129,かだな。↓これじゃ、男ってバカだよな。って言われるのも無理ないな。うん。↓今日はその後、カラオケに行ってきましたｗ履歴
130,てゆく。もちろんワンカットである。はじめ、アラカンはとてもできないと言う。元来が無理な注文である。走るだけでも呼吸が乱れる。だから立ち廻りがサマにならないと
131,か？私は十五年くらいがいいと思いますギャハ！未成年だから、復帰は無理でしょ。。ジャニタレで、未成年、飲酒、喫煙で戻ってきたのは、誰
132,めっちゃ忙しかった…目が回ったよぉ…２人で回すの無理があった…なめてました。オーナーが手伝ってくれなかったら、もう無理だった
133,一致しているのかは体験してみないと分からない。食べることが痛みとして残るなら、無理に押さえ込まずに向かい合った方がいい。どうあがいても私たち人間は他の生命を
134,喋らないのではない事は僕には分っていたが、あの頃の貴方は無理に喋るというような気がして、可哀そうだった。原映画はやはり
135,”という彼の言葉が、素直に受け入れられなくて・・・。私達はもう無理なのでしょうか？このスランプを抜け出すにはどうしたらいいのでしょうか？６年もつきあっ
136,。しばらく佇んだ後、タスポのセンサーに指先でタッチ。おばあさん、それはきっと…無理です。ここで、おばあさんに声をかけた主婦であります。今はタスポカードがない
137,。米米クラブなんかも一夜限り、とかでライブしてくれたら嬉しいですね。ブルーハーツやイエモンは無理そうだけど、もう一度見たいです。あとは、安室奈美恵ｗスーパーモンキーズ、やって欲しいです
138,だから冊子小包と記載したのですが引き受けた方が良い出品者なのでしょうか？メール便が無理というのは、受付場所が近くに無い等の発送の利便性の問題ですか？それとも
139,はよく頑張ってくれました。今日も朝から片付けしていたし、プンプン怒るのも無理ないですね。皆さんは、ちゃんと大掃除してらっしゃると思いますが、いるものといらない
140,れます。全体の輪の長さが揃っていないために剥がれ易くなっているのでしょう。修理は無理で、新しいマジックテープに交換する方が確実です。良い機会ですから、マジックテープ以外の方法も
141,蹴っている瞬間に『引き分けでもいい』なんて考える選手はいない。そんなの、無理ですね。小野伸二パオロ、遊んでこいよ。これはゲームなんだから。ニルス・リードホルム
142,パンフレットでは、生きもの、植物類は荷積みできないと記されています。梅の木は無理にしても萩、沈丁花、紫式部などはフーさんは自分で自転車で運ぶつもりで
143,のですがすでに、質問者の心には「気に入らない」思いがあるので、無理でしょう。今後の対応・フルネーム、住所、電話番号を知らせてくれるまで振り込まない。・
144,それはそのまま八五郎やその家族の首を胴に付けておくという知らせなのだから無理もない。八五郎はまるくなって乾（北西）の隅へかけ出しながら、ぐっと眼頭
145,厚意は身に染みてありがたい。それとも、俺がよほど貧乏に見えたのだろうか。無理もない。俺は見かけどおりの貧乏人なのだから。洗面をすませ、布団を
146,の眼の周りの深い隈に、彼女は気づいたはずである。が、母は無理にも微笑を浮かべようとしていた。「そなたこそ…私が寝まずに
147,というのは極端すぎると思います。お菓子類は一切与えないということでしょうか？それは無理だと思います。うちはアトピーがあるのでそういうことには敏感です。確か
148,そうに、再び腕を締め上げた。先程よりは手加減しているものの、関節を無理なほうへと曲げられる痛みはかなりのものだ。男はヒイヒイ言いながら言葉を
149,のだろう。観光客の自覚に頼るしかない」と話した。観光客の自覚に頼る。無理だと思うなぁ。肯定派もいたり、開き直ったり・・・という方もいる今
150,のヘリ空母なら、あれで二千名近い乗員は必要だった。でも、潜水艦は当分は無理でしょう。何より静粛性が要求されます。ギーコ、ギーコというロボットの駆動音はまずい。まだ
151,お気持ちは痛いほどわかります。しかも３年ごとに引越しです。もう５回経験しましたが、無理に仲良くなろうとしなくてもいいのです。とにかく挨拶だけはにこやかにを心がけます。話題
152,点が見当たらないという私は推定のもとに、急激に日ソ関係においてソ連が余りな無理はできないというのがこの漁業関係の交渉においてもあらわれたものだと思います。
153,―」「できません」きっぱりと言い切った。ケチ根性で言っているのではなく、無理なものは無理なのだ。その現実は警察にも認識してもらわなければならない。「でも
154,人間がこんなにこわばった表情で、いったいどうしちゃったのだろうか。しかし、無理もない。なんと運転席に座り、真剣なまなざしでハンドルを握っているのは十一月に
155,、当然ながら松平女史の怒りは容易におさまらなかった。心情的には、まことに無理ないことだが、このあと常磐会としてできることは、東宮女官長の送り込みである。無論、
156,効いたなあ。こんなにみみずばれになって、ティエン様もかたなしだ。母さん。もう、無理なんか言わないからね」「ティエン。すまないね。私たちが貧乏だから、
157,といった好条件で核頭脳誘致を企てる第三世界の軍事国家の誘惑に、彼らが応じるのは無理もないことだ。日米独など西側諸国が共同して緊急の対策を講ずることが要請され
158,のせいだと言ったわね。自分で自分を許せないって。その気持ちを無理に変えさせることは私にはできないわ。ただ、これだけは知っておいてほしい
159,ないのでしょうか？ＭＩＷＡのＰＲですね。ディンプルの形状が複雑ですからホームセンターでは無理でしょう。専門屋に依頼するしか無いでしょうが大家に頼めないのですか？
160,の妖法についてなおかんちがいしているふしがあるようだから、未体験の勝小吉がこんがらがるのも無理はない。ともあれ、はじまった。―忠治の姿をした男谷がかんちがいし
161,が発生しやすい４人の入れ替わりにともなう労務管理が困難である５繁忙期には能力オーバーの無理な生産になり、納期遅れや品質不良が発生しやすい６閑散期は時間的に余裕のある生産
162,で今週から土曜出勤あるんだろう・・・・・（←現実逃避）合わせ来週とか絶対無理だしとか言ってみる。ぶっちゃけ何も出来てない。もうダメだ。誰か
163,の殴り合い、すっごい楽しみです。本多が眼鏡を殴ってる絵が見たいな！（無理でしょうね…）オフではホンメガしか書いたことないですけど、サイトにはメガホン
164,ひどく、半月以上もの間、ずっと臥せっていた。彰子が見舞いにきたときに無理をして起きていたのも、よくなかったのかもしれない。だが、昌浩の心情
165,たわけですね」「その点は警察でも疑問に思った。しかし、無理もないです。月の晩でさえ、この道は真暗です。しかも、あの晩
166,もうやだ！！！このバイトもう無理！！！！やめたい！！！！！！でもやめるとお金に困る！！
167,に名古屋へ入らつしやること出来ますの、御都合如何でせうか。お金が入りますから、無理にいらつしやらない方がいゝと思いますの、たかはとても来てほしいんですけれど心ぼう致ます
168,。皆、元気です」細い唇が少しへの字になった。鶴子は無理に笑おうとしているらしいのだが、完全な笑みにはならなかった。鶴子
169,た。世界で活躍する日本人男子選手が見たいです。マスターズ最終戦に出場する日本人選手が見たいです。無理なんかなぁ、、、、。私もチリ戦見ました。おそらく今オールジャパン対スペインＵ十八
170,高校も生徒が受験校を選ぶさいにあくまで本人の希望と意志を尊重しています。無理と思われてもあえて挑戦する生徒が多いために、現役合格が伸びず、浪人する生徒が
171,は年４回試験の地域でスムーズに行って約１年かかりますのでこの場合は夏休み中には無理です。
172,一枚か二枚か、ヨーグルトの代金分だけコーンを受けとって同時に財布をあけるのは無理なので、その前に払おうと用意する。「わかりません。ぼく、いまはじめ
173,、それでもあの頃培った力のようなものは少しは残っているらしい。最新曲は無理としても、何回か聞くうちには憶えられるようになった。別に若ぶっているわけ
174,したいわね」「水曜日、一緒に裁判所に来てくれる？」「無理よ」「お願いよ。あたしには大事なことなのよ」「どうして
175,た。陽一はぞくぞくした。女にそうされているつもりになろうとした。無理だった。体のあちこちに熱くて硬い平田の体が当たるたびに、陽一の
176,落ち着かない気分になりますが、歯科医がきちんとした気の持ちようや、慣れるまでは無理に自分を抑制しないというような、精神面の指導をする必要があります。
177,、１ｄａｙ２ｐａｒｋというチケットで１日で制覇しましたよ。ＷＤＷは１週間あっても無理ですね（笑）暑さ対策→とんでもない暑い時期なので、サングラス、帽子は必要です
178,医学系研究科修士課程に在学中牧野雪子さんフィットネス・インストラクター。健康維持のためのエクササイズ指導やスポーツイベントなどに参画。日常に無理なく取り入れられる簡単エクササイズも好評丸山尚子さん出張ビューティーアドバイザー。元美容部員としての経験を生かし、現在は個人宅に
179,を含む動詞であることを銘記されよ。独和辞典を繙けば、この単語には「無理な要求をする」という類いの訳語が与えられているが、それは「理由を
180,こうなりました。確かに、これならいちいち説明しなくても区別つくね。でももう無理なのさ。何となく黒髪菊也の雰囲気が雲雀さんっぽいと思うのは俺だけ？
181,が１急に病気になった。しばらく休む２よくよく考えたら十八万では無理、家族４人を養えないので辞退させてもらうと言う３無連絡と自分で考えまし
182,な決算対策が行われてきたというワケです。たとえば子会社への損失押しつけや、決算期末の無理な押し込み販売などなど。いわば“見せかけ”の決算書対策によって苦境を乗り切ろうとした会社
183,べく懸命に適応しようとする。しかし、異常ともいえる画一化社会に完全に溶け込むことは無理で、多かれ少なかれ不適応を起こす。このような教育を長年にわたって受けることによって、
184,した。「誰が？」「先生、今の成績じゃとてもタカタカは無理だろうって。この前のテストで分かったんだってさ」「じゃあ、これから
185,もきっとそうなのだろう。一万ドルの現金と、貴重な密造酒が燃えてしまったのだから無理もない。西のほうから別のトラックが近づいてきた。近づくにつれ、
186,か」ああいやだおおいやだ夢みたくても夢みない夢みなくても夢みたい無理なむすめむだな麦こすい心と凍えた恋四角なしきたり海のウニ海
187,。体の疲労が全然取れないのも原因だ。やはり連チャンでスノボー＆運転手というのは無理がある年になったのかも。悲しいな〜日曜日は休養日にしたものの〜
188,を知り尽していなければ、とても船の操縦などできはしないのだ。私も、無理に舵を握らせろとは言わなかった。きのうの荒れ模様が、海には
189,ている。さあもう出発です。キャンプへゴー。恐らくもとの絵を再現することは無理だろう。これらは与えられた絵を見て、物語を作ったものである。Ａ
190,実写にしか見えないＣＧも金と時間をかければできるでしょうが、今回は無理。で、待つことになったわけです。奇跡の名演技を。もちろん専門の調教の
191,せるという荒技を使っていたが、さすがに『戦国自衛隊千五百四十九』では国家の機密上無理！！ヘリの操縦は全て現職の自衛隊の隊員が行った。実際に
192,は。私も今何かないかと探していますがなかなか見つかりません。けど無理をすると長続きしません。本当に興味の持てるものが出てきたら自然とのめりこん
193,それが「弧」ですよね）しかしアメリカを全く無視しようっていうのは土台無理なんですよ。満州だってそれでやられたでしょう。アメリカを無視する
194,た。「いいとも。なんたって俺が演出者なんだからね。大統領閣下に無理をたのもう」とたんに、「もちろん私の分も、頼んでくれるんだろうね
195,でも、実際にはその言葉どおりを達成することはできませんでした。私には無理なのかなあと。まあ、今となって思えば、昼夜フランス料理を食べ続けるなんて、
196,帝を玉座から引き降ろして、その璽綬を解き、北面して臣下の列の中へ無理に立たせた。そして、泣き狂う何太后をも、即座にその后衣を剝い
197,の明治四十四年（千九百十一年）のことであるから、父がスキーを知らなかったのも無理はなかったが、それからの父は持ち前の好奇心の強さと器用さでスキー作りを始める
198,てないです。「携帯何？」Ｄｏｃｏｍｏ、黒色「コンピューターから離れられる？？」無理です。絶対。「殴り合いの喧嘩したことある？？」ないです。「嘘つい
199,よ。「おいおい。帰って来ちまったぞ・・・」。都会では無理でしょうか？風呂に漬けるのは、ちょっと・・・・・。屍骸の後始末も
200,の質）が問題になります。「肺がんや肝臓がんは、これ以上の治療は無理だろう、となってから、亡くなるまで一〜二カ月です。しかし、子宮がんは半年、あるいはそれ以上
201,ます涼しくなると出てくるんだよねー筋肉痛も有るのだが？！年輪重ねてくると無理が利かなくなってくる疲れもなかなかとれなくなってさ！今朝もエンジンかかるのに
202,にこなせるなら問題ないと思います。でも幼い頃から英語付けの生活ではそれは無理ですものね。日本人なのに日本語が出来ない・・・日本では英語が
203,、ニンジン・リンゴジュース、または生姜紅茶か、両方を飲むのがよいのである。食べたくないのに無理に食べる必要はまったくない。しかし、それだけでは日中に空腹を感じるの
204,か、その辺は娘ちゃんと息子君の言い分です。息子君は「無理だよ」と言ったそうですが、娘ちゃんが強行突破したらしい・・・
205,ひとりの気持ちだから言葉にする気はないけどここから…うまくまとめるのはかなり無理があるだろうなぁ〜。だけど…りぱぷぅの高校が転出をした以上、もう変更不可能
206,、憲法九条は単純にして明快、これで十分であると信じている。これを無理にしているのは、「戦力の非保持、交戦権の放棄」を明確に規定した
207,某大手飲料メーカーの子会社である運輸会社に勤務しています。宅配を含める運輸業務はいろいろ問題点が多く（無理な時間帯での配達指定など）特に小さい業者などは無法地帯であることが多いです。朝
208,するなど、積極的な姿勢がいい結果をもたらします。ただし、上達を望むあまり、無理な練習やスケジュールを立てないほうが楽しめます。★恋愛運３恋愛対象として見
209,やはり無理な仕事量でした…（泣）またまた徹夜します…でも少し時間があるので一週間ぶりに
210,ます。過去それが許容されているのは、男子が、過酷な生存条件に対応するための無理や、戦いに出ることなどの慢性的不足が予想されたという歴史的な背景のあること
211,か？また計上出来たとして年に何回ぐらいなら認められますか？毎月は無理なのでしょうか？現金で購入した場合経費をある程度計上しないと節税ではなくなっ
212,た方がいいですし、無理に体を動かすのは危ない気がします。無理は禁物ですよ…うつの夫持つ妻より
213,彼はよき夫でありよきパパである。そんな彼の姿を想像するなといっても無理かも知れないけど、せっかく逢えた短い二人の時間を楽しめない。これが愛人生活
214,ので毎年格闘してます・・・。なれないと、ナイフ１本で開けるのは無理です。それかしっかり洗い、お酒を振ってレンジで酒蒸にすると開きます。
215,キュウリはやはりこの寒さ、無理だったのでしょうか？ラブシートの下では生きられなかったようで！三十四個のタネ
216,ビッグスポーツイベントであり、そのために巨額な放映権料がクラブに支払われる。したがってクラブオーナーは先行投資として無理をしてでもスーパースターを集めるというのである。スポーツがビジネスとなり、選手は商品
217,のです。オルガンを弾くように自分からすすんでやるのではなく、まわりから強制されて無理に弾かされるのは、とても苦痛だったのです。音楽はもっと楽しいもののはずだ
218,なんだが。必要性は感じているけど、食という楽しみをスポイルする気はないし、無理に運動なんかしても止めたら元に戻るだけなんで、あくまで記録一本で「
219,キレイデス」などと訳の判らないお世辞を言うはめになった。さらに、少々無理な設定をしてしまった行きがかり上、オレはありふれた日本家屋の各部屋を案内されて回り
220,一般の人は座れないと思います。（メンバーの家族とか知り合い・関係者等でないと無理です）親子席なら座って見れますが、大人の方だけで座って見てる人
221,。」「息子や娘には傍にいてほしいが、島には仕事がなく無理である。盆や正月にのんびりしに帰ってきてくれればいい。」など、外部の
222,なこと言うようなら「降ろせなくてもいいんですか？」と言うしかないでしょ。奥さん無理なら院長に言ってみる。とにかくそうしなよ。
223,し過ぎたのよ」どこかから、声が聞こえる。「わたしたち、ただでさえ無理に無理をしてきたんだわ。船から出て…ヌバ人の中に入っ
224,がいいのかもしれませんが、もうそんな気になれません。他の男性でも当然無理です。どうしてダメかというと、気持ちがいいとか悪いとかという問題ではなく
225,じゃありませんけれども、ある程度は雇用問題は前進すると考えております。民間あたりではこれは無理だろうというようなことを言っておられますけれども、しかし政府は、総理大臣も
226,た状態を作り出す確信犯の集団に、普通の市民が自己防衛だけで太刀打ちしろというのは無理。警察がもっと摘発しなければ」と指摘する。宇都宮弁護士によると、ヤミ金融対策法（貸金業規制法及び出資法の
227,牛すじトロトロそんで〆は、お店に無理言ってラーメンの玉をお願いしました。
228,ここで紹介した料理はすべて２人前。１万円のコースではさすがに乾燥鮑は高価すぎて無理、新鮮な鮑のオイスターソース煮となった。それでも、十分に贅沢な、鮑の食感
229,で、やはりノーザンダンサー系が強かった馬場次第かなしかしながら、ＯＰ特別や千六百万のレーキャラは、無理かも条件が変わりすぎでサンプルが少な過ぎますねでわ！
230,本当はまだへこんでるんですかね？へこんでいるのかもしれませんね。。。でも、これ以上無理って言うくらい落ち込んじゃえば、逆にスッキリするのかも。泣きたいときは思いっきり泣い
231,しなかった。トモヤは普段より明るく、元気そうに見えたけれど、どことなく無理をしている気がした。「団地に住みついている野良猫は、みんな、死ん
232,ａ＝二千八万千二百十七−００００００１６−ｙｏｍ−ｂｕｓ＿ａｌｌ日本政府が市場介入するとか言ってたけど、もうこうなったら無理でしょ。焼け石に水です。後は覚悟を決めて・・・なるようにしか
