,0
351,に関しては強ち誇張でもなく、以前の明らかにミケランジェロの模倣と思われるような無理な表現は影を潜め、一方で初期の作品に殊にはっきりと認められる彼の
352,：絶対無理十二：短気△：うちも短気やし十三：ヤクザ×：無理十四：甘えんぼ△：マザコンは無理十五：Ｓ○：別にいいやん十六
353,多い。このような小型航空機の事故の防止を図るため，法令及び安全関係諸規程の遵守，無理のない飛行計画による運航の実施，的確な気象情報の把握，操縦士の社内教育訓練の充実等を
354,下げていった。これは、お尻のところで必ず引っかかるので、前から下げようとしても無理であった。まずお尻を外すのがコツであった。吾一は、その辺り
355,ダイヤモンドで武器を作ったら最強だと思うんですが、無理なんでしょうか？？ダイヤモンドは火に弱い。そっこーで燃えます。石炭と成分
356,ていたかも疑問である。まして集団的な規律に服させようなどというのは、とうてい無理な相談であったといえる。最後の点は特に重要なことであるが、兵士
357,ありません。このため画質を落とさない限りそれ以上は圧縮はまず期待できません。無理に圧縮しようとすると返ってサイズが大きくなる場合もあります。
358,ご遠慮なく」「ララ、きみ以外の女性なんて、考えられない。でもやはり結婚は無理だ。分かるだろう？きみもぼくも仕事を放棄するわけにはいかない。どんなに一緒にいたく
359,彼女ができたことがありません。アプローチや告白は全部失敗・・・この先、無理に彼女を作ろうとせずにいて、自分に自然と合った女性と出会え
360,微笑）次からは、お見舞い無理しなくていいからね、うん、無理しないでね、無理は、絶対」郷子「え…」江津子「（苦笑）」郷子「
361,どうしても人が苦手な方もいます。その方はいいんですそのままで。無理に他人を受け入れるとストレスです。亡くなり方も人それぞれがあっても良いと思います。
362,この寒空の中、まさか１時間以上もバス停で立っているなんて、無理、無理、絶対に無理。結局、往復同じタクシーを使うことになり、なんだか慌しいお墓参りになってしまいました
363,前年の八月に続いて、またしても独断（山内豊信流の言い方では、「無理に御独断」）したのである。機が熟するのを待てない、堪え性のない彼
364,でしょうか？暑くて死にそうです。ビバーエアコンＳＲＫ二十五ＳＣです。タイマーランプ６回点滅診断記号０５ですね。無理だとは思いますが、コンセントを一度抜き差ししてからもう一度リトライしてみてください。駄目
365,だわけでもないしね」正面切って、指紋の提出を求めるのは無理だ。しかし、遅滞は一瞬だった。三人の指紋を入手すべく、すでに
366,旨を伝えました夕方の出発時間や行き先などを聞いたのですが、時間的にも無理だし無理をして行ってもも楽しくないので、折角の誘いでしたが
367,頭取も石田、直井の両君も、揃って明治三十年代生まれで、すでに七十歳になっている。無理のきかない年齢であることは、誰の眼にも明らかだし、そうなると
368,。遠誉野署内は、ちょうど判断の端境期にあった。「やはり、樹来静弥の犯行は無理でしょうか」佐々本の声に、手のなかの鉛筆がぽきりと折れた。
369,か考えていたのは【六甲山】か【須磨離宮公園】でも酷暑の中・・・無理！！炎天下の中で撮影するのはちょっと・・・ということで京都に変更♪
370,昇天の刺青一「おたえ、俺に刺青をしろ」「その躰では無理だよ、お父っつぁん」「いいから、やれ！この腕にぼかしをしてみろ
371,狂います。きっとそんな時の私は般若の顔になっているでしょう。割り切る事なんて無理です。私もあなたも不倫には向いていなかったのかもしれません。でももう荒波に
372,ますが。なんでだろうね？体が硬いのかもしれない。体が硬いと、ちょっと無理な体勢になった時にすぐ怪我するし、疲労もたまりやすいからね。
373,ごくたまに可能なことがあるらしいが）バングラデシュとインドの国境は政情不安定で危険かつ無理。北上して中国まで行ってネパールから入るというのなら可能かもね。飛行機の
374,できた。「それがようやくわかった。間違いだったとは言えないけど、無理だった、と。会社はまだ納得していないかもしれないが、多くのサラリーマンはそう気付い
375,あれ！またコツン！全部室内灯の辺りからします！助けて〜って言っても無理だからとりあえず、南無阿弥陀仏…ですね！オバケさん出ないでね！怖いですから…あー
376,をかわれ石岡市では生活排水浄化モデル事業まで手がけています。■■理事長は「大海も一滴から、無理なくできることからの活動です。みなさんの参加をお待ちしています」市の封筒に
377,私にチョコをやめろと言うのは無理です。もう腹へって腹へって２つもチョコのお菓子を買ってしまいました（
378,相談の手紙の内容は、極端なほど自分勝手で、読んでいる中に、それは無理ですから、おやめなさいといいたくなって来る。第一、必ず美しくなるかといわ
379,た色のひまわり正統派ひまわりバッタ君♪いやぁ〜アップにしないで〜〜ってか？これ以上、無理っす。。蜂君♪ちょうちょ〜〜〜♪お願い〜〜じっとしてて〜
380,太い指で、乳首をこすったり摘んだりした。シュミーズを引き上げると、片手を無理に脚の間に入れてきた。「おや、極上だね」指で触り
381,？私も鬱病ですが同意見です。自分のことすらコントロールできないのに子育てなんて絶対無理だと思います。
382,て痛々しいです。無理してるんでしょうか？年なのに…。十八才女なーんも無理なんてしていない．むしろ十八才より奥深く幅広くいろいろできて楽しい．無理そう見えるのは，
383,はあくまで宮守であり、神の姿を見、声を聞くことが出来るわけではないので無理もありません。新しくお宮に座された神は姫神です。これから
384,が「書くこと」だったのです。制服が嫌い、九時―五時の生活は無理、団体行動は苦手、誰かの都合で動くのは駄目…。これでは
385,からもまだ結論は伺っておりません。まず内臓から治さなければ、手術は無理な状態！足のほうは、それが完治してから…とのこと。待つ
386,湿度の高い時は危険です。２急な暑さは要注意。暑さに慣れるまで無理をしないようにしましょう。３失った水と塩分を取り戻そう。こまめに
387,ねばならなかった．明治民法自体「伝統的家の理念を，私有財産に基づく法律にはめこもうとした無理」をもつものであったが，こうした法解釈上の矛盾を内包してまでも，
388,中学受験は、子供の資質にかなり負うところがあって、特殊なものですので、無理をさせないのがコツです。
389,五十五ステーションは、信用の買い売りは、出来ないのですか！？倒産銘柄は無理ですね。既に建ててる信用の返済オンリーです。つか、元々売りは出来ませんけど
390,たら凄い事になるのです。黒っぽい色なら少しは細く見えるかと試着しましたが無理でした。やっぱり、諦めるしかないのでしょうか？ぽっちゃりがデブになれるアイテムの一つですよ
391,＝成果指標を設定する。原則的には、１目標につき１指標に絞り込めるとよい。しかし、無理に絞り込むと戦略目標の趣旨が損なわれてしまう場合には、複数の指標を設定すること
392,にゆだねることといたしておりまするのは、運用の細部についてまで条例で定めることに無理があり、適切でないためでございます。人事委員会規則に係る事項は、関係職員団体の意見を
393,正捕手」を条件に強気にメジャー挑戦を表明したソフトバンクの城島健司。一方、「ＦＡまで無理」とポスティングでのメジャー移籍を全面否定された西武の松坂大輔。果たして、日本を代表する
394,。いや、自分ひとりでこの世界を変えられるなんて思ってやしない。ひとりでは無理だし、わたしでは無理だ。わたしのような人間が千人、いや、十万人
395,ってのは、まだ非常な冒険なんだぜ。まず信者は教師になることは無理だ。教師が信者になったら、辞表を書かされるだろうな。もちろん、党員も
396,「どうやって食べるの？」私は尋ねた。「ああ、君には無理だよ」Ｍｕｊｕはそのまま蕎麦を食べるのに集中している。「でもすごく知り
397,地元保安官事務所の鑑識の技官が、そのフィルムを現像して白黒のべた焼きにしていた。無理もないことではあったが、技官は証拠としての価値を認識していなかった
398,になりましたし、時期ってあると思います。私も自分の子には無理強いさせずに、勧めています。（プーさんに出てくるラビットが好きな人参
399,いけないような…姉にグチると…嫁に行きなさいと…この年では、無理！でも、物好きが、いるかも…って物好きしか、もらってくれないってこと？
400,は多いみたいですよ。先方には気の毒ですが事故はお互い様と考え、相手に無理な負担を要求しないのが賢明です。とは言え、貴方から先方へそんな事
401,笑い出したり声をかけてきたら走る。こういうふうにして、循環器系に無理な状態で運動していないかどうかコントロールしながら、できるだけ長く走りましょう」といっ
402,ところへ連れて行って、すっかり病菌が体中に回って、病み衰えている病人と、無理にでもキスさせるよ。たっぷりと、ヴィールスが伝染するように」すると青ざめて
403,期待していない、ミチヒコ、おぬしが間者の長になれ」「いや、ミチヒコは無理だ、地形を知らぬ、迷うばかりで間者の役目は果たせぬ、その点吾
404,額で行けるのならいいですが、がんばらなければという状況なら、期間を延ばして無理の無い額にした方が無難です。二十五年間もがんばり続けるのは大変でしょ、それ
405,それに、クィディッチ・ワールドカップを見にいくのだ。いまは、何かを心配しろというほうが無理だ―たとえ、ヴォルデモート卿のことだって。
406,よねぇ。これって、渋井さんにとっては準備可能な金額なんでしょうか」「そんな、無理ですよ。私に用意できるのはせいぜい三百万円くらいです」「噓です。二億は
407,あ〜…真面目に無理っすよ泣泣泣早く部活やめたい←もうやだ―――――．
408,梨乃がちょっと考えていると、れい子は、「デートなら、そういって。無理に誘わないから」と、笑いながらいった。「あら、そんなのないわ
409,自分にもっとも適した接着剤をどうやって選ぶかということですが，これは絶対無理だと言い切れるような数です．とにかくオールマイティな接着剤を目指すことが接着剤の開発方向として
410,ように…私、八十四歳女性事務員で御座います。どうぞ宜しくご指導ご鞭撻をお願い致します。それは無理と言うもので御座いましょう。汝、左の頬を打たれれば右の頬を差し出せ
411,ます。そしてまた挫折します。これをもう何度も繰り返しているのです。佳子さんは自分に無理をして規則的な生活をしても、それが新たな緊張を生み、その
412,、ちなみに政府はどう試算をされますかと。そうしたら、その試算に無理があるだろう、コスト計算にいろいろ矛盾があるんじゃないか、そういうチェックが全国各地から集まっ
413,に力を注ぎましょう。要は、そんな事を「ばかな政治家に求めても無理です。（すべての政治家の方がそうとうはおもいたくないのですがね・・・
414,見え、からだが自然にその中に入っていく。そして、酒場にゆく、そして無理に飲んでしまう。毎日だった。なぜなぜと思いながら、自分と戦っている。また
415,、水分をきちんととってできるだけ動くようにすれば標準に近づけると思います。無理をしないで食生活をみ直す（摂取量）ことですね。
416,実際のところかもしれません。また，中途半端に，解決を部下任せにしたり，自部署だけで無理に解決しようとしてはいけません。早期に社内のしかるべき部門に相談し，
417,でも、それは無理だ。リンがどんなに力を尽くしてくれても、ぜったいに無理だ。くちびるを嚙んだまま黙っていると、リンがため息をついた。そして
418,絶好のチャンスをものにするには毎日通うしかない。……無理だァ〜！ミルトニア・スペクタビリス（ラン科ミルトニア属）学名Ｍｉｌｔｏｎｉａｓｐｅｃｔａｂｉｌｉｓ
419,、いろいろなお店をめぐっての情報収集くらいかもしれませんが、地道に勉強するつもりです。無理だと思うことは、開店資金を準備すること。ただし自宅を改装すれば、不可能ではないか
420,が、最後に残った土盛り工事が影響を受けそうです。こんなことならやはり、少々無理をしてもお盆休み前に引き渡しをしてもらうように青木さんに頼めばよかったと思わなく
421,のツアー会社はありますか？ツアーによっては８日前というのもありますがそれでも無理ですね。正規でとるかチケット屋で株主優待券を買うかです。
422,自作パソコンでスーパーコンピュータ作れますか？無理でしょう・・・せいぜい、サーバーくらいししか出来ないと思うぞ。
423,残りは新しい映画のギャラをもらったら送ります。最低二カ月はかかるけど。それ以上は無理。これで満足するか、諦めるかしかないわ」クエンティンは値踏みするようにケイトを
424,九．四ダイヤ（現行七．四ダイヤ）を検討しはじめたが、これは技術的、経済的にみて、かなり無理があると思う。日本の大動脈はもはやパンク寸前である。東海道新幹線はその時点における最も
425,根気と時間のかかる説得（納得）になると思いますが諦めないで下さい。そして無理はしないで下さい。良き解決を心より応援致します。
426,でいます。ＸＰがフォーマット形式ＮＴＦＳに対して九十八はＦＡＴだから？ドライバーは入れました？どうしても無理な場合は、ＬＡＮ等でＰＣつないで、古いＰＣ経由で抜き取るしかないですね。
427,身なりの男などもいる。宿の主人の祈禱師は、あとからの一行を無理にもこの部屋に泊めたい気持で、頭を搔きながらまごまごしている。姫君の
428,八十ぐらいの感じの方がぱっと逃げたんです。いやなんだなと思って、無理に追いかけなかったら、あとでちょこちょことこっちにいらして「ごめんなさいね、ご協力できなくて
429,。なぜかというと、大阪というところは信用社会ですから、信用を獲得するために、無理をしてでも「ええかっこ」をする。日本も世界から信用されたい
430,に徹しようの意。花模様の和紙にうまく収まったが、わが子や教え子でないと無理かな。ちょっと変わった書体と書き方。ことばの意味に従って濃墨で力強く。
431,は休み。私も城ヶ倉ヒルクライムでも行きたいところですが、店を開けてしまったので無理かな。（＞＜）
432,たら、途中もうラウンド嫌になりましたからね。そいで摑まえるには全部決定打するの無理やからね。打ってるうちに捨てパンチになりますやんか。打ってその
433,付加価値をつけようと思っていたのは、わたしぐらいだったのかと思います。無理なことをしているのかも、と迷うこともありました。大兼久の集落で
434,の家庭の授業で男女平等って何回も言われます。でも、この世に男女平等なんて絶対無理だと思います。良い例が女性専用車両です。痴漢が嫌なのは分かりますが
435,が田中太郎さんだからです」夢子さんが悲鳴をあげた。「十八年ぶりだから、無理もありません。しかも、岡田先生はこのように髭もじゃですからね。十八年まえの太郎さんは
436,わかっても，返事ができない場合がある。自分の英語力ではその説明が無理だとか，何かの都合で答えてはいけないときは，下記の中から適切な
437,ＧＴ４の耐久レースはミノルタトヨタで全部勝てますか？無理です。ロードスター４時間耐久に出られませんから・・・。
438,を転職しているので人脈を作っておくことは大切です。未経験で最初から正社員は、無理に近いのでまずは、下っ端から始めたほうがいい＆決してお金になる仕事ではない
439,。とくに、後ろへ首を曲げるときは両手で首の後ろ側を支えながら行うと無理なくできるでしょう。●ストレッチ―４背筋をストレッチ１１両腕をクロスさせて手のひら
440,ＡＴＭや窓口から送金はできますか？手数料はいくらかかるのでしょうか？ＡＴＭでは無理ですが窓口でなら可能です。それは「電信払込み」で、窓口でしか払込めませ
441,合理化されてきたが、皇太子が国会開会式に出席し発言することにはこの説明の適用も無理であることはいえる。どうやらそれは皇太子時代の明仁天皇なりの思考もしくは信念が「昭和天皇の
442,もう殆ど無いので早い者勝ちです。予約が入ってますので、この２点は、もう無理かな〜。他でも良い石が沢山あるので、気軽に相談くださいね。頂いた
443,篭ったが、思いなおしたように、「これは三名の気が一致しなければ無理でございます、一人が矢を放ち、一人が石を放る場合も同じです」
444,は極楽に生まれ変わって仏になること＝苦しみから完全に救われる）、それが無理でも来世での幸せを願って、今生で徳行を積むことです。『後生
445,このシリ〜ズは、時間もかかりますし、何より、素材の数がなければ無理なので、もしかしたら、これで、最後になるかもしれませんが、心を込め
446,事は考えていません。この質問を読む限り、彼と友達になるのは無理だと思います。お互い好意を寄せ合っている既婚者同士が、これ以上進めば不倫に間違いなく進むと
447,ただしこの「シロ」については原文の読み方も色々でありうる。メシヤ預言と解するのは無理なように思われる。十一、十二節は黄金時代の神話的描写。八節は恐らく九―十二節を総括する
448,川開きの宵に神田方から両国橋にかかった。すでにこの設定が噺をおもしろくするための無理だ。反対の本所方から供を従えた旗本らしい武士が馬上豊かに橋上の大混雑に
449,「思い切って、明日からツアーを組みましょうや」「いや。今回はスケジュール的に無理なんだ。ダメならダメでいい。時間が許す限りケープ・バッファローを求めて走り回ってみよう」
450,なのだが、騙してやろうという気持ちに触れることがダメなのだ。まあ、慣れるまで無理をしないで、この国らしさを充分経験するしかないと思い、歩き始めた。４時間くらい
451,ＩＳキラ全部ＡＴＬＥが４枚ＬＥが十四枚カルチョのカズカード有りカルチョが３冊カズカード付札幌限定では無理だと思います。ネットオークションに出したら売れると思います。
452,、これはそのう…」「残念だったわね。このスケジュールは、生徒会長たちに無理を言って、わざと１日空けてもらったモノよ…私たちの活動を嗅ぎ回っている、スパイ
453,以下でもない。五十嵐はやはり気負っていたのだと思う。でも、それも無理はないよなぁ。あれだけ特殊な空間で、地元の期待と２番人気という責任を
454,胸まで水につかっているし、流れも速い。正興は「ふたり越し」というのも無理はないと思った。右側に海を眺めながら、また歩きつづける。大磯（神奈川県中郡大磯町
455,、ゴヤの生前の記録がしばしば「ヴィーナス」という名称を用いているのは、何とか無理をしてでもその口実を通用させようという意図があったからに違いない（生前のみならず
456,した形跡はありません。なぜ、話し合いをしなかったのでしょうか。同居が無理なら誰がいくら生活費を補助するとの合意を成立させ、その合意を文書にし
457,からできると信じれば、何だって実現できるし、できないと思えば、はじめから無理なのだ（フォード）●凧が一番高く上がるのは、風に向かっている時である
458,もう２年以上使ってる糞フトバン糞「コンピューターから離れられる？？」―今は無理だなぁ…超依存ｗ「殴り合いの喧嘩したことある？？」―あるよｗ「
459,Ⅱ理想の変化形図Ⅲ東家のリーチ３狂気のリーチにはヤミテンで無理な勝負は避ける俗に“やみくもリーチ”と呼ばれるリーチがある。たとえば、相手
460,いらっしゃいませんよねぇ〜笑まぁ〜たしかにかこりんの今のレベルじゃ無理！！！←自信ありますっ笑第十四回韓国語能力試験のポスターにウリ王子が
461,は「戻りたい気持ちはあるし、それに向かって頑張りたいとは思う。でも無理な場合は仕方ない」と心境に変化が出てきていた。チームは松井抜きの
462,。小型魚の場合１匹につき１リットルが目安です。エビも合わせて既に二十匹。もう無理です。ネオンテトラもすぐに大きくなります。
463,つながらないって怒ってた。アマのバイト先、俺の知り合いの店なんだよ。無理言ってあいつ雇ってもらったんだ」私はアマの事を何も知らない。
464,に飛びついている！ヘイスティングズだって、ポアロ、もうぼくに他のことを考えさせようったって無理だよ。まさか、きみだってあの欲の深い老人が心臓病で死んだと考え
465,とおもわれます。記入とは通帳記入のことでしょうか？もしそうでしたらこれも無理です。Ｑ：通帳がないのはなぜですか［質問一覧に戻る］
466,かということすら私のところへ言ってこられた方があります。それも無理はないと思うんですが、オーストラリアとか非常に核廃絶に対して熱心だった国も同じ
467,バカヤロー。狩野、そいつは誰が考えたっておまえが悪い。高円寺が怒るのも無理はねえ。早く謝るんだ。さあ、詫びろ」狩野はうなずき、「先輩、
468,なら全く異なる専攻からでも可能かと思います。また、文系から理系はほとんど無理ですが、逆は可能性ありでしょう。イギリスの大学院は、マスター（修士）の前段階
469,と認めるから、配給側が「作品ごとに基準が違うのはおかしい」と憤るのも無理はない。映倫は「不服があれば再審査請求もできる」と言うが、「公開
