,0
0,てよいわけではない。だが他方、言語社会にできあがっている規範が、構成員一人一人の個別的行動と無関係に存在するはずもない。では、日々のコミュニケーションに苦悩する一人一人の話し手が、コミュニケーション
1,、肝心かなめのことが必要な一割、二割の人と、そんな肝心かなめのことが全く無関係な八割を超える人と、こういう法的に差が、全然性質の違うものを
2,まっすぐ落下します。これは止まっているときとまったく同じ現象で，列車のスピードには無関係です。このような力学的な現象についての相対性原理はニュートン力学でもなりたっていました
3,整備されていなかったからだ。ベトナム人精神障害者の発生は、閉鎖的で排他的だった日本社会と無関係ではない、と石川神父は考えている。食事の時間は、村で最も楽しいひとときだ
4,十二／２（火）の夕方、仕事とは無関係に六本木ヒルズ森タワーに行来ました。目的は、東京タワーの五十歳記念ライトアップと六本木ヒルズのＸ’
5,。絶滅強制収容所の所員たちは、終業時間までは無感情で労働し、仕事が終わると、仕事と無関係な感情や情緒に没頭していた（ヘルダリーンさえ所員たちは読んでいた）。こういう
6,、いくら個人の財産でも周囲の物笑いのタネになったんじゃ会社としても無関係じゃないから。だから社長が援助しようと思う人物が出てくれば、取締役連中がそれを認める
7,生の躍動”の象徴でもある。アール・ヌーヴォーにおけるこうした象徴性は世紀末の象徴主義とも無関係ではないが，しかし，（ペラダンの薔薇十字会に代表される）秘密結社的，カトリック的，高踏的，貴族主義的
8,してねえぜ。そうかそうか、お前にきいたものだから、お前に無関係じゃないことを推察しているというわけだな」「あっしとしては、そう思うより他
9,たのであれば、彼にまつわる過去の思い出までもすべて捨て去ったに違いない。彼は無関係だと思いますよ、ともう一度繰り返して、柳原知子は男の名前―北野洋一と
10,ひどい目にあわせているんじゃ…」「まさか。姉さんを傷つけた奴らとは無関係だよ」「もしそうでも、心配だわ…」やがて到着した屋敷
11,で、以下に同意すること、というのがあります。Ｙａｈｏｏ！オークションで売っている商品とは無関係の商品のための広告掲載やリンクを行うことはいたしません。Ｙａｈｏｏ！オークションで売っ
12,−５）％（マイナス五乗オーダー）以下になると、多くの場合、鉱床とは無関係だという、詳細は『早稲田大学鉱山学研究報告』に載っている博士の「日本水銀鉱床の分布について」を
13,こととする。もちろんこれは客観空間図式における何メートル、何センチというような概念とは本来無関係である）。これは上図Ⅰ‐７では、ｂ強度の場合、線分ＭＮ、これを
14,ない。重なる山が、雪雲のあいだに見えているが、それも私とは全く無関係に、単なる山として冬らしく聳えているだけである。こういう時に、私はいよいよ入っ
15,業種・企業がＩＴを利用したビジネスを積極的に展開しています。本来、ＩＴ業界とは無関係な企業においても情報処理技術者の有する知識・技術が求められるようになってきているのです。資格取得後
16,・、・・・・・・・閃いたぁ！！そうだ口の大きさに無関係で、なおかつハサミを持った生物兵器ＮＯ．十三そう！！キミニキメタァー！！出動だぁー！
17,がやってるんだ、といってるのだ。となればピカソの言は伝統云々とは無関係である。しかもその仕事ぶりは伝統的墨絵の約束などまったく蹴とばした、傍若無人なやり方である。第一
18,、その一方でジュリーの身の安全も守ると決意したことだ。彼女はまったく無関係で、そんなものがあることも知らない薄汚れた小さな争いに巻きこまれただけに
19,危うさは伝わってこない」と述べている。満州事変は、日本政府の方針とは無関係に、日本陸軍の出先の部隊である関東軍がおこした戦争だった。政府と軍部中央は
20,。どこにつながりがあるんだ？」「おじさんは、ふたつの事件はたがいに無関係だと、ほんとうに信じてるの？まったくおなじ場所に二回も落雷があった
21,に取りました。が。免許代わりの合格証書がどこかにいってしまいました。ずっと無関係な仕事に就いていたので気にしていなかったのですが、突然心配になり
22,にし、恋愛において、情熱、性欲、セックスはそれほど重要視しない。年齢とは無関係だが、比較的年上のカップルに好まれるスタイル。プラグマ（Ｐｒａｇｕｍａ）：実利的な愛実益
23,したがって，精包の完成にともなう感覚情報は，コートシップソング発音の発現，つまり，タイマーの動作に無関係ということがわかった。はじめに述べたように，雄は他の雄に
24,はいるが、それらは後から説明用として引合いに出したものであり、本質的には無関係であると考える。論拠はきわめて単純なものである。それは童話「インドラの網
25,自由」が憲法によって保障されている以上、その具体的活動の結果が憲法の保障する個別的権利・自由と無関係といえるかどうかは疑問のように思われます。団体（法人）の性質
26,ない政策をとっていて、漂流記の類が流布しないようにしていたことと無関係ではない。清野謙次が所蔵する『蕃談』の表紙にも、「禁他見」と記されている
27,想定する。また、フリーキャッシュフローは本業から期待されるキャッシュフローであるため、会社ないし事業本業とは無関係な資産・負債や遊休資産（遊休土地やゴルフ会員権などで、本業で獲得しているキャッシュフローないし価値には
28,事実とは矛盾するのではないかという点です。つまり、一方では実質的な物理変化とは無関係だと言いながら、他方では新しいタイプのエネルギーをつくり出しているというのは矛盾しない
29,である。しかし、今話題の脳死や臓器移植の一例を取り出してみても、憲法と決して無関係ではない。憲法は、われわれの日常的な“生”と“死”の問題とも
30,を拝見し思わず顔が違う！！叫んでました。ところでスキーとは無関係の水泳の肩書きで今や超一流スキー指導員なんでしょうね全日本スキー連盟事務局の平野さまにもご相談しきちんと区別の
31,の似非自由恋愛論はとうに瓦解していた。それは無政府主義革命理論とも、純粋な恋愛とも無関係な、身勝手な男の単なる好色にすぎず、自分が利用されていただけであった事実
32,た。私どもは棄民と呼んでおります。したがいまして、厳密には年齢とは無関係な概念なのであります。ただ老齢はあるていどの肉体的衰弱をもたらし、恢復不能であるという
33,たら商売ができるという仕組みでございますから、建築がどうのこうのということと無関係な形で法律ができているわけでございますので、この間の体系を変えるという
34,も発達している。このことは、夫婦の骨組みを揺るがす無秩序な恋愛の多さとも無関係ではない。したがって、身体を解放する二つの要素（感情との距離と私生活の基礎である
35,なことに、私たちの中には、どんなに目を背けても、イジメと無関係になれない悲しい人間の性があります。イジメというとすぐ学校を連想しがち
36,五年後に学生一人ひとりの成績表をひもとくと、学校の成績と会社での成績はまったく無関係なことが、年とともに明らかになり、わが社の採用法が間違っていなかっ
37,対象となりうる（団藤四百六十二頁，大塚六十九頁，福田百七十頁）。他方，告知の相手方と無関係の人間に向けられた害悪であれば，これを予告することが，ただちに一般人の意思決定
38,の容疑で逮捕された▼しかしそれはそれ、これはこれ、オウムとは無関係の事件だから本稿は切り離して考える。それとは弁護士の「犯罪」、これ
39,でつぐなえると思ったその人の考え方、とくに、ペットとしての生きものの実益とは無関係な性格に気づかない無神経さだった。でもこれはたぶん無神経というより、単純に
40,、それを真っ白な白紙にいったん戻してみせた。人間の愚かな営みとは無関係に生き続ける誇り高く純粋な海の姿がそこにあった。母なる海には
41,、清算の必要はなく、新組合設立につき、重複施行を制限した法第百二十八条は本件と無関係、旧組合の同意は不必要だ、ということである。控訴人（原告）の主張は
42,大移動させたのは船井電機です。パーツまで徹底的に現地生産に切り替えて、円高とほとんど無関係の体制をつくったのも船井電機です。それに比べると松下電器などは真っ先にマレーシア
43,ている。それを喜ぶ人も苦々しく思う人もいるだろうが、そういうこととは無関係に、もはや地域の食の一角を占める「煎炸〓」である。でも、いや、だから
44,第三の社告における「私の監督不行届き」と書く意識が互いに照応しており、両者が無関係に現われた表現ではないように私には思われる。それらは近代的な言論機関
45,メカニズムが再発見されるだろう。そしてこのことは、考察されるレベルの絶対的な高さとは無関係である。２しかし、右に提示した解釈は、いわば均衡の外的な様相に
46,被害時に動揺したかどうかは、被害後に相談等をしたかどうかとは無関係のことがらであろう。（２）‐十最も不快な・傷ついた被害の被害種別・開始時期・加害者の
47,企画して行った事業であり、同業者同士の領地の取り合いであって、武士以外の人々には無関係なものであった。この事情が一変したのは、明治国家になって徴兵制度ができ
48,あつかうのもむずかしい。女性の「あら、いやだ」という表現なら、敬語とは無関係に考えることもできるだろうが、同じく女性が「おサイフ」や「おドンブリ」などの
49,ただし、建設会社やプラント会社の場合には、工事進行基準と言って、工事代金の回収とは無関係に、工事の進行状況に合わせて売上高を計上する会計方法を採用している例もある。長期
50,ならぬように思います。いまの振興計画は高速道路や新幹線など患者の救済とは無関係な産業基盤造成にかたよりすぎています。もっと患者を中心とした居住環境の改善や内発的な
51,。しかし、真のキリスト者であるならば、自分たちの置かれている場所で、神と無関係の場所などあるべきでない。主は、常に私たちとともにいたもうお方
52,Ｍｅｄｉｃｉｎｅ（ＥＢＭ）の考えが要求されていますが、わが国ではｅｖｉｄｅｎｃｅとは無関係に、風習として患者の入浴を禁止することがよくあります。開放創や抜糸前の
53,フランス人と決まったからは、イギリス人特有の筆跡で英語の詩を書いたなんて事実は無関係だ。「クラパムにある学校に行ったのかもしれん」声に向かっ
54,ていた。このためには南に解放戦線を組織し、しばらくの間はイデオロギーと無関係の民族主義者とも手を結ぶといった方針をとっている。しかも、労働党としては「南の
55,原因であることも要しない」とされる．もっとも，この見解によっても，業務と無関係な休憩時間中の私用外出，私的けんかなど，業務関連性を奪う特段の事由があれば業務外とさ
56,そうした人為的努力の結果として他国の併合に成功するならば、侵略・併合は天とは無関係なまま、人為としてそれなりに自己完結してしまう。とすれば、墨家が侵略・併合を罪悪と
57,、見知らぬ町で過ごした四年間の、子供心の印象というものは、現実とは無関係に、その時代の心の持ちかたが影響しているのかもしれない。太陽が出ていた
58,ないといいました。それはロケット内で観測されるあらゆる物理現象がロケットのスピードとは無関係だからです。このようにすべての慣性系では物理法則が同じになっています。
59,国民から“圧倒的に支持されていない”福田総理ですが、国民の意思などとは無関係に日本国の最高権力者であると共に、政策の方針や実行に関してリーダーシップをとり続ける権力のあること
60,あったら教えてください。刺されている場所が、洋服で覆われているかどうかに無関係なら蚊ではないと思います。皮膚の固い部分より、柔らかい部分や、下着のゴム部分
61,降りたい、払いきれない」との事。連帯人は以前の仕事先の方で今は無関係だそうです。このまま連絡がつかず、強制退去も念頭に入れての本人所有の
62,私の人材採用、人材育成の原点となるものだからです。学校と会社の成績は無関係「大声試験」「早飯試験」といった、成績を度外視した採用試験を行なってきましたが
63,幅は、費用構造に依存します。この費用構造は、売上高の増減に比例する変動費と、無関係の固定費に分けることが可能です。つまり、損益計算書において企業の安全性の分析をする
64,朝の４時から５時にかけての明かりの変化は我々のこころの内とは無関係に美しいものだ。その微妙な変化に気づくことが出来れば決して負け犬なんかじゃない。
65,株数の増減に関する株式の併合・分割に関する規定が増えてきたが，これらは計算とは無関係であるので，株式の節に移すのが適当である。❖３第２に，
66,が工程に到着してから完成するまでの統計的な平均値と考え，オーダーの数量とは無関係に一定とみなす場合が多い．十製造リードタイムの短縮特急オーダーや遅れている作業オーダーを
67,の乗数が減税より公共投資の方が高いという理屈を用いようとも、国民のニーズに無関係な土木工事を固定的な省庁別シェアに従って続ける限り、後には国に膨大な不良資産
68,せんじ詰めるところ、いくつかの世代の生み出した価値観や、また彼らが引き受けた課題と無関係ではなかったし、それどころか、もしかすると、その種の「課題」を
69,ものであり、また広域対策は応急、復旧対策に限定される（したがって、一次被害そのものとは無関係）ものであることから、地域や地区対策を基本に推進した上で、二次災害等被害の拡大防止
70,いう城郭関連遺構の中に尾根道や耕作地、それにやぐらに伴う平場など、城郭とは無関係のものも混じっている可能性が指摘されている［岡二千一］。あるいは北条氏と三浦氏
71,」の立場は、「百％の中立性などあり得ない」と断わりながらもホモフォビアとは無関係な中立的な位置に限りなく近いと表明しているものだ。けれどそれは実はとても特権的な
72,」のための例外的な扱いにとどまり、他の子どもが履修している教育課程と、まるで無関係であるかのように位置づけられるのであれば、今後、通常学校においては、子どもの多様な
73,のような知識をいくらたくさん持っていても、「頭がいい」とはまったく無関係である。もちろん最小限の知識は必要である。しかし、もっと大事なことは、そのこと
74,趙匡胤が高官として迎えようとする話であって、その内容は水滸伝の筋書きとは全く無関係であるが、この正名のほうは水滸伝のこの話を彷彿させている。陳摶は五代宋初
75,”をおそれずに書いたというのは、江戸後期の文化の爛熟への自信と無関係ではないと思います。キーン日本人の中国に対する感情は、長いこと崇拝みたいなもの
76,に向けてのいろんなプロセスについて、その答申どおり進んでいるかどうかについてこれはもう全然無関係、無関心でいいわけですか。何の発言権もないんですか。○政府委員（棚橋泰君
77,か、俺にはさっぱり見えないというか…」「見えんでよろしい。無関係の部外者の分際で、口を挟むなたわけ」一刀両断に切り捨てる篁である。
78,同じ）」を証明したり、ピサの斜塔で、モノの重さと落ちる速度とは無関係であることを証明する実験をしたことでも知られていますね。また彼
79,入れて冠動脈をふくらませたりするのは、たかだか慣習の否定であり、倫理とは無関係だろう。それが生殖医療になると人間の根源にかかわってくるので、ことさら目立ってくるだけ
80,は異なるし、それらを混同すると馬鹿げた誤りを犯すことになるが、夢と現実は無関係に存在しているのではない。夢が発展してゆくことは、その人間の心の発展が生じ
81,意味があり、歌詞の意味、解釈が確立していなくても国民の権利義務には無関係であり、したがって確立する論理必然性はないと思いますが、いかがでしょうか。○政府委員（大森政輔君
82,たどっている。例えば、最近教育の場で問題になっているいじめも、これと無関係ではない。いじめは、どんどん陰湿化し、自殺者が出るケースすらある。いじめの事件をみ
83,の敵は聖職者であったという。革命期の妻帯僧についても、その一部は非キリスト教化運動と無関係の妻帯であったことが指摘されている。Ｊ＝Ｌ・フランドラン、蔵持不三也、野池恵子訳『農民の愛と
84,自己負担率α＊との関係は明らかである。つまり、右辺は医療サービス需要の自己負担率に関する弾力性εとは無関係であるのに対して、左辺は図１‐２のように弾力性が増すに従いα＝
85,まだわからない。そういうこと自体も、こんにちまで明治が連綿として続いてきていることと無関係だとは思いません。新聞には、間組本社で追悼式をやったということが
86,で喚問を受けた人の数は延べ八百三十四人に上つた。極東軍事裁判の開廷準備とは無関係であることをあらかじめ確約し、専ら事実の追跡だけを目ざして、証言者には「Ａｄｍｉｒａｌ
87,章覚醒』は、現在、松竹ビデオ事業室よりＤＶＤ＆ビデオリリース中。というわけで、学園とは無関係なれど本作も必見！力さんとトモロヲさんはほとんどアドリブです（山口）面白いと思え
88,はドミノの特徴であること。中国では古くからドミノが盛んで―たぶんヨーロッパと無関係に独自の発達をしたのだろうが―特別な賭博の方法も創造されているから
89,をしていたのに、どういうものか、私はお水取りとは無縁であり、無関係であった。お水取りの正しい名は東大寺二月堂の修二会（旧暦二月におこなわれる法要）
90,と思います。絵にすれば、また無機物であれば、それは血や肉と無関係になりますから平気でいられるわけです」亀山巌が先日、手紙の中に書い
91,、栄養補給、抗生物質の調査の結果、これらの治療が患者、家族の意思とは無関係に行われているとし、実施要領の作成が必要だとしている。日本で
92,「…以上のような経緯で、結局妹さんの失踪は、矢切悦子殺しと小森勝一殺しとは無関係と断定されました。妹さんはべつの事情あるいは原因から姿を晦ましたと推定さ
93,、科学的な合理性があると思われるのですが、個人にとっての意義はそれとは無関係のこととなりがちです。だからといって、数量的記述や表現を否定するわけにはいか
94,なっているのが本筋だろうと思うんです。それにしても、今まで西洋音楽にはまったく無関係のようにみえた人物がヴァイオリンをつくりだしたときには、ただただ呆れるばかりでした
95,速を求めて…）←無関係技はこんな感じ。（多分、大丈夫だろう…３匹共通の技ザオリク・ベホマズン・しっぷう突き後はそれぞれ微妙に
96,アポクリファ》のラストを飾るクライマックスだった。が、それは北朝鮮の意思とは無関係のところで成立、進行していた計画であって、テイワたちに計画の編纂を命じた
97,の日本の国民性はそんなに卑下したものではない。政治がどうあろうと、それに無関係なごとく、次第に国民自身が自己の生活の正しい方向を自覚し、黙々たる間に
98,色調が非常に濃い神社を建てた気持の底には、案外、仏とは無関係な神社を作りたいといふ、神仏分離的心情が作用してゐたかもしれない）。ところが円山公園のしだれ桜
99,ないような四隅突出方墳が出現し、越中にまで拡がる。この新しい墳墓祭祀と青銅器祭祀の消滅は無関係ではあるまい。首長権力の強化が青銅器祭祀を必要としなくなったのである。
100,から考えられたものでもない。しかし、臨床の知を提唱する以上、生命倫理と無関係ではいられないことは当然であり、したがって、ここ数年来、臨床の知の観点
101,の子供・・・何かの大会の度に奉加帳が回ってきます。全く無関係の私でさえ明徳には過去１万円は払ってます。ＯＢや現役学生の親、
102,神の指紋を探すようなことをしないで、暗殺は神の意志とは無関係であり、私たちに敵対する行為だったように神にも敵対する行為であったと認めて
103,ニックは葉巻に火をつけながら、これからは葉巻を大事にしなければならないと無関係なことを思った。その朝、最後の箱を開けてしまったのだ。彼は
104,四分の一世紀（二十五年間）に準備すべき「資本主義第三世代」へのプログラムを作成したという情報と無関係ではない。資本主義第一世代とは、マルクスが資本論を書いた頃の英国で見られ
105,たということは、日本人の“お上に任せる”という体制べったりの国民性と、全く無関係ではないと私はみている。日本人の国家権力を監視するチェック＆バランス意識の低さ、市民や消費者として
106,ているんだ。本気でね。幹部の三村が、死んだのに、早々と、無関係の声明を出したのも、そのためだと、おれは、睨んでいるんだよ
107,ばかりの貧乏な移民でも、ハンバーガーやジーンズには手が届く。社会階層にも無関係です。それで、このようなアメリカ文化が生まれたのではないかと思います。２エンターテインメント
108,犯行は、ロバートさんとキャサリンさんが結婚するということで関係があるが、ミイラの盗難は無関係ですね」「ところが、やはりあるのだ。ロバート君は家柄からも多くの役職に
109,。その認識も、それ自身一つの生の情熱である限り、生とも生の関心や利害とも決して無関係ではない。それゆえ、もろもろの情熱から、そしてもろもろの“根本的誤謬”から、いかにして
