,0
329,なれば簡単な話だ。美鎖の危機と、姉原邸に泥棒が入ったことが無関係であるはずはない。どちらもほとんどゼロといってもいい確率でしか起こり得ないことである。
330,れても別にどうということもないけれども、私がしないのは、そんなこととは無関係な一つの或る確信によるのである。私は多分、それをこんな風に考え
331,のではないのでしょうか。ただし細かくいうと、だいぶ違いますが。フェチは生殖に無関係な事物に性的嗜好が結びついたもので、少しは高等な精神作用と言えます。ＳＭ
332,、バビロニアの緯度であてはまるもので、伝わった数値をそのままインドの実情とは無関係に導入していたことがわかる。紀元五百五十年ごろヴァラーハミヒラがまとめた『パンチャシッダーンティカー』（五天文学書綱要
333,と、故意・過失・規約違反による傷や汚れなどは、原状回復費用負担が生じます。礼金・敷金が何ヶ月かは無関係です。敷金は、何か特約がなければ、要するに保証金です（法律の規定は
334,をとられているが、その自治体から恩恵を受けていない。住民の意志とは無関係に、存在するだけでも不快な利権者のために、大金が勝手放題使われてきた
335,可能性が高い。北朝鮮は千九百九十九年の日本海での不審船事件の時も、北朝鮮とは無関係で、事件は日本側のでっち上げと非難した。海上保安庁などでは船舶の形など
336,よ」「一緒にするなと云った筈だ」「一緒です！無関係の訳がない！」「勿論無関係ではない。しかし例えば十五年前の事件を解明すること
337,安易に他者を攻撃したり、命を粗末に扱う人間が増えてきたことが、無関係ではないことを示しているのではないだろうか。（２）さらに、アンケートの結果
338,気づいてはいた。景の記憶がニューロンフォンによってすりかえられたことも、それと無関係ではないと思っていた。だがその一端を今、結城が口にしていることが
339,の要素を持った品位風格が感じられたものであった。それは装幀とも無関係ではなかったとは言え、内容に拠る新鮮さであった。「絵のように」
340,行ったことと無関係ではないということを、私は教えられて帰ってきた。無関係でないどころか、この世での思い方、考え方、生き方が、死んでから帰ってゆく
341,不正であって、もともといたのが不正だとかどうとかという数字とは無関係です。そうすると、不正な在留資格を取得するのがいるということで、いろいろ入管
342,武士的ないし儒教的女性観にもとづく面をもっていた（深谷千九百九十）が、近代的なジェンダー規範と無関係であったわけではない（牟田千九百九十六：百十八）。まず、「子を育てる母」、「家庭内存在
343,なでおろしているのかい？いいえ野口さんは昨年の世界陸上で内定もらっていたので高橋さんとは無関係ですよ。。それに今回は３人とも入賞（マラソン初）だから結果オーライだけどね。
344,安定および増悪の３型に分けられる。安静狭心症は労作など明らかな心筋酸素需要の増加とは無関係に起こる胸痛発作が特徴であり，その成因には一過性の冠動脈の機能的な閉塞（冠スパスム
345,組長の寺本が、指示したのなら、三村とミユキを殺したことに、彼が無関係とは、考えにくい。寺本が、直接、手を下さないまでも、承知してい
346,食べさせない。そういう愛情が選べる人になるということが、人格ということと無関係でないと思います。話が少し皆さん方にとっては将来のことになってしまったかも
347,に足を踏み入れるくだりがあったが・よいこのわたしたちとこの悪徳の園とは無関係…でもないか。十・『謎まで三マイル』（ハヤカワミステリ文庫）この最初の
348,ものである。なお本論文の執筆は筆者自身の意志によるものであって、教団とは一切無関係であることをお断りしておく。当然ながら筆者は同教団による犯罪を肯定するものではない。むしろ犯罪
349,クーリッジ大統領も、当然大きな責任を負うことになる。そして、肝心な選挙の年において、全く無関係である議員をも含めて共和党全体が被害を被り、大敗北を喫することは一目瞭然であった
350,した点は、「日本語学」が千九百三十年代後半以降にあらたな意味をもって登場してくることと無関係ではないだろう。十四「国文学史」の整序を千九百三十年代におこなった国文学者久松潜一については、安田敏朗
351,を終えた参加者の顔は大満足の笑顔に満ち溢れていた。アリストとサーキット、一見無関係のように思われがちだが、オーナーとして一度は自分のアリストでサーキットも走ってみたい
352,、前述したように、ヤオ族に対する幼児の主たる供給源がアカ族とラフ族であることと、無関係ではあるまい。この地域のヤオ族が人為的な人口抑制をおこなっているかどうかは
353,をおす行為、つまりその殺人行為は、通常の意味の殺人行為のあらゆる情景や心理と無関係であり得るにちがいない。犯人は犯人らしくなく、殺人は殺人らしくなく、犯行の自覚はきわめて不明瞭
354,していないことを知らなかったのだ。美代子や新吉は、清作の世界とは無関係な事柄のなかに巻き込まれていたからである。６君子は、いままで彼女
355,なければならない。十一月の申の日を祭日とする神社が多いのは、この伝承的心意現象と無関係ではないと思われる。たとえば猿を神使とする日吉山王の祭日は、四月・十一月
356,とどんなに思いこもうと、事実を記述するということ自体、こうした申請をめぐる法と決して無関係ではありえないのである。研究者という位置など無前提的に存在し得ない。（８）植民地主義
357,や、空気をすすることも、関西あたりのおやじがやるものであって、自分とは無関係だと決めつけてしまいたい。大人だって負けてはいない。若者のしゃべり方、
358,せといて、「そりゃあないだろう」って感じですよね。ちなみに、スティーブン・キングとは無関係ですが「サイン」もそうでしたな・・・。まあでも、キングの
359,もその流れに位置づけることができるかもしれません。実はこうした二十世紀初頭のモダニズム絵画と、モダニズム写真はけっして無関係ではありません。スティーグリッツらモダニズム写真が、彼らと親しかったというだけではなく、スティーグリッツらも
360,がジャック・イル・ダーク役を務めた映画、『デトロイト・メタル・シティ』がこの８月二十三日から一般公開を迎えることと無関係じゃないことも、改めて説明するまでもないだろう。なにしろ『地獄烈伝』の発売日は映画公開日の
361,そうしたものを獲得できるかどうかは、アメリカ社会では黒人の能力とはほとんど無関係だと彼らが感じているからだ。歴史的にみても、黒人はたとえ能力が
362,理由のない不安感に苛まれ、幻覚、幻聴、錯覚、妄想に駆られて、無関係な他人に対し攻撃行動に出る。隣人が突然、凶器に変身する。千九百八十二年（昭和五十七
363,のなかで生きているのだ。このことは、恐らく日本という風土、その自然環境と無関係ではあるまい。日本では―場所によって多少は異なるが―一年のうちで
364,がある。一般に高速道路を遠距離利用するものにとっては朗報であるが、高速道路未利用者には無関係だ。対選挙対策だとか単なる人気取りのばら撒きといわれているが、一時的にも
365,Ａのいうことが正しい。Ｃのいうようにアイスバーンはバーンと略されるが、無関係である。アントレプレナーＡ◆「肉料理を載せた皿のことじゃな。フランス料理は久しく
366,になんらかの関わりを持っていた。それは染谷がなぎさと呼びかけたことと無関係ではあるまい。つまり、茜はなぎさであり、結婚前、いや、もしかすると
367,覚醒剤を使用したという疑いは百パーセントないが、白い粉がここにある以上、全く無関係だとは断言できない。警察は俊也の死を事故だと断定した。しかし
368,精神科外来における患者数は年々増加傾向にある。それらは現代社会で私たちを取り巻く心理的ストレス環境の増加と無関係ではない。ここでとりあげる代表的な心の病気は、精神科医が日常診療でよく遭遇するもので
369,今、私の心はとても急いでいます。」参照ｈｔｔｐ：／／ｂｌｏｇｓ．ｙａｈｏｏ．ｃｏ．ｊｐ／ｙｕｋｉｔｔｉ０００／３８４０８２５４．ｈｔｍｌって話していた事とも無関係じゃないんじゃないかって思います。ｈｔｔｐ：／／ｊｐ．ｙｏｕｔｕｂｅ．ｃｏｍ／ｗａｔｃｈ？ｖ＝ｅＬａｊＬａＣＪＴｐＡ＆ｆｅａｔｕｒｅ＝ｒｅｌａｔｅｄ
370,半の目にしろ、出た目の事実と、お前がそう考えたこととは無関係だ」「お言葉を返すようですが、親分、手前の判断を信用できねえと
371,から、需要側に影響を与えることを目的とするマクロ政策は、潜在ＧＤＰ、潜在成長率とは無関係なのである。こうした「マクロ政策の限界」を正しくわきまえておくことは、マクロ安定化それ自身
372,とも解しうる。また、（予想される通り）拓銀取引関係の有無は九十七年時点の利払率水準とは無関係である。言うまでもないが、より注目すべきは利払率の変化である。表右側の２欄で
373,と感じるのは、自分の文明圏で起きた出来事だけである。それ以外の出来事とは無関係であり、したがって文明論とは別の原理に基づく介入（人道的介入など）が何らかの
374,自己嫌悪を抱くことさえある。そんなはずはない、世間の嫁姑問題など自分には無関係だと思っていたのに、そんな低俗で平凡なことにこの私が巻き込まれる
375,の水準に引き下げ、購買力平価と円レートの調整を行なうこと。この二つは一見全く無関係のことのように見えるが、わが国の経済活動に固有の硬直化した習慣や慣習
376,からである。そのため、８番とのＴラインは、４番の方向性とは意外と無関係なのである。８番と強くキスしたときは長クッションに入り、その後フットクッションの「キスゾーン
377,自律していく、いわゆる近代絵画が始まった。ところで、写真の登場は決してマネの絵画と無関係ではない。ジョナサン・クレーリーが指摘するように、そこには、古典的光学から生理学的プロセスに基づく視覚モデルへの
378,するのでは、という予感に襲われる。雲の上に出てしまえば、天候など無関係。だから、上がるときはひたすら地球の本能に逆らって、とにかく上がっていけば憂鬱
379,星野さんは思うのです。確かに繰り返されていくのです，人間の悲しみや喜びとは無関係に。自然の秩序とは，だからこそ私たちの心をなぐさめてくれるのかもしれません。
380,自分の意思でしたことだった。だからって、こんな…。意思とは無関係に口中に肉棒を突きこまれ、秘孔に見立てたように抽送されて、紀香の
381,が、矢寿志には面白くなかったらしい。「うちの妻は、そんなことに無関係ですよ」そう言って、向こうから電話を切ってしまった―。２クラブ・ハイビスカス
382,十日には大成建設とつづいていく。のちに、いわゆる過激派の犯行と判明するが、まったく無関係の人までまきこむタイプの犯罪は、やりきれないの一言につきるものであった。じぶん
383,ともいえる。アクショーノフを巻き込んだ「スパイ事件」も、こうした時代の動きと無関係ではなかったのだろう。第二次大戦後、約四十年間続いてきた冷戦の時代も、千九百八十九年十二月に
384,です。インターネット上にはさまざまな情報が公開されており、その中には業務とは無関係な情報も多数含まれています。また、メンテナンスの不備によってワームなどに感染した
385,れたも同然であった。武蔵でなくても、武蔵に身形が酷似した全く無関係の剣客でさえ、この被害に遭って野宿を余儀なくされたほどである。
386,は、政治的な意思を括弧に入れて、敵の指定が政治的な決断とは無関係であるかのように振る舞うことにほかならない。ハンチントンもこの点については十分意識的であり、世論
387,領土であるし、メソジストの信徒がいるところ、そこはもうひとりのアメリカ皇帝（アメリカ政府は無関係）の領土である。そして、正教会の信徒がいるところ、そこはスウェード人を祖と
388,はならない働きをしているらしいのだ（それに対して、女性ホルモンのエストロゲンはオーガズムには無関係のようだ）。それを示すデータを紹介しよう。女はエストロゲンを作る器官である
389,のハイテクが不可欠になってきているという問題にしても、こうした新しい世界情勢のトレンドと無関係ではないと思います。相互依存が軍事の面にまで顕われ、米ソ日という不思議なバランスの
390,（興亜式）もモダニズムも当時の政治‐社会的状況と関わっていた。統制がない以上ファシズムと無関係だというのでなく、むしろともに関連していると見るべきなのだ。興味深いことに、新生満州国
391,たから聞きますが。あなたはどう思いますか。政治カテを利用しない方には無関係でしたでしょうが。・・・・＊＋．．．．．．．：：
392,（スターリン，ヒットラー，毛沢東）を例にして，カリスマ性はリーダーの有効性とは無関係であり，むしろリーダーシップの本質はリーダーシップを仕事であると見ることを強調している。確かに
393,よりも不快感と訴える場合が多く、胸痛の部位や方向は心筋の障害部位とは無関係です。典型的な狭心痛は身体活動によって誘発され、三十分以上は続かず、安静にし
394,を失っても、もう恐くないんだ。親父を殺し、妹を殺し、そしてまったく無関係の人間を殺したワルを、どうしても許せないんだよ。そのワルとおまえは、
395,詐欺を理由にＸが取り消しうるが（九十六条１項），これはＸＢ間の保証契約とは無関係であると解されている。ただし，ＸＢ間の保証契約におけるＸの動機の錯誤として，動機
396,のを知っていますか？別説で、ただ空気が入っただけで病気とは無関係とも聞きます。一体どちらが正しいのですか？空気が入るとなるらしいとは
397,頭脳線は直接関係がないように思われがちですが、当事者の頭の中身が恋愛に無関係であるはずがなく、よい頭脳線であるにこしたことはありません。手相学で
398,を嚙んだ。桐生の蒸発は、相隣同志会の内部に最近発生した一連の異変と無関係ではないことを、桐生自身が裏づけた形であった。ほぼ時を同じくして
399,とくに白亜塔〔ＷｈｉｔｅＴｏｗｅｒ〕が、そこに幽閉された王侯貴族たちにまつわる伝説とは無関係に（以下のことは伝説によって満足に説明のつくことではない）、その近隣に
400,」な抵触法しか観念できないという所に力点がある。）。例えば，米国とまったく無関係の日本での行為を対象として米国特許権に基づく主張をしたとして
401,´）を考える．（Ｘ，ｄ）と（Ｙ，ｄ´）は，全く無関係な距離空間であるという設定から，話ははじまる．ＸからＹへの写像φが与え
402,、この論文の終り近くで、『仏教大辞彙』を引いて、円観の略伝と立川流と無関係の旨が述べられている。（二百二十三頁以降）。◆２立川流（たちかわりゅう）―醍醐三宝院勝覚
403,その到達前に表意都死亡しまたは能力を失っても，発信後の死亡や能力喪失は意思表示と無関係な事実であるから，当該意思表示の効力は妨げられないからである。（２）契約
404,特定の言語が拡張し、他の言語が縮小する理由が、言語そのものとは無関係であることを強調しておくことは重要である。言語を拡張するのは人間なのである。初期
405,。（二十二）ドイツ競争制限禁止法二十三ａ条一項二号は、規模の大きな企業結合に関して市場構造や市場シェアと無関係に支配的地位の推定を行う規定を置いている。この規定は一般集中の防止と類似の
406,低く，更新に時間がかかる欠点がある．一方，ロボット型は実際の目的とは無関係の情報がヒットしやすく，また内容の検索認識箇所がエンジンによって異なるため，複数のサーチエンジンによる検索
407,の合意（生前契約）によるところが、遺言による遺贈（贈与を受ける側の意思に無関係）との違いです。口約束でも効力はありますが、文書に残しておくほう
408,ないものの、高齢化による担い手交代にともなう技術伝承が不十分であること、兼業化の進展による自然条件と無関係でのスケジュールに沿った農作業の実行、圃場見回りや水管理の不足等が指摘されており、
409,行う者です（第２条第１項第９号）。（放送法による免許等を得ているかどうかは無関係）３保護を受ける放送（第９条）ア日本国民である放送事業者の放送イ国内
410,対応出来なかったようで・・・ｏｒｚまぁ、それと昨日，更新しなかったのは無関係ですが。お察しの通り、戦国ランスに没頭するあまりの結果で＾＾；とりあえず、アリスソフトの地域制圧ゲー
411,が始まります。街は否が応でもクリスマスモードが盛り上がり、世の中の景気とは無関係に賑わいます。どうせならそんな流れに乗って楽しんだ方がいいですね！当社
412,と思いますけれど」「そんなの知るか。ともかく穂は、そんなのとは無関係なんだよ」「理屈になってませんわ」「理屈なんて関係な
413,公正な価額で新株を発行しなければならない。既存株主に対する新株発行であっても，株主の持株比率と無関係になされる場合は同じである。株主以外の者に対して有利な価額で新株が発行される
414,いったって何の件なのやら全くわかりはしなかったわけだが）には無関係な人たちなのかも見定めがたく、しかもちょっと気をそらしていた隙にそのわずかな
415,を抜いた。仲間を殺すわけがないのだから、あの無頼漢は首謀者どころか、無関係の乱闘に巻きこまれた、ある種の被害者ということになる。やはり、問題は
416,容易には変えない」。それに「様々の横合の論を生じて掛け合う（無関係な問題を持ち出して要求する）」。そこで自分としては、「彼らが内心
417,なくなった婦人、等々。ヒステリーは仮病とは異なり、本人の意志とは無関係に症状があらわれるので、より原始的な防衛反応といえる。ヒステリーの治療はこうした
418,で文章でアピールができるでしょうか？教えてください。倉庫の仕事なんて、特に見た目は無関係です。うちは自営業でリサイクルショップを運営しておりますが、店先に立ってもらう子は、
419,ライムライト）のお気楽なブログ」へようこそ！まったりして行ってくださいな＾＾記事に無関係なコメント、トラックバックはご遠慮ください。無関係なコメント、トラックバック、儲け話のブログ、明らかにアダルト系
420,店舗を開設しなければならない。というのは，もし店舗が開設されないのであれば，社会協同パレスと無関係な中間商人が店を開き，すべての利潤を取得してしまうからである。しかるに，現に
421,レジ係の女性はすぐに売り場の主任を呼び出し、その間、自分はトラブルとは無関係だという態度を示します。このように現場の能力は必ずしも高くはないのですが
422,変革の時だ」と訴えた。記者会見した代表によると、メンバーは党派とは無関係に危機感を共有しており、大半は前回の大統領選でブッシュ大統領を支持したという。ブッシュ大統領
423,５）景気循環と失業（構造的・摩擦的失業と景気循環）構造的・摩擦的失業も景気循環とは無関係ではない。すなわち、労働力需給が引き締まっている労働力不足の時期には、労働力供給が不足している層に対する
424,」新聞か何かに出ていたような気もするが、自分とは無関係な財界人のことだったので関心は薄く、はっきりとは思い出せない。しかし「そんな
425,地」（五節）である。人々は、しばしば自己の置かれている場所を神と無関係の場所と考える。しかし、真のキリスト者であるならば、自分たちの置かれている場所
426,ただ問題が…。前回は青空を待って行ったのですが、今回は空なんて無関係…この写真で切り取った一部の空だけが辛うじて青空っぽかったのですが、基本的に曇り空
427,もわたる実り少ない会議を重ねたが、その進展を阻んだのは、いろいろと無関係な、扱いにくい事柄を議論することにこだわったロシアだった。議題はといえば、
428,」といわれることがあります。手のひらを握ることは、脳や自律神経（意志とは無関係に体の機能を調節する神経）などに刺激を与え、血液の循環を促進し、
429,条件を満たさなければ、Ｙの核が残ることはほとんどなく、Ｙのアと無関係に‐○’○○○に統一される傾向が非常に強い。例：アカムラサキ（赤紫）
430,、それは、高度経済成長のグラフと重なり、家庭の経済的潤いによる教育過熱といわれる状態と無関係ではない。また、幼児期から、知的教育を志向し、それを強引に押し進める知性偏重の育児態度
431,定まる。抵当権設定後の建物の存在や登記の存在は、抵当権に対する対抗力の存否とは無関係である。建物が滅失、或は登記が抹消されても、買受人に対する借地権の対抗力は
432,明らかになった。何百万人の失業労働者とその家族が，自分自身の個人的な活動とは無関係な要因によって生じた経済的災厄のために，過酷な財政問題を被った。さらに，この
433,捧げる意味で働いているだけであり、惑星の裏側にいるリゲル人たちと同じくこの会合とまったく無関係な人々なのだった。サムズは爆発する色彩の氾濫に目をふさぎ、圧倒的な
434,たということにはなりません。そうしないかぎり表層の自己の意志とは無関係に、深層にひそむ煩悩の種子がひょこっと芽をふいて、せっかくとらえた牛
435,高瀬は打ち明けた。「ほう、まったく知りませんでした。うちの会社は無関係です。手形割引で五十億とか百億とかになると、うちの会社では手
