,0
221,壁に掛かった先々代当主・義一の肖像画を見つめる。「ルビーさんの来日は契約とは無関係です。それに、春江さんも、わが鳳凰家に嫁いできて一年。いつまでも
222,示しており，０ポイントが両者の中間に位置するのに対して，ｉｎｖｏｌｖｅｍｅｎｔは行動の方向性とは無関係に調査対象者（回答者）がその所与の対象にどの程度の関わり合いをもっているかという
223,、世界は意味を必要としないのだから。世界は、私たちの意識とは無関係に、初めから存在していた。私たちは、いま意識を持っているから、世界を
224,。ルター派の信徒がいるところ、そこはスカンジナビア皇帝（スウェーデン、ノルウェー、デンマーク王室、政府は無関係）の領土である。バプティストの信徒がいるところ、そこはアメリカ皇帝（アメリカ政府は無関係）
225,た。この会議は建築と哲学の対話と呼ばれています。そんなラベルとは無関係ですが、私は毎回何がしかの建築的提案を、浅田彰はそのテーマについての理論的な
226,。１飛び出す電子のエネルギーを測ってみると、それは照射する光の強さには無関係である。２照射する光の強さを大きくすると、飛び出す電子の個数が多くなる
227,妨げるとはいえない。依存をしてしまう心理そのものは、チャットの存在とは無関係にあるのだから。リアリティを放棄しながらチャット「現代社会はコミュニティが欠落している。それ
228,５〜６分で百羽を鑑別できるそうです。食肉用の鶏であるブロイラーは、オス、メスは無関係ですが、採卵用の鶏であるレイヤーにとっては、この雌雄鑑別は大変重要で欠かせない作業
229,ＵＫＵＳＡ同盟傘下の諜報機関群から毎日二十件ほどの諜報報告書が送られてくるのだが、ニュージーランドとは無関係な内容であると一見してわかるようなものばかりだ。たとえば八十五年にオークランド停泊中の核実験抗議船
230,金額下がった分手数料は頂き済みです。貴女の慰謝料が高いのと夫が悪いのは無関係のことです。
231,、抗菌というのはあたかも清潔さを保持する技術結果である。しかし清潔さは、抗菌する結果とは無関係である。むしろ、抗菌仕様という確信犯的な商品づくりのいやらしさは、奇麗事として私の奇麗美学には
232,読んでいるかもしれない金賢姫さん、ごめんなさい）。そのときわたしは、あたかも自分とは無関係の、遠い世界でのことを話すように、金賢姫の裏切りを、口をきわめて
233,あきらかに「有料」でかせいでいたからである。資本主義経済の中の紙幣流通というものと無関係には、「寺院」そのものが、存在できない。そこに、矛盾もあり苦しみ
234,女性にＤＳＳが発生していたら、ヘンだと思いながらも、自分の意思とは無関係にどんどん引っ張られていくので、その恋を受け入れざるを得なくなってしまいます。そんな恋ばかりし
235,のナワバリなのだ。西オギをヨナヨナめぐる分化人ナワバリといっても怖い方面とは無関係。もっと穏やかなの。マエバリ？いやそういう関係の映画館もあるけど、
236,連絡がつかず、事実関係の確認が取れない。指摘が事実なら、会社とは無関係の個人的なことだ。会社として購入した九十九年の井上議長のパーティー券は十二万円（６枚）
237,高く放り投げた。ボールは重く響く音を立ててレーンの手前の床に落ち、無関係の客のレーンまで転がっていった。みんなが押し黙ったままそそくさとそれぞれのレーンに
238,のスーパーマーケットで働いていることだろう。ああよかった、本当によかった。スピロは無関係だった。そのことに対して、満典は何物かに感謝したくなった。あの、いつ
239,が来る。そんな馬鹿なことがあってたまるものか。私はたまたま居合わせた無関係の旅人に過ぎない。逃げる必要なんてない。冷静に事情を話せば、すべてがあっさり氷解する
240,出入りしていたことがわかってからだね」「ええ、そうです。いまは無関係かも知れませんが、前教授時代の人間が出入りしただけであれほど神経質になる
241,つまり一方が増加するとき他方も増加する傾向にあるのか，あるいは減少するのか，あるいは無関係なのかを調べることができますが，これを相関といいます。そして，一方
242,。でも、単語を指差すだけの『旅の指差し会話帳』ならば、発音のよしあしも無関係！現地の人ともすぐ仲よくなれそう。「旅の指差し会話帳シリーズ」１冊千二百円〜千八百円
243,がわかったわよ。依頼内容も思い出した。たしかに、津田たちの今度の仕事に無関係じゃなくなるわけか」「もうすでに手は回してある。準備は着々と進行中さ
244,プレゼンス＝持続可能性」に改革の本質があるのだと取り合えず信じよう。民主党の能力は無関係である。全ては自由民主党の失敗と改革の過程。これから起こるであろう（欲しい）政権交代
245,系列）のあいだの照合の偶然性が強調されなければならない。それぞれの系列がもともと互いに無関係であればこそ、たまたまかろうじてそこに達成されたその照合が浮き彫りになるのである。
246,ば、果物に含まれるペクチンなどは繊維とみなしていいので、果物も繊維と無関係ではありません。しかし、果物から繊維をすべてとろうとすると、果糖の
247,心拍数と血圧は仰臥位時，座位，起立時において測定する必要があり，体位には無関係に突然発症する洞性頻拍が存在すれば，洞結節リエントリー性頻拍の可能性が示唆され，心臓電気生理学的検査が必要となる
248,ずに付け加えられるに至ったことである。この二つの交通網は、互いに非常に無関係であっても、それぞれ都市交通の公共サービスに関する同一の政治的見解を示している。地方団体と私企業
249,インターネット上のニュースグループやメーリングリストやＷｅｂ上のディスカッションが権力によって取り締まられコントロールされるという問題とは無関係であろう。これまでインターネットのセールスポイントであった混沌はもう明らかに通用しなくなっている。
250,識別する能力を持っているが，その能力を発揮して無関係な帰結をせっせと挙げつらっては無関係なもののリストに入れ続けている最中にバッテリーもろとも爆破されてしまう．ここでのフレーム問題は，
251,？誰かジャニーズのＨＰやブログ携帯から読む方法教えてｍ（＿＿）ｍ写真は記事には無関係だよ〜昨夜は２時すぎに寝ました。おはよ〜起きたら７時☆早起きして
252,大切なのは仕事能力ということだ。一人前になったプロにとって、年齢と仕事能力は無関係のはずである。ところで七十代、八十代の顧問や相談役がいつまでも会社の経営
253,入っているジャケットのデザインは、決して、私たちの体験の中では、音楽とは無関係なものでありえない。さらに、こうした外装に加えて、買った場所、
254,ふうに考えられるんじゃないですか。全くそういうことは無関係だと言うのですか。無関係であるならば、こういうふうな九つの小区域に分けたということは全く違った
255,の合意で交換的分割もできます。（両親の意見については、どう考えようが、全く無関係です。）なお、祭祀主催者として墳墓等を承継しても、ほったらかしにしたって、これまた
256,？ちなみにベルばらファンですが、ベルばらのオスカルさまとは関係ないんですよね？ベルバラとは無関係だと思います。水商売御用達のコンビニです。中央区三ッ寺筋。
257,。「まあまあ、自分の言ってることはわかっております。それは今回の事件と無関係な―ちっぽけで重要とはいえないものかもしれません。でも、実際に関係があるのです
258,。フォードとＧＭは航空機産業のパイオニアだった。しかし今日の航空機メーカーは、自動車メーカーとは無関係のベンチャーから発展した。同じように今日の大手医薬品メーカーの大部分は、五十年前に近代医薬が
259,にいないから・・・・・・・今の引きこもりの大半は知恵袋とは無関係です。２ちゃんねるとは多少関係あるかもしれないけどね。
260,ない。そして、宝くじが当たっている以上、どうやら発見者の安本氏は、殺人とは無関係のようだ。となると、普段から本格ミステリーに毒されている諸君の頭には
261,たに相違ない。そう感じたとき小浪は思わず身震いを覚えた。身分に無関係に古代エジプト人は等しく、すでにミイラそのものを広く、むしろ当然のこととして受け入れていた
262,て「作詩」された五言詩（巻十二、近体詩十六首）中の「所」と、この両者を無関係とし、「偶然の一致」と見なすならば、それこそ粗雑の鑑賞、後世
263,２つの特性値の間で，一方が大きくなっても，他の動きとは無関係な場合，これを相関がないと言う（図十五．２（ｃ）参照）
264,潰した後、静岡で盗んできた車のトランクに入れ、自分たちとは極力無関係な場所に放置することにした。加藤が直感したとおり、死体の身元がわかれば
265,人間の意識を超越した存在であるから。つまり良心は、本来、自我の意識と無関係に、あるいはそれに反しても作用する「たましい」の内界の多様な自立的要因の一つ
266,直撃したところ、「僕もそういう話を聞いたことがあるけれど、僕はまったくの無関係です。共産党なんて関心ないよ」と言下に否定した。むろん、共産党側は「
267,はまだわからないが、植物の世話もコミュニケイションの一種だとすれば、長年のキャリアと無関係ではないだろう。芝生に水を遺るだけでも、たしかに植物がどんなに敏感に
268,ロムルスに対して、表出関係の極度に薄い三重のメタ・シニフィアンとなっているわけだが、これだけ無関係になると、かえって、シニフィアンは、原初的シニフィエのイメージを喚起する力を蘇らせるらしい。
269,が、他ならぬ社会主義の総本山ソビエトで起こったのも、決して近代主義としてのマルクス主義と無関係ではないのである。近代主義としてのマルクス主義の欠陥については、地球環境破壊ということが今後の人類最大
270,おたずねしているのですが」「ま、裁判風にいいますと、その質問は本件とは無関係により却下させていただきます、というやつですな」「…」めずらしく里見がため息を
271,マウンテンバイクって肩こりに良いですか？逆に良くないですか？それとも無関係？？？自転車ってのは全身運動に一番良いんだよ。関節への衝撃が少ない
272,の考えによれば、情欲は自身の個体のなかのみにあつて、他人からはまつたく無関係であり、あらゆる行動において他人に奉仕したり、快楽を分つことは意味のないことで
273,が出てくるものなのである。アメリカでは法令を施行する部門が商務省などとはまったく無関係の独立した組織になっていて、常に規制する側にまわる。しかるに日本で
274,（青山先生は大栄町出身との事）。そもそも地域振興券もらうには資格があって私は無関係だったし、大栄町に縁もゆかりもなかったのですが、当時レプリカが発行される
275,ε‐δ論法のもととなる不等式による連続性のいい表わしが，このような不等号とは全然無関係な形でいい表わされてしまったことに，注意を払うべきであろう．集合概念の
276,だが、俺個人ではない」という、奇妙な免罪符を与える。チーマーどうしの喧嘩や、無関係な通行人を対象におこなわれる「狩り」が、ときにとり返しのつかない結果を
277,肺炎、肝機能障害、慢性胃腸障害…」に保険がきくのに対し、品質の差などとは無関係に、後発メーカー品は「胃炎、胃腸虚弱、疲労感…」など六症状にしかきかず、慢性肝炎患者
278,にマーク側が訴訟を起こして発売中止にさせたが、彼は自分の意向と無関係に編集盤が作られることに相当神経を尖らせていたようだ。そして公式に登場し
279,踏みしめていくのだ。わたしにはどうすることもできなかった。わたし自身の意思とは無関係のところで、右足が、左足が、暴走していくのだった。右へ曲がり、
280,の二十三％に比べ投票意欲は高い。このことは，今回投票率が大幅に上がったことと無関係ではないだろう（図３）。図１投票意欲（投票に「必ず行く」＋「
281,ても，相手の話したことばをイントネーションもそっくりまねしたおうむ返しだったり，意味に無関係に語や句を繰り返したり，決まった語句やコマーシャルを繰り返すひとりごとを話したり，
282,た意味で考えなければならなくなった。異国の叫びは、自国の叫びで、それは無関係だとうそぶいているわけにはいかなくなった。義務でそうしなければならないのではなく、
283,やオーストラリアの等面積の区域の植物と比較してみるなら、物理的条件の差異とはまったく無関係ななにかがこれほど大きい数のちがいを生じさせていることを、みとめざるを
284,れるトイプ−さん（（゜Д゜ｌｌ））３…とりゃあ〜４…ちまき。アタシは無関係です。５…セ−ルでゲットしたレギュラーペットシ−ツ二百枚九百九十九円！今まで見た
285,を結びつけるものは存在しないとはいえ、双方の機能や役割をふまえれば、両者をまったく無関係ということはできないかもしれない。むしろ、テロ対策といった最近の治安対策の方向性は、軍と
286,が細胞間隙等から吸収される可能性も否定はできず，糖の種類によっては腸内細菌とは無関係の生理機能を発揮するケースもないとはいえない．１．６．３フェノールカルボン酸類フラボノイドをはじめと
287,。戦前・戦中に教育を受けた人がほかのアジアにたいして優越感をもっていることと無関係ではありません。この時期の人類学・民族学なども侵略のための調査をおこなった
288,としているという傾向も否定できないですね。夫婦ともども年をとってきているのと無関係じゃないでしょう。で、水戸黄門のような勧善懲悪の世界には、たどり着くんでしょうか。もし
289,なく、彼自身でも現実の相手と自分の夢のなかの「恋人」とは無関係だと気付いて、相手から遠ざかるのが常だった。現に、あの大柄の美人学生
290,やエステ、美容整形の広告である。このような人体の改造は、肉体が精神と無関係に勝手にひとり歩きをはじめたということで、ひとことでいうなら肉体の記号化、象徴化
291,２月十一日建国記念打法。建国には無関係ですが、水曜日なので１クレで買取。１試合目。軽くトップですが、黄ネギは
292,れるのも、息長帯姫を天照大神の荒魂、また「日ノ妻」とみる民間信仰と無関係ではないだろう。香椎宮の「廟」号のことでだいぶ道草を食いました。橿日宮での
293,「ｒｕｎｓ」に変わってしまい、今にも走り出そうとしている馬のイメージとは全く無関係に、いきなり自分が走っている像が浮かんで「ｒｕｎｓ」と声に出します。
294,暑さや湿気の急激な変化に体がついていけず、自律神経（意志とは無関係に作用する神経で、消化器・血管系・内分泌腺などの不随意器官の機能を促進または抑制し調節するもの）の働き
295,」とは長年にわたってたまったたんぱく質などのカスからなっており、毎日の排便とは無関係にたまっていく、いわば煙突の内壁にたまったすすみたいなものである。自覚症状と
296,があるからだ。こちらの方は、十五歳くらいのとき、個人の好みとは無関係に受験儀式のため、無理矢理どちらかの種族に分類されてしまう。そして、よほど勇気が
297,ている。それも、幼稚園、ホームセンター、スポーツクラブの運営など、マツモトキヨシの本業とはまったく無関係な新規事業ばかりだ。松本がいう。「新規事業はすべて手作り。幼稚園のときも
298,先生が発表した敷き写し絵の写真を調べてみたんだが、ますます確信を持った。無関係の人間があれを元にして贋物を作るってことは容易なことじゃないぜ
299,は社会の徒花にすぎない」という、フリーターをハナから意味のないもの、自分とは無関係のものとして見るよそよそしい視線である。最も典型的な例は、いわゆる「最近の若者
300,と破壊のための軍事的な訓練は、難民救助にとっては不向きでしかない。軍隊とは無関係な特別緊急対処グループが必要とされるのである。日本が改組された国連安保理事会の常任理事国になっ
301,名誉か命か」という選択ではなく、全く別のもの、彼女たちの命には全く無関係な選択である。彼女たちが突きつけられているのは、彼女たちの〈大義〉、彼女たち自身を
302,によれば，千五百八十三年，十九才のガリレイは，ピサの大聖堂のシャンデリアが，振幅の大きさに無関係に同じ周期でゆれ動くことを見出したという．千六百三十八年に出版された著書「新科学対話
303,―その他には、どんな発がん原因がありますか。「エストロゲンとは全く無関係に起こる、遺伝子の異常が考えられます。疫学的には高血圧、糖尿病、それに
304,「政策」と「課題」の結びつきは弱いが，そうかといって，まったく無関係というわけでもないことを意味している。角度を変えていえば，政策はどの
305,，自らの行為の帰結を予測する能力に加えて，目下の状況に関係する情報と無関係な情報とを識別する能力を持っているが，その能力を発揮して無関係な帰結を
306,（アプリケーション開発者など。あとはＪａｖａＳｃｒｉｐｔなどを使用したホームページを作る人など）にはほとんど無関係な言葉です。自分で作ったものでなく、どこかのサイト（ホームページ）を見
307,であり人生観なのです。しかし多くの人は、これらの結果は自分とは無関係に起きるものと考えています。そう考えるのも無理はありませんが、そう
308,受けたのは体制派諸教派の信徒であり、それらの教派の大学や元信者もこの動きと無関係ではなかった。また千七百九十五年以降信仰復興運動が高揚すると、ヴォルテールやトマス・ペインが説教者の身代わりとして非難され
309,出生した者であるところ，わずか５歳の頃実父母の別離のため本人の意思とは無関係に韓国へ渡らざるをえなかったこと，本邦への不法入国の動機も父と２人で遍歴
310,そして、正教会の信徒がいるところ、そこはスウェード人を祖とするロシア皇帝（ロシア政府は無関係）の領土である。民主主義思想を信じる人々がいるところ、そこはアメリカの皇帝の領土
311,の「本質に迫る」という気づきから得た、自分なりの仕事上の法則を、まったく無関係に思えた趣味の世界に当てはめる、ということもできる。趣味で始めたゴルフ
312,弱いからでしょうか？上記のような人生を棒に振った人と自分とは無関係考えているのかな？酒を飲むと以下の点でダメです。＜口が
313,ないし二百九十三条ノ３ノ６の４ヵ条が追加された。株式併合も会社の計算とは無関係であるが，株式分割と表裏の関係にあるところからここにおかれたわけである。
314,きました。…これって別に私が贈りたいから送っただけでオークションとは無関係だからお断りしてもいいのですよね？でもお断りしたら評価を下げられそうでなんか怖いです
315,激化させたのは誰の目にも明らかだったので、「不良債権問題は景気問題と無関係」などという見方は吹き飛んでしまった。その結果、不良債権問題をタブー視する空気も薄まった。
316,を保障したものです」という答弁を引き出していますので、「知る権利」とまったく無関係というわけでもありません。政府はとにかく「知る権利」を入れたくなかっ
317,実験＆観察４）。（五十七）周期は糸の長さだけで決まり，振幅に無関係である。これを，振り子の等時性という。↑図四十一単振り子の復元力重力ｍｇの
318,金銭請求については，第１段階において法例十一条１項によるとしているから，仮に米国と無関係ならこの段階で既に米国法は選択されない。しかしそれでも，米国での結果発生が主張さ
319,‐五十商業目的や広告目的での利用‐三十わいせつな内容、無関係なリンク‐二十
320,ていた時もあった。率直にいうが、戦後日本の形成とソ連社会主義体制は無関係ではない。資本側と労働階級の間には激しい対立があったからこそ、今、絶頂期
321,これは、世界に比べて日本の低用量ピルの認可が何十年と遅れたことと無関係ではないのでしょう。アメリカに比べて認可されるのに実に四十年も遅れました。ピル
322,与頭として、不逞浪人の取り締まりに当たったことも、この会津藩の出身だということと無関係とはいいきれない。守護職たる会津松平家と、見廻組の関係は微妙なものがあっ
323,オートポイエーシス・システムは絶えず産出を行いネットワークを保つことによって，観察者との相互作用とは無関係に同一性を保持する。３境界の自己決定オートポイエーシス・システムは自己産出のプロセスのなかで自ら
324,。しかし、会計改革の前提にもルールの国際標準化という流れがあるわけですから、あながち無関係ともいえません。▼性急すぎる国際化いまさらいうまでもなく、日本企業の業績はきわめてひどい
325,でわかってないみたいなのに全くわからないであろうまわりに聞くのも謎。そして無関係な人と一緒に攻撃してくるのも謎。友達が全く詳細がわからないみたい
326,カツが、生涯を通じて「不幸な妻」であったことは、この婚姻届のはなはだしい遅延と無関係とは思えない。啄木が育つ頃、一禎は渋民村の宝徳寺の住職であった
327,とるのは、外交経験を持たない整形外科医の新会長ロゲだ。「五輪ボイコットは、政治に無関係な選手を苦しめただけだった」。総会最後のスピーチで、サマランチはスポーツの独立性
328,をみせてくれる、記念すべき珍しい品か、尊重すべき家宝としての愛蔵品か、お金に無関係な特殊のお道具によって、胸のすくような面白い組立ができているに違いないと想像して
