,0
110,、司直に捕らえられ、あるいはその前に自害する。そうして、家督欲しさに兄を殺し、無関係な人々までを殺してまわった稀代の大悪党が現れるというわけです」
111,。どのようなことが原因でしょうか？朝だけですか？歯磨きの時とは無関係ですか？吐き気がする時は、胃が悪い時、肝臓など胃以外の臓器が
112,厭なものを喚起されそうになり、それを防ぐべく、自分はこの谷間に無関係な他人だ、とおまじないをとなえた。たとえ自分がそこにいかなる意味をも見出さ
113,な表現など避けないといけなくなるのが嫌だと、逆に会社とは無関係の友達を選んだり。。時期的なものもあって，今は本気になれそう
114,関係もないと言って、猫の引き取りを拒否したそうであるが、黒崎がまったく無関係の人間を緊急連絡先に指定するはずがない。すると、連絡先は黒崎に指定された
115,の海で溺死したのは、その直前に、風摩の庄に行ったことと無関係ではないはずだった。「松次郎が海に行った晩に、わたしが
116,ない痴漢被害をデッチ上げ、その人の人生を平気でブッ壊す女と一緒ですな。無関係の人間を貶め、その人の人生を破壊したり、貴女の友達と思っていた
117,をかけることになる。―吉田さんの主張は二点ですね、第一には好況・不況とは無関係に、長期的な観点から、分配の是正が行なわれないままに税負担を上げるの
118,がジュースに致死量の毒をいれた。その後，ＢがＡの行為と無関係に同じジュースに致死量の毒を入れた。Ｃがこれを飲んで死亡した
119,一般管理費）を、売上高の変動に比例して増減する「変動費」と売上高の変動とは無関係に発生する一定の「固定費用」に分けると、「営業利益＝売上高−（変動費＋固定費
120,をしっかり指導しなければならない。筆順がでたらめだと、学習力がつかない。文字はことばと無関係では意味がない。この点をのがしては大人になって修正がきかない
121,涅槃となり、涅槃は生死と断絶した別の存在となるから、現在世とは無関係な事柄となってしまう。言い換えれば、生老病死という苦悩がそのまま実体的に考えられ、
122,では十四〜十六％と安定した成績を残している．体外受精の治療成績は夫の年齢とは無関係だが，妻の年齢とは明らかな相関が見られ（表Ⅱ‐５）
123,日常会話を観察する意義はあったと言えるだろう。日本語の音声コミュニケーションは、日本語の文法と無関係か？但し断っておくと、この本で取り上げてきたしゃべり方がすべて、実験室的な
124,かこつけて、わしを責めておるのだ」という。自分は孔子の出魯とは無関係であり、女の口車に乗せられて生命を狙ったなどとは言い掛かりだといい
125,犠牲の羊として帝国軍に引きわたすなど論外であったし、ひとたび彼を逃がした後、無関係を決めこむこともできなかった。証拠もなく噂だけで事態が動くとは思わ
126,手段のために認められるものだからです。したがって、労働条件や待遇の維持改善に無関係な目的で行われたり、団体交渉を有利な方向に妥結させるのに必要な程度
127,底知れぬ広がりがある。彼女たちは権力や財力や、ましてや腕力などとは無関係なところで、相手を包容し、守り抜いていく。女の意識は、日々に進化する
128,たと思う。だが、どうしてそれが起こったのだろうか。多分、個我自立・近代的個の確立と無関係ではないと思う。人類は、この期間を費やし、中世より近代にかけて出来上がっ
129,棒状構造を持っていることがわかった。つまり、棒状構造の有無は活動銀河中心核の有無とは無関係であることがわかる。棒状構造がガス補給に決定的な役割を果たしているとは思えない。
130,使えないとのことで、わざわざＤＶＤ−ＲＷで作成したもの。ところが、そんなところとは無関係のところで作動しない原因があったようである。拡張子にも問題がある通常、
131,こんどは東京大田区の高級住宅街・田園調布で、ひとりの少年の誘拐事件が起こった。一見するとまったく無関係に思われるふたつの事件だったが、両者は三十二年前、北陸の能登島に建つ、
132,必ずすべての生命に訪れる。自分もその例外ではない。それぞれ生命は他の生命と無関係で生きることはできない。家畜とは人間の手によって生かされ、人間の手
133,，自分がどのような「自分である」かを証明するためには，自分が自分自身と無関係な姿勢であってはならない。自分は，しっかりと自分とかかわり向き合わなければならない。他者の目
134,動物その他の物を利用する場合に於ては，これを目的とする排撃手段は無関係な第三者を害することになるが，さればといって，これを単純に緊急避難の場合として
135,私は、再開発事業主体のうち、地方公共団体以外の公団あるいは公社は地方公共団体の意向を無視してあるいは無関係に、独自にこの再開発に乗り出すべきじゃないという考え方を持っております。したがって、
136,損益計算書において企業の安全性の分析をするにあたって対象になるのは、売上高と無関係に発生する固定費にあります。この固定費の存在が企業の安全性にどのような違い
137,にヒットするように小細工している業者も多く、カテゴリーを絞っても、承知の上で無関係な商品を出品していますから、時間の無駄を省くためにも、カテゴリーを絞り込むの
138,とは何の関係もないことである。新聞界の「リクルート汚染」のせい？まったく無関係なことを理由に挙げて「賞は出せない」と決めたということは、
139,関係する情報と無関係な情報とを識別する能力を持っているが，その能力を発揮して無関係な帰結をせっせと挙げつらっては無関係なもののリストに入れ続けている最中にバッテリーもろとも爆破され
140,な効果を与えることが強調されました。しかし、実際に必要な労働時間とは無関係に大幅に短い時間を「みなし労働時間」とするため、みせかけの時短とは裏腹に
141,、疲労、ふさぎ、いらいら、更年期障害などなど女性の三十余種類の病気や症状は環境ホルモンと無関係ではないとしている。また、女児の初潮年齢が時代とともに早くなっているのも
142,の席上で協力するかしないかは、その人の教養とか社会的地位とは全く無関係であることを肝に銘じておくこと。遺産分割協議の席は、誰かが議長役を
143,先祖代々から伝わる「家の宗教」と考える風潮が強くなり、自分自身の信仰とは無関係であると思っている人も少なくないのも事実です。また、お寺もこの檀家制度に
144,メールヘッダーは返信先が「ｍｅｄｉｎｆｏ＠ａｎｅｔ．ｎｅ．ｊｐ」とＡｎｅｔのものとなっているが、Ａｎｅｔとは全く無関係。同社はこうしたウイルスメールが送られていることをインターネット上で公開し注意を呼びかけている
145,、ターナーやマネ、印象派の画家たちが登場してくることは決して、写真装置の発明と無関係ではありません。何かそこでは、視覚制度において、古典主義時代との決定的な
146,なのだと思います。そこで培った健康や、張り合いは、■■さんの現在と無関係ではないはずです。私自身は今のところ何十年続けられるようなものに出会っ
147,を優先して，広く解すべきである。受任していない事項にかかる秘密，紛争問題とは無関係と思われる秘密，職務外の私的関係を通じて知り得た秘密であっても，依頼者が開示する場合
148,ないうちは、堅は対象物に発現せずに隠れている。もし白が物とは無関係に、もともとそれ自身で白なのでないとすれば、どうして白が石や物を白く
149,たではないか。「はは、まあいいです。夏江さんのばあいはもちろん、騒擾罪とは無関係です」「つまり附和随行者というわけですの？」「法律的にはそうなります」「
150,一途をたどった。もともと鉱山事業主には、所有奴隷数に基づく一種の人頭税（産出高とは無関係）が課されていたが、５分の１税へと移行した。しかも、今度は、鉱山事業主
151,思ったかも知れない。「やっぱり、姉さんがこの屋敷を訪れたのは、事件と無関係じゃない」門を出てしばらくして、サンはやっと口をきいた。
152,という概念はインドではじめて発見されたということですが、それは、この暑さと無関係ではないと思われます。まさに、この暑さから逃れてゼロになりたいという感じです
153,にいた友達に突っ込んだわけよ；そしたらその友達も後ろによろけ…無関係な男子高校生にぶつかってしまったのですよ；ちなみにもう一人の友達爆笑してるだけ、あげく「ま
154,かもしれないと思ったのです。けれども予備審問で判事は、マリファナの所有は本件とは無関係であり、証拠として提示することはできないと裁定していました。それでもジョッシュは法廷で
155,彼はふいに口をつぐんだ。目のまえにいる二人が、騒ぎに無関係ということがわかったのだった。しかし、一瞬の小休止ののち、彼はいっそう興奮し
156,の発生）。ところがこの販売活動に供される労働力に対する賃金は，売掛債権の回収時期とは無関係に，やはり現金で支払われるでしょう。このように，資金の回収と支払に時間的
157,企画、準備され、編集についても何らの相談、報告を受けておらず、党と無関係にマルクス主義の雑誌を勝手に発行することは自由主義、分散主義の産物であることはもちろん、
158,とか）は、ぜんぜん受賞してないのも年齢査証のせいかもね。年齢は無関係のどうでもいい賞は沢山とってるけどね。
159,適切ではないのでとらわれ無くて良い．体の発達に伴う自然の欲求はそれとは無関係です．
160,たソニア・ドローネーや、メゾン・キュビストの装飾を通してサロンにデビューしたマリー・ローランサンといった女性芸術家の活動と無関係な出来事ではなかったはずである。とりわけソニア・ドローネーの活動は、二十世紀の近代主義的な美術史の中
161,彼らを迎えた言葉だった。「どのみちあたしたちは定めある命ですから」（「無関係なことをいいおる！」バルバスがつぶやいた）「ぜんぶ貸してしまって残りは一部屋きり
162,まで、生まれた子供が成人に達するまでに死亡する比率は、生活水準とはある程度無関係にかなり高かったから、おそらく一組の夫婦が平均七―八人、あるいはそれ以上の子供を産ま
163,」［ＭＳＰゴシック］または［ＭＳＵＩゴシック］にしてみてください。「テキスト形式フォント」は今回無関係と思いますが［ＭＳゴシック］なら無難です。
164,です。からくりなどありませんよ。ちなみに私は普通の一般人です。公団とは無関係です。
165,に表示される＊ｓｃｒａｔｃｈ＊バッファやミニバッファなどです。これらのバッファはファイルとは無関係に存在します。＊Ｍｅｓｓａｇｅｓ＊バッファというバッファもあり、このバッファにはミニバッファに表示された
166,岩波書店、千九百九十六年。初出は千九百七十五年）。前掲吉村書は宅地について、日本の律令制国家は租税収取に無関係な土地の班給には無関心であったという。現実は別として律令法上はそのとおり
167,の立場とは無関係であり、同様に「受取人」や「発送人」などという立場も無関係です。ただし、実際の補償金の支払いは約款通りの手続きを要求されるのではなく、個々の
168,を折る文士は少なくなかった。もちろん世渡りの上手下手はあったから、文才とは無関係に羽振りの良い者もいた。菊池は先ず足元を固めた。それから、自分
169,「憩いのひととき」は珍しい窓と、その前に止められた自転車。まったく無関係のようであって、ないと寂しい。お互いが見つめ合っているようです。「春」
170,は行為者が夫れに依って利益を得る意思があろうと無かろうと、そういうこととは無関係な無色な証券上の行為であります。夫れ夫れが全部絶対的商行為になる訳で、之と営利
171,は、その人間の心の発展が生じたことを示しており、それが外界と無関係に進むことはあり得ない。このあたりの数年間は、明恵としては女性との交わり
172,と教皇権の対立を軸に生まれたもので，全体教会の構成単位としての司教区意識とは無関係である。このことは，司教区巡礼という形態がフランス以外の国では決して中心的・特権的なもの
173,ベンガルをきらってのことであった。第一次世界大戦が勃発すると、インド人の意志とは無関係にイギリスへの協力が要請され、戦時支出の財政的負担とインド人兵士の出兵が背負わされた
174,は、「伏屋に生ふる」という賤しさ、すなわち「中の品」という身分と無関係ではありえない。同じことが蜻蛉巻の場合にもいえると思う。薫の歌
175,な屈辱の印である。多くのテロリストが中流階級出身であるからという理由で物質的苦痛とテロは無関係だとするコメンテーターは、次の点を見落としている。それは、自分の属する集団
176,はコンピューターの画面に釘づけだった。五分。ヒットはまだ二件だ。どちらも無関係の項目だった。ラングドンは不安になりはじめた。パメラ・ゲタムは隣の部屋で
177,に驚かされる。刑法犯の認知件数が、戦後最高となった（平成十二年）ことと無関係ではない。船橋警察署の場合、“常時満員”であるのみならず、他の警察署へ委託し
178,ための手段として利用し、利益を得ようとしている。今日、このような仕組みと無関係にスポーツをするのはきわめて困難であるが、しかしそれをよりよいものに変えていく
179,腕からの採血ができませんが、献血しても貧血は起こしません。あまり無関係なことを、つなげて考えない方が良いと思いますよ。
180,を連想的思考に費やすようになることである。したがって，エリートランナーか初心者ランナーかどうかとは無関係に，ランナーたちが運動がよりハードになったことを認識したとき，彼らの思考
181,収入や支出として処理する会計原則をいう。これに対して発生主義とは，現金の授受とは無関係に，資産価値の増加や減少が生じたときに，収入や支出として処理する会計原則を
182,クレーメルは自ら演奏したいもののためにこの音楽祭を始めたらしい。言ってみれば商業主義と無関係な状況で自らがやりたいと思う音楽をやりたいメンバーとやるという意思表示だ。
183,にある者）が登録商標権を有しているとは限らない。たとえば，パーカー社とは全く無関係の者が登録商標権を有しているということだって考えられるのである。もちろん，多くの場合
184,ていく」私たちがこの〔序〕を問題にせずに、それとは無関係に論理的に検討して到達した結論と、ぴったり完全に一致する。その年すなわち千九百八十九年
185,その新決算対策を「ツギハギで終わらせてはならない」ということではないでしょうか。会計改革とは無関係に、ここまで日本企業は決算対策目的で、さまざまなツギハギを行ってきました。本業の
186,，変化する前の状態と変化した後の状態だけで決まり，変化の過程には無関係である。」これをヘスの法則（総熱量保存の法則）という。ヘスの法則
187,に着手した平成二年には、沖縄と大阪で抗争に絡んで、組とは無関係な市民、警察官各二人が誤認射殺される事件が起こった。それが同法成立へ向けての世論
188,。このころブロードウェイの形態としてレヴューは衰退していた。このようなショーは、無関係のスケッチや必ずしも同一の作曲家によらないミュージカルの歌を単純に舞台に乗せてい
189,で狭路やクランク部、あるいは岩塊が道路に立ち塞がるという現在の光景も、これらと全く無関係であったとは考えにくい。なお、鎌倉を襲った地震はこれに止まらず、元禄
190,えない。それはおそらく、リクルート社の未公開株が新聞界にもばらまかれていたことと無関係ではあるまい。というのは、リクルート事件が拡大していく中で、日本経済新聞社の社長
191,「ミッシングリンク」とは何ですか？【失われた環】一見、まったくの無関係と思われる事実と事実とを結びつける秘められた関係性のこと。例えば、関係が
192,は）憂慮すべき事態だ」と表明。ＩＡＥＡは研究所が北朝鮮側の主張する電力生産とは無関係とみて再稼働の動きを最も警戒してきた。北朝鮮は今月十二日の核施設再稼働宣言後、
193,」「みんな知っているんだろうか」「さあどうかしら」「とにかくぼくは無関係だよ。だってぼくがそんなことするはずがないじゃない」「そうだろうとは
194,、このくだけた態度は、事実上、新城ただ一人で近衛の評価をあげているという現実と無関係ではない。また、今、実仁が軍人として新城を迎えている点にも関わりがある
195,の節におかれたものと思われる。株式分割に関する二百九十三条ノ４は計算とは無関係であるが，その機能・本質において株式配当・無償交付と類似あるいは共通するところから計算の節におかれた
196,悪くても支給することがある」というような規定では足りず、業績と無関係に支給することが明示されている必要があります。また、賞与支給が、労使慣行として
197,かあるでしょうか？イマヌエル・カント［千七百二十四―千八百四］ドイツの哲学者。人の意識とは無関係な客観的な存在はあるが、それ自体は感知することができず、現象が見えるだけだと
198,の同盟国はアメリカのリビア攻撃に協力しなかった。それどころか、アメリカのリビア攻撃とは無関係だとの態度をとった。石油供給国リビアとの関係を重んじたわけである。アメリカ国民
199,とスタッフの現物投資がこの頃活発になされている”として”俳優の真正性と共に映画界不景気とも無関係ではない新しい風俗も”と話した。
200,洋装科主任にはパリ帰りの武林文子が選ばれ、パリ・モードが紹介された。和装もパリと無関係ではない。たとえば千九百二十九年に高島屋が染色業者に配布した流行趣意書は、ギヨーム・アポリネールやポール・ヴァレリーの詩を
201,「それでは、泊っている中原徹という人は、この似顔絵の男のひととは、無関係なのかしら？…私も、心当りがないんですもの…」と、高山が呟く
202,は食中毒全体の約４割にもなります。少量でも感染するため、食品の鮮度とは無関係です。●ノロウイルスから身を守る３つのポイント１手洗いをしっかりしましょう調理をする
203,か何百万かの別途収入があろうが無かろうが、それは呑み屋のワリカンとはまったく無関係のことではないか―という主張なのだ。これは理論的にはたしかに正しい。
204,模索せねばならないが、ひとつには男性が政治から身を引きだしたことと無関係ではなさそうである。従来の政治は典型的な男性一辺倒の世界であったが、
205,リングに上がれば、どちらもトランクス一枚の裸になる。家も、親も、無関係な世界がそこにはある。面白いな…と、麻沙美は思った。私鉄
206,友達でいような』と言われたり、もともとは私が所属してるサークルの集まりに無関係な彼女を連れてきたり、なんだか無神経すぎる気がします。よりを戻すつもりは
207,か、そんなことまで得々と喋っているのであった。これは私にとっては今もって無関係の世界であり、父はともかく「家」として兄について考えておったが、私にとって
208,居たとき、自分がその部屋へ入ったことがバレてしまう。あくまでも野見山さんと無関係の形にして失った物を回収しなければならないのです」「あれから二か月も経っ
209,の杜境内にある博物館「遊就館」には祭神の遺影が生前の階級等とは無関係に展示されている東京ドームの２倍以上の境内には相撲場や庭園、能楽堂などもある
210,一般に，トラクタのけん引力は，エンジン出力が十分にある場合には，エンジン出力と無関係にトラクタの質量（自重）と地盤条件によって決まる。地盤条件とは，土質とその締め固まり
211,にただ巻き込まれただけなんだ。腹が立つくらい、本来俺ともにこにこ園とも無関係なトラブルだった。でももう今さらそんなことをいくら言ってても始まらないからね
212,た。パパも安心したんだぞ、わかるか」だが千織は僕の言葉など無関係に、おう？と妙な声を上げた。そして不思議そうな顔をし
213,米国のいう「制裁」を、むしろ「侵略」ととらえる可能性が高く、制裁に無関係の一般市民が多数巻き込まれれば、反米感情が一気に燃え上がる危険がある。イスラム諸国が
214,昔の人と会える場所である。そこには、老いゆく日系一世の老人たちと全く無関係な、それでいて老いた日系人に軽蔑の眼ざしを投げ、禿げ鷹のように
215,という報告がある。Ｐｏｉｎｔ：摂取窒素量を直接的に反映し，健康牛においては他の要因は無関係である。食欲の有無の判定にも有効である。（３）アンモニア（ＮＨ３）
216,で県の指定金融機関ならもっと県民にサービスしろと追及したわけです。小針さんや福島民報とは無関係なんですよ。だけど、民報の記者にあとから聞くと、日債銀への多額
217,ひとつとしてあげられるのが自律神経の乱れだ。自律神経は、人の意志とは無関係に内臓や血管の働きを支配している。自律神経には交感神経と副交感神経があり、この
218,アメラジアンという言葉を用いるのか、理由を説明させてほしい。アメラジアンは、国境とは無関係に、広い領域に住む人々を包括している言葉である。多数の国に住む多様な
219,あっても、誰にも言うことはできなかった。一切は自分とは無関係のできごと。すくなくとも第三者にはそう思わせなければならなかった。弘は髪
220,はふつうに売るだけである。処理が自分の自由にできるということは他人は無関係となる。だからその管理は誰もやってくれない、自分でやるしかないのである。買い戻し
