,0
100,が宅老所である。宅老所は，痴呆性高齢者を対象にしたデイサービス・配食サービス・ホームヘルプサービス・ショートステイ・居住サービスなどを実施している住民参加型在宅福祉サービス事業の総称である。この小論文の目的は，地域社会において居住サービスを実施している宅老所の役割について考察すること
101,本来は『人形使い』なんだ…『人形使い』とは自立型機械人形を制御する魔導師の総称だが、浄化兵器もその一種だ。私にとっては普通の機械人形の制御を外し、
102,それは間違いないのだが、この世界で「ちゃんこ」とは、お相撲さんが食べる料理の総称をいう。だからカレーライスも、ハンバーグも、ラーメンだって、「ちゃんこ」だ。
103,か問題があるのでしょうか。Ａステロイド剤（分子中にステロイド核という共通構造を持つ有機化合物の総称。体内では副腎皮質ホルモンが有名です）は、幅広く多くの疾患で使用され特にアレルギー疾患
104,や動物から放出され、他の生き物の生活に影響を与える物質、いわば生物活性物質の総称。その種類は多く、中には既に医薬品などとして利用されているものもある。
105,にわざわざ内科病棟まで出かけたり、主治医に質問をしたり。最初は胃の病気の総称ですなどとごまかしていたようですが、そのことが私たち外科医の間で話題になり
106,もちろん、大国主神は一人の神とは考えられない。何代にもわたる国土開拓者の総称であろう。少年の時のオオナムチという名前や、越の国の女王に妻問いに行っ
107,に収容されている者を，収容期間満了以前に仮に釈放して社会復帰の機会を与える措置の総称であり，これには，懲役又は禁錮の受刑者に対する仮出獄，拘留又は労役場留置中の
108,叮責でもよい花き（花卉）→花、草花、花物、草木卉は草の総称で草木のこと覚せい（覚醒）→覚省醒は目ざめる、省はかえりみる、みる、
109,は代表されるが、それにひとが触れることによって危機にさらされる様々な物の総称である。もちろんそれは、けっして中世期に淵源をもつものではなく、有史以前の原始社会にこそ
110,になったお吉も“唐人”と呼ばれている。唐というのは、外国人の総称に発展した。それほど日本への影響がつよかった。しかし現実にこの大唐街に
111,」による「しわ」「あざ」「しみ」「たるみ」の根治療法の「テクニック」等の総称です。「ｌａｓｅｒｒｅｊｕｖｅｎａｔｉｏｎ：レーザー・リジャビュネーション」は「合衆国ＵＳＡ」でも「難しい言葉」
112,恵みの雨。下財［げざい］山師をはじめとする鉱山で働く者の総称。地域によって少しずつ意味が異なる。下路下路［おろおろ］１泣いたときの
113,これはもともと贄土師部の造るところであったと思われる。海布の柄ワカメ・ヒロメ・アラメなどの総称。メは芽あるいは藻の転とされるが、おそらく後者であろう。カラは茎
114,主張されてはいるものの、具体的な一個の行為があるわけではなく、個別行為の単なる総称であり、かつ、各具体的行為には旧請求の請求原因とは行為の主体が異なるものも多く
115,えらばねばならなかった。山家三方衆とは、奥三河の山間に領土を持つ三所の土豪たちの総称である。戦国期には、北設楽郡田峯の菅沼氏、南設楽郡長篠の菅沼氏、同郡作手の奥平氏
116,から人的資源管理へ１．１．１経営労務の特徴人的資源管理は，千九百九十年代以降の企業の従業員に対する人事労務管理施策の総称としてよく使われている。従来では経営労務，人事管理，労務管理などといわれており，
117,先。名古屋帯で表すと広くなっている方の一番下。反物（たんもの）和服地の総称。着物を仕立てるにあたり一着分取れる幅、丈を持つ布地で、この寸法あるもの
118,と書いてあるものは本物という意味なんでしょうか？日本の正規代理店を通さない物の総称です。大抵は本物ですが、悪質な業者もあるので注意はしてください。偽物
119,ギリシャで有名だった画家。リシポはギリシャの彫刻家。ここでは画家と彫刻家の総称として使われており、バシリオの肖像が描かれ、胸像が刻まれて永久に残さ
120,ことである。言うまでもなく大神宮とは皇大神宮（内宮）と豊受大神宮（外宮）の総称であり、伊勢大神宮を指す。各地にただ大神宮と称して、天照大神を祭神とする神社
121,の下に釈放して更生の機会を与え，円滑な社会復帰を図ろうとする制度の総称である。仮釈放には，懲役又は禁錮の受刑者に対する仮出獄，拘留受刑者又は労役場留置者
122,】『熱中症を覚えよう』熱中症は、日射病、熱射病、熱ケイレン、熱疲労を含んだ総称。『日射病とは』暑い所で例えば直射日光に長時間さらされて動きまわったとき
123,住民税と市民税の違いは？「住民税」は、「都道府県民税」と「市区町村民税」の総称です。
124,二十四，ＡｃａｄｅｍｉｃＰｒｅｓｓ，千九百八十六より）真菌真菌とはカビ、酵母、キノコの総称です。生物学では、粘菌とともに菌類に分類されます。真菌は細菌と
125,あなたもその一人かもしれません。「区域麻酔」という医学専門用語は、麻酔科医が硬膜外麻酔と脊髄くも膜下麻酔の総称として用いますが、からだのある範囲内に限られている麻酔のことを意味します。
126,になったり、助動詞「だ・です」を付けて述語になったりする単語の総称。体言は、それだけで主語になることもでき、それだけで独立語にも
127,の板橋宿に対応する。板橋宿は、平尾、仲宿、上宿の三つの小さな宿場の総称である。その中の仲宿と上宿のあいだに石神井川が流れている。石神井川に板
128,合併する。早期診断と早期療育開始が重要となる。フロッピー・インファントｆｌｏｐｐｙｉｎｆａｎｔ。筋緊張低下を示す乳児の総称である。脳性麻痺をはじめとする種々の中枢神経疾患では、一般的に乳児期に全身の筋緊張低下
129,ある。明暦の大火は明暦三年（千六百五十七）一月十八〜十九日に起きた三つの大火の総称。第一の火元が本妙寺、第二が小石川伝通院付近、第三が麹町で、江戸城天守閣・本丸・二の丸や大名屋敷など
130,で”いきいき”とした地域づくりをサクラ（桜）バラ科サクラ属の落葉高木または低木の総称。サクラ属は亜科とされることもある。中国大陸・ヒマラヤにも数種あるが、日本に最も種類
131,品詞分類表用言文中で語形が変化し、それだけで述語になることのできる単語の総称。用言は、それだけで修飾語にもなる。用言には、動詞・形容詞・形容動詞がある。
132,ていたことからその名が付いたとか。［キーワード］トリップ牛の胃の総称。リヨン地方ではトリップ（ｔｒｉｐｅ）のことをグラ・ドゥブル（Ｇｒａｓ‐Ｄｏｕｂｌｅ）ともいう
133,がみられる．更年期に関連する疾患・異常―更年期障害―更年期に認められる多種多様な症状の総称．特に病変を認めない自律神経失調症を中心とした不定愁訴を主訴とする症候群である．
134,とは、労働者災害補償保険（一般に「労災保険」といいます。）と雇用保険をまとめた総称であり、業務上災害と通勤途上災害による傷病等に対する補償（労災保険）、失業した場合の給付（
135,てはいられない。というのも、脳卆中（脳梗塞、脳血栓、脳内出血などの総称）や心筋梗塞には縁がないと思うのはあなたの一人よがり。もしかして
136,悪魔なんですか？どっちの方が偉いとかあるんですか？サタンは悪魔の総称。ルシファーは堕天使です。詳しくは参考を見てください。
137,。郢曲とはもともと楚の都郢で発祥した歌曲の意であるが、催馬楽・今様・朗詠等謡い物の総称となって、日本で独特の発達をとげ、平安末期以来公卿の間に流行したのである
138,ています。当時は民間の住宅金融専門機関であるスリフト（貯蓄金融機関：貯蓄貸付組合（Ｓ＆Ｌ）と貯蓄銀行の総称）が主な住宅ローンの貸付主体でしたが、千九百六十年代の高金利時に、預金を貸付原資とする
139,は多く、ジビエという言葉も浸透しつつある。［内臓類／アバＡｂａｔｓ］骨以外の臓物・くず肉の総称。レバー、腎臓、胃・腸（トリップＴｒｉｐｅともいう）、タン、テール、胸腺肉、
140,に入るものにワックス磨き仕上げがある。ワックスはロウ、パラフィン、シリコーン油などの総称で、液体、固体、半練りペースト状、エマルション状のものがある。用途別には家具用、白木用
141,ｉｍｍｏｂｉｌｉｚｅｄｐｌａｎｔｃｅｌｌ）、動物細胞（ｉｍｍｏｂｉｌｉｚｅｄａｎｉｍａｌｃｅｌｌ）などを固定化したものの総称。バイオリアクターの反応素子として、アミノ酸、有機酸、アルコール、糖、抗生物質などの有用物質の生産
142,は、本来、貝を表わす言葉であった。今日の市場ではバイおよびエゾバイ類の総称として使われている。「黒ばい」と「白ばい」に分けられることが多い
143,映画の題名がならんでいる。映画が活動写真に代わって今日に至る新しい時代の総称になるのは千九百十七―十八（大正六―七）年の帰山教正の「純映画劇」運動をきっかけに
144,笹と竹の違いって何でしょうか？笹イネ科タケ亜科の植物のうち小形のものの総称。タケに比べ丈が低く、稈（かん）は細くて生長後も竹の子の皮
145,〉の大会場に所狹しと並んだ人形たち。千というのはあくまでもタイトルとしての総称で、何千あるのかわからない。人形劇やテレビに登場した人形たちもさることながら
146,洗面台ユニットなどがあります。キャビネット一般には飾り棚やたんす、小型の整理箱など収納家具の総称。ここでは、鏡の近くや洗面器下の収納部分を指す。さらに洗面台ユニットには
147,ひよう）との中間の状態のもの。雪霰（ゆきあられ）・氷霰（こおりあられ）の総称。（これらはその直径によって判別するのだそうで、直径が５ミリ以上の氷の粒
148,ひとつの島の名と誤解されがちだが、じつは仙台湾の支湾・松島湾に浮かぶ二百六十余の島々の総称である。この松島が、近い将来、なんと陸続きになってしまうかもしれないという。
149,組み合わせたビデオ・ディスクの一種の商品名として使われ、「コンパクトディスク（ＣＤ）」が音楽ディスクの総称になっている。遺伝子の情報技術はデジタルである。当時はこんな表現はしなかった
150,するものは，すべて神とされている。八百万神とは，こうした神々の総称である。古代日本人にとっては，この世界には，このような神々がそれぞれの持ち場や
151,は進まない。誰にでも分かる易しい錦の御旗が必要と考え、新技術の総称を「ウルトラクリーンテクノロジ」とし、その三原則を以下のように決めた。１シリコン基板表面が
152,●あおもの（青物）アジ、サバなどの背が青い、中層を泳ぎ回る回遊魚の総称。●あかしお（赤潮）海水中でプランクトンが異常発生し、潮の色が赤く濁り、海中
153,別冊ＭＡＰ二十六Ｃ‐４河津七滝とは、河津川沿いの約２ｋｍに点在する７つの滝の総称。滝めぐりを楽しむなら、水垂バス停で下車して上流から、釜滝、えび滝、蛇滝、初景滝
154,」と呼びます。ですから、日本の天台宗は天台山門派、天台寺門派、天台真盛派、天台単立寺院の総称でもあるわけです。昨日、勘違いされたのでしょうと思いますが、帰りがけに
155,かの大神秘家モーセへと伝えられたと「ミドラシュ」（ユダヤ教のラビによるさまざまな旧約解釈書の総称）は記している。この謎の石にまつわる伝承には、天界の叡借
156,天王寺七坂大阪市天王寺区の上町台地にある７つの坂の総称である「天王寺七坂（てんのうじななさか）」。今回は、７つあるうちの４つ
157,を提示しておきたい。ちなみに、「三界」というのは、欲界・色界・無色界という三つの世界の総称である。ここでも、「学道」の仕方をめぐって、一面的な固定化は
158,にも適用可能というものではない。通常の（レギュラー）学校教育に代わり選択的であるという意味で総称としてそれらはオールタナティブ教育と呼ばれる。以下、報告書からオールタナティブ教育の例を摘記する。〈規律維持
159,十二支が使われた。十干は甲、乙、丙、丁から癸までの総称。古代中国の陰陽五行説に基づいて、対立する陽（兄）と陰（弟）の
160,。シャチはクジラの一種です。クジラ…哺乳類クジラ目の海獣のうち、大型のものの総称。形は魚に似、海中生活に適する種類が多く、歯のあるもの（歯クジラ
161,解説１農地法上の定義農業法人とは、「法人形態」によって農業を営む法人の総称です。農業生産法人というのは、農地法で規定された呼び名で、農地や採草放牧地を利用し
162,Ｓｐｉｎｏ‐ｃｅｒｅｂｅｌｌａｒｄｅｇｅｎｅｒａｔｉｏｎ）脊髄小脳変性症とは運動失調を症状とする原因不明の変性疾患の総称である．大部分は遺伝性ないし家族性に発病するもので，主に小脳，橋，オリーブ核，および
163,鯖街道［さばかいどう］若狭湾でとれた海産物を小浜から京都に運んだ数ある道の総称。「京は遠ても十八里」と歌われるほど、盛んな行き来かあり、
164,代表する打ち上げ物といったら海藻でしょう。カジメ、ワカメ、ホンダワラ、天草（マクサなどテングサ類の総称）を拾い集めて、ところ天をつくる人もいます。食材を拾うという行為は有史以前
165,（田中純一郎「日本映画発達史Ⅰ活動写真時代」中公文庫）。ヴァイタスコープもシネマトグラフも結局は活動写真という総称でくくられて一般化することになり、活動写真の時代が到来する。「映画いや活動写真は、たちまち
166,電子、原子核など。放射物体から放出された電磁波（電波や光のこと）の総称。七十四年以来、私は一般相対論と量子力学を結びつけた整合性のある理論をまとめるべく研究
167,も著しい著しい影響が続くような傷を受け不健全な生き方を学びとってしまった人たちの総称です。生活そのものが極限状態にあって、子供達は親のアルコール依存、ギャンブル
168,。万世一系の天皇とは、歴代天皇を各別に考へるのでもないし、又、その総称といふわけでもない。一系の皇統を要件として歴代天皇として発現しながらも個々の天皇
169,王国である。ポルトガル人は地図を支配したから、インド諸国（インド、インドシナ、東インド諸島の総称）を支配したのである。貿易の独占権を確立、維持するため、エンリケ航海王子とその後継者たちは
170,をまたいで縫い付けられたベルトをいい、サドルシューズとはこのベルトを付けた靴の総称です。わが国ではインステップ部に色や材質の異なる革を、鞍状にまたがらせ
171,１．概念ネフローゼ症候群とは蛋白尿，低蛋白血症，高脂血症，浮腫を主徴とする腎疾患の総称であり，１つの疾患単位を意味するものではない．糸球体基底膜蛋白透過性の著しい亢進によって大量の蛋白が尿中
172,を生みだしたことでも有名である。これらの堂々たる彫刻群はイギリス人にはエルギン・マーブルズの総称で知られている。そしてエルギン伯によってイギリスに運び去られ、現在は大英博物館に収蔵されている
173,預言者ムハンマドの従弟で、娘ファーティマの夫でもあるアリーを預言者の継承者とするイスラム諸分派の総称で、スンナ派に対置される。「シーア」は党派を意味し、もともと「シーア・アリー」（
174,などで脳の細胞が傷ついたり脳が萎縮したりして認知機能が低下していく病気の総称です。高齢者に多い物忘れとは、根本的に違います。■■■■なるほど。では、
175,元来賞状とは、表彰状や感謝状、修了証書、免許状などすべてを含んだ書状の総称なのですが、ここで賞状と限られた言い方をする場合は、たとえば研修会、
176,概念の構成を図った。もちろん、ここでのアトムくんは原子、分子、イオンの総称あるいはこれら概念の未分化な状態であることは言うまでもない。しかし、これらの概念への
177,、ネットワーキングと表現したほうが好ましいのかもしれない。ネットワークは、ネットワーキングを含めて、その総称としてここでは扱うこととする。一般的には、交通ネットワーク、放送ネットワーク、通信ネットワークの
178,のは、戦後の出版の自由、性風俗の解放にともなって台頭してきた大衆娯楽紙の総称である。内容はもっぱらエロ、グロ、猟奇等の過激なもので占められ、それゆえ発禁
179,の歌謡曲「川の流れのように」のこと。３アロエユリ科アロエ属の多肉植物の総称。４エミリ・ディキンソンＥｍｉｌｙＤｉｃｋｉｎｓｏｎアメリカの詩人。千八百三十―千八百八十六◆ここにあげられ
180,とは北部九州全域にあった国で、女王国を含めた女王の支配するすべての国の総称であり、卑弥呼の本国は「女王国」であるとしてよい。
181,は二種類の読み方があって、『ハハソ』と読むと、コナラなどのブナ科コナラ属の総称になるのですが、今回は、マンサク科の常緑高木である『イスノキ』。『いす
182,。これまた素っ気なく感じ『大辞林』へ移れば「日本で発達した伝統的な料理の総称。魚介・野菜・乾物などを、醬油・砂糖・酢などで調味した淡泊なものが多い」と出ており、
183,れていないローカットで、ひもやファスナーなどの締具や留具を用いていない靴の総称です。イギリスでは「コートシューズ」、フランスでは「エスカルパン」あるいは「デコルテ」と
184,女性たちや中国王朝の頽廃した男たちのために造られたものだ。ジョナサン（アメリカ人一般の総称）なら誰だって、その汽車の備品の名を知っているだけで恥になる
185,ている。タマリンというのは、コロンビアからボリビア北部に至るアマゾン河上流域に生息するマーモセット科に属する種の総称で、成体でも体重がせいぜい三百五十グラムと、小型の動物である。ムネアカタマリンは、この
186,。３知的財産権の意義と種類知的財産権は，知的創作と経済活動におけるマークに対する排他的独占権の総称である。この知的財産権を分類すると，発明，考案，意匠などのテクノロジーやマークに対する排他的
187,。６制禁制。７小蔀十二ページ注十一参照。８職事蔵人頭と五位・六位の蔵人の総称。９一の人十四ページ注２参照。時平は左大臣であるが、関白に準じた地位に
188,よねぇ？？？元々「かいわれ菜」とは種を蒔いて出てきた双葉の総称です。大根の種を蒔いて出てきた双葉を間引き、食べるようになった
189,＋Ｈ２Ｏとなり、ラウリル硫酸Ｎａが形成されます。すなわち、ラウリル硫酸塩は、ラウリル硫酸Ｎａなどの総称です。
190,の活動法に含まれます。［註］＊所掌事務：行政機関に与えられる職務の総称です。内閣法４条「所掌事務の範囲及び権限」にある所掌事務と権限は行政機関の作用
191,纏って他者を扇情しつつ、同様にエロス化された他者のジェンダー記号に対して欲情するというゲームの総称なのだ。その意味では、レズビアン／ゲイ／バイセクシュアル／ヘテロセクシュアルは互いに「違う
192,＝浅い川などの水がさらさらと流れる音。またはその様子。二十五五臓＝内臓の総称。ここでは体全体のこと。二十六塔楼＝「塔」も「楼」も高くそびえ立つ
193,。十月は労働保険適用促進月間です伊那労働基準監督署ＴＥＬ７２‐６１８１伊那公共職業安定所ＴＥＬ７３‐８６０９労働保険とは、労災保険と雇用保険の総称です。労災保険は、業務中や通勤途上の事故などにより負傷したり病気に見舞われたり
194,一泊して、翌朝仁田峠行きのバスに乗り込んだ。雲仙岳とはいうけれど、それは総称であり、実際は国見岳・妙見岳・普賢岳の三山からなる。
195,、飛行機、兵器その他の軍需品の研究、製造、修理などを担当する工廠などの総称で、工作庁査察の規定ができたのは昭和十八年だが、査察官は常設ではない。
196,である。五色沼とは毘沙門沼、赤沼、みどろ沼、弁天沼、瑠璃沼、青沼などの湖沼群の総称だが、それぞれの水の色が藍色、青緑色、淡青色、エメラルド色と、違った
197,貴州省茘波、四川省武隆、雲南省石林の３カ所のカルストの総称。「中国南方カルスト」として二千七年にユネスコの世界自然遺産に登録された。総面積は千四百六十平方キロメートル以上で、
198,。「労務」という言葉は，多くの場合，工場労働者を対象とする管理施策の総称として使われている。日本では，労務管理と人事管理を強いて区別すれば，前者は
199,の商品名（群栄化学（株）製品）で，炭素化前後および活性化されていないものをも含んだ全ガラス状カーボンファイバ製品の総称である．表二十三で特に注目すべきことは，図七十二でも明らかなように
200,の動物―原文は「五虫」。虫とは昆虫ではなく、古代では動物の総称。『大載礼記』易本命によれば、「羽のある虫は三百六十種あり、鳳凰がその長。毛
201,、クウガとアギトは同じ世界です。Ｇ３は、未確認（クウガでの敵の総称）のデータを元に作られていますので。ただし、クウガでの登場人物は一切
202,フランスで生まれた靴です。【シューズ】トップラインがくるぶしより下にある靴の総称です。シューズの定義はイギリスとアメリカでは多少違いますが、ここではくるぶし
203,多様化（外資系企業の導入、個人企業の容認など）にしたがって、現在では農村企業の総称となり、広く個人企業、外資系合弁企業なども含む非国有セクター農村企業の総称となっている。郷鎮企業の実態
204,ますが、五体とはどこのこと何ですか？辞書で調べたら、全身の総称と書いてあるけど。すみません。二通りの考え方があります。１頭・首・胸・手・足の五つ。２頭・右手・左手・右足・左足の
