,0
0,玄関らしい玄関というのはなかった。とはいっても、現在では、出入り口の総称として「玄関」という言葉を使っているので、こうした場所も玄関といって
1,分子を消去すると、すなわち、紫外線が当たると、ＮＯＸ（ＮＯとＮＯ２の総称）を触媒として、一個の酸素分子が二個の酸素原子に光解離されたことになる。この
2,福祉の運用１障害者手帳とその対象者障害児（者）とは身体・知的および精神障害者の総称であり，長期にわたり日常生活または社会生活に相当な制限を受ける者をいう。わが国に
3,ていけるよう，ライフスタイルを築いていくことが望まれている。▼１コンピュータ・リテラシーコンピュータ操作能力の総称。▼２メディア・リテラシーコンピュータをはじめとする情報関連機器の利用能力の総称。図２わたしたち
4,からの退去を命じた。十八日付「覚」では、キリシタン宗門を「八宗九宗」（各仏教宗派の総称）の一つとしながら、同宗門の「押付け」（強制）を禁じ、大身層の
5,仏教の隠語で米の粒を表す言葉シルバースプーン、フォーク、ナイフなどの食器の総称縦飯〈たてめし〉日本料理のこと。それに対し、西洋料理は横飯。たま赤貝のこと。
6,正客がすぐに定座につくと床の前をふさいでしまうため、連客（客の総称）の床拝見の邪魔にならないよう仮座（かりざ）に座る。末客が釜
7,ように、内側にファスナーつき。ハイブーツトップランが膝のすぐ下まで達しているブーツの総称です。「ハイトブーツ」、「ニーブーツ」ともいいます。↓カウボーイブーツウエスタンブーツの一種です
8,拠点だ。品川駅港南口直結の「品川グランドコモンズ」は、品川イーストワンタワー、太陽生命品川ビル、品川三菱ビル、三菱重工ビル、品川インターシティの総称で、人気シェフのレストランや都市型ホテルが続々とオープンしている。（広域図Ｐ百三十一Ｃ５）街ナビ
9,）から選べ。（１）特定の有機物質のきわだった特徴を利用した化学製品の総称。（２）軟質ポリ塩化ビニルに多量に含まれていて，溶出により環境汚染の懸念が
10,上述したように，デイサービスやショートステイおよび居住サービスなど，痴呆性高齢者を対象にした各種在宅介護サービス事業の総称として用いられることが一般的であるが，ここでは，居住サービスを実施している施設のみを
11,は血管を流れる血液だけではなく、体内全体に栄養分をゆきわたらせる体液（体内の液体成分の総称―血漿・リンパ液・組織液など）をさしている。このように〈気血〉とは要するに「
12,意味で政治行動論とは、科学としての政治学の確立を求める自覚的な政治現象に対するアプローチの総称といってもいいすぎではない。この発展としてすぐ後に触れるように、政治行動論は千九百六十年代以降
13,」ということで、こうなりました。もともと、哲学は、「学」の総称でした。形而上学も、哲学の一部（第一哲学）でした。しかし、はじめに自然科学
14,湯釜などでは現在も噴火活動の兆候が見られる。草津白根山というのは白根火山の総称で、多くの噴火口や火口丘などがあって、複雑な地形を見せているが、
15,」といいます。↖デッキシューズヨット、ボートなどのデッキ（甲板）ではく靴の総称。アッパーがキャンバスか水に強い厚手のオイルアップレザーで、本底には濡れたデッキで
16,幻夢を楽しんだにちがいない。【二百四十一ページ図版解説】シダは維管束植物のうち、種子をもたないものの総称。一般的にシダ類といわれるものは真正シダ類ｆｅｒｎのこと。その生活史は、独立生活を
17,は「接点」で生まれるブランドは、消費者の頭のなかに生まれた意識の総称です。ブランド価値は、その総称に対して消費者が持っている意味に、どのくらいの価値が
18,すなわち、これらから邪馬台国とは、女王国を含めた女王の支配するすべての国の総称であり、その戸数が七万余ということになる。このことは、『晋書四夷伝』にある「
19,て、スキンク、トカゲモドキの類やや誤解がある。トカゲはまさしく、有鱗目トカゲ亜科の総称。また、ニホントカゲＥｕｍｅｃｅｓｌａｔｉｓｃｕｔａｔｕｓのことを、ニホンカナヘビＴａｋｙｄｒｏｍｕｓｔａｃｈｙｄｒｏｍｏｉｄｅｓと対比して
20,中学校程度の教育課程を実施するものの、制度としては「中学校」以外で設置されたさまざまな教育機関の総称―あるいは俗称・通称―だったのである。各種学校として設置された事例が多いが、実業補習学校（
21,などに含まれるリノール酸が、化学的に変化してできた物質（共役リノール酸、異性化リノール酸）の総称のことである。このＣＬＡには、大きく３つのダイエット作用が期待できる。アドレナリンの分泌
22,。野に生える蒜の意味で、蒜とは臭味に刺戟をもつネギ・ニラなどの総称。鱗茎は白色で径１〜１．５ｃｍ。茎は直立して高さ三十〜六十ｃｍ。葉は太さ２〜３ｍｍの
23,の異なる二個以上の物が結合した場合に、所有権の得喪を生じること。付合・混和・加工の総称。
24,授産施設において行われる要援護者の自立、自活、社会復帰のための訓練、職業供与等の活動の総称です。これらの訓練等の課程で製作した作品等を、授産施設が他に対価を
25,の理解と協力が必要となっています。＊２ブラックバス：オオクチバス及びコクチバスの総称＊１特定外来生物等専門家会合：「特定外来生物による生態系等に係る被害の防止に関する法律」に基づき、
26,の部姓を与えられた。「夷俘」は身分ではなく「蝦夷」「俘囚」の総称とみるべきである。また位階および六ランクのいわゆる蝦夷爵による序列化も行われた。前者
27,ビタミンとは化学物質の名前ではなく、たとえばビタミンＣなら、「ビタミンＣの働きをする化学物質の総称」のことです。一番有名なのがアスコルビン酸です。
28,をはじめ、大小約五十基の前期古墳が密集。萱生（かよう）、柳本、纏向の三古墳群の総称として用いられる。苅谷あの当時、東田大塚（桜井市）周濠の調査をやっていた
29,一期［いちご］一生涯。一札［いっさつ］一通の書付・証文・手形などの総称。文書の表題・巻頭に用いられる。一束［いっそく］百を一束と呼び、
30,、「関係―種子」、「関係―人間」、「関係―本」など、タイトルの総称に「関係」という言葉を使い、物の存在の根幹的あり方を表現しようとしている
31,いう風に説明したらいいですか？工業所有権（意匠権、特許権）、著作権、商標権などの総称です。
32,の略で、様々な情報交換を通じて国民の意見を聴取し行政に反映していくための手法の総称。実施形態としてはいろいろなものがある。国さらに国民とのコミニュケーション推進を図るため
33,「社会の義務」です。※労働保険とは？「労災保険」と「雇用保険」の総称です。●労災保険業務上の災害や通勤災害に対して必要な給付を行います。●雇用保険
34,社会生活を営む上で様々なハンディキャップを負っている人々を援護する目的で設置されている施設の総称である。第Ⅴ‐５‐１表社会福祉施設の状況（昭和六十二年十月１日現在）（注）
35,潮の流れのこと。●うわもの（上物）主に中層や上層に生息している魚の総称。磯釣りの底物と区別して用いられる。え●エギ（餌木）アオリイカを釣るための
36,、生命を賭けたアフリカ大陸探検家たちへの献花なのである。【二百二十五ページ図版解説】ユリ科Ｌｉｌｉａｃｅａｅの多肉植物アロエ属の総称だが一般にはキダチアロエＡ．ａｒｂｏｒｅｓｃｅｎｓをいう。約三百種が知られ、アフリカ南部〜中部の
37,１コンピュータ・リテラシーコンピュータ操作能力の総称。▼２メディア・リテラシーコンピュータをはじめとする情報関連機器の利用能力の総称。図２わたしたちの身の回りの情報図３ＩＣカードの機能例４生活にかかわる
38,機械式クロノグラフ時計は純粋なる時刻時計機能の他に簡単なアナログ式ストップウォッチ機能が追加されているモデルの総称で御座います。この機能に追加して外周リングに回転式計算尺ダイアルを装備させたのがブライトリングの
39,すなわち市場リスク及び信用リスクが主に取り上げられます。市場リスクとは，為替リスク，金利リスク，価格リスクの総称です。１為替リスク為替リスクとは，為替レートの変動によって生じる損失の可能性をいい
40,られる公共的な開発計画に関して実施されるもので，フィージビリティ調査，マスタープラン調査，各種資源調査，地形図作成，地下水開発調査等の総称である。八十四年度は，百八十九億円の予算規模（外務省予算及び通商産業省予算）をもって，二百十二件にのぼる調査を
41,ための催物で，一定の目的をもって開催される国際会議・国内会議，セミナー・シンポジウム・学会，各種大会，展示会・見本市などの総称をいう。コンベンションが都市に与える効果は，経済効果はもとより，産業刺激効果，情報発信効果，文化振興効果
42,）糖尿病性腎不全の冠動脈疾患冠動脈疾患は虚血性心疾患と同義で，心筋梗塞，狭心症，無痛性心筋虚血をひっくるめた総称です．糖尿病患者の冠動脈疾患は，非糖尿病患者に比べて多くの特徴を有しています．１
43,バイオマス元年バイオマス（ＢｉｏＭａｓｓ）エネルギーとは、生物体を原料としたエネルギー資源の総称であって、再生可能なエネルギー源として将来最も期待できる資源であろう。バイオマスの構成成分は基本的には
44,値する生活が不可能または危殆化した場合に，必要な援助を国家に要求していく権利の総称である。こうした社会権という考え方は，資本主義が急速に発達した十九世紀の西ヨーロッパ
45,、しばしばこの行動を見せる。シャチのスパイホップ。ハクジラクジラ目のなかの、ハクジラ亜目の総称。マッコウクジラやシャチなどがいる。ふつう口の両顎に歯が並び、魚類やイカなど
46,カービングスキー＝製造技術の進歩によって、昔のスキーに比べてカービングターンがやりやすくなったスキーの総称。＋純粋なカービングターンは難しいが、サイドカーブによって初心者や力のない人でも昔
47,た。■フーリガン（ｈｏｏｌｉｇａｎ）サッカーの試合会場に押しかけ、暴れ回る過激なファンの総称。アルコールが入ることで暴徒化する例も多い。七十年代より、その凶暴性で世界に悪名
48,出典不明。十六摩登迦女摩登迦（伽）は種族名。摩登伽女はその種族の女子の総称。摩登伽種に鉢吉蹄という女性がいた。仏弟子の阿難に恋し、結婚を望む。
49,十年ぐらい前に電気製品が韓国や中国から安値で輸入されてその総称があったと思うのですがなんと呼ばれてたか教えてください。確かＮＩＥＳ
50,を起こす恐れもある．（３）浸炭窒化処理浸炭と窒化を同時に行う処理の総称であり，浸炭浸窒処理ともいう．ガス浸炭窒化と塩浴浸炭窒化がある．前者は浸炭性ガスに１〜５％程度
51,のすべての国の総称である可能性がでてくる。これに関連し、安本美典氏は「総称としての邪馬台国の下にいくつかの国があった」とし、「邪馬台国という
52,な用法が多い。また、俗な表現として袍（ほう）を着用した姿の総称を「衣冠束帯」と呼ぶことがあるが、装束の構成や着用する場面に於いて、本来は衣冠
53,千八百九十年ころから千九百十年ころまでの間に西欧、特にフランスを中心に開花した芸術運動および様式の総称。ガラスではナンシー派のエミール・ガレやドーム兄弟、ボヘミア（チェコ）のレッツ工房、アメリカのティファニー
54,なおＫＤＤＩでは、「ａｕまとめトーク」の提供に伴って、ＫＤＤＩの固定電話サービスの総称を「ａｕおうち電話」と命名している。「ひかりｏｎｅ電話サービス」（プロバイダがａｕｏｎｅｎｅｔ
55,，同時にまた，個別言語の構造に依存してその表現形式が決定される文法的あるいは語彙的範疇の総称として用いる。また，動詞語彙を用いて表現される行為，状態，出来事など全てをカバーする
56,花形が特徴。エリカの佳品である。英名はブライダルヒース。ヒースはエリカの英語での総称。花嫁のエリカという、花にふさわしいすてきな名である。バウエラは十八〜十九世紀に活躍した
57,も可磯子まつり〜横浜開港百五十周年記念版〜これからは、区内各所で開催されるさまざまな自主イベントの総称を「磯子まつり」とします。磯子まつりは、磯子まつり月間（９月十三日〜十一月９日）を
58,ていると、目の前に緋鯉（ひごい→金・銀・赤などの色の付いたコイの総称）が顔を出して言いました。「カエルのお坊さま。さっき、夫が亡くなり
59,がもともとそうであったように、同じ人物を主人公にしたいくつもの話の総称です。その主人公の名前は、地方によって異なりますが、かならずあだ名で呼ばれており
60,ダイナミックＨＴＭＬとは、ホームページに動きを持たせてインパクトのあるものに仕上げるための技術の総称です。ＪａｖａＳｃｒｉｐｔやスタイルシート（本書では解説しません）などがこの中に含まれ
61,。流動資産（ｃｕｒｒｅｎｔａｓｓｅｔｓ）とは，現金および短期間に換金化または費用化される資産の総称であり，短期性資産の性質を有し，長期性資産たる固定資産に対比されるものである。これは，
62,た。美術家が用いたエンブロイダリー（刺繡やアプリケなど布や糸を使った表現の総称）をオスロの美術工芸大学で教えている、という。電話で連絡が取れ、早速
63,の逆語。ナク（泣く）雨が降る。ナコヘロインなど粉末状の麻薬の総称。「コナ」（粉）の逆語。ナシ話。ハナシを略し、逆語に
64,《チャップスイ》欧米などでは「チャップスイへ行こう」というふうに、中華料理の総称のように使われているが、それ自身は海のもの、山のものなどの色々
65,と言い換えてもよい。斂葬（れんそう）の儀＝葬場殿の儀、陵所の儀の総称。斂葬とは埋葬のこと。陵所の儀＝陵墓で行うご埋葬式。天皇以下がご参列
66,だろう。「広範性発達障害」とは、わかりやすく言えば、自閉症やそれに関連した障害の総称だ。この障害を持つ多くの人と同様に、耕ちゃんは自閉的傾向に加えて知的障害
67,．４―５の写真はそのときの１コマ。ヒゲクジラクジラ目のなかのヒゲクジラ亜目の総称。セミクジラ科（セミクジラやホッキョククジラ）、コククジラ科、ナガスクジラ科（シロナガスクジラ、ミンククジラ、ザトウクジラなど）が
68,主なカロテノイド色素とその所在３）フラボノイド関連色素フラボノイドはフラバンを基本構造を有する化合物の総称で，コウリャンの色素アピゲニンの植物性色素の大きな部分を占めているフラボノイド系色素である。また，その
69,部品をいう。はみだしコラムソフトウェア：コンピュータを動作させるためのプログラムや、それに付随するデータの総称。単にソフトともいう。Ｓｅｃｔｉｏｎ七十リンクにエラーがないかチェックするには訪問者
70,フォトは借りてきました。くるみ（胡桃）は、クルミ科クルミ属の落葉高木の総称。花の咲いている時期５〜６月です。果実の核はきわめて堅く、中の種子は
71,とはどんなものなのでしょうか？Ａペプチドとは、アミノ酸が二個以上結合したものの総称です。数個のアミノ酸が結合してできたものをオリゴペプチド、十個以上のアミノ酸が結合して
72,パウンドってなんですか？相手が寝てる状態で上から当ててる打撃の総称です。別にガードポジションだろうがマウントだろうが関係ありません。
73,、店員に、言ってもいいんですか？？ストックがおかしいいと…。バーとビッグの総称はボーナスです。『ＢＩＧ間』ではなく、『前回ボーナス後』の回転数をみないと
74,空気中の酸素の濃度がうすくなって、人の体に起こってくるさまざまな症状の総称である。高度と酸素濃度の関係は、海抜０メートルでの酸素濃度を百とすれば、
75,もいいます。ロングブーツトップラインが膝までか、あるいはそれ以上の高さにあるブーツの総称です。←ルーズフィットエスニックな雰囲気をデザインにあしらったルーズフィットのロング丈。カウボーイタイプをもっとシンプル
76,です。日本天台宗の教えでは、焼身供養を私たちが煩悩（心身を悩ます精神現象の総称）に侵されない状態の反映と見なします。つまり「焼身」とは、エゴ
77,幸いですｗｗ〜♫〜（＊＾−＾＊）ｖ■アジサイ（紫陽花）―アジサイ科アジサイ属の植物の総称―＊学名＝「Ｈｙｄｒａｎｇｅａ」・・・”水の容器”という意味＊原産＝
78,で、奥州とは陸奥州の略称である。陸奥とは、もと白河、勿来の二関以北の総称であった。名義は『道の奥』で、略されて『みちのく』となっ
79,グリセロールを持つ脂質。→糖脂質グリセロリン脂質リン脂質の一つ。グリセロリン酸を骨格とするリン脂質の総称。ホスファチジルコリン（レシチン）、ホスファチジルセリンなどがあり、生体膜の構成成分として重要である。「クリッシュ
80,違いは何ですか？分割払いは支払の方法のこと。「分割」以外の３つの言葉の総称みたいなものです。月賦とローンはほぼ一緒です。日本語と外来語の違いぐらい？
81,スコッチとはどういったお酒なんですか？スコッチ・ウィスキーはスコットランドで作られるウィスキーの総称であり、次のように法律で厳しく規定されている。（千九百八十八年制定スコッチウィスキー法）１．スコットランドの
82,てください・・そら♪ブログ（ウェブログの略）個人運営で日々更新される日記的なＷｅｂサイトの総称。一般的には、単なる日記サイト（著者の行動記録）ではなく、ネットで見つけた
83,．⇒男性尿中十七‐ＫＳの二十〜三十％は精巣由来である．アンドロゲンは男性ホルモン作用をもつステロイドの総称であり，精巣，副腎皮質，卵巣で生合成される．⇒男性体内におけるアンドロゲンの生合成の
84,ね。ＰＣ／ＡＴ互換機＝ＩＢＭ社が千九百八十四年に発売したパソコン「ＰＣ／ＡＴ」と互換性のあるパソコンの総称。ＤＯＳ／Ｖ＝千九百九十年にＩＢＭ社が発売した、ＰＣ／ＡＴ互換機で動作するＯＳ。Ｍｉｃｒｏｓｏｆｔ社
85,空挺部隊を使用して多くの橋を奪取するという、連動して行われた２つの奇襲作戦の総称。「マーケット作戦」は、アイントホーフェン、ナイメーヘン、アルンヘムにかかる橋梁確保のための空挺作戦でで
86,フッター文書面とは別に紙面下部に配置する文字列や飾り部分。▲ブラウザデータを閲覧するプログラムの総称。複数の画像を一度に表示させるアルバム的なものや、Ｗｅｂページ（ＨＴＭＬ文書）を閲覧する
87,籃胎（籠地）に色漆で模様を描き、乾燥させてから針彫りを加えたものの総称である。上手のものは針彫りに沈金の技法を施したものもあり、明末の
88,効果がある食材である。また，後者の食療中薬は，中薬（中国医学で用いる薬の総称）に比べて著しい薬効はないが，色や味があり，調理によっておいしく食べる
89,甘トウガラシ」と呼ばれるように「トウガラシ」の一種であり、辛みが比較的弱い甘み種の総称。一般的には、そのうち大型種を「ピーマン」、小型種を「ししとう」、または
90,、セグロカモメなどはよく見られる。しかし、バードウォッチャー以外には、一般に識別されず、総称として単にカモメと呼ばれている。カモメは、海の風景の一部として文学に登場する
91,か？Ａどちらも池や川、湖沼などの水辺や水中に生息する植物の総称で、同じ植物群を指しています。水生植物、ウォータープランツともいいます。住む場所によって
92,人体にある九つの穴。目、耳、鼻、口、前陰、後陰の総称。乞［いでや］さらば。それでは。乱離［らり・らんり］めちゃくち
93,そのコレクターになる事。そして足利義政（銀閣寺）に倣って行く行くは、自分の総称を冠する、例えば《安土御物》なるものを模索していたのではなかろうか。その一端として
94,ハナアブ（花虻）は、ハエ目（双翅目）・ハナアブ科（Ｓｙｒｐｈｉｄａｅ）に属する昆虫の総称、あるいはその中の一種Ｅｒｉｓｔａｌｉｓｔｅｎａｘの和名。・概説ハナアブ科は
95,が建設した選帝侯国（千六百九十二―千八百六年）、王国（千八百十四―千八百六十六年）、プロイセン属領（千八百六十六―千九百四十五年）の総称がハノーファー王国である。この王国からイギリスのハノーヴァー家（ｔｈｅＨｏｕｓｅｏｆＨａｎｏｖｅｒ〔千七百十四
96,エタノール）、メチルアルコール（メタノール）、イソプロピルアルコール（２−プロパノール、イソプロパノール）などのアルコール類の総称です。一般的にはアルコールといえばエチルアルコールを指します。つい最近、エタノールを水
97,に建てられた有頼少年像が雄山の頂上を指差す＝富山市立山連峰中部山岳国立公園北部に位置する七十二峰八千八谷の総称。主峰・雄山（三千三メートル）に剱岳、浄土山、薬師岳、大日岳などの名山が連なる。原始林
98,）シアン（青酸）ａ）病態生理シアン（青酸）は−ＣＮ基をもつ化合物の総称で，シアン化水素（ＨＣＮ）は食品などの消毒に，青酸カリ（ＫＣＮ）と青酸ソーダ（
99,。ルビービールの逆語。レンケツキ（連結器）男女の性器の両方をいい表した総称。レンコン（蓮根）リボルバー式の拳銃。弾を入れる部分が蓮根そっくり。ロクジに帰る
