,0
0,その了解を得なければ国会に提出することができない。それに見合うように、日本の諸官庁は大蔵省に予算を要求するが、その前にアメリカ側の担当部局の諒承をとらなければ
1,内容は，現実には，さまざまな政治的圧力集団を背後にもつ政治家の要求に対応しながら諸官庁が決定しており，全体的な合理性が考慮されているとはいいがたい．公共事業の多くは中央政府
2,、同時に外務省も当然窓口でございますから外務省、労働省ですか、その辺の諸官庁の関係者を中心としまして、ときには業界代表の意見も聞いても結構
3,長野県警捜査本部は県合同庁舎の一角にある。長野市の中心部からわずかに西に寄った、諸官庁やオフィスビルが集まった地域の、文字どおり中枢に位置する。庁舎ビルの屋上にのぼると、
4,た文化，社会教育施設としての勤労青少年ホーム，勤労婦人センター，勤労者総合福祉センター，勤労青少年体育施設，老人福祉センターなどの機能施設は，諸官庁に属し社会教育局のみの所管でなく，広く国家行政関連省庁によって，設置運営がなされていることに注目せ
5,。次の記事は中郡の記事である。中郡では各小学校、中等学校、公共団体、諸官庁で御大典を永久に記念すべき有意義な事業が計画されているが最も注目を払われ
6,倒産に追い込まれ、五十万人以上の失業者が街にあふれ出した。自動車産業も例外ではなく、諸官庁の予算削減と運輸業者の経営不振から購買力が低下して需要が激減し始めた。背に腹は
7,到着した日はあいにくと金曜日だった。この日は回教国ペルシアの休日にあたっていて諸官庁も休みである。そこで外務省への出頭はひとまず見合わせることにし、英国ホテルというところ
8,、発想力、販売力、この五つを学び、使わせていただこうというのです。もちろん中央の諸官庁からの出向もいただいておりますが、これはいわば同業種交流で、それも大事ですが
9,ないほどの荒稽古をつけてやると、進藤は一瞬考えたが、現在の鉄道も諸官庁も、命令に従わない奴は、遠慮なく首を切っている就職の難しい時代に
