,0
0,正しい人権意識を身に付け，心身ともに健全な国民として育成されるように，次の諸施策を講じている。（１）啓発活動等青少年に正しい人権意識を普及浸透させるために，講演会
1,今御説明しましたように、最近の経済情勢のもとでは、公共事業など景気に配慮した諸施策を実施するためにやむを得ない措置として大量の建設公債の発行を行ってきたわけで
2,まで五十九年度を目標年度とする削減基本方針及び総量削減計画に基づき，下水道の整備，総量規制基準の適用等の諸施策が実施されてきている。その実施状況をみると１ＣＯＤの発生負荷量は，東京湾，伊勢湾，
3,れたものである。この基本構想案によると，今後，国鉄は経営の重点化・減量化のための諸施策を講じ，要員については当面，六十年度三十五万人体制をめざすほか，運賃の適時適切な改定，
4,」において「防衛力整備の具体的実施に際しては、そのときどきにおける経済財政事情等を勘案し、国の他の諸施策との調和を図りつつ行うものとする」との基本方針のみが示されている。
5,が、２工場分については二十億円程度のコスト削減を見込んでいる」（広報ＩＲ）という。これらの諸施策による０９年３月期の業績に与える影響については、０９年２月９日に行う０９年３月期第３四半期決算発表の
6,を図るための方策としてマルチ・チャンネル・アクセスシステム（ＭＣＡシステム）の導入，通信路間隔の縮小（ナロー化）の推進等諸施策が講じられている。２有線電気通信有線電気通信設備の設置の態様は，単独設置，共同設置及び
7,に付け，心身共に健全で，有為な社会の一員として育成されるよう，次の諸施策を講じている。（１）啓発広報活動国民一般が正しい人権意識を持ち，その高揚を
8,は，ＬＰＧタンク，エチレン製造設備等の高圧ガスプラントの耐震構造化を図るため，特殊法人高圧ガス保安協会に委託して，以下の諸施策を推進する。ａ高圧ガスプラント耐震設計認定委員会運営学識経験者から成る専門の委員会を設置し，新設される高圧ガスプラントが
9,労働者のための各種施設の整備及び運営、失業対策等の施策を行っている。これらの諸施策に要する経費である労働費の決算額は四千三百六十一億円で、歳出総額の０．９％（都道府県０．８％、市町村０．８％
10,ます。農林水産省におかれましても、供給の安定とそれによる価格安定を期待するための諸施策を講じておられますことは認めます。しかし、その施策が十分な効果を発揮し
11,）土地の有効利用の促進―総合的な土地利用計画の整備・充実と土地の有効利用のための諸施策の推進―土地の有効利用に向けては，総合的な土地利用計画を整備・充実するとともに，都心居住
12,の建設、整備等を行うとともに、これらの施設の維持管理を行っている。これらの諸施策の推進に要する経費である土木費の決算額は二十三兆三百二十八億円で、歳出総額に占める割合は二十三．三％（
13,六十年４月現在では百四十五施設）。さらに，海洋汚染防止思想の普及・啓蒙及び関係法令の周知徹底を図るための諸施策を講じている。（浄化対策）海洋の浄化対策として，港湾区域内においては堆積汚泥の浚渫，
14,を目標年度とする総量削減基本方針に基づき総量削減計画が定められ、下水道の整備、総量規制基準の適用等の諸施策が実施されてきている。その実施状況をみると、ＣＯＤの発生負荷量は、東京湾、伊勢湾
15,職業訓練の充実、労使関係の安定、労働者のための各種施設の整備、運営及び失業対策等の諸施策を推進し、労働者の福祉向上に努めている。これら諸施策に要する経費である労働費の決算額は
16,５つを掲げている。また，今後の施策推進の主要な課題として，在宅生活支援のための諸施策の充実，障害の重度化・高齢化への対応，親亡きあとの対策の充実，社会活動への
17,都市緑化対策の推進）都市の緑化を総合的に推進するためには、緑のマスタープランに基づく諸施策の推進と併せて、道路、河川等公共公益施設の緑化及び市街地の約５割を占める民有地の緑
18,，湖沼等については，「水質汚濁防止法」，「湖沼水質保全特別措置法」等に基づき，適切な水質が確保・保全されるよう諸施策を実施する。６土壌汚染対策農用地の土壌汚染対策については，引き続き「農用地の土壌の汚染防止等
19,係る対策を推進するとともに、し尿・ごみなど一般廃棄物の収集、処理等、住民の日常生活に密着した諸施策を実施している。これらの諸施策の推進に要する経費である衛生費の決算額は６兆四千七百四十五億円で
20,ための各種福祉施設の整備及び運営、生活保護の実施等の施策を行っている。これらの諸施策の推進に要する経費である民生費の決算額は十三兆四千四百五十四億円で、前年度と比べると５．７％増（前年度
21,ライフステージに応じた各種施策を整備することとしており，今後，これらの計画に掲げた諸施策の実現に向けて，県と市町村が一体となって取り組むこととしております
22,国民の生命、身体及び財産を保護することなどが警察行政の内容である。これらの諸施策に要する経費である警察費の決算額は３兆四千五百六十六億円で、前年度と比べると１．０％増（前年度１．２％増）
23,一般廃棄物の収集、処理等、住民の日常生活に密着した諸施策を実施している。これらの諸施策の推進に要する経費である衛生費の決算額は６兆四千七百四十五億円で、歳出総額の６．５％（都道府県３．８％、
24,特色を生かしながら個性的な教育研究がどんどんできるように、私学振興につきましていろいろな諸施策を講じていきたい、そういうふうに思っております。○山元委員政務次官は。○河村政務次官
25,は、住民の健康を保持増進し生活環境の改善を図るため、各種医療対策、公衆衛生、精神衛生対策等の諸施策を推進するとともに、し尿・ごみ等一般廃棄物の収集、処理、さらには公害対策の推進等住民の日常生活に密着した
26,緩やかなものにとどまる一要素となっていること等の状況を踏まえ，新総合土地政策推進要綱に示された諸施策を具体化するとともに，さらなる土地の有効利用促進策が取りまとめられている。また，これらの施策を通じて土地取引
27,の建設、整備等を行うとともに、これらの施設の維持管理を行っている。これらの諸施策の推進に要する経費である土木費の決算額は二十一兆三千三百四億円で、前年度に比べると５．１％減（前年度
28,夜間事故，高速道路の事故等が依然として多発していることなどを踏まえて，次の諸施策を強力に推進する。ア自動車乗車中の死傷者数の減少方策昭和六十三年以降急増傾向にある自動車乗車中の
29,）へき地教育国は，へき地教育振興法（昭二十九法百四十三）に基づき，スクールバス等購入費の補助等へき地学校に対する諸施策を講じて教育水準の維持向上を図っている。また，へき地学校の教育内容及び指導方法の充実
30,たようなことでございまして、やはり最後のとりでといいますか、地法あるいは諸施策を活用した上で、力足らずあるいは及ばず生活費がその分足りないという場合に
31,ための各種福祉施設の整備及び運営、生活保護の実施等の施策を行っている。これらの諸施策の推進に要する経費である民生費の決算額は十一兆九千七百九十九億円で、歳出総額に占める割合は十二．一％（
32,全国の都市地域において１万分の１地形図及び空間データ基盤を整備している。このほか、防災、環境保全、地域開発等の諸施策に資する地理調査を実施し、各種の主題図を作成している。また、高度情報化社会に対応し、地図
33,いけない。つまり、ここの文章表現をかりると「児童、生徒等の健康の保持増進に関する諸施策を総合的に推進することは、文教行政の重要な課題となっております。」、こう
34,は，救急搬送に係る傷病者の救命効果の向上を図るため，救急業務の高度化のための諸施策を積極的に推進した。（国費七千四百七十九千円）（三十三）救助資機材等総合整備の推進消防庁
35,総合的，計画的に推進することにした。鉄軌道，海上及び航空交通における事故は，これらの諸施策の推進によって，全体として横ばいないし減少傾向にあるが，昭和六十年８月の日航機墜落事故のよう
36,の心身の健全な成長・発達と生活保障のために、子どもを取り巻く多くの生活福祉課題を解決する諸施策を立案し、法制化しなければならない。これらの施策を実践する仕組みが、児童福祉行政のサービス供給体系である。
37,。そこで，それらの営業に対しては，環境衛生関係営業の運営の適正化に関する法律に基づく諸施策により衛生施設の改善向上，経営の健全等を通じて衛生水準の維持，向上を図っている。一方，
38,でありますが、最近の国際情勢、厳しい財政事情などを勘案いたしまして、国の他の諸施策との調和を図りながら、効率的で節度ある防衛力の整備を進めるための必要最小限の経費
39,ための各種福祉施設の設備及び運営、生活保護の実施等の施策を行っている。これらの諸施策の推進に要する経費である民生費の決算額は十二兆七千二百十五億円で、前年度と比べると４．３％増（前年度
40,の総合的な整備及び保全を図るための計画であり、緑地に関する規制、誘導、整備等の諸施策を推進するための指針となるものである。緑のマスタープランは、都市の骨格の形成
41,）‐二十一図事業種類別重大事故件数Ⅰ‐（Ⅱ）‐二十二図原因別重大事故発生件数第２節安全確保のための諸施策１自動車検査等の充実強化（１）自動車検査の充実自動車の構造，装置に起因する
42,を反映している。また，心身障害の早期発見，早期治療の重要性にかんがみ，そのための諸施策が推進されているところであるが，これに伴い相談件数の低年齢化の傾向がみられる。
43,また，既存化学物質の点検作業もようやく軌道に乗ってきつつある。現在は，これら化学物質に関する諸施策の体系化を行っていく段階に入っている。その際，国内国外を問わず，化学物質に関する
44,つつ、最近の石炭鉱業をめぐる環境の変化に対応して、その長期安定化のために必要な諸施策の総合的推進と石炭対策財源の確保に努めるとともに、本法施行にあたり、次の諸点について適切な措置
45,実態等に応じた種々の工夫改善が進められている。（３）教育課程改善・充実のための諸施策文部省では，学校における取組を推進するため，各学校段階ごとに，教育課程運営改善講座等の各種研修会の実施
46,係る対策を推進するとともに、し尿・ごみなど一般廃棄物の収集、処理等、住民の日常生活に密着した諸施策を実施している。これらの諸施策の推進に要する経費である衛生費の決算額は５兆千百十一億円で
47,修正。連結営業利益を六千万円から七千五百万円（前年同期比三十一．八％減）に引き上げた。受注時の採算性強化などの諸施策が奏功し、工事利益率が改善した。なお、通期業績予想は据え置いており、変更がある場合は
48,２年５月二十八日，交通対策本部において「大都市における駐車対策の推進について」を申し合わせ，これに基づく諸施策を推進しているほか，放置駐車違反対策の推進，自動車の保管場所の確保の継続的履行のための制度
49,（平成３年度〜７年度）においても，７年中の交通事故死者数を１万人以下とする目標を掲げ，諸施策を推進したが，昭和六十三年以降８年連続して１万人を上回り，同計画の目標を達成することは
50,展開するのに当たって重要な役割を果たしうるとの認識が強まり，システムの開発，普及に関する諸施策と相まって，ＰＯＳを導入する小売店の増加をもたらしており，小売業界全体としてＰＯＳ導入意欲はかなり高く
51,を促進いたしますとともに、さらに街路、公園等の都市施設の整備によるオープンスペースの確保等の諸施策を行ってまいりまして、都市構造の防災化に努めてまいる所存でございます。○
52,られる建設業の労働条件・福祉の向上を図り、良質な建設労働力を確保するため、次のような諸施策を講じた。イ建設労働者の労働条件・福祉の向上のための施策１建設労働者の労働条件
53,を支えていただいて成り立っている経済であるわけですから、そういう部分では相当思い切った諸施策というものを根本的にビジョンとして打ち出さないと、日本の経済自体が環境と時短だと
54,の取組を積極的に支援していくこととしている。２教育委員会の活性化教育行政の諸施策を総合的にかつ効果的に推進するためには，国と地方とが一体となってこれ
55,は，引き続き「農用地の土壌の汚染防止等に関する法律」等に基づき公害防除特別土地改良事業等の対策事業をはじめとする諸施策を実施する。また，市街地の土壌汚染については，事業者等の自主的な取組みによる環境基準の
56,されていると聞いておりますので、本法を含めたいわゆる町づくり三法が十分機能するよう諸施策の実施をお願いをいたします。製造業分野におきましては、現在、大手製造業等が海外
57,，沖縄の地域特性を生かし，自然環境の保全や地域社会との調和に配慮した観光振興に関する諸施策を推進する。また，六十一年十一月には首里城正殿の復元を含め首里城跡地を国営沖縄記念公園首里城地区として整備する
58,）（５）九十年度ＯＤＡ予算第４次中期目標の３年目に当たる九十年度ＯＤＡ予算は、同目標に盛り込まれた諸施策を着実に実施するため、一般会計予算で前年度比六百十八億円増（８．２％増）の八千百七十五億円を計上している。また
59,警察をはじめとする関係機関が国民と一体となって推進してきた少年非行防止に向けた諸施策が効果を挙げ始めたためと見られる。しかしながら，少年非行は，基本的には依然と
60,の経営規模の拡大，農用地の有効利用の促進，水田利用の再編，地域農業の組織化等に資する諸施策を総合的に推進する。１農用地利用増進特別対策事業の実施等（１）農用地利用増進特別対策事業我が国農業の体質
61,を極力下げる方向で努力する。ヨーロッパにおきましては、これは雇用確保のための諸施策、そういうようなことをそれぞれの国が着実に実行に努めていく。そういう
62,配慮する。また，その具体的実施に際しては，そのときどきにおける経済財政事情等を勘案し，国の他の諸施策との調和を図りつつ行う。このため，隊員の充足，士気高揚，防衛施設の有効
63,いたしましても、中央心身協が昨年八月に意見具申をいたしました「生活安定のための諸施策の推進」ということに十分こたえているとは言えないと思うんです。今後一層努力
64,を平成十年４月に全面改定した。また，試験研究・教育機関の施設整備及び都市機能の充実・強化等のための諸施策を実施するとともに，改定建設計画等の推進のための調査を実施した。９関西文化学術研究都市の建設
65,と安全会を統合して新しくつくるということは、「児童、生徒等の健康の保持増進に関する諸施策を総合的に推進する」ということのために行われるんだというふうに文脈上から理解できるんです
66,情報収集，提供を効率的に行なうことにより，文化財保護のための調査研究及び保存・活用のための諸施策に役立てる必要がある。このことは，文化財研究所や埋蔵文化財センター等の文化財に関する教育研究の円滑な
67,提供等の諸施策を講じていく必要がありますが、現行手数料のもとでは、これらの諸施策はなし得ない状況にございます。このような事情から、平成十年四月一日から、
68,を図るため、生産基盤の整備、農産物消費流通対策、総合農政対策等の施策を実施している。これらの諸施策の推進に要する経費である農林水産業費の決算額は３兆九千四百十五億円で、歳出総額の７．７％（都道府県十一．〇％、
69,これらの施設の効用を十分発揮させるために必要な維持管理を行っている。これらの諸施策の推進に要する経費である土木費の決算額は十兆二千六百十六億円で、歳出総額の二十．一％（都道府県十八．八％、
70,を図るため、職業能力開発の充実、労働者金融対策、失業対策等の施策を行っている。これらの諸施策に要する経費である労動費の決算額は四千八百四十九億円で、前年度と比べると４．２％減（前年度６．５％減）
71,、（財）日本住宅リフォームセンターの活用により、リフォーム関連技術開発の促進、増改築相談員の養成、増改築推進キャンペーンの全国展開等リフォーム促進のための諸施策を講じてきたところである。六十一年度においても、引き続き、キャンペーンの実施をはじめ、リフォーム促進の
72,実施して、旅行業取引に関し国民から広く意見を徴し、これを旅行業法の施行に当たっての諸施策に反映させることにした。３（社）日本旅行業協会及び（社）全国旅行業協会は、四十七年４月の運輸大臣の指定に
73,では、昭和六十三年以降の情報化施策の評価を行うとともに、情報化施策を中心とする今後の諸施策の推進に資するための意見、要望等の収集を行うため、市民、事業所等に対してアンケート調査を
74,の応用のための研究開発が，日本原子力研究所等において実施された。原子力委員会は，これら原子力開発利用に関する諸施策の進め方について，昭和四十二年に改訂した原子力開発利用長期計画の中で示したが，原子力の安全確保
75,である。各年度の防衛力整備については、その時々における経済財政事情等を勘案し、国の他の諸施策との調和を図りつつ、「大綱」に定める防衛力の水準を着実に達成すること
76,問題行動を，青少年を取り巻く様々な側面から調査・分析することにより，今後の非行対策及び青少年に関する諸施策の基礎資料とすることを目的として，平成十一年度に実施したものである。（
77,を進める上で重要なことであるため、五十八年度には、五十七年度に引き続き次のような諸施策を講じた。１主要建設資材の需給及び在庫状況を調査するとともに価格の動向を早期に
78,推進するため、水質総量規制の実施、富栄養化対策等第１章第８節で述べた対策を推進するとともに、以下の諸施策を講じた。１環境基準の設定水質に係る環境基準は、水質保全行政の目標として
79,指導育成、工業団地の建設、消費流通対策、観光施設の整備等各種の施策を行っている。これらの諸施策の推進に要する経費である商工費の決算額は１兆二千二百五十七億円で、歳出総額の３．７％（都道府県４．７％、
80,した邦人の海外への発展に対応して，在留邦人の重要関心事である子女教育，医療等について諸施策の充実に努めるとともに，在留者及び旅行者の保護・援助に最善をつくしている。こういう努力
81,各種研修会の実施，教師用指導資料の作成，教育課程研究指定校等の各種研究指定校の指定とその研究成果の普及などの諸施策を行っている。また，教育課程の改善充実のためには，不断の実施状況の把握
82,、構造改善、消費流通対策、農林漁業に係る技術の開発・普及等の施策を実施している。これらの諸施策の推進に要する経費である農林水産業費の決算額は６兆七千七百八十七億円で、歳出総額に占める割合は６．９％（
83,の上に立って，各種施策の費用効果の検討を行い，最適な実施計画に基づいて諸施策を推進していかねばならない。第３‐１図窒素酸化物の発生源第３‐２表硫黄酸化物対策と窒素酸化物対策の経過等２
84,講ずる。」こういうようになっております。「政府としては、」こういう「諸施策を一体として推進しつつ、」「可能な限り景気に配慮するよう努めることにより、」
85,の諸施策を推進するとともに、し尿・ごみ処理施設の整備、更には公害対策の推進等、住民に密着した諸施策を積極的に講じている。これらの諸施策の推進に要する経費である衛生費の決算額は
86,ニーズの高いゆとりある生活空間の実現等を目指して，土地の有効利用・取引の活性化に向けた諸施策を一層推進していくことが必要である。（土地政策審議会提言）最近の社会経済構造の変化を踏まえ
87,の総合治水対策特定河川については，総合治水対策特定河川事業による河川改修の重点的実施，流域の保水・遊水機能の確保等，流域整備計画に基づく諸施策を実施する。また，上記十七河川以外の河川においても，浸水予想区域及び浸水実績の公表を推進する。
88,し尿・ごみなど一般廃棄物の収集・処理等、住民の日常生活に密着した諸施策を実施している。これらの諸施策の推進に要する経費である衛生費の決算額は６兆七千二百二十三億円で、前年度と比べると１．１％増（前年度
89,に決定すべきである。ただし、働く女性が改姓により社会的不利益を被ることのないように諸施策を講じていく必要がある。例えばクレジットカード・銀行カード・その他の役所の公文書等に旧姓使用を認める
90,。しかも、これを早期に完成させまして、さらにはオンラインによる登記情報の提供等の諸施策を講じていく必要がありますが、現行手数料のもとでは、これらの諸施策はなし得
91,が，千数百万ＫＷにも達している我が国の現状にかんがみ，これまで安全委員会の講じた諸施策を顧みてこれを評価するとともに，今後の課題に関し，述べることとしたい。
92,が、終生変わらず最も力を傾注されたのは農業の振興とそのための諸施策の拡充でありました。君は、常々、農村の青年が明るい希望を持って
93,残る、そういう公共事業を選択しておるわけなんでありまして、私は、政府のこの諸施策、この方が合理的、効果的であると、こういう見解でございます。自余の問題
