,0
94,事故防止に対する意識の高揚，交通規制の強化，道路環境の整備，自動車の安全基準の強化等の諸施策の効果が現われ始め，四十五年，四十六年を境に，交通事故件数，死者数，負傷者数とも減少の傾向を
95,心身障害者福祉施設等の整備、運営や生活保護の実施等社会福祉向上のための施策を推進している。これらの諸施策の推進に要する経費である民生費の決算額は３兆七千三百六十七億円で、歳出総額の十一．二％（都道府県６．０％、
96,の間での市民レベルによるスポーツの国際交流事業等に対し補助を行い，地域におけるスポーツ振興のための諸施策の推進に努めている。さらに，近年，誰でも気軽に参加し，楽しめるスポーツ・レクリエーション
97,なるアナログ周波数変更対策の着実な実施、国民への周知広報の一層の強化、放送事業者の支援等の諸施策を積極的に実施している。図表１「第４次行動計画」に基づく各関係者の具体的取組■地上テレビ放送事業者
98,を通じる健康管理体制の強化、健康づくりの基盤整備、健康づくりの啓蒙普及の三本柱を中心として諸施策を総合的に推進するものでありますが、その一層の充実に努めることといたしております
99,今後の漁業生産の在り方を中心として水産物の需給の安定化のために必要な諸施策の方向についてみていこう。１周辺水域の見直しと活用我が国の周辺水域は
100,を確保することを目途として，新たな削減目標を設定し，その達成に向けて諸施策を講じていく必要があり，六十年十月二十一日環境庁長官から中央公害対策審議会に対して諮問を行う等総量削減基本方針の策定について
101,の検診機関の設置、水俣病の認定業務の促進に関する臨時措置法に基づく国における認定業務の実施等の諸施策を講ずるほか、認定審査が長期にわたっている申請者に対して医療費の自己負担分等を補助する治療研究事業、棄却者
102,の建設、整備等を行うとともに、これらの施設の維持管理を行っている。これらの諸施策の推進に要する経費である土木費の決算額は十四兆八千五十七億円で、歳出総額の二十二．三％（都道府県二十．八％、
103,「芸術文化振興基金」が設立されるとともに、「（社）企業メセナ協議会」が発足し、それまでの国及び地方公共団体の諸施策とあいまって、公・私による文化芸術への支援が格段に充実するようになった
104,指導育成、工業団地の建設、消費流通対策、観光施設の整備等各種の施策を行っている。これらの諸施策に要する経費である商工費の決算額は２兆二百五億円で、歳出総額の４．０％（都道府県５．１％、市町村２．５％
105,４教育，文化，医療機能の整備，５観光レクリェーションの振興，６交通通信体系の整備等の基本的課題について，諸施策を総合的かつ体系的に推進することとしている。各地方開発促進計画の推進を図るため，各種施設
106,ための各種福祉施設の整備及び運営、生活保護の実施等の施策を行っている。これらの諸施策の推進に要する経費である民生費の決算額は９兆三百十五億円で、歳出総額の十．八％（都道府県６．１％、
107,，勤労青少年の自由時間（余暇）活動の充実を通じて，職業生活に資することを目的とする諸施策を実施している。具体的には，ボランティア活動等の社会参加の促進のための講座を重点に
108,発展に伴い、大気汚染、水質汚濁、騒音・振動、地盤沈下、悪臭等の公害問題が生じ、これに対する諸施策の強化が緊要となってきている。このため、地方公共団体は公害の監視、測定体制
109,そうに聞こえるが日本の県知事を想像してはいけない。徴税や犯罪取り締まり以外の、社会生活に必要な諸施策はすべて村々の有力者（郷紳という）の自治に任されていたのである。（
110,甘味資源作物「甘味資源特別措置法」に基づいて指定した生産振興地域を対象として，次の諸施策によりてん菜及びさとうきびの生産振興を図った。てん菜については，糖分の向上を図る
111,の諸施策を推進するとともに、し尿・ごみ処理施設の整備、更には公害対策の推進等、住民に密着した諸施策を講じている。これら諸施策の推進に要する経費である衛生費の決算額は１兆九千三百十五億円で、歳出総額
112,によって適正な家賃の良質な民間賃貸住宅の供給を誘導するため，公的資金による低利融資，利子補給等の諸施策を実施している（表３‐４‐１）。なお，大都市地域において，高齢者等の
113,の整備，商業・業務機能の充実，工業団地等新たな市街地の整備，都市の管理運営体制の確立等の諸施策を推進する。昭和六十二年度においては，土地利用の促進，新たな開発立地に伴う関係機関の
114,、所要の事業量を確保するため予算額の増額等を図る一方、義務教育費国庫負担金等の見直しを行う等諸施策を推進することとしております。科学技術の振興につきましては、我が国社会経済
115,、しっかりと未来を展望した基盤づくりが進められるよう、市長部局との連携を深め、諸施策を推進します。市民の皆さん、市議会議員の皆さんのご理解とご協力をお願いします。
116,の安定及び福祉の増進を図るための事業ロ北方地域元居住者が北方領土問題の解決のための諸施策の推進を図る上において特別の地位にあることについての認識を深めるのに資する
117,しておりまして、近々設置する防衛調達制度調査委員会における検討や、自衛隊員の再就職のあり方の検討等、諸施策の推進に全力を挙げて取り組むことを明らかにしておるところであります。今後、
118,精神衛生等に係る対策を推進するとともに、し尿・ごみなど一般廃棄物の収集・処理等、住民の日常生活に密着した諸施策を実施している。これらの諸施策の推進に要する経費である衛生費の決算額は６兆七千二百二十三億円で
119,処理、さらには公害対策の推進等住民の日常生活に密着した諸施策を実施している。これらの諸施策の推進に要する経費である衛生費の決算額は３兆千二百二十一億円で、歳出総額の６．１％（都道府県４．１％、
120,更には公害対策の推進等、住民に密着した諸施策を積極的に講じている。これらの諸施策の推進に要する経費である衛生費の決算額は１兆五千六百五十八億円で、歳出総額の６．８％（都道府県５．２％、
121,の推進，良質な住宅・宅地の整備の促進，土地情報の整備・提供等の各般にわたって，具体的な諸施策が盛り込まれている。このような背景の下に，平成十年度の土地税制改正において，
122,十七の総合治水対策特定河川について，総合治水対策特定河川事業による河川改修の重点的実施，流域の保水・遊水機能の確保等，流域整備計画に基づく諸施策を実施する。また，上記十七河川以外の河川においても，浸水予想区域及び浸水実績の公表を推進する。
123,を図るため、中小企業の指導育成、企業誘致、消費流通対策等各種の施策を実施している。これらの諸施策の推進に要する経費である商工費の決算額は６兆二千六百五億円で、前年度に比べると十六．五％増（前年度
124,みるに至った。１環境基準の設定等（１）環境基準航空機騒音公害防止のための諸施策の目標となる「航空機騒音に係る環境基準」が四十八年十二月二十七日に定められた。同基準
125,向けて創造的で活力ある社会を築いていくために，教育及びこれに関連する分野に係る諸施策に関して幅広い観点から審議を行い，４次にわたる答申を提出して昭和六十二年８月に３年間の
126,のある中小企業が生き残れるために、政府におかれましては、今後とも中小企業振興のための諸施策を一層拡充強化していただきますようお願いを申し上げまして、私の意見陳述を終わらせていただきます
127,の国家意識、「国体」意識の高揚を利用して、財源等種々の障害によってこれまでなかなか実現できなかった諸施策を、一気に実現する絶好の好機として位置づけておこなったのである。先に県知事が各部課
128,。○政府委員（高石邦男君）日本学校健康会として、両法人を統合いたしまして子供の健康保持増進のための諸施策を展開する一歩前進であるということはもちろん考えるわけでございますが、そのほかに、文教施策全般
129,の規模については，大綱には，そのときどきにおける経済財政事情等を勘案し，国の他の諸施策との調和を図りつつ行うものとするとの基本的指針が示されている。しかし
130,単に事務職員のみならずサービス労働者も含まれる。ホワイト・カラー労働者も含んだ勤労者を対象にした人的資源管理の諸施策が検討される。第２に，雇用形態が多様化し，多様な雇用関係を前提とした
131,節目としつつ，「文化発信社会」の構築に向けて，今後，文化振興のための諸施策を一層推進していくことが強く望まれるものである。３文化行政に求められている役割
132,知的クラスター創成事業」を実施している。ここでは、国が実施している地域における科学技術振興を支援する諸施策を中心に概観する。第３‐３‐十四表地方公共団体における科学技術審議会等の設置状況第３‐３‐
133,障害のある人の連絡の利便を図ることなどが挙げられる。こうした諸施策が有効に行われるように，警察部内では，職員が障害のある人からの
134,信頼を回復すべく、綱紀の粛正及び規律の保持を徹底するとともに、以上述べました諸施策の推進に全力を挙げて取り組んでいくことを申し上げまして、私の報告にかえる
135,久保氏によれば、広義の安全保障というのは、国防会議の機構の改革、防衛関連の諸施策、防衛に直接関係のある核の問題、領海幅員問題と安全保障、民間防衛、防衛産業、資源問題
136,な消防防災体制の確立等消防力の充実強化を図るとともに、救急救助体制の整備に努めている。これらの諸施策の推進に要する経費である消防費の決算額は八千六百七十二億円で、歳出総額の１．７％（都道府県０．４％、
137,海防法の規制内容の周知徹底、海洋汚染防止思想の普及・啓蒙を引き続き行うとともに、規制を円滑に実施するための諸施策を講じていくこととする。（２）海洋汚染監視測定等環境庁においては、日本周辺を流れる
138,（平成３年度〜７年度）においても，７年中の交通事故死者数を１万人以下とする目標を掲げ，諸施策を推進したが，昭和六十三年以降８年連続して１万人を上回り，同計画の目標を達成することは
139,を図るため、職業能力開発の充実、労働者金融対策、失業対策等の施策を行っている。これらの諸施策に要する経費である労働費の決算額は五千四百十億円で、歳出総額に占める割合は０．５％（都道府県０．６％
140,なければならない点は、今日も従来と同様である。加えて現在は、景気回復に資するための諸施策を機動的、弾力的に実施することが要請されている。上記のような厳しい財政事情の
141,、構造改善、消費流通対策、農林漁業に係る技術の開発・普及等の施策を実施している。これらの諸施策の推進に要する経費である農林水産業費の決算額は６兆三千八百二十四億円で、前年度と比べると１．４％減（前年度
142,よる校舎の破却、明和法論・三業惑乱と学内外にわたる大事件を経験するが、その都度これに対応する諸施策が講ぜられ、制法が発せられた。その中でも、とくに文化四年（千八百七
143,これらの施設の効用を十分発揮させるために必要な維持管理を行っている。これらの諸施策の推進に要する経費である土木費の決算額は６兆八千百二十三億円で、歳出総額の二十．四％（都道府県十九．四％、
144,べきでない。（ロ）天然ガスの重要性を認識しつつその供給攪乱に対する脆弱性を低減するための諸施策を検討する。（ハ）産油国と消費国との間での相互理解を深めるための接触強化
145,考慮し、各年度の防衛力整備の具体的内容は、その時々における経済財政事情等を勘案し、国の他の諸施策との調和を図りつつ、柔軟に決定するのが適当であり、中期の防衛力整備の見積り
146,甘味資源作物「甘味資源特別措置法」に基づいて指定した生産振興地域を対象として，次の諸施策によりてん菜及びさとうきびの生産振興を図る。てん菜については，合理的な輪作体系を確立し，
147,の交通事故を防止するため，「高齢者の交通安全総合対策について」（昭和六十三年交通対策本部決定）等に基づいた諸施策を積極的に推進する。特に，幅の広い歩道，エスカレータ等が付いた利用しやすい立体横断施設，弱者感応化信号機等高齢者
148,円滑の確保にも配慮することとする。高速走行抑止システム２第５次交通安全基本計画における目標１に掲げる諸施策を総合的かつ強力に推進することにより，交通事故の増加傾向に歯止めを掛け，特に死亡事故の
149,定めた第５次交通安全基本計画が作成され，３年度から７年度までの今後５年間，この計画に基づいた諸施策を官民一体となって，また，総合的かつ計画的に推進することとした。ここ
150,つきましては、これまで第一次及び第二次の振興開発計画の推進を通じまして総合的な諸施策が講じられました結果、沖縄の経済社会は社会資本の整備を中心として総体
151,のは本当にあってはならないことだろうと思います。そういうことを考える上から、諸施策についでひとつ着実にお進めいただきたいということを申し上げているわけであります。次に、時間
152,ますとかあるいは高性能林業機械の導入促進あるいは就労条件の改善、労働環境の改善等を重点とした諸施策を講じておるところでございますけれども、特に平成五年度におきましてはこれまで
153,、構造改善、消費流通対策、農林漁業に係る技術の開発・普及等の施策を実施している。これらの諸施策の推進に要する経費である農林水産業費の決算額は５兆千三百六十億円で、歳出総額の６．１％（都道府県８．４％、
154,を生かした緑のマスタープランの策定を推進し，これに基づき緑地の整備，保全の諸施策を積極的に講ずる。（３）都市公園五十一年度を初年度とする第２次都市公園等整備五箇年計画を策定し
155,高速教習の積極的推進，長距離バス，トラック等の運行管理の充実などを推進する。なお，以上の諸施策を推進するに当たっては，特に大都市や地方中核都市において慢性的な交通混雑，交通渋滞が発生していることに
156,、例えば国内のみならず海外にも通用する中小企業のブランドの確立をするためのジャパン・ブランド育成支援事業を始めとする諸施策の更なる強化拡充をお願いいたします。最後に、商工会が抱える課題について、要望を踏まえて
157,充実・強化を図る等，我が国内外の研究開発拠点として活力と魅力ある都市の熟成を図るための諸施策を推進した。また，本都市の将来都市ビジョンである「新つくば計画」を指針として，さらに
158,から営業用へのトラック輸送の転換，共同輸送等物流合理化施策の推進等の交通総量の削減対策等の環境改善のための諸施策について積極的に検討を進めていくこととしている。（メタノール自動車導入のための施策の推進
159,協業の推進，林産物の生産流通，林業従事者の福祉の向上及び養成確保等の林業経営改善合理化対策その他の諸施策を総合的，計画的に行う中核林業振興地域育成特別対策事業を新たに実施することとし，五十一年度には三十四県四十地域について
160,が進出している。現在、都市機能の一層の充実と、国内外の科学技術振興・新産業創出拠点形成のための諸施策を推進している。（２）関西文化学術研究都市関西文化学術研究都市（京都府、大阪府、奈良県）は、創造的
161,と体の健康に関する種々の問題が生じており、児童、生徒等の健康の保持増進に関する諸施策を総合的に推進することは、文教行政の重要な課題となっております。」というくだり
162,の諸施策を推進するとともに、し尿・ごみ処理施設の整備、更には公害対策の推進等、住民に密着した諸施策を講じている。これら諸施策の推進に要する経費である衛生費の決算額は２兆千四百三十五億円で、歳出総額
163,から支援し，奨励することであり，人材の発掘・養成，組織づくり等を始めとする生活文化振興のための諸施策を推進していく必要がある。（６）国語に関する施策の推進社会状況の移り変わり
164,四％成長達成のための政策いかんということでございますが、ただいま申し上げましたような諸施策、さらに本年度の経済の動向も見据えまして、適切かつ機動的な財政と金融の
165,の国民が安心して医療を受けられるためには，良質で効率的な医療を提供するための諸施策の推進とともに，医療費を保障する医療保険の全制度を通じた給付と負担の公平化
166,た産炭地域における雇用の安定対策の確立に努めること。五、産炭地域の活性化のための諸施策について、自治体等との連携のもとに、企業誘致の推進を含めて総合的な産業分野の
167,，国土利用計画法に基づく届出勧告制の改善（平成十年６月）など，法制度の見直しを含めた諸施策が推進されているところである。また，これらの緊急に実施すべき措置の他に
168,ことを目的として全国警察駅伝大会を実施するなど，警察職員の基礎体力を充実，向上させるための諸施策を推進した。（４）勤務ア制度警察の果たすべき治安維持の責務
169,な経営戦略とする企業の雇用・人事戦略の一環として，成果主義化，報酬の短期決済化，労働力流動化などの諸施策を企業に導入することで，企業経営を柔軟な構造に作り変えようとしたものである。
170,を図るため、中小企業の指導育成、企業誘致、消費流通対策等各種の施策を実施している。これらの諸施策の推進に要する経費である商工費の決算額は５兆六千六百二十二億円で、歳出総額に占める割合は５．７％（
171,住民の健康を保持増進し生活環境の向上を図るため、各種の医療対策、精神衛生対策、食品衛生対策等の諸施策を推進するとともに、し尿・ごみ処理施設の整備、更には公害対策の推進等、住民に密着した諸施策を
172,，前述のような文化行政の役割を前提としつつ，「文化発信社会」を目指し，諸施策の推進を図っていくことが求められている。４これからの文化政策の方向（
173,これらの災害の防除と被害を軽減することなどが消防行政の内容である。これらの諸施策に要する経費である消防費の決算額は１兆九千十二億円で、前年度と比べると１．２％増（前年度１．４％増）
174,カドミウム汚染米被害については，農用地の機能回復，農業経営の維持等農業政策やその他の観点から，総合的に諸施策を検討していく必要がある。
175,立地条件に起因する炭鉱間格差の是正を図るため、安定補給金の傾斜配分を含め、石炭鉱業経営安定化のための諸施策の推進に努めること。三、最近における石炭需給環境の変化に対応して鉱業権消滅鉱区の再開発について
176,原子力開発、国内炭、水力、地熱等の国内エネルギー資源の活用、電力の長期安定的供給確保のための電源開発等の諸施策を総合的に推進してまいりたいと考えております。また、揮発油販売業の健全な発達と
177,た「全国子どもプラン（緊急３ヶ年戦略）」を策定し，関係省庁の協力を得ながら緊急かつ計画的に諸施策を推進しているところであるがその一環として実施している「子ども地域活動促進事業」において，障害のある子供たち
178,結果を公表する。また、地球環境の保全を図るため建設省環境策大綱の理念を実践に移す諸施策を実施していく。さらに、建設リサイクル推進計画’九十七の行動計画の実践とフォローアップを行う。〈
179,整備及び運営、老人医療費の公費負担、生活保護の実施等の施策を行っている。これらの諸施策の推進に要する経費である民生費の決算額は５兆七千四百五十三億円で、歳出総額の十一．二％（都道府県５．８％、
180,含んだ救急課程の円滑な実施や救急振興財団等における救急救命士の着実な養成が行われるよう、諸施策を推進してきている。そのほか、全国救急隊員シンポジウムや日本臨床救急医学会等の研修・研究機会を通じて、救急隊員の全国的な
181,。新総合土地政策推進要綱の決定以降，同要綱に基づき，土地の有効利用や土地取引の活性化に向けた諸施策が推進されてきている。実施に移された主な施策を挙げると，都市計画法・建築基準法の改正
182,職業訓練の充実、労使関係の安定、労働者のための各種施設の整備、運営及び失業対策等の諸施策を推進し、労働者の福祉向上に努めている。これら諸施策に要する経費である労働費の決算額は
183,ております。各省との連携のもとに、各般のそういった健全育成のための諸施策を進めているところでございます。○東（祥）委員揚げ足を取るわけでは
184,目的とされ、第二次十ヵ年計画では特色のある産業の振興に重点をおいた諸施策が実施された。しかし第二次振興計画が終了した千九百九十一年における沖縄の県民所得は全国平均の七十二％
185,。第８節瀬戸内海環境保全対策の推進五十九年度においては，「瀬戸内海環境保全特別措置法」及び「瀬戸内海環境保全基本計画」に基づく諸施策を引き続き講ずることにより，環境保全対策を推進することとしている。また，これらの施策
186,第２節文化振興への取組―これまでとこれから―文化の振興を図るための諸施策の立案実施を担当する行政組織として，国においては文化庁が，関係行政機関等の協力も得ながら文化
187,持っております。そのため、物価の安定を推進していくためにはこうした各種の諸施策を総合的に積み重ねていくことが必要であるわけでございます。こうした経費が具体的
