,0
221,なくては三途の川を渡れない、あの世へ行っても両親に会えない、非難ごうごう。もっとひどいのは売名行為だ、選挙にでも出るのか、などいろいろ言わ
222,よじって男性の手から逃れ、再び歩きだした。自分の背中に威厳に満ちた非難が漂っていればいいと願いながら。その一方で、彼女は振り返ってもう一目彼を
223,のシーズン中に、選手たちを率いて五十日を越すストライキを敢行したが、予想どおり轟々たる非難を浴び、球団側はミラーこそ試合を駄目にしている元凶だと言い張った。
224,のは当たり前なんです。それを、男はスケベでしょうがないというような非難の仕方をされると、男は黙っていますが実に恨めしいし、傷つくのです
225,があるのではないか、ということを私なりに解釈してみました。栃木県警は石橋事案で非難を浴び、種々の込み入った事情もあって、その後の対応に必ずしも迅速な
226,、伊勢氏から北条氏へ改姓した。この氏綱による改姓は、他国出身者の侵略という上杉朝興の非難に対し、その名分的正当性をうるためのもので、鎌倉幕府の執権北条氏を意識した改姓であったと
227,そこにさがした。が、そのニコラス少年を彷彿させるところはまったくなかった。世間の非難の重圧と、一生つきまとう後悔の念と切々たる友への思いが重なって彼
228,“ｄ”をあまり発音させないことがあります。Ｈｏｗｃｏｕｌｄｙｏｕ！には非難の気持ちが表れています。気をつけたいこんな表現Ｓｈｉｔ！とＦｕｃｋ！アメリカ映画
229,が」どうやら、これはすでに一度ならず論じてきた問題らしく、カレーニンは、多少非難の色を見せてリジヤ・イワーノヴナをかえりみながら、言った。「まったく、この箇所の誤っ
230,機能」の結果である、とデレヴィヤンコは非難した。連合国対日理事会での合衆国の回答はその非難を明確に否定するものであった。二十五）ＭｉｎｕｔｅｓｏｆＡｌｌｉｅｄＣｏｕｎｃｉｌｍｅｅｔｉｎｇ
231,の上陸を、かたくなに拒み続けていた。こうした日本の姿勢に国際社会からの非難が高まり、いわば外圧に押される形で、難民の受け入れを決定したのだ。しかも
232,、独裁者、冷血漢、誇大妄想狂と罵倒しても、ヒトラー人気はゆらぐまい。偉人に凡人の非難や嫉妬はつきものなのだと、信奉者に一笑に伏されるだけだ。第二、第三
233,謝罪の意を表したことについて「なぜ、イラク国民に直接謝らないのか」と非難。「ブッシュ大統領の発言に怒りを覚える」とまくしたてた。紅茶販売業者の男性（三十五
234,から選手強化費用をたんまりもらっておきながら結果も出せず、楽しみましたはないだろう」と非難ごうごう。「楽しみます」は、相当な自信がないかぎり使えない言葉なの
235,でございますが、余り外需依存の成長をやっておりましては、世界経済の中で非難を浴びるということになります。かつまた五十五年度後半のような低迷した景気状態のまま放置するわけにはいかない
236,人々が大勢、会場に集まれば集まるほど、その数に比例して憎まれ役に非難が集中するという図式に変わりはなかった。その日、熊谷市民体育館は満杯の盛況！
237,て、その中にはロスアンジェルスのプロジェクト十のように高く評価された（同時に非難もされている）ものもあります。ニューヨーク市ではすでに多文化教育のカリキュラムがあっ
238,一方ヨーロッパでもヤソ会士がたびたび政治に深入りしすぎて、いたるところに陰謀を企むとの非難があり、ローマ法王は旧教を奉ずる諸国王の勧告に従って、ヤソ会の解散を命じ
239,も分かるけど、予選から７試合かせいぜい８試合。どういう結果になっても誰も非難はしない」王監督自身は、会見でＷＢＣについて「日本の野球界が自分を
240,次第に彼から離れていき、研究会も事実上崩壊していた。同志の人々の大杉に対する非難も次第に高まっていった。市子もこの複雑な関係がそろそろ終局にさしかかってきた
241,て広島県警を告発していたのである、その感性と行動力は賞讃すべきであったにしても、けっして非難さるべきものではない。札幌弁護士会の幹部たちは“身内”からそのような弁護士が出現した
242,魂のうちに封じ込め、既に彼女の顔は沈黙してしまっているのに、あたかも彼女の非難を恐れているかのように、彼女への恐れによって泣きたい衝動を窒息させてい
243,四百七十六―四百七十七．この計画案の起草者たちは彼ら（ユダヤ人）に対して一般にさし向けられている種々の非難をしりぞけながらも、彼らがはっきりと少数民族を構成していることは、うごかしようのない事実
244,指名されたことである。これは再選されたばかりの知事が、縁故採用ではないかといった非難を浴びる危険を覚悟のうえで、あえてした冒険だった。しかし、クリントンに
245,お話がありましたが、建設省というところをお預かりする限りは、それは幾ら自分が非難を受けてもそういう道を歩んでいきたいと思っております。久米宏の番組に
246,愛されているのだと感じられるようにしてあげなくては。父が批闘大会で非難を浴びせられているあいだ、私は父から見えるところにすわって父を見守り励ました
247,世間では学生の抗議に反対的空気が強く、それが学生を甘やかしていると大学に対する非難をこめた言辞にあらわれてくる。七十年代になると、別の問題が出てき
248,の奉仕を軽く見られ、比すればあまりにささいな者の死について、われらを非難なされました。そこでわれらまっとうな職人といたしましては、荷物を
249,古賀自身が結婚を急いだのだから仕方がないところでもある。全体として妻に対する非難がほとんど見られないのは立派というべきか。「伊東の町に夜
250,には、罪悪感を覚えた。なにせ、病人なのだから。ぷちこは露骨な非難の眼差しをうさだに投げつけると、再び双子に、「あいつはほっとけにゅ
251,）相当の贈答品を受け取っていたことなどをめぐり、身内の民主党内からも夫妻に対する非難が強まっている。民主党有力者のデーリー・シカゴ市長は二十五日付のシカゴ・サン・タイムズ紙で、前大統領の退任直前の振る舞いを
252,もあるが、国、原子力事業者にとって都合の良い情報のみを選択的に提供しているとの非難を受けることのないよう情報公開を積極的に進めることが重要である。原子力委員会は、政策決定過程
253,「自分が死んだら、ゴッホの絵と一緒に燃やして欲しい」と言い放ち、世界中の非難を浴びたことは記憶に新しい。日本では国宝を燃やせば犯罪だが、
254,ｋｅｉｎＲｉｃｈｔｅｒ、告訴主義、職権的訴追の不存在）。しかもその訴えは、常に法侵害に対する非難を意味したという点では刑事訴訟的であるが、しかし贖罪金によって被害者に対する償いがなされ
255,交わした。おれの耳にも、その縁組みに対し関東の他の組からの非難の声が入ってきた。「稲原は、山賀組の関東進出の手引きをする
256,一カ月も先になったら、何をやっているんだと、またおたくの方からは非難をするんじゃありませんか。ですから、そういうことのないように、私ども
257,！！！！なんて言う低脳な人間は日本にいますか？？原爆記念日に非難はしますが、核廃絶を求めるだけで賠償請求はしてませんね。被害者へ
258,７つの原理というものもあります。旧原理は［死、受難、苦痛、恐怖、非難、強欲、渇望］。新原理は［調和、平和、愛と統合、許し、尊敬
259,我らが当地を引き払う今日という今日、貞任めは妹を奪いに押し寄せたのでしょう」非難の眼差しが、言い合せたように貞任の父、安倍ノ大掾頼時の面上へ注がれ
260,をやったからさ。」「いんちきだって！」ブリアンは、思いがけない非難に顔色を変えていった。「そうとも。インチキさ。投げるとき、足
261,が失敗に終わった結果、イタリアにおけるマッツィーニの影響力は決定的に低下した。彼に対する非難は以前にもまして激しさを増し、マッツィーニ派の運動は解体した。民主派内の連邦主義者を
262,弘兼憲史とつるんで『ビッグコミックオリジナル』で「田山孝」という「激辛評論家」を登場させ、汚い非難をしておいて、「証拠を出せ」とは片腹痛い。明らかに私をあてこすっ
263,子どもを自由にのびのびさせる教育であったが，行きあたりばったりで計画性の放棄であるという非難を浴びたところもあった。特に戦後のわが国のそれは，「子どもの
264,大統領としたゲンナジー・ヤナーエフをふくむクーデター派の何人かがいた。私に向けられた非難の合唱の中でモスクワのボナパルティズムは登場を待ちわび、「ブリュメール十八日」がすでに意図さ
265,そうした権利を持ち得るのだ」と…。共産党は容赦なく、天皇に激しい非難を浴びせ続けた。共産党の攻撃は、エマーソンによると、「逆に日本人の心を傷つけ
266,というより内縁の妻というべき者たち」に与えてしまった（これは重大な非難の言葉といえよう）。この女性たちのリストは文書中の略述に見られる。「まず
267,かということですが、全員助命すれば、幕府は弱腰を笑われるかもしれませんが、そう非難は将軍に集中することはない、浪士側にも悪いところがあるというような意見も出
268,。組織はセクハラの加害者の処罰よりも、被害者の告発という行為そのものへの非難へと向かう。真に男女同権に基づく生き方を身に付けない限り、正常に
269,受けることは通産省の中堅官僚にとってはめずらしいことではない。アメリカではこんなことは世間の非難の的になるが、日本では役人がある企業の接待を受けたからといって、
270,ようです。あの本が正式に出版され、たとえそれに対してどのような批判や非難が寄せられようと、私はそれをきっかけにして二つの国の間にいろいろ
271,、一般信徒のみならず、聖職者の内部までをも幅広く浸食していたこの悪しき実践に、強い非難を浴びせ続けていた。ブールジュ（千五百八十四年）やナルボンヌ（千六百九年）での教会管区会議、およびその
272,保安の責任者だろうが。どの面下げて言えるんだよ。」一斉に抗議と非難の声が挙がった。けれども、そうして非難することが気休めでしかないことは誰も
273,た評決を口にした。「われわれの負けでしょう」とつじょ室内に話し声と非難が渦巻いた。怒りと不満と失望に声が張りあげられてゆく。激昂した感情
274,平然としている。山下息子が一度就農して百姓やめるときは村中から私は非難ごうごうで、「何考えてるんだ」といわれた。いまは、農業の担い手
275,米韓合同演習北朝鮮が非難６カ国協議へけん制【ソウル７日時事】北朝鮮の朝鮮中央放送などによると、同国外務省スポークスマンは七日、今月十八日
276,残る悪行であった．反対派の怨嗟の声は高く，Ｃｒｏｍｗｅｌｌには教会側や民衆の非難をかわし，説得する必要があった．この時，聖職者や修道院の非を声高に
277,の暴力団対策をいっせいに非難した。暴力団対策の担当である警視庁の捜査四課は、その非難の渦中に身を置くことになった。四課では、この抗争を全く予測していなかっ
278,という事実が、かえってその重さを物語っていた。自殺。そして、無言の非難。父親のそばにいてやらなかった娘への非難。苦しんでいる父親をよそに
279,）］、ドイツでは講壇社会主義者［千八百七十年代ドイツの改良社会主義。マルクス社会主義者が講壇の学者の説として非難］だった。現代社会が産業社会ではなく商業社会のままであることや、その商業社会では
280,詐欺に遭ったも同然じゃないか、誇大広告に遭ったも同然じゃないかというふうな非難が集中しているわけです。とても今理事のおっしゃるような答弁では皆さん納得しない。中
281,否定に等しいものですらありうる。多文化主義の支持者が伝統的な学習指針を擁護する人々に向ける非難の背後にはこのようなものが存在している。多文化主義者たちは、学習指針の拡大への
282,でそんな土地を買わせたのよ」それまで黙って聞いていた紗絵の非難に、柳井は「裏があったんだ」と言った。「その土地は
283,ている、そう言って最初にＭを攻撃したのはある女性ジャーナリストだった。最初の非難に続き、Ｍに対するまさしく魔女狩り的なキャンペーンが繰り広げられ始めた。新聞、テレビ、
284,成長させるのに有効な自己反省の度合だ。その範囲を超える自己批判は無用であり、非難という破壊的な行動パターンにつながる。学習には、立ち止まることが必要である。個々の逆境
285,提案をする前に、この誤解邪推を撤回させないと、マイケルは自分の弟に対する非難を弟が正当なものと認めたという風に解釈するだろう、と。わたしは
286,内容だが、その軽口こそ政治の世界ではご法度だ。フラムはマスコミから非難を浴びた。ＣＮＮの出演者で、コラムニストのロバート・ノバックも、プラムの軽薄さ
287,を得意とする作家だった。その戦術は成功し、かれの「灰色の月」非難は多くの文学者の共感と同情をもって受け入れられた。その共感を準備したのが
288,知恵袋で創価学会がこれだけ非難，中傷されているのに、学会は知恵袋を運営している、ヤフーに抗議や名誉毀損で
289,を要した。激怒したときは、凶暴な狂人のようにふるまった。偏執狂的に非難の声を浴びせ、怒鳴り、パンチを食らわせ、物を割った。殴り合いになった
290,、アメリカ国民は、別荘の取得方法の不正を追求したものの、休みをとり過ぎるといった、みみっちい非難の声を、一度として浴びせたことはありません。つまり、欧米型の先憂後楽
291,犯行の動機・目的はあまりにもあさましく愚かしい限りというほかなく、極限ともいうべき非難に値する。２そして、本件は、これまでみてきたとおり、▽その被害
292,ほぼ例年どおりの決議を採択した。これら決議はパレスチナ人の自決権承認をうたうとともにキャンプ・デービッド合意に対する間接的な非難を行ったほか，７月に開催されたパレスチナ問題に関する第７回緊急特別総会決議と同じく対イスラエル制裁措置に言及したの
293,せられるのは迷惑との思いも透けて見えた。「元専務が証拠隠滅」と非難焼却処分「焼いたこと。あれが一番許せない」。農水省の若手職員の間で
294,手が代行する方法で、倫理にはずれる行為だと非難されたし、いまだにその非難は一部でくすぶっている。こんなふうに考えてくると、反倫理とは反自然にほかならないという
295,。各省庁の役人、警察官、国公立学校の先生、自衛官等で色々な事件を起こす人は非難の対象になるし、やるべきことをやらない人は尊敬できないよな。大多数
296,の情熱がかつてと同様，不変であったとしても，学生の学力低下が起こった場合，非難の矛先は，教師および大学教育へ向けられがちである。もちろん，逆に，大学教師の教え方は
297,ている米国は野蛮な国だ！」と自国のことを棚に上げた一方的な非難が集中したが、もしかしたらこの人たちが思っているほど日本人は“銃嫌い”
298,確認して記事にしてるんだ」編集主幹は「わかった。ただし、日本政府がこちらを非難でもしたら、やり返す」と答えました。「日本語ではいってない」
299,わが子と絆を結ぶことのできない母親はあらゆる怠慢の烙印を捺され、非難の的とされてきた。精神分析学者たちは、子どもの精神の不幸の原因は母親
300,できるだけ公平な態度をとろうした項英を、富田事変の反革命性を曖昧にしたと非難、ソビエト区中央局書記から更迭し、代わりに毛沢東を書記に任命した。さらに富田事変の指導者たちを
301,「（あの時）〜だったら，…なのになあ」…「後悔」「非難」などを表す表現１．８時三十分の特急に乗っていたら，午後１時には目的地に
302,）彼女の妄想で膨らみまくった話をあちこちでペラペラと吹聴され、結果事実とは異なる非難の集中砲火により、ストレス起因の疾患につきまとわれるようになってしまった残念な経験がある
303,―」それは、きのう起こったどんなことにも負けず劣らず納得のいかない非難だった。ケロウィンは怒りとも悲しみともつかない感情にとらわれた。そして、流した
304,しかしＳｕｐｅｒ六千クラスの競走過程で濾過ない排気騷音が位を度が外れたという非難がおこっていて刻苦の努力末に顔見せをしたストックカーの出発に負担で作用している
305,の文章では「自然の一隅」とも言う）。歴史的に見ると、非難の嵐に囲まれていたマネを一貫した価値基準をもって弁護したのは、まさしく千八百六十六年
306,から立ち退かせ、「グループ分け」キャンプへ移住させた。キャンプの状況は劣悪である。国際社会から非難の声があがり、二千年九月、キャンプは閉鎖された。しかし、家屋がほとんど破壊さ
307,考えもよく聞いてくれた。「小山君は昔も今もロマンチストだね」非難の口調ではなかった。勝清が持っていった「或村の近世史」の連載
308,ないとね」「あのひとはいつも遅れるんだよ」リーディスはわるぎのない非難をする。「だからといって、ぼくが遅れていいというものではない。さあ
309,新都には実害はなかったのだが、そのおりの言動に関して伯要は後に、非難を浴びたのだ。たしかに不遜ないい回しもあったし、言質をとられ
310,木津屋さんもお気の毒というしかない。なんぞ前世の悪い祟りでござりましょう」と、口々に非難の言葉をささやき合う。お雪はそれらを聞いて笑いながら、―陰でごちゃごちゃ
311,わけにはいかなくなる。これはデマゴギーなのだろうか。いや、そうではない。デマゴギーという非難は、役者じみているという非難と同じく、参加者たちの欲求を否定し、ヒトラーがともかく何か
312,生きかただけである。半三郎もそのために格別非難を招かずにすんだ。いや、非難どころではない。上役や同僚は未亡人常子にいずれも深い同情を表した。同仁病院長山井博士の
313,キャスターが、遠慮がちに言った。その質問の裏には、ともすれば己が非難の対象になりかねない作品を敢えて出版した芝野にたいしての率直な疑問と懐疑心が
314,過去の闘いが、すなわち祖国を去らねばならず、彼らにとって妥協はなかったという事実が非難にかわり、ドイツ国民の肉体の刺になった。トーマス・マンをめぐる程度の低い論争は
315,も、態度でも、いっさい咎めなかった。だがいま、シュナンをみつめる瞳には非難の色が浮かんでいた。それともこれは、軽蔑なのかもしれない。「ぼくは
316,に発せられたなら、受け流すこともできたろう。しかしその場においてその言葉は、非難ではなく挑戦であり、取り合わないことで人格的に優位に立つことのできるような侮蔑の
317,ためのものであり、そこには日本のあらゆる階層の代表者が、彼に対する激烈な非難を用意して待ち構えていた。中でも子供の夢を壊したという伝統的な非難
318,後藤象二郎をはじめ、大隈重信も板垣退助も尾崎行雄も志賀重昂もみんな変節漢である。それが蘇峰だけに非難が集中したことは、蘇峰の「平民主義」が国民に徹底して印象づけられていた
319,隊員は「あれはＳＡＳとデルタ・フォースが行なった」と述べている。アラブ諸国からも非難を浴びて孤立無援の状況だったサダム・フセインは、多国籍軍による空爆が開始されると、その
320,いうときは―いや、大体があまり論理的な頭の持主ではないので、少々ズレた非難を、兄に浴びせている。しかし、片山は、こんな場合、妹に反論しても
321,ということでございます。アメリカからは時期尚早だと、韓国は大国主義だといったような非難もしておるわけでありますが、これについてはどういうふうに取り扱われるつもりか、
322,の長であると表現された。これは後に裁判でもソクラテスに対して唱えられた非難である。同様にプラトンも『国家』の中で「ディアレクティケー〔対話術、問答術〕
323,のもよいが、それでは敵将に身を任せた女、としてそなたものちのち非難を浴びつづけよう。その辺り、我が殿は十分に配慮遊ばされ、今後の相手には
324,止めようとしたミリィの腹部に一撃を喰らわせる。様子を見守っていた近隣住民の非難の声。それを耳にしたウルフウッドは言う。「ちょうどええわおまえら
325,にも毎年新しい家が増え、新しい家族が越してくるのに、いつでも非難の矛先が平和台に向くのは一体なぜなのであろうか。中学一年の夏、
326,に各地の劇場で取り上げられると、「性的倒錯を音楽で描いた」として一部で非難の声が上がり、ニューヨークではピューリタンの反対で初演直後に上演禁止、ウィーン国立歌劇場では大司教
327,。戦後になってはじめてこれに難癖をつける批判が出て来たのであるが、その非難も、筆者はこれを笑殺していいと思う。欲を言えば、午前零時
328,。おもしろいことに、イングランドでは、この語は千七百三十三年以降“ａｒｅｂｕｋｅ”（強い非難、叱責）、あるいは“ｂｌａｍｅ”（非難）という意味であった。アメリカでは
329,、「大物と会ったり大物の噂話の好きな」ラスキのスノッブぶりについて、夫唱婦随の非難を公けにしている。感情的しこりの根深さを想像させるが、問題はスノッブにある。
330,てきた。ところが、どうだ・・・おれの得たものは、冷たい世間の非難と、お尋ね者の烙印だけだ」となげいたのは、かつて全米をふるえあがらせ
331,．軍人７万人がチベットに進駐、専門家は中共を非難【大紀元日本３月十九日】香港メディアによると、現在チベットでは７万人の軍人が進駐しており、
332,いい人が現われましたか？この言い方は、ずいぶん冷めているね、という非難の矢となってオードリーを刺した。彼女は凛として答えた。「どなたで
