,0
333,縮まることが必要だ。アメリカはイスラエルのガザ攻撃を見て見ぬ振り・・・非難もなんもせん。自民・公明はこの後に及んでも派遣社員ことを考えず大企業
334,●犬と同じ扱いその昔、犬の虐待に関する近隣の住民からの非難に対応していたイギリスの動物保護施設のスタッフが、あるとき、偶然、ベビーベッドの中で
335,その結果数々の競技でオリンピック史上類を見ない大問題が発生→世界中のメディア、スポーツ関係者から非難をあびる→逆ギレ→世界中の国々（韓国、北朝鮮以外）から大ブーイング→総すかんをくらい孤立
336,語は千七百三十三年以降“ａｒｅｂｕｋｅ”（強い非難、叱責）、あるいは“ｂｌａｍｅ”（非難）という意味であった。アメリカでは、ｔｏｔａｋｅｔｈｅｒａｐ（他人
337,に暮していたことまで、アイゼンバーグは一緒に非難している。このようにごうごうたる非難もあったが、筆者は国際関係の分析に役に立つ枠組で、考え方に示唆的
338,に慣れすぎているからだとか、不測の事態を十分想定していないというような非難を耳にします。もちろん用心するに越したことはありません。しかし、どれ
339,、報告を完成した。顧みればこの戸口調査の断行については、伯は八方から非難の声を浴びたのであるが、しかも伯は、見事に日本における最初の国勢調査に
340,仕事を押しつけられるようなことは、嫌にきまっている。だから考えを曲解されて非難を受けるようなことがあったり、国または故郷が、それで危険にさらされる
341,〈城居地主〉の一人であったことが推定される。一方、（Ⅲ）において非難の対象とされ、「土豪」という名辞を与えられた高利貸資本は「大抵一郷
342,、冒頭が自己正当性の強調だとすると、ここは旧派の古くささへの痛烈な非難です。（３）に移りますと、だからわれわれは「遠き伊勢国みもすそ川の流を三盃くんで
343,無確信を暴露したものはない」（最高裁発行の『裁判所時報』昭和二十七年一月一日号）と非難をあびせている。この間、尊属殺規定や公安条例事件、わいせつ罪の判断基準などで、国家体制の
344,がくるわ、濡れ手で粟のぼろ儲けをしていると、犯罪をおかしたような非難を受けまして…」「…」鬼平は並んですわった宮之原をみつめ
345,は、メディア事業を円滑に進めるために、アメリカの映画会社を買収した。その時沸き起こった非難の嵐は、メガトン級だった。グループの市場のターゲットは依然としてアメリカだっ
346,不公正さを示すものとして受け止められ、こうなると資産運用目的で保有している駅前一等地のビルも非難の的になる。消費者が生保に将来を託すような雰囲気ではないが、生保
347,のである。事実ロベールは、新たに迎えた妻の四親等にあたる親族であった。この非難は婚礼の妨げとはならなかったが、しかしジョフロワ・マルテルはそこに口実を見出して
348,も咎めませんでした。その後で、アメリカがベトナムでした虐殺には、非難ゴーゴーでした。フランスの軍隊を見てもらえば判りますが、ベレー帽をした
349,課題となっている。他方、インドに対抗して行った九十八年５月の地下核実験により国際社会の非難を浴び、九十九年十月に上述の軍事クーデターが発生したため、主要国はパキスタンへの対応
350,でも現実にほとんどの子がかぎっ子おばあちゃんっ子です経済的に問題がなければ、私に陰口や非難があってもできれば数年は母親が育てたほうがいいんでしょうか？それとも周囲
351,は沈没〈二千二年〉１月二十九日ブッシュ米大統領、北朝鮮など３カ国を「悪の枢軸」と非難９月十七日小泉純一郎首相が訪朝、日朝平壌宣言に署名。金正日総書記との日朝首脳会談で北朝鮮が日本人拉致を
352,に、傷つけられ、恥かしめられた不具者なのだ。「ルーズヴェルトさんよ！」声に非難と軽蔑をたっぷりと籠めて言った。「つい今しがた奴さんが話すのをラジオで聞い
353,、たちまち非民主主義国家のフォーラム（討論会場）となり、そこでは主として民主主義国家が非難の対象となったが、それは民主主義国家が少数だったためである。人民の政治的権利
354,ていることを明かしている。無知なる者の妬み、衒学者の自惚れ、悪意ある人々の非難、愚か者の疑念、偽善者の熱狂、野蛮人の憎しみ、暴民の怒り―ブルーノの挙げ
355,への嫌悪ということが、さらりと書いてあるが、その背景には、デビュー当時の非難や、暴力団追放キャンペーンのスケープゴートにされてしまった事件などが、裏打ちされているのだと思う
356,最大の失敗の一つに数えている。しかしここまで闘志が充実していれば、そういう非難を受ける恐れもないだろう。間もなく、水平線の彼方に、炎々と燃え上がる
357,幕府のご威光も庶民の口は容易に塞げません。却って義政公の御庭道楽への非難を逸らすためか、などと一層酷い噂をたてられるおそれが…」板床に
358,エゴのために、他国の文化を愚弄している現代の「ジム卿」に等しい、という非難の矢面に立たされることを意味していた。私は胸の動悸が高まるの
359,すなわち、個人や社会を危険にさらす状態であるという問題意識は十分にない。批判や非難の声がよく聞えるが、ではどうすべきかという具体的な対応策が出てこない
360,米国南部も大きく進歩したことは明らかだった。一方、故郷の町で私に対して非難と歓迎の両方の声が渦巻いていたことも、実はちょっと意外なことだった
361,で迫った。スーザンが目でマイケルに訴えた。黙ったまま、彼に非難のまなざしを浴びせた。一度の熱いキスよりも大切なことがあるのだと。
362,の日本叩きの暴走だといえる。ところが盧武鉉政権下の韓国では、アメリカに対しても感情的な非難がぶつけられているのだ。しかも盧大統領以下、政権内外からはアメリカとの長年の同盟関係を事実上
363,ている政策をとる。一部には、こうした官僚システムは、継続性がないという非難を浴びる。「継続は力なり」とは日本官僚の好み言葉だが、継続が行き過ぎる
364,はしっかり握った。「日本の駅長は自爆して新京へ去りました」非難ともきかれない言葉で劉が言った。「さあ、すぐ焚き出しをし
365,ための努力をする責務があると思いました。障害児者の保護者への不当な非難をさせないためにも、この実践例を読んでいただいて、具体的に理解をし
366,に突き当たろうものなら、それ見たことかとバッシングをし、人格を否定するような非難さえ浴びせる。そのあげく、どうせ日本にはイノベーションなど期待できないのだとしたり顔で語ってしまう
367,は判断した」カナダ国民のＳＩＳＳ非難が情緒的に大きかったその分だけ、ピアソンはきびしい非難を浴びせかけられる。たしかに、注意深く読みなおしてみると、ウィットフォーゲル証言直後（千九百五十一年八月九日）のピアソン
368,執拗に繰り返されたのだろう。真理子には責任のとりようがないことまでも、非難と追及の対象となったのだろう。山脇は、真理子の胸のうちの悲痛
369,ことにある。敵対する政府は、多くの場合、敵対するテロリスト集団を支持している。テロ行為に対する非難だけでなく、ときには現実のテロが、二国間で双方向に投げつけられる。アパルトヘイト政策をとっ
370,ことは言わん方がいい」と、此の発言に対しては老クラスメイトの中からさえ強い非難が出たし、「井上さんは考えが余りに偏狭すぎる」という批判もあった
371,千九百三十四年七月二十四日〜八月八日）に掲載。掲載中、一般読者から「ふざけきっている」などといった非難が殺到し、本来三十篇予定であったが、十五篇で打ち切られた（「詩第七号」から
372,不当なのではないでしょうか」かねがね父の伊兵衛とも苦々しいこととして話題にしている非難を、文次郎は口にした。「お山伏も、そこを怒って利吉と
373,漢族の顔色当時、共和国と中国との国家関係は中国側からの「朝鮮修正主義糾弾」の非難の中で極度に緊張しており、延辺でも紅衛兵たちは「大字報」で金日成主席の死亡
374,の御前で、法門の解釈のうえで、師の教えに従わなかったので、非難をあびて、郷里へ帰ることになった。御弟子の蓮位房が、そのとき申しあげた
375,は受け継いでいるような感じがいたします。といいますのは、ソビエトの軍事力増強等を非難をするというか、特に、ことしはソビエトの軍備増強については非難をするが、
376,が伝えたいわけだ。だとすると、「非常識だ」「だらしない」という非難ではない言い方を探すことが大事だ。ＤＥＳＣのところでやったように、
377,らしい。これを喜劇「女中難」でも使ったのは、恐らく「ラヴ哲学」に対する非難の声があまりにも高かったので、イタズラ好きの彼はわざと“袖ヶ浦人作”として攪乱戦術
378,のかについて、さまざまな提案があったが、ワイネルトのヒト・チンパンジー親戚説と同じように、非難を受けたり、奇妙だとか単純な考え違いであるとかいう理由で、斥けられ
379,が、それは品種を改良するためだという。「つまり、インカ人のやりかたは、非難を浴びているスコットランドの狩猟家のやりかたとは正反対だった。スコットランド人はすぐれた雄ジカを
380,男性労働者には労働時間の上限規制がないため、長時間労働が放置されているので、国際的にも非難を浴びています。ヨーロッパでは、男女ともに時間外・休日労働の上限規制をしています（
381,に陥る。そこでまた一計を案じる。エロイーズと正式に結婚することによって、世間の非難をかわそうとしたのである。
382,ことを銘記しよう。二、できる限りの最善を尽くそう。あとは古傘をかざして、非難の雨が首筋から背中へ流れ落ちないようにするだけだ。三、自分の犯し
383,あることに気づいていたのです。しかし評論家はある種の世間知らずだという非難にも、根拠がないわけではありません。ランゲとヴィルヘルム・ヴントは、教養ある
384,激励の言葉で白瀬南極探検隊を送りだしている。「百発の空砲」とは世間の中傷や非難を指し、「一発の実弾」は白瀬隊の成功を意味しているのである。大隈のこの
385,、若さが商品として売られ、他方では、この若さという商品を買うひとが非難をあびせられているのです。この両方に社会が費やすエネルギーは注目にあたいします。年
386,最初に出した人は、田村元さんです。田村さんは通産大臣の時、東芝機械のココム規制違反事件で非難を受けると、アメリカへ飛んで行って、きちんと謝っていらした。あの時
387,である山崎拓を離そうとはしなかった。山崎の境遇がどんなに苦しくとも、どんな非難を浴びようとも、小泉首相は歯牙にもかけなかった。小泉には、非情な一面
388,たようである。千九百二十七年にデッサウで選挙があり、右翼勢力が進出し、バウハウスへの非難も激しくなり、新聞はグロピウスを個人攻撃した。彼はプリッツ・ヘッセ市長ともうまくいかなく
389,、大変傷ついているようだ。誇りと自信をなくし、弱気になっている。すべての非難が、自分に集中するように思っている」「ええ。でも、実際そうなりそう
390,演奏家タイプの成立を指向したのである，それも，果てはマリブランＭａｌｉｂｒａｎの場合のごとき非難を浴びる，あの激越さに陥ってしまう危険を孕んでまでである。６）ミュッセＭｕｓｓｅｔ著
391,。これらの関連書類の処分等の問題は、その理由のいかんを問わず、疑惑、非難を受けるのは当然である。防衛庁長官は、しかし、既に厳格な措置の第一弾を
392,）は、小規模図書館の場合には受け入れがたいであろう。そして直接的にデトロイトの計画への非難を慎み、次のように述べている。「私個人としては、これらのものを必要
393,にすべりこんできた森川の顔にひたと視線を当て、身じろぎもしない。非難の視線なのか。最初、森川はそう思った。だが、違った。強烈
394,を獲得する。もちろん久米を堕落させたという理由から、菊池に対する仲間の文学者たちからの非難や風当たりは異常なまでに強かった。その同じ年に、菊池は結婚を
395,だのって、さんざんあんたら偉い連中の非難をあびるんだろ」「もう、さんざん非難はあびてるでしょうに。いやというほど」思わずヴァレリウスが云った。イシュトヴァーン
396,反響は騒然たるものだった。カナダでは、ＳＩＳＳ（アメリカ上院司法委員会治安小委員会）のやり方に対する非難と反米感情が一気に高まる。ピアソンの多くの声明と同じ調子の赤狩り非難が各新聞に
397,たのでしょう」「殺すつもりだったのよ」と菊枝が言って、無言の非難がその場を飛び交う。「きっとそれで反対に落ちてしまったのだわ」「
398,人々は反感を強めたことがしっかりと記されている。そして何より五百旗頭氏はこの非難を『新しい歴史教科書』に向けているが、批判の相手を間違えてはいないだろう
399,文脈上、正しい。そのような性的な結びつきは“結婚”ではない。ソビエトは非難に反発するのではなく、達成し切れない残された壁を越えて“結婚”の外に新しい
400,。漠然とそう感じていた正憲は、園生と職員の立場に立つべきだという非難の思いを込めてそう言った。「ああ、その主任の話…俺が
401,両国の緊張が高まっている。ロシアは「武装勢力を野放しにしている」とグルジアを非難。グルジアも「ロシア戦闘機がグルジア領を空爆している」と訴え、険悪だ。武装勢力は
402,関係者は、いずれも南陸相によって処分せられていた。したがって処分が寛大に過ぎるとの非難はあったが、後任の荒木陸相としては、これらの関係者を改めて処分し直すわけには行かなかった。
403,すぐ肩を持つという言葉を使うがね、わたしはただ、人間として確証のない非難は避けるべきだと思っているだけだよ。あの人はお前の親しい友人だろう？
404,それに対する批判は、それがその実体に関する効用論であろうと尚冠された形容詞への非難として弾劾されたり、誰しもが希求する平和の実現のために駆使されるべき、政治
405,◉痛恨の旅順陥落、黒溝台の危機旅順では苦戦が続き、乃木は国民の非難を浴びていた。国際評価でも、日本軍が勝ち進まなければ外債が集まらず、戦費
406,な抗議文であった。要請書の前段で、去年一年間の福岡・佐賀両県が長崎県に対して行った非難や激しい攻撃を改めて思い起こさせている。その後に「本年のノリの作付け棚数を二割
407,あったという理由で、彼の女奴隷十二人を処刑した。この処置には何の非難も生じなかった。というのは、女奴隷たちはオデッセウスの所有物であったからである。自分
408,人民日報、「チベットの発展がすべての非難への答え」中国紙『人民日報』は二十二日、「チベットの発展を尊重する権利」と題する文章を
409,，輸入におけるシェアが高いような場合は，的が絞り易くなり，その国に対し，非難が集中することになる。過去において日本と欧米諸国間に生じた貿易摩擦の例をみると，日米間
410,無経験であって、だからひとびとがどんなことを話し合っているか知りはしないのだ、と非難のことばをつらねた。彼らエスパーニャ人たちは、フライ・アロンソ・デル・エスピナルを誉めちぎって絶大の信用をつけ、
411,命じた「福岡ケース」は、原告の異性関係を中心とした私生活に関するあらぬ非難が、職場での対立関係の解決のために、女性の一方的退職を余儀なくさせた
412,新調するのであろう。一中の君への匂宮の殊遇を、尋常ならざるとと非難。二身なりのぱっとしない女童。三なまじはなやかすぎる住いだ、の意。
413,原潜として初の寄港を佐世保にした時、佐藤に向けてごうごうと巻きおこった非難の声を無視し去った。社会党の成田知巳書記長が、もしも佐世保で放射能洩れがおこった場合
414,その効験、成果の情けないばかりの貧寒さよと言い出すなら、あちらこちらから、烈しい反撥、非難の声が上げられ、忽ち数知れぬ紙礫さえ飛んできかねないだろうか。いや
415,のあることを書くとき、そこにはほんのわずかながらも、からかい半分の皮肉や、非難のひらめきが読み取れる。彼女こそは“完全な母性愛”という潮流にさからった最初の
416,れていると思っていた。だから米国を訪れてみて、憎悪に満ちた極端な非難の言葉を浴びせる人がいるのは意外だったのだ。正確に言えば、彼ら
417,ていましたので、はっきりマイケルの肩を持ちました。母はアンドルーが兄の非難を正当と認めて、兄を金で買収しようとしたのだ、という風にアンドルー
418,通常、その見る人間が見ると予期しているものなのだ。じつはピーター・パスコーの眼差しは非難ではなく安堵を含み、手招きは怒りではなく命令を伝えていたのだ。彼は文化遺産・芸術・図書館センター
419,にもかかわらず決定が下されたという意味で国家の意図を体現するこの不揃いは非難の的になったが、この愚昧主義は、モスクワの赤の広場に憐接するホテル
420,と唱え伊藤博文らと共に鉄道導入事業を創始、英国から百万ポンドの借入れを敢行して国内から非難を受けたがひるまず、これを貫徹した。明治七年、台湾蛮地事務局長官、ついで大蔵卿となる
421,を呼びかけているにもかかわらず、日本の対南ア貿易は増加し、人権よりも経済的利益を優先させているという非難の声すら聞くのであります。アパルトヘイトに対する日本政府のとるべき対応について答弁を求めます。
422,の条件を付しもした。これに対して四月二十三日、佐藤首相は会談コミュニケでの中国側の非難は内政干渉であって、軍国主義化は誤解だと反論したが、滞在中の広岡社長は、これら
423,小説の刊行は、センセーショナルな文学的事件となり、陰惨かつ不道徳であるとして批評家たちの非難を浴びる。こうした批判に応えるために、ゾラは六十八年の四月に第二版を刊行し
424,で仲間を作り、それとつき合う」ということは、現地人の半分やっかみもまじった非難だが、その仲間とは、何でもが打ちあけられる救済の世界ではない。もちろんそのよう
425,ばなりませんな」「ヴァレンタイン卿…」ディキシーは少し眉をひそめ、軽い非難を込めてやんわりと言った。「それは、あまりに気が早すぎます。
426,コナーは、夫と六カ月になる双子の娘を残して家を出たマグダに対して非難の気持ちを隠そうとはしなかった。「きみはぼくが人の顔しか
427,、解党している。各地に頻発する暴動、活動資金面での行き詰まり、政府の弾圧と改進党の非難…そうした事態を考え、「他日、世運が大いに進歩し、公同の資格に
428,偉いです。私はクレームをつけられたので返品の意向をお伺いしたら、散々な非難と共に「捨てましたよ」と言われたことがありますよ。
429,てたけど、気持ちのいいものではないね。相撲には張り手があるから一概に非難はできないけどね。●魁皇一言で言えば、今日の相撲はつまらなかっ
430,更に９月にはクウェイト国王がマレイシアを来訪した。対ソ関係については，アフガニスタン問題につきマレイシアが非難の立場を明確にした（９月）ことが注目された。対中関係については八十年
431,が明けて、一月二十七日に開かれた友愛会議の総会では、塚本委員長に対する名指しの非難と辞めろの声が続出した。「塚本委員長がリクルート追及などと言っても、泥棒
432,といたしましてもあらゆる角度からいま慎重な態度をとって、いやしくも世間から非難を受けるようなことのないりっぱな事業を行いたい、このように考えておるところ
433,亀井さん選挙戦優位に戦っているはずなのにすご〜く悲壮感ただよってました！他人の非難ばかりで支持者が嫌気をさしたのでしょうか？何故小泉さんに追い出されたかを、
434,たが，南京占領の際には多数の中国人を殺害して（南京虐殺事件），国際世論の非難をあびた。中国はアメリカ・イギリス・ソ連の援助をうけ，政府を南京から・武漢，さらに
435,私が、世間一般の常識からそうしたにすぎない。告白によって、ある程度、成人の非難から逃れられることを私はよく知っていた。「僕はね、君じゃ
436,の利益に対して多大の努力を払うことができる。出身民族によるえこひいき、身内の優遇、汚職といった非難は、すぐさま地元出身の幹部のパージと、能力や効用のみが選抜の基準になっ
437,所属する外務大臣としての自分が下した判断である。「ノーマン事件」についてのピアソンへの非難は、カナダ国内親英派による、ピアソンが展開する外交政策批判の声をも大きくした。イギリス連邦の一員
438,に見すえようとする漱石の態度がうかがわれて、興味深い感想だ。「不徳義漢」と非難を浴びた朝日「入社の辞」朝日新聞に専属作家として入社し、第一作『虞美人草』
439,しようなどという意見ばかりです。リベラル派の人たちは、「日本は土建国家である」と非難をしますが、これといった産業のない地方では、中小の建設業者や土木業者が
440,時期に殴られたことを公にする勇気はありません。子供に降るかかる非難（きっとあると思う）を親がすべて守ってやることが出来ないからです。なんだかみんな
441,、ほとんど先生御承知のとおりに、日本は約束だけして一向に実行に移らないという非難もこうむっておったのでありますが、その原因は何かと言うならば、輸出に
442,た。イギリスではすでに事態の調査がはじまり、スコットランド・ヤード、内務省、外務省のあいだで非難と弁解が飛び交っていた。数日後、私は連邦警察の警部を護衛につけてもらい
