,0
111,。「フジを退社した途端、ライバル局に出ることに、フジの内部では非難の声もありましたが、逆にＴＢＳとしては、こんな大物キャスターをほうっておく手
112,と称して、全国の党組織をむりやりその指揮下に引きこむと同時に、宮本さんたちにたいする非難と攻撃のキャンペーンをいっせいに開始したのです。
113,を悪者にしておけば、万事うまくいく。表沙汰になった場合、社会から厳しい非難を受けるが、当事者を処分してしまえばそれで終わってしまう。社会感情も沈静化してしまうのである。
114,た」とメルロ＝ポンティは回想している。そして彼のこのような観点からみれば、「非難の余地なき行動というものは存在しなかった。フランスに留まることによってわれわれはみな幾分
115,提言した。ごく少数をのぞいて、この考え方は誤った判断に基づくリベラリズムだという非難を受けた。つまり麻薬の災禍に対しては乱用の社会、すなわち乱用者と供給者の社会
116,予測した。そのために、相続く日食記載の洩れに対してこれらの民間天文学者たちが一斉に非難の声をあげた。「幕府はおかしい。つくった暦もおかしい」という批判
117,耐えていた思いのたけを一気に吐きだそうとするかのようだった。マリアの非難の矛先はあらゆる対象に向けられた。まずバルナベを、そして男たちを、さまざまな
118,少ない政治評論家になり、「ＡＥＩ研究員」の肩書で本格的にマスコミ活動もはじめた。ブッシュ政権の非難はもちろんしない。ブッシュ政権からは追い出されたものの、“外郭団体”に下ったよう
119,の反対を押し切って軍縮条約を結んだのは統帥権の干犯であるとして，激しい非難を浴びせた。ロンドン海軍軍縮条約をめぐって，政府と条約反対派との間で紛糾が続き，
120,又、海外からの入国者に対して、指紋の採取を行うのは、差別的であるとの非難もある。しかし近年では、金融機関や個人情報を取り扱う企業の部門は、『
121,「資格」が十分にあったってわけなんだ。もちろんなかには、いかにも非難と憎悪と軽蔑に充ちた視線を向ける人々もいた。一体それはなんて
122,ものもあるが原則公開とし、都合の良い情報のみを選択的に提供しているとの非難を受けないよう一層配慮していくとともに、情報ネットワークなど新しい媒体を活用した情報提供など提供手段の
123,「その人物」は、政敵は「マスコミ・ネタにしようとばかりしている」と別の非難によって答えるのである。彼の返答は否定か否か？また、もしはっきりと否定する
124,ようである。しかし、人為について疑念が生じたらしく、後には魔術師との非難を受けることになった。彼は術の教授に対しては金銭を請求したし、また記憶
125,、看護師が起こしに来る。明け方には、彼がこの処置について礼儀を欠いた非難の言葉をまくし立て始め、キャサリンもいらいらしてきた。疲れきっていたので怒鳴る元気がなかった
126,★アンジェリーナ・ジョリー、動物愛護団体からの非難に先手？！現在、スリラー・アクション映画「Ｓａｌｔ」（原題）を撮影中のアンジェリーナ・ジョリーが、動物愛護団体を安心させよう
127,がロシア風のファー・ハットにチンチラの毛皮で出来たポンチョをまとった姿があり、さっそく非難の矢が集まるかと思われた。しかしこれに対し、アンジーの広報はすかさず先手
128,は心を痛めている、とアルメッソはいう。そこでノラ人はオックスフォードの学者たちへの非難を取り消すが、それは現代の人々が軽蔑している中世オックスフォードの僧侶たちへの賛辞という
129,に、邯鄲攻略中止命令を出したのはあなたです、とはいわない。だが、言外に非難の意が込められている。范雎に懇請させてみたが、それでも白起は動か
130,」「後世を願え」「死んでも罰はついてまわるぞ」非難の声がごうごうとあがる。その声を切りさくように、錫杖（僧侶や修験者が
131,」と弁明。同じ試合、ダーキン主審はミカエル・シルベストルのゴールを無効にし、マン・Ｕ側からも非難を浴びている。二千四年２月十五日リーガ・エスパニョーラレアル・マドリー１‐１バレンシア１‐
132,あるし、大部分が社会に役立つ企業を目指している。また、放漫な経営戦略に対して、非難の声があがるリーマン・ブラザーズは、かつて日本を救ったことがあるのだ。千九百七十七年に同社はクーン・ローブ社
133,」から排除されていったことをあまりにも性急に認めすぎていると非難している。この非難は博士論文においてそのまま繰り返される。このことはこの期間にブローデルが一歩踏み出したという
134,にされたりするのも、サラリーマン本人のせいではない。税制を正せば、不当な非難はなくなるのである。このことは、同じサラリーマンである以上、役人にも当てはまる。
135,、私たち（私）はどのような行動をとるだろうか」。つまり、無用な非難を避け、成長のため教訓を大切にするということだ。正式な方法でも
136,もよくいわれる現代詩が難解で一般の読者には理解できないという非難である。この非難は詩人たちの最も好まないものであるが、事実、あらゆる近代詩が具えているエルメティスム（錬金秘法的難解さ
137,半分はウィトゲンシュタインの言うとおりだと思っているからです。」さらに数日間、彼はこの非難のことで考え込んだ。３「私が正確さを信条とする人間へ裏切り行為
138,でありましょうが、このほうでは「心やすらふ」という句は幾分露骨になり過ぎているという非難があるかもしれません。「若葉吹く風匂ひきて」というほうもあるいは道具立てがおおすぎるという
139,も、一時期大きな話題となりました。もちろんこれは正しくない日本語である、という非難を浴びたことは皆さんご存知の通りです。けれど現実に日常で意味が通じ
140,な」スーザンの口から言葉が飛びだしそうな気配を見てとり、マイケルは非難を浴びる覚悟をした。けんかも今なら悪くはない。もっと楽しい発散方法のほう
141,の夢を壊したという伝統的な非難は実に執拗に繰り返された。彼は非難がでるたびにスタジオに集められた程度の低そうなガキどもから吊し上げを食った
142,蘇峰が、外国から帰ってすぐに松隈内閣の役人になったことによって、多くの非難を受け、変節漢と呼ばれるに至ったのである。蘇峰は『蘇峰自伝』で、参事官任命まで
143,た。国連平和協力法案は、当初、山崎の理想どおりにすすんでいた。が、世論の非難の砂塵に巻きこまれ、収拾しきれない状態になってしまった。公明党の態度が途中から
144,自民党を飛び出すくらいなら、なぜＰＫＯ協力法審議中に体を張って反対しなかったのか」といった非難が、一方で石原に投げかけられた。いうまでもなく、石原はれっきとした
145,がやったということであるものの、小沢氏の資金集めに関してやったのであろうから小沢氏に対する非難は避けられるものではない。政治不信が増えるだけで内閣支持率は上がらないとか、企業献金の
146,のために使われることもなく、ただ恨みとして表現される。恨みが溢れると、非難、いやみ、執念、だんまり、涙が生活を覆う。これは被害者がよく使う生活上
147,に同意した。二日後、ジョーはＮＢＣのラジオ・ネットワークで演説した。聴取者は武器貸与法の非難を期待していた。だがジョーは自分は「中傷」キャンペーンの的にされてきた、と
148,日本独特の精神的美徳につながる要素だろう。無遠慮で人のことを考慮しない振る舞いは世間の非難を受ける。だが、相互配慮性を失いつつあるいまの職場集団では、メランコリー親和型ばかりが一方的に
149,永野修身は宮中に参内し、昭和天皇に「戦争はすべて堂々とやって、どこからも非難を受けぬように注意いたします」と奏上した。また、連合艦隊をハワイ沖に送り出すに
150,は、被害妄想にも陥りやすい。「課長が言っていたのは、ほんとうは私に対する非難だ」というように捉えだすと、大変なことになる。この種の人は、
151,に、枢密院の態度は「同意しがたき」ものであり、また、斎藤の現役復帰に対する枢密院の非難についても、「是れは正式に云へば天皇の大権に属する事に付余はわざと
152,数学とならぶ学問であるこの占星術をバシリオは修めていた。占星術への最初の非難はアウグスティヌスの『神の国』に見られる。教会は千五百八十五年にシクストゥス五世が教書
153,シェワルナゼは疲れている」「シェワルナゼの神経は参っている」などのことだ。これらの非難の首謀者の一人に、当時のソ連最高会議議長ルキヤノフとクーデターの際、自らを大統領とした
154,になる。進歩派、革命派の知識人、活動家としゃべるなかで出てきて、論難、非難の対象になる。「おまえの国はどうか。おまえの国はアメリカ合州国と仲
155,が明らかなところから、自由主義者は、敗ける戦いに国を導くものという誇張された非難にさらされざるをえなかったのである。自由主義が基盤としようとするブルジョアジーも
156,は内閣総理大臣となり、十年には日韓併合条約に韓国側代表として調印した。もっとも親日的な官僚として非難を浴びた。戦後、無謀な太平洋戦争を引き起こした東条英機らが「国の進路を
157,に包囲された「二條御所」にいたものの、無事に脱出したことから、激しい非難にさらされた人物とされている。さらに、大坂の陣では旗幟を不鮮明
158,ます。違っているのは、古典派作家たちの序文の場合、そうした言及は一般に非難から身を護るためのものだということです。『フェードル』の序文で〈古代〉
159,られたものだから」「それがあなたの生き方なんです。それを誰も非難はしませんよ」「そうかも知れない。でも他人を不幸にしやすい
160,を余儀なくされた。レース後の会見でバリチェロは、「アマチュアのやること」と非難。ヨーロッパ中の月曜日の新聞のスポーツ面にも、「カミカゼ攻撃」という見出しが踊ることは
161,いうようなお話があったわけでありますが、今も我が国が世界的に大きな非難の的になっている、いわゆる市場開放をしなくてはならぬ、そういうことで大臣も大変御苦労し
162,詳細に触れざることとするが、これ以来皇族中にも、真崎は頑固なりとの非難起こり、真崎は統制を妨ぐるとて、弾劾はいっそう強くなった。以上述べたる
163,のだろうか、という不安が頭をよぎりました。友達には、大きな声で非難をあびせる中学一年の子供たちも、親に対してはまだまだ信頼し、親の言うことを素直
164,見るだろう。背信行為だと非難するだろうか。ぼくは彼を弁護しない。けれども、非難もしない。それでも、このことだけは高松愚哲の告白としてぼくは連帯責任をとりたい
165,かの大胆な諷刺家（不明）は、キリスト教に帰依した歴代皇帝への偏頗で感情的な非難によって自己の不満を発散させたが、テオドシウスの長子アルカディウス帝を、あの羊というおとなしい単純
166,）そして，集団内には，精を出しすぎてはいけない，怠け過ぎてはいけない，裏切り者，おせっかいは非難，排除されるという集団の掟が各人の行動を規制していたのである。すなわち，集団メンバー
167,手紙が公になったら、桜澤は朱野を自殺に追い込んだ人間として、周囲の非難の的になるだろう。Ｓ医療少年院から追い出されるかもしれない。璃星は桜澤を守りたかった。
168,を使ったり、なんとなく反対をにおわせる話し方をしたりするだけで自分が非難を受けたような気になり、急に激情するからである。■クレッチマーの分類◆
169,こんどは批評家の責任が追及される。これは主として詩人の側から提出される非難である。つまり批評家は、詩に対してそれにふさわしい位置を与えない、詩の
170,や情報を与え、啓発する本ですが、ほとんどの本はユダヤ民族をステレオタイプ化し、無知な非難をするものです。千九百八十年代の中頃、ユダヤ人に関する出版物の多くは、日本経済の乗っ取りを
171,人は、人にすきを見せることを好まない。素直でない人といえるかもしれない。非難の余地のない状態をつくることによって、自分の安全を図ろうとする。その
172,の間から，幣原外相の対中国政策は日本の権益を守れない「軟弱外交」であるとする非難がおこった。１千九百二十七年３月，南京に入城した中国の国民革命軍が，外国の
173,。「やる気がないんだったら、出てけよ！」リハビリをする隼人に、非難の言葉をあびせる入院患者の岩出（石原良純）。「おまえは、しあわせ者なんだよ。
174,た。あすは自分もこうなるかもしれないとの不安が全身を貫いていた。非難をこめておそるおそる、「おれはすてないんか、ええで、すててもう
175,意識をそらす。ＯＤＡ等お金を奪い取る。強く出る国を批判すると、逆に非難を受け、国民から無能国家と突き上げられ、押えきれなくなります。だから、イギリスやロシア・アメリカ
176,だったのである。２それにしても、容赦なく又七郎を撃ち殺した武蔵の非情冷酷さに対する非難の声は、日を追って激しくなるばかりであった。京界隈には、武蔵
177,の研究は、聖堂騎士団に対する―歴史家から歴史家へとたえず繰返されてきた―非難が、フィリップ・ル・ベルとその相談役たちの手でつくられたマキャヴェリ的策略にすぎなかったことを、明らかに
178,全部とりまとめて債権者に引き渡すという執行方法が、法律の予定していない違法なものだという非難はあたらず、これを認めても現行法上格別の不都合があるとは考えられない
179,た。彼はお定まりの小言が聞こえてくるのに耳を傾け、元上司の怒り狂った非難の演説がようやく終わったところで口をはさんだ。「とにかくこれで彼女に怪しま
180,なった。あのとき、なぜ借り手だけが、なぜ桃源社だけが、嵐のような非難を受けたのか。そんな疑問を残したまま、記憶に残る「住専国会」から
181,、依存しているように思われる。このことは、伝統的なカリキュラムの作成者へ向けられる非難の性格から見てとれる。ここでなされる主張は、彼らが依拠していると想定さ
182,相当なものです。いかにも恭しく恋慕の情を綴ったように見せかけていながら、激しい非難（というよりもむしろ悪口に近い）をあびせかけている歌。この激烈さはやはり
183,を、キリスト教神学校に通わせてきた。それらの学校では、少しでもユダヤに対する非難が見えれば、それがたとえ歴史的な事実であろうとも、「ユダヤ人差別だ」との声
184,人が多い。この部分では確かに実利的な御利益で引きつけ、罰でおどすという非難が当たるのかもしれない。しかしその後、会員になった人にとって、その幸せはどの
185,選択は慎重でなければならず、その点で父の計算に甘さがあったという非難は正しいだろうと思う。しかし私は非難しない。結果から言えば、父の
186,にして殆んど英人の習慣を敵とせるものの如くなりき。クロムウェルに対する非難は、彼が議会政治の指導者としては不適格であった点から生まれた、と竹越は
187,非芸術性の論拠となっていた、人間の手の加わらない機械的、自動的な再現という非難を打ち破ることができると考えられたわけである。いわば「冷やかなる玻璃のレンズを透りし
188,、空港出発ロビーの転勤者が夢見るごとき表情をかい間見せても、年甲斐がないなどとあんまり非難はできません。見送り人も見送り人で、妙な友情を発揮して、わざわざ空港の
189,ことにもなっていった。一党独裁体制、人権問題、軍備費の増大などに対する欧米諸国政府、国際世論の非難の高まりがそれである。これらは同時に中国指導部、政治体制への批判へとも発展しがち
190,スペイン領フロリダに侵入、そこにいたイギリス人を処刑したりして、一時は国際法ムシで非難を浴びます。が、国民の支持が多く、かえってスペインはフロリダをアメリカに
191,がミュールを履いてちゃらちゃらとしていたら「この女何考えてるの！」と非難の目を浴びます。ただ、店でモードっぽい格好を必要とされる接客担当などは
192,クリントン大統領は国連総会で、「国連の能力は、増大する責任に追いついていない」ときびしく非難。ガリを信じて米軍を任せたのに、裏切られた―とガリへの
193,、わが国でもよくいわれる現代詩が難解で一般の読者には理解できないという非難である。この非難は詩人たちの最も好まないものであるが、事実、あらゆる近代詩が具え
194,やスペイン、ポルトガルもそうである。しかし実際に完全な消極的立法を成立させようと有権者の非難を覚悟している国は―ドイツをふくめて―一国たりともない。もっとも、スペイン
195,状態になっていない母親を十分な看護もせず病院へ入れてしまった、という非難の一項目が入っていたそうである。こんなに性格の悪い兄弟、姉妹がいる
196,いとま乞いだったのかもしれない。あるいは、自分を十分に探してくれなかったことにたいする、非難と呪詛の言葉だったのかもしれない。ウルリヒは、その死霊をすぐそばに、
197,別の男性と結婚してしまい、そのときブラウンは顔色ひとつ変える風でなかった。彼は非難の実害などとうていおよばない高みにわが身を置いていた。彼はまたして
198,のフックから引っぱりおろし、ごしごしからだを拭いた。まるで、あの思いやりのない、的はずれな非難の言葉を心からこすり落とすかのように。思いやりもなく、真実でもなく
199,声に耳を貸さなかったといって非難されてきた。そのとおりで、この非難は当を得たものだ。しかし、そうした劇を書いていたとしたら、
200,て鳩山パージの早期実施を促したのであろう。幣原も総辞職後に後継内閣が決まらず、世論の非難を前にして、やむなく鳩山を奏請する方針を固めた、との情報もＧＳ
201,中国は国際捕鯨委員会で日本を非難。何で動くものなら何でも食べる中国が日本の捕鯨を非難するわけ？日本はＩＷＣ
202,。だが例のひとり合点の不服を心のなかに包んだ彼女は、はっきりと非難の言葉を口に出そうとはしなかった。ああ、疑心暗鬼などには耳も
203,に関する日本政府の立場は、ａ彼を首相に選出することで、連合国政府と報道機関により激しい非難と不承認に直面するか、ｂ反鳩山勢力が鳩山排除により政治的優位に立つか、単に漁夫の利を
204,にしてあまりにも奇抜であったため、「精神状態を疑う」などと多くの非難を浴び、本人も世論の“空欄”に合わない自分を大いに哀れんでいた（
205,イラク戦争で、血まみれの米兵捕虜や訊問される女性捕虜の映像が世界中に流れ、捕虜虐待との非難が沸き上がった。戦争に捕虜の虐待はつきものだが、第二次大戦では日本が連合軍
206,ユダヤ人入植地建設を推進。国防相の八十二年にはレバノン侵攻を指揮、この時のパレスチナ難民虐殺は国際的な非難を浴び、超タカ派のイメージが世界に広がった。国家基盤相、外相を務めた後、
207,を続けた自由主義者も、この民族のあいだに強いて階級対立を「作り出す」ものという非難に、じゅうぶん答えることができなかった。植民地政策に対案を提起したのも石橋湛山ら少数にとどまった
208,しかし言わなければ、白虎としても腹の虫が収まらない。一方篁の方は、非難などどこ吹く風、といったふうで手にする扇を開いたりしている。仕種と
209,人間は自己に対して最善を行っている」■悩みを完全に克服する方法一、不当な非難は、しばしば擬装された賞賛である。それはときとして、あなたが
210,人は弱いくらいでちょうどいいくらいなの」母親はそう言うと、父親の非難を始めた。父親は性欲が旺盛で、母親が嫌がっても求めてくるので、
211,、途中から面倒になって紹介されるままにしておいた。珍しく英国のインド統治に対する非難を耳にした。地方からの来客も帰って、寂しくなった。インド
212,潜んでいるのが見つかった。イヴンはそれを取り上げると、村の男たちに軽い非難の眼を向けたのである。「こりゃあ、あんたたちの失態だぜ。こんなものを残し
213,今川家を討つ事などありましょうや？」義信の説くところは道理であり、全く非難の余地はなかった。信玄もその説には正面からは反駁しかねた。しかし
214,わからないのよ！」小林富恵は、目にいっぱい涙を浮かべながら、妹に非難の言葉を浴びせかけた。小林富恵の気持ちは、赤かぶ検事には手に取るように
215,先生が多いのでありますけれども、金融監督庁が大蔵省の植民地になるんじゃないかなどという非難もございましたけれども、そんなことは絶対ありませんということを私は常
216,が悪く、ごまかすには実にもってこいありもしない証拠でビンラディンに非難を向けさせなければならないし、アフガニスタンへの侵攻も正当化しなければならないのだ。ビンラディンの
217,や沿海州への勢力拡大を意図した日本は，なおも駐兵を続けたため列国の非難を浴び，巨額の経費と多くの死傷者を出して，千九百二十二（大正十一）年
218,です。ドライブスルーでない場合でも、ファストフード店のカウンターで行われる会話は、気難しい客の非難の言葉さえもが（裏）マニュアルに書き込まれています。これは、工場の
219,たいことを書くもので、日の暮れるころにはマスコミの論調はイギリスに対してはっきり非難の色を強めていた。マサチューセッツ・アベニューのイギリス大使館では、テレビ中継でアメリカ側のＣＹＡ（
220,。判事はアフリカ系アメリカ人であった。このことでアシュクロフトは「人種差別主義者」として囂々たる非難を浴びた。さらにアシュクロフトは、差別撤廃措置にも反対してきた。アファーマティブ・アクションというの
