,0
0,ように、両腕を組み両眼を固く閉ざした広元。やがて、主人実朝への激しい非難の言葉を語り終えた義時が、更に黙想を続け未だ一言の返事もしない広元
1,女たち』の歌詞では「黒人の女の子は一晩中ファックしたがる」というくだりが黒人運動家から非難を浴びた。これは、アトランティック・レコーズ社長のアーメット・アーティガンのとりなしで事なきをえた。ミック
2,をアルカイダの庇護者と決めつけ、アルイスラミアに所属するアブドゥルカシムをその手先だとして双方に非難の矢を射はじめた。こうした方針はＳＲＲＣ最高幹部会議で検討され、アイディード議長が決断した
3,雨滴を飛び散らして脱いだ。菊乃は黙つてその様子を眺めながら、道徳的な非難をじつと心で投げつけてゐる気持になつた。菊乃にはどうして江木がそんな
4,た。「これと似たような手紙は、どうですか？」「非難の手紙なら、いくらでも来ますよ」と沼田は笑って、「駅員
5,であるらしい・・・。「だったら、お金をくれよ！！」という非難にも似た声もあったりするが、どう投稿するか？非常に悩む・
6,できた娘エリゴネ。いずれもオレステスの身内に当たる人々であったが、法廷では激しい非難を彼に浴びせかけた。多くの論議が戦わされた末、陪審員らが肯か否
7,られないのであり、もしマルクスの思想を全体主義的だというのなら、ヨーロッパの政治思想全体がその非難を受ける可能性があると考えていた。（６）本書、九ページ。この点
8,一角獣アドルフとの交歓のエピソード（第八章）を描いたものもあり、スミザースは世論の非難を恐れて、これを発表することを差し控え、ビアズレーに内証で湮滅してしまったという
9,新）委員そうすると、我々は戦争に一方的に加担をするというような非難を受けるおそれも出てくる。それが第一線に復帰する、戦力になる、こういうこと
10,でしかない。それが証道上人を追い出して東寺の大勧進を拝命したのだから、当然非難は集中してくる。しかし、文観は動じなかった。彼が志すのは、妙適興隆
11,ながら、私と似た立場を理解しようと努力もしたし、ラスコリニコフの残忍さを非難もした。この本を全部読み終えた後、私がこのように生きていてもいい
12,が自分でも驚くほど冷たい口調で言ったので、香代子は「えっ？」と非難の目を振り向けた。「いいえ、そんなにはっきりした形ではありません
13,その人達に相談してはいかがでしょうか。そうすればその上司は多くの人の非難を浴び、会社に居づらくなるでしょう。
14,計画を立てている」と一席ぶったのをもとに書かれたものだろう。劇作家協会の非難を逆手にとって探偵奇談「女中難」のＰＲを試みているようなフシもある。「女中難」
15,、インドを訪問し、「アフガンでの介入政策は失敗した」と、パキスタンの外交姿勢を非難。アブドラ外相も同日、タジキスタンを訪れ、ロシアのイワノフ国防相と会談し、ロシアからの武器供与も
16,可能ですよ」部屋を埋めた母親たちは、動揺した様子を見せ、数人が非難の溜息を洩らした。游子が慌ててとりなす調子で、「ですから、家庭
17,た。風早はソファーの肘掛けを、爪でコツコツ叩き始めた。二人分の無言の非難を受け止めて、潮は静かに言った。「―私のそういう態度が
18,通りだった。昨日の一方的な取材打ち切りについての、わたしへの擁護と報道陣への非難。わたしに好意的な記事ではある。けれど。おかしいのはそもそも、強制的に
19,政治総裁松平春嶽が打ち出した新制度で、幕府内はかなり騒ぎたっていたのである。当然新政策に対する非難と人事問題である。まだ旧体制下の要人も多く残っており、春嶽に対する風当たりは強い。この
20,めでたしめでたし。皆が納得する平和的な結末。３ゲームキャラはいらない！？燃燈道人に非難が集中！高評価まちがいなし！！作者のエゴで（？）ゲームから原作に掟破りの
21,男の子の母親は、ときには女を捨てる覚悟も必要ですか？なんだか非難の回答が多いというか意味わかんないという回答者が多いですが、質問の意味
22,平和的手段で抗議し続けたことは、裁判所からみても、ほめられこそされ、決して非難さるべきことではないからだ。なお山口記者はモスクワ在住当時も「経済班」の欧米オルグ担当として活躍し
23,なかなか仮釈放を許可しなくなった。出所者が強盗殺人等の再犯をたて続けに起こし、社会の非難を浴びたからである。いつになったら仮釈放になるのか皆目見当がつか
24,の的となってしまった。そしてダドリーがすでに結婚していたこともあり、ふたりの関係に対して非難の声が上がりはじめていた。ダドリーは妻をアビングドン近くの親戚の家に預けて
25,日米安保にただ乗りして経済のみに力を注ぎ、アメリカに洪水のように輸出しているという非難に対しても、戦争放棄を決めた日本国憲法第九条は、どこから見ても米国製で、日本
26,が始まり、成績が芳しくなければ“ＣＭに出すぎるからこうなったんだ”くらいの非難はされると覚悟しておいた方がいいでしょうね」名物オーナーがかつて「日本の
27,、あの新参の軽輩は、絵図帳面ばかりを振り廻して威張っておる。何たる了見か」という非難が拡まったのである。「私は力仕事を厭うものではございません。どなた
28,官庁軍部方面の指示に即応して、ひたすら戦争遂行に協力したから、その方面からのお小言や非難をあまり受けたことがない。そればかりでなく、昨年は陸軍報道部から感謝状さえ頂いている
29,し、次のグラフィックアーツ州大会で賞をもらえるかもしれないが。会員制志向の劇場によく浴びせられる非難は、その観客の相当部分がいやらしい中流階級だというものだ。ロシア革命の時は、手
30,など裸の多さが売り物；エログロ低俗化）に表現されたことなどから、事件当事者などから非難が寄せられ報道倫理上問題となったり、警察の取材協力を断られた事もあった。そして
31,を中心課題とした運動にはなかなか参加することができなかった。家父長的な家族に対するフェミニストの非難に対して、そのような家族体系を擁護するメキシコ系の女性もいた。しかし、次第に多く
32,、あとで人伝に聞いたことがあります。小説家の癖に二股かけて…という非難は、なにも平林さんばかりでなく、当時、随分と耳にしたものです。
33,のように問題をすり替えて言う。最も多い言い方は、自分の直属の上司に対する非難で、曰く、「あの上司は能力がなく、管理者としてふさわしくない」「あの人
34,。あるレベルに達していない選手に限って、他人と違うことをする選手に非難を浴びせる。こいつは、はめられたのだ。そのことを教えておくべきだろう
35,「政治的必要の意味を解し」た行為として、積極的に肯定されており、また王位簒奪者という非難に対しても、彼にその意図がなかったことをあげて、弁明につとめている。
36,することだの、赤い街道の盗賊の手口だのって、さんざんあんたら偉い連中の非難をあびるんだろ」「もう、さんざん非難はあびてるでしょうに。いやという
37,ある方は参加してください。でも私、遊びに行くので、お祭りは欠席です。相当非難の目を向けられましたが、そんなことではめげません。せっかくの休み
38,仕置きのことは想像もしたくなかった。拘置房行きだな。身内贔屓だという父さんに対する非難も厳しいものになるだろう。父さんはぼくとの養子縁組を解消するだろうし、そうさ
39,不作為も作為と同価値なので作為と同様に処罰できる，と解するならば，類推解釈の非難を免れないであろう。不真正不作為犯を認めることが罪刑法定主義に反しないとするためには，条文解釈
40,が多くの人を納得させるからです。役所が先例にこだわるのも、失敗や非難というリスクを回避するためです。先例ばかりを持ち出して、新しいことに取り組もうとし
41,。誰も私を遮るものはなかった。彼らの、一様に暗い、そして、非難をこめた視線を除いては。そこでは、女の横顔をまじまじと
42,日本の政党政治は弱体化。また、軍部が政府決定や方針を無視して暴走を始め、非難に対してはこの権利を行使され政府はそれを止める手段を失うことになる。その後、
43,精神的自由の規制に対する違憲判決を下すには至っておらず、学説からリップ・サーヴィスにすぎないとして非難をあびている。２特別権力関係論（１）特別権力関係論の内容伝統的な特別権力関係論によると、
44,てよい。こうしたグルジアの動きに対しモスクワの保守派と軍は、口先の非難こそすれ、まだ何も目立った行動には出ていない。ヤゾフ国防相は八十九年４月の
45,はあり得るだろうか？…そうだ。あり得るのだ」。「たとえこの書物がにがい非難を含んでいるとしても、それらは人生に当てられたのではない。むしろ反対である
46,すすぐためにほかならない。だが、物語が進むにつれて、本能寺から脱出したことへの非難は、信長亡き後の織田家の将来を決める「清州評定」の時に、信忠の
47,の歌を放吟することもあった。そんな事情は耳に入っているのだろうが、園長はべつに非難の色はみせなかった。おれは恵まれている。いろんな人に助けられていると思っ
48,でもあるのは、イソップの昔から他の鳥の羽を体にさして非難をあびたカラスの寓話にあるとおりである。「着る」という行為がただ保温の
49,は執拗に説明をつづけた。もしこれ以上犠牲者を出すようなことになれば、社会的な非難が会社に集中することは、火を見るよりも明らかだった。殊に安全管理に対する社会的要請
50,言った。手は止まっており、「ひとりじゃ、来ることができなかった？」非難の調子はなかった。静かで、悲しみのようなものがにじんでいた。
51,非難記事が掲載されていたが）、おそらく彼のもとに直接電話などで多くの非難が寄せられたからではないかと推察する（こういった局面ですぐ頭に血が
52,「無事育つといいですよね。世界中があっと驚きます」「驚くより、非難が集中するだろう。自然の摂理に反するとね。しかしクローン人間作りよりはましだ。少なくとも
53,戦後のわが国のそれは，「子どもの基礎学力が身につかない」という非難が集中した。では同様に子どもを大事にし，子ども一人ひとりの興味・経験を尊重する「
54,ソビエトの軍事力増強等を非難をするというか、特に、ことしはソビエトの軍備増強については非難をするが、アメリカの軍拡については評価をする、こういう記述に実はなっている
55,エイモン・プリーンとなれば、話は別だが…「いいか、これは聞き流せない非難だぞ。そんな話を聞きたくはない。気分を落ち着けてよく考えてみたらどう
56,麻酔薬の最たるものとされているケープコッドみたいな田舎では、そういうことばが非難なのか敬意の表現なのか、可能性は五分五分だ。こちらにまっすぐ向け
57,適性を疑われることになってしまう。どうしたら民の動揺を収め、かつ朝廷に対する非難を回避できるのか。何度も閣議が設けられる中、声を上げたのは
58,のように、何かをしようとする自我のほうが大きくなっている状態です。非難の声が聞こえなくなってしまうのです。超自我はどこから生まれるかこの良心、あるいは
59,意味である。しかし後者は単なる感想だが、前者はいわばレッテルだ。私は敢えて非難の意味を込めたレッテル、つまり評価を下した。そのように評価せざるをえない、と
60,が、それを兄が悪く誤解邪推して、弟を悪賢い裏切り者と非難しました。この非難はどんな人にもショックを与えるほどのものでした。アンドルーもわたしも考えまし
61,白書は日本の市場閉鎖性とかアンフェア経済慣行なども指摘してはいるが、日本への非難よりもまずはアメリカががんばろう、と呼びかけている点が特徴である。だからまさに「
62,ムスリムはあくまでマイノリティである。政権を握る内陸部の諸民族―その多くはキリスト教徒である―に対する非難や怨嗟の声を、スワヒリ・コーストではしばしば耳にした。私が出会った
63,はお離れ下さい。でもせめて、お発ちの折に、お身の安全だけは。あの恥ずべき非難、ご自分の名誉だけはお守りになり、父上に、あの祈願を取り消していただかなく
64,者等につきまして消極的評価がなされたということ、あるいはそれに伴ういわゆる世間の非難の声というものももちろんあろうかと思います。そのほかに、犯罪によって検挙され
65,て道真は、ついに右大臣まで昇りつめる。その時、時平を始めとした公卿たちから、非難の声が上がった。そして道真に、右大臣辞任を迫った。もちろんその理由はと
66,は途上国において家族計画の名の下に中絶のため国連のカネが使われていると非難を続けてきた）。長官就任後のアシュクロフトについてのエピソードもご紹介しよう。アメリカ司法省の
67,いる人々の論調が一種自重的な調子を帯びるようになり、学校や教師に対するあからさまな非難が鳴りをひそめるようになった。従来、こうした事件に対してマスコミの表層
68,という言葉が好きなんだろう？」ジョナスがじれたようにいった。「連中は非難の言葉、間違いなく嘲笑の言葉として使っているがね。きみは“カルト”がラテン語
69,もの、と言うべきだろう。曖昧、どっちつかず、煮え切らない、など、国際的な非難を浴びながらも、中間を大切にする伝統を生かして、戦後に高度な消費社会
70,を持っていた。テレサの軽率な行動を「国家の恥」と糾弾し、非難をいっせいに始めた母国・台湾に強制送還したら、歌手生命にもかかわるとみた日本の関係者ら
71,気になっていなかったのだということを知って啞然とする。ニュージーランド国内の非難を、一身に受ける立場にある日本の光藤俊雄駐ニュージーランド大使は、この事件がエスカレートするのに気
72,ながら、なぜ米国を支持するのか？パキスタン政府は、米国同時多発テロ事件直後から、ビンラディンのテロ行為を非難、米国への情報提供ばかりか、米軍によるアフガニスタン空爆に空軍基地の使用も許可するなどを決定し
73,の提議により４月から５月までの間３回にわたり南北スポーツ会議が開かれたが，ビルマ爆弾テロ事件を巡る非難の応酬等に終始し，実りある進展は見られなかった。しかし，９月初の韓国水害
74,の側からも好かれません。エラスムスの場合がそうであったように両派から非難を浴びせかけられます。それでもエラスムスは、あえて観客でありつづけました。▽キメラＣｈｉｍｅｒａ（
75,作者の真意を韜晦させることになったのだろう。讃美もしないが、暴発として非難を加えてもいないのである。ただ、この理想家の純粋な行動（政治テロ）
76,オドゥールが仕込んだ『野手にぶつかっていくスライディング』を与那嶺はそのまま実行した。たちまち非難の渦だ。殺人スライディングの名が冠せられ、敵の野手はもちろん、観客も怒り出す
77,十三１５参照）。十一原文は「言葉の行為、業」。七十人訳は「虚偽による非難の言葉、口実」。十二ケレーで読む。十五―二十一節での「娘」への
78,ん。また、隠居同然の天皇を倒したとしても、倒す正当な理由が見つからないため非難をあび、かえってこれが引き金になって殺される可能性もでてくるかもしれない
79,に、空想がいろいろと広がる。未知なものに対しては誇張して喧伝される。日本に対する非難があれば一方で、途方もないくらいの賞賛も起きる。私たち日本人は、近代的
80,自殺。そして、無言の非難。父親のそばにいてやらなかった娘への非難。苦しんでいる父親をよそに、勝手な生き方をしていた娘への非難。
81,を装った。そして教授会自治はいつの間にか既得権の擁護者と化したとの非難を受けるにいたる。千九百九十年代の大学の合理的な管理運営体制の確立に向けての提案
82,からといって、契約どおり三ヵ月の予告期間で従業員の首をどんどん切ったら、囂々たる非難を浴びるだろう。このことは、外国人が日本人を雇用した場合にしばしば現実の
83,そうですね。そうとは知りませんでした。竹島問題で、韓国は日本の非難を繰り返し、ヨン様も「竹島は韓国のも」という発言をしているのにも
84,がはたして賢明であるのかどうかという彼の疑いは―彼らのホモセクシャルに対する彼自身の非難は別にして―その選出が「ある種の災難を招く」ことになる
85,になってくるのだ。男の愚痴をこぼすとき、女は得てして本気で彼を非難の的にしたいわけではなく、なにがしかの解答を求めているわけでもなくて
86,ｉｂｉｄ．ｖｏｌ．ＩＩ．ｃｈａｐ．ＸＸＸＩＩＩ．また太平天国の乱にたいする武力干渉に反対し、平和と不干渉政策を唱える政派の非難にたいして、オールコックは「よしそれは正しくないにしても、必要なのだ
87,の小中学校、高校の歴史の教科書に、日本のやった残虐行為が書いてないという非難は、ほとんどが日本の教科書など見たこともない、日本語など読めない人びとから
88,を楽しもうと、懸命にそうでないふりをしながら、公衆の眼前では数えきれない非難を浴びせて快楽を粉砕するのです。もしもあなたが快楽、つまり、痴愚の薬味を
89,娘さんは自分の席から立ち上がって、木の娘について、あなたがおっしゃったことで非難までしたんですよ―そうでしたね、ちがってますか？それでは、わたしたち
90,とまどったのかを考えた。考えすぎとはわかっているが、その言葉は私に対する非難に聞こえた。チェルシーまで歩き、たぶんこの時間には教授は膝の上に
91,と言えます。反対の躁状態では、超自我がすっかりおとなしくなってしまい、道徳的な非難を振りかざす人がいなくなってしまったかのように、あるいは、やりたいことは
92,日程を変えたが、人的被害は限定的だった。数十万人とも二百万人ともいわれる非難が奏功した形。カトリーナの教訓が生きた形だが、それにしても自然災害の影響
93,ように、「大人のくせに子供のものを盗むの？」といった、単なる非難の目だけで見ていたとは思いません。だとすれば、驚きの目か
94,、自分への失望と戦おうとするのです。親と同じように、他人への非難で自分がダメな人間だという思いから目をそらそうとします。他人を非難し
95,日本においても外国人の地方参政権などが議論になっており，政治家の人種差別発言はしばしば国際的な非難をよんだ。このように，少数民族や外国人の人権に細心の注意をはらう努力
96,過去は現在形動詞で（冒険家、オートバイで南極に到達）（米、日本の貿易政策を非難）（捕鯨団体、禁漁区計画を棚上げ）未来はｔｏプラス動詞で（中毒患者用のリハビリセンターが、大阪に
97,を避けるよう、移動式に造られていないですよ」と言いはった。なるほど、その非難は今でも通用する。なぜなら、われわれの家というのは非常に扱いにくい財産である
98,な暴言の報道をきっかけに、日栄と商工ファンドをリーディングカンパニーとする商工ローン業界に対して、集中豪雨的な非難がメディアから加えられることになった。新聞やテレビメディアで連日繰り返された激烈な商工ローンバッシング
99,追い詰める冷酷非道な読売グループには毅然たる態度で臨んでいきたいと思います」と読売新聞グループを非難。また、中村さんは東京ディズニーランドを運営しているオリエンタルランド（千葉県浦安市）の出身であることから、
100,、思考においてありとあらゆるかぎりの罪を犯すが、しかし外面的には、われわれは非難の余地がない。彼女は世間体におもねており、そして混乱していた。不思議なこと
101,広がっていくに違いない。チベットのこれまでの発展こそが、根も葉もないすべての非難や質疑に対する最も説得力のある答えとなる」としている。写真は
102,別の仕方で定式化される場合があり、この場合は反駁することがより難しい。しかし非難がこの形態をとる場合には、多分、それは論駁されるべきものでない。少なくとも
103,緊急避難的な修理のあり方、全国に拡大し有名な組織となった保晃会は、マスコミの非難の格好の対象となった。著名な新聞が保晃会を非難する記事を掲載し、会
104,であったことはむしろ誇りにさえ思ってきた。歴史的に侵略性があるという非難がアジアの一部国家にあるのは、「本来の戦争そのもの」の性格からし
105,冒頭の問いにもどるならば，「ブルセラ」や「援助交際」があれほど世間の非難や嘆きを引き起こす理由はそこにある。そこで，女子生徒というものが，「
106,抑えた方がいいですよ。片思いだから楽しいんです。行動してしまえば、責任と非難が伴いますよ。
107,、力いっぱい足をふみならしだしたのである。トンマーゾ・ブシェッタをののしっていないマフィアは、自分たちの弁護人に非難の言葉をあびせていた。「なにかやれ！金なら、いくらでも
108,なこの類型においては、差異を同質化するという非難を免れうる。もっとも、この非難は、これとは別の仕方で定式化される場合があり、この場合は反駁すること
109,（底曳き）が土佐沖にも出没するようになって打撃を受けていたこともあって、非難の視線が部落に集中するようになった。漁師たちのトロール船反対運動は漁民闘争として発展しながらも
110,と言っているが、その見方は正しい。しかし、だからといって米国の政策を非難だけしていればいいというわけではない。消極的行動ではなく、何ができるかを考えなければならない段階に
