,compound unit,context,segmented,split units,the unit is split,compound unit form,unexpected segmentation,unexpected joining
0,参議院,ほどの注目の的。質疑にじっと耳を傾ける。それにしても、いつから参議院の委員会の現場は、こんなにも野次がうるさくなったのか？それも,"['ほど', 'の', '注目', 'の', '的', '。', '質疑', 'に', 'じっと', '耳', 'を', '傾ける', '。', 'それにしても', '、', 'いつ', 'から', '参議院', 'の', '委員', '会', 'の', '現場', 'は', '、', 'こんなにも', '野次', 'が', 'うるさく', 'なっ', 'た', 'の', 'か', '？', 'それ', 'も']",['参議院'],NO,参議院,NO,NO
1,参議院,三十日以内に選挙を行うという規定の例外措置といたしまして、これらの期間が国会または参議院の緊急集会の開会中または閉会の日から三十日以内にかかる場合にあっては、その閉会,"['三', '十', '日', '以内', 'に', '選挙', 'を', '行う', 'という', '規定', 'の', '例外', '措置', 'と', 'いたし', 'まし', 'て', '、', 'これら', 'の', '期間', 'が', '国会', 'または', '参議院', 'の', '緊急', '集会', 'の', '開会', '中', 'または', '閉会', 'の', '日', 'から', '三', '十', '日', '以内', 'に', 'かかる', '場合', 'に', 'あっ', 'て', 'は', '、', 'その', '閉会']",['参議院'],NO,参議院,NO,NO
2,参議院,での数字があるからです。彼ら３人の票が民主党から消えることで、参議院での採決が際どいラインとなるのです。結局、離党した３人は自分が所属する,"['で', 'の', '数字', 'が', 'ある', 'から', 'です', '。', '彼ら', '３', '人', 'の', '票', 'が', '民主党', 'から', '消える', 'こと', 'で', '、', '参議院', 'で', 'の', '採決', 'が', '際どい', 'ライン', 'と', 'なる', 'の', 'です', '。', '結局', '、', '離党', 'し', 'た', '３', '人', 'は', '自分', 'が', '所属', 'する']",['参議院'],NO,参議院,NO,NO
3,参議院,を控えていた河本に一気に傾斜していった。そして、平成八年に河本は参議院から父親の地盤を継承して衆議院兵庫十二区に鞍替え。当選は果たしたが、対立候補にわずか,"['を', '控え', 'て', 'い', 'た', '河本', 'に', '一気に', '傾斜', 'し', 'て', 'いっ', 'た', '。', 'そして', '、', '平成', '八', '年', 'に', '河本', 'は', '参議院', 'から', '父親', 'の', '地盤', 'を', '継承', 'し', 'て', '衆議院', '兵庫', '十', '二', '区', 'に', '鞍替え', '。', '当選', 'は', '果たし', 'た', 'が', '、', '対立', '候補', 'に', 'わずか']",['参議院'],NO,参議院,NO,NO
4,参議院,は順次御発言を願います。○田沢智治君私が質問をするに際しまして、まず参議院の文教委員会の構成員でありました森山眞弓先生がこのたび文部大臣に就任したこと、我が文教委員会全体を,"['は', '順次', '御', '発言', 'を', '願い', 'ます', '。', '○', '田沢', '智治', '君', '私', 'が', '質問', 'を', 'する', 'に際しまして', '、', 'まず', '参議院', 'の', '文教', '委員', '会', 'の', '構成', '員', 'で', 'あり', 'まし', 'た', '森山', '眞弓', '先生', 'が', 'この', 'たび', '文部', '大臣', 'に', '就任', 'し', 'た', 'こと', '、', '我が', '文教', '委員', '会', '全体', 'を']",['参議院'],NO,参議院,NO,NO
5,参議院,解散するっていうのは、分かりにくいよな。まあ、残念ながら、小泉総理をもってしても参議院は解散できないんだよ。郵政民営化は前の選挙公約で、小泉政権の最優先課題だから、参議院,"['解散', 'する', 'っていう', 'の', 'は', '、', '分かり', 'にくい', 'よ', 'な', '。', 'まあ', '、', '残念', 'ながら', '、', '小泉', '総理', 'を', 'もっ', 'て', 'し', 'て', 'も', '参議院', 'は', '解散', 'でき', 'ない', 'ん', 'だ', 'よ', '。', '郵政', '民営', '化', 'は', '前', 'の', '選挙', '公約', 'で', '、', '小泉', '政権', 'の', '最', '優先', '課題', 'だ', 'から', '、', '参議院']",['参議院'],NO,参議院,NO,NO
6,参議院,解散するっていうのは、分かりにくいよな。まあ、残念ながら、小泉総理をもってしても参議院は解散できないんだよ。郵政民営化は前の選挙公約で、小泉政権の最優先課題だから、参議院,"['解散', 'する', 'っていう', 'の', 'は', '、', '分かり', 'にくい', 'よ', 'な', '。', 'まあ', '、', '残念', 'ながら', '、', '小泉', '総理', 'を', 'もっ', 'て', 'し', 'て', 'も', '参議院', 'は', '解散', 'でき', 'ない', 'ん', 'だ', 'よ', '。', '郵政', '民営', '化', 'は', '前', 'の', '選挙', '公約', 'で', '、', '小泉', '政権', 'の', '最', '優先', '課題', 'だ', 'から', '、', '参議院']",['参議院'],NO,参議院,NO,NO
7,参議院,にも、多くの国民の中にもまだ根強くあって、結局、この再建計画は参議院で廃案になってしまったのである。,"['に', 'も', '、', '多く', 'の', '国民', 'の', '中', 'に', 'も', 'まだ', '根強く', 'あっ', 'て', '、', '結局', '、', 'この', '再建', '計画', 'は', '参議院', 'で', '廃案', 'に', 'なっ', 'て', 'しまっ', 'た', 'の', 'で', 'ある', '。']",['参議院'],NO,参議院,NO,NO
8,参議院,、参議院で過半数を獲得するためには二十三議席が必要であった。そのとき、公明党の参議院での議席数は二十四。公明党が、自民党の提出している金融機能早期健全化緊急措置法案に賛成すれば法案を成立さ,"['、', '参議院', 'で', '過半数', 'を', '獲得', 'する', 'ため', 'に', 'は', '二', '十', '三', '議席', 'が', '必要', 'で', 'あっ', 'た', '。', 'その', 'とき', '、', '公明党', 'の', '参議院', 'で', 'の', '議席', '数', 'は', '二', '十', '四', '。', '公明党', 'が', '、', '自民党', 'の', '提出', 'し', 'て', 'いる', '金融', '機能', '早期', '健全', '化', '緊急', '措置', '法案', 'に', '賛成', 'すれ', 'ば', '法案', 'を', '成立', 'さ']",['参議院'],NO,参議院,NO,NO
9,参議院,、参議院で過半数を獲得するためには二十三議席が必要であった。そのとき、公明党の参議院での議席数は二十四。公明党が、自民党の提出している金融機能早期健全化緊急措置法案に賛成すれば法案を成立さ,"['、', '参議院', 'で', '過半数', 'を', '獲得', 'する', 'ため', 'に', 'は', '二', '十', '三', '議席', 'が', '必要', 'で', 'あっ', 'た', '。', 'その', 'とき', '、', '公明党', 'の', '参議院', 'で', 'の', '議席', '数', 'は', '二', '十', '四', '。', '公明党', 'が', '、', '自民党', 'の', '提出', 'し', 'て', 'いる', '金融', '機能', '早期', '健全', '化', '緊急', '措置', '法案', 'に', '賛成', 'すれ', 'ば', '法案', 'を', '成立', 'さ']",['参議院'],NO,参議院,NO,NO
10,参議院,郵政民営化の件ですが、なぜ参議院で否決されると衆議院を解散するのですか？衆議院で可決されているのですよね？それ,"['郵政', '民営', '化', 'の', '件', 'です', 'が', '、', 'なぜ', '参議院', 'で', '否決', 'さ', 'れる', 'と', '衆議院', 'を', '解散', 'する', 'の', 'です', 'か', '？', '衆議院', 'で', '可決', 'さ', 'れ', 'て', 'いる', 'の', 'です', 'よ', 'ね', '？', 'それ']",['参議院'],NO,参議院,NO,NO
11,参議院,、小泉氏が、かねて主張するとおりに郵政民営化なる政策を実現したいと熱望しているのだとすれば、参議院で否決されたことは、大変残念なことでしょう。あらかじめの票読みで不可能だと,"['、', '小泉', '氏', 'が', '、', 'かねて', '主張', 'する', 'とおり', 'に', '郵政', '民営', '化', 'なる', '政策', 'を', '実現', 'し', 'たい', 'と', '熱望', 'し', 'て', 'いる', 'の', 'だ', 'と', 'すれ', 'ば', '、', '参議院', 'で', '否決', 'さ', 'れ', 'た', 'こと', 'は', '、', '大変', '残念', 'な', 'こと', 'でしょ', 'う', '。', 'あらかじめ', 'の', '票読み', 'で', '不可能', 'だ', 'と']",['参議院'],NO,参議院,NO,NO
12,参議院,思います。それから次は、二院制の問題で、現行憲法上、一院が衆議院、二院が参議院と、こういうことになっております。参議院のあり方についても憲法上考える余地はないのか,"['思い', 'ます', '。', 'それから', '次', 'は', '、', '二院', '制', 'の', '問題', 'で', '、', '現行', '憲法', '上', '、', '一院', 'が', '衆議院', '、', '二院', 'が', '参議院', 'と', '、', 'こういう', 'こと', 'に', 'なっ', 'て', 'おり', 'ます', '。', '参議院', 'の', 'あり方', 'について', 'も', '憲法', '上', '考える', '余地', 'は', 'ない', 'の', 'か']",['参議院'],NO,参議院,NO,NO
13,参議院,思います。それから次は、二院制の問題で、現行憲法上、一院が衆議院、二院が参議院と、こういうことになっております。参議院のあり方についても憲法上考える余地はないのか,"['思い', 'ます', '。', 'それから', '次', 'は', '、', '二院', '制', 'の', '問題', 'で', '、', '現行', '憲法', '上', '、', '一院', 'が', '衆議院', '、', '二院', 'が', '参議院', 'と', '、', 'こういう', 'こと', 'に', 'なっ', 'て', 'おり', 'ます', '。', '参議院', 'の', 'あり方', 'について', 'も', '憲法', '上', '考える', '余地', 'は', 'ない', 'の', 'か']",['参議院'],NO,参議院,NO,NO
14,参議院,がある。野党の民主党は典型的な動乱型のパターンになっている。実際には、参議院や各派閥を率いる首領の性質を加味しなければならないが、以前の数値と比較して見ると,"['が', 'ある', '。', '野党', 'の', '民主党', 'は', '典型', '的', 'な', '動乱', '型', 'の', 'パターン', 'に', 'なっ', 'て', 'いる', '。', '実際', 'に', 'は', '、', '参議院', 'や', '各', '派閥', 'を', '率いる', '首領', 'の', '性質', 'を', '加味', 'し', 'なけれ', 'ば', 'なら', 'ない', 'が', '、', '以前', 'の', '数値', 'と', '比較', 'し', 'て', '見る', 'と']",['参議院'],NO,参議院,NO,NO
15,参議院,大仁田厚先生はどんな仕事してますか？郵政民営法が参議院で否決して暴動になったときに備えて、体を鍛えていると思います。,"['大', '仁田', '厚', '先生', 'は', 'どんな', '仕事', 'し', 'て', 'ます', 'か', '？', '郵政', '民営', '法', 'が', '参議院', 'で', '否決', 'し', 'て', '暴動', 'に', 'なっ', 'た', 'とき', 'に', '備え', 'て', '、', '体', 'を', '鍛え', 'て', 'いる', 'と', '思い', 'ます', '。']",['参議院'],NO,参議院,NO,NO
16,参議院,千九百四十八）年二月の衆議院では、芦田が二百十六票、吉田が百八十票だったが、参議院では吉田が百四票、芦田が百二票になるという逆転現象が起こった。衆議院の優位性,"['千', '九', '百', '四', '十', '八', '）', '年', '二月', 'の', '衆議院', 'で', 'は', '、', '芦田', 'が', '二', '百', '十', '六', '票', '、', '吉田', 'が', '百', '八', '十', '票', 'だっ', 'た', 'が', '、', '参議院', 'で', 'は', '吉田', 'が', '百', '四', '票', '、', '芦田', 'が', '百', '二', '票', 'に', 'なる', 'という', '逆転', '現象', 'が', '起こっ', 'た', '。', '衆議院', 'の', '優位', '性']",['参議院'],NO,参議院,NO,NO
17,参議院,の状況と同時に、自己の信念や衆議院よりも長期的な視野に立つために、参議院の任期は保証されているのです。ということは、衆議院議員と同じ質の政治家,"['の', '状況', 'と', '同時に', '、', '自己', 'の', '信念', 'や', '衆議院', 'より', 'も', '長期', '的', 'な', '視野', 'に', '立つ', 'ため', 'に', '、', '参議院', 'の', '任期', 'は', '保証', 'さ', 'れ', 'て', 'いる', 'の', 'です', '。', 'という', 'こと', 'は', '、', '衆議院', '議員', 'と', '同じ', '質', 'の', '政治', '家']",['参議院'],NO,参議院,NO,NO
18,参議院,感じているわけであります。したがって、今この委員会で審議をされました、あるいは参議院も含めて衆参全体で審議をされました答弁の内容、また、ほぼコンセンサスが,"['感じ', 'て', 'いる', 'わけ', 'で', 'あり', 'ます', '。', 'したがって', '、', '今', 'この', '委員', '会', 'で', '審議', 'を', 'さ', 'れ', 'まし', 'た', '、', 'あるいは', '参議院', 'も', '含め', 'て', '衆参', '全体', 'で', '審議', 'を', 'さ', 'れ', 'まし', 'た', '答弁', 'の', '内容', '、', 'また', '、', 'ほぼ', 'コンセンサス', 'が']",['参議院'],NO,参議院,NO,NO
19,参議院,ということでしょうか。○政府参考人（塩尻孝二郎君）今委員御指摘のとおり、川口当時外務大臣が衆議院の外務委員会あるいは参議院の外交防衛委員会で、在勤手当に関する基礎資料となる各種データを外務省のホームページに公開していくというお考えを,"['という', 'こと', 'でしょ', 'う', 'か', '。', '○', '政府', '参考', '人', '（', '塩尻', '孝二郎', '君', '）', '今', '委員', '御', '指摘', 'の', 'とおり', '、', '川口', '当時', '外務', '大臣', 'が', '衆議院', 'の', '外務', '委員', '会', 'あるいは', '参議院', 'の', '外交', '防衛', '委員', '会', 'で', '、', '在勤', '手当', 'に関する', '基礎', '資料', 'と', 'なる', '各種', 'データ', 'を', '外務省', 'の', 'ホームページ', 'に', '公開', 'し', 'て', 'いく', 'という', 'お', '考え', 'を']",['参議院'],NO,参議院,NO,NO
20,参議院,この法律も審議の途中で機関委任事務になりかけたのです。去年（千九百九十七年）の十一月末、参議院で自民党が「機関委任事務にしよう」と言い出したのです。私は、「機関委任事務にする,"['この', '法律', 'も', '審議', 'の', '途中', 'で', '機関', '委任', '事務', 'に', 'なり', 'かけ', 'た', 'の', 'です', '。', '去年', '（', '千', '九', '百', '九', '十', '七', '年', '）', 'の', '十一月', '末', '、', '参議院', 'で', '自民党', 'が', '「', '機関', '委任', '事務', 'に', 'しよ', 'う', '」', 'と', '言い', '出し', 'た', 'の', 'です', '。', '私', 'は', '、', '「', '機関', '委任', '事務', 'に', 'する']",['参議院'],NO,参議院,NO,NO
21,参議院,、公明支持層の票がなければ当選しなかった候補が大分いると思われます。さらに参議院では自民党は単独過半数の議席をもっていません。公明の議席とあわせて,"['、', '公明', '支持', '層', 'の', '票', 'が', 'なけれ', 'ば', '当選', 'し', 'なかっ', 'た', '候補', 'が', '大分', 'いる', 'と', '思わ', 'れ', 'ます', '。', 'さらに', '参議院', 'で', 'は', '自民党', 'は', '単独', '過半数', 'の', '議席', 'を', 'もっ', 'て', 'い', 'ませ', 'ん', '。', '公明', 'の', '議席', 'と', 'あわせ', 'て']",['参議院'],NO,参議院,NO,NO
22,参議院,憂いて書いた論文が最優秀作品に選ばれた田母神空幕長は更迭、退職させられた。参議院の外交国防委員会に参考人として招致されたにも関わらず冒頭からその発言は封じられた,"['憂い', 'て', '書い', 'た', '論文', 'が', '最優秀', '作品', 'に', '選ば', 'れ', 'た', '田母神', '空', '幕', '長', 'は', '更迭', '、', '退職', 'さ', 'せ', 'られ', 'た', '。', '参議院', 'の', '外交', '国防', '委員', '会', 'に', '参考', '人', 'として', '招致', 'さ', 'れ', 'た', 'に', 'も', '関わら', 'ず', '冒頭', 'から', 'その', '発言', 'は', '封じ', 'られ', 'た']",['参議院'],NO,参議院,NO,NO
23,参議院,し、質疑を行います。質疑のある方は順次御発言願います。○竹村泰子君先日来、参議院でも国旗・国歌の審議が始まりまして、それぞれの立場でいろいろ御議論がございました,"['し', '、', '質疑', 'を', '行い', 'ます', '。', '質疑', 'の', 'ある', '方', 'は', '順次', '御', '発言', '願い', 'ます', '。', '○', '竹村', '泰子', '君', '先日', '来', '、', '参議院', 'で', 'も', '国旗', '・', '国歌', 'の', '審議', 'が', '始まり', 'まし', 'て', '、', 'それぞれ', 'の', '立場', 'で', 'いろいろ', '御', '議論', 'が', 'ござい', 'まし', 'た']",['参議院'],NO,参議院,NO,NO
24,参議院,国家的な事業についての便益考査がなかったかというと、これは皆さん、私も参議院にかつていましたが、割と年次として新しい方がおられるし、その方々は,"['国家', '的', 'な', '事業', 'について', 'の', '便益', '考査', 'が', 'なかっ', 'た', 'か', 'と', 'いう', 'と', '、', 'これ', 'は', '皆さん', '、', '私', 'も', '参議院', 'に', 'かつて', 'い', 'まし', 'た', 'が', '、', '割', 'と', '年次', 'として', '新しい', '方', 'が', 'おら', 'れる', 'し', '、', 'その', '方々', 'は']",['参議院'],NO,参議院,NO,NO
25,参議院,バレンタインのように特定の日に特定の相手とデートするようなことを禁止する法律が参議院で通ったというのをネットで目にします。本当なんですか？本当なら,"['バレンタイン', 'の', 'よう', 'に', '特定', 'の', '日', 'に', '特定', 'の', '相手', 'と', 'デート', 'する', 'よう', 'な', 'こと', 'を', '禁止', 'する', '法律', 'が', '参議院', 'で', '通っ', 'た', 'という', 'の', 'を', 'ネット', 'で', '目', 'に', 'し', 'ます', '。', '本当', 'な', 'ん', 'です', 'か', '？', '本当', 'なら']",['参議院'],NO,参議院,NO,NO
26,参議院,質問をしたいと思います。まず、皆様御存じだと思いますけれども、この参議院の法務委員会というのは、かなり死刑制度について真剣な議論が以前より行われてまいりまし,"['質問', 'を', 'し', 'たい', 'と', '思い', 'ます', '。', 'まず', '、', '皆様', '御存じ', 'だ', 'と', '思い', 'ます', 'けれども', '、', 'この', '参議院', 'の', '法務', '委員', '会', 'という', 'の', 'は', '、', 'かなり', '死刑', '制度', 'について', '真剣', 'な', '議論', 'が', '以前', 'より', '行わ', 'れ', 'て', 'まいり', 'まし']",['参議院'],NO,参議院,NO,NO
27,参議院,が決議されました。ｐ百三十三参照）、同月二十二日に衆議院本会議で議了しました。参議院においても、国土交通委員会で５月二十日に提案理由説明が行われ、同月二十二日及び６月３日に委員会質疑,"['が', '決議', 'さ', 'れ', 'まし', 'た', '。', 'ｐ', '百', '三', '十', '三', '参照', '）', '、', '同月', '二', '十', '二', '日', 'に', '衆議院', '本', '会議', 'で', '議了', 'し', 'まし', 'た', '。', '参議院', 'において', 'も', '、', '国土', '交通', '委員', '会', 'で', '５月', '二', '十', '日', 'に', '提案', '理由', '説明', 'が', '行わ', 'れ', '、', '同月', '二', '十', '二', '日', '及び', '６月', '３', '日', 'に', '委員', '会', '質疑']",['参議院'],NO,参議院,NO,NO
28,参議院,いずれ選挙に出馬しそうな有名人を教えて下さい。宜しくお願いします。オトタケさんは参議院出そうな気がしませんか？スポーツキャスターより向いてそうな・・・。,"['いずれ', '選挙', 'に', '出馬', 'し', 'そう', 'な', '有名人', 'を', '教え', 'て', '下さい', '。', '宜しく', 'お願い', 'し', 'ます', '。', 'オト', 'タケ', 'さん', 'は', '参議院', '出', 'そう', 'な', '気', 'が', 'し', 'ませ', 'ん', 'か', '？', 'スポーツ', 'キャスター', 'より', '向い', 'て', 'そう', 'な', '・', '・', '・', '。']",['参議院'],NO,参議院,NO,NO
29,参議院,中島洋次郎、中山成彬、額賀福志郎、野田実、原田義昭、細田博之、茂木敏充、山口泰明、山本幸三〈参議院〉加納時男、陣内孝雄、須藤良太郎、中島眞人、成瀬守重、畑恵（千九百九十八年８月二十七日付）,"['中島', '洋次郎', '、', '中山', '成彬', '、', '額', '賀', '福', '志郎', '、', '野田', '実', '、', '原田', '義昭', '、', '細田', '博之', '、', '茂木', '敏', '充', '、', '山口', '泰明', '、', '山本', '幸三', '〈', '参議院', '〉', '加納', '時男', '、', '陣内', '孝雄', '、', '須藤', '良太郎', '、', '中島', '眞人', '、', '成瀬', '守重', '、', '畑', '恵', '（', '千', '九', '百', '九', '十', '八', '年', '８月', '二', '十', '七', '日', '付', '）']",['参議院'],NO,参議院,NO,NO
30,参議院,を可決されたものを参議院が再度可否を投票で決議します。今回の郵政法案は参議院で否決されました。小泉総理はこれを国民に再度可否を問うために内閣、衆議院,"['を', '可決', 'さ', 'れ', 'た', 'もの', 'を', '参議院', 'が', '再度', '可否', 'を', '投票', 'で', '決議', 'し', 'ます', '。', '今回', 'の', '郵政', '法案', 'は', '参議院', 'で', '否決', 'さ', 'れ', 'まし', 'た', '。', '小泉', '総理', 'は', 'これ', 'を', '国民', 'に', '再度', '可否', 'を', '問う', 'ため', 'に', '内閣', '、', '衆議院']",['参議院'],NO,参議院,NO,NO
31,参議院,を可決されたものを参議院が再度可否を投票で決議します。今回の郵政法案は参議院で否決されました。小泉総理はこれを国民に再度可否を問うために内閣、衆議院,"['を', '可決', 'さ', 'れ', 'た', 'もの', 'を', '参議院', 'が', '再度', '可否', 'を', '投票', 'で', '決議', 'し', 'ます', '。', '今回', 'の', '郵政', '法案', 'は', '参議院', 'で', '否決', 'さ', 'れ', 'まし', 'た', '。', '小泉', '総理', 'は', 'これ', 'を', '国民', 'に', '再度', '可否', 'を', '問う', 'ため', 'に', '内閣', '、', '衆議院']",['参議院'],NO,参議院,NO,NO
32,参議院,地域代表的性格という特殊性から、衆議院の場合よりも大きな格差を許容しています。判例からすると、参議院の場合は、１対６ぐらいが基準のようですね。,"['地域', '代表', '的', '性格', 'という', '特殊', '性', 'から', '、', '衆議院', 'の', '場合', 'より', 'も', '大きな', '格差', 'を', '許容', 'し', 'て', 'い', 'ます', '。', '判例', 'から', 'する', 'と', '、', '参議院', 'の', '場合', 'は', '、', '１', '対', '６', 'ぐらい', 'が', '基準', 'の', 'よう', 'です', 'ね', '。']",['参議院'],NO,参議院,NO,NO
33,参議院,あるようです。ひとくちに国会といいますが、正確にいえば国会は衆議院と参議院の二院制をとっています。国会の議決事項は原則として衆議院と参議院の両方の賛成多数,"['ある', 'よう', 'です', '。', 'ひとくち', 'に', '国会', 'と', 'いい', 'ます', 'が', '、', '正確', 'に', 'いえ', 'ば', '国会', 'は', '衆議院', 'と', '参議院', 'の', '二院', '制', 'を', 'とっ', 'て', 'い', 'ます', '。', '国会', 'の', '議決', '事項', 'は', '原則', 'として', '衆議院', 'と', '参議院', 'の', '両方', 'の', '賛成', '多数']",['参議院'],NO,参議院,NO,NO
34,参議院,あるようです。ひとくちに国会といいますが、正確にいえば国会は衆議院と参議院の二院制をとっています。国会の議決事項は原則として衆議院と参議院の両方の賛成多数,"['ある', 'よう', 'です', '。', 'ひとくち', 'に', '国会', 'と', 'いい', 'ます', 'が', '、', '正確', 'に', 'いえ', 'ば', '国会', 'は', '衆議院', 'と', '参議院', 'の', '二院', '制', 'を', 'とっ', 'て', 'い', 'ます', '。', '国会', 'の', '議決', '事項', 'は', '原則', 'として', '衆議院', 'と', '参議院', 'の', '両方', 'の', '賛成', '多数']",['参議院'],NO,参議院,NO,NO
35,参議院,の行き過ぎとかあるいはまた国民の監視とか良識、そういうものをあらわすのが参議院である、これが二院制の本来のあり方であったはずです。それが緑風会とかいろいろ,"['の', '行き過ぎ', 'とか', 'あるいは', 'また', '国民', 'の', '監視', 'とか', '良識', '、', 'そういう', 'もの', 'を', 'あらわす', 'の', 'が', '参議院', 'で', 'ある', '、', 'これ', 'が', '二院', '制', 'の', '本来', 'の', 'あり方', 'で', 'あっ', 'た', 'はず', 'です', '。', 'それ', 'が', '緑風', '会', 'とか', 'いろいろ']",['参議院'],NO,参議院,NO,NO
