,0
103,観光スポットを巡回している赤い靴バスや週末はみなとみらい地区を巡る百円バスもあり、観光施設やレストラン・ショッピングセンターの割引きがセットされた市バス・市地下鉄１日乗車券（五百円〜）もあります。楽しんできてくださいね。
104,対応もほかの巡礼団に対するものとは違っていた。代金を受け取ろうとしなかったり割引きをしたりお土産を渡したりと，機会をとらえては好意を表わそうとする。
105,と親しくなれる。”□“参加者の質的内容を把握しやすい。”□“参加費が無料または割引きになる。”などの、メリットが重なり、スタッフならではの収穫が期待できるもの
106,を利用しない手はないのである。例えば、すべてのキャリアに、手続きなしに受けられる割引きとして、「長期契約割引」がある。長く使ってくれている顧客に対しては基本使用料（パック料金も対象
107,８時半に出て飯○に９時三十分着。朝の割引きで七百五十円であった。荘○さん宅を見舞う。カギを開けてもらい、写真の撮影を
108,で予約できる会社もあるので、観光シーズンには日本出発前に予約しておくとよいでしょう。特典や割引きが受けられることもあります。また、申し込み時に、支払いの保証としてクレジットカードの提示を
109,一層のご利用をお願いします。ＥＴＣ割引が拡張されました土日祝日の９：００〜十七：００も割引きが適用され５割引となり、料金的にも利用しやすくなりました。皆さんのご利用をお待ちし
110,をもってするを問わず、農林中央金庫の業務の範囲外において、貸付けをし、若しくは手形の割引きをし、又は投機取引のために農林中央金庫の財産を処分したときは、三年以下の懲役
111,２年以上。ポイント九千九百七十五。割引き三千七百五十円プラス二千百円。ほとんど…ただ
112,て、９時から十七時の休日割引に引っ掛かるように、９時１分頃ゲートを抜け、高速の割引きになるようにした。通常千三百円
113,大人同伴の場合、小学生未満は１人は無料、２人目以降は子ども運賃）。障害のある方は割引きがあります。新しいパンフレットは、７月から市役所市政情報センター、堺老人福祉センター、北老人福祉センターで配布しています。
114,大人二枚と子ども一枚、シルバー割引一枚と幽霊一枚って頼まなきゃいけない。幽霊にも割引きがあるはずだ。もしかしたら、動物をおどかさなければ、無料で入れるかもしれない
115,、ｗｅｂから予約すればＡＵＤ百八十。さらに「まごしど」をみたと言うとさらに割引きがあります。安くは無いですが、内容を考えたら、納得の価格。ワイナリー訪問
116,ダミー）通話量の大きいユーザーは特定話者割引を使うはずである。逆に言えば、この割引きを使わない人は、通話量がそもそも少ない人であろうと考えられる。最後に性別と
117,「電子マネー」を使える店が増えています。より普及させるため、さまざまなポイントサービスや割引きなども用意、計画されています。（粂博之）≪講座１マイルと交換≫
118,Ｙａｈｏｏ！ポイントがたまると、何かいいことがあるのですか？１ポイント一円でＹａｈｏｏショッピングで割引きが出来る二百五十ポイント＝二百五十円割引可能！またポイントをいくら使うか自由に出来る。二百五十ポイント有るけど今回
119,今度、どこまで行っても、休日千円ってことになると三百円の割引きしかならない・・・・・・
120,妊婦は病気じゃないし、買い物とかで手助けしてくれるところがあったとしても、金銭的な割引きとかは聞いたことない。妊婦＝世間に大事にされる、って発想は
121,は気晴らしにいいか！という事で行きました。３月イッパイは関西在住の人は割引きもあったので（千円ぐらい安かったかな）父・母。娘２人分のチケットは母
122,人気があります。マイレージがたまるＪＡＬやＡＮＡのカードやガソリンスタンドでの給油が割引きになる出光やＪＯＭＯカード、また、自動車の購入や点検時のキャッシュバックが受けられる、トヨタ自動車
123,事業により、大正十一年春から湯治客が増え始め、馬車鉄道の乗客に無料入浴券の配布や運賃の割引きなどのサービスに努め、受け入れ側の登別温泉では桜の大樹に電飾灯を点滅させるなど
124,思っています。大人の入場料が千八百円で案外高いなと思ったのですが近くで割引きでチケットを買えると聞いたのですが具体的にどこで買えるのかわかりますか？
125,も深夜割引の五十％ＯＦＦ、つまり深夜（０時〜４時）高速道路を少しでも走っていれば割引きが適用だって！驚きそれよりもＥＴＣ￥千になれば距離に関係なく遠く
126,も行うことができるものとする。なお単純化のために、以下では期間を通じた割引きの問題は捨象して議論を進めよう。ここで、υ１は必ずしもｃ１より大きくなる必要
127,。アルパインスターズのグローブ、シューズ、または、ウィランズのレーシングハーネスを装着していると“五千円”の割引きもあり。受付の期間は７月二十日（火）まで、毎年大盛況で早い段階で
128,、どなたか教えて下さい。お願いします。まず年払いの場合は月払いに比べて数％保険料が割引きになっていますので月払いから年払いに契約応答月に変更が可能なのが普通ですでに
129,、そういう互いの交換もできないし、ボリュームディスカウントも適用されないし、新いちなん割引きの解約金は、継続利用にかかわらず一律三千円もかかる！！！これってドコモをやめられ
130,などの間接コストが圧縮される分、預金金利の上乗せや貸出金利の引き下げ、送金手数料など各種手数料の割引きなどで顧客を増やそうとするわけです。ただし、ネットバンクは広告などのマーケティングにコスト
131,てくると思われる。ケータイをお店のレジにピッとあてる。ＦｅｌｉＣａが使える店や割引きの最新情報はｈｔｔｐ：／／ｗｗｗ．ｅｄｙ．ｊｐ／でａｕは「ＥＺナビウォーク」で“３Ｇ時代”勝負！迎え撃つａｕは
132,、長距離移動を極力控える」という内容に矛盾してますよ。ＥＴＣの利用促進が目的の割引きなら、搭載機の低価格化が最も普及率アップにつながるのじゃないですかね。（加古川、会社員、
133,の人が、協賛店舗・施設で買い物や飲食などの際にカードを提示すると、さまざまな割引きや優待を受けることができます。ぜひご活用ください。▶協賛店舗・施設を募集しています協賛の申し込み
134,たのですが、最近は落ち着いてきました。たぶん、早期注文の時期が過ぎて、割引きがきかなくなったからですね。どこもそうなのかもしれないけど、クイナの行っ
135,）コプラナーＰＣＢの測定分析費用有機、無機にかかわらず７〜９万円／１サンプル。ダイオキシンと同時に測定分析する場合割引きがあります。上記は１サンプルから受け付けます。費用には、サンプルを入れる専用コンテナー
136,なる。さらに、６カ月分をまとめて前払いすると約５％、十二カ月分をまとめて前払いすると約７．５％の割引きに。２カ月ごとの訪問徴収の場合、年間受信料が１万六千七百四十円（衛星放送付き２万八千八十円）かかるところ、１年分を
137,実験は，購入した１枚のＩＣカードで交通機関や主要観光施設の入場料の支払い（観光施設については割引きの特典付き）を可能にしたものであり，これによって，観光客の公共交通の利用促進，
138,、了承してもらったら取引をすると良いと思います。もし、取引してもらえるのなら少し割引きなどをすると喜ばれますよ。取り消す場合は、入札者の削除をして取り消せ
139,商店などの協力により、衣料品や食品などの割引販売を行います。タクシー料金や理髪も割引きの対象になります。この割引販売に使える買い物カードを交付します。利用できるのは本人のみ
140,のかもしれぬ。しかし割引ができるということにしてくれれば、積極的なところは割引きをするわけですから、そういう面でいわゆる運賃法の中にそういう規定がない
141,は、すこぶる濃厚である」という疑惑から、「（十五）ロンドン金融市場は日本の輸出入手形に対する割引きを拒否するなど、経済的にも露骨なる非友誼的態度を示した。然るに支那に対しては二千万ポンド
142,二十年度友の会会員募集特典・当館主催展覧会の招待券２枚進呈・会員証の提示により、入館料を五百円に割引き。同伴者は２名まで団体料金に割引・展覧会や友の会行事（見学会・研修旅行等）をご案内いたします
143,買ったのですが、今日行ったらちゃんと残っていました♪（マンモスラッキー！）滅多に割引きをしないこの食パンを四十四円引きで買えるなんて夢のようです！！（笑）
144,、トムスが企画したサービスです。旧料金（重量制）を適用、出荷数１個から二十五％の割引きです。サービス内容は通常ゆうパックと同じです。月会費￥百個人で申し込めます。
145,がきて止められてしまい受理されませんでした。創設者の方針で警察に割引きで飲食させるなど、チェーン店の店ですがかなり警察と懇意にしているようです。
146,●料金がゆうパックより高い。●集荷してもらうのに、別途料金がかかる。●割引きは実績がないと難しい。郵便局（ゆうパック）と宅配便（ヤマト運輸宅急便）のサービス比較８
147,６月二十六日から等々力陸上競技場で開催される同大会の入場券を販売中です。４日間共通券、六十歳以上・障害者の割引きもあります。小学生以下はＡ・Ｂ席無料、Ｓ席は中学・高校生と同額。前売り券はチケットぴあ、ＣＮプレイガイド、
148,値引きの特典があるというのです。商品が入ってない。サービスというか、割引きの特典なんです。これは本法で取り締まりできますか。○真砂説明員お答え申し上げます。いまお示しいただき
149,か、忘年会とかも大体そこを使っています。また何かのキャンペーンとか割引きの情報かな？と思って文面を見たら…。「３月二十五日を持ちまし
150,には最初は対物だけにでも入るように勧めています。年数を重ねて割引きが大きくなってくると対人や搭乗者など条件を増やしていくと金銭的には楽です。
151,が、流通系カード。百貨店や大手スーパーが発行しているもので、系列店のショッピングの際の割引きや会員限定のセールなどのサービスが豊富です。三越、高島屋、伊勢丹などの百貨店カードに
152,か。１土地と建物のセットで購入２土地と建物を別々に購入１割引き、書類の手間が一度、完成した家を見られる。２自分好みの家が
153,証明さえすれば配偶者割引が適用される。１名分の往復正規運賃を払うと、残りの１名分が割引きになるシステムで、適用期間の区別のない他はペックスと同じ。また、台湾
154,取扱いについて」（平成十二年３月三十一日保険発第六十四号・老健第八十五号）を参照してください。Ｑ百二十九利用料の割引き利用料が高額となり支払いが困難な場合は，利用料を割引設定できますか。Ａ
155,暇であった。リフトは空のままカラカラと回っていた。お客からも平日は割引きをしてほしいと要望があったが、それも難しかった。当時はリフトの運賃
156,がどんとふえる、できれば、むしろ私どもは一．〇を超えるようなことを期待しながら割引きを考えていくべきだろう、そういうふうに思っております。これは予測の問題である
157,、東京ドームシティアトラクションズ、西武園ゆうえんち●ゴルフなら指定のゴルフ場をご利用の際は、３千円の割引きになります。●資格試験なら資格試験の受験料を上限５千円まで補助します。※詳しく
158,あなたの入会に賛成する投票をした記憶があります。会員証を持っていらっしゃい。割引きを受けるために見せる必要があります」「どうもご親切に」陳は数年前
159,）。生活保護の加算。ＮＴＴの番号案内が無料。自治体によっては、公営バス・地下鉄の運賃が割引きになる。公営住宅への優先入居と家賃減免。三十二条の手続きの簡素化。自治体により福祉タクシーの
160,どのくらい買うとどのような優待があるか教えてください。よろしくお願いします。乗車券の割引き（新幹線・特急等）あります。参考ＵＲＬ参考ください。
161,に、つい「３年前より安くなっているし、小腹も空いたから」と言いながら割引きが始まった牛丼を食べて、変な時間帯に食事をしたために胃もたれに苦しん
162,、ヘリコプター遊覧や家庭教師の手配といったものまでありますが、人気メニューは宿泊施設やコンサートなどの割引きですね」ベネフィット・ワンと提携し、０１年十月から選択型福利厚生制度を導入しているマツダは、その具体的中身
163,席百十五交地下鉄水天宮前駅から徒歩３分※近隣のシティエアターミナルの駐車場を利用すると１時間分駐車料金が割引き※長いバーカウンターもあって気軽にアルコールが楽しめるのも嬉しい１人当たりの予算は￥四千
164,の？何かの割引には、使えないんでしょうか？そうです。でもほんとに割引きに使えればいいですね。ひどい回答や、荒らしを削除する権利を与えるというのはどう
165,事業者は，同盟の名で荷主と一手積み契約を締結すれば，通常の荷主より９．５％の割引きをし，反面，この契約に違反した契約荷主に損害賠償を支払わせ，協定の破棄
166,のセールは十二月十六日〜１月８日までです。多くの免税店で、約二十％から五十％の割引きとなります。ただしプラダ、エルメス、ルイ・ヴィトンなどいくつかの人気ブランドは、セールを行わ
167,の２％控除はまた節約できるでしょう。だって貨幣は自由に使えるのだし、人々はそれで割引きの恩恵に浴しているのですから」質問５「この貨幣は市民たちにどのように
168,で、本部で支払い、事業所へ振替ることは通常の方法です。むしろ、一括契約により割引きなどのメリット、一括支払による効率化は大きいものです。それは、本部で扱うことによって
169,の充実したプログラムをそろえて会員を募集しています。４月からの入会は五百円に割引きとなります。※詳しくは左記へ。問合せ（財）都民劇場☎０３・３２８９・４６２１シルバー人材センター１学習教室生徒定年退職し
170,がなされている一方で，通勤費の事業所負担が一般化している定期については，かなり高率の割引きが行われている。国鉄については，こうした割引制度は，かつて国鉄が独占状態の
171,になります。オプション料金は発生しません。是非この機会にお遊び下さい！！※他の割引きとの併用はできません。ＴＥＬ０６−六千四百八十一−千百七十六ＰＣｈｔｔｐ：／／ｗｗｗ．ｂｌｏｎｄｈｏｕｓｅ．ｃｏｍ／携帯ｈｔｔｐ：／／ｗｗｗ．ｍ−ｂｌｏｎｄｈｏｕｓｅ．ｃｏｍ／ＭＡＩＬ
172,ぎっしり「姫路観光パスポート」発売中姫路城をはじめ、観光・文化施設に割引価格で入場できる姫路観光パスポートを発売中。お土産や飲食の割引きなど、協賛店舗による特典も。■販売場所姫路観光なびポート、各入場券付き施設（右表）■有効期間
173,交通・旅行・宿→鉄道・交通全国でのレンタカー予約ができる。スーパーレッドメンバーになれば、レンタカーの料金も割引きになってお得。交通／タクシータクシーに乗る前に空港タクシー情報ＥＺインターネット→交通・旅行・宿→鉄道・交通
174,期間も含まれるんですか？（学割で３年使って年割に変わった場合３年分の割引きになる？）社会人になったら年割になります。学割を使っていた期間も
175,二千円一回利用：一般四百円一回利用：高校生以下二百円☆ご家族で申し込まれるとお一人様につき千円の割引きがあります。☆１年間定期利用をしていただくと十三ヵ月目から五百円引きの割引がございます
176,だが、一年目で十二％、二年目で二十五％、五年以上は三十五％と、基本使用料の大幅な割引きが行われる。家族割引は、ツーカーセルラー東京・東海の場合は、副回線の基本使用料が五十％引きとなる
177,今年度、大々的に社会実験を行って、そうした研さんを積んだ上で、どういう割引きのあり方にするかという点を検討してまいりたいと思っております。○岩國委員これ
178,や乗鞍，白骨温泉へ行くパーク・アンド・ライド方式を取り入れればかなりの渋滞解消になる．当然，駐車料金は割引きにし，できれば日本道路公団とタイアップして高速道路料金も割り引けばいい．大庭から各観光地に行く
179,てあります。（私が持っている手帳には）あと、ボーダフォンやドコモの基本料金が割引きになります。詳しいことは、市町村役場や福祉事務所、保健所などに相談したら教えてくれます
180,に時間稼ぎしているんだ」「手形の決済日がくるまでだよ」「手形の割引きもしないで、手形決済日がきたって天野会長は決済しないぜ。Ｍ商事もしない」
181,。どういうことですか？またこれ以上安くなる方法はありませんか？ＥＴＣの割引きの適用を受けたのでしょう。朝晩の通勤時間割引を活用すると、それ以上の割引を受けられる
182,に満席になるようならそんな事しなくても良いんですから。年間シートにして割引きまでして売らなければいけないって事は売れないって事なんでしょう。もっともっと
183,という情報が飛び込んできた。利用頻度の高い大口顧客に対して、利用回数に合わせて一定の割引きをするというものだ。すでに個人タクシーでは深夜と早朝の割増率を３割から２割
184,たわけではございません。ただ、大切なことは、多分いろいろな考え方あるいは割引きの仕方がある。その割引の仕方に応じて、先ほど申し上げましたように、
185,をまとめて口座振り替えで納めると、３、五百五十円割引されます（納付書払いでは三千円の割引き）。６カ月前納（４〜９月分）では、九百六十円割引されます。【１２共通】▼申込場所
186,で直接お買い求めください。※チケットぴあステーション、スポットでチケットを購入すると、Ｐコードの後ろの金額が割引きになります。金額表示のないものは、窓口料金と同じ。出出品者ｏｒ出演者→内容紹介※
187,４月８日必着。選考。しあわせの村馬事公苑初心者乗馬教室（５月）中学生以上。４回。二万円（高齢・障害者は割引き）▶月曜▶木曜▶金曜▶土曜▶日曜。詳細は問を。申電（☎
188,は、損保商品を顧客に直接販売する「契約係社員」。脅迫に加え、保険料の立て替えや割引きなど保険業法に違反する行為もしていた。うすい百貨店７月期決算経常赤字、大幅に圧縮昨年
189,になります。５十日町市博物館無料入館６雪まつりクーポンサービスパスポートに付いているクーポン券で、市内の各温泉やレンタカーの割引きなどが受けられます。７雪上カーニバル優待パスポートゾーン入場雪まつり最大の華、「雪上カーニバル」会場の優待パスポートゾーンに入場できます。
190,からではなく助かった！それはお昼の時レストランで清算の時あ！割引きです！！と私がパスをお見せする前に申されパスを嬉しくお見せして
191,や受取手形、未収金、貸付金などをいい、受取手形には、年末時点で第三者に対して裏書や割引きに回しているものも含みます。同じ人に対して、売掛金と買掛金がある場合や、
192,そう！ＪＡＦに入ってたらカードは財布の中に！どこに行っても大抵割引きがありますので窓口で出してみてください。
193,は不要なので、すでにすべてのユーザーが恩恵を受けている。ヘビーユーザーも自動的に割引きを受けている。それは「ボリュームディスカウント」だ。通話料が五千円を超えると五％、一万円
194,見逃せないですね」（同社四十代社員）その他、良品計画では「年間３万六千円分の割引きが受けられる無印良品の買い物クーポンが支給される」（同社三十代社員）というし、スターバックス
195,→最近終わったばっかりです。２ご登録された自動車・ＥＴＣカード以外でのご利用の場合は、割引きが適用されません。３必ず手帳を携行してください。実際に間違えたので、
196,。ただ、大切なことは、多分いろいろな考え方あるいは割引の仕方がある。その割引きの仕方に応じて、先ほど申し上げましたように、通勤時間帯を選んで割り引く、こう
197,試算している、こういう状態でございますので、先ほど申し上げましたような、きめ細かな割引きというよりは、平均一割引き下げたら、結果、〇．三ぐらいの交通量の増加がある
198,機会に便利でおトクな口座振替をお申し込みください。なお、すでに口座振替をご利用のお客さまは割引きが適用されています。【問合】上下水道局お客さま受付センター（名水ダイヤル）☎８８４‐５９５９（ゴクゴク）
199,開始します！開港記念日の６月２日から、チケット販売をスタートします。開催期間中の購入よりも割引きがあるほか、十一月三十日までの第１期前売期間中のみの販売となる２会場のセット入場券もあります
200,二百円ごとに１ポイントが付きます。五百ポイントたまれば五千円のキャッシュバックか、１ポイント十円で飲食代金から割引きかが選べます。宴会の幹事を何回か引き受けていたら五百ポイントなんてアッという間
201,。商品券の種類や持ちこむお店にもよるかと思いますが、だいたいどのくらいの割引きでひきとってもらえますか？八十％くらいでしょうか。また、高額で引き取ってもらえるお店が
202,の代理となる（商業貨幣）。そして，この手形決済に至るまでに，銀行がこの手形を割引きで買い取り，銀行自身の手形を手渡すということが行なわれる。この銀行手形が銀行券であり，
