,0
0,価格でリッター百五十円と仮定して換算しても、ガソリン代だけで三十七万５千円、高速料金はＥＴＣの割引き考慮しても、往復１万円の二十回で二十万円、さらに宿泊費にメシ代やら道具の準備やら
1,の購入者の場合、２年未満で解約したり、機種変更したりすると、その後の通信料金の割引きがなくなる。＜ＮＴＴ東日本＞携帯と連携、サービス多彩に…社長に聞く６月末に就任した
2,を使って、ラベルを張り、郵便局に持ち込むと言うことですか？Ｙａｈｏｏ！ゆうパックには持込割引きは適用されません。送り状を貼り、そのままコンビニの店員に預けます。郵便局
3,に係る借換国債を含む。次条及び第五十二条第一項において同じ。）の償還に要する費用（割引きの方法により発行した場合においては、発行価格に相当する部分に限るものとし、借換国債
4,ホームページをご覧ください▼ｈｔｔｐ：／／ｗｗｗ．ｏｉｔａｋｏｓｏｄａｔｅ．ｎｅｔ／１パパママとくとくショップ十八歳未満の子どもがいる家庭を対象に、料金の割引きなどのサービスを提供している店舗など。※別府市では現在、二十一の店舗が登録
5,が二千五を早く取り入れたほうがいいですか。二千四を使っていることで二千五は割引きなどされるのでしょうか。こんばんは。ウイルスバスター二千四は、二千五／十二／三十一でサポートが終了します。ウイルスバスタークラブ会員期間内
6,遅くなりそうだったので、前日に用意しておきました。海老と鱈は閉店前の割引きで安く買えたけど、はまぐりは中国産をさけたのでめっちゃ高かった。でも、たまに
7,をする映画館もあります。また、単館上映の映画館なら、映画の内容にちなんだ割引きをする企画もあります。カメラマンが主人公の映画に、カメラを持参した人は
8,通話料金や、メールの通信費が一番安い携帯電話の会社ってどこでしょうか？いろいろな割引きやプランによって違いますが、全体的にボーダフォンだと思います。週末は５分以上通話時間がある
9,もし出品者側でしたら、複数落札の場合の割引きの申し出には皆さんどうされますか？初めて値切られました？ので対応
10,大切なクロージング技法だ。「決めさせ上手」は、「本日までキャンペーン期間ですので、割引きができます」「もう残りは僅かになりました」「今なら在庫があり
11,を知りながら、その通常の条件よりも有利な条件で資金の貸付け又は手形の割引きを内容とする契約の締結の代理又は媒介をする行為（所属銀行の業務の健全
12,「対馬観光パスポート」があり、旅人に嬉しい特典が満載。フェリーやジェットフォイル、観光施設・宿泊施設・土産物店・飲食店での割引きなどが受けられる。※パスポートには写真を貼付し、名前を記入（家族利用の場合
13,この化粧水日本だと九千四百五十円するのですが三千円で（笑）ＤＦＳで働いてるので色々と割引きが。てか、お金取ってくれないと頼めなくなるのでなんとか三千円は支払いましたが
14,手段でも行けますが、小笠原へは、竹芝桟橋からしか行けません。乗船券の割引きが、あると思われるので、小笠原海運に問い合わせてみてください。東海汽船では、ありませ
15,〇．七とか〇．八とかいうことが期待できる状況もある。できれば、せっかく料金の割引きをさせていただくのであれば、それに応じてお使いいただける度合いがどんとふえる、できれば
16,商店で商品割引・無料提供などのサービスが受けられます。３巡回バス乗り放題４妻有焼陶芸体験割引サービス妻有焼陶芸センターでの陶芸体験が割引きになります。５十日町市博物館無料入館６雪まつりクーポンサービスパスポートに付いているクーポン券で、市内の各温泉やレンタカーの
17,なら保障してもらえる。・ポイントやマイルを貯めるといった付加価値。・カードを提示ｏｒ利用することで割引きやいろいろなサービスを受けられる店や施設などもある。＜デメリット＞・より良い
18,面倒なら、郵便局で点検してもらってから封する。第三種郵便物以外を同封しない。当然一通では割引きないので、料金表どうりの料金となる。個人が第三種郵便物を別の個人に送る場合、
19,二千円の買い物ごとに１ポイントが付きます。三十ポイントで次回の買い物の時に五千円分の割引きが受けられます。無期限で使用できるのがうれしいところ。最近、全国店舗の数を増やし
20,のレンタル・直営全施設にてケータイクレジット利用可能・駐車場予約サービス・１台の車に５人以上同乗で来場される方への割引き等【本件に関するお問い合わせ先】日本スキー場開発株式会社サンアルピナ鹿島槍スキー場担当：■■、■■Ｔｅｌ：
21,てオペレーターに相談するとお試しをさせてくれますょ★あとは、ポイントがそのまま割引きに使えるのでたまるたまる！！（買い金額の５パーセントつきます）学生には本当に
22,）を利用する場合。２．ドコモポイントを利用する場合。どちらにしろ、端末購入時にその端末料金を割引きで買いたい場合になります。
23,高格付けの上場企業となると、わざわざ手形を集めるインセンティブは乏しく、「裏書き」や「割引き」で十分だと思われます。実際に、大手企業は手形の印紙代等の負担を
24,た。ファッション・マガジンに彼女が登場するとき、彼女はギャラを支払われていた。彼女は割引きで服を手に入れるためにそこに出ていたのである。服はアリスにとっては
25,「もうひと頑張りする」と出勤していきました。頑張って。（神戸・東灘、主婦、六十三）割引きより搭載機を安く今、ＥＴＣ（ノンストップ料金収受システム）搭載車による夜間割引制度を日本道路公団が実施してます。
26,です。迷って迷って眠れない日々をすごしています；；新築中です。大工さんにも割引きで入りますが施工主にもけっこう割り引いてくれますよ。キッチン・風呂も定価ではそれぞれ二百万円
27,も楽しめます。もしＪＡＦに入っておられたら優待券持って行ってくださいね。入館料の割引きありますよ（２割引き）
28,なります。二十年度保険料を一括前納すると、口座振替の場合は三千六百二十円、現金払いの場合は三千七十円の割引きがあります。また、６カ月前納などの割引制度もありますが、現金払い以外は事前申し込みが必要
29,小学生未満は１人は無料、２人目以降は子ども運賃）。障害のある方は路線バスと同様の割引きがあります。新しい時刻表は、市役所市政情報センター、北老人福祉センター、ふれあいバス車内で配布しています。また
30,練習十四日）明け、８日比野が腰痛（練習７日）明けでの出場と、こちらも割引きは否めない。ここは勝負強さが光る２新井を
31,エコポイント」参加申込書に貼り付け、スーパーマーケットなど、エコポイント協力店に提出します。３．お店のポイント加算や商品の割引きなど、企業ごとに異なった特典が受けられます。参加申込書の配布「みえのエコポイント」参加申込書
32,貸金業を営む者が業として行う金銭を目的とする消費貸借の契約（手形の割引き、売渡担保その他これらに類する方法によつて金銭を交付する契約を含む。）において、年
33,航空券のお得な予約方法を教えて下さい。（国内でいいです）バースディー割引きは知っているのですが、超割とかバーゲンフェアとか・・・？友達が話してい
34,の会社のあれについていわゆる組合が一部持つとか、全部払ってもらってその一部を割引きのものについて一割を一緒にして組合員がそれを会社に渡すというやり方をし
35,もは￥二千五百位でどこを通てきてますと言うべきです、又料金の割引きを求めても良い金額です￥二百〜￥三百の差ならまだしも￥千以上
36,生活保護受給者は永久的・一時的ストーマにかかわらず，特定治療材料としてストーマ用装具の助成を受けることができる．そのほかに交通運賃の割引き，税金の控除，減税などのサービスを受けることができるので，詳しくは福祉事務所に問い合わせるよう
37,だろうな。まあ、私はＷｉｉ持ってないんですけども・・・やっぱお店によって割引きができる分レンタルＤＶＤの方がいいかなと思うんですがお店に返す必要がないの
38,ています）を持っていると、医療給付や通院医療費の公費負担、税制上の優遇措置、旅客運賃の割引きなどが受けられます。もし親が対象になりそうな障害を持っているなら、
39,午前９時三十分〜午後２時三十分矢掛駅〜やかげ郷土美術館をシャトル運行得得市利用者は矢掛本陣・やかげ郷土美術館入館料が割引き★得得市（矢掛駅前）午前９時〜午後３時◆餅つき実演・つきたてお餅をどうぞ！（無料）◆あっ
40,措置をしている。それから地方鉄道法にも実は第二十八条に、「主務大臣ハ地方鉄道ノ会計及運賃ノ割引きニ関シ特別ノ規定ヲ設クルコトヲ得」と書いてあるのだけれども、これを実現し
41,夕立譲受人湯沸器呼出符号読替規定陸揚地陸揚量両替割合割当額割高割引き割増金割戻金割安〔備考〕※印を付けた語は、「送り仮名
42,倉庫、検査部門にまで波及している。輸出を行うためには、損害保険や海運業、輸出手形の割引き、代金の取立のために銀行業の発展を促した。ましてや一年間に六百万台（
43,家族のきずなを見直す機会を設けます。家族の日に協賛施設・店を家族で利用すれば割引きや特典などのサービスを受けられます。今年度は１回目を８月３〜９日に予定しています
44,固定資産税は４月二十五日、市県民税は６月二十五日です。※１年分をまとめて納めても、割引きなどはありません。※これまで通り、納期別の口座振替もご利用できます。くわしくは
45,（→＿→）早朝割引！と、かみさんがバッサリ。知らねーもんそんな割引き（；´ー｀）さて、上映時間にまた並ぶと、やはり見る年齢層は変わらない。「映画館は
46,一日乗り放題の乗車券なども数多く発売されているほか，蒸気機関車の乗車券とセット販売の一日乗車券の割引き，全県共通スキーリフトシーズン券といった様々な取組みが行われている。６観光地におけるタクシー運賃観光地における主要施設
47,国際的な「通貨」として機能するようになるはしりといえようか。なお、十五世紀半ば以降には割引きを通じた手形の流通も始まっている。（注９）ただし、次第に単なる送金
48,二年以上たったのでそろそろ機種変更しようと思います。けど二年前に入った時に「ずっと」割引きと今はない料金プランに加入しました。機種変更しに行ったら今はない「ずっと」
49,勿論、出場して来るには体調万全ということだが、割引きは必要。長走路五百バンクでの連搦みに、本人も
50,」を持ち歩く人も見かけるようになり、また、はしを持って行くと飲食代の割引きなどのサービスを受けられるお店も出てきました。「マイはし」を
51,気をつけて。小さな子は浮き輪を持参した方がいい。前売券を買うと割引きがあるよ。真岡駅からのバスがでている。車の方が便利だけれど
52,キャッシング消費者金融まとめ可能むじんみ金即フリマイレージ割引き金融ランキング借り替えまとめローン相談イコールクレジット借換ｓｂｉイコールクレジット
53,ているわけです。これについてやはり福祉タクシーといいますか、身障者の乗る自動車の運賃の割引きについて何らかの具体的な措置をとる必要があると思うが、大臣はどうです
54,いう代理店なら事故にあったときもうまくサポートしてくれると思います。地震保険も新築なら割引きが適用されるケースが多いので確認してみて下さい。それと建物だけでなく、家財も保険に
55,？ＥＴＣの割引の適用を受けたのでしょう。朝晩の通勤時間割引を活用すると、それ以上の割引きを受けられるかもしれません。ただし、百ｋｍ未満の制限があるため、途中で一度ＩＣを出
56,想像できたのか…買う時にあんまりパッケージを気にしてなくて。アルコールは割引きも対象外だし、と思ったらいきなり店で声をかけられた。お買い上げの方
57,一歩、いや二歩踏み出して延滞債権（利払いが半年以上停止している貸し付け）、金利減免債権（金利の割引き、免除等を行っている貸し付け）まで含めた不良債権を、「総貸し出し残高一兆九千百二十八億円に対し二百億円あまりです」
58,）に手形交換所経由で期日に手形を現金化します。しかし、多くは「裏書き」や「割引き」で当面の運転資金を調達します。では、約束手形を証券化しようとする場合、どんなパターン
59,に決めるということについては、言うとおり少し問題があるのかもしれぬ。しかし割引きができるということにしてくれれば、積極的なところは割引をするわけですから、そう
60,、商品のお届けは１週間後となります。５月十日までにご注文いただけますと、５％の割引きとなります。私たちは二度目の注文をされるお客様に対してすべての商品を十％割引で
61,も頑張りましたが、この２頭からは離されました。この世代は、少し割引きなのかもしれません。ということで、来週から東京競馬場でＧⅠが連続であります。その
62,で直接お買い求めください。※チケットぴあステーション、スポットでチケットを購入すると、Ｐコードの後ろの金額が割引きになります。金額表示のないものは、窓口料金と同じ。出出品者ｏｒ出演者→内容紹介※
63,決めた。先着順で四十五万台が対象で、六月の中下旬にも始める予定だ。割引きは、料金所で６％程度のＥＴＣ利用率を十％超まで引き上げるのが狙い。日本道路公団など道路三公団で
64,三百人という小さなキャパシティの劇場の公演は、制作費・経費と入場料収入とのバランスで考えれば、割引きをすればそれ１本ではとても採算はとれません。しかし、劇場側としては５年先
65,の総称り掛け販売一割引きのこと。「り」は数字の９を意味する。「割引き」は禁句旅行アイ・ティー個人単位で参加するパック旅行のこと。「インクルーシヴ・ツアー」の頭文字アッシャーホテルの
66,。クレジットカードを利用すればさらにポイントが付きます。土曜日にミニストップ各店で利用すると、５％の割引きになります（二千一年５月６日まで）。▲ミニストップカード＊日用品＊●ユニクロポイントカード（ファーストリテイリング）
67,あと、高速の通勤割引を利用して・・・関ヶ原から大津の料金が、１．１５０円の割引きで１．２００円でした。しかし、比叡山ドライブウェイの入口は、道を間違えて到着が遅れまし
68,てきてるので・・痛い出費だけど同時に２台買い替えたよ（´○｀）ｍｏｖａからＦＯＭＡ対象機種変の割引き（１台につき一万五百円）と・・ドコモポイントを利用したんだけどね（汗）新しい
69,つき千円の割引があります。☆１年間定期利用をしていただくと十三ヵ月目から五百円引きの割引きがございます初めての方、以前ご利用になられていた方、スタッフ一同皆さまのご利用を
70,という場合には、百八十円の定額料を払うと、その相手にだけ「ゆうゆうコール」の割引きが適用される。百八十円で指定できるのは五ヵ所。相手は加入電話でもドコモの携帯で
71,た分の料金は名義人に請求されます。もし契約時に、複数年契約を継続することで割引きになる料金プランを選択していた場合は、解約の際には解約料を支払う必要が
72,ＥＴＣ車載機が付いていない車で、ＥＴＣカード決済ならで高速道路の割引きはできるのでしょうか？ＥＴＣ割引の殆どはＥＴＣ車載器による無線通信で流入する事が前提です。前払い割引
73,計算しています。それ以下の通話プランではパケ放題は使えません。あとは、各社の割引きとサービスで考慮して下さい。
74,か？我が家はオール電化ですが、電気代は十％引きです。ガス代が要らないし、深夜割引きや時間帯割引などを利用してお湯を沸かすので経済的かな。（地域によって違います）
75,恋のメロディをかなで、そして、私はロマンポルノを見たのであった。夜間興行の割引きで九百円。海女がたくさん出てきて、やたらに裸になり、やたらに男と
76,もっと公平に、もっと困ってる人を優先するような経済対策が必要じゃない？？高速の割引きは、実家の遠い我が家にとっては嬉しいけど、でも『出かける＝余裕がある』という
77,記事でも書いていたのですが、普段は、二百五十二円もする高級食パンで、なかなか割引きが無い商品なのですがなんと、このように二百八円で売っていたのです！
78,。定価販売ではないので、価格は小売店が自由につけられる。べつに雨の日の割引きじゃなくても、誕生日が今月ある人は一割引きとか、クルマのナンバーが奇数
79,！色々知ってるジャン。該当する時に該当の航空会社のホームページから予約すれば良いんですよ。割引きのメニューも書いてあります。
80,ときは、「料金は」、「下記のように」、「早朝」、「割引きに」という具合に区切ります。それぞれの読みを入れるときは、「ＲＹＯＵＫＩＮＮＨＡ」、
81,が二百一〜六百ｋｍの場合は５％（学割二十％）引き。３往復の特急券・寝台券などは、割引きの対象にならない。４ゾーン券のみの購入と、複数のゾーン券を一つの
82,方▽申込期限１月三十一日（消印有効）次の７つのメニューから１つを、無料または割引きで利用できます１練馬区指定保養施設２区内公衆浴場３区内理容店・美容店４区内はり・きゅう・マッサージ・指圧施術所５豊島園庭の湯６区立体育館・プール、練馬区立美術館７区内映画館※利用期限
83,ない。繁華街から十分程度歩かなくてはならない場所にも問題がある。それでもいろんな種類の割引きが効いて、映画を見に来る人は増えた気がする。
84,です。ＪＡ共済マジで対応悪すぎ！！と思い、家の車が２台とも東京海上で、３台目から割引きになるのと、以前対応がよかったので、東京海上にしました。等級は変わり
85,デパートやスーパーなどでご優待日に何十パーセントＯＦＦとかでよく使うところのが良いですねぇ。割引きのほうがよっぽどお徳ですヽ（´∀｀）ノポイント＝１円として１ポイントから普通にレジで支払い
86,かつその商品券は引き出したお店しか使えません。（有効期限もあり）両方とも会員サービス（割引き）があります。どっちも年会費は無料なのでカードを持つことに抵抗が無かっ
87,、それが結局従前の権利者に対しましてその権利に対応する建物を差し上げる場合に割引きになっているということが申せるかと思います。なお、借家人等を含めまして零細権利者
88,沿った返済ができなくなることが高度に見込まれるような場合に、一定の割引きを実施したうえ、残債権を一括して弁済することを内容とする更生計画に変更することに
89,となります。発送にかかる人件費は計算に入っていません。大量に発送すれば割引きがあるはずだけど…きっと人件費のほうが高いはずｗ
90,を目指す「電源三法」（電源開発促進税法、電源開発促進対策特別会計法、発電用施設周辺地域整備法）もあり、実質的な電気料金の割引きや交付金によるさまざまな公共施設の建設などに使われている。第３章原子炉の燃料と
91,・・厚さ的に難しいような気もしますけど？ちなみにゆうパックではないので持込でも割引きはないですよ。小包でもエクスパックは補償がありませんし。エクスパックは「
92,など背中を押されるキーワード「いまだけ」「限定」「先着」「特別」「割引き」「おまけ」…などアナタはどんな言葉にそそられますか？アナタの
93,五百円はそのまま残り、そして実質基本料は二千二百七十円−五百円で千七百七十円。例え、基本料金から割引きが適用されて、実質基本料は下がっても、無料分はそのままなので、使える分
94,お知らせが来てたんですが…還元額が０円となってたので、既に走行で割引き使っちゃったのかな？自動還元サービス入ってるしぃ…と思ってその時はスルーし
95,太いボーダーのハーフパンツ。それから、白いトートバッグ。これは衝動買いで（笑）あ〜、多少割引きになってるとはいえちょっと買いすぎたかなぁ・・。ま、いいか（笑
96,、この間Ｂ型肝炎などの検査をしました。母子手帳には、そういった検査の割引き？みたいな券が付いていますよね？もう検査をしてしまったので、その
97,開始するとその月は利用回数×二百十円（サポートの方は百五円、ただしサポートは翌月から割引きとなりますから、初めて利用するときは×二百十円）なので、一ヶ月位利用が難しい
98,映画でよくあるレディースデイって男女差別じゃないの？男が割引きの日があるとこもあるらしいけどさぁ。少なくない？法律には触れないの
99,と中国側との交渉を通じて決定されるので、生産規模（従業員数）や力関係によって、相当の割引き（ディスカウント）を獲得することも可能であろう。戦略ポイント●広東式の委託加工貿易（＝来料加工）で
100,は、なんとポイントが３倍になります！特典としては、ポイントの利用は、割引きのほかに現金を受け取ることも可能なこと。各種商品券での支払いにもポイントが
101,登山鉄道はベラボウである。しかも、例のユーレイル・パスは使えない。これだけはべつあつかいで、割引きさえもないのだ。たった三、四十分ばかりの行程で、十五フラン（約二千円。往復
102,いかがですか？オートキャンプ場「さくら割」のお知らせ桜の花見シーズン、オートキャンプ場のサイト料金が半額になる割引き「さくら割」を実施します。さくら坂の桜を見ながら、家族や仲間とバーベキュー
