114,不調,緊張をほぐし、ストレスから解放してくれます。また、消化器系に働きかけるオイルで、胃腸の不調に作用します。ラベンダー中枢神経のバランスを整え、血圧を下げる作用があります。,"['緊張', 'を', 'ほぐし', '、', 'ストレス', 'から', '解放', 'して', 'くれ', 'ます', '。', 'また', '、', '消化', '器', '系', 'に', '働きかける', 'オイル', 'で', '、', '胃腸', 'の', '不調に', '作用', 'し', 'ます', '。', 'ラベンダー', '中枢', '神経', 'の', 'バランス', 'を', '整え', '、', '血圧', 'を', '下げる', '作用', 'が', 'あり', 'ます', '。']",['不調に'],NO,不調,NO,YES
115,不調,いやぁ〜ルーニー代表戦では、最近不調やったのに、ここに来てすごいなぁ〜２点やでぇ〜私の大好きベッカム様,"['いや', 'ぁ', '〜', 'ルーニー', '代表', '戦', 'で', 'は', '、', '最近', '不調やった', 'のに', '、', 'ここ', 'に', '来て', 'すごい', 'な', 'ぁ', '〜', '２', '点', 'や', 'で', 'ぇ', '〜', '私', 'の', '大好き', 'ベッカム', '様']",['不調やった'],NO,不調,NO,YES
116,不調,昨日の過食でビクビクしている響です。胃が・・最近私の胃腸君は不調らしい。過食に若干耐えられておりません。頑張れよ〜。でも肌の調子は良い,"['昨日', 'の', '過食', 'で', 'ビクビク', 'して', 'いる', '響', 'です', '。', '胃', 'が', '・', '・', '最近', '私', 'の', '胃腸', '君', 'は', '不調', 'らしい', '。', '過食', 'に', '若干', '耐え', 'られて', 'おり', 'ませ', 'ん', '。', '頑張れよ', '〜', '。', 'でも', '肌', 'の', '調子', 'は', '良い']",['不調'],NO,不調,NO,NO
117,不調,多く、一晩中アイドリングをすることもあります。滅多にエンストはしませんが、不調のエンジンがある場合はそのエンジンを止めて他のエンジンの力で走らせることがあり,"['多く', '、', '一晩', '中', 'アイドリング', 'を', 'する', 'こと', 'も', 'あり', 'ます', '。', '滅多に', 'エンスト', 'は', 'し', 'ませ', 'ん', 'が', '、', '不調の', 'エンジン', 'が', 'ある', '場合', 'は', 'その', 'エンジン', 'を', '止めて', '他の', 'エンジン', 'の', '力', 'で', '走ら', 'せる', 'こと', 'が', 'あり']",['不調の'],NO,不調,NO,YES
118,不調,と、どんな機種なのかが分かりませんから。で、原因。＊ＡＤＳＬが不調だった。（ＡＤＳＬモデムを再起動してからやってみては？）＊オーディオケーブルが外れかかっている,"['と', '、', 'どんな', '機種', 'な', 'の', 'か', 'が', '分かり', 'ませ', 'ん', 'から', '。', 'で', '、', '原因', '。＊', 'ＡＤＳＬ', 'が', '不調だった', '。', '（', 'ＡＤＳＬ', 'モデム', 'を', '再', '起動', 'して', 'から', 'やって', 'みて', 'は', '？）＊', 'オーディオケーブル', 'が', '外れ', 'かかって', 'いる']",['不調だった'],NO,不調,NO,YES
119,不調,食欲不振が加わり、次々といろいろな医者にかかり、薬が増え、その副作用でさらに不調が深まり、まるで底のない沼に、ゆっくりと沈んでいくように、少しずつ,"['食欲', '不振', 'が', '加わり', '、', '次々', 'と', 'いろいろな', '医者', 'に', 'かかり', '、', '薬', 'が', '増え', '、', 'その', '副', '作用', 'で', 'さらに', '不調', 'が', '深まり', '、', 'まるで', '底', 'の', 'ない', '沼', 'に', '、', 'ゆっくり', 'と', '沈んで', 'いく', 'ように', '、', '少しずつ']",['不調'],NO,不調,NO,NO
120,不調,幸運を思っていた。コロラドでの高地練習をして東京に帰ったあと、不調がつづいていた。呼吸が楽にならないのだ。高地練習とは、ご存知のよう,"['幸運', 'を', '思って', 'いた', '。', 'コロラド', 'で', 'の', '高地', '練習', 'を', 'して', '東京', 'に', '帰った', 'あと', '、', '不調', 'が', 'つづいて', 'いた', '。', '呼吸', 'が', '楽に', 'なら', 'ない', 'のだ', '。', '高地', '練習', 'と', 'は', '、', 'ご存知', 'の', 'よう']",['不調'],NO,不調,NO,NO
121,不調,思うでしょ。そんな本日のへんじん。じゃ、じゃぁ〜ん♪復活〜！二日続きの不調も何とかマシに！今日はちゃんとパジャマからお着替えを済まし、日常のルーティンもいつも,"['思う', 'でしょ', '。', 'そんな', '本日', 'の', 'へんじん', '。', 'じゃ', '、', 'じゃ', 'ぁ', '〜', 'ん', '♪', '復活', '〜', '！', '二', '日', '続き', 'の', '不調', 'も', '何とか', 'マシ', 'に', '！', '今日', 'は', 'ちゃんと', 'パジャマ', 'から', 'お', '着替え', 'を', '済まし', '、', '日常', 'の', 'ルーティン', 'も', 'いつも']",['不調'],NO,不調,NO,NO
122,不調,、菜生子には一つ思い当たることがあった。その事件と前後して、しばしば体の不調を訴えて保健室にやってくる少女がいた。三年の窪田由利枝で、教師間で,"['、', '菜', '生', '子', 'に', 'は', '一', 'つ', '思い当たる', 'こと', 'が', 'あった', '。', 'その', '事件', 'と', '前後', 'して', '、', 'しばしば', '体', 'の', '不調', 'を', '訴えて', '保健', '室', 'に', 'やってくる', '少女', 'が', 'いた', '。', '三', '年', 'の', '窪田', '由利', '枝', 'で', '、', '教師', '間', 'で']",['不調'],NO,不調,NO,NO
123,不調,が出来る様です。これが当たり前でしょうか？押したら全開が当たり前だと思いボタンの不調とばかり思ってます。良い回答をお願いします。つまり、この事が知りたかった,"['が', '出来る', '様', 'です', '。', 'これ', 'が', '当たり前でしょう', 'か', '？', '押したら', '全開', 'が', '当たり前だ', 'と', '思い', 'ボタン', 'の', '不調', 'と', 'ばかり', '思って', 'ます', '。', '良い', '回答', 'を', 'お', '願い', 'し', 'ます', '。', 'つまり', '、', 'この', '事', 'が', '知り', 'たかった']",['不調'],NO,不調,NO,NO
124,不調,から陥落した。中日は投打とも昨年の迫力を欠いた。特に川上や朝倉ら投手陣の不調が響いた。広島は新外国人・ルイスや若手の前田健ら投手陣が頑張り、初のクライマックスシリーズ出場へ猛然と追い上げ,"['から', '陥落', 'した', '。', '中日', 'は', '投打', 'と', 'も', '昨年', 'の', '迫力', 'を', '欠いた', '。', '特に', '川上', 'や', '朝倉', 'ら', '投手', '陣', 'の', '不調', 'が', '響いた', '。', '広島', 'は', '新', '外国', '人', '・', 'ルイス', 'や', '若手', 'の', '前田', '健', 'ら', '投手', '陣', 'が', '頑張り', '、', '初', 'の', 'クライマックスシリーズ', '出場', 'へ', '猛然と', '追い上げ']",['不調'],NO,不調,NO,NO
125,不調,ないのが、古さからくるトラブルだ。アイドリングが安定しないだけでも、スロポジの不調や燃料ポンプ、そして燃料フィルターの詰まりなどが原因として考えられる。さらに壊れやすいものの代表,"['ない', 'の', 'が', '、', '古', 'さ', 'から', 'くる', 'トラブル', 'だ', '。', 'アイドリング', 'が', '安定', 'し', 'ない', 'だけ', 'でも', '、', 'スロポジ', 'の', '不調や', '燃料', 'ポンプ', '、', 'そして', '燃料', 'フィルター', 'の', '詰まり', 'など', 'が', '原因', 'と', 'して', '考え', 'られる', '。', 'さらに', '壊れ', 'やすい', 'もの', 'の', '代表']",['不調や'],NO,不調,NO,YES
126,不調,みんな皇帝シューマッハが不調だと言うけど、ジャック・ビルニゥーブも元ワールドチャンピオンなのにあんまりテレビで取り上げられないのは何,"['みんな', '皇帝', 'シューマッハ', 'が', '不調だ', 'と', '言う', 'けど', '、', 'ジャック', '・', 'ビルニゥーブ', 'も', '元', 'ワールドチャンピオン', 'な', 'のに', 'あんまり', 'テレビ', 'で', '取り', '上げ', 'られ', 'ない', 'の', 'は', '何']",['不調だ'],NO,不調,NO,YES
127,不調,でチェック目に見える被害がないからといって、感染していないとはかぎらない。パソコンが不調になるなど怪しいと思ったらホームページでウィルスチェックできるサービスを利用しよう,"['で', 'チェック', '目', 'に', '見える', '被害', 'が', 'ない', 'から', 'と', 'いって', '、', '感染', 'して', 'い', 'ない', 'と', 'は', 'かぎら', 'ない', '。', 'パソコン', 'が', '不調に', 'なる', 'など', '怪しい', 'と', '思ったら', 'ホームページ', 'で', 'ウィルス', 'チェック', 'できる', 'サービス', 'を', '利用', 'しよう']",['不調に'],NO,不調,NO,YES
128,不調,人が生活するうえで，健康であるかそうでないかを考えるのは，体の不調がひどく自分では手におえないと思ったとき，あるいは，気持ちが極端に,"['人', 'が', '生活', 'する', 'うえ', 'で', '，', '健康である', 'か', 'そう', 'で', 'ない', 'か', 'を', '考える', 'の', 'は', '，', '体', 'の', '不調', 'が', 'ひどく', '自分', 'で', 'は', '手', 'に', 'おえ', 'ない', 'と', '思った', 'とき', '，', 'あるいは', '，', '気持ち', 'が', '極端に']",['不調'],NO,不調,NO,NO
129,不調,、久田さんは扁桃腺を腫らしたり、偏頭痛持ちだったり、ひどい鼻炎に罹ったり、常に不調があったほうである。―話を戻そう。薬局で相談したら、漢方薬にしなさいという,"['、', '久田', 'さん', 'は', '扁桃腺', 'を', '腫らしたり', '、', '偏', '頭痛', '持ち', 'だったり', '、', 'ひどい', '鼻', '炎', 'に', '罹ったり', '、', '常に', '不調', 'が', 'あった', 'ほう', 'である', '。', '―', '話', 'を', '戻そう', '。', '薬局', 'で', '相談', 'したら', '、', '漢方', '薬', 'に', 'し', 'なさい', 'と', 'いう']",['不調'],NO,不調,NO,NO
130,不調,今年のベランダのにがサマはあまりに不調なので、ほとんど記事にしていないのですが・・記事にしていない間に,"['今年', 'の', 'ベランダ', 'の', 'にが', 'サマ', 'は', 'あまりに', '不調な', 'ので', '、', 'ほとんど', '記事', 'に', 'して', 'い', 'ない', 'のです', 'が', '・', '・', '記事', 'に', 'して', 'い', 'ない', '間', 'に']",['不調な'],NO,不調,NO,YES
131,不調,が多くなりました・・・。しかも・・・自宅のＰＣは、不調のままですから診察室に移動して来ました。さて、「０系新幹線」の「,"['が', '多く', 'なり', 'ました', '・', '・', '・', '。', 'しかも', '・', '・', '・', '自宅', 'の', 'ＰＣ', 'は', '、', '不調の', 'まま', 'です', 'から', '診察', '室', 'に', '移動', 'して', '来', 'ました', '。', 'さて', '、', '「', '０', '系', '新幹線', '」', 'の', '「']",['不調の'],NO,不調,NO,YES
132,不調,突き放して不調を吹き飛ばす勝利。ＭＦの得点が大事なんだそうです。愛媛は未だ不調から抜け出せず。久しぶりに得点は入ったが。明日もサッカー日和。もちろんスカパーで見る,"['突き放して', '不調', 'を', '吹き飛ばす', '勝利', '。', 'ＭＦ', 'の', '得点', 'が', '大事な', 'んだ', 'そうです', '。', '愛媛', 'は', '未だ', '不調', 'から', '抜け出せ', 'ず', '。', '久しぶりに', '得点', 'は', '入った', 'が', '。', '明日', 'も', 'サッカー', '日和', '。', 'もちろん', 'スカパー', 'で', '見る']",['不調'],NO,不調,NO,NO
133,不調,突き放して不調を吹き飛ばす勝利。ＭＦの得点が大事なんだそうです。愛媛は未だ不調から抜け出せず。久しぶりに得点は入ったが。明日もサッカー日和。もちろんスカパーで見る,"['突き放して', '不調', 'を', '吹き飛ばす', '勝利', '。', 'ＭＦ', 'の', '得点', 'が', '大事な', 'んだ', 'そうです', '。', '愛媛', 'は', '未だ', '不調', 'から', '抜け出せ', 'ず', '。', '久しぶりに', '得点', 'は', '入った', 'が', '。', '明日', 'も', 'サッカー', '日和', '。', 'もちろん', 'スカパー', 'で', '見る']",['不調'],NO,不調,NO,NO
134,不調,４年間で通算百二セーブをマーク。強力なセットアッパーとして計算できるだけでなく、クルーンが故障した場合や不調のときは、代役として抑えも期待できる。交換相手となる二岡は今季開幕戦で右ふくらはぎを,"['４', '年間', 'で', '通算', '百二', 'セーブ', 'を', 'マーク', '。', '強力な', 'セット', 'アッパー', 'と', 'して', '計算', 'できる', 'だけ', 'で', 'なく', '、', 'クルーン', 'が', '故障', 'した', '場合', 'や', '不調の', 'とき', 'は', '、', '代役', 'と', 'して', '抑え', 'も', '期待', 'できる', '。', '交換', '相手', 'と', 'なる', '二', '岡', 'は', '今季', '開幕', '戦', 'で', '右', 'ふくらはぎ', 'を']",['不調の'],NO,不調,NO,YES
135,不調,が家の周辺を走り回って親戚や知人から金をかき集める時間だけだ。それが不調に終わると救急車は患者を残して立ち去るのが普通である。私は多くの,"['が', '家', 'の', '周辺', 'を', '走り回って', '親戚', 'や', '知人', 'から', '金', 'を', 'かき集める', '時間', 'だけ', 'だ', '。', 'それ', 'が', '不調に', '終わる', 'と', '救急', '車', 'は', '患者', 'を', '残して', '立ち去る', 'の', 'が', '普通である', '。', '私', 'は', '多く', 'の']",['不調に'],NO,不調,NO,YES
136,不調,ている。これに対し，供給は，マンション供給，戸建て供給とも，三大都市圏では「やや不調」，地方圏では「どちらとも言えない」とみている企業が多い。,"['て', 'いる', '。', 'これ', 'に', '対し', '，', '供給', 'は', '，', 'マンション', '供給', '，', '戸', '建て', '供給', 'と', 'も', '，', '三', '大', '都市', '圏', 'で', 'は', '「', 'やや', '不調', '」', '，', '地方', '圏', 'で', 'は', '「', 'どちら', 'と', 'も', '言え', 'ない', '」', 'と', 'みて', 'いる', '企業', 'が', '多い', '。']",['不調'],NO,不調,NO,NO
137,不調,（託児はさくらぎこども館）▼内容…子どもを中高生に託児してもらう間、ヘッドスパで体の不調を取り、リフレッシュしましょう。▼対象…２歳以下の子とその親三十組（申込順）▼,"['（', '託児', 'は', 'さくら', 'ぎ', 'こども', '館', '）', '▼', '内容', '…', '子ども', 'を', '中高', '生', 'に', '託児', 'して', 'もらう', '間', '、', 'ヘッドスパ', 'で', '体', 'の', '不調', 'を', '取り', '、', 'リフレッシュ', 'し', 'ましょう', '。', '▼', '対象', '…', '２', '歳', '以下', 'の', '子', 'と', 'その', '親', '三十', '組', '（', '申込', '順', '）', '▼']",['不調'],NO,不調,NO,NO
138,不調,の人生の師に合掌して、筆を擱きたい。はじめにこのところ日本経済が不調ということで、その分析や対策についてじつに多種多様な意見や論文が出ているが,"['の', '人生', 'の', '師', 'に', '合掌', 'して', '、', '筆', 'を', '擱', 'きたい', '。', 'はじめ', 'に', 'この', 'ところ', '日本', '経済', 'が', '不調', 'と', 'いう', 'こと', 'で', '、', 'その', '分析', 'や', '対策', 'に', 'ついて', 'じつに', '多種多様な', '意見', 'や', '論文', 'が', '出て', 'いる', 'が']",['不調'],NO,不調,NO,NO
139,不調,山菜採りに出掛けて、全く不調です（〉＿〈）目的の「ワラビ」が皆目ゼロに近い状態でした！！！そんな時,"['山菜', '採り', 'に', '出掛けて', '、', '全く', '不調です', '（', '〉', '＿', '〈', '）', '目的', 'の', '「', 'ワラビ', '」', 'が', '皆目', 'ゼロ', 'に', '近い', '状態', 'でした', '！', '！', '！', 'そんな', '時']",['不調です'],NO,不調,NO,YES
140,不調,には、相当の覚悟が必要であったろう。執筆中も、無理のきかぬ身体の不調に焦って、民間療法を聞きかじってきては、自分のへそにじかにお灸を,"['に', 'は', '、', '相当', 'の', '覚悟', 'が', '必要であったろう', '。', '執筆', '中', 'も', '、', '無理', 'の', 'きか', 'ぬ', '身体', 'の', '不調に', '焦って', '、', '民間', '療法', 'を', '聞きかじって', 'きて', 'は', '、', '自分', 'の', 'へそ', 'に', 'じかに', 'お', '灸', 'を']",['不調に'],NO,不調,NO,YES
141,不調,て、弱火で約二十分煮る。気冷えタイプはイメージトレーニングが効果的症状冷えによって精神的な不調をきたしているのがこのタイプ。うつ、倦怠感、不眠、自律神経失調症などの精神疾患は、,"['て', '、', '弱火', 'で', '約', '二十', '分', '煮る', '。', '気', '冷え', 'タイプ', 'は', 'イメージ', 'トレーニング', 'が', '効果', '的', '症状', '冷え', 'に', 'よって', '精神', '的な', '不調', 'を', 'きたして', 'いる', 'の', 'が', 'この', 'タイプ', '。', 'うつ', '、', '倦怠', '感', '、', '不眠', '、', '自律', '神経', '失調', '症', 'など', 'の', '精神', '疾患', 'は', '、']",['不調'],NO,不調,NO,NO
142,不調,不安といった精神症状だけではなく不眠・食欲不振・頭痛・胃腸の痛み・めまい等自律神経系の身体症状が生じます。精神科・神経科では，メンタルの不調に重点をおいて治療を進め心療内科の場合，内科の一部門として身体の症状に,"['不安', 'と', 'いった', '精神', '症状', 'だけ', 'で', 'は', 'なく', '不眠', '・', '食欲', '不振', '・', '頭痛', '・', '胃腸', 'の', '痛み', '・', 'めまい', '等', '自律', '神経', '系', 'の', '身体', '症状', 'が', '生じ', 'ます', '。', '精神', '科', '・', '神経', '科', 'で', 'は', '，', 'メンタル', 'の', '不調に', '重点', 'を', 'おいて', '治療', 'を', '進め', '心療内科', 'の', '場合', '，', '内科', 'の', '一', '部門', 'と', 'して', '身体', 'の', '症状', 'に']",['不調に'],NO,不調,NO,YES
143,不調,与えた．５月末までには，アウラングゼーブはアーグラーに入った．父帝との交渉が不調に終わると，アウラングゼーブはシャー・ジャハーンを屈服させた．アーグラー城の財宝を没収した後，,"['与えた', '．', '５', '月', '末', 'まで', 'に', 'は', '，', 'アウラングゼーブ', 'は', 'アーグラー', 'に', '入った', '．', '父', '帝', 'と', 'の', '交渉', 'が', '不調に', '終わる', 'と', '，', 'アウラングゼーブ', 'は', 'シャー', '・', 'ジャハーン', 'を', '屈服', 'さ', 'せた', '．', 'アーグラー', '城', 'の', '財宝', 'を', '没収', 'した', '後', '，']",['不調に'],NO,不調,NO,YES
144,不調,●気・血・水でいうと→「気」が不足しやすく、「水」が滞りやすい●不調が出やすい部分→耳●調子が悪いと顔色が…→ドス黒くなる,"['●', '気', '・', '血', '・', '水', 'で', 'いう', 'と', '→', '「', '気', '」', 'が', '不足', 'し', 'やすく', '、', '「', '水', '」', 'が', '滞り', 'やすい', '●', '不調', 'が', '出', 'やすい', '部分', '→', '耳', '●', '調子', 'が', '悪い', 'と', '顔色', 'が', '…→', 'ドス', '黒く', 'なる']",['不調'],NO,不調,NO,NO
145,不調,は五十八キロ。（去年は五十七キロ）それがどうか。今年に入って、微妙に不調な感じも。スローでないと伸びないヘンなところもあって、信頼感はイマイチ。,"['は', '五十八', 'キロ', '。', '（', '去年', 'は', '五十七', 'キロ', '）', 'それ', 'が', 'どう', 'か', '。', '今年', 'に', '入って', '、', '微妙に', '不調な', '感じ', 'も', '。', 'スローで', 'ない', 'と', '伸び', 'ない', 'ヘンな', 'ところ', 'も', 'あって', '、', '信頼', '感', 'は', 'イマイチ', '。']",['不調な'],NO,不調,NO,YES
146,不調,問題が正子を捉えていた。夏が過ぎ、秋になった。基貞親王が不調を訴えて亭子院から津和院に移って来た。ここ数年、夏には必ず体調,"['問題', 'が', '正子', 'を', '捉えて', 'いた', '。', '夏', 'が', '過ぎ', '、', '秋', 'に', 'なった', '。', '基', '貞', '親王', 'が', '不調', 'を', '訴えて', '亭', '子', '院', 'から', '津', '和', '院', 'に', '移って', '来た', '。', 'ここ', '数', '年', '、', '夏', 'に', 'は', '必ず', '体調']",['不調'],NO,不調,NO,NO
147,不調,普通にしているとほとんど血は出ません。生理のときのような体の不調もありません。子宮内膜症はありますがそんなにひどくないと診断されたばかりです,"['普通に', 'して', 'いる', 'と', 'ほとんど', '血', 'は', '出', 'ませ', 'ん', '。', '生理', 'の', 'とき', 'の', 'ような', '体', 'の', '不調', 'も', 'あり', 'ませ', 'ん', '。', '子宮', '内膜', '症', 'は', 'あり', 'ます', 'が', 'そんなに', 'ひどく', 'ない', 'と', '診断', 'さ', 'れた', 'ばかりです']",['不調'],NO,不調,NO,NO
148,不調,リカバリーＣＤがあるのですが、別ＷＩＮノートＰＣ（別メーカー）に使用する事は出来ますか？ノートＰＣが不調の為、初期化して状態を確認したいのですが・・・ダメです。ハードディスク構成やドライバ,"['リカバリー', 'ＣＤ', 'が', 'ある', 'のです', 'が', '、', '別', 'ＷＩＮ', 'ノート', 'ＰＣ', '（', '別', 'メーカー', '）', 'に', '使用', 'する', '事', 'は', '出来', 'ます', 'か', '？', 'ノート', 'ＰＣ', 'が', '不調の', '為', '、', '初期', '化', 'して', '状態', 'を', '確認', 'し', 'たい', 'のです', 'が', '・', '・', '・', 'ダメです', '。', 'ハードディスク', '構成', 'や', 'ドライバ']",['不調の'],NO,不調,NO,YES
149,不調,の寒さが厳しいからだ。黒砂糖は、体を温め、低体温からくる朝の不調を取り除いてくれる。体温が上がると体内の脂肪、老廃物、糖分の燃焼が促され,"['の', '寒', 'さ', 'が', '厳しい', 'から', 'だ', '。', '黒砂糖', 'は', '、', '体', 'を', '温め', '、', '低', '体温', 'から', 'くる', '朝', 'の', '不調', 'を', '取り除いて', 'くれる', '。', '体温', 'が', '上がる', 'と', '体', '内', 'の', '脂肪', '、', '老', '廃物', '、', '糖分', 'の', '燃焼', 'が', '促さ', 'れ']",['不調'],NO,不調,NO,NO
150,不調,と言った。明子は、心にもないことを言ったわけではない。体の不調は、死にたい気持を強めたであろう。故障の多い体だったから、明子,"['と', '言った', '。', '明子', 'は', '、', '心', 'に', 'も', 'ない', 'こと', 'を', '言った', 'わけで', 'は', 'ない', '。', '体', 'の', '不調', 'は', '、', '死に', 'たい', '気持', 'を', '強めた', 'であろう', '。', '故障', 'の', '多い', '体', 'だった', 'から', '、', '明子']",['不調'],NO,不調,NO,NO
151,不調,？茶木うん。西原あなたのサクセスはそこで終わってるの（笑）。不調だった師匠のホントの理由！？―大会中、西原さんは山崎さんの後ろで見,"['？', '茶', '木', 'うん', '。', '西原', 'あなた', 'の', 'サクセス', 'は', 'そこ', 'で', '終わって', 'る', 'の', '（', '笑', '）', '。', '不調だった', '師匠', 'の', 'ホントの', '理由', '！？―', '大会', '中', '、', '西原', 'さん', 'は', '山崎', 'さん', 'の', '後ろ', 'で', '見']",['不調だった'],NO,不調,NO,YES
152,不調,の交渉が不調に終わった場合は、記者の上司であるデスクと話し合う。それも不調に終わったら法律やＰＲの専門家と相談のうえ、文書の形で「○○記事について,"['の', '交渉', 'が', '不調に', '終わった', '場合', 'は', '、', '記者', 'の', '上司', 'である', 'デスク', 'と', '話し', '合う', '。', 'それ', 'も', '不調に', '終わったら', '法律', 'や', 'ＰＲ', 'の', '専門', '家', 'と', '相談', 'の', 'うえ', '、', '文書', 'の', '形', 'で', '「', '○', '○', '記事', 'に', 'ついて']",['不調に'],NO,不調,NO,YES
