,compound unit,context,segmented,split units,the unit is split,compound unit form,unexpected segmentation,unexpected joining
0,不調,こう言うなんだよな！！「あのね、多貴。圭祐くんここのところちょっぴり不調でしょ？」母さんはそれでも頷こうとしない俺に、少しだけ俯くと、トーン,"['こう', '言う', 'なんだ', 'よ', 'な', '！', '！', '「', 'あの', 'ね', '、', '多', '貴', '。', '圭', '祐', 'くん', 'ここ', 'の', 'ところ', 'ちょっぴり', '不調でしょ', '？', '」', '母さん', 'は', 'それ', 'でも', '頷こう', 'と', 'し', 'ない', '俺', 'に', '、', '少し', 'だけ', '俯く', 'と', '、', 'トーン']",['不調でしょ'],NO,不調,NO,YES
1,不調,→夏●気・血・水でいうと→「気」「血」が滞りやすい●不調が出やすい部分→舌●調子が悪いと顔色が…→赤くなる,"['→', '夏', '●', '気', '・', '血', '・', '水', 'で', 'いう', 'と', '→', '「', '気', '」', '「', '血', '」', 'が', '滞り', 'やすい', '●', '不調', 'が', '出', 'やすい', '部分', '→', '舌', '●', '調子', 'が', '悪い', 'と', '顔色', 'が', '…→', '赤く', 'なる']",['不調'],NO,不調,NO,NO
2,不調,少し寂しくて。親の心は複雑だ。学園まつり秋雪は心配していた体の不調もなく、たくさんの行事に参加できた。夏の終りに催される学園まつりでは、,"['少し', '寂しくて', '。', '親', 'の', '心', 'は', '複雑だ', '。', '学園', 'まつり', '秋', '雪', 'は', '心配', 'して', 'いた', '体', 'の', '不調', 'も', 'なく', '、', 'たくさんの', '行事', 'に', '参加', 'できた', '。', '夏', 'の', '終り', 'に', '催さ', 'れる', '学園', 'まつり', 'で', 'は', '、']",['不調'],NO,不調,NO,NO
3,不調,して会いに来ただから込み上げるものがあるのだろう・・・久し振りだからねずっと不調だったから一日延ばしで今日まで待ち続けていたもしもこの日雨が降らなければ,"['して', '会い', 'に', '来た', 'だ', 'から', '込み上げる', 'もの', 'が', 'ある', 'のだろう', '・', '・', '・', '久し振りだ', 'から', 'ね', 'ずっと', '不調だった', 'から', '一', '日', '延ばし', 'で', '今日', 'まで', '待ち', '続けて', 'いた', 'もしも', 'この', '日', '雨', 'が', '降ら', 'なければ']",['不調だった'],NO,不調,NO,YES
4,不調,入ると自然に治りましたから、結果は母が正しかったんです」もちろん、不調の多い久田さんにも、しのぐ家系の血が脈々と息づいており、おたふく風邪で学校を,"['入る', 'と', '自然に', '治り', 'ました', 'から', '、', '結果', 'は', '母', 'が', '正しかった', 'んです', '」', 'もちろん', '、', '不調の', '多い', '久田', 'さん', 'に', 'も', '、', 'しのぐ', '家系', 'の', '血', 'が', '脈々と', '息づいて', 'おり', '、', 'おたふく', '風邪', 'で', '学校', 'を']",['不調の'],NO,不調,NO,YES
5,不調,・・怪しい粉は・・？？顔まで白いぞ・・・耳耳が不調なときに栄養のあるフォーミュラーと言う餌を購入しました。以前おくさんたちの時もウズラ〜さん,"['・', '・', '怪しい', '粉', 'は', '・', '・', '？', '？', '顔', 'まで', '白い', 'ぞ', '・', '・', '・', '耳', '耳', 'が', '不調な', 'とき', 'に', '栄養', 'の', 'ある', 'フォーミュラー', 'と', '言う', '餌', 'を', '購入', 'し', 'ました', '。', '以前', 'おくさん', 'たち', 'の', '時', 'も', 'ウズラ', '〜', 'さん']",['不調な'],NO,不調,NO,YES
6,不調,に目を向けると、そこではまださっきのレポーターとキャスターが、主に鷹塚さんの不調を話題にして会話を続けていた。母さんのむかつき所は、鷹塚さんを批判する,"['に', '目', 'を', '向ける', 'と', '、', 'そこ', 'で', 'は', 'まだ', 'さっき', 'の', 'レポーター', 'と', 'キャスター', 'が', '、', '主に', '鷹', '塚', 'さん', 'の', '不調', 'を', '話題', 'に', 'して', '会話', 'を', '続けて', 'いた', '。', '母さん', 'の', 'むかつき', '所', 'は', '、', '鷹', '塚', 'さん', 'を', '批判', 'する']",['不調'],NO,不調,NO,NO
7,不調,！ってことは、クルマのメンテを急いでやんなきゃ、だ。そんなとき、不調で悩んだら速攻、新鮮組に相談だ。メール＆手紙、待ってるヨ〜！ドラテク,"['！', 'って', 'こと', 'は', '、', 'クルマ', 'の', 'メンテ', 'を', '急いで', 'や', 'ん', 'なきゃ', '、', 'だ', '。', 'そんな', 'とき', '、', '不調で', '悩んだら', '速攻', '、', '新鮮', '組', 'に', '相談', 'だ', '。', 'メール', '＆', '手紙', '、', '待って', 'る', 'ヨ', '〜', '！', 'ドラテク']",['不調で'],NO,不調,NO,YES
8,不調,白朮（オケラ）、桔梗（キキョウ）などの生薬と配合し、下痢をともなう消化器の不調に見られる風寒をともなう内湿の症状の治療薬、藿香正気散に使用。黄芩（スカルキャップ,"['白朮', '（', 'オケラ', '）', '、', '桔梗', '（', 'キキョウ', '）', 'など', 'の', '生薬', 'と', '配合', 'し', '、', '下痢', 'を', 'ともなう', '消化', '器', 'の', '不調に', '見', 'られる', '風', '寒', 'を', 'ともなう', '内', '湿', 'の', '症状', 'の', '治療', '薬', '、', '藿香', '正', '気', '散', 'に', '使用', '。', '黄', '芩', '（', 'スカルキャップ']",['不調に'],NO,不調,NO,YES
9,不調,見た。２月二十八日ああ、忙殺される毎日に負けじと奮闘する不屈さ。体の不調だけには敏感にとおびえている臆病さ。でも何より、悲しみを悲しみとして流す,"['見た', '。', '２', '月', '二十八', '日', 'ああ', '、', '忙殺', 'さ', 'れる', '毎日', 'に', '負け', 'じ', 'と', '奮闘', 'する', '不屈', 'さ', '。', '体', 'の', '不調', 'だけ', 'に', 'は', '敏感に', 'と', 'おびえて', 'いる', '臆病', 'さ', '。', 'でも', '何より', '、', '悲し', 'み', 'を', '悲しみ', 'と', 'して', '流す']",['不調'],NO,不調,NO,NO
10,不調,、いろいろな講演会やワークショップなどを開催したりもしています。何か心に不調を感じたときや、家族の様子で心配なことがあっても、なかなか病院,"['、', 'いろいろな', '講演', '会', 'や', 'ワークショップ', 'など', 'を', '開催', 'したり', 'も', 'して', 'い', 'ます', '。', '何', 'か', '心', 'に', '不調', 'を', '感じた', 'とき', 'や', '、', '家族', 'の', '様子', 'で', '心配な', 'こと', 'が', 'あって', 'も', '、', 'なかなか', '病院']",['不調'],NO,不調,NO,NO
11,不調,不眠、自律神経失調症などの精神疾患は、気冷えから起こる。うつ病や自律神経失調症など、精神的に不調の人は、ほとんど例外なく三十六．五度に満たない低体温だという。「このタイプ,"['不眠', '、', '自律', '神経', '失調', '症', 'など', 'の', '精神', '疾患', 'は', '、', '気', '冷え', 'から', '起こる', '。', 'うつ病', 'や', '自律', '神経', '失調', '症', 'など', '、', '精神', '的に', '不調の', '人', 'は', '、', 'ほとんど', '例外', 'なく', '三十六', '．', '五', '度', 'に', '満たない', '低', '体温', 'だ', 'と', 'いう', '。', '「', 'この', 'タイプ']",['不調の'],NO,不調,NO,YES
12,不調,申し出を受けた」今にして思えば、琴江はすでに自分の体の不調に気づいていたせいではなかったかと通之進はいった。「今、申した,"['申し出', 'を', '受けた', '」', '今に', 'して', '思えば', '、', '琴', '江', 'は', 'すでに', '自分', 'の', '体', 'の', '不調に', '気づいて', 'いた', 'せい', 'で', 'は', 'なかった', 'か', 'と', '通', '之進', 'は', 'いった', '。', '「', '今', '、', '申した']",['不調に'],NO,不調,NO,YES
13,不調,不調だったんですが、ここ２週間ほど調子がよく復活しましてました。でもまた不調になりだしました。これはマウスの故障ですか？原因は何が考えられます,"['不調だった', 'んです', 'が', '、', 'ここ', '２', '週間', 'ほど', '調子', 'が', 'よく', '復活', 'し', 'まして', 'ました', '。', 'でも', 'また', '不調に', 'なり', 'だし', 'ました', '。', 'これ', 'は', 'マウス', 'の', '故障', 'です', 'か', '？', '原因', 'は', '何', 'が', '考え', 'られ', 'ます']",['不調だった'],NO,不調,NO,YES
14,不調,不調だったんですが、ここ２週間ほど調子がよく復活しましてました。でもまた不調になりだしました。これはマウスの故障ですか？原因は何が考えられます,"['不調だった', 'んです', 'が', '、', 'ここ', '２', '週間', 'ほど', '調子', 'が', 'よく', '復活', 'し', 'まして', 'ました', '。', 'でも', 'また', '不調に', 'なり', 'だし', 'ました', '。', 'これ', 'は', 'マウス', 'の', '故障', 'です', 'か', '？', '原因', 'は', '何', 'が', '考え', 'られ', 'ます']",['不調に'],NO,不調,NO,YES
15,不調,重く感じたり体がむくんだりイライラしたりするのも、このバランスが崩れるから。そんな不調を整えるためにも、飲料水は大切な役割を果たします」女性のためのクリニック,"['重く', '感じたり', '体', 'が', 'むくんだり', 'イライラ', 'したり', 'する', 'の', 'も', '、', 'この', 'バランス', 'が', '崩れる', 'から', '。', 'そんな', '不調', 'を', '整える', 'ため', 'に', 'も', '、', '飲料', '水', 'は', '大切な', '役割', 'を', '果たし', 'ます', '」', '女性', 'の', 'ため', 'の', 'クリニック']",['不調'],NO,不調,NO,NO
16,不調,や缶詰を食べ、煙草を吸い、焼酎を飲んだりして眠ってしまいました。不調なエンジンとの格闘で疲れていた。それに、波に揺られる船の上で,"['や', '缶詰', 'を', '食べ', '、', '煙草', 'を', '吸い', '、', '焼酎', 'を', '飲んだり', 'して', '眠って', 'しまい', 'ました', '。', '不調な', 'エンジン', 'と', 'の', '格闘', 'で', '疲れて', 'いた', '。', 'それ', 'に', '、', '波', 'に', '揺られる', '船', 'の', '上', 'で']",['不調な'],NO,不調,NO,YES
17,不調,体調は復活した。なんだ、ただ髪の毛がのびてイライラしていただけだった。不調のときは、爪を切ったり床屋に行ったりジタバタしているうちになんとかなるようだ,"['体調', 'は', '復活', 'した', '。', 'なんだ', '、', 'ただ', '髪', 'の', '毛', 'が', 'のびて', 'イライラ', 'して', 'いた', 'だけ', 'だった', '。', '不調の', 'とき', 'は', '、', '爪', 'を', '切ったり', '床屋', 'に', '行ったり', 'ジタバタ', 'して', 'いる', 'うち', 'に', 'なんとか', 'なる', 'ようだ']",['不調の'],NO,不調,NO,YES
18,不調,先行して、しぶとさを生かす？中山は合いそうな６・マコトスパルビエロ。×⇒不調ながら、内からあるいは伸びるかも？１・キクノサリーレ。×⇒中山なら、,"['先行', 'して', '、', 'しぶと', 'さ', 'を', '生かす', '？', '中山', 'は', '合い', 'そうな', '６', '・', 'マコトスパルビエロ', '。', '×', '⇒', '不調', 'ながら', '、', '内', 'から', 'あるいは', '伸びる', 'かも', '？', '１', '・', 'キクノサリーレ', '。', '×', '⇒', '中山', 'なら', '、']",['不調'],NO,不調,NO,NO
19,不調,についてもわたしは疑っています。お父様は晩年、とっくに発作で脳の機能が不調になっていたにもかかわらず、元気なご様子に見えました。でもやはり従来のあの方,"['に', 'ついて', 'も', 'わたし', 'は', '疑って', 'い', 'ます', '。', 'お', '父', '様', 'は', '晩年', '、', 'とっくに', '発作', 'で', '脳', 'の', '機能', 'が', '不調に', 'なって', 'いた', 'に', 'も', 'かかわら', 'ず', '、', '元気な', 'ご', '様子', 'に', '見え', 'ました', '。', 'でも', 'やはり', '従来', 'の', 'あの', '方']",['不調に'],NO,不調,NO,YES
20,不調,に限って切らしていたりする（汗）増産しました、が！レイアウトミス、プリンターの不調、ラミネート失敗、他諸処色々有りまして三十枚中十四枚しか使い物にならず！！生存率五十％未満か,"['に', '限って', '切らして', 'いたり', 'する', '（', '汗', '）', '増産', 'し', 'ました', '、', 'が', '！', 'レイアウトミス', '、', 'プリンター', 'の', '不調', '、', 'ラミネート', '失敗', '、', '他', '諸', '処', '色々', '有り', 'まして', '三十', '枚', '中', '十四', '枚', 'しか', '使い物', 'に', 'なら', 'ず', '！', '！', '生存', '率', '五十', '％', '未満', 'か']",['不調'],NO,不調,NO,NO
21,不調,強請って、やすえを捨てて家に帰る積りだったと。福島は会社が不調で三千万強請った。中本は、それを知って福島を殺して五千万強請って,"['強', '請', 'って', '、', 'や', 'すえ', 'を', '捨てて', '家', 'に', '帰る', '積り', 'だった', 'と', '。', '福島', 'は', '会社', 'が', '不調で', '三千万', '強', '請', 'った', '。', '中本', 'は', '、', 'それ', 'を', '知って', '福島', 'を', '殺して', '五千万', '強', '請', 'って']",['不調で'],NO,不調,NO,YES
22,不調,もいえるマンダング人の居住域である。危険は承知のうえだ。イギリス人との交渉の不調、そのため川向こうに渡ることを父に伝えさせるため、アユバは二人の従者を,"['も', 'いえる', 'マンダング', '人', 'の', '居住', '域', 'である', '。', '危険', 'は', '承知', 'の', 'うえ', 'だ', '。', 'イギリス', '人', 'と', 'の', '交渉', 'の', '不調', '、', 'その', 'ため', '川向こう', 'に', '渡る', 'こと', 'を', '父', 'に', '伝え', 'させる', 'ため', '、', 'アユバ', 'は', '二', '人', 'の', '従者', 'を']",['不調'],NO,不調,NO,NO
23,不調,による調停が成立したときは，裁定申請は取り下げられたものとみなされ，また，不調に終わったときは，裁定手続が続行される（公害紛争処理法第四十二条の二十四）。（イ）,"['に', 'よる', '調停', 'が', '成立', 'した', 'とき', 'は', '，', '裁定', '申請', 'は', '取り下げ', 'られた', 'もの', 'と', 'みなさ', 'れ', '，', 'また', '，', '不調に', '終わった', 'とき', 'は', '，', '裁定', '手続', 'が', '続行', 'さ', 'れる', '（', '公害', '紛争', '処理', '法', '第', '四十二', '条', 'の', '二十四', '）', '。', '（', 'イ', '）']",['不調に'],NO,不調,NO,YES
24,不調,に描き出している。「彼らは何と結構な人生を送っていることか！心身の不調の手当てをして、かえって病気の数を増やし、合併症に苦しんでいる。しかも、,"['に', '描き', '出して', 'いる', '。', '「', '彼', 'ら', 'は', '何と', '結構な', '人生', 'を', '送って', 'いる', 'こと', 'か', '！', '心身', 'の', '不調の', '手当て', 'を', 'して', '、', 'かえって', '病気', 'の', '数', 'を', '増やし', '、', '合併', '症', 'に', '苦しんで', 'いる', '。', 'しかも', '、']",['不調の'],NO,不調,NO,YES
25,不調,は確実に２次空気（本来入ってはいけない所から入る空気の事）が入り前授のとうりの不調になります。あとゴム製のインマニに亀裂が生じてる場合もアウトです,"['は', '確実に', '２', '次', '空気', '（', '本来', '入って', 'は', 'いけない', '所', 'から', '入る', '空気', 'の', '事', '）', 'が', '入り', '前', '授', 'の', 'とうり', 'の', '不調に', 'なり', 'ます', '。', 'あと', 'ゴム', '製', 'の', 'インマニ', 'に', '亀裂', 'が', '生じて', 'る', '場合', 'も', 'アウト', 'です']",['不調に'],NO,不調,NO,YES
26,不調,の痛み、発熱、セキなどのカゼの症状から、腹痛、食欲不振など、体の不調に対するショウガの処方が載っています。生ものにショウガが添えられるのは、ショウガの,"['の', '痛み', '、', '発熱', '、', 'セキ', 'など', 'の', 'カゼ', 'の', '症状', 'から', '、', '腹痛', '、', '食欲', '不振', 'など', '、', '体', 'の', '不調に', '対する', 'ショウガ', 'の', '処方', 'が', '載って', 'い', 'ます', '。', '生もの', 'に', 'ショウガ', 'が', '添え', 'られる', 'の', 'は', '、', 'ショウガ', 'の']",['不調に'],NO,不調,NO,YES
27,不調,た。ほおずきの棲む世界では、ボスの意をうけて手がけた仕事が不調におわるということは、死をもってあがなわねばならないことのようだった。水島,"['た', '。', 'ほおずき', 'の', '棲む', '世界', 'で', 'は', '、', 'ボス', 'の', '意', 'を', 'うけて', '手がけた', '仕事', 'が', '不調に', 'おわる', 'と', 'いう', 'こと', 'は', '、', '死', 'を', 'もって', 'あ', 'が', 'なわ', 'ねば', 'なら', 'ない', 'こと', 'の', 'ようだった', '。', '水島']",['不調に'],NO,不調,NO,YES
28,不調,、葛藤パターンの人は、心療内科を受診することが多く、ストレスから来るさまざまな身体の不調を起こしやすいと考えられます。口に出せない怒りを抱えていつも悩んでなど,"['、', '葛藤', 'パターン', 'の', '人', 'は', '、', '心療内科', 'を', '受診', 'する', 'こと', 'が', '多く', '、', 'ストレス', 'から', '来る', 'さまざまな', '身体', 'の', '不調', 'を', '起こし', 'やすい', 'と', '考え', 'られ', 'ます', '。', '口', 'に', '出せ', 'ない', '怒り', 'を', '抱えて', 'いつも', '悩んで', 'など']",['不調'],NO,不調,NO,NO
29,不調,にすると燃料が流れ、オン、リザーブにすると燃料が止まります。コックの不調ですか？そうですね、フェールコックの交換をお進めします。オーバーフローになり、キャブも,"['に', 'する', 'と', '燃料', 'が', '流れ', '、', 'オン', '、', 'リザーブ', 'に', 'する', 'と', '燃料', 'が', '止まり', 'ます', '。', 'コック', 'の', '不調です', 'か', '？', 'そうです', 'ね', '、', 'フェールコック', 'の', '交換', 'を', 'お', '進め', 'し', 'ます', '。', 'オーバーフロー', 'に', 'なり', '、', 'キャブ', 'も']",['不調です'],NO,不調,NO,YES
30,不調,せてます。コンパに連れて行きたいのですが．．．。体の中が不調なんだと思います。ダイエット（植物性のものを多く摂るなど）や運動をし,"['せて', 'ます', '。', 'コンパ', 'に', '連れて', '行き', 'たい', 'のです', 'が', '．', '．', '．', '。', '体', 'の', '中', 'が', '不調な', 'んだ', 'と', '思い', 'ます', '。', 'ダイエット', '（', '植物', '性', 'の', 'もの', 'を', '多く', '摂る', 'など', '）', 'や', '運動', 'を', 'し']",['不調な'],NO,不調,NO,YES
31,不調,のですが、何でも指で足裏にある数多くの反射区を刺激し、ストレスや肩凝り・腰痛・冷え性・肌荒れなどの不調を解消する足裏健康法らしいです。リフレクソロジーに関する仕事に就くには学校に通うなどして民間の,"['のです', 'が', '、', '何でも', '指', 'で', '足', '裏', 'に', 'ある', '数', '多く', 'の', '反射', '区', 'を', '刺激', 'し', '、', 'ストレス', 'や', '肩凝り', '・', '腰痛', '・', '冷え性', '・', '肌', '荒れ', 'など', 'の', '不調', 'を', '解消', 'する', '足', '裏', '健康', '法', 'らしい', 'です', '。', 'リフレクソロジー', 'に', '関する', '仕事', 'に', '就く', 'に', 'は', '学校', 'に', '通う', 'など', 'して', '民間', 'の']",['不調'],NO,不調,NO,NO
32,不調,，学校健康教育の充実が社会的要求になりつつある中，教科に位置づけられている保健学習の実施が不調であるという報告が多くなされてきた。不調の原因として，教師の保健学習に対する姿勢・関心・位置づけ,"['，', '学校', '健康', '教育', 'の', '充実', 'が', '社会', '的', '要求', 'に', 'なり', 'つつ', 'ある', '中', '，', '教科', 'に', '位置づけ', 'られて', 'いる', '保健', '学習', 'の', '実施', 'が', '不調である', 'と', 'いう', '報告', 'が', '多く', 'なされて', 'きた', '。', '不調の', '原因', 'と', 'して', '，', '教師', 'の', '保健', '学習', 'に', '対する', '姿勢', '・', '関心', '・', '位置づけ']",['不調である'],NO,不調,NO,YES
33,不調,，学校健康教育の充実が社会的要求になりつつある中，教科に位置づけられている保健学習の実施が不調であるという報告が多くなされてきた。不調の原因として，教師の保健学習に対する姿勢・関心・位置づけ,"['，', '学校', '健康', '教育', 'の', '充実', 'が', '社会', '的', '要求', 'に', 'なり', 'つつ', 'ある', '中', '，', '教科', 'に', '位置づけ', 'られて', 'いる', '保健', '学習', 'の', '実施', 'が', '不調である', 'と', 'いう', '報告', 'が', '多く', 'なされて', 'きた', '。', '不調の', '原因', 'と', 'して', '，', '教師', 'の', '保健', '学習', 'に', '対する', '姿勢', '・', '関心', '・', '位置づけ']",['不調の'],NO,不調,NO,YES
34,不調,も、当日は完璧に放送できることもあるし、テストがうまくいっても本番が不調に終わることもあるので、確かなことは言えない」〕このような記事を読む,"['も', '、', '当日', 'は', '完璧に', '放送', 'できる', 'こと', 'も', 'ある', 'し', '、', 'テスト', 'が', 'うまく', 'いって', 'も', '本番', 'が', '不調に', '終わる', 'こと', 'も', 'ある', 'ので', '、', '確かな', 'こと', 'は', '言え', 'ない', '」', '〕', 'このような', '記事', 'を', '読む']",['不調に'],NO,不調,NO,YES
35,不調,掲載しました。数多くのポーズの中には、あなたのちょっとしたからだの不調を改善したり、慢性的になっているやっかいな症状を和らげるポーズも、必ずあるはずです,"['掲載', 'し', 'ました', '。', '数', '多く', 'の', 'ポーズ', 'の', '中', 'に', 'は', '、', 'あなた', 'の', 'ちょっと', 'した', 'から', 'だ', 'の', '不調', 'を', '改善', 'したり', '、', '慢性', '的に', 'なって', 'いる', 'やっかいな', '症状', 'を', '和らげる', 'ポーズ', 'も', '、', '必ず', 'ある', 'はずです']",['不調'],NO,不調,NO,NO
36,不調,飲み方朝食の代わりに生姜紅茶を飲むことで、健康を増進し、ちょっとした体の不調や、検査値の異常を正常に戻すことは、十分に可能だ。体温低下傾向の,"['飲み', '方', '朝食', 'の', '代わり', 'に', '生姜', '紅茶', 'を', '飲む', 'こと', 'で', '、', '健康', 'を', '増進', 'し', '、', 'ちょっと', 'した', '体', 'の', '不調や', '、', '検査', '値', 'の', '異常', 'を', '正常に', '戻す', 'こと', 'は', '、', '十分に', '可能だ', '。', '体温', '低下', '傾向', 'の']",['不調や'],NO,不調,NO,YES
37,不調,。結局、次の枠で再度走行チェックを行ったのだが・・・ん〜、トムキャット、不調。はっきりした原因はわからず。夏バテしてるのかなぁ〜。週末のレースまでに,"['。', '結局', '、', '次の', '枠', 'で', '再度', '走行', 'チェック', 'を', '行った', 'のだ', 'が', '・', '・', '・', 'ん', '〜', '、', 'トムキャット', '、', '不調', '。', 'はっきり', 'した', '原因', 'は', 'わから', 'ず', '。', '夏', 'バテ', 'して', 'る', 'の', 'かな', 'ぁ', '〜', '。', '週', '末', 'の', 'レース', 'まで', 'に']",['不調'],NO,不調,NO,NO
38,不調,が長すぎると嘆いてました。そういえば、日本も苦戦してしまいて選手達が不調なのも影響してるのでしょうか。でも良く頑張ってますね！バーレーボールはアメリカには,"['が', '長', 'すぎる', 'と', '嘆いて', 'ました', '。', 'そう', 'いえば', '、', '日本', 'も', '苦戦', 'して', 'しまい', 'て', '選手', '達', 'が', '不調な', 'の', 'も', '影響', 'して', 'る', 'のでしょう', 'か', '。', 'でも', '良く', '頑張って', 'ます', 'ね', '！', 'バーレーボール', 'は', 'アメリカ', 'に', 'は']",['不調な'],NO,不調,NO,YES
