230,不調,が販売されていないので、ＶＩＳＴＡマシンを購入し、ＷｉｎｄｏｗｓＸＰにダウングレードすることにしました。バックライトが不調で上部が暗くなっていたモニターも同時に買い換えましたが、キーボードとマウスは,"['が', '販売', 'さ', 'れて', 'い', 'ない', 'ので', '、', 'ＶＩＳＴＡ', 'マシン', 'を', '購入', 'し', '、', 'ＷｉｎｄｏｗｓＸＰ', 'に', 'ダウン', 'グレード', 'する', 'こと', 'に', 'し', 'ました', '。', 'バック', 'ライト', 'が', '不調で', '上部', 'が', '暗く', 'なって', 'いた', 'モニター', 'も', '同時に', '買い', '換え', 'ました', 'が', '、', 'キーボード', 'と', 'マウス', 'は']",['不調で'],NO,不調,NO,YES
231,不調,は七千八百六十三件であり、そのうち、調停が成立したものは五千六百三件（七十一．二％）、調停が不調に終わったもの千百四十六件（十四．六％）、その他が千百十四件（十四．二％）となっている。,"['は', '七千八百六十三', '件', 'であり', '、', 'その', 'うち', '、', '調停', 'が', '成立', 'した', 'もの', 'は', '五千六百三', '件', '（', '七十一', '．', '二', '％', '）', '、', '調停', 'が', '不調に', '終わった', 'も', 'の', '千百四十六', '件', '（', '十四', '．', '六', '％', '）', '、', 'その他', 'が', '千百十四', '件', '（', '十四', '．', '二', '％', '）', 'と', 'なって', 'いる', '。']",['不調に'],NO,不調,NO,YES
232,不調,てる時は必ずホークス打線のことでなんとなんと十七安打十四得点もしていたいままで不調だった小久保が２ランに３ランにと大活躍したしスタメン全員安打かな？打線爆発〜〜〜,"['てる', '時', 'は', '必ず', 'ホークス', '打線', 'の', 'こと', 'で', 'なんと', 'なんと', '十七', '安打', '十四', '得点', 'も', 'して', 'いた', 'いま', 'まで', '不調だった', '小久保', 'が', '２', 'ラン', 'に', '３', 'ラン', 'に', 'と', '大', '活躍', 'した', 'し', 'スタメン', '全員', '安打', 'かな', '？', '打線', '爆発', '〜〜〜']",['不調だった'],NO,不調,NO,YES
233,不調,後日思いだした。千九百八十九年八月のことである。この月の初め、父が体調の不調を訴えたので、Ｐ病院で検査を受けた。Ｆさんに電話で呼ばれ、病院,"['後日', '思いだした', '。', '千九百八十九', '年', '八', '月', 'の', 'こと', 'である', '。', 'この', '月', 'の', '初め', '、', '父', 'が', '体調', 'の', '不調', 'を', '訴えた', 'ので', '、', 'Ｐ', '病院', 'で', '検査', 'を', '受けた', '。', 'Ｆ', 'さん', 'に', '電話', 'で', '呼ば', 'れ', '、', '病院']",['不調'],NO,不調,NO,NO
234,不調,なさそうなとこが嫌いって言う人がいっぱいいるからね。谷村ただ、ときどき不調になられるときには、逆に駒田選手からそういうおおらかなところが薄れていっている,"['な', 'さ', 'そうな', 'とこ', 'が', '嫌い', 'って', '言う', '人', 'が', 'いっぱい', 'いる', 'から', 'ね', '。', '谷村', 'ただ', '、', 'ときどき', '不調に', 'なら', 'れる', 'とき', 'に', 'は', '、', '逆に', '駒田', '選手', 'から', 'そういう', 'おおらかな', 'ところ', 'が', '薄れて', 'いって', 'いる']",['不調に'],NO,不調,NO,YES
235,不調,２勝をマークして文句なしのＭＶＰに輝いた。特にラミレス、李スンヨプに対して計十二打数無安打。不調だったとはいえ、韓国の主砲からは５奪三振だ。国際大会の経験はなくとも、外国人選手,"['２', '勝', 'を', 'マーク', 'して', '文句なしの', 'ＭＶＰ', 'に', '輝いた', '。', '特に', 'ラミレス', '、', '李', 'スンヨプ', 'に', '対して', '計', '十二', '打数', '無', '安打', '。', '不調だった', 'と', 'は', 'いえ', '、', '韓国', 'の', '主砲', 'から', 'は', '５', '奪', '三振', 'だ', '。', '国際', '大会', 'の', '経験', 'は', 'なく', 'と', 'も', '、', '外国', '人', '選手']",['不調だった'],NO,不調,NO,YES
236,不調,は基本的には若返り法だと考えられているそうだ。それを応用することにより身体の不調や病気を自らの手によって治すわけだが、本来技のほとんどが秘伝として未公開,"['は', '基本', '的に', 'は', '若返り', '法', 'だ', 'と', '考え', 'られて', 'いる', 'そうだ', '。', 'それ', 'を', '応用', 'する', 'こと', 'に', 'より', '身体', 'の', '不調', 'や', '病気', 'を', '自ら', 'の', '手', 'に', 'よって', '治す', 'わけだ', 'が', '、', '本来', '技', 'の', 'ほとんど', 'が', '秘伝', 'と', 'して', '未', '公開']",['不調'],NO,不調,NO,NO
237,不調,にしていません。クルマ用オイルを勧めるものではありませんが体験から書きました。万一、不調を感じたら即交換して下さい。,"['に', 'して', 'い', 'ませ', 'ん', '。', 'クルマ', '用', 'オイル', 'を', '勧める', 'もの', 'で', 'は', 'あり', 'ませ', 'ん', 'が', '体験', 'から', '書き', 'ました', '。', '万一', '、', '不調', 'を', '感じたら', '即', '交換', 'して', '下さい', '。']",['不調'],NO,不調,NO,NO
238,不調,先月購入したばかりのパソコンが不調です。画面に一本の白い線が縦に入っています。気まぐれなパソコンで、,"['先月', '購入', 'した', 'ばかりの', 'パソコン', 'が', '不調です', '。', '画面', 'に', '一', '本', 'の', '白い', '線', 'が', '縦', 'に', '入って', 'い', 'ます', '。', '気まぐれな', 'パソコン', 'で', '、']",['不調です'],NO,不調,NO,YES
239,不調,自殺の動機としては、仕事の不調や職場の人間関係など、勤務上の問題も増加した。社会経済生産性本部の調査によると、労使双方の,"['自殺', 'の', '動機', 'と', 'して', 'は', '、', '仕事', 'の', '不調', 'や', '職場', 'の', '人間', '関係', 'など', '、', '勤務', '上', 'の', '問題', 'も', '増加', 'した', '。', '社会', '経済', '生産', '性', '本部', 'の', '調査', 'に', 'よる', 'と', '、', '労使', '双方', 'の']",['不調'],NO,不調,NO,NO
240,不調,不調な次男。熱は三十七℃台で落ち着いてますが、このとおりべったりです。夕べは食欲,"['不調な', '次男', '。', '熱', 'は', '三十七', '℃', '台', 'で', '落ち着いて', 'ます', 'が', '、', 'この', 'とおり', 'べったり', 'です', '。', '夕べ', 'は', '食欲']",['不調な'],NO,不調,NO,YES
241,不調,れた…トータル四十五ｋ。３箱回収してるから−三十ｋ。なんかここ数日の乙女は不調ですなぁ。−三十ｋ取り返すのは容易じゃない…ここは一発ミドルか？シトフタも空きは,"['れた', '…', 'トータル', '四十五', 'ｋ', '。', '３', '箱', '回収', 'して', 'る', 'から', '−', '三十', 'ｋ', '。', 'なんか', 'ここ', '数', '日', 'の', '乙女', 'は', '不調です', 'な', 'ぁ', '。', '−', '三十', 'ｋ', '取り', '返す', 'の', 'は', '容易じゃ', 'ない', '…', 'ここ', 'は', '一', '発', 'ミドル', 'か', '？', 'シトフタ', 'も', '空き', 'は']",['不調です'],NO,不調,NO,YES
242,不調,千九百九十六年）で、ガメラとレギオンのバトルの最中、避難民を乗せたＣＨ‐四十七が不調か何かで飛び立つのが遅れ、観客をやきもきさせたシーンに登場しているが、,"['千九百九十六', '年', '）', 'で', '、', 'ガメラ', 'と', 'レギオン', 'の', 'バトル', 'の', '最中', '、', '避難', '民', 'を', '乗せた', 'ＣＨ', '‐', '四十七', 'が', '不調', 'か', '何', 'か', 'で', '飛び', '立つ', 'の', 'が', '遅れ', '、', '観客', 'を', 'やきもき', 'さ', 'せた', 'シーン', 'に', '登場', 'して', 'いる', 'が', '、']",['不調'],NO,不調,NO,NO
243,不調,れてませんが電磁波過敏症と呼ばれる症状があります。これは超低周波による体の不調を訴えるものです。ＰＣの電磁波遮断機のような商品もありますから、電磁波を浴びる,"['れて', 'ませ', 'ん', 'が', '電磁', '波', '過敏', '症', 'と', '呼ば', 'れる', '症状', 'が', 'あり', 'ます', '。', 'これ', 'は', '超', '低', '周波', 'に', 'よる', '体', 'の', '不調', 'を', '訴える', 'もの', 'です', '。', 'ＰＣ', 'の', '電磁', '波', '遮断', '機', 'の', 'ような', '商品', 'も', 'あり', 'ます', 'から', '、', '電磁', '波', 'を', '浴びる']",['不調'],NO,不調,NO,NO
244,不調,ケースは多いのだ。腰痛が軽くなった、非特異性の頭痛が減った、消化器の不調が減った、皮膚の発疹が減った、などなどなど、実に幅広い例が,"['ケース', 'は', '多い', 'のだ', '。', '腰痛', 'が', '軽く', 'なった', '、', '非', '特異', '性', 'の', '頭痛', 'が', '減った', '、', '消化', '器', 'の', '不調', 'が', '減った', '、', '皮膚', 'の', '発疹', 'が', '減った', '、', 'など', 'など', 'など', '、', '実に', '幅広い', '例', 'が']",['不調'],NO,不調,NO,NO
245,不調,不調三十六下痢気味のとき排便は健康の大切なバロメーターです。排便に不調がある場合、暴飲暴食など思い当たる原因があるときはあまり心配ありませんが、症状,"['不調', '三十六', '下', '痢', '気味の', 'とき', '排便', 'は', '健康', 'の', '大切な', 'バロメーター', 'です', '。', '排便', 'に', '不調', 'が', 'ある', '場合', '、', '暴飲暴食', 'など', '思い当たる', '原因', 'が', 'ある', 'とき', 'は', 'あまり', '心配', 'あり', 'ませ', 'ん', 'が', '、', '症状']",['不調'],NO,不調,NO,NO
246,不調,不調三十六下痢気味のとき排便は健康の大切なバロメーターです。排便に不調がある場合、暴飲暴食など思い当たる原因があるときはあまり心配ありませんが、症状,"['不調', '三十六', '下', '痢', '気味の', 'とき', '排便', 'は', '健康', 'の', '大切な', 'バロメーター', 'です', '。', '排便', 'に', '不調', 'が', 'ある', '場合', '、', '暴飲暴食', 'など', '思い当たる', '原因', 'が', 'ある', 'とき', 'は', 'あまり', '心配', 'あり', 'ませ', 'ん', 'が', '、', '症状']",['不調'],NO,不調,NO,NO
247,不調,のひと言につきるらしい。「ある部門は好調であっても、べつの部門が不調ならば会社は潰れるということですよ」そのとき山添さんは五十八歳であったが、,"['の', 'ひと言', 'に', 'つきる', 'らしい', '。', '「', 'ある', '部門', 'は', '好調であって', 'も', '、', 'べつの', '部門', 'が', '不調ならば', '会社', 'は', '潰れる', 'と', 'いう', 'こと', 'です', 'よ', '」', 'その', 'とき', '山添', 'さん', 'は', '五十八', '歳', 'であった', 'が', '、']",['不調ならば'],NO,不調,NO,YES
248,不調,はーー疲れたよぉｗｗてヵ最近不調でミスばっかだよー汗もぉすぐ番手決めしなくちゃいけないのにーどぉゆーことですヵ,"['は', 'ーー', '疲れた', 'よ', 'ぉ', 'ｗｗ', 'て', 'ヵ', '最近', '不調', 'で', 'ミス', 'ばっかだ', 'よ', 'ー', '汗', 'も', 'ぉす', 'ぐ', '番手', '決め', 'し', 'なくちゃ', 'いけない', 'のに', 'ー', 'ど', 'ぉゆ', 'ー', 'こと', 'です', 'ヵ']",['不調'],NO,不調,NO,NO
249,不調,は違う命だけど、命を繋いでいくために、咲くのです。体が不調で、子どもの出来ない人もいる。でも、人は一つの点,"['は', '違う', '命', 'だ', 'けど', '、', '命', 'を', '繋いで', 'いく', 'ため', 'に', '、', '咲く', 'のです', '。', '体', 'が', '不調で', '、', '子ども', 'の', '出来', 'ない', '人', 'も', 'いる', '。', 'でも', '、', '人', 'は', '一', 'つ', 'の', '点']",['不調で'],NO,不調,NO,YES
250,不調,して言っていることです。とはいえ、どのように健康管理していても、体の不調は出てくるでしょう。そういうときに、どうすれば自らを癒すことができるか。元気,"['して', '言って', 'いる', 'こと', 'です', '。', 'とはいえ', '、', 'どのように', '健康', '管理', 'して', 'いて', 'も', '、', '体', 'の', '不調', 'は', '出て', 'くる', 'でしょう', '。', 'そういう', 'とき', 'に', '、', 'どう', 'すれば', '自ら', 'を', '癒す', 'こと', 'が', 'できる', 'か', '。', '元気']",['不調'],NO,不調,NO,NO
251,不調,ｙｕ＿四百四十四さんの質問に便乗ですがＰＣでＸＰを使っていて、不調って方はいますか？プリンターを酷使した日に限って固まります。☆☆,"['ｙｕ', '＿', '四百四十四', 'さん', 'の', '質問', 'に', '便乗', 'です', 'が', 'ＰＣ', 'で', 'ＸＰ', 'を', '使って', 'いて', '、', '不', '調って', '方', 'は', 'い', 'ます', 'か', '？', 'プリンター', 'を', '酷使', 'した', '日', 'に', '限って', '固まり', 'ます', '。', '☆☆']","['不', '調って']",YES,不調,NO,YES
252,不調,点火コイルが故障するという現象が起きるのだ。そしてその場合、点火不良が起きてエンジンが不調になる。突然症状が出て、すぐに直るということもあるので注意が必要,"['点火', 'コイル', 'が', '故障', 'する', 'と', 'いう', '現象', 'が', '起きる', 'のだ', '。', 'そして', 'その', '場合', '、', '点火', '不良', 'が', '起きて', 'エンジン', 'が', '不調に', 'なる', '。', '突然', '症状', 'が', '出て', '、', 'すぐ', 'に', '直る', 'と', 'いう', 'こと', 'も', 'ある', 'ので', '注意', 'が', '必要']",['不調に'],NO,不調,NO,YES
253,不調,友達も、その奥さんも三人ともおかしいです。私なら具合悪いとか体の不調を理由にもう家にも来ないで欲しいし、会いたくもないです。鈍感,"['友達', 'も', '、', 'その', '奥さん', 'も', '三', '人', 'と', 'も', 'おかしい', 'です', '。', '私', 'なら', '具合', '悪い', 'と', 'か', '体', 'の', '不調', 'を', '理由', 'に', 'もう', '家', 'に', 'も', '来', 'ないで', '欲しい', 'し', '、', '会', 'いたく', 'も', 'ないで', 'す', '。', '鈍感']",['不調'],NO,不調,NO,NO
254,不調,「頼れる打者の１人」森野がやや下降線でしょうか。でも今年は頑張っているし、不調といっても昨年のフル出場の経験が生きて復調も早いとは思いますが。そして・,"['「', '頼れる', '打者', 'の', '１', '人', '」', '森野', 'が', 'やや', '下降', '線', 'でしょう', 'か', '。', 'でも', '今年', 'は', '頑張って', 'いる', 'し', '、', '不調', 'と', 'いって', 'も', '昨年', 'の', 'フル', '出場', 'の', '経験', 'が', '生きて', '復調', 'も', '早い', 'と', 'は', '思い', 'ます', 'が', '。', 'そして', '・']",['不調'],NO,不調,NO,NO
255,不調,新しいのに越した事がありません。それでもエンジンが止まりそうに成るのならキャブの不調も考えられます。,"['新しい', 'の', 'に', '越した', '事', 'が', 'あり', 'ませ', 'ん', '。', 'それ', 'でも', 'エンジン', 'が', '止まり', 'そうに', '成る', 'の', 'なら', 'キャブ', 'の', '不調', 'も', '考え', 'られ', 'ます', '。']",['不調'],NO,不調,NO,NO
256,不調,「休め」の指令がうまく発せられなくなる。それが倦怠感やイライラ、不眠など不調の原因となるのだ。自律神経を安定させるために有効とされるのが、,"['「', '休め', '」', 'の', '指令', 'が', 'うまく', '発せ', 'られ', 'なく', 'なる', '。', 'それ', 'が', '倦怠', '感', 'や', 'イライラ', '、', '不眠', 'など', '不調の', '原因', 'と', 'なる', 'のだ', '。', '自律', '神経', 'を', '安定', 'さ', 'せる', 'ため', 'に', '有効', 'と', 'さ', 'れる', 'の', 'が', '、']",['不調の'],NO,不調,NO,YES
257,不調,なって二つぶんバックしたりするんですが、なぜ？教えてください。自分も以前、マウスの不調でそんな状態になった事があります。（その時は、マウスを買い換えました）,"['なって', '二', 'つ', 'ぶん', 'バック', 'したり', 'する', 'んです', 'が', '、', 'なぜ', '？', '教えて', 'ください', '。', '自分', 'も', '以前', '、', 'マウス', 'の', '不調で', 'そんな', '状態', 'に', 'なった', '事', 'が', 'あり', 'ます', '。', '（', 'その', '時', 'は', '、', 'マウス', 'を', '買い', '換え', 'ました', '）']",['不調で'],NO,不調,NO,YES
258,不調,た。戸外に出ても空気は生暖かく、むしむしした暑い夜だった。使いが不調に終ったので、星野はいっそう心持ちが悪い。見上げると半月が、どろんとし,"['た', '。', '戸外', 'に', '出て', 'も', '空気', 'は', '生暖かく', '、', 'むし', 'むし', 'した', '暑い', '夜', 'だった', '。', '使い', 'が', '不調に', '終った', 'ので', '、', '星野', 'は', 'いっそう', '心持ち', 'が', '悪い', '。', '見上げる', 'と', '半月', 'が', '、', 'どろ', 'ん', 'とし']",['不調に'],NO,不調,NO,YES
259,不調,判る。日長の一日せいいっぱい働けばいきおい睡眠時間の短かくなるのは当然で、体の不調は寝不足のせい、と思いつつ一日の休みも許されなかった。ときどき、,"['判る', '。', '日長', 'の', '一', '日', 'せいいっぱい', '働けば', 'いきおい', '睡眠', '時間', 'の', '短', 'かく', 'なる', 'の', 'は', '当然で', '、', '体', 'の', '不調', 'は', '寝不足の', 'せい', '、', 'と', '思い', 'つつ', '一', '日', 'の', '休み', 'も', '許さ', 'れ', 'なかった', '。', 'ときどき', '、']",['不調'],NO,不調,NO,NO
260,不調,ブラジルに対して、どんな戦いを挑むのかが焦点だった。しかも、今年のブラジルは不調で、センターバックに不安がある上、チリのツートップが強力なだけに「もしか,"['ブラジル', 'に', '対して', '、', 'どんな', '戦い', 'を', '挑む', 'の', 'か', 'が', '焦点', 'だった', '。', 'しかも', '、', '今年', 'の', 'ブラジル', 'は', '不調で', '、', 'センター', 'バック', 'に', '不安', 'が', 'ある', '上', '、', 'チリ', 'の', 'ツートップ', 'が', '強力な', 'だけ', 'に', '「', 'もし', 'か']",['不調で'],NO,不調,NO,YES
261,不調,最近ＰＣが不調です。急に電源落ちたり。気がついたのは、ＰＣから通常のカリカリ,"['最近', 'ＰＣ', 'が', '不調です', '。', '急に', '電源', '落ちたり', '。', '気', 'が', 'ついた', 'の', 'は', '、', 'ＰＣ', 'から', '通常', 'の', 'カリカリ']",['不調です'],NO,不調,NO,YES
262,不調,アテネで金を」。期待は高まるばかりだったが、今年に入ってからは不調が続く―。背後に迫るライバルの影。そんな中でようやく見えてきた光。,"['アテネ', 'で', '金', 'を', '」', '。', '期待', 'は', '高まる', 'ばかりだった', 'が', '、', '今年', 'に', '入って', 'から', 'は', '不調', 'が', '続く', '―', '。', '背後', 'に', '迫る', 'ライバル', 'の', '影', '。', 'そんな', '中', 'で', 'ようやく', '見えて', 'きた', '光', '。']",['不調'],NO,不調,NO,NO
263,不調,が出てきたんですね。富本新田さんがその話をされた後でその不調が出てきたんです。それで、どうしても支度をしないといかないね、という,"['が', '出て', 'きた', 'んです', 'ね', '。', '富', '本', '新田', 'さん', 'が', 'その', '話', 'を', 'さ', 'れた', '後', 'で', 'その', '不調', 'が', '出て', 'きた', 'んです', '。', 'それ', 'で', '、', 'どうしても', '支度', 'を', 'し', 'ない', 'と', 'いか', 'ない', 'ね', '、', 'と', 'いう']",['不調'],NO,不調,NO,NO
264,不調,は、他人の人生をも充実させる事になる」整体やオステオパシーを、痛みや不調を改善させるだけの手段・・・とだけ利用するのではなく自分の人生を充実させる為,"['は', '、', '他人', 'の', '人生', 'を', 'も', '充実', 'さ', 'せる', '事', 'に', 'なる', '」', '整体', 'や', 'オステオパシー', 'を', '、', '痛み', 'や', '不調', 'を', '改善', 'さ', 'せる', 'だけ', 'の', '手段', '・', '・', '・', 'と', 'だけ', '利用', 'する', 'ので', 'は', 'なく', '自分', 'の', '人生', 'を', '充実', 'さ', 'せる', '為']",['不調'],NO,不調,NO,NO
265,不調,、生真面目で物静か、言われたことはきちんとする、責任感がある…。由利枝の不調の原因は、その時に応じて風邪だったり貧血だったり生理痛だったりと、,"['、', '生真面目で', '物静か', '、', '言わ', 'れた', 'こと', 'は', 'きちんと', 'する', '、', '責任', '感', 'が', 'ある', '…', '。', '由利', '枝', 'の', '不調の', '原因', 'は', '、', 'その', '時', 'に', '応じて', '風邪', 'だったり', '貧血', 'だったり', '生理', '痛', 'だったり', 'と', '、']",['不調の'],NO,不調,NO,YES
266,不調,にとって流れとして最悪です。悪い流れが尾を引く恐れもあります。一方巨人は不調で二試合引っ込めていた亀井を５番に起用し活躍し、キャッチャーの阿部が怪我をして,"['に', 'とって', '流れ', 'と', 'して', '最悪です', '。', '悪い', '流れ', 'が', '尾', 'を', '引く', '恐れ', 'も', 'あり', 'ます', '。', '一方', '巨人', 'は', '不調で', '二', '試合', '引っ込めて', 'いた', '亀井', 'を', '５', '番', 'に', '起用', 'し', '活躍', 'し', '、', 'キャッチャー', 'の', '阿部', 'が', '怪我', 'を', 'して']",['不調で'],NO,不調,NO,YES
267,不調,、当クリニックを訪れました。なぜ思い当たったかと言うと、基礎体温をつけ始めて、不調の周期性に気づいたことがきっかけだったのです。そこで安定剤は生理前だけに,"['、', '当', 'クリニック', 'を', '訪れ', 'ました', '。', 'なぜ', '思い当たった', 'か', 'と', '言う', 'と', '、', '基礎', '体温', 'を', 'つけ', '始めて', '、', '不調の', '周期', '性', 'に', '気づいた', 'こと', 'が', 'きっかけ', 'だった', 'のです', '。', 'そこ', 'で', '安定', '剤', 'は', '生理', '前', 'だけ', 'に']",['不調の'],NO,不調,NO,YES
268,不調,のある感染症についての知識を得ることも大切です。もし、体調に不調を感じたら、早めに医療機関で受診し、ペットの飼育状態や動物との接触状況につい,"['の', 'ある', '感染', '症', 'に', 'ついて', 'の', '知識', 'を', '得る', 'こと', 'も', '大切です', '。', 'もし', '、', '体調', 'に', '不調', 'を', '感じたら', '、', '早', 'めに', '医療', '機関', 'で', '受診', 'し', '、', 'ペット', 'の', '飼育', '状態', 'や', '動物', 'と', 'の', '接触', '状況', 'に', 'つい']",['不調'],NO,不調,NO,NO
269,不調,プレステ２が不調です。レンタルのＤＶＤを見るとき本体に入って行きますが、スタートしません。,"['プレステ', '２', 'が', '不調です', '。', 'レンタル', 'の', 'ＤＶＤ', 'を', '見る', 'とき', '本体', 'に', '入って', '行き', 'ます', 'が', '、', 'スタート', 'し', 'ませ', 'ん', '。']",['不調です'],NO,不調,NO,YES
270,不調,はそれであった。道鬼自身は今年八十一歳になっていた。自分では体の不調を自覚しなかったが、昨年あたりから、「老人はもう戦場にでることもある,"['は', 'それ', 'であった', '。', '道', '鬼', '自身', 'は', '今年', '八十一', '歳', 'に', 'なって', 'いた', '。', '自分', 'で', 'は', '体', 'の', '不調', 'を', '自覚', 'し', 'なかった', 'が', '、', '昨年', 'あたり', 'から', '、', '「', '老人', 'は', 'もう', '戦場', 'に', 'でる', 'こと', 'も', 'ある']",['不調'],NO,不調,NO,NO
