386,無関心,第五章天皇という存在無関心だった自身の健康明治天皇は、自分の健康にまったく無関心でしたし、生涯大の医者嫌いでした。たとえば、一度も歯医者に歯を診てもらっ,"['第', '五', '章', '天皇', 'と', 'いう', '存在', '無関心', 'だった', '自身', 'の', '健康', '明治', '天皇', 'は', '、', '自分', 'の', '健康に', 'まったく', '無関心でした', 'し', '、', '生涯', '大', 'の', '医者', '嫌いでした', '。', 'たとえば', '、', '一', '度', 'も', '歯', '医者', 'に', '歯', 'を', '診て', 'もらっ']",['無関心'],NO,無関心,NO,NO
387,無関心,第五章天皇という存在無関心だった自身の健康明治天皇は、自分の健康にまったく無関心でしたし、生涯大の医者嫌いでした。たとえば、一度も歯医者に歯を診てもらっ,"['第', '五', '章', '天皇', 'と', 'いう', '存在', '無関心', 'だった', '自身', 'の', '健康', '明治', '天皇', 'は', '、', '自分', 'の', '健康に', 'まったく', '無関心でした', 'し', '、', '生涯', '大', 'の', '医者', '嫌いでした', '。', 'たとえば', '、', '一', '度', 'も', '歯', '医者', 'に', '歯', 'を', '診て', 'もらっ']",['無関心でした'],NO,無関心,NO,YES
388,無関心,に成功した瞬間である。だが、近隣の国々で起こっている宗教戦争に、エリザベスは無関心でいるわけにはいかなかった。フランスやネーデルランドでの戦いがカトリックの勝利に,"['に', '成功', 'した', '瞬間', 'である', '。', 'だが', '、', '近隣', 'の', '国々', 'で', '起こって', 'いる', '宗教', '戦争', 'に', '、', 'エリザベス', 'は', '無関心で', 'いる', 'わけに', 'は', 'いか', 'なかった', '。', 'フランス', 'や', 'ネーデルランド', 'で', 'の', '戦い', 'が', 'カトリック', 'の', '勝利', 'に']",['無関心で'],NO,無関心,NO,YES
389,無関心,にせっつかれたりする人もいたりする。もっとも、今の親は、大半は無関心を装う。下手に刺激して、逆切れされたらかなわんという思いがあるのだろう。子,"['に', 'せっつか', 'れたり', 'する', '人', 'も', 'いたり', 'する', '。', 'もっとも', '、', '今', 'の', '親', 'は', '、', '大半', 'は', '無関心', 'を', '装う', '。', '下手に', '刺激', 'して', '、', '逆', '切れ', 'さ', 'れたら', 'かなわ', 'ん', 'と', 'いう', '思い', 'が', 'ある', 'のだろう', '。', '子']",['無関心'],NO,無関心,NO,NO
390,無関心,ように思います。加えて先行きの不確かさを知りながら具体的に一歩踏み出す勇気への無関心、さらには実った成果を己だけに求め、周囲との共感が得られない,"['ように', '思い', 'ます', '。', '加えて', '先行き', 'の', '不確か', 'さ', 'を', '知り', 'ながら', '具体', '的に', '一', '歩', '踏み出す', '勇気', 'へ', 'の', '無関心', '、', 'さらに', 'は', '実った', '成果', 'を', '己', 'だけ', 'に', '求め', '、', '周囲', 'と', 'の', '共感', 'が', '得', 'られ', 'ない']",['無関心'],NO,無関心,NO,NO
391,無関心,は、連休の前の日だった。ハイカーが見ただろうが、よそものは、無関心だったのだろう。おれは幸雄君をのせてジープを運転し、連休の夕方でひっそりしている,"['は', '、', '連休', 'の', '前', 'の', '日', 'だった', '。', 'ハイカー', 'が', '見た', 'だろう', 'が', '、', 'よそもの', 'は', '、', '無関心だった', 'のだろう', '。', 'おれ', 'は', '幸雄', '君', 'を', 'のせて', 'ジープ', 'を', '運転', 'し', '、', '連休', 'の', '夕方', 'で', 'ひっそり', 'して', 'いる']",['無関心だった'],NO,無関心,NO,YES
392,無関心,れていた事実を率直に認めていた。そして、それがまわりの人への無関心や無理解につながっていたことに気づいたという。自分を見直すきっかけになっ,"['れて', 'いた', '事実', 'を', '率直に', '認めて', 'いた', '。', 'そして', '、', 'それ', 'が', 'まわり', 'の', '人', 'へ', 'の', '無関心', 'や', '無理解に', 'つながって', 'いた', 'こと', 'に', '気づいた', 'と', 'いう', '。', '自分', 'を', '見直す', 'きっかけ', 'に', 'なっ']",['無関心'],NO,無関心,NO,NO
393,無関心,の少年非行の深刻化の背景の一つとして，少年の規範意識の欠如や家庭，地域社会の無関心が指摘されている。警察では，少年の規範意識の形成や家庭，地域の,"['の', '少年', '非行', 'の', '深刻', '化', 'の', '背景', 'の', '一', 'つ', 'と', 'して', '，', '少年', 'の', '規範', '意識', 'の', '欠如', 'や', '家庭', '，', '地域', '社会', 'の', '無関心', 'が', '指摘', 'さ', 'れて', 'いる', '。', '警察', 'で', 'は', '，', '少年', 'の', '規範', '意識', 'の', '形成', 'や', '家庭', '，', '地域', 'の']",['無関心'],NO,無関心,NO,NO
394,無関心,でいる」というわけである。したがって男たちがもっとも恐れているのは、女たちが異性に無関心になることである。男たちは、女が男へのこまやかな気づかいをする気を,"['で', 'いる', '」', 'と', 'いう', 'わけである', '。', 'したがって', '男', 'たち', 'が', 'もっとも', '恐れて', 'いる', 'の', 'は', '、', '女', 'たち', 'が', '異性', 'に', '無関心に', 'なる', 'こと', 'である', '。', '男', 'たち', 'は', '、', '女', 'が', '男', 'へ', 'の', 'こまやかな', '気づか', 'い', 'を', 'する', '気', 'を']",['無関心に'],NO,無関心,NO,YES
395,無関心,授業の終わりの感想文に先生ありがとうって書いてしまったｗ周りの生徒はヅカに関しては無関心でした。。誰か食いついていないか回り確認したけど皆無でしたｗそれから、,"['授業', 'の', '終わり', 'の', '感想', '文', 'に', '先生', 'ありがとう', 'って', '書いて', 'しまった', 'ｗ', '周り', 'の', '生徒', 'は', 'ヅカ', 'に', '関して', 'は', '無関心でした', '。', '。', '誰', 'か', '食いついて', 'い', 'ない', 'か', '回り', '確認', 'した', 'けど', '皆無でした', 'ｗ', 'それ', 'から', '、']",['無関心でした'],NO,無関心,NO,YES
396,無関心,とらえていて論議の的になっていたが、私は一貫してそういうハヤリモノに無関心で、無理解だった。そもそも伝統的な体系的宗教にも興味がないのだ。十代の,"['とらえて', 'いて', '論議', 'の', '的に', 'なって', 'いた', 'が', '、', '私', 'は', '一貫', 'して', 'そういう', 'ハヤリモノ', 'に', '無関心で', '、', '無理解だった', '。', 'そもそも', '伝統', '的な', '体系', '的', '宗教', 'に', 'も', '興味', 'が', 'ない', 'のだ', '。', '十代', 'の']",['無関心で'],NO,無関心,NO,YES
397,無関心,これらを実現するためには、日本の無条件降伏後、米英が日本に対してとろうとしている措置に無関心であってはならない。とくに、ソビエトの極東地域に隣接していて現在日本の支配下にある地域（,"['これ', 'ら', 'を', '実現', 'する', 'ため', 'に', 'は', '、', '日本', 'の', '無', '条件', '降伏', '後', '、', '米', '英', 'が', '日本', 'に', '対して', 'とろう', 'と', 'して', 'いる', '措置', 'に', '無関心であって', 'は', 'なら', 'ない', '。', 'とくに', '、', 'ソビエト', 'の', '極東', '地域', 'に', '隣接', 'して', 'いて', '現在', '日本', 'の', '支配', '下', 'に', 'ある', '地域', '（']",['無関心であって'],NO,無関心,NO,YES
398,無関心,が目的ではない」との回答でした。でも、どうしても役員や熱心な人と、無関心な人との、負担の差は大きく、不平等感があります。現在、ＰＴＡ会費は,"['が', '目的', 'で', 'は', 'ない', '」', 'と', 'の', '回答', 'でした', '。', 'でも', '、', 'どうしても', '役員', 'や', '熱心な', '人', 'と', '、', '無関心な', '人', 'と', 'の', '、', '負担', 'の', '差', 'は', '大きく', '、', '不平等', '感', 'が', 'あり', 'ます', '。', '現在', '、', 'ＰＴＡ', '会費', 'は']",['無関心な'],NO,無関心,NO,YES
399,無関心,ていなかったそのときの気持ちを、推して測ったのだ。それまで何事にも無関心だったラリ・ネットの変化は、意外だった。サルヴァトーレは舵を握りながら、人,"['てい', 'なかった', 'その', 'とき', 'の', '気持ち', 'を', '、', '推して', '測った', 'のだ', '。', 'それ', 'まで', '何事', 'に', 'も', '無関心だった', 'ラリ', '・', 'ネット', 'の', '変化', 'は', '、', '意外だった', '。', 'サルヴァトーレ', 'は', '舵', 'を', '握り', 'ながら', '、', '人']",['無関心だった'],NO,無関心,NO,YES
400,無関心,包括する能力を持たない者（私）」への「無限（神）」の「無関心ではない―異なりでなくはない―異なりである（ｎｏｎ‐ｉｎ‐ｄｉｆｆｅｒｅｎｃｅ）」ことであったかのごとくに、神の,"['包括', 'する', '能力', 'を', '持た', 'ない', '者', '（', '私', '）', '」', 'へ', 'の', '「', '無限', '（', '神', '）', '」', 'の', '「', '無関心で', 'は', 'ない', '―', '異なり', 'で', 'なく', 'は', 'ない', '―', '異なり', 'である', '（', 'ｎｏｎ', '‐', 'ｉｎ', '‐', 'ｄｉｆｆｅｒｅｎｃｅ', '）', '」', 'こと', 'であった', 'か', 'の', 'ごと', 'く', 'に', '、', '神', 'の']",['無関心で'],NO,無関心,NO,YES
401,無関心,思慮にとんだ、戦国権謀の表裏を知り尽している家臣がいる。小田原方の諜報活動にまったく無関心だったわけではない。わけても長尾意玄などは、氏康の戦術に対して細心の注意を,"['思慮', 'に', 'とんだ', '、', '戦国', '権謀', 'の', '表裏', 'を', '知り', '尽して', 'いる', '家臣', 'が', 'いる', '。', '小田原', '方', 'の', '諜報', '活動', 'に', 'まったく', '無関心だった', 'わけで', 'は', 'ない', '。', 'わけても', '長尾', '意', '玄', 'など', 'は', '、', '氏', '康', 'の', '戦術', 'に', '対して', '細心の', '注意', 'を']",['無関心だった'],NO,無関心,NO,YES
402,無関心,から言えば、肩書きをもった医師二人と薬剤師ですね。倫理的責任の概念に相当無関心なサン・サルヴィ、残るはルイとわたしです」新たな吸い殻が、すり鉢のなかで,"['から', '言えば', '、', '肩書き', 'を', 'もった', '医師', '二', '人', 'と', '薬剤', '師', 'です', 'ね', '。', '倫理', '的', '責任', 'の', '概念', 'に', '相当', '無関心な', 'サン', '・', 'サルヴィ', '、', '残る', 'は', 'ルイ', 'と', 'わたし', 'です', '」', '新たな', '吸い殻', 'が', '、', 'すり鉢', 'の', 'なか', 'で']",['無関心な'],NO,無関心,NO,YES
403,無関心,上手にはこぶなら人はわかれはしないだろうから。それに、男からどれほど無関心な態度を示されても、やはり女は漠然とこう感じるのだ。これまで女,"['上手に', 'はこぶ', 'なら', '人', 'は', 'わかれ', 'は', 'し', 'ない', 'だろう', 'から', '。', 'それ', 'に', '、', '男', 'から', 'どれほど', '無関心な', '態度', 'を', '示さ', 'れて', 'も', '、', 'やはり', '女', 'は', '漠然と', 'こう', '感じる', 'のだ', '。', 'これ', 'まで', '女']",['無関心な'],NO,無関心,NO,YES
404,無関心,に社会的役割が明確でなく，経済的自立などのできない人達をさしている。スチューデントアパシー無気力，無関心で感動が少なく，はっきりした勉強の目的もない大学生をさしている。モラトリアム現象エリクソンが,"['に', '社会', '的', '役割', 'が', '明確で', 'なく', '，', '経済', '的', '自立', 'など', 'の', 'でき', 'ない', '人', '達', 'を', 'さして', 'いる', '。', 'スチューデントアパシー', '無気力', '，', '無関心で', '感動', 'が', '少なく', '，', 'はっきり', 'した', '勉強', 'の', '目的', 'も', 'ない', '大学生', 'を', 'さして', 'いる', '。', 'モラトリアム', '現象', 'エリクソン', 'が']",['無関心で'],NO,無関心,NO,YES
405,無関心,君臨していた。ナイアルは彼らに、砂漠でラクダグモに感じたのと同種の、無関心な友好的態度を感じた。後ろを一瞥さえしないでドギンズは、ホールを横切り,"['君臨', 'して', 'いた', '。', 'ナイアル', 'は', '彼', 'ら', 'に', '、', '砂漠', 'で', 'ラクダグモ', 'に', '感じた', 'の', 'と', '同種', 'の', '、', '無関心な', '友好', '的', '態度', 'を', '感じた', '。', '後ろ', 'を', '一', '瞥', 'さえ', 'し', 'ないで', 'ドギンズ', 'は', '、', 'ホール', 'を', '横切り']",['無関心な'],NO,無関心,NO,YES
406,無関心,納得していただける。それくらい悪玉コレステロールの悪名は高く、いまでは日ごろ健康のことに無関心の人でも、ほとんどの人が知っている。ところが、人間のからだというもの,"['納得', 'して', 'いただける', '。', 'それ', 'くらい', '悪玉', 'コレステロール', 'の', '悪', '名', 'は', '高く', '、', 'いまでは', '日ごろ', '健康', 'の', 'こと', 'に', '無関心', 'の', '人', 'でも', '、', 'ほとんど', 'の', '人', 'が', '知って', 'いる', '。', 'ところが', '、', '人間', 'の', 'からだ', 'と', 'いう', 'もの']",['無関心'],NO,無関心,NO,NO
407,無関心,と呼んでいるものを次々に回した。「無関心をよそおっても、本気で無関心になろうとしても、いずれにしても最初のショックは相当なものよね」,"['と', '呼んで', 'いる', 'もの', 'を', '次々', 'に', '回した', '。', '「', '無関心', 'を', 'よそおって', 'も', '、', '本気で', '無関心に', 'なろう', 'と', 'して', 'も', '、', 'いずれ', 'に', 'して', 'も', '最初の', 'ショック', 'は', '相当な', 'もの', 'よ', 'ね', '」']",['無関心'],NO,無関心,NO,NO
408,無関心,と呼んでいるものを次々に回した。「無関心をよそおっても、本気で無関心になろうとしても、いずれにしても最初のショックは相当なものよね」,"['と', '呼んで', 'いる', 'もの', 'を', '次々', 'に', '回した', '。', '「', '無関心', 'を', 'よそおって', 'も', '、', '本気で', '無関心に', 'なろう', 'と', 'して', 'も', '、', 'いずれ', 'に', 'して', 'も', '最初の', 'ショック', 'は', '相当な', 'もの', 'よ', 'ね', '」']",['無関心に'],NO,無関心,NO,YES
409,無関心,た。マネ以前の古典主義的絵画が依拠していた宗教的・神話的・歴史的コンテクストを離れて成立する絵画。主題への大いなる無関心。ここに、絵画が絵画として自律していく、いわゆる近代絵画が始まった。ところで、写真,"['た', '。', 'マネ', '以前', 'の', '古典', '主義', '的', '絵画', 'が', '依拠', 'して', 'いた', '宗教', '的', '・', '神話', '的', '・', '歴史', '的', 'コンテクスト', 'を', '離れて', '成立', 'する', '絵画', '。', '主題', 'へ', 'の', '大いなる', '無関心', '。', 'ここ', 'に', '、', '絵画', 'が', '絵画', 'と', 'して', '自律', 'して', 'いく', '、', 'いわゆる', '近代', '絵画', 'が', '始まった', '。', 'ところで', '、', '写真']",['無関心'],NO,無関心,NO,NO
410,無関心,ている仲間のことで、小型で美しい種類が多い。まったくの別種の魚に対しては無関心だが、同種や近似種に対しては縄張りをめぐって激しく争うので、小型水槽ではこの,"['て', 'いる', '仲間', 'の', 'こと', 'で', '、', '小型で', '美しい', '種類', 'が', '多い', '。', 'まったく', 'の', '別種', 'の', '魚', 'に', '対して', 'は', '無関心だ', 'が', '、', '同種', 'や', '近似', '種', 'に', '対して', 'は', '縄張り', 'を', 'めぐって', '激しく', '争う', 'ので', '、', '小型', '水槽', 'で', 'は', 'この']",['無関心だ'],NO,無関心,NO,YES
411,無関心,叔父をＡ級戦犯として処刑された小林は、隣国に発生した戦争の行方に決して無関心になれない。単に地理的に近いというだけではなく、近親者を戦争の人柱に,"['叔父', 'を', 'Ａ', '級', '戦犯', 'と', 'して', '処刑', 'さ', 'れた', '小林', 'は', '、', '隣国', 'に', '発生', 'した', '戦争', 'の', '行方', 'に', '決して', '無関心に', 'なれ', 'ない', '。', '単に', '地理', '的に', '近い', 'と', 'いう', 'だけ', 'で', 'は', 'なく', '、', '近親', '者', 'を', '戦争', 'の', '人', '柱', 'に']",['無関心に'],NO,無関心,NO,YES
412,無関心,られますことね！」リジヤ・イワーノヴナが言った。「わたしはこういう問題に関して、無関心というわけじゃなく、目下待機中なんですよ」相手の心をやわらげるような例の微笑,"['られ', 'ます', 'こと', 'ね', '！', '」', 'リジヤ', '・', 'イワーノヴナ', 'が', '言った', '。', '「', 'わたし', 'は', 'こういう', '問題', 'に', '関して', '、', '無関心', 'と', 'いう', 'わけじゃ', 'なく', '、', '目下', '待機', '中', 'な', 'んです', 'よ', '」', '相手', 'の', '心', 'を', 'やわらげる', 'ような', '例の', '微笑']",['無関心'],NO,無関心,NO,NO
413,無関心,涼しい。“観光”を法で律し、規則と礼儀に満ちあふれ、人びとは旅行者に無関心で、それゆえの安心感と心地よさもあった。それに比して、ローマは暑く、,"['涼しい', '。', '“', '観光', '”', 'を', '法', 'で', '律し', '、', '規則', 'と', '礼儀', 'に', '満ち', 'あふれ', '、', '人びと', 'は', '旅行', '者', 'に', '無関心で', '、', 'それ', 'ゆえ', 'の', '安心', '感', 'と', '心地よ', 'さ', 'も', 'あった', '。', 'それ', 'に', '比して', '、', 'ローマ', 'は', '暑く', '、']",['無関心で'],NO,無関心,NO,YES
414,無関心,こうしていつになくだんまりを決めこまれたために、私も気分を害し、いきおい無関心を装うことになってしまった。そしてこのときから私のほうも、日本についても、弁天,"['こうして', 'いつ', 'に', 'なく', 'だんまり', 'を', '決め', 'こま', 'れた', 'ため', 'に', '、', '私', 'も', '気分', 'を', '害し', '、', 'いきおい', '無関心', 'を', '装う', 'こと', 'に', 'なって', 'しまった', '。', 'そして', 'この', 'とき', 'から', '私', 'の', 'ほう', 'も', '、', '日本', 'に', 'ついて', 'も', '、', '弁天']",['無関心'],NO,無関心,NO,NO
415,無関心,シェバが出てくる部分を引用し、問いかけた。「シェバが与えてくれたインスピレーションにどうして無関心でいられようか。アラビアの地に足を踏みいれた、まさにその日から、私,"['シェバ', 'が', '出て', 'くる', '部分', 'を', '引用', 'し', '、', '問い', 'かけた', '。', '「', 'シェバ', 'が', '与えて', 'くれた', 'インスピレーション', 'に', 'どうして', '無関心で', 'い', 'られよう', 'か', '。', 'アラビア', 'の', '地', 'に', '足', 'を', '踏みいれた', '、', 'まさに', 'その', '日', 'から', '、', '私']",['無関心で'],NO,無関心,NO,YES
416,無関心,可能性も、少なくない。私は、自分の身を守るということについて、ほとんど無関心と言ってよかった。だからいつも、ひとりで動いていると、平然として言う。,"['可能', '性', 'も', '、', '少なく', 'ない', '。', '私', 'は', '、', '自分', 'の', '身', 'を', '守る', 'と', 'いう', 'こと', 'に', 'ついて', '、', 'ほとんど', '無関心', 'と', '言って', 'よかった', '。', 'だから', 'いつも', '、', 'ひと', 'り', 'で', '動いて', 'いる', 'と', '、', '平然と', 'して', '言う', '。']",['無関心'],NO,無関心,NO,NO
417,無関心,ば懐が狭い春彦は、自分が興味を示せないモノに対しては残酷なまでに無関心だった。「だからって、やっていいことと悪いことがあんだろ！？,"['ば', '懐', 'が', '狭い', '春彦', 'は', '、', '自分', 'が', '興味', 'を', '示せ', 'ない', 'モノ', 'に', '対して', 'は', '残酷な', 'まで', 'に', '無関心だった', '。', '「', 'だ', 'から', 'って', '、', 'やって', 'いい', 'こと', 'と', '悪い', 'こと', 'が', 'あんだ', 'ろ', '！', '？']",['無関心だった'],NO,無関心,NO,YES
418,無関心,、深い帳に包まれた、恍惚とした夜のことである。不思議さには無関心、悲しみには心が澄みわたり、愛はおぼろに感じる、そんな夜のことだ。,"['、', '深い', '帳', 'に', '包ま', 'れた', '、', '恍惚', 'と', 'した', '夜', 'の', 'こと', 'である', '。', '不思議', 'さ', 'に', 'は', '無関心', '、', '悲しみ', 'に', 'は', '心', 'が', '澄み', 'わたり', '、', '愛', 'は', 'おぼろに', '感じる', '、', 'そんな', '夜', 'の', 'こと', 'だ', '。']",['無関心'],NO,無関心,NO,NO
419,無関心,です。仔犬は本来、目を輝かせ好奇心旺盛・天真爛漫で元気すぎる程です！落ち着きがない・無関心、無反応・それは仔犬の本質ではありません。犬達は犬幼稚園Ｂｕｄｄｙ,"['です', '。', '仔犬', 'は', '本来', '、', '目', 'を', '輝か', 'せ', '好奇心', '旺盛', '・', '天真爛漫で', '元気', 'すぎる', '程', 'です', '！', '落ち着き', 'が', 'ない', '・', '無関心', '、', '無', '反応', '・', 'それ', 'は', '仔犬', 'の', '本質', 'で', 'は', 'あり', 'ませ', 'ん', '。', '犬', '達', 'は', '犬', '幼稚園', 'Ｂｕｄｄｙ']",['無関心'],NO,無関心,NO,NO
420,無関心,と結びつけて道徳を論じたことが弾圧に際しても問題にされた。宗教に無関心であったとされるデュクロだが、さすがにこうした挑発的な態度は避けている,"['と', '結び', 'つけて', '道徳', 'を', '論じた', 'こと', 'が', '弾圧', 'に', '際して', 'も', '問題', 'に', 'さ', 'れた', '。', '宗教', 'に', '無関心であった', 'と', 'さ', 'れる', 'デュクロ', 'だ', 'が', '、', 'さすが', 'に', 'こうした', '挑発', '的な', '態度', 'は', '避けて', 'いる']",['無関心であった'],NO,無関心,NO,YES
421,無関心,ているものの、全体から見れば少数派である。一方、男性にもプロ野球には、まったく無関心な人もかなりいる。こうして計算してみると、ぼくたちは狭い交友範囲の中で,"['て', 'いる', 'もの', 'の', '、', '全体', 'から', '見れば', '少数', '派', 'である', '。', '一方', '、', '男性', 'に', 'も', 'プロ', '野球', 'に', 'は', '、', 'まったく', '無関心な', '人', 'も', 'かなり', 'いる', '。', 'こうして', '計算', 'して', 'みる', 'と', '、', 'ぼく', 'たち', 'は', '狭い', '交友', '範囲', 'の', '中', 'で']",['無関心な'],NO,無関心,NO,YES
422,無関心,ヨン様だのチェ・ジウ姫だのキャーキャー騒いでるオバちゃん達は、イ・スンヨプには何故無関心なのでしょう？イスンヨの嫁さんに激しく萌え〜チェジウより美人だと思います。,"['ヨン', '様', 'だの', 'チェ・ジウ', '姫', 'だの', 'キャーキャー', '騒いで', 'る', 'オバちゃん', '達', 'は', '、', 'イ', '・', 'スンヨプ', 'に', 'は', '何故', '無関心な', 'のでしょう', '？', 'イスンヨ', 'の', '嫁', 'さん', 'に', '激しく', '萌え', '〜', 'チェジウ', 'より', '美人', 'だ', 'と', '思い', 'ます', '。']",['無関心な'],NO,無関心,NO,YES
423,無関心,知らないアルベルト・モラビアの書いた『無関心な人々・・・』もう一度読んでみたくなっ,"['知ら', 'ない', 'アルベルト', '・', 'モラビア', 'の', '書いた', '『', '無関心な', '人々', '・', '・', '・', '』', 'も', 'う', '一', '度', '読んで', 'み', 'たく', 'なっ']",['無関心な'],NO,無関心,NO,YES
