238,無駄,ことへの不安要因がなくなりますように」「何をするにも計画を立て、無駄のない行動を心がけられるわたしになりたい」「人生を前向きに整理するために必要な,"['こと', 'へ', 'の', '不安', '要因', 'が', 'なくなり', 'ます', 'ように', '」', '「', '何', 'を', 'する', 'に', 'も', '計画', 'を', '立て', '、', '無駄', 'の', 'ない', '行動', 'を', '心がけ', 'られる', 'わたし', 'に', 'なり', 'たい', '」', '「', '人生', 'を', '前向きに', '整理', 'する', 'ため', 'に', '必要な']",['無駄'],NO,無駄,NO,NO
239,無駄,なった。もともと、キャリーはラング同様、ブロンド美人が好みだし、見込みのない相手と無駄な時間を過ごすことを好む男ではないからだ。「君の役目は、例,"['なった', '。', 'もともと', '、', 'キャリー', 'は', 'ラング', '同様', '、', 'ブロンド', '美人', 'が', '好み', 'だ', 'し', '、', '見込み', 'の', 'ない', '相手', 'と', '無駄な', '時間', 'を', '過ごす', 'こと', 'を', '好む', '男', 'で', 'は', 'ない', 'から', 'だ', '。', '「', '君', 'の', '役目', 'は', '、', '例']",['無駄な'],NO,無駄,NO,YES
240,無駄,、その補完し合ってきた歴史が人類史を形づくっている、という摂理である。それぞれの文明が無駄に同じものをつくるようなことはしない、ともいえる。最近では,"['、', 'その', '補完', 'し', '合って', 'きた', '歴史', 'が', '人類', '史', 'を', '形づくって', 'いる', '、', 'と', 'いう', '摂理', 'である', '。', 'それぞれ', 'の', '文明', 'が', '無駄に', '同じ', 'もの', 'を', 'つくる', 'ような', 'こと', 'は', 'し', 'ない', '、', 'と', 'も', 'いえる', '。', '最近', 'で', 'は']",['無駄に'],NO,無駄,NO,YES
241,無駄,を必要とするので、ちょっと気が向かない。数年ぶりだけれど、ごろごろして、無駄に過ごす休日を満喫したい。,"['を', '必要', 'と', 'する', 'ので', '、', 'ちょっと', '気', 'が', '向か', 'ない', '。', '数', '年', 'ぶり', 'だ', 'けれど', '、', 'ごろごろ', 'して', '、', '無駄に', '過ごす', '休日', 'を', '満喫', 'し', 'たい', '。']",['無駄に'],NO,無駄,NO,YES
242,無駄,の良いところを教えて下さい。自分に必要な機能のみ組み込む事ができ、経費節約。無駄なソフトが入ってないのでシンプルでよい。ほとんどフリーソフトで事足りる。パソコンのハードに,"['の', '良い', 'ところ', 'を', '教えて', '下さい', '。', '自分', 'に', '必要な', '機能', 'のみ', '組み', '込む', '事', 'が', 'でき', '、', '経費', '節約', '。', '無駄な', 'ソフト', 'が', '入って', 'ない', 'ので', 'シンプルで', 'よい', '。', 'ほとんど', 'フリーソフト', 'で', '事', '足りる', '。', 'パソコン', 'の', 'ハードに']",['無駄な'],NO,無駄,NO,YES
243,無駄,にした女が現われた。「よかろう、せっかく志乃が淹れたコーヒーだ。無駄にしても勿体ない」女は無言でカップを並べるとひき退った。私はコーヒーを,"['に', 'した', '女', 'が', '現われた', '。', '「', 'よかろう', '、', 'せっかく', '志乃', 'が', '淹れた', 'コーヒー', 'だ', '。', '無駄に', 'して', 'も', '勿体', 'ない', '」', '女', 'は', '無言', 'で', 'カップ', 'を', '並べる', 'と', 'ひき', '退', 'った', '。', '私', 'は', 'コーヒー', 'を']",['無駄に'],NO,無駄,NO,YES
244,無駄,たんじゃないか。わたしはそう思うんだが…」宮之原はそういい、「無駄かもしれないが、赤坂ユープラザをあたってみよう。そのうえで、三友銀行の浜崎常務の話を聞く。,"['たん', 'じゃ', 'ない', 'か', '。', 'わたし', 'は', 'そう', '思う', 'んだ', 'が', '…', '」', '宮', '之原', 'は', 'そう', 'いい', '、', '「', '無駄', 'かも', 'しれ', 'ない', 'が', '、', '赤坂', 'ユープラザ', 'を', 'あたって', 'みよう', '。', 'その', 'うえ', 'で', '、', '三', '友', '銀行', 'の', '浜崎', '常務', 'の', '話', 'を', '聞く', '。']",['無駄'],NO,無駄,NO,NO
245,無駄,も周囲を見渡せば壮大な印象を得ることができます。私は彼のこの見解を無駄な空想遊びと見なしていましたが、このような空想の検証にいつも付き合わされ,"['も', '周囲', 'を', '見渡せば', '壮大な', '印象', 'を', '得る', 'こと', 'が', 'でき', 'ます', '。', '私', 'は', '彼', 'の', 'この', '見解', 'を', '無駄な', '空想', '遊び', 'と', '見なして', 'い', 'ました', 'が', '、', 'このような', '空想', 'の', '検証', 'に', 'いつも', '付き', '合わされ']",['無駄な'],NO,無駄,NO,YES
246,無駄,は、ＩＰ電話を使っているなら料金の話などしても入ってもらえないから時間の無駄だと思って引き下がったのでしょう。ちなみに電話会社の社員を名乗っていてもほとんど代理店,"['は', '、', 'ＩＰ', '電話', 'を', '使って', 'いる', 'なら', '料金', 'の', '話', 'など', 'して', 'も', '入って', 'もらえ', 'ない', 'から', '時間', 'の', '無駄だ', 'と', '思って', '引き下がった', 'のでしょう', '。', 'ちなみに', '電話', '会社', 'の', '社員', 'を', '名乗って', 'いて', 'も', 'ほとんど', '代理', '店']",['無駄だ'],NO,無駄,NO,YES
247,無駄,何を期待されているのか。まずそれを、きちんと把握しておかないと、努力が無駄になってしまうのです。私が、生まれて初めて作詞に取り組んだとき、真っ先に,"['何', 'を', '期待', 'さ', 'れて', 'いる', 'の', 'か', '。', 'まず', 'それ', 'を', '、', 'きちんと', '把握', 'して', 'おか', 'ない', 'と', '、', '努力', 'が', '無駄に', 'なって', 'しまう', 'のです', '。', '私', 'が', '、', '生まれて', '初めて', '作詞', 'に', '取り組んだ', 'とき', '、', '真っ先', 'に']",['無駄に'],NO,無駄,NO,YES
248,無駄,ヒットする可能性は万にひとつであろう。私は、朝からやって来たことが無駄に終わった脱力感に身を委ね、冷えてきた床に寝っ転がった。頭を載せ,"['ヒット', 'する', '可能', '性', 'は', '万', 'に', 'ひと', 'つ', 'であろう', '。', '私', 'は', '、', '朝', 'から', 'やって', '来た', 'こと', 'が', '無駄に', '終わった', '脱力', '感', 'に', '身', 'を', '委ね', '、', '冷えて', 'きた', '床', 'に', '寝', 'っ', '転がった', '。', '頭', 'を', '載せ']",['無駄に'],NO,無駄,NO,YES
249,無駄,だったかな？余ってましたけど、この前ピッタリになりましたよ。無駄にしちゃってね。,"['だった', 'かな', '？', '余って', 'ました', 'けど', '、', 'この', '前', 'ピッタリ', 'に', 'なり', 'ました', 'よ', '。', '無駄に', 'しちゃ', 'って', 'ね', '。']",['無駄に'],NO,無駄,NO,YES
250,無駄,思いやりのおもない夫にこれ以上夫に何を言っても無駄だから取り合えず「ごめん」って謝ったら逆切れした自分を棚に挙げ,"['思いやり', 'の', 'おも', 'ない', '夫', 'に', 'これ', '以上', '夫', 'に', '何', 'を', '言って', 'も', '無駄だ', 'から', '取り', '合え', 'ず', '「', 'ごめん', '」', 'って', '謝ったら', '逆', '切れ', 'した', '自分', 'を', '棚', 'に', '挙げ']",['無駄だ'],NO,無駄,NO,YES
251,無駄,教えてくれただけだった。花粉症を治す目的なら、バーベインを何本飲もうが金の無駄である。バッチのエマージェンシー（レスキュー）は、例えば、歯医者で自分の順番を待っ,"['教えて', 'くれた', 'だけ', 'だった', '。', '花粉', '症', 'を', '治す', '目的', 'なら', '、', 'バーベイン', 'を', '何', '本', '飲もう', 'が', '金', 'の', '無駄である', '。', 'バッチ', 'の', 'エマージェンシー', '（', 'レスキュー', '）', 'は', '、', '例えば', '、', '歯', '医者', 'で', '自分', 'の', '順番', 'を', '待っ']",['無駄である'],NO,無駄,NO,YES
252,無駄,の何物であるだろうか！全く感心して仕舞いそうに成るよ、こんなに詰まら無い、無駄に良く出来た話も在るまいに！本に見事な、お笑い種だ、まるで,"['の', '何物', 'である', 'だろう', 'か', '！', '全く', '感心', 'して', '仕舞い', 'そうに', '成る', 'よ', '、', 'こんなに', '詰まら', '無い', '、', '無駄に', '良く', '出来た', '話', 'も', '在る', 'まい', 'に', '！', '本', 'に', '見事な', '、', 'お', '笑い種', 'だ', '、', 'まるで']",['無駄に'],NO,無駄,NO,YES
253,無駄,リアリーとメガンのふたりに攻撃をやめさせられるんじゃないか？」「頼んでも無駄だとわかっていたから…」バクスターはうなずいた。「なるほど…。さて、,"['リアリー', 'と', 'メガン', 'の', 'ふた', 'り', 'に', '攻撃', 'を', 'やめ', 'させ', 'られる', 'んじゃ', 'ない', 'か', '？', '」', '「', '頼んで', 'も', '無駄だ', 'と', 'わかって', 'いた', 'から', '…', '」', 'バクスター', 'は', 'うなずいた', '。', '「', 'なるほど', '…', '。', 'さて', '、']",['無駄だ'],NO,無駄,NO,YES
254,無駄,簡保。だがその実態は、私たち庶民がコツコツと貯めてきた財産なのだ。それが無駄に使われることがあってはならないし、国民不在のまま、政争の道具として郵政民営化が図ら,"['簡保', '。', 'だが', 'その', '実態', 'は', '、', '私', 'たち', '庶民', 'が', 'コツコツ', 'と', '貯めて', 'きた', '財産', 'な', 'のだ', '。', 'それ', 'が', '無駄に', '使わ', 'れる', 'こと', 'が', 'あって', 'は', 'なら', 'ない', 'し', '、', '国民', '不在', 'の', 'まま', '、', '政争', 'の', '道具', 'と', 'して', '郵政', '民営', '化', 'が', '図ら']",['無駄に'],NO,無駄,NO,YES
255,無駄,は腕を激しく振って、虫を追い払おうとした。だがそれも、しょせんは無駄なあがきだった。彼は闇雲に走りながら、ジープから遠去かっていった―緑色,"['は', '腕', 'を', '激しく', '振って', '、', '虫', 'を', '追い払おう', 'と', 'した', '。', 'だが', 'それ', 'も', '、', 'しょせん', 'は', '無駄な', 'あがき', 'だった', '。', '彼', 'は', '闇', '雲', 'に', '走り', 'ながら', '、', 'ジープ', 'から', '遠', '去', 'かって', 'いった', '―', '緑色']",['無駄な'],NO,無駄,NO,YES
256,無駄,無駄な死に方のことを”犬死に”っていうのはどうしてですか？畜生同然の無駄死にだ,"['無駄な', '死に', '方', 'の', 'こと', 'を', '”', '犬死に', '”', 'って', 'いう', 'の', 'は', 'どうして', 'です', 'か', '？', '畜生', '同然の', '無駄', '死に', 'だ']",['無駄な'],NO,無駄,NO,YES
257,無駄,無駄な死に方のことを”犬死に”っていうのはどうしてですか？畜生同然の無駄死にだ,"['無駄な', '死に', '方', 'の', 'こと', 'を', '”', '犬死に', '”', 'って', 'いう', 'の', 'は', 'どうして', 'です', 'か', '？', '畜生', '同然の', '無駄', '死に', 'だ']",['無駄'],NO,無駄,NO,NO
258,無駄,はうれしくないのです。このように、神のため、人のために、時間の無駄をすること（ｗａｓｔｅｔｉｍｅ）が必要なのだと話されました。バニエ氏,"['は', 'うれしく', 'ない', 'のです', '。', 'このように', '、', '神', 'の', 'ため', '、', '人', 'の', 'ため', 'に', '、', '時間', 'の', '無駄', 'を', 'する', 'こと', '（', 'ｗａｓｔｅｔｉｍｅ', '）', 'が', '必要な', 'のだ', 'と', '話さ', 'れ', 'ました', '。', 'バニエ', '氏']",['無駄'],NO,無駄,NO,NO
259,無駄,に夫のシャツを浸けた。トニーはずっと前に、シャツをクリーニングに出すなんて無駄な贅沢だと決めつけ、家で洗ってアイロンをかけろと言いだしたのだった。クリス,"['に', '夫', 'の', 'シャツ', 'を', '浸けた', '。', 'トニー', 'は', 'ずっと', '前', 'に', '、', 'シャツ', 'を', 'クリーニング', 'に', '出す', 'なんて', '無駄な', '贅沢だ', 'と', '決めつけ', '、', '家', 'で', '洗って', 'アイロン', 'を', 'かけろ', 'と', '言い', 'だした', 'のだった', '。', 'クリス']",['無駄な'],NO,無駄,NO,YES
260,無駄,。私たちは、再び空の大惨事がくり返されないように祈り、五百二十人の命を無駄にしないでと訴え続けてきました。事故の教訓を空の安全確保のために,"['。', '私', 'たち', 'は', '、', '再び', '空', 'の', '大', '惨事', 'が', 'くり返さ', 'れ', 'ない', 'ように', '祈り', '、', '五百二十', '人', 'の', '命', 'を', '無駄に', 'し', 'ないで', 'と', '訴え', '続けて', 'き', 'ました', '。', '事故', 'の', '教訓', 'を', '空', 'の', '安全', '確保', 'の', 'ため', 'に']",['無駄に'],NO,無駄,NO,YES
261,無駄,ですよ。薬の飲み方や病院に行く日など間違えるとせっかくの不妊治療なのに無駄になってしまいますので。お互い頑張りましょう♪,"['です', 'よ', '。', '薬', 'の', '飲み', '方', 'や', '病院', 'に', '行く', '日', 'など', '間違える', 'と', 'せっかく', 'の', '不妊', '治療', 'な', 'のに', '無駄に', 'なって', 'しまい', 'ます', 'ので', '。', 'お互い', '頑張り', 'ましょう', '♪']",['無駄に'],NO,無駄,NO,YES
262,無駄,。ここではリアの端子にＰＵのホット線をハンダ付け。十八ＰＵ配線完了リード線の引き回しも無駄がなく、きれいに仕上がった。十九ボディ側との結線・１〜ジャックのグランド最初,"['。', 'ここ', 'で', 'は', 'リア', 'の', '端子', 'に', 'ＰＵ', 'の', 'ホット', '線', 'を', 'ハンダ', '付け', '。', '十八', 'ＰＵ', '配線', '完了', 'リード', '線', 'の', '引き', '回し', 'も', '無駄', 'が', 'なく', '、', 'きれいに', '仕上がった', '。', '十九', 'ボディ', '側', 'と', 'の', '結', '線', '・', '１', '〜', 'ジャック', 'の', 'グランド', '最初']",['無駄'],NO,無駄,NO,NO
263,無駄,用事が終わって帰って来ました。（無駄に終わったけど）今、お昼ご飯を食べています。久しぶりに鴨汁うどんです。,"['用事', 'が', '終わって', '帰って', '来', 'ました', '。', '（', '無駄に', '終わった', 'けど', '）', '今', '、', 'お', '昼', 'ご飯', 'を', '食べて', 'い', 'ます', '。', '久しぶりに', '鴨', '汁', 'うどん', 'です', '。']",['無駄に'],NO,無駄,NO,YES
264,無駄,で、態勢づくりに力をいれてた。俺は結局副番ってことでさ。無駄じゃなかったんだよね、これが。青函連絡船の上でさっそく事件勃発。どっかの,"['で', '、', '態勢', 'づくり', 'に', '力', 'を', 'いれて', 'た', '。', '俺', 'は', '結局', '副', '番', 'って', 'こと', 'で', 'さ', '。', '無駄じゃ', 'なかった', 'んだ', 'よ', 'ね', '、', 'これ', 'が', '。', '青', '函', '連絡', '船', 'の', '上', 'で', 'さっそく', '事件', '勃発', '。', 'どっか', 'の']",['無駄じゃ'],NO,無駄,NO,YES
265,無駄,東海道新幹線はなぜ塗装するのですか？塗装の分、重たくなってスピードと時間や電力の無駄ではないのでしょうか？飛行機とかの各航空会社の識別ぐらいハッキリした目的があれば別です,"['東海道', '新幹線', 'は', 'なぜ', '塗装', 'する', 'のです', 'か', '？', '塗装', 'の', '分', '、', '重たく', 'なって', 'スピード', 'と', '時間', 'や', '電力', 'の', '無駄で', 'は', 'ない', 'のでしょう', 'か', '？', '飛行機', 'と', 'か', 'の', '各', '航空', '会社', 'の', '識別', 'ぐらい', 'ハッキリ', 'した', '目的', 'が', 'あれば', '別です']",['無駄で'],NO,無駄,NO,YES
266,無駄,では、あやなちゃん、ほのかちゃん、りこちゃんがお姉さんクラスになるための練習をしています。無駄なおしゃべりもせず、しっかり背中や首、つま先を伸ばそうという努力を感じます。,"['では', '、', 'あや', 'な', 'ちゃん', '、', 'ほのか', 'ちゃん', '、', 'りこ', 'ちゃん', 'が', 'お', '姉さん', 'クラス', 'に', 'なる', 'ため', 'の', '練習', 'を', 'して', 'い', 'ます', '。', '無駄な', 'おしゃべり', 'も', 'せ', 'ず', '、', 'しっかり', '背中', 'や', '首', '、', 'つま先', 'を', '伸ばそう', 'と', 'いう', '努力', 'を', '感じ', 'ます', '。']",['無駄な'],NO,無駄,NO,YES
267,無駄,。経験が浅い数学の学生は、一個の一般的な結論に至るまでに、専門家であれば無駄だと見なす幾何学的実験を頭のなかで何回となく繰り返す。たとえば、空間中に固定され,"['。', '経験', 'が', '浅い', '数学', 'の', '学生', 'は', '、', '一', '個', 'の', '一般', '的な', '結論', 'に', '至る', 'まで', 'に', '、', '専門', '家', 'であれば', '無駄だ', 'と', '見なす', '幾何', '学', '的', '実験', 'を', '頭', 'の', 'なか', 'で', '何', '回', 'と', 'なく', '繰り返す', '。', 'たとえば', '、', '空間', '中', 'に', '固定', 'さ', 'れ']",['無駄だ'],NO,無駄,NO,YES
268,無駄,見たかったわけではないが、投地の体勢のまま死の予行演習をして一日を無駄にするのももったいなかったので体を動かすことにした。「とりあえず神社に行きましょう,"['見', 'たかった', 'わけで', 'は', 'ない', 'が', '、', '投', '地', 'の', '体勢', 'の', 'まま', '死', 'の', '予行', '演習', 'を', 'して', '一', '日', 'を', '無駄に', 'する', 'の', 'も', 'もったいなかった', 'ので', '体', 'を', '動かす', 'こと', 'に', 'した', '。', '「', 'とりあえず', '神社', 'に', '行き', 'ましょう']",['無駄に'],NO,無駄,NO,YES
269,無駄,れ、カークは不機嫌な顔でティベリウスを見た。ティベリウスは“言っても無駄か”とばかりに肩をすくめ、森の中に入っていった。ティベリウスの,"['れ', '、', 'カーク', 'は', '不機嫌な', '顔', 'で', 'ティベリウス', 'を', '見た', '。', 'ティベリウス', 'は', '“', '言って', 'も', '無駄', 'か', '”', 'と', 'ばかり', 'に', '肩', 'を', 'すくめ', '、', '森', 'の', '中', 'に', '入って', 'いった', '。', 'ティベリウス', 'の']",['無駄'],NO,無駄,NO,NO
270,無駄,来ることを、神から夢によって示されたヨセフは「『お米を一粒だって無駄にしてはならない』と言った」と書いてある。ところで、私の家は六畳,"['来る', 'こと', 'を', '、', '神', 'から', '夢', 'に', 'よって', '示さ', 'れた', 'ヨセフ', 'は', '「', '『', 'お', '米', 'を', '一', '粒', 'だって', '無駄に', 'して', 'は', 'なら', 'ない', '』', 'と', '言った', '」', 'と', '書いて', 'ある', '。', 'ところで', '、', '私', 'の', '家', 'は', '六', '畳']",['無駄に'],NO,無駄,NO,YES
271,無駄,、きっと騒ぎ立てます。そうなったら、蟠竜公はお退きになり、白十組の苦心の駆け引きも無駄になってしまうのではないですか」新吾の推察からすれば、そういうことになろう。「そう,"['、', 'きっと', '騒ぎ', '立て', 'ます', '。', 'そう', 'なったら', '、', '蟠竜', '公', 'は', 'お', '退き', 'に', 'なり', '、', '白', '十', '組', 'の', '苦心', 'の', '駆け引き', 'も', '無駄に', 'なって', 'しまう', 'ので', 'は', 'ない', 'です', 'か', '」', '新吾', 'の', '推察', 'から', 'すれば', '、', 'そういう', 'こと', 'に', 'なろう', '。', '「', 'そう']",['無駄に'],NO,無駄,NO,YES
272,無駄,。次のことが考えられますが、いずれにしても水道局に相談してください。１無駄に使用している２漏水（トイレが多い）している３他人の,"['。', '次の', 'こと', 'が', '考え', 'られ', 'ます', 'が', '、', 'いずれ', 'に', 'して', 'も', '水道', '局', 'に', '相談', 'して', 'ください', '。', '１', '無駄に', '使用', 'して', 'いる', '２', '漏水', '（', 'トイレ', 'が', '多い', '）', 'して', 'いる', '３', '他人', 'の']",['無駄に'],NO,無駄,NO,YES
273,無駄,たら、ちっとも早く走れないだけじゃなく、お年よりは倒れてしまうでしょう。新しい電池は無駄に疲れて電池切れしてしまい、古い電池は無理に電気を流されて、場合によっては,"['たら', '、', 'ちっとも', '早く', '走れ', 'ない', 'だけ', 'じゃ', 'なく', '、', 'お', '年より', 'は', '倒れて', 'しまう', 'でしょう', '。', '新しい', '電池', 'は', '無駄に', '疲れて', '電池', '切れ', 'して', 'しまい', '、', '古い', '電池', 'は', '無理に', '電気', 'を', '流さ', 'れて', '、', '場合', 'に', 'よって', 'は']",['無駄に'],NO,無駄,NO,YES
274,無駄,飼っています。トイレや待て、お座りなどいうことは聞いてくれますが家族相手でも無駄吠えをしてしまいます上手く直す方法があれば教えてくださいよろしくお願いいたします。いつから吠える,"['飼って', 'い', 'ます', '。', 'トイレ', 'や', '待て', '、', 'お', '座り', 'など', 'いう', 'こと', 'は', '聞いて', 'くれ', 'ます', 'が', '家族', '相手', 'でも', '無駄', '吠え', 'を', 'して', 'しまい', 'ます', '上手く', '直す', '方法', 'が', 'あれば', '教えて', 'ください', 'よろしく', 'お', '願い', 'いたし', 'ます', '。', 'いつ', 'から', '吠える']",['無駄'],NO,無駄,NO,NO
275,無駄,その友人が言ってたんですが、万一試験前に利き腕を骨折でもしたら１年が無駄になるので、利き腕以外の準備が必要とも言ってました。一度試してご自身,"['その', '友人', 'が', '言って', 'た', 'んです', 'が', '、', '万一', '試験', '前', 'に', '利き腕', 'を', '骨折', 'でも', 'したら', '１', '年', 'が', '無駄に', 'なる', 'ので', '、', '利き腕', '以外', 'の', '準備', 'が', '必要', 'と', 'も', '言って', 'ました', '。', '一', '度', '試して', 'ご', '自身']",['無駄に'],NO,無駄,NO,YES
276,無駄,。次の第三章では、「心の体力」を回復した人が無理なく無駄なく試行錯誤して、自分の生き方をどう探っていったらよいかのプログラムを示しています。,"['。', '次の', '第', '三', '章', 'で', 'は', '、', '「', '心', 'の', '体力', '」', 'を', '回復', 'した', '人', 'が', '無理', 'なく', '無駄な', 'く', '試行', '錯誤', 'して', '、', '自分', 'の', '生き', '方', 'を', 'どう', '探って', 'いったら', 'よい', 'か', 'の', 'プログラム', 'を', '示して', 'い', 'ます', '。']",['無駄な'],NO,無駄,NO,YES
277,無駄,（・＿ノ【ファイファン十】ささっと今日は超大作ＣＧを駆使しているくそぶろぐなので無駄に時間がかかっていたのですが、放置しつつも必死にぶろぐを書いていたらその,"['（', '・', '＿', 'ノ', '【', 'ファイファン', '十', '】', 'さ', 'さっと', '今日', 'は', '超', '大作', 'ＣＧ', 'を', '駆使', 'して', 'いる', 'くそ', 'ぶろぐ', 'な', 'ので', '無駄に', '時間', 'が', 'かかって', 'いた', 'のです', 'が', '、', '放置', 'し', 'つつ', 'も', '必死に', 'ぶろぐ', 'を', '書いて', 'いたら', 'その']",['無駄に'],NO,無駄,NO,YES
278,無駄,が、事実が立遠の言うがごときものであれば、役人に規律を説いても無駄という気がいたすの」「立遠が記していることは事実でござります」と,"['が', '、', '事実', 'が', '立', '遠の', '言う', 'が', 'ごとき', 'もの', 'であれば', '、', '役人', 'に', '規律', 'を', '説いて', 'も', '無駄', 'と', 'いう', '気', 'が', 'いたす', 'の', '」', '「', '立', '遠', 'が', '記して', 'いる', 'こと', 'は', '事実', 'で', 'ござり', 'ます', '」', 'と']",['無駄'],NO,無駄,NO,NO
