398,無駄,に役に立たなければいけないのですか。芸術の役に立たないものはすべて無駄なんですか。」「無駄とは言っていません。ただ価値が低いと言っ,"['に', '役', 'に', '立た', 'なければ', 'いけない', 'のです', 'か', '。', '芸術', 'の', '役', 'に', '立た', 'ない', 'もの', 'は', 'すべて', '無駄な', 'んです', 'か', '。', '」', '「', '無駄', 'と', 'は', '言って', 'い', 'ませ', 'ん', '。', 'ただ', '価値', 'が', '低い', 'と', '言っ']",['無駄な'],NO,無駄,NO,YES
399,無駄,に役に立たなければいけないのですか。芸術の役に立たないものはすべて無駄なんですか。」「無駄とは言っていません。ただ価値が低いと言っ,"['に', '役', 'に', '立た', 'なければ', 'いけない', 'のです', 'か', '。', '芸術', 'の', '役', 'に', '立た', 'ない', 'もの', 'は', 'すべて', '無駄な', 'んです', 'か', '。', '」', '「', '無駄', 'と', 'は', '言って', 'い', 'ませ', 'ん', '。', 'ただ', '価値', 'が', '低い', 'と', '言っ']",['無駄'],NO,無駄,NO,NO
400,無駄,とはしない。その様子を見て、白人の男は警官に頼むのは無駄だと判断したようだ。「いいでしょう。銃でこの場所を守っていてください,"['と', 'は', 'し', 'ない', '。', 'その', '様子', 'を', '見て', '、', '白人', 'の', '男', 'は', '警官', 'に', '頼む', 'の', 'は', '無駄だ', 'と', '判断', 'した', 'ようだ', '。', '「', 'いい', 'でしょう', '。', '銃', 'で', 'この', '場所', 'を', '守って', 'いて', 'ください']",['無駄だ'],NO,無駄,NO,YES
401,無駄,この地方の人びとの生活に密着している。みんなそのありがたさを知っているので、ひと粒も無駄にしないために一度打ち終わった茎をもう一度打ちつけ、その後さらに、飛び散った細長い,"['この', '地方', 'の', '人びと', 'の', '生活', 'に', '密着', 'して', 'いる', '。', 'みんな', 'その', 'ありがた', 'さ', 'を', '知って', 'いる', 'ので', '、', 'ひと', '粒', 'も', '無駄に', 'し', 'ない', 'ため', 'に', '一', '度', '打ち', '終わった', '茎', 'を', 'もう', '一', '度', '打ち', 'つけ', '、', 'その後', 'さらに', '、', '飛び散った', '細長い']",['無駄に'],NO,無駄,NO,YES
402,無駄,の表紙の手帳で日々是風水”。ゴールドの表紙の手帳にタイムスケジュールを書くと、無駄なくバランスよく過ごせます。日常のささいなことでも、手帳やメモ帳でスケジュールを,"['の', '表紙', 'の', '手帳', 'で', '日々', '是', '風水', '”', '。', 'ゴールド', 'の', '表紙', 'の', '手帳', 'に', 'タイム', 'スケジュール', 'を', '書く', 'と', '、', '無駄な', 'く', 'バランス', 'よく', '過ごせ', 'ます', '。', '日常', 'の', 'ささいな', 'こと', 'でも', '、', '手帳', 'や', 'メモ', '帳', 'で', 'スケジュール', 'を']",['無駄な'],NO,無駄,NO,YES
403,無駄,は、あなた方ダイバーが好きにすればいい」気に入らない言い方だ。しかしここで無駄な戦闘をするのは避けたい。それに、捕らえるにしてもビヨンド二人が,"['は', '、', 'あなた', '方', 'ダイバー', 'が', '好きに', 'すれば', 'いい', '」', '気', 'に', '入ら', 'ない', '言い', '方', 'だ', '。', 'しかし', 'ここ', 'で', '無駄な', '戦闘', 'を', 'する', 'の', 'は', '避け', 'たい', '。', 'それ', 'に', '、', '捕らえる', 'に', 'して', 'も', 'ビヨンド', '二', '人', 'が']",['無駄な'],NO,無駄,NO,YES
404,無駄,て問題点を発見する『ユーザーテスト』という手法があります。そのユーザーテストの最中に、さんざん無駄な操作を繰り返したユーザーにテスト終了後の感想を聞くと、「まあ満足」「普通,"['て', '問題', '点', 'を', '発見', 'する', '『', 'ユーザー', 'テスト', '』', 'と', 'いう', '手法', 'が', 'あり', 'ます', '。', 'その', 'ユーザー', 'テスト', 'の', '最中', 'に', '、', 'さんざん', '無駄な', '操作', 'を', '繰り返した', 'ユーザー', 'に', 'テスト', '終了', '後', 'の', '感想', 'を', '聞く', 'と', '、', '「', 'まあ', '満足', '」', '「', '普通']",['無駄な'],NO,無駄,NO,YES
405,無駄,いるチームに２連敗。ということは２Ａ程度。そんなレベルの連中の試合を見ても無駄。子供たちに夢を・・・・冗談きついね。,"['いる', 'チーム', 'に', '２', '連敗', '。', 'と', 'いう', 'こと', 'は', '２', 'Ａ', '程度', '。', 'そんな', 'レベル', 'の', '連中', 'の', '試合', 'を', '見て', 'も', '無駄', '。', '子供', 'たち', 'に', '夢', 'を', '・', '・', '・', '・', '冗談', 'きつい', 'ね', '。']",['無駄'],NO,無駄,NO,NO
406,無駄,ことは教えに反する行為として見なされるようになっていきましただけど仏教では無駄な殺生はするなと言う考え方があっても命あるものをいただく時は感謝し,"['こと', 'は', '教え', 'に', '反する', '行為', 'と', 'して', '見なさ', 'れる', 'ように', 'なって', 'いき', 'ました', 'だ', 'けど', '仏教', 'で', 'は', '無駄な', '殺生', 'は', 'する', 'な', 'と', '言う', '考え', '方', 'が', 'あって', 'も', '命', 'ある', 'もの', 'を', 'いただく', '時', 'は', '感謝', 'し']",['無駄な'],NO,無駄,NO,YES
407,無駄,。アキラ・メジャーは一番新しく征服した星だが、これが最後ではない。ここで時間を無駄にはできない。孤立地帯にいる最後のレジスタンス勢力をできるだけ早く排除し、他の星,"['。', 'アキラ', '・', 'メジャー', 'は', '一', '番', '新しく', '征服', 'した', '星', 'だ', 'が', '、', 'これ', 'が', '最後で', 'は', 'ない', '。', 'ここ', 'で', '時間', 'を', '無駄に', 'は', 'でき', 'ない', '。', '孤立', '地帯', 'に', 'いる', '最後の', 'レジスタンス', '勢力', 'を', 'できる', 'だけ', '早く', '排除', 'し', '、', '他の', '星']",['無駄に'],NO,無駄,NO,YES
408,無駄,になってきて、「どうせうまく行かないんだろうけど」とか、「やっても無駄なんだろうけど」とか、何かにつけてそんなふうに自分に言い聞かせるように,"['に', 'なって', 'きて', '、', '「', 'どうせ', 'うまく', '行か', 'ない', 'んだろう', 'けど', '」', 'と', 'か', '、', '「', 'やって', 'も', '無駄な', 'んだろう', 'けど', '」', 'と', 'か', '、', '何かにつけ', 'て', 'そんなふうに', '自分', 'に', '言い聞かせる', 'ように']",['無駄な'],NO,無駄,NO,YES
409,無駄,になっていたのでしょう。私はこのままでは、三日間も待ちつづけたことも無駄になると思い、横断歩道を走りました。その姿をあのひとが発見し、何,"['になって', 'いた', 'のでしょう', '。', '私', 'は', 'このまま', 'で', 'は', '、', '三', '日間', 'も', '待ち', 'つづけた', 'こと', 'も', '無駄に', 'なる', 'と', '思い', '、', '横断', '歩道', 'を', '走り', 'ました', '。', 'その', '姿', 'を', 'あの', 'ひと', 'が', '発見', 'し', '、', '何']",['無駄に'],NO,無駄,NO,YES
410,無駄,。だが方舟伝説によれば、洪水がはじまってから、いくら先を争っても、ほんとうは無駄なのだ。というのは、どこで誰が「方舟」をこしらえているのか、,"['。', 'だが', '方舟', '伝説', 'に', 'よれば', '、', '洪水', 'が', 'はじまって', 'から', '、', 'いくら', '先', 'を', '争って', 'も', '、', 'ほんとう', 'は', '無駄な', 'のだ', '。', 'と', 'いう', 'の', 'は', '、', 'どこ', 'で', '誰', 'が', '「', '方舟', '」', 'を', 'こしらえて', 'いる', 'の', 'か', '、']",['無駄な'],NO,無駄,NO,YES
411,無駄,、なかなかイケるつまみになる。食いしん坊が揃っている我が家は、こうして少しの無駄なく食べつくしてしまう。少々、食い意地が張っているきらいもあるが、その方が魚に対する,"['、', 'なかなか', 'イケる', 'つまみ', 'に', 'なる', '。', '食いしん坊', 'が', '揃って', 'いる', '我が家', 'は', '、', 'こうして', '少し', 'の', '無駄', 'なく', '食べ', 'つくして', 'しまう', '。', '少々', '、', '食い意地', 'が', '張って', 'いる', 'きらい', 'も', 'ある', 'が', '、', 'その方', 'が', '魚', 'に', '対する']",['無駄'],NO,無駄,NO,NO
412,無駄,ん。だとすると、コトバに回す労力はできるだけ少ないほうが、情報を無駄なく適切に処理するためには望ましいし、コトバを使う際には他の情報も当然必要,"['ん', '。', 'だ', 'と', 'する', 'と', '、', 'コトバ', 'に', '回す', '労力', 'は', 'できる', 'だけ', '少ない', 'ほう', 'が', '、', '情報', 'を', '無駄', 'なく', '適切に', '処理', 'する', 'ため', 'に', 'は', '望ましい', 'し', '、', 'コトバ', 'を', '使う', '際', 'に', 'は', '他の', '情報', 'も', '当然', '必要']",['無駄'],NO,無駄,NO,NO
413,無駄,は、書く前に何を書くのかを考えてから書く、書いた文章から無駄な部分を取れるだけ取る、そして自分の考えをはっきり主張する、の三つである。平凡,"['は', '、', '書く', '前', 'に', '何', 'を', '書く', 'の', 'か', 'を', '考えて', 'から', '書く', '、', '書いた', '文章', 'から', '無駄な', '部分', 'を', '取れる', 'だけ', '取る', '、', 'そして', '自分', 'の', '考え', 'を', 'はっきり', '主張', 'する', '、', 'の', '三', 'つ', 'である', '。', '平凡']",['無駄な'],NO,無駄,NO,YES
414,無駄,は他人がくだらない話をしていると、「そんな話を聞いても時間の無駄……」などと思いがちではありませんか？「煙が出ている荷を背負ったかちかち,"['は', '他人', 'が', 'くだらない', '話', 'を', 'して', 'いる', 'と', '、', '「', 'そんな', '話', 'を', '聞いて', 'も', '時間', 'の', '無駄', '……', '」', 'など', 'と', '思い', 'がちで', 'は', 'あり', 'ませ', 'ん', 'か', '？', '「', '煙', 'が', '出て', 'いる', '荷', 'を', '背負った', 'かちかち']",['無駄'],NO,無駄,NO,NO
415,無駄,ば、建武の新政の轍は踏むまい。（顕家、其方の死は決して無駄にはせぬぞ）後醍醐は顕家の訃報に頰を濡らしながら固く心に,"['ば', '、', '建武の新政', 'の', '轍', 'は', '踏む', 'まい', '。', '（', '顕', '家', '、', '其方', 'の', '死', 'は', '決して', '無駄に', 'は', 'せ', 'ぬ', 'ぞ', '）', '後', '醍醐', 'は', '顕', '家', 'の', '訃報', 'に', '頰', 'を', '濡らし', 'ながら', '固く', '心', 'に']",['無駄に'],NO,無駄,NO,YES
416,無駄,を捨てきることができずに苦しむほうが、一般的な心のありようだろう。「人生に無駄はない」は遠回りした人の方便最近の新入社員は、先輩社員から、「キミ,"['を', '捨て', 'きる', 'こと', 'が', 'でき', 'ず', 'に', '苦しむ', 'ほう', 'が', '、', '一般', '的な', '心', 'の', 'あり', 'ようだろう', '。', '「', '人生', 'に', '無駄', 'は', 'ない', '」', 'は', '遠回り', 'した', '人', 'の', '方便', '最近', 'の', '新入', '社員', 'は', '、', '先輩', '社員', 'から', '、', '「', 'キミ']",['無駄'],NO,無駄,NO,NO
417,無駄,苦行からも、何も得られなかっただけに、今の努力も、結局は無駄ではないかという思いも、頭をもたげてきたであろう。ともあれ、欲望への執着,"['苦行', 'から', 'も', '、', '何も', '得', 'られ', 'なかった', 'だけ', 'に', '、', '今', 'の', '努力', 'も', '、', '結局', 'は', '無駄で', 'は', 'ない', 'か', 'と', 'いう', '思い', 'も', '、', '頭', 'を', 'もたげて', 'きた', 'であろう', '。', 'ともあれ', '、', '欲望', 'へ', 'の', '執着']",['無駄で'],NO,無駄,NO,YES
418,無駄,煙がもうもう。かえって余荘児の中毒がぶり返した。「貴女は全く食べ物を無駄にしますね」と彼は笑いながら言う。「遊びで吸っているだけよ,"['煙', 'が', 'もうもう', '。', 'かえって', '余', '荘', '児', 'の', '中毒', 'が', 'ぶり返した', '。', '「', '貴女', 'は', '全く', '食べ物', 'を', '無駄に', 'し', 'ます', 'ね', '」', 'と', '彼', 'は', '笑い', 'ながら', '言う', '。', '「', '遊び', 'で', '吸って', 'いる', 'だけ', 'よ']",['無駄に'],NO,無駄,NO,YES
419,無駄,そこで、彼女は魚料理の最大の長所を「捨てるところがほとんどなく、全体を無駄なく食べられること」とし、それまでの「通念」では捨ててしまうのが,"['そこ', 'で', '、', '彼女', 'は', '魚', '料理', 'の', '最大の', '長所', 'を', '「', '捨てる', 'ところ', 'が', 'ほとんど', 'なく', '、', '全体', 'を', '無駄な', 'く', '食べ', 'られる', 'こと', '」', 'と', 'し', '、', 'それ', 'まで', 'の', '「', '通念', '」', 'で', 'は', '捨てて', 'しまう', 'の', 'が']",['無駄な'],NO,無駄,NO,YES
420,無駄,と母がいった。あなたのいうことならきくかもしれないわ。わたしが頼んでも無駄よ。僕は階段を駆け上がって祖母の部屋のドアを開けた。祖母の,"['と', '母', 'が', 'いった', '。', 'あなた', 'の', 'いう', 'こと', 'なら', 'きく', 'かも', 'しれ', 'ない', 'わ', '。', 'わたし', 'が', '頼んで', 'も', '無駄', 'よ', '。', '僕', 'は', '階段', 'を', '駆け上がって', '祖母', 'の', '部屋', 'の', 'ドア', 'を', '開けた', '。', '祖母', 'の']",['無駄'],NO,無駄,NO,NO
421,無駄,自分のためにも一番よいのではないか？シャルルが催促した。「時間の無駄だと思うよ、エリザベス。もうそうするしかないんだから」いや、ほかにも,"['自分', 'の', 'ため', 'に', 'も', '一', '番', 'よい', 'ので', 'は', 'ない', 'か', '？', 'シャルル', 'が', '催促', 'した', '。', '「', '時間', 'の', '無駄だ', 'と', '思う', 'よ', '、', 'エリザベス', '。', 'もう', 'そう', 'する', 'しか', 'ない', 'んだ', 'から', '」', 'いや', '、', 'ほか', 'に', 'も']",['無駄だ'],NO,無駄,NO,YES
422,無駄,悲しんでもらった方が良いんじゃないですか？もう一度言います、与えられた命を無駄にしないでくれっ！,"['悲しんで', 'もらった', '方', 'が', '良い', 'んじゃ', 'ない', 'です', 'か', '？', 'もう', '一', '度', '言い', 'ます', '、', '与え', 'られた', '命', 'を', '無駄に', 'し', 'ないで', 'くれ', 'っ', '！']",['無駄に'],NO,無駄,NO,YES
423,無駄,中絶後に男に何らかの義務を課せば、無駄な中絶はなくなるし、男性が中絶を避けるようになれば女性も子供を産みやすく,"['中絶', '後', 'に', '男', 'に', '何らか', 'の', '義務', 'を', '課せば', '、', '無駄な', '中絶', 'は', 'なく', 'なる', 'し', '、', '男性', 'が', '中絶', 'を', '避ける', 'ように', 'なれば', '女性', 'も', '子供', 'を', '産み', 'やすく']",['無駄な'],NO,無駄,NO,YES
424,無駄,限りある資源として、大切に使わなければなりません。市は、水道水を無駄にすることなく、また、皆さんが安心して飲めるよう、施設や水質の管理を,"['限り', 'ある', '資源', 'と', 'して', '、', '大切に', '使わ', 'なければ', 'なり', 'ませ', 'ん', '。', '市', 'は', '、', '水道', '水', 'を', '無駄に', 'する', 'こと', 'なく', '、', 'また', '、', '皆さん', 'が', '安心', 'して', '飲める', 'よう', '、', '施設', 'や', '水質', 'の', '管理', 'を']",['無駄に'],NO,無駄,NO,YES
425,無駄,は〜ほは◉墓石（はかいし）―ダイナミックを考える松本なんか世の中、無駄なもん、いっぱいあるよなー！オレ、墓石なんかよくわからんわ。あんなん,"['は', '〜', 'ほ', 'は', '◉', '墓石', '（', 'はかいし', '）', '―', 'ダイナミック', 'を', '考える', '松本', 'なんか', '世の中', '、', '無駄な', 'もん', '、', 'いっぱい', 'ある', 'よ', 'な', 'ー', '！', 'オレ', '、', '墓石', 'なんか', 'よく', 'わから', 'ん', 'わ', '。', 'あんな', 'ん']",['無駄な'],NO,無駄,NO,YES
426,無駄,公共事業をやろうなんて言う人は一人もいない。どれが無駄か、どうやって無駄をなくして有意義に予算を使うかが大事なんです。官僚に乗せられている,"['公共', '事業', 'を', 'やろう', 'なんて', '言う', '人', 'は', '一', '人', 'も', 'い', 'ない', '。', 'どれ', 'が', '無駄', 'か', '、', 'どう', 'やって', '無駄', 'を', 'なくして', '有意義に', '予算', 'を', '使う', 'か', 'が', '大事な', 'んです', '。', '官僚', 'に', '乗せ', 'られて', 'いる']",['無駄'],NO,無駄,NO,NO
427,無駄,公共事業をやろうなんて言う人は一人もいない。どれが無駄か、どうやって無駄をなくして有意義に予算を使うかが大事なんです。官僚に乗せられている,"['公共', '事業', 'を', 'やろう', 'なんて', '言う', '人', 'は', '一', '人', 'も', 'い', 'ない', '。', 'どれ', 'が', '無駄', 'か', '、', 'どう', 'やって', '無駄', 'を', 'なくして', '有意義に', '予算', 'を', '使う', 'か', 'が', '大事な', 'んです', '。', '官僚', 'に', '乗せ', 'られて', 'いる']",['無駄'],NO,無駄,NO,NO
428,無駄,その花々がこの世界を作っているのです。その一人のために時間を使い、一見無駄に見えるような時間を過ごすことが、ほんとうの意味で人間を生かすのだとバニエ氏,"['その', '花', '々', 'が', 'この', '世界', 'を', '作って', 'いる', 'のです', '。', 'その', '一', '人', 'の', 'ため', 'に', '時間', 'を', '使い', '、', '一見', '無駄に', '見える', 'ような', '時間', 'を', '過ごす', 'こと', 'が', '、', 'ほんとうの', '意味', 'で', '人間', 'を', '生かす', 'のだ', 'と', 'バニエ', '氏']",['無駄に'],NO,無駄,NO,YES
429,無駄,んので要りません」とハッキリ言います。するとすぐに去りますよ。相手も無駄な電話はしたくないようですので。,"['ん', 'ので', '要り', 'ませ', 'ん', '」', 'と', 'ハッキリ', '言い', 'ます', '。', 'すると', 'すぐ', 'に', '去り', 'ます', 'よ', '。', '相手', 'も', '無駄な', '電話', 'は', 'し', 'たく', 'ない', 'ようです', 'ので', '。']",['無駄な'],NO,無駄,NO,YES
430,無駄,ないわ。逃げるのに疲れたの」「ほう、しおらしいな。逃げても無駄だとわかったってわけだな」「いいえ、私、あなたと話がしたく,"['ない', 'わ', '。', '逃げる', 'の', 'に', '疲れた', 'の', '」', '「', 'ほう', '、', 'しおらしい', 'な', '。', '逃げて', 'も', '無駄だ', 'と', 'わかった', 'って', 'わけだ', 'な', '」', '「', 'いいえ', '、', '私', '、', 'あなた', 'と', '話', 'が', 'し', 'たく']",['無駄だ'],NO,無駄,NO,YES
431,無駄,と思う。だから「無駄がなくなる」のである。つまり青春の感傷性の中にある無駄な夾雑物が次第に洗い流されてゆき、真正のロマンティシズムが現われてきたのである。作品,"['と', '思う', '。', 'だから', '「', '無駄', 'が', 'なくなる', '」', 'のである', '。', 'つまり', '青春', 'の', '感傷', '性', 'の', '中', 'に', 'ある', '無駄な', '夾', '雑物', 'が', '次第に', '洗い流さ', 'れて', 'ゆき', '、', '真', '正', 'の', 'ロマンティシズム', 'が', '現われて', 'きた', 'のである', '。', '作品']",['無駄'],NO,無駄,NO,NO
432,無駄,と思う。だから「無駄がなくなる」のである。つまり青春の感傷性の中にある無駄な夾雑物が次第に洗い流されてゆき、真正のロマンティシズムが現われてきたのである。作品,"['と', '思う', '。', 'だから', '「', '無駄', 'が', 'なくなる', '」', 'のである', '。', 'つまり', '青春', 'の', '感傷', '性', 'の', '中', 'に', 'ある', '無駄な', '夾', '雑物', 'が', '次第に', '洗い流さ', 'れて', 'ゆき', '、', '真', '正', 'の', 'ロマンティシズム', 'が', '現われて', 'きた', 'のである', '。', '作品']",['無駄な'],NO,無駄,NO,YES
433,無駄,も役立たないと思うし。放置すれば、掲載期間終了でそのうち削除される。ヤフーサーバーにとっても無駄に解決済が増えるよりはあまり有用でない物は消えたほうが良いと思うだろう。,"['も', '役立た', 'ない', 'と', '思う', 'し', '。', '放置', 'すれば', '、', '掲載', '期間', '終了', 'で', 'その', 'うち', '削除', 'さ', 'れる', '。', 'ヤフーサーバー', 'に', 'とって', 'も', '無駄に', '解', '決済', 'が', '増える', 'より', 'は', 'あまり', '有用で', 'ない', '物', 'は', '消えた', 'ほう', 'が', '良い', 'と', '思う', 'だろう', '。']",['無駄に'],NO,無駄,NO,YES
434,無駄,。私としては十万くらい使ってもいいと思うのですが、嫁は「十万なんて大金を無駄な事に使えない」って言います。ぶらっと買い物に出かけ十万くらいを使いたい,"['。', '私', 'と', 'して', 'は', '十万', 'くらい', '使って', 'も', 'いい', 'と', '思う', 'のです', 'が', '、', '嫁', 'は', '「', '十万', 'なんて', '大金', 'を', '無駄な', '事', 'に', '使え', 'ない', '」', 'って', '言い', 'ます', '。', 'ぶら', 'っと', '買い物', 'に', '出かけ', '十万', 'くらい', 'を', '使い', 'たい']",['無駄な'],NO,無駄,NO,YES
435,無駄,なければいけない。もしこの考えが勝利を得るのを望むなら、もはや時を無駄にすべきではない。やる気を結集すべきだ。連盟と有段者会の総会を開いて、,"['なければ', 'いけない', '。', 'もし', 'この', '考え', 'が', '勝利', 'を', '得る', 'の', 'を', '望む', 'なら', '、', 'もはや', '時', 'を', '無駄に', 'す', 'べきで', 'は', 'ない', '。', 'やる', '気', 'を', '結集', 'す', 'べきだ', '。', '連盟', 'と', '有段者', '会', 'の', '総会', 'を', '開いて', '、']",['無駄に'],NO,無駄,NO,YES
436,無駄,、無償の行為ってやつがあって悪いことはない。それに較べ、自分は何一つ無駄な行為はしないという人生の価値観を身につけている。これはこれで意味,"['、', '無償', 'の', '行為', 'って', 'やつ', 'が', 'あって', '悪い', 'こと', 'は', 'ない', '。', 'それ', 'に', '較べ', '、', '自分', 'は', '何一つ', '無駄な', '行為', 'は', 'し', 'ない', 'と', 'いう', '人生', 'の', '価値', '観', 'を', '身', 'に', 'つけて', 'いる', '。', 'これ', 'は', 'これ', 'で', '意味']",['無駄な'],NO,無駄,NO,YES
437,無駄,た。経験から言うと、超高額なもので肌に合えば、それは流石に無駄にお金は取ってないとうならせるものはあります。かといって、安価,"['た', '。', '経験', 'から', '言う', 'と', '、', '超', '高額な', 'もの', 'で', '肌', 'に', '合えば', '、', 'それ', 'は', '流石', 'に', '無駄に', 'お', '金', 'は', '取って', 'ない', 'と', 'うなら', 'せる', 'もの', 'は', 'あり', 'ます', '。', 'かといって', '、', '安価']",['無駄に'],NO,無駄,NO,YES
438,無駄,あっちのマンションはどうしたんだよ。まだ契約は一年以上残ってただろう。無駄に金ばっかり使いやがって。冬馬、悪い癖だっ」「怒るなよ。ここ,"['あっち', 'の', 'マンション', 'は', 'どうした', 'ん', 'だ', 'よ', '。', 'まだ', '契約', 'は', '一', '年', '以上', '残って', 'た', 'だろう', '。', '無駄に', '金', 'ばっかり', '使い', 'やがって', '。', '冬', '馬', '、', '悪い', '癖', 'だっ', '」', '「', '怒る', 'な', 'よ', '。', 'ここ']",['無駄に'],NO,無駄,NO,YES
439,無駄,は答えた。「そうね、あなたには何もないのね。時間を無駄にしてしまったわ。でも、あなたには知性があるから、ひょっとしたらこの辺,"['は', '答えた', '。', '「', 'そう', 'ね', '、', 'あなた', 'に', 'は', '何も', 'ない', 'の', 'ね', '。', '時間', 'を', '無駄に', 'して', 'しまった', 'わ', '。', 'でも', '、', 'あなた', 'に', 'は', '知性', 'が', 'ある', 'から', '、', 'ひょっとしたら', 'この', '辺']",['無駄に'],NO,無駄,NO,YES
