121,無駄,古代エジプト史の講義をしたときに説明したじゃないか」「里佳に言っても無駄ですよ」と美久が口を挟んだ。「この子、必修科目だってろくすっぽ出席し,"['古代', 'エジプト', '史', 'の', '講義', 'を', 'した', 'とき', 'に', '説明', 'した', 'じゃ', 'ない', 'か', '」', '「', '里', '佳', 'に', '言って', 'も', '無駄です', 'よ', '」', 'と', '美', '久', 'が', '口', 'を', '挟んだ', '。', '「', 'この', '子', '、', '必修', '科目', 'だって', 'ろくすっぽ', '出席', 'し']",['無駄です'],NO,無駄,NO,YES
122,無駄,見せる瞳が、どこか不敵だ。袖のない上着から伸びた長い腕には無駄な肉は一切なく、代わりにほどよい筋肉がびっしりとのっている。そして瞳の色,"['見せる', '瞳', 'が', '、', 'どこ', 'か', '不敵だ', '。', '袖', 'の', 'ない', '上着', 'から', '伸びた', '長い', '腕', 'に', 'は', '無駄な', '肉', 'は', '一', '切なく', '、', '代わり', 'に', 'ほどよい', '筋肉', 'が', 'びっしり', 'と', 'のって', 'いる', '。', 'そして', '瞳', 'の', '色']",['無駄な'],NO,無駄,NO,YES
123,無駄,選出だ。名良橋は４年ぶりの代表復帰。「４年ぶりの代表選出でとても嬉しい。この４年間を無駄にしないよう試合に出場できるよう全力で頑張りたい」とコメントした。名良橋が４年ぶり,"['選出', 'だ', '。', '名良橋', 'は', '４', '年', 'ぶり', 'の', '代表', '復帰', '。', '「', '４', '年', 'ぶり', 'の', '代表', '選出', 'で', 'とても', '嬉しい', '。', 'この', '４', '年間', 'を', '無駄に', 'し', 'ない', 'よう', '試合', 'に', '出場', 'できる', 'よう', '全力', 'で', '頑張り', 'たい', '」', 'と', 'コメント', 'した', '。', '名良橋', 'が', '４', '年', 'ぶり']",['無駄に'],NO,無駄,NO,YES
124,無駄,から、洗濯ばさみがひとケース発見されたよ。シークレストから洗濯ばさみを追放しようというミルドレッドの試みは無駄だった。しかも、発見されたのはそれだけじゃない」フェニモアはポケットに手を,"['から', '、', '洗濯', 'ば', 'さ', 'み', 'が', 'ひと', 'ケース', '発見', 'さ', 'れた', 'よ', '。', 'シークレスト', 'から', '洗濯', 'ば', 'さ', 'み', 'を', '追放', 'しよう', 'と', 'いう', 'ミルドレッド', 'の', '試み', 'は', '無駄だった', '。', 'しかも', '、', '発見', 'さ', 'れた', 'の', 'は', 'それ', 'だけ', 'じゃ', 'ない', '」', 'フェニモア', 'は', 'ポケット', 'に', '手', 'を']",['無駄だった'],NO,無駄,NO,YES
125,無駄,話だよね、コレ。ヴァンパイア騎士第十一話・・・吸血シーンでの優姫の台詞が無駄にエロかった（笑）。かのこん第十一話・・・相変わらずの内容ではある,"['話', 'だ', 'よ', 'ね', '、', 'コレ', '。', 'ヴァンパイア', '騎士', '第', '十一', '話', '・', '・', '・', '吸血', 'シーン', 'で', 'の', '優', '姫', 'の', '台詞', 'が', '無駄に', 'エロかった', '（', '笑', '）', '。', 'かのこ', 'ん', '第', '十一', '話', '・', '・', '・', '相変わらず', 'の', '内容', 'で', 'は', 'ある']",['無駄に'],NO,無駄,NO,YES
126,無駄,住所は手帳にひかえてある。その裏書人の住所を調べてみる」「調べても無駄だと思うが、まあ、調べてみるか」と諸橋が言った。手形の,"['住所', 'は', '手帳', 'に', 'ひかえて', 'ある', '。', 'その', '裏書', '人', 'の', '住所', 'を', '調べて', 'みる', '」', '「', '調べて', 'も', '無駄だ', 'と', '思う', 'が', '、', 'まあ', '、', '調べて', 'みる', 'か', '」', 'と', '諸', '橋', 'が', '言った', '。', '手形', 'の']",['無駄だ'],NO,無駄,NO,YES
127,無駄,間に距離を置こうとしたのだろう。そしてゆっくりと振り向いた。「人生を無駄にしてはいけないよ、キャシー」彼は唇を指でこすった。「,"['間', 'に', '距離', 'を', '置こう', 'と', 'した', 'のだろう', '。', 'そして', 'ゆっくり', 'と', '振り向いた', '。', '「', '人生', 'を', '無駄に', 'して', 'は', 'いけない', 'よ', '、', 'キャシー', '」', '彼', 'は', '唇', 'を', '指', 'で', 'こすった', '。', '「']",['無駄に'],NO,無駄,NO,YES
128,無駄,留年したら中退してもらうってばっさり切られました……ちゃんと、卒業しなきゃ！！４年間を無駄にしたくないよ……！ムックのライブと卒業旅行の韓国をバネにして,"['留年', 'したら', '中退', 'して', 'もらう', 'って', 'ばっさり', '切ら', 'れ', 'ました', '……', 'ちゃんと', '、', '卒業', 'し', 'なきゃ', '！', '！', '４', '年間', 'を', '無駄に', 'し', 'たく', 'ない', 'よ', '……', '！', 'ムック', 'の', 'ライブ', 'と', '卒業', '旅行', 'の', '韓国', 'を', 'バネ', 'に', 'して']",['無駄に'],NO,無駄,NO,YES
129,無駄,カオルは、自分をたしなめるように口に出して言ってみた。しかし、無駄だった。といって、彼女に、自分の落ちつかない原因が分からないわけ,"['カオル', 'は', '、', '自分', 'を', 'たしなめる', 'ように', '口', 'に', '出して', '言って', 'みた', '。', 'しかし', '、', '無駄だった', '。', 'と', 'いって', '、', '彼女', 'に', '、', '自分', 'の', '落ちつか', 'ない', '原因', 'が', '分から', 'ない', 'わけ']",['無駄だった'],NO,無駄,NO,YES
130,無駄,ＦＭも合わせてすでに３回聞いています。何故でしょう？聞きたいことに返事がなく無駄なやり取りで、時間がかかっています。全部教えろってことなんでしょうか？なんだか不安,"['ＦＭ', 'も', '合わせて', 'すでに', '３', '回', '聞いて', 'い', 'ます', '。', '何故', 'でしょう', '？', '聞き', 'たい', 'こと', 'に', '返事', 'が', 'なく', '無駄な', 'やり取り', 'で', '、', '時間', 'が', 'かかって', 'い', 'ます', '。', '全部', '教えろ', 'って', 'こと', 'な', 'んでしょう', 'か', '？', 'なんだか', '不安']",['無駄な'],NO,無駄,NO,YES
131,無駄,には飼い主の連絡先を記入しましょう。■不妊・去勢をしましょう。野良猫の繁殖や無駄な繁殖を防ぐためにも、不妊・去勢手術を受けましょう。■トイレのしつけを！糞尿,"['に', 'は', '飼い主', 'の', '連絡', '先', 'を', '記入', 'し', 'ましょう', '。', '■', '不妊', '・', '去勢', 'を', 'し', 'ましょう', '。', '野良', '猫', 'の', '繁殖', 'や', '無駄な', '繁殖', 'を', '防ぐ', 'ため', 'に', 'も', '、', '不妊', '・', '去勢', '手術', 'を', '受け', 'ましょう', '。', '■', 'トイレ', 'の', 'しつけ', 'を', '！', '糞尿']",['無駄な'],NO,無駄,NO,YES
132,無駄,ＲｅｔｕｒｎｏｎＡｓｓｅｔｓ）がある。このＲＯＡを改善するためにはＡｓｓｅｔｓ（資産）の無駄をなくさなければならない。いいかえれば、総資産額を減らすことである。具体的には、ユーザーのところ,"['ＲｅｔｕｒｎｏｎＡｓｓｅｔｓ', '）', 'が', 'ある', '。', 'この', 'ＲＯＡ', 'を', '改善', 'する', 'ため', 'に', 'は', 'Ａｓｓｅｔｓ', '（', '資産', '）', 'の', '無駄', 'を', 'なくさ', 'なければ', 'なら', 'ない', '。', 'いい', 'かえれば', '、', '総', '資産', '額', 'を', '減らす', 'こと', 'である', '。', '具体', '的に', 'は', '、', 'ユーザー', 'の', 'ところ']",['無駄'],NO,無駄,NO,NO
133,無駄,てきて秋場で待ち合わせしようといったのに聞かなかった妹のせいで時間を無駄にしましたほんとむかつきました後は知りませんお金さえ返してくれればそれで,"['てき', 'て', '秋', '場', 'で', '待ち合わせ', 'しよう', 'と', 'いった', 'の', 'に', '聞か', 'なかった', '妹', 'の', 'せい', 'で', '時間', 'を', '無駄に', 'し', 'ました', 'ほん', 'と', 'むかつき', 'ました', '後', 'は', '知り', 'ませ', 'ん', 'お', '金', 'さえ', '返して', 'くれれば', 'それ', 'で']",['無駄に'],NO,無駄,NO,YES
134,無駄,わたしは何も否認しない。今、思い返してみると、当時思っていたほど時間を無駄にしたような気はしない。モデルをしていたときは、それ,"['わたし', 'は', '何も', '否認', 'し', 'ない', '。', '今', '、', '思い', '返して', 'みる', 'と', '、', '当時', '思って', 'いた', 'ほど', '時間', 'を', '無駄に', 'した', 'ような', '気', 'は', 'し', 'ない', '。', 'モデル', 'を', 'して', 'いた', 'とき', 'は', '、', 'それ']",['無駄に'],NO,無駄,NO,YES
135,無駄,て食べています。弟はインスタントラーメンひとつ作るにも恐ろしい程台所をメチャクチャにし、無駄に食器を使い（自分で片付けない人ってなるべく洗い物を増やさないようにしようと,"['て', '食べて', 'い', 'ます', '。', '弟', 'は', 'インスタントラーメン', 'ひと', 'つ', '作る', 'に', 'も', '恐ろしい', '程', '台所', 'を', 'メチャクチャに', 'し', '、', '無駄に', '食器', 'を', '使い', '（', '自分', 'で', '片付け', 'ない', '人', 'って', 'なるべく', '洗い', '物', 'を', '増やさ', 'ない', 'ように', 'しよう', 'と']",['無駄に'],NO,無駄,NO,YES
136,無駄,地域経済の仕組みづくりのための事業化が極めて重要であることを教えています。さらに、無駄な公共事業などの経費を見直し、新たな就業の場をどうつくるかという模索も,"['地域', '経済', 'の', '仕組み', 'づくり', 'の', 'ため', 'の', '事業', '化', 'が', '極めて', '重要である', 'こと', 'を', '教えて', 'い', 'ます', '。', 'さらに', '、', '無駄な', '公共', '事業', 'など', 'の', '経費', 'を', '見直し', '、', '新たな', '就業', 'の', '場', 'を', 'どう', 'つくる', 'か', 'と', 'いう', '模索', 'も']",['無駄な'],NO,無駄,NO,YES
137,無駄,あって安上がりにできるんです。そして第三が税源の地方移譲です。地方分権です。無駄な公共事業をやめろ、というのは無意味な言葉です。無駄な公共事業をやろうなんて言う,"['あって', '安上がりに', 'できる', 'んです', '。', 'そして', '第', '三', 'が', '税', '源', 'の', '地方', '移譲', 'です', '。', '地方', '分権', 'です', '。', '無駄な', '公共', '事業', 'を', 'やめろ', '、', 'と', 'いう', 'の', 'は', '無意味な', '言葉', 'です', '。', '無駄な', '公共', '事業', 'を', 'やろう', 'なんて', '言う']",['無駄な'],NO,無駄,NO,YES
138,無駄,あって安上がりにできるんです。そして第三が税源の地方移譲です。地方分権です。無駄な公共事業をやめろ、というのは無意味な言葉です。無駄な公共事業をやろうなんて言う,"['あって', '安上がりに', 'できる', 'んです', '。', 'そして', '第', '三', 'が', '税', '源', 'の', '地方', '移譲', 'です', '。', '地方', '分権', 'です', '。', '無駄な', '公共', '事業', 'を', 'やめろ', '、', 'と', 'いう', 'の', 'は', '無意味な', '言葉', 'です', '。', '無駄な', '公共', '事業', 'を', 'やろう', 'なんて', '言う']",['無駄な'],NO,無駄,NO,YES
139,無駄,と思います。浅田仮にものにならなくても、一生懸命書いたものは無駄にはならない。僕は二十代の頃に書いた小説が柳行李の中にいっぱい,"['と', '思い', 'ます', '。', '浅田', '仮にも', 'のに', 'なら', 'なくて', 'も', '、', '一生懸命', '書いた', 'もの', 'は', '無駄に', 'は', 'なら', 'ない', '。', '僕', 'は', '二十', '代', 'の', '頃', 'に', '書いた', '小説', 'が', '柳', '行李', 'の', '中', 'に', 'いっぱい']",['無駄に'],NO,無駄,NO,YES
140,無駄,にたっているのか、公園へ連れていったり、夜みほりんが寝なくて１時間無駄に過ごしたと思うと、時給に換算したらいくらで、公園で２時間遊ぶのと,"['に', 'たって', 'いる', 'の', 'か', '、', '公園', 'へ', '連れて', 'いったり', '、', '夜', 'みほ', 'りん', 'が', '寝', 'なくて', '１', '時間', '無駄に', '過ごした', 'と', '思う', 'と', '、', '時給', 'に', '換算', 'したら', 'いくら', 'で', '、', '公園', 'で', '２', '時間', '遊ぶ', 'の', 'と']",['無駄に'],NO,無駄,NO,YES
141,無駄,の日本人はこれらの燃料を使っていた。森林の間伐材も炭にされるなど無駄のない資源として重宝されていた。今や、間伐しても利用されないとなると,"['の', '日本', '人', 'は', 'これ', 'ら', 'の', '燃料', 'を', '使って', 'いた', '。', '森林', 'の', '間伐', '材', 'も', '炭', 'に', 'さ', 'れる', 'など', '無駄', 'の', 'ない', '資源', 'と', 'して', '重宝', 'さ', 'れて', 'いた', '。', '今や', '、', '間伐', 'して', 'も', '利用', 'さ', 'れ', 'ない', 'と', 'なる', 'と']",['無駄'],NO,無駄,NO,NO
142,無駄,ない。私だけ？いや、どこもかしこも儲かっていないのに、忙しいのは無駄。見込みがあるなら、がんばって伸ばせるようにする。だめならだめなりに動く。わかる,"['ない', '。', '私', 'だけ', '？', 'いや', '、', 'どこ', 'も', 'かしこ', 'も', '儲かって', 'い', 'ない', 'のに', '、', '忙しい', 'の', 'は', '無駄', '。', '見込み', 'が', 'ある', 'なら', '、', 'がんばって', '伸ばせる', 'ように', 'する', '。', 'だめ', 'なら', 'だめ', 'なり', 'に', '動く', '。', 'わかる']",['無駄'],NO,無駄,NO,NO
143,無駄,になる。おまけに、日本語による相談をしても、こちらにはわかってしまうから無駄だと、あらかじめ、こちらに通告することにもなり、余計な摩擦を少なくできる。,"['に', 'なる', '。', 'おまけに', '、', '日本', '語', 'に', 'よる', '相談', 'を', 'して', 'も', '、', 'こちら', 'に', 'は', 'わかって', 'しまう', 'から', '無駄だ', 'と', '、', 'あらかじめ', '、', 'こちら', 'に', '通告', 'する', 'こと', 'に', 'も', 'なり', '、', '余計な', '摩擦', 'を', '少なく', 'できる', '。']",['無駄だ'],NO,無駄,NO,YES
144,無駄,求めて頼り切っている自分がたまらなく嫌だったし、それを彼女に期待しても無駄だということは分かっていた。それでも俺は、彼女の眠りを妨げないように,"['求めて', '頼り', '切って', 'いる', '自分', 'が', 'たまら', 'なく', '嫌だった', 'し', '、', 'それ', 'を', '彼女', 'に', '期待', 'して', 'も', '無駄だ', 'と', 'いう', 'こと', 'は', '分かって', 'いた', '。', 'それ', 'でも', '俺', 'は', '、', '彼女', 'の', '眠り', 'を', '妨げ', 'ない', 'ように']",['無駄だ'],NO,無駄,NO,YES
145,無駄,でも，ＨＩＶを認めないや他の社会経済的障壁によって，流行を縮小させ，財政的な無駄を防ぎ，一番大切な人命を救うための介入活動が遅らされてきた．図２,"['でも', '，', 'ＨＩＶ', 'を', '認め', 'ない', 'や', '他の', '社会', '経済', '的', '障壁', 'に', 'よって', '，', '流行', 'を', '縮小', 'さ', 'せ', '，', '財政', '的な', '無駄', 'を', '防ぎ', '，', '一', '番', '大切な', '人命', 'を', '救う', 'ため', 'の', '介入', '活動', 'が', '遅らさ', 'れて', 'きた', '．', '図', '２']",['無駄'],NO,無駄,NO,NO
146,無駄,私は即座に「この行革の折にそんな話はダメだ。会議室を増やすより無駄な会議を減らすことが先決だ。どうしても必要な会議なら、街の中の洒落,"['私', 'は', '即座に', '「', 'この', '行革', 'の', '折', 'に', 'そんな', '話', 'は', 'ダメだ', '。', '会議', '室', 'を', '増やす', 'より', '無駄な', '会議', 'を', '減らす', 'こと', 'が', '先決', 'だ', '。', 'どうしても', '必要な', '会議', 'なら', '、', '街', 'の', '中', 'の', '洒落']",['無駄な'],NO,無駄,NO,YES
147,無駄,まで何か心のなかで引っかかっていたものが消えると、心にかかっていた無駄な負荷が無くなる。そうすると自由になるから、他のことがスムーズに出来る,"['まで', '何', 'か', '心', 'の', 'なか', 'で', '引っかかって', 'いた', 'もの', 'が', '消える', 'と', '、', '心', 'に', 'かかって', 'いた', '無駄な', '負荷', 'が', '無くなる', '。', 'そう', 'する', 'と', '自由に', 'なる', 'から', '、', '他の', 'こと', 'が', 'スムーズに', '出来る']",['無駄な'],NO,無駄,NO,YES
148,無駄,。ミックスゲージニットとカーゴタイプのコーデュロイパンツというシンプルなコーデでもおしゃれ感がキープできるのがいい。この無駄のないリラックスモードが心地よい。ニット￥一万千三百四十・パンツ￥一万千三百四十／Ｘ‐ｇｉｒｌ（Ｘ‐ｇｉｒｌ,"['。', 'ミックスゲージニット', 'と', 'カーゴタイプ', 'の', 'コーデュロイパンツ', 'と', 'いう', 'シンプルな', 'コーデ', 'でも', 'おしゃれ', '感', 'が', 'キープ', 'できる', 'の', 'が', 'いい', '。', 'この', '無駄', 'の', 'ない', 'リラックス', 'モード', 'が', '心地よい', '。', 'ニット', '￥', '一万千三百四十・', 'パンツ', '￥', '一万千三百四十', '／', 'Ｘ', '‐', 'ｇｉｒｌ', '（', 'Ｘ', '‐', 'ｇｉｒｌ']",['無駄'],NO,無駄,NO,NO
149,無駄,涙を流した。せっかくの筋書きも水の泡だ。心血を注いだのはみんな無駄になった。初めからしくじったのなら、まだましだったろう。何より辛いの,"['涙', 'を', '流した', '。', 'せっかく', 'の', '筋書き', 'も', '水', 'の', '泡', 'だ', '。', '心血', 'を', '注いだ', 'の', 'は', 'みんな', '無駄に', 'なった', '。', '初め', 'から', 'しくじった', 'の', 'なら', '、', 'まだ', 'ましだったろう', '。', '何より', '辛い', 'の']",['無駄に'],NO,無駄,NO,YES
150,無駄,の底の妖精が作った逸品を、毛羽立たせることも出来なかった。「無駄ですよ、アヌビスさん。あなたは所詮、《アヌビス神》その人ではないのですから。その笏丈,"['の', '底', 'の', '妖精', 'が', '作った', '逸品', 'を', '、', '毛', '羽', '立た', 'せる', 'こと', 'も', '出来', 'なかった', '。', '「', '無駄です', 'よ', '、', 'アヌビス', 'さん', '。', 'あなた', 'は', '所詮', '、', '《', 'アヌビス', '神', '》', 'その', '人', 'で', 'は', 'ない', 'のです', 'から', '。', 'その', '笏丈']",['無駄です'],NO,無駄,NO,YES
151,無駄,前で一時間も奮闘する高校生に向かって、そんな暇があるなら勉強しなさい、と忠告したって無駄である。だから私は物分かりのいい笑みを浮かべて、「君たちはあれかい？,"['前', 'で', '一', '時間', 'も', '奮闘', 'する', '高校', '生', 'に', '向かって', '、', 'そんな', '暇', 'が', 'ある', 'なら', '勉強', 'し', 'なさい', '、', 'と', '忠告', 'した', 'って', '無駄である', '。', 'だから', '私', 'は', '物分かり', 'の', 'いい', '笑み', 'を', '浮かべて', '、', '「', '君', 'たち', 'は', 'あれ', 'かい', '？']",['無駄である'],NO,無駄,NO,YES
152,無駄,きてくれんかな」それだけいうと、電話は切れた。盛田は、無駄な会話を嫌う。せっかちなうえに超多忙だから、そうせざるを得ないのだが、だから,"['きて', 'くれ', 'ん', 'かな', '」', 'それ', 'だけ', 'いう', 'と', '、', '電話', 'は', '切れた', '。', '盛田', 'は', '、', '無駄な', '会話', 'を', '嫌う', '。', 'せっかちな', 'うえ', 'に', '超', '多忙だ', 'から', '、', 'そう', 'せ', 'ざる', 'を', '得', 'ない', 'のだ', 'が', '、', 'だから']",['無駄な'],NO,無駄,NO,YES
153,無駄,使うと便利なのか、よくわからない」「ネットサーフィンはそこそこ面白いが、時間の無駄のような気がする」インターネット上には膨大な量の情報が存在します。,"['使う', 'と', '便利な', 'の', 'か', '、', 'よく', 'わから', 'ない', '」', '「', 'ネットサーフィン', 'は', 'そこそこ', '面白い', 'が', '、', '時間', 'の', '無駄', 'の', 'ような', '気', 'が', 'する', '」', 'インターネット', '上', 'に', 'は', '膨大な', '量', 'の', '情報', 'が', '存在', 'し', 'ます', '。']",['無駄'],NO,無駄,NO,NO
154,無駄,うー小説進まなーい制作予定だけ無駄に多いのが悪いですね明るい話書くの向いてないのかなあ投票、やっ,"['う', 'ー', '小説', '進', 'ま', 'な', 'ー', 'い', '制作', '予定', 'だけ', '無駄に', '多い', 'の', 'が', '悪い', 'です', 'ね', '明るい', '話', '書く', 'の', '向いて', 'ない', 'の', 'か', 'なあ', '投票', '、', 'やっ']",['無駄に'],NO,無駄,NO,YES
155,無駄,祈った。それなのに何かやっても、やっても「そんなこと無駄！」という悪魔のささやきが聞こえてくるのだ。ともかく気持ちを落ち着かせること。心配しすぎたり,"['祈った', '。', 'それなのに', '何', 'か', 'やって', 'も', '、', 'やって', 'も', '「', 'そんな', 'こと', '無駄', '！', '」', 'と', 'いう', '悪魔', 'の', 'ささやき', 'が', '聞こえて', 'くる', 'のだ', '。', 'ともかく', '気持ち', 'を', '落ち着か', 'せる', 'こと', '。', '心配', 'し', 'すぎたり']",['無駄'],NO,無駄,NO,NO
156,無駄,をする…過剰包装、過剰梱包は材料の回収や廃棄などの問題を含みます。また無駄なコストが発生するため、輸入者にとっても良いことではありません。商品価値を落とさない梱包,"['を', 'する', '…', '過剰', '包装', '、', '過剰', '梱包', 'は', '材料', 'の', '回収', 'や', '廃棄', 'など', 'の', '問題', 'を', '含み', 'ます', '。', 'また', '無駄な', 'コスト', 'が', '発生', 'する', 'ため', '、', '輸入', '者', 'に', 'とって', 'も', '良い', 'こと', 'で', 'は', 'あり', 'ませ', 'ん', '。', '商品', '価値', 'を', '落とさ', 'ない', '梱包']",['無駄な'],NO,無駄,NO,YES
157,無駄,産物を活かし，ときには新しい料理も．○調理や保存を上手にして無駄な廃棄を少なく．○自分の食生活を見直してみましょう．Ｃわが国の食生活,"['産物', 'を', '活かし', '，', 'ときに', 'は', '新しい', '料理', 'も', '．', '○', '調理', 'や', '保存', 'を', '上手に', 'して', '無駄な', '廃棄', 'を', '少なく', '．', '○', '自分', 'の', '食', '生活', 'を', '見直して', 'み', 'ましょう', '．', 'Ｃ', 'わが国', 'の', '食', '生活']",['無駄な'],NO,無駄,NO,YES
158,無駄,は土曜日だし、朝もゆっくりできるからいいと思ったんだけど、いらなかったら無駄にしていいわ」病院からの帰り道、夏澄の家の近くまで来た,"['は', '土曜日', 'だ', 'し', '、', '朝', 'も', 'ゆっくり', 'できる', 'から', 'いい', 'と', '思った', 'んだ', 'けど', '、', 'いら', 'なかったら', '無駄に', 'して', 'い', 'い', 'わ', '」', '病院', 'から', 'の', '帰り道', '、', '夏', '澄', 'の', '家', 'の', '近く', 'まで', '来た']",['無駄に'],NO,無駄,NO,YES
159,無駄,ているのではなく，必要最小限の暗号のみが発現しているのである．生物は省エネルギーに徹していて決して無駄なものはつくってないのである．このような細胞内での発現制御はどのようにし,"['て', 'いる', 'ので', 'は', 'なく', '，', '必要', '最小', '限', 'の', '暗号', 'のみ', 'が', '発現', 'して', 'いる', 'のである', '．', '生物', 'は', '省', 'エネルギー', 'に', '徹して', 'いて', '決して', '無駄な', 'もの', 'は', 'つくって', 'ない', 'のである', '．', 'このような', '細胞', '内', 'で', 'の', '発現', '制御', 'は', 'どのように', 'し']",['無駄な'],NO,無駄,NO,YES
