116,無関心,大切だと実感した。育児に追われ、疲れはてているわたしは、夫に対してまったく無関心となり、夫の顔が怪物に見える（言い過ぎてるよね。あなた、ゴメン）,"['大切だ', 'と', '実感', 'した', '。', '育児', 'に', '追わ', 'れ', '、', '疲れ', 'はてて', 'いる', 'わたし', 'は', '、', '夫', 'に', '対して', 'まったく', '無関心', 'と', 'なり', '、', '夫', 'の', '顔', 'が', '怪物', 'に', '見える', '（', '言い', '過ぎて', 'る', 'よ', 'ね', '。', 'あなた', '、', 'ゴメン', '）']",['無関心'],NO,無関心,NO,NO
117,無関心,こんなにしょっちゅうそれを交互に失って堂々めぐりをするなんて、こんなにしょっちゅう欲望と無関心、無関心と欲望の円を描いているなんて、何の意味があるのだ？わたし,"['こんなに', 'しょっちゅう', 'それ', 'を', '交互に', '失って', '堂々めぐり', 'を', 'する', 'なんて', '、', 'こんなに', 'しょっちゅう', '欲望', 'と', '無関心', '、', '無関心', 'と', '欲望', 'の', '円', 'を', '描いて', 'いる', 'なんて', '、', '何の', '意味', 'が', 'ある', 'のだ', '？', 'わたし']",['無関心'],NO,無関心,NO,NO
118,無関心,こんなにしょっちゅうそれを交互に失って堂々めぐりをするなんて、こんなにしょっちゅう欲望と無関心、無関心と欲望の円を描いているなんて、何の意味があるのだ？わたし,"['こんなに', 'しょっちゅう', 'それ', 'を', '交互に', '失って', '堂々めぐり', 'を', 'する', 'なんて', '、', 'こんなに', 'しょっちゅう', '欲望', 'と', '無関心', '、', '無関心', 'と', '欲望', 'の', '円', 'を', '描いて', 'いる', 'なんて', '、', '何の', '意味', 'が', 'ある', 'のだ', '？', 'わたし']",['無関心'],NO,無関心,NO,NO
119,無関心,染まった手拭を巻いて、街をカッ歩するのである。私も相当に服装には無関心なのであるが、オッサンのいでたちには、初期の頃は、やはり恐れいったものであっ,"['染まった', '手拭', 'を', '巻いて', '、', '街', 'を', 'カッ', '歩', 'する', 'のである', '。', '私', 'も', '相当に', '服装', 'に', 'は', '無関心な', 'のである', 'が', '、', 'オッサン', 'の', 'いでたち', 'に', 'は', '、', '初期', 'の', '頃', 'は', '、', 'やはり', '恐れいった', 'もの', 'で', 'あっ']",['無関心な'],NO,無関心,NO,YES
120,無関心,考えればなぁ・・・とは思いますが、ＰＴＡ会費の値上げなんて、普段ＰＴＡ活動に無関心な人ほど文句言いそうな気がしません？？？こういうことって言い出しにくい,"['考えれば', 'な', 'ぁ', '・', '・', '・', 'と', 'は', '思い', 'ます', 'が', '、', 'ＰＴＡ', '会費', 'の', '値上げ', 'なんて', '、', '普段', 'ＰＴＡ', '活動', 'に', '無関心な', '人', 'ほど', '文句', '言い', 'そうな', '気', 'が', 'し', 'ませ', 'ん', '？', '？', '？', 'こういう', 'こと', 'って', '言い', '出し', 'にくい']",['無関心な'],NO,無関心,NO,YES
121,無関心,国社会全体における人権意識の立ちおくれ、あるいは物質的な豊かさを追い求める余り心の豊かさをはぐくむことに無関心になりがちな現代社会の風潮などを挙げることができるのではないでしょうか。このような問題を一日,"['国', '社会', '全体', 'に', 'おける', '人権', '意識', 'の', '立ちおくれ', '、', 'あるいは', '物質', '的な', '豊か', 'さ', 'を', '追い求める', '余り', '心', 'の', '豊か', 'さ', 'を', 'はぐくむ', 'こと', 'に', '無関心に', 'なり', 'がちな', '現代', '社会', 'の', '風潮', 'など', 'を', '挙げる', 'こと', 'が', 'できる', 'ので', 'は', 'ない', 'でしょう', 'か', '。', 'このような', '問題', 'を', '一', '日']",['無関心に'],NO,無関心,NO,YES
122,無関心,、アイシャさんが勝ったそうですよ、今度の自主制作映画」そう言った誠にまったく無関心というように島田が階段を下りていく。「そうなんだ・・・どうせ,"['、', 'アイシャ', 'さん', 'が', '勝った', 'そうです', 'よ', '、', '今度', 'の', '自主', '制作', '映画', '」', 'そう', '言った', '誠に', 'まったく', '無関心', 'と', 'いう', 'ように', '島田', 'が', '階段', 'を', '下りて', 'いく', '。', '「', 'そう', 'な', 'んだ', '・', '・', '・', 'どうせ']",['無関心'],NO,無関心,NO,NO
123,無関心,思った。名前が分らない大多数の植物を、つい雑草と言ってしまう。無恥、無関心、無頓着の故かも知れない。雑草という名の植物は無いんですよね。,"['思った', '。', '名前', 'が', '分ら', 'ない', '大', '多数', 'の', '植物', 'を', '、', 'つい', '雑草', 'と', '言って', 'しまう', '。', '無', '恥', '、', '無関心', '、', '無頓着', 'の', '故', 'かも', '知れ', 'ない', '。', '雑草', 'と', 'いう', '名', 'の', '植物', 'は', '無い', 'んです', 'よ', 'ね', '。']",['無関心'],NO,無関心,NO,NO
124,無関心,二は知らん顔でいる。聞えないのでもない。聞えたのでもない。無関心の放心で天井を見ている。お時は、立入らない。小さい時から関西の,"['二', 'は', '知らん顔', 'で', 'いる', '。', '聞え', 'ない', 'ので', 'も', 'ない', '。', '聞えた', 'ので', 'も', 'ない', '。', '無関心', 'の', '放心', 'で', '天井', 'を', '見て', 'いる', '。', 'お', '時', 'は', '、', '立入ら', 'ない', '。', '小さい', '時', 'から', '関西', 'の']",['無関心'],NO,無関心,NO,NO
125,無関心,、キャサリン・キームラは新しい校長の図書館への態度は憂慮すべきものだと気づいた―「無関心な態度、そして頼れる守護聖人が誰もいないような感じです」。州議会議員は,"['、', 'キャサリン', '・', 'キームラ', 'は', '新しい', '校長', 'の', '図書', '館', 'へ', 'の', '態度', 'は', '憂慮', 'す', 'べき', 'もの', 'だ', 'と', '気づいた', '―', '「', '無関心な', '態度', '、', 'そして', '頼れる', '守護', '聖人', 'が', '誰', 'も', 'い', 'ない', 'ような', '感じ', 'です', '」', '。', '州', '議会', '議員', 'は']",['無関心な'],NO,無関心,NO,YES
126,無関心,。黒人の友人を尋ねたために逮捕された若い神学生。殺人。仲間の聖職者の無関心。店が破壊されるのを恐れて声をあげない実業家。クー・クラックス・クラン。ブル・コナー。ブル,"['。', '黒人', 'の', '友人', 'を', '尋ねた', 'ため', 'に', '逮捕', 'さ', 'れた', '若い', '神学', '生', '。', '殺人', '。', '仲間', 'の', '聖職', '者', 'の', '無関心', '。', '店', 'が', '破壊', 'さ', 'れる', 'の', 'を', '恐れて', '声', 'を', 'あげ', 'ない', '実業', '家', '。', 'クー', '・', 'クラックス', '・', 'クラン', '。', 'ブル', '・', 'コナー', '。', 'ブル']",['無関心'],NO,無関心,NO,NO
127,無関心,）。前掲吉村書は宅地について、日本の律令制国家は租税収取に無関係な土地の班給には無関心であったという。現実は別として律令法上はそのとおりであろう。一般に大差ない,"['）', '。', '前掲', '吉村', '書', 'は', '宅地', 'に', 'ついて', '、', '日本', 'の', '律令', '制', '国家', 'は', '租税', '収', '取', 'に', '無関係な', '土地', 'の', '班', '給', 'に', 'は', '無関心であった', 'と', 'いう', '。', '現実', 'は', '別', 'と', 'して', '律令', '法', '上', 'は', 'その', 'とおり', 'であろう', '。', '一般に', '大差', 'ない']",['無関心であった'],NO,無関心,NO,YES
128,無関心,人々の欲求が極めて多様であり，場合によつては対立したり，ある場合にはお互いに無関心であつたりすることが理解される。そうだとすれば，人々の欲求がわかつたとしても,"['人々', 'の', '欲求', 'が', '極めて', '多様であり', '，', '場合', 'に', 'よつて', 'は', '対立', 'したり', '，', 'ある', '場合', 'に', 'は', 'お互いに', '無関心で', 'あつた', 'りする', 'こと', 'が', '理解', 'さ', 'れる', '。', 'そう', 'だ', 'と', 'すれば', '，', '人々', 'の', '欲求', 'が', 'わかつ', 'た', 'と', 'して', 'も']",['無関心で'],NO,無関心,NO,YES
129,無関心,。もしかしたら、彼は、そうした父親の一方的受容を、自分に対する無関心、事なかれ主義と受け取っていたかもしれない。少なくとも、ちゃんと自分に向き合ってくれない、葛藤し合ってくれない,"['。', 'もしかしたら', '、', '彼', 'は', '、', 'そうした', '父親', 'の', '一方的', '受容', 'を', '、', '自分', 'に', '対する', '無関心', '、', '事なかれ主義', 'と', '受け取って', 'いた', 'かも', 'しれ', 'ない', '。', '少なくとも', '、', 'ちゃんと', '自分', 'に', '向き合って', 'くれ', 'ない', '、', '葛藤', 'し', '合って', 'くれ', 'ない']",['無関心'],NO,無関心,NO,NO
130,無関心,父親が家事や育児に無関心な人だと、息子も将来そうなるのでしょうか？可能性は高いのではないでしょうか。,"['父親', 'が', '家事', 'や', '育児', 'に', '無関心な', '人', 'だ', 'と', '、', '息子', 'も', '将来', 'そう', 'なる', 'のでしょう', 'か', '？', '可能', '性', 'は', '高い', 'ので', 'は', 'ない', 'でしょう', 'か', '。']",['無関心な'],NO,無関心,NO,YES
131,無関心,多いかもしれません。株の貯金をすることで、いままでは「株なんて」という無関心だった自分が自然と株に注目するようになります。その「関心度」が株式投資,"['多い', 'かも', 'しれ', 'ませ', 'ん', '。', '株', 'の', '貯金', 'を', 'する', 'こと', 'で', '、', 'いま', 'まで', 'は', '「', '株', 'なんて', '」', 'と', 'いう', '無関心だった', '自分', 'が', '自然', 'と', '株', 'に', '注目', 'する', 'ように', 'なり', 'ます', '。', 'その', '「', '関心', '度', '」', 'が', '株式', '投資']",['無関心だった'],NO,無関心,NO,YES
132,無関心,しょっちゅうそれを交互に失って堂々めぐりをするなんて、こんなにしょっちゅう欲望と無関心、無関心と欲望の円を描いているなんて、何の意味があるのだ？わたしはホテル,"['しょっちゅう', 'それ', 'を', '交互に', '失って', '堂々めぐり', 'を', 'する', 'なんて', '、', 'こんなに', 'しょっちゅう', '欲望', 'と', '無関心', '、', '無関心', 'と', '欲望', 'の', '円', 'を', '描いて', 'いる', 'なんて', '、', '何の', '意味', 'が', 'ある', 'のだ', '？', 'わたし', 'は', 'ホテル']",['無関心'],NO,無関心,NO,NO
133,無関心,しょっちゅうそれを交互に失って堂々めぐりをするなんて、こんなにしょっちゅう欲望と無関心、無関心と欲望の円を描いているなんて、何の意味があるのだ？わたしはホテル,"['しょっちゅう', 'それ', 'を', '交互に', '失って', '堂々めぐり', 'を', 'する', 'なんて', '、', 'こんなに', 'しょっちゅう', '欲望', 'と', '無関心', '、', '無関心', 'と', '欲望', 'の', '円', 'を', '描いて', 'いる', 'なんて', '、', '何の', '意味', 'が', 'ある', 'のだ', '？', 'わたし', 'は', 'ホテル']",['無関心'],NO,無関心,NO,NO
134,無関心,華々しく日本で宣伝しているＮＧＯなどはこうしたカトマンズのスラムの状況には無関心なのだろうか。村での学校づくりと暇があれば、寄付を募っている日本,"['華々しく', '日本', 'で', '宣伝', 'して', 'いる', 'ＮＧＯ', 'など', 'は', 'こうした', 'カトマンズ', 'の', 'スラム', 'の', '状況', 'に', 'は', '無関心な', 'のだろう', 'か', '。', '村', 'で', 'の', '学校', 'づくり', 'と', '暇', 'が', 'あれば', '、', '寄付', 'を', '募って', 'いる', '日本']",['無関心な'],NO,無関心,NO,YES
135,無関心,、こちらをヅンヅン突いてくるのです。「意識したら痴漢と間違われる！」と無関心を装い、天井の広告に目をやろうとしたのですが…。女性の,"['、', 'こちら', 'を', 'ヅンヅン', '突いて', 'くる', 'のです', '。', '「', '意識', 'したら', '痴漢', 'と', '間違わ', 'れる', '！', '」', 'と', '無関心', 'を', '装い', '、', '天井', 'の', '広告', 'に', '目', 'を', 'やろう', 'と', 'した', 'のです', 'が', '…', '。', '女性', 'の']",['無関心'],NO,無関心,NO,NO
136,無関心,の間にあって、その両者と部分的に重なり合い微妙に交錯しながら、評価についてそもそも無関心、または考えたくない、という消極層が存在することである。・評価されたくもないし,"['の', '間にあって', '、', 'その', '両者', 'と', '部分', '的に', '重なり', '合い', '微妙に', '交錯', 'し', 'ながら', '、', '評価', 'に', 'ついて', 'そもそも', '無関心', '、', 'または', '考え', 'たく', 'ない', '、', 'と', 'いう', '消極', '層', 'が', '存在', 'する', 'こと', 'である', '。', '・', '評価', 'さ', 'れた', 'くも', 'ないし']",['無関心'],NO,無関心,NO,NO
137,無関心,新たな量的自然学を準備するものだったからである。そして、アリストテレス主義に対するデカルトのこうした無関心は、彼が「パドヴァに」―その大学の名声のゆえに―立ち寄ったと,"['新たな', '量的', '自然', '学', 'を', '準備', 'する', 'もの', 'だった', 'から', 'である', '。', 'そして', '、', 'アリストテレス', '主義', 'に', '対する', 'デカルト', 'の', 'こうした', '無関心', 'は', '、', '彼', 'が', '「', 'パドヴァ', 'に', '」', '―', 'その', '大学', 'の', '名声', 'の', 'ゆえ', 'に', '―', '立ち寄った', 'と']",['無関心'],NO,無関心,NO,NO
138,無関心,さながら埃りをかぶった廃屋であった。「君は前にこの家で本に無関心なのはマルガリーテだと言ったことがあるね」「はい、申しました。あの,"['さながら', '埃', 'り', 'を', 'かぶった', '廃屋', 'であった', '。', '「', '君', 'は', '前', 'に', 'この', '家', 'で', '本', 'に', '無関心な', 'の', 'は', 'マルガリーテ', 'だ', 'と', '言った', 'こと', 'が', 'ある', 'ね', '」', '「', 'はい', '、', '申し', 'ました', '。', 'あの']",['無関心な'],NO,無関心,NO,YES
139,無関心,熊笹の原から手をさしのべて叫ぶと、その人はこちらを向いた。無関心な、乾いた木の実のような眼を向けて、彼女をみつめ、またわらびを,"['熊', '笹', 'の', '原', 'から', '手', 'を', 'さしのべて', '叫ぶ', 'と', '、', 'その', '人', 'は', 'こちら', 'を', '向いた', '。', '無関心な', '、', '乾いた', '木', 'の', '実', 'の', 'ような', '眼', 'を', '向けて', '、', '彼女', 'を', 'みつめ', '、', 'また', 'わらび', 'を']",['無関心な'],NO,無関心,NO,YES
140,無関心,ゆっくりつぶやいた。「そうだべな」お鈴婆はふたりの話にもまったく無関心なていで、フトンの底にうずくまってうごかなかった。「ばあさん、気分は,"['ゆっくり', 'つぶやいた', '。', '「', 'そう', 'だ', 'べ', 'な', '」', 'お', '鈴', '婆', 'は', 'ふた', 'り', 'の', '話', 'に', 'も', 'まったく', '無関心な', 'てい', 'で', '、', 'フトン', 'の', '底', 'に', 'うずくまって', 'うごか', 'なかった', '。', '「', 'ばあさん', '、', '気分', 'は']",['無関心な'],NO,無関心,NO,YES
141,無関心,ともにアンジェラの話にも耳をかたむけた。彼女は彼の訪問に対してしだいに無関心ではいられなくなり、それを歓迎するようになったばかりか、ついには次,"['ともに', 'アンジェラ', 'の', '話', 'に', 'も', '耳', 'を', 'かたむけた', '。', '彼女', 'は', '彼', 'の', '訪問', 'に', '対して', 'しだいに', '無関心で', 'は', 'い', 'られ', 'なく', 'なり', '、', 'それ', 'を', '歓迎', 'する', 'ように', 'なった', 'ばかり', 'か', '、', 'ついに', 'は', '次']",['無関心で'],NO,無関心,NO,YES
142,無関心,追いかけた。警官なら一緒にいたほうが安全なのではないか。しかし、彼の無関心な立ち去り方は警官らしからぬ態度にも思える。彼女はためらいながらも、少々間隔を,"['追い', 'かけた', '。', '警官', 'なら', '一緒に', 'いた', 'ほう', 'が', '安全な', 'ので', 'は', 'ない', 'か', '。', 'しかし', '、', '彼', 'の', '無関心な', '立ち去り', '方', 'は', '警官', 'らしから', 'ぬ', '態度', 'に', 'も', '思える', '。', '彼女', 'は', 'ためらい', 'ながら', 'も', '、', '少々', '間隔', 'を']",['無関心な'],NO,無関心,NO,YES
143,無関心,彼らは、彼らの生活原理へと高めた。この濫用は、彼らをあらゆる道徳に対し無関心にした。もちろん、ほとんどだれも知ることはできなかったが、ここでひとり,"['彼', 'ら', 'は', '、', '彼', 'ら', 'の', '生活', '原理', 'へ', 'と', '高めた', '。', 'この', '濫用', 'は', '、', '彼', 'ら', 'を', 'あらゆる', '道徳', 'に', '対し', '無関心に', 'した', '。', 'もちろん', '、', 'ほとんど', 'だれ', 'も', '知る', 'こと', 'は', 'でき', 'なかった', 'が', '、', 'ここ', 'で', 'ひと', 'り']",['無関心に'],NO,無関心,NO,YES
144,無関心,のつきあい方を教えてほしいという依頼が、最も多いものでした。子どものことに無関心（自分のことで精一杯）で、教師の声に耳を貸さない親。教師,"['の', 'つきあい', '方', 'を', '教えて', 'ほしい', 'と', 'いう', '依頼', 'が', '、', '最も', '多い', 'もの', 'でした', '。', '子ども', 'の', 'こと', 'に', '無関心', '（', '自分', 'の', 'こと', 'で', '精一杯', '）', 'で', '、', '教師', 'の', '声', 'に', '耳', 'を', '貸さ', 'ない', '親', '。', '教師']",['無関心'],NO,無関心,NO,NO
145,無関心,、ましてやゲルマント公爵夫人や演劇はそれに輪をかけて―なんと色褪せたもの、無関心なもの、死んだものになってしまうことだろう！それにまた、この結婚問題で,"['、', 'まして', 'や', 'ゲルマント', '公爵', '夫人', 'や', '演劇', 'は', 'それ', 'に', '輪', 'を', 'かけて', '―', 'なんと', '色褪せた', 'もの', '、', '無関心な', 'もの', '、', '死んだ', 'もの', 'に', 'なって', 'しまう', 'こと', 'だろう', '！', 'それ', 'に', 'また', '、', 'この', '結婚', '問題', 'で']",['無関心な'],NO,無関心,NO,YES
146,無関心,くれなかった。彼の手をわたしにさしだすことはなかった。わたしにとってとうてい無関心ではいられないこの謎を解こうとしながら、たっぷり一時間のあいだ、こうし,"['くれ', 'なかった', '。', '彼', 'の', '手', 'を', 'わたし', 'に', 'さしだす', 'こと', 'は', 'なかった', '。', 'わたし', 'に', 'とって', 'とうてい', '無関心で', 'は', 'い', 'られ', 'ない', 'この', '謎', 'を', '解こう', 'と', 'し', 'ながら', '、', 'たっぷり', '一', '時間', 'の', 'あいだ', '、', 'こう', 'し']",['無関心で'],NO,無関心,NO,YES
147,無関心,、それもまた拒否しきれない焦りを社会と共有もしているのである。他人事と、無関心を決め込まないかぎり、断れる理由もまた自分に探せなかった。それは私も,"['、', 'それ', 'も', 'また', '拒否', 'し', 'きれ', 'ない', '焦り', 'を', '社会', 'と', '共有', 'も', 'して', 'いる', 'のである', '。', '他人事', 'と', '、', '無関心', 'を', '決め', '込ま', 'ない', 'かぎり', '、', '断れる', '理由', 'も', 'また', '自分', 'に', '探せ', 'なかった', '。', 'それ', 'は', '私', 'も']",['無関心'],NO,無関心,NO,NO
148,無関心,、あるいはイギリスの保守党も、それからイギリスの労働党、左翼も両方ともが非常に無関心、冷淡だったのです。ところがブレアの新しい労働党（ニューレーバー）が、環境問題を非常に,"['、', 'あるいは', 'イギリス', 'の', '保守', '党', 'も', '、', 'それ', 'から', 'イギリス', 'の', '労働', '党', '、', '左翼', 'も', '両方', 'と', 'も', 'が', '非常に', '無関心', '、', '冷淡だった', 'のです', '。', 'ところが', 'ブレア', 'の', '新しい', '労働', '党', '（', 'ニューレーバー', '）', 'が', '、', '環境', '問題', 'を', '非常に']",['無関心'],NO,無関心,NO,NO
149,無関心,内心喜んで居られたでせう。その頃は弟の英作さんも茶には全く無関心であつたのですが、克徳さんは洋行から帰るのを待ち受けて帰ると直ちに茶の湯の,"['内心', '喜んで', '居ら', 'れた', 'で', 'せ', 'う', '。', 'その頃', 'は', '弟', 'の', '英', '作', 'さん', 'も', '茶', 'に', 'は', '全く', '無関心で', 'あつた', 'のです', 'が', '、', '克', '徳', 'さん', 'は', '洋行', 'から', '帰る', 'の', 'を', '待ち受けて', '帰る', 'と', '直ちに', '茶の湯', 'の']",['無関心で'],NO,無関心,NO,YES
150,無関心,ならないのはもちろんのことである。それぞれのタクトがメスのごとく鋭く生き生きと（無関心であったり、動力的であったり、機械的であったりせずに）弾きおおせられてこそ、つぎつぎ,"['なら', 'ない', 'の', 'は', 'もちろん', 'の', 'こと', 'である', '。', 'それぞれ', 'の', 'タクト', 'が', 'メス', 'の', 'ごとく', '鋭く', '生き生き', 'と', '（', '無関心であったり', '、', '動力', '的であったり', '、', '機械', '的であったり', 'せ', 'ず', 'に', '）', '弾き', 'おおせ', 'られて', 'こそ', '、', 'つぎつぎ']",['無関心であったり'],NO,無関心,NO,YES
151,無関心,」とぼそっと言うようにもなった。だいたいは他人のことにはまるで無関心な彼であるが、ここ何年か、赤ん坊が泣いているのに出くわしたりすると、,"['」', 'と', 'ぼ', 'そっと', '言う', 'ように', 'も', 'なった', '。', 'だいたい', 'は', '他人', 'の', 'こと', 'に', 'は', 'まるで', '無関心な', '彼', 'である', 'が', '、', 'ここ', '何', '年', 'か', '、', '赤ん坊', 'が', '泣いて', 'いる', 'の', 'に', '出くわしたり', 'する', 'と', '、']",['無関心な'],NO,無関心,NO,YES
152,無関心,ても人に聞かないのは弱みを見せたくないから。０４ムキになる、無関心…男のプライドがわかるとき。「自分のプライドに関わることほど男は多弁,"['て', 'も', '人', 'に', '聞か', 'ない', 'の', 'は', '弱', 'み', 'を', '見せ', 'たく', 'ない', 'から', '。', '０４', 'ムキ', 'に', 'なる', '、', '無関心', '…', '男', 'の', 'プライド', 'が', 'わかる', 'とき', '。', '「', '自分', 'の', 'プライド', 'に', '関わる', 'こと', 'ほど', '男', 'は', '多弁']",['無関心'],NO,無関心,NO,NO
153,無関心,のではないかということだ。ところが、厚生省はこうした国民の健康増進志向にはほとんど無関心なのである。提供者側の論理で徹底している。これからはこの一点だけでも直してもらわ,"['ので', 'は', 'ない', 'か', 'と', 'いう', 'こと', 'だ', '。', 'ところが', '、', '厚生', '省', 'は', 'こうした', '国民', 'の', '健康', '増進', '志向', 'に', 'は', 'ほとんど', '無関心な', 'のである', '。', '提供', '者', '側', 'の', '論理', 'で', '徹底', 'して', 'いる', '。', 'これ', 'から', 'は', 'この', '一', '点', 'だけ', 'でも', '直して', 'もらわ']",['無関心な'],NO,無関心,NO,YES
154,無関心,なゆとりがでてきて、しかも諸外国からは日本人は自分のもうけになること以外は無関心、心の豊かになる文化性に冷淡とみられている現実のイメージを改める反省が,"['な', 'ゆとり', 'が', 'でて', 'きて', '、', 'しかも', '諸', '外国', 'から', 'は', '日本', '人', 'は', '自分', 'の', 'もうけ', 'に', 'なる', 'こと', '以外', 'は', '無関心', '、', '心', 'の', '豊かに', 'なる', '文化', '性', 'に', '冷淡', 'と', 'み', 'られて', 'いる', '現実', 'の', 'イメージ', 'を', '改める', '反省', 'が']",['無関心'],NO,無関心,NO,NO
