,compound unit,context,segmented,split units,the unit is split,compound unit form,unexpected segmentation,unexpected joining
0,非合法,オランダでは大麻が合法らしいですが、日本では非合法です。ニュースを読むアナウンサーが、海外での大麻吸引を、テレビで発表したときに,"['オランダ', 'で', 'は', '大麻', 'が', '合法', 'らしい', 'です', 'が', '、', '日本', 'で', 'は', '非合法です', '。', 'ニュース', 'を', '読む', 'アナウンサー', 'が', '、', '海外', 'で', 'の', '大麻', '吸引', 'を', '、', 'テレビ', 'で', '発表', 'した', 'ときに']",['非合法です'],NO,非合法,NO,YES
1,非合法,のです。このときから私とアフメロフとの付き合いがはじまります。アフメロフは、アメリカに非合法の仕事で滞在してすでに四年になっていた。彼は、北京でも一年間、,"['のです', '。', 'この', 'とき', 'から', '私', 'と', 'アフメロフ', 'と', 'の', '付き合い', 'が', 'はじまり', 'ます', '。', 'アフメロフ', 'は', '、', 'アメリカ', 'に', '非合法の', '仕事', 'で', '滞在', 'して', 'すでに', '四', '年', 'に', 'なって', 'いた', '。', '彼', 'は', '、', '北京', 'でも', '一', '年間', '、']",['非合法の'],NO,非合法,NO,YES
2,非合法,として医師の親類や友人に自動車を提供したりする。労働社会問題省は、引退した医師による非合法の診療は無駄遣いだとみなしている。ある論説では、「有料ポリクリニーク」の開始、,"['と', 'して', '医師', 'の', '親類', 'や', '友人', 'に', '自動車', 'を', '提供', 'したり', 'する', '。', '労働', '社会', '問題', '省', 'は', '、', '引退', 'した', '医師', 'に', 'よる', '非合法の', '診療', 'は', '無駄遣い', 'だ', 'と', 'みなして', 'いる', '。', 'ある', '論説', 'で', 'は', '、', '「', '有料', 'ポリクリニーク', '」', 'の', '開始', '、']",['非合法の'],NO,非合法,NO,YES
3,非合法,た場合は、相手にも落度があったと判断される。あるいは、麻薬などの非合法な取引の場でケンカになり、殺してカネを奪って逃げた場合、やはり,"['た', '場合', 'は', '、', '相手', 'に', 'も', '落度', 'が', 'あった', 'と', '判断', 'さ', 'れる', '。', 'あるいは', '、', '麻薬', 'など', 'の', '非合法な', '取引', 'の', '場', 'で', 'ケンカ', 'に', 'なり', '、', '殺して', 'カネ', 'を', '奪って', '逃げた', '場合', '、', 'やはり']",['非合法な'],NO,非合法,NO,YES
4,非合法,が一般的になっている。また、第一次世界大戦以降、版図の拡大を目的とした侵略戦争を非合法とみなす考えが次第に広まり、今では国際社会に定着している。さらに、核兵器に,"['が', '一般', '的に', 'なって', 'いる', '。', 'また', '、', '第', '一', '次', '世界', '大戦', '以降', '、', '版', '図', 'の', '拡大', 'を', '目的', 'と', 'した', '侵略', '戦争', 'を', '非合法', 'と', 'みなす', '考え', 'が', '次第に', '広まり', '、', '今では', '国際', '社会', 'に', '定着', 'して', 'いる', '。', 'さらに', '、', '核', '兵器', 'に']",['非合法'],NO,非合法,NO,NO
5,非合法,など面接をうける会社が勝手に調べることはできるのでしょうか？探偵社にたのめば、非合法なルートで調べることはできますが・・・。勝手にはできませんが,"['など', '面接', 'を', 'うける', '会社', 'が', '勝手に', '調べる', 'こと', 'は', 'できる', 'のでしょう', 'か', '？', '探偵', '社', 'に', 'たのめば', '、', '非合法な', 'ルート', 'で', '調べる', 'こと', 'は', 'でき', 'ます', 'が', '・', '・', '・', '。', '勝手に', 'は', 'でき', 'ませ', 'ん', 'が']",['非合法な'],NO,非合法,NO,YES
6,非合法,に認められた範囲内での取材が発端となっているが、三田事件は、犯人隠避という非合法のところにまで踏み込んで起こったものである。したがって、同列には論じられない。,"['に', '認め', 'られた', '範囲', '内', 'で', 'の', '取材', 'が', '発端', 'と', 'なって', 'いる', 'が', '、', '三田', '事件', 'は', '、', '犯人', '隠避', 'と', 'いう', '非合法の', 'ところ', 'に', 'まで', '踏み込んで', '起こった', 'もの', 'である', '。', 'したがって', '、', '同列', 'に', 'は', '論じ', 'られ', 'ない', '。']",['非合法の'],NO,非合法,NO,YES
7,非合法,くらい、あそこにゃいくらも店がある」「お断りします」「なぜだ。非合法だからってか」「そうじゃない。まず第一に、バカラのルールをよく知ら,"['くらい', '、', 'あそこ', 'に', 'ゃ', 'いくらも', '店', 'が', 'ある', '」', '「', 'お', '断', 'りし', 'ます', '」', '「', 'なぜ', 'だ', '。', '非合法だ', 'から', 'って', 'か', '」', '「', 'そう', 'じゃ', 'ない', '。', 'まず', '第', '一', 'に', '、', 'バカラ', 'の', 'ルール', 'を', 'よく', '知ら']",['非合法だ'],NO,非合法,NO,YES
8,非合法,にかわって国有資産占有者、使用者が反対に現れてくることになる。」合法的流失のみでなく、非合法の流失は、さらに驚くべきほどの多額におよび、大きな問題であるらしいことは,"['にかわ', 'って', '国有', '資産', '占有', '者', '、', '使用', '者', 'が', '反対に', '現れて', 'くる', 'こと', 'に', 'なる', '。', '」', '合', '法的', '流失', 'のみ', 'で', 'なく', '、', '非合法の', '流失', 'は', '、', 'さらに', '驚く', 'べき', 'ほど', 'の', '多額に', 'および', '、', '大きな', '問題', 'である', 'らしい', 'こと', 'は']",['非合法の'],NO,非合法,NO,YES
9,非合法,当たる地上でしか成立しない職業なんだ」治子は木村に対する疑いを、夫が非合法な仕事に巻きこまれるのではないか、という不安に転換することで納得したようであったが,"['当たる', '地上', 'で', 'しか', '成立', 'し', 'ない', '職業', 'な', 'んだ', '」', '治子', 'は', '木村', 'に', '対する', '疑い', 'を', '、', '夫', 'が', '非合法な', '仕事', 'に', '巻き', 'こま', 'れる', 'ので', 'は', 'ない', 'か', '、', 'と', 'いう', '不安に', '転換', 'する', 'こと', 'で', '納得', 'した', 'ようであった', 'が']",['非合法な'],NO,非合法,NO,YES
10,非合法,も存在しているのです。現在、それらの科学者たちは適正な任務に従事し、その仕事自体、非合法ではありませんが、イラクは科学者たちを引き続き、核兵器開発計画を進めるのに都合の良い形で配置し,"['も', '存在', 'して', 'いる', 'のです', '。', '現在', '、', 'それ', 'ら', 'の', '科学', '者', 'たち', 'は', '適正な', '任務', 'に', '従事', 'し', '、', 'その', '仕事', '自体', '、', '非合法で', 'は', 'あり', 'ませ', 'ん', 'が', '、', 'イラク', 'は', '科学', '者', 'たち', 'を', '引き続き', '、', '核', '兵器', '開発', '計画', 'を', '進める', 'の', 'に', '都合', 'の', '良い', '形', 'で', '配置', 'し']",['非合法で'],NO,非合法,NO,YES
11,非合法,もある。「落書き」で罰金刑を受けたことのある作家もいるが、「非合法から生まれたという文脈は踏まえつつも、展示そのものは合法の枠内でやること,"['も', 'ある', '。', '「', '落書き', '」', 'で', '罰金', '刑', 'を', '受けた', 'こと', 'の', 'ある', '作家', 'も', 'いる', 'が', '、', '「', '非合法', 'から', '生まれた', 'と', 'いう', '文脈', 'は', '踏まえ', 'つつ', 'も', '、', '展示', 'そのもの', 'は', '合法', 'の', '枠', '内', 'で', 'やる', 'こと']",['非合法'],NO,非合法,NO,NO
12,非合法,たりして、彼らがガリ版で刷ったビラを配りました。秋田はそのころ非合法な運動となっていた日本労働組合全国協議会傘下の日本金属労働組合の組織者でした。その当時の社会傾向を直接,"['たり', 'して', '、', '彼', 'ら', 'が', 'ガリ', '版', 'で', '刷った', 'ビラ', 'を', '配り', 'ました', '。', '秋田', 'は', 'そのころ', '非合法な', '運動', 'と', 'なって', 'いた', '日本', '労働', '組合', '全国', '協議', '会', '傘下', 'の', '日本', '金属', '労働', '組合', 'の', '組織', '者', 'でした', '。', 'その', '当時', 'の', '社会', '傾向', 'を', '直接']",['非合法な'],NO,非合法,NO,YES
13,非合法,な宝石貴金属店を開きたい夢があり、そのためには、信用できる人間がもちこんでくる非合法の仕事で、余分のドルを稼ぐのをいとわなかった。ルビーの複製を,"['な', '宝石', '貴金属', '店', 'を', '開き', 'たい', '夢', 'が', 'あり', '、', 'その', 'ため', 'に', 'は', '、', '信用', 'できる', '人間', 'が', 'もち', 'こんで', 'くる', '非合法の', '仕事', 'で', '、', '余分の', 'ドル', 'を', '稼ぐ', 'の', 'を', 'いとわ', 'なかった', '。', 'ルビー', 'の', '複製', 'を']",['非合法の'],NO,非合法,NO,YES
14,非合法,求めること。犯人捜査は、そのやり方を知っている人に任せるほうがよいでしょう。●非合法なことや、気まずい思いをさせるようなことをしてはいけません。,"['求める', 'こと', '。', '犯人', '捜査', 'は', '、', 'その', 'やり', '方', 'を', '知って', 'いる', '人', 'に', '任せる', 'ほう', 'が', 'よい', 'でしょう', '。', '●', '非合法な', 'こと', 'や', '、', '気まずい', '思い', 'を', 'さ', 'せる', 'ような', 'こと', 'を', 'して', 'は', 'いけ', 'ませ', 'ん', '。']",['非合法な'],NO,非合法,NO,YES
15,非合法,効率的に，効果的に，そして適切に使われているかを確認する。・連邦政府職員からの非合法で不適切な行為に関する申し立てを調査して，真実を究明する。・連邦法に基づいて，,"['効率', '的に', '，', '効果', '的に', '，', 'そして', '適切に', '使わ', 'れて', 'いる', 'か', 'を', '確認', 'する', '。', '・', '連邦', '政府', '職員', 'から', 'の', '非合法で', '不', '適切な', '行為', 'に', '関する', '申し立て', 'を', '調査', 'して', '，', '真実', 'を', '究明', 'する', '。', '・', '連邦', '法', 'に', '基づいて', '，']",['非合法で'],NO,非合法,NO,YES
16,非合法,は違法でないのか」との指摘を受けた。職業安定法によって、民間の人材派遣業は非合法とされていた。刑務所に入れられるかもしれない。不安が襲った。それからも何度,"['は', '違法で', 'ない', 'の', 'か', '」', 'と', 'の', '指摘', 'を', '受けた', '。', '職業', '安定', '法', 'に', 'よって', '、', '民間', 'の', '人材', '派遣', '業', 'は', '非合法', 'と', 'さ', 'れて', 'いた', '。', '刑務所', 'に', '入れ', 'られる', 'かも', 'しれ', 'ない', '。', '不安', 'が', '襲った', '。', 'それ', 'から', 'も', '何度']",['非合法'],NO,非合法,NO,NO
17,非合法,，内政面では，千九百二十八（昭和３）年に普通選挙による衆議院議員総選挙が実施されると，非合法の日本共産党の活動が活発だったので，田中内閣は総選挙後に治安維持法を発動して，多く,"['，', '内政', '面', 'で', 'は', '，', '千九百二十八', '（', '昭和', '３', '）', '年', 'に', '普通', '選挙', 'に', 'よる', '衆議院', '議員', '総', '選挙', 'が', '実施', 'さ', 'れる', 'と', '，', '非合法の', '日本', '共産党', 'の', '活動', 'が', '活発だった', 'ので', '，', '田中', '内閣', 'は', '総', '選挙', '後', 'に', '治安', '維持', '法', 'を', '発動', 'して', '，', '多く']",['非合法の'],NO,非合法,NO,YES
18,非合法,に成功した子供のように無邪気な微笑みを浮かべる。「向こうにいる時、非合法なビデオで一度見たことがあったんだ。アメリカは性器の露出はＯＫだけど、,"['に', '成功', 'した', '子供', 'の', 'ように', '無邪気な', '微', '笑み', 'を', '浮かべる', '。', '「', '向こう', 'に', 'いる', '時', '、', '非合法な', 'ビデオ', 'で', '一', '度', '見た', 'こと', 'が', 'あった', 'んだ', '。', 'アメリカ', 'は', '性器', 'の', '露出', 'は', 'ＯＫ', 'だ', 'けど', '、']",['非合法な'],NO,非合法,NO,YES
19,非合法,。こうしたメールが、中学生や高校生にも無制限に届けられている。明らかに非合法な物品の販売、出会い系サイトの広告も目立つ。中には経済産業省の表示義務を守った,"['。', 'こうした', 'メール', 'が', '、', '中学生', 'や', '高校', '生', 'に', 'も', '無制限に', '届け', 'られて', 'いる', '。', '明らかに', '非合法な', '物品', 'の', '販売', '、', '出会い', '系', 'サイト', 'の', '広告', 'も', '目立つ', '。', '中', 'に', 'は', '経済', '産業', '省', 'の', '表示', '義務', 'を', '守った']",['非合法な'],NO,非合法,NO,YES
20,非合法,な陳腐な革命は、彼が一番侮蔑していたものだ。革命の真意は、非合法を一挙に合法となすにある。それなら、革命などは、国家権力を合法的に,"['な', '陳腐な', '革命', 'は', '、', '彼', 'が', '一', '番', '侮蔑', 'して', 'いた', 'もの', 'だ', '。', '革命', 'の', '真意', 'は', '、', '非合法', 'を', '一挙に', '合法', 'と', 'なす', 'に', 'ある', '。', 'それ', 'なら', '、', '革命', 'など', 'は', '、', '国家', '権力', 'を', '合法', '的に']",['非合法'],NO,非合法,NO,NO
21,非合法,れた四十九年以後初めて、共産党がまだ国の東部を支配していた八十九年八月に東ドイツで非合法に結成されたドイツ社会民主党の東の代議員も出席した。設定した目標の点で,"['れた', '四十九', '年', '以後', '初めて', '、', '共産党', 'が', 'まだ', '国', 'の', '東部', 'を', '支配', 'して', 'いた', '八十九', '年', '八', '月', 'に', '東', 'ドイツ', 'で', '非合法に', '結成', 'さ', 'れた', 'ドイツ', '社会', '民主党', 'の', '東', 'の', '代議員', 'も', '出席', 'した', '。', '設定', 'した', '目標', 'の', '点', 'で']",['非合法に'],NO,非合法,NO,YES
22,非合法,少なくとも半分はわしのもんやで」あほくさ、私は鼻で笑った。非合法の贋作作りに契約違反もないもんだ。「ひとつ訊きたいんやけどな、この,"['少なくとも', '半分', 'は', 'わし', 'の', 'もん', 'や', 'で', '」', 'あほ', 'くさ', '、', '私', 'は', '鼻', 'で', '笑った', '。', '非合法の', '贋作', '作り', 'に', '契約', '違反', 'も', 'ない', 'もん', 'だ', '。', '「', 'ひと', 'つ', '訊き', 'たい', 'ん', 'やけど', 'な', '、', 'この']",['非合法の'],NO,非合法,NO,YES
23,非合法,ていた徳田・野坂分派が、正規の党の会議などなにもやらないで、自分たちだけで非合法の体制に入り、これが正規の党中央だと称して、全国の党組織をむりやり,"['ていた', '徳田', '・', '野坂', '分派', 'が', '、', '正規の', '党', 'の', '会議', 'など', 'なにも', 'やら', 'ないで', '、', '自分', 'たち', 'だけ', 'で', '非合法の', '体制', 'に', '入り', '、', 'これ', 'が', '正規の', '党', '中央', 'だ', 'と', '称して', '、', '全国', 'の', '党', '組織', 'を', 'むりやり']",['非合法の'],NO,非合法,NO,YES
24,非合法,娯楽系産業は壊滅的被害を被っているが、デリヘルは例外的に勝ち上がった産業であるようだ。単に非合法だと蔑むばかりでは、物事は解決しない。冷静にデリヘルが成長した要因を,"['娯楽', '系', '産業', 'は', '壊滅', '的', '被害', 'を', '被って', 'いる', 'が', '、', 'デリヘル', 'は', '例外', '的に', '勝ち', '上がった', '産業', 'である', 'ようだ', '。', '単に', '非合法だ', 'と', '蔑む', 'ばかりで', 'は', '、', '物事', 'は', '解決', 'し', 'ない', '。', '冷静に', 'デリヘル', 'が', '成長', 'した', '要因', 'を']",['非合法だ'],NO,非合法,NO,YES
25,非合法,た面影の残った、まじめな勉強家であった。彼は大学時代、共産党（当時は非合法）に関係して捕えられて投獄され、また出獄してからもプロレタリア作家同盟に加入して教育部長,"['た', '面影', 'の', '残った', '、', 'まじめな', '勉強', '家', 'であった', '。', '彼', 'は', '大学', '時代', '、', '共産党', '（', '当時', 'は', '非合法', '）', 'に', '関係', 'して', '捕え', 'られて', '投獄', 'さ', 'れ', '、', 'また', '出獄', 'して', 'から', 'も', 'プロレタリア', '作家', '同盟', 'に', '加入', 'して', '教育', '部長']",['非合法'],NO,非合法,NO,NO
26,非合法,から九年後には―もっと早い時期にと期待するが―おそらく大麻は現在のように非合法というよりはむしろヨーロッパ中で正式に受け容れられるようになっているのではないか。私は,"['から', '九', '年', '後', 'に', 'は', '―', 'もっと', '早い', '時期', 'に', 'と', '期待', 'する', 'が', '―', 'おそらく', '大麻', 'は', '現在', 'の', 'ように', '非合法', 'と', 'いう', 'より', 'は', 'むしろ', 'ヨーロッパ', '中', 'で', '正式に', '受け', '容れ', 'られる', 'ように', 'なって', 'いる', 'ので', 'は', 'ない', 'か', '。', '私', 'は']",['非合法'],NO,非合法,NO,NO
27,非合法,のかもしれない。ミーガンは頻繁に世界中を旅しているし、祖母からの遺産を合法か非合法な手段で増やしたいと考えた可能性もある」「ミーガンは犯罪行為にはかかわっ,"['の', 'かも', 'しれ', 'ない', '。', 'ミーガン', 'は', '頻繁に', '世界', '中', 'を', '旅', 'して', 'いる', 'し', '、', '祖母', 'から', 'の', '遺産', 'を', '合法', 'か', '非合法な', '手段', 'で', '増やし', 'たい', 'と', '考えた', '可能', '性', 'も', 'ある', '」', '「', 'ミーガン', 'は', '犯罪', '行為', 'に', 'は', 'かかわっ']",['非合法な'],NO,非合法,NO,YES
28,非合法,―これは一体どう云うことなんだ？君は警察官じゃなかったのか。こんな非合法なことを仕出かして、それで君の公僕としての一分は立つのか？それとも,"['―', 'これ', 'は', '一体', 'どう', '云う', 'こと', 'な', 'んだ', '？', '君', 'は', '警察', '官', 'じゃ', 'なかった', 'の', 'か', '。', 'こんな', '非合法な', 'こと', 'を', '仕出かして', '、', 'それ', 'で', '君', 'の', '公僕', 'と', 'して', 'の', '一', '分', 'は', '立つ', 'の', 'か', '？', 'それとも']",['非合法な'],NO,非合法,NO,YES
29,非合法,二十数年もたつのに、奴隷から解放された黒人（アフリカ系アメリカ人）たちに対して、合法、非合法の差別が頂点に達していた。ハワイ人に対しても、偏見や人種差別意識がこういう,"['二十', '数', '年', 'も', 'たつ', 'のに', '、', '奴隷', 'から', '解放', 'さ', 'れた', '黒人', '（', 'アフリカ', '系', 'アメリカ', '人', '）', 'たち', 'に', '対して', '、', '合法', '、', '非合法の', '差別', 'が', '頂点', 'に', '達して', 'いた', '。', 'ハワイ', '人', 'に', '対して', 'も', '、', '偏見', 'や', '人種', '差別', '意識', 'が', 'こういう']",['非合法の'],NO,非合法,NO,YES
30,非合法,日本国民に知らされました。しかし戦争がおわっても配給は滞り食料品は非合法の闇市や買出しによって手にいれるしかない困難な生活が続きました。,"['日本', '国民', 'に', '知ら', 'さ', 'れ', 'ました', '。', 'しかし', '戦争', 'が', 'おわって', 'も', '配給', 'は', '滞り', '食料', '品', 'は', '非合法の', '闇市', 'や', '買出し', 'に', 'よって', '手', 'に', 'いれる', 'しか', 'ない', '困難な', '生活', 'が', '続き', 'ました', '。']",['非合法の'],NO,非合法,NO,YES
31,非合法,た。しかし今や迷惑メールの大半にわいせつな言葉がちりばめられ、中には明らかに非合法なポルノやわいせつ画像の販売、児童買春向けの出会い系サイトをうたうものもある。東京都内の高校,"['た', '。', 'しかし', '今や', '迷惑', 'メール', 'の', '大半', 'に', 'わいせつな', '言葉', 'が', 'ちりばめ', 'られ', '、', '中', 'に', 'は', '明らかに', '非合法な', 'ポルノ', 'や', 'わいせつ', '画像', 'の', '販売', '、', '児童', '買', '春', '向け', 'の', '出会い', '系', 'サイト', 'を', 'うたう', 'もの', 'も', 'ある', '。', '東京', '都', '内', 'の', '高校']",['非合法な'],NO,非合法,NO,YES
32,非合法,その次の年の初め、あなたのお母さんは、ディヴァチャでユーゴスラヴィアとイタリアの国境を非合法に越えて以来、わたしたちの家にやって来るまでの身の上を、ことこまかに話し,"['その', '次の', '年', 'の', '初め', '、', 'あなた', 'の', 'お', '母さん', 'は', '、', 'ディヴァチャ', 'で', 'ユーゴスラヴィア', 'と', 'イタリア', 'の', '国境', 'を', '非合法に', '越えて', '以来', '、', 'わたし', 'たち', 'の', '家', 'に', 'やって', '来る', 'まで', 'の', '身の上', 'を', '、', 'ことこまかに', '話し']",['非合法に'],NO,非合法,NO,YES
33,非合法,カイロ大学の医学部を卒業して外科医となった。その一方で、十五歳で、当時、非合法だったムスリム同胞団に加入、イスラム原理主義に傾倒、その後、より過激な革命路線をとるジハード団,"['カイロ', '大学', 'の', '医学部', 'を', '卒業', 'して', '外科', '医', 'と', 'なった', '。', 'その', '一方', 'で', '、', '十五', '歳', 'で', '、', '当時', '、', '非合法だった', 'ムスリム', '同胞', '団', 'に', '加入', '、', 'イスラム', '原理', '主義', 'に', '傾倒', '、', 'その後', '、', 'より', '過激な', '革命', '路線', 'を', 'とる', 'ジハード', '団']",['非合法だった'],NO,非合法,NO,YES
34,非合法,昭和三十三年に売春防止法ができるまでは、この場所には通称「青線」と呼ばれる非合法な売春宿があったりもしました。このゴールデン街は、非常に多くの作家,"['昭和', '三十三', '年', 'に', '売春', '防止', '法', 'が', 'できる', 'まで', 'は', '、', 'この', '場所', 'に', 'は', '通称', '「', '青', '線', '」', 'と', '呼ば', 'れる', '非合法な', '売春', '宿', 'が', 'あったり', 'も', 'し', 'ました', '。', 'この', 'ゴールデン', '街', 'は', '、', '非常に', '多く', 'の', '作家']",['非合法な'],NO,非合法,NO,YES
35,非合法,『ＢＢ』流出による国益の失墜などは、二義的なものでしかないのだから。彼らが非合法の手を動かせば、トゥエルブの命などは簡単に消し飛ぶ。決められたシナリオから,"['『', 'ＢＢ', '』', '流出', 'に', 'よる', '国益', 'の', '失墜', 'など', 'は', '、', '二', '義', '的な', 'もの', 'で', 'しか', 'ない', 'のだ', 'から', '。', '彼', 'ら', 'が', '非合法の', '手', 'を', '動かせば', '、', 'トゥエルブ', 'の', '命', 'など', 'は', '簡単に', '消し飛ぶ', '。', '決め', 'られた', 'シナリオ', 'から']",['非合法の'],NO,非合法,NO,YES
36,非合法,によって国際テロで有罪を宣告され―裁判所の言い方では、政治的目的のため「力の非合法な行使」に対し―これらの犯罪を中止し、相当額の賠償金を支払うよう命令された,"['に', 'よって', '国際', 'テロ', 'で', '有罪', 'を', '宣告', 'さ', 'れ', '―', '裁判', '所', 'の', '言い', '方', 'で', 'は', '、', '政治', '的', '目的', 'の', 'ため', '「', '力', 'の', '非合法な', '行使', '」', 'に', '対し', '―', 'これ', 'ら', 'の', '犯罪', 'を', '中止', 'し', '、', '相当', '額', 'の', '賠償', '金', 'を', '支払う', 'よう', '命令', 'さ', 'れた']",['非合法な'],NO,非合法,NO,YES
