37,非合法,た。やがて多くのポリスでは，僭主とよばれる独裁者が，平民の支持により非合法に政権を奪取して僭主政治を実現した。アテネの僭主ペイシストラトスは，中小農民を保護するなど平民層,"['た', '。', 'やがて', '多く', 'の', 'ポリス', 'で', 'は', '，', '僭主', 'と', 'よば', 'れる', '独裁', '者', 'が', '，', '平民', 'の', '支持', 'に', 'より', '非合法に', '政権', 'を', '奪取', 'して', '僭主', '政治', 'を', '実現', 'した', '。', 'アテネ', 'の', '僭主', 'ペイシストラトス', 'は', '，', '中小', '農民', 'を', '保護', 'する', 'など', '平民', '層']",['非合法に'],NO,非合法,NO,YES
38,非合法,作家の多くは二十代後半で女性は２人。９月中旬に制作が始まった当初は、非合法と勘違いされて通報され、警察官に取り囲まれたこともあった。グラフィティは六十年代末の,"['作家', 'の', '多く', 'は', '二十', '代', '後半', 'で', '女性', 'は', '２', '人', '。', '９', '月', '中旬', 'に', '制作', 'が', '始まった', '当初', 'は', '、', '非合法', 'と', '勘違い', 'さ', 'れて', '通報', 'さ', 'れ', '、', '警察', '官', 'に', '取り囲ま', 'れた', 'こと', 'も', 'あった', '。', 'グラフィティ', 'は', '六十', '年', '代', '末', 'の']",['非合法'],NO,非合法,NO,NO
39,非合法,は本当に色々あるので一概に言えません。もちろん「合法」な方法も「非合法」な方法も色々。あとは、自分にあった方法を自分で探すしかないです,"['は', '本当に', '色々', 'ある', 'ので', '一概に', '言え', 'ませ', 'ん', '。', 'もちろん', '「', '合法', '」', 'な', '方法', 'も', '「', '非合法', '」', 'な', '方法', 'も', '色々', '。', 'あと', 'は', '、', '自分', 'に', 'あった', '方法', 'を', '自分', 'で', '探す', 'しか', 'ないで', 'す']",['非合法'],NO,非合法,NO,NO
40,非合法,殞す」ことだとして、許されなかった。当時のパリやロンドンには非合法な形で海を渡って来た武士たちもいた。薩摩や長州から密出国してきた,"['殞', 'す', '」', 'こと', 'だ', 'と', 'して', '、', '許さ', 'れ', 'なかった', '。', '当時', 'の', 'パリ', 'や', 'ロンドン', 'に', 'は', '非合法な', '形', 'で', '海', 'を', '渡って', '来た', '武士', 'たち', 'も', 'いた', '。', '薩摩', 'や', '長', '州', 'から', '密', '出国', 'して', 'きた']",['非合法な'],NO,非合法,NO,YES
41,非合法,ですが、義理事や当番とかが無いときは、みんなそれぞれの仕事（合法、非合法合わせて）をしてますよ。お金に対して執着が強い人が多いので一般社会に,"['ですが', '、', '義', '理事', 'や', '当番', 'と', 'か', 'が', '無い', 'とき', 'は', '、', 'みんな', 'それぞれ', 'の', '仕事', '（', '合法', '、', '非合法', '合わせて', '）', 'を', 'して', 'ます', 'よ', '。', 'お', '金', 'に', '対して', '執着', 'が', '強い', '人', 'が', '多い', 'ので', '一般', '社会', 'に']",['非合法'],NO,非合法,NO,NO
42,非合法,しめしている。さらに、こうした武器の使用を主張するだけで、軍は劣化ウラン弾を非合法の大量破壊兵器に認定した千九百九十六年の国連決議を意図的に愚弄することになるのである。劣化ウラン、別名ウラン二百三十八,"['しめして', 'いる', '。', 'さらに', '、', 'こうした', '武器', 'の', '使用', 'を', '主張', 'する', 'だけ', 'で', '、', '軍', 'は', '劣化', 'ウラン', '弾', 'を', '非合法の', '大量', '破壊', '兵器', 'に', '認定', 'した', '千九百九十六', '年', 'の', '国連', '決議', 'を', '意図', '的に', '愚', '弄する', 'こと', 'に', 'なる', 'のである', '。', '劣化', 'ウラン', '、', '別名', 'ウラン', '二百三十八']",['非合法の'],NO,非合法,NO,YES
43,非合法,作品が描かれている。公共空間の「落書き」が「芸術」になりうるのか。非合法の落書きが公認されるとき、そのエネルギーは維持されるのか。（鈴木京一）ＪＲ水戸駅前,"['作品', 'が', '描か', 'れて', 'いる', '。', '公共', '空間', 'の', '「', '落書き', '」', 'が', '「', '芸術', '」', 'に', 'なり', 'うる', 'の', 'か', '。', '非合法の', '落書き', 'が', '公認', 'さ', 'れる', 'とき', '、', 'その', 'エネルギー', 'は', '維持', 'さ', 'れる', 'の', 'か', '。', '（', '鈴木', '京', '一', '）', 'ＪＲ', '水戸', '駅前']",['非合法の'],NO,非合法,NO,YES
44,非合法,五日、条例案を再修正し、不満の「ガス抜き」を図った。内容は、中国で非合法の団体の香港支部を取り締まる条文の削除や機密の暴露に関し、メディアの利益を,"['五', '日', '、', '条例', '案', 'を', '再', '修正', 'し', '、', '不満の', '「', 'ガス', '抜き', '」', 'を', '図った', '。', '内容', 'は', '、', '中国', 'で', '非合法の', '団体', 'の', '香港', '支部', 'を', '取り締まる', '条文', 'の', '削除', 'や', '機密', 'の', '暴露', 'に', '関し', '、', 'メディア', 'の', '利益', 'を']",['非合法の'],NO,非合法,NO,YES
45,非合法,の、稀有な宝が満ちているように思われた。わたしは、その全体が非合法の存在たる宣告を受けていたこの国民の中で自分がひとり自由な人間である,"['の', '、', '稀有', 'な', '宝', 'が', '満ちて', 'いる', 'ように', '思わ', 'れた', '。', 'わたし', 'は', '、', 'その', '全体', 'が', '非合法の', '存在', 'たる', '宣告', 'を', '受けて', 'いた', 'この', '国民', 'の', '中', 'で', '自分', 'が', 'ひと', 'り', '自由な', '人間', 'である']",['非合法の'],NO,非合法,NO,YES
46,非合法,「それから」になど、到底大きな期待はできないからだ。日本では非合法の存在。さりとてバングラデシュに、明るい未来と自分の居場所があるのだろうかと考えだすと,"['「', 'それ', 'から', '」', 'に', 'など', '、', '到底', '大きな', '期待', 'は', 'でき', 'ない', 'から', 'だ', '。', '日本', 'で', 'は', '非合法の', '存在', '。', 'さりとて', 'バングラデシュ', 'に', '、', '明るい', '未来', 'と', '自分', 'の', '居場所', 'が', 'ある', 'のだろう', 'か', 'と', '考え', 'だす', 'と']",['非合法の'],NO,非合法,NO,YES
47,非合法,のクルド族が罹災難民となってイラン・トルコに流出した。ＥＣ域内の外国人労働者は、合法八百二十万人、非合法約三百万人の約千百二十万人といわれる。さらにソ連邦の解体、東欧の自由化に伴って、主,"['の', 'クルド', '族', 'が', '罹災', '難民', 'と', 'なって', 'イラン', '・', 'トルコ', 'に', '流出', 'した', '。', 'ＥＣ', '域', '内', 'の', '外国', '人', '労働', '者', 'は', '、', '合法', '八百二十万', '人', '、', '非合法', '約', '三百万', '人', 'の', '約', '千百二十万', '人', 'と', 'いわ', 'れる', '。', 'さらに', 'ソ連', '邦', 'の', '解体', '、', '東', '欧', 'の', '自由', '化', 'に', '伴って', '、', '主']",['非合法'],NO,非合法,NO,NO
48,非合法,ライブハウス経営者の能勢伊勢雄さんは「グラフィティは公共空間で自由にものが言えなくなることに対する異議申し立て。非合法な領域を通ってきたからこその造形であり、単なる芸術としてのみ見てほしくない」,"['ライブハウス', '経営', '者', 'の', '能勢', '伊勢', '雄', 'さん', 'は', '「', 'グラフィティ', 'は', '公共', '空間', 'で', '自由に', 'もの', 'が', '言え', 'なく', 'なる', 'こと', 'に', '対する', '異議', '申し立て', '。', '非合法な', '領域', 'を', '通って', 'きた', 'から', 'こそ', 'の', '造形', 'であり', '、', '単なる', '芸術', 'と', 'して', 'のみ', '見て', 'ほしく', 'ない', '」']",['非合法な'],NO,非合法,NO,YES
49,非合法,落書きか芸術か水戸市街で「公認グラフィティ」三十八作家が展覧会４日までどうなる「非合法ならではの力」水戸市中心部が今、「落書きの街」になっている。,"['落書き', 'か', '芸術', 'か', '水戸', '市街', 'で', '「', '公認', 'グラフィティ', '」', '三十八', '作家', 'が', '展覧', '会', '４', '日', 'まで', 'どう', 'なる', '「', '非合法', 'ならでは', 'の', '力', '」', '水戸', '市', '中心', '部', 'が', '今', '、', '「', '落書き', 'の', '街', '」', 'に', 'なって', 'いる', '。']",['非合法'],NO,非合法,NO,NO
50,非合法,が大祭司であり、サンヒドリンの議長役をつとめていた。エルサレムを脱出したサンヒドリンは、非合法のユダヤ地下政府となって、まずジャッファ（現在のテルアビブ）にその姿をあらわした。,"['が', '大祭司', 'であり', '、', 'サンヒドリン', 'の', '議長', '役', 'を', 'つとめて', 'いた', '。', 'エルサレム', 'を', '脱出', 'した', 'サンヒドリン', 'は', '、', '非合法の', 'ユダヤ', '地下', '政府', 'と', 'なって', '、', 'まず', 'ジャッファ', '（', '現在', 'の', 'テルアビブ', '）', 'に', 'その', '姿', 'を', 'あらわした', '。']",['非合法の'],NO,非合法,NO,YES
51,非合法,あったということのようだ。日本の企業は現地政府と協力して、こうした非合法の組織を地道につぶす作業をしていく他はない。もっとも、知的財産権の問題,"['あった', 'と', 'いう', 'こと', 'の', 'ようだ', '。', '日本', 'の', '企業', 'は', '現地', '政府', 'と', '協力', 'して', '、', 'こうした', '非合法の', '組織', 'を', '地道に', 'つぶす', '作業', 'を', 'して', 'いく', '他', 'は', 'ない', '。', 'もっとも', '、', '知的', '財産', '権', 'の', '問題']",['非合法の'],NO,非合法,NO,YES
52,非合法,の調達について思いを巡らせていた。ロンドンのヴェテランの要求を満たすには、非合法ぎりぎりまで踏み込まねばならない。それに一見単純なようだが、いざとなれば生命が,"['の', '調達', 'に', 'ついて', '思い', 'を', '巡ら', 'せて', 'いた', '。', 'ロンドン', 'の', 'ヴェテラン', 'の', '要求', 'を', '満たす', 'に', 'は', '、', '非合法', 'ぎりぎり', 'まで', '踏み込ま', 'ねば', 'なら', 'ない', '。', 'それ', 'に', '一見', '単純な', 'ようだ', 'が', '、', 'いざ', 'と', 'なれば', '生命', 'が']",['非合法'],NO,非合法,NO,NO
53,非合法,さえ用意すれば搾取し放題、儲かってしかたがないではないか。逆にいえば非合法な仕事だけに労働基準監督官とやらも関知しないのだろう。つまり、やりたい放題である。,"['さえ', '用意', 'すれば', '搾取', 'し', '放題', '、', '儲かって', 'しかたがない', 'で', 'は', 'ない', 'か', '。', '逆に', 'いえば', '非合法な', '仕事', 'だけ', 'に', '労働', '基準', '監督', '官', 'と', 'やら', 'も', '関知', 'し', 'ない', 'のだろう', '。', 'つまり', '、', 'やり', 'たい', '放題', 'である', '。']",['非合法な'],NO,非合法,NO,YES
54,非合法,ある（☞ｐｐ．百十九―二十）。しかし，移民の一部は，「非合法」のまま国境を越える。非合法外国人労働者は，自己の所得機会を極大化するため，各国の労働市場,"['ある', '（', '☞', 'ｐｐ', '．', '百十九', '―', '二十', '）', '。', 'しかし', '，', '移民', 'の', '一部', 'は', '，', '「', '非合法', '」', 'の', 'まま', '国境', 'を', '越える', '。', '非合法', '外国', '人', '労働', '者', 'は', '，', '自己', 'の', '所得', '機会', 'を', '極', '大', '化', 'する', 'ため', '，', '各国', 'の', '労働', '市場']",['非合法'],NO,非合法,NO,NO
55,非合法,ある（☞ｐｐ．百十九―二十）。しかし，移民の一部は，「非合法」のまま国境を越える。非合法外国人労働者は，自己の所得機会を極大化するため，各国の労働市場,"['ある', '（', '☞', 'ｐｐ', '．', '百十九', '―', '二十', '）', '。', 'しかし', '，', '移民', 'の', '一部', 'は', '，', '「', '非合法', '」', 'の', 'まま', '国境', 'を', '越える', '。', '非合法', '外国', '人', '労働', '者', 'は', '，', '自己', 'の', '所得', '機会', 'を', '極', '大', '化', 'する', 'ため', '，', '各国', 'の', '労働', '市場']",['非合法'],NO,非合法,NO,NO
56,非合法,ていた。元々は幻獣との共生を主張する穏健な人々だったが、各国で非合法とされ、徹底した弾圧を受けるようになってから武装するようになった。,"['ていた', '。', '元々', 'は', '幻', '獣', 'と', 'の', '共生', 'を', '主張', 'する', '穏健な', '人々', 'だった', 'が', '、', '各国', 'で', '非合法', 'と', 'さ', 'れ', '、', '徹底', 'した', '弾圧', 'を', '受ける', 'ように', 'なって', 'から', '武装', 'する', 'ように', 'なった', '。']",['非合法'],NO,非合法,NO,NO
57,非合法,が、知った。あとからおもえば、それはぼくの最初の秘密というか非合法というか、かくれてしなければならないことの体験でもあった。（６）,"['が', '、', '知った', '。', 'あと', 'から', 'おもえば', '、', 'それ', 'は', 'ぼく', 'の', '最初の', '秘密', 'と', 'いう', 'か', '非合法', 'と', 'いう', 'か', '、', 'かくれて', 'し', 'なければ', 'なら', 'ない', 'こと', 'の', '体験', 'で', 'も', 'あった', '。', '（', '６', '）']",['非合法'],NO,非合法,NO,NO
58,非合法,にアイディードは、イリーガルな企業家にとっても、正当なビジネスマンにとっても目障りな存在にちがいない。非合法な連中にとっては仲間に加わらない限り、いつ旨い汁を吸いとられるかわからず、,"['に', 'アイディード', 'は', '、', 'イリーガル', 'な', '企業', '家', 'に', 'とって', 'も', '、', '正当な', 'ビジネスマン', 'に', 'とって', 'も', '目障りな', '存在', 'に', 'ちがいない', '。', '非合法な', '連中', 'に', 'とって', 'は', '仲間', 'に', '加わら', 'ない', '限り', '、', 'いつ', '旨い', '汁', 'を', '吸いとら', 'れる', 'か', 'わから', 'ず', '、']",['非合法な'],NO,非合法,NO,YES
59,非合法,は台湾製との指摘も）、偽証明書類、誘拐されてきた人間など、ありとあらゆる非合法「商品」が売買され、詐欺師の類も多い。春節（旧正月）前後のラッシュ時,"['は', '台湾', '製', 'と', 'の', '指摘', 'も', '）', '、', '偽証', '明', '書類', '、', '誘拐', 'さ', 'れて', 'きた', '人間', 'など', '、', 'ありとあらゆる', '非合法', '「', '商品', '」', 'が', '売買', 'さ', 'れ', '、', '詐欺', '師', 'の', '類', 'も', '多い', '。', '春節', '（', '旧', '正月', '）', '前後', 'の', 'ラッシュ', '時']",['非合法'],NO,非合法,NO,NO
60,非合法,、判例や修正によって張りぼてになった法律はミイラの山であり、何をしたら非合法なのか、最初から明確ではなくなってしまう。何が合法で何が不法か,"['、', '判例', 'や', '修正', 'に', 'よって', '張り', 'ぼ', 'て', 'に', 'なった', '法律', 'は', 'ミイラ', 'の', '山', 'であり', '、', '何', 'を', 'したら', '非合法な', 'の', 'か', '、', '最初', 'から', '明確で', 'は', 'なく', 'なって', 'しまう', '。', '何', 'が', '合法で', '何', 'が', '不法', 'か']",['非合法な'],NO,非合法,NO,YES
61,非合法,さなかには、一回三十ドルから四十ドルという金は、大金だったのだ。彼は、非合法の無謀な地方レースで三百回以上も優勝している。ボブは、ナスカー・グランド・ナショナル・シリーズとして知られるようになる,"['さなか', 'に', 'は', '、', '一', '回', '三十', 'ドル', 'から', '四十', 'ドル', 'と', 'いう', '金', 'は', '、', '大金', 'だった', 'のだ', '。', '彼', 'は', '、', '非合法の', '無謀な', '地方', 'レース', 'で', '三百', '回', '以上', 'も', '優勝', 'して', 'いる', '。', 'ボブ', 'は', '、', 'ナスカー', '・', 'グランド', '・', 'ナショナル', '・', 'シリーズ', 'と', 'して', '知ら', 'れる', 'ように', 'なる']",['非合法の'],NO,非合法,NO,YES
62,非合法,な発掘と偽物作りのテンポで、ルクソールはぶんぶん唸るほどの活気を呈していた。非合法の発掘屋たちは、知事を恐れてびくびくもので暮していたが、それでも過去何世紀も,"['な', '発掘', 'と', '偽物', '作り', 'の', 'テンポ', 'で', '、', 'ルクソール', 'は', 'ぶん', 'ぶん', '唸る', 'ほど', 'の', '活気', 'を', '呈して', 'いた', '。', '非合法の', '発掘', '屋', 'たち', 'は', '、', '知事', 'を', '恐れて', 'びくびく', 'もの', 'で', '暮して', 'いた', 'が', '、', 'それ', 'でも', '過去', '何', '世紀', 'も']",['非合法の'],NO,非合法,NO,YES
63,非合法,を怒らせることなんか気にしない。捜査を進展させられるなら、合法だろうが非合法だろうが、なんでもオーケー。ほら、マーティン・ルーサー・キングも言ってるでしょ？」「“わたしに,"['を', '怒ら', 'せる', 'こと', 'なんか', '気', 'に', 'し', 'ない', '。', '捜査', 'を', '進展', 'さ', 'せ', 'られる', 'なら', '、', '合法だろう', 'が', '非合法だろう', 'が', '、', 'なんでも', 'オーケー', '。', 'ほら', '、', 'マーティン', '・', 'ルーサー', '・', 'キング', 'も', '言って', 'る', 'でしょ', '？', '」', '「', '“', 'わたし', 'に']",['非合法だろう'],NO,非合法,NO,YES
64,非合法,に手渡したいと亮介は思った。だが方法がない。やるならＤＤＲ体制に対する挑戦として非合法に外貨をもち込むしかない。もちろん発覚すれば重大経済事犯である。もっとも亮介は外交特権に保護される外交官,"['に', '手渡し', 'たい', 'と', '亮介', 'は', '思った', '。', 'だが', '方法', 'が', 'ない', '。', 'やる', 'なら', 'ＤＤＲ', '体制', 'に', '対する', '挑戦', 'と', 'して', '非合法に', '外貨', 'を', 'もち', '込む', 'しか', 'ない', '。', 'もちろん', '発覚', 'すれば', '重大', '経済', '事犯', 'である', '。', 'もっとも', '亮介', 'は', '外交', '特権', 'に', '保護', 'さ', 'れる', '外交', '官']",['非合法に'],NO,非合法,NO,YES
65,非合法,、森川寅平などで構成し全協へ加入した。しかし、三．一五、四．一六の大弾圧で全協は非合法に追いこまれた。合法・非合法の対立が続き合法組織を主張した中原健次は昭和六年十月除名さ,"['、', '森川', '寅', '平', 'など', 'で', '構成', 'し', '全', '協', 'へ', '加入', 'した', '。', 'しかし', '、', '三', '．', '一五', '、', '四', '．', '一六', 'の', '大', '弾圧', 'で', '全', '協', 'は', '非合法に', '追い', 'こま', 'れた', '。', '合法', '・', '非合法の', '対立', 'が', '続き', '合法', '組織', 'を', '主張', 'した', '中原', '健次', 'は', '昭和', '六', '年', '十', '月', '除名', 'さ']",['非合法に'],NO,非合法,NO,YES
66,非合法,、森川寅平などで構成し全協へ加入した。しかし、三．一五、四．一六の大弾圧で全協は非合法に追いこまれた。合法・非合法の対立が続き合法組織を主張した中原健次は昭和六年十月除名さ,"['、', '森川', '寅', '平', 'など', 'で', '構成', 'し', '全', '協', 'へ', '加入', 'した', '。', 'しかし', '、', '三', '．', '一五', '、', '四', '．', '一六', 'の', '大', '弾圧', 'で', '全', '協', 'は', '非合法に', '追い', 'こま', 'れた', '。', '合法', '・', '非合法の', '対立', 'が', '続き', '合法', '組織', 'を', '主張', 'した', '中原', '健次', 'は', '昭和', '六', '年', '十', '月', '除名', 'さ']",['非合法の'],NO,非合法,NO,YES
67,非合法,が動かなかった見返りに、もともと自国の領土ではない地域をヒトラーがムッソリーニに非合法に譲ろうとしたからである。そこで第二次大戦後すぐ、オーストリア臨時政府は南ティロルの住民投票を要求し,"['が', '動か', 'なかった', '見返り', 'に', '、', 'もともと', '自国', 'の', '領土', 'で', 'は', 'ない', '地域', 'を', 'ヒトラー', 'が', 'ムッソリーニ', 'に', '非合法に', '譲ろう', 'と', 'した', 'から', 'である', '。', 'そこ', 'で', '第', '二', '次', '大戦', '後', 'すぐ', '、', 'オーストリア', '臨時', '政府', 'は', '南', 'ティロル', 'の', '住民', '投票', 'を', '要求', 'し']",['非合法に'],NO,非合法,NO,YES
68,非合法,靴をはいたり洋服を着たりしません、と誓わされたのである。一方、非合法に海を渡ってきた薩摩などの留学生は、それに比べてはるかに自由で,"['靴', 'を', 'はいたり', '洋服', 'を', '着たり', 'し', 'ませ', 'ん', '、', 'と', '誓わ', 'さ', 'れた', 'のである', '。', '一方', '、', '非合法に', '海', 'を', '渡って', 'きた', '薩摩', 'など', 'の', '留学', '生', 'は', '、', 'それ', 'に', '比べて', 'はるかに', '自由で']",['非合法に'],NO,非合法,NO,YES
69,非合法,」、「自警団」、ナチ党もその一つである国粋主義を標榜するさまざまな小政党、準軍事組織、非合法の軍隊に押し寄せた。反逆者あるいは国家にとって危険な人物と見なした者にたいして,"['」', '、', '「', '自警', '団', '」', '、', 'ナチ', '党', 'も', 'その', '一', 'つ', 'である', '国粋', '主義', 'を', '標榜', 'する', 'さまざまな', '小', '政党', '、', '準', '軍事', '組織', '、', '非合法の', '軍隊', 'に', '押し寄せた', '。', '反逆', '者', 'あるいは', '国家', 'に', 'とって', '危険な', '人物', 'と', '見なした', '者', 'に', 'たいして']",['非合法の'],NO,非合法,NO,YES
70,非合法,を撲滅するという道徳教化的側面とがあった。しかし、教皇ピウス九世（在位千八百四十六〜七十八年）は売春自体が非合法であるとの立場から不干渉の姿勢を堅持しており、教会としてはもちろんのこと、何ら,"['を', '撲滅', 'する', 'と', 'いう', '道徳', '教', '化', '的', '側面', 'と', 'が', 'あった', '。', 'しかし', '、', '教皇', 'ピウス', '九', '世', '（', '在位', '千八百四十六', '〜', '七十八', '年', '）', 'は', '売春', '自体', 'が', '非合法である', 'と', 'の', '立場', 'から', '不', '干渉', 'の', '姿勢', 'を', '堅持', 'して', 'おり', '、', '教会', 'と', 'して', 'は', 'もちろん', 'の', 'こと', '、', '何ら']",['非合法である'],NO,非合法,NO,YES
71,非合法,のです。ミサイル部品の製造は禁止項目に含まれる技術ですから、このような行為は非合法であり、経済制裁違反であり、国連決議違反でもありました。理論的にいえば、イラクは安保理,"['のです', '。', 'ミサイル', '部品', 'の', '製造', 'は', '禁止', '項目', 'に', '含ま', 'れる', '技術', 'です', 'から', '、', 'このような', '行為', 'は', '非合法であり', '、', '経済', '制裁', '違反', 'であり', '、', '国連', '決議', '違反', 'で', 'も', 'あり', 'ました', '。', '理論', '的に', 'いえば', '、', 'イラク', 'は', '安保理']",['非合法であり'],NO,非合法,NO,YES
