,0
114,の技術、知識、人格等を要求され、かつ、指導員は教習生および経営者や幹部職員と善良な人間的な信頼関係を保持する必要がある」ことを重視して重大な背信行為であると評価し
115,に陽気な口調に戻った。「あなたはどうなの、ノア？まじめで善良な牧場向きの女性を見つけたの？」「いいや」またもキーリーはノアの
116,天的となるまでの修業は、なかなかひととおりではなく、この世にいろいろの不幸があり、善良な人がさまざまの難儀に出会うのも、ひとつには、副守霊を浄化し向上せしめる
117,この世でお目にかかったことはございません！貴方がたのようにご親切な、善良な、そして勇敢な方々は、いまだかつて一度もこの世に姿を見せたためしは
118,♣とばくやお妾さんの契約は無効それからまた，契約の目的が公の秩序や善良の風俗に反する場合も，その契約は無効とされます（民法九十条）。
119,で男のびっくりしたような顔がうかんだ。歳は三十くらいだろうか。ごくごく善良な市民のような顔つきだ。服装は、黒っぽいウインドブレーカーに、茶色のズボンをはい
120,わかったような説明ですが，よく考えてみると「正常な性的な羞恥心」「善良な性的道義観念」などは，個々の人にとって大きく異なるものですし，また，社会の
121,ので，まず借主の目的物保管・保存義務について述べる。Ⅰ目的物の保管・保存義務（１）借主は善良なる管理者の注意をもって保管する義務を負う（四百）。（２）目的物の保存義務
122,ない、という問題ではありませんよ。。。整理すると、賃借人には「善良なる管理者としての注意義務」が課されます。平たく言うと、故意・過失・規約違反による傷や汚れ
123,効力においては，債務者の注意義務が軽減され，担保責任が緩和されている。有償契約では善良なる管理者の注意義務が要求されるが，無償契約では自己の財産におけると同一の
124,運転者に対しても危険や迷惑を及ぼす暴走族，覚せい剤使用運転者等の危険な運転者を的確に排除し，善良な運転者による安全で快適なくるま社会をつくっていく必要がある。自動車等の運転上危険性
125,こう言った。「みなさん、どうぞおかけになってくだされ。会議はただちに始まりますからな。善良にして有徳なる国王を愛おしむ者ならみな、この地の植民地が忠誠を尽くす
126,たってわたしは日本人なんだし」と説明すると、相手は好意を裏切られた善良な羊のような、きょとんとした顔をする。さらに彼らは、筆者の日本側
127,の峰の部分であり、事件や事故に強い警察、犯罪者からは怖れられる警察、善良な市民からは力量・執行力を頼りにされる警察、これを目指さなければなりません
128,―あさのなかのよもぎ―【意味】善良な人とつき合えばその人に感化され、特に教育しなくても自然によい人
129,ずにいられなかったでしょう。ですが、ぼくはあくまで驢馬の味方です。驢馬は善良で有益な人間です」「じゃ公爵、あなたは善良な人間ですか？
130,冷静な方々です。世の中には様々な人がいるわけで、つまりここでいかに善良な皆さんの意見に沿って行動されても、あなたの相手が著しく常識を逸脱し
131,、公平かつ誠実に前条の行為をしなければならない。２保護機構は、保護機構代理保険契約者に対し、善良な管理者の注意をもって前条の行為をしなければならない。（届出に係る事項の変更）
132,します。とはいえ、兄は怒りっぽい人ではありませんでした。辛抱強くて、きわめて善良な性質であり、たとえ叱られたり叩かれたりしても、それが誰であろうと
133,どうしようもない、困った人なのでございます。とはいっても底抜けに善良な人だもので、それに研究業績もあがり、主人自身は終生万年助手でいたかった
134,には、エリートたらんとする前に知性と教養の備わった、国を愛する善良な市民になってくれたら…と願う。そして、「自立心」を大事にし
135,地獄の大天使のもくろみを台無しにしてしまった。組織の悪党に支配されていた善良なメンバーが、陰にこもった憎悪の念を指導者たち〔マッツィーニ派〕に抱くように
136,食んでいた。その息子は器用で頭のよい若者であったが、その地の善良なキリシタンの一人である卜ジョアンという家臣からしばしばデウスのことを聞くに及んで、（
137,気質，循環気質，統合失調気質（分裂気質），粘着気質を指摘した．循環気質とは，社交的，善良，親切で，活発，明朗でユーモアがある側面と，平静，寡黙で気が
138,のことと思います。民法では、受任者は、「委任の本旨に従い善良な管理者の注意をもって委任事務を処理する義務を負う」と定められています。これを
139,が冷肉なら、プディングの代わりにいただけるのは火焰地獄おちということらしいですよ！」と善良な男がいった。「さて、きょうの午後、ネヴィルトンまで歩いてゆかなきゃなら
140,使用されず、いくつかはロンドンの制作に追加された。〈オー、淑女よ善良なれ〉、〈その半分でもいいからブルースを〉、〈小さなジャズの鳥〉
141,まさにここにあったのだ。こうして、事態は極度に悪化した。組織の善良なメンバーは、無意識のうちに二種の悪党の間に立たされていることに気
142,に言われている言い方によるイメージは、日本軍は戦闘終了後、町の中へ入って、善良な市民を無差別かつ虐げる意志を持って三十万人殺した、ということだ。しかも、
143,朝鮮の人たちは、人間的にも精神的にも日本人の特徴ととても似ていて、善良で知的で頑強な男性に思われたのですが、どうして人間がそのようになれる
144,）ア、ＡがＢに通常の報酬を約束した場合には、Ｂは、善良なる管理者の注意をもって示談交渉にあたる義務を負うが、Ｂが無報酬または通常より低廉
145,どうしてもっと早くからこのようなシステムにしなかったのか？と思います。善良な質問および回答を心掛ける人にとってはまったく支障の無い事ではないかと思います。
146,んだ」「とっくに再婚して子供もいます」「噂によると、じつに善良で誠実な男だったらしいな。俺とはずいぶん違うよな」そうな
147,の味方です。驢馬は善良で有益な人間です」「じゃ公爵、あなたは善良な人間ですか？いえ、わたしはただ物好きにきいてみるだけなんですよ」
148,クリスマスを雪で飾りたいと願うのは、南カリフォルニアの住人とて、他の地域の善良なアメリカ人と同様である。しかし、いくらこいねがっても、これだけは神のお恵みに
149,ノ２）。信託財産の管理人の義務については，１信託の本旨に従って善良なる管理者の注意をもって，信託事務を処理しなければならない（民法六百四十四条，信託法二十条）。
150,あった工員が結構、冗談を言いあっている。事実、彼らの仲は、下士官と善良な工員との関係よりずっと親しかったんです。下士官からすれば、お人よしの工員より
151,にいられるっていうことさ」「そうあって欲しいわ」「ぼくは、善良な一市民にすぎない。北川が言ったことは単なる想像の産物だし、気にかける
152,更生会社に生じた損害の額と推定する。（管財人の注意義務）第八十条管財人は、善良な管理者の注意をもって、その職務を行わなければならない。２管財人が前項の
153,してハンド・バッグは、彼のいう通り、走り出した車の屋根から落ちたあと、善良な通行人に拾われて最寄りの交番に届けられていた。彼は彼女が車
154,そこに、人間的な弱さが顔を出すのだ。相手の偉大さを認めて、ただ善良でいられるのか。―おれは荒れた、それは確かだ、しかし、
155,られておるのか。○柳館説明員お答え申し上げます。こういった事案といいますのは、善良な国民に対しまして大きな被害を与えるという事案でございます。したがいまして、
156,も十五分すれば見る人がいなくなる。●美しい女はやがて飽きる時がくる。善良な女はけっして飽きることがこない。こんなことわざがあるじゃないか。
157,た後三年を経過したとき。三保管記録を閲覧させることが公の秩序又は善良の風俗を害することとなるおそれがあると認められるとき。四保管記録を閲覧さ
158,その学生さんは、明るい快活な、それはいい方でした。血の一滴までも正しい善良な方でした。あれほどいい方は、この世にふたりといないでしょうよ。あの
159,た傲慢な若殿様だ。」ゲーテがもっとも残忍な処刑を執行したのは、あの善良で優しいゲオルク・ヤコービに対してであり、彼を女とか弱虫とか呼び、この致命的な一撃
160,インディオたちと同様に、金鉱とかその他のもうけ仕事で死んでいったのである。彼ら聖職者たちが善良な人間だったことは確かであるが、自分らのためにインディオたちに大きな危険と危害
161,に感じたそのとき、ネッド・ランドとコンセイユが広間の戸口にあらわれた。われわれの善良なふたりの仲間は、山のようにあつめられた珍しいコレクションを目にして
162,、この二本のポプラは、いつも人びとの目につく所に立っていて、善良な人たちを喜ばしてくれるようになるよ。その頃にはねアルティナイ、ぜんぜん別の
163,」けれども魔女の邪悪な暗示はマクベスの胸に深く沈み込んでしまつたので善良なバンクォーの警告に従ふのを許しませんでした。この時から彼の思は
164,１ホテル・旅館等宿泊施設については、旅館業法（昭和二十三年法律第百三十八号）によって公衆衛生の向上と善良な風俗の維持の見地から各種の規制が加えられている。業として営まれる宿泊施設
165,、今、背教を一掃すべく新しい主教を迎えましたからね。奥さんも敬虔で善良なかたです」医者はいった。ジュリーの口もとのくぼみが深くなり、上を
166,。この世の中には知らぬが幸いという事実もある。危険きわまりない出来事の渦中に、善良なラグノオまで巻きこむのは忍びない。「ああ、わかった」俄に緊迫し
167,の義を含蓄せるもの」と言います。精神の善良は申すまでもなく、形式も善良にせねばなりません。ゆえにいかに誠意の人でも、悪罵、詭激
168,。好き勝手なことをやっといて、今さら助けを求めたって後の祭りよ。善良な市民は大迷惑だわ。…そんな汚れた患者には有罪判決を下して、政府
169,両者同じであるが、ホンウイジンの理想的人物は、其行爲實着、其道德の確乎たる守舊思想の善良なる老人にして、當時の社會の輕薄俗を爲し、禮義地を拂う
170,定む６保険医療機関又は保険薬局は一部負担金の支払を受くべきものとし保険医療機関又は保険薬局が善良なる管理者と同一の注意を以て其の支払を受くべく努めたるに拘らず仍
171,そういう暴力行為があったんだろうということを中心にして責め立てているわけであります。善良な組合員はそういう暴力行為を働くような密議や謀議は少しもしておりません
172,場合に売主に対し有益費の償還請求をなしうる〔民法五百八十三条２項本文，五百九十五条２項参照〕―），善良な管理者の注意をもって借用目的物を管理すべき義務があり，貸主の意に反して保存行為以外
173,たとえベルリンに勝利の並木道があろうと、信じたくありません。…それにあの善良なホーホベルクが、よりによって『火の飢饉』のために辞職したという話
174,といえる。そして次第に、父母その他の家族等の「模範によりて漸次に善良の行為に誘致」していくのであり、これらは「家庭」が「自然の教育所」である
175,ホトケに引導を渡すのだが、私は生きながら、勝利を信じてせっせと働いている善良な同胞に引導を渡して歩かなければならなかったのだ。私はこうして、津軽地方
176,者の性欲を著しく興奮刺激又は満足させる動作で、普通人の正常な性的羞恥心を害し、善良な性的道義概念に反するものをいう（東京高判昭二十七・十二・十八高刑５・十二・二千三百十四）。性器の露出や性交行為が典型
177,、彼がいる土地の信徒たちは、つねに堅固に信仰を保っていた。この善良な老人は、キリシタンたちに対して行なった説話の中で、しばしば次のように語ってい
178,，それらの人々の意見を交通行政の上に十分反映させるとともに，無事故，無違反の善良な運転者については社会的にも適正に評価される方策を推進する必要がある。自動車安全運転センター
179,率直な感受性、誰とでも寝てしまいます…。それに代わってメチェは、善良な娘で、どうしようもないほど従順で受身です。メチェはそういう存在
180,地方警察とＦＢＩに通知させる、そして国内テロに関与している組織のリストを公表して大統領が善良な市民に注意を呼びかける、というものだ。だが、このプランは市民的自由を引きあいに
181,ます。彼女に無駄遣いの癖があるというのはまったくの嘘です。世界じゅうでいちばん善良な心をもっています。私は心から彼女を愛していますが、彼女も
182,と思いますが量販店の安い観葉植物はこのような確率は高いでしょうね。ちなみに善良な販売業者は少し仕入れ値が高くても生産者の名前を確認して仕入れをしてい
183,のある文字をあてることに常一は我慢ができなかった。貧しいけれども勤勉で善良で、時には頑固でずるいところもあるが、とにかく精いっぱい生き、しかも平凡に
184,でその４倍にも延長され，明らかにその影響による大胆なオルガン演奏は，アルンシュタットの善良な会衆を当惑させるに至った。女人禁制の聖歌隊席に〈見知らぬ女性〉を上げ
185,の活ける父なる神に信頼する。吾は神の法の仁慈と神の業の善良なることに信頼する。しかして吾は生くるかぎり神を愛しその法を守りその業
186,のが、今回の事案の概要でございます。○坂上委員大変怖くて、普通の善良な者は生活できないんじゃないの。市役所が、結果的にはでたらめの報告をした
187,取引もないしこれは残念ながらアテになりません。本人に全く悪気のない善良な人であっても、ちょっとした不注意や認識不足で感染し、知らずにウィルスをばら撒い
188,資力及び規模に応じて会社を存亡の危機に陥れないように経営を行うべき善良なる管理者の注意義務を負っているのであり…、新規事業については、会社の規模、事業の
189,換気や除湿願います、（黴が生えやすい季節です）＞＞※【入居者は善良なる管理責任が有りますので、十分の換気をお願い致します】退室時に弁償に成ること
190,連絡。※不法滞在で他の日本人が迷惑を被るとは言い切れないが、他の善良な外国人滞在者にとっては迷惑でしょう。
191,た。末王子のレオポルドが女王を着替えの間に訪れると、「彼女に仕える善良な忠実者のブラウンが今朝方早く他界したという、恐ろしい凶報を伝えた。この訃報に
192,て相接することが肝要であります。ジェントルマンとは、「形式も精神もきわめて善良な習慣をもって固めたもの」と申すのであります。ジェントルマンの真の意味は「温厚
193,あるものか。えい、皆さんおきき下さいまし、こりゃ言いがかりってものですよ。あたしはもともと善良な市民、たまたまベム・フェロモンがあったればこそベム捕獲業なんていう、やくざな稼業に手を
194,た。地盤は、台本の大部分と歌とダンスがストーリーと一致する《淑女よ善良なれ》を受け入れる態勢になっていた。一文なしの兄妹のダンス・チームが、変装して彼ら
195,アフリカ女性の優しさに由来しているのだろうし、一部は彼自身の性格によるものだ。ランダーは善良で、外向的で、小柄な、肉付きのよい快活な青年で、遠征が始まった
196,たびに舟を出して救ってくるんです。その費用だって大変です」と、善良そうな夫はしょんぼりと語った。Ｎ先生は、私が彼女をヒステリーではなく、
197,に保護されない表現に限定されているかどうか疑問の余地がある。「善良な風俗」に反する表現の典型はわいせつな表現であろう。放送でわいせつな表現が
198,固めたもの」と申すのであります。ジェントルマンの真の意味は「温厚、平和、善良の義を含蓄せるもの」と言います。精神の善良は申すまでもなく、形式も
199,ツラに表れますね。馬鹿もここまでくると何をかいわんや、ですね。善良な市民がつまらぬ傷害などを受けないよう、檻の中にでも入れて
200,保守的になることなく適正な判断・行為が行えるよう、原則として取締役は、各自善管注意義務（善良な管理者の注意をもってその任務にあたる義務）を尽くせば、会社に対して責任を負わ
201,高山）右近殿を元の身分に引き戻すかどうかとの話に及ぶと、この善良な老人ダリオは、「伴天連様方が追放されているのに、息子のジュスト（右近）が
202,の向上とを促進すること並びに、このために、寛容を実行し、且つ、善良な隣人として互いに平和に生活し、国際の平和及び安全を維持するためにわれら
203,、スキッゾ人間といいますと、すこぶる生まじめで、非社交的で、内気で、神経質で、善良である分裂性気質といわれるタイプの人のことなのです。ニンフェット・シンドロームの男性もスキッゾ人間であること
204,といいましょうか、関心を持って取り組んできたつもりでありますけれども、本当に善良な自動車ユーザーがこの保険を払って、そして何かあったときの保障のために
205,腐臭に満ちている。それに比べて、彼らは市井に生きる者としてフツーであり、善良なシティズン予備軍である。いろいろな体験をしながら少しずつ大人になっていく。まともに、
206,メグの頰にキスをした。「文句なくすばらしかったよ。クリスマスのおとぎ芝居に善良な妖精が登場するシーンだって、ああはいかないだろうね。あれで、誰か
207,ために営利目的でわいせつ行為を行うことも含まれる。わいせつに当たるかどうかは、善良な性的道義観念に関係するものであるから、時代とともに変遷する。その判断基準は、一般人の
208,こいつらを排除してくれ！！ほんまにこの時のマル機は根性なしであった。これなら善良な市民の味方というよりオウムの味方ではないか。結局、熊本県警は早川、
209,にドキドキしてきた。あるいは、可慧はあなたを助けてくれるかもしれない！可慧はあんなに善良だし、あんなに情熱的である。可慧はこんなことを言ったことがある。「人は
210,ここは仕事のしがいがあるからね」コンセイユをけしかける必要はなかった。この善良な男は、陳列ケースに身をかがめると、腹足鋼、エゾバイ科、タカラガイ属、マダガスカル・シプレア種などと
211,から，今後の運転免許行政においては，悪質危険な運転者を的確に排除する一方で，多くの善良な運転者に焦点を合わせた施策を推進していくことが必要である。また，従来
212,お答えできないことがあります。◆次の場合は、実施しません。●公の秩序や善良な風俗を乱す恐れがあるとき●政治、宗教、営利を目的とした集会
213,ありません。しかし、あの場における問題というのは、書面議決を金で買い集めて善良な組合員の意思というものを踏みにじる、そのことについての一種の生活防衛闘争でしょう。あなた方は
214,もこうして生きてるんだもの」「まあね。しかし、ついに生還できなかった善良な若者だって大勢いる。もしそこに何かの意味があるのなら、どうしておれたち
215,しかるに、現在のこのありさまを見ますと、本当に毎日のごとく凶悪犯罪、また善良な国民をあざむくようなアンフェアな出来事が毎日のように報道されているわけでござい
216,もしくは「国賊」と疑わしきすべての人にまで広がった。群衆の恐ろしさには、善良な日本市民までが思い切って立ち向かおうとしなかった。警官の不足から「自警団」と
217,開け、二百五十五公演行われた。この催しから休む間もなく、ガーシュインは《淑女よ善良なれ》のスコアを十二月一日の開幕に間に合わせてなんとか完成した。このころ
218,ミスター・ジェリーバンドは、この大切なお客さまをおもてなしするためにあたふたと心を砕いた。この善良な人たちは、二人とも宿屋のものとしての作法をいっぱいに身につけていたので
219,各地で暴力ドライバーによる殺傷事件が発生した。この種事案は，道路交通に障害を及ぼすだけでなく，善良な一般運転者にも不安を与えるなど極めて悪質な事案である。暴力ドライバーに限らず，くるま社会の
220,言葉を使わずに）する人は誰ぞやと反問して見た。農村の善良な婦人達は「今のご時世に、私達は何をどうしたらよいか教えてください。
221,そうな目に接すると、ピラーは微笑んだ。マリナといるだけで人間は本来善良なのだと思えてくる。マリナは周囲の人々の人生を豊かにする珍しくも偉大
222,きちんと提供する場として、この資産ドックというセミナーを立ち上げたことを知ったからです。今善良な地主さんらに、「節税効果が抜群！」等々でアパート建築を売り込む○○パレス二十一や
223,なのに、ぼくが起きて、このセットに駆けこむとこを見たら、ボストンの善良なる人々は目覚ましどころか目をむくんじゃないかって気がして」へえ
224,彼が心正しい好男子であったりしたら、思うだにぞっとする結果になる。つまり飛行機は善良な彼の重みで墜落するか、誰か一人が彼のおかげで、乗り込めないこと
225,な役なのにすてきなふりをしてはいけなくて，悪役なのに善良なふりをしようと思ってはいけないと思う．訳もなく力を入れてしまわなければならないし．
226,が一般的にどこまでいえるか、かなり疑わしいように思われる。３「公安及び善良な風俗」を害する表現では、放送法三条の二第一項の「公安及び善良な風俗
227,このくらいのことなら反省するだけで充分だと思います。それよりあなたのような善良な方はいろいろ騙されやすいので、そのほうが心配です。
