,0
228,ないのだ。タヴィストックと結婚するのだから。モーガンはそれについて考えてみた。サー・ウィリアム・タヴィストックは善良で財産家だ。母は何不自由なく暮らせるだろう。しかし…。モーガンは十五年もの
229,の範囲駐車場の維持・管理について管理会社等に業務委託を行なう場合には、受託者が当該受託業務を善良な管理者の注意をもって処理するよう指導し、必要がある場合には報告を求め、または
230,られ、ジャニスははっと口を閉じ、禊ぎの言葉を口にした。素直で善良な娘だ。だからこそ神殿の巫女をつとめられる。エンドギラは笑みを浮かべて
231,までのレースを取材したレポーター、マックス・ミュールマンは、「ノースカロライナ州シャーロットのレース場に集まる人々は、善良な庶民だった。自動車や中古部品の仕事に関わる低所得層、農村からやってくる大勢
232,いや、丁寧すぎる文面だ。武士は、獰悪な本性を秘めた、だが優しげで善良そうな顔をして社会に溶けこんでいる、そんな殺人鬼をイメージした。マウスへ
233,あとで、彼の弟子、あるいは助手の一人を訪ねました。それは非常に善良な人でしたが、常にあらゆる事に説明をほどこそうとするような人であり
234,はよほどぶっきらぼうか変人で、正常な人間は扱えないにちがいないと思うのだ。善良な市民にとってさいわいなことに、おまわりは身内同士で固まる。別に仲間といるほうが
235,あるいは下品な言葉や差別用語などが、これに該当する可能性があろう。しかし、もし「善良な風俗」を理由に、下品な言葉、品性を欠く言葉が規制されることになれば
236,呼称される。前記（補訂）参照〉ア風俗営業に関する規制の概要本法は、善良の風俗と清浄な風俗環境に影響を及ぼす営業形態での営業のうち特定の種別の
237,は二人のあいだの結びつきが理解できなかった。ヴィクターは社会的に成功した、大金持ちの善良な市民。一方、ジャックはそれらのひとつも持ち合わせてはいない。彼らは
238,その後フランスで三十五年暮らしたわけだけれど、イタリアでは彼女の生き生きした情熱と善良な心があればどこでも扉を開けてくれたのに、フランスは結局いつ
239,豊潤なヴェネツィア風の美しさともまったく異なっている。むしろ彼女は控えめで、穏やかで、善良な実在の人間のようにみえる。レンブラントの内縁の妻ヘンドリッキェが、この絵の
240,交通規則を守っていれば事故は起きないかもしれませんが、私たちドライバーすべてを「善良な市民」「善良なドライバー」と考えてしまうことに問題があり、交通事故の九割がドライバーに原因が
241,、その際には、果たして一体どのような配当が行われるかについては、まさに善良な管理を行う信託を受ける者との信頼関係にかかっているわけでございます。その
242,一晩中自分をなぶり深手を負わせ続けたのだ、と答えた。これを聞いた善良な先の人物は、たいへん同情し、即座に若者たちの元に駆けつけて、厳しく叱責し
243,導くとき、その巡礼の途上で彼に一人の少女を発見させたまえ。その善良そのものの魂が、同時に優美そのものの姿にも恵まれ、家庭本位のまめまめしい
244,、さきに本書の第二巻第三章でその経緯を述べたように、千五百二年、聖フランシスコ会の善良なる修道士たちが数人この島へやって来た。彼らを引率していた上長者はフライ・アロンソ・デル・エスピナル
245,。それからまたしゃべり始めた。「なら、こうしたらどうだ、おまえ。おれたちは善良なアメリカ市民だよな、違うか？兵隊たちは、おれたちのために遠い戦地で
246,彼とつきあっている節がある。そればかりではない。マルジオリオを悪人として排斥することは、善良で利他主義で道徳的な人間のみを肯定することになるようで、気がひけるのだ。
247,をたくさん持っているわけでして、その機能を発揮させるためにも、森林そのものを善良に管理していく必要があるという観点で、基本的な、理念の見直しから始まって、
248,大戯曲家ホンウイジンは精神に於いても思想に於いても当代の大人物である。彼は露西亞國民の道德と善良とを信じて、浮華虛飾の佛國文明の崇拜家に反對せり。彼は露國のもの
249,はそこでは次のように述べている。すなわち、取締役は会社の経営に関し善良な管理者の注意をもって忠実にその任務を果たすべきであるが、企業の経営
250,。さらに、その家の各住人も、彼らなりにできるだけ利益を得ようとする。そして善良なツァクライス夫人のように、自分の住居の一室を喜んでまた貸しすることになるのだ。さらに、
251,手によって文明を破滅させようとしているときだけです。ただ、そのときには、善良なる者も介入してくるでしょうが、同時に悪なる者も介入してくるということ
252,に釈明を余儀なくされて、書かれた右の手紙である。どんなにコンスタンツェは善良かをモーツァルトは強調せずにはいられぬ立場に置かれていたとは、
253,不当な差別的取扱いをするものでないこと。ハ保険契約の内容が、公の秩序又は善良の風俗を害する行為を助長し、又は誘発するおそれのないものであること。ニ保険契約
254,いまだにキーリーを思い出させる。キーリーが『マッチョ』のヌードグラビアを飾って、アリゾナ州サグアロ・ジャンクションの善良な住民たちを驚愕させたのがそんなに昔のこととは信じられなかった。
255,られますか、礼金１か月、敷金１か月で入ったマンションです。賃借人には、「善良なる管理者としての注意義務」が課されます。平たく言うと、故意・過失・規約違反による傷や汚れ
256,。自分に好意をよせたのが、美代子でなかったということだけでなく、相手が、善良だが、伝票の勘定をまちがえてばかりいて、みなから軽蔑されている君子だっ
257,Ｅｔｉｑｕｅｔｔｅエチケット先年、九州のさるゴルフ場で起きた暴力団員による発砲事件ほど、われわれ善良なるゴルフ愛好家たちの心胆を寒からしめた衝撃的な事件はなかった。ゴルフの加速度的な大衆化と
258,ぱさぱさの長髪をかきあげ、血走った鋭い眼で矢口を睨んだ。「詩人は善良な市民になっちまったら、おしまいさ。詩人は冥府の人間なのさ。薄暗い
259,でうんざりさせている彼の愛人でさえもと思います。彼を惜しむのはこの善良な将軍だけです。ところであなたはまた手紙を書いて下さったのですね？こんな
260,いう金の買収によるところから発したことでしょう。それを不正だと思っておる善良な漁民たちが、何だこのやろうと言ったのでしょう。このやろうと言われた理事
261,寄託は、受寄者が寄託者のため保管することを約して物を受け取る契約。有償なら善良な管理者の注意（五百五十一頁）、無償なら自己の財産におけると同一の注意で
262,居住している。彼らの一パーセントなら一万人、〇．〇一パーセントでも百人になった。つまり大多数が善良な市民だとしても、絶対数が大きければ一定の数字が出てしまうのである。それ
263,ホテル，旅館（１）概況宿泊施設については，旅館業法によって，公衆衛生の向上と善良な風俗の維持の見地から各種の規制が加えられている。業として営まれる宿泊施設
264,一年前まではスペインの友であり、ハイルッディンに脅されてやむなく彼の支配に従った善良な市民たちだった。そのため、カトリックの年代記編纂者でさえ、この事件を語るときは
265,飯を食い、何の為に数百篇の下手くそな詩を書いてきたのだろう。善良なだけでは何も成せない。この廃屋に等しい若菜かまぼこ店の二階に借りた部屋
266,悪役で中心を取ってくれたからその部分に焦点が合わせられなければならないと思った．善良な役なのにすてきなふりをしてはいけなくて，悪役なのに
267,の木馬というのはギリシャ神話のトロイ戦争の中に出てくる木馬に由来しています。一見善良なソフトの姿を偽ってパソコンの中に進入して、ある時正体を表して
268,が分かった。私は彼女の人格が素晴らしいと感じている。彼女はとても誠実で善良なので、授業も素晴らしいものになっている。中国人にとって、日本人から日本語を
269,についての認識を改められたのは、その時であり、それまで抱いていた、善良な眼をもち、小動物にもやさしい心配りを忘れない俳諧師といったイメージは、みじんに
270,に思いをめぐらせているのだった。人間はそのときそのときの事情によって、すごく善良になれるけれど、一転して極悪に走ることもできる。それは前の日、
271,に送りこんだ斥候のことであった。さて三十三年経って今やって来た男は善良なエルデクにほかならなかった。歳月は彼を通り越してしまった。しかし、われわれは
272,場合を除き、これを承認しなければならない。一当該業務の内容が、公の秩序又は善良の風俗を害するおそれがあること。二当該業務の内容が、当該申請に係る会社
273,れている以上に行われたことはなかったと述べ、ヨーロッパの市民の状態が人権や善良な人々の正当な要求を満足させるものでなかったことが、自由と平等の願望
274,？》とかその他ブルジョワ個人主義のさまざまのメランコリーを、手の甲で払いのけるのである。《善良な青年たちよ》とゴーリキーは、人生は単調で空しく凡庸だと不平をならす人たち
275,、大体決まっていた。いわば、「性、善良」というべき人物である。「善良」では尽くせない。あるやらせ易い一面をもつ人柄というものがあるようである。だが
276,を駆使してお客様のご要望に応えているという思いこみがあるらしい。この貼り紙を見ると善良なお客様も、人の好い館長までもがだまされて、近寄らないでくれるのである
277,に性欲を興奮または刺激させ，かつ，普通人の正常な性的な羞恥心を害し，善良な性的道義観念に反するもの」（最高裁判決昭和二十六年５月十日）とされています。一見わかった
278,蹴とばされたような怒りを覚えた。ジャネットは自分を騙したばかりか、あの善良なアメリカ人まで忌まわしいペテンにかけたのだ。それもこれも、自分が彼の話
279,捨てて、どこか秘密の場所に隠れる決心をしていた。その地の善良なキリシタンで、大いに尊敬されている了珪の息子のヴィセンテはそれを聞くと、司祭たち
280,であり、イスラムの原理主義者や中国の全体主義者は恐ろしい。この名高い「他者」とは、善良な他者でなくてはならない、つまり、我々と同じでなくてはならない…。自由の敵に与えるべき
281,一ハ以テ勧戒ニ充ツルニ足リ一ハ以テ智恵ヲ発スルニ足リ其徳性才質自ラ善良ニ帰着シ、他日学ニ就クニ至リ更ニ成業ヲ速ニセン」としている。なお
282,などではなくノイローゼ患者にすぎない、ということになる。三作目『ローマに死す』の、善良な若い登場人物たちは、ヴォルフガング・ケッペンのアンチ・ヒーローの〈散乱した四肢〉の部分を各自が持ちあわせ
283,三十八歳という若さで死んだが、それとても、もっと早く死んでくれればと願っていた善良なアメリカ人にとっては遅すぎたくらいである。彼と組んだのがダニエル・ドルーとジェイ・グールドで、
284,嘲弄されているのではと。況や、昔も今も変わらず平穏無事な市民生活を願う善良なる犠牲者・被害者及び親族の心境に於いてをや。何故、第一報以降は匿名で、との報道協定
285,が挙げられる。集団でオートバイや乗用車を暴走させる暴走族は、暴走行為のみならず、一般の善良な市民にまで暴力を加えたり、場合によってはグループ同士の対立抗争をくりかえしている。いわば
286,、当該減額された一部負担金とする。）の支払を受けるべきものとし、保険医療機関等が善良な管理者と同一の注意をもつてその支払を受けることに努めたにもかかわらず、なお
287,はかけん。我々政治家に任せておいてくれ給え。必ず、諸君のような、善良なカリフォルニア州民の期待を満足させるような回答をもたらしてみせる。」拍手。
288,交互に相手の頰を打つ。二度やらされた。初めの相手は、タムラという善良そのものというべき男だった。およそ、悪意というものを知らないかに見える
289,面白いのだ。特に面白いのは、ぼくの前を通りかかる、なんていうか、「善良な市民」とでもいうような人々や、例の庄司薫くん風（！）な若者
290,ません。ただ、その周辺になだらかで穏やかな幅広い裾野の存在が必要です。善良な市民一般に対しては、親切で信頼される警察を目指したいものです。この両方が相俟っ
291,を悔さしむるにあり、乙ハ専ら教誨を加へて以て其囚徒の心を善良に感化せしむるにあり、然り而して其効力に至りてハ、則其人民進度の如何
292,サディスト！メロドラマの愛好者！』なぜなら千九百三十六年のドイツでは、平均的な人間は善良であり、世界の平和は勝利を収める国家社会主義の最高の作品となるだろうと信じる必要
293,がだからこそ、ぼくはそれに対する防波堤にならなくてはいけないと思っている。普通の善良な人々というものはおそらくまったく、そんなふうに思うことはなくて、だからこそ自分
294,に李総統に向けた企みを持ち、政権を奪う準備をしていた。周りの善良な人たちを利用して着々と根回しをしていたのだ。政治とは恐ろしい職業
295,ており、兄の意向で結婚することになっているオルタンスにはどうしても好意をもてないのである。善良だが軽率な末弟のジェロームは、兄に厳しく躾けられている。「市民将軍殿、
296,だけで、道徳がたかまり、刑罰はほとんど行なわれない。君主の聡明と大臣の善良をたたえる歌が湧きおこり、広くおだやかな感化が完成した。太階の星（天下の
297,いいます。誰でも、経験すると慎重になりますが、さくら評価をつけたり、善良な出品を装ったり、住所をきちんと教えたりで判別できなくなるのでしょう。知恵袋のどの
298,島々に住んでいたひとびとは、なるほどその性質がルカーヨス諸島のひとびとと同様に素朴で善良であったが、しかし、われわれは習慣として、それらのハルディンの小さな島々のことを
299,場合も，その契約は無効とされます（民法九十条）。公の秩序または善良の風俗のことを略して，簡単に公序良俗という場合もあります。どのよう
300,ても認容しないこと）がいる。ただし、失火で隣家などを類焼したときは善良な管理者の注意を著しく欠いた重過失がないと不法行為にならない。
