,0
0,か」「そうだ。元帥ゲーリングだ。だが彼はその朝は軍人としてではなく、善良な美の愛好者としてイサベルの邸に立ちよったつもりらしかった。お茶を一杯ごちそうに
1,電事連は幾らでも出して六ケ所を征伐しようと思っているんだ。この不法なたくらみに対する善良な、いたいけな力のない漁民の正義の闘いだと私はこれを見るのです
2,かを見るために、工場を抜き打ち査察したりしたといったものが多い。部下思いの、善良かつ優秀な連隊長殿が、そのままの感覚と視野のままに、陸軍大臣になり、
3,ている夫が増えていることは事実です。しかしこの種の夫たちは、いずれも善良でそれなりの企業に勤め、立場も面子もある、という前提があることを忘れ
4,、徽宗皇帝に自分たちの意見を押しつけた。徽宗は芸術家としては天才で、為人も善良であったが、皇帝としては不定見であった。蔡京たちの意見に、深く考えもせ
5,が、イタリア人についての僕の考えをすっかりかえてしまうような―形式が立派で、善良な―第一級の音楽なのだ。
6,６回にわたり仮出金名義のもとに，会社名義の小切手を振出していた場合，監査役として常に善良なる管理者の注意をもって会社の会計などに関する帳簿書類などを検査していたならば，その
7,この娘と行きずりに知り合うマストロヤンニの青年もまた、この街に赴任して間もない善良で平凡な独身の勤め人の代名詞にすぎない。勤め人としてのかれの生活が具体的に示さ
8,公安及び善良な風俗」を害する表現では、放送法三条の二第一項の「公安及び善良な風俗を害しないこと」（一号）はどうであろうか。このうち「公安
9,』。よし、これでいい。この問題が片付いたお陰で、僕はようやく善良で辛抱強い―ここまで読んでくれてるのはきっとそういう人たちだけだろう―読者の
10,と剣の流血ざたです。これらの闘争に疲れた市民たちの間では、強く善良な独裁者の出現を待ち焦がれる気風が強くなっていました。これがシニョリーア制、つまり
11,その喜びを深く感じたのは、ロケと呼ばれ、すでに年老い、かつ非常に善良なキリシタンであった。彼はかつては仏僧で、清水と称せられる一寺院の長を
12,ぞ。まさしくその晩、ダーク・スーツを着てブリーフケースをさげてはいるが、いたって善良そうな顔つきの日本人ふたりが、ポンティタナに到着した。すでに八時をすぎ、まだあい
13,責任を負うので、身元保証人に酷な結果が生ずることが多い。雇用の当時は善良な被用者だと思って簡単に身元保証をしたところが、被用者が数億円の使い込み
14,閲覧した者は、閲覧により知り得た事項をみだりに用いて、公の秩序若しくは善良の風俗を害し、犯人の改善及び更生を妨げ、又は関係人の名誉若しくは生活の
15,余程の事がないと取り締まらないのかもしれません。私いつも思うのでですが、善良で正直者だけがつかまって反則金を取られているような気がします。もう
16,。特に崇高に見える機会が五フランを獲得するための絶好のチャンスである場合はなおさらだ。善良な聖カルロ・ボロメオが初めて原価を支払った問題のその偉業は確かに印象的だったが、
17,には女達が集まり、神に救いを求める合唱。カサンドルが来て、エネが善良な市民を救出し、トロイの財宝と共にイタリアへ行くべくイダ山へ向かった、
18,なくてはならないでしょう。そうですね、僕の楽観主義は欠陥があります、善良な心の人は金持ちにならないということがよく分りました…ああ、夕食
19,放送の場合にもむずかしい問題が残されている。では、わいせつな表現以外にも「善良な風俗」を害する表現があるであろうか。おそらく、わいせつとはいえないが品性
20,はどうするこうする、そんな具体的なことはそれほどみんな悪らつな人じゃない、みんな善良な市民ですから言わないですけれども、しかし考えてしまうねということで、今我々一般
21,、心配そうに見る。「この人は古い友人で、見た目とちがって根は善良ですよ」秀平は常吉と小僧を安心させ、大井とつれだって路地に入っ
22,ない。ただ、こんなに悪いことがある、けしからんって怒って、それで自分は善良なんだと思い込んでいるのだ。皆、自分のことは棚に上げて他の誰
23,ゴイと呼んで家畜と思いこんでいるのはタルムードを信じているからなのです。一般の善良なユダヤ人を差別しないよう注意が必要と思われます。隠されている情報を知る
24,にして、ささたるけがであるのにもかかわらず、言うなれば核燃サイクル基地に反対する善良な漁民をいかにして痛めつけ征伐するか、こういう考えのもとに検察陣や警察陣が
25,）仕手のイメージは●錬金術師●インチキ●乱暴●違法●アンダーグラウンド●怖い●作為的●善良な投資家を欺く●閉鎖的●企業に混乱を招く…ｅｔｃ．０２“仕手っぽい相場
26,）第九十九条管理人は、執行裁判所が監督する。（管理人の注意義務）第百条管理人は、善良な管理者の注意をもつてその職務を行わなければならない。２管理人が前項の注意
27,大変だろうなとは思う。そういう人間に遭遇してしまった平和な日常を暮らしている善良な裁判員たちが、彼等の気力の限りを尽くして、ものすご〜〜〜〜〜〜くやっかい
28,を規定している。また、特許法は、三十二条に不特許事由を掲げ、「公の秩序、善良の風俗又は公衆の衛生を害するおそれがある発明」を排除している。３特許手続き
29,区別させる力を持っている。だから「教養が邪魔をする」と言って人は善良であろうとするのだ。豊かな教養人こそ「文化人」であるための必須条件といえる。『
30,の者がいいかげんなことをしておるのでは、何のあれもない。そして、善良な諸君は何の手も加えないのだ、勝手に転んでいる自損行為みたいなものに
31,。だから…と、いわでもがなのことを口にしたくなる。この善良な、普通の人たちを不幸な目にあわせないように、政治家や行政を預る
32,覚えているだろう。遅かれ早かれ、必要な答えを見つける自信はあった。コルビーの善良な人々はもう事件は解決し、とっくの昔に幕を閉じたと思っているかもしれない
33,したケバブを詰めた袋を数千個投下した、としますよ。いったいニューヨークの善良なる市民たちは、心のどこを探せばアフガン政府を許せる気持ちが湧いてきますか？
34,。しらじらしい小さな善行をひけらかさない。こせこせした小さな正義を押しつけない。村里の百姓で善良な人が、節季に酒肴を携えて私の機嫌伺いに来ることがある。仲間
35,を選べるということです」彼は腕時計を見た。「さて、そろそろあんたの善良なる隣人グローリアを訪ねる時間ですね」「なんのために？」「カーティス・ベネットに
36,という単純至極なアイディアだ！混乱と無秩序を法的に認め、それによってわれらが善良な市長の市政に固有の整然たる秩序の要素にすること！物乞いし、悪さ
37,、清教徒的排他性、偽善性を直視して改善を唱える有識者より、教会の教えに盲目的に従う善良な市民が大多数であった。この点に、典型的な既成社会のエリートであり従僕である「
38,に！」という理屈が第一段階で崩れるからだ。。。ちなみに、我が家の世帯主は善良ではなさそうです。。。グフフフ。。。それと弟もこの制度には反対らしく、
39,観光と同じく、対人サービスや介護には永い丈化の蓄積が必要である。いかに素朴で善良な人々がいるとはいえ、例えば、石炭を掘っていた人が急に高齢者に優れ
40,がやってきた事実などまったくない、と強い調子で断言したのだ。上の善良な人物は彼らを外に連れ出したが、深手を負った男はすでに姿を
41,家庭の出身者が多いのはそのためである。ハーバートにはその自由はない。つましく善良な生活をしつつ自分を愛している家族が極東の日本にいるし、婚約者の
42,。どのような欠点をこのインディアンが持っていたにせよ、それは彼の実に善良な性質と従順な気性によって十分帳消しにされていた。彼が私といっしょ
43,のものを二百五十万円で売りつけるのはよくないでしょう。社会的に許されないような、善良な風俗に反する法律行為（契約）は、公序良俗違反（民法九十条）といって無効と
44,いつも思うことがあります。一人ひとりは本当はみなよい人で、仕事は一所懸命で、善良な人たちだと。それなのにいったん組織のなかに入るとみな、大魔神の
45,の商売において発言力のある重要な立場にいるという。彼女の世代のおとなしくて善良な日本女性たちの中では、非常に強烈な個性で、きわめて自己主張の強い人な
46,たが応訴したこと。三判決の内容及び訴訟手続が日本における公の秩序又は善良の風俗に反しないこと。四相互の保証があること。（改正前第百十八条
47,一兵に至るまで、神兵の名にそむかず、住民に畏怖や不安を全く感じさせない善良な軍隊であることが、よくわかったからでしょう」との説明であった。「
48,は教えるわ。でも、お父様の悪いところも認めなくてはね。ルシアン・ル・ダノワは、善良な人ではなかったんじゃない？それに、レイフは子供を奪ったわけじゃないわ。
49,上、無許可風俗営業罪、許可不正取得罪、名義貸罪等の風俗営業に関する許可制度を維持するための罰則を設けているほか、善良の風俗、清浄な風俗環境又は少年の健全な育成に障害を及ぼすおそれのある客引き行為
50,てからも気になって仕方がありません。警察に言えばいいんでしょうか。善良な方ですね。主婦の方でしょうね。私は以前、駐車場の隣の方
51,を規定いたしております。この場合は、基本的に申しますれば、信託を受ける人は善良な管理義務をもってこの信託業務を行うわけでございますが、その際には、果たして一体
52,もついていた。ただし亡者の中で橋を渡ることができるのは、ごく一部の善良な者に限られており、大部分の死人は自分で川へはいって浅瀬を探っ
53,見せぬものと決めているのか君を思いぬどしがたきおのれと思えど憎むべし善良と呼ばれる生き方の怠惰をわたくしのなぐさめとしてあまくだる才すぐれたる者の
54,ての偽善行為で、大臣たるものの度量ではない」と。（五）百姓で善良な人原文「村里凡人之謂善守良者」。校語によれば旧写本では謂の字が
55,ず、お医者様から「運動しなさい。歩くだけでもいいですから」と言われた。善良な患者であることを自認していたから、せっせと歩き始めた。
56,、いたずらに性欲を興奮または刺激させ、かつ、普通人の正常な性的羞恥心を害し、善良な性的道義観念に反する行為をいう（名古屋高金沢支判昭三十六・五・二下刑集三巻五＝六号三百九十九頁）。公然わいせつ罪（刑
57,素朴な人柄に触れることができました。そこで思ったことは、こうした善良な地主さんたちを喰い物にする悪徳業者から、その被害を防ぐことが必要で、そのため
58,かと、淡い希望がつながる朝でもある。法廷の証言席のように、善良な者も威圧する病院の部屋。法廷よりまだましなのは、話す側と
59,なものなので、おまえたちが拒んでもおかしくはない。ただ、これは私が善良な依頼人を助けるために無料で提供する儀式だということを、わかってもらいたい。私たちが
60,に憧れて、虚しくもがいている。黒い肌のアメリカ人兵士でさえ、世界は気高く慈悲深く、善良な人びとにとっては素晴らしいものに違いない、と思っていた。そしてある日、この黒人は
61,第十七章壮大な嘘、大胆な推測あまりに単純、善良な人々これまで多くのページを費やして、『アメリカの力によるベトナム政策の失敗
62,に心してほしいのです。地球への飛来者たちは神ではないし、また、そのすべてが必ずしも善良なる人びとではないのです。宇宙には知的生命体が数多く生きていますが、地球の国連
63,を小莫迦にしたような口調で、肥満した男は応じた。先刻までの善良そのものという表情が、一転して猜疑心の塊にと変化する。金髪のがっしりした
64,。母や祖母から聞いた昔話。心温まる話、悪を戒める話、神や善良なものを讃える話など、枚挙に暇がない。「上山昔ばなし切り絵の会」は
65,俺のような善良な市民をノーヘル程度でどこまでも追いかける暇があるなら、逃亡中の凶悪犯を捕まえろ！
66,が言った。「少しだけ会社に忠実すぎたかもしれないが、根っこのところでは善良な男だった。こいつが何をしたにせよ、こんな罰を受けるいわれはない
67,だって、あなたがそこまで考えているのですから。でも、やっぱり他人なんです＾＾；いくら善良な人でも反対の部分は誰でも持っています。疑いなさいとは言えませ
68,は「いたずらに性欲を興奮または刺激させ，かつ普通人の正常な性的羞恥心を害し，善良な性的道義観念に反するものをいう」と定義される（最判千九百五十一・５・十集５‐１０２６，最判千九百八十・十一・二十八集三十四‐四百三十三）。
69,が指摘され、同時に非犯罪化が叫ばれ、活発な議論の対象となっている。善良な風俗秩序というのは、各人それぞれ考え方や感じ方が異なる。それを刑罰によって一律に規制する
70,民族についても言えることは、割合はともかく必ず一定数の悪が存在する点だ。むしろ善良な性格の人たちの多い民族の居住区ほど、隠蓑として適していると考えられた。
71,にあらず、囚徒を喜ばしむるの義にあらず、唯其囚徒をして善良に感化せしむるにあることなれバ、断乎として之を行ふに何の妨げ
72,のである（五十五条１項）。信託管理人の義務については，１信託の本旨に従って善良なる管理者の注意をもって信託事務を処理しなければならず（民法六百四十四条），２管理事務を処理するにあたっ
73,相手をやじり倒して勝負を混乱させる作戦をとることにした。聖フランシスコ会のフライ・アロンソ・デル・エスピナル神父は、善良ではあったが少なからざる無知のために、前述のような任務を引き受けてしまっ
74,形で、こういうような宣伝をそのままさせておくということは、そういう善良なる消費者に対して大変な迷惑になると思うのでありますが、裏づけのないこの種の
75,。老人夫婦は、前の二組の男女に劣らぬほど、互いに愛しあっている。善良で優秀で、敬愛されるタイプの一組だ。ただ前の二組とちがっているのは
76,借主は賠償義務がある（これについても六百条の準用を肯定すべし）。また借主が善良なる管理者の注意を怠りつつも使用収益することは，契約または目的物の性質によりて
77,の御指名であれでございますが、私は医師と患者の信頼関係の中で、善良な市民であればこの法律の流れの中に乗ってくる人の方が大部分である
78,重大な憲法問題が提起されるというべきである（最高裁判所は、政見放送事件で、差別的表現を善良な風俗に反すると判断している。最三小判千九百九十〈平成二〉年四月十七日民集四十四巻三号五百四十七頁
79,スピードオーバーをせず、交通規則を守っていれば事故は起きないかもしれませんが、私たちドライバーすべてを「善良な市民」「善良なドライバー」と考えてしまうことに問題があり、交通事故の九割
80,」ファラスが、その言葉を邪魔するかのように声をはりあげた。「善良そうなふりをしているだけです。そもそもぼっちゃんは偽りの記憶を植えつけられているのです
81,きちんと提供する場として、この資産ドックというセミナーを立ち上げたことを知ったからです。今善良な地主さんらに、「節税効果が抜群！」等々でアパート建築を売り込む○○パレス二十一や
82,の長所を認めていません。それは―あの、笑わないで下さい―私が素晴らしく善良な人間だということです。まあ、たいていのことは気にしないようにし
83,人はもちろんのことであるけれども―この効果はおそらくは祖国に刺激を与え、善良なる方法に向かってよく工夫して行くようにということを、勧告したる事実であろうと
84,はハイレ・セラシエ皇帝の時代で、私も当時のエチオピアの人とコーヒー取り引きをしていたが善良な紳士が多かった。彼らにいわせると、標高二千四百メートルの首都アジスアベバはどこから見
85,ギャグアニメか或いは勧善懲悪かの２極化です。なぜならば、アニメ（及びコミック）が「善良なアメリカ人」に槍玉に挙げられた際に、出版社を初めとする製作者サイドが「我々
86,支配者の意識から出てくるということは、注目に値する事実です。自分が社会の善良な風俗の保護者であるという思いあがった態度が、逆にワイセツ意識を社会にはびこらせるの
87,の？ドイルは最後のメニューを選べるっていうのに、他の人たちは―善良な人たち、子どもや老人、少女に父親―彼らは最後に口にする味が
88,は過去に起こしていそうな雰囲気を持っている。彼らはひいき目に見ても、善良でおとなしいアメリカ人とは言えないが、２人ともこの上なく素晴らしい人間である。そんな２人と
89,。消費者のわがままが罷り通ると、業者はその費用を販売価格に転嫁します。そして、善良な一般の消費者は、その分高い価格の商品を買うことになります。消費者センターは
90,、いたずらに性欲を興奮又は刺激せしめ、かつ、普通人の正常な性的羞恥心を害し、善良な性的道義観念に反するものをいう（最判昭二十六・５・十刑集５・６・千二十六）。被害者が現実に性的羞恥心を害さ
91,た。道化役をやらされる顔ぶれは、大体決まっていた。いわば、「性、善良」というべき人物である。「善良」では尽くせない。あるやらせ易い一面をもつ
92,難しいし、言わせておくしかない。問題はこうした言説に左右されかねない普通の善良な市民がいることです。結局、ここは世界史をよく勉強しようと言うしかない。
93,に湧いた。アメリカに不忠誠な行動をした者はなく、誰もが、善良な市民たちばかりであった。天羽賢治は、名前を呼ばれて、一階の取調べ室へ
94,あるいは犯人の改善更生の妨げにならないようにするとか、あるいは公の秩序なり善良の風俗を害することのないようにするとか、そういった点の配慮も
95,”だった●ヘロドトスが目撃した神殿売春古代の聖なる神殿では、なぜか善良な生娘が春をひさいでいた。前三世紀、バビロニアの町々を踏査したヘロドトス（
96,は「温厚、平和、善良の義を含蓄せるもの」と言います。精神の善良は申すまでもなく、形式も善良にせねばなりません。ゆえにいかに誠意の
97,の人々をみんな手なづけ、マクベスも郷士や貴族たちと自由に語り合つて、自分の善良な友達のバンクォーさへ来てくれたら、国ぢうの立派な人たちが悉くこの家根の下
98,これを紹介すれば多くの安定した報酬が得られるということで、余り知識のない善良な人たちを勧誘するという形の中でその人たちを被害者に変えていく、こういうよう
99,を降りた。ただちに参るように、という知らせを聞いて、今はやや年老いた善良なミセス・グリムズディッチは目に涙を浮かべた。オーランドーと彼女は一緒に館内を見て
100,口につっこませた。そして、十数人の男が二人一組になり、たぶん一人ひとりは善良だったり、美男子だったりしたのだろうが、ともかくそろって元気な若者だった日本兵たち
101,なければいけない、と改めて思うのです。我々も職場と離れれば、一人の善良なる市民、平々凡々たる人間として、社会の規律規範を守るのは当然のことですが
102,は庶民を描いているのではなく、乞食たちだ。その乞食たちは、残念なことに、全員とも善良な人たちだ。盗賊でもなく、女慈善家の家を破壊しようともしない。詮索する
103,」と同一の意義を有するとみなすことができる。２加盟国は、公の秩序又は善良の風俗を守ること（人、動物若しくは植物の生命若しくは健康を保護し又は環境に対する
104,この国では、芸術はあまりにも大衆と関わりをもちすぎていた。大衆は善良な思考をもち、お人良しで優しかったが、これはドイツ国内のナチ敵対者の多くもそう
105,その場合、派遣会社は派遣社員に対して、平均賃金の六割に当たる休業手当を支給しなければならないが、そんな善良な派遣会社はまずない。もし構内請負契約が中途解約されたら、派遣会社は他の手持ちの
106,素になる濃縮ウランみたいなもんです。「喜ぶ顔が見たいので」とかいう善良な動機とは、比べ物になりません。古今それを機に「成功」した人の
107,滑りぬ。忽然たるアカシアの花よ！我はオドコロンを飲みたり然しさらば！善良にして継続性を有する金曜日に水管パイプを捧げて眺望の方へ向かんとする
108,でも、親の責任だなんだって喚いて、ついでに兄弟まで責めたてるような善良な市民がゴマンといるぐらいだから…」溜め息を吐いた修一は、口元だけ
109,に支払われる。。。世帯主に支払うというのもある意味愚策だ。。。世帯主が善良でない場合、国が掲げる「全国民に！」という理屈が第一段階で崩れるからだ。
110,自棄っぱちになったからにしても、恋していないコンスタンツェを、五カ月後には「善良なコンスタンツェは家庭の殉教者で、いちばん心根がやさしく、いちばん聡明で、要するにいちばんよい
111,夢うつつ、白日夢の世界にいる。単調な勤行は耐えがたい。「わが修道僧フリードリッヒは善良な人物だったが、寝坊で有名であった。ある時、詩篇詠唱の最中に眠り込ん
112,てくださいって祈るの」「ぷはっ、はっははは。神や仏がいるのなら、この善良な松前様が交通事故に遭うはずがない」松前は、真剣な忍を嘲笑うよう
113,変幻常なき五色の空、広島の最期はただ一瞬であった。永年築きあげた広島市と善良なる市民がこの美しい空に消えうせてしまったのだ。
