,0
211,交流が急速にふえていくことは明らかです。この時代に、若い世代がアジアの一員、世界の一員として信頼され、自信をもって生きて行くためには、自国自賛を
212,で転戦中の日本軍将兵を慰問する碁・将棋慰問団が派遣された。まだ院生だった私もその一員に選ばれた。碁の団長は、アマ碁界の大御所とも言うべき安永一さんで、
213,特権階級に属していると信じている自己愛パーソナリティーの人は、自分の子どものことも特権階級の一員として育てることが多い。また、国会議員は地元の名士であり、その生活はそもそも特権階級的
214,ならこの家から出て行きなさい」「自分の仕事をしない子はこの家の一員じゃないわ」×他の人と比べないように。「あなたの弟はあんなに
215,ために，この憲章を定める。児童は，人として尊ばれる。児童は，社会の一員として重んぜられる。児童は，よい環境のなかで育てられる。一すべての児童
216,といいかもしれません。長くなりましたが、あたり前の義務というよりも、家族の一員としての役割を目的をもってやっているわけでしょうから、それが納得できるかどうか
217,の社会参加活動少年に主体的に社会とのかかわりを持たせることによって，社会を構成する一員としての自覚を促す目的で，関係機関，団体等と協力しながら，社会奉仕活動，生産体験活動，文化伝承活動等
218,民主的で安定した国家ができるよう可能な限りの支援を行うことは、国際社会の一員として当然の責任であります。自衛隊の安全確保につきましては、私自身、昨年十二月
219,。「この１年、けがなくやれた。それが一番うれしい」。名実ともに虎戦士の一員となり、優勝の喜びをかみしめた。一昨年の優勝の時は入団１年目で
220,、事業を行う者は皆、誰がその少数独裁の一員であって、誰が一員でないか、誰が重要であって誰がそうでないかを知っていた。なぜある
221,。処刑されたのはティモシー・マクベイ。三十八歳。連邦政府に憎しみを持つミリシア（民兵組織）の一員であった。千九百九十五年四月十九日、オクラホマシティの連邦政府ビルが爆破された事件をご記憶の読者
222,どうして」と私。しかし、聞くのも愚かだった。オーストラリアは何よりも英連邦の一員だった。十二時過ぎ、階下の教員クラブに行き、松井さん、ジョン・クラーク氏を交え、四人で
223,認め、国家や地域間の経済競争の時代には、日本の国家の利害が西側の一員であるという「単なる言葉のうえの認識」よりも重要だと述べた。力
224,左手甲を骨折、６月に左ふくらはぎを肉離れ。代表入りは絶望視されながら、逆転で星野ジャパンの一員に選ばれた。最後の最後まで、何が起きるか分からないのは世の
225,独自の目標設定について、彼の自叙伝的な『第七書簡』に記述している。アテネの貴族の一員としての彼には、とりあえずは政治的な出世がごく手近にあったが、しかし
226,保つためには老人に優しい社会を築かなければならない．老人が年をとっても社会の一員として位置づけられる社会，そういう社会制度が結局は安く上がるため得であるという結論に
227,ておりました。二月に、中山太郎先生を団長として、自社さで米軍基地問題の調査プロジェクトチームというものの一員として、私もワシントン、ホノルルにともに行きました。その二月の初めの状況
228,を明かしている。早乙女は、九十一年生まれの栃木県出身。０７年、ＡＫＢ四十八に合格後はチームＢの一員として活動していた。二千九年１月に”降格”処分を受け、３月から発足した「チーム研究生」
229,嵐のメンバーが、クレーム処理を専門にうけおう、日本初のクレーム処理会社「クレームエージェント嵐！」の一員としてがんばっている新番組「Ｃの嵐！」。ゴミ問題、放置自転車など、視聴者から届いた
230,からである。すべてを知るには、カヴンの一員にならねばなるまいし、一員になればなったで、秘密を守る誓いを立てたために、それについて書くことができ
231,魚釣りをしたりして遊んでいました。当時は子どもであっても、家族の一員として家の仕事をすることが当たり前でしたので、学校での出来事を話すの
232,余り、家庭への関心がおろそかになっていたのだろう。しかしそれでもさすがに家族の一員が欠けていることに、ようやく気づいたらしかった。「あの子ですか？
233,を貼り付けた。そして、トラックから二人乗りスポーツカーまでの各種四輪車と、二輪車の大集団の一員となり、元旦の午前十一時を期してベルサイユ宮殿前を出発し、一路地中海へ向けて南下し
234,からだという。だが、口ではなく態度で示すものもある。「会社の一員としての姿勢とかは、口じゃわからないんです。そういうのは自分がまず
235,たのでμはその竹輪の後を追いました。これが子猫μが前沢家の一員として第一歩を印した瞬間のことです。この時からμはもう少女の家の
236,彼女には四歳の子供がいたうえに、結婚すれば、彼女の母親も家族の一員としていっしょに住むことになっていたが、私は、全員がいっしょに住めるのはもちろん
237,ことをしたからこそ与えられたお金なのである。また私は、家族に寄与する一員としても認められたのである。もう、父や母に全面的に頼らなくても済む
238,国づくりを進めてまいります。インドネシア・スマトラ島沖大地震及び津波災害で被災した各国に対しては、同じアジアの一員として、資金、技術・知識、人的貢献のそれぞれの観点から最大限の支援を行ってまいります
239,になった火山。「マーケティングと自己実現の両立」を追究した。企業も社会の一員。＜競争＞と＜利他＞が経営戦略になると信じた。トップを巻き込む＜
240,。たとえば青年士官のころは、日露戦役の時期と重なっており、旅順要塞攻防戦では海軍重砲隊の一員として参戦、無力な陸軍砲兵を尻目に、黒井悌次郎大佐の元で大活躍した。また壮年
241,のケアを十分にすることで、病んだものを治し、また新たに会社の一員として生産に従事させる、ということが会社の明日の活力を生み出すために必要なこと
242,重要である。３地域防災活動への貢献企業は，自社の災害対策だけでなく，コミュニティの一員としての役割を果たすことも重要である。企業の持っている資源（人材・土地建物・資材等）を活かし
243,にひんしているのを心から心配している。世間知らずの学者であっても民主社会の一員であることに変わりはない。多くの人と同じように岸首相が今までの行きがかり
244,。麻酔から覚醒したりんごちゃん元気でしたよ！！愛犬は大切な家族の一員。そう考えるオーナーにとって、愛犬の避妊・去勢の肯否は避けては通れない問題といえる
245,のフクイくんに、アドバイスをした。フクイくんは、〈青狼連盟〉という、大きなグループの一員である。彼は、わたしのアドバイスを受け入れ、「今夜はやばいらしい」と
246,危機に瀕していた。というのも、ローズヴェルトは「インドには戦争中、連邦の一員という地位を、五年ないし十年後には完全な自由という選択肢が与えられるべきだ」
247,でも書いたように、民主党から離党表明した渡辺・大江両氏は参院比例区の選出議員。「民主党の一員」であるからこそ議員になっているという立場で、その党から離党するというのならばまず
248,思い知らされるのだった。千九百八十一年八月から十一月までの三カ月間、国際協力事業団の組織したカンボジア難民救済日本医療チームの一員として雨季のタイで暮らした。募集の段階では何科の医者でも可と
249,中で基礎年金の給付水準にかかわる法案修正の動きが出ておりますが、大臣、与党の一員として情報を仕入れていらっしゃいますか。○中曽根国務大臣年金関連法案の修正につきましては、
250,。ピエール・ド・リュクサンブールの場合が、それを証している。（十七）ルクセングルク（リュクサンブール）家の一員であるアルトワのサンボール領ならびにバーのリニイ領の伯で、ブルゴーニュ候に近侍したヴァレラン・ド・リュクサンブールの弟
251,た。Ｊファミリーの３姉妹と一緒に年賀状を飾ったオウジ・・・もう既に家族の一員でありトライアル卒業の様です。Ｊファミリーの皆様へ安心して、オウジをお任せ出来ます。宜しくお願い致し
252,そつなくこなし、ぼくと義兄の和也さんはあまり共通の話題はないものの、家族の一員としてごく普通に接している。彰は姉の一人息子の卓郎が大好きだ。卓郎
253,豊富な知見を有しており，ＵＮＥＰの活動においては，理事国となるなど，国際社会の一員として積極的に貢献してきた。今後ともＵＮＥＰにおける「国際環境情報源照会制度」（ＩＮＦＯＴＥＲＲＡ），「環境の
254,ドイツ連邦共和国（西ドイツ）となった。連邦共和国は，キリスト教民主同盟のアデナウアー首相の指導で，西側の一員となって経済復興に成功し，五十四年のパリ協定で主権を回復した。一方，ソ連管理地区も
255,講座を持っている。また、民主党の中米問題コンサルタントとして活躍するかたわら、千九百八十二年以降、さまざまな議会代表団の一員として中米を訪れるとともに、学会、ティーチインを組織したり、学会誌や政治専門誌に寄稿し
256,を見ない人とはずいぶん違うものである。彼は明らかに子猫を「我が家の一員」として暖かく迎え入れたのである。彼は別にこんな詩も作っている。
257,選ぶ。しかし、所属チームの消滅という非常事態は選手人生を大きく変えた。横浜Ｆの一員として摑んだ天皇杯優勝という栄光。そして、ステージ優勝を果たせなかったＣ大阪での二千年第１ステージと
258,れる。これこそが，ＥＣ経済再建への真の道であり，また，世界経済の三極の一員として自由貿易体制の維持・強化の役割を担うＥＣの責務でもある。八十六年９月に開始さ
259,た方がいらっしゃいます。人間は決して一人では生きていけません。社会の一員として、自覚と責任を持っていかないと一人前の社会人とはいえません。
260,」という自分個人にとっての動機が，それぞれ，四十％を超えているのに対し，「社会の一員として気の毒な人を見過ごせないから」という他人に関する動機を挙げる者は二十％に満た
261,政治運動として民衆の支持を増やすためであった。「わたしは時々、同じタイ系諸民族の一員なのに、どうしてタイ人とラオ人だけがタイとラオスという自分たちの独立国を持ってい
262,ともし判断したとしたら、少し奇異なことである。）日本がまだ完全に西側の一員になり切っていないのではないか、という疑念がアメリカ人の胸のなかで頭をもたげること
263,に踏みとどまらねばなりません。多くの情緒的音楽家たちの場合には―私もその一員なのですが―感動が非常に強くて、もはやあらゆる細部を聴いていないことが
264,て体調もベストに近い状態に戻ったことを確認できたし、何よりも代表の一員としてふたたび国際試合のピッチに立てたことで自信を取り戻すことができた。チームとしても
265,来られそうだって」「それはよかった。今や彼も、我が家族の一員だからね」トレースはそう言ってオナーの手を取り、暖かい家の中へ
266,な緑ー！私には背景にマーモンが見えます。あの子だってヴァリアーの一員なんだいっ！（主張）いやー・・語りだすとこの表紙絵だけでジャンプ感想終わっちゃう
267,親戚やお世話になった方にあいさつに行くのを忘れずに。■社会の一員としての出発点成人式を境に，世間に認められる一人前の大人に変身するわけではない
268,非難は、カナダ国内親英派による、ピアソンが展開する外交政策批判の声をも大きくした。イギリス連邦の一員であるカナダが、国連緊急軍派遣の提唱によってイギリスの「スエズ運河喪失」に手を貸すのは、
269,と、磁石のように登山家を引きつける。彼らは希望を提供する企業に集まり、その一員となって働こうとするはずだ。ＡＤＰ社は情報とトランザクション処理を金融業界に提供するプロバイダ
270,も、実は、森井委員長から冒頭調査の報告がありましたように、私も調査団の一員、こういうことで現地を十分に拝見させていただきました。そういう中でいろいろ
271,か覚えるだけで、愛犬とのつきあいがずっと楽になります。よりよい家族の一員に育てられる可能性も、それだけ高まるでしょう。しつけは、ほめるのが基本動物
272,建物を設計していた。またデイはセントルイスの図書館設計に際して、ギルバートを選んだ審査委員会の一員であった。デイの助言にしたがって、図書館理事会は２段階の競争に同意した。この
273,）は、しばしば使用人（血縁関係でない）の分家を分枝してやり、彼を同族の一員として扱った。このような分家は多くは血縁の分家よりも低い社会的地位におか
274,ＮＡＴＯ同盟の枠組みが役立ったことは言うまでもない。航空製造企業エアバス誕生も、ＮＡＴＯの枠組みで西欧の一員となった西ドイツとフランスの蜜月関係が生んだものと言える。西欧は米国の庇護
275,の陸海軍は、その第一線で身を挺して働いていること。皆さんの子弟もその一員として国家の護りについていること。今日皆さんがお持ちになっている土地はすべて国土といっ
276,、何はともわれ同居を始めて無事１周年が過ぎました♪すっかり家族の一員です♪
277,には「オジンギがない」ことになる。同様の趣旨により、独身者はクルワの一員とはみなされていない。筆者の調査時に、商売の都合上専用の電話番号が電話帳に
278,ねらいは、地域社会から外に目を向けがちな生徒に、地域社会を見直し、地域の一員としての自覚をもたせ、地域活動への参加を促し、郷土理解を深めることにある
279,）は、言うまでもなく中国の空母保有といったような事態は阻止したい。ＮＡＴＯの一員であるトルコはこうした意向をくんで、廃艦ワリヤーグのボスポラス、ダーダネルス海峡の通過を頑
280,関わり、共に豊かで住みよい地域づくりに貢献しています。●誰もが地域社会の一員として、住みよさを実感し、連帯感も育まれています。学校では…●互いの
281,を探し求めなければならなかった。そこで千九百六十年五月に成立するＥＦＴＡ〔欧州自由貿易連合〕協定に署名した。ＥＦＴＡの一員であることは、欧州共同体との提携に代わるものでなく、オーストリアもそのように考えなかっ
282,発想はなかった。一つの村落の構成員すべてが、村の守り神のもとの共同体の一員とされた。そして、同じ村落の者が互いに助けあって生きるべきだと
283,何も変わっていかないということも往々にしてあるということも事実である。プロジェクトチームの一員として、先生方にいかにわかりやすく、そしてやわらかく提示し、クッションの役目を果たして、好意的な
284,葬儀や法事のみの付き合いとなったのは、残念なことです。家族の一員が亡くなった時のみにお願いするのではなく、日ごろから、菩提寺とのお付き合いはしておきたい
285,、家族内で死について話し合ったことがない人がほとんどである。よって、いざ家族の一員が死に瀕する事態になったときにパニックに陥ることが多い。２施設
286,ほうの計画はぶっつぶれずにすんだかもしれない。〈ヘリコプター〉はいまやおれをレジスタンスの一員だと信じている。彼のフランス語は申し分ないが、それでもおれのドイツ語訛りを見抜くほど
287,発揮いたしました。こうした我が国の行動に対し、訪問各国の首脳より、アジアの一員としての真剣な対応に大変信頼を強くしたとの言葉が寄せられたこと
288,一方で石原に投げかけられた。いうまでもなく、石原はれっきとした派閥の一員であった。派閥のバックがあってこそ、今日の石原が存在しているのである。派閥抜き
289,たというのが大方の意見ですが。バラハ：それは違う。私はチームの一員なだけで、一人では何もできなかっただろう。ヴァレンシアには素晴らしい選手が
290,ば、世界経済の活性化にとって大いに役立つものと存じます。我が国はあくまでもアジア・太平洋の一員であること、また、我が国の存立そのものが自由貿易体制の中にのみあることを
291,そのような話は聞こえてこない。僕は至って冷静だし、今はスペイン代表の一員として、この大会（ユーロ）で良い成績を収めることに集中しているんだ」人気：
292,が池内さん（愛生園よりの傍聴者）の胸に響いた。「われわれも社会の一員。社会が要求しているのはもちろん、患者にとってどんなに辛い言葉なのかを考えれ
293,ツノマタとともにヒジキも調理材料として示されている。ヒジキは正式にはジョロモク属の一員であるが、食用にされているのは、この属ではヒジキだけである。その
294,聊モ私心ヲ蓄ヘカラス」）などに表われているように、会社組織を構成している一員たる自覚のもとでの公私のけじめが強調されていることも重要なことである。
295,、といいたいのだ。そこで、オランダ人の植民者の子であるスプリンガー少年と、軍事占領者の一員である阿部知二とは、細い線でつながる。加害者でありながら被害者。このオランダ人の少年（
296,作品でも、ソコにちょこっと出るだけで大喜び。なもんで、犬もキャストの一員としてしっかり描かれた極上のドラマとなると、“そこまで号泣するか！？”
297,絵を包んでいた風呂敷を持っている。彼女もさっき駅前を掃除していた老人たちの一員なのだろうか。意思の強そうな顔立ちの女性だった。月子はそれを
298,も持たなければと考えるからだが、子育てが終わると子どもは人類の他の一員となんら変わりがなく、むしろ期待はずれになる。ジェニーとクリスはすなおでおとなしい子どもだっ
299,●国産車メーカー三菱（三菱自動車）ＭＩＴＳＵＢＩＳＨＩ◆三菱自動車とはどんなメーカー？その１／ダイムラー・クライスラーの一員。その初の開発モデル「ＣＯＬＴ」が示すように、これまでの三菱イメージは明らかに変化を
300,人生の重要な転換期にあることに気づくにとどまらず、日本人として、また人類の一員として、どのように生きていかなければならないかを、真剣に考えていることが表現された
301,ために、この憲章を定める。児童は、人として尊ばれる。児童は、社会の一員として重んぜられる。児童は、よい環境のなかで育てられる。児童福祉法児童福祉の基本法
302,でございますが、オランダにおいてもドイツにおいても、やはり国家としてまとまり、あるいは西欧の一員としての立場をしっかりとってきた。そういう意味において、自由主義陣営が結束、連帯を
303,が、宮廷における立場の卑さとはべつに嵯峨の私的サロンの中でのみ有力な一員でありえたのは、逸勢の才華によるとはいえ、空海の庇護があずかって力
304,とは関係なさそうな、パレスチナの難民や、南米で政治運動をしているデモ隊の一員や、東南アジアの地方都市の人だったりすると、ちょっと考えてしまうのだ。つまり、マイク
305,もとからの住人にどこか似た夫婦が日本列島をはなれ、自分たちの新しい国の一員になって、老後を大西洋岸のその土地で過ごすことになる、などと想像してみたことがあっ
306,女として見る事ができるんでしょうか？女としてみてもらいにくくなると思います。家族の一員か料理係、洗濯係くらいにしか思ってもらえないと思います。でもＳＥＸは求めてきます
307,この時代に狂信的反ユダヤ主義者、また反ユダヤ主義的ドイツ民族主義者になった）、大戦の前年ミュンヘンに移り住み、バイエルン軍の一員として大戦に参加、戦後軍の思想統制の仕事に従事、その関係から右翼運動と接触し始めた
308,体を動かそうが知恵を使おうがサラリーとは無関係である。会社は社員に会社の一員としての給料を支払う。つまり、その人がその会社での生活をしていく上で
309,配下の最高幹部と役員がただちにに除去されたと述べました・・・ロスチャイルド・ファミリーの一員であるネーサン・ロスチャイルドは星からの使者インディゴであり、彼はロスチャイルド家の中で唯一、ＮＥＳＡＲＡ．の
310,金額にすれば大変な削減ですよ。これをやれば日本に対して、さらに西側の一員としてそれを肩がわりをする圧力がかかってくるんじゃないか、まずこのことを考える
311,たケースもあります（大阪地裁昭和六十一年３月二十七日判決）。（３）ファミリー・カー家族の一員が起こした交通事故について，他の家族や家族主宰者（たとえば，父親）が運行供用者責任を負う
312,》ってことは？」「なんですって？このぼくが？カルトの一員ですって？まさか！」とジミー。「フム。では、さしつかえなければお聞かせ願いましょう
313,とそれはナショナリズムだと批判される。しかし、日本国家が厳としてあり、その一員である以上、その政治的な力を自分とは別のところにおいては対応し切れません。
314,から守るために、今あなたにできることを考える」をテーマに、子どもが地域の一員として尊重され、自分をかけがえのない存在であると思える地域づくりを具体的に考えます。
315,、自信に乏しく、どこか暗い感じさえ与える生徒でした。ところが、ある劇団の一員として採用され、演技が認められたのがきっかけで、彼女は驚くほど変ってしまっ
316,、公権力自身です。だから個人情報保護法の仕組みの一番大事なところは、市民、あるいは市民社会の一員であるジャーナリズムが、公権力が保有している個人情報を不正な目的に使ったりしないように
