,0
106,を基礎にしたアジア・太平洋地域における国際秩序をワシントン体制といいます。日本は、帝国主義列強の一員となり、イギリス・フランス・イタリアとともに国際連盟の四常任理事国の一角を占め、国際政治における発言権を強め
107,男の子は生後三十日め、女の子は三十一日め、赤ちゃんを氏神様に連れていって、氏子の一員として認めてもらうと同時に、今後の健やかな成長を祈る儀式です。お宮参りの
108,な分家は多くは血縁の分家よりも低い社会的地位におかれたが、同族の一員として、生活の上で緊密な関係を持った。多くの場合、そのような
109,ドッグタイプテスト犬は、仲間意識がとっても強い動物。愛犬家の人たちは、犬を家族の一員としてかわいがっていることでしょう。それでは、もしもあなたが犬だったら……？あなたは
110,、そのたびにその徴候はあらわれた。しかし、僕が、最後に、敵戦車爆破隊の一員として、生死と対決したときに、それはもっとも明確な形をとった。僕
111,、人々と親しく交流するリーダーはそうでないリーダーに比べて、メンバーに「家族」の一員として迎えられる確率がはるかに高い。人間は自分が好ましく思い、信用している相手
112,ていますが、どう言う戦いがあったのでしょうか？日本は日英同盟に基づき連合国の一員として参戦し、陸軍はドイツが権益を持つ中華民国山東省の租借地青島を攻略、海軍は南洋諸島
113,失ったメンバーの姿に、戸田が激怒したのである。山本伸一も「水滸会」の一員であった。彼はメンバーが師の心を知らず、「水滸会」の目的を
114,とかに、ぜひお読みいただきたく思います。１回目は、七十年代編。ちなみに小田がオフコースの一員としてメジャーデビューしたのが、まさに千九百七十年であった。でも、その前に…。彼が
115,その宣告のような。「しかし、そうは言っても、安良さんも神領家の一員ということになるのでしょう？失礼ですが、なぜこんなところに？」「さあねえ
116,あります。皆さんが暮らしているまちをより住みよいものにするために、地域で支え合う一員として、あなたにもできることを探してみませんか？地域にあるさまざまな課題
117,明治の頃、佐吉と従業員にとって、会社は即家庭であり、皆は家族の一員であり家人である。この考え方は日本の伝統的なイエ思想に基づいている。佐吉が従業員を
118,述べている。ペドロ・マルティルが右の事を記述していたそのころ、彼はインディアス顧問会議を構成する一員だったので、そうした情報が提供されたわけである。ペドロ・マルティルは千五百十八年にインディアス顧問会議
119,も、すべて出席していた。ジャッキーは再婚していたが、いまでもまだケネディ家の一員と考えられていたのである。その証拠に、彼女はアーリントン国立墓地の見事に手入れされた
120,目標となっていた。そして彼は、ロブ・フォークが忌み嫌うものすべてを象徴している―排他的集団の一員で、特権地域、つまり外交官の集まる地域の出身なのだから。ロブは銃口を
121,農民問題といえば農奴以外ではなかったのである。農民は「ミール」とよばれる共同体の一員であった。彼らは村の集会で村長、村役人を選び、農作業の手順をはじめ
122,についてもやはり鉄道荷物の職員については考えるべきではないかと、こういうふうに関連産業の一員として、責任者として思うわけでありますが、きょうは交通公社とか弘済会の例を言え
123,発展し、ついには命を落とした。この喧嘩相手、前歴を看破った者がマスターストロークの一員でないとはいい切れません」一理ある推論だった。「き、君は
124,ように弄り回していた神楽が時限爆弾を起動させた。突入をしようとする真選組の一員を突破して走り出す銀時。爆発寸前で神楽が銀時をホームランして何とか難を逃れる。そんな
125,ようなことで関係省庁からの申し合わせも行っておるところでございまして、私どももその一員といたしまして各省と連絡調整を図りながら適切に対処してまいりたいというふうに考え
126,の話を持ち出して怒鳴りたい衝動はぐっと抑えよう。それより「ならばこの家の一員としてお前はどういう形で貢献するべきだと思う？」とか「家族一人ひとりの役割
127,の奥には当時まだ大きなヒッピー・コミューンが残っていました。彼女はそこでコミューンの一員として生活しました。そこの水はマルタの霊能力に大きな影響を与えました。
128,からいってもまずいか。また、国際社会、なかんずく同盟諸国との関係、特に西側の一員としてそれはやらなければならぬかという立場に立って、防衛力整備という問題は考えるべきです。
129,一流の馬の調教師になることだけを考えていた。最高の調教師、エリートの一員になるのに必要なものは持っていると信じていた。だがその後、ローラ
130,いっそう発揮されている。個人として私たちは微力であるが、科学的社会主義の学説に立つ党の一員として集団的、民主的に活動しているから、「正しいので全能」な水準に限りなく接近できるという
131,いったいどうなってるんだ？」軍曹がたずねた。「ぼくはネットフォース・エクスプローラーズの一員です」マットはあえぎながら説明した。「ワシントンのネットフォースを通じてキャプテン・ウィンターズに連絡してくれれば、
132,ｂａｓｕａｉｓｙｏｕ＠ｃｉｔｙ．ｔｅｎｒｉ．ｎａｒａ．ｊｐ）へＴｈｅＨｕｍａｎＲｉｇｈｔｓ人権を考えてみませんか百四十八同じ社会の一員として身体障害・知的障害・精神障害などの障害がある人は、社会的な誤解や偏見などによって
133,の原藻と違い、原始紅藻綱の仲間で、いわば下等な紅藻ということになる。アマノリ属の一員であるが、この属の紅藻は日本には十種ほどあり、すべて食用になり、
134,貴女はミルフィオーレの一員です。御好きに選択どうぞ！■朝、遭遇…！１『おっはよー！』
135,」のなかで、「我々引率者側ヨリ当時ノ状態ヲ見ル時、華人労務者即チ産業戦士ノ一員トシテ共ニ提携シテ活躍セント大東亜省ノ指示ニ依リ誓ヒ来リシ者ニ対シ何故、警察側ガ斯クモ物々シキ警戒ヲナスヤ、
136,、女優なんだ」メリーは悲しげにつぶやいた。「あなたはきらびやかな社会の一員になってしまったのね」「きらびやか？」チャールズがきき返す。「みんな、ふつう
137,千葉大学は、「時代にふさわしい高い専門性と総合的判断力を持ち、国際化・情報化の進んだ人類社会の一員として、創造的に行動する能力を持った人材を養成する」ことを目標としている。
138,五年も住んでいるけれど、私たちはつねに外国人のコミュニティに属していて、タイ社会の一員ではないわけでしょう。外国人であるがゆえに、一般市民のスタンダードよりもちょっとばかりよい
139,た。七年間、ぼくは商売人たちのまわりで暮らしてきたが、一度として自分がその一員だと思ったことはなかったはずだ。それなのにこの時、ぼくは彼らの
140,ＩＵＣＮ（国際自然保護連合）等が作成した「新世界環境保全戦略」から作成。（２）地球生態系の一員としての今後の取組問題は、人命や人の健康への差し迫った危険を
141,ためらったが、すぐに断固として奏でた。「それでもおれは天の川の一員だ。天の川の利益を犠牲にするわけにはいかない。こっちがアンドロメダに手
142,高齢者が趣味のサークル活動を楽しんでいる。高齢者自身が施設の運営に参加しており，社会の一員として生活している。一方，この国では，図十一のように出生率が低く，
143,味わうことを学ぶと宣言する。人が詩を読み，書くのは情熱溢れる人間の一員である証拠であり，詩は人間の生きる糧であると語るキーティングは，ホイットマンの「おお
144,送れるよう支援するとともに，高齢者がそれぞれの経験と能力をいかし，高齢社会を支える重要な一員として各種の社会的な活動に積極的に参加できるための条件の整備を図る。また，個々人
145,ない快さなのである。自我というカプセルで心を包んでいるから、われわれは社会の一員として社会に生きることを許されている。子どもが社会の構成員として半人前といわ
146,させ、前の右少弁にもどして、その官籍も、政事にかかわりのない絵所の一員に移す―とはしていたのである。が、絵所の弁殿の志士的な気概
147,はｗｗｗ．ｊｗｌｙ．ｃｏｍ。韓国ではＢｏＡと並ぶ人気のトップアイドルイ・ヒョリ元々はＦｉｎ．Ｋ．Ｌというアイドルグループの一員。当時から一定の人気はあったが、’０３年、下のアルバムでソロとして
148,ぼくの父親は、協和会の幹部だった。つまり、大日本帝国を支える大政翼賛会の地方幹部の一員であった。家庭の暴君であったこととこの勲章とのあいだにはなんらの因果関係
149,共通のものが多いが、このことに見られるように、人類は、地球生態系の一員として地球の歴史を他の生物と共有しつつ、その生存を続けている。「今日
150,背景には同属社会に属する、または同属社会から離れるというセレモニー的感覚があり、全体の中の一員という認識、つまり同属意識が極めて強いことがその背景にあります。換言すれば、日本式
151,をまとめた「マンション対応マニュアル」を作成します。新たに区民になった人も地域の一員として迎え入れ、新旧の住民がともに地域活動に取り組めるよう支援します。また、自治会の
152,は平成七年に参議院議員にさせていただいて、国会、立法の機関として、国会議員の一員として、これは平成二年に衆議院も参議院も決議を出したことに対して、私たちは
153,崩れると、自然破壊となってそのほこ先は人間社会に向けられ、やがて、自然を構成する一員としての私たち自身の存在をおびやかすことになる。その自然環境が国の手によって、封印され
154,にともなうショックである。このようなショック，あるいはそれに伴う課題に対処し，組織の一員としてアイデンティティーを確立していく，というステップは，発達論的キャリア論においては，生涯にわたってつづくプロセスの縮図
155,早いものだった。わたしたちの友情関係はブエノスアイレスでも続き、わたしはまるでゲバラ家の一員のように、ほかの弟妹たちとも親しい関係を続けていた。わたしたちはお互いに
156,が千九百九十年代の初めまで、経済を主に支配していた。私は大手企業のスタッフの一員となった。ＤＴＬを始めるまでの私の履歴書の経歴を見ると、調査（
157,ように変化する。具体的には、地域住民として「対等に付き合える関係づくり」「共生社会」の一員へのまなざしへと移っていく。日本政府のまなざしとメディアのまなざしは必ずしも同じではない
158,防ぐとともに，落葉によって栄養分を沿岸の動植物に供給しており，熱帯や亜熱帯の生物の一員として欠くことのできない存在である。◀マングローブ▶
159,塗炭の苦しみにあえいでいる農家はどうなるのですか。私は、先般災害対策特別委員会の調査団の一員として参加をいたし、現地をつぶさに見てまいりました。ビニールハウスが辛うじて守られてい
160,をしますがオーストラリアやカナダのような大きな国がなぜいつまでも英連邦なんかの一員なのでしょうか？未だにイギリスが支配しているのですか？これらの国は、大英帝国崩壊後、
161,た」と見なされてすでに長い年月を経ているのだ。キャシーは寛解者の社会の一員である。入院と治療から何年もたった今でも、彼女は自分自身の身に起こっ
162,権利を有するものとする」（第３条第１項）、「すべて障害者は、社会を構成する一員として社会、経済、文化その他あらゆる分野の活動に参加する機会を与えられるものと
163,にこれを貼りつけるとする。これは宣伝効果があるだけでなく、「自分はデルタ航空の一員である」という一体感を感じさせる効果もある。管理法としては、かなり巧妙だと
164,、この努力は、自己という束縛からわたしたちを解放し、わたしたちを最も偉大な人々の一員にします。五十二いかなる問題も、それをつくりだした同じ意識によって解決することはでき
165,ことになります。ところが、ユダヤ人はそんなことは信じません。あれは同じユダヤ人の一員であって、普通に死んだのだ、神様でも何でもなかったと言います
166,この言葉は身に沁みました。将来なにをやるかに関わらず、所属集団の一員としての評価より、個人としての評価のほうが点が高い、という人間になれ
167,なってきた。企業も暮しの多様な面とのバランスを考えながら、社会の一員としての責任や貢献を要求され、自らの体質を改善していくことが求められている
168,な構成員として人権を尊重され，自己選択と自己決定の下に社会活動に参加・参画し，社会の一員として責任を分かち合う社会の実現を目指している。障害のある人の社会への
169,とを混同している。「すばらしいプロレタリア社会」（そんな言い方が許されるとして）の一員ではないこれらの人にズバリ当てはまるのは、トラーヴェンという名の、この問題に
170,のにぶい私は、そのときになって初めて、人気者に迷惑をかけているマスコミの一員である自分に気づく始末だった。荒木にとって二度目の甲子園にあたる、昭和五十六年三月
171,れた課題でした。この問題は、日本が西洋の一員か、東洋の一員か、との自己認識への問いとして、近現代をつうじて人びとに抱かれてきてい
172,た。「ええ」「きみなら見つけられると思っていましたよ。奇術師協会の一員なら、誰だって《ペッパーの幽霊》には気づくでしょうから」ヒーローは鋭く
173,に反対するとの原則的な態度をも明確にしたのである。登山活動は自然の一員としての人間が、より人間らしい資質を合理的に発達させるためにつくりだした、すぐれた
174,未来，ニチメン・日商岩井ホールディングス，ほくぎんフィナンシャルグループ，コムシスホールディングス，アルフレッサホールディングス，宮地エンジニアリンググループ，メルコホールディングス），企業グループの一員をなしていた会社の上場（形態Ｃ）（セイコーエプソン，三井海洋開発，ファイナンス・オール，マッグガーデン），
175,供用利用や家業のために使用されている場合には，所有名義は誰であれ家族の一員が起こした事故につき，他の家族，特に家族主宰者は運行供用者責任を負うと解され
176,（６）千八百五十八―千九百三十八。外交官。ヴェルサイユの講和条約では、アメリカの外交団の一員として交渉に臨んだ。ウィルソンの助言者として、国際連盟の設立にも寄与した。
177,五十四人だけである。残る十八人（うち三人は建碑までに死亡）は、なぜ義援の一員とならなかったのだろうか。富一郎の示す労働条件に異見を唱え、かなり早い時期に
178,のような内容であった。「わが国が、平和条約の発効により再び国際社会の一員となってから一年有余、その間変転する国際情勢のうちにあって、よく世界の友邦諸国
179,成り立っている。つながりを断ち切られれば，生態系は機能しなくなる。人間も生態系の一員である。現在の水田地帯はすっかりようすが変わってしまった。潅漑用水は周辺との
180,）は、エーゲ海北岸のイオニア系植民都市スタゲイロスに生まれた。十七歳でプラトンの学園アカデメイアに入門、二十年間その一員として学究生活を送る（アカデメイア時代）。前三百四十八年、アテナイを離れ、アッソス、レスボス島を遍歴
181,はいないということです。誰でも少なからず、入社した以上、この会社の一員となって自分は何をしたいのか、何ができるかと、夢を
182,、神、キリスト、そしてキリスト教共同体全体であった。たとえサタンに攻撃されようと、少なくとも大軍の一員となって、霧のなかで保護の隊列に包みこんでもらえると感じることができた。
183,は、松江くにびきメッセで開催された中四国地区仏教婦人大会で、五千人もの婦人大会の運営を取り仕切る幹部の一員となっています。数年前には、同好の方々とインドにいって釈迦如来の
184,からのたっての頼みである。ことわる理由がなかった。二千三年、同じヤンキースの一員として、それこそ寝るとき以外の大半を、松井選手とともに行動してきた。あるとき
185,美の世界を創り上げていった。しかし、Ｖ・イワーノフやブリューソフらに代表され、スクリャービンを一員とする後期ロシア象徴主義者たちは、前期ロシア象徴主義の世界観を受け継ぎながらも、その中心的特質だった芸術至上主義に異
186,も、三軒の中では、零落はしたが、今なお高貴な家族の一員といった感じがある。私は、ときどき、一ペニーの酢づけトリガイなどたべながらで申し訳ないとあやまり
187,骨子の一つは、こういうことだ。個人の見解はヒソヒソ話の世界。組織の一員としては別の基準で公的に語る。仕事の喜びがあれば、一方で組織
188,れ、「愛神愛人」の思想が目覚めた。花岡山結盟の参加により浮田は「熊本バンド」の一員として信仰の第一歩を踏み出していた。一方、浮田が非聖職者ジェーンスを介して受容した
189,、京都会議で一定の前進がみられましたが、まだ日本の社会に不可欠の一員として根付くまでには至っていません。それだけに、市民によって支えられ市民の
190,奴」を標的として猛烈な毒舌を吐き散らしていた。言うまでもなく、グツェリエフもチョールヌィの一員である。しかし、ザル経済の中に張り巡らした鋭いアンテナを通じてグツェリエフは、自由民主党は取引できる政党
191,きっかけになった。それはまた、ソ連の脅威を実感した日本が、西側の一員だという自己認識を強める契機にもなった。他方、米国や西欧も、この事件
192,必ずしも基づくのではないので勝者と敗者が存在しない。すべての人はコミュニティーを形成する対等な一員と見なされ、お互いに敬い、自分たちが共同でこしらえた社会のルールを守る。
193,午後友人は去って行き、私はブリムフィールド雑貨店の裏手のゲリ・スミッソンとエシの家庭の一員となった。翌朝、私は店の横の巨大な樫の木の下に
194,じゃないの？」福盛「おまえが私を拒んでも、おまえが私のクラスの一員でいる間は絶対に見過ごすわけにはいかない」あずみ「バカでしょう！あんた」福盛「バカか
195,そして、現実に自分を殺そうとしているあの侍女は、何か特殊な集団の一員らしい。侍女の件は後回しだった。まずは裏切り者の名前を国王に告げ
196,共産主義者でも宗教過激派でも国家主義者でも国粋主義者でも無政府主義者でも犯罪者でも犯罪組織の一員でも腐敗した権力者でもこれらの折衷でもないからどうかあなたが気持ちとして
197,二小５年、■■■■くん。当日は、木遣り道中や打ち上げ前の口上など、子どもたちも地域の一員としてお祭りを盛り上げます。区長紹介名前：■■■■生年月日：昭和二十四年１月二十日山羊座（清見寺
198,する。しかし、本当に個人が背骨を伸ばして生きるためには、自分も国家の一員としての参加費、維持費を払わなければならない。そのためには、比率を同一にすれば
199,だろう。実は人間は全てのものを自然から借りている。そして人間も自然の一員だから、ジックリ考えれば、「人間に優しい」ということと「自然に優しい」
200,へ帰還を許されるのである。子どもというものはまず共同体のものであり、共同体の一員になるまでは子は親の元には置けないという、宮崎自身もおそらく気が
201,、ハンブルグ、パリにおいても、事業を行う者は皆、誰がその少数独裁の一員であって、誰が一員でないか、誰が重要であって誰がそうでないかを
202,小さいから、島自体がみんなの家みたいなものでしょう。中に入ると、家族の一員のような気になっちゃうんです。サブタイトルに風の島とつけたのは、
203,最近ではペット専用の火葬場や霊園もあります。飼い主にとっては、ペットも家族の一員であるから当然のことと受け止められます。昔から人々の生活には、犬
204,率いるＧＵＮＧ‐ＨＯ‐ＧＵＮＳのメンバーとしてのチャペル・ザ・エヴァーグリーンがそれだ。実はウルフウッドもまた、ＧＵＮＧ‐ＨＯ‐ＧＵＮＳの一員なのである。このあたりのことについては『ＴＲＩＧＵＮ』に詳しいが、ウルフウッドがＧＵＮＧ‐ＨＯ‐ＧＵＮＳ
205,、ロバートには家族はありませんでした。ですから、ロバートをわたしたちの家族の一員にしてやってほしいのです。たとえ、初めは、それがどんなにむずかしいと思えるとしても
206,をもち，深く考え行動することが，私たちの使命であり課題であるのではないか。地球社会の一員として真の国際協力を求めて，世界各地で若者が活動している。ラオスで活動するＮＧＯ
207,イギリスの影響をみることができる。また，アフタヌーンティーを楽しむ習慣なども残っている。アジア・太平洋圏の一員として千九百六十年代まで，オーストラリアの最大貿易相手国はイギリスであった。その後，イギリスの占める
208,やヴェスパシアヌス等の軍務のプロたちが遂行中だったから、名門貴族のガルバには、皇帝随行団の一員がふさわしかったのだろう。ガルバ、四十七歳の年のことである。この後、アフリカ属州総督に選出さ
209,ているといわれています。たとえ日ごろはほとんど付き合いがなくなったとはいえ、家族の一員が死亡した場合には、その菩提寺に葬儀を依頼し、その後のさまざまな法事
210,外交面では、国連総会決議によって独立したこともあり、国連中心の外交を展開している。英連邦の一員、また、カリブ共同体の加盟国として、英国及びカリブ海諸国とは緊密な関係を有している。
