,0
0,、二十四％は減額支給もしくは無給となっている。社員は企業の一員であると同時に地域社会の一員でもあるため、社員の自発的なボランティア活動への参加が容易になるように、
1,５カ国は，英・フランス・ベネルクス３国（ベルギー・オランダ・ルクセンブルク）である。東アジア・東南アジアの解放と分断中国は戦後，５大国の一員としての地位を認められたが，国内では大戦末期から国民党と共産党の衝突が
2,方策がすでに取られているのですよ。その子の母親である女性も我等の組織の一員でしてね、彼女の一番の望みがその子の安全というものですから、我等
3,こと欠かない。衣服の着け方は特定の時節と結びついている。だから、例えば上流社会の一員を自負するヨーロッパ人なら、誰ひとりとして、六月一日になる前は白服を着用しない。
4,、それ以後の史料探索をこの二人にしぼった。宝暦明和度の甲申通信使は大坂で対馬訳官が一員を殺害するという異常事件がおこり、解決まで約一カ月大坂に滞留する異例な事態となった。
5,たものである。私たちはミスイが大好きだった。ミスイは私たち家族の大切な一員だった。その独特の個性、優れた知性のために、ミスイは親しい人間の
6,”と見なすようになった。現にウルマン神父の記憶では初めて、彼の親族の一員が共和党候補として議会に出馬した。「親父はさぞかし墓の下で呆れ返っているだろう」
7,た。結婚後、ジェレドはその理由を知った。それまでは、平社員から経営者一族の一員に出世したことにのぼせあがり、詮索するどころではなかった。自分の幸運を祝うのに忙しく
8,体験的な学習の一環としても貴重な場で、また地元の中学生が地域の一員として、地域行事の運営に参加することには、大きな意義があると思います。
9,メディア規制の第三者機関である「新聞苦情処理委員会」や「放送苦情処理委員会」に提訴することになる。英国では王室の一員だからといって、報道に手心が加えられたりすることはなかったし、また、
10,含まれる東アジア世界でも、狩猟社会あるいは狩猟集団は、中国を中心とする巨大な政治経済圏の一員として、大きな役割を果たしてきた。そこで需要が高かった狩猟産品は毛皮と薬
11,。政府は，その救援のため，国際緊急援助隊を派遣することを決定し，国際警察緊急援助隊も救助チームの一員として同国へ出動し，現地マンジール等で被災者の捜索，救出活動を行った。続いて，同援助隊
12,お寺に身を置くのではなく、町や村のひとの群の中に、群の一員としてはいっていって、生活の資を自分のちからで稼いで生きて、
13,は運動の中核に入ることを許し、少なくとも最高の民族、唯一無二の人種の一員であることを認めたことである。リーフェンシュタールの映像からはそれが読みとれるのだ。割
14,かあると分かっていて、野村のときのようにはいかせない。ＩＭプロの一員としてそう思う。だが、もちろん、堀河の個人的な力には限界がある。
15,〕。ＧＨＳ‐Ｒはグレリンが発見されるまで内因性リガンドが不明であったことで、いわゆるオーファン受容体の一員であった〔Ｈｏｗａｒｄら，千九百九十六〕。ＧＨＳ（ｇｒｏｗｔｈｈｏｒｍｏｎｅｓｅｃｒｅｔａｇｏｇｕｅ：成長ホルモン分泌促進因子）と
16,ハーバード天文台で，写真に写っている星のカタログをつくる作業がはじまった。その作業の一員であったリービットは，千八百九十五年から南天の変光星をみつける仕事を割り当てられていた。そして
17,抱きながら食べるのです。もちろん赤ちゃんがご飯を食べるわけではないけれど、「赤ちゃんも家族の一員なのだから、何でもいっしょに」という母の考えによるものでした。私は
18,だった。アユバはロンドンの人々を魅了したのである。アユバはロンドンの知名士たちの一員になった。千七百三十四年五月、アユバは王立協会に名誉会員として受け入れられるよう立候補、同年六月
19,である。彼は百七十年まえのやはり八月、第一次地球統合戦争の終結の日―平和会議の日本代表団の一員として出席したフローレンス・キミコ提督の従兵（人見一郎兵曹）として、ホノルルにあった時のことを思い出し
20,やって妻と二人の娘を養っていくか。今後どのようなかたちで社会の一員として復帰していくか。またしても隆志の脳裏にあのスナックでのママさんの言葉
21,から、なるべく仕事の状況を報告したがらない態度が生まれてくる。だが、組織の一員として仕事をすすめている以上、こうした自分だけの成果へのこだわりや、秘密主義
22,そのまま、先生のお宅に駆けつけた。単に、師弟の関係としてではなく、親戚の一員として、これは当然のことであった。もっとも親類とはいっても、谷口先生
23,から浮上した。調べでは、金容疑者は北の工作機関「対外情報調査部」の幹部で、商社代表団の一員を名乗って七十七年８月に来日。在日朝鮮人協力者とともに東京都三鷹市役所のガードマン、久米裕さんに
24,は、この連合国の占領は米国一国によるものかの如くに転換し、日本も防共の一員として育成しようという当初全然皆無であった一要素が占領政策に加味され始めたことは御承知の
25,」米沢藩上杉家は、帝のお召しによって御所内警備の任にあたっていた。つまり、公武合体派の一員として活動していた。その米沢藩軍に加わっていた武士のひとりが、率直にこういう
26,「たしかに、通りいっぺん以上の関心をいだいているとはいえます。レイチェルはわたしどもの一員ですし、それでいて…こういえばいいでしょうか…あの人は、中心から
27,警戒し合い、口をそろえて語り合う。われわれも自戒しなければならない。慎み深く行動しなくてはいけない。家族の一員でありながら、家長の罰を受けるような不始末をしでかせば、（たとえ隣家に逃げこん
28,できない。自分のエスニックバックグラウンドを消して、どの民族であろうと関係なく、アメリカ社会の一員であると感じられるためには、アメリカ消費文化のアイテムは、手軽で安くて便利です。アメリカ
29,のだろう。「いわゆるオアシス・プロジェクトです」加納は言った。「あなたはリンツ社の一員なんでしょう？どうして、担当者に聞かないのかしら？」「それができれば
30,、その個性に応じた対応がよりよくできるのではないでしょうか。地域でともに暮らす一員として、自立した暮らしの実現に向けた一歩を踏み出していきましょう。問人権政策課（☎
31,の戦績に絞れば欧州の７勝１敗。この８試合を振り返ると、欧州のチームの一員として延べ十四人の南米出身選手がプレーしてきたが、南米側のチームでプレーをした欧州
32,の入党申込書を書いた。私の入党は認められ、こうして私は日本共産党の一員になったのである。２民同の進出と片山内閣の懐柔策その後、大会を
33,で成人式実行委員会委員を募集二十歳を迎える若者の新成人としての門出をお祝いするとともに、社会の一員として自立することを願って、毎年成人式を行っています。この成人式は同年代の
34,の独立とともに英連邦に加わり、国連及びＩＭＦにも加盟し、カリブ共同体、ＣＤＢの一員としても活躍している。現バード政権は独立前から十三年にわたって政権を担当している。＊カリブ共同体（Ｃａｒｉｂｂｅａｎ
35,て面白がっていたと思えばまあ大した間違いはなかろう。集中排除法案なるものは一局の一員の手になるもので、何の意図が後ろにあったか未だに知るよし
36,及ぼしてきております。こういう意味で、我が国がＰＫＯに参加することは国連の一員としての当然の責任の遂行であり、そしてまた大国としての当然の役割分担であります。
37,ひとつの前提条件の上に成り立っている。つまり、個人とは、相互に依存しあう共同体の一員であるということである。（中略）土地倫理とは、この共同体という概念の枠を、
38,にその他のなんの役割もあたえられていなかったわけではない。彼は船内保安班の一員でもあった。しかし保安班が集合したり出動したりするような騒ぎは何ひとつ持ちあがら
39,真似して」（笑）。そういうふうに、本来なら、子ども集団のなかの一員としてやっていくことを、子どもに対してやっていくという不思議なことになっちゃっていた。
40,絆、教育、礼儀作法は、黒人クレオールにとって何より大切とされる。ニコレットはこの地域社会の一員にはならないだろうが、皆の中に溶け込んでいくだろう。学校や教会に
41,という。生活設計にあたっては，個人として自分が望む生き方と，家族の一員として自分にともなう責任や義務とを考慮し，最も適切な選択ができるように調整する
42,広島からは玉木。いずれも、貴重な戦力として活躍しました。来年も楽天の一員として活躍するでしょう。それに引き替え、腹が立つのは・・・（以下自粛）
43,ふえていくことは明らかです。この時代に、若い世代がアジアの一員、世界の一員として信頼され、自信をもって生きて行くためには、自国自賛をこえた、歴史
44,で言い切った。「言い得て妙ですね」自分もいつかは、その一員になってしまうのだろうか―と考えたファラダは、別の不安材料に気づいて、つい
45,ありかたや、価値観・規範等を学びとる。第三の力は他の子どもたちであり、子どもは子ども集団の一員となり、ことに遊びによって想像力や創造力を発展させ、精神の集中・躍動を経験し、
46,から国司が赴任する「遠の朝廷」であるのに対して、郡司は朝廷を構成する支配階級の一員とは見なされていなかったことの反映である（Ⅲ章中扉参照）。一方、城柵は
47,留守家族の所に仮住まいし、その年十一月、沖縄に帰還するときも、宇久氏の家族の一員ということにしてもらって、いっしょに帰ったのであり、現在も、親族以上の交際を続け
48,ｏｃｅａｎ（大洋）の語源となったオケアノスは、ガイアとウラノスから生まれたティタン神族の一員である。わたしたちは地球が丸いことを知っているが、古代の人々は、この世界
49,れて来たもんだなあ！と落胆したものだった。しかしもう前沢家の一員となってしまった以上、落胆ばかりしてはおれないのでμは一人になると
50,もなかったが、僕は彼女を説得して連れて行った。僕たちは巨人の一員なのだから、と。昨日までのチームメイトであった小林さんが僕の入団のため
51,「港九大隊」にたいして、イギリスはじつにつめたかった。日本の侵攻前に連合国の一員である中国のゲリラに、イギリスは武器を援助すると約束しながら、総督のサインがない
52,参画できる人材を育成することを目指しています。こうした人材は、家庭や地域社会の一員としての責任を持って環境に配慮した生活や活動を進め、また、環境問題に
53,に描かれたと考えられる。２人の少年は、ドルトレヒト周辺に住む裕福な一族の一員である。この地域は、背景に描かれた風景とよく似た地勢を示している
54,、その標準となる注意の程度は行為者自身の平常の注意程度ではなく、法律が社会共同生活の一員として要求する程度の注意である。換言すれば、社会共同生活の一員として要求せられる程度の注意を
55,の段階、４家族機能の再確立の段階、の４つから成り立っています。家族の一員がこの世からいなくなるという現実は、その結びつきが強い家族ほど深い喪失感と悲しみ
56,（ロ）外交（ａ）緊密な米加関係とともに，ＮＡＴＯ，自由主義陣営の一員として協調的外交を基本としている。特にマルルーニー政権は，「第３の選択」として米国以外の
57,あなたを通じて青年の反革命組織と関係をもっていたんだろう、あなたはその組織の一員で、ブハーリンとこの組織の連絡係をしていたんだろう。この組織のメンバーの名前
58,連ドラ放送され、好評を得た「ウォーターボーイズ」の２夜連続ＳＰ版。今回は連ドラ第１シリーズでボーイズの一員だった田中を主人公に、彼の成長と、南の島でシンクロに臨むことになっ
59,各手記からは、「東大卒」のエリートもまた、所詮「会社というバカでかい組織」の一員にすぎず、程度の差こそあれ会社に人格的に従属した職場生活を送っている実態が滲み出
60,国際社会における指導的地位の維持・強化を図るとの仏外交の基本目標の下、このために国連安全保障理事会常任理事国の一員としての地位を活用しつつ、仏独協調に基づいた欧州統合の積極的推進を図るとの基本路線に
61,の意味での霊的エネルギーの供給をしています。それは、地球もまた太陽系団の一員であり、太陽系を司る大きな意識からエネルギーを得て、その存在が許されているから
62,を、私たちは知っておくべきなのだ。東京裁判でオランダやフランスは、連合国の一員として日本軍国主義を厳しく断罪した。日本の植民地支配や軍事膨脹主義に対して、その批判は確かに歴史的普遍性
63,ますさかいなぁ・・・とはいえ、去年、ウチの再婚の際に我が家の一員になったばっかのころはかなり痩せっぽっちやったのが今はええ感じに、やし
64,おるから、目立つわけでもないでな」「あの男は祖父に家族の一員のように育てられたのです。長年祖父に仕え、西部でいっしょに従軍していまし
65,さそいを受諾した。もともと鷲津長弘が実権をにぎっていたころ、大内氏は武家組織の一員として足利に属していた。宮方を標榜したのは長弘への一時的対抗手段にすぎない。どちら
66,を求めるものに変質してきている状況を踏まえ、人間が個人として、また、社会の一員として、快適で充実した生活を送るためには、健康を維持・増進するとともに、安全性を確保し
67,政治を一日も早く粛正する必要があります。そのためにぜひわたくしを、国政担当者の一員にお加えいただきたい」「よくわかった。ご案のとおりにしよう」治済は承知し
68,レストランに入る前に■お客さまである前に、自分もまた、その場をつくる一員という自覚を持ち、次のチェックをしましょう。〈お手洗いを済ませます〉
69,。（七十）臨時約法の成立に見通しがついた宋教仁はみずから志願して蔡元培の一員に加わった。蔡らが北京に着くとまもなくいわゆる北京兵変が起り、袁世凱は宋教仁
70,とともに，青少年自らが正しい人権意識を身に付け，心身共に健全で，有為な社会の一員として育成されるよう，次の諸施策を講じている。（１）啓発広報活動国民一般が
71,千六百三十二〜千六百八十七イタリアのフィレンツで生まれフランスに渡り、ルイ十四世の宮廷の下僕として仕え、バレー団の一員となる。フランスバロック歌劇の基礎を確立。エール・タンドル（エールはアリアのこと、タンドルは愛らしい
72,』秋山勝美（３年目）「キャリア教育を本校で立ち上げたいので、プロジェクトチームの一員になってくれないか」という話を工藤校長からいただき、上越教育大学助教授の三村先生を訪ねた
73,」としての地位に甘んじなければならない。西ドイツがこの外交的な行きづまりを打開し、国際社会の一員として正式に復帰するには、やはり第二次大戦の「戦後処理」をきちんとしておく必要があった
74,、行衡はそう答えた。彼らを見ていてひとつわかったことがある。砧家の一員になる資格は「おおざっぱ」だと。「ねえねえ」「ねえねえ」
75,れたのが、高句麗滅亡当時には大和政権に使者として来日していた、高句麗の王族の一員である高麗若光（コマノ・ジャッコウ）だったのです。とても良い人選だったのではないでしょうか。何は
76,でございます。そこで、各市町当局あるいは被災者の方々から、私も調査団の現地参加の一員として、あるいはまた各班の視察団の中に加わりまして、両三度にわたりまして現地
77,の１階は、ペットのための食品やグッズが並べられている。▲「家族の一員としてのペットをサポートできるプロにならなければ…」
78,、日本政府と「女性のためのアジア平和国民基金」を批判する意見を述べられた。基金の一員として被害者への償いにかかわってきた一個人の立場から、思うところを述べたい。
79,担う勤労青少年には，主体的，積極的に自己を確立し，可能性を伸ばすとともに，社会の一員としての責任を果たすことが期待されている。こうした状況を踏まえ，平成
80,一日１分というのは屋敷のリップサービスで本当はしっかり勉強している。実は真田も研究会の一員で、住まいも近くとあって、二人は仲よしなのである。馬ができ、
81,，その充実を図っている。イ児童・生徒に対する交通安全教育児童・生徒に対する交通安全教育は，交通社会の一員として健全な社会人を育成することを目的として，小・中・高等学校の教育活動の全体を通じて行わ
82,の前で両手を合わせた。エルピー・プルのスパイ容疑はすぐに晴れた。ニュータイプ部隊の一員であることを、駆けつけたマガニーが証明したのである。「この少女がニュータイプ部隊の戦士
83,取るという部分では総務省の所管だと思っております。あるいは公務員改革を掲げる小泉内閣の一員として麻生大臣はどのようにお考えでしょうかと伺っております。○国務大臣（麻生太郎君）私
84,が救出する個人は、単なる一人の人間ではなく、政府の正統性がそこに由来する国民の一員としての個人（集合的存在の代表的個人）であるからである。事件が政府の政策にかかわる「
85,あとは―これが義務でないことは記憶してほしいが―みずから地球を訪れ、銀河評議会の一員に加わっていただけるとたいへんありがたい。どうだろうか？」「そうしよう」打てば
86,をケイド・ダリネードが元に戻すために、手を貸してくれたのだ。もちろん炎の一族の一員である彼が、その件に関して完全に無関係であったとはいえないだろう。
87,ていた頃、ダレスはアチソンに対して、朝鮮における情勢の変化で、日本が西側諸国の一員として信頼できる国になる見通しが疑わしくなった、と述べた。中ソによる対日平和攻勢が活発
88,やることは国民、国家の利益になる。橋本氏自公保三党の連立政権の内閣の一員として、お互いの信頼関係は大切にしていきたい。それぞれが政策をもって政党を
89,からの苦情が多くなってきています。ペットを飼うときには、家族の一員として愛情を持って、最後まで飼い続けることはもちろんのこと、ルールやマナーを守り
90,取り除き、できればやる気の出るような仕事を与えれば良いのである。せっかく採用しチームの一員となったＰ／Ａを、やる気のないままつかってはお互い不幸だ。《意欲の
91,その対象とする市場が狭く，立地する地域と密接にかかわっていることから，地域の一員として，社会的な役割を十分果たしつつ地域の中に確固たる経営基盤を構築する努力も
92,することで、だれもが犬やネコと対話できるようになります。家族の一員として犬やネコと接している人なら、その感覚がおわかりになると思います。それを
93,となれば人間は自己一身の栄達を求むることが自然的性情であると同時に、人が社会の一員として立つ以上、共同生存ということもまた人類自然の性情であらねばならぬ。したがって自己一人が富貴栄達
94,でて助けてと懇願していたのを告白していましたよアントニオ猪木だって代表団の一員としてＴＶ撮影隊と一緒でなければいかないでしょうそれだけ怖いところなのです
95,するなら、そいつが駄目なやつでも、そのことをやっているうちは社会の一員として認めてあげようとしないといけない。モハメド・アリが全盛時代に、相手に大して
96,頰ずりをして柔らかくふわふわした毛皮の感触を確かめた。ウルフはラティも群れの一員だと認めて、その顔を舌でぺろぺろと舐めはじめた。「よかった、
97,がこれだけ世の注目を浴びる話題となっていたことを考えると、シドニー・グループの一員である詩人トマス・ワトソンが、千五百八十五年頃かそれ以前に、『場の記憶術大綱』（Ｃｏｍｐｅｎｄｉｕｍｍｅｍｏｒｉａｅｌｏｃａｌｉｓ
98,「いいえ、切手も消印もありませんでした」「つまり、犯人グループの一員が直に関東トラベルの郵便受けに投げ込んだわけだ」「そうにちがいありません
99,の連携の必要性と具体的な連携のための調整方法医師と同じく，医療チームとしての一員として，お互いの役割や業務分担，責任の範囲を話し合いで明確にしておく。３
100,のモデルを以下に紹介しておきます．１医師：医療面で責任をもつチームの一員であるとともに，コンサルタントとしての役割を期待されています．そのため，精神医学だけでなく，グループダイナミックス
101,王室のために前王妃を離婚させたが、妃殿下の称号を残して、王室の一員として遇することを勧めたのは、他ならぬフォルジさ、慈愛の心の深いドクター
102,はその状態を当り前のこととして育ち、船の生命維持システムが供給する食物を掠奪する孤児の一員になっていた。ふとしたことで、乗員のやはり子孫である乗員につかまり、そこ
103,の自宅に、青山から電話があったのは、十月二十九日日曜日だった。霊感商法被害対策弁護団の一員だった河田は、これまでの経験から、オウムの「商法」に問題がある
104,なことである。各省庁がばらばらな国際対応をしたり、国会議員が外遊するたびに議決機関の一員である立場を忘れてあれこれ勝手な援助の約束をしてくるようなことは、
105,だから、社会的地位だってある。でも私を愛してるから、うちの家族の一員としての責任を果たすため、父の申し出を受けてくれた。うちは三姉妹で、
