,0
317,思いますが。○国務大臣（武部勤君）私は今国会議員ではありますが、政府の一員でございまして、そのことについて、いいかどうかということも含めて、お答え
318,カニ、クモ、ムカデなどとともに節足動物の仲間に分類される。カブトムシはコウチュウ目コガネムシ科の一員なので、分類学上の位置は、動物界・節足動物門・昆虫綱・コウチュウ目・コガネムシ科のカブトムシとなる。ヒメリンゴの葉の葉脈を
319,で合計約四千億円もの税金を納入することができる会社になったこと、私はその会社の一員であったことを誇りに思っています。どうしても、民営化というと国鉄改革のことを
320,と変わっていっていると二月十七日に述べている。テオドーアはアンデルセンの主治医であり、コリン一家の一員という立場からだけでなく、患者の気質もおおかた理解している医療の専門家という視点からもアンデルセン
321,た際、当時四十歳の笹田さんが第九のソリストを務めた。この時、コーラスの一員として出演したのが何よりの自慢である私の母は、「この時の笹田さんは
322,盲導犬になるのよ。しばらくあずかって育てているの。いまは、うちの家族の一員だけど、また訓練センターへ返さなければならないの」ドラマの中の女の子は、友だちに
323,お前らにいまの政策を批判する資格があるのか、と言いたい」ＹＫＫの一員であり森派会長でもある小泉氏は、九月十日発売の月刊誌で、次の十兆円補正批判を展開した
324,言って荷物を受け取ると、空港ロビーに回り、出国手続きを申請する。手続きと言っても、天体危機管理機構の一員であるレイノルズ司令が出国を許されない訳がない。黙って用意されているチャーター機にその
325,もよくわからない。僕はまだ正式の同盟員にはなっていないが、毎日Ｂ派の一員として作業をしている。だとすれば、あの男に血を流させた暴力に、
326,に対して毛利元就・輝元や小早川隆景から感状が発せられていることから判断して、吉利は、毛利方の一員として、本太城を守っていたものと思われる。毛利氏が、永禄初年に備中国を
327,が提供されるのである。教育とは、未成熟な存在である子どもたちを成熟した社会の一員へと変化させていく営みであり、学校という空間は、擬似的体験を通してそのトレーニングを
328,はえぐられるように痛んだ。ディーコンは言った。「おれはもう警察の一員じゃない。調べたくとも、鑑識課を抱えてるわけじゃないし。友人への好意からロリマー
329,顔も持ち合わせた人物。自分が部隊を率いる分隊長という立場でありながら、部隊の一員として部下たちと仲間であるという想いを持って、激戦地で戦ってきた。過去に任務
330,医学部長時代、昭和六十年一月から六十二年九月まで、文部省の「医学教育の改善に関する調査研究協力者会議」の一員として、調査研究に従事した。ちょうど昭和五十九年九月から臨時教育審議会の論議が盛んになり
331,は機械の摩滅に似ています」東方の小王国で五人か十人の僧侶の一員であった彼の祖父のことを、私は考えた。彼は非常に質素に
332,四角柱のものもあります（十四‐５）。これは中新世の溶岩で易国間安山岩類の一員です。十四‐４大間崎からさらに続く海岸段丘十四‐５津島崎柱状節理の発達し
333,ております。こういったことで、この先、動物愛護普及のために獣医師も会員の一員になって大いに今後普及活動をしていこう、何も協会を乗り取ろうという趣旨ではない
334,救い主はご自分を人類のすべての子供と等しくなさった。わたしたちが天の家族の一員となるために、キリストはこの世の家族の一員となられたのである。キリストは人
335,により示された陸上自衛隊の基本的な枠組みの一部として位置づけられている。すなわち、第一線部隊の一員として運用できるよう、即応予備自衛官には、予備自衛官よりも高い練度と即応性が要求される。ⅰ
336,いい−人間社会は昔から、こうだった。ひとり一人が家族の、一族の、一員としての義務を果たす。それが求められてきた。それがどうして、こんなになっ
337,と定めており（第３章第５節「ハイテク犯罪対策への取組み」参照），アクセス管理者が情報通信インフラを担う一員として自主的な防犯行動をとるように促している。（注）アクセス管理者とは，電気通信回線
338,μはもう少女の家の子猫ではなくなりました。前沢家の大切な家族の一員に加わったのです。μが畳の上で竹輪を追っていると書き物をし
339,「フシダラな果実」（二見書房）ｈｔｔｐ：／／ｈｏｍｅ．ａｔｔ．ｎｅ．ｊｐ／ａｐｐｌｅ／ｒｉｋａ／プライベートな性をオープンに綴り、ピンクローターズの一員としても活躍する栗戸理花さん。最後に、男には予測不能な女の「濡れる！」メカニズム
340,として応対する一方で，旅行者を受け入れるホスト集団側からみれば，業務とはいえ旅行者サイドに立つゲストの一員としてサービス利用の側に立つわけである．現地受入れ側と利用者，主催旅行会社と旅行者，ホストとゲスト
341,ことも、もちろん助けになる。あなたが共通の夢に向かって頑張るチームの一員で、自分の仕事が大好きで、チームメイトが尊敬できるなら、それ以上望むことはほとんどない
342,。Ｂ派とは僕にとって何だろう。この三ヵ月、僕は白ヘルメットをかぶり、Ｂ派の一員として活動してきた。だがそれは、かたちばかりのものだ。僕は、闘わなければならない
343,。人間は他の生物と同じ意味合いと条件のもとで、地球の生物共同体の一員をなしている。そして他のすべての生物種同様、人間という種は相互依存のシステムの中
344,ます笑翔太郎にも初対面＆ご挨拶したし無事に新たな我が家の家族の一員になりましたねぇヾ（●´ω｀●）（健太郎や亮一郎に会わせるのは離乳食始まっ
345,常習犯として当局を悩ませていました。万引きだけでなく、若いころにはいわゆるヤクザの一員で、人を傷つけたり、麻薬をやったりと、悪の限りを尽くした男
346,にようこそ、お疲れでしたでしょう」例によって心臓の強い私はあたかも主催者の一員のような顔をしてヒンデミットにすり寄った。そして見事その手を捕らえたのだ
347,多いのか当然家の中に一緒に住んで居るんでしょうねま〜〜家族の一員なんでしょうそうだやはり動物は癒される物だね・・・。
348,たのは、ピーター・ドッズだった。彼は、コロンビア大学の数学者で、わたしの研究グループの一員でもあった。ピーターとわたしはすでにほかの問題について共同研究をしていた（
349,のかどうか、当然そんなことはないと思うのですけれども、そうでなければ、政府閣僚の一員として、アメリカに対して強く財政、貿易赤字の削減を迫るという意見を閣内でも言っていただき
350,福祉・教育，資源リサイクル問題，食料の自給問題に関する活動など，幅ひろく行われている。２社会の一員としてのボランティア活動二千一年はボランティア国際年（ＩＹＶ）であり，日本では，千九百九十五年の阪神・淡路大震災，ナホトカ号
351,それは、人を怠け者と見なすのではなく、組織の将来に関心を抱くコミュニティの一員と見なしているという暗黙のメッセージを送ることになるからである。■ゆとりの時間を大切
352,としていくためには，高齢者を単に社会から保護・援助される存在としてみるのではなく，社会の一員として大いにその役割を果たす積極的な高齢者像を確立していくことが必要である。このため，
353,と言えばわかるでしょうか。だから、個人の力に頼るのではなく、あくまで組織の一員としてプレーできるような存在として兵士をみなすようになったのです。日本でも、
354,これが白人から得られる最善の取引だ」と言ったのである。アボリジニーの交渉団の一員だったノエル・パーソンは、「ゲームに加わらないということは馬鹿げているように思われまし
355,めざましい発展をみせることは、もはや疑いの余地はありません。日本もアジアの一員として関わっていくことが求められます。互角にビジネスを成功させていきたいものです
356,個人的反感で紛糾することはなかったであろう。じっさい、この間、宋教仁は孫文が派遣した迎袁特使の一員として二月十八日に上海を発ち、三月九日まで北京に留まる。臨時約法はその前日、
357,であったため、自然、茶の湯の上でも師弟関係が結ばれたのであろう。佐々木家の一員が参宮の折、普斎に茶道の「かた見」を乞うたところ、烟草盆の火入
358,ですし、未成年の喫煙や非行化もそうです。とくに複数になると、社会の一員としての良心が麻痺するんですな。この点では、高校生も大学生も同じですよ
359,であるとも言えます。もじもじして挨拶もできないような社会的内向では、社会の一員としての義務を果たせないからです。しかし、本人の努力によって変えられるので、出来
360,メンバー達（フリーメイソン教の魔女達）やその子供達を受け入れてるのだろうか・・。オウムの一員ならば、そんな事はしないはずだが。その後の、「さくら」浅草
361,ことが明らかになっている。すなわち、「地域研究からの脱皮」「歴史学・政治学・社会学など伝統的学問分野の一員としての自覚を持つ日本研究者新世代」が拡大しているのである。このような事態がさらに進めば
362,なかったためか，私が千九百九十二年７月に参加したパリ司教区巡礼では，司教区民やフランス教会の一員としての仲間意識を感じる場面はなかった。私は司祭１人・神学生２人と互い
363,となってからは、もはや局外の観察者ではなくなった。歴史を担当する中枢の一員となっていたのだ。福王を擁立した南京の亡命政権は、史上でも稀
364,が愛であるとは思わずに、樹木がふたたび自分たちを親しく同胞として、家族の一員として迎えてくれるだろうと期待して、樹々との類似を空想しだしたのだ。以来
365,いささかも考えておりません。後藤田官房長官がおっしゃるように、自分としては、あるいは政府の一員としては、人事院としてこういうふうなことも考える時期に来ておるのじゃないかという
366,の先祖は、ずいぶんと財産を蓄えこんでいたようだ。しかし僕がこの家の一員になった時点では、もはやその名残はあまり見られなくなっていた。父
367,の健康相談を行う子ども・青少年の健全育成●子どもたちの学習支援サポートを充実させるとりくみ２自立した地域の一員として、地域活動に参画しやすい環境をつくる定住化が進む今、地域住民として地域活動への参画や
368,の大半は、震災で未曾有の被害を物質的にも精神的にも蒙った家庭の一員であった可能性が高いのです。何の役にも立たなかったＴＶを恨みこそ
369,のそれではありません。シェリーは英国の貴族に生まれましたが、その一員とはなりませんでした。彼は貴族的な発想だけでものを考えるような
370,という意味で，欧米先進国が設定した国際社会の基準を満たすことで，発展途上国が国際社会の一員になろうとすることだと考えられます。その意味では西洋化の色彩が濃い
371,運んで下さって有り難うございます。癒しだなんて…！わああ頑張ります！ゴジレンジャースタッフの一員として今後とも宜しくです（＾ー＾）柚良さま＞早速本家見て下さって有り難うございます！素敵と言っ
372,、ガーシュインはダンス監督のサミー・リーと共同でアパートを借りた。リーはガス・エドワードの子供レヴューの一員としてこの道に入った。ロンドン滞在中、ガーシュインはポーリン・ハイフェッツに手紙で、ニューヨークでしたよう
373,ました、この人にも以前は普通の生活があって、おばあちゃんとして家族の一員で、お孫さんなんかと暮らしていて、出かける時は車に乗せてもらってて、そう
374,導かれて感情を克服し、自己を所有して宇宙の調和が支配する秩序正しき世界の一員となることができる余地が残されている。主人公セヒスムンドがたどる悟りの道がまさにこれである。
375,には、ヤエンマツとモナシリの笑顔があった。モナシリはすっかりうちとけて、コタンの一員になりつつあった。庄太夫はヤエンマツから、モナシリを養女にしたいという相談もうけている
376,や，さまざまな物質によって自然環境が形づくられている。そしてまた，わたしたち人間も，自然界の一員である。人間は，より快適な生活を求めることによって，自然環境にさまざまな影響
377,それは歴史的教訓、制度的確立、意識的変化という三つの要素が組み込まれている。一方、社会主義共同体の一員となった東ドイツ人は、冷戦構造の固定化によって西の同胞とは全く別の道を
378,しかしその間ソ連軍司令官は、パリやスイスのソ連大使館と連絡をとり、ウィーンの地下抵抗組織の一員に間違いないと確認するや、態度は一変した。一夜明けて今度はウオットカでの歓待
379,営んでいた。この世話好きな六十代の女性は、ハーンの境遇に同情し、家族の一員として迎え入れることを拒まなかった。
380,て日本式の氏を名乗った者はとりあえず天皇家の分家のひとつ、天皇の子孫の一員に加えてやろう」という発想がこの対立を超えるために利用されます。この、日本式の
381,千九百六十一年５月５日）が，「…児童は人として尊ばれる。児童は，社会の一員として重んぜられる。児童は，よい環境の中で育てられる」と，宣言している。
382,が、ちゃんと自分の力で自分の生活費を稼ぎだし、地域の中で、社会の一員として暮らしていくのを見守り、必要なときに力をかしてやり、少しでも
383,，２成績良好３月以上継続，３本人の性質に安定性があり向上傾向があり，健全な社会の一員に更生し，保護観察を行う必要がないとき（昭和二十八，２，二十法務省保護二百三十五号保護局長，
384,十年以上、市民オンブズマン、あるいはグループ「見張り番」という市民団体の幹事をしたり、その弁護団の一員としてやってきました。私が生まれた千九百六十一年は実は、日本でサリドマイドの発生報告
385,。ビスカヤ自身にも思うところがあり、支援の申し出を受けた。かくて退位派の一員だ。実際、ウェンディエンは彼女を気に入ってくれている。身分さえなければ―
386,見つけるために生まれた「科学」「心の教育」を実現していくうえで、社会の一員である企業の役割が大きいことを指摘したが、これほど巨大な経済力をもつよう
387,若者の血を流した。これがアメリカの母親にこたえた。そこで自由諸国の一員として日本に十八万人を、というんです。そのころアメリカの空と海はまだ強かっ
388,を編制外においていたらしかった。僕が志願したので、無論、僕はその一員に加えられた。なぜ、すすんで危険のなかに加わったか。そのときの
389,近くのお寺に葬儀を依頼する時です。都会で生活している人が、家族の一員の死にあい、近くのお寺に葬儀をしてもらい、故郷のお寺のお墓に
390,日本が「異質な」国であり、南北アメリカやオーストラリアのようにいずれ完全な西洋文明圏の一員となるべき移行プロセスにあるということではない。成熟した近代国家としての日本は他の
391,のチーズの分け前を催促する。分かってる分かってる、あなたも私たちの大切な家族の一員であると。ふと気配を感じてふりかえると、月の出を待っていた宵待草
392,を残してホテルを出るが、待ち構えていたのは、アイルランド人たちであった。過激派の一員として、セリフはないが、若きピアス・ブロスナンが出演。なお、製作会社の社主は、ジョージ・ハリスン
393,たからだと、当時はずい分激しく責められた。このとき、秋田さんも役場の一員として、避難するのを手伝っていた。一番責められたのは、総務課長だった
394,にしたように鼻を鳴らした。「あたしはアシュレイ。《アムスヴェルトニール》の一員さ」ぐりぐりと死体を踏みつけて溜飲を下げた女は、そう名乗った。
395,なさった。わたしたちが天の家族の一員となるために、キリストはこの世の家族の一員となられたのである。キリストは人の子であるから、アダムのすべての息子、
396,また、科学の実験場としての役割を果たした。交易はアフリカの人々に世界の一員として生きることを促し、異なる人々の道徳観に触れることで進歩をもたらすというのが
397,ところがところが。うちのパパはちがう。なんたってプリンスだから。ジェノヴィアの王族の一員たるもの、重大問題が生じたときに「家に帰る」なんてとんでもないそうだ。
398,てもらうことです。案内状の発送、受付係、案内係…なんでもいいから主宰者側のスタッフの一員となることが大切なんです。心がけ次第では企画に関することにも手伝いの範囲が
399,戸田技師について航空本部から気球関係のスタッフが技術本部へ移された時、その一員として戸田正鉄技師がおりました。オートジャイロという航空界の異端児のごときものが日本に誕生する
400,の夢が実現されるように、皆さんも、いろいろな人の夢に、社会の一員として関わってみませんか。私たちのまちの夢を実現するために、郡山で生きる
401,共産党が勢力をのばした。東ヨーロッパ・バルカン地域では，大戦中徹底的に破壊されたり，枢軸国側の一員になった国が多く，その改革は第二の建国といわれるほど徹底したもの
402,カープなどで構成する企業グループと）具体的な協議を開始するという広島市の決定に対し、チームの一員として大変光栄に思っています。早期に事業実現できるよう努力していきます。皆様方のより一層
403,、自然です。恋人との同棲も珍しくありません。十代後半から、すでに社会の一員として、それぞれ自分の人生を選択していきます。ロッタは高校を卒業すると、大学
404,三十代からやっておきたいこと夫に家事の一端をになわせることは、家庭の一員という自覚をもってもらうためにも大切である。もちろん専業主婦の場合、それが仕事なのだ
405,ことは、まさにわが身の問題として原爆をとらえ直す機会となる。参加者は人類の一員として、人類に廃絶を呼び掛ける必要性をあらためて実感するだろう。実現への具体的な方策を
406,就任する直前の三月二十二日、グロティウスは、レイニエ＝パウらからなる、イギリスへの外交使節団の一員に任命され、ロンドンに赴いた。このいわゆる東インド（植民地）会議は、オランダ連合東インド会社が
407,）の意見一致で入会し、みぬま福祉会の運動に参加させていただくことになりました。私もその一員に加わりました。親が教職員や関係者の人たちとともに運営にかかわり、
408,家族全員で、家事・育児・介護を分担し、喜びも苦労も分かち合っています。●一人ひとりが家族の一員として意見を出し合い、互いの協力により、豊かで充実した家庭生活を築いています。
409,の肝入りグループと考えてもいいと思われるが、柳田は〈「明治文学談話会」の顧問〉の一員、勝本は『近代生活』の執筆者の一人として名前が出てくるだけで活動に関しては
410,ただけ」。そう話すのは家電リサイクルを手がける東京エコリサイクル（東京江東区）の馬場研二取締役。日立製作所地球環境戦略室の一員でもあり、都市鉱山の活用論者の一人だ。東京エコの工場では家電サイクル法に基づいて
411,、点々と規則正しく何キロも続く姿は感動的であった。東大イラン・イラク調査団（江上波夫団長）の一員として西アジア各地の乾燥地域で、何千年と続く伝統的水利技術の叡智を見て歩くことができた。それ
412,で設立された民間援助団体で，世界各地で医療援助を実施している。市民の立場から地球社会の一員である私たち市民は，平和で公正な地球社会をつくりあげるために，私たちの政府に対してさまざまに働きかけ
413,幼少時から聖職者になりたいと望み―そうなりました。神学校に入り、十字騎士団の一員になろうと決意したのです。後年、彼が公言したところによりますと、彼
414,ていることだ。実は秘かに中国の野球界と交流を深め、中国のナショナルチームの一員である呂建剛投手を一年間研修生として預かっていて、プロで十分通用すると見極めをつけたうえで、
415,「私の目的はお金を貯めることではなくて、人間が好きだし、社会の一員として役立っているという実感が大切と思うから」ペット業界の将来については、新井さんも
416,を送ります十一月十四日、ヤングリーグ二千八グランドチャンピオン大会（十一／二十二〜二十三、三重県）へクラブチーム「ヤングカープ岡山」の一員として出場した■■■■さん（中、矢掛中学３年）が役場を訪れ、■■町長の激励を受け
417,、患者に知らされることもない。「ですが、院長…」「きみはチームの一員なんだぞ、ペイジ。われわれは皆チームプレーに徹しなければいけない」「でも
418,とやってもやることは一緒」とマイペースを強調した。心はすでに侍ジャパンの一員。ダルビッシュの心はすでに日の丸のユニホームを身にまとっている。
419,どう受け止めたか、お返事していく広聴レポートを発行したりします。３地域を支える（地域の一員として共に考え行動する）たとえば…区役所が地域に寄り添い支えるためには、区役所内部で
420,きてくれないかと〈ブルジョワ〉にいわれていたんだ。私は〈ボーリンジャー〉・グループの一員ではないし、〈ブルジョワ〉も中継役にすぎないんだ」「ええ、それはわかっています
421,。同僚から非常に尊敬され、しばしば助言を求められた。かの有名なスタンフォード一家の一員であることを知る者はほとんどいなかった。彼がけっして父の名を口に
