,0
328,車をもってから妻が死ぬまで三十年です。思えばわれわれは、ごく普通の会社員でも車のある生活を楽しむことができた、その点でも最初の世代ということ
329,生命保険を月に１万２千円ほど払っている主婦です。会社員であれば年末調整で控除金が戻ってきます。主婦の場合は１年間の保険料が十万
330,に引き戻されると柚子は、「一枚二枚と皮をむいていくと、どこの会社員も似たような肌を見せてくるわ。どこまでむいても、正体が
331,引越しして会社に届出ない場合どうなりますか？別にばれなければいいのでしょうか？労務士が会社員の社会保険などの手続きをしているのですが・・・交通費の申請が、今まで
332,主人公は忍野半三郎と言う男である。生憎大した男ではない。北京の三菱に勤めている三十前後の会社員である。半三郎は商科大学を卒業した後、二月目に北京へ来ることになった。同僚や
333,いう。母親の気持ち十分のために半日休み／気兼ねせずに本音話せる■埼玉県草加市会社員（三十五）中学校で「家庭訪問がない」という説明を聞いて、思わず「
334,は？→Ａ型★住みは？→福岡の田舎★職業は？→今のところ会社員。★ズバリ今何歳？→十九でございます。〜ヲタ編〜☆神に値するの
335,社会保障税だ。給与の十二．四％で、労使が６．２％ずつ支払う。例えば千ドルの月収がある会社員の場合、本人が六十二ドル、会社側が六十二ドルを負担し、計百二十四ドルを納める。問題は
336,と言える。ノーマルタイプの指部分を自分でカットする人も多く出現した。山本孝志（二十四）会社員グローブ：中古（２月号）田下ユウスケ（十九）学生グローブ：ビームス（２月号）ｖｏｉｃｅ阿部健吉（
337,秋山美加（仮名）＝主婦・三十一歳私は三十一歳になる主婦です。主人は五つ年上の会社員、娘はようやく保育園に入ったばかりです。現在は親子三人で賃貸マンションに住んでい
338,「ＮＴＴ独占はいいかげんやめてほしい」（会社員二十九歳）、「どんどん競争をしてほしい」（会社員三十六歳）、「光ファイバー網は国策にして実施してほしい（個人負担ゼロ）」（会社役員四十六歳
339,は、この日だけで約４万七千八百人が帰国予定という。インドネシアから帰国した東京都文京区の会社員、花田陽（あきら）さん（三十三）は「一週間、ゆっくり休めました。楽しかったです」と旅
340,刺身専門の飲食店はその六十％が上村にある。三十歳代、四十歳代の海女の夫は会社員が多く、五十歳代と六十歳代の海女は夫と死別した人が多い。六十歳代の死因
341,じゃないみたい」―〈記者〉お父さんはどんな仕事をしているの？「普通の会社員。でも、職場に友だちもいないしね。だから、仕事をするだけで帰っ
342,なんでしょ？それが廃止されるなんて、あんまりだよ！」（Ｙさん・三十三歳・会社員）うん、その不安はイタイほどよくわかる。そもそも住宅ローンにはさまざまな種類が
343,。このほかには、フルタイムで働いているボランティアが二人。そのほかにも、会社員、学生、自由業など、さまざまな人が集まってくる。雇用関係も上下関係もなく、
344,。なくなるのは寂しいし、復活してほしいですね」と感慨深げな様子だった。会社員の山田剛嗣さん（四十）は神奈川県平塚市から駆けつけた。山田さんは幼いころ、家族４人で
345,だ」国際通り裏の飲食店。売上高を計算する店長は「十―十二月は三十―四十％減だ。昼は会社員のランチが主で、その後は観光客がひっきりなしに入っていたが、だいぶ減っ
346,描いてパソコンも使う。売れっ子イラストレーターは忙しいなぁ（笑）積める＆濡らさない工夫成井宏行さん（会社員）愛車オデッセイ（’００年式）死滅回遊魚捕りが好きで、現在暮らしている仙台から千葉県など
347,ＣＶＳ業務マニュアル」は毎年改正され、年々その内容が濃くなっている。スタッフは主婦をはじめ会社員、学生、職場をリタイアした人と幅広い。居住地も洞爺村や旭川市、帯広市など道内各地
348,に満足した？何歳ですか？誰と来たの？九十点（篠塚大さん二十八歳・会社員）自分もボクシングをしているが、言葉では表せない格闘技の魅力が画面に
349,わね。なまじ会社の生活の方に、妙にリアリティがあって（君、会社員だっけ）浮いたとこがないので（おひるに何とかランチとシーフード・スパゲティを食べたり、
350,たのである。昭和四十三年春、大学を出て会社員になった時、私はその会社員になったという現実が、またどうしても現実とは感じられず、はじめて己れの現実剝離
351,もちろん、経験を積み、地位が上がってくればそれほどでもなくなるが、それでも会社員の日常とはかなり違うことは間違いない。第２章経営コンサルタントに必要な基本ノウハウとはその具体的
352,が三十二人で、約四十％を占め、最も多い。その次は海女の夫の職業が会社員という場合で、二十九人・約三十六％、漁師が９人で約十二％の順になっている（図
353,２．鎖骨外側部骨折に対するｔｅｎｓｉｏｎｂａｎｄ法にて偽関節となった症例症例二十八歳，男性，会社員，右利き。【現病歴】飲酒をして乗用車を運転中に自損事故にて受傷する。受傷機転の
354,素を駆使する調香師宮口鍵吾さんみやぐちけんご千九百四十七年十一月二十七日、福井県生まれ。調香師としてキャリア三十年の会社員。商品を開発する際、その商品とイメージに適した香りを調合し処方箋を書いたり
355,なかった。「褒めてるの？」「そうだよ」「相手の会社員もやりにくいと思うわ」柚子は常々感じていることを庸助に言った。「
356,浸かってる人の職業が知りたいです。夏休みということで学生さんが多いのでしょうか？会社員ですが、時間を潰しているのではなく、世のため人の為です。
357,寮から聞こえてくるフォーク・ギターの音色に誘われてその部屋へ押しかけた林は、その会社員からギターを借り受け、結局自分の所有物のようにしてしまった。そして、ただちにクリフ・リチャード
358,ていた。叔母の夫である義叔父さんはいわゆる業界の人で、といっても今は、会社員だが。昔は、在阪テレビ局で音楽関係の仕事をしていた。ここでは書け
359,悔しいと思う間もなく、大島機は鹿児島西方の海面に着水した。中津留達雄は、会社員の父明、ヌイの一人っ子として大正十一年（千九百二十二）一月、大分県津久見町徳浦に生まれた
360,１事例の概要〈クライエント〉Ａ氏二十七歳男性会社員〈主訴〉「心理的水準を上げること」とＡは申込用紙に記入する。〈家族構成〉
361,ます。頭金は千万用意できると思いますが、彼の年収が二百四十万位（勤続４年の会社員）で、どれくらいのローンが組めるでしょうか？マンションですので、管理費も必要に
362,も通ってました、課題もやってました。うーむ、完全に物好き。会社員を辞めたと同時に土地探しに入ったのは、時期的にかなり偶然でした
363,は、つまり能力不足だけど一人前に出世だけはしたいという、そういう虫のいい会社員ってわけ。彼らは私たちの造幣局ってところかな」毎日やっている事柄を改めて
364,雙葉は良妻賢母を育てる学校。雅子さまも、きっとよい母親になられると思う。（会社員）９同級生でも十人以上は高齢出産の人がいるはず。頑張って。（１児
365,自己紹介をしていきたいと思います！！名前→ｔｏｍｏ＿ｙｕｋａ年齢→２●歳職業→会社員好きな芸能人→錦戸亮クン♥ジャニーズ暦→初めてジャニーズを好きになったのは保育園のころ
366,上役から新しい商品を生み出せ、売上げを伸ばせ、ノルマ何億と命令され働いていくのが会社員でしょ。そこには彼らの意思はないのよ。命令されたからやるより仕方
367,だ時に、ひんやりして腫れがひく。目がパッチリと開く感じ」（二十四歳・会社員）アンティグラヴィティファーミングアイリフトクリーム￥五千五百（クリニークラボラトリーズ☎
368,実現！の予定。そうしたら日本の年金制度とはおさらばさ。（二十五歳・会社員）Ａ．要注意！離陸しそこなうと無年金のただのオヤジだ。海外に住んでい
369,二十一）と、埼玉県桶川市の職業不詳の男性（二十五）が亡くなっていたのを、会社員の知人らが発見した。十一月二十一日、福岡市早良区内の林道で、同市西区に住む
370,「お弁当」で節約出来てしまうので必見！！！？外食だと毎日じゃん？特に会社員や学生さんたちは。でも弁当だと買いだめでもないけど、材料は買ってあるのを
371,てよかった。Ｊ・ムーアもクラリスを、違和感なく演じている。八十点（萩原剛さん二十三歳・会社員）ラストシーンが謎。あのレクターの心理は、見終わっても理解できない。ラブストーリー的な要素
372,は、たいていは付き合いで入ってきた一見さんだ。コンパの時間まで暇を潰す会社員だったり、ＤＰマニアの彼氏に付き合って、なかば強引にコニーパレスに連れ込まれた女子大生であっ
373,はっきりとわかるのでございます。同様の観察を私たちもしております。すなわち学生や会社員に、もしあなたがＨＩＶに感染していると感ずるようなときにはエイズ検査を受けます
374,普段は会社勤めで取引しにくい会社員がリアルタイムの取引に貢献したらしい。二十六日に仕事納めだった会社員も多く、証券市場が閉まるまでせっせと取引に励んだ、というわけだ。「三十日
375,がきっかけで、その先が大きく変容してしまうってことだ。この時だって、会社員とぶつかって時間をくってしまったために、もしかしたらぼくは、その後カラス
376,いう感じがする）。それに、ま正直いってさ、二十八歳の平凡な会社員二人がカップルだと、全体がジミになるのはいなめないわね。なまじ会社
377,いう。同署によると、この巡査長は昨年五月にもＪＲ山陽線の電車内で、鳥取市の会社員に痴漢されて同条例違反の現行犯で逮捕していた。邦人女性６人レイプロンドン被告に禁固十八年
378,に住む会社員男性（二十七）と東京都国立市の職業不詳の男性（四十二）、茨城県ひたちなか市の会社員（二十九）、埼玉県入間市の無職の男性（二十八）が亡くなっているのが発見され
379,大きく分けて、雇用関係のあるものとないものに分けられます。前者については、会社員が自宅で働く在宅勤務などがあります。後者については、企業に属さず請負的に
380,。●カミラさんもチャールズ皇太子も独身になったんだから、再婚してもいいんじゃない？（二十八歳・会社員）●再婚をするのは自由だけど王室に入るのは反対。王子がかわいそう
381,何を考えているのかということを真剣に考えていないからです。私は会社員でしたから、売り上げをいくら上げても給料が増えるわけではありません。
382,漂流していた宇治市内の五十一歳と四十歳の男性二人を、プレジャーボートで通りかかった滋賀県蒲生町蒲生道の会社員、長沢嘉徳さん（四十一）と、妻孝子さん（四十二）が発見、救助した。男性二人にけが
383,ものごとをいいかげんではすまされぬ病Ｅ氏は、きまじめで几帳面な四十二歳の会社員である。子供のころからの両親の厳しいしつけが影響して、身のまわりの整理整頓
384,た。昼を過ぎると、食後の散歩に公園を歩く、近くの公務員や会社員で賑やかになってきた。芝生に腰を降ろして弁当を食べているＯＬさんも、
385,に対しては、「インターネットで映画を見たい」（会社員三十一歳）や「動画配信」（会社員三十四歳）、「インターネット上の対戦ゲーム」（主婦三十三歳）、「遠隔教育を受けてみたい。
386,個人（会社員）が、自家用に作った食品を土日に販売するためには、税務署に届け出る必要が
387,をするのでしょうか？３仕事をするのなら、いつ練習するのでしょうか？１あくまでも会社員です。２ちゃんと仕事をします。３午前中仕事して、午後から練習です。
388,反省を既に忘れつつあります。ワイドショーなんてもってのほかです。点字ブロックに荷物置いてた住職が会社員に注意された事からもみ合いに→突き落とされる。これを凶悪事件発生？そうでしょうか？
389,文部省留学生其他教育者百三十八、画家百二十三、学生百、官公吏其他八十四、軍人五十九、会社員三十九、視察二十八、医師二十四、被傭人二十二、新聞記者通信員十八、彫刻家十三、音楽家十二だっ
390,、「妨げとなる」と回答した人の割合。３．回答者は、全回答者が三千九百七十二人、会社員が千二百五十三人、無職の主婦・主夫が五百七十三人、学生が二百八十九人。（ボランティア活動に関するさらなる情報提供が求め
391,で■■容疑者再逮捕＝「捕まりたくない一心」−マンション女性不明・警視庁＞東京都江東区のマンションに住む会社員■■■■■さん（二十三）が行方不明になった事件で、警視庁深川署捜査本部は
392,充実」を望んでいる※近隣市町の充実を望むのは、わずか７．８％●「若年層や会社員、運転する層」が町外、「老年層や無職者、運転しない層」が町内という二つ
393,方法を使って、この目標達成を押しすすめてみましょう。新しい年度が始まるたびに、会社員は目標を設定します。もちろん、仕事ですから自分一人で決められる目標ではあり
394,に不安がある人は、医師か保健センターの保健師や栄養士などにご相談ください。Ｑ会社員の妻ですが、健康組合の健診と新さわやか健診を一緒に受けることができますか。Ａ
395,独身の会社員ですが、知り合いの女性の下着に興味が有ります。どのようにしたら、
396,現在会社員ですが、転職して介護の仕事に就こうか迷っています。介護職の方、今
397,「加入させてもらう」わけですから、保険料の納付期限にも厳しい制限があります。会社員など一般の被保険者の場合、毎月の保険料は翌月末日とされているのに対し、任意継続被保険者
398,過去に７年ほど、農業団体の職員をしていました。現在は、会社員をしています。先日、何気に自分の年金手帳（黄色）を見たところ、会社員
399,考えてみればすごいことだよね。たとえば、ぼくと誰か―ごく普通の会社員なんかが、代々木の駅前でぶつかったとする。ぼくは毎日代々木まで通っている
400,会社員の方に伺います。最近、特に若い人たちを中心に、郵便物の宛名を書く
401,小物で差をつけるのがモットー小物使いで大人のキュートを演出。藁谷あきさん（二十三）会社員袖や襟の切り替えがポイントのワンピースは、ポール＆ジョーのもの。バレエシューズを合わせてキュートさ
402,。受賞理由は「生体高分子の同定および構造解析のための手法の開発」。島津製作所に勤める会社員であり、まさに日本国にあっては田中耕一氏の「業績」は「無名」であったため
403,」コーナーは、駅前の放置自転車問題を考える「お知恵拝借！放置自転車をなくすには？」。会社員、放送局ＯＢ、主婦など六十人あまりの市民ディレクターが映像によるまちづくりに参加している。アクセスの難しい
404,て多様な副業を行なっている。副業には農業、露天商、飲食店、下働き、会社員などさまざまな業種がある（図十四）。兼業活動の種類が多様な年齢層は五十歳代
405,人が身近にいたら相談する事態に陥らないし新しい道徳の教科書岩手県・■■■■（三十三才・会社員）―オレの友人はカレーのみ食ってました。その日、オレはその
406,をかわしたことが一度もないことに気づいた。おそらくこの十年間、いや、たぶん会社員になってから一度だってない。あったのは、仕事絡みの市場調査のときだけ
407,ようなムシのいい話だ。なにか裏があるに決まっている。だから、会社員には自分のやりたくない仕事を断る権利が、基本的には、ない。家族
408,ヘクティク（７月号）水戸直人（二十）大学生シャツ：無印良品（十月号）ｖｏｉｃｅ小澤真也（二十五才・会社員）「衿回りのボタンがアクセントになって、重ね着のインナーに最適でした。今年
409,の割引なら、搭載機の低価格化が最も普及率アップにつながるのじゃないですかね。（加古川、会社員、男、三十四）高校合格おめでとう長男が高校に合格しました。大好きなバレーボールと
410,のである。経済的理由でまだ小さい子供を預けてまで働かなければならない主婦、生活がかかっている会社員、あんなことでいちいち会社をやめてたら即、日干しになってしまう。皆生活かかっ
411,になります。ご近所でも評判です」。お手入れ代月十万円のローズガーデン大阪府堺市・樫根秀子さん（五十四才・会社員）業者による月に２回の剪定と、３〜４か月に１度の花の入れ替えで、
412,で、しっかりした作りが気に入っているとのこと。はまやんさん（二十八才・会社員）ネックレス、ブレスレット、リングともにメキシコのタスコで購入したもので、ブランド名は不明
413,したら来年は主演男優に！？↑栃木県・まきの／二十二歳・アルバイト↑滋賀県・赤紫式部／二十五歳・会社員ＣａｔｃｈｔｈｅＫｅｙｍａｎ！！格闘家を追う元格闘家が最高の大晦日を演出！長尾昇さん’
414,ており、“永遠”を信じてみようという気持ちになれた。九十点（岡久滋さん四十六歳・会社員）あまりの感動に、涙が止まらなかった。中国人姉妹の演技が印象的で、恋愛
415,回って中古バイクを買い取る業務を３年間担当してこの仕事を覚えたんですよ。でも、会社員は自分には合わないとこもあったし、頑張れば一人でもできる仕事だ
416,三十代中盤の専業主婦です。元々ファッションやメイクには疎い方です。会社員だった十年程前のメイクしか出来ず時代遅れなメイクで出歩いています・・・
417,会社員です。たまに集配に来る宅急便のお兄さんが気になっています。でも、話すきっかけ
418,値段を究極値まで下げてもらいたい」（美容師二十四歳）、「とにかく安く提供してほしい」（会社員三十二歳）、「もっと電話料金を安くしてほしい。ＮＴＴの電話回線しか使えないユーザーは損
419,ているはずの江藤ですら、なかなか融資を受けられない。ましてや、中小企業に勤める会社員が、銀行から家を建てるための融資を受けられる可能性はきわめて低いのではないか。その
420,東京だよ・・・・明日は我が身？発表によると、男は自称同市川口町、会社員■■■■容疑者（三十三）。調べに対し「仕事がうまくいかず、両親に
421,に満足した？何歳ですか？誰と来たの？八十五点（長谷川浩さん二十六歳・会社員）常にコワイ方向に展開していき、イヤなツボをついてくる作品。日常の
422,団員は、二十代から七十代と幅広い年齢層で、地元の郵便局長や寺院の副住職をはじめ、会社員、市職員、主婦など。敬老会が近づく２月から、週に１回ほどのペースで、
423,にしても“紫”って、サツマイモじゃないんだから。新しい道徳の教科書千葉県・トニー２号（二十四才・会社員）―最近、普通の雑種の犬を散歩させてる人って見かけないよなァ
424,って、どの位で結果が出るのでしょうか？他に借り入れ等は全くありません。会社員、三十八歳、勤続年数７年、年収四百二十万です。３千万のマンションを三百五十万の頭金で申請中です
425,の神秘的な発色も魅力的」（メーカー勤務・二十九歳）「しっとりしたつけ心地も◎」（会社員・二十一歳）このメークの詳細は八十七ページにあります。３位百二十七票パルファン・クリスチャン・ディオールサンククルール
426,千九百九十六年六月二日未明に発生した荒川区の一家四人殺しの重要参考人とされて行方を探されている会社員、石田直澄・四十六歳の名であった。しかし石川巡査には、信子のこの言葉を
427,が設けられています。これも居住した翌年の確定申告シーズンに、税務署で申告です。会社員の場合は２年目からは、年末調整ですみます。固定資産税と都市計画税は申告の必要
428,のスタイル。かわいいゴムをチョイスして、アクセントにするのも人気。森本麻里二十二会社員スッキリまとまったシルエットでオトナっぽく今日は仕事がお休みなのでらくちんヘアです。短い髪を生かし
429,を出発した三百二十人分の最終チケットは、発売開始十秒で完売したという。東京都中野区の会社員、高木操さん（三十九）は旅行会社を十数軒も回り、最終チケットを手に入れた。父親
430,都内二十三区内に住む会社員ですが、私の勤務する会社の給与は毎月給与から所得税を引いていますが、
431,会社員の皆さん、いつ頃から出世、昇給を断念し、人生こんなもんだと、あきらめるものな
432,」「学歴」「職業」に関係なく存在する。教師。医師。弁護士。裁判官。会社員。自営業。フリーター。自由業。公務員。職人。芸能人。Ｊリーグの選手。幼稚園副園長。等々
433,「楽しかったから苦労と感じなかった」と山崎さん。これぞＤＩＹ山崎博文さん（三十九歳・会社員）ＤＩＹ歴十年リフォーム内容●部屋／十畳のリビングダイニング●床面／収納つき小座敷の製作●その他
434,との因果関係は認めなかった（二十六日）●日暮里駅殴打事件で容疑者逮捕ＪＲ日暮里駅で昨年十一月、会社員が殴られ意識不明の重体になった事件で、警視庁は内装工■■■■容疑者を傷害容疑で逮捕（
435,の現行犯で逮捕された。どうも風呂場には女性もいたらしく、それで会社員も慌てたらしい。また中身はカラでしたが、現場近くに田代のビデオカメラも落ち
436,な、あるいは物凄い光景が展開されています。ふだん過激な反資本主義の議論を吐いている会社員が、誰も見ていない所では、貰ったばかりの昇給の辞令を、
