,0
110,を見ながらのコースにしますか」と颯爽と飛び立っていった。ＯＬなど会社員の会員もいるとか。ｄａｔａ●菖蒲庵／長野県小諸市大杭千七十五☎０２６７・２２・７５８２。ヘリを飛ばしてで
111,から，シアノアクリレート法により鮮明な指紋の採取に成功した。直ちに保管資料と照合した結果，会社員（二十八）の右手親指と確認された。発生後十三時間で逮捕（青森）〔事例２
112,乗り越えて大学を出る。いったい今まで何度柵を飛び越したことやら。千九百九十三年秋、会社員になっているカワカミに電話した。「今度、私もアメリカズカップの仕事を引き受けることにし
113,の２色コンビ控えめな色味のゴールドの２色セット。「２色使いで立体感のある目元に」（会社員三十一歳）「これひとつあれば旬のゴールドメークが楽しめる」（学生・二十一歳）「派手すぎ
114,年収二百五十万の会社員が二百八十万の借金で自己破産の申立てをしました。それぐらいで自己破産できるのですか。
115,もしてもらえなくなる。俺は嫌だった。だから辞めた。今は民間の会社員が輝いて見えるし、公務員が腐って見える。。。さぁ、これからが大変
116,のでしょうか、それとも出発時の無職ということにするべきなのでしょうか？入国カードも同じ。会社員、が無難。調べないから。・・・・・・・・・・・・
117,ファミリーマートは外部へ委託して店舗運営状況を調査し、各店の改善点の把握に乗り出した。会社員から転職して小売業の経験がないままＦＣオーナーになる人が増えている。このため、
118,は、山田順子さんと彼女の友人カトーさんの三人旅。若竹と同年輩のカトーさんはこのとき出版社勤務の会社員で、海外旅行初体験であった。旅の手配はすべて順子さんがしてくれたが、海外旅行初心者
119,商品なら、締切直前にはリアルタイムで参加しないとなかなか落とせない。ところが、一般の会社員だと、平日の日中や、翌日が平日の深夜などは、パソコンにかじりついて
120,もないのなら生活保護という手もあります。ちなみに私は、専業主婦経験がないので、会社員としての給料をもらえますが、二人目の子供が中学に入ってからは、子供
121,を倍増させている。自然で優しい映像も、心地よかった。九十点（穐山隆臣さん三十六歳・会社員）忍足亜希子の演技が素晴らしく、アフガン人と言葉の壁を越えて通じ合う姿が感動的だっ
122,、京都市も八ミリの雨となった。京都市下京区の四条大橋では、通勤通学の会社員、学生らの傘が行き交い、強い雨で足元を気にしながら急ぐ姿が見
123,。しかし家の旦那のように自由ならまだ良いが、市内に働きに出ている会社員にはこんな日はたまらない。アルゼンチンにだって皆勤賞など色々な賞があるが
124,を刺し、さらに別の男性を刺して逃げた。ＣＤを買いに来ていた会社員の男性（三十五）は「あっという間に■■が警察官らを刺したの
125,ですね。３ｃｈａｒａ。あの独特の雰囲気に憧れてしまいます。榊原佑子さん二十三歳会社員１暑かったので、ナチュラルビューティーのノースリーブニットにアクアガールのスカートを合わせてみました。
126,）―アレも忘れないでほしいよ、イタリアチームのイケメン軍団っての。大阪府・■■■■（三十才・会社員）―昔はよくこういうハムが肉屋の天井からブラブラ下がってたんだけど
127,を乗り越えて、中南米諸国をリードする「教育大国」になってくれることを期待したい。イランダビッド・モハタリさん会社員革命によるイスラム主義の影響イランといえば私たち日本人には、ホメイニ師、イラン・イラク戦争、女性の
128,。『いきなり当たりが来て、釣ったら四十五のバスでした！』（二十三歳・会社員）『いきなりコンコンと部屋に入ってきて、見たら四十五歳のオジサンでした！
129,ガムを踏んづけてしまって、怒りながら階段を降りてきたのかも知れない。そこで、会社員とぶつかったとする。運命的と言えば運命的だけど、全くの偶然の出来事
130,●アクションもできて、クール！でも意外にしたたかかも…。（二十九歳・会社員）リヴ・タイラー話題の超大作『ロード・オブ・リング』３部作の全編を通じてヒロイン役で登場。●『ジュエルに気を
131,。命令をキャッチしたはいいけれど、そのボールをどこに投げればいいのかわからない会社員がいればいるほど、私たちに仕事があるの。私たちを生かしているのは、
132,人間味にふれ、また、共感で胸が熱くなりました。（兵庫県・なみだ男／三十一歳・会社員）理想の政治を行う難しさは昔から…☆「聖徳太子」（ＮＨＫ総合）は、
133,早大、横浜国立大学、明大、慶応義塾大学、東京都立大学、学習院大学、日本獣医大学など全国五十九大学。このなかに会社員など職業をもっている者がわずか七人しかいなかったことは、学生たちがどれだけ
134,Ａ列車〈トレイン〉に乗って十二／二十（土）新宿トーアにて調査九十点（高岡英樹さん三十七歳・会社員）ジャズが好きなら、絶対に楽しめるハズ。津川雅彦が栗山千明をエスコートする場面の、さりげなさ
135,、かすれた長い悲鳴をあげた。ちょうど家を出たばかりの、近所に住む会社員が、オーバーコートを着たまま哲之の部屋に入って来た。同じ路地の一角
136,この先、どこにいくんだ？五十六才！！神奈川県・萌えてます（二十九才・会社員）―たしかに昔から男のアレに関しては、“一黒、二赤、三紫”
137,や家の間取りにもよると思いますがたまに聞こえるときはあります。私は会社員なので、夜に洗濯って結構あります。なので他の人がやっていて少し
138,なっただけのことだろう。私は鈴子が、できれば片山のような真面目な会社員の後妻に入って、倖せな半生を送ってくれたらいいと願っていた。稲田
139,ます。改まった場や仕事上では使わないことです。個人のレベルはもちろん、会社員であれば会社のレベルが問われる場合もあります。
140,それでも休まない男である。完全な「仕事バカ＝ワーカホリック」。もしも彼が普通の会社員だったら、定年退職したとたんに、趣味もなく、遊んだ経験もないため、ボケ
141,初詣は会社員ばかり・・・派遣村も地獄こんばんは。センター試験までのこりわずかしかないというこの時に
142,、この「切り替え」を忘れているケースが多くあることが話題になりました。会社員から専業主婦へ、さらに再就職した場合にはまたまた厚生年金に加入…。現在の年金制度
143,マッサージに行っても大丈夫なものなんでしょうか？なんかあまり運動できないからか、会社員ってのもあり、足がだるくて・・・。・生殖器関連のツボを押さない
144,、お父さんの仕事の内容を考えて、たとえば消防士だったらすごく自慢で、普通の会社員だとちょっとつまらないとか、いろいろ差別化されてきますけれど、十歳ぐらいまでのうち
145,出産で戻ってくるお金について質問です。現在会社員で妊娠６ヶ月で、８ヶ月目くらいで退職します。この場合、出産一時金と出産手当金と貰える
146,（１児の母）二十一おめでとう。高齢出産と言われても心配しないで。（会社員、子供１人）二十二ご懐妊を信じていた。昨年十二月のソフトボール部のＯＧ会では
147,料理ができる電子レンジとか」（会社員三十八歳）、「世界美術展ｂｙインターネット」（会社員二十三歳）など、今よりさらに生活に密着したインターネット像を挙げる人たちもいた。高速
148,に行かずにテレビをみていた。隣では妻と大学三年生の娘、会社員で一人暮らしの息子が心配そうに画面を見詰めている。妻はこうなっても責め
149,からにエネルギーが乏しく元気のない様子であった。［家族構成］父親（四十五歳・会社員），母親（四十三歳・パートタイマー），本人，妹（小学５年生）の４人家族。敷地つづき
150,たのに、下の娘のことでは本当に悩まされました。当時、会社員だった私は、会社に行ってもろくに仕事が手につかない日が続き
151,翔悟は、一枝を奪い取ることに…。●登場人物○沢口大輔／岩崎電気工業に勤める二十四歳の会社員。○沢口翔悟／二千三年から来た沢口大輔の息子。千九百八十年ではジョン池山を名乗る。４
152,のですか。もしそうならどのように付き合えばいいのでしょうか。アドバイスお願いします。二十五歳会社員男仕事以外は無視していいと思います。他の同僚の方も、その人
153,（二十六歳・ＰＲ会社）●マドンナやドリュー・バリモアなど交友関係が、なんかかっこいい。（二十七歳・会社員）●毎年、来日予定はあるみたいだけど、なぜか日本には縁がない？
154,なる。野外で飲むお茶は格別です野遊びの最前線まで行く、僕の相棒室井勉さん（会社員）愛車パジェロ（’九十七年式）初めて見る人は「クルマにバイク積んでるの？
155,四十代後半の会社員です。年齢的なもののせいなのか、残業していても集中力や持続力に欠け
156,毎年十万―十三万人で推移。同日夕、五十万人目まであと一人となったところで須崎市浦ノ内の会社員、森田真敏さん（三十）と吾川郡春野町平和の保育士、入交真琴さん（三十）が手を取り合って
157,、いや、きみのお父さんのほうがはるかに上だ。私はただのバクチ好きの会社員にすぎない。課長って肩書はあるが、こんなものは、まあ、バーゲン品だと思った
158,が問われている。分離不安症候群プロフィール小一男子。ひとりっ子、健康で知能はふつう。父は会社員、母は専業主婦。両親とも教育熱心、母親は几帳面だが、やや神経質、過干渉な
159,環境問題について学んだ区内の女性たちを中心に翌九十一年四月に発足した。会員は現在、会社員、主婦、区議など十七人。代表の石毛教子さん（五十一）は「江東区にリサイクル・システムを
160,。波止場人足だった男もいます。なんといっても多いのは大学生です。会社員、学校の先生、公務員、ありとあらゆる職業にたずさわるものが、よろこびいさんで義勇兵
161,最悪な場合上がらないときがあったとしても下がることはありえない」と考えている会社員が多いため、もしも本当に会社が給料を下げようとしたら社員の反発が
162,暮らし方を通じて、子どもに向き合う姿を伝え続けることが今とても大切なのだと思う。ある会社員の男性は、「勉強なんかして何になる」と荒れ始めた娘さんに百の
163,で話題になっているのが、事務所の“要塞化”だ。真紀子事務所がある長岡市の会社員は、「８月の終わり頃だったと思う。突然、事務所の車寄せと道路の
164,は一緒でも人によってその原因はそれぞれ違うし、治療方針も当然違っている。会社員のＫさんが、治療院にやってきたのもひどい肩こりに悩まされてのこと
165,を受給しています。この場合、新マル優の非課税措置は受けられるのでしょうか。（兵庫県、会社員・五十歳）というのがございますが、いかがですか。○水野政府委員新しいマル優と申し
166,のもの。ワイルドなファッションにワイルドなシルバーでかなり目立っていた。佐藤慶臣さん（二十四才・会社員）ドーブベルのペンダントヘッドはレナード・カムホートで、小指のリングがクロムハーツ。さりげなく付けたシルバーと
167,マットな質感が魅力的。「ピンクの発色がオフィスにもデートにも大活躍」（会社員・二十六歳）「なぜか肌色がきれいに見える。女の子らしいメークにしたいときに使っ
168,ひどい吹き出物が焼き梅干しできれいに消え重度の倦怠感が三日で一掃●岐阜県●三十五歳●会社員川崎美和子（仮名）三日で体が楽になった焼き梅干しが体にいいという
169,肌をしっとりさせる、など、石鹸としての基本的な機能が優れている」（三十歳・会社員）クレンジングビューティオイルバランサー￥５、０００（シュウウエムラ☎０３・３７９７・１９８８）
170,九州在住、二十九歳、会社員（建設業）年収三百九十万、高卒、十段階評価でとどれくらいでしょう？自分は６か７
171,、新しい環境で登校できるようになった。おいたち父母、本人の三人家族。父は会社員。毎日残業があり帰宅時間は十一時を過ぎる。素朴でやさしい父は、ひとりっ子の和子
172,にきらめくダイヤモンドスキンで、ジュエリーとともに光を吸収して。大野かをるさんおおのかをる会社員乾燥肌でベースがのりにくく、ムラになりやすいのが目下の課題なのだとか。保湿
173,ＰＴＳＤ）になった。女性を診察した国保旭中央病院（千葉県）の大塚祐司医師によると、女性は会社員。救急法の指導員資格があり、機内で倒れた男性に独りで人工呼吸や心臓マッサージをし
174,、食費・水道光熱費って月にいくらくらいですか？？参考にしたいのでご返答お願いします☆会社員の夫と、出不精の専業主婦です。食費（夫のお弁当込み）３〜３．５万円です。月に
175,なキラメキがＯＬ層に人気。「オフィスでも大活躍。クリーミーな質感で使いやすい」（会社員・三十一歳）「指でつけられるのがいい。パール感もきれい」（販売員・二十四歳
176,五十七．七％が「会社員」であるが、総貸付残高別でみてみると、規模が大きくなるほど「会社員」の比率が多くなる傾向にある。男性年齢別顧客構成比（％）女性年齢別顧客構成比（％）男性年齢別顧客構成比（
177,たりした時は、行きつけの喫茶店「阿羅漢」でモーニングセットを注文したりしてしまう。一方その会社員は、きちんと毎日朝六時に起きて、埼玉県や千葉県あたりから遠距離通勤していて、たまたまその
178,するように」と言ったとか。向いは和田英ちゃん家。同じ年、お父さんは会社員、お母さんは、何時も頭を奇麗に結って居て眼鏡を掛けて居ます
179,この店の誇りが感じられる。ここのあるじは、富山県の出身で、むかしは会社員だったそうな。今度、久しぶりに行ってみたが、味は少しも変ら
180,の接続。ホームページからのレシピ情報など情報を取り込んで料理ができる電子レンジとか」（会社員三十八歳）、「世界美術展ｂｙインターネット」（会社員二十三歳）など、今よりさらに生活
181,続けている」「どういう意味？」柚子は具体的に知りたかった。「会社員にとって一番大事なことは社内政治だ。どの人脈に入れば出世するかだ。邪魔者は
182,会社員の間下（鈴木浩介）が殺害され、出会い系サイトで知り合った美由紀（安倍麻美）が逮捕され
183,能力」という題名の興味深い調査結果を目にしました。それによると、三十代初めの会社員が「現在働く上でとても重要な能力」としてあげているのが、「コミュニケーション能力」「
184,勤める人が通常より安い価格で購入できるのですが、このアカデミック版をオークションで購入し、例えば会社員や主婦など対象者でない人が使用することは可能でしょうか？本来はいけないことな
185,常盤貴子の人気で、香港映画を多くのひとに見てほしい。百点（吉野ゆかりさん三十二歳・会社員）こういう香港映画をもっと日本に呼んで、地方でも公開し多くのひとにその
186,発生した。十月三十日未明、東京都奥多摩町内の林道脇に止めてあった乗用車内で、中野区の会社員の男性（二十一）と、埼玉県桶川市の職業不詳の男性（二十五）が亡くなっていた
187,三十才独身男です。会社員で年収四百万円です。大阪市在住です。結婚相談所に入会しようとおもいますが、どこがいいでしょう
188,という意見が目立つ。その一方で、「今までどおりのことをもっと快適にできる」（会社員二十七歳）と、とにかく現在の通信速度が不満で、その改善策として高速インターネット環境がほしいという意見
189,三十歳・自営）●いきなり再婚して、世間をあっと言わせそうな予感。（二十五歳・会社員）ヘレン・ハントキャリアウーマンからアル中の主婦までこなす演技派。新作『Ｄｒ．Ｔと女たち』が待機中。
190,】（図は☖７四同玉まで）（最終局面）指し手九十八手受けつぶし今井さんは三十歳。会社員。棋歴十五年。四段。好きな棋士は矢内理絵子女流三段。得意戦法は居飛車。棋風は受け
191,あけび高山珠美昭和四十三年生（群馬県）会社員遠い遠い記憶のようだが、ふとした瞬間、鮮明によみがえってくる思い出がある
192,出来ちゃった結婚もいるし、色々ですよね、でもみんなバイトじゃなくて正規な会社員でしたよ、バイトでいるなら彼も結婚とか思ってないんじゃないかな、
193,お弁当は社食より安くできるから、お小遣いが増えてうれしい御褒美です」■■■■さん（二十五才）会社員週末につくりおきしたりレンジを活用して時間短縮（右）しそ入り肉みそチャーハン（左）スクランブルエッグ鶏肉
194,て、だんだん圧を加え、五感を刺激していくことという。参加者の一人、会社員の清水勲さんがマッサージしてあげると、五カ月の日菜子ちゃんはうれしそうに反応している。平日の
195,一、十四年以上五十年未満の男子及び二十五年未満の未婚女子一、著述業者（官公衙奉職者、学校教職員、会社員、医師等を除く）一、有資格者は八月末日までに住所、年齢、部会別明記、事業部宛ハガキ
196,、双方ともあきがこないデザインが気に入っているとのこと。ＮＵＫＥさん（二十七才・会社員）ペンダントはクロムハーツのもので知人に目の部分にダイヤを入れてもらったオリジナル。
197,・販売員）●『チアーズ！』で久々に人気復活。チアガール役がハマリ役。（三十三歳・会社員）●マキシム誌の表紙を飾った挑発的なポーズにはびっくりしたな。（二十六歳・新聞記者）
198,この説示の内容は、いくつかに分類できます。一つは法律問題です。例えば、会社員が公務員に対してその令嬢の結婚祝いに三十万円も渡したために、贈賄罪で起訴され
199,＞二十五番＝五十嵐昭之助―菓子製造販売業―停車場前＞二十六番＝石川昌訓―呉服商―停車場前＞二十七番＝田中九十郎―会社員―停車場前＞二十八番＝石井勘七―雑貨商―停車場前＞二十九番＝石井藤次郎―
200,とて月給取りなのだから、サラリーマン化するのは当然だという声も聞かれるが、民間会社の会社員と警察官とでは根本的に性格が違っている。民間会社は、利益を上げなけれ
201,間は自分で３に入る、ということになります。年金今話題の年金です。会社員は「厚生年金」に自動的に加入しているので、どれくらい支払っていて、どれくらいもらえる
202,基本原則２）。特にレストランの新メニューのような場合は会社全体の一大事だから、会社員を前提に考えるのがよい。活動のテーマが、お土産コーナーであれば、レジを担当する
203,なかったけど、『ロード・オブ・ザ・リング』とか大作系の公開が控えているから。（二十七歳・会社員）●英国のこれからを担う実力派。子育てとの両立がんばれ！（三十一歳・秘書
204,しました）由理さん（三十一）札幌市在住の会社員。亜紀さん（三十二）札幌市在住の会社員。夫（二十八）、長女（三つ）と暮らす。弘美さん（二十九）大学院生、
205,人」を指定するのが正解な時がほとんどさ。今日はいわゆる「ゴトウビ」しかも会社員は給料日。正常な判断ができなくって怒る気まんまんのクレーマーの電話がいつもの
206,は，約７割が農業と関係のない職業についていた者であり，なかでも会社員が最も多くなっている。就農の動機としては，「農業には夢，将来性，
207,が主にやっていて売上はしれていますがキチンと申告もしています（私自身は会社員です）。そのお店に百円入れて遊ぶゲーム機があって子供が時々遊んでいます
208,ているわけです。このため、マンション経営に取り組むお客様も、従来の富裕層からごく平均的な会社員、公務員の皆さんまで、すそ野が急拡大しています。今後、マンション経営は、賃貸マンション間の
209,多いということで有利です。そのため「自己表現力」と「教養」こそは、会社員として充実した人生を送るための車の両輪と言えます。特に今日、情報の
210,に対する不満としては，職業階層全体でみると，包装単位に一番大きな不満が表れているが，会社員は貯蔵期間，主婦と専門職人は表面と中身の違い，自営業者は包装単位，学生は不均一
211,たこれまた怪しげなタイトルがならび、しかし著者は「山崎俊夫」なるむしろ平凡な、会社員の名刺にでも刷られているような名前だったのが、かえって妙に気
212,自分の意思の弱さにガックリです。皆さんはどんな方法で貯金しました？私は会社員で、給与が銀行振込なので自動引き落としの定期預金にしています。自動的にお金が貯まる
213,週３日、契約家庭を訪問し掃除をするのが仕事。夫・亨司さん（四十六歳）大手鉄道会社に勤務する会社員。スノーボード、サーフィンが趣味。長男・司くん（中２）最近、ボディーボードを始めたお兄ちゃんは、
214,立たないクズ社員ばかりが集まっていると、悪口を言われていて。まあ、ぼくも会社員としては優等生ではなかったけど、『全員集合』をやったおかげで、「良いクズ」
215,四十代、会社員、既婚、女です。六十歳位の知人の男性と、時々朝にお茶を飲みます
216,を稼ぐか」シュミレーション説明。この種類の本にはどの本も全く不動産を知らない会社員が始めるには説明不足を感じたため。全くの新規層に本当に初手から教えて
217,結婚２年目の会社員です。住宅ローンを考えています。消費者金融５件で二百万ぐらい借り入れしていて去年に完全返済して
218,でパ・リーグ（オリックス）に移籍しました。その後九十一年オフに解雇され野球選手をやめて会社員として働いています。ちなみにパ・リーグ審判員の栄村は別の人です。
