,0
0,製品に対する愛着も芽生え、かつモラルも高まる。セル生産だと、生産現場で隣の作業員がどんな作業をしているのかがわかりやすい。それで一人の作業員の行う作業の範囲
1,調べ、出来ましたら確認のためご説明を頂くのもかねて事前にお電話してみましょう。作業員は必ず取り扱い免許を持ってますので訪問された際には、免許ならびお名前を確認しておきましょう
2,たいと願っている。庭のヤツデの花も開きだしている。隣の建設現場も重機が作業員を待ちかねているようだ。父の葬儀で始まった年も残りは少ない。やり残し
3,）作業者工程分析とは工程分析は一般に物を対象としているのに対し，作業者工程分析は作業員の動きを対象としている。つまり，作業員の移動が生産性に大きく影響を及ぼす
4,はどうしても釈然としないものが残る。地主が小作人の、もしくは工事現場の現場監督が作業員の不始末に対して、この言葉を発するのであれば、あるいは抵抗感もなく受け入れられるであろう。
5,水位をはかろうとしたとき、堤防に亀裂が生じた瞬間、堤防が決壊し、作業員数人がその濁流に巻き込まれ、人的被害をこうむりました。町に浸水した濁流は
6,の作業員と機械との関係の分析，各作業者の相互関係の分析のほか，機械や作業員のワークサンプリングに適している。その反面，スピードのある細かな動作の分析には不向き
7,軽減することはいうまでもない。根源の核種が減少するほど、熱的加重、放射能によりおこりうる損害、作業員への危険度等々すべては減少する。もし廃棄物が適当な容器に完全に収容されていると仮定すれ
8,。（１）工程の種類工程とは，一つの仕事を分業化し，複数の作業員が分担することによって生じる概念で，製造過程を構成する一つの単位をいう。つまり，工程
9,に豪雨が降った。特に，５日，高知県土佐山田町の繁藤駅付近の土砂崩壊現場で，救出作業中の作業員が再び山崩れにあい，生埋めとなる等で死者・行方不明者六十一人を出し，また，６日，
10,に恵まれていることも大である。時期も十二月に入り、営林署でも夏山作業が終わり作業員も失業中であったので、これからやる仕事を話し合っていた。「大池集落で、
11,，それを実践していかなければならない．そのためには，限られた時間内に，業者（作業員）にいかに有効に効率良く働いてもらうかが重要である．仕上工事の期間としては
12,ことで、感情の捌け口を見いだそうとする。収容所生活も２年を超えた四十二年９月。作業員を運ぶインド人に化けた２人は、監視の目を欺いて脱出し、そこからハラー
13,分別・ラベル剥がし等を行ってから排出させる。各種の取り決めの周知徹底に対して大きな効果が期待できるが、作業員にはこのような指導を行えるよう日頃から研修を行う必要がある。３．
14,が特に多い．したがって，この時期に仕上業者を確保するのは非常に難しい．確保した作業員をいかに有効に用いるかも施工管理技術者の腕である．そのためにはどのように彼ら
15,ことが確認できます．ただし，かなり堅苦しい文書のようです．ｗｗｗ．ｓｔｏｃｋｓｉｇｎｓ．ｃｏ．ｕｋ／ｐｄｆｓ／二千三／五十．ｐｄｆ作業員は，支給されたイヤー・プロテクターを着用し，何か欠陥があれば報告しなければならない．ｗｗｗ．ｇａｒａｎｌｕｃｏｗ．ｃｏｍ／ｓｂｅｌｔ．ｈｔｍ運転者
16,ＶＴＲ以外によるメモモーション分析は，一般的とはいえない。５．６稼働分析稼働分析は，主として作業員の動きを観測する手法である。作業員の勤務時間中の行動をみると，作業に直接関係
17,を合わせて約四百ｋｍの広範囲な除雪を行うため、約五十台の除雪車両と総勢百人を超える作業員が除雪作業に備えています。作業員一同、今後とも迅速・適切な除雪を心掛けてまいりますので
18,現場での作業についてみると，閉鎖型の施設内では粉塵が問題となる。作業員の健康を考えると施設内の労働環境についても改善する必要があるが，運営が厳しくその
19,の動きを追い，倉庫から現場へ行き，各工程の作業状況を観察する。その際，作業員や職場長から作業方法の説明を聞き，作業内容を理解した上で分析表に記入する。４）
20,冬仕事の話でにぎやかである。高坂集落の若い衆は四月から十一月の間、真室川営林署の作業員をしている者が多かった。農業と営林署からの収入で村でも豊かな
21,ことでしょう！千五百ドルでこの沈没船を日本のサルベージ会社へ売却したのです。日本の作業員は軍艦の残骸の中に、たくさんの水死した乗組員の遺体を発見しました。
22,実線，運搬員は点線，運搬機器は一点鎖線で表す。５．５動作研究動作研究とは，作業員の行う動作について観測し，その中から不必要な動作を排除したり，動作の方法を
23,！以前に納めた装置が原因不明のトラブルで動かなくなってしまって今日の午後から作業員が客先に行き修理をしていたのですが、結果的に現地修理作業だけでは直らない
24,は、別の棟にある機械格納室をよく見て、そこでの作業の手順と作業員の仕事振りをよく観察すべきである。
25,五分から十八時まで、どこで何をしていたか。とくに十三時五分から一時間、作業員は昼食をとるためにゴンドラから目を離している。写真はその間に撮影された
26,。それは上陸部隊の兵員数で、アメリカ軍のウェーク島にあった二千名（兵員千名、作業員千名）に対して五百名しか用意していなかったことである。もともと海軍の陸戦隊は普通の
27,こともございまして、厳寒の中で昼夜を問わず復旧を行っておりました作業員に対して市民の温かい応援があったということでございまして、心から感謝しているところ
28,は二千一年五月十五日に、有害物質を積んだ貨物列車が無人で走り出して暴走し、勇気ある作業員が飛び乗って停車させ、危機が回避された。この“整備新幹線”という有害列車は
29,出ても一、二等の寝台車に乗らず、二等の座席であった。工場では作業員と同じ服装をして働いた。そのため佐吉を作業員と間違えることもあった
30,。だが、そこには何もなかった。橋桁の上を牽引車に乗った作業員が通りかかった。「おじさん、ここにあった隕石はーっ！？」
31,考えておりませんで、むしろ定期につきましては、将来基幹作業員とそれから臨時の作業員の両極に分配をしていくというのが、基幹作業員制度を設けました際の基本的考え方で
32,を設ける．４可燃性ガスの濃度が爆発下限値の三十％以上であると認めたときは，直ちに作業員を安全な場所に避難させ，火気その他点火源となるおそれのあるものの使用を
33,さえないというのが、およそ想像を絶したことだったわけである。またそれらの作業員は、地球的な意味における労働者でもなかった。彼らは週のうち何時間かを
34,何をしているかを瞬間的に観察する方法。（３）観測対象と観測項目稼働分析は作業員のほか，機械や間接員にも適用される。観測に当たっては，観測対象の作業（行動
35,られるかどうか下見に来ているミアは、いつもと違ってまるで何かの作業員かと思うほどカジュアルな服装だったが、そんな服でさえミアが着ると妙
36,うるさい」衆院選立候補者の演説を妨害したとして、警視庁捜査２課などは三十一日、作業員（三十七）を公選法違反（自由妨害）の現行犯で逮捕した。容疑者は「朝から名前
37,の観測項目機械が対象の場合は，機械自体の動きに応じて作業を分類し，作業員の動きとは一応切り離して考える必要がある。表２‐十八は，機械の
38,建設工事なら請負工事にするのだが、困難な技術開発を行うのだから最初は国鉄が直接作業員を雇い、器材も直接購入するという直轄直営方式が採用された。最初の仕事は、直轄職員部隊の
39,きたＭ社は本の冊数を再度確認して、七十箱が無理だと分かると、作業員を一人増やし、ダンボールを百個にして、十万円という数字を出しました。三万円
40,から立ち上がった老女たちはしめて十人、私を入れて十一人だった。今日の作業員は十一人、ということはクラブ会員全員ということである。十一人で頑張れば、なんとか今日中には
41,になった場合には後進に道を譲っていただくというような形を現場の作業員の方々にもとったわけでございます。国有林の場合、私どももただいま改善合理化を進める
42,気をつけて窓の外を見てみよう。黄色い服を着て道路を掃除している作業員がすぐに見つかるはずだ。上海に毎年ほど行っているが、最初はゴミだらけの
43,た。支那服の上に作業衣を着せて、公役作業員の恰好にしてくれ、他の作業員と共に、収容所を出た。福原総領事も付き添ってくれたので、中国軍の衛兵は
44,による改善作業者工程分析によって，作業員の移動距離の短縮と移動時間の低減を図る。また，作業員が行っている工程（特に移動工程，停滞工程）の廃止，作業順序（移動経路）の変更など
45,安全に保管されていた。連絡を送ると、打てば響くように十名の作業員が円匙、十字鍬、戦死者の帯剣の束などをかついで現われた。私は
46,（ワ）撮影、映写設備当然、これらの施設・設備には、これを動かす技術員、作業員がおり、各伝習会には他から招かれる講師、これを助ける助手、作業員がおり
47,は危険水位を断続的に超えていたため、破堤防止の作業を徹底的に行いました。作業員が水位をはかろうとしたとき、堤防に亀裂が生じた瞬間、堤防が決壊し
48,四十日はかかるのがふつうだ。この間、一つの原発について最盛期には千六百人以上の作業員が検査関連作業に携わる。こうした作業の際には、放射能の高い炉心など
49,処置：地盤を凍結して空洞をつくりビットの取付けを行った．４セグメント組立中に作業員が挟まれた．原因：合図ミス５発進立坑からシールド発進の際，エントランスパッキンから浸水し，
50,のように雑然としているが、ここはダイムラークライスラーにとって隠れた戦略拠点なのである。作業員が二人一組で小型車「Ａクラス」の解体作業に取り組んでいた。一人が部品を次々に取り外し
51,で時間を観測する方法。２）瞬間観測法（ワークサンプリング法）ある時刻に現場を巡回し，作業員がそのとき何をしているかを瞬間的に観察する方法。（３）観測対象と観測項目
52,た。工場では作業員と同じ服装をして働いた。そのため佐吉を作業員と間違えることもあった。だが一方で、佐吉は用意周到な計画を立てて、
53,かが落下し、大爆発と同時に大きな火柱が立った。その場に居合わせた作業員の大部分が、工兵隊員だけに、その反応は素早かった。爆発で生じた粉塵
54,Ⅱ（短大・高卒程度）、事務Ⅲ（身障者）、作業療法士、臨床心理士、看護師、技能労務職Ⅰ・Ⅱ（作業員、調理員など）。受験資格など、詳しくは受験案内で確認を■申し込み九月十六日（
55,作業者工程分析の目的を示す。１工程，作業方法，設備を改善するための資料収集。２作業員の移動を最小にするためのレイアウト改善の資料収集。（２）作業者工程分析による改善作業者工程分析によって
56,なかった。全体の様子が、なんとなく気持ち悪かった。次の週も作業員は一人も現場に現われなかった。スティールに談判するため、ララは再びハリファックスへ向かっ
57,技術員、作業員がおり、各伝習会には他から招かれる講師、これを助ける助手、作業員がおり、また、ホームスパンの如く恒常的に雇われている女子作業員もいた。前に
58,まれに起こる行動であるから，稼働率の算出には含めない。表２‐十七作業員を対象とした観測項目の分類例２）機械の観測項目機械が対象の場合は
59,が初めて発生した二日後。五月二十六日に水無川の最上流で砂防工事をしていた建設会社の作業員が、火砕流に巻き込まれたが、運よく腕に軽い火傷を負っただけで
60,指名し，毎日作業開始時および異常を認めたときは，ガス濃度を測定させ，その結果を作業員に反映できるようにするとともに，記録する．３可燃性ガスが存在して爆発または火災が発生する
61,アホなネタになってしまいました。会社の昼休み中に散歩している時に通りかかる列車に作業員があの独特の格好をしたんで、ネタになりそうだったんで、作業員に
62,いえない。５．６稼働分析稼働分析は，主として作業員の動きを観測する手法である。作業員の勤務時間中の行動をみると，作業に直接関係のある動作だけでなく，種々雑多な仕事
63,今朝も既に工事音が響く我が家である。またもや地中からパイプが発見された。昨日は作業員も３人に減っていたが、今日は増員している。それでも当初の人数よりは少ない
64,の対策をしていくに当たって、汚染された土壌を浄化していくわけですよね。その作業員とか従業員の健康を守るためにどのような対策がとられていくべきだとお考え
65,スティールは彼女を安心させた。「ほかの仕事の引っかかりがあって、作業員をそっちへ回さなければならなかったんだ。でも、これは一時的なもんだ」「では
66,広げて我々に「止まれー！」と道端で叫んでいた「君のところの作業員が交通事故に遭って、病院へ運ばれたぞ！」そしてその向こう側にぐちゃぐちゃに
67,て兵器、材料、部品をあつめ、運搬し、工事を実施する。その各段階をベテランの作業員が円滑に工事を進めてくれる。私ははじめはもっぱら一つ一つ頭に入れていっ
68,対象としているのに対し，作業者工程分析は作業員の動きを対象としている。つまり，作業員の移動が生産性に大きく影響を及ぼす場合に適用される。これに該当する作業には
69,最初の発表の四十九人のうちに含まれています。これら及びその後に起こった作業員の被曝に関しては、驚くべき、そして今後の大きな反省材料にしなければならないよう
70,のである。「金龍丸」では「大発」一隻が破損、「金剛丸」では作業員二名が海に落ちるという事故が起きてしまった。この原因として、（一）
71,なった。「また中途半端で終わるのか」と不安がよぎったが、残った作業員と力を合わせようと気持ちを切り替えた。休日返上で作業を続けていると、「
72,た。「大勢の俳優や高給取りの技術者を雇う、二十〜三十ヘクタールに広がるスタジオ。大勢の作業員が文字どおり一夜にして中国やロンドン、インドの街並みを造り上げ、一度に二十本の
73,残っているからだろう。読売新聞によると、千九百八十年十一月、横浜市緑区の高圧送電線の鉄塔建て替え工事現場で、作業員が機械で掘削中、白く塗装されたアルミ製の箱を掘り当てた。作業員が箱を
74,数メートル間隔で並んで、決められた作業を繰り返し行う風景が頭に浮かぶだろう。作業員の間の仕掛品を運ぶベルトコンベヤーは工場の中心に陣取る主役という構図だ。これは
75,地味なウエアを着ていた。スノーボーダー独特のごつい手袋をしていることを除けば、作業員のようなスタイルである。男は、雪がのっかったままの頭をぺこっと
76,（２）を中心に，独立の電力システム（太陽電池アレイ；４）をもち，ＩＳＳ組立中の作業員の居住区となる．ＩＳＳ完成後は，資材貯蔵所，科学研究施設となるが，ＩＳＳ制御機能の一部も受けもつ
77,を分割したにもかかわらず七千五百平方メートルで納まった。さらに、人員は全自動化ラインが九百二十五人の作業員を必要とするのに対して、宮田工場は八百二十五人と百人の省力化に成功した。これは
78,を出す惨事となった。９月には、新日本製鐵株式会社名古屋製鐵所の燃料用ガスのガスホルダーが爆発炎上し、作業員十五名が負傷するほか、周辺民家の窓ガラスが割れるなどの被害が発生した。また、株式会社ブリヂストン栃木工場
79,四人を見まわして説明した。「昨日の朝、七時三十分に建設現場にいなかった作業員の数です。ただし、そのほとんどはもともと仕事がはいってなかったからです。彼ら
80,整備が進められていた。島の要所要所には砲台が据え付けられ、千名以上の作業員が基地建設に従事していた。加えて開戦直前には空母「エンタープライズ」によって、グラマンＦ４Ｆワイルドキャット戦闘機十二機が送り込まれ
81,出すべきだ」と、注文をつけた。座散乱木遺跡のある宮城県岩出山町で検証発掘の作業員として参加している農業、三塚一栄さん（六十八歳）は「今日こそは（本物の石器が）
82,とか、そんなんじゃないよね？どうしよう。何て言おう。とりあえず、この作業員の人達と一緒に、今日のところは帰って欲しいって、当たり障りなく言うには、
83,稼働分析は，このような行動を研究するわけである。（１）稼働分析の主な目的作業員の行動を終日観測して，どういう動作が，いつ，どんな割合で発生するかを
84,にする。この調査資料を次のような目的に活用する。１）稼働率の向上作業員が行う間接作業や余裕作業の発生原因を追究し，職場管理の欠陥を明らかにし，それを
85,，その観測方法の違いによって次の２種類に大別される。１）連続観測法（連続稼働分析）作業員の行動を連続して一日中観察し，ストップウォッチや腕時計で時間を観測する方法。２）瞬間観測法
86,の不良により，排気系を通じて六フッ化ウランが環境中に漏えい。２千九百八十六年１月，米国セコイヤ転換工場において，作業員の操作ミスにより六フッ化ウランの過充塡及び過充塡されたシリンダの加熱が行われたため，シリンダ
87,担いで帰ると、１人分の日当が出たということです。だから、山主さんは、作業員に帰りには間伐材を担いでくるように言っていたそうです。かりに、
88,破損箇所に対する応急措置等の応急対策活動に関する協定。企業は，必要な建設資機材を提供するほか，協力企業の作業員が「災害工作隊」「レスキュー隊」等として，障害物除去，破損箇所応急措置等の作業を実施する。■図３‐２
89,、タコが何たるかも知らず、ただ恐れていたのです。当時、土工現場の作業員には他雇と自雇があり、他雇は前借して雇われ、自雇は普通の作業員
90,移動を最小にするためのレイアウト改善の資料収集。（２）作業者工程分析による改善作業者工程分析によって，作業員の移動距離の短縮と移動時間の低減を図る。また，作業員が行っている工程（特に
91,。いかにもフロイト的で抵抗があったという言い分はわかりますが、水とかパイプ、作業員といった実際的なものでなくフロイト的なシンボルが頭にうかんだことには、何か理由
92,が箱を開けたところ、厳重に梱包された黒い鉄製の箱が出てきた。作業員は爆弾ではないかと思い、横浜・緑署に届け出た。同署で調べたところ、箱の中身
93,、バラバラに壊れるし、生物のからだの中でつくることもできる。おダンゴをくっつける作業員、それを酵素っていう。マグネシウムなどのミネラルには、酵素の作業を助ける働き
94,やがて業者が、資材運搬のため幅３ｍほどの砂利道を三百ｍ、五百ｍと伸ばした。作業員は、モッコとツルハシで、その先に幅１ｍの歩道を開いていった。ただ
95,境にあると伝えられます。驚くべきことにこれら三人も含めて、多くの作業員は放射線量を測るための線量計もフィルムバッジも着用（放射線管理区域内の作業では当然義務づけられている
96,をしていたか」泣き出したい気持ちが、ふっと薄らいだ。事件当日の、「作業員がゴンドラから目を離した時間」のアリバイなら、ちゃんとある。「昼休みは
97,かしら鍵のかかっていない出入口があるものだ。ましてやいまはあれだけ大勢の作業員が出入りしているんだ。だが、ぼくは探し物に来ただけで、妹には何
98,ました。同じ時期に金沢八景（神奈川県）の百貨店がオープン間近だったので、私も作業員と一緒に現場作業もしました。千葉県の浦安のショッピングセンターにも行き、店舖
99,の騒音にかき消された。写真家が黒いヴェールの下にひょいともぐった。製材所の作業員は荷馬車を空にし、十本あまりの柱の下に腕をくぐらせて大通りを
100,平成二十年度（平成二十年４月１日〜）に採用する臨時職員を募集します。●募集内容１職種（作業員、保育士、調理員、校務員）２昭和二十八年４月２日以降に生まれた方３職種ごとに必要な
101,また、現場の作業者の知恵でどんどん生産性をカイゼンできるのもセル生産方式の良い点。作業員はモノづくりの喜びが生まれ、製品の品質が上がり、製品に対する愛着も芽生え、かつ
102,ていました。線路際には電源関係を収納した灰色のボックスがあり、恐らく保線関連の作業員が草刈りしたようです。このボックスの位置から北側（下関方面）に隧道の南側坑口が
103,の引越は避けたい。２年前、やむをえない事情で夏に引越した時、作業員の汗が大量に荷物に落ちて、それを拭き去るのに大変だった記憶が
104,ています。取り替えにかかる時間は十分程度で、費用は市が負担します。※作業員は身分証明書を携帯しています。水道料金の支払いは口座振替で水道料金の支払いは、手間
105,認めなかった事例・古電柱の荷おろし作業中，積載されていた古電柱が荷台から落下して，作業員が下敷きとなって死亡した場合（大阪高判昭五十五・十二・二十三（控訴審）交通民集十四巻６号千二百六十一頁，
106,色に塗られている。そこに働く人たちの作業服も、部屋と同じ色だ。作業員は部屋に入るたびに、特別殺菌室を通らなければならない。食事や休憩や用便に外出する場合
107,、国有林につきましては、いま申し上げましたように、直営直用でやっております作業員につきましては通年雇用という体制をとりまして、十分な安定した形で仕事
