,0
108,鉄塔建て替え工事現場で、作業員が機械で掘削中、白く塗装されたアルミ製の箱を掘り当てた。作業員が箱を開けたところ、厳重に梱包された黒い鉄製の箱が出てきた。
109,あった。石垣は遺跡保存のために築かれたもの。千九百九十年●ハネ遺跡の発掘現場。作業員の子どもたちが見学にやってきた。千九百六十四年●発掘作業員の一人，テイキ・カベエＴｅｉｋｉＫａｖｅｅ。
110,、器材も直接購入するという直轄直営方式が採用された。最初の仕事は、直轄職員部隊の転勤交渉や作業員の確保、職員・作業員の宿舎の手配、さらに鍋釜茶碗の類までの調達などの組織作り
111,傍に長さ六フィート、幅三フィートの大きな箱をよく見かけたものだ。その箱に作業員が夜の間、自分らの作業道具をしまっておくのだが、それを見て私が
112,三十四年頃、Ｄ五十のブルで草津白根の工事現場に入った。飯場は殺生付近に在り、作業員は二十名程だった。現場の土質は柔弱だったため、ブルがカメに
113,よっ。あたし、なんとなく数えてたんだけど、マンションにはいっていった作業員は八人。だけど、でてきたときは九人だった。どうしてひとり増えたの
114,行う作業の範囲が広がり、一作業員の生産性が向上する。ただねじを締めるだけだった作業員は別の作業も受け持つことになり、結果として人員が少なくて済む。究極の工場の
115,や改善の原則を適用することになる。１）動作の観測・記録まず，作業中の動作（作業員の手や足，目などの動き）を観察しながら細かく分解し，観測用紙に記入する。
116,工期を短縮しなければ終わらない，「がんばってやってくれ」とはっぱをかけておく．作業員の方々には申し訳ないが，そうすると多少の遅れが出ても工程の中
117,口をあけた。「ちょっと、みずき、わたし、さっぱりわからないよ。コンテナ車と作業員と作業服って、いったいなんのために？」「つまりその三つこそが、この
118,難易に関係する。次に観測項目の分け方について説明する。１）作業員の観測項目機械作業における作業員の観測項目の分類例を表２‐十七に示す。詳細に調査するには，カッコ内の
119,観測の精粗や観測の難易に関係する。次に観測項目の分け方について説明する。１）作業員の観測項目機械作業における作業員の観測項目の分類例を表２‐十七に示す。詳細に
120,かによって変わるが，小さな異物の混入は予想されるよりもずっと多く，スクリーンには作業員がついていて，ブラシでこまめに清掃しなければ，プラスチック片や髪の毛などがからんで
121,一つの製品をつくること。それがキヤノンでいう一人完結セル、つまり一人屋台生産方式である。作業員は自分の周りに必要な資具、工具を並べてモノをつくる。お祭りでたこ焼き
122,。きっかけは山形県の月山で起きた雪崩れ事故なんです。山で電気工事をしていた作業員の方が４人埋まっちゃったんですが、その中の一人のお父さんが、スコップ持っ
123,にした。まったく他人事ではない。テレビの一報では「東海村」「放射能漏れ」「作業員が被ばく」という程度のことしかわからなかった。その後「臨界事故」であることが
124,私の本日の作業は広島県大竹市黒川の大膳川の河川改良工事現場にて下流左岸側の凭れ擁壁の脱枠作業を作業員四名で行います。今週！月曜、火曜、水曜日までに凭れ擁壁の型枠の脱枠作業を
125,。どうしてですかと言ったら、まだ雪が消えないうちです、ある日どどっと作業員の方がおいでになって、雪を片づけなすった。そこを舗装を、今のあの機械
126,相談も受けていない」などと詰め寄り、原発阻止を強調した。さらに福島原発の定期修理に作業員として行ったという磯部一男さん（五十九）は「ポケット線量計など四つの放射能測定機を持って作業に
127,六十三％と、こういう指摘なわけですから、これは労務管理というか、個個の作業員が、当然計画者がこれぐらいはできると思ったやつが実際やってみるというと
128,‐６加工経路図５．３作業者工程分析作業者工程分析は作業者移動分析ともいわれるように，作業員が作業場所を移動しながら作業する場合を対象とし，その作業すべての内容と各作業との
129,の真相は・・・・道路を直進していた韓国チームの車に左側からパキスタン系の作業員を運んできたバスが一時停止もしないで進入してきたらしいサウジアラビアの道路は
130,ていたのも印象的です。施設関係者だけで一万人に上り、建設現場では毎日四千人の作業員が働いている、とのことでした。地元シェルブール商工会議所の職員は「施設が立地したこと
131,の動きが急におかしくなり出した。ある朝、ララが現場に行ってみると、作業員は二人しかいなかった。しかも、二人ともぶらぶらして、ほとんど何もしていなかった
132,しかし、国が乗り出す以前に、緑化事業を試みていたことなどが考慮され、なんとか作業員になれた。始まった当時のことを、飯田さんは克明におぼえている。「
133,ウーン、参ったなあ」と言いつつ、会社に携帯で電話をし、Ｈ社より作業員を一人増やして十六万円で引き受けてもよいかと問い合わせていました。が、会社
134,求められるだけに、間伐の手の入らないまま放置される山林が非常に多い。作業員の人手不足が、その傾向に拍車をかけている。上野村では、間伐作業への
135,状態でした。急な仕様変更や追加工事には対応できる状況でなく、工事に着手できず、作業員が遊んでしまうこともありました。●現場情報は、毎週の役員会で各現場の状況報告を確認し
136,のいる場所からかなり離れた場所でベージュ系の作業着で光る物を全く付けていない作業員が道路の真ん中で１人で作業をしていました。最徐行をしていたので
137,岸壁をのぞいた。山崎平吉は舷梯の手すりに手をかけ、のぼろうとして作業員に取り抑えられた。彼はもがきながら、彼女のほうに向かってなにか叫んでいる
138,用いられていたものと同型であり，ＩＳＳの軌道上組み立て開始時に真先に打ち上げられて，作業員の居住区となるとともに，ＩＳＳ完成後は科学実験などの目的に用いられる．＊５
139,て調査に来ていて、金儲けの仕事に来たのではない、ただし発掘のために作業員を雇うが、それは地主とその親族関係の者から選ぶことにする、ということにしまし
140,は、昔からあるような靴屋さんなら手に入るかも。後は、とび職さんや作業員の人の為のお店「ダイワ」と言うのがうちの近所にありますが。
141,。木箱の陰にぴたりと身を寄せながら、声のするほうへ進み、ふたりの作業員から十ヤードも離れていないところを見つからずに通り過ぎた。スコットは苦しそうに歩き
142,た。窓口に面した廊下解体途中の足場の前に、少年と見える細い背中の作業員が立っていた。オレンジの繫ぎ姿がちらとこちらを振り返り、池袋のバーにいた
143,を終えたら、隣の人にポンと手渡しでモノを渡していくのが特徴。「作業員がほとんど肩を寄せ合うにしています」（キヤノン幹部社員）。ベルトコンベヤーにモノが乗っ
144,分担することによって生じる概念で，製造過程を構成する一つの単位をいう。つまり，工程は作業員１人，または機械１台が分担する範囲の作業を指す。工程をその内容によって分類すると
145,決まってるじゃん。つまり、水橋トオルが、持ちこんできてもらった作業服一式を着て、作業員にばけてたんだよっ。でもみんな、作業服にだまされて、本物だと
146,けど。ともかく水橋トオルはそこに連絡して、たのんだんだよっ。コンテナ車二台と、作業員をおおぜいよこしてくれるようにって。あ、そうそう。もひとつ、わすれちゃいけないもの
147,船員におしつけた。船員が両手にそれを抱えてまごついているあいだに、彼女は作業員を押しのけ、ハイヒールをはいた足で舷梯を駆けのぼった。上甲板の踊り場では
148,一歩近づいたと勇気凜々である。事務所の玄関で、モッコとシャベルを持った若い作業員が待っていた。挨拶を交わして後ろからついて行く。もう一度坂を上っ
149,単位作業の大きさでの分析は可能である。２）メモモーション分析が適している作業グループ作業の作業員と機械との関係の分析，各作業者の相互関係の分析のほか，機械や作業員の
150,、生産現場で隣の作業員がどんな作業をしているのかがわかりやすい。それで一人の作業員の行う作業の範囲が広がり、一作業員の生産性が向上する。ただねじを締めるだけだっ
151,で働くことを敬遠する。単調さにうんざりするような、単純で画一的な操作に明け暮れする作業員の数は、どんどん増加している。こうした産業革命の不愉快な結果のひとつには
152,見つけましたんや。Ｎカントリーの支配人でんねん。支配人自らが先頭に立って、作業員と一緒に働いてますんや。ジャンパー姿で、ゴム長はいて、復旧作業に励ん
153,九、自然のしうちそして、いよいよ「えりも岬緑化事業」が本格化し、緑化の作業員が募集された。男四十女四十人で、各家庭から一人という原則だった。当然飯田さん
154,酒造会社の酒蔵には杜氏と言う人が現場を指揮していますが他の作業員みたいな人の事を何て言うんですか？「蔵人」とか云いません
155,Ｔ市の宅地造成地で大規模な地盤沈下が起こった。資材を運び込む前の段階だったから作業員が数人、軽傷を負った程度ですんだがな」聖は曖昧にうなずい
156,たとえば、ディーゼル・バスの運転手、ディーゼル・バスのガレージで働く人、ディーゼル機関車を使っている鉄道の作業員、ディーゼル・エンジンを装着した機械を使う構内作業者などが、調査対象として考えられる。ガレージ作業員の
157,出発の準備をするよう伝えろ」二分後、甲板では一等兵曹が笛を吹いて作業員を振り分けていた。装備を終えた救難艇に熱意あふれる水兵たちが配備され、剣帯を
158,のラックだった。目ぼしいものといえば、最後に開けたラックの下に、作業員が点検時に置き忘れたものか、十字スパナと眼鏡レンチが何本か束になって転がっている
159,に対して意識調査アンケートを行ったり、広報紙を配布したりする。・排出現場での口頭指導集積場等に作業員を配置し、分別・排出前処理等についての取り決めを守っていない排出者に対して、その場で分別・ラベル剥がし等を行っ
160,に作業員があの独特の格好をしたんで、ネタになりそうだったんで、作業員に気付かれぬように撮影しました。ウチも列車が近付いた時にどうしてこの
161,叫びながら立ち上がり、一足飛びにはしごを上った。私たちが貨車の屋根に現われると、作業員はじっと見て、それから安心して言った。「あと一分遅かったら、お前らは死体
162,は、編集部門の大部分が移転するため人海作戦でやるしかありません。ＮＨＫさんと同じ作業員百人、トラック二十台体制で臨みます。紙面製作の都合に合わせるため、一部は午前二
163,作業員には他雇と自雇があり、他雇は前借して雇われ、自雇は普通の作業員と同じく、給料日には稼働に応じて賃金をもらっていたそうです。他雇
164,これは１枚目とは逆に厳しい躯体工事の工程を組んでおく作業員用のマスター工程表である．作業員は，えてして自分たちの都合に合わせるので，この工事は工期的に非常に厳しくて，
165,右手、ディマプール寄りの道路に埋めるんだ。よしとなったら、連絡をよこせ。大小行李の作業員を十名ほど向けてやる」無人の壕には、撤退後に敵の侵入した
166,て、みずきはとどめの推理を語った。「コンテナ車がやってきて、作業員がぞろぞろおりてくる。そしたら、だれだって引っ越しだって思うよねっ
167,第十八仕上工事１仕上工事の計画に当たっては，飛来・落下，火災，有機溶剤中毒等，関連工事の作業員への影響も考慮した事故・災害の防止策を検討すること。２仕上工事の施工に当たっては
168,の杭を打つ作業をしているとき，知らないうちに一面にメタンガスが立ちこめ，作業員がタバコに火を付けた途端に燃えはじめ，これが広範囲に燃え広がって，その
169,先日行ったとき、うれしい光景を見かけましたで。クラブハウスの大屋根に何人かの作業員が登って、瓦の修理をしてまんねん。倒れたり傾いたりした
170,二目に見えぬ恐怖のもとで―被曝と避難作業員の被曝事故によってもっとも直接的に影響を受けたのは、もちろんＪＣＯの労働者たちでし
171,透明のボックスにいる、黒いアノラックを着込んだ老人と、赤い小さな旗を持った作業員だけだ。反対側のホームの端に、老いた女達が十人ほど固まっていた
172,。鉄板を扱う者、天井を張る職人、大工などが、いっせいに動き出した。作業員の数も建築材の量も、それを運び込むトラックの数も三倍になった。
173,対象の作業内容に精通していれば，誰でも容易に観測できる。３対象者（作業員）が調査を意識した行動をとることが少ないため，実態を正確に反映した
174,れないように、わざわざ人気が途絶えてから書庫に降りてきている。「作業員がゴンドラから目を離したのは、昼時だけじゃないんだよ。十五時の休憩時間と
175,ｍａｎ‐ｈｏｕｒ）など）を要する。そこで仕事量の単位を１台の機械ないし１人の作業員で実施する延べ時間で表わし，これを工数という。いくつかの製品の生産に当たって
176,収集車や施設の被害状況により修理のための多額の費用がかかるだけでなく、場合によっては作業員の人命にかかわることもあります。火災の原因となる可能性が高い廃棄物のうち、
177,で一旦、仮植えし、さらに百ｍ、山の斜面を背負って山腹に植えた。作業員は六十人ほどで、女性が半分以上を占めた。集落から現場まで片道２時間かかる。
178,増減―新設備拡張ないし現有設備遊休（時に廃棄）により，生産変動に応じる。○労働調整…作業員の雇用・解雇（ｈｉｒｅａｎｄｆｉｒｅ），レイオフ（ｌａｙｏｆｆ／一時解雇），人海作戦（単純労働力増強
179,ここ、僕の家です」「はぁ？」すっとんきょうな大声で聞き返した作業員は、あからさまに笑った。「大人をからかうんじゃねよ。ここがお前
180,左手に小型のスーツケースをぶらさげている。男は山崎平吉をおしのけ、とめに入った作業員の手をはらいのけると、一目散に舷梯を駆けのぼってくる。いっきに踊り場まで走りあがった青年
181,ます。この会社って、おかしくないですか？給料じたいも私たち技術者（監督）は少なく、作業員のほうがおおいし・・・・管理監督者の立場の人は、時間の管理を
182,たセレモニーは、ほかにはありません。この勤勉な日本の仲間、漁民や作業員の示した敬虔な行為、慈愛、雅量、そして物惜しみしない姿を米国人は深く心
183,倉庫をつくる建築用木材、その伐り出し及び製材作業員の募集の苦労を説いた。いま、その作業員を送り届けるところであることを話しながら、七時四十五分、郡長ヴェナス氏の家に着いた。
