,0
117,にとって、二か月ぶりのほんとうの笑いだった。けっきょく、舞は幸生におんぶされて保健室に行くことになった。「やれやれ、これで一件落着だね」幸せそうに
118,と、銀行に遅刻するっておもって、あせっちゃって。銀行にきてから、やっぱり保健室で手当てしてもらって、みんなとしゃべればよかったとおもったんだけど」「手の
119,誰にも気づかれるわけもないと、清隆は苛む心に言い訳し、怜奈が待つ保健室に足を向けた。
120,ます。私は授業中に「お腹痛いので保健室行ってもいいですか？」って言って保健室に行きました。んで、便秘とかかもって話して、「一回トイレ行く！
121,のこと。でも、別室がなくなれば俺はもう二度と学校へ行かないだろう。保健室はもっと嫌だ。絶対に同級生と会うんやもん。それなら別室がいい。
122,言って相談してみましょう。そんなときのために先生はいるのですから。相談しづらい担任なら保健室の先生に相談しましょう。
123,祖母といっしょに保健室へやって来た。いったん教室へ行くが、しんどいと再び保健室に帰って来た。しかし、少し休養した後、箱庭を作り始めた。翌日
124,。（４）学校と話し合い、子どもを登校させるために全面的な協力を依頼する。そして保健室などが逃避の場所とならないようにする。（５）関係者は子どもが約束どおり
125,すら頭に残っていない。朝日を浴びてバッタバッタと生徒が倒れても、保健室が一杯になっても、先生はいっこうに話をやめる気配はなかった。今
126,。ａ．「退け！！」野次馬を一喝。駆け寄ってきてそのまま抱き上げられ保健室へ向かう。「世話がやけるな」でも心配そうなハレルヤｂ．「目が
127,清隆にほくそ笑むと、怜奈はプリントの端に短いメッセージを書き残した。放課後、保健室に来なさいと…。「分かったわね？」ファスナーを引きあげ、メッセージの
128,生徒を支援するようになってきた。実習校のとっている体制を理解し，相談室や保健室を訪問して，カウンセラーや養護教諭の先生から話を伺う機会を積極的につくってみよう。
129,たら、実はその子のお母さんの姉だという話。しょう子ちゃんのお母さんは、高校の保健室で養護の先生をしていたらしいのだが・・・・高校３年生の男子と
130,の前後に心身が不安定になり、頭痛や腹痛など身体の不調を訴えて、保健室に来ることが多い。またちょっとしたことがきっかけで問題行動をおこしたり、学校に
131,声を変えようとしたらしい。ドイルさんは看護婦だからねえ。しかも一時は学校の保健室にいたこともある。仮病をつかって学校を抜け出そうとする子供たちは大勢診ている。
132,うちに…。と、ブルマに手をかけたとき、「ふぶきっ！保健室の先生、帰ってきてたよぉって、アンタ、なにやってんのよっ！
133,先生から電話がかかってきて、「先日お漏らしをしてしまったときに貸した保健室のパンツを返してほしい。」とのことでした。さらによくよく聞くと、「今月
134,。体育の時間も、みんな思いっきり青空の下を走り回ったのに、誰も保健室へ行く者はいませんでした。また教室も笑い声が聞こえる明るい雰囲気で、
135,来た。しかし、少し休養した後、箱庭を作り始めた。翌日、母親が保健室に来て「昨日はかわいそうなことをしました」と言う。育子は母親
136,でいる人が多いでしょ。そういう人たちに、“安心”を与えてやるのが保健室です。だから養護教諭は一人だけですが、その役割は全校におよぶんです。学校づくりの
137,社会教室、葉っぱのひろば、しみんホール、調理室、家庭科室、木工金工室、機械工作室、美術室、メディアセンター、保健室、相談室２階国語のひろば、国語教室、数学のひろば、数学教室、英語のひろば、
138,「待てる」感性の幅を、いま教師が持つことが大切なのではないだろうか。保健室では一人一人を大切にし、彼らが無事に思春期の激動期を乗り越えるのを見守っ
139,だったため、保健医の梅田北斗（上川隆也）が代わりに対応する。そして瑞稀と梅田が保健室に行くと、そこには原秋葉（紺野まひる）がいた。原は、１冊の
