,0
112,の戦いである。榎本武揚とプロイセン公使ブラントが出会った夜、その場には傷ついた会津の兵士がおり、榎本の部下が兵士の治療を引き受け、江戸に運んだことは前
113,職務を遂行するのに足る人数がそろっておらず、チームに割り当てられる平均的なＳＦの兵士は、一年のうち六ヵ月以上も「ダウンレンジ」で過ごす。その結果が燃え尽き症候群となる
114,に突き刺し、血を大地に吸わせて、皆殺しにいたしました。我が軍の兵士は、敵の死体を獣に投げ与え、その餌食にしてやりましたが、
115,ともつかぬ声になった。ローランドは耳をそばだてた。とても猛勇の兵士の声とは思えない。まるで卑屈な嘆願者の声。キングの内面になにが
116,れている信仰であり認識でもある。太平洋戦争が終結して半世紀以上たっても、政府派遣による兵士の遺骨収集がおこなわれるのは、かつての兵士たちに「死者」となるべき充分な
117,。他の記念日八甲田山の日千九百二（明治三十五）年、八甲田山へ雪中行軍に出かけた兵士二百十名が遭難しました。冬の八甲田山は本来は冬の重装備が必要でしたが
118,さらに守正倉、守客館、守朱雀樹、清掃丁、市司執鑰などの役人が配属されていた。兵士が四十人も置かれている点に平安京の京職の警察機能の強化がよく現れているが
119,であり、彼女が都とした邪馬台国は当然、北部九州にあった。大勢の兵士が気勢をあげていた矛の祭祀が、東遷後に消えたのは、王権の
120,。履の下に、台があり、その台の上に、そのふたりの兵士は立つかたちになっている。「やはり、俑のようですね」空海が
121,。私たちの自動車に乗った案内の人たちはＭ十六ライフルで武装をしたが、兵士ではないし、待ち伏せをされたら、いっぺんにやられてしまいそうで、私はとても
122,に、日本の兵士の存在が象徴的に示されていると思った。こうした兵士を戦前の国家主義教育が育てた。忠君愛国を目指した「教育勅語」こそ、その最たる
123,立ちやがれ！」楊志は鞭でひっぱたき、襟首をつかんでひき起こすが、つぎの兵士にとりかかると、さきほど立ったのが、またごろりと横になる。兵士たちはスト
124,と声を上げた。鼻につく異臭。大量の血の匂いだ。そこに兵士の見たものは、生涯忘れることのできない惨劇だった。女、子供が
125,に手榴弾を下げ、Ｍ１ライフルを手に取った。茫然として見守っていた他の兵士が見ならった。彼らは一言も発せず身支度をし、完全武装を施した。
126,、生涯忘れることのできない惨劇だった。女、子供が血の海に漂っている。兵士は背筋を凍らせ、あとずさった。逃げ出そうとしたそのとき、一人の娘が
127,、その死は「不幸な死に方」とみなされるような死のありようである。兵士の死の場合はこれらのすべてが重なることが多く、まさに「非業の死」
128,ように拝む。そして、八月十五日には、これまでの戦争で死んだすべての兵士の魂を祀るのがなぜ責められるのか。日本人の感覚のなかでは、
129,皇帝は俸給を上げたが、まもなくそれも不十分になる。ついにがっかりした兵士は、出来るならばラインもドナウも勝手に守らせるがままにして、自ら
130,兵士に向かって手を振り、「連れて行け！」と合図を送った。兵士が二人、虎王の両脇に立って連れて行こうとした時、虎王が言っ
131,では、指揮官である武将の能力がものを言うし、個性的で能力のすぐれた兵士―英雄・豪傑が活躍する余地がある。
132,全羅南道済州島に渡航し、現地軍の兵十名とトラック二台によって、各所より二百五人を奴隷狩りして、兵士の強姦を許して、徴発してきた。本書の「付録１」の『私
133,が戦後日本の「外向きの自己」だとすれば、「三百万の自国の死者」とりわけ兵士の死者に向かう保守派は「内向きの自己」である。戦後日本の「根源」に
134,になんとか落ちた物資についてのおぞましい話をヨステンは耳にしていた。飢えた兵士が荷物を開けると、コンドームやクリスマス・ツリーのようなものがはいっていたという。
135,で官民に押し売りしたといわれる。彼は漢族によって構成されている新軍をおそれ、兵士が武備学堂の生徒と喧嘩したという理由で新軍を解散し、新軍司令の楊纉緒を強制的に
136,マルグリットが両手をこすりあわせた。「ああ、早くお会いしたいわ」ちょうどそのとき、兵士が広間のドアを開けた。すると、頬を上気させたクリスティーナが駆けこんでき
137,ない！みつばちがいない！おーい、たいへんだ。みつばちがにげたぞー…。兵士は、いすにしばりつけられたまま、あたりを走り回って大さわぎする。ぶたい暗くなる。スクリーン
138,茨城県出身者は十万人余にのぼり、戦没者五万三千二百人余であり、この中には一般人も含まれていて兵士のみではない。ただし、国外での死の場合、そのほとんどは兵士であると考えられる
139,三代格』同年八月二十三日付官符）。一方、出羽については必ずしも明らかとはいいがたいが、兵士一千人・健児百人を定数としたようである。延暦期の大動員体制に比較すると、陸奥・出羽両国が
140,を征服し，元という大きな国をつくりました。↑元との戦い元の兵士と戦う日本の武士。↑守りに向かう武士たち↑海上の戦い元の大船に
141,も経済が一向に好転していないということは知っていたが、根っからの兵士として軍隊組織から外へ出たことのない彼は、経済一般についてほとんど関心を抱いた
142,。通称「めがね岩」。■潮井石：秀吉朝鮮出兵の時、航海安全と戦勝を祈って、兵士１人に１つずつ海岸から運ばせた積石。■遠見番所跡：江戸時代に置かれた異国船
143,道を突き進む人々の姿を…。この戦いは大方の南朝鮮（韓国）の兵士にとっては初めての戦闘経験だった。そして、これは遺恨の戦いだった。千九百五十年六月
144,重く、およそ七十キロ近くもありました。そんな自分自身よりも重いものを背負って、兵士はひたすらジャングルの中を歩くのです。日がのぼりきってしまうと気温が高くなり、
145,の兵士の姿があった。死んではいない。微かに呼吸をしながら兵士は眠っていた。虎王は兵士の腰から剣を引き抜くと、石段を上って
146,あるダラールの親類宅へ向かった。ドアをノックするとダラールが出てきた。「兵士は外にいたか」と緊張した表情で私に聞く。「いなかった
147,や、商業機、一般民間機のパイロットの悩みの種となっていた。百六十五名の定員いっぱいに兵士を詰め込んだボーイング七百七機は、横田、立川の両基地が補給その他の軍事輸送業務で一杯
148,小浪たちを追い越して行った。一瞬、異様な雰囲気が漂った。黒づくめの軍服の兵士の異様な緊迫した臨場感は街に張り巡らされていた。その光景は小浪達がカイロ考古学博物館
149,を気絶しそうになるまで歩くことでした。パトロールなどの任務を遂行するために、兵士は目的地まで道もないジャングルを徒歩で向かわねばならないのです。兵士が戦場で背負い
150,た。荒巻が兵士ふたりに命じた。「銃、かまえ」ふたりの兵士が並び、表情も変えずに銃をかまえた。撃鉄を引き起こす音が聞こえた
151,サイトｈｔｔｐ：／／ｗｗｗ．ｚｅｎｋｏ−ｐｅａｃｅ．ｃｏｍ／０８ｚｅｓｐ１．ｈｔｍｌｈｔｔｐ：／／ｉｖａｗ．ｏｒｇ／ｈｔｔｐ：／／ｉｖａｗ．ｏｒｇ／ｃｈａｐｔｅｒ／ｃｈｉｃａｇｏ（ＩＶＡＷシカゴ支部）ｈｔｔｐ：／／ｖｉｄｅｏ．ａｏｌ．ｃｏｍ／ｖｉｄｅｏ−ｄｅｔａｉｌ／ａｆｓｃ−ｓｐｅａｋ−ｆｏｒ−ｐｅａｃｅ−ｔｏｕｒ−ｐａｔｒｉｃｉａ−ｍｃｃａｎｎ−ｐａｒｔ−１−ｏｆ−２／１３０２９６１３１４（パトリシア・マッカーンさんＹｏｕＴｕｂｅ）帰還できなかった兵士もいる。
152,時であった。私ははじめて、それを見た。米兵であった。まだ若い兵士が、片手にペットボトル、片手にＭ十六を下げて、ゲートの横に立っている
153,ある。魁殿とは総帥幕舎のことで、半兵衛がそこにいるというだけで兵士は安心していられたというから、いわば三国志における蜀の軍師・諸葛孔明のような存在だっ
154,何かばかげた命令を博士に出します。博士はすぐに従おうとしない。兵士は刀を抜き、残りの兵士たちもそれに加わります。そしてジャムをばらばらにし
155,で彼は、まさに先生今おっしゃいましたけれども、平和維持軍は非暴力、非強制の敵なき兵士だからこそ偉大な力を発揮する、戦う平和維持軍は決して役に立たないということを
156,のような詳細な指示が記されている。沿線のすべての駅には出征する兵士を見送るあるいは帰還兵を出迎えるべき市町村の名が記され、それぞれの駅で各市町村から
157,アメリカ軍と南ベトナム政府軍に同行取材した。アメリカ軍の通常の作戦は朝、一個中隊約百五十名単位の兵士がヘリコプターに分乗し、攻撃目標までくると地上に飛びおりて村を攻撃する。ひとつの
158,が命中した建物を調べたりしているテレビの映像を見たとき、彼はあの兵士や民間人が劣化ウランに被曝しているのではないかと推測した。したがって、現在軍隊に誘惑さ
159,呆然とたたずんでいました。銃弾を打ち込まれた兵士や、剣を突き刺された兵士が苦しみにのたうち回りながら、誰ひとりとして助けてくれる者のいない戦場に放置されている
160,積重ネ又ハ人家ニ敷アル畳ヲ積ミ、所々砲門ヲ穿チ旧式ノ大砲ヲ備エ兵士之ヲ守衛ス」といわれる幼稚なものだった。備前より遠路はるばる房総
161,勉強も出来ない有様。また、アルトパルミタールでは同地小学校校庭で二十人あまりの児童が運動中、兵士が来たというので児童を解散させたところ、突然ピストルを発砲した。幸い六十メートル余離れ
162,れていないが、母・大王がいる飛鳥の板蓋宮の周辺には、松明を持った兵士が護衛していた。何時もは松明などつけないから母もこの非常事態を知っている
163,いたってもあたかもそれが戻るかのような手続きを国はとり続けた。つまり、兵士が出兵前に家族に残しておいた、生きている身体からの髪や爪を預かり、
164,弾頭と噴出質量を同じにして無反動性を得ていた。噴流は危険で付近の兵士は充分注意する必要があり、使用に際しては後方に広く空いた場所を取らねば
165,だった。ともかくオギャーと生まれたときから、敗戦を迎えるその日まで男は兵士、女は強い兵士を生み育てる銃後の守り手。だから女は国のために命を
166,の空も春寒しさえかへるらむ北支那の山厳寒の中、苦難に堪えている兵士のことを思い詠まれた歌です。故郷に残された者たちに思いを馳せ
167,開幕早々の、例の嵐の場からオテロの登場、ついで、戦いの勝利を祝う兵士や島の人たちの、らんちき騒ぎの場は、大変な数にのぼる人間を登場させ
168,ます」。曹操はこの意見に同意し、兵を分けて屯田（戦いのあいまに兵士を農耕に従事させること）させながら、出陣を待たせた。さて、
169,、答えも待たず、左右の部下に目配せする。青ざめたベーラに、緑衣の兵士の手がかけられ、やはり縄を打たれていく。「賞金の金貨はな
170,兵士１〜十がドドーッと走ってきて、マーヤを取り囲む。七十三七十三くまんばちの兵士は、やりを持って、かんたんな「かぶと」のようなものをかぶるなど、
171,の役に飽きていた部下たちは一も二もなく賛成した。早速百五十名の兵士を選抜し、その日の夕暮れを待って金峯山へ迂回した。木の根、岩角
172,ドンと、ゆかを鳴らして）わかったか！マーヤ…。（シクシク泣く）兵士５わかったんだな！…あ、泣いちゃった。兵士６こまった
173,は防衛軍を動員して戦わなきゃいけない。兵士になるのは白血球やリンパ球ね。兵士が戦うには余分なエネルギーがいるんで、からだは糖類や脂肪を燃やして
174,と馬の鞍覆いが昨夜のまま残されていた。壁には二、三の聖人像と兵士の写真がかかっていた。窓を開けて空気の入れ換えさえしていない。あきらか
175,新イラク軍創設正式発表連合軍暫定当局【バグダッド二十三日共同】イラクの連合軍暫定当局（ＣＰＡ）は二十三日、新イラク軍の兵士を来週から募集し、二年後に四万人規模にする計画を正式発表した。またフセイン旧政権下の元兵士
176,をひきいた戦いだろう。連邦宇宙軍では、士官学校の卒業生が正式入隊する時、一般公募の兵士より詳細に本人の適性検査を行ない、進路を振り分ける。第一等勲章を与えられるほど
177,）ダンケルク、ノール県、フランス一般的に良い兵器と言われている代物が、最前線の兵士にとり、必ずしも好評なものであるとは限らない。数値データだけを比較して結論
178,なんの変哲もない小山に変っていた。それでも土を掘ると、いまでも兵士の靴や銃の端などが出てくることもある。白須は二百三高地の麓で馬車
179,「効果音」のＣＤが各社から売り出されているので、それを使うといいでしょう。兵士１（目をさまして）おや？な、なんだこれは…。あっ
180,（声だけ）うるさい！おい、あのみつばちに、おしおきをしてやれ。兵士１（声だけ）はっ、しょうちいたしました。くまんばちの兵士１〜十
181,一度もないのだ。これだけ世の中が平和なのに、国の人口と共に兵士の数はどんどん増えていく。すると―「こらあ、ザカ！いいかげん仕事に戻れ
182,になると、有力な貴族には奴婢が三千人もおり、それに見あうだけの兵士や牛・馬・豚がいた。彼らは穀物を農民に貸してその利息をとっており、
183,が不愉快なものかもしれないと思わせることを避けたいのだ。ゲームの使用説明書によると、「兵士が殺されると、その兵士はただその場に倒れ、もはや進行中の任務とは
184,桟に兵士は背をぶち当てた。頭をもたげた娘は澄んだ目で、兵士を確かに見つめたが、その瞳孔は何も映していない。「敵ですか
185,に至ったという。（六十八）この陸軍省内での草案作成過程において、家族の自活不能な兵士の徴集延期または現役免除を規定した徴兵令第二十二条などの存廃をめぐる論争が人事局恩賞課と軍務局歩兵課
186,毛布に火がついたので投げ捨てて、中庭に走った。中庭にはユゼクさんと兵士しかいなかった。二人とも血だらけだった。二人をひきはなそうと、満身の力を込め
187,ものの満ちた城となったからには、これ以上闘い続けることは無意味だった。虎王は兵士の剣を躱して窓辺へ走った。窓の下は城壁の屋根になっている
188,の日本兵は“鬼畜”であったという話を聞くが、どうもほんとうに食った兵士もいたようである。彼らはむかし首狩族で頭ガイコツをたくさん家の中にかざってい
189,国民政府に開戦を迫れ」「対日ボイコットを全土に拡大しろ」「国民政府軍の下級幹部、下士官、兵士、そして大衆を獲得して、国民党を凌駕しろ」つまり長期的な日中全面対決に持って行き
190,家康」を討てという命令を受けていたというのだ。現場では、下級の兵士であればあるほど上官の命令に従うだけで、いま自分が何をしているか
191,は青かったが、赤ら顔をして赤鬼そっくりに映った。すぐ後についてくる若い兵士はアジア系らしく皮膚が赤銅色だった。ふたりとも自動小銃を肩に吊し、こっちを警戒しながら近づい
192,が開いていて、その前を犬を連れたおじさんが悠然と歩いていた。兵士と若い娘が抱き合っていた。明日もステーキを食いたいというと、会計係の
193,。男のなかには、想像力がゼロだから、恐れることを知らないから、兵士になる者もいる。だが、チャールズ・ハリスの場合は、戦場で神業に近い能力を
194,れたらやめ―ほんとうにただの機械人形ね…」「ときには、機械人形の兵士のほうがずっと勇敢で、忠実なのじゃないかという絶望感にとらわれることもあるのだけれどね。
195,なかった。フレームがドアノブにぶつかって、ガラスが割れ、軍服を着た若い兵士の写真に穴があいた。キャサリンはフレームの残骸をつかみ、父の面影
196,死の不安について配慮していた。しかし彼らは、後方のキャンプに戻ってきた兵士のように、会社人間としての生き方について語り合っている。それは妻とも話せないこと
197,冷たい叱責だけであった。首里城の城壁近くで戦死した守備軍兵士の無残な姿。守備軍の兵士がひそんでいるとみられた部落は片っ端から焼き払われた。上空を飛ぶのは
198,てやれ。兵士１（声だけ）はっ、しょうちいたしました。くまんばちの兵士１〜十がドドーッと走ってきて、マーヤを取り囲む。七十三七十三くまんばちの兵士
199,だとされていました。身体頑健、いかにも強そうという肉体を持った存在が兵士の理想だったのです。ところが、十八世紀後半になると、兵士の身体は「作ら
200,た。列車は戦勝気分に満たされ、せっかくありつけた一等車の自分の席に納まっている兵士など一人もいなかった。もちろんケネスもその騒ぎの中にいた。
201,は、その愛唱性の低さを示唆すると思う。似たような状況ではドイツの兵士はドイツ国歌を歌った。）メロディーもいいし、歌詞だって、えっと、大伴家持
202,罪なきものをうち殺した、その残虐性に慄然たらざるをえない。しかし、兵士を駆って殺人鬼たらしめた動機はそもそもなんなのか。兵士は国家のため
203,おり、全員がベルトに短剣を差していた。一種の制服は着用していた―兵士は濃紺の上着、将校と将校付伝令兵は赤いうわっぱりであり、後者はアルジェンティンの屠畜場
204,朗読していった。「絶望というものが退路を援護するために我身を寸断される兵士の絶望のように確かなもので、それほどその対象に結びつき抑制されているなら
205,ました。それがベトナムでの三日目でした。戦場で身につけるもの兵士としての生活が始まったのは、翌四日目からのことでした。この日から、
206,、もっとあとになってからだが、千九百二十八年に〔ドス・パソスの〕小説『三人の兵士』の新版で彼だけで決定的な歩みをふみだした（図版十九）。千九百二十二年の
207,言うだろう」と冷たく言います。これは本当にそうなのです。イエスがイスラエルの兵士に囲まれて引き立てられるときや、みんなの前で非難されて、おまえもこの
208,がまだできていない時、紅軍兵士の主要な源泉は、白軍（軍閥軍および国民党軍）兵士とこの流氓層であった。彼らは一般の農民に比べ農村を離れる機会が多く、
209,ここに来てウェリントンは守備にかなり優位な場所に陣取っており、砲火を避けるために兵士を反対側の斜面に伏せさせることができ、ブリュッヒャーと連絡をとって、翌日の
210,不毛の沙漠がつづき、そこはできるだけ速く駆け抜ける以外に方法はない。将軍も兵士も、できるだけ速くつぎの町にたどりつきたいのである。ジンギス汗の遠征も、席巻
211,て、一般市民が朝鮮人は帝国の敵であると「確信」したことは想像に余りある。兵士が戦果をあげるたびに拍手万歳で共感を示したものも多数いよう。流言は、
212,同じように、タイ側の難民キャンプで暮らすことができる。それなのに、なぜビルマ側にとどまり兵士になったのか。そのわけを彼に聞いてみた。「平和な村
213,にした男爵は、部下に向かって、あごをしゃくってみせる。うなずいた兵士が、家の外に出たかと思うと、撫子の刺青の少女を引きずっ
214,第二次世界大戦が終わった年に再会しました。フランスにいた私の前に一人の兵士が現れたのです。その人は私のことをじっと見つめるのだけれど、私はなぜ
215,に聞こえなくなった。原子炉建屋地下の銃撃戦はまだ続いていた。赤軍とソ連解放戦線の兵士の死体が散乱している。自衛隊特別攻撃隊の犠牲者は三人だった。二人は銃撃で死亡し、
216,では、かつてハワイを奇襲したさいの猛将南雲中将指揮のもとに、陸海軍合わせて二万五千人あまりの兵士が、凄絶な死闘をくりひろげていたのである。趣向をこらして競った「愛宕」艦上の分隊対抗
217,よもやまさか、あの三流ゴシップ・ホモポルノ雑誌をお読みになっていらっしゃるんですかっ！」驚愕する総務科の兵士の問いに、スクリーン・グラスの士官は平然とうなずく。「部下から俺の副官が多量
218,だけど）、そのメーカーから発売もされていないようです。（色使いも、兵士の数も手の上げ方も同じ）発売予定のメーカーのホームページの写真を使ったよう
219,。「除隊したらなにをするつもりだ？〈マクドナルド〉で働くのか？」その兵士は答えた。「除隊してもし〈マクドナルド〉でハンバーガーをひっくりかえすことになったとしても、少なくとも
220,海外公演のかくれたスポンサーでもあった。悲惨な戦争の中で生まれた、兵士と舞踊家の奇しきロマンスの人生の一ページがきられたのだった。戦場ではじまった
221,軍務に服していたが―少佐になっていた―ロシア語の知識を調べられた兵士など一人も思いあたらなかった。（２）私は、自分の飼犬とチェスを
222,が聞こえた。「ギムの国から逃げ出してきた野郎だ！」馬車の兵士が答えた。「そんな奴ぁ、縛り首にしちまえ！」「そうだ
223,口止めして、それを仕舞い込んだ。しかし、迂闊に口止め料を支払い忘れる。それで怒った兵士の一人が、褒賞金欲しさで、袁紹に密告した。洛陽に留まる意味がないと
224,〉をあとにして早々に、ファファードはかすかな金属音を聞きつけた。武装した兵士が用心深く移動する音だ。フリスカの魅力をあれこれ考えていたところなので、ふいに
225,ないことはわかっていたが、行けと命令されたからには行くしかなかった。兵士の一人が泥水に嫌気がさしたのか、立てかけてあった梯子で塹壕から這い上がり
