,0
0,が起こる。今度はドイツの側でも、プロイセンの封建領主や専制君主に雇われた兵士が王の利害によって戦争するのではなく、「ドイツ人ならみな、立ち上がらなければならない」と、フィヒテの
1,或いは時として交渉テーブルに着くことさえも叶わない。また難民・避難民の選挙登録や投票，そして兵士，警察官のみならず，裁判官，行政官の教育・訓練等にあたっても，ＯＳＣＥミッションは国際社会の軍，
2,軍紀を簡潔にまとめたもの。軍歌としてうたわれる）という軍歌を高らかに歌い、兵士のように、各事務室の壁にかかっている最高司令の肖像の前で直立不動の体勢を
3,ポプランの背後にまわろうとしたが、躍りかかったカスパー・リンツが、トマホークの一閃でその兵士を血煙の下に撃ちたおした。「薔薇の騎士！」戦慄が帝国軍兵士の
4,エピソードが面白くて、つい買ってしまったんだ。昔、戦争があって、男たちが兵士として戦場に連れてゆかれると、残された女たちは恋人や夫のいない
5,は自ら大将を名乗り，宗派組織を軍隊組織に模してつくったのです。普通の信者を兵士と言い，奉仕活動の世話をする者を下士官と言い，一生を救世軍に捧げる者
6,」（一橋大学『経済研究』二十八‐２，千九百七十七年）スハルト体制へ９．３０事件―「革命評議会」側の兵士に射殺された「将軍評議会」の６将軍の遺体を乗せ墓地に向かう装甲車（千九百六十五・十・７）
7,こうした剿共（討共）軍の心理を読んだ共産軍側は工作員を送り込み、兵士は少しずつ赤くなっていく。千九百三十五年から蔣の命令で出動するが、三つの戦役に
8,なかなか見どころがある。いい勘をしているし、熱心に仕事をする。優秀な兵士に育つだろう。「ソノブイ五番と六番に感あり」。爆音に負けまいとするキンキン声
9,は対空部隊所属の海兵隊の兵士である。猫にパジャマがいらないのと同じく、対空部隊の兵士にロシア語などいらない。その夜、資料を読むのはそこで止めた。
10,にあらず〕アントネリ！ゴールドバーグ！マルチネス！ワシントン！」と互いを呼び合う兵士の叫び声は、ヒトラーの軍隊と決定的に異なるアメリカ軍の熱い人類的連帯の証だった。
11,、後醍醐天皇は悲願成就の感謝をこめ、石清水八幡宮に行幸した。足利尊氏は楠木正成とともに兵士を引き連れ、その護衛の任にあたった。「尊氏どの、何を考えておられ
12,母の目を錐で突こうとした。母の背後に立っていた造反派の兵士がそれに気づき、母を床に押し倒した。あの兵士のおかげがなかったら、
13,出唸る未完ビル灰の広場を横切つて来るアロハの幼児髯や猫背や円柱にかくれ兵士の顔塗りたてペンキの白い林立だるい僕ら裁判やかのオートバイ光り休む橋体の彼方ゴルフの細い男女
14,増していった。フォードは、きのう一日、二十四時間で、二万人以上の敵と味方の兵士の生命が戦場で奪われた、という戦況解説の記事を読み終ると、「ばかばかしい
15,リアルタイムで」「こちらからの介入は？」「映像を送っている前線の兵士に、音声メッセージを伝えることは可能です。ですが、二、三分で防衛庁は気付いて手を
16,最後に香油を塗るのが習慣だった。だが皇帝ネロの時代には戦地へ赴く兵士まで愛用するようになり香料の消費量が莫大になったため遂に法令をもって消費を制限し
17,がん細胞を殺傷するにはあまりにも不十分です。多勢に無勢というわけで、有能な兵士が集まっても数に開きがありすぎで、とうてい太刀打ちできない状況になるのです。
18,。冬の八甲田山は本来は冬の重装備が必要でしたが、指導部の無謀さから兵士は軽装のまま行軍を開始したため、猛吹雪の中で道を失い寒さと飢え
19,国のことを強調するときには、ホームランド＝ｈｏｍｅｌａｎｄといいます。戦争に出かけた兵士が帰ってきたりするときに、Ｗｅｌｃｏｍｅｂａｃｋｔｏｔｈｅｈｏｍｅｌａｎｄ！と
20,。「廃棄処分」さて、それから間もなく、シモンズ憲兵長は執務室から出て、兵士の娯楽施設がある区画に向かって行った。何のつもりか、通常の佐官級憲兵の
21,、剣を奪うのだ」ファーレンの言葉に操られたように、ルーヴァンス少将と若い兵士は公爵への礼も忘れてテントを飛び出して行った。部下の姿を呆然
22,」についてはこれを打ち捨てて顧みない。革新派は、侵略戦争の尖兵だった日本の兵士の死者を「汚れた死者」として嫌っているからだ。他方、保守派はといえ
23,は軍旗。二十一走舸軽快な小舟。早船。二十二軽鋭軍装の身軽な強い兵士。精鋭。二十三雷鼓太鼓を雷鳴がとどろくように激しく打ち鳴らすこと。二十四北軍
24,ネアンデルタール人研究の不備（２）父親の崇拝する文学者への反撥（３）第二次大戦の兵士としての反戦的志向が重なつて出来あがつたものなのかもしれない。彼らが組織的狩猟ができなかつ
25,で死んでいた孫淳―上海のボスのボディガードは正真正銘のプロだった。元人民解放軍の兵士だ。孫淳は、坂本富雄に殺された。警察の捜査ではそうなっている。
26,事を、知る人は圧倒的に少ない。そして、垂仁天皇の時代においても、力士たる兵士の増強を推し進めている。今年四月、私は天神社に初参拝した。その道中、道
27,ましたが、天の助け、いねむりしていました。マーヤたいへんだ！マーヤは兵士のほうを見る。兵士はコックリコックリ、いねむりしている。マーヤ（小さい声で）
28,もどし、ハンカチで口元を押さえた。ブリストルの駅で、別の車両に帰還兵らしい兵士の一団が乗り込んだが、二人が乗った車両は閑散としていて、考えごと
29,の孔を感じた。病室のドアはここのところずっと開いたままである。兵士の姿も見えない。まるで私の知らぬ間に戦争が終わってしまったかの
30,如水は中津郊外で閲兵式を行った。これがまたいかにも如水風だった。新規採用された兵士は一人一人、かれの前に進み出て名前を名乗らされた。如水はその一人一人に
31,、アンデスの先住民言語ケチュア語の歌を、書かれた詩に領有した、メスティソの詩人で兵士のマリアノ・メルガール（またの名をオビエド）の作品は、やがてペルー国民文学の代表作とみなされる
32,ても、統一されたアメリカは、統一されずにいるが十万の訓練された兵士をもって戦争に備えているアメリカよりも、外国の野心を阻止する断固たる姿勢を示すことになる
33,のソ連兵が線路沿いにあらわれた。薄汚ない身なりをした兵士たちだった。先頭の兵士は目は青かったが、赤ら顔をして赤鬼そっくりに映った。すぐ後について
34,規模を示すマグニチュード（Ｍ）は４．５と推定される。戦後六十年戦禍の記憶第２部兵士―南方編５鎌倉修吾さん（八十二）＝空知管内栗山町暑さと空腹でフラフラ「明日
35,な輪郭が見える岩の台地に着いた。車を走らせていくと若い兵士が車に近づいてきて、私たちに同行していた将校に敬礼した。「担当
36,た。お国のためにと、たくさんの男の人たちが中国大陸や東南アジアへ、兵士としておもむきました。そんな時代のあらしの中で、ぎんの心は、ふかく
37,佐野常民記念館」が、出身地の佐賀県川副町にオープンした。佐野は、西南戦争で負傷した兵士を救護するため博愛社を設立。これが、後に日本赤十字社に発展した。また、佐賀藩三重津海軍所
38,へ行きたい）ベッドに横たわり、股間に指を当て荒い息づかいをしていた兵士が、突然むっくりと上体を起こして身仕舞いを始めた。他の兵士はぼんやりし
39,空からの援護」のおかげで、タリバン政権を転覆する寸前にある。一方、タリバンの兵士のほうでも、敗北が迫るのを感じて、北部同盟に寝返る者が続出。
40,れる。こうして一般人の死者の霊との差異を鮮明にしたうえで、兵士の霊魂は改めて、あるいは新たに国家の統制下に組み入れられたのだと解釈できる。
41,で厳格な知性派だが、コズロフは白髪の豪放磊落な巨漢で、兵士の中の兵士、兵士の息子であり孫であり甥っ子である。ランク三位の第一副参謀総長にすぎなかったその彼が三段跳び
42,敵兵から奪った軽機関銃、何もかもバドリオ派の部隊とは対照的で、バドリオ派の兵士は英国軍と同じカーキ色の軍服にブルーのネッカチーフ、そして銃は最新式の英国製ステン軽機関銃で統一さ
43,戦争に参加する米軍への協力であります。演習じゃなくて、まさに戦争に出かけていく兵士がこの空港や港湾を利用することがあり得るし、武器弾薬の輸送などもあり得る。ですから
44,あるか！」迅雷、反論の言葉もない。接近する麒麟を畏れるように後ずさっていく兵士や他の将軍たち。いつの間にか龍旗の下に、迅雷だけが残され
45,、罰則ばかり厳しく適用すれば、兵はますます心服しない。心服していない者は使いがたい。兵士がすでに親しんで従っているのに、罰則を適用しなければ、同じように使いがたい。
46,のばしたが、これはいうまでもなく、匈奴に対するそなえであった。長城には多くの兵士をおくりこみ、彼らは屯田して耕地を開発した。現地で除隊したものはひきつづきその
47,たとしても、本心は分からない」と話している。栄養失調で実家に送り返される十九歳の兵士（５月上旬、北朝鮮・清津―新義州駅間の列車内＝ＲＥＮＫ提供）読者テレホン☎０８８・８２５・４０４０ｄｏｋｕｓｈａ＠ｋｏｃｈｉｎｅｗｓ．ｃｏ．ｊｐ午前十時〜午後５時受け付け
48,窮鼠猫をかむ」の捨身の攻撃に出るかも知れない）。部将がなれなれしく下手に出て兵士に話しかけているのは、部下の信望を失っている証拠である。しばしば恩賞を与えるの
49,露営の夜、大便をしに森などへ入って、敵におそわれた兵士が最近何人か出た。中国人は平気でつれだって野グソをする。だが、日本人
50,悪の双璧と呼ばれていた一方の需品科を陥落させた英雄に対し、総務科の兵士は敬意しか持っていない。「ほめてもらって悪いんだが、俺もエカテリーナさまには
51,べきか。全長は三十メートルはあろうかという、金属の甲冑に身を包んだ兵士だ。「な…！」鷲士は凍りついた。教科書で目にし
52,。なお、将校は作業に出ず、作業に出ていたのは下士官と兵士だけであった。そして、俘虜の将校にはその階級に応じて日本の陸軍将校の
53,、大元帥スターリンを頂点にいただいた赤軍の凱旋パレードがおこなわれた。数百旒のドイツ軍旗が行進する兵士の足もとに投げ捨てられ、踏みにじられた。そして、撃滅すべきつぎの目標は、日本陸軍
54,、わたしはライフル銃を地面において、片ひざをつきました。そして、うつぶせにたおれている兵士をころがして、あおむけにしたそのときでした。わたしは恐怖にこおりつきました
55,人を故郷に残した兵士がいると士気が下がるという理由で、ローマでの兵士の婚姻を禁止したといわれている。キリスト教司祭だったウァレンティヌス（バレンタイン）は秘密に
56,の原爆実験以来、これまで世界各地で確認された二千五十八回を数える核実験（二千年現在）は地域住民、兵士の間に大量のヒバクシャを生んでいる。「例えば中ソは互いに国境に近い
57,はユゼクさんをもぎはなそうとした。手からピストルが落ち、屋根を転がっていった。兵士が悲鳴をあげた。最後の瞬間、ユゼクさんがふり向いて、ぼくたちの目があっ
58,の番犬の餌にもなれへん」。解説＃７ここにはウルフウッドの兵士としての本能と、同時に人としての優しさが現われている。闘いの音に動き出そう
59,」と叫びながら、都市を攻め落とす。この叫びはイタリアの恐怖であった。彼の兵士は手あたり次第に殺戮をほしいままにした。女たちは群がる男たちに犯された。多数
60,言った発言が、兵士の手記にしばしば見られた。一銭五厘に、日本の兵士の存在が象徴的に示されていると思った。こうした兵士を戦前の国家主義教育
61,なった。陸海軍は解体され、戦力を持たない不思議な国が出来上がった。兵士だった者たちは、焼け野原の国土を復興するために働き始めた。瓦礫の中から、
62,二人の印象的な人物も描き直したに違いない。矛槍と竜飾りのある兜をもつ粗野な兵士と、白衣をまとった綿毛のような髪の天使がそうであり、とくにこの
63,でこの詩を削り落としてから、剣を棄てて馬に乗った。蔡瑁が「兵士はすでにそろっております。すぐ新野に向かい劉備を逮捕させてください」と言ったところ、
64,とある玄関口の窪みにニューマンはイザベルと共に隠れた。両側に機関銃を持った兵士が立っている。全員が、ニューマンとイザベルのいる側の、あるビルを見つめている
65,。王族は江華島に、南韓山城に避難した。朝鮮八道に檄文が張り出されて四方で兵士を募集した。ハンゴンは世の中に生まれて初めて自分の実力をまともに発揮することができた
66,た。ギリシャとトルコは軍事的に緊張関係にあるから当然だろう。自動小銃を抱えた兵士の前で係官にトランクを開けて見せると、一瞬、相手は呆れ返ったような
67,天皇より兵士を預かり戦地へと赴かせたのであるから、出征した兵士は死後も兵士として天皇に返さねばならず、そして靖国神社に祀られた他の戦死兵士たちと一体化させなければ
68,じゃない。日本があっさり無条件降伏したときに、中国政府は大陸にいた数百万人の日本軍の兵士や在留邦人を「母のもとに帰れ」といって全部、日本に送り返した。
69,の判別がつかないほど殴りつけた妻に向かって、このように笑う。敵の兵士が、レイプした少女にこう笑いかける。処女の娘に性器切除をさせた父親も
70,だったか、そんなことを教えてやりたいんです。トニーはベトナムでもっとも勇敢な兵士でした。通称“トンネルねずみ”と呼ばれる部隊に所属していました。ベトコンがこちら
71,は微笑んだ。「賢明でしょうね。生き続けて敵に打撃を与え続けるのが良い兵士です。ところで…そちらに余っている戦車はありませんか？」「何故です
72,百二十ミリ滑空砲が火を噴き、事務棟の壁が崩れ落ちる。不意をつかれたソ連解放戦線の兵士は動揺した。しかしすぐに体勢を立て直し、反撃を始めた。正門前を守ってい
73,だから、個人の力に頼るのではなく、あくまで組織の一員としてプレーできるような存在として兵士をみなすようになったのです。日本でも、戦国時代に織田信長が力を発揮し
74,襲わせた、というのだ。この衝突でピコを護衛していた優に十七名の兵士が惨殺され、彼本人も片腕を負傷したらしい。この逸話の真偽のほどは
75,多く依存しているので、戦後の死傷者はさらに増えるかもしれないと心配している。防護されていない兵士やイラクの民間人が戦車の砲火で破壊され炎上するイラクのトラックの横を車で
76,「急げ！」中央制御室に松尾の声が響いた。その前で、ソ連解放戦線の兵士に銃を向けられたロシアと日本の技術者たちが、茫然と松尾とポロスキーを見
77,んだろう？」「何を思い、何を感じてシャッターを切っているんだろう？」「兵士でもないのに、危険なのに、なぜ戦場に行くんだ？」―考えれ
78,、他の計器盤に火花を散らした。次々に計器盤が砕け散る。操縦席の兵士は、やっと外部から攻撃されていることに気づいたようだった。あわてて敵
79,ひとつの点になって」、〈私〉の気分に尾を引く。五十人の兵士を統率する隊長の〈私〉が、そんなエロス的な感情の高ぶりの中にいること
80,の秘中の矢、修練をつんだ選りぬきの者が、なぜ、疲弊しきったわたしの兵士ごときに捕えられた？わたしはわけもなく、愉しい。「このあたりは
81,ように、自国の兵士の死者を見捨ててアジアの犠牲者に向かうのではなく、自国の兵士の死者を先において、彼らに深い哀悼と感謝を捧げなければならない。そのときにのみ
82,が消えうせてしまったことになる。この事実が、戦死が「異常死」であることに加えて兵士の慰霊が特別なかたちをとらざるをえないこと、またそれを多くの人びとが承認すること
83,定数とする陸奥軍制の縮小を申請し、許可された（同年閏十二月辛丑条）。このうち兵士二千人は名取・玉造団に所属し、鎮兵は胆沢・徳丹両城を除いて廃されたようであるが、弘仁
84,味方のサボートに当たる。次の味方が渡り終えたらポイントマンはコーナーの警戒を次の兵士に任せ、若干進行方向に進出し、進出方面の警戒にあたる。後続はそれを繰り返すのだ
85,に垂らしたりした娘たちが、ＦＦＩや午前零時までの外出許可をもらったルクレール部隊の兵士の腕の中でくるくると回っている。マザリーヌ通り、ドーフィーヌ通り、ランシエンヌ・コメディー通りは、割れたガラス
86,一歩屋敷内に入ると右側に警備の小屋がある。五〜六人の無愛想な男たちは軍事政権側の兵士である。別の生き生きした五〜六人は、スーチーさん側つまりＮＬＤの同志たちである。ノートに国籍と
87,中で甲高い声で叫んでいる猿」に見たて、カンボジアの戦士が一人あたり三十人のベトナム兵士を殺したら、容易に勝利を収めることができると主張していた。ポル・ポトはさらに同じ月
88,行進していくところであった。何台もの戦車の蓋があけられ、上半身をのりだした兵士が沿道の人々に敬礼をしていった。真っ直ぐな姿勢とぴしっとした態度
89,後方に広く空いた場所を取らねばならずかなり制約を受けた。これは兵士の隠れるタコツボや狭い陣地などから安全に発射することができず、少なくとも射手の後方十メートルの
90,の巧者」という表現があるが、これは上野（群馬県）西部から来た兵士のことで武田軍全般をいっているわけではない。一方、参謀本部が種本としたと見
91,しばらくして、ワリフ村にミズベの兵士たちがやってきた。かれらは村に駐屯する兵士の詰め所にまず顔を出し、それから村中の宿屋に触書を持って訪れた。「
92,、チェチェン共和国の首都グローズヌイ近郊で、露軍のＭｉ８型ヘリが武装勢力側の携帯式対空ミサイルで撃墜され、搭乗していた兵士九人が死亡した。
93,ものですから、と言った。ムエルテは、即座に今ではＭＭの卓越した兵士である部下のコブラを呼びつけた。マックスウェル・コブラはムエルテの言葉に同意しただけでなく、さらに続け
94,を選択して、分隊単位のチーム対戦を楽しめる。■ストーリー司令部はそれをマーケットガーデン作戦と呼んだ兵士はそれをヘルズハイウェイと呼んだ千九百四十四年９月ヨーロッパ戦線、ノルマンディ上陸作戦でドイツ軍に大打撃を与えた連合軍
95,御心に従うべきであると語られ、自ら進んで連れていかれました。・兵士がイエスを捕らえたのではなく、イエスが自ら捕らえられたのです。・イエスが縛られ
96,ばもののたとえのこのことばあなたのためのよい教えじぶんの国の人や馬兵士も村もしあわせにみなたのしくとねがうのがまことの王のつとめですこう王さま
97,は、血とともに言葉をしたたらせた。「…あさましくも…優秀な兵士に…」「狂ってる…」洋次は、吐き捨てた。「おまえたちは
98,て六人のテロリストを射殺し、列車の乗客が二人、巻き添えをくって死亡した。兵士と警察官からは一人の犠牲者も出なかった。「名前はプレトリウス。ヤンニ・プレトリウスです
99,乗組員百二十名兵士四十名。『ゼーラント』は、備砲三十二門乗組員百十名兵士四十名。『デン＝ヘクトル』は、備砲二十二門乗組員七十名兵士二十名。
100,国の人間も神を信じるのか？」ゲバラ「信じている人はたくさんいる」兵士「あなたも神を信じているのか？」ゲバラ「私は人間を信じている」
101,ではなく、皇帝を実際上の政治主体と想定している。皇帝の大権にはほかに宣戦・講和、兵士の徴募、外交、栄典の授与、兵備、国政施行のための命令の発布、行政官吏・司法官吏
102,ている。「中にいてどうするんだ！出て撃ちまくれ」またふたりの兵士が外に出た。ひとりは身をかがめて、銃座を連射した。ガトリング銃
103,を一つの土地のような所として見る。その土地では南北戦争の際戦死した兵士がリンカーンとおしゃべりしていたり、また貧乏な少女たちがその上で遊べるほどのピアノを
104,。軍の意図にもかかわらず、女たちのエネルギーは、外へ外へと噴出した。出征する兵士がいると聞けば、街頭に立って千人針を集め、港や駅に見送りに
105,そこで荒木大学は、八百名の人夫と砂金洗い、さらにはその警護に当たる充分な兵士とその成就を願うための神聖な聖職者である「修験者」一名を引き連れるべく組織した。
106,てムキムキの完全兵器にしてから兵士を戦場に連れ込めと、んで覚醒状態を落ち着けるために兵士のほっぺたを一発バチンとやったれってことですねハハハ笑えねぇ素人目にみても「馬鹿
107,降った神兵のごとき珍客を迎えて百日余。別離の間際、わずかな時間を敬愛する兵士の手を一人でも多く握ろうと、狂人のように走り回る娘たち。無数の手
108,てのけた。それでもなお、若者たちは死をいとわなかった。なかには女の兵士もいたが、何人かはぼくと二、三歳しかはなれていなかった。一人はデボラ
109,し、南政府軍に入隊して内部で解放軍の立場でかくれて活動する人もいた。兵士に働きかける「兵運」もあった。主人公は二十歳の女性ハムタムである。戦略村の中
110,だから暑いさかりである。炎天に焦げるような道を行く。人足に化けた兵士十一人、梁中書の夫人が実家へ届ける別口の贈物を宰領する都管（執事）の謝
111,もが自分がその立場になりえたかも知れないことを想像させますね。兵士だけではなく、被害者の市民もそうです。ユダヤのホロコーストは、想像を絶する無名の
