,0
103,だった。寝巻の襟元がはっきり写ってしまっていたのを、鳥飼は知り合いの写真家に頼み、修正してぼかしてもらった。修正はうまくいき、写真は一昔前の芸能人の
104,重く引っかかった言葉を吐きだした。「そう、森とかいったな。あの写真家が、のんきに世界じゅう飛びまわれるのも、札幌や小樽で派手に写真展をひらけるのも
105,のモデルに変身するという役どころである．ファッション写真を芸術の一形態にまで押し上げた，世界屈指の写真家．美女のクローズアップ写真が典型的な作品．
106,第一の批判に包摂されるとも言えます。ただ、二番目の批判には、写真家の「作る」という創造的意志の問題も関わってきます。つまり、お手軽、簡単なデジタル写真
107,、さしあたりやはり美しくなければならなかった。「どうぞ、やさしく好意をこめて！」写真家は画家へと変貌した（例としてステルンハイムの『宝石箱』など）。写真
108,Ｃｏｗｂｏｙ”「オクラホマのヨーデル歌いのカウボーイ」Ａｖｅｄｏｎ，Ｒｉｃｈａｒｄリチャード・アヴェドン（千九百二十三―）写真家．ファッション写真の第一人者．作「オブザーヴェイションズ」（五十九），「ナッシング・パーソナル」（六十四）
109,日時…１月十九日（土）午後２時から４時場所…みのお市民活動センター講評…■■■■さん（写真家）●入賞作品展・１月十六日（水）から二十日（日）場所…みのお市民活動センター・１月
110,をしているころ、馬生は小学校を卒業して冨士フィルムに就職したの。そのときは写真家を目指してたんですよ。自分でもずいぶん写真を撮ってたわね。現像代
111,は、東洋の魅惑的な室内ゲームとしてマージャンを紹介している。国際的写真報道記録の保管所にドイツの写真家が撮った香港でのマージャンの写真が収められている。一家でマージャン卓を囲み、
112,ヌードであろうがなかろうが、被写体以上に写真家の腕、感性が重要です。人それぞれ好みの写真家は違いましょうが、同一モデルでも作品への自己評価は違ってきます。写真家専属かどう
113,休学、アフガニスタンに長期滞在千九百七十七年同志社大学卒業。時事通信社にカメラマンとして入社千九百八十年時事通信社退社、フリーランスの写真家に。千九百八十一年『ゲリラ七つの戦線』（未来社）千九百八十九年『若き獅子マスード』
114,はまず被写体となる場所をある程度絞り込むことからはじまる。長倉の場合ならば、写真家としての転換点となったエルサルバドル、学生時代から関係が深いアフガニスタン、さらにフィリピン、ブラジル、
115,自分を撮りはしない。そういう気さえ全然起こらないし。それもたくさんの写真家がひしめいている区画だな。僕は若者たちがこれから何を求めようとしているの
116,もとづいた相互的なカウンセリング。●そのほかの人々とのたくさんの抱擁と身体接触。写真家という職業柄、私は病気と健康のイメージがどんなふうに表現され、提示され
117,が作製中の「百円パッ区」利用ガイドの原案に意見を書き込む市民ら賢治の物語題材東北の自然活写仙台の写真家佐々木さん作品展仙台市青葉区の仙台文学館で、四月十七日に始まる開館五周年記念特別展「宮沢賢治展ｉｎセンダード―永久の未完成」
118,こと考えていると、たいてい夢で解決法が得られると話していました。アトランタ在住の写真家、キャスリン・ヒース・ゲイブルは、四インチ×五インチのカメラの技術上のむずかしい問題を、夢で見た
119,は世界的に有名である。ラッシュアワーを体験する観光ツアーがあると言われるくらいだ。世界中の写真家が撮影しているが、そうした写真を見ると、だいたい三種類の乗客がテーマと
120,：Ｎｏ．六千八百二万三千八百五十四レンズ：Ｎｏ．六千八百五万二千九百八十五田沼ドクターの実写診断デザインが一新されたＫｉｓｓ●担当ドクター田沼武能写真家辻内順平東工大名誉教授志村努東大助教授深堀和良元工業技術院機械技術研究所川向秀和日大芸術学部光画像計測センター編集部▲撮影＝門間新弥
121,（最近動かせてないなー…）のドライバーとしても、模型制作者としても、アマチュアの写真家としても、正直ザンネンな部類に入るミヤザキ、やっぱり上手い人はウラヤマシイ。それでも仕事を
122,第１展示室（☎０４６６‐２６‐５１３３）●ひとこと「十年ほど前から、藤沢市教育委員会の依頼で、写真家の富岡畦草氏が、藤沢市公民館で写真教室を開いています。卒業後、有志が集まって写真サークルを
123,ている．トラブル・シューター的な火消し役として，つとに有名．Ａｄａｍｓ，Ａｎｓｅｌアンセル・アダムズ（千九百二―八十四）写真家．ニューヨーク近代美術館における写真部門の設立に貢献．ヨセミテ国立公園ハーフ・ドームの印象深い岩石面の一枚を採るか
124,た広告によると、二千枚の種板を所有していたという。金兵衛が他の同時代の写真家と異なる点は、その作品の多くが現存するというだけではなく、カタログが存在すること
125,ミレーのバルビゾン撮影・文栗原達夫（写真家）ＫｕｒｉｈａｒａＴａｔｓｕｏレストランの看板も「晩鐘」。上空をジェット機が行くパリ郊外に
126,けど、その証言はあてにならないよ」「どうしてですか」「あの写真家は、水尾みつ子の若いツバメだというのが、もっぱらの噂だぜ。われわれの仲間
127,画家から写真家への転身シャルル・アドルフ・マルヴィルの生涯は、あまり知られていない。パリの写真家だが、それ以前には画家、石版画家として活動していた。千八百四十八〜五十一年ころの作品が、パリ
128,、音楽の表現力、アーティストの個性、それらを受け入れるファンの柔軟性、企画力、デザイナーや写真家の感性、印刷と製版技術など、全ての条件が違っている。ポピュラー音楽が刻々と変化し
129,動きを待つのではなく、稽古に没頭する役者の動きを追う撮影。スタジオ内は役者にとっても写真家にとっても自己との格闘の場のようだ。「もう夜になりました
130,出発前から連絡を取り合っていたのだ。彼は、一日だけパリにいて、ある写真家を追いかけてアルルに向かうのだそうだ。たった一日しかなくても、会いたい
131,ローリーとぼくから三メートルほど離れたどころで、この瞬間を永遠に留めることになる写真家が、三脚にのせたオレンジ用木箱大の蛇腹型カメラの後ろで、構図が立ちあらわれるのを待ってい
132,を一杯おごってくれれば「わしのカワイイ娘」を見せてやってもいいよ、と誘う。写真家はそのかわいい娘というのが彼の妻なのか、猫なのかもわから
133,投げ出さなくちゃならないけど、わたしは一文も払わなくてもいいって」「彼は写真家としてどうだった？」「ほんとうのプロだったわ。最初の一時間にフィルム
134,てまたいい気んなって今度は写真界について吠えてたら、朝日新聞に「ＪＡＰＡＮは写真家の新・出世コース」と書かれてそれはいくら何でもおこがましい、ウチなんかどうせ一介のちんぽだらけの
135,が進めば」と語った。一方で部員たちは、平和都市・広島で鑑賞した郷土出身の写真家による展示にも強い印象が残った様子。同行した佐藤律男副校長は「生徒たちにとっては演舞
136,３月２日十一―十九時・安芸市庄之芝町、そらそらビル５階「ア・ニュー・ムーン」）保育園児や小学生、詩人、写真家、工芸家、主婦らが誰かに伝えたいことや共有したいことなどそれぞれの思いを
137,のなかで記号化していただけかもしれませんが。ご存じのように浮世絵では、いま写真家がよくつかう技法ですが、広重などが大きな松の木をどんと近景に持っ
138,撮った写真家も注目して見ますか？はい。ヌードであろうがなかろうが、被写体以上に写真家の腕、感性が重要です。人それぞれ好みの写真家は違いましょうが、同一モデルでも
139,企画展は、「予言者マン・レイと二十世紀の現代美術ーコレクションから」です。私は、彼は写真家だとばかり思っていましたら、画家であり、彫刻家でもありました。しかも、
140,だったんだ。バルトはそれを《ｓｔｕｄｉｕｍ》（欲求）と称した。これは写真家が一枚の写真を撮るときに言おうとするものだ。しかし、この意思を超え
141,ていた。そのときに買った図録が、ＭｏＭＡオリジナルの写真集。Ａかなり有名な写真家なんだよね。Ｎ大御所だよ。ショーウインドーや車のバックミラーに映った街
142,あらみ」の下の句三十甲賀と並んで忍術の名産地三十一フェスティバル三十二美術家、写真家などの仕事場三十四背中をかく道具三十五運搬に要する費用三十六ワルツで有名
143,に使われた。やがて彼は中島河畔の自邸で「上野写真館」を開設してプロの写真家として活躍する。彼はまず長崎に滞在する外国人に目をつけて彼らから注文を取っ
144,、ハーバート・ブリーンによるミステリーだ。謎を解いて犯人を追いつめる役を、レイモンド・フレームというジャーナリストそして写真家が、つとめている。おなじ主人公による第一作がこのときすでにあり、これは第二作であった
145,」ことをめざして企画されたこの展示には、三十組（三十四人）のアーティスト、写真家が参加していた。その規模においても、「デジタル・テクノロジーの興隆の時期における写真の変質
146,、まゆみ自身言っていたではないか。それが、どうしてまだデビュー間もない沢木のような写真家と…。だが、彼女のそんな疑問は、眼前で繰り広げられる光景に目を
147,大量にフィルムを処理する商業用の大型現像機は製作されているが、ＡＴＬ３のように、写真家が自宅に設置するプライベートなラボ向きのマシーンは作られていない。わが国のプロ写真家
148,生まれる。いやちょっと違うかな…純粋さ？信憑性？これによって観賞者は「この写真家はあんまり上手ではないな。だから真実を語っているに違いない」と考える。そういう
149,思ってるんだ。僕がやりたいのはね…」「知ってるさ」なにしろ写真家とは何度も旅行したことがあるからな。「『すごい写真を撮ること』だろ。
150,は世界的に有名である。ラッシュアワーを体験する観光ツアーがあると言われるくらいだ。世界中の写真家が撮影しているが、そうした写真を見ると、だいたい三種類の乗客がテーマと
151,おまけに、筋骨たくましい肉体とロマンチックな青年のようなハンサムな顔だちは、女たちや写真家の好感を得ていた。どんなに手きびしい新聞の論説委員たちでも全員一致で、彼に
152,から取り出す写真家とは、対象についても違った考えをもっている。それは画家と写真家を別の仕事と考えた場合のことではあるが、ホックニーは事物の美
153,ミューズの微笑みときめき美術館」で、昨年十一月に区立となった、熊谷守一美術館が放映されます。写真家の桐島ローランド氏をナビゲーターに、訪れてみたくなる美術館の一つとして紹介されます。美術館の
154,ＥＮＧＩＮＥでした。株式会社新潮社エンジン編集部の数藤氏と自動車人物撮影のプロキャメラマンでお馴染みの写真家阿部昌也氏それから今回の主人公でもあり複数台所有オーナーでもある濱田企画室の最高経営責任者濱田氏
155,、わかりません。本人に聞いてみないと…」「いずれにしろ、フリーの写真家だという新森由紀江を呼んで、事情を聞くことだな。もっとも、現段階では、
156,わ」「なぜきみにそんなものを見せたんだい？」「プロの写真家として、刺激を受けたんですって。その女の人たちは彼が写真を撮って
157,見ていただいている。同誌でグラビアを組んでいただけることは、自分を含めた若い写真家にとって励みとなり、そこでわれわれは切磋琢磨している。最後に、山小屋の従業員の
158,震わせていた。「母さんはロバート・キンケイドという人に恋をしていたのよ。写真家よ。覚えてるでしょう、橋の話が出ていた『ナショナル・ジオグラフィック』をみんなで見
159,。それに、飲んでばかりいると、身がもたない。自宅に帰ろうとしたら、写真家の坂本真典氏より電話があり、「いま、神楽坂の居酒屋で筑摩書房の中川美智子さんの歓送会を
160,を見ましたけど、随分前の話です・・・アメリカではすごくポピュラーな写真家なので海外通販で探せばきっとあると思います。
161,でやるんですか。田沼文化庁と一緒になって、半官半民の保存センターをつくる。写真家がお亡くなりになると、フィルムを遺族が管理するのは困難なのです。だから保存整理をして
162,を知り、棚橋はパートナーを引き受ける。◇徹子の部屋（東日本後１・二十）写真家の荒木経惟氏を迎える。バイタリティーあふれる数々の写真で話題を振りまいてきたが、作品の
163,つくっていました。なかでもいちばんおもしろいと思ったのは、アーサー・ダヴでした。写真家のスティーグリッツもいましたが、彼の最大の特徴は哲学者であることでしたね
164,共通していたのは、写真は記録するということだった。一方、中央図書館では写真家の■■■■■さんが名護で久しぶりに泡瀬干潟の写真展を開いた。ひざ下五十センチの干潟の世界
165,のときからヴェネツィアに住み、幅広い活動を展開。画家であると同時に、版画家、彫刻家、写真家、舞台装置家でもあったが、何よりも服飾デザイナーとして知られている。たとえばデルポイの有名な馭者像
166,のない母親を一番きれいに撮れるのはどこなのか。それを考えたとき写真家として大きく成長したという。◇ためしてガッテン（ＮＨＫ後８・００）有名人から
167,ようこそ＋゜○ｏ。．猫好きの写真家．。ｏ○゜＋へ将来の夢は『プロカメラマン』たくさん素敵な写真を撮る
168,こと」と言うようにまでなった。写真を撮り始めるきっかけとなったのは、写真家の長嶺輝明さんだ。祥伝社の「肌に髪に優しい石けん」の撮影のときに、
169,飛び回り写真を撮り続けてきた「プロ」の写真家・田沼武能氏。「子ども」を撮る名人二人の写真家の写真観・子ども観とは。司会は飯沢耕太郎氏。ポートレート撮影：宮崎明子くまがい・もといち千九百九年、長野県会地村
170,日本商工会議所会頭をつとめた足立正や漫画家の水木しげるは、弓ヶ浜半島先端の境港の出身。詩人生田春月、写真家の岩宮武二、国文学の池田亀鑑、元横綱琴桜なども本県出身者である。体型は、いかつい
171,「どうしても書かねばならない」という思いにせかされたという。ベトナム戦争取材中に死亡した写真家、沢田教一氏の軌跡を丹念に追ったノンフィクション「ライカでグッドバイ」など、精力的な
172,「彼も農夫になりたいとは思ってないわ」ブライアナは言いかえした。「写真家なのよ、それも国際的な。才能があるのよ。それを使うのが
173,を通じて、写真がいかなる「意味するもの」でありうるかを明らかにすることである。また写真家はもし方法を問題にするならそのような意味の構造にてらして、自らの
174,なくなった日。以来、シンメトリーな暮らし。文・今森光彦いまもり・みつひこ写真家ぐっと眼前に迫る花や昆虫。人と共にありながら幻想的でさえある里山
175,Ａｐｅｒｔｕｒｅ千九百七十五年千八百八十九年「自然主義写真」を提唱したエマーソンは、イギリスのピクトリアリズムを代表した写真家。『既視の街』渡辺兼人（写真）金井美恵子（文）新潮社千九百八十年ありえない都市
176,たにちがいないが、私の撮影の大半はスキーツアーによるもののため、純粋の写真家と違って行動はどうしても制約される。しかし、スキー人だけに許されるツアーの途次に
177,に動員され、その後レジスタンスに加わる。千九百四十八年以来、通信社ラフォをエージェントとしたフリーランスの写真家として活躍。特にパリとその郊外の街頭や人頭や人物などを撮影。千九百九十四年没。
178,写真家は、常に健全堅固な肉体と精神の確立を心がけるべし。四、写真家は、常に豊かな感性を育むべし。
179,ながらファインダーを覗き、ある写真家は、小屋番用の風呂の窓から被写体を追い、ある写真家は、「写真は体力」との信念のもとにたえず山を駆け回り…と
180,ば、認めさせるまで作り続ける不屈の意志を育てた。その後、多くの才能豊かな写真家と仕事をする機会に恵まれ、ますます広告写真の面白さを知っていった。日本写真協会新人賞を
181,ミックはいる？って聞いていたよ」ドミニク・タルレ（写真家）ＤｏｍｉｎｉｑｕｅＴａｒｌｅ千九百七十一年、写真家のドミニク・タルレは、コートダジュールの小さな港町ヴィルフランシュ・シュール・メールにあるキースの貸別荘を訪れた。その後
182,たイカロス出版編集部の廣部妥編集長、ならびに鉄道写真に情熱をかけ、今回もすばらしいショットを提供していただいた写真家の金盛正樹氏、取材に労苦をいとわず、煩雑な原稿の整理に尽力をいただいた
183,感得＊完備媒体創出書写する写字生ミエログーテンベルク聖書港千尋千九百六十（昭和三十五）―写真家。批評家。神奈川県の生まれ。千九百八十五年よりパリで活躍。その後、東京に拠点を
184,こうした全体の構造を限られた一点から偏微分していくことでしかない。多くの写真家によって、写真という総体的かつ同時代的な地平がうまれてこよう。そして未来から逆にこれ
185,な透視図法、明快な陰影、つまりドキュメンタリーの極致を達成した（アンドレ・ジャム）□画家から写真家への転身シャルル・アドルフ・マルヴィルの生涯は、あまり知られていない。パリの写真家だが
186,。「どちらもいわゆる、２世カップル。そのうえ、ソフィアは映画監督、女優、モデル、写真家、『ＭＩＬＫＦＥＤ』のデザイナーと、多才な女性。スパイクは時代の寵児と
187,。ステージ写真家に頼んで、自分がスターの近くに立っているところを写してもらうのだ。写真家も心得ていて、焼き増しを二枚作ってくれる。ジルはその一枚を母親に送り、
188,気になって私もやってみました。Ｔｉｇｅｒさんと一緒で一般生徒でした〜♪写真家か・・・ちょっと楽しそうかも。
189,なくさせてしまうような作品を生みだすことのできる写真家が、わたしの考える一流の写真家である。白状してしまおう！穂高は、いま、わたしにとって、唯一、苦手な
190,。かんかん帽の見物人は現場監督のまわりをうろつき、現場監督は子馬たちに向かってわめきたてた。写真家はヴェールの下から出てきて、背中を伸ばした。「ネッド、これはいったい
191,・・』参考文献よりの引用ですが〜〜〜合掌三、写真家は、常に健全堅固な肉体と精神の確立を心がけるべし。四、写真家
192,である。首からちびカメラをふたつさげ、歩くときも写すときも俯いてばかりいる、写真家というより「写真ひろい」といった風体の中年男を穂高で見かけたら、それが、
193,五月）原弘の論文も含めて、第二期では写真技法、写真材料、職業としての写真家などを論じた実用的な記事が目立ってくる。Ｊ・Ｆ・カーン、小林閑之助訳「芸術・スポーツ・写真家」、ジャック・プライス、ＨＫ生訳「
194,は轟音を立てながら橋に近づいていたが、私はそこで、『映画撮影ファンと写真家のための撮影規則』という、ソ連で生き残る法を伝授しようとした、インツーリスト発行のパンフレット
195,号して月報などに書いてゐた。」「むらさき」氏はまず、一人の「円満なる写真家」を「学者」「技術家」「想家」の三つの人格に分け、そのうち
196,日下部金兵衛キンベイさんはどこ全盛期の横浜写真を担った写真家として、ベアトの助手から出発した日下部金兵衛、スティルフリート経由ベアトの写真館を継承したファルサーリ、東京から
197,がたくさんあるので、生物の生存環境には適しているし、最近では、多くの写真家の皆さんが来るのもこの風景が美しく五感を震わせるものがあるからです。また
198,あざやかで力強い絵と、えらびぬかれた短い言葉のためでしょうか。「雪の写真家ベントレー」は、雪の結晶のさつえいに一生をささげたベントレーの人生をまとめ
199,を与えたんですね、あのアルバムは。だから、いわゆる音楽ファンだけじゃなくて、たとえば写真家だとか美術評論家だとかというように広いジャンルの人たちに関心を持たれ
200,であろう。ある写真家は、小屋の売店でラーメン売りを手つだいながらファインダーを覗き、ある写真家は、小屋番用の風呂の窓から被写体を追い、ある写真家は、「写真は体力
201,いけば、自然主義風の私小説だか告白文学だかになるのであろうが、僕はこれで写真家なのである。結局のところその凹の状態にせよ、写真を見てもらったほうが
202,のは明白であり、写真家たちは新たな展望を見出そうともがいていた。長倉が写真家としてのキャリアをスタートさせたのは、まさにそんなフォト・ジャーナリズムの「冬の時代」の
203,コートも、あるいは河西からの贈り物だったのかもしれない。壁には、有名な写真家の撮った彼女自身の写真が、大きなパネルにして、飾ってあった。セミ・ヌードの
204,にかけて、スチュアート・マッキンニー（共和党下院議員）、マックス・ロビンソン（ＡＢＣニュースキャスター、黒人初のアンカーマン）、ロバート・メイプルソープ（写真家）、キース・ヘリング（ポップアート画家）、アンソニー・パーキンス（映画俳優）、アーサー・アッシュ（元テニス選手）らがエイズで
205,この区画には写真家がひしめき合っているんだよ。これに対して、感嘆するということはほとんどの写真家が自分に課していない使命なんだ。我々は一つの物体、建物、樹木を
