,0
0,判読・理解できた。事情聴取で彼を攻める有力な武器になるかもしれない。犠牲者の娘と写真家、大村菜美の思いもかけない協力のおかげで、まったく異例なくらい成果の多い日
1,の夕焼けを紹介しながら、写真の勉強と思ってはじめたが、だからといって写真家を目指すつもりでもない。仕事を引退した後の趣味の中の一つとしてやっ
2,千代田区神田小川町１丁目のオリンパスギャラリー（小川町駅、☎０３・３２９２・１９３４）。武蔵野の自然を撮影した７人の写真家による作品展。印画紙ではなく和紙で仕上げた写真を約六十点。日祝休み。ミュージアムｍｕｓｅｕｍ
3,。これも初めて書くが、霞町あたりにスタジオを持ち、三島のボディビル姿を撮っていた写真家の矢頭保と、三島と私で何度か撮影したものだった。雑誌『血と
4,だ。五流国民のために山形たちは郊外だけでも六十人以上もいる商業写真家・その他写真家と五十九の写真現像・焼き付け店を訪れるように依頼された。他になぜか実に数多い
5,。『でも、コウモリの写真はこれしか見つからないんです』。それまで、ほとんどの写真家はコウモリの翼を無理やり広げ、その顔に息を吹きかけてから、写真を撮っ
6,逃避する。これで破廉恥な事態が避けられるからだ。僕が感服している何人かの写真家も、別の手段で自分を表現したいという同じ欲求を感じているよ。カルティエ・ブレッソンは
7,怒りの念も創造的であることへの助けになっているかもしれないと思っているけどね。写真家の時間は特別だ。一日に十時間も練習する音楽家、ある時間からある時間まで規則的
8,Ｑ＆Ａカメラ・写真の疑問にお答えするコーナー今月の回答者小池恒裕（写真家）投稿歓迎●メカニズムや撮影方法などなんでもお答えします。できるだけ具体的なデータや写真を添え
9,ために千九百三十一年にストロボスコープが開発されるなど、カメラと周辺の器材のきめの細かい開発が写真家の要求をみたすと同時に大衆への普及を支えていった。初期の百三十五パトローネ（
10,写真家たちのせいだろう―一方、写される兎は嬉しくはない。僕はこうした写真家のように仕事をする勇気はないよ。ウィリアム・クラインのような厚かましさはないんだ。
11,が悲しい現実ですが、気持ちだけは「カメラはスポーツだ」（テレビでおなじみの写真家、浅井慎平氏の著作名）を座右の銘に、フットワーク軽くありたいと思っています。
12,は何事にまれ彼等に学ばんとす、然れども思へ、彼等の間に写真家たる資格を有する者は殆んど稀なり、彼等は何等の思想、何等の智識を
13,。彼らが間違っているとは言わない。でもこれは僕向きじゃない。この区画には写真家がひしめき合っているんだよ。これに対して、感嘆するということはほとんどの写真家が自分に課し
14,。市川紀元●いちかわのりもと。六十年生まれ。湘南の海とサーファーの撮影を得意とする写真家。いい波と時間さえあれば、波乗りに励むというサーファーでもある。ＨＰ
15,「海外派遣型」文化交流使として十一名，「現地滞在型」文化交流使として４名，「来日芸術家型」文化交流使として４組の指名を行いました。重要無形文化財保持者，写真家や音楽家など様々な分野で活躍中の方々の活動を通じて，日本文化のこれまで紹介され
16,生き方を絡めています」▲くまきり・けいすけ千九百三十四年東京生まれ。五十七年日本大学芸術学部写真学科卒業。フリーランスの写真家として主にジャーナリズムの分野で活躍。六十一年講談社写真賞受賞。写真集に『東京港』『世界でいちばん住み
17,サルバドル救世主の国』ＪＩＣＣ出版局千九百九十フリーランスになって十年余りを経て、長倉が写真家として成長した証しというべき写真集。千九百八十二年以来のエルサルバドル取材の集大成だが、彼の視線
18,た。いや、私が驚いたのはそのせいばかりではなかった。二十世紀を代表する写真家のひとりであり、千九百三十年代はじめには古典的なスナップ写真術をすでに完成させていたこの人が、
19,を混乱に陥れ、シャッターを切れなくさせてしまうような作品を生みだすことのできる写真家が、わたしの考える一流の写真家である。白状してしまおう！穂高は、いま
20,。マルヴィルの写真作品でもっとも古いのは、千八百五十一年のものになる。この画家から写真家への転身は、ブランカール＝エヴラールの影響があるのではないかとも見られている。
21,があります。更に、写真集の場合、印刷屋がもんだい。印刷の質と色合い。写真家と息が合ってないと興ざめです。
22,も、作られたものなら興味を示さない。「うそがある」からだ。写真家の自分を「房総風土記録家」とするのも、同じ理由による。久しぶりに九十九里浜
23,のが、日本の伝統的造形への再解釈を試みたデザインであった。多くのイラストレーターや写真家の作品を素材に使いながらアートディレクターとして多様な表現を試みてもいる。しかし、
24,ｍａｇｎｅｔｉｓｍｅｄｅｌ’ｅｓｐａｃｅ空間の持つ力に魅せられる０２ＴａｍｉＡＭＩＴタミー・アミットさん（写真家）パステルカラーの中に潜んだ、スパイシーな個性大きな空間だから家具には気を
25,を合わせる、十八世紀以来の囲う身振りを、囲う機械である写真を介してメタ批判する大層マニエリスティックな写真家が次々に出現してきているのが嬉しい。そのフォトに「懐かしさ」を憶える瞬間、
26,ている。古径の作品において手の動きはとても大切な要素だと思います」写真家はまた「女性たちの顔も気になった」という。なるほど顔の部分だけ
27,の庫内温度、冷凍時間、顕微鏡の観察倍率、ライトの当て方、絞りの使い方などをプロの写真家の方などにもアドバイスをいただきながら、少しずつ研究を確立していきました。
28,に頼って遊び暮らしているような偏見は持たないでほしい。自分は銀行に勤務中、写真家を志し、職業訓練校に通って写真家に転職した。芸術写真なので、食べていけず
29,の個人的情報は明かせません。医者や弁護士には守秘義務っちゅうのがあるでしょう？写真家にも守秘義務はあるんです。モデルの携帯電話の番号なんて、たとえ丸山先生であっても教え
30,あとで呉が話しかけてきたわ」「どんなふうに？」「プロの写真家としてよ、もちろん。カメラ・バッグに入っている最新の道具を見せてくれたわ。外国製の
31,れる。店内カルチャーサロンでは、ポエムグラファー・沼田元氣による書評ライブをはじめ、最新作『空中庭園』も好調な作家・角田光代と写真家の橋口穣二による異色のトークセッションや、オウム真理教を題材にしたドキュメンタリー『Ａ』で知られる森達也監督
32,につづいて展開される情念の恋物語にはとにかく圧倒された。そして今回、物語好きの写真家は古径の絵のあちこちからさまざまな細部を抜きだして、コマ割りのように並べたく
33,思う。しかしながら私は一スキーと写真の二足の草鞋をはいていた。純粋の写真家であるならば、ヨーロッパなどの山小屋に宿泊し、写真だけに専念して朝夕の斜光による
34,を組み、胸を突き出し、足を開いて踏ん張った。黒いヴェールの下で、写真家が足を開いてファインダーをのぞきこんだ。職人たちが足場のそばにやってきて
35,。（笑）飯沢田沼さん、この『一年生』を見て、同じ子どもを撮る写真家としてジェラシーを感じたりしないですか。田沼感じますよ。これは先生じゃない
36,保険という集合的原理によってまかなわれるのが適当であるかもしれない。ボランティアの人たちやフリーの報道記者や写真家にも頼れる保険があるといい。それがない場合には、その人たちの活動
37,酷似と、そしてそれらの庭を酷似したアングルで「絵」にした二人の写真家を通底している感受性へと、こちらの興味をそそらずにはいないのだ。
38,人々の暮らしへと大きく広がっていったことがよくわかる。僕にとっても、長倉洋海という写真家の存在を最初に印象づけられた写真集でもあった。巻末の土方正志によるインタビューで
39,はより多面的なものになりつつある。森村は京都市立芸術大学で、アメリカで活動していた写真家のアーネスト・サトウの指導を受け、写真の表現力に目を開かれる。八十年代後半に、美術史上
40,た。卒業後は迷わずＵターン。地元紙で７年半の記者生活を送り、九十八年にフリーの写真家として再び上京した。「便利な仕事場として選んだだけ。でも、学生時代より東京
41,に響く。曲は「群青日和」「透明人間」「ここでキスして」（予定）写真家の蜷川実花がバスツアーに同行。その作品も紹介ポップス６／十八土Ｓ開運音楽堂ＴＢＳのみ
42,減り、０９年版は半分の約５万部まで減少した。０２、０３年にモデル撮影を手掛けた写真家の立木義浩さんは「撮影当時、世間にはまだ客室乗務員へのあこがれが強かった。時代の
43,〈完全版〉アンネ・フランク大人を観察するアンネの目の鋭さを強く感じます。織作峰子さんおりさく・みねこ写真家「いつも身近に置いておいて、何年かに一度、必ず開く本です」
44,写真集を仏壇の前に供えて、『氷室さん、もっと長生きして画家として、私が写真家として、二人で立派な仕事をして頑張りたいと思っていたのに。私
45,５枚のポスターを作製しました。なお、ポスターの作製に当たっては、撮影を市内在住の写真家である■■■■■氏に、デザインを■■■■氏に依頼しました。季節に合わせた花のポスターを
46,）フジプロビア四百Ｆｐｒｏｆｉｌｅ〉〉〉ｍａｓａｋｏｉｍａｏｋａ千九百六十五年神奈川県生まれ。東レ（株）を退社後、写真家としてドキュメンタリーを主体に活動中。５／三十一〜６／９東京・新宿コニカプラザギャラリーにて写真展を開催。５／二十五に写真集も出版さ
47,」「わかった。同じ場所で撮影しても、違った写真になるのは、写真家の個性によるものだってことが、一応、理解できたわね。それじゃ、一番最後
48,というセンチメントをここ程味わえる街角を私は知らない。最終日には、ランチに写真家の小林紀晴くんを呼び出した。実は、出発前から連絡を取り合っていたのだ。彼は、
49,には官庁関係、元大使、商社マン、報道機関の人々、いまなお東アフリカを舞台に活躍している写真家、画家、実業家の面々が招待され、続々と集まってきて旧交を温める。
50,に生れたのかね？」「その点については、よくわかりません。写真家になる前のことは、ほとんど、他人に、喋らないそうですから」「
51,、特殊音楽家のとうじ魔とうじ、テクノアートユニット“グラインダーマン”らがパフォーマンスを披露。夕方以降からは、佐内正史や川内倫子ら４人の写真家の作品を紹介する青山ブックセンター初の野外スライドショーが行われる。このほか、スタッフおすすめの本をコメント付き
52,の花となった。妖しさ美しさはますます円熟していますね。（談）（しのやまきしん写真家）ばんどうたまさぶろう千九百六十年東京生まれ。千九百六十四年五代目坂東玉三郎を襲名。歌舞伎のほか「ナスターシャ」など劇、
53,たくてニューヨークに来たという。そのヒビくんをぼくらに会わせたのが、写真家のロバート・フランクだった。ヒビくんがロバート・フランクの家に遊びに行っているときに、ぼくが
54,キリキリ舞いさせる笑いと感動のアドベンチャー・コメディー。１歳の誕生日を迎える直前のベイビー、ピンクが写真家を装ったエディ（マンテーニャ）らに誘拐された。エディらは身代金五百万ドルを要求。
55,アンセル・アダムスという写真家の「エルナンデスの月の出」という写真を探しています。できればポスター、なけれ
56,で闇は写せるか」とか、「デジタル写真には水がない」なんて、おっしゃる写真家もおります。十九世紀中頃、写真装置が登場したときもおそらく、画家たちが同じようなこと
57,―５カリグラフィーｃａｌｌｉｇｒａｐｈｙ筆勢によって文字を美しく書く技術。６ロベール・ドワノーＲｏｂｅｒｔＤｏｉｓｎｅａｕフランスの写真家。千九百十二―◆「建築的な含み」・「宗教的な起源」とは、それぞれどう
58,ばモノクロームというイメージが強かったし、デジタルカメラが一般化した現在でも、白黒に執着する写真家もかなり多い。むしろ長倉の世代が「ニュー・カラー・フォト・ジャーナリズム」というべき傾向を強く打ち出していっ
59,お問い合わせ／東京店☎０３‐３４０６‐６４９２／０３‐３４０６‐６３７２大阪店☎０６‐６３３０‐８０７１●講師／あべ弘士（絵本作家）今森光彦（写真家）落合恵子（作家）金盛浦子（セラピスト・臨床心理士）川端誠（絵本作家）邱淑恵（中国健康コンサルタント
60,は持たないでほしい。自分は銀行に勤務中、写真家を志し、職業訓練校に通って写真家に転職した。芸術写真なので、食べていけず労働不能手当に支えられながらいい写真を
61,あるむ千九百八十八年千九百三十年代後半から、シュルレアリスムやアブストラクトといった美術思潮の影響によって「前衛写真」を志向する写真家が輩出した。「名古屋フォトアバンギャルド」の中心メンバーであった坂田稔は、写真の科学的機能を生かし、
62,の白黒写真にいたるまで様々である．写真を芸術の一分野にまで高めたアメリカを代表する写真家の一人．直截でくっきりとした作風で知られ，アンセル・アダムズ的な写真といえば
63,と大地に生きていることを知ることができます」千九百九十六年に他界した、アラスカを撮り続けた写真家、星野道夫の晩年のフォトエッセイ。南東アラスカからシベリアへ、ワタリガラスの神話を追い求め、人類の
64,の財産ですので誰でも自由に撮影することができます。一般的には美術品を撮影した写真家に著作権が発生しますが、撮影にあたっては許可を求めなくてはなりませ
65,は、大学や写真学校で専門的に［フォトグラフィ］を学んだ者だけではなく、アート・スクール出身の写真家、というよりは［フォトグラフィ］を表現の手段として選びとったアーティストたちの存在が大きく
66,評価され、同時代の若者たちの憧れの的になった。戦場を駆け巡るフォト・ジャーナリストが「写真家」の代名詞だった時代がたしかにあったのだ。だがベトナム戦争が終結し、硬派
67,採用、監督を驚かせた。一見、色彩とは無縁なようなモノクロ写真にこだわる写真家、立木義浩の写真に色濃くにじむ色彩感。そしてメキシコに飛んだ北野武を瞠目（どうもく）させた
68,、私が、「この写真は、性が煽情的に強調されていますが、写真家がもうすこし自分の個性と女性の個性とをぶつけあうと、もっと生き生きした写真に
69,描き上げる画家は、見ることの瞬間から写真を定着させて、それを暗室から取り出す写真家とは、対象についても違った考えをもっている。それは画家と写真家を別
70,カメラ以前にあるので、カメラはそのプロセスの結果であるともいえるが、ホックニーは自ら写真家とも称しながら、カメラで撮ったあとも、そのプリントをたくさん手にして
71,していた二人の職人に対する現場監督の怒鳴り声は、工事現場の騒音にかき消された。写真家が黒いヴェールの下にひょいともぐった。製材所の作業員は荷馬車を空にし、
72,のスタジオで撮影され、フィツロイ・ストリートにてウィスラーついでシッカートが保管。「この劇はヴァージニアの大伯母で写真家のジュリア・マーガレット・キャメロン、詩人のテニソン、画家のＧ．Ｆ．ワッツ、そしてワッツと結婚していた女優のエレン・テリー
73,の短所は長所でもあったわけだ。カメラを腹のところで構えると、写真家の様子がそれほど攻撃的に見えない、というね。礼拝するように被写体（ｓｕｊｅｔ
74,てやまない。そこが、ランドサットの地表写真とは決定的に異なる点であり、写真と写真家の強さであり、むしろガガーリンの体験に繫がる部分である。インターネットのユートピアに対置すべき、
75,オンライン秋山庄太郎さん花のなかに永遠の恋人を写真家の秋山庄太郎さんが急逝した。取材のため東京・西麻布にある秋山さんのスタジオを訪ねたの
76,なにをいおうとしているのか。「あの自殺はね、なんとかいう有名な写真家が自殺を証明するかのような証言を警察にしたために、自殺ということになっ
77,かねて何度か浅瀬でテスト撮影を繰り返しているが結構海の世界は難しい。海に詳しい写真家に聞くと、「本島北部の十年前のリーフは、珊瑚も種類が豊富でその群落
78,ほどしか経っていない日の出来事だ。この様子を見ていたのが、写真家の秋元良平さんである。秋元さんは、この時点で、すでに二年以上クイールの姿を撮りつづけており、
79,トリミングされるのさえ気にしない、と君は言ったね。こんなことをいう写真家はざらにはいない。これも石蹴り遊び、いわば偶然にまかせたもう一つの
80,マスードの顔は皺が深くなり、翳りを帯びてくる。彼を撮り続けることは、写真家としての自分の原点を確かめることであり、マスードはある意味で長倉の分身とも
81,ＤＲＩＶＥ夕日を見に行く。Ｒ百三十四ドライブ湘南の海を撮り続けている写真家が語る夕日の魅力とは？沈んでいく太陽の光を浴びて、赤く染まる
82,これ、ブログ友ちぢみさんところで見つけて、試してみました＾＾ブログ年齢五十五歳とは＾＾写真家を目指すのもいいかも＾＾でも、趣味の１つなんで＾＾これ、気楽
83,撮られた場所と時間と異なる場と時で見られる。その隔たりをめぐって写真家の試みと、我々見る側の想像がある。そして高度情報化社会となり必要な写真情報など
84,。ホフマンは第三帝国でただ一人、いつでもどこでも総統の写真を撮ることができる写真家として名声を得、『誰も知らないヒトラー』を始めとする数々の写真集で
85,／ＡＳＹＳＴＥＭＯＦＭＯＭＥＮＴＳデニス・ホッパー／ア・システム・オブ・モーメンツハリウッドきってのカルト俳優にして映像作家のデニス・ホッパーの写真家としての顔は、千九百八十六年の名著『アウト・オブ・ザ・シックスティーズ』（絶版）でよく知られているが
86,書いた彼が、「地を這うように」というタイトルを選んだところに、写真家としての成熟を見る。『人間が好きアマゾン先住民からの伝言』福音館書店千九百九十六「
87,は写真芸術社の同人を中心として「シセイドウ・フォト・ジュニオル・サークル」が結成され、写真家としての活動が再開される。そして同年十一月には、同サークルと浅沼商会系の写真家団体「光画会」が
88,百三十キログラムほど。姿潮砂はま樹林垂れ下がる胸穴骨厳しい星野道夫千九百五十二〜九十六年。千葉県生まれ。写真家。「グリズリー」「アラスカたんけん記」などの作品がある。学習▼筆者といっしょに森
89,は、先生方の愛情の表れでもある。子どもたちの絵百二十四点に、詩人、児童文学者、写真家、女優、作家、画家ら七十人の、百二十四の文章が寄せられ、絵本となった
90,みなさんは（ヌード含む）グラビアを見るとき、そのグラビアを撮った写真家も注目して見ますか？はい。ヌードであろうがなかろうが、被写体以上に写真家の腕
91,らしい。冬柴は、小泉首相に言った。「総理、名誉会長は美術家でも写真家でもなんでもないのですが、心眼で写真を撮るんです」「ああ、そうです
92,の写真の多様性のなかから、共有できるひとつのコンテンポラリーなものを見出すことができる。ひとりの写真家にできることはせいぜいこうした全体の構造を限られた一点から偏微分していくこと
93,ているのは絶妙な画面構成で、なかでも余白の使い方が巧み。ところが今回、写真家は徹底して細部にレンズを向けたのだ。「余白を無視した撮影は、
94,と、通常は遠近感（パース）がきつくついて撮影されます。これをプロの写真家は、「あおり」という手法を用いて補正して撮影することがあります。これにはシフトレンズ
95,とする人々がいる。技術者には林業に従事する人々がおり、文学者、画家、写真家には森林の美を描写しようとする人々がいる。森林はこれらの専門家の視点
96,だけが生きがいという男でしてね、生活能力はまったくないんですが」町田はその写真家のパトロンになったような口ぶりだった。「この犬の表情が何と
97,父への手紙父のたたずまい橋口譲二（写真家）父は僕が小学六年生の時に脳梗塞で死んだ。五十六歳だった。
98,て、これほど熾烈な撮影レースを展開している山も、またとないであろう。ある写真家は、小屋の売店でラーメン売りを手つだいながらファインダーを覗き、ある写真家は、小屋番用の
99,作品が集まり、なんともにぎやかで豪勢になりました。スペシャルゲストの一人目は写真家の田邊順一さん。「老い」を、人間としてのあたたかい目で撮りつづけてきた、すてきな
100,ギニア湾岸に出、アフリカ大陸を横断してケニアのナイロビまで三十六ヵ月かけて、計二十五ヵ国を旅した写真家だ。彼は先進国では、野宿の次にＹＨが安いと言っていた。
101,「写真のチカラ」をメーンテーマに、カメラや用品の展示のほか、プロの写真家による各種イベントやセミナー、さらに作品の展示など多彩な内容で、昨年の７万五千四百人を上回る
102,取り付け可。アングルファインダーは、子供の視線位置の低さを意識して、また、カメラを向ける写真家の鋭い視線を浴びせないために用いることもある。
