,0
206,彼を必要としたのか。吉岡攻テレビジャーナリストよしおかこう千九百四十四年生まれ。写真家を経て八十五年から「ニュースステーション」「報道特集」などテレビジャーナリストとして多くのドキュメンタリー番組を手がける。
207,一度のわりで開かれていたアエラ会には、『アエラ』の表紙を撮っている写真家の坂田栄一郎氏の紹介で入り、渥美さんはかなり熱心で、ほぼ皆勤だったといい、
208,イエローを外れて道路にでました。如何でしたかイエローストーンの大自然。上手な写真家のＤＪさんのショットはいつも安定していますので見ごたえがあります。ネット新聞。「夕刊
209,依頼された。他になぜか実に数多い写真館と少数の写真材料店も調べる。写真家がポラロイド・カメラを犯罪者か仲間に貸し出したかもしれないし、いわゆるＤＰＥ店でもカメラを売っている
210,も十分重いのに、大判カメラをすくなくとも一台と三脚を持参ですから大変です」写真家がそう説明してくれる。由紀子よりも軽そうな菜美のどこにそんな馬力があるのだろうか
211,）千九百二十五年金大中（元韓国大統領）千九百三十年ゴダール（映画監督）千九百四十年篠山紀信（写真家）千九百五十年イルカ（歌手）千九百五十一年長州力（プロレス）千九百五十二年今いくよ（
212,〜）は、プライベートな視点を生かしたドキュメンタリー写真の分野で高い評価を受けてきた写真家である。代表作を集成した『アメリカの時代』（ＴＩＥＭＰＯＳＤＥＡＭＥＲＩＣＡ，千九百八十五）
213,禁じる。僕だって暴力が存在することは知っているし、暴力を非常にうまく表現する写真家がいるのも事実だ。彼らが間違っているとは言わない。でもこれは僕向き
214,せた。千九百七十四年３月ニューヨーク近代美術館で開かれたニュー・ジャパニーズ・フォトグラフィー展に、土門拳先生をはじめとする十五人の写真家の１人として選ばれ、晴れのニューヨークでのオープニングパーティーに招待された。その作品を
215,【撮影】鈴木理策［すずき・りさく］熊野やサント＝ヴィクトワール山の風景にさまざまな物語をみいだしてきた写真家が、大好きな日本画家の作品に初めてレンズを向けた古径の色と線と
216,、名声や、見知らぬ人からのお祝いの手紙や、サインをせがまれたり、写真家や新聞記者たちから会見の申しこみを受けたり、といったことはよろこびませんでした。そう
217,生家は松屋という乾物屋で、名字帯刀を許される家柄だったという。その金兵衛が写真家として大成するきっかけは、開港直後の横浜に出てきて、ベアトの助手となった
218,写真ではない。外部の者の方が正しい判断をするのさ。彼らは「この写真家はこんなもんだ。だからこれらの写真が彼を表現しているのだ」と言う。彼ら
219,。熊谷固執して村を撮っておった者の相手が、世界中を撮影してきた写真家というのは、おもしろいんじゃないかと。それで頼んだんだ。（笑）
220,百八十四席もあるのに。郊外ののどかな山と田んぼに囲まれた中に写真家の父親が手作りで建てたらしい木作りのアメリカンハウス、庭には絵本の「おおきな木
221,、それが何の頭文字か、わたしは最後まで知りませんでした。彼は写真家で、千九百六十五年に屋根付きの橋を撮影するためにここに来たのです。その写真
222,と再度開催を希望しているところもあります。全国の自治体関係者や農家、一般市民、研究者、写真家が集まるので、垣根を越えた交流もこのサミットの楽しみの一つです。十日町市
223,子どもの本当の姿、本心が写っているんですよ。熊谷飯沢さんが『日本の写真家』（全四十巻・四十人）で書いてくれた文章があるでしょう。身に余る言葉だ
224,写し出されていた。話は変わるが、国内外の志の高いフォトジャーナリストたちが支援し、写真家の■■■■さんが二千四年に発刊したフォトジャナリズム月刊誌「ＤＡＹＳＪＡＰＡＮ」が創刊４年目を迎えた
225,としたカルチャームーブメントの十年をたどってみよう。（↓二百四十六）デイズド・アンド・コンフューズド’九十二年、写真家ランキン・ウォデールによって創刊。今年３月からは日本版も発刊されている。タップ界の若手カリスマアメリカから
226,た活動を促したともいえる。パウロさんと一緒に会う予定になっていたある写真家の男性は急に用事で来られなくなり、次のような伝言をくれた
227,ひとの脳中にまで侵入する生命力（亡霊に生命力もおかしいが）はない。他の写真家の頭にしつこくまつわりついて写真的感性を混乱に陥れ、シャッターを切れなくさせてしまうよう
228,会津の伝統野菜を守る会、財団法人・舘岩村農業公社、ＪＡ宮城中央会、ＪＡ仙台、有限会社・平野物産店たんの・きよし千九百四十四年生まれ。写真家。日本各地の農村を巡って取材を続けており、ここ数年、地場野菜を訪ねる旅を
229,互いに交わるか、または人間たちの力線と交差しているね。画家や作家と比べて写真家の利点は、人生のざらざらした面とのこうした接触なんだ。これが
230,毎日女の子が遊びにきて、ミックはいる？って聞いていたよ」ドミニク・タルレ（写真家）ＤｏｍｉｎｉｑｕｅＴａｒｌｅ千九百七十一年、写真家のドミニク・タルレは、コートダジュールの小さな港町ヴィルフランシュ・シュール・メールにあるキース
231,ようだ．年次報告書の写真選びは，厄介でしかも高くつく傾向にある．ニューヨーク高齢者住宅・サービス協会は写真家を雇う予算がないため，協会のニュースレターで告知，メンバーの援助を仰ぐ．メンバー
