,0
0,三十八ＣＥです。どなたか解決方法、アドバイスをお願いします。はっきりとはわかりませんが、冷蔵室の上の奥に霜を解かした時に排水するパイプがあれば、そこが詰まっ
1,だ。それとは別にわたしはメルセデスにごく小さな油彩画を一枚贈った。肉屋の冷蔵室にぶらさがっている牛の肉の列を描いたものだ。そのなかには、わたし
2,どっさり！シンプルで使いみち豊富ぎょうざのたね八百ｇ二百二十三円保存方法密閉容器か保存用ポリ袋に入れ、冷蔵室で２日、冷凍室で約３週間保存可。使う量ずつに分けておくとよい。ぎょうざやしゅうまいにしても
3,、ストレッチ。スポクラは今日は、ジャンプの多いエアロなのでドクターストップ。冷凍室に、冷蔵室から水漏れが。家電屋さんに左開きの冷蔵庫の取り寄せをお願いしてきました。２週間後に届く
4,し、余計な電気代もかからなくなってイライラも解消！」（Ｓ・Ｈさん福岡県）冷蔵室を１日五十回、冷凍室を１日十六回開閉する場合と、冷蔵室を二十五回、冷凍室を８回開閉する
5,温度が低くなります。アスパラはなるべく０℃に近い低温での保存が望ましいため、冷蔵室での保存がお勧めです。ただし、０℃以下に下がると凍結が始まるので注意してください。
6,縛り付けられるのは、ダニーだったかもしれないのよ。シェリーは解凍しておいたひき肉を冷蔵室から取ってくると、ガス台の脇にあるカウンターに持っていった。あの大ばか野郎。
7,（ＯＳＩ）に変換表４‐十一冷蔵庫のファクターを構成する項目庫内デザイン全体の容量冷蔵室の大きさ冷蔵室，野菜室などの室の種類の豊富さ野菜室の大きさ冷凍室の大きさチルド室の
8,解かした時に排水するパイプがあれば、そこが詰まっていませんか？または、冷蔵室の壁面に水滴が付いて下にたまっているようでしたら、ドアパッキンに隙間が出来
9,に変換表４‐十一冷蔵庫のファクターを構成する項目庫内デザイン全体の容量冷蔵室の大きさ冷蔵室，野菜室などの室の種類の豊富さ野菜室の大きさ冷凍室の大きさチルド室の大きさ機能（
10,うまみを閉じ込めてコクのあるおいしさにフライパンチャーシュー六百ｇ六百七十五円保存方法冷めたら煮汁ごと密閉容器や保存用ポリ袋へ。冷蔵室で２〜３日保存可。冷凍する場合は使う量ずつに切り分け、煮汁と別にして保存。
11,「大腸菌群」、腐敗や食中毒の原因にもなる「低温細菌」など５種類。各冷蔵庫の冷蔵室、チルド室、野菜室、冷凍室の底面や側面など、各十三カ所をふき取って調べた。最も
12,Ａをボウルに合わせ１を加えて混ぜる。このあと、盛りつけ用の皿と一緒に冷蔵室で十五分ほど冷やして！３パスタをやわらかめにゆでる。ゆで上がったらざるにとり、
13,ボウルの底にたまった砂をあさりが再び吸いこむことがない。いたみやすい夏場は、冷蔵室に入れて砂出しするとよい。２パスタをゆではじめる。３フライパンにオリーブオイルとにんにく
14,『弱』です（＾＾ゞ十分です〜〜ちゃ〜んと冷えるし凍るし！＾＾そして、冷蔵室の扉を開けると付く電気。我家は電球ごと外しちゃってます（＾＾ゞ電気付かなくて
15,ってうそです。誰が流したんですかそんながせねた。温度設定を弱にすると、冷蔵室では中で４℃とすると６℃位になるでしょう。ということ
16,したので見に行ったところ、九十五年購入の四百三十Ｌ４ドア冷蔵庫から音が聞こえた。一番上の冷蔵室を開けたら、上の部分から白い煙が上がっていた。すぐ電源プラグを抜いた
17,の贈り物のようにありがたい。スイセンとスプレケリアの取り合わせに満足し、アレンジした花を冷蔵室に詰め込む。地元の民宿から注文を受けたアイリスとチューリップと見栄えのする白ユリと
18,にアスパラを立てて入れ、冷蔵庫に保存します。一般的に冷蔵庫は、野菜室よりも冷蔵室の方が温度が低くなります。アスパラはなるべく０℃に近い低温での保存が
19,にして空気をしっかり抜いて密閉します。それを冷凍庫で保存します。解凍は冷蔵室に移して自然解凍。半解凍したぐらいで形が作れるので、普通の小判形のバーグで
20,。冷蔵庫を賢く使いこなせば、電気代だけでなく、食費の節約にもなります！１日に冷蔵室を二十五回、冷凍室を８回開閉。開放秒数を二十秒と５秒の場合で比較年に￥四百おトク
21,になります。臭いは同じ場所に合った生ものの臭いではないでしょうか？私は冷蔵室、チルド室、野菜室、冷凍庫それぞれに脱臭剤をおいています。
22,といっても、買い物ず〜といってなかったから、冷凍庫もこわれ、でも冷蔵室としてつかえるので、便利だわ。ははは・・・あ〜〜〜〜〜疲れた。
23,た。その時点で、江本所長は実験室を造ってくれました。畳一帖ほどの冷蔵室です。室内に冷凍庫（二十九ページ写真）を入れることもできましたから、これでだいぶ
24,で比較年に￥四百おトク！冷蔵庫にカーテンを付けて、ムダな冷気をシャットアウト「冷蔵室の内側にカーテンを付けたら、月の電気代が約二百円ダウン！古いビニールのテーブルクロスを
25,！」（Ｓ・Ｈさん福岡県）冷蔵室を１日五十回、冷凍室を１日十六回開閉する場合と、冷蔵室を二十五回、冷凍室を８回開閉する場合とで比較ひと夏￥九十おトク！使いかけコーナーを冷蔵庫に作っ
