,0
0,ようでございますけれども、そういうごみを処理する、どこか運んでいかなければならない。いわゆる処理場が破損したのじゃなくて、ごみそのものの処理の事業、これはいろいろ大変むずかしい
1,、下水道管理用光ファイバー網の整備により構築する。このため、通常の管理用光ファイバーに対する国庫補助のほか、事業場と処理場を光ファイバーで結び排水水質の常時監視を行うシステムを構築する事業を平成８年度から開始しているほか
2,重点的な使い方が必要なのではないか、私はそんなふうに思っております。一般廃棄物の処理場の補助率、一般的に、地方では四分の一と言われておりますが、本当につくら
3,、空間と資源には限りがあり、増えつづける一方のゴミの流れを処理するにも処理場の数は限られている、という点である。冷戦が終わった今日にあっては
4,能勢のダイオキシン、これはごみではなくして、ごみを処理していたところの処理場の処理ということにちょっと話を移させていただきたいというふうに思うのですが、個別
5,を持って行きましょう！下水道の正しい使い方洗剤は適量で！洗剤の使い過ぎは処理場の機能を低下させます。洗剤は適量にしましょう。パパ・ママ教室保健福祉部健康推進室（あいあい☎
6,の物品が肥料として使われる。すると、サナダムシの卵が野菜なら野菜に付着する。処理場では、熱が加えられていないから、卵は生きているのである。野菜は卵付き
7,旅館若しくは下宿、共同住宅、寄宿舎、公衆浴場、鉄塔、火葬場、と畜場、ごみ若しくは汚物の処理場、熱供給事業法（昭和四十七年法律第八十八号）第２条第４項に規定する熱供給施設、石油パイプライン事業法（昭和四十七年法律第百五号
8,たように実質的にアイソトープ協会だけでございます。ここが分散をしましてそういう処理場を設けるということは効率的ではないわけでございまして、全国のかなりな部分をそう
9,いて、宿主であるヒトの排泄物の中に卵がまじっている。排泄物はバキューム・カーによって処理場に運ばれ、乾燥されて、汚なくもなければほとんどくさくもないブロック型の固形物となる
10,問題がございます。したがいまして、原料つまり廃棄物をどうしてうまく収集をしてその処理場に持ち込むか、その持ち込むのもまた経費を使いますと高くなります。したがいまし
11,、石水渓野外研修施設窓口で直接お申し込みください。下水道の正しい使い方洗剤は適量で！洗剤の使い過ぎは処理場の機能を低下させます。洗剤は適量にしましょう。暮らしの情報ＢＯＸ無料住宅相談産業建設部建築住宅室（
12,が・・。途中でポンプ場を経由して、一度か二度標高をあげてから、処理場まで流します。河川の下などは、サイフォンの原理で通過させます。
13,，現状では，出されてきたゴミの量が，あまりにも膨大すぎて，処理場（焼却・埋め立て）では収まらなくなっているのです。この問題は，個人で解決できない
14,これらのなかには、各国民社会が希少資源を消費することや、廃棄物処理のためにグローバルな処理場を利用することに対して、効果的な制限を設けることを定める国際協定が存在している。こういっ
15,、上の人ミハイルではなくニコライが殺されるところです。さて、本題ですが、カードキーは処理場で追跡者（第２形態）との戦いに勝利してから、死体のポケットから滑り落ちます。
16,試みが行われてきた。下水道の処理法もそのうちの一つ。下水道の水は処理場に流れこむと、活性汚泥法によって浄化された後、排出される。下水道中の有機物を微生物に
17,と豊能町が一緒に組合をつくってやっている施設からダイオキシン、高濃度が出た、処理場が汚染されているので、それを技術でもって中和をして、安全にし
18,。４月は、大型ゴミを処分しないといけない。これは、弟と一緒に処理場に持って行く事にしている。地図で、場所の方は把握している。
19,越え，国を越えての越境廃棄物・廃棄物処分場の建設地これらの課題は，大量廃棄物の処理場の建設場所をめぐっての住民の意識（ニムビイ）が，解決を難しくしています
20,やっている事柄、具体的には、例えばこのケースとして挙がっていますのは、廃棄物の処理場に反対だとか、そういうイベントをするのは無駄だから反対だとか
21,の研究者らがここを舞台にマイクログリッドの実現に向けて動き出した。下水やゴミの処理場に設けたガス化発電装置や燃料電池、公共施設の屋根に取り付けた太陽光パネルや風力発電をすべて結び、
22,ています。↑環境にやさしい製品づくり↑郊外にできたアウトレットモール（千葉県）↓産業廃棄物の処理場［千九百九十八年］
23,わけなんですが、その点についていかがお考えでしょう。○中村（守）政府委員ラジオアイソトープの処理場というものが、特定の滝沢村以外のどこにもそのような適地がないというわけではない
