,0
0,ほどの注目の的。質疑にじっと耳を傾ける。それにしても、いつから参議院の委員会の現場は、こんなにも野次がうるさくなったのか？それも
1,三十日以内に選挙を行うという規定の例外措置といたしまして、これらの期間が国会または参議院の緊急集会の開会中または閉会の日から三十日以内にかかる場合にあっては、その閉会
2,での数字があるからです。彼ら３人の票が民主党から消えることで、参議院での採決が際どいラインとなるのです。結局、離党した３人は自分が所属する
3,を控えていた河本に一気に傾斜していった。そして、平成八年に河本は参議院から父親の地盤を継承して衆議院兵庫十二区に鞍替え。当選は果たしたが、対立候補にわずか
4,は順次御発言を願います。○田沢智治君私が質問をするに際しまして、まず参議院の文教委員会の構成員でありました森山眞弓先生がこのたび文部大臣に就任したこと、我が文教委員会全体を
5,解散するっていうのは、分かりにくいよな。まあ、残念ながら、小泉総理をもってしても参議院は解散できないんだよ。郵政民営化は前の選挙公約で、小泉政権の最優先課題だから、参議院
6,にも、多くの国民の中にもまだ根強くあって、結局、この再建計画は参議院で廃案になってしまったのである。
7,、参議院で過半数を獲得するためには二十三議席が必要であった。そのとき、公明党の参議院での議席数は二十四。公明党が、自民党の提出している金融機能早期健全化緊急措置法案に賛成すれば法案を成立さ
8,郵政民営化の件ですが、なぜ参議院で否決されると衆議院を解散するのですか？衆議院で可決されているのですよね？それ
9,、小泉氏が、かねて主張するとおりに郵政民営化なる政策を実現したいと熱望しているのだとすれば、参議院で否決されたことは、大変残念なことでしょう。あらかじめの票読みで不可能だと
10,思います。それから次は、二院制の問題で、現行憲法上、一院が衆議院、二院が参議院と、こういうことになっております。参議院のあり方についても憲法上考える余地はないのか
11,がある。野党の民主党は典型的な動乱型のパターンになっている。実際には、参議院や各派閥を率いる首領の性質を加味しなければならないが、以前の数値と比較して見ると
12,大仁田厚先生はどんな仕事してますか？郵政民営法が参議院で否決して暴動になったときに備えて、体を鍛えていると思います。
13,千九百四十八）年二月の衆議院では、芦田が二百十六票、吉田が百八十票だったが、参議院では吉田が百四票、芦田が百二票になるという逆転現象が起こった。衆議院の優位性
14,の状況と同時に、自己の信念や衆議院よりも長期的な視野に立つために、参議院の任期は保証されているのです。ということは、衆議院議員と同じ質の政治家
15,感じているわけであります。したがって、今この委員会で審議をされました、あるいは参議院も含めて衆参全体で審議をされました答弁の内容、また、ほぼコンセンサスが
16,ということでしょうか。○政府参考人（塩尻孝二郎君）今委員御指摘のとおり、川口当時外務大臣が衆議院の外務委員会あるいは参議院の外交防衛委員会で、在勤手当に関する基礎資料となる各種データを外務省のホームページに公開していくというお考えを
17,この法律も審議の途中で機関委任事務になりかけたのです。去年（千九百九十七年）の十一月末、参議院で自民党が「機関委任事務にしよう」と言い出したのです。私は、「機関委任事務にする
18,、公明支持層の票がなければ当選しなかった候補が大分いると思われます。さらに参議院では自民党は単独過半数の議席をもっていません。公明の議席とあわせて
19,憂いて書いた論文が最優秀作品に選ばれた田母神空幕長は更迭、退職させられた。参議院の外交国防委員会に参考人として招致されたにも関わらず冒頭からその発言は封じられた
20,し、質疑を行います。質疑のある方は順次御発言願います。○竹村泰子君先日来、参議院でも国旗・国歌の審議が始まりまして、それぞれの立場でいろいろ御議論がございました
21,国家的な事業についての便益考査がなかったかというと、これは皆さん、私も参議院にかつていましたが、割と年次として新しい方がおられるし、その方々は
22,バレンタインのように特定の日に特定の相手とデートするようなことを禁止する法律が参議院で通ったというのをネットで目にします。本当なんですか？本当なら
23,質問をしたいと思います。まず、皆様御存じだと思いますけれども、この参議院の法務委員会というのは、かなり死刑制度について真剣な議論が以前より行われてまいりまし
24,が決議されました。ｐ百三十三参照）、同月二十二日に衆議院本会議で議了しました。参議院においても、国土交通委員会で５月二十日に提案理由説明が行われ、同月二十二日及び６月３日に委員会質疑
25,いずれ選挙に出馬しそうな有名人を教えて下さい。宜しくお願いします。オトタケさんは参議院出そうな気がしませんか？スポーツキャスターより向いてそうな・・・。
26,中島洋次郎、中山成彬、額賀福志郎、野田実、原田義昭、細田博之、茂木敏充、山口泰明、山本幸三〈参議院〉加納時男、陣内孝雄、須藤良太郎、中島眞人、成瀬守重、畑恵（千九百九十八年８月二十七日付）
27,を可決されたものを参議院が再度可否を投票で決議します。今回の郵政法案は参議院で否決されました。小泉総理はこれを国民に再度可否を問うために内閣、衆議院
28,地域代表的性格という特殊性から、衆議院の場合よりも大きな格差を許容しています。判例からすると、参議院の場合は、１対６ぐらいが基準のようですね。
29,あるようです。ひとくちに国会といいますが、正確にいえば国会は衆議院と参議院の二院制をとっています。国会の議決事項は原則として衆議院と参議院の両方の賛成多数
30,の行き過ぎとかあるいはまた国民の監視とか良識、そういうものをあらわすのが参議院である、これが二院制の本来のあり方であったはずです。それが緑風会とかいろいろ
31,述べた国会決議についてお触れになりましたが、御指摘の昭和二十九年の決議、あれは参議院において有権的に解釈は行われるべきものである、私もそう考えておりますけれども、
32,それに関係ある条文について簡単にふれておこう。まず、臨時大総統副総統の選出については、参議院から選挙され（二十九条）、その地位は「臨時政府を代表して政務を総攬し、法律
33,はすべて１人区ですから、１議席減らされたら議席がなくなってしまいますよ。まあ、参議院は３年ごとの半数改選のため、すべての都道府県の定数が偶数になっているということに
34,小泉首相の選挙区に民主から刺客がでましたが現役参議院議員じゃないですか？参議院辞めたらまた補欠選挙で血税を使うのですかほんと民主党のやることは国民をバカ
35,、私の質問を終わらせていただきます。○木庭健太郎君野党の御協力によりまして、参議院で今日からこの地方自治法の改正の審議ができているわけでございます。今日を開始
36,際ちょっと意見をもう一遍申し上げさせていただきたいと思います。きょう、御承知のように参議院に送付された法案が、公布の日から発効するという修正案となって衆議院に回付さ
37,利用されている。この実事は承知をしていただかないと、総理がお見えになる席上での参議院での答弁と食い違いますよ。そこを承知をしておるのかどうか。今
38,問題で、現行憲法上、一院が衆議院、二院が参議院と、こういうことになっております。参議院のあり方についても憲法上考える余地はないのか。一院である衆議院が政党政治と、こう
39,ね。やがて、いずれの形で、メディアも媒体としてあるわけですから、参議院は参議院の委員会としてのひとつ所見というものを是非お聞かせ願いたい。委員長、よろしくお願いいたします。○
40,役割を果たすべきであるか、という点にまでさかのぼって考えなくてはならない。私は、参議院はあくまでも「良識の府」として、独自の役割を持つべきだと考えるが
41,わずか一カ月後の四月三十日解約され、ロイヤルメドウを通じて全額長銀に返済された。これは堀江証人も参議院の証言で大筋を認められておられます。こういうこともあったのですか。そのとき
42,具体的に言えば、この標準基準を改正することだというふうに思います。私ども民主党は、参議院に現在、三十人以下学級という議員立法を出しています。三十人以下学級というのは時代の要請でも
43,たのです。その中に信用組合のことも随分議論されて、そして附帯決議に出る。参議院でも同じように昭和四十六年の二月からこの法案を始めておるときも大議論をさ
44,で衆議院と参議院の特別委員会の趣旨が違っても、私は良識の府であるこの参議院の委員会としての権威としての回答をいただきたいと思うんです、国民に向かって。
45,中心として）を告発してきました。最初の質問は千九百七十六年５月、沓脱タケ子議員が参議院でおこなった質問でした。以来二十八年が経過しました。この間、政府は個別
46,同じであるならば、選ばれた結果もほぼ同じになるはずです。衆議院と参議院、二院ある理由は、参議院が衆議院のチェック機能を果たす、ということと同時に
47,ていると思うんですよ。私たちも、もうじき政権交代になりますから、そしたら参議院でも大臣出れるって、でも厚生労働大臣だけは断ろうねという話をするぐらい、ここの
48,ます。そこできょうは、この問題についてもう少し立ち入って議論したいと思うのです。参議院の土地特別委員会で、西新宿の地上げ問題に関連して、今申し上げた農林中金系の協同住宅ローングループ三社、協同住宅ローン
49,、民主党、社民党は無所属議員の賛同も得て、選択的夫婦別姓制などを柱とする民法改正案を参議院に提出し、早期実現をめざして国会内で発表する集会を開きました。改正案は、
50,あと衆議院でも会期末まで十七日しかないですね。慣例でいけば、衆議院で二十日間、参議院で二十日間、普通のところでも審議が要る。ところが、一メーターもある書類をわずか
51,た形で、メディアも当てにならないところもあるけれども、良識の府である参議院の特別委員会の見識というものをお答えいただきたいんですが。先般も、新しい官邸が誕生いたしまし
52,。―まあ、辞める状況も違いましたけどね。馳うん。俺は参議院の本会議に出席しない、と決めたんだ。その本会議で「馳浩くんから辞職願いが出さ
53,を除き、当該文書が同号ロに掲げる文書に該当するかどうかについて、当該監督官庁（衆議院又は参議院の議員の職務上の秘密に関する文書についてはその院、内閣総理大臣その他の国務大臣の職務上
54,の優越の原則から、法案は通るのではないのですか？解散させるぞ、とおどして参議院を通過させたいから。参院で否決されて衆議院に差し戻されと、２／３の賛成票
55,ているんですが、ここで私が懸念をしておりますのは、今、財政構造改革が参議院で審議されておりますが、この枠の中で今後この障害者プランの完全達成、拡充が
56,開いた。民主、公明、共産の各党の代議士らが参加。衆議院を通過し、参議院に送られた両改正案の対応について論議した。建物区分所有法の改正案では、建て替えの
57,）年十一月，公職選挙法一部改正による国会の組織憲法は，「国会は，衆議院及び参議院の両議院でこれを構成する」（憲四十二条）として，「両院制」（二院制）を
58,ましたので、それについて答弁をさせていただきましたし、私は三月三十日の参議院の国土交通委員会で、哀悼の辞を数度にわたって述べさせていただいております。こういうことだ
59,日本国憲法第四十一条）衆議院参議院国立国会図書館［議員］国会は戦後、貴族院が廃止され、衆議院と参議院となり、衆議院議員、参議院議員が有権者の選挙により選出される。衆議院議員の任期は四年、
60,けれども。私も平成四年まで治安機関にいたんですが、その後平成七年に参議院に初当選しましたときに、アメリカ大使館の人が、当選後間もなくであったと思う
61,そうした新たな状況にふさわしいものに発展させる必要があります。千九百九十八年の参議院の比例選挙で日本共産党は八百数十万票を獲得しました。そのうちの四百万は出口調査によれば経営で
62,は、議長は、既に弔詞をささげました。ここにその弔詞を朗読いたします。参議院はわが国民主政治発展のため力を尽くされさきに農林水産委員長の要職に就かれまた国務大臣
63,特別な事情があったからこそこういうふうなことになったので、本来は衆議院、参議院の性質なりなんなりが違うということからいいましても十分慎重に考えなければならないことではない
64,な政治情況からいえば、袁世凱の大総統就任はもはや避けられず、じじつ二十四日には、参議院は臨時政府を北京に移すことを決議し、十八日には蔡元培らを「迎袁」特使として北京に
65,法律」あるいは議院の同意を必要としたのである。これに対して大総統を拘束する参議院は、第十九条に職権を定め、「参議院は臨時大総統に対して謀叛行為があると認めた時
66,どうか、ちょっとお尋ねをさせていただきたいと思います。○奥田国務大臣実は、きのう、参議院の文教委員会がございまして、その席で参議院の文教委員の先生からそのお話を聞き
67,か？確かに、反対派にとっては一面では脅迫でしょうね。ただし、参議院議員は、参議院の解散はないので、次の選挙までは心配ありません。それまでには
68,についてはどういうふうにお考えになられますか。○嶋崎国務大臣御承知のように、参議院の場合には一人の人が六年、三年ごとに交代で行われるという選挙、先ほど
69,（独占禁止法改正の動きについては第３独占禁止法改正の動き参照）。下請法の一部改正案は，公明党から参議院に議員提案され，第七十六回国会においては商工委員会に付託の後審査未了となり（「下請代金支払遅延等防止法の一部
70,参議院、衆議院って何？？？ベルトみたいなのが参議院、台風の赤ちゃんみたいなのが衆議院。。。。
71,その議論を詳細に申し上げる必要はないかと思いますけれども、その際、この参議院の法務委員会でも六項目の附帯決議が付されております。その第一点目が、「本邦在留の
72,田村は、永野の自衛隊時代の後輩で、航空幕僚監部装備部長、航空自衛隊幹部学校長を歴任し、平成元年七月の参議院で初当選を果たした。防衛大学校を卒業後、京大工学部博士課程修了し、アメリカへ技術連絡官として派遣されるなど
73,の要請による検査報告というのがあるんです。「会計検査院は、各議院又は各議院の委員会若しくは参議院の調査会から国会法第百五条の規定による要請があつたときは、当該要請に係る特定の
74,を国権の最高機関であり，国の唯一の立法機関であると規定した．国会は衆議院と参議院の両院で構成され，それぞれが全国民を代表する選挙で選ばれた議員で組織される
75,ございます。○稲葉（誠）委員そうすると、衆議院が解散をされて参議院の緊急集会が仮に開かれるとしますと、議員の身分を持っている人で
76,と思う。ただ、どのような選挙制度にするかは、なかなか難しい問題である。参議院がどのような役割を果たすべきであるか、という点にまでさかのぼって考えなくてはならない。
77,努力については、敬意を払うにやぶさかではないわけであります。きょうは通産大臣が参議院の方に行って、来ておりません。したがって、通産大臣の本委員会への出席が
78,を国会に提起するときは、主権者、国会にていねいに説明する必要がある。千九百五十四年、参議院の『自衛隊の派遣をなさざることに関する決議』に、首相は、あのときの
79,何で郵政法案が参議院で否決されると衆議院を解散するんですか？参議院を解散すればいいのではないですか？郵政法案が参議院で否決されると衆議院を解散する・・・
80,実際に、これまで一度も捕獲枠が見直されたことはありません。先般の参議院での水産庁による御答弁では、水産庁ではトドを絶滅の危機に瀕している種
81,は、今後十分な検証を行い、必要な見直しを行うこと。」。これは参議院の方の附帯決議ですが、衆議院の方についても同等な内容のものが付され
82,の選挙の仕方にとらわれずに、じっくりと考える必要がある。いずれにせよ、参議院の自己改革努力も大切だが、国民がもっと参議院のあり方について、真剣な関心を持ち
83,（マジック）選挙であったことを多くの国民は、見抜いているのである。その結果が参議院での民主党をはじめとする野党に多数を与え逆転せしめたのである。今、自公政権
84,商工大臣として、詔書に当日署名をいたしました。○松本（七）委員先週の参議院の予算委員会における総理大臣の、新条約第五条にいう「武力攻撃」に関する答弁の言葉をそのまま
85,の質疑及び採択を経て、十二月２日衆議院本会議において全会一致で可決された。また、参議院においては、参議院世界貿易機関設立協定に関する特別委員会（参ＷＴＯ特委）における十一月二十四日から十二月８日までの間の６日間
86,では二回も行きまして、同じ話なんでもういいだろうと言いましたら、参議院の与党の某大幹部が、衆議院と違って参議院ははるかに品がいいし、良識
87,もそういう思いにはなっておりました。○桜井委員次に、三月の二十九日の参議院における証人喚問で高橋さんは、今あなたも触れたけれども、高橋さんは、同時に、
88,ことは国民をバカにしてますね？比例のトップにおいてくれますから、立候補者は参議院から衆議院に確実に鞍替えできるわけです。小選挙区で落ちても衆議院議員♪うれしいでしょうね。
89,されます。著作者の不利益にならないように注意しなさいということでございまして、参議院においてもそういう意味での附帯決議がなされたところでございます。しかし、これ
90,ていますでしょうか。木島則夫モーニングショーにでてた人。坂本スミコと結婚していたけど離婚。参議院に出馬したけど落選したのかな？今は、料理研究家の栗原はるみのだんならしい。
91,なる。これまでの自民党に見られるような派閥の弊害も是正されるだろう。参議院の選挙制度も、いずれは抜本的に改められるべきだと思う。衆議院と同じように
92,お答え願いたいと思います。これも同僚議員がお聞きになった問題ですが、五十六年四月二十一日の参議院の議事録を見ますと、わが党の近藤忠孝委員の質問に対して、当時の渡辺喜一政府委員が答え
93,ね。その次が不況業種を対象にしているのです。今年度になりますと、いま参議院で御審議いただいておりますけれども、特定不況業種対策が生まれているのです。通産も、労働も、雇用構造
94,、現状は自由民主党だけで法律を決められるという時代ではございません。それは参議院の議院構成を見ればすぐわかることでございまして、当然にこれは与党でおやりになる
95,はないのでしょうか？実際、衆議院では野党側で２名の欠席者がいたから。参議院でもその可能性がある。しかし、マスコミはそのことに一切触れないのだから、
96,年金を財源にレジャーセンター造るのやめた方がいいんじゃないかと、昭和五十年にちゃんと参議院では言っているんですね。それに対して、当時の田中大臣が答弁で、言っている御趣旨
97,だいたい議員、多すぎません？参議院議員って必要？参議院を不要のものにしているのは強行採決をしまくった与党の功績です。衆議院の
98,参議院の権限を縮小させる憲法改正も考えている。具体的には明示されていないが、参議院の首相指名権（六十七条）の廃止。さらに法案成立における参議院の成立阻止権（五十九条）を弱める意味
99,三分の一に相当する金額とするものであります。本委員会におきましては、去る四月二十四日参議院における修正部分についての趣旨説明を聴取し、以来参考人から意見を聴取するなど慎重に審査を重ね
100,制度）。また首相のみ提起ができる閣法に対する国民投票（レファレンダム）制も導入。また参議院の権限を縮小させる憲法改正も考えている。具体的には明示されていないが、参議院
101,善処すると言った、そのことは東京都の信用組合課に書類があるはずだという証言を参議院の方でされているわけですが、かなり食い違っているわけですね。東京都の方
102,区分され、本予算（当初予算）・補正予算・暫定予算などの種類がある。２予算について、参議院で衆議院と異なつた議決をした場合に、法律の定めるところにより、両議院の
103,なお、予算の提出権は内閣に専属しているが、本会議において、衆議院は五十名以上、参議院は二十名以上の賛成があれば、国会において予算の政府案を修正する提案を行うことができる。
104,お尋ねをすることではないと思います。しかしながら、もう余り日にちはないわけですね。参議院でも審議をしなきゃいかぬわけですね。そうしますと、十二月八日の
105,〇よって、本案は全会一致をもって可決されました。○議長（井上裕君）この際、参議院事務局職員定員規程の一部改正に関する件についてお諮りいたします。議長は、本件につきまして議院運営委員会に諮り
106,ので、お答えする性格のものではないと考えております。○平野貞夫君それでは、私たちは今後、参議院では野党が一致すれば野党が多数でございますので、刑訴法の四十七条ただし書きというよう
