,0
107,そして、驚くべきことにというか、ぜひ注意しなくてはならぬのは、さらには衆議院、参議院の両方の大蔵委員会の附帯決議、衆議院ではこう書いてある。衆議院の附帯決議に、「
108,状況を防止するために，衆議院に法律案・予算案の議決や，条約の承認，内閣総理大臣の指名において参議院よりも優越する地位を認めている。これを衆議院の優越という。また，内閣不信任決議権を
109,の重要課題とされております三Ｋのうち、国鉄は分割・民営と決定し、健保も現在参議院で審議されております。しかしながら、食糧管理の問題は残ったままになっております。
110,五十人、参議院四十五人）のような大規模な委員会もあれば、懲罰委員会（衆議院二十人、参議院十人）のような小規模な委員会もある。複数の省庁にまたがるような議案や
111,この一貫教育に関するお考えをまずお伺いをしたいと思います。○奥田国務大臣中高一貫教育、きのうも参議院の文教委員の先生方からいろいろお尋ねいただいたわけでありますが、率直に申し上げてやはり私は
112,―百二十四頁、馬君武の殴打事件については居覚生前掲書百十一―百十二頁参照）。すでに述べたように、参議院に設立された編輯会議はこの臨時約法の審議に一ヵ月余りの期日を費したが、
113,てしまう点です。すでに述べたように、衆議院は「小選挙区＋比例代表」で、参議院は「選挙区＋比例代表」です。選挙区の大きさに若干の違いはあり、また比例代表
114,において、国会が閉会中又は衆議院が解散中であり、かつ、臨時会の召集を決定し、又は参議院の緊急集会を求めてその措置を待ついとまがないときは、当該支援の受入れについて必要
115,国会は衆議院と参議院の二院制をとっています。国会の議決事項は原則として衆議院と参議院の両方の賛成多数が必要です。衆議院と参議院が異なった議決をした場合、
116,一般会計及び特別会計とする。〔予算の作成〕第二十一条財務大臣は，歳入予算明細書，衆議院，参議院，裁判所，会計検査院並びに内閣（内閣府を除く。），内閣府及び各省（以下「各省各庁
117,国務大臣（中尾栄一君）私は、先ほどから先生の御高見を聞いておりまして、非常に参議院の商工の先生方が御勉強なさっておられることはつとにいつも腹の中に考えておるので
118,、諮問第一号に係ります人権教育、啓発の基本的事項については二年を目途にという衆議院及び参議院の各法務委員会の附帯決議を踏まえまして、人権教育、啓発に関する施策を中心に調査、審議
119,十一日に投票がおこなわれた第四十四回衆議院選挙は，郵政民営化関連法案が，与党自民党議員が一部反対に回ったために参議院で否決されたのを受け，小泉総理大臣が衆議院を解散する，という異例の経緯を経
120,郵政民営化法案ですが、これで衆議院は可決でしょうが、前のように参議院で否決されないのでしょうか？国民が出した結果が賛成なんだからと考えを
121,、国土庁長官が主催する「首都機能移転問題に関する懇談会」を開催した。４）平成２年十一月７日衆議院及び参議院において、「国会等の移転に関する決議」が議決された。５）平成２年十二月４日
122,改選とか非改選の意味が分かりません。今回参議院の選挙のニュースを見ていて疑問に思いました。初歩的な質問で申し訳あり
123,の人で、なんていったかな…。市会議員をやった人で、昔、参議院の勝俣稔さんの秘書なんかやった人…松野…松野…」「松野良平さんでは？
124,決定権は党の総裁にあります。この選挙結果を受けて、一番震え上がっているのは参議院で反対票を投じた議員でしょう。世論を参考にしたと言い賛成票を投じる議員
125,、実質的にも法律案の場合より強い優越性を持っている。すなわち、予算については、参議院が衆議院と異なった議決をした場合には、必ず両院協議会を開き、それでも意見
126,野党法案も衆参に提案されていますが、二千三年通常国会では衆議院で参考人質疑を行ったものの参議院はまったく審議に入れませんでした。自民党などの保守勢力に、家族制度の崩壊に
127,こういう答弁を田中総理は当時されております。それから、これは昭和五十六年の三月、参議院の予算委員会で、当時の大村防衛庁長官が答弁をされているのは、「専守防衛とは
128,な、そういう制度を取るべきだとかねがね主張しております。是非そういう、この参議院でも寄附税制についてお考えいただきたい。そうしますと、自分の好きな、例えば今東京
129,「憲法調査会」を設置するための「国会法改正案」と「憲法調査規定案」が千九百九十九年７月７日に可決、参議院でも同様の調査会が設置され、二千一年１月の通常国会から調査会活動がスタートしました。
130,法律の定めるところにより、両議院の協議会を開いても意見が一致しないとき、又は参議院が、衆議院の可決した予算を受け取つた後、国会休会中の期間を除いて三十日以内に
131,に膨張をしてきているという姿となっているわけですけれども、そこで昨日も参議院の本会議で、日米首脳会談の評価、それに対する総理の答弁漏れというか、答弁拒否、これ
132,一種の金融特別措置でございまして、ぜひともこの三月三十一日に間に合うように御審議をお願いし、参議院まで通していただいたらありがたいな。決算は五月でございますから、法律が通ったこと
133,出すまい、こういう姿勢が一貫して見受けられる。同じ表題の文章を、衆議院と参議院で別々の内容に取りかえて改ざんをしてきた。そこにやっぱり通産行政の問題点が
134,思います。○奥田国務大臣実は、きのう、参議院の文教委員会がございまして、その席で参議院の文教委員の先生からそのお話を聞きまして、今先生がおっしゃっております本の中身
135,は、国会の承認（衆議院が解散されているときは、日本国憲法第五十四条に規定する緊急集会による参議院の承認。以下本項及び次項において同じ。）を得て、自衛隊の全部又は一部の
136,で御理解をいただくという意味で、最終的に採決という形で決着をつけさせていただき、参議院に参りまして、非常に熱心な長時間をかけた御審議の中で段々の御議論
137,訴え、食糧の自給の大事さを強調したものであったというふうに思っております。参議院の決議の中には「完全自給」という大変明確な表現も入っておりますが、
138,。労働界から三人出て、三分の二は官僚ＯＢ、三分の一は財界の皆さん。玉置長官もよく参議院のころに言われておりましたように、原案が出ますと、大体原案が
139,」も含めて検討する旨の一部修正の上、同年十二月に可決された。その後参議院に送付されたが審議時間がなく継続審査となり、二千（平成十二）年の通常国会
140,してくれ！」との悲鳴と批判が浴びせられる。そこで、雇用関連４法案の参議院での強行採決を行い、今度は衆院解散・総選挙を求める決議案を衆院に提出する方向のようだ
141,に発信し、同時に国民から広く憲法に関する意見を聞けるようにするために、現在の参議院のホームページに、開かれた憲法調査会にふさわしい専用ページ及び専用Ｅメールボックスを直ちに開設していきたいと存じ
142,国会では衆議院にだけ認められている。２衆議院が解散されたときは、参議院は、同時に閉会となる。但し、内閣は、国に緊急の必要がある
143,法案を通すことができない自民党政権は、金融危機への対応能力を失っていた。自民党は、参議院で過半数を獲得するためには二十三議席が必要であった。そのとき、公明党の参議院で
144,衆議院の予算委員会で詳細に審議され、さらに本会議で審議、議決される。その後、参議院に送付され、同様の手続きを経て予算が成立する。なお、予算については
145,はない。決算の審議は、決算委員会の審査によって行われる。審議は、衆議院と参議院とで別個に進められ、その結果、適正とみなされれば政府の予算執行責任が解除さ
146,確かなんですね。だけれども、今まで十二年間やってこれだけ、例えば衆議院で百三十二回、参議院で七十九回委員会が開かれて、それを全く無駄にしてしまうということもどうかな
147,特別議席があればとの思いは持っておりました。それが昨年、萱野茂さんが参議院に議席を得られました。私どもにとっては、これは大変大きな喜びでありまし
148,国会の開会式は参議院で執り行なわれるし、天皇陛下がお座りになる「玉座」があるのも参議院だけ（へぇ〜）。衆参で議員バッジのデザイン・値段も微妙に違えば、速記者の使う
149,か。一院である衆議院が政党政治と、こういうことになりますれば、衆議院を補佐する、監視する参議院は、むしろ政党政治の枠から離れて個人中心のものにすべきではないのか、こう
150,も海外の動きに刺激され、国会テレビ構想が浮上した。あまり知られていないが、参議院では一昨年の五月の予算委員会審議が中継された。衆議院でも昨年一月から試験放送を
151,今の日本で、参議院と衆議院が２つ保たれている必要があるのでしょうか？私はないと思います。
152,にするためにも厳正な処分をしなきゃならぬ、こう考えまして、これは参議院でも、あれは予算委員会に提出したのでございましたでしょうか、内部調査の結果と
153,た独占禁止法改正法案は，同年６月二十四日に衆議院において全会一致で一部修正の上可決されたが，参議院において審議未了となった（この間の経緯については，昭和四十九年度年次報告参照）。その後
154,で質問を提起していたのですけれども、あわせて質問させていただきたいと思います。参議院での附帯決議に盛り込まれました、障害者が著作物を享受する機会の確保ということです
155,の議会にたいてい二つも議院があってチェック・アンド・バランスなんていってるが、日本で見れば参議院など今じゃただのカーボンコピーだし・アメリカの二院制も下院が実質的にはただの
156,て、昭和六十三年五月十九日、不動産登記法及び商業登記法の一部を改正する法律案に対する附帯決議というのが参議院の当委員会でございます。その中に、第五項「登記情報システムへの移行のための経費
157,いう点は指摘できます。それは、現在の日本の選挙制度では、衆議院と参議院という二院の存在価値はなく、どちらか一つあればいい、ということになってしまう
158,で否決されると衆議院を解散するんですか？参議院を解散すればいいのではないですか？郵政法案が参議院で否決されると衆議院を解散する・・・法案を可決した衆議院を解散するっていうの
159,（昭和二十七年）三月六日、到るところで憲法問題の質問攻めに遭い、たまりかねた吉田首相が参議院の予算委員会で証言し、憲法は「自衛のための戦力は禁止していない」と次
160,できるようにということで、ＥＹＥマークの運動をなさっているということをお聞きしました。参議院では日下部議員が丁寧にお話しされ、マークも皆さんにお見せしていらしたようでした
161,来年の選挙も以前と変わらぬようにお任せをいたしますので、是非、職域代表を参議院に送っていただきたい」と話した。青木は座談会で、日歯連が当時、反対し
162,ております。○中尾国務大臣草川委員、この間の土地問題対策委員会、衆議院にはその委員として、また参議院では傍聴されながら、熱心に討議を重ねたことを私も熟知しております。
163,検討の中間的なとりまとめが行われたところである。また，平成２年十一月７日衆議院及び参議院において議決された「国会等の移転に関する決議」を受けて，首都機能移転及びこれに伴う
164,ていたとみることもできる。九十三年十一月十八日に衆議院を通過した法案は、参議院に送付されたものの、法案可決に消極的な自民、社会両党の水面下での協力もあり
165,かけ続けた。しかも海部内閣では、厚生大臣でありながら薬害エイズを放置した。そればかりでなく、参議院のＰＫＯ特別委員長として、自衛隊の海外派遣を強行し、アジア各地から危険視される今日の日本人像をつくりだした
166,ました」に見えるんですよ。馳あのパフォーマンスもマイナスだよな。俺も参議院のバッジを外した経験があるけれども、あんなことはしなかったよ。―
167,ですが、これは次は高校生の通学費問題です。これは四十九年の九月の十日の参議院の運輸委員会で私どもの岩間委員が質問いたしました。北海道の例を出して質問いたしました
168,には、確定給付企業年金法が参議院本会議で成立、〇二年四月一日施行した。確定拠出年金法は六月二十二日に参議院で成立、同年金は企業型年金（事業主実施）と個人型年金（国民年金基金連合会実施）の二つの制度が設け
169,ことができるわけでございます。この点につきましては、昭和五十四年の三月十三日に参議院の予算委員会におきまして、当時の内閣法制局長官の方から、私立学校法、私立学校振興助成法等の制定の
170,というプロジェクトの整合性というものをまず私はお聞きしたい。いずれ、その時点で衆議院と参議院の特別委員会の趣旨が違っても、私は良識の府であるこの参議院の委員会として
171,消費税の税率引き上げを自民党が多数を占める衆議院で可決しても、野党が多数を占める参議院が否決してしまえば、「国会の同意は得られなかった」ということになり、税率引き上げ案
172,，同年，衆議院に憲法調査特別委員会が置かれた。国会の構成と運営国会は衆議院，参議院の二院からなっている（二院制）。衆議院議員は任期４年で，解散もあり，参議院議員
173,の一致をみないときは、衆議院の議決が国会の議決となる。また、参議院が衆議院の可決した予算を受け取った後、（国会休会中の期間を除き）三十日以内に
174,者を証人として職務上の秘密について尋問する場合には、裁判所は、当該監督官庁（衆議院若しくは参議院の議員又はその職にあった者についてはその院、内閣総理大臣その他の国務大臣又は
175,ます。法律案が自民だけの賛成で衆議院を通過しても公明の協力がなければ参議院で否決されてしまうのです。
176,かつての（といっても私が在籍したのは今から８年前だが・・・）参議院は、それこそ良識の府として、落ち着いた雰囲気での審議だったのだが。
177,れ、その中で三十日間の周知期間を置くことが決まったため、一時は日程的に参議院との同日選挙が不可能になったと誰もが思った。だが、中曽根首相は「
178,ことなく承認されたといえよう。憲法制定の審議はさきの孫文提唱の会合の後、参議院によって編輯委員会と名づけられた起草会議が組織され、以後二月七日より三月八日に全案が
179,，少なくとも１票の価値を１対２未満にまで是正することは，国民に対する国会の責任である。参議院については１票の格差問題はより深刻である。また，選挙活動をめぐる事実上の買収や供応
180,だと思う。衆議院と同じように選挙をするなら、政党本位にならざるを得ないが、参議院が衆議院に対して独自の立場を持つことを重視すれば、政党以外の良識を代表する場であっ
181,役割を果たすことを難しくしている。そうした点にも目を向けながら、参議院の役割と選挙の仕方を、衆議院の選挙の仕方にとらわれずに、じっくりと
182,負の遺産だと思っておりますが・・どこの国の参議院だ？日本の参議院はそういったところじゃないよ。よく調べようね。つぅか、そんなのあったら
183,言われております。その意味では、今、赤桐先生がおっしゃったように、この参議院において、まさに日本の良識というものを、国会は国権の最高機関であり、代表機関である国会議員
184,はこれからなされていくだろうと思うんですけれども、その中で、やっぱり衆議院と参議院の役割分担の問題もあるいは定数の問題もいろんな形で影響してくると私は思う
185,は、翌五十六年（同三十一年）の参院選には、推薦候補者六人を立て、うち三人を参議院に送った。また、翌年の参院大阪地方区の補欠選挙にも、候補者を立てた。
186,三十人から四十人、参議院では二十一人のものが多い。ただし、予算委員会（衆議院五十人、参議院四十五人）のような大規模な委員会もあれば、懲罰委員会（衆議院二十人、参議院十人）
187,ようだが、どなたかの指示で、それはご破算。これも、ねじれ国会ゆえの参議院の姿。この真実を麻生総理も直視すべきだろう。さて、今回は一般的な
188,。国会の議決事項は原則として衆議院と参議院の両方の賛成多数が必要です。衆議院と参議院が異なった議決をした場合、衆議院の議決を優先するケースがまったくないとは
189,質問ですね。やがて、いずれの形で、メディアも媒体としてあるわけですから、参議院は参議院の委員会としてのひとつ所見というものを是非お聞かせ願いたい。委員長、よろしくお願いいたします
190,三十三条）、「文武職員」の任命及び「国務員及び外交大使公使」を任命するが、いずれも参議院の議決もしくは同意を必要とし、さらに「宣戦講和及び条約の締結」、「戒厳」令、
191,という期待、要するに期待値としての支持率だといわれたものだ。しかし、政治改革関連法案を参議院に送り、税制改革や規制緩和などの行政改革にも着手し始めた今日において、なおこれだけの
192,ではありますけれども今度ふやされるということになっております。しかし、千九百七十五年七月に参議院の文教委員会で、高校、大学の経常経費の二分の一を補助する、そういう国会決議がございます
193,かという問題のあるところであります。人権擁護推進審議会におきましては、現在、衆議院、参議院の各法務委員会の附帯決議を踏まえまして、人権教育啓発施策についての調査、審議を中心に行っている
194,では、衆議院と同じ直接選挙制で、権限も衆議院とほぼ対等になっているので、参議院を重視しているように見えながら、実は参議院が独自の役割を果たすことを難しくし
195,衆議院と参議院がありますが、小泉首相はどちらですか？また、首相に選ばれるのは衆議院
196,に閉会となる。但し、内閣は、国に緊急の必要があるときは、参議院の緊急集会を求めることができる。緊急事が重大で、急ぐ必要のあること。また、
197,参議院だー衆議院だー与党だー野党だー公明党だー自由民主党だー小泉派だー
198,引き続き内水対策を推進していくことといたしております。特に、今、紀尾井町の方でも参議院の議員宿舎の下に大放水路をつくっておりますし、この間私も大阪でも、
199,なんですという御答弁でした。今、局長は違っておりました。今たまたま長官が参議院の方に行く時間になってしまわれましたので席を離れておられますけれども
200,んでもういいだろうと言いましたら、参議院の与党の某大幹部が、衆議院と違って参議院ははるかに品がいいし、良識の府であるから、どうもちょっとそう思えない
201,もない〉石田の耳にも、いろいろな動きが入ってきた。参議院の野末陳平をはじめとする税金党の三人を入れたことで、なんとか法案の参院通過を
202,ということとは少し次元の違った問題ではないかと思います。○立木洋君先般の参議院の本会議で橋本総理がこの問題について、どういう根拠で、どういう国連安保理の決議に
203,立法府国会国権の最高機関であり、国の唯一の立法機関である。（日本国憲法第四十一条）衆議院参議院国立国会図書館［議員］国会は戦後、貴族院が廃止され、衆議院と参議院となり、衆議院議員
204,総質疑時間は６日間，三十一時間三十分でした。法律案は十三日の衆議院本会議で賛成多数で可決され，参議院に送付されました。参議院では，参議院本会議で十一月十日に「宗教法人等に関する
205,衆議院と参議院の優劣を固定するのではなく２年に１回選挙で決めてはどうですか？そうすれば議員
206,か？二千円札に次ぐ負の遺産だと思っておりますが・・どこの国の参議院だ？日本の参議院はそういったところじゃないよ。よく調べようね。つぅか
207,どなたか教えて下さい。参議院で郵政民営化法案が否決になり、内閣解散・総選挙になって、新内閣が発足したら、郵政民営化法案はどう
208,が、このような政治システムの根幹に関わる改革を議論すべきであり、歓迎したい。そもそも参議院は衆議院のコピーだといわれ、参議院本来の役目を果たしていない。簡単に言え
209,が認められています。大統領官邸の青瓦台国会【】韓国の国会は、衆議院と参議院の二院制を持つ日本とは異なり、一院制です。国会議員の総数は二百九十九人と定められ
210,）。こうした不透明さを少なくすることと並んで，二院制のあり方，特に，参議院の改革が国会の大きな課題となっている。５国会で，両院の議決が異なっ
211,、誰が総理大臣になったって、そんなものはどっちでもいいけど、衆議院でも参議院でも、なかには間に合わん人が出とるんですよ。力のない代議士が
212,国民年金法等の一部を改正する法律等」について一部修正の上、衆議院において可決され、６月５日に参議院で可決され、成立した。（２）平成十六年年金制度改正の概要ここでは、第百五十九通常国会
213,タレント候補が続々登場、衆院選とは一味違った華やかな選挙戦となっております。参議院といえば、なんといっても衆議院の“暴走”を止めるために生まれた「
214,とは縁遠い所が多い。あまり好きな所もない。病院、少年院、修道院、参議院、衆議院などと、“院”が付く場所で思いつくのは、どこも苦手な
215,、国会、立法の機関として、国会議員の一員として、これは平成二年に衆議院も参議院も決議を出したことに対して、私たちはこれを粛々ともう審議をしながら、
