,0
0,いい悪いは別にしまして、なってまいりました。そういたしますと、地場でできる野菜の時期というのは限られるわけでございますので、広域的に全国的に
1,食べよう』午前十一時三十分〜午後１時●旬の食材料理コーナー参加無料親子を対象に地場の旬の野菜、果物、魚を食材にバラエティ豊かな料理方法の体験と試食。
2,格好でやっていくことが、結果として、全体的には、そういうさっき出た、地場という言葉が出ましたけれども、そういう点でいうならば、みんな負の
3,も回復しているのだ、こういうことになるわけなのでございます。それに対して、では本当の地場の、地域で営業活動をされている中小企業の皆さんたちはどうなのか。私は
4,たにせよ、事情は変わらないんだ。この地域は、海上交易で巨富を蓄えるので、地場の海運に影響のある重要な決断の基礎は、天候だ。天気予報に関する最新鋭の
5,で、地方団体の中で、あるいは自治省でも考えられることですが、たとえば中小企業あるいは地場の企業へ官公需の優先発注であるとか、あるいは公共事業の中へ失業者を吸収するとか
6,行政施策として廃屋の農家住宅を転用し「農家民宿」を設置する。経営は農家の主婦であり、地場の農産物ばかりであり、石畳の家庭料理のみであるが、年間をとおして千二百人の宿泊客を
7,ます。○棚橋分科員どうもありがとうございました。最後に、一番重要な中小企業対策、特に地場の、地域の中小企業振興政策について大臣のお考えをお伺いしたいと思っております。ただいま景気は
8,（６）（ジバ）産業の発展を支援する。地場（７）外国製品を（ユニュウ）する。輸入
9,という機能、これはすぐれて社会的機能を持っていると思いますね。メーンバンクというか地場の銀行という力がかなりそこに働いておると。地域的な要請というものがあって
10,が動きだすと、いつのまにか新聞、雑誌の記者が集まってきた。地場の証券新聞や、相当な経済雑誌までが、日満興業を書きはじめた。“体質改善完了の日満興業、
11,を向けてほしい」あの時…これなら、県産材でも低コストの住宅を提供でき、地場の業者だからこその売り物になると考えた。企業紹介社名株式会社寺島製材所代表者名代表取締役
12,ことを、東京都における三つの具体的実例に即して御説明させていただきます。まず初めに、地場の土木工事業を営む中小企業の例であります。この会社は、大手ゼネコンの下請体質からの脱却
13,れたことがあります。群馬県が錚々たる政治家を輩出したのも、養蚕と製糸産業が地場に根付き、相当な政治資金の調達をおこなうことができたことも、大きかったと思います
14,や有機栽培のものを積極的に取り入れて使用していますまた、夏から秋にかけて地場の野菜を農家の方から直接仕入れて美味しいだけではなく、お客さまに安心して食べて
15,ことでございます。また、地方取引所の問題の解決の仕方いかんによりましては、地場の証券会社の経営の問題にも響いてくるという問題もございます。その辺のところ
16,たフラップの数々である。その存在感は倉庫スペースという均質な空間の中に、強力な地場を発生し空間を独特なものに変えている。コンピューターの中のクリーンな世界と、
17,。最初の転職は、実務経験のイロハを身につけるためと宅地建物取引主任者資格を活かすために地場の不動産業へ転職し、主に不動産仲介業に従事しました。大手企業に入り業務の一部を任さ
18,私どもでは、国公法二十八条の社会一般の情勢に適応するという概念の中にはそれぞれの地場の給与も反映させるということも当然含まれておると考えておりますから、地場賃金の
19,に向けての計画づくりに着手をされました。先日は産業復興会議という名前でそれぞれ地場の業者の方々の代表も含めた御論議の末の結論を私どもにお届けをいただき
20,たいわば今度の調査の総論的な部分については、全く同感でございます。できるだけ地場に野菜産地をつくってその地場野菜を供給していくということは、流通経費も非常に少なくて
21,は、都市近郊の地場野菜産地が都市化の進展によりまして徐々に宅地化、工場用地化して、地場の野菜供給が非常に困難になってきたという点が第一点でございます。第二点は
22,回天記念館，徳山市美術館。念仏・武内踊り（無形文化財）等がある。徳山みかげを利用した日本一の巨大モニュメント，地場の巨峰ワインが有名。素材型の石油コンビナートがある。／目下テレトピア・ニューメディアコミュニティ構想の取組，徳山駅周辺地区再開発，文化会館大規模改修
23,た。しかし一方で、ＩＴ化に対しては非常に敏感でした。なぜなら、地場の中堅ゼネコンである同社が、将来の生き残りのためにＩＴ化に対応することは必須という考え
24,？「マックスバリュー」です。実は、このマックスバリュー、静岡のヤオハンや山口のマミーなど、地場で有力なスーパーを次々と買収して店が増えているので、「店内放送でよく聴く
25,＋八十七三千三十一本日は朝から、次なる浮上では千円突破、と地場の証券筋が強気していた。朝は八百八十円で寄り、その後は八百六十円台まで下げてい
26,を中心に値段が高く，近代的な経営手法を取り入れる余地が大きいと見られている。地場の小売業に勝る商品力を維持するためには，ＳＣＭ（ＳｕｐｐｌｙＣｈａｉｎＭａｎａｇｅｍｅｎｔ）の構築
27,のは確実。このままでは大手でも苦しくなる一方だ。それだけに、地場の業者は、特徴のある家づくりをしなければ、もっと厳しい状況に追い込まれてしまう
28,廻った際はピンときませんでしたが先入観を捨て検討してみたい。現在、地場でご協力いただけそうな業者様で管理会社様としての候補。検討していきたい。１．〇〇コーポ主任様
29,を考えて相続対策と安定した事業収入を確保するということからこの事業は始まった。地場の大地主さんということから地域からいろいろな提案もあったようだが、あくまでしっかりと
30,逆に強い動きが発生。買い戻し効果などから、さらに一段高も期待されるとして、地場、マスコミは注目している。やるものがないから、この手の取り組み株が一番とする
31,た、あの証券会社と金融会社は自分の口座だろう？」「客の一人に、地場の人間がいるんです。その客の紹介です。それに、いろいろなところに顔
32,銀行という力がかなりそこに働いておると。地域的な要請というものがあって、地場であるということの作用がかなり強いんじゃないかと思います。この点については私も
33,宮崎県の「ミヤ」と韓国語で音をさす「ソリ」をくっつけた商品名は、地場の技術力と韓国ＩＴの融合を象徴する。カラオケは全国約五十万台、約九千億円のビッグな市場
34,提供できる。しかも、同じ規格のまとまった材料を必要とする大手業者には扱いづらいため、地場の業者だからこそ売り物になると考えた」その結果、同社の住宅の
35,は私どもの調べではおよそそのうちの半分、ちょうど半分ぐらいがいわゆるその地方の地場の業者の方というふうに考えておりますので、そういう意味では相当その地方
36,、感謝しています。妻への完全な説得はできないまま、わずか５〜６名程度の地場の不動産業者へ転職しました。給与や福利厚生等の労働環境は何一つとっても以前と
37,その大量販売に要するコストが、生産コストを上回るため、大手はハウスメーカー全体としての生産性は、地場の遅れた生産性にあえぐ中小零細住宅建設業者に近似した状態になっている。日本の住宅産業が
38,地下１階。京都駅前とはいえ穴場的なスポットだ。京野菜、湯葉、生麩、豆腐など京の地場の食材をふんだんに使った家庭料理は、京都弁でまさに「ほっこり」できるやさしい味。
39,ますと資格のある人が少ないということがございまして、それで思ったような地場の地元業者を使えないといううらみがございます。そういう点は先生もう一番よく御承知
40,十軒も残ればいいところじゃないですか」かつて長い年月をかけて形成された地場の産地も、衰退していくさまはあっけないほど、もろい。「なにしろ後継者がいませ
41,、関西や他の地域でも東京ドームを例えに使ったりするのでしょうか？他に地場ならではの物を例えに使っているのでしょうか？その場合はどの様なもの
42,た（＠゜▽゜＠）今年は恵比寿グルメ＆ファッションに力を入れましたが、私は一般の人と違い地場の良さや雰囲気の良さやスタッフの性格をスピリチュアルな世界で感じて居心地の良い
43,商業関係者は大変な関心を持って見ておるわけでございます。やはり商業というのは地場でやっておられる方もたくさんおるわけでございまして、そういった方々との
44,続く中で、大企業がよくなっても中小企業はよくならない、特に、地域、地場の中小企業はなかなか厳しい状態にあるというのが私の認識でございます。私の
45,のではないのかなと思っております。○谷口委員考えられるのは、証券会社の小さい、地場の証券会社が、これは、資本金五億以下で負債も二百億に至らないというような
46,な産業には、地方経済の活性化という観点からも重要な役割が期待されている。地場の食材を利用する食品産業や、農村環境を活かしたツーリズムがその代表である。さらに異業種から
47,（三．三平方メートル）単価が三十万円を切る商品も提供しており「大手メーカーとの差別化を図り、地場の業者が生き残るためには、必ず県産材利用が大きな武器になる」と意気込む。千九百三十五年
