,0
0,のアカマツを守る薬剤樹幹注入剤の費用にあてさせていただいています。募金箱は村内５箇所（役場、村民センター、大芝荘、大芝の湯、ＪＡ上伊那南箕輪支所）に設置しています。なお、多額の
1,は、説明会会場に結果書を持っておいでください。※伊那健康センター受診の方は、受診した翌月に役場から健診結果・保健指導について連絡します。※国保の方で人間ドックの補助を受ける方は
2,栗橋町教育委員会【後援】栗橋町人権教育推進会議【問合せ】栗橋町政策推進課人権・広報・統計担当内線３３２２月Ｆｅｂｒｕａｒｙ広報くりはし情報ページ役場☎（五十三）千百十一２月のカレンダー上下水道課☎（五十二）二千百十二Ｂ＆Ｇ海洋センター☎（
3,ました。これらの情報支援機器は高齢者の皆さんの情報支援にも幅広くご利用いただけます。役場や中央公民館へお越しの際は、ご自由にお使いください。※福祉生活課ＴＥＬ６７４‐１１１６清掃センターからのお知らせ
4,による民謡〈レモン林〉〈丸木舟〉の斉唱と保存会による南洋踊りから構成された（小笠原村役場千九百九十四）。〈アオウミガメの旅〉は、小笠原小学校元教諭の町田昌三作詞、同・大浜勝彦作曲による作品で、
5,の海産物もこれに続いている。これらの農産物海産物は縁故者からの送付が多い。役場や商工会でも小値賀会のチャンネルを利用した販路および販売量の拡大を目指している。最近
6,れざる滝釜ヶ淵？あまり知られていない淵である。場所がわかりにくいので、役場などで確かめてから出かけたほうがいいだろう。国府町から瓜巣地区を通り、高山市
7,ご覧ください。）ＡＥＤ村内設置場所●南箕輪小学校●北部保育園●南部小学校●南原保育園●南箕輪中学校●役場●南部保育園●村民体育館●西部保育園●大芝公園管理事務所●中部保育園●大芝の湯松の緑
8,あったのだ。植村さんがいろいろな対策をねりはじめたのは、それからだった。役場には、いろいろな情報がおしよせてきた。その中にはデマもあり、
9,本会議は午前十時から、委員会は午前９時から▼本会議の傍聴（定員三十二人）役場４階の本会議場傍聴席入口で、住所氏名などを記入してください。▼委員会の傍聴（定員４人）
10,が、それだったのです。自転車は、救援隊が病院を出てだいぶたってから役場のジープでとどけられたのでした。「うたがうのか。ならば、おれが
11,そして、帳場に行き、番頭に長距離電話を頼んだ。「愛媛県南宇和郡城辺町の役場じゃ」と熊吾が言うと、番頭は、「愛媛県の南宇和郡。ちゃんとかかるが
12,語らない。小池某と自称すると云う警察の添書のまま、Ｎさんはその子供を同居人として役場にとどけてあるのだけれども、昔のことをけっして語ろうとしない子供の哀れな
13,つぎのように記されている。「工場建設当時の速星村笹倉郷は、宮島川の東側には役場、小学校、駐在所等が点在し、川西県道筋（現国道三百五十九号線）上長部落と井田川堤防沿の舟部落には夫
14,、生年月日、性別、職業、電話番号、応募の動機（簡潔に）」を記載し、役場に持参、または郵送してください。持参の場合は、木野支所でも受け付けます。なお、
15,てください！全国大会に出場！ベストを目指して頑張って！３月十七日（月）、役場でスポーツ激励金支給式が行われ、第５回全国ホープス選抜卓球大会に出場する、南小学校５年の■■■■さん（右写真右）、第三十回全国ＪＯＣジュニアオリンピックカップ春季水泳競技大会で
16,十一件）の被害があります。未遂に終わりましたが「電話料金が還付されるので役場の銀行ＡＴＭにいって携帯電話で指示を受けるように」との事件もありました
17,周囲の連中に無担保、無利子で貸した金がどのくらいあるか不明だが…役場の総務課長に貸していた四百万円も含めて、総額で数千万円がいいところでしょう」
18,している。僕たちは、それに気づいています。そして、大賀記者の死にも、役場が一枚嚙んでいるのではないかと考えています。いいですか？僕たちの眼は
19,」５人のうち、■■■■氏（岡山商科大学大学院教授）と■■■■氏（前岡山県副知事）が、１月十日役場を訪れ、■■町長と懇談を行いました。（写真右端：■■氏、左端：■■氏）
20,の中で、児童虐待の疑いがあることに気がついたときは、すぐに役場又は児童相談所に相談（通告）してください。■保健福祉課福祉人権係☎８２‐１０１３有線０５３２■倉敷児童相談所☎
21,名前、電話番号をお書きのうえ、ご応募ください●作品の応募用紙に規定はありません●役場へ郵送または持参ください●締切は平成二十年十月三十一日（金）■応募・問い合わせ先人権政策課男女共同参画担当（〒８１１‐１２９２
22,は背後を振り返る。小さな出張所には煌々と明かりがついている。こんな夜遅くまで役場に明かりがついていること自体、おかしいと思う。もちろん、窓口は五時で閉まっている
23,に、「急な空きが出来た」と電話がありました、、、。役場の人間の「きまり」なんて、そんな程度ですよ。
24,●改定後の時刻表は「じゅんかい君時刻表（平成二十年４月１日改訂版）」に掲載しています。●役場・いこまい館・町民会館・町民体育館・各児童館などにも配布用時刻表が置いてあります。※また、町ホームページおよび町民カレンダーにも掲載し
25,生まれると、その戸籍にその子がさらに記載されます。そして、人が死ぬと役場に死亡届が出されて、今度はその人が戸籍簿から抹消されます。このよう
26,は、田畑だけではなく家の床下も洗い、子供たちは閉じ込められた家の中から役場のサイレンが鳴り続けるのを聞いている。いつもたった数日間のことだったが、水浸し
27,二十二日（金）までに１住所２氏名３年齢４電話番号５応募の動機を記載の上、直接、役場２階都市計画課まで提出していただくか、メールもしくは郵送にて提出してください（様式は問いません）
28,とＮさんは、大砲に対して釈然としないものがあったのだ。まず、同居人として役場にとどけを出して、学校へは上げたのだけれど、最初の日に、子供
29,な」という多数のはげましメールがとどいた。いちやく「時の村」となった役場の職員は、「世の中、何が原因で名が売れるのか、わからない」
30,、と遠藤は言い立てていた。それは、その前の日に彼が一人で役場を訪れたときのことである。当時村役場に大川原正吉という書記がいた。酒ぐせが悪く
31,そんなわけだから、仕事が終わったときには、市長はこおどりした。そして、役場の書記を相手に、心ゆくまでウマとびをした。おかげで、ズボンのボタンが
32,など「よりわかりやすく」を目指した工夫が行われました。株式会社北原産業・北原工業工場立地調印式十一月十七日、役場において、グループ企業である株式会社北原産業と北原工業の工場立地協定書及び公害防止に関する協定書の調印式が行われ
33,はしてねえですね」「はい、大体祝言のあと半年くれのあいだに役場に届けるあんが慣習になってますねえ。賀穂のときもそうでした」
34,思い、もう一度同じ言葉を繰り返した。房江からは、何の応答もなく、役場のなかの物音や話し声がかすかに伝わった。「それを言うために、金沢
35,）に開催される、第二十三回大芝高原まつりのポスターなどの原画を決定するための審査会が、６月十七日に役場で行われました。今年も南箕輪中学校の生徒らから三十一点の応募があり、どれも
36,小丹生、右岸が大丹生と分かれ、大丹生の北二キロの海岸が鮎川だ。鮎川の役場に保存されていた地籍図を見ると、鮎川の小字として大入、東大入、北大入、
37,月）注意事項！○町県民税申告が必要と思われる人には、１月下旬から２月上旬までに役場から申告書を郵送します。届いていない人で町県民税申告が必要と思われる場合は、
38,。倉敷市・井原市にまたがる諸問題を協議１月十八日、本町と倉敷市・井原市の２市１町の首長・正副議長会議が役場で行われました。会議では、小田川の治水対策や井原線車両のＪＲ倉敷駅乗り入れなど、各市町
39,な書類】１住宅用太陽光発電システム設置承諾書なお、必要な様式は、町のホームページからダウンロードできます。「役場の組織・仕事」→「企画課」→「新エネルギー設備導入支援事業」の順番にクリックしてください。不明な
40,の気温変化は、年によって違う。登山計画を立てる時点で、残雪状況を山小屋や地元の役場、警察署に問い合わせることも必要だ。山岳現場と事故現況（２）病気や疲労
41,どうだったか。役場の職員は、異様な光景にあ然としていた。役場には噴火を取材するために多くのマスコミが集結していた。役場の屋上に設置され
42,で、「十一月六日、夜間のパラシュート降下訓練を実施する」旨の通報をしてきた。役場の関係者は一瞬緊張した。“これはまちがいなく事故が起きるぞ”というのが、
43,ます介護保険被保険者証は、被保険者が満六十五歳になる月（第１号被保険者資格を取得する月）に、役場から各個人へ郵送しています。被保険者証は、介護保険のサービスを必要とする人が、
44,、北総・公団線の始発駅「印旛日本医大」駅を中心に、住宅地や生活に必要なスーパー、学校、総合病院、役場などのさまざまな施設が半径１ｋｍ以内に配置され、誰にでも便利で特に身障者
45,」という声も上がりましたが、すぐに慣れて楽しく遊びました。情報ＢＯＸ役場の代表電話番号０５６１（３８）３１１１スポーツレクスポの日スポーツ課ＴＥＬ０５６１（３８）６１１１アリーナを町民の皆さんに無料開放し
46,の教師をしていて、戦後は体をこわしてやる気もなくなって、今は役場の小使いですけど」と滝口が言った。店は労働服の男たちでほぼ満席
47,２月十日（日）午前９時〜正午、午後１時〜４時場所高田地域役場高田庁舎北庁舎２階第３会議室本郷地域本郷保育所新鶴地域新鶴保育所※申し込みをした保育所の所在地
48,。それは、昭和の合併の例などを見れば明らかです。合併すると、役場が支所になり、保育園や小学校が統廃合されて地域の子どもたちが少なくなっていき、
49,一月十二日、あの大爆発で桜島が大隅半島につながった、大変な爆発でありました。役場が埋まり、学校が埋没をし、町の三役が官を信ずるなかれとのろいながら
50,た出会った。きんにょ、役場で鈴木さんさ、いっきゃった（＝きのう、役場で鈴木さんに出会った）うっつぁしまつわりついて、うるさい。うっつぁしわらしは
51,あつてはその裁判所書記官の所属する裁判所に、公証人の処分にあつてはその公証人の役場の所在地を管轄する地方裁判所に異議を申し立てることができる。２執行文の付与に対し、異議の
52,には、いろいろな情報がおしよせてきた。その中にはデマもあり、役場の中はひどく混乱していた。このままでは、何ひとつ実行することができない。避難
53,の人たちが書類を書き込む机や申請を待つ間に座るソファなどがあり、いかにも役場といった感じ。
54,―修太郎は帰って来るようになった。その日もそうだった。役場から戻った保田は大層疲れていた。表通りはもう暗かったが、作業場の
55,のではないと、どうして言えるだろう？７田中は疲れた身体を引きずるようにして役場を後にした。もう十一時を過ぎている。村にとっては深夜と言っていい
56,どこさも売らねッ」と言うだけだった。ある日、国次はトラックで役場へ行って村長さんと約束してきた。「俺たちぁ子どもいねえから、死んだらそっくり村さ
57,。それが何かばらばらになってきているんだけれども、私は学校というのは役場じゃないと思うんですよ。本当に校長と教師が一緒になって議論しながら、子供たち
58,くらい）には、胎児の大きさから出産予定日を推定し、出産届けの用紙をもらって、役場で母子手帳と無料券がもらえます。さらに次回は、妊娠初期の血液検査などがあり、エコー
59,をのせる。●１人分の栄養価●エネルギー二百三十五ｋｃａｌ塩分相当量１．０ｇ３月Ｍａｒｃｈ広報くりはし情報ページ役場☎（五十三）千百十一３月のカレンダー上下水道課☎（五十二）二千百十二Ｂ＆Ｇ海洋センター☎（
60,させる事のできる「宝」を見つけたと二人に語る。そんな夕刻の時間に役場から訪れた男性が、公的な用事として彼を車で同行させるのだが・・
61,なお、ご自分で申告書を作成された場合には、確定申告書は税務署へ、町・県民税申告書は役場へ、郵送等により提出されても結構です。申告しなければならない人所得税◆一般の人
62,の地方では委任状があっても，第三者からの戸籍謄本の交付申請には応じない役場があります。そのような場合には，銀行側で届出人の押印ある戸籍謄本交付申請書（
63,地方制度であった。このような制度のなかにどっぷり漬かって仕事をしてきた役場の人たちは、いまになって急に、自分たちで財源を求め、自主財政で町
64,それで田舎の岡山に帰り、なんとこのわしが公務員になったわけやけど、役場で働いとったときにも、二十二歳の若さで平々凡々とした生活でいいもん
65,の、千九百四十九年ごろだった。九歳だった龍憲は、母の代わりに大田町（当時）役場まで、父の遺品を取りに行かされた。役場で受け取った白い布に包ま
66,を記入し、有田秋まつり実行委員会（町企画商工観光課内）へ提出していただくか、ＦＡＸで申し込んでください。申込用紙は役場、東出張所、または福祉保健センターの窓口にあります。詳しくは▼有田秋まつり実行委員会（町企画商工観光課内）☎
67,行ってきた。予定通りニセペンキ屋。明日は恒例の役場。役場のトコらへん祭なので行き帰りごった返すかも。今日はやや早仕舞いだった
68,としていた。役場には噴火を取材するために多くのマスコミが集結していた。役場の屋上に設置された民放のカメラが映し出すモニターを見ていたら、突然、スタッフ
69,義理がないからねぇ〜使命感だけだね。それは関係者の慢心に依るのだ、役場がするこっちゃ工夫が無い。マァ俺に言わせれば「芸がない」っちゅう
70,しかし、なつかしい故郷に帰ってきた彼らを待っていたのは、県庁や役場を根城にする役人衆、これと表裏の関係にある私学校生徒らの白い眼であった
71,二十三、三重県）へクラブチーム「ヤングカープ岡山」の一員として出場した■■■■さん（中、矢掛中学３年）が役場を訪れ、■■町長の激励を受けました。子どもと家族の楽しいふれあい十二月７日
72,知っちょることを正直に喋らんと、あとで厄介なことになる」役場で何人もの刑事が待っているというのもおかしな話だな…。熊吾は自分
73,その前日から来て、役場の隣の小苗代部落の前野という地主の家に立ち寄り、役場を出たあともまたそこへ行ったということだった。遠藤が前野宅に立ち寄っ
74,生徒に対して制服、靴、食事、教育に必要な資材すべてを無償で供与すべきである。役場のある町からきわめて遠隔地にある地区の中心的共同体には寄宿舎つきの中学校を設置すべきである
75,には、むしろ母が誇らしげに胸を張っているようにさえ見えた。ところが、役場の職員が帰った途端、母はいきなり走り出した。「たつのり」は驚いて
76,、ハンガリーの雇用者平均月給は約九千フォリントだった。協同組合が役場から借金した大きな理由は、役場のそばに新しいショッピング・センターを作るためであって、その建物は役場からの借金の担保
77,ましてね」「俺たちが来ることを、どこで知った？」「役場をぶらついているときに耳にしました。調査は本格的なものかと思ってい
78,具合が悪いので、ちょっと休ませてください）いっきゃった出会った。きんにょ、役場で鈴木さんさ、いっきゃった（＝きのう、役場で鈴木さんに出会った）うっ
79,か？全然関係ありません。武豊町は神社の名前から付けられています。でも役場のＨＰには武豊騎手の情報も載っています。
80,あるのですがどう片付けたらよいでしょうか。轢かれたみたいなのですが。保健所か役場にお電話してください。。。。。。。。。。。私の会社でも以前
81,役場の臨時駐車場に車を止めまして、桜並木の川沿いをそぞろ歩きですね。役場の桜も五分咲きくらいですかね。明日につづくたんしんはひとりで
82,の雪が道に流れただけみたいですから、明日じゅうになんとか復旧できるでしょう。朝、役場に電話します」「お願いね」晶世さんは杉迫さんにうなずきかけると、わたしたちの顔
83,石坂浩二ふうの二枚目で、頭もいいし、モテるんだ。よく俺んちの前の役場の広場で女の子二、三人と遊んでる。女の子はスカートから毛糸のパンツ出したりして
84,盛り、煮汁をはる。●１人分の栄養価●エネルギー二百九ｋｃａｌ４月Ａｐｒｉｌ広報くりはし情報ページ役場☎（五十三）千百十一４月のカレンダー上下水道課☎（五十二）二千百十二Ｂ＆Ｇ海洋センター☎（
85,にもなかった。秋田は、消防団、島の交通を束ねる東海汽船、東京電力、役場のスタッフ、日々の仕事をしている人間たちがそれぞれの持ち場で精一杯の行動をし
86,に設置した在宅介護支援センターである。仕組みは、こうなっている。新生苑、支援センター、病院、役場などで町民の介護相談を受け付け、「在宅支援カード」に病状や家族構成などを書き込む。それ
87,月曜、祝日二十三日（火）二十八日（日）〜三十一日（水）・西公民館別館図書室（役場２階☎四十六．二九一五）月・水〜金曜９時三十分〜十七時三十分土・日曜９時三十分〜十六時三十分
88,「こ…こりゃあ、田中の坊やだ」「田中の―？」「役場に勤めていた田中のとこの昭くんだよ。お父っつあんが死んで、おっ母さんが倒れ
89,はそのなかに入ることになっており、その建物の一角にできるはずのレストランとガソリンスタンドは役場が協同組合から買いとり、そこからあがる利益も村の年次予算に繰り込まれる。ハンガリーで
90,は萩市の経済圏にあった。そのうえ両村とも同程度の規模の村だったため、役場をどこに置くかでもめにもめた。両村とも一歩も譲らず、難航した。
91,という程度の小島で、幼稚園や小学校、郵便局や公民館などはあるが、中学高校、役場、病院となると船で本土のＫ市街まで行かなければならなかった。付近に沢山ある島
92,てますただ最近秘密兵器をみつけました役場や市町村の競売物件！これは役場に昼間連絡しないといけないのが邪魔くさーいですが楽しみながらトライします
93,を親権者と定めたかを記載しなければなりません。記載のない離婚届は、役場（所）で受理されません（Ｐ二十二参照）。関連ページ▶離婚届の記入方法→Ｐ
94,広げ夢を膨らませ子供から高齢者まで参加して種蒔きをした。種は蜂蜜業者や役場の支援を得て入手した。支援の受け方も学習の成果である。さる４月十五日
95,犠牲者も出さないこのとき町役場では、職員たちがあっけにとられていた。役場に集まっていたマスコミが、カメラやモニターをはずしはじめていたのだ。当時の町長植村秀正さん（
96,の交換レートでは一米ドルが約六十フォリントで、ハンガリーの雇用者平均月給は約九千フォリントだった。協同組合が役場から借金した大きな理由は、役場のそばに新しいショッピング・センターを作るためであって、その
97,君はほんとうは決してそんな男ではない」こうして男は泥棒をやめて、役場の課長になりました。そのあとも真実だけを話す修行をつづけ、その自然
98,頃からあると言うことか？地元の郷土史研究家が調べたことを元にして、役場が、看板を作ったんだろうから、根拠はあるんだろうが。一体、何にそんな
99,た。よろしくお願いします。ＩタウンページやＹＡＨＯＯの電話帳で検索してみれば。田舎だと、役場に電話すると教えてくれる場合も有ります。
100,よかった。チェコスロヴァキアの場合、末端の市町村に国民委員会という機関があって、そこが役場と議会を兼ね、その議長が同時にその地域の首長でもあった。国民委員会
101,も、ちょっとわからんわねえ」棟居は、横渡と目を交わしながら、やっぱり役場で調べる以外になさそうだとうなずき合った。食事の半ばごろから旅館の前の
102,探し。しかし、予想よりも、野花が少なかったので驚いた。さて、数日前、役場から、町作りの為の町民アンケート用紙が送られてきた。現在、南種子町の人口は
103,かなァし」「そうじゃ。早よう行け。それまで電話を切るなと、役場の連中に言うちょけ。もし切ったら、切ったやつを捜し出して、八つ裂きに
104,て、その建物は役場からの借金の担保になっている。これが完成したら、役場はそのなかに入ることになっており、その建物の一角にできるはずのレストランとガソリンスタンドは
105,設楽は、考えていた。どこまでしゃべればいいかわからなくなったのだろう。「役場は、蛇姫沼のことを隠そうとしている。僕たちは、それに気づいています。
106,せている。また、これらの事業所に電話とファックスの回線を工面してやって、役場に五十万フォリント払わせるようにした。さらに役場はこれらの事業所に百万フォリントのクレジットを
107,てくれた出生証明書を書き移せばよいのです。出生届の提出先は、次の四か所の市区町村役所（役場）のどこでもかまいません。１赤ちゃんが生まれた地区の役所２親の
108,婿養子でもないし、石材店の仕事をしている訳でもない。保田は、役場の出納係をしている。百合子とは見合い結婚である。上司から縁談話を貰った
