,0
217,▼平井米店（矢掛）餅あすなろ園へ求人情報ハローワーク笠岡（☎０８６５六十二二千百四十七）役場１階ロビーでも閲覧できます。詳細はハローワーク笠岡へ直接お問い合わせください。＊職種・求人数・年令・所在地の順▼ホームヘルパー
218,靴下。しかし、そのほとんどの箱が開けられていなかった。ふと見ると、役場の職員らしき男性が、ダンボールを眺めて考え込んでいた。「このダンボールの山
219,休館日月曜、二十三日（祝）※３日（月・祝）は開室します。・西公民館図書室（役場２階☎四十六．二九一五）月・水〜金曜９時三十分〜十七時三十分土・日曜９時三十分〜十六時三十分
220,格上げ（？）になる場合はあるのでしょうか？４大卒の男ですが、中途で役場の一般職を受けようかと思っております。公務員に一般職と総合職の違いはないです
221,皆、奮い立ちました」役場内の動揺を収めると秋田は、職員に命じて役場の屋上に登らせ、そこから溶岩流の動きを五分おきに報告するように指示した。
222,は大声で「テルツィ、テルツィ！」を合唱して彼の演説を要望した。役場の建物のバルコニーにテルツィが現われ、松葉杖をつき、青ざめた顔で、片手を
223,使っている。村長は、これらの事業所の立地にあたって、土地とエネルギーの便宜を役場が与える形をとり、その見返りとして役場に地代を一平方メートル当たり六百フォリント、合計二十四万フォリント支払わせ
224,て、海にばらまくと言うちょけ」大竹は慌てて電話を置いた。役場から北裡の家まで五分。往復で十分。まあ、それまで番頭と話でも
225,思いますが、町としての考えは比較的、建設的だと思います。しかし田舎の役場ですから、これほどの大事業の申請を受理したことがかつてなく、正直、手探り
226,四時十五分に起きた大噴火は、誰も経験したことのない激しい揺れだった。役場は騒然とした。そこに根拠もないデマも含めたさまざまな情報が殺到し
227,国の定めのようなものがあるのかどうか、誰も知らない。役場の古参吏員も知らないとみえ、お互いに顔を見合わせていたが、その中の
228,姑は嫁との同居を打ち切って娘のところへ出ていってしまい、他方嫁側は役場に「婚姻関係終了の意思表示」を提出した。その後、嫁側は新しく仏壇を購入し、
229,コミュニケーション支援のため、町内各施設の窓口に簡易筆談器を設置しました。お気軽に利用ください。設置場所：役場１階（町民保険課・福祉課・税務課・環境経済課）・第２庁舎（都市整備課）・保健センター・上下水道課・総合文化会館イリス・イリス図書室・Ｂ＆Ｇ海洋センター・健康福祉センターくりむ・ハクレン館・コミュニティセンターくぷる■問合せ
230,ことを誇ってみせた。廣松の出生届が出されたのは、山口県内の役場である。工場技師であった、その父の仕事のつごうによるものといわれる。戸籍上は
231,買上げの会場では姿を見ていなかったなと思い出しましてね。その後役場に持ちこんだのかもしれませんけども、だったら買上げの領収証でも見せてもらえないかと
232,来春には、全国上映に踏み切りたいとしている。重松清さんロケハンで訪れた西城町で、役場の人から町の説明を受ける政友さん左と三木さん（中央）バイオリン製作者陳昌鉉共感呼ぶ
233,最後には絵の具の付け合いっこになり、楽しさで暑さを忘れたひと時でした。情報ＢＯＸ役場の代表電話番号０５６１（３８）３１１１スポーツレクスポの日スポーツ課ＴＥＬ０５６１（３８）６１１１アリーナを町民の皆さんに無料開放し
234,は良くもあり煩わしくもある。私が小学生のころ、町には医者と役場にしか電話がなかった。家に帰れば小学校の仲間は、それぞれの村に
235,な地方町もいまは完全に目ざめたおもむきであった。食事が終わると、そろそろ役場の開く時間になった。旅館のお手伝いから聞いたとおりの道筋を忠実に伝っ
236,入場券は送付しません。問合先選挙管理委員会事務局（内線４１１）新一村一雇用おこし支援事業の申請を受け付けます申込・問合先役場商工観光課商工労働係（内線７３２）北海道では、新規開業・新事業展開などで新たな雇用の創出に
237,。浩はゆうべ夢を見た。薪を燃して走るトラックが二台、役場の前に止っていた。集った人々を整列させた男を、浩は菅谷
238,できたのでしょうか？何か情報があれば歓迎します。富山県出身の者です。役場が全家庭にＭａｃを配布した村というのは山田村のことですね。今年
239,てください。まず最寄の警察に行って申請書をもらいます。住民票を取ります。同じ役場で身分証明書を取ります。店舗の管理者に使用許諾書に署名・捺印してもらいます。書類の必要項目に
240,。室田忠七は、一月二十五日、「評議員トシテ雲龍寺事務所ニ出頭、同所ヨリ左部氏ト共ニ吾妻村役場ニ出頭、島田村長に面会シ上京青年組織ノ件ニ付キ相談」（「日誌簿」）し、二月五日には、一村三名
241,は我がかわいいけん、他の所なら寄りつきもせなんだろうに、ここの人らは役場の係りの人と一緒になって、丁寧に葬ってあげなはったそうな（あげ
242,、酔えばだれかれの見境もなく当たりちらすことで有名な男だったが、遠藤が役場に来ていたとき、外から酔っぱらって入ってきた。勤務時間も何もあっ
243,、“難を転ずる”に通じる「南天」の実などで飾りつけられ、役場高田庁舎玄関で役場に来る方を迎えていました。●いっしょに歌ったよ〜高校生による発表会〜
244,で終了する予定です。最後の募集を次のとおり行います。▷申込方法（１）役場環境保全課環境保全係へ電話で「申込書」を請求してください。（２）受付後、購入助成の「申込書
245,国民に売り込もうと試みていた。実際、東條の写真は、学校や工場、あるいは役場といった施設に飾られ、その言葉は重々しく朝礼や訓示といった機会に引用されていた
246,。（基本的に、市町村役場で通話が出来ることを基準に人口カバー率○％と言っているので、役場と駅が離れていたら通話が出来ない可能性もあります）どのあたりで電波が
247,自分達の住んでる所の土地の値段ってどうやって調べるのですか？役場からくる固定資産税の通知書にある評価額（課税標準額ではありません）がその土地の
248,思い、もう一度同じ言葉を繰り返した。房江からは、何の応答もなく、役場のなかの物音や話し声がかすかに伝わった。「それを言うために、金沢
249,でくれ。この電話は金沢からかけちょる」大竹という、熊吾の口ききで役場に就職した遠縁の青年の声が聞こえると、熊吾は、さらに大きな声で、
250,といわれると、チト困る。いやチトどころではない。大いに今後が困る。これは役場に相談して、かえってヤブをつついたかなと思ったが、いまさら「もういい
251,ここでもパチパチと拍手で迎えてくれた。密航は移民保護法違反だが、村の役場でさえも誰一人として密航を非と見ているものはいない。村長も
252,に預けるような言い方もしておるわけでありまして、公平に配分するなんということは役場のいまのあれではできない、この補正事項の中の加算要因だとか減算要因を
253,設計事務所がするのでしょうか。住居表示は普通、施主が行います。住民票を移す前に役場に行って手続きをして、一週間位で住居表示の連絡があります。その後
254,（明治十九）年、政府は琉球にも戸籍制度を適用。琉球の人たちを一人ひとり役場へ呼びつけて、日本式の氏名を強制しました。アイヌ・ウタリに対しては明治政府の支配権が確立し
255,、各家庭に配布しているごみ収集カレンダーをご覧ください。なお、ごみ収集カレンダーをお持ちでない人は、役場および木野支所の窓口で配布していますので、ご利用ください。問合先役場環境保全課環境保全係（内線５６３）生ごみ堆肥化容器
256,たんだろうって、そういう噂ですわ」「その、その課長さんってのは、役場でどんなことをされてた人です？」先生は小首を傾けた。
257,生活がどのようなものであったかを手にとるように知ることができる。大庭さんは役場へつとめるかたわら、余暇を利用して年寄りの話をきいてあるいた。じつに
258,文献に現れ、まず海岸部を中心に拓けていく。漁業中心の村落形成が進み、郵便局、役場、病院などは海岸部に作られた。千九百十九年には電話が開通、根室本線が開通し
259,子に名前がつけられて市区町村役場に出生届が出されます。出生届が出されると役場では、生まれた子を親の戸籍簿に記載します。また、人が結婚した
260,材料に増築したという部分が光っていた。なげしには昭和十七年以来の営林署や役場からの褒状と賞状が六枚、額に入れてかけてあった。床の間には松村謙三氏
261,山とあろう。それを、ここにいるものみんなに聞かしてやってくれ。なんだったら役場はきょうは休みということにしてもよい」と、上機嫌でいった。「ハア」
262,お聞きいたしますと、道路は全部寸断されておる。この町長さんなんかは、朝の八時に役場の吏員二人を使って、大体千メーターの山を越えて、車で行けばわずか
263,にも役場は、村内の協同組合にも同じ利率で六百万フォリントを貸し出している。そのため役場には年に約二百万フォリントの利息が入る。ちなみに、この時点での交換レートでは一米ドル
264,しかし，この場合，届出人からの委任状は，相続人関係および戸籍の移動状況から複数の役場にまたがることが多いので，届出人の了解が得られるのであれば複数枚の委任状をあらかじめ
265,こちらをふり返って、「あ、ところで道ですけど、明日の朝いちばんに役場に連絡して、人手と、ブルドーザーかなにかよこしてもらいます。わたしたちも困りますから
266,までは中学の寄宿舎で生活します。信州秋山の小赤沢には、千九百九十六年、郵便局、役場の出張所などをまとめた秋山郷総合センターがつくられました。ここには秋山郷の小さな博物館
267,障害者手帳をもっているのですが（緑のもので２級です）役場では何の特典はありませんと言われました。でもいろいろな障害者の
268,受け付けます。また、電子メールの場合は、必要事項を記入した申込書をメールに添付し、役場に送信してください。なお、申込書は、役場総務課および木野支所でも配布しますが、町ホームページ
269,生まれた。若くして死んだ父親の土地を長男である耕一が相続し、地元の役場に勤めながら、農家も兼業した。必死で働き、まずまずの暮らしができるように
270,従い全額補給します。）申込・問合先申込みは、町商工会☎４２‐２２４６または、各取り扱い金融機関。問い合わせは、役場商工観光課まで。文化ボランティア体育Ｌｅｔ’ｓサークル活動根気良く、繰り返し、続けようさくら社交ダンスサークル活動日時第２
271,、村の財政計画で年次的に立て替え整備される保育所、診療所、駐在所、学校のグラウンド、役場の出張所などを結ぶ生活道の交差点をケアポートよしだの多目的ホールに置いたのです。一方
272,バイトしていました。収入は七十万くらいです。就職活動等で確定申告していなかったのですが、役場から、あなたの所得がわからないということで住民税の申告書がとどきました。学校
273,てたんだい、エディ？」ビルと呼ばれている男がいった。「役場に届けを出してやったのか、エドマンド？」ジミーがいった。「
274,昨日もひとり、町で死んだ人がいたそうですね」「ええ、役場の課長さんでした。川に倒れていたそうです」先生は銀行員と同じこと
275,パスポート申請・更新などこれまでは宇和島まで行ってやっとったけどもしかしたら地元の役場でできるようになったんやろか・・知っとんさる人、
276,関係ないですが・・・私は保育園勤務ですが、昨年園舎の新築の会議で役場の担当者や課長と何回か会議がありました。そこで先頭に立ってやりあっ
277,メンバーで確認しあった。このマップを待っている人・捜し求めている人も多かったので、役場、公民館、銀行、スーパー等町内のあちこちに頼んで置かせてもらった。それぞれのネットワークで
278,ている女優で絶世の美女で人間国宝の令嬢だ、などというひとがたかが温泉町の役場の書記にすぎぬ、ふうさいもそれほどすぐれているわけでもなければ何ひとつほか
279,てきたわけや。まあ、その疑問があったがために、たった三カ月で役場を辞めてしまったということでもあるかもしれんが。何のあてもなく頼れる人
280,富山県のある村だったと思いますが、役場が全家庭にＭａｃを配布したことがニュースになりました。数年？十数年前
281,教育現場におけるさまざまな学校運営の苦しみがある。だって、学校は役所と違うんですよ。役場じゃないんですよ。校長が教員と一緒になって山登りする。山登りした子が帰って
282,申請があった場合には、事業内容などを勘案して決定します。※申請書は、役場商工観光課商工労働係に備えています。商工業振興資金を利用してください町では、中小企業のみなさんが事業経営
283,を守る。そのことにより、世代交代可能な地域にしていく。この発想が必要です。役場、学校、医療機関、郵便局、商業施設、移動システムがなければなりません。簡素な自治
284,いうとおり、ぜったいに一人の犠牲者も出してはいけないのだと、かたく決意していた。役場には、いろいろな専門分野にたずさわる人が集まった。火山の専門家、東京都の役人
285,いう。※海水と淡水の混ざり合う状況図１‐２地質断面図次に、役場で実施した公共用設備設置のボーリング調査による地質構造資料を図１‐２に示した。川島中学校の
286,加入を希望する人は３月二十一（金）までに申込みをお願いします。申込窓口：役場町民保険課（午前８時三十分〜午後５時十五分）／栗橋郵便局・南栗橋郵便局（午前９時〜午後４時）
287,来たと、役場にも顔を出し、私と何げなしに話して帰った。役場の連中の話では、彼はその前日から来て、役場の隣の小苗代部落
288,者が多かった。遠藤は明日の調査の下準備のために来たと、役場にも顔を出し、私と何げなしに話して帰った。役場の連中の話
289,は何狙いで」シンゾーさんはまた根掘り葉掘り質問をはじめる。ラブホテルなんかやめて、刑事か役場の戸籍係になればいい。「ク、ク、クエ…」「クエかあ、
290,よく残す点で、ここは一番だ。千六百九年の島津侵攻後は薩摩の番所、廃藩置県後は役場が置かれた。沖縄戦では米軍が近くに上陸したが、戦闘が南で
291,鎮めない表情で言った。「いや、ほんのついでに立ち寄っただけですよ。役場でこちらのおばあさんが、谷井種さんのいとこだとわかったものですからね」棟居
292,平成二十年６月から平成二十一年２月まで随時受付■受賞発表平成二十一年３月詳しくは村ホームページ、役場においてありますちらしをご覧ください。皆さんからのご応募をお待ちしています。■応募先・問い合わせ先
293,、だれが送ってくださったのですか」「さあ、ちょっとわかりません。そこの役場の人にたずねてみたらどうでしょう」「ああ、きいてみたんですよ。それ
294,て帰った。役場の連中の話では、彼はその前日から来て、役場の隣の小苗代部落の前野という地主の家に立ち寄り、役場を出たあともまた
295,７月８日）には一変したのです。次はどのように変るのかな。役場においでの節は、どうぞご覧になってください。（Ｋ）町勢の動向●
296,無度。も度。高度さん亀鶴さん＞ただ最近秘密兵器をみつけました＞役場や市町村の競売物件！＠ほーそれなら安いでしょう。特に、今はね。
297,」「ううん。むずかしいなあ」「本当のボランティアって、何でしょうね」役場の方のこのつぶやきが、今でも心に響いている。Ｑ二千四年、日本
298,控訴期間の二週間を経過すれば、判決が確定します。したがって、この判決を添付して、役場へ離婚届を出せば、それで離婚ができるということになるのです。四外国人と
299,た大きな理由は、役場のそばに新しいショッピング・センターを作るためであって、その建物は役場からの借金の担保になっている。これが完成したら、役場はそのなかに入る
300,土・日曜十時〜十七時（※開室時間を三十分延長しました）休館日月曜・西公民館図書室（役場２階☎四十六．二九一五）月・水〜金曜９時三十分〜十七時三十分土・日曜９時三十分〜十六時三十分
301,産婦人科に書いてもらった「妊娠証明書」が必要なところもあります。また、担当も役場の福祉担当だったり保健所だったりする場合もありますからお住まいの自治体のＨＰでご確認ください
302,たんびにきて家」や地元の直売所に出す。そのほか、県の出先機関や役場、飲食店、知り合いの勤める職場などに売り先を開拓して、販売額は約六百万円まで増えてき
303,内部でいざこざはないんだろうなということを念押しをしておる。その記録が町村の役場にあるわけであります。そこまでやっておるにかかわらず、皆さんはこの問題を、
304,で包み、達者でいるのを知っていたといった。上京してから何回も役場に電話して、クマが元気でいるかを問い合わせていたといった。それから
305,ふき出したのだ。しかも、流れだした溶岩が住宅街にむかって、山を下りはじめた。役場では、みんなが騒然となった。溶岩が山すそまで広がったのは、五百年ぶり
306,しかし、たとえばどれくらいの雨量まで堤防が耐えられるか、停電になっても役場ではどれだけの時間自家発電が可能なのか、ある避難所が危険になったとき
307,を実施する場合は、そちらが優先です。なお、その場合はお手数ですが、役場までお知らせください。また、農協組合員が農協の助成を受け帯広厚生病院で受診する人間ドックは、特定健診
308,間近になってそんな悠長なことは言っていられない。妻に頼み、奥多摩町の役場にカタクリの咲き具合を照会してもらった。「大分咲き始めているから連休もなるべく早い時期に
309,、調査開始いらい最悪となっています。働く人の中でもっとも多いのは、会社や役場などで雇われる雇用者です。自分で会社や店を経営する自営業主や、家族でいっしょ
310,して審判を受け、許可があったら審判書の謄本を添えて市区町村の役所（役場）に届けます。ところで、改名をしたいがとても“正当な事由”に
311,兄弟姉妹である場合は，改製原戸籍を求めることが多くなり，また転籍が絡むと各地の役場に改製原戸籍を依頼することが少なくありません。届出人に対する戸籍謄本の追加請求はクレームに
312,で生きていこうとしているのかしら。私に気を遣って）真行が少し役場に用事があるから、と出掛けた。昼食の後片づけを手伝って台所に立っ
313,の収入が少ない場合は、申告の必要がない場合もありますので、最寄の役場の住民税課にお聞きになってみた方がいいですよ。
314,奉仕する、大学教育を受けた教師が配備された良質の小・中学校が必要である。行政地区の役場のある町に小・中・高等学校を設置し、政府は生徒に対して制服、靴、食事、教育に
315,は過敏になっているはずなのに、それは異常だと思います。お近くの役場の「国勢調査実施本部」又は総務省統計局に通報した方が良くないですか？調査票と一緒
316,と回って、川津町に到着しました。お〜！咲いてますね〜♪役場の臨時駐車場に車を止めまして、桜並木の川沿いをそぞろ歩きですね。役場の
317,町の二つの郵便局に役場の支所が移転した。町職員一人ずつが常駐、郵便局で役場の用事も済ませる「ワンストップサービス」が全国で初めて始まった。■行政事務を代行
318,○昨日、高根町の役場の玄関でマンホールの蓋のデザインを飾ってあったので一枚パチリ。本物は家の
319,より壬生町消防団に入り、千九百九十七年より二千五年まで団長を務める。〜妊婦さん・赤ちゃんの家庭訪問で地域と役場のパイプ役〜◆母子保健推進員さんに感謝状◆４月二十八日壬生町母子保健推進員の総会において、感謝状の
320,社員は退社事由となり、株式会社の取締役、監査役は退任事由となります。本籍地の役場の破産者名簿に登載され、身分証明書に破産者である旨が記載されます。但しこの身分証明書
321,参加者は那珂川町役場をスタートし、那珂川に沿ってウォーキング。裂田溝や安徳台を巡り、ゴールの役場に戻りました。途中、チェックポイントで用意されているゲームやクイズなどにも挑戦。
322,ていますか？高齢者の総合相談窓口として各市町村に設置されており、那珂川町では旧消防所跡の役場第２別館１階にあります。（みどりの旗が目印です）相談内容○病院から退院して
323,の夫の子と推定され、嫡出子（婚姻によって生まれた子）としての出生届を役場に出すことになります。この場合、出生届は母が出さなければなりません（戸籍法
324,があるらしく、毎年その分は消えていくそうです。保険証がないと困るので、役場に毎月五千円位を持参し、保険証をもらっているようです。何年か前に、役場
325,」国民年金「再交付の申請書を市区町村役場に出してください」とあります。年金相談サービスセンターというのが役場なのかなんなのか分かりませんが、市町村役場か、社会保険事務所に行かれたら
326,の県議。このため県議の一人が同村役場にいた酒井村長に確認したところ、本人が役場から送信したことを認めた。送られた県議らは「知事の責任問題に関する意見
327,たので、大いに役立ったとの事であった。いよいよ工事が完了してしまうと主人も役場に出勤することになった。三十六歳になっての再就職である。学校新卒者と違って三人
