,0
109,たものですからね」棟居は相手の表情に視線を凝らしながら言った。役場で閲覧した戸籍によると、この内儀がよしのの息子の嫁である。とすれ
110,伝統あるいは芸能や文化などがあるわけですが、この守り手というのは、実態は役場だとか学校だとか郵便局、農協などに働く人々が中心なわけです。
111,そろえることです。自分で市区町村役場へ行って自分で戸籍係に請求すればいいのですが、役場に行くことができないときには郵送で戸籍謄本を取ることもできます。原戸籍が遠隔地
112,れた「行政相談委員」が相談に応じます内容：住民の皆さんから、広く行政（役場）に対する苦情や意見・要望等をお聴きして、苦情の解決を促進するとともに、それらの意見を
113,だと思います。職場体験を終えて西有田中学校３年■■■■（舞原）職場体験の第一希望が役場でした。１日目はとても緊張していましたが、職場の人たちのおかげで２日目の
114,をアイデアと実行と情熱で克服し実現してきたことで，双海町のイベントも一年を通じて役場や地元の住民の手によって行われるようになった。そのような若松さんの
115,車イス利用者）に配慮しよう、４地域住民と観光客の両方に配慮しよう〉をとりまとめると共に、役場によって示された予算条件（総額三千万円）を踏まえ、簡単な見積もりも行って計画内容を
116,七月、除籍となり、公安局に逮捕された。五十五年末、寧夏に移り、賀蘭県京星郷で役場の文書係となる。五十六年八月、中共甘粛省委員会幹部文化学校の教員となる。そして千九百五十七年。詩『大風歌』
117,。問合先役場環境保全課環境保全係（内線５６４）新たに廃食油回収ポストと布リサイクル回収バッグを設置する９つの施設１役場２保健センター３サンドームおとふけ（総合体育館）４総合福祉センター５木野支所６
118,息子は四十七歳、国民年金に入っていないので、『私が保険料を立て替えるから』と役場に行ったら、これから国民年金に加入しても、二十五年に足りないので年金をもらえ
119,わしは口べたでうまくはいえないが、創太がいってくれたとおりじゃ。わしは役場の仕事をしながら、人や畑に害をおよぼす動物を殺してはきた
120,や山林の樹木等はなるべく早く撤去して下さい。土地の代金や上作等の補償については後日役場をとおして支払金額や支払方法及び支払日時、場所等お知らせ致します。皆さんも突然の話で
121,限り、どこの誰か、また誰に連絡すればいいか、全く見当が付かない。役場の人は警察の立ち会いのもとに、町はずれの無縁墓地に丁寧に葬った。お遍路さん
122,出生届を役所に提出しなければなりません。この用紙は最寄りの市区町村の役所（役場）の戸籍係窓口でもらえますが、産院や産科のある病院ならほとんどが用意しています
123,、麓の元町市街に流れ始めた。町投場このとき、町役場はどうだったか。役場の職員は、異様な光景にあ然としていた。役場には噴火を取材する
124,木をくり抜いたものを叩いて、演奏いたします。」とカカを紹介した（小笠原村役場千九百九十四）。このときまでにカカを伴う南洋踊りは、完全に小笠原島民による自己表現の手段
125,がおくれたからだと、当時はずい分激しく責められた。このとき、秋田さんも役場の一員として、避難するのを手伝っていた。一番責められたのは、総務課長
126,でも田舎を歩いて見ると、普通の工業でないものをも工としてゐる。役場や警察で戸籍上職業を大別する時にもさうで、たとへば斬髪屋なども工の中へ
127,ホームページに写真などの情報を掲載しています。犬がいなくなったときは、役場や保健福祉事務所へ連絡すると同時に、町や県、近隣市町のホームページも確認してください。
128,、このとき、あるつらいできごとを思いだしていた。千九百五十七（昭和三十二）、秋田さんが役場に勤めてから五年目のことだ。この年にも、三原山は噴火している。中規模
129,送達され、確定するのを待って、判決を添えて離婚届を、あなたの住所の役場へ出せば、手続きは終了です。離婚訴訟にあわせて、慰謝料、財産分与、子の
130,交付昨年から町内での業務を開始した株式会社戸田レーシングへの企業立地促進奨励金交付式が１月十五日に役場で行われました。これは、町内に新たに工業用地を取得し、雇用機会の拡大等
131,ちなみ「鰹乃國（かつおのくに）」の愛称で地域活性化を目指す高岡郡中土佐町。役場のある久礼から海岸線に延びる県道を南へ六キロ余り。トンネルを抜けると町人口の二割
132,二年を過ごした森の中の菊次の小屋の思い出が、どっとふきあがってくる。役場の前では、恭之助がぼんやりと立っていた。いやな予感がした。
133,十時頃まで寝て役場（図書館も）行き、帰ってから読書＆飲酒。「犬と私の十の約束」
134,向かったってわけよ」秀洋がスミ江を見る。「でも、あいつらどうやって役場にアクセスしたんだ？」「ヤツらは地蔵ヶ原で肉体を失い、元の姿、
135,にうまれ、十八歳の秋に村の青年と結婚した。夫になった男は役場に勤めていた。やがて二人の子をうみ、お咲さんは二十四歳になった。この
136,かなァし」「そうじゃ。早よう行け。それまで電話を切るなと、役場の連中に言うちょけ。もし切ったら、切ったやつを捜し出して、八つ裂きに
137,長寿の里ゆずりはら」老人クラブ連合会が建てたもので、わきに協賛のようにして役場と社会福祉協議会と警察署が書きそえてある。長寿になぜ警察が顔を出すのか不明だ
138,の年金から天引き（特別徴収）される納付方法に変わりました。しかし、８月上旬に役場から「国民健康保険税のお支払い方法の変更について」の文書が届いた方は、申し出
139,して、智恵子の心をいやそうとしました。道中、智恵子が生まれた町の役場へ行き、正式に入籍の手続きも済ませています。智恵子が四十七歳のことでし
140,、担当部署に用意してあります。詳しいことは、担当まで気軽にご相談ください。申込・問合先役場商工観光課商工労働係（内線７３２）ホームページにキッズページを新設町水道事業では、子どもたちに上下水道
141,おすもうさんとあそぼう・表敬訪問大きな力士にびっくり！大相撲名古屋場所を控え、田子の浦部屋の親方が、役場を表敬訪問しました。中部児童館には、同部屋の西山力士・久の虎力士が登場。子どもたちは
142,のバスを、芝山町役場前で降りる（ＪＲ成田駅前発のバスもあるが、午後一便だけ）。役場の入口にコースの案内板があるから、概略を頭に入れて出発しよう。最初の
143,役場に毎月五千円位を持参し、保険証をもらっているようです。何年か前に、役場の人が取立てに１度来たきりだそうです。必死に働き、請求額を滞りなく
144,たのだ。川舟で漁をしていた人が見つけ、派出所に届けたらしい。役場の人もやって来て、身元を確かめようとお遍路さんの持ち物を捜したが、
145,もらっておれはもらえない。これは非常に悩ましい問題でありまして、それじゃ、例えば役場でもどこでもいいんですが、勤めていて、そこで給料はもらいながら土曜
146,行ってきた。予定通りニセペンキ屋。明日は恒例の役場。役場のトコらへん祭なので行き帰りごった返すかも。今日はやや早仕舞いだったので帰り
147,その年分（役所の場合は年度です）までは支払わなければなりません。（役場から納付書が届きます）そして、やめた年の分までの給与に対しては、翌年
148,ほどだが、列車到着に合わせて村営バスが漆島まで１日数本運行されている。詳細は役場に問い合わせること。ただし名古屋からだと、飯田線の普通列車を乗り継いでも、大嵐駅着が
149,の代わりに大田町（当時）役場まで、父の遺品を取りに行かされた。役場で受け取った白い布に包まれた箱を抱えて戻ってくると、門徒が
150,。高知県の最東端、太平洋に面した東洋町。今春、この町の二つの郵便局に役場の支所が移転した。町職員一人ずつが常駐、郵便局で役場の用事も済ませる「
151,自動車安全運転センターが今年の５月１日以降に発行した無事故・無違反証明書を添付し提出してください。※無事故・無違反証明書の申請書は役場と木野支所にあります。申請には手数料七百円と郵便振替払込料金がかかります。▷提出期限
152,た。学校は遭難事件でごった返えしていた。彼は有賀喜一から急ぎの用を云いつかって役場へ行く途中だった。樋口に会ったが話している時間はなかったから目で
153,いただきました図書カード町内で活動する団体「ボランティア芽ぶき」の会員が、十一月十六日（金）に役場を訪れ、町立小学校と子育て支援センター「すくすく」に総額二十三万円分の図書カードを寄付しました。
154,のではないかというふうに想像をしております。○鈴切委員ことしの八月四日、大分県の役場がお盆休みということで職員がいなくなり、そのために警備員が埋葬許可証を発行した
155,うれしそうな顔をしていた」という言葉に胸を打たれ、早速、役場の福祉課を通じてもらってきたのであった。「体が大きいから、手動式で自走式
156,ません。ムチです。このような合併促進策には批判もあります。合併すると役場への距離が遠くなり、車を運転できない高齢者には深刻な問題です。さらに
157,子を親の戸籍簿に記載します。また、人が結婚したときも同じように役場に婚姻届を出します。婚姻届が出されると、それまで親と一緒の戸籍に
158,デジタルカメラ中川保育園へ▼匿名希望金一封矢掛町へ求人情報ハローワーク笠岡（☎０８６５六十二二千百四十七）役場１階ロビーでも閲覧できます。（平日午前８時三十分〜午後５時三十分）詳細はハローワーク笠岡
159,ないときは、筑紫税務署の申告（相談）会場をご利用いただき、期限までにご申告ください。役場で所得税の確定申告の受付はできませんので、ご注意ください。とき２月十八日（月
160,も帯広地方交通安全協会入会者が受賞の条件となっています。▷申込方法推薦を希望する人は、役場と木野支所に備えてある優良運転者推薦書に必要事項を記入・押印し、自動車安全運転センターが今年の５月１日以降に発行し
161,県外の医療機関などの場合や、県内でも提示し忘れた方は、領収書をお持ちになって役場で申請をしてください。児童手当現状届を提出してください住民福祉課福祉係６月に発送いたしました児童手当の
162,もちろん、窓口は五時で閉まっている。受付時間が変更になったわけではない。ただ、役場の人員が減っていた。保健係の石田は失踪したまま行方が知れない。他
163,いかないし、「株主にも合わす顔がないですからね。場合によっては役場の公印管理の責任を問うつもりでいます」（高知銀行）いずれ訴訟をも辞さ
164,窓口支払が自己負担限度額までとなります。七十歳未満の人が入院した場合には、限度額認定証を役場で申請してください。この認定証を医療機関の窓口に提示することにより、支払いは自己負担限度額までと
165,て記入・押印のうえ、期限切れの受給者証とともに提出してください。新規該当となる場合は、役場までお問い合せください。《福祉医療受給者証の使い方》県内の病院、処方せん薬局などにかかられるとき、
166,ので高速をノロノロ午前十一時半やっと着いた諜報活動開始１〜４もう少し足を伸ばせば【役場のよん様】がいる町が近い午後十四時終了次の場所に移動午後十五時半諜報活動５
167,意味なのです？」「僕やある社の記者が、沼について調べはじめた。役場にも何度か足を運びましたよ。そうしたら、あなたたちがやってくる
168,秋田を間近に見ていた町役場の職員は、こう語った。「噴火が役場に迫った時、職員の大半が、対策本部を解散して、逃げる準備を始めた
169,火」とよばれる三原山。この山の噴火で、観光客は、ますますふえるにちがいない。役場にも、噴火を取材するためにたくさんのマスコミが集まってきた。島の中に
170,納付書が届きます）そして、やめた年の分までの給与に対しては、翌年に役場に申告する必要がありますね。ただ、その年の収入が少ない場合は、申告
171,、自治体職員が住民と直接ふれあう機会が少なくなり、「顔の見えない行政」「役場」になるという問題もあります。住民サービスが後退します第四に、福祉など住民サービス
172,もめた。両村とも一歩も譲らず、難航した。その結果、苦肉の策として、役場を一定期間ずつ交互に置くことになった。合併してから８年間は毎年移転していたが、
173,市区町村…午前８時三十分から午後８時、選挙が行われていない市区町村…その市役所または役場の執務時間中手続きは…１「不在者投票宣誓書・請求書」で、市選挙管理委員会事務局に投票用紙の交付を請求（請求者
174,でくれ。この電話は金沢からかけちょる」大竹という、熊吾の口ききで役場に就職した遠縁の青年の声が聞こえると、熊吾は、さらに大きな声で、
175,経費がバカにならない。千九百九十五（平成７）年に移転を取りやめ、明木地区に役場を固定することで決着した。■小郡町ｖｓ山口市小郡町と山口市はいまでも仲が悪い
176,リサイクル品の販売も行うエコドーム事業が開始される予定です。この他、再生品の販売も役場や病院・学校に販売しています。だいたい以上のようなことを進めています。司会ありがとう
177,た。話は変わりますが世紀末の千九百九十九年、日本では地域振興券という商品券が役所や役場から発行されました。そんな中で鳥取県の大栄町発行の地域振興券は、コナンの原作者・青山剛昌先生が
178,知っちょることを正直に喋らんと、あとで厄介なことになる」役場で何人もの刑事が待っているというのもおかしな話だな…。熊吾は自分
179,ファックスの回線を工面してやって、役場に五十万フォリント払わせるようにした。さらに役場はこれらの事業所に百万フォリントのクレジットを、二十八％の高利で提供している。このほかに
180,日）、午前十時〜午後２時三十分▷ところ○木野地域町民センター（木野支所）２階会議室○役場１階税務課納税係（出入りは北側入口をご利用ください）※税務課納税係では、役場執務時間内に、いつでも納税相談
181,お気軽にご参加ください。■日時９月三十日（火）午後２時から３時三十分■場所役場講堂■講師倉田歯科医院院長■■■■先生／上伊那口腔保健センター歯科衛生士■■■■先生／役場理学療法士■■■■テーマ
182,が使えますが、手続きはお済みですか？市町村長が証明書を発行しますので、役場の担当課にお問い合わせ下さい。扶養者が給与所得なら、今年の給料から天引きされる所得税も安く
183,（午前８時四十五分〜午後５時三十分の間も相談を行っています）▷ところ役場１階税務課納税係（出入りは、北側入口を利用してください）【休日納税窓口】▷とき５月十七日（土
184,植村秀正町長（六十三歳）文字通り最高責任者。午後四時十五分の大噴火を受けて、植村町長は役場の町長室の隣の十畳ほどの会議室に「対策本部」を設けた。・秋田壽
185,ました。１計画素案の閲覧場所（次の場所でご覧いただきました。）○町役場総務部総務課消防交通係○公民館（壬生中央公民館・稲葉地区公民館・南犬飼地区公民館）○生涯学習館○町ホームページ２募集期間平成十九年十一月二十二日
186,『世界を元に戻す方法はこいつらが知っている』のメッセージがよぎる。「役場へのアクセスはセキュリティウォールの突破にコツがいるだけでそれほど難しい話じゃない。一回目
187,ています。その中には、自転車や家具などがあります。ここで、役場の住民環境課（リサイクルプラザ）で分別作業や自転車作りの職場体験をした西有田中学校３年生の■■■さんと■■■さん
188,れた「行政相談委員」が相談に応じます内容：住民の皆さんから、広く行政（役場）に対する苦情や意見・要望等をお聴きして、苦情の解決を促進するとともに、それらの意見を
189,たころには、八月の終わりから十月にかけて、毎日のように住民から役場に電話があった。電話がかかってきても、そのほとんどがなんらかの
190,声無き抵抗だったのでしょうか？！ダムの貯水率が三十％を切ると姿を現す役場は毎年見ることが出来ます！ダムの恩恵を受ける者はそのダムが持つ歴史を知っ
191,時代の建物が残っているが、これを保存し維持していく金をどう工面するかで、役場は頭を抱えている。この町には従来通常予算として国から年に二千万コルナが下り、
192,の収入役「十五億円横領」穴埋めは誰がする高知県土佐山村の収入役が村長印を勝手に使い、役場の予算や地元金融機関から十五億円余を引き出して着服した事件があったが…今後、この
193,。助役の秋田壽さん（六十一歳）しかいなかった。秋田さんは大島で生まれ、三十五年間役場に勤めていた。島の事情を、だれよりもよく知っている人間だ。
194,これらの事業所に百万フォリントのクレジットを、二十八％の高利で提供している。このほかにも役場は、村内の協同組合にも同じ利率で六百万フォリントを貸し出している。そのため役場には
195,街の話題飛躍へのステージ応援します１月には、次の皆さんがそれぞれ役場を訪れ、山野町長からの激励を受けました。（写真右）第十四回西日本小学生ハンドボール大会（総社市）に
196,歯の健康をチェックしてみませんか？問合先保健センター保健課☎４２‐２７１２事業主向け制度を利用してください申請・問合先役場商工観光課商工労働係（内線７３２）産業研究開発支援助成金を利用してください町では、新製品の開発および新産業創出等
197,競売物件！＠ほーそれなら安いでしょう。特に、今はね。＞これは役場に昼間連絡しないといけないのが邪魔くさーいですが＞楽しみながらトライし
198,そして、帳場に行き、番頭に長距離電話を頼んだ。「愛媛県南宇和郡城辺町の役場じゃ」と熊吾が言うと、番頭は、「愛媛県の南宇和郡。ちゃんとかかるが
199,新町の種の生家のあった場所と、大室よしのの家の所在を聞いて、役場を出た。上新町は、商店街であった。種の生家のあった番地
200,田植えの準備が始まるころから外での労働時間はぐんと長くなった。村の役場では朝五時と夜九時にサイレンを鳴らすのだが、五時のサイレンで起こされる
201,でいる事業主も、雇用の時期により対象となる場合があります。※事業計画書様式は、役場商工観光課にありますが、北海道雇用労政課のＨＰからダウンロードもできます。（２）補助申請
202,も聞かされたのは、地方自治をこれからどう進めていいかわからないという、役場の幹部の歎きであった。社会主義体制の時代には、地方行政は上から割り当てられ
203,て、海にばらまくと言うちょけ」大竹は慌てて電話を置いた。役場から北裡の家まで五分。往復で十分。まあ、それまで番頭と話でも
204,てきた。一方、「地域の力」という点では、日本の山村は役場、地区、集落、協同組合等のしっかりした組織があって、しばしばそれらの組織が自主的
205,。引き取り場所や日時、手数料などについては、次の表のとおりです。※役場での引き取りは行いません。伊万里保健福祉事務所まで連れて行くことができない場合は、出張引き取りを
206,法被十五着。セールスに駆け回る内藤印刷社員の藤原克夫さん（五十二）は「趣旨は理解してもらえるが、役場や周囲に気を使って、のぼり旗を立てるのに踏み切れない人も多い」と
207,母・頼子の足もとにくっついてうろうろしていた幼いころの、ある日の午後だった。役場の職員が来て、母に何か紙切れを渡し、二言三言頭を下げながら話し
208,な方向で鋭意取り組んでいただきたいと思います。さて、同じ四百六号絡みで、実は鬼無里村の役場のあるところが村の中央地点ともいうべきところなんですが、そこから県庁まで
209,同じ月内の医療費が高額となり自己負担額が下記の自己負担限度額を超えたときは、役場に申請することによって、限度額を超えた分が高額療養費として給付されます。なお、「
210,たのであろう。一方、婦人会による〈レモン林〉〈丸木舟〉は、ピアノ伴奏付で（小笠原村役場千九百九十四）、白いブラウスと紺のスカートで衣装を統一した女性が、それぞれ楽譜を
211,２は聴覚障がいのある人へ筆談などで対応できるよう配慮していることを示すマークで、役場の窓口などにも表示しています。３はオストメイトの人が利用できるトイレとして、町内
212,られない場合※飼い犬の所在地が変わった時や死亡した時、飼い主の人は役場に届け出をしてください。指定ごみ袋取り扱い店舗について問合先役場環境保全課環境保全係（内線５６３）平成十六年
213,、十年ぶりに島に戻った。昭和二十八（千九百五十三）年、二十八歳の時、役場に転職。初めて町役場に出勤した日、「随分のんびりしたところだと思いまし
214,…Ｇｏｏｇｌｅマップで山奥か否かを確かめてますただ最近秘密兵器をみつけました役場や市町村の競売物件！これは役場に昼間連絡しないといけないのが邪魔くさ
215,の立地にあたって、土地とエネルギーの便宜を役場が与える形をとり、その見返りとして役場に地代を一平方メートル当たり六百フォリント、合計二十四万フォリント支払わせている。また、これらの事業所に電話と
216,なったのだ。秋田さんは、あの十三時間をのりきった自分をこう思っている。「役場では、三十数年、与えられた部署で、その仕事をコツコツと一生懸命とりくんできまし
