,0
214,か。もし、これで逢えばどうなりますか？こう言うのはまともな業者で無いですから覚悟してかかってください！やってみないとわからないですね！
215,産業廃棄物最終処分場建設の必要性は、高まってくるものと思われます。現在、産業廃棄物最終処分場建設については、業者からの処分場建設の申請に基づいて県が許認可の判断を下されているとうかがってい
216,を受領しましたのが十二月でございます。○堂本暁子君それは結局十二月に落札した業者をお認めになったということですか。○参考人（天野貞夫君）違います。私どもは手続的に
217,表示食糧庁が行った米販売業者の点検で、精米年月日などで不適正な表示をしていた業者は１割（二千六百六十六）にのぼり、内容を偽る悪質なものもあった。また、
218,手数料を支払う場合は、業者がその後の金銭の支払可能性を約束する取引であるため、業者のデフォルト等によりその後のキャッシュフローの支払が行われなくなるリスクが生じるし、期限前解約し
219,ますよと言う事にしているそれならいいやとたいていどっかに行ってしまう一応業者に連絡するが詰まっていた事はなかった昨日もそんな事があり不景気だからまた
220,の募集をしているところもある。そこで、お伺いしますが、現在こうした業者あるいは市場というものはどれほどあるのか、お答え願いたいと思います。○河本国務大臣金
221,はなかなかいかないんじゃないか。金額的に八％ぐらいだということですから、地元に大きな業者がないといえばそれまでのことですが、しかし発注の仕方によってはもっと高める
222,、これが今回の改正になりますと、地方団体の執行機関ということになりますから直接業者は訴えられないと。そうなると自治体は、これは変な形ですけれども
223,などの外観だけでなく、自分の目で見て耳で聞き雰囲気を感じてみてください。業者との相性を確認することができます。利用者への対応がきちんとしている業者なら安心です。
224,時間的余裕がなければ、過払または債務が不存在だとして（あるいは不渡が生じれば業者への支払も困難だとして）商工ローン業者と直ちに電話で交渉すれば、依頼返却の
225,諸条件）をしてもらいに金融機関へ行き、その銀行マンからお勧めの業者を聞き、その業者へ行き誰々さんの紹介で来ましたって言って接すると担当する営業マンも心
226,店はなく、材料の入手には大変苦労しました。結局、ニューヨークやテキサスの業者と直接話し合い、そこから仕入れることにしました。ご夫婦同伴で遊びにみえた駐在員の
227,連絡先を知りたいときは、これを使うと便利です。たとえば赤ちゃん用品を扱っている業者について調べたいときは、まず、「職業名・サービス名一覧」を開いてみます。そこから「赤ちゃん用品
228,ＬＡＮボード（業者により異なる）特徴●比較的高速で常時接続が可能。●通信速度やサービスが業者により違う。また、業者ごとにサービス提供地域が限られている。●申し込みは各提供事業者に。一般的
229,を落とす場所はいくらでもある気がします。たまたま先週から入っている外壁工事の業者の方から大きな脚立をお借りし、隅々まで洩らさずの意気込み。フローリングの床も
230,の七十万円と同額を言われることが多いとかニュースでやってますが、こんな業者は最低ではないでしょうか。こういう時こそ奉仕の精神でなるべく金額を抑える業者こそ
231,ということで違約金の上限を十五％と定めたわけでございます。この根拠は、業者が資金を市中の金融機関から調達する場合のコストでございますとか、通常取引で用い
232,ているのでしょうか？中古ピアノを買って、そのピアノをどういう風に有効活用し、最終的に業者の利益にしているのでしょうか？ご回答お願いします。一旦再生工場に持って行くようです
233,その打開策を私から提案しないといけないんだ！！２録音聞き直したらその業者の口から「社長に怒られるし私も恥ずかしい」なんて・・普通
234,注文住宅を建てられた方に質問です。間取りは希望を伝え、業者に頼みましたか？それとも自分で作ってそれに手を加えてもらいましたか
235,ました。ちっちゃいカセットテープみたいなのですが家にはハンディーカムが無いのでみれません。業者に頼むとＤＶＤに写してくれたりするんでしょうか？知ってる方教えてくださいお願いします。
236,がわずか三千円程度で住民基本台帳補助の閲覧ができてしまうわけだ。そして、市役所などでは業者に雇われたパートたちが総がかりで、この台帳を写している。ちなみに、この場合は
237,を借りて、全額をこちらに預けてほしい」と言われ、お金を借りた。業者にお金を送る前に、心配になり、友人に相談すると「だまされていない
238,今日は８億の中古マンションアパートを『高利回り』や『駅近くの物件』を県南や都内感覚で業者から買い大失敗して、痛い思いをしながら、覚えた専門家の体験談です★失敗の
239,ても連絡がありません。普通便での発送を自らが希望したのにかかわらず、業者に配送確認をしたうえでメールで督促にすると、電話で「まだ商品の到着確認
240,購入の依頼を受けていること。根のついた取引乗りひとつの物件に複数の業者が介入することコンピュータアーケードゲームゲームセンター用のゲームアベンド稼働させたプログラムに異常が発生し、正常な
241,，いわゆる転貸人である場合である。その転貸人が，よく名の知れたサブリース（転貸）業者ならばともかく，よく分からない会社名であったり，またまったく第三者の個人であったりする場合
242,ものに限って禁止法を仮につくりましたといたしましても、どうせ悪質な業者のことでございますれば、いろいろ悪知恵を働かして、その法律の目をくぐって
243,２：配達業者（佐川とかクロネコとか）に連絡。つか、間違えたのは業者なんだから業者に電話入れる方が正解かと。そのワンピースのこと、同姓のその方
244,展開に伴っての調査を大変まめにやっていただいていること、これはまず下請の業者の方が非常に喜んでおられることの一つでございます。ところが、どうしてもこの法律
245,というので、父親の旅館でもとの生活に戻り、商売に身を入れて業者の会合にも出たりしたが、同業者の親睦会で一泊旅行に行ったときすでに
246,となってくるはず。（２）パートナーの確保通関上の問題、貿易実務を代行してくれる業者をはじめ、生産地から現地までの流れをシステム化し、販路を確保するためには、現地での
247,いたしました。○諫山委員この改正で問題になるのは、食管法違反で処罰された業者の問題です。現在、登録業者が二十九社あるはずですが、この二十九社の中で食管法違反
248,）、（リフォーム工事総合保険）引き渡した工事の目的物自体の損害をカバーする保険…瑕疵保証責任保険【７業者の事業所を訪問】業者を五、六社リストアップした段階ではまだいいですが、二、三社に
249,がすべての技術をまかなうことはほぼ不可能と言ってもよい。それだけに、外部の業者の選定においては慎重を要する。システム系業務をアウトソーシングする場合、一般的にその委託業務内容は次
250,流動性資金，市場などの問題がすべて政府により解決された。政府は紡績産業を統制しながら業者の経営を支援し，優遇された加工賃を手にし，巨額な利潤を獲得していっ
251,、どこの業者に修理依頼しているのか尋ねれば、業者名を教えてくれますから、その業者に聞いてみてはどうですか。交換する場合、ボンネット下のジャッキアップ専用の丸い金属が
252,にも，インディアナ州サンタクロース市には私書箱があるし，それを商売にしている業者もいます。親が代金を払い込めば，子どもの欲しがっていた品物がクリスマスイブに
253,何の音沙汰なしになってしまって４ヶ月が経ちました。今回の連絡では勝手に業者を頼まないで下さい、そうじゃないと料金はお支払いできない、という事を言われました
254,にも、少しでもおかしいと思うことがあったら、すぐ家にいらっしゃいと繰り返して、業者の人達と帰っていった。それで僕は、こうして彼と家
255,。落札された方が（私は北海道なのですが…）本州等の場合どこの業者が届けてくれるのでしょうか？教えて下さい。ちなみに北海道〜東京だと送料はどの位な
256,のＲＩ同様、第一ラジオアイソトープなどで購入できるはずです。私も使っています。実験施設の出入りの業者に確認をされては？上の方、別に怪しい物質じゃないですよ。とくに
257,２万円の方がトラブルの元だと思うんですが。顧問の先生に電話して、業者へ振り込みに出来ないか聞いてもらったら、それでいいとの事。なら、何
258,た。その影響で農業用のビニールが供給されなくなり、価格が高騰したうえに、業者が売り惜しみするようになったのです。Ｓ社は、これまで売れなかったために大量に
259,、協定量を若干下回るのではないかという感じでございます。○加地分科員それから、わが国の業者の方では、韓国との協定内容については生糸と絹織物の二つに分けると、
260,通信販売全体の信用を失墜させるということになるわけでありますし、千差万別で、しかも無数の業者のすべての行動について通産省が全責任を負って監視するなどということは、人手の点
261,改造をしなければなりません。なお、これらの工事は市が指定した業者でなければできません。◇処理区域福住町・山田町（下記の水色部分）◇詳細は、下水道課
262,の責任者が隠されてしまった。ひょっとすると、「つくる会」の人たちが主張する「業者による『慰安婦』集め」だけ、そして「業者による個人責任であって、国家責任はない。」を
263,アンモナイトなどの化石を買い取ってくれる業者はありますか？ＹＡＨＯＯ！オークションで出品されています。業者を探すよりもいいかもしれない。
264,になったからだ。溜まった糞尿は、夜の十時から夜明けまでに汲み取り業者が集め、糞尿処理場の溜池まで運んでいたが、汲み取りは有料であった。日本の
265,その時刻に届け物をしていたのだという。毎日決まった時刻に店に来る業者だそうだが、なんとなくおれはそこに作為の臭いを嗅ぎ取った。いかにも
266,の円滑かつ適正な転嫁）も確認してるところである．ところで，取引の際に業者が「外税」の形式で３％の消費税相当分を表示したとしても，法的に「価格」
267,。そういう面では、この規定の効果は、御指摘のように、不適当な業者を排除する最後の担保手段、こういう形になろうかと思っております。したがいまして
268,、母屋も私たち夫婦宅と同じく、オール電化にすると契約してしまったようです。でも、その業者は２人とも若い茶髪で香水プンプンな兄ちゃん達でして、ここは岡山県なのに変な
269,時間を与えずに契約を急がせたり、その日のうちに工事を始めてしまう業者も多く見受けられます。点検商法の被害に遭わないためには、いきなりやってき
270,関西で有名な引越し業者といえば、どの業者でしょうか。見積もりの段階で値切れたのはアリさんですので、私はアリさんを推し
271,業者案内が入居の基本です』近くの業者を大切にして、案内が出来る近い業者に、まず挨拶すること３他社の入居資料を、参考にして、自己アピール出来る、入居資料
272,で一応のチェックはしますが、詳細は分からないことも多いので、それぞれの業者から請求された額を、そのまま支払うことが多くなりがちです。発注者が強い
273,ている。住東京都江東区森下５‐二十‐４☎０３‐５６００‐００１７ｗｗｗ．ｖｅｄｅｒｅ‐ｓｉ．ｃｏｍ／ＡＦＴＥＲ最近は業者のオークションも進化。店頭で商品をチェックしてもらった後、衛星と電話回線を使った
274,、私どもも驚いてしまいましてね、何とかかすみの間だけはのこせないものかと業者にお願いをして」「ていねいに手でこわされたとか」「
275,いえば、体のいい借金なのである。数ヵ月（中には半年などという図々しい業者もいる）の間、無利子で金が手に入り、督促もなし。これ以上の
276,てみせる。たとえそうであっても、本体工事の欠陥を認めてはならない。そして系列下の業者を差し向け調査をさせて、格安の費用で目立つところを直すのが、会社
277,も、値段の割に質が悪ければ、買わなければいいんです。良いものを提供しない業者は自然に潰れて行くのは当たり前です。それを何で鬼の首を取っ
278,かたちで」これまで、確かに闇金融の業者を、二つ潰した。しかしその業者は、社名と場所を変え、また営業をはじめている。私のやっていることは
279,を刻みつけ、時代のイメージをワインに押しつける。ボルドーのブドウ園では、九十五パーセントの業者がワインを生産し、五パーセントの業者がワインというものを創造する。創造はつねに、
280,に相通ずるものがある。松葉は束の間であったが、車を盗んだ現場から、業者のガレージまで運転した感覚が忘れられない。すべてのメカニズムは彼の意の
281,厳しい」「非常に厳しい」としている。総貸付残高別では、非常に良いとする業者は皆無であるが、千億円以上の規模の大手では「良い」とする比率が二十五．〇％
282,でございますけれども、やはりこの問題につきましては、およそ訪問販売を行います業者及びそのセールスマンとしてまず第一に心がけねばならない重要事項というふうに考えておりますので、これを
283,の敬意を忘れません。相手が部下であれ、新人であれ、あるいは取引先や下請けの業者であれ、その人間に対して根本で敬意を持っています。立場やキャリアや能力の
284,できる」とうたって在宅ワークの求人がよくありますが、ほとんどの場合は悪質な業者によるものなのでしょうか？それと、インターネットで在宅ワークを探す事は可能ですか？
285,に行われている。これらは，市町村の直営によるもの，市町村の受託を受けた業者によるもの及び一般廃棄物処理業の許可を受けた業者によるものとに分けられる。第２‐２
286,自分になろう訪問販売といっても、最近は、家に訪ねてきてのセールスより、業者からの電話で勧誘されたり、その電話で契約という被害が増えています。
287,ｈｔｔｐ：／／ｏｐｅｎｕｓｅｒ．ａｕｃｔｉｏｎｓ．ｙａｈｏｏ．ｃｏ．ｊｐ／ｊｐ／ｕｓｅｒ／ｔａｎｓｈａ５５？評価もよく、良出品者に見えるが、ヤフオクにそんな業者は存在しない。例えばこれ。ｈｔｔｐ：／／ｐａｇｅ１０．ａｕｃｔｉｏｎｓ．ｙａｈｏｏ．ｃｏ．ｊｐ／ｊｐ／ａｕｃｔｉｏｎ／ｍ２２２８２４４１「最初にお読みください」をクリックすると・
288,ますので、ご心配はいりません」「わかりました」とご主人が答えると、業者が、「他に質問はありませんか？」と言うとご主人があり
289,。この自然塩が政府に許可されている関係で、政府発売の化学塩と、民間の業者が枠内ぎりぎりで作る自然塩の二種類の塩が店頭に並ぶことになった。もちろん、
290,かなと思います、とりあえず管理業者は必要有りませんので客付け業者として、名前を上げる業者を二者程度決めて、看板を二枚程度出し、協力や結果を見てみて最終的に決めれば
291,菓子仲間に砂糖の不正取引のないように命じているが、仲間以外にヤミで菓子を作る業者が増加、町奉行所は「上菓子に似寄りの品をこしらえ店売または内々で仲間外に売り歩く
292,で比較したものが以下の図表である。総貸付残高別でみてみると、全ての規模の業者で延滞比率が増加している。またその増減比も中小業者になるほど高くなっていることがわかる
293,五月現在二千六百七十本の立木にオーナーが契約をすませた。金権で山を買占めようとする業者に対して「あれえ、おまえさんも盗みに来たんか」とは、とてもいえない。
294,のボウルをくすねてこようと決心した。あとはメシだ。局長は電話で、業者が届けると言っていたが、アテにはならないと思った。第一、ドッグフード
295,地盤が悪くては意味がないからです。意外とこの段階で手抜きをしている業者が多いように感じられます。さて、この地盤が問題なければ基礎工事に進むのです
296,数が多く，買い手がどの業者からも同等な製品を購入できる場合，代替品を供給する業者が多い場合などは売り手の交渉力が弱いことになる。一方で，売り手にとって特定の業界
297,を相手に明確に伝え、手短に電話を切ることが大切です。さまざまな業者からかかってくる勧誘電話を避けることは因難ですが、発信電話番号通知サービスや留守番電話の機能を使い
298,がこの幸運に恵まれているのではない。ただ競争力の強い業者だけが生き残り、競争力の弱い業者は淘汰される運命にあるということである。台北地区のみをみると、年商は千九百九十八年
299,今日は朝から楽しい１日だった！というのは、仕事の業者とのやり取りをメールでよくするが、最後に一言温かさが伝わるメッセージを添える。すぐ近く
300,今中古マンションの物件を探しているのですが、仲介業者の対応がイマイチです。よい業者の選び方をおしえてください。よろしくお願いします。不動産屋＝営業マンって言う位に担当者次第で物件
301,もないのに業者が自分の手で薬殺する場合もあります。あるいは、別の業者が買い取って、実験動物として大学などに転売される。ペットショップで売れ残って大きくなりすぎた子犬
302,。そんな生の米麹は、米麹を使った漬物など米麹による発酵食品を作っている業者や甘酒などを飲ませる甘味処などで手に入ることもある。Ｑ良い米麹とは
303,や弁護士ら＝那覇地裁前である主婦の債務の変化※単位は万円、−（マイナスは業者から取り戻した額）
304,出品予定です。「食品衛生責任者」「営業許可取得済」等の嘘を書いたらばれますか？「店舗や業者ではない個人が趣味で作った食品」は、出品禁止です。免許を持ってい
305,に進学したら塾のＤＭ、娘が七歳になるとおけいこごとのＤＭとか。いったい業者はどこからこれらの個人情報を入手しているのか。これはだいたいネタはわかっています
306,に富んだ自然がある。ここに開発業者が乗りこんでゴルフ場をつくってしまおうというのだ。業者は、すでに十億もの金を投下したとか。予定地は「百入り」という地名
307,は苦しいけれども、住宅とかマンションとかを手がけておった、主としておった業者は非常に大きく今飛躍しておるという、業界の中における大きい変化が起こってきております
308,だけではない。「突きつめれば三州のほうが切羽詰まっていたんですよ」と深谷の業者がいう。つまり、三州にとって古くからの最大の市場は名古屋だが、もともと大規模
309,だ。逆に酷寒期なら保温用のシートを被せる。最近はこういうことをしている業者は珍しくなってしまった。ひどい業者になると、コンクリートを打って三、四日し
310,業者は委託契約を結ばない限りは営業ができない。ところが銀行や会社がそういう業者と委託契約を結ぶことになりますと、十分に調査をして、もしそれに該当しなけれ
311,とき、つねに近代化への立ち遅れが指摘されるが、皮肉にも近代化を推し進めた業者が姿を消し、旧態依然とした業者のほうがかえって生き残る結果となった。
312,未然防止につながります）。□引越し荷物について・荷物の積み込みおよび引渡しの際、業者と一緒に荷物の個数を確認します。・現金、有価証券、預金通帳、カード、はんこ
313,「エコ製品」の優先調達は一定の成果を見せているが、もう一歩踏み込み、調達先の業者が環境にやさしいかどうか、公共事業の入札などを通じて選別していこうという動きが現れ
314,笛田１‐十一‐三十四、☎３２‐９０９４＝平日の十：００〜十六：００）へリサイクル市出店者を募集業者は不可。先着二十人。出店料千五百円。●７／十九（土）…鎌倉宮境内十：００〜
315,ます。私は保護者ですが、幼稚園や保育園には、学研とか、そういう業者の、カタログがありました。外の遊具から、かわいいロッカー、先生向けのエプロンなど
316,の方で生年月日を聞かれたので訳も解らず電話をきりました。この業者は何をしたいんでしょうか？こんな事ありえない事だと思うんですが迷惑電話です
317,順次行き詰まりを見せてはおりますけれども、私どもとしては、このような悪質な業者というものは今後もいろいろな手口で新たにまた問題を起こしてくることは十分
318,好きの男にありがちな傾向である。江梨子の部屋には、病院勤務時代の知り合いの業者から仕入れた、本格的な内診台が設置されている。男はその上に四つん這いにさ
319,ませんと、北海道の地元の業者も相当最近は技術も向上し、太刀打ちできるような業者も育成されているわけでありますから、この工事契約については他から批難を浴びるような
320,になっておりまして、そして十四の二で、前条の規定にかかわらずこれを業者に委託することができるというふうになっているわけです、それほど半減期が短くて問題のない
321,．．。ぜひ教えて下さい。１個人が、メルアドを知る手立ては有るのですか？良く業者が営利目的に、多数の人にランダムに送るのは聞いた事がありますが？無けれ
322,必死にはならないんじゃないかしら」「偽薬で期待を持たせて儲けようとする業者が、いくらでもいるからじゃないかな」ラーラは首をかしげ、アダムを
323,た方がよいかと思います。あなたが第三者として、明らかに違法行為をしている業者を告発したいのならば、警察で相談されるのがよいと思います。
