,0
0,安いものだと、うちの顧問弁護士も申しておりました。青井先生は、これまでに業者を二つ潰しておられるそうですね。それも、裏をほとんど出さないかたちで」
1,アンモナイトなどの化石を買い取ってくれる業者はありますか？ＹＡＨＯＯ！オークションで出品されています。業者を探すよりもいいかもしれない。
2,。いっぽう雨が協力してくれて綿が豊作になると、値段はさがる。メンフィスの業者のもとに、さばききれないほどの綿があつまるからだ。畑で身を削っている
3,客がいなくなってから。適当さ。なんでも商品と引き換えの現金払いだから、業者ともめたこともないね。九龍城が取り壊しになるから、別の所で仕事を
4,れた」というケースもあります。■業者に電話をする前に悪質な業者は、一度電話をするだけで言葉巧みに消費者に近づいてきます。電話をする
5,を登り、お参りして引き返す。銀杏の屋台があったので今朝がたの銀杏並木にいた業者を思い出した。ぐるりと歩いて鎌倉駅に向かう。ドイツ風のＡＲＶＫＡＭＡＫでビールとソーセージ。
6,少なく見積もっても千五百万円はかかる。その話をすると、兄は「知り合いの業者を紹介してやるから、値切ってみろ」と言ってくれた。その業者というのは
7,仮店舗の前で来店者に近寄らないように説得しようと思いましたが警察から「業者に訴えられたら貴方の方が犯罪者になりかねないので止めるよう」と
8,のでは」と頭を抱える。国産大豆を扱う九州内のある卸売業者は「末端の業者は海外産に切り替えるか、価格を上乗せするしかない」と言い切る。豆腐や納豆を製造・販売する熊本県
9,利用を排除することは実際上できないので，利用回数の制限（民訴三百六十八Ⅰ但書・Ⅲ・三百八十一）により業者の利用を抑えている。（２）少額訴訟の特則少額訴訟には，通常訴訟の
10,で返ってこない、つまりきちんと受信されたメールアドレスを名簿化し、それをアンダーグラウンドで販売する業者もいます。一度この名簿に載ってしまったら、際限なく迷惑メールが送られてき
11,一辺倒です。服に合った、白とかピンクとかそうゆう業界に参入するような業者はないんでしょうか。面白そうだからあなたが会社を起こしてやってみたらどうですか
12,ても、現実には赤字企業の入札参加の条件は厳しいため、官公庁の仕事を受注する業者は「赤字決算」を提出できず、つまりこれまで以上に「粉飾決算の疑いが増えている
13,に見え隠れする放映権の問題現場を見学したＮＨＫの判断とはいえ、録画ネット「ハウジングサービス」という他の業者とは違ったビジネスモデルを持っているのは明らかであり、予断だけで判断するわけにはいかない。そこ
14,上昇している（表２‐十八）。警備業者の売上高を見ると，売上高五千万円未満の業者が全体の五十五．四％と過半数を占めている。売上高二十億円以上の業者は１．８％とごくわずかだ
15,ているか（７条）、勧誘方針を策定し公表しているか（８条）という事項をそれぞれの業者を業法上監督する当局がチェックすることがあるものと考えられる。事実上は業法の一種と
16,複数の業者から見積もりを取るようにしましょう。今回の場合は、消費生活センターから業者に連絡して交渉したところ、作業前に見積もりを出さなかった非を認めて２万円の減額
17,ていないと。例えばその原料が、どこから持ってきたのか、宮崎の業者から持ってきたと言っているんですけれども、そんな黒ずんだものを出すはずが
18,ところ、とにかく契約させようとする強引なところは、いうまでもなくダメです。こんな業者はとっとと放してしまいましょう。ビジネスという側面から見れば、買い手や借り手である消費者が
19,、仲介業者がいれば業者と打ち合わせしてください。補足。二重売買云々も受託した司法書士が（＆業者も）調査した上で、手続き進めますから、心配ないと思っていいですよ。
20,や業者の方からもお話を伺って、率直に言って、国も県も業者も、いわばこの責任の所在をあいまいにするような状況にあるのじゃないか、
21,いかんと言うておるわけです。それをもし是とするならば、業者と業者との過当競争は刀を持って切りあいはございませんけれども、やはりそれと同じ
22,個人出品の方に質問させていただきたいのですが、仕入れとは業者から仕入れているのですか？普通の個人なら家にある不用品などを出品すると思うのです
23,で「いいです」と答え、電話を切りました。数日後に高額な写真集が業者から届き、その処理に困っています。不要な商品なのですぐに返品したいのです
24,かかります。そのほかのハチの巣の駆除は、市では行っていません。業者に直接ご相談ください。スズメバチの巣は、一般的に球状で茶褐色のマーブル状の模様が
25,として私どもは今回の特例措置を講じました。ですから、例えば神戸の市内の業者の方々とのお取引があり、その結果、例えば製品が届かない、あるいは手形が
26,か？巾木をめくるとき、クロスをやぶく恐れがあるからでしょう。そうなると、業者が弁償・・・・・クロスも変えると、楽に作業出来ますからねクロスは
27,オンラインシステムを通じて，他の会員業者に送られる。一方，不動産の購入を依頼された業者は（３），希望条件に合う物件を検索し（４），買主に物件を紹介する
28,を迎える千六百万人の兵士のために低金利の住宅ローンを提供すると同時に、住宅建築にかかわる業者の利益を保護し、千九百五十六年には連邦政府の資金援助によるハイウェイ建設法を成立させるなど、政府は
29,ブレンボのものと同一形状ですか？取り付けた状態でも出来なくはないが、もし業者がやるなら確実に外すでしょう。ブレーキラインは同じだとは思いますが計ればすぐ
30,五十二年７月及び８月と五十二年十一月から五十三年３月までの２回にわたって，日本合板工業組合連合会に加盟していない業者についても農林大臣による事業活動規制命令が発せられ生産調整が実施されている。更に，五十二年度から五十三年度に
31,．企業概要１．社歴と登録後年数、情報センター加盟状況社歴（事業年数）では、総貸付残高の少ない業者では十五年未満が多くなっている。大手では十五年以上が多くなっている。また、都道府県
32,ある意味では職人国家ともいうべき非常に基礎的な部分を担う本当に小規模の業者の方々、しかし特化された分野における技術の非常にレベルの高い集団、それが
33,市民十四人が死亡、二十人以上が重軽傷を負った。◆輸入ペットに野兎病流行米テキサス州の業者がペット用に販売、日本にも輸出していたリスの仲間のプレーリードッグに、人間に
34,協定締結葬儀でのトラブルが全国的に増加しています。市では、市民が信頼できる業者を選択し、安心して契約ができるよう、市内の葬儀関連事業者団体と「葬儀における消費者トラブルの防止
35,、指導をお願いしたいと存じます。わが方としましては、訪問販売をする業者のうちの少なからざる部分が業として通産省の所管に属するかと存じますので、
36,放送界だけじゃない。日米構造協議で問題になった項目、みんなそうでしょう。国が特定の業者と癒着して、ダメだ、ダメだといったって、この国際時代には通用しません
37,業者と勘違いしてた」とハッキリ名言してる。十歳の小学生がダンボール持っただけで業者と勘違いする大人なんているでしょうか？事務所ぐるみの隠ぺい工作です。
38,「オークションストア以外は消費税を請求しない」とありますが、時折、個人ＩＤで「当方は業者ですので、消費税５％だけお願いします。」というのを見かけます。当然、これで
39,の業者にそういうものが特に見られるということで、そういう苦情を多発している業者へのいわゆる苦情につきましては、消費生活センターといわゆる地方公共団体等、そういうところが受けつけ
40,ため、もちろんハードディスクはフォーマットしている。ところが３ヶ月後、患者の電子カルテが霊感商法を行なっている業者に流出していたことが判明。Ｋさんは責任を追及された。コンピュータの性質上
41,。単価が小さいため利益は小さい。銃などの小型兵器だけ扱っていたのでは、業者はもうけにならないのだ。「イワシをいくらたくさん売っても、マグロ一匹売る
42,ができないとき、代わりにしてくれる人はいない？家政婦紹介所に問い合わせて、業者を紹介してもらいましょう。炊事、掃除、洗濯などの家事全般のほか、買い物や留守番のみ
43,でしょうか？視力回復の器械は効果がないものが多いので注意してください（２〜３年前かなりの業者が摘発されています）
44,と推測されます。○林（孝）委員具体的ではないですね。では、一部の業者がこうしたいかがわしい行為の結果、犯罪というものが生まれる、そういう温床となっ
45,ピアノに消音ユニットの取り付けを検討していたら、業者から、大きな修理を持ちかけられました。もろもろあわせて、新品を買うほどかかる修理
46,結果、鈴木氏の後援業者一社しか入札に参加できない仕組みになった」と指摘。この業者が落札できるよう工作したのは明らかだと迫る考えだ。鈴木氏はこの業者から
47,のことはできるものです。まずは、友達、知人がつけるときにでも、業者のすることを見てみる事をお勧めします。
48,てほしい」あの時…これなら、県産材でも低コストの住宅を提供でき、地場の業者だからこその売り物になると考えた。企業紹介社名株式会社寺島製材所代表者名代表取締役寺島
49,か？ここはヤフーゆうぱっくが利用できないので、ゆうぱっく・ヤマト運輸・日本通運など持ち込める範囲の所にある業者で料金を検索しているのですが、ゆうぱっくより他業者が安かった事が今まで
50,焚き火が好きな人多くありません？メンテは自分でやると大変ですが、業者に頼むこともできます。あと、煙突から野鳥が侵入してきたり、巣を
51,た場合と，業者を排除した直接取引の両者を完全に２つに峻別してしまうのではなく，業者の尽力の度合い，委託者の業者排除の態様によって，その間にさまざまな量的強弱のある
52,は、そこから百メートルほど進んだ先にあった。各専門工事と工区別に複数の業者が出入りしている建設現場は、ゲート脇の看板も十数社の社名がひしめく賑やかさだった。設計・監理
53,違うのですか？宅配業者の違いなどでこんなにも差が生じるものなのでしょうか？業者と個人の違いなのでは？業者の方なら宅配便会社と契約しているので安くなると
54,でございます。したがいまして、もしお尋ねの趣旨が、この法律案における預託等取引契約を行う業者とはどういうものかというお尋ねとして考えてみますと、例えば金投資口座あるいは金貯蓄口座の名称
55,」コール７キロの洗濯機で２回分梅雨入りし雨の日が多くなる施設から「業者のジャージを使ったら」と奨められ何枚使っても１日￥二百少し
56,地域も、特定地域で業者を指定しているということではございませんので、複数の業者の中から選定できるようになっているはずでございます。もしそういう御指摘のような
57,営業マン（査定士資格あり）を連れて行くともっと嫌がります。査定書見せろ！と言って拒む業者はだめです。査定書に虚偽記載すると最悪の場合古物販売商の認可を取り消される可能性がある
58,なら、フリーで公開すればよい。自分で暗号化作業をやるのが面倒なら、それを代行する業者が出てきてもよい。インターネットで配信できる音楽をわざわざ物理的パッケージにして売るビジネスは
59,まいります。そうすると、それまで禁止するわけにはまいりませんので、悪質な業者にとりましては実質的な禁止の効果が出るような、契約前、契約時あるいは契約後
60,しかし、公的な許可・資格を持ち、建物についての専門的な知識・技能を持った者のいる業者に頼んだほうが安心です。特に増改築のように建物の構造部分にまで手を
61,全く無視してますのでそちらの方はどうでもいいのですが、問題はこれらの業者の情報の入手先です。考えられるのは、最近いくつかの新聞、雑誌等の懸賞
62,芝野はにがい笑いを誘われた。償いきれない負債をかかえたまま他国へ夜逃げしていく業者の話をしばしば見聞きしていたことが皮肉にも早めの見切りどきを心得させて、
63,のグレードなどじっくり情報う収集し、勉強すれば、建売も良い物は沢山有ります。業者も価格、品質競争の中、日進月歩です。なにもコストアップにつながる注文住宅だけが完璧な
64,「くじょうしん」をしたら、業者がお金を返すかもしれないと、消費者センターの人に言われました。「くじょうしん」って
65,によるとプラスチックのもので値段が四百円と書かれていたので、賢明に輸入しようとする業者は少ないなぁ〜と思った！！
66,、広島市社労士検索では絶対上には、あがれません。なぜなら他の人は皆、業者の作ったＳＥＯ対策ずみだからね。彼らは定期的に、メンテナンスしているので無理ですよ。
67,。●海貨業者とは、輸出入を行なう者の依頼を受けて港湾運送の一切を行なう業者。輸出の場合、運送、受け渡し、通関手続き、倉庫業、船積など広い範囲で業務を
68,、ダイエットとは体重を減らすために食事制限することと間違った考えが多く、そこにつけ込む業者がサプリメントとか、置き換えダイエット・健康グッズなどむちゃくちゃなことで儲けようとするなどの問題が起きてい
69,ました、☆やっと下りた五千万の融資で土地を私が安く譲り、建物も業者に協力してもらい、原価を割る位の、厳しい工事をしてくれました…→これ
70,たマンションもある、といいます。前出の弘中さんのマンションでも、管理組合は業者と直接、契約を結び、管理会社は業者との日常的な連絡・指示などの仕事をする
71,の材料を買って、自分で組み立てるというもの。雑誌広告を頼りにキットハウスを販売している業者に電話をかけ、自分の目で見てみることにした。その販売会社は長野県に
72,。その期待耐用年数を保障できるかという問いかけもしてみて下さい。ここまで聞けば、いい加減な業者は連絡してこなくなります。
73,た流れでウェブサイトのデザインもこなす業者である。５自社のパンフレットやポスターなどを依頼している業者であれば、デザインのテイストや仕事のやり取りに慣れていることやウェブサイト制作のために新た
74,（マルチ商法）について、取引の概要を説明した書面の交付義務、契約書の交付義務などを業者に課している。守らない場合には、改善指導や業務停止と事業者名公表などの行政処分の制度
75,又は全額を無条件で返却しないとする特約の事です。この特約は、一方的に業者に有利な為に消費者契約法に違反しており、無効であるとの判断が裁判所で出され
76,でいるのかはどこかへいってしまいます。とくに埼玉県内の中学校では、かつて業者による県内一斉のテストが毎月行なわれ、このテストの偏差値が高校入試に大きく影響するように
77,ここは岡山県なのに変な関西弁を使うしで、もしかして悪質な業者なのでは？と疑っているのですが・・・ＩＨ調理器＆給湯器で約百万円だそうです。値段
78,れてきたので、名前や住所や電話番号などの個人情報を入力したところ、見知らぬ業者から広告メールや勧誘の電話が殺到するようになった。（二十代Ｃ男）●お答えし
79,被催眠者は即座に拒否するか、催眠から目覚めてしまうかのどちらかになります。あと業者の選び方も、同じサイトにありました。ｈｔｔｐ：／／ｐｓｙｃｈ‐ｔｏｏｌｂｏｘ．ｈｐ．ｉｎｆｏｓｅｅｋ．ｃｏ．ｊｐ／ｈｙｐｎｏｓｉｓ／ｏｔｈｅｒｓ．ｈｔｍｌ
80,ありません。民法二百三十四条に違反しています。工事を差止めることは出来るでしょうか。業者に話しても無視された状態です。準防火地域で、耐火構造（コンクリート等）でなく防火構造
81,、［六十三］和歌山市一般廃棄物処理業等不許可事件があげられる。なお、市町村の処理計画といっても、事実上、既存の業者の決めた業務の区割りを処理計画の趣旨に合致するとして追認し、これを根拠
82,警備室を後にした。相変わらず無口な美希の案内で作業着に着替え、退出する業者の列に混じってビル前に停車したワゴンに乗り込む。隣に座った男の左脇
83,ですね。このレートですと、輸出先の値段に合わせた場合、国内の下請けの業者は大変なことになりそうです。このレートではかなりのコストダウンを迫られるかと思わ
84,少し前に『あり○とう商事』という送料全国一律三千八百円も徴収する業者がいたのですが、『あり○とう商事』を見ると、健全な、悪い
85,歩きながらうなずく。中堅商社の建築事業部長という立場からすれば、一土木工事会社の社長は、むしろ出入りの業者のように扱ってもよい力関係にあるはずだが、建設省のトップに縁戚をもつ権藤
86,年度末・・・さらに一番仕事をこなしてくれてた下請けさんが緊急長期入院・・・代わりの業者が最低・・・こんな悪条件がかなさり、ここ数日は地獄でした。金曜日、
87,ています。それを解体して、一から新しくする必要はないと思います」と業者の人が言うと、「表十と表十一どちらを選ぶかはっきり一つに
88,賃貸マンションを借りる時に保証人になってくれる業者があるようなのですが、どこにありますでしょうか？また、それは安全な
89,、幅広くたくさんの業者に知れ渡ります。ところが、実際にはまったく登録をしていない業者が多くいます。また、しばらく日付が経ってから登録する業者も多いです（ＴＴ
90,すべて公表される。農林水産省は１月二十九日、食品の偽装表示をした業者の指示・公表の基準などを定めたＪＡＳ（日本農林規格）法の指針を改定、今日三十日
91,た。親書は郵便法で郵便局しか扱えませんが、一般の印刷物などは民間の業者も扱えます。千九百九十四年の郵便料金値上げを機に、カタログなど大口の印刷物を対象に宅配便
92,たところでも明らかなように，本件上告人のように，課税売上高が三千万円前後の規模の業者にあっては，売上げの際にも３％の消費税を徴収するのがむしろ普通である
93,です。工事が不完全だと、つまりや悪臭の原因にもなりますので、業者が指定工事店かどうかを確認し、排水工事などについて疑問・質問などがありましたら、
94,？一社ではないはずだ。市役所が入札をして一番安く入札で落とした業者が入れているはずだ。どれだけ公共の事務所ではお茶を飲むのだろうかと
95,というのは大変多種多様に行われておるわけでございまして、もっぱら通信販売だけを行っている業者というものが必ずしもいるわけではございません。いろいろな販売業者が通信販売形態も行っている
96,訪問看護ステーションや地域保健師，受持ちナース（病棟・外来），理学療法士，作業療法士，医療ソーシャルワーカー，必要によっては医療福祉機器の業者も参加しての「合同カンファレンス」や「合同訪問」などの企画・立案・実施を進めること。以上
97,で例を申し上げれば、そのうちの五分の一か十分の一ぐらいは東北で資格を持っている業者だというふうに考えております。そういうクラス分けの仕方をしてやっております。
98,をされたりする。※注意すること◇点検結果で不安をあおり、契約を急がせる業者に気を付けましょう。◇シロアリ、水道水、消火器などの事例もあるので、気
99,対抗しようとしても恐らく無駄かと。その情報をドコモ側に連絡して、悪質な業者を摘発してもらいましょう。少しでも迷惑メールを無くす為には、多くの情報が必要です
100,ですが、ファン内のヤニを取るのは業者を呼ぶしかないですね。ちなみに私は業者です。給気側はフィルターを、排気側は届く範囲で清掃をして下さい。分解はし
101,工事をします。百万のうち、二十万がハウスメーカーの利益、二十万が遠くからくる業者の移動コストです。これは日本の経済構造上当然のことです。地元の塗装店数社に見積もり
102,ている自民党長崎県連の■■■■前幹事長（六十五）は三十日、長崎地検の事情聴取に対し、県発注工事を請け負っている業者に知事選目的で献金要求したことを認めた。二十九日の幹事長と県議辞職を境に全面否認の
103,メーカ製のカラーモニター付インターホンの基板から回路をおこしてくれる業者はあるのでしょうか？どなたかお教えくださいませんでしょうか。宜しくお願い致します。危ない質問です
104,というのは、軒先を借りて商売をするのと同じです。そのため、業者を替えれば、給湯器は無料で交換してくれるというわけです。これによって、給湯器が
105,実はその説明から抜け落ちていた別種のリスクによって元本欠損が発生した場合は、同法により業者に無過失責任が問えるにもかかわらず、「当該商品のリスクについて理解した」と署名した
106,■■氏明らかに通りやすいというか、見ていないのが実情だと思う。どの業者にも、コスト削減頼む■木村建設木村社長・篠塚元東京支店長林委員長七十一件の偽造のうち木村建設が関与した
107,（平成十三年度）を超え、さらに増え続けているという状況下において、今後も簡易裁判所を利用した業者の取立が減ることは考えられない。「街の法律家」を自認してきたわれわれ司法書士
108,な経済性が追求されて、コストが安いからといって市町村が安易に民間の業者に委託する。すべて問題が起こるとは思いませんが、やはり問題が起こるとすれば、
