,0
324,。〈事例３〉家族の入院費が必要になり、インターネットで見つけた低金利の業者に百万円を借りた。その際、自宅・実家・会社の住所・電話番号を伝えた。業者から「信用調査
325,。特に機器選定については、メーカー名や仕入れ先など具体的なことも知ることができる。前もって業者の担当者に面通ししてもらえば、さらに話が早い。聞くばっかりで恐縮というときは缶コーヒー
326,したいと考えていますので、よろしくお願いします。自分でパソコンで原稿をつくって業者に印刷をたのんだら１枚８円といわれました。いまではうちで印刷することにし
327,パソコンの管理者はと聞かれましたが初心者なのでパソコンは業者に設置設定していただきました。自分のパソコンの管理者（？）などはどこで分かります
328,）が火災警報器や消火器などを訪問販売することは絶対にありません。また、特定の業者に販売を委託することもありませんので、ご注意ください。訪問販売や電話勧誘販売の場合は、
329,第二十回は群馬県の箱島湧水です。見学当時、箱島湧水入口には業者の物と思われる台車が多く置かれていて、ポリタンク族御用達の水源と化していまし
330,積極的に追加予算ですか、追加で予算の割り当てをして、地元で、しかもたとえば業者にやらせる場合も、大手業者が不況で地方へ来て細かいのまでさらっていこうと
331,活動は大きく制約されている。（４）鈴木前掲書三百八十一〜三百八十四頁真参照。上述の販売業務に対して、業者は販売価格と仕入価格との差をマージン＝収益としてうけとる（公定消費者米価から、政府の査定し
332,・民営に・・・改革・・・すもうから・・・運営を・・・業者に・・・の・・・時代に・・・歴史が・・・時代が
333,第三条）のである。このような許可制度の採用は、米穀需給の逼迫に備え、業者を整理する一方、政府の米穀流通統制に服させることに狙いがあった。第二は
334,て販売されています。抗菌グッズには台所やトイレ用品から文具類まであるようですが、業者は抗菌グッズが売れるから開発し販売します。しかし、かりにまな板や台所スポンジを抗菌グッズに代え
335,前出の弘中さんのマンションでも、管理組合は業者と直接、契約を結び、管理会社は業者との日常的な連絡・指示などの仕事をすることになっています。マージンなんてとんでもない、
336,場合、二年間で二戸の新築マンションの売買に巻き込まれてしまった。不動産売買には、業者の手数料、不動産取得税などかなりの負担があり、金持ちや脱税者でもない私は、
337,、全員で日曜日の朝からやっているが、多少お金を出しても、専門の業者に頼んだ方がいい。階段の掃除の当番を、守らない人がいる…
338,認めた判例〔判例９〕東京地判千九百五十八年６月十三日（判時百五十七号二十四頁）依頼者は業者から物件の案内をうけた以上は，売主との直接交渉で売買契約を結んだ場合
339,出品削除などの対象になります。・取り扱いが難しい、あるいは保存期間が短い食品店舗や業者ではない個人が趣味で作った食品、賞味期限の短い食品などとヘルプに
340,、登録取消しなどの行政処分や懲役刑を含む刑罰を科すことを定めています。監督行政庁業者を監督し、違法な行為などがあった場合に営業停止や登録の取消しなどの処分
341,失って株式会社に化け、いつまで経っても是正されない組織、十五％はあるという業者からのリベート、コメの価格を下げる努力をしないことだ。学校を卒業し
342,届出業者とは総トン数百トン未満で長さ三十メートル未満の船舶のみにより，内航運送業または内航船舶貸渡業を営む業者をいい，許可業者とは届出業者以外の内航海運業者をいう。（２）（）は兼業
343,です。（建築確認がおりないと一戸建ての契約は締結出来ない。）更に、売主が業者ならば、通常相場よりも２割は安く買うべきでしょう。我々はそのような物件の
344,なるかなど、作業前に見積もりを書面で出してもらいましょう。可能であれば、複数の業者から見積もりを取るようにしましょう。今回の場合は、消費生活センターから業者に連絡し
345,（月）※隣組回覧板は企画業者である（株）サイネックスと協定を結んで作成します。今後、業者が広告掲載について事業所を訪問する場合があります。大切な果樹を守りましょう農業施設等
346,ので今年最大のキャンペーンを開始します以下はワンルーム苦戦オーナーの、深謝メールです。おかげさまで、いよいよ業者〇〇ヨシ様との決別する決心がつきました。相手が相手なので考えただけ
347,ロゴマークを作成したいのですが、相場はどのくらいでしょうか？１万円、２万円で請け負ってくれる業者があれば一番良いのですが・・・。そういった需要もあるのですね。
348,を設置しましょう。悪質な訪問販売にご注意を！消防職員が住宅用火災警報器を販売したり、特定の業者に販売を依頼することはありません！不適正な価格（火災警報器の価格は、メーカー
349,、資本構成、営業の概要、財産及び損益の概要、あるいは業務、財産状況に関する書類を業者の事業所で閲覧できる旨、これは第六条の規定に関連するわけでございますけれども、
350,ませんが、登録を受けなければいけないというふうに解釈しております。先生御指摘の業者につきましては、日本では登録は受けておりません。ただ、海外の
351,もとれるものであったが、モスコーニセンターが再開発のために長い時間をかけ、ツーリストや業者のための施設として使うのではなく、“市民のためのもの”というコンセンサスでつくられ
352,の状況を調査する事前調査の際に用意する物まず、現地付近の一般の地図です。業者の略図や広告用の地域図だけでなく、必ず市販の地図を持参します。次に登記簿謄本
353,ものがあります。【相談１】のように、未遂で済めば良いのですが、業者の言葉巧みな誘導に冷静さを失い、言われるままに支払ってしまう人も後を
354,を進めていかなければならないというふうに思っているわけでございます。○水田委員労働省というのが業者へ直接手を出せないあれですからやむを得ぬのですが、たとえば週休二日制
355,で早急に補修工事が必要と指摘された。すべての契約を解除し返金してほしい。業者に契約の内容を確認した上で苦情を伝えた。過量販売であることは確かだが
356,取り計らいをした謝礼として現金二百万円を受け取った。また，同市市議会議員（六十六）は，業者からの請託を受け，同市担当部長に対し同業者に予定価格を教示するなどの職務上の不正行為をさ
357,。そこから今度は、蓑編みという工程があるんだけども、それは最近は業者から買ってしまうんですよね。蓑編みは、むかし使った蓑の編み方ですが、その
358,花を見直す気持になった。不思議なもので、この品種は、その後、業者の手によって促成栽培され、新しく「十二ひとえ」などの名前が付けられた鉢物として市場
359,工事現場が汚い、くわえタバコで仕事をする、あいさつをしない、服装がだらしないような業者は要注意です。次に、訪問した時の目の付けどころです。まず店
360,）、十月のミプコム（ビデオと映画の番組見本市）と年に三回はあらゆる国の業者が集まって商談をすすめる。そのほかに、ロサンゼルス、ミラノ、ロンドン、ベニス、
361,な商品なのですぐに返品したいのですが。〔Ａ．相談への対応〕業者に連絡すると「商品が気に入れば購入してもらっている。必要がなければ返送を
362,うそですよね。本田あれは、絶対に早くは問題にしないです。業者もあれば、方々皆あるからね。（ふたりの最後の対談になった「
363,、これはもう先生にはある意味では釈迦に説法でございますけれども、業者の登録あるいは採取計画の認可に際しまして、いろいろな問題が生じないように所要
364,）イギリスのギルド、日本の徳川時代の株仲間と同種類の商業や手工業の同職仲間であり、業者の数や商品の価値、品質、販売数量、販売方法を協定した。一人の親方の
365,、お宅の屋根もずれているように見えるので無料で調べてあげますよ」と業者が訪ねてきました。驚いて、すぐに屋根に上がってもらいました。「
366,決め、落札したのはあなたですから。＞確かに、出品文章や連絡メールには、業者から直接お届けの旨が書いて有りました。寧ろ、良心的な出品者だと思い
367,つながる危険さえもあるのではないか、そのようなこと。あるいはまた、許可を受けた業者が、先ほど申し上げたように、最初お化粧をしていたのがだんだんはげて悪質
368,ます。つまり志保を殺害してから島を逃げ出すことはできなかった。この日は業者も本土に戻っていますし、大江さんによれば余所者がやってきて留まってい
369,規定―では、当該証券取引所の会員たる証券会社なり或は当該商品取引所に上場される商品の売買等の業者たる取引所の会員が、其の上場有価証券乃至商品に関して、売買取引を自己の名に於て
370,た。ほかに営口、大連、北清の各地の名がみえた。営利にめざとい業者は占領地へなだれるように少女たちを送ったのである。そして戦後の三十九年から四十年、
371,た。ｉ．代替製品・サービスを競合他社，新規参入業者，売り手，買い手が提供する場合と他業界の業者が提供する場合に配慮して，企業単位ではなく製品・サービス単位で識別する。また，代替品・サービスは技術革新との
372,業者には入札に参加しないようにとの指示をしたことはなく，またそれらの業者が入札に参加することが不可能であるとは認識していないことなどからすれば，郵政省が一般競争入札
373,ているものといえばＩＰアドレスくらいです、このＩＰアドレスだけで個人を特定するには、この業者は貴方のプロバイダに問い合わせなくては絶対に分りません、プロバイダだってそんなもの
374,業界の反発であった。従来日中貿易には数多くの中小貿易業者が参加していたが、社会党系・日共系の業者も多数含まれていた。このような複雑さに加え、窓口の一本化となれば
375,費用はかからないし、実際に問題があるようなら、それをきっかけに他の業者にもダブルで点検してもらう。複数のプロに確認された事実なら、早めに工事
376,ものがもちろんあると思いますので、その点は十分理解しておるわけですが、最近業者の技術も相当向上しておりますし、それから契約方法にもジョイントベンチャーのような形もいろいろ
377,た時期がなかったわけではない。三州瓦に対抗すべく、昭和四十〜五十年代にかけて計八軒の業者でトンネル窯が導入され、陶器瓦の生産に乗り出している。ところが、これは失敗に終わっ
378,【東京は８月、大阪は７月に募集】お墓のミニ事典公営霊園の申し込みを代行している業者のＣＭに注意しておくのもよいでしょう。Ｑ五十五民営霊園の募集は、いつ、
379,対応住民はこの間、何度か市役所に足を運び、マンション建築計画の変更について、業者を指導するよう求めたが、市役所では、「設計変更を指導する法的根拠がない」と
380,がずっと決まってきたんです。イングランド銀行が売り手になるんですが、買い手の五人の業者のうちの中心がロスチャイルドなんです。金の取引をする「黄金の間」という
381,部分的なお手伝いをしてくれるところもあります。下記の団体に連絡するか、タウンページで業者を選びます。●（社）日本臨床看護家政協会（ケアネットワーク）☎０１２０‐０４１‐８１７買ったものがすぐにこわれた！
382,の対策、横の対策などと言う物はないと思います。最近では何処の業者も地震対策で講じているのはホールダウン金物を木造２階建てでも使用するようになった事ぐらいで
383,せる方法はあるのか？ＡＣＤクリーニングキットを購入して、付着した汚れを除去するか、業者にメディア修復を依頼することも可能だ。また、「ＴＤＫ」の「スーパーハードコート超硬」の
384,でずいぶん、なかなか仲間に入れてもらえない条件の一つになっておる。こういうことに対する業者の方方の大変な御不満がある。まあターミナルビルのようなものや、また鉄道の
385,全部使い切ったよ。だからまあ、思い残すことはないんだ。それより、来る時に業者のトラックを見なかった？」俺が着く前に、査定を依頼した会社
386,答えた。「昨日、仲介業者のバックスター・レッドに相談したんだ。街でも最有力の業者だけどね。それで、いっしょに屋敷の内外をあらためて見たんだが、やはりひどい
387,ミスの原因を究明し再発防止策を検討することが大切です。Ｑ百十四情報処理を委託した業者の従業員が、わが社の個人情報を持ち出しました。わが社に責任はあるのでしょう
388,で変わりますの問い合わせてください。最近は排家電品を無償（場合によっては買取）で引き取る業者が徘徊しています。家電リサイクル法対象品でも引き取ってくれますが、しっかり処理してくれればよいのですが、
389,。ただ野菜につきましては地域毎に仕入れる業者が違っていまして、この業者から直接、各店に入荷されます。私どもの会社以外の他のあるファミレスのチェーン
390,維持するためにも、専門的な建築の知識・技能が不可欠です。こうした許可・資格を取得している業者は、一応身元もしっかりしているといえます。リフォームに関わる公的な許可・資格としては
391,場で決めない誰かに相談するタダより高いものはなし！無料の裏を考えよう５．業者の言葉をうのみにしない不安をあおるのは常とう手段おまけ感性と２つの勇気
392,行う業者に注意してください。消防本部では、住宅用火災警報器を直接販売することも、販売を業者に委託することも行っていません。「おかしいな」と思ったら、はっきりと断り
393,は古く粗末で今にも倒れそうだった。不要品の買い取りを専門にしている業者がまるごと安値で買い取って、フォークやスプーンは束で五十ペンス、椅子は一脚五ポンドといった
394,周囲と同化しなければ異端視される世界なのかもしれない。早い話、上司の大山に、業者からの接待やなにがしかの付け届けを受け取るよう勧められれば、いやとは言えない
395,捗りません。本部は少しでも経費を削ろうとして、少しでも安い業者に頼んで作ってもらおうとしています。それはそれでいいんですが、僕たち現場が
396,その大根を地元・聖護院の農家が丸い形に育成したとされる。京都市内の業者がつくった飴を授与している。大根に少しショウガをきかせた味。お寺の
397,段階までの加工を行う場所です。ただ野菜につきましては地域毎に仕入れる業者が違っていまして、この業者から直接、各店に入荷されます。私どもの
398,業者利用プロパンガス・ガソリン・車検・事務用品の購入などの際は、町内業者を平等に利用し、発注が特定の業者に集中しないように努めます。いしいドームの運営状況１月末までの十カ月間の利用状況は、
399,一つの産廃銀座）が形成されていく。一廃（一般廃棄物）は、自治体が委託した業者が、パッカー車でゴミ集積場やオフィスビルから回集し、清掃工場で焼却処分している。保積の余地はない
400,はオオゴトになって大変の所を見た方がいいと思います。うちは業者に頼んでレーザーで計ってもらいました”と言う方がおられました。その職業
401,は大工さんがつくるものというイメージはすっかり様変わりしてしまいました。それでは住宅メーカーとはどんな業者なのでしょうか？住宅メーカーは、正確には「住宅建設販売会社」といい、住宅を中心
402,た私が悪いのでしょうか・・・・。確かに、出品文章や連絡メールには、業者から直接お届けの旨が書いて有りました。こういった出品者の方は違法
403,神奈川県内に「糖尿病食」を宅配してくれる業者をご存知の方どうぞ教えて下さい。神奈川だと他にも色々ありそうですがこんな
404,、メーカーや種類によりますが、目安として１個三千円〜九千円程度）による販売を行う業者にご注意ください。火災警報器はクーリングオフの対象です。すでに全国では悪質な訪問販売が発生してい
405,いいのでしょうか？ハードディスクの物理フォーマットをやっておきたいところですねー。処分は請け負ってくれるなら業者で構わないと思いますが、とにかくハードディスクだけはどうにか再起不能にしておきたいな〜！
406,までなかった音が出るようにでもなったのかと、家を施工した業者を呼んで調べさせたが、やってきた若い技術屋二人はそんな音はまったく
407,と、安易にこの法的な安定性が阻害されてしまうということにもなりますし、業者にとりましては、急に消費者から解除を行うと言われましたときに
408,登録をしていない業者が多くいます。また、しばらく日付が経ってから登録する業者も多いです（ＴＴ）大手なら安心と思われるかもしれませんが、実はそうではあり
409,‥‥‥よく分かりませんでした。パソコンの故障で修理と一緒にリカバリを業者にしてもらいセットアップは自分ですることになり、今お手上げ状態です。Ｗｉｎｄｏｗｓｘｐです
410,でしょう。しかしできれば，迷惑メールを受信するのは不愉快かもしれませんが，ここは，少しずつ業者を追い詰めていきましょう。参考ＵＲＬ・２番めに，届いた迷惑メールを転送して
411,の乳原料は日本にも入ってたのですね〜。また、事故米を流した業者は被害者が出たら死刑ものですな（怒）↑現在の玄関横のウエルカムフラワーです♪
412,くるようになったというわけです。民営霊園の募集【年中募集の状態】お墓のミニ事典業者のなかには問題のあるものもあるので、契約を結ぶまでには細心の
413,ものではないからだ。特殊な壜を使用するので、回収して再利用をする必要上、業者は家庭への持ち込みを極力避けた。そのため、壜が四散しないような、
414,比較して検討するとよいだろう。・広告代理店に委託する・社内でこれまでに実績のある業者を選ぶ・自分のネットワークから紹介を受ける・書籍や雑誌広告などから直接問い合わせる次
415,やりたかったのかもしれない。モンテベルデには、この手のアトラクションの業者が幾つかあって、それぞれネーミングが少し異なる。私が体験したものは、スカイウォーク
416,と食い違いを見せる。また改正内容にある受信停止希望申請の受け付け義務も両刃の剣だ。停止希望を業者に送れば、そのアドレスは「生きたアドレス」ということになり、これがリスト化して
417,円高の中で国内品の調達ルートを見直す流通業者が五十七％，既存ルートは残すがコスト圧縮を進める業者が二十九％となっており，多くの流通業者が流通の合理化の必要性を考えている（第１
418,アパートが回りから目立たない場所ですから★『業者案内が入居の基本です』近くの業者を大切にして、案内が出来る近い業者に、まず挨拶すること３他社の
419,で売上高が異なるのはおかしい●立替費用発生時には、役務提供者が主たる債務者である●サービス提供者が業者を選択する●業者への支払いから顧客からの回収まで、役務提供者が信用リスクを負う２
420,の犯行時刻、ヘレンにはアリバイがあったとロナルドから聞いている。食材を配達している業者が、ちょうどその時刻に届け物をしていたのだという。毎日決まった時刻に
421,長ければ長いほどよいというものではありませんが、これも一つの目安として考えましょう。業者の企業概要や売上、利益などの業績といった情報については、インターネットで調べることができます。
422,」という先輩たちの忠告にしたがって、これまで高柳はかなり多くの部品の製作を業者に依頼してきた。しかし、それではだめだということを思い知らされたのである。全電子式テレビの
423,大がかりになればやはり専門の業者に頼むことになる。そういう場合、どうやって良い業者を選ぶのか？「最近ではホームセンターなどでもリフォーム事業を行なっています。
424,ん。以前取引があったとかならともかく、不特定多数にいきなり広告メールを発信するような業者は、信用できませんね。下手に取引して、自分のメールアドレスが「生きている」
425,訴訟の控訴審判決が二十一日、大阪高裁であった。加藤英継裁判長（吉原耕平裁判長代読）は一審大阪地裁判決と同様、業者に被災前の時価を基準にして買い取るよう命じたが、時価算定では市場性を
426,和尚さんは書いてたよ。土地ころがしならぬ、遺体ころがしだ。病院に出入りする業者が、首尾良く葬式の注文を取りつけて、遺体を自宅まで運ぶ。その途中、
427,しないじゃないですか。その手数料の相場ってどれくらいですか？一部の悪い業者ですと、車両価格を安く表示して諸費用の代行手数料でカバーしているようです。相場は地域
428,カード借入融資はじめてローン銀行ローン審査返済ローンローン検索金利銀行業者専用ご融資フリーローン審査お金借りるなら借金整理ｃｒｅｄｉｔ年率事業
429,二日でいいんだ。二日間だけ、そこに飼っといてくれ。その間に、元の業者に引き取らせる」「どうして今日中に引き取ってくれないんですか」「いねえんだ
430,、もう一つ言いたいのは、やはりＢＳＥの発生によって、責任が全くない生産者や業者、本当に大きな打撃を受けていますよ。本来は、重大な失政と指摘され
431,工事が中断されたのは半年前。もっと隠微な真相があってのこととはいえ、業者に支払う違約金や維持費は半端な額ではない。ここは工事を強行すべきと訴え、
