,0
109,見ました。サンドイッチです。日当たりは最低湿気は最悪転売は出来ず。業者はどうやら最初からサンドイッチを考えていたようですね。
110,？ネットで、営業している店を検索したらいかが。保証はないでしょうね。変な業者に引っかからないように気をつけてください。
111,千九百五十八年十二月二十六日（高民集十一巻十号七百五十三頁）（再掲）（この判決は，事件を業者を排除した直接取引とは認めなかったのに，民法六百四十八条３項・六百五十一条の趣旨，
112,収支は急速に悪化と協会加入業者の激減という冷厳な現実である。業界に見切りをつける業者が続出する一方で、とんでもないことが起きている。それは貸付の金利が年率数千％
113,海外産に切り替えるか、価格を上乗せするしかない」と言い切る。豆腐や納豆を製造・販売する熊本県の業者も「昨年は値上げをせず持ちこたえたが、今年は無理だろう」と嘆いている
114,大家の顔もみたことないいんだけど！いっつも対応は不動産屋。しかも、業者はいつも約束とちがうことになる。時間ばかり経過！契約時の言っていることと、違う
115,３）バック・マージン大学の備品購入、印刷物の納入などのたびに発注の見返りとして、業者から教授に渡される。現金の場合もあるが、酒席に招待し車代として渡される
116,でいます。みなさんなら、どうしますか？？教えてください。絶対にイヤです！業者の両方に、文句言います！もちろん、相手の境界内で納まる大きさで、水は
117,ＦＸを始めようと思うのですが、どの業者がいいでしょうか？逆にやばい業者はどこですか？最悪０円になっても良い二十五万
118,「なぜですか？」「名簿が社外に流れるからです。ダイレクトメールを発送する業者の手に渡ることから、廃止したということです」「堀越さんは、あなたの
119,のである。廃棄物処理法が施行されると、それまで廃棄物を好き放題に埋め立ててきた業者は、最終処分場の許可を取得するか、許可を取得した他社の処分場に委託するかの
120,：％）２．上限金利引き下げ後の貸付残高の増減規模の格差鮮明に。進む寡占化傾向百億円以上の業者で貸付残高増加三十億円未満の業者は「減少」が「増加」を上回る上限金利二十九．二％への引き下げ後
121,て受ける被害者というのは非常に多くなってきておるわけです。その素性のはっきりしない業者というのは、大方がサラ金業者から転業していっている、そういう者たちです。これは
122,構成されています。これを２部料金制といい、ほとんどのプロパンガス世帯で採用されています。業者によっては、基本料金に含まれていた設備利用などの料金を区別して、別立てとして徴収する
123,思いっきりかいてあるんですけど・・・ｈｔｔｐ：／／ｐａｇｅ１３．ａｕｃｔｉｏｎｓ．ｙａｈｏｏ．ｃｏ．ｊｐ／ｊｐ／ａｕｃｔｉｏｎ／ｒ１７４７５７０６都合が悪く、行けなくなったのでしょ。業者のように、継続反復販売してなければ、大目に見れると思います。
124,ですよ。縁があれば、また良い商品がでてきますよ。アクセサリーは、業者の出品者から買った方が失敗が無くて良いですよ。
125,Ｄ外構、植栽は直接発注してコストダウン駐車スペースに敷いたコンクリートブロックは、ご主人が知り合いの業者から割安で購入。それを数社の工事会社から相見積もりを取って、直接発注しました。
126,の資格審査の申請を次のとおり受け付けます。平成十九年２月（十九．二〇年度分）に申請した業者は必要ありません。▼とき２月４日（月）〜８日（金）午前
127,が参入してくる余地がない。いきおい、競争の原理が働かず、古くからの業者は、のほほん、とやっていられる。“売ってやる”という姿勢はここから来るの
128,変動することがあります。処理方法等詳細は公認会計士・税理士とご相談ください。」といった内容になろう。）（信用リスク・販売当事者の業者の信用リスクについて）「本取引は、当社（行）の財産の状況の変化により
129,激烈な競争の下、数社が小幅の伸びを維持できるほか、その他の多数の業者はゼロ成長であるか、またはマイナ成長にある。例えば豊群グループの来来百貨、統領百貨、永埼百貨は連続
130,なんですが、それなら工事はできるんですか？以前ボードをとるのはムリと業者が言ってましたが、やれる業者もいるということですか？いろいろ聞いてすみません
131,訪ねて来た少女もちろん、〈Ｋ化学工業〉の受付にも、出入りの業者とか関連会社の客以外にも、色々な人がやって来る。特に一階の
132,の労働法制によって、ほとんど意味をなさなくなっています。請負契約は、家の建設を業者に依頼したり、ソフトウェアの開発を依頼する場合の契約です。雇用と違うのは、
133,先ほど業者の人が来てデッキやっぱりお持ち帰りになりました。壊れるなとはいいません。せめて
134,の宅配業者で着払いを指定されました。仕事の都合で帰宅が遅いので、その業者に自宅に集荷に来てもらうのは無理で、営業所も近くにありません
135,ている。その行為自体が「故人との思い出にひたれる時間になります」と安田さん。業者に依頼することもできる。砕いた遺灰を海にまく場合、舞い散らないよう水溶性の
136,をマージン＝収益としてうけとる（公定消費者米価から、政府の査定した販売経費を差引いたものが業者への払下価格となる。販売経費は、卸・小売マージン、搗精費、ロス、副産物収入より成る）。
137,もう休みの日だけでは間に合いません・・・。そこで、こうなったら業者に雑草処理から改装までお願いしようかと思ってるのですが、こういうのはどこに頼め
138,ＦＸの業者選びについて質問です。現在どこの業者をお使いですか？その業者にした理由も教えて下さい。ちなみに私は三貴商事で始めようと思ってます。年内
139,を減らすってのも環境に配慮していることになると思いますが。あっ、私業者じゃないですよ！自分でいじる時に結構その手の店をつかってるだけですから
140,な学生は，排除するだけだ．ＪＡＢＥＥ仕事の邪魔をする教員も排除する．金儲けを優先する業者とは，まともに付き合わない．人間としての人生を奪い，学者としての人生を
141,を葺き直す代わりに「太陽電池」を設置するだけなので、住宅に関わる工事を請け負っている業者（住宅工務店、電気工事業者、リフォーム業者など）であれば、簡単な工事研修を受ければすぐに
142,の商品購入券を贈呈しています。建売モデル住宅の建築などに助成指定区画に建売モデル住宅を建築した業者には、モデル住宅優遇助成、固定資産税（家屋）の減免および土地を無償で借りることができます。
143,配食サービスを利用するお年寄りから質の向上やバラエティーなどを求める声があり、七月から業者を選考するなど準備を進めてきた。安佐南、安佐北区はサービスを提供できる業者がほかに
144,と思うのです。○田中国務大臣中小企業対策、なかんずく建設業関係の中小企業の中におきまして地元の業者の方を使うということは、これはもう最も重要なことでございます。大体
145,言い方で処理をされておられるのですけれども、この間というか中間にある業者、この辺について何か別のお取り扱いをする御意思はございませんか。○長谷川政府委員
146,十分考えなければいけないかと思っておりますので、先生御指摘の点は、十分その業者の側にも、また消費者の側にも注意されてお買いになるようにということを
147,ましては、その特性に即応いたしました販売方法を採用しておりまして、特に特定な業者へ安売りしているというふうには私どもも考えておりません。こういうことで修正を
148,て、ざる一杯いくらという形で日本のやくざに売るのだ。芳幸は宝石を買い取る業者を日本から同行させて、交渉の前にざるの宝石を値踏みさせる。「そう
149,話も聞かされているわけでありまして、そういう面からしますると、ただ単に業者の善意にまつということでは防災対策としては不十分ではないのかな、こういうふう
150,が聞かれた。選挙後を見越し、「とりあえず勝ち馬に乗るだけ」とはっきり言った業者もいた。４年前の知事選で、自民は元県幹部を擁立して敗北した。「
151,家のリフォームに合わせてアクオスのＤ２を買いました。アンテナの工事を業者と相談しているのですが、ＵＨＦとＢＳのアンテを混合器でケーブルを一つにまとめようと
152,かかえ倒産騒ぎになった。さらに金塊の取り付けにまで広がった。そこで他の業者に影響を及ぼしそうになってきたので、ときのサッチャー政権は懸命になって防ごう
153,。また、同法が、リスク説明を行わずに顧客に元本欠損が発生した場合には業者に対して無過失損害賠償責任を認めているので、わざわざ自己責任で重要事項の説明を不要と表明すること
154,、［五十四］によれば、「法九条の許可はあるが法七条の許可のない業者」が、不法投棄や汚泥の放置などの「その業務に関し不正又は不誠実な行為
155,ば、コストが高くなってしまいます。ところが、こうした試乗サービスを簡単にできる業者があるのです。しかもその業者は、このサービスに参入しようとしているのかもしれません。それ
156,ことを証明する身分証を携行しています。メーターの交換は無償で行いますので、業者が交換費用を請求することはありません。なお、作業をスムーズに行うため、
157,は皆様にご好評頂いておりますベストセラー著者の山田里志先生をお迎えし優良物件の探し方・良い業者の探し方などを解りやすくご説明いたします。それから、丸善本店にて堂々の第３位にランキングし
158,公表その他必要な措置を講じることができる。３市長等は、競争入札の参加資格を有する業者に対して第１項の警告を行った場合は、別に定めるところにより当該業者に対し指名停止
159,７、０００匹を出荷し、十億円の売り上げを見込んでいるところです。一方、別の業者の手で、国内最大級の養殖施設を整備する計画が新和町沖で進められており、これらの養殖場
160,、その病院に馴れた業者にさせるほうが良いと現場は言ってくる。業者が変わると、その病院のやり方を知らないので、不便、不都合がおこると思い込ん
161,「あのう、言い忘れていたことがあるんです」と言った。外来の患者さん、職員や業者の人たちが行き交うエレベーターホールで、米田さんはぼくを見おろしながら、しゃべり始めた。「お袋
162,の手伝いが加わるかたちでの結婚披露宴や葬式は影を潜め，その施行のほとんどを業者に委ねるようになっている．しかし，そのことによって家族の宗教的機能がなくなったわけで
163,について議長が知ったのは昨年９月だったという。「半田秘書から『ある業者から六千四百万円を返せと要求されている』との報告を受け、驚愕した」。問いただす
164,たきり状態の人などを対象に、寝具洗濯乾燥事業を実施します。実施時期７月事業内容業者が自宅を訪問して、対象者本人が使用している布団などを預かり、洗濯（水洗い）・
165,。このほか、事務所の紙くずは古紙回収に、プラスチック系ゴミは圧縮してＲＤＦ（固形燃料）業者に委託、蛍光灯は年間約二千本ばかり出ますが、府内の中間処理業者に委託して北海道の
166,は皆様にご好評頂いておりますベストセラー著者の山田里志先生をお迎えし優良物件の探し方・良い業者の探し方などを解りやすくご説明いたします。それから、丸善本店にて堂々の第３位にランキングし
167,問題の指摘がありました。例えば第一には、実態上世の中には相当悪質な業者も存在することを否定することはできない取引分野であろうかと思いますけれども、そのよう
168,ものなのでしょうか？また、それは素人でもできる作業なのですか？それとも、業者に頼んでやってもらわなければいけないのでしょうか？教えてください。ホントに何度も質問し
169,、購入後に不安に思ったら消費生活センター（☎三百三十四．〇九九九）にご相談ください。また、住宅用火災警報器は、業者による点検は不要です。「点検に来た」などと言って、新しい警報器を
170,てきたという面もあること，３郵政省の担当官は，情報の提示を受けない業者には入札に参加しないようにとの指示をしたことはなく，またそれらの業者
171,窯。石の間には長くて赤いサツマイモが潜っている。伝統に忠実な業者は荷車を引き、肺活量を頼りに売り歩いているが、大多数は車でスピーカーを使っ
172,氏名、住所、電話番号は名簿として販売することがあります。」事例３情報処理サービスを行っている業者の場合は、「給与計算処理サービス、宛名印刷サービス、伝票の印刷、発送サービス等の情報処理サービスを業として行う
173,がいて、その里親で貰った犬や猫等を、「実験用」として卸している業者も多いとか？？？まあ、ペットショップがこれだけ存在する事自体がおかしいとは思い
174,の比率が大きくなる。「振込」は１億円〜５億円未満、三十億円〜百億円未満の規模の業者でその比率が高くなっている。総申込者数と新規顧客数（平成十二年４月〜十三年３月単位
175,テレワーク千九百七十年に制定された家内労働法が適用対象とする「家内労働者」とは，委託者（業者）から委託を受けて物品の製造または加工によって労働の対償を得ている者である
176,により異なる料金月額二千五百円（イッツ・コミュニケーションズ「かっとびプラス」の場合）必要機材ケーブルモデム、ＬＡＮカードまたはＬＡＮボード（業者により異なる）特徴●比較的高速で常時接続が可能。●通信速度やサービスが業者により違う
177,ではジョン・リーチ、アンドリューおよびジョアンナ・ヤング、デヴィッド・フリス、リチャード・バターハムといった陶芸家をはじめ、ダート製陶工場やハイランド陶器会社などの業者が、技術と工夫を駆使して完成度を高めながら、上記のような堅苦しい陶器の
178,、百分の十五という数字を規定いたしましたときの目安といたしましては、一つは、業者が市中から資金を調達する際に要するコストでございますとか、あるいは通常の取引で
179,レンタル業＝運送業＝汲取り業＝清掃業という、いわば避難所トイレ業なる業態が存在していること、２この業者（ＬＲＣ）は、バキュームカーの後部に仮設トイレを数台積み用水タンクと清掃器材を積載収納して、要請
180,したがいまして、私どもといたしましてはそれを禁止するということではなくて、悪質な業者にとりましては実質上禁止の効果のある行為規制によりまして対処するというのが適切
181,受けた』と言うので、受注を了承したそうです」そして入札当日。十八社の業者が参加して行われた１回目の入札は、ほぼ全社９億円台後半で不調となる。２回目
182,いうものは対象にならないわけであります。しかしながら、今御指摘のように日本の業者がそういうことをやっているというような場合に何らかの薬事法上の措置が
183,いいでしょう。宅急便の場合、重さ・サイズ・送付先によって送料（五百十円〜）が変わります。発送したい業者（ヤマト便・佐川急便など）によって料金が多少違うかもしれませんが、ＨＰで探すと料金表が載ってい
184,、クリエイターが最も利益を得るべきで、中間に入って不当に利益を貪っている業者は排除するべきだと考えていたんです。この徹底的なクリエイター至上主義の裏には、有名大学
185,，法規制の強化あるいは警察の取締りといったことのみで解決できる性質のものではなく，関係行政機関による業者に対する指導監督の強化，利用者に対する啓発指導の徹底等の諸施策に期待すべき面が極めて大きいもの
186,ているのに対し、第四条は「米穀ノ買入売渡…ヲ為ス者ニ対シ」としており、業者のみならず、米に関係する生産者・消費者をも対象としていることである。この政府による命令
187,）のみの引越しで（一軒家から一軒家に）、運送費と丁寧さ（設置も）で業者選ぶとしたら、どこがいいと思いますか？今考えているのはサカイです。引越し
188,と、「つくる会」の人たちが主張する「業者による『慰安婦』集め」だけ、そして「業者による個人責任であって、国家責任はない。」を文部省は見解としているとしか思え
189,ではないですね。ただ運任せって行かない位に不動産の購入は一生ものですからね。業者の選別方法の１つはやはり紹介ですね。知人や会社の同僚、先輩・後輩。あと
190,大きな修理を持ちかけられました。もろもろあわせて、新品を買うほどかかる修理です。業者の言い分は、古い楽器のほうが、材料も作りもいいので、新品に買い換える
191,くる。この店をひいきにする吉本芸人やプロ野球選手も多いという。「長年付き合っている業者から、タチ肝など流通しにくい肉も新鮮なものを仕入れることができるんです」とマスターの平山さん。
192,な業者もいる。現在の委託先がそのような業者であるなら、すぐにほかの業者を探したほうがよいだろう。アウトソーシング先と業務を行う前に次のような
193,、できる限り市が巣を駆除しますが、駆除が困難な場合は、専門の業者を紹介します。アシナガバチ【アシナガバチの巣（写真下）】傘のような形
194,大きな業者の場合、本社所在地だけでなく、実際に対応することになる事業所の住所も確認しましょう。業者の事業所は、施工現場から遠すぎないほうがいいでしょう。自動車で三十分以内であればいうことなし
195,八十三年から八十五年の間に、違法マシン・ガンの押収数は、三倍にのぼり、販売許可を受けている業者の数も、八十五年までの五年間に、三倍増を記録している。合法的に売られるマシン・ガン
196,、そうでない方、幅広くお返事お待ちしております。以下のＵＲＬはヤフー掲示板の「見合い」トピです。業者のことから、個人のお見合いおばさんの話まで、一通り目を通すのにかなり時間がかかり
197,やつは口をひらいた。「中高生や男の子をおいているとなると、まともな業者じゃないな。モグリだろう。届出をしてるかどうかも怪しいもんだ。広告を
198,協定量を相当上回った輸入が行われるのではなかろうかという新聞記事等が出て、わが国の業者は非常な不安に駆られていたのでございますが、現在のところでは、
199,です。住宅リフォーム推進協議会が定めた「住宅リフォーム事業者倫理憲章」に基づき適切な事業者行動をとることに同意した業者が登録しています。（ｈｔｔｐ：／／ｗｗｗ．ｃｈｏｒｄ．ｏｒ．ｊｐｈｔｔｐ：／／ｗｗｗ．ｒｅｆｏｎｅｔ．ｊｐ〇三‐三二六一‐四五六七）マンションリフォーム推進協議会（ＲＥＰＣＯ）…マンションリフォームの関連業者とマンションリフォームマネジャー
200,の推移延滞残高対前年比（％）延滞残高の推移４．対残高償却比率の推移償却比率も多くの規模の業者で増加全体で４．４％から５．０％へ０．６ポイント増加償却額、償却比率とも多くの規模の業者で増加している
201,しかも、同じ規格のまとまった材料を必要とする大手業者には扱いづらいため、地場の業者だからこそ売り物になると考えた」その結果、同社の住宅の七割は
202,、第二次近代化計画を清酒製造業の業界において並行的に進める中で、すでに御承知のとおり二百二十を超える業者がやはり転廃業のやむなきに至っておる。さらにまた、最近御承知のとおりの大変な急激
203,対応した典型的な例であり、地域で生産された木材を認証したり、これらを取り扱う業者を紹介したりするといったＮＰＯは七十に及ぶ。また、現在、各地で「顔
204,淡々と説明する。「シャツの襟に縫いとられた商標から、それを製造した業者を突きとめた。東京の練馬の方にある、中規模の衣料品メーカーだった。捜査本部から
205,ございます。○林（孝）委員簡単なんですよ。被害者から具体的にこういう業者が渡していった資料等取り寄せれば、現物であるか先物であるか一目瞭然で、皆さん方専門でしょう、
206,ないと、こういうことが言えるわけなんですよ。だから、三十％が適当だなんて業者が言っているそのまんまをうのみにされては私は困ると思うのですね。
207,あげている。しかし，一部になお不徹底な面もみられるので，警察では，業者に対して，自主規制の一層の徹底を要請している。（ウ）出版関係業界への自粛の
208,」「中小サラ金利用者名簿」などで、できれば現在営業している業者よりも、すでに廃業してしまった業者から出てきた名簿のほうが騙しやすいといわれる。というのは、廃業した
209,のやり取りをメールでよくするが、最後に一言温かさが伝わるメッセージを添える。すぐ近くの業者で、朝始業時間前にラジオ体操をしているのでそのことを、“元気いただき、朝
210,郡司彰君そういう仕組みにさしていただいたということですが、例えば焼却の場合でも、業者の方と団体とで契約を結ぶことになりますね。その結んだ契約というのは
211,サイトをそのままプリントアウトしたものを使うのが良いと思います。その際、その業者を「催眠商法」と断定しないことです。こういう商売がありますから気を付け
212,という条件で取り引きをしているのだ。よって、夕方から夜にかけての時間帯で業者が内臓を運び入れているような店なら、まず合格。それが確認できなかったなら
213,多く見受けられます。点検商法の被害に遭わないためには、いきなりやってきた業者の言うことをうのみにして、その場で契約するのではなく、一度業者に帰ってもらっ
