,0
119,教えてください。うちの子も食物アレルギーあります。保育にはまだ行ってません。病院にも掛かってます。小児科アレルギーですが先生は、数値はあくまで数値（目安）と
120,質問したのだすが・・・恥ずかしいのですが、カンジダ膣炎らしいのですが。。。病院に行きたいのですが現在保険証がなく所持金もない状態です・・・どうし
121,終えるのを待ちかねたように、校門で待ち合わせ、二人で電車とバスを乗り継いで病院へ来るのだという。父親も仕事が許す限り、ほとんど毎夜、妻の病室
122,を犯さうとして、或る秋の一夜をその家に忍び込んだ。主人は病院の方もやつてゐたが、自宅でも診療してゐて、玄関の内側に
123,たのち、救急指定病院である新潟市社会事業協会・信楽園病院に運びこまれた。腎臓病治療などでは県下でも有数の病院である。病院側によれば、到着時、呼吸停止、心停止の状態であったということだが、
124,ができないのです。もっと大切にしなければいけません。ボディケアには定期的に病院、診療所に行くことも含まれています。ケガをしていないから行くのです。
125,耳に入ったんやと思うんやけど」「そりゃいけるかや。早よう病院へ連れていけ。城辺の医者じゃあ頼りない。宇和島の町まで行って、しっかりした
126,をつれていきます。私は自分の症状を言うのが苦手で、特に、病院にいる間は冷静のせいか、症状を忘れてしまっている状態です。彼氏に、
127,てしまい、むしろ上記の文章に書かれたＤｉｅｋｅｍａ医師の見解のほうが最終的には病院のスタンスに入れ替わってしまっているのですから、こちらの方が、さらに大きな不思議です。いったい
128,この病院を再び訪れることはないだろう。マキコの死後、薫はそう思っていた。それが
129,間、鈴木さんは、できれば切らずにガンを治す方法はないかと考え、病院を抜け出し、何人かの友人に相談した。しかし、友人たちの大半は手術を勧め
130,調べてみますのでお待ちください」美穂は足早に診察室から出ていった。たいていの病院では、医療機器やペースメーカーを狂わせるので、モバイルコンピュータを使うことはできない。ここ
131,ましたので、自宅治療の旨を伝えて、その方法を執ってもらうとよいでしょう。病院にはカルテがありますから、その病人の担当医が不在でも、臨終までの
132,妊娠した皆さん、初めて病院に行ったのは何週の時ですか？私は今回やっと妊娠したようです。
133,、来なくていいって言ったのに。誰よ、告げ口したの…ううっ…病院なんか行くの、やだよぉ…」妹が、ホッとしたような苦笑いを浮かべ
134,ません。ダウン症の検査（羊水検査）は何週目くらいにするのでしょうか？それはどの病院も行っているものなんでしょうか？それとも希望を聞かれるのでしょうか？羊水検査は全員が
135,よ」と何度の言うのですが無呼吸症の検査で、散々な目に合ったらしく病院を嫌ってます。もう腰痛が発生してから３日過ぎています。寝ている状態から
136,が、昔でいえば数えの七つである。私は七つのとき、入院した病院の付き添い看護婦にほのかな慕情をいだいたことがある。妙な話だが、私は
137,は彼に任せてくれた。山田さんに私を任せた姉は、骨髄移植ができる病院を探すために、関西地方から東海地方へと足を延ばし、走り回っていた。私は
138,人工透析の準備をすすめられ主治医が紹介状を書いて下さり透析の機械がある別の病院に行き検査を受けたところです。たまたま友人の義母も透析をやっているそうで
139,の活動点訳ごみ拾いお年寄り訪問２土曜日に１の活動をする場所海岸病院中学校３日曜日に１の活動をする場所海岸公園コミュニティーセンター●Ｏｐｔｉｏｎ―
140,精神科の奥深さに引かれているという■■さん。「研修では、地域に密着した病院で良い経験をしています。いろいろな人と知り合え、仕事も私生活も充実し
141,支援を必要とする方※協力できる家族などがいる家庭は除きます。▼派遣期間病院、診療所などで出産した場合は退院の日から、そのほかの場合は出産の
142,てきたという。南北に丘を背負ってうなぎの寝床のように長く伸びた病院である。病室は八室ある。建築はそまつであって、材木は節だらけで曲がってさえ
143,復職したらなかなか病院も行きにくいので午前中歯医者さんに行き総点検してもらう友達とお茶しておしゃべり（チャイと
144,「後送病院」という言葉を聞きましたが、どのような病院をそういうのですか？「後送」とは後に送るという意味や、戦場から
145,十七日（月）租税徴収制度調査会第四十三回速記録大蔵省主税局午後一時四十五分開会○原委員ちよつとお諮りいたしますが、我妻先生は病院にお立ち寄りになつて二時ごろまでおかかりになるというので、きようは相続と租税との関係、
146,、警察から事情を聴かれても、口を箝して語らなかった。さらに病院に収容されていた江馬のボディガードに面会を求めて、桐生の写真を指し示したところ
147,なって，心配した妻は，救急に電話。「こんなところで電話しても病院なんてないよ。」と言っても聞かない。電話をすると，予想通り
148,。。。。忘れたとか白々しく言うスキャンダル議員に、このボケ議員、さっさと議員辞めて病院に行けとはいえないでしょう？
149,を引いてます。直るでしょうか？腫れはありません。一般的に言うと早く病院に連れて行ったほうがよいのではないでしょうか？私は、よくスポーツをやるので
150,、どこもフォローしようとしないね。アサヒとキリンとサッポロ、サントリーで、内臓専門の病院を建てるとか。酒を飲み過ぎて肝臓を壊したやつはただになるっていう
151,一昨日、叔母の胆石除去手術の付き添いで母と一緒に病院で半日すごしておりました手術自体は、お腹に４カ所小さい穴を開けて十個ほどの
152,不利点を克服するひとつの手段として、遠隔医療システムは有用と考えます。慢性疾患の患者さんは、病院で定期受診を受けなくても在宅で済ませることができます。専門医の不足している病院で
153,の手術があると言いながら、たった一例を挙げただけ。それが、他の病院の他の医師が行ったものならともかく、自分が関わったものでは、正しさ
154,病院は何故待ち時間が長くって診察は十分なんでしょ？実際に担当している医者は少ないから
155,書く体力も失せていたので、発病から一年はなにもできなかった。午前は病院に出て、午後は狭い病院住宅の庭の移りゆく四季をぼんやり眺めながらかろうじて生きてい
156,たい。純粋語啞患者Ｅ・Ｆｒ千九百四十七年十二月十日、六十三歳の貿易会社代理人症例Ｅ・Ｆｒ（右利き、男）がパリのラリボワジェール病院の循環器科に入院してきた。十年越しの循環器疾患の検査とその治療が目的であった。
157,で作成した病理標本の画像をインターネットで診断専門医に送り診断してもらえば、病理医はほかの病院への巡回出張をしなくても済み、迅速な診断も可能となります。これ
158,な、イギリスの新聞で、日本では犬を食べる習慣があるだとか、病院で実験用に犬を使うだとか、大きく取りあげられたことがあった。ちょうどその
159,も家にて死にき吊忍―当節、在宅で死ぬことは稀有である。たいていは病院で死ぬことになる。いつからひとは自宅で死ぬことができなくなったのか。思えば
160,陥没乳首の手術ってどこでした方がおおいですか？エステ、病院・・・保険はきくのでしょうか？また、どんな手術なのか痛みがあるの
161,第二条第六号に規定する臨床修練外国歯科医師」と、「その病院又は診療所」とあるのは「その病院」と読み替えるものとする。２臨床修練指導医又は臨床修練指導歯科医は、臨床修練外国医師又は臨床修練外国歯科医師が行う臨床修練
162,他の女の子達はみんな、感じがよくて仲良しなんですが、彼女がいるときに病院に行くたびに、とてもいやな気持ちになります。そのこと以外は、犬猫にとっても
163,と、抗生物質いりの目薬が必要ですが、これは、動物病院で処方してもらいます。病院へは行けませんか？腫瘍などでは、多分、そのまま見守るのが最善
164,病院へ行こうと思っています。ただ、今赤ちゃんが欲しいと思っています。その病院は漢方を処方してくれるそうなのですが、そういった状態ではやはり薬は飲め
165,「そうです。ご家族に一度来てほしいと」「わかりました。じゃあ、病院の先生の名前をもう一度教えてもらいますね」「はい。内科の…」
166,心拍数は前日よりむしろ持ち直した値だった。玉置氏が来院し、近郊と地方の病院に、血液型もＨＬＡ（組織適合抗原）もよく合う腎移植待機患者が一人ずつ見つかったと報告してくれ
167,ベストだと聞いたのですが、本当のところはどうなのでしょうか？また、病院に着いてからも、いつもさらに三十分間機械の中に入れるのですが、この前は
168,を目指すことを決意。父の執刀をした医師・西園陽平教授のもとで学んでいる。病院の壁に寄せて穣治は車を止めた。つい最近、中古で買った国産車
169,の交替があり、私がＡ子さんに関わるようになりました。訪問に際し、病院のソーシャルワーカー、療法士とケース検討。援助上の情報、助言を受けました。病状は
170,ん。それまでの過労が弱っていた肩に一気に出てしまったのかもしれません。病院で痛み止めの注射を打ってもらうとらくになりますが、薬が切れてくると、
171,ところが出血が多く、病院に運ぶという決断を家族がしたときはすでに遅く、病院まで後数分のところで命を落としてしまった。二千六年の国連人口活動基金の統計によると
172,十二月二十九日、優一を内科へ連れて行きました。今まで連れて行っていた病院を替え、違う病院にしました。父が八女郡黒木町にある十一面観音院の住職さんから
173,でも診察を受けさせてあげたいのですが、大阪でヘルニアの治療で有名な病院があれば教えていただきたいのですが。すべり症とヘルニアはぜんぜん違いますよ。それに
174,を神経に打つことでどちらも症状は治まっています。子供が小さいとなかなかゆっくり病院にもいけませんが、機会があれば整形外科へ行ってみて下さい。
175,仕事をさがしましょう。目は覚めるはず。二度寝もしないはず。それでダメなら病院です。睡眠障害。
176,の教育レベルにもかなりの差があるというのが現状です。日本のほとんどの病院では、個室どころか、カーテンで仕切っただけの大部屋も多く、トイレや洗面所
177,けど。ここで住んでいて，いい歳になって倒れても安心して行ける病院がない。不安なまま朝を迎える。今朝７時に起こされて，８時過ぎに
178,か、ローリについて残るかの二つにひとつだった。選択の余地はなかった。病院にとどまれるように、彼女のお母さんに子供たちをみてもらう手はずをつけた。たぶんローリ
179,は判断できないここ数年、医療事故が多発することへの反省から「患者本位」をうたう病院が増えてきた。一方で、患者として当然の質問を疎ましがる医者や衛生管理がずさん
180,た気がする…私のさがしものも…」優は遥か遠くに小さくなった病院を振り返りながらそうつぶやいた。良太とまゆ子の二人を見ていて、清々しい気分に
181,でした。（全部でで３回妊娠検査薬で検査してる。）みなさんこのような症状で、病院に行かれなんと言われましたか？きっと生理不順だと思うので今は、
182,に立たず。早期発見、早期治療。なんでもなければそれだけですよ！安心の為に病院へ行きましょう〜
183,を選ぶ時間は認められないんですか？うちのイトコも四十過ぎて違う病院に移ろうと色々と探してましたが結局は年齢制限や色々な理由で
184,普通の医療法人なら４割くらいは戻ってくるというような仕組みになるので、かなり病院にとって有効かなと私は思っているのです。ただ、一方で、普通のＲＥＩＴ
185,、私はいそいで家に帰る。母が入院したためである。次の日、病院にゆき、母に六．一五の集会のことを話してきかせた。母は「
186,にジーンズメイトではなくてもお直し屋さんでやってくれるでしょ。その辺にある。洋服の病院、とかいろいろ町のお直し屋さんに相談したらいいと思います。どんくらいのお直しが必要
187,に男であることの自信を失ってしまう若い夫が多いそうだ。やっぱり、男は病院の廊下でオロオロしている方がいいと、僕は思う。「産み落とすというぐらいで
188,の外をみながらいった。２冬子は、思いついたまま、その日、病院に並木をたずねた。並木は、着がえを終って、荷物をベッドの上
189,ちょうどそのとき具合が悪くて入院してたら、彼がお見舞いに来てくれて、病院で。夜の誰もいない待合室の中。ひやひやしました。（二十一歳大学生
190,も、あるいは元本をたくさん払わなくてもいいし、税金もセーブできるのです。要は、病院の、トータルとしてのキャッシュアウトを減らすことができるわけです。家賃を払うので自分の資産に
191,急を要す場合には、直ぐに救急隊に搬送して貰うか、後日、架り付けの病院から紹介書を書いて頂き、直ぐに病院を受診してください。たいした事が無い事を
192,終えて帰宅するとぐったり…。夕飯をつくる気力もありませんでした。夫に病院へ行くように言われましたが、婦人科を受診したことがなく、敷居が
193,のでどうしても早く調べたいんですがやはり今日はキャンセルするのがマナーでしょうか？今までは病院へ行く前日は避けていたのですがみなさんどうなのでしょうか？やはり検査結果に影響が
194,離れることを希望している。具体的には、彼の日本の病院は患者を海外の病院に送り込むための検査や治療の前段階のみを行い、自分が中国に建設した病院に
195,の男性の様子がおかしかったため、救急車により病院に搬送しましたが、収容先の病院で死亡が確認されたという報告を受けております。この被留置者は、室内で大声
196,いうか既に寝てる）８月末からちょっと気になってることがあって今日コトラの病院に行ってきました。病気ではないので、大丈夫です。待合室でコトラは初めてセキセイ
197,ができるようにしてやるべきなのだ」その人らしい美しい死を迎える場所として病院が適していないことは私も同感です。しかし、それでは自宅が病院よりも
198,年少の子供がりんご病になりました。病院では登園しても大丈夫といわれましたが、頬は赤く熱いです。薬
199,三割も出されちゃ、手も足も出ない」岩谷は愚痴った。病院にクレームをつけたところで、リベートをもらった看護婦のほうは、あっさり辞めてしまって一件落着
200,し、病院で食事をするよう勧められていることも明かさなかった。エリックが病院に帰ってみると、昨日手術した患者はまだ生きていた。しかし医師が看護婦に
201,ことを認識し始めていた。シータス社との三年間の共同事業における主眼と優先事項は、たしかに病院における免疫診断法の開発ではあった。しかしコダック社は、ＰＣＲ製品の開発を、とくにＨＩＶ
202,までよい関係を結び続けたいと思っていても、依存症になって問題を起こし、病院に連れて行かれたら、言い渡されることはただひとつ「一生涯にわたる断酒」のみです
203,花畑のある島七十五歳のその老女を、仮に「矢田老女」としておく。病院の看護婦や付き添いの間では、「矢田のばあちゃん」と呼ばれていた。
204,のでしょうか。低所得者用の特別の施設を作って対処するのでしょうか。しかもいまは、病院すらも入れません。百八十日を超えて入院すると、入院基本料が特定療養費化され、保険が
205,、十和田湖で合宿中だったＫ大の陰山政夫と恋におち、卒業式の翌月に結婚。病院を営む夫の家で暮らし始めた。夫は生家の病院は継がずに大学病院勤務を
206,見ている。自衣の看護師はいやに屈強で、一文字の眉が濃かった。病院は地下一階・地上八階の建物だ。ここでも四は伏せられており、現在
207,妊娠初期の方がたいのうが確認できたとありますがたいのうって何ですか？先日病院に行って超音波写真撮りましたがそこに写ってるものですか？胎嚢とは羊水
208,を休み、私を入院させ、抗酒剤を服用するなどの治療を受けさせました。病院の方から、アルコール中毒になったご主人に付き添う奥さんはいても、奥さんに付き添う
209,ための診療所を交えての自由競争がある。患者は病院を評価し、自分が納得した病院に受診する。フリーアクセス（患者が自由に好きな診療所、病院の診療を選択できる）の
210,病院受付の不親切さや無愛想に毎度不愉快な思いを致します。病院は大変気に入っておりますが、通院するのがいやになります。皆さんはこんな
211,をよぶことにしようよ。太郎山に電話して、だれか来てもらおう。それと、病院にベッドがあるかどうかもたずねないと。お昼に一人入院させちゃったから
212,低床式のがふえてきております。○松永忠二君それは特別のバスはありますよ、病院へ通うね。一般のバスでこういう低床式のものやっているというのはほとんど私たち
213,午前８時三十分〜午後８時○場所役場庁舎４階会議室◆不在者投票不在者投票施設の指定を受けている病院や老人ホームなどの施設に入所している人は、病院長や施設長に申し出るとその施設内で
214,に移る）が多いのは、こんなところに原因があるのかもしれません。最近、病院も他企業と同じく格付けされるようになってきました。それが「病院機能評価」です。
215,本日、映画を観てきました。バチスタの次の作品、病院を題材に今回も期待を裏切らなく面白かった。不景気で、病院にかかれない
216,よく生きていたと不思議なほどだった。現状回復のため治療に当たった他の病院の医師たちは、一様に驚き、顔をしかめたのである。
217,、その結果の詳しい説明と今後の生活の注意を受けたい”“今かかっている病院での治療について、これでいいか意見を聞きたい”“健康食品について具体的にその
218,ずにビールばかりを飲んで…」「人を待ってるだけじゃないのか。病院とは関係ないだろう。入口のほうに眼をやっていれば自然と病院のほう
219,にはどうすれば良いですか？病院のＨＰくらいしかないでしょうか？そこの病院の手術の内容が判れば、ある程度は想像できます。ＨＰや病院の冊子など
220,、相手をしていたおまわりが、林弁護士の前で倒れた。で、そのまま病院にかつぎこんだけれど、死んだ。それに対する腹いせ、意趣返しや。明らかに捜査二課
221,、もうイヤです。今朝は座薬が効いて、なんとか寝る事はできたが、病院にいくあたりから再び痛みがひどくなりまたもや車椅子での診察を受ける。先生に痛風
222,判明し、ＮＩＣＵのある大きな病院に搬送になりました。ちなみに最初からＮＩＣＵのある病院に行ったとしても、今はＮＩＣＵはどこも満床傾向にあり、出産のタイミングでベッド
223,つづけた。「ここを出るのは夕方になる。ちょうど夕食の時間帯だから、病院を抜け出しやすいと思うんだ。タクシーで駅に駆けつけて、電車に乗ってしまえば、もう
224,のでしょう。疑問があれば質問してみるメンタルな病気であるだけに、受診する側にとってかかる病院が自分に合っているかどうかというのは、大きな問題でしょう。初めて受診してみた
225,」に改造され、重篤な救急例にはソフィアから全国情報助言サービスを得られる。ポリクリニークは病院と連携し、やはりソビエト制度にならって予防と治療を結合させている。「医者が患者
226,になり修道会に入る時、クサヴェラは面接の修道女から希望を聞かれました。病院と教育機関の二つの仕事のうち、どちらを選ぶかというものでした。もちろんクサヴェラ
227,…市町村道，街路，都市計画（地方公共団体の一般会計による公園整備・区画整理等），住宅，環境衛生，厚生福祉（病院，国民健康保険，公立大学付属病院の各事業を含む），文教施設，水道及び下水道の各投資（産業基盤投資）
228,も繰り返していました。そんな日々が５年ほど続いたあとの平成９年３月、病院から夢にも思わないようなことを説明されました。「それはびっくりし
229,ようにして下さるのである。Ⅱコリント１：４私が子供のころは、病院や歯医者に行くときには、いつでも父が一緒に行ってくれました。
230,の腺が切れたらどうします？いいえ、わたしゃ、御免こうむります」この病院では予算が少ないため、電気ショックもナマでかけねばならなかった。こうした信念
231,運んでもらうんだ」「だめよ。それはしないと彼女に約束したの。病院には行きたくないんですって」ロミーナは大きなスパゲッティ鍋に水を満たし、レンジの電気バーナー
232,てゆっくり帰ってきました。うまれてから１ヶ月健診まで実家にいて、そこの病院で健診後、家に帰りました。初めてだったので、実家に帰ってよかった
233,の、これがちょっと苦手ですわね。マヨネーズだとかなんとかいってかけるでしょ。病院でも毎日出てきた。あの、ニンジンの葉っぱみたいなのあるでしょ。え？
234,さも家族の問題があるかのような論評が、社会的支援が存在しなかった時に病院に頼らざるを得なかった家族を苦しめ、罪責感さえ持たせていることを忘れてはなりませ
235,千ｃｃもあった。ガン性胸膜炎のために、呼吸がひどく苦しくなるのである。悠子さんが病院につき添っていったが、粟國さんは歩くのも難しいくらい痛がっていた。それでも二日後の
236,になる。産婦人科の開業医では双子を出産できない。未熟児の可能性が高い場合、病院にお願いするしかないので頼りは総合太田病院だった。今は、そこに医師はいて
