,0
237,気にしており、軽くダイエットをしております。又、ＩＧＡ腎症があるそうです。病院にかかるのが一番なのでしょうが、自営業で忙しいのと、田舎暮らしなので、なかなか
238,だ。数日後、傷ついた養母を、夙川の河口近くにある病院へ運んだ。病院に入院させたところで、治療のための薬があるわけでもない。煮炊き
239,が出たら、一刻も早く救急車を呼び、病院に行くことが重要です。病院に運ばれるまでの時間が短かければ、脳の障害を最小限に食い止めることができ
240,た。淀野はそのことに就いて、こんなふうに云った。「ここの病院で手術をしたがらないのは、機械が旧式でよくないからだそうだ。
241,なく、穏やかに言った。「ひと聞きが悪いな。ちょっと借用しただけだ。病院のほうの債権者にヤクザ者が混じっていてな。切羽詰まっていたんだ。それだって
242,分かりました。それでは早速」「あ、そうだ。橋口さん、どうして初めからもっと大きな病院に行かなかったの」「それがね先生。譫言のように、篠田医院に行っ
243,た。「いやいや。井原先生が謝られることはないですよ」「有森君をウチの病院に引き抜いたのは、私ですから」「有森先生、とても時間にシビアな方
244,Ｑ１つわりと妊娠悪阻の境界線はどこにあるのでしょうか。また、つわりでも病院へ行くべき目安のようなものはありますか。Ａ１痛みや辛さに対する
245,早く」と私が言っているので、よしクンもあせっちゃうのかなぁ。ごめんね。病院ででもいいから、いっしょにいるときが一番幸せです。人間って不思議な
246,。その後どうすればいいかとかも教えてくれると思うので、明日にでも病院へ電話するなりして聞いてみてください。
247,どうも』滝沢はそんな挨拶をした。『知ってるんですか』『何度か病院に行ったからね。美人は覚えやすいんだよ』北村はそんな軽口を叩いた
248,な仲間の出現を期待したいからでした。患者の一人は、「あのあと病院の応対の仕方が変わった」と喜んでいました。マス・メディアの果たした大きな役割
249,病気の対処方法や病院の診察を受けたらいいかなどの相談ができます。それから病院、というのが順序」親が迷ったときのアドバイスをしてくれた▼「なんでも
250,」とも聞きます。どちらがホントですか？痛みがあるのであれば、早急に病院へ行き水を抜いてもらった方がお母様も楽になると思いますよ。場合によって
251,脳波測定機で運転者の脳波を検査する。異常波を出している者は、発作を起こす前に病院へ収容されるのである。でも、わたしはテンカンの素質はないはずだし、もちろん
252,交流が続く病院の患者さんだった人たちの集まりがありました。会場は病院の広い待合室日曜日の午後先生を囲んで集まりました。皆さん子連れでした
253,ない。こうした問題を解決するためには、高齢者が日常的に利用する機会の多い病院や福祉施設の協力を得たり、テレビ等のマスメディアを活用したりすることが有用であると
254,の業者さんに予約確認到着した車へ２人がかりで母を乗せていただき妻同乗して病院へ病院のストレッチャ−で外科検診・胃ろう管交換その後内科検診病院の配慮と妻の大活躍
255,８月の始めから子供が入院をしずっと付き添いで病院にいました。今日退院してきてビックリ！！体重が３キロも増えていまし
256,、和代は病院へ直行してきた。そして、午後には、帰国児学校帰りのあけみが、病院へ来た。三度、道をきいて、わかったという。その夜は
257,をかみそりでいつもみたいに剃ってしまっていいのですか？教えてください！！私は病院でしましたが、２〜３年くらいすると少しづつ細い毛がところどころ生えてきます。
258,）。クレイ氏が、首相就任受諾（８日）■シンガポールで新型肺炎陽性シンガポール保健省は、シンガポールの病院に入院した男性から、新型肺炎（重症急性呼吸器症候群＝ＳＡＲＳ）の陽性反応が出たことを明らか
259,資金需要に対する充足度を示したのが表五十九である．これをみると，二百〜二百九十九床の病院における資金不足感がとくに強いなど，規模別では跛行性があって明確な傾向は見出せない
260,を食べた少し後からなったのであれば、アニサキスという寄生虫の可能性があるので、病院に行ったほうがいいです。
261,なんてあまりないですよ。そんなに急を要する熱とか怪我は、あなたより、病院へ行った方が幼稚園も良いと判断するでしょう・・ってか救急車呼ぶでしょうが。
262,に、彼はこんな事を言っていた。「精神病院に一年いたけど、病院っていうところは、本当にチャネラーが多いね。みんな霊感体質だった。びっくりした」
263,くれるだけの医者がいるので、そうではなく具体的に説明してくれたりアフターケアが良い病院にいってみたらどうでしょうか？
264,です。現在イライラの極致！仕事場での子供達の喧騒は平気ですが・・・病院という、自分と向き合う場所では、非常に腹が立つ！連れて来なければ
265,たって、もう三ヵ月もしないうちに生まれるんだろう」「そうだけど」「病院は、今、通っているところでいいのか」「いちおう、そのつもりだけど
266,ではないということになってな」夏木は思わず、傷のことも、そこが病院であることも忘れて大声を出した。「なぜですか！あの人の
267,でも役だっているといえます。「患者の権利章典」と「カルテ開示」私たちの病院は医療生協の病院です。日本の医療生協は、千九百九十一年に「患者の権利章典」を確定し
268,神戸市薬剤師会ハートフル事業開始在宅介護の相談受け付け／視聴覚障害者や外国人に優しく…医薬分業のメリット前面に病院の医師が書いた処方せんを院外の薬局に持ってゆき、薬を受け取る医薬分業が
269,や嘔吐、中耳炎、副鼻腔炎、とびひ、溶連菌感染症、肺炎などです。これらの病気で病院を受診すると、まず抗生物質を処方されるケースが多いでしょう。しかし、抗生物質の使用が
270,解熱剤を飲ませ、今はぐっすり寝ているのでこのまま朝まで寝かせ、明日の朝病院へ連れて行こうと思っています！この間気をつける事とか何か良い
271,》エイズＨＩＶウイルス・キャリアの体調が改善。健康人と変わらないほどに好転！◎マニラの病院へ…キレート水を開発した木村微生物研究所所長・木村謙二氏は、数年前から大きな難題に挑戦しています。それ
272,か。病院とは関係ないだろう。入口のほうに眼をやっていれば自然と病院のほうを見ることになる」「わたしの思いすごしならいいんですがね。でも、その
273,であったとしてもなんら父も不思議に思わないだろうが、秋田のさびれた町の小さな病院に勤めている外科医をいくら旧知でもわざわざ訪ねていくはずはない。何か男女
274,からな」それがわかっているからこそ、宮緒に知られる前に、こっそりと病院へ行って、とっとと治してしまいたかったのである。『だったら、あそこが一番です。
275,復員してきたあとは、大学病院の精神科の医師としてその主治医になった。晋助が病院で死んだときに看取ったのも彼であった。実習が終って彼が
276,混んでいる耳鼻科ですが、今年は花粉がそうとう多いおかげで、毎年お世話になっている病院に通うのを諦めました。中に入れず外まで並んでいるんですから、もう
277,にも、医療安全のための会議や保険証明書の作成など、医療以外の仕事も増え、病院で働く医師の勤務環境は大変厳しいものになっています。医師の社会的立場を見る
278,できてるらしいですけど」「ほんとうに？」「あたし、頭かたいんですよ」病院をでた。紺野は店に戻るというし、わたしと千秋も店にバッグ
279,私の場合は家にいても一人なので同じだし・・・それなら病院で人といっしょにいることの方がいいことなんだろうな、って思います。
280,は飲んでいたのですね。病院へは行っていたんですか？」Ｈ氏「病院には行ってなかったけど、薬だけは飲んでいたよ。母親が糖尿病で
281,するだけでなく、病室を訪れて、患者一人ひとりの食事の好みや希望を聞くように配慮する病院もあります。
282,今重要であると、深く思い知らされました。看護部門に活力の見られる病院には、看護職員も患者も集中することは明らかです。私的病院、法人立施設などにおいて、前述
283,ぬ。満津子さん、実は僕は健康が思わしくない。ひょっとしたら、死ぬかも知れない。病院では親切に十二分に手当をしてくれているが、これまでの肉体の酷使が
284,咳き込んだ。胸苦しさが喉まで上がってきたようだった。まっすぐ母のいる病院へ向かった。病室では義姉が付き添っていて、今日は朝から意識がはっきりし
285,。膀胱が刺激されこちょばく気持ち悪いです。もう年内は検診がないのですが、病院で診察してもたった方かいいのでしょうか？膀胱炎だったら診察しないと治らない
286,取れぬまま…ここはヤロ〜に…ちゅ〜んで店長君と打ち合わせ…ヤロ〜に病院行かせながらＴＡＸＩにてお迎え＆風呂入れてもらい…その間にぬわんとかエルカミ君…動く様に
287,なかなかそういうわけにもいかないのが現実である。現代ではほとんどの人は病院で死ぬ。老人病院の病室あるいは集中治療室などが多くの人を待ちうけている最後の場所である
288,三十九歳です。本当に年だというだけで不正出血があるものなのでしょうか？違う病院で診てもらった方がよいとは思うのですが、また何か言われるかと
289,てきたときは一度病院を疑いました。患者に不安を与える伝え方をする病院は、患者本位の所ではないと思ったからです。私はセカンドオピニオンを勧めました。
290,悪いさ、早くとめられる方法教えてください。昨日から何も食べてません。とりあえず病院に行きましょう。貧血かもしれませんよ。単なる風邪ならいいですね。くれぐれもノロウイルスには
291,は意を決した。お母さん、大変なんだって？「うん。これまで病院に入ってたのが家に帰ってきちゃったんですよ。だから当分はこっち
292,ということもありえます。わたしとしては、もちろん、給料をアップしていただいて、今の病院で来年も働ければいいとは、思っています。
293,に立たず。早期発見、早期治療。なんでもなければそれだけですよ！安心の為に病院へ行きましょう〜
294,ている。病院で働く職員の六十％は看護師である。その中には医師よりも病院のことをすみずみまで知っている賢い人が何人もいる。医師は一つの科に
295,な事です。午前八時に別宅を出て、三十分歩いて病院へ・・・・・・・・・・さてさて、久しぶりに（内科）外来に
296,ずに百十九番通報してください。これ以外の場合は、百十九番通報をする前に、自家用車やタクシーで病院に行けないか、今一度検討してみてください。また、どの病院に行けばよい
297,を前に渡辺さんが講演を始めた。「異常があると言われても病院に行かない人、けっこういるんですよ。『酒を飲むなと言われるのが
298,ます。何科にいけばいいですか？整形外科です。小児科じゃあないですよ（笑でも病院にいかなくても大丈夫ですよ＾＾用は慣れです。
299,襲った症状で今朝は早起きして嫁さんを助けるはずが役立たずに終わりました（ＴｏＴ）病院には行かなかったけど明日は診察に行こうかな…綺麗どころの看護婦さんと触れ合え
300,行った病院で、いろんな人に声をかけてもらったんだけど、みんなにニコニコ。病院の受付のおばさんがビックリするぐらいの笑顔でした☆りょうくんもしゅうくんも、赤ちゃんの時
301,も自分の両親はすでに亡いが、父親（明治四十三年生まれ）が病気で倒れて、病院で闘病生活を送り死亡した後、実母（大正二年生まれ）を引き取った経験をもつ（
302,られましたが、余りにも金額が少な過ぎるということなんです。東大阪市の蛇草という病院がございますが、そこにいらっしゃる旧日赤従軍看護婦の田中アヤさんという方からも、私じかに切々
303,。脱水症状にならないようにアルカリイオン飲料を大量に摂取して、出しまくるしかありません。病院まで肛門を閉じてる自信があるのなら、とっとと病院に行きましょう。食いすぎは、苦しみ
304,着替えるとしばらく待たされた。医療器具がまだ到着しないというのだ。数が少ないのでいろんな病院で順番に回しているようだ。そろそろ麻酔注射を打つという。心臓が破裂しそうに
305,の薄い）の処方をする医師も多いようです。まだ間に合うようであれば別の病院へ相談しに行ってはどうですか。
306,なくいっていました。末期の胃がんが見つかるそれで、私たちの勧めもあって病院に検査に行かれました。診察の結果は、胃がんでした。それもかなり
307,の調子で病院にお世話になれるぐらいだったらいいな、と思います。今日の病院への支払い：（抗がん剤＋ゾメタ）三万二百十＋（薬代）五千三百四十＝三万五千五百五十円でした。
308,休日を返上して見舞いにきてくださったのです。Ｍ先生には心から感謝します。この病院で抗がん剤治療が終わったら、また手術のためにＫ大学付属病院整形外科へ帰らなければならないのです。本来なら
309,人間は厳重に口止めされているんです」「ひどいわ！主人に話して別の病院へ移します」と清子は怒っている。「―いや、ありがとう。参考になっ
310,淳之介だったのだろう。「これは淳が褒めてくれたブラウス、これを着て病院へお見舞いに行ったとき、『よく似合いますね』って言ってくれたのよ」
311,。ＬＤＲＰ（陣痛・分娩・回復・産後）ルーム二十二室、リカバリールーム十四室。詳細はホームページで。メリーランド州アナポリスにあるこの病院は、住まいの延長線上にある、くつろげる環境作りを目指している。ＫｌｉｎｉｋＦｌｅｅｔｉｎｓｅｌＨａｍｂｕｒｇ●
312,ているのですが・・・４ヶ月になる子供を持つ父親ですが、妻が出産した病院でもクーラーによる空調管理がされていました。皆さんが言われているように、
313,ましたらご紹介ください。愛生会・・・・・・・・・・・・埼玉にある病院のＨＰ☆：；；：・：；；：＊：；；：・：；；：＊：
314,、そんなときには、朝一番でバスに乗り、朝一番の受付をし、病院からバスに乗って帰ってくる。バスに乗りもしないのに、そう
315,、家族の意見に基づくようにします。遠方の人に連絡する場合は、病院や交通路について、くわしく伝えます。親族表医師がいないときは警察へ死の
316,病院が懸命に努力して抗生物質の使用量や種類を制限したとしても、患者が別の病院に行って抗生物質の大盤振る舞いをうければ、こうした努力は何の意味も持た
317,はとれていきましたが、未だに歩いたり力を入れると付け根が痛みます。病院に行った方がいいのですか。はれはしませんでした。ひびが入っ
318,強い横綱だったとわかるまでは頑張ろう」と決意を新たにしていた。病院までの道のりは、ひどく長く感じられた。「どこか遠いところから帰る途中の
319,「赤ちゃんに栄養が足りていないかどうかは実際に診ないとわからない。病院の母乳外来や市区町村の家庭訪問の制度を利用してほしい」と呼びかけ、「粉ミルクでも赤ちゃん
320,を提供していく必要がある。例えば，ねたきりの高齢者は，特別養護老人ホームに約十一万２千人，病院に約十六万８千人入所（入院）しているが，これらの者の心身の状態に応じた適切
321,てきてもらったのもあって、そんなに遅い時間になることもなく、病院でもらった薬も効いたおかげで、試合をゆっくり観ることができました。中沢氏の
322,は両側背の痛みがあります。腎臓病を疑ってしまうのですが、同じような症状で病院を受診されたかたおられますでしょうか？お願いします。再検って、自分で試験紙
323,退く）ですから。人間は入っていって帰る時は、退くと言います。病院へ入って（入院して）快復してその病院から退きます（退院）
324,たび、老朽化や耐震性が心配されることから東館を建て替え、さらに高度な先進医療を行える病院に生まれ変わりました。新たにオープンする新東館は、患者さんにとって快適なだけでなく、最新の
325,。知り合いは病院にいって半年かからずに治りました。早めに治したいなら病院にいくのをお勧めします。
326,に入院されていました。奥さんからの入院の知らせを受けて、私は早速病院へ出向きました。二千二年１月〜３月まで抗がん剤の化学療法を受けておられ、前年に
327,おお、２週間の遅れが命取りに。ありえない話じゃないな。ベストは、今週末で病院２箇所を回って、腸の検査と親知らずを引っこ抜く。来週に検査の結果
328,が付く所は、わたしとは縁遠い所が多い。あまり好きな所もない。病院、少年院、修道院、参議院、衆議院などと、“院”が付く場所で思いつくの
329,ないから、しょうがないので病院を探したりします。特別養護老人ホームの空きがないから病院に入ったり、ショートステイをつないでいったり、老健施設（介護老人健康施設）に入ったりしている
330,インパチェンスが３色、病院のプランターにありました。
331,熟睡できてるみたい・・・（＠＿＠）やっと薬が効いてきてるみたいです。もう少し早く病院に行けばよかった・・・（＞＿＜）今日から十二月・・・。１年があっと
332,を翻訳する際に、ＶＴという言葉を使うようになり、最近ではブイティーさんと呼ぶ病院も増えてきました（この本では「動物看護士」「看護士」と統一して表記し
333,行くことができなくなるのか？Ａ３必要な医療が制限されたり、自由に病院に行くことができなくなることはありません。後期高齢者診療料とは…窓口での自己負担割合
334,思います。万が一それでいやな顔されるようなところならば時代に逆行した病院ですので、更に別の病院をあたってください。
335,方で経験された方がいらっしゃる方、経験談をお聞かせ下さい。無痛分娩を考えています。病院でリスクのこととか聞いていますが、実際の体験談も知りたいです。よろしく
336,によって、不安を感じたときにはすぐに相談できるラインを確保する。緊急時に対応してくれる病院と連携できるように連絡・調整をする。４在宅療養は、家族も医療の知識や技術
337,な気持ちです」紹介状公次さんが外来にやってきたときは、かかっていた病院からの紹介状をもっていた。紹介状を開封してみると、重症の気管支喘息という病名が
338,ネジが緩んでいるので手術が必要といわれました。ただ、今度手術を受ける病院は遠方で車で２時間かかり、子供の私たちは仕事や子育てのため見舞いや付き添い
339,食生活は以前と変わり無いです。洗顔やクレンジングを気にしてやってます。病院では大きな炎症を起こしたにきびはなく小さなにきびだから他の患者さん
340,熱で溶けて飴のようになったアスファルトのぬかるみを通って逓信局へ辿りつき、病院に応援にきて手術の準備や患者の世話をしてくれていたのであった。
341,もってわけにはいかないでしょ。白木さんならいいなって、この前、あそこの病院で会ったときから、じつは考えてたんだ」私は、いつか家を出
342,が血圧の上昇を抑えるのではないかと考えられています。Ｑ重度の貧血で、病院にかかっています。栄養を考えて食べているのですが、太ってきて困っています
343,に寝泊まりしている。老人には町に妻と子供がいるのだが、この刑務所の病院のほうが気にいっていて、何年にもわたってこの病院の親切なもてなし
344,。そのあと私もゆきもまた寝た。今日は仕事を休んで、一眠りしたら病院に連れていこうと決めて。病院で血液検査。肝臓とたんのうが悪い様子。異常
345,のに妊娠していたという人はいらっしゃいますか？どのくらいの期間生理が来なかったら病院に行った方がよいのでしょうか？排卵が周期十日頃なら、その次の日から
346,に行った方がいいでしょうか？治療費はいかほど予想されますか？早々に病院に行かれる事をお勧めします。脳神経外科でよいとおもわれます。治療費はどんな検査
347,慢性的にお腹（大腸のあたり）が痛くなります。病院で診てもらうと、ラックビー、セレキノン、ハイゼットという薬を処方してもらうのですが
348,する彼女は、自称「オヤジキラー」。これまでセックスをした相手は十二人。同じ病院で働く医者や、居酒屋で知り合ったサラリーマンなど、中年男ばかり。「相手に恋人
349,か」「植物状態の人間って居るよ」そう言う優樹の脳裏に浮かぶのは病院で幾つものチューブに繫がれたままひたすら眠り続ける『田辺のお爺ちゃん』の姿だっ
350,ず、医師から直接自宅に電話で知らせてきた。できるだけ早くガン専門の病院に入院させたほうがよい、とのことだ。まさか、自分が胃ガンになる
351,ったら、どうかしてる。さっちゃんはサチコだったんだ」明日になったら、病院、行きなよ、な？…玄関口で吉崎がそう言っている。玄関のドアが
352,みな市販薬を買って飲むのですか？時間がないから？医療用医薬品を入手するには病院へ行き、処方箋をもらわなければならないからです。処方箋を出してもらうには医師の診察が
353,、病院で定期受診を受けなくても在宅で済ませることができます。専門医の不足している病院で撮影した放射線画像、内視鏡画像、病理画像は、大学病院や専門医のいる病院にネットワークを介し
354,なファンタジーと解釈されてきた。しかし、サン・レミの精神病院に関する新聞広告を眺めれば、この病院のまわりには、実際に糸杉が立っていて、窓のすぐそばに伸びてい
