,0
114,んですが…。何か他のアイデアもあれば教えて下さい。着替えのスピードは、美容師の先生によって全く違います。あらかじめ式場の人と打ち合わせをしておかないと、大変
115,もなく毒ガスが漏れはじめたとざわめいている。メリー藤田がこれに雷同しなかったのは、美容師として扱い慣れたアンモニアのにおいであることがすぐに分かったからである。かたわらに馬
116,などという答えが返ってきます。こんなときは嬉しくなります。若く、これから美容師をめざそうという人が、「親切だった」「お客様に喜んでもらいたい」という希望
117,肌映りのいい色、小顔に見える髪型。今日の印象ローライトがいいですね。美容師の選び方オーダー８割、センス２割で切ってくれる人。
118,喜んでもらえる美容師になりたいのです」「私が行っていたところの美容室の美容師がスゴクかっこよかったんです。でも、かっこいいだけじゃなくて、私にすごく良くしてくれて
119,質問です。私は今サラリーマンをしている二十六歳の男です。会社を辞めて美容師になりたいと思っているのですが、年齢的に厳しいでしょうか？美容師になるのは
120,今日の印象いつもとは違っていて、新鮮です。目指す髪型ベリーショート。美容師の選び方雰囲気とフィーリングです。ヘア＆メークのこつ服の色によってシャドーの色も
121,上手に出来ません。ふわっと丸く仕上げるのはどうしたらいいのでしょうか？理容師で美容師です。ホットカーラーで巻くと扱いが楽になりまとまりやすくなりますよ。一度美容室でセット
122,巡り合い最初は美容師オレは四十二歳までに三度結婚をしている。思えば、心の中で
123,でウォレットチェーンがセルティックアーツ。“しくこく付けるのがポイント”だそうだ。浦本伸次さん（三十四才・美容師）バイカーの彼が付けているペンダントと右手の２つのリングはアルジャンで、時計は
124,です。ふだんから髪の毛をいじるのに慣れているので、自分でやります。（別に美容師なわけじゃありません）お金と時間が節約できるし。
125,ことを考慮すれば、この意外な程の高い支持率＆得票率は納得できるだろう。植田（二十一）美容師シャツ：？（８月号）天田敬太（二十）？シャツ：？（８月号）たけや（
126,除けば、女工か女中になるしかなかった女性の働く場が、事務員、店員、美容師などの新しい職種へと徐々に拡大し、住み込みで長時間の拘束のある女中という職業
127,とということですが、その高級な職業というのは、バスの車掌、映画俳優、美容師、飛行機のスチュアデスなどのさらに新しい職業になりました。まあそんなふうな失敗談
128,ストレートヘアの後ろ姿を見かけると、あの髪の手触りがよみがえっちゃいます。（福岡市中央区の美容師、真人さん二十七歳）ふくおかホテルマン日記ゲストリレーションズよろず注文承ってます突然のお尋ねだった。フィリピン政府高官の
129,感触を確かめるように、死体の右手の指を一本ずつ伸ばしながら、腕のいい美容師が客を口説くような口ぶりで、「死後硬直が出始めてますね。体温の
130,背中などのツボを刺激しながらのトリートメントは病み付きになる気持ちよさ。コース後のブローも美容師だけにお手のもの。頭のてっぺんから肩までの凝りがほぐれ、視界もクリア
131,たので貼りますね実は、俺の妹もぜんそく持ちで現在お仕事をしていません美容師になって東京でしばらく働いてから田舎に戻ってきたんです地元の美容院に
132,人。それが理想だった。最初の結婚は二十代前半の頃で、相手は美容師だった。彼女には申し訳ないが、思い出すらほとんど無いのが本当のところで
133,そのまま出てきました。中谷美紀さんの全てが私の理想です。小山かおり二十一美容師アッシュブラウンのカラーで落ち着いた印象に基本的に何もしなくてＯＫの楽チンヘアスタイル。でも
134,原点があります。ですから、採用試験の面接のときには、必ず「あなたはどうして美容師を選んだんですか？」と聞いています。すると、「私はお客様
135,カラーをした後、流し台に座らされた時のことです。なにやらいきなりその美容師は私の肩をタオルで必死に拭いていたんです。しかも隠すように必死に
136,ことがある。胸の触診をするときは特にそうだ（Ｇｒｏｓ，千九百八十七）。美容師は、髪に触れるのは職業的な動作だと絶えず自分に言い聞かせているために、
137,。美容師さんだったの」冬子は、和美のことを思い出した。彼女も美容師だったが、今はもう亡くなっている。運転手は、慣れているらしく、観光案内を
138,いう時こそアンコの量を増やす（質をあげる）ことができる人間が今の美容師には足りないみたいなことを書いてた。今の自分の店もやっぱ上
139,生きることと母親として生きることをどう両立していいのかわからない」（四十二才・美容師）前出・内藤さんも再婚の難しさをこう話す。「次の幸せなんてなかなか見つけられ
140,で治すということに興味を感じてもいた。けれどもそれは、あくまでも美容師としてやっていくうえでのプラスアルファの部分として必要と思ったからで、鍼灸師になろう
141,は昨年、女性誌の読者投票で人気スタイリスト１位になった。広島県出身。大阪を通り越し、美容師を目指して東京に出て十年になる。いまも「ハント」を欠かさない。
142,た。その修業真っ盛りの二十六歳ごろ、角田は中学時代の友人の紹介で付き合い始めた同い年の美容師と、お互いに結婚を真剣に考えたことがあった。しかし、角田との結婚を
143,ているだけになってしまい仕事に対する誇りもハリもなくなってしまうのです。私は、従業員の美容師、エステシャンにお客様と触れあう喜び、人に快を与える仕事をやっているという喜びを
144,「つけた直後の、滑るようなつるつる感は初めての体験でした」（二十四歳・美容師）、「肌の上に薄い膜を張って、汚れた空気などから守ってくれ
145,などを贈る敗者復活戦。くしの日［美容週間実行委員会］九月四日●美容関係のメーカー、ディーラー、美容師などで構成する美容週間実行委員会が昭和五十三年に制定。九月一日から七日の美容週間のうち四日を
146,美容師になるにはまず、どうしたらよいのでしょうか？今、三十歳ですが、可能でしょう
147,お客様自身も充実した一日になることでしょう。このようなことはエステシャンだけではなく、もちろん美容師にも言えることなのです。私はこのような美しさの中に「快」を
148,美容師の兄（二十五歳）を持つ者です。先日兄が勤務している美容室のお客さま（三十一歳
149,病室に入って来たのは、アパートの持ち主だった。厚化粧の、本業は美容師である小肥りの大家は、いちおう見舞いの言葉を儀礼的に述べたあと、あの蜥蝪は
150,問題を中心に考えながら、より健康で、年齢とともに変化する自然な美しさを美容師は提案し、お客様を満足させていく技術力と知識を身に付けなくてはなりませ
151,」「奥さんは？」「明るくて気のいい人ですよ。もと、美容師だったとかで、美容室の忙しいときにはアルバイトで、美容室で働いています
152,の悩みを解決しましょう。読者の悩みＱ＆Ａお話をうかがった方々大崎智実さん資生堂ビューティーサイエンス研究所主任研究員美容師の資格をもち、商品開発なども手がける髪のプロ。小川雅子さんロレアルパリマーケティング部
153,のために脇役女優として彼女と契約。主演はサンティアーゴ・アリエータとアニータ・ホルダン。マール・デル・プラタ近郊の撮影現場で、美容師のフリオ・アルカラスと知りあう。彼女は二十三歳になろうとしているところだった。病的なほど
154,を相談したところ兄は自分から店を半年以内に辞めることになりました。今後、兄は美容師としての転職は難しくなるのでしょうか？やはり店を変わるときに前のお店へ退職理由
155,美容師の方に質問です。今度髪の毛をカットしに行こうと思いますが、自分で髪型
156,です。どこの専門学校を出ているかによって働ける店が違うのも現状ですこれから美容師になろうと言う前途有望な方の鼻をへし折るような事言って申し訳ないですが、私
157,がきくこと。今日の印象後悔することの多いショートですが、今日はばっちり。美容師の選び方基本的には女性がいいですが、西本さんは別格。憧れの女性
158,が出てくる。恋愛はテレビに出ているようにそんなに安つぽくないでしようと「美容師は口をまげて」言うが、西脇氏の詩のなかの「恋愛」ということば
159,にまとめることをご了解下さい。理容師も広い意味で「美容」を表現する仕事人なので、美容師としての大きな枠の中に入れていきます。古来より人間は、自然との
160,三千七百十七．一二三三本場バリ仕込みのヘッドマッサージを体感できるクリームバス専門店が誕生。４月にオープンしたこちらは、スタッフ全員が美容師で、バリでのクリームバスの資格を取得しているという実力派揃いのサロン。頭皮や髪の
161,スクリーントーンってヤツ？そこまで気合いいれられると、なんだか申し訳ないです。京都府・ババネコ（四十四才・美容師）―アレも忘れないでほしいよ、イタリアチームのイケメン軍団っての。大阪府・■■■■（三十才・
162,です♪まず恋愛正直リーマンとか土日祝日ＯＦＦのカレだと長く続きません基本的に美容師の休みは平日…合いませんお客さんと…あります。特に若い頃ＭＥＮ’Ｓ美容師
163,のような頭の形以外、大丈夫だとは思うのですが・・・・・。美容師に聞いてみるのも手段の一つです。それと、坊主は顔が小さい方が
164,ますせめて１週間なら我慢して下さい髪の為にもなるべく期間をあけるほうが良いですよ美容師
165,私は、全然オシャレでもないし、人見知りで、不細工で、引篭もりだけど、美容師になれますか？人見知りでトークが出来ないんなら、人以上の腕を持つよう
166,海外で美容師をしたいのですが、日本の免許だけでできますか？地域にもよるんでしょう
167,がクロムハーツ。さりげなく付けたシルバーとブラウンレザーとの組み合わせがクールだ。諏訪伸明さん（二十二才・美容師）フェザーをあしらったペンダント、ブレス、ウォレットチェーンとすべてのアイテムが大阪ＦＵＮＹのスローというブランド
168,美容師の方に質問です。美容院でお客さんから「おまかせでお願いします」と言われると
169,月曜日は多くの美容室がおやすみですよね。ということは、日曜深夜の知恵袋は美容師の方が沢山いるとか？？そんなことない。．．．．．．．
170,も好きな商売ができて楽しかったので、足かけ五年ほど営業したが、次女が美容師の免許を取ったのを機に店をたたんだ。次は、美容院の経営
171,たしかに注文に答えた顔ではない。息子を朝鮮に送り出してから、メリー藤田は美容師の資格をとりなおすべく受験準備にとりかかった。はじめてアメリカで資格をとってからすでに十三年
172,なることに対して意識を広げていけるようにアプローチしていくのです。そのことがこれからの美容師にとって非常に大切なプロセスになってくるでしょう。このような意識になれるよう
173,悪くなってしまします切らずに伸ばすと言うのは間違っています切りながら伸ばしましょう美容師
