,0
0,ます。花屋は花のことができて当たり前、カメラマンは写真が撮れて当たり前、美容師は髪がセットできて当たり前、そういった素地のほかに何かプラスアルファを持っている
1,刃物」でしょ。政府が規制法案適用で取り締まるらしいですよ。博士：違うよ！美容師は厚生省が管轄する免許制だから、最近のブームで激増する無免許カリスマ美容師一斉摘発に乗りだしたんだよ。
2,すれ出会えるのでしょうか。意外にも出会いはたくさんあるものですよ。私の彼は美容師で、お客と店員という関係から彼氏彼女になりましたよ。ちょっとコンビニに行く
3,ている。靴はｐａｎｔｏｕｆｌｅｓであり、髪の毛はｃｈｅｖｅｌｕｒｅであり、香水瓶はｆｌａｃｏｎであり、美容師はｆａｒｄｅｕｓｅである。ｆｒｏｌｅｒ（こする）という動詞が不定法で英語の文中にあるの
4,のもの。また、右手人差し指のリングもプエルタデルソルでブラックチタン製とのこと。下谷圭弘さん（二十二才・美容師）友人から三万円くらいで購入したというセルディックアーツのペンダント。単色でまとめたシックな
5,はしないんですが、ちょっとかゆいんです。美容師さんにもいいずらくて。。。理容師で美容師です。美容師の不注意ですね、綿棒を水で湿らせて軽く拭いてみてください。
6,れてしまいそうです（笑）余談ですが、今度実家に帰った時に同級生の美容師に髪を切ってもらうんですが、何とか、たっちゃん風にならないものかと＾＾ゞ今
7,得意とし、それらの技能は、理容業界の第一人者と誰もが認めるところである。美容師■■■■■さん（堂前町）美容業界で、長年技術の研鑚に精励する。特に、弱酸性パーマ施術
8,早くて資金があっても三十五歳。それまでたぶん年下店長に仕えることにまります。美容師は三十歳が、自分の店を持つか、一生下働きするか、他業種へ転職するか、
9,けど、髪をのばしたら毛質が変わると聞くんですけど、本当でしょうか？理容師で美容師です。成長期にボウズにしていると癖毛になる割合が高くなります、それは
10,もので壁も飾ってますよ」ヘアチェンジを撮ってプレゼントに！■■■■さん（二十二歳・美容師）シャオＧＡＩＫＯＫＵ／ポラロイド（インスタントカメラ）カットなどが終わったばかりのお客さんにプレゼントすること
11,私にすごく良くしてくれて、親切な人だったんです。それで私もこんな美容師になりたいと思ったんです」などという答えが返ってきます。こんなときは
12,てしまうのです。（ひっかいたことにより）けっこう大きなフケやかさぶたがぼろっと取れます。美容師のかたがあまりの頭の引っかき傷の多さにびっくりしていました。ひとりでいるとき
13,。席に案内されて、担当となった美容師が近づいてくるなり、その美容師から何か異質なイメージを受けました。見るからに不機嫌そうです。クロス
14,娘が美容師になりたいというのですが厳しい職業で体力的な面や色々な理由で続かない
15,ができてるんですよ」と当時をしのんでメリー藤田は声をはずませる。若い美容師を十数人かかえていたが手が足りぬほどである。夫もはげしい肉体労働には
16,小さい方が似合うと思います。そして、日焼けしている方が似合うと思います。（美容師の卵）
17,か？」と聞いています。すると、「私はお客様に喜んでもらえる美容師になりたいのです」「私が行っていたところの美容室の美容師がスゴクかっこよかっ
18,学生時代にそういうことがしょっちゅうありました。自分の顔を棚に上げて、美容師の腕が悪いんだって思い「恨んでやる！」なんてことが、一体何回あった
19,いかないので、以前通っていた美容室にまた行きたいと思っています。しかし、美容師の方に心よく受け入れてもらえないんじゃないかと思い、なかなか行けずにいます。
20,「もちろん！自分の思い通りに出来ますよ。でなきゃ私も行かないもの。美容師はフランス語しか話さないから注文には語学力が必要だけど、あまり自信のない日本人
21,がこれからの「健康美容」にとって一番のポイントになってきます。多くの美容師にとってお客様を美しくする、気持ちを良くするということは大事な仕事ですが
22,十二月までに三回行きました。髪はかなり伸ばしていて別人だったけど「喋れる美容師になる！」と言ってただけあってなんの変わりもない喋りの達者な
23,ような資質・技能をもった人気者を俗にいう語。九十年代後半から流行語的に用いられ、美容師や百九の売り子まで冠せられるようになった。
24,髪がふくらみます。何かいいワックスなどありませんか？とても困っています。美容師です。自宅でのアイロンはお勧めできませんね。ほぼ毎日やっているかと思います
25,自然なふるまいって、マジこんな感じだから」の一本調子でごり押し。で、「美容師なオレ」「検事なオレ」とかいろいろあったけれど、それに続いて「
26,茶髪みたいになりました。家で色を目立たなくする方法ってありますか？美容師です。明るすぎた髪をトーンダウンするのは簡単です。逆に暗く染めた髪をトーンアップする
27,飛び降り自殺。踊り場に書き置きがあり、友人関係での悩みが書かれ「愛商に入って美容師になって、お母さんのあとを継ぎたかった。お父さん、お母さんごめんなさい」などとあっ
28,集中している。「インターネット人口の増えている今こそ、値段を究極値まで下げてもらいたい」（美容師二十四歳）、「とにかく安く提供してほしい」（会社員三十二歳）、「もっと電話料金を安くし
29,その上に白っぽい灰がかかっていた。髪の様子をはっきり覚えているのは、美容師としてのメリー藤田の職業意識が先立ったせいだろう。広島市はいまでも川が多い
30,って（笑）。「これ、『コチン・ムーン』じゃない！」って言ったら、美容師の人が「今、僕、これが好きで毎日かけてるんです」って。だから
31,発音の美しさに定評がある．Ａｒｄｅｎ，Ｅｌｉｚａｂｅｔｈエリザベス・アーデン（千八百八十四―千九百六十六）カナダ生まれの美容師，実業家．化粧品チェーン店を世界中に展開．熾烈な競争，消費者の嗜好の変化，
32,思います。私の行きつけの美容院は普通に男性客も多いですよ。女性よりも美容師に注文が細かいです。「このへんをもうちょっとこんな感じに・・・」なんて
33,」そういえば、二週間ほど前に品川さんのシャンプーをベッド上で行ったのだ。美容師になったような気分で「お痒いところはございませんか？」などと聞い
34,ねから◆子育て講座〜チャイルドカット☆プラス１内容簡単にできる子どもの髪のカット方法を美容師の講師から学びます。日時十月二十一日（火）午後１時十分〜２時四十分。
35,医療事業内部で医師を自由選択したいという主張が投書記事に出た。つまり１人の女性が、美容師や洋裁師を選ぶ自由と、自分の信頼する婦人科医師のもとを訪れることができないこととを
36,としています。私たちがかかわっている美容において考えてみると、お客様の喜びや美容師としての喜びは、五感を通じて魂に語りかけるものであり、精神的充実感を得ることができます。そして
37,をつくってみました。横しばりやパイナップルヘアのアレンジもよくやってます。ムツミ二十二美容師個性を生かしたオリジナルのポニーテール横上でポニーテールを作ってから、ピンでてきとうにとめ
38,ませんよ〜それに貴女はお客様なのですから。正々堂々と行きましょう。美容師のメンバーも代わってるかもしれませんしね。
39,の旗手であった吉行エイスケを父に、婦人の職業として時代の先端を行っていた美容師のあぐりを母に、千九百二十四（大正十三）年四月岡山に生まれ東京で育った
40,んですが、ちょっとかゆいんです。美容師さんにもいいずらくて。。。理容師で美容師です。美容師の不注意ですね、綿棒を水で湿らせて軽く拭いてみてください。耳の中
41,一度経験してみれば分かります。美容院でのカラーリング代がいかに妥当な値段かを。美容師より
42,、今日美容室にいって、完全にダサい髪型にされました。マジでその美容師にキレそうです。前日に行ったあなたも悪いいろんな展開を予想して行動しましょう
43,本質は何も変わってないよ！玉袋：オウムも通り魔も危険極まりないけど、美容師も危険極まりないね。博士：たしかに評判悪いけど、オウムや通り魔と一緒に
44,たよ退院してから１年後に仕事に復帰しましたがすぐにまた発作が起き、美容師の仕事を辞めてしまいました現在は、何の薬も飲むことなく元気になっ
45,たときの手の感触と五感とプラスアルファで診断するんです」フーテン時代を経て、美容師になろうと思い立った竹村先生が、「美容師になるなら、肌の色つやをよくし
46,は美容院を変えてみることにしたのです。席に案内されて、担当となった美容師が近づいてくるなり、その美容師から何か異質なイメージを受けました。見る
47,ますか？』って聞いてみたらどうですか？１年も通われていたなら、美容師の方も覚えてるんじゃないでしょうか？むこうも商売なので、なんで今まで来
48,支払っていないことをあきらかにした。彼女は、彼の激励をうけながら、美容師としての新しい道を切り拓いてきたのだった。日弁連懲戒委員会は、八十四年十月二日、下坂弁護士
49,ような経験があるかもしれませんね。美容院をはじめて利用するお客様は、担当になった美容師を拒むわけにはいきません。しかし、初回に気に入れば、ずっと担当し
50,なことまで踏み込んでいくことになるでしょう。私たち一線で活躍している経営者は、そんな提案ができる美容師の育成をしていかなければならないのです。このようなことが私の描いている基本的な
51,はもちろん、ビタミンＥやグリチルリチン酸の働きで「唇の乾燥防止力はリップクリーム級！」（二十一歳・美容師）と、スキンケア効果への高い評価も。安かろう悪かろうの時代はもう終わった！？
52,によって料金がはね上がることを知ってびっくり。「でも、せっかくだし」と、トップの美容師にカットしてもらうことに。が、彼は私のリクエストした髪型が「僕のイメージ
53,は最高の武器だと思います。伝統工芸や宮大工、最近では女性の家具職人、美容師からウイッグ専門のヘアーメイクさんに転身した方もいらっしゃいます。大手企業では若返りが進み、人事部長
54,小さな感動を言葉にして贈る。言葉は立派な贈り物になります。美容師のＭさんは、今日の私にどんな言葉をかけてくれるかが、楽しみな女性です
55,腕はどうだろう？「ラボには常時四人のスタッフがいます。日本の美容師と比べてしまうとフランス人は雑なところもあるけど、悪くはないかな。とりあえず
56,頭に振りかけていた。そんな辛木さんは、毎月欠かさず美容院に通う。なじみの美容師にカットを頼み、雑誌を読みふけっていると、「白髪増えたねー。白髪染めしようか」
57,と卒業するのは二十八歳になります。トホホ私は二十三歳から学校に通いました。美容師になって５年です。私が通っていた時は、三十過ぎてからと言う
58,ていれば、自分の人生の中で何も正しいものはない。億万長者だろうと、美容師だろうと、保険の営業マンだろうと、主婦だろうと、関係ない。他人の幸せに
59,や色々な理由で続かない人が多いので、その話はしているのですが、美容師の資格（国家試験）って実際合格率どの位ですか美容院で働いている方って皆さん資格もっ
60,に、いつもの化粧に戻して帰られたいなら、ご自分で化粧しなおししてくださいね。美容師
61,赤茶にしてって美容師に言ったら、ビックリするくらいの朱色にされました。本当に朱色。あまりの
62,なさい、私の説明のしかたもはっきりしてなくて・・・」こういえば、美容師も張り切ってやりなおしをしてくれますよ！！
63,皆さん資格もっているんですかない方でも、一生の仕事として成り立ちますか現役美容師です美容師の国家試験の合格率は九十％くらいです専門学校では国家試験に合格できるように国家試験用の勉強を
64,？告白：ねーよｗｗｗｗｗ（ｐａｓｔ／昔の）将来の夢：美容師過去になってシモタｗ怖かったもの：フランケンシュタインｗ（あれ、あってる？習い事
65,においてあゆむ人生がはじまる。■世界の高校生の夢★スコットランドの高校生あこがれは，美容師です。しかし，この職業で生活をすることがひじょうにむずかしい現状です。私の
66,会社を辞めて美容師になりたいと思っているのですが、年齢的に厳しいでしょうか？美容師になるのは十代からの夢であり目標でした・・が、経済的な事情も
67,履かせた。「きみの青いペディキュア、気に入ったよ」「あれは美容師が選んだのよ」ガースは片膝をついたまま彼女を見上げた。「
68,たし。中学の後半に、当時のフミヤみたいな髪型にしたこともあって、美容師に憧れたこともあったし。ピアノは結構弾けたのと、高校からドラムだの
69,で診断するんです」フーテン時代を経て、美容師になろうと思い立った竹村先生が、「美容師になるなら、肌の色つやをよくして、化粧ののりのよくなるマッサージ師の
70,。相手が何を望んでいるかを探るために、冷たいウーロン茶を置くのです。美容師は、おかまをかぶせて、「暑かったら言って下さい」と下がりますが、それだけ
71,。少し理論的なお話しになりますがご容赦ください。なお、理美容師というくくり方を本章からは、美容師という名称にまとめることをご了解下さい。理容師も広い意味で「美容」を表現する仕事人な
72,に通勤で着ているコートを羽織ると思いますが半そでにコート着てますか？美容師です。お店では半そでです。お昼休みなどは、カーディーガンを羽織ります。お店専用
73,意識してお客様と接していく中で「快」を表現していくことが重要なのです。美容師がこのようなことを理解していないとお客様に快適さ、爽快さという「快」を
74,も、「二センチくらいかしら」といって額の真ん中あたりを手で示すと、その美容師は「ぱっと見ておかしくなければいいんじゃないですか」と断言。正直、ほとほと
75,セットするには、その髪型にセットできるように美容院で切ってもらうしかないのでしょうか。理容師で美容師です。専門店に行ってください、できれば美容室のほうが良いでしょう。
76,、一体何回あったでしょう！でもドンゴンさんは顔のことは言えないから、本当に美容師の腕が悪いって恨んでたりして・・・！そういうことはドンゴンさんに
77,こなかった。きっと、もう彼の中ではおれは普通の行きつけの美容室の美容師に戻ったんだと思う。それでいいんだ。おれもそれを望んでいたんだ
78,がいる）。慌ただしい昼食の後は、ヘア、メイクに取りかかる。ヘアはプロの美容師がやり、メイクはモデルが自分で、というケースが多い。楽屋でメイクを始める
79,ません。たとえば、看護学校は看護師になるための教育しかおこないませんし、美容師学校も美容師になるための教育に特化しています。つまり、途中で「ほかの職業をめざしたい
80,、すべて「快」というものがからだのすみずみの健康にまで繋がっていくのです。美容師がそのことを意識してお客様と接していく中で「快」を表現していくことが
81,中田ヒデさんって美容師を月に１回日本から呼び寄せて費用が三十万円で周りのスタッフも皆ヒデさんと同じ髪型
82,をお願いします。美容学校（専門学校）などに行ってください。卒業後、国家試験を受けて、美容師になります。三十歳でも可能ですが、ほとんどは高卒です。その雰囲気に耐えれる
83,フェミニンな感じで攻めてみました。浜崎あゆみさんみたいにかわいくなりたいです。渡部美奈子二十美容師ピンでタイトにまとめたサッパリヘアー今日は上にあげるようにピンでねじってまとめまし
84,美容室に切り抜きを持って行きますか？美容師です。切り抜きは希望のイメージを伝える手段としては有効です、ただ切り抜きそっくりに作っ
85,から、スカルモチーフのハード系まで、自分にあったスタイリングを盗んじゃおう。坂井一裕さん（二十一才・美容師）ペンダント、ブレス、２つのリング、ウォレットチェーンとすべてをクロムハーツでかためた彼は、
86,経験してました。丁寧で親切で同じように１対１で接するだけなら、看護士や美容師やショップの店員など他にもたくさんいると思うんですが…。歯医者さん（歯科助手も
87,並んだ旧公式計量所から石を投げると届くほどの距離のところにある。主人である美容師は一週間ほどイタリアの修道院に瞑想にでかけており火曜日には戻って開店することから家人
88,の映像が映っていましたｗｗナツと優梨には女の子が生まれ、美亜は美容師になっていて、麻美は花屋さんになっていて、沙良は大学生になっていて
89,振り回させていたのでは、仕事の喜びも半減してしまいます。私は、本質的な美容師を育成しようと考えて何軒もの美容室を持ちました。その育成のプロセスの中
90,一軒の家まで世話をして下さった。近くに服部家のある場所だ。東京の美容師が持っている別荘である。京都を出た私は、極めて身軽な形で鎌倉山
91,美容院について質問します。店舗を一つだけでなく三つ、四つと広げてしかも各店舗に多くの美容師を雇いお店の中はとても広くて綺麗、ＣＭなどもしている。（それを
92,が「サラリーマン、ＯＬ」」や「教師」で、全体的には「看護師」「美容師、理容師」など、手に職をつけたいという意識が高まっています。「子ども
93,のブローも楽々で今までの苦労は何なの？！って思いますよ！美容師に完全に死んでると言われた私の髪の毛でもサラサラのツヤツヤになりまし
94,に済ませることが多いよう。●向いている仕事黒ひょうに向くのは、美容師やエステティシャンなどのオシャレな職業。普段から最新の流行を意識しているので、それが
95,、鍼灸師、マッサージ師、自動車学校指導員などもおおかた「先生」です。でも例えば「看護師」「美容師」「介護福祉士」「ボイラー技士」などはほとんど先生とは呼ばれていません。この
96,たときの事です。そこのヘアーサロンはその時初めてだったのですが、担当の美容師はいきなりタメ口で話掛けて来たんです。しかも初対面でいきなり“君の頭変
97,ていることがわかる。日本の子どもたちのように、タクシーの運転手とか、大工や美容師などをあげる子どもはほとんどいないのである。新しい世代に新しい価値観が宿りはじめていること
98,暮れたりはしていない。夫の入院中にグレイスハーバー・ビューティースクールで、二千時間の単位を習得して美容師の免許を手にしたのである。アメリカ生活に見切りをつけ、親子三人が第三十代大統領カルヴィン・クーリッジ
99,多い割に伸びません。無料ですしお直しに行ったほうがいいですよ。美容師
100,ジュノビューティー」の横川純一社長（五十八）には夢があった。美容業の企業化。美容師の負担を軽くし、コスト削減で価格を引き下げることだ。髪をさまざまなロッド
101,自宅で受ける理髪費の一部助成をしていますが、４月から、美容所からの美容サービス（美容師によるカットなど）も助成の対象となります。ただし、協力をいただいている理・美容所
102,は似合わない場合もありますし場合によっては出来ないデザインもあります。乱暴な美容師だと「似合いませんよ」などと一刀両断にしてしまう者がいるようですが
103,１剤操作軟化度合いアイロン操作など注意すべき要点はたくさんあります。美容学校での毛髪科学程度の知識しか持っていない美容師にやられたらアウトです。
104,ないことが、見える美しさ。つまり、デザインであったりカラーであったりするわけです。美容師がこれから先取り組んでいく健康美容は、食事や運動、休養などとの関わりを持っ
105,。アルトの髪がそのまま伸びた！みたいな状態だから笑。タイミング良く、美容師の友達に『そろそろ切らないの？』と声を掛けてもらったので、お言葉に
106,美容師の免許習得を考えております。四十歳ですが、就職するのは難しいでしょうか？それと
107,ラジカールとデジタルパーマは同じものですか？理容師で美容師です。どちらもメーカーが勝手に付けた名前です。そのメーカーの製品を使っている
108,ているか？お聞かせ下さい。ちなみに私は二十九才独身です。外見には自信がありません。美容師です♪まず恋愛正直リーマンとか土日祝日ＯＦＦのカレだと長く続きません基本的に
109,いいですか？カラーと縮毛矯正をする間どれくらいあけたらいいですかね？理容師で美容師です。カラーをやっても矯正は取れませんが、矯正によってカラーのトーンは
110,てましたよね〜見るからに「白く塗ってる」って白髪ですよ＾＾（美容師の目から見て）ご本人は白髪があるのかどうか・・・ＣＭなど
111,、腕がいいからと私にもその人を勧めます。主人はあきらかにその美容師を気に入っている（恋愛感情）のに私に、その人を会わせるという行動
112,・・・！そういうことはドンゴンさんに限っては絶対にないでしょうね。例え美容師の失敗があったたしても、「ケンチャナよ」って笑っていそうですね。
113,の方に担当してもらいたいのですが、他の美容師さんは名前すら分かりません。皆さん美容師を指名するきっかけって何ですか？指名がないと言っているのなら、前回の担当者
