,0
0,除き、別に辞令を発せられない限り、研究所の成立の日において、研究所の職員となるものとする。第三条前条の規定により研究所の職員となった者に対する
1,というような、いわゆる天下りというものがあるわけです。これに反して一般の職員は一生懸命働いて、自分はそれこそ身も魂もささげ尽くして、私どもはくず鉄と
2,に規定する法人とみなす。（職員に関する経過措置）第六条会社の成立の際現に公社の職員である者は、会社の成立の時に会社の職員となるものとする。２
3,ただしかし、いろいろな人事管理上の問題がありまして、幹部職員と申しますか一般的な職員についてはそういうことは余り起こらないだろうと思いますけれども、また、そういう
4,及び飛行場以外の場所で輸入してはならない。（取締りに従事する職員）第二十六条主務大臣は、その職員のうち政令で定める要件を備えるものに、第六条第一項又は第十条第一項に規定する権限の
5,身近な場所へ出向いて職員が説明「市税出前講座」市内各地へ職員や専門家が出向き、市の計画や暮らしに
6,や自転車などが当たる只今売りさばき中」とありサンタクロースと門松が同居する中発売記念撮影２階に並ぶ職員の内右から３人目山崎東農業と大工に生きて黒木一男（大正七年〜
7,利用者が増えて入れ替わりが激しく、介護が手薄になる。利用者の顔もわからない職員もいるという実態が背景にはあるようだ。以前、介護は行政の「
8,信用保持の義務一信用失墜行為の禁止職員は、その職の信用を傷つけ、又は職員の職全体の不名誉となるような行為をしてはならない（地公法三十三条）。これは、
9,し、国有林には営林局、営林署、担当区それぞれございます。したがいまして、そういう職員に、先ほど大臣からお話しいただきましたように十分その辺の考え方を徹底いたしまして、
10,パソコンなどのＩＴに詳しい人たちの電子申請が増加することで、役所は事務コストを削減し、職員の労働時間にも空きが出る。この浮いたコストと時間を、パソコンが使えない
11,秘密を漏らしてはならない。その職を退いた後も、同様とする。（役員及び職員の地位）第十二条センターの役員及び職員は、刑法（明治四十年法律第四十五号）その
12,自分は前はサービス業についており、今は病院に勤めていますが、病院の職員というのはいわゆる「接客業」という意識が薄いんですね。医師にしろ看護師にしろ受付
13,「ゆう杉並」が「チャレンジ」と「出会いの場」であることを表している。そして、職員の働きかけで、「ゆう杉並」専属のダンスとフリークライミングのチーム（オフィシャルチーム）も発足させることが
14,育児休業をすることができない（育児休業条例§２）。ⅰ非常勤職員ⅱ臨時的に任用される職員ⅲ１年以内に任期の満了する職員及び定年により退職することとなる職員ⅳ定年退職日の
15,。一般病院に比べエイドを増やしているのが特徴であるが、実際にはこれでは職員の数が足りず、より介護に中心がおかれた「特例許可老人病院入院医療管理承認病院」通称「介護力強化病院」と
16,ことが大事だと思っておるわけでございまして、先生のおっしゃるような専門的な職員を各学校に配置できるというところまではなかなか私どもも踏み切れないわけでございますけれども、
17,、谷原小学校の合い言葉です。だれもが「楽しい学校」であるように、児童も職員も保護者も、そして地域の方々も、みんなで考え、協力し、実践している学校です
18,味覚、嗅覚、聴覚に激しく訴えてきますので、普通ならすぐに忘れちれてしまう職員も、読み手の記憶に鮮明に刻みつけられます。きのこのバター炒めのような森の
19,以前、天下りの支配人は夕刻五時になると、繁閑におかまいなく帰宅していたと職員から聞かされ、番匠さんは啞然とするしかなかった。ホテルニューオータニでの活躍番匠さんは「
20,を除き、国家公務員法（昭和二十二年法律第百二十号）第二条に規定する一般職に属する職員（以下「職員」という。）の勤務時間、休日及び休暇に関する事項を定めるものとする。（
21,にかかわらず、研究所の成立の日の前日の属する月の翌月から始める。（研究所の職員となる者の職員団体についての経過措置）第四条研究所の成立の際現に存する国家公務員法（
22,の日の前日に厚生労働省の職員として在職し、附則第二条の規定により引き続いて機構の職員となった者のうち機構の成立の日から雇用保険法による失業等給付の受給資格を取得するまで
23,）第二条機構の成立の際現に経済産業省の部局又は機関で政令で定めるものの職員である者は、別に辞令を発せられない限り、機構の成立の日において、
24,試験事務に関して知り得た秘密を漏らしてはならない。２試験事務に従事する指定試験機関の役員又は職員は、刑法（明治四十年法律第四十五号）その他の罰則の適用については、法令により
25,ため，施設の運営面で，医学的管理が十分なされるように配慮されている。また，職員についても，医師及び看護婦が配置され，その健康管理に特に配慮がなされている。
26,定めるものに属する者に限る。）が研究所の成立の日において研究所の役員又は職員（職員に相当するものに限るものとし、以下この条において「役職員」という
27,。３４時間に十五分の休息時間を与えると、職務の能率を著しく阻害し、又は職員の健康・安全に有害な影響を与えるおそれがある場合には、人事委員会の承認を得
28,で、身近なことだというヒントを得た。ここに焦点を当てることにより、職員の意識もこの一点に集中し、行動に直結できる。しかし、単純で身近なことこそ
29,融和という言葉で団結とチームワークを強調した。糸賀は寝食を忘れて走り回った。職員からは、その識見の広さと誠実さで絶大な信頼を得ていた。この
30,継続長期組合員として共済組合の組合員とすることといたしております。また、国または地方公共団体に出向する職員につきましても、公団等に出向する場合と同様に取り扱うことといたしております。
31,一登録住宅性能評価機関（その者が法人である場合にあっては、その役員）又はその職員（評価員を含む。）で第五条第一項に規定する業務に従事する者二登録住宅型式性能認定等機関（
32,十三裁判官及びその他の裁判所職員十四国会職員十五国会議員の秘書十六防衛庁の職員（防衛庁設置法（昭和二十九年法律第百六十四号）第六十一号第一項に規定する審議会委員及び調停職員等で、人事院規則で指定するもの
33,がいいだろうと思って始めた仕事だ。昼前、痴呆症の老人を自宅まで職員と迎えにゆく。老夫婦の二人住まいで、奥さんの友人が手伝いにきていた。
34,ますが、今のお話のように、訴訟告知がなされるとその効力が個人である職員の方にも及ぶというお話ですけれども、そうであれば、その一段目の訴訟の
35,普通地方公共団体の長及びその補助機関たる常勤の職員、」いろいろこうずっとございまして、「職員に対し、給料及び旅費を支給しなければならない。」二項で、その他の手当等について規定を
36,ハローワークの職員の対応はどうですか？親切な方もいますし、事務的な方もい
37,んか？」すると西山氏はこんな話を始めた。「私が市の職員だった時代、議員がバッジの威力を過信して、職員に無理を押し付けてくること
38,規定する親法人をいう。）であること。ロ登録申請者の役員に占める農林漁業体験民宿業者の役員又は職員（過去二年間に当該農林漁業体験民宿業者の役員又は職員であった者を含む。）の割合が二分の一
39,都市の調査をやっております。それを見ますと、自治体でホームヘルパーの正規の職員は六十三％なんですね。そして、社会福祉協議会では正規の職員は二十二．三％、そして福祉公社で
40,、この条件を当てはめてみましょう。まず、当然のことですが、この拘置所の職員は、真っ先に除外されます。すなわち、松山所長。山崎保安課長。関根保護課長。三代教育課長。岩見看守長。
41,指す。このメッセージは約六分でクロードの元に届けられる。そして今度も、メッセージは職員に提出され、内容が照合された。またしても、内容に違いはない
42,には誰もおらず、「一階に行ったのかも…」若い職員が言うのに、「部屋を片付けてて」游子はエレベーターに乗り込んだ
43,学校給食は私の昼食よりはるかにいいものが出ていますが、あれは職員が作っているのですか？それとも委託する給食センターでつくられているんですか？おいらも、学校給食
44,れている。民営化のためのコスト削減を考えるならば、まず社宅を売却すること。職員には民間企業並みの住宅手当を支給するような改革が望ましい。なぜなら民間企業会計基準に移行する場合
45,たいと思います。○堀籠最高裁判所長官代理者裁判官の勤務場所につきましても、原則として一般の職員が勤務しております裁判所で行うのが原則でございます。ただ、裁判官の職務は
46,項において「密接関係者」という。）に対し報告若しくは資料の提出を命じ、又はその職員に密接関係者の店舗その他の事業所に立ち入り、帳簿、書類その他の物件を検査さ
47,する。第三条研究所の成立の際現に前条に規定する政令で定める部局又は機関の職員である者のうち、研究所の成立の日において引き続き研究所の職員となったもの（
48,：■■■■さん」の４つのチームで具体的な検討を行います。また、市の職員も「まちづくりコーナーチーム」をつくり、まちづくりサポーターの皆さんと同じ視点で、協力しあいながらイベントを盛り上げ
49,、職員が２部に分かれ、当番・非番の順序に隔日ごとに勤務する制度であり、３部制は、職員が３部に分かれ、日勤・当番・非番を組み合わせて勤務する制度である。平成十一年４月１日現在全国九百十一消防本部中、
50,の導入に係る規定を追加するための条例改正である。◇尾道市職員給与条例人事院の給与勧告に伴い、職員の給与を一般職の国家公務員の給与改定に準じて改定するため、また医療職給料表の適用を受ける
51,ています。これが実にユニークな活動を続けています。メンバーは、建築課の職員もいれば、総務や農政、商工、財政と、まったくバラエティに富んでいます。
52,初めて訪れた人の相談を受け付け、各種制度の説明を行い、申請の受理を担当する職員で、面接相談員と呼ばれる。制度に関する情報を持たず、生活上の困難を抱え
53,国の行政庁（各行政機関、各行政機関に置かれる部局若しくは機関又は各行政機関の長その他の職員であるものに限る。）に対する申請、届出その他の行為の期限で法律又は法律
54,なにも云わなかった。なにも云わず傘の下から飛び出してきた。しがみつく職員の制止を振り切り、恭介も駆け出す。サクヤを抱きしめるために。ぬくもりをこの腕で確かめる
55,市民に対して業務についての十分な説明を行い、理解を得るよう努めなければならない。３職員は、提供することにより、公正な職務の遂行を損なうおそれのある情報又は公正な
56,ていただく場合は別途、登録調査員に連絡を行います。また、調査に従事された職員には手当が支払われます。申はがきに「統計調査員登録希望」と明記し、郵便番号、住所
57,特定な関係でのかかりうけ二十五学校には宿直があって、職員が代る代るこれをつとめる。但し狸と赤シャツは例外である。（坊つちやん）二十六
58,を？）！私を誘拐しようとしている（これはイヤガラセ）。あんた（病院の職員）は事務の人じゃないの？なんだいあんたなんかあっちへ行け！車椅子なんか要り
59,政令で定める機関の職員である者のうち、機構の成立の日において引き続き機構の職員となったもの（次条において「引継職員」という。）であって、機構の成立
60,、独居老人ですね」と呼び掛けるものはなく、たとえば定期的に老人所帯を訪問している福祉事務所の職員だの、近所の交番の若い警官だのに、同居の家族の有無を訊か
61,ずいぶん前につくったんだなあ。「公団では事業の円滑な遂行のため、職員に転勤を命じることがあり、職員の住居を確保する必要から、宿舎を公団において建設・整備」
62,をもって組織された国家公務員共済組合（以下この条において「厚生労働省共済組合」という。）の組合員である職員（同日において附則第二条に規定する厚生労働省の部局又は機関で政令で定めるものに属する者
63,その時になってみないとわからないが、そもそも誰が誘導するというのか。誘導する職員がいなければ、大混乱だ。車椅子移動の十六人を、ベッドから車椅子に移すの
64,期間は、勤務したものとみなされる（勤務時間等規則§十三・Ⅳ）。３年次有給休暇は、職員の請求する時季に与えなければならない。ただし、請求された時季に休暇を与えることが、
65,にテレビ観戦することを禁止する知事見解を職員に伝えたところ、県民相談室に賛否の電話が殺到し、職員は海外の通信社などからの取材にも追われている。高橋和雄知事が十日の定例記者会見
66,で、ぜひとも環境省さんに、とりわけ環境省さんを目指される若い人たち、若い技術者、今もいらっしゃる職員の方がやる気を持って生き生きと仕事をしていただける、そういう環境省内の環境づくりという
67,ＮＨＫを解散して職員全員を解雇し、独立行政法人として新しい放送局を立ち上げてはどうでしょう？。職員は新規採用として給与を大幅に削減すれば受信料は安くなる。（少し前のＮＴＴで
68,その１つですね。（こんにゃく）神戸市広報印刷物登録平成二十年度第１号‐１（広報印刷物規格Ａ‐１類）職員などの募集水道局技術職員（作業手）昭和四十八年８月２日〜平成２年８月１日生の中学・高校卒業者（短大・高専卒業以上
69,福祉の仕事につくと，きっと，いろいろと制度に対する疑問が出てくる。どうして職員の数をもっと増やせないのか，こんなに困っている人に対して，どうして給付がなさ
70,五％の節減をしているということになるわけでございますが、この間、地方公共団体の職員の定数は職員の定数と申しますか、実数はどのように推移してまいりまし
71,ということを扱う、そういったものを売却する担当者として、これで利用者や住民や職員に対する責任が果たせるんですかと、私はお尋ねしているんです。○国務大臣（尾辻秀久君）今
72,及び都道府県警察に勤務する警察職員は，警察官，皇宮護衛官，事務職員，技術職員等で構成され，これらの職員が一体となって警察職務の遂行に当たっている。また，婦人警察官，婦人交通巡視員，婦人補導員等
73,通じ、公務能率向上に資するための、職員の福利厚生全般を実施しています。※この互助会は、職員の会費と市の補助金を主な財源とし事業を行っています。（２）
74,、その指定定期検査機関に対し、同号に規定する者を解任すべきことを命ずることができる。（役員及び職員の地位）第三十六条検査業務に従事する指定定期検査機関の役員又は職員は、刑法（明治四十年法律
75,元となる書類を目茶苦茶に引き千切った。なぜ、そうしたのか。窓口の職員の不信感を素直に受け入れて例の求職票を書き直すこともできたのに、隆志
76,なります。そして、課税したり、福祉サービスを行ったりします。市長は、市の職員の１人なのです。一方市議は、市民の代表者です。市の職員ではあり
77,ましては、まあいろんな問題があろうともその受け入れ側におきましては温かい気持ちで職員は迎えてほしいということは、私ども何遍も申し上げたところでございます。しかしながら、受け入れ側
78,代表権を有する役員）が、農林漁業体験民宿業者の役員又は職員（過去二年間に当該農林漁業体験民宿業者の役員又は職員であった者を含む。）であること。２登録実施機関の登録は、登録実施機関登録簿に次
79,にいていくらか自信のあったわたしは、前年のシーズンに市役所の弘報係の職員に頼まれ、一週間ほど中国の娘たちに水泳の指導をしてやったことがあって
80,若しくは帳簿書類その他の物件を検査させることができる。２前項の規定により立入検査をする職員は、その身分を示す証明書を携帯し、関係者の請求があつたときは、これ
81,の変動をもたらす処分のことです。（２）懲戒処分等の状況懲戒処分とは、職員の一定の義務違反に対する道義的責任を問い、地方公共団体の規律と公務遂行の秩序を維持するための処分
82,日本の在外公館には現在も、軍事や警備・警護の専門知識を持つ自衛隊や警察庁の職員も配置されている。だが、彼らの実際の仕事は、情報収集や、警備計画の企画・立案
83,を行います。３元気な区役所をつくるたとえば…職場の情報共有をすすめたり、職員のがんばりを応援したりします。☆関連データ職員の受けとめ方は？運営方針を共有している
84,、湯河原、大阪、玉造、湯布院などでは、公的医療機関としての存続を求める住民が職員とともに声を上げ、地方議会や地元医師会、商工会など、多くの団体が存続を
85,を漏らし、又は盗用してはならない。（役員及び職員の地位）第十四条研究所の役員及び職員は、刑法（明治四十年法律第四十五号）その他の罰則の適用については、法令により
86,とされていますので，事業団に協議してください。２常時従事することを「要する職員」とは，就業規則等の定めるところにより常時業務に従事することを条件とされていること
87,ているわけであります。それでもなおかつ、まだ二万何千人か、地方財政計画上に見込まれていないところの職員があるように聞いております。そこで、そういう状態でありますと、せっかく国
88,ことが必要であるという観点から、戦略計画の策定を開始した。これは、インターネット活用戦略計画を職員の手づくりでまとめるという、重要な試みであった。担当者ばかりの研究会から政策提案を
89,まさにその点を指摘したいわけでありますが、職員の半数以上、すなわち五十二年は五十四％の職員が事務、いわゆるホワイトカラーであり、残りの四十六％が伐採等の現場作業者ということになりますが、
90,。年金・税金などの「還付金詐欺」にご注意を最近、井原市内において社会保険庁などの職員を名乗り、年金や税金などの還付を受ける手続きを装って現金を振り込ませる「
91,も五名入っていますよね、臨時委員が五名。そしてまた、先ほど私は行政機関の職員の話もいたしましたけれども、本来は、行政機関の職員というのは、いわば
92,四十種類のパン乙訓ひまわり園は「共生」を基本理念に、二千年十一月に開所した障害者総合支援センター。職員の坂森由美子さん（二十四）はオープンからワークセンターで製パン・喫茶部門を担当、「メンバーさんと一緒にパン作り
93,が読まんでもいいのかね」満堂の高等官達、即ち海軍士官の教官や職員と文官教授とが、食後の茶を飲み、煙草を吹かしながら、二人の議論を
94,病欠や育児休業，休職，停職，欠勤の部分は，「理由や時期，期間が職員の私生活に密接に関わる情報」で非公開，という内容でした。つまり，個人
95,た。それを買い取ったのが三科であるということを、私はこの間漁協の職員との会話で偶然に知った。市と漁協が、玉江村の出身である三科に
96,腕時計に目をやった。十一時半、麻生病院の昼食の時間である。配膳台を押している職員は、すれ違った倉沢に、軽い会釈を送ってよこした。倉沢は、去年外科
97,別に辞令を発せられない限り、センターの成立の日において、センターの相当の職員となるものとする。第三条センターの成立の際現に前条に規定する政令で定める
98,、自分たちの施設において育成していくことが肝要となる。また、経験の豊富な職員は往々にして自分の仕事スタイルや介護に対する考え方など、はっきりした強い個性を持っ
99,もあり、また、職員がいない法人も二千六百九十九法人（十．五％）ある。このような職員がいない法人については、設立母体の企業・団体からの出向・派遣により、法人とは雇用関係に
100,出てくるだろう。利用方法の変更や新規事業の希望など、活発に論議されると思う。職員もこれまで以上に柔軟な発想と機動力をもって、彼らの考えに応えていか
101,定める部局又は機関の職員である者のうち、機構の成立の日において引き続き機構の職員となったもの（次条において「引継職員」という。）であって、機構の成立
102,たことは既述したとおりであるが，利用者が十人と十九人の場合とで同数の職員でいいのかという議論があった。議論のなかでは，利用者数に応じて
103,をさせていただきましで、合わせまして、局長、次長も入れまして八十四人の職員をそこに配置をさせていただきました。それと同時に、全国の財務局等に
104,べきことを命じ、又はその職員にこれらの措置を講じさせること。三その職員に、当該食鳥、食鳥とたい、食鳥中抜とたい又は食鳥肉等について廃棄その他の措置を講じさせること。
105,と、立看板が出ている。「五合目附近は凍結しているが、四合目までなら行ける」と職員はいった。庭は例年より雪がとけるのが早かったらしく、日かげに残っ
106,なることができるようにも配慮しているところであります。また、協力隊に派遣された行政機関の職員には、従前と同様の給与の支給が行われますが、そのほかに、
107,。パスポートを提出するよう要求しても応じず、それどころかカバンからお金を取り出し、職員やまわりの乗客に配ろうとするなど買収するそぶりを見せた。職員は説得を続け
