,0
108,挙げられる。こうした諸施策が有効に行われるように，警察部内では，職員が障害のある人からの困りごと相談等に適切に対応するための手話講習会や障害のある人に対する
109,、「裁判官の介護休暇については、」本法に定めのないものについては「一般職の職員の勤務時間、休暇等に関する法律の適用を受ける職員の例に準じ、最高裁判所規則で定める。
110,の資金が必要です。この資金はロボットの製造にまわされる多額の資本金と、職員の再教育に使う費用のことです。もしも、ある作業では鋼塊を操作し、
111,同条第四項各号列記以外の部分中「第二項」とあるのは「第三十五条第二項」と、第十六条第一項中「職員（試験委員を含む。次項において同じ。）」とあるのは「職員」と、
112,。◆「通い」「泊まり」「訪問」のどのサービスを利用してもなじみの職員によるサービスを受けられます。◆利用しないときは、電話で安否確認を行います。
113,の開発を目的とする養成訓練委託訓練は，郵政省外で教育・訓練の専門機関が開催する各種講習会に職員を派遣して行われる訓練であり，職務遂行に直接必要な専門的な知識と技能の修得
114,特定都市鉄道工事の実施状況若しくは特定都市鉄道整備積立金及び特定都市鉄道整備準備金に係る経理の状況に関し報告を求め、又はその職員に、認定事業者の事業場若しくは事務所に立ち入り、特定都市鉄道工事に係る施設、帳簿、書類その他
115,職務の遂行に当たっては、常に業務内容の説明ができるよう整理しておかなければならない。２職員は、違法又は第６条第２項に規定する公正な職務の遂行を損なうおそれのある行為（
116,アメリカ人の移民官が日本にやってきて、成田で入国審査をするのではなく、全日空の職員が旅行者のパスポートナンバーや彼らの名前をロスの移民局のコンピューターに送り、少しでも
117,一部を改正する法律（平成十六年法律第百三十号）の公布の日のいずれか遅い日（職員の引継ぎ等）第二条研究所の成立の際現に厚生労働省の部局又は機関で政令で定める
118,得意技である。そう、面倒くさいだけね・・付け加えるならセンター店の事実上ナンバー２もいらっしゃる！職員四百人超で仕事山積みなのに、わざわざ出向いていただけるとは光栄です。さて、とりあえず玄関
119,。そうすると当然誘導を始めます。誘導の仕方は、二時間に一度、職員が患者さんを誘ってトイレに連れて行きます。目標は、ひとつでも上の
120,か不祥事があればそこから弁済させれば良い。１億九千万円なんて個人では弁済不能だろうから職員に奉加帳でも回して弁済するんですな。
121,です。司会調査はいつごろ？●水環境室中心に、湧水に関係する他の部署の職員も参加して、平成十三年の夏から秋にかけて調査、撮影しました。司会
122,の学長、副学長、学部長、教授、准教授、助教、講師、助手若しくはその他の職員のうち専ら研究に従事する者、同法第一条に規定する高等専門学校（以下この条において単に「
123,地域との結びつきの大切さや，図書館職員の役割の大きさなどを知ることができた。また職員の懇切な対応を受け，司書の仕事の素晴らしさを知り，意欲を高めることができた
124,（痴呆対応型老人共同生活介護）の原則的な設備は，居室（原則的に個室）・居間・食堂・浴室・台所（利用者と職員が共働できる広さ）・便所（原則的に複数箇所）・洗濯家事室・職員室・その他で，利用者１人当たり
125,おくべきと自戒している。交渉ではときとして、議論が紛糾して、一人の職員とのやりとりに集中してしまうこともある。こんなとき、その職員が職場に帰って「いじめ
126,た」、という回答をいただいたほか「１階の庁舎案内所で尋ねた」「途中で職員に尋ねた」「庁舎案内図を見た」方の中でも、「分かりやすかった」
127,中電は昨年十二月から岩国営業所の前職員ら三人を柳井市内に常駐させ、さらに山口市の県原子力準備本部の職員も加えた約十人のプロジェクトチームをつくって準備を進めている。地元では、昨年
128,までの五日間において一日につき八時間（同条第二項の規定により一週間の勤務時間が延長されている職員にあっては、八時間に相当する時間）の勤務時間が割り振られている職員について同条第四項
129,の裁判所職員、いわゆる裁判所職員の例によるという一般的な規定を置きますほか、一般の職員と違うこととして定めることとして現在考えておりますのは、次のようなことで
130,地方公務員法第四十条および「武蔵野市職員勤務成績評定に関する規程」に基づき，毎年２月１日を評定基準日として一般職の職員について実施昇給への勤務成績の反映反映させていない４職員の手当
131,と利益の保護●福祉〈武蔵野市職員共済会〉地方公務員法第四十二条の規定に基づき職員共済会を設置し，職員の健康増進，その他厚生に関する事業を行っています。これらの事業は職員の会費
132,ございますし、正にこの施設類型というのは多岐にわたっております。したがって、法人における職員の採用に際しましては、今お話ございましたけれども、いろんな角度から適任者
133,責任はその職務者自身にしかない。日本の場合は、命令系統が上にあって、職員の不正は、監督不行届きの結果起こるのだから、それは上に立つ者の責任である
134,でのケアマネジメントには乖離が生まれることがある。なぜなら、高齢者ケアの社会的制度のうえから提供できる職員や財源には自ずと限界があり、限られた全体の資源を利用者ごとにどう効率的・公平
135,勤務成績や技能が未熟で向上心がみられず他職員へも勤務の負荷を与えている職員がいます。就業規則に照せば解雇も仕方ありませんが、本人の将来や
136,に必要とされる技能、職務遂行の困難度等職務の内容と変化に応ずるものであり、かつ職員の発揮した能率が充分に考慮されるものでなければならない」とか「当該地方公営企業の経営の
137,次の各号に適合していると認めるときでなければ、その指定をしてはならない。一職員、設備、試験事務の実施の方法その他の事項についての試験事務の実施に関する計画が
138,、この申請に関する手続きを代行してもらうことができる。市町村は、申請があったとき、職員をその被保険者に面接させて、その心身の状況、そのおかれている環境その他
139,赤字経営の不安に備えて郵政公社自体は、旧国鉄のような赤字はない。約二十七万人の職員も公務員ではあるが、その給料は税金から支払われるのではなく、公社の収入から
140,、『個人情報に関する相談事例と考え方』対象自治会、同窓会、ＰＴＡ団体、消防団、民生・児童委員地方公共団体の職員、その他個人情報保護法に関心のある人。定員二百人参加費無料申込み氏名、
141,、同別表第２）。表二十三新規採用職員の年次有給休暇日数エ病気休暇１病気休暇とは、職員が疾病又は負傷（以下「疾病等」という。）のため療養する必要があり、
142,である。また，グループホーム（痴呆対応型老人共同生活介護）の利用者定員は５人以上９人以下，職員配置は利用者３人に対して職員１名，利用料は約二十五万円（利用者負担は１割）＋食材料費＋理美容代＋おむつ代（＋光熱水費）
143,活用した研修等は，米国，オーストラリア，韓国等が進んでいるが，わが国においても，職員の資質向上を図る上で，今後，様々な活用方策が検討されることが必要である。現在
144,発言ができ、任期満了まで継続して協議会に出席できる人（年１〜２回程度）。※町の職員および議会議員を除く。▷応募方法申込書に必要事項を記入し、持参、郵送、ファクスまたは
145,している。その間を縫うように趣味の絵を描き、三味線も弾く。職員からは「怪物」と言われている。「あらあ、いらっしゃい。お母様のことは
146,ます。また、仮に現在それなりに機能しておる団体であるといたしましても、今後職員の年齢構成の高齢化が進むということによりまして、十分には機能しにくくなるということ
147,４前条の規定は、試験員に準用する。（秘密保持義務等）第三十条指定試験機関の役員若しくは職員（試験員を含む。次項において同じ。）又はこれらの職にあつた者は、
148,でございます。鈴木前理事長さんが種々おっしゃっていたということでございますが、決して当時の職員をかばうわけではございませんが、そういうお話を申し上げた後、鈴木さんが
149,定期的（年２回、１月と７月）に勤務成績の評価を行っています。６．職員の福祉及び利益の保護の状況（１）厚生計画の状況（２）公務災害などの
150,ていただいておりますけれども、先ほど局長が話になったように、国立病院の場合は職員が国家公務員であるので云々と。国家公務員であろうとなかろうと、国が関与して造ったこれら
151,、山口、沖縄の各県すべてに、介護保険の準備室や担当課が置かれ、それぞれ専任の職員が八人から四人配置された。九十八年度当初予算では、各都道府県で高齢者介護サービス体制整備支援事業費や普及・啓発費、保険事業支援計画策定費など
152,、綾香さんがやってきた。手には、志望大学の合格通知書が握ってあった。職員、ボランティアみんなで大喜び。１年間の彼女が頑張る姿と、ボランティアの懸命な教える姿を
153,が、十年になる拘禁生活も、無事過して来ました。これは、一重に所長さん初め職員の先生方のあたたかい御配慮があったからでした。（中略）テレビを見ていて
154,瀬谷区役所です。瀬谷区役所が目指すのは「幸せが実感できる瀬谷づくり」。瀬谷区役所は、元気な職員と職場を原動力に、「幸せ」づくりをすすめます。特集瀬谷の幸せのためにできる
155,自治体でホームヘルパーの正規の職員は六十三％なんですね。そして、社会福祉協議会では正規の職員は二十二．三％、そして福祉公社では四．五％で、平均しますと十％にすぎないわけですね。九十％
156,―少なくともその必要性―の存在を共通して前提としていた従来の研究からすれば，職員の（一部）非常勤化にあたっては，常勤・経験の深い職員は高い専門性を要求される
157,、要するに地方団体の事業に対して反対をする、その意思を表すために個人を相手取って、職員を相手取ってお金の出し入れについて賠償しろという訴えをするというのは、その組織の
158,のでございます。今回の調査によりますと、過去五年間に金融関連部局に在籍された職員に限定して行われているのではないかと思います。おやめになりました長野前証券局長、それから杉井前銀行局審議官は
159,なれる部分もございますので、どうぞお引き取りください、結構です。運輸大臣にお伺いいたします。国鉄の職員は、戦争中は満鉄、朝鮮鉄道あるいは台湾鉄道ということで、外地に出かけて非常に苦労
160,児童アンケートの結果からも充実した時間を過ごした様子がうかがえた。また、カセサート校の職員の方もよい評価をしてくださり、今後もこの方向性で児童交流重視の会にしていこう
161,○塩田政府委員そのとおりだと思います。○相沢委員そうしますと、先ほど来、特別職の職員の退職金につきまして、自治大臣も公務員の例あるいは一般民間の例等に照らして多額
162,二交代制で一週三十八時間四十五分勤務に、四十時間分の給料支給を違法とした私の監査請求に対して「職員は早出や超過勤務しても、超過勤務手当を支給されておらず、損害は発生していない」
163,とき。附則（施行期日）第一条この法律は、平成十三年一月六日から施行する。（職員の引継ぎ等）第二条研究所の成立の際現に文部科学省の機関で政令で定めるものの
164,の元町市街に流れ始めた。町投場このとき、町役場はどうだったか。役場の職員は、異様な光景にあ然としていた。役場には噴火を取材するために多く
165,の定数に関する条例に反して過員を生ずる結果となるばかりか，競争試験による合格者から職員を採用するという町の職員採用方針に反することになる採用を独断的に強行したという事案につき，
166,はカメラを額に巻きつけて、一緒に踊り出した。踊りの後、私は職員と児童に感謝の意を表する短いスピーチをして、次の予定に進んだ
167,の受刑者につきましては、国際対策室が置かれている施設等に収容し、語学能力を有する職員のほか、国際専門官や外部協力者など語学の専門家の協力を得るなどの手段を講じながら
168,もいれば職員とその家族もいます。患者が千二百人はいましたか。職員が四百人、家族が五十人あまり、それが二十輛の列車に詰め込まれるわけですから、
169,の適用除外）第三十一条国家公務員宿舎法（昭和二十四年法律第百十七号）の規定は、機構の役員及び職員には適用しない。
170,無料申込方法＝事前に電話で。市政と暮らしの出前講座広報広聴課☎八百二十九．一一一四市の職員が出向いて市政や暮らしの情報を分かりやすく紹介。お近くの公民館などで講座を開き
171,この法律には罰則規定がないことだ。第七条「従事者の義務」は、行政機関の職員もしくは元職員は、「業務に関して知り得た個人情報の内容をみだりに他人に知ら
172,第五十四条の２第１項において準用する改正国公法第百六条の二十四第１項第４号及び改正法附則第十条において準用する改正法附則第十二条、職員の退職管理に関する政令（平成二十年政令第三百八十九号）第三十二条及び附則第４条、特定独立行政法人の役員の退職管理に関する
173,は，記載内容や閲覧などを工夫して活用すべきであろう。［３］研修職員の研修は，その業務に関する知識や技術を修得するとともに，仕事に対する姿勢を再考する機会
174,臨時的に任用される職員ⅲ１年以内に任期の満了する職員及び定年により退職することとなる職員ⅳ定年退職日の翌日以降引き続いて勤務している職員ⅴ配偶者が育児休業をしている職員ⅵ
175,の自由利用の適用が除外されている業種警察官、消防吏員、常勤の消防団員、児童自立支援施設に勤務する職員で児童と起居を共にする者など休憩時間の原則７．休日の取り扱いは？
176,内閣総理大臣が任命する。４会議に、幹事を置く。５幹事は、関係行政機関の職員のうちから、環境大臣が任命する。６幹事は、会議の所掌事務について、会長及び
177,長年の住みなれた故郷を離れる、そういう決断をして東京、大阪に来た職員につきましては、まあいろんな問題があろうともその受け入れ側におきましては温かい
178,ながら、姉や佐竹さんと一緒に指定された場所へ急行しました。係りの職員の説明によると、「これまでたまごの輸入はしたことがあるが、殻だけを輸入し
179,開催や，障害のある人に対する応接マニュアルの作成・配布，さらには有志による手話クラブの結成や職員のボランティア活動への参加の支援などを行っている。また，地方公共団体，消防機関，社会福祉協議会等
180,にかかわらず、センターの成立の日の前日の属する月の翌月から始める。（センターの職員となる者の職員団体についての経過措置）第四条センターの成立の際現に存する国家公務員法（
181,をかいてくれる今では、重宝される存在なんです。朝八時から夕方五時までの職員ではなく、地域という組織にもかかわって自分の力量を地域に向かって出していく
182,ば、このままでは「笛吹けど踊らず」という事態になりかねず、二十九万人の職員の教育は実に頭の痛い問題といえそうだ。（Ｐ）“官業ゆえ
183,の引継ぎ等）第二条研究所の成立の際現に文部科学省の機関で政令で定めるものの職員である者は、別に辞令を発せられない限り、研究所の成立の日において、
184,勤務時間の割振りとみなす。２この法律の施行の際現に前項に規定する職員以外の職員について旧給与法第十四条第三項又は第四項の規定に基づき定められている勤務を要しない日又は勤務時間
185,六月の期間内において必要と認められる期間とする。３介護休暇については、一般職の職員の給与に関する法律第十五条の規定にかかわらず、その期間の勤務しない一時間につき、同法第十九条
186,何年間かは大学図書館事務長を兼任させられた。専任司書は一人もいなかった。事務局の職員や学生アルバイト、主婦のパートタイマーなどを使っておびただしい未整理図書を記帳し分類し、目録を作り、
187,後も、同様とする。（役員及び職員の地位）第十三条研究所の役員及び職員は、刑法（明治四十年法律第四十五号）その他の罰則の適用については、法令により
188,秘密を漏らしてはならない。その職を退いた後も、同様とする。（役員及び職員の地位）第十三条研究所の役員及び職員は、刑法（明治四十年法律第四十五号）その
189,。（幹事）第十六条本部に、幹事を置く。２幹事は、関係行政機関の職員のうちから、内閣総理大臣が任命する。３幹事は、本部の所掌事務について、本部長、
190,おきましていわゆる学科教育を担当している者を教育専門官と呼んでおりまして、矯正処遇に当たる職員というものは、その人たちだけでは決してございません。心理などを含めて各種
191,管理が人民管理でございますので、利用者も含めて、その管理については、入居者、職員、それから地域の行政体みんな入ってその管理をすることになっておる。これは大変おもしろい例で
192,（二十六）退職手当退職手当とは退職手当は、職員が退職した場合に、当該職員または遺族にたいして支給される手当であり、自治体労働者の場合は
193,受けているときは、この限りでない。４機構は、施行日の前日に厚生労働省の職員として在職し、附則第六条の規定により引き続いて機構の職員となった者のうち施行日
194,なると定置網にマンボウがかかりはじめる。真鶴の定置網で捕れたマンボウは３尾。市場の職員が「１尾五百円くらいかなあ」といっていたが、千円で入札された。
195,いうふうになっておるということでございます。確かにそのことによって現在の国鉄の職員の方々あるいはＯＢの方々にスライドもできない、これは不公平ではないかという御指摘で
196,では、特に議員の身分についていろいろ特例措置が講じられております。それから、一般の職員については、これは身分保障があるわけですから、当然合併がされても基本的
197,となっている。（１）現地調査の回数被害者からの苦情申立て後における公害苦情処理を担当する職員の現地調査の有無及び回数をみると，現地調査を行ったことがあるが九十．六％となっており
198,。しかしながら、利用者からもう一歩突っ込んだ情報や情報の解釈を求められた場合、職員に制限が課せられる場合がある。図書館には注意深く取り扱わなければならない多くの主題分野がある
199,↓↓１：“ひまわり”「宮原彩」さん。＝保健所の職員がガス室で殺処分された犬たちを想い作った歌＝２：“笑顔のゆくえ
200,」とあるのは、「前条並びに独立行政法人物質・材料研究機構法第十条及び第十一条」とする。（役員及び職員の秘密保持義務）第十三条機構の役員及び職員は、職務上知ることのできた秘密を
201,またＮＨＫの職員が電車で痴漢したらしいが、ＮＨＫの職員の教育はされているのですか。ＮＨＫはハーレムなのです。痴漢電車と勘違いしてしまった
202,非常に成績がいいということで四回、五回あるいは六回以上というような回数特別昇給しておるという職員も一割以上いるということでございまして、全体としてこれを見ますと、制度本来の
203,状況分限処分とは、法律又は条例に定められた事由に該当した場合に、職員の意に反してその身分に不利益な変動をもたらす処分のことをいい、地方公務員法
204,な運用に活用するものとする。（取締りに従事する職員）第五十条環境大臣は、その職員のうち政令で定める要件を備えるものに、第八条、第十一条第一項、第十四条、第十八条、
205,べきです。院長回診のときのいかめしさなどと同様、改めたい医療機関の古い慣習です。職員の家族への敬語職場には、職員の家族からも電話がかかります。
206,を見て、皆、奮い立ちました」役場内の動揺を収めると秋田は、職員に命じて役場の屋上に登らせ、そこから溶岩流の動きを五分おきに報告するよう
207,講じなければならない。（育児短時間勤務をした職員の退職手当の取扱い）第十五条育児短時間勤務をした職員については、国家公務員育児休業法第十二条第一項に規定する育児短時間勤務をした国家公務員の退職手当の取扱いに関する事項を
208,処遇に直接影響を及ぼさない業務については，この限りでない。●精神障害者社会復帰施設は，職員に対し，その資質の向上のための研修の機会を確保しなければならない。［４］
209,た者はすべて、裁判官または法により司法権を行使することを認められたその他の職員の面前に速やかに連行されるものとし、かつ、合理的な期間内に裁判を受け
210,ていて、両方でトロ箱七千百二十トンを本土へ直送している。境港の出張所には四十人の職員がいる。昭和五十二年には、隠岐の島全体の水揚げは八十億円という景気のよさだから
211,一様に金融機関への不信感と不満を抱くと伝えられております。一方、金融機関の職員による横領や使い込みといった犯罪も増加しており、現行制度のまま放置すれば、利用者と金融機関と
212,義務付けております。そういうことでございまして、訴訟告知を受けた先ほどの長、職員、相手方は、地方公共団体の執行機関との間で判決の内容を争えないという参加的効力が
