,0
318,ば、昼間くらいはおむつのはずせるＣグループまで、レベルを上げるのが目標です。職員の割り当ては、日勤や当直、休みなどの勤務体制があるため、グループ別に配置するの
319,に重なり合っているわけですね。そういうわけですから、聞いてみますと、これまで職員の研修も一体となって人事行政の中でも行われてきた、こう聞いており
320,で分配する、だから結局分配の問題だろうと思うのですけれども、それにしても特別会計で一般会計の職員と、これは公務員の定員内の職員なわけですから、これが人事院の勧告の
321,いた。彼らは昭和六十一（千九百八十六）年十一月十五日の噴火以来、毎晩交代で十一人の職員が泊まり勤務で監視体制を続けていた。その町役場に正式な対策本部ができた
322,詐欺容疑で逮捕されたのをはじめ、七、九月にも、ハイヤー代やホテル代の水増し請求事件で職員が逮捕された。破たんした在日朝鮮人系の金融機関、朝銀東京信用組合をめぐっては、十一月に
323,リーダーシップは重要です。しかし、それらを最大限の効果に近づけるためには、トップを支える職員のノウハウが必要です。それがないと住民参加により得られた情報を、より効果的
324,と能力を有する職員によって処遇が行われること（設置運営基準第２条）。なお，精神障害者社会復帰施設の職員のうち利用者に対する援助の提供に係る業務に従事する者は，精神障害者の福祉に熱意
325,かわかんない生き物だな。メルツァーの感慨に気が付かぬように司法省の職員は、受け取った身分証と乗船チケットを目の前にあるデータリーダーに差し込んだ。数秒
326,の成立の際現に公社の職員である者は、会社の成立の時に会社の職員となるものとする。２前項の規定により公社の職員が会社の職員と
327,推移表２‐２‐十四所管官庁出身常勤役員がいる法人における有給常勤役員の平均年間報酬額規模別法人数（職員）職員は、理事の職務を助け、実際の法人の活動を担う中核的存在であり、法人管理、
328,職員というのは三千二百七十五人おります。それで、先ほどお話ししましたとおり、在外に勤務する職員の給与というのは二本立てになっております。在勤基本諸手当、これについては経費ということで
329,に活用する観点からも、評価結果を職員本人に開示をしていく方向性で検討する。さらに、職員の苦情につきましては、評価プロセスにおける対応を第一としながらも、職員の
330,も『四川日報』など監督下にあった組織の批闘大会にひっぱり出されたが、そこの職員も父に個人的なうらみがあったわけではなく、批闘大会は形式だけのものだった
331,、ローソクを使った幻想的にダンスに「涙そうそうのハワイアンバージョン」の曲に合わせて、職員十四人が息の合った演技を披露した。また、二十三日に行われた同保育所
332,と。それは、例えば学校の先生であるとか労働基準監督官であるとか、あるいは法務省の職員であるとか、いろいろなところを、本当に国民はもっともっと増やしてほしいと思うよう
333,今までの係制に変わるもので、定員適正化により職員の減少が進む中で、少ない職員で効率的・効果的に業務を行うために、係の枠を取払い、課全体で業務を行うために
334,皆さんどうですか？絶対不公平ですよこの辺の問題！役員報酬が三千万円〜五千万円、職員の平均報酬が千万円以上ですので、少し給料を下げれば十分やっていけます。自民党と
335,推移してまいりましたか、伺いたいと思います。○塩田政府委員昭和四十二年に地方公共団体の職員が二百三十五万六千人でございます。これも五十二年四月一日ですが、三百一万二千人でございます。その
336,、このアンケートが有識者会議である行刑改革会議により行われるものである、それから個別の回答内容が施設の職員の目に触れることはないというようなことを説明いたしました。そういう配慮をし
337,規定する届出を受けた場合には、当該通報又は届出を受けた高齢者虐待対応協力者又はその役員若しくは職員は、その職務上知り得た事項であって当該通報又は届出をした者を特定させるもの
338,どう感じましたか…生活の情報多治見市職員（民間企業等職務経験者）募集平成二十一年４月１日付で採用する職員を募集します求める人材土木、建築、電気の専門的な知識、技術を有し、
339,が各種研修に参加しました。（２）勤務成績の評定の状況十日町市では職員の人材育成及び業務効率を増進させることを目的として、定期的（年２回、１月
340,対応しております。また、台風等重大な災害の発生するおそれのあるときは、臨時に職員を配置しております。御質問の突発的に発生する地震につきましても、防災上極めて重要
341,。大学院生が大部分を占めているが、すでに教授として大学で教えている人、図書館の職員、博士論文を準備中の年輩の人（Ｃ．Ｎ．Ｒ．Ｓ．の研究員が多い）、あるいは役所や会社
342,において、更生保護法人に対し、その業務若しくは財産の状況に関し報告をさせ、又はその職員に、更生保護法人の事務所その他の施設に立ち入り、その業務若しくは財産の状況若しくは帳簿
343,考えられますので、その間、増加する登記事件を適正迅速に処理するための要員が必要であり、職員の増員を図ることが緊急の課題であります。民事関係の立法につきましては
344,ことになる。「承り学習」を拒絶するのはいいとしても、今度は十分な理解をもった職員が前面にでる高踏的な課題の設定ではないのか。第二に、学ぶことと実践する
345,議論が紛糾して、一人の職員とのやりとりに集中してしまうこともある。こんなとき、その職員が職場に帰って「いじめられた」と同情を求めると、同僚はこういっ
346,敗訴させた。これに対し、第二審の福岡高等裁判所宮崎支部（二千二年七月二日判決）は、「職員はもっぱら信用金庫内部の不正疑惑の解明を目的で行動しており、実際に疑惑解明につながった部分
347,するときは，個人情報の保護のために必要な措置を講ずるものとする。（職員の義務）第８条協会の職員又は職員であった者は，職務上知り得た個人情報を
348,が出ている。間違いありませんか。○説明員（澄田信義君）今の各管理局等に「職員の自殺について」という書面を出したのは事実でございます。それはこういっ
349,加えて、身体のバランス感覚、認知機能、触感機能などを刺激するからである。コミュニケーション能力は、職員や入所者同士の共同作業や活動を通じて身につけたものである。たとえば二人一組での丸太運搬
350,行うための施設・設備の借上金，共同施設の管理費・利用費等），５社内人件費（社内の研修施設および能力開発部門の職員の給与・手当等），６社内の施設設備・管理費（建物の減価償却費，光熱費，賃貸料，委託費，保険料
351,からこそ分かる現状を語ってもらう。とはいえ、計二十三学科もあると、学科で担当教員や職員の支援の仕方にも取り組み方に差が出る。全学的な取り組みをするためにキャリアサポート
352,チェレンジするのは当然である。しかし、ＭＡＳ業務は専門分野ではない。しかも、われわれの雇っている職員は、われわれと比べ知識も経験も著しく劣っている」彼は、黒板にグラフ
353,にもかなりの時間とエネルギーを要する。しかし、問題行動に対するケアプランが成功するのは、職員が問題に取り組むことが、入所者のＱＯＬを向上させるのに絶対必要だということ
354,設置し，職員の健康増進，その他厚生に関する事業を行っています。これらの事業は職員の会費と市の交付金で運営しています。職員共済会の運営状況会費交付金公費率
355,た。この「さわやか運動」のコアとなる部分に「事務事業評価システム」を導入した。職員は苦労して予算をつくるが、決算には関心が薄い。予算がどう使われ
356,でコケた。ここに、大丈夫ですか。と寄ってきたのが保健所の職員。「あ、つまずいただけです。」とメタ坊。ところが、保健所員は、こんなところ
357,ひんぱんに電話がかかってくる。オンブズマン制度について尋ねてくる場合もあるし、県の職員の対応が悪かったことについてカンカンに怒って電話してくる場合もある。後者の
358,母さんを殺したんだ」ブローガンは答えた。「殴り殺したんだよ」福祉事務所の職員がブローガンを連れていったあと、パーカーは執務室でハンソンと話をした。
359,開催、うねめ踊り流しへの参加、サークル助成などの文化体育事業を通じ、公務能率向上に資するための、職員の福利厚生全般を実施しています。※この互助会は、職員の会費と市の補助金を
360,できる（自治法二百四十三の２８）。なお，自治法上の特別の賠償責任を負うべき職員については，賠償責任に関する民法の規定は適用されないが（自治法二百四十三の２十四），
361,＝７日午後７時五十四分、愛知県一宮市で愛知県の「３セク総点検」民間と競争で痛みも職員、雇用に不安公共施設管理の外部委託率が全国で最も高い愛知。施設管理者を公募する指定管理者制度が
362,の前日に厚生労働省の職員として在職する者が、附則第二条の規定により引き続いて機構の職員となり、かつ、引き続き機構の職員として在職した後引き続いて国家公務員退職手当法第二条第一項に規定する
363,とするときは、その者の国家公務員退職手当法第二条第一項に規定する職員（同条第二項の規定により職員とみなされる者を含む。）としての引き続いた在職期間を研究所の職員としての在職期間
364,は圧迫されているので、らちがあかない場合は、自宅まで返却を求めて、職員が訪問するかもしれません。借りた本は返しましょう。紛失の場合は弁償し
365,条例」に基づき、公表します。職員の任免および職員数に関する状況職員の給与の状況職員の勤務時間その他の勤務条件の状況職員の分限及び懲戒処分の状況１分限処分の状況（平成
366,消防職員委員会における審議案件は２万件を超えるに至っている。消防職員委員会制度は、消防職員の意志疎通を図り、職員の意見を消防事務に反映しやすくすることにより、消防事務の円滑な運営に資することを目的
367,たが、専門の運転手はなく、車を使うときはいつも運転免許をもった職員に頼っていた。録音機はあったが、据え置き型の円盤録音機で、重さ百キロ以上、
368,よくある例として、組合の理事がすべて組合員企業の役員であったり、技術者が組合員企業の職員であったりして、常勤性や専任性を問われ、許可取得の障害になることがあります。
369,第四条の規定にかかわらず、国家公務員の育児休業等に関する法律（平成三年法律第百九号）の適用を受ける職員の例に準じて、最高裁判所の定めるところにより、期末手当又は勤勉手当を支給する。（不利益取扱い
370,二十七万七千人、六十一年度四月一日現在でございますが、このうち四月一日現在で退職前提休職に入っております職員は千九百六十三人でございます。○橋本敦君この千九百六十三人については、本法による特別給付金は支給するんですか
371,をようやく救急車に押し込んだ。救急救命室でもまるで悪魔のように暴れて抵抗するので、職員を守るために、皮製の拘束具で手足を束縛しなければならなかった。徹底的に検査がおこなわ
372,職員を国際機関、外国政府等に派遣している。昭和六十三年度についてみると、新たに派遣された職員は百九十人で、職務復帰した職員は百七十三人である。新たに派遣された職員の派遣状況を
373,第一項に規定する職員をいう。以下同じ。）の処遇等について定めるものとする。（職員の派遣）第二条任命権者（地方公務員法第六条第一項に規定する任命権者をいう。以下同じ。）
374,の回収でございますけれども、これも受刑者みずからに封をさせ、そして施設の職員がこれを集めて、開封することなくそのまま行刑改革会議事務局に回付いたしまして、行刑改革会議事務局の職員
375,たが、そう簡単に整備が進んだわけではない。大和市には全部で二千名の職員がおり、そのうち行政職が千百名、残りが消防や病院関係などの職員ということになる
376,を考慮し二十日を超えない範囲内で人事院規則で定める日数）二次号に掲げる職員以外の職員であって、当該年の中途において新たに職員となり、又は任期が満了することにより退職する
377,は職員も驚かされた。中高生も、自分たちのニーズにあった目標の設定と職員の適切な援助があれば、グループとして成立する。これはオープンして初めてわかった新鮮
378,の前日に厚生労働省の職員として在職する者が、附則第二条の規定により引き続いて研究所の職員となり、かつ、引き続き研究所の職員として在職した後引き続いて国家公務員退職手当法第二条第一項に規定する
379,。郵便局におけるワンストップ行政サービス（イ）双方向サービス情報端末で取り扱える定型的な手続にととまらず、職員との相談を要するような専門的な手続についても、通信手段を介して提供するための取組
380,ましょう。●浄化槽維持管理に関する問合せ山口県周南健康福祉センター☎０８３４（３３）６４２９／環境事業課☎０８３３（７２）１４００（内線３００／３０１）職員の人事異動を行いました４月１日付け（）は前職【光市人事異動】【部長級】
381,で、証人はいるかね」「いるわけないじゃないですか」学生課の職員は、学生証をかえすそぶりもみせず、しばらくそれに貼りつけられた文大の写真に
382,ことができる。（役員及び職員の公務員たる性質）第二十六条給付金業務に従事する介護労働安定センターの役員及び職員は、刑法（明治四十年法律第四十五号）その他の罰則の適用については、法令により
383,介護休暇２週間以上にわたり親族を介護するとき、６月以内で認められる休暇・育児休業３歳未満の子を養育する職員に認められる休業４職員の服装の状況（１）地方公務員法の規定により、次
384,があったときは、その出資額により資本金を増加するものとする。第二章役員及び職員（役員）第六条研究所に、役員として、その長である理事長及び監事二人を置く
385,当該食鳥の隔離、食鳥処理場内の消毒その他の措置を講ずべきことを命じ、又はその職員にこれらの措置を講じさせること。三その職員に、当該食鳥、食鳥とたい、食鳥中抜とたい
386,遂行するために必要な知識・技能等を付与するために実施される訓練であり，主としてマネージメントの中核となり得る職員を養成するための大学部と事業活動において中核となり得る職員を育成するための専門部が設けられている。
387,，復興に伴う大量かつ集中的な登記事務を適正かつ迅速に処理するため，引き続き他部署の職員による事務応援及び賃金職員の雇用による処理体制の整備を図る。（５）登記特設相談所の開設
388,大きいと、よそとの衝突が大きいということが一つと、また現在の国鉄の職員の体質からいいまして、必ずしも商売がうまくやれるという確信が持てないということで
389,及び警察）に提出したという事件である。職員は懲戒解雇された。そこで、この職員が信用金庫を相手に「解雇無効」の裁判を起こしたものである。第一審の宮崎地方裁判所
390,アドバイザーバンク登録者名簿が備え付けてあります。名簿をご覧になり、希望にあった方を選んで各機関の職員に申し出てください。インターネット・電話で申し込むこともできます。２直接交渉が可能な講師の場合は
391,の懲役又は三万円以下の罰金に処せられることになっている（地公法六十条二号）。これは、職員が当該地方公共団体の秘密を漏らすことによって、当該地方公共団体の利益を害し、あるいは、職務の遂行上
392,）についても、同様とする。（休日の代休日）第十五条各省各庁の長は、職員に祝日法による休日又は年末年始の休日（以下この項において「休日」と総称する。）
393,すべて現物のサービスによって提供するためには、多くのサービス提供者を確保する必要があり、十分な職員の確保・研修とサービス提供の基盤整備が難しいからである。二つ目は、介護保険制度という社会的なシステム
394,必要な事項を調査審議することとなった．日本国有鉄道幹線調査会は，運輸大臣が委嘱した学識経験者および関係機関の職員三十五名で構成され，会長は委員の互選によって，元満鉄理事大蔵公望が選出された．千九百五十七年
395,連れてゆくのだった。大蔵省主計局長が下院で猿芝居を演じて、外務省の諜報関係の職員のひとりにまつわるある種のスキャンダルを根も葉もないことと打ち消し、野党側の
396,、外国政府の機関等に派遣される職員（地方公務員法（昭和二十五年法律第二百六十一号）第四条第一項に規定する職員をいう。以下同じ。）の処遇等について定めるものとする。（職員の派遣）
397,わけであります。その後順次減員いたしまして、統合後は二百九十三人ということで、若干の職員についても減少するわけであります。○田沢智治君そうしますと、必然的に役員と職員が
398,ひそかにわが校将来の前途に危惧の念をいだかしむるに足る珍事でありまして、われわれ職員たるものはこの際ふるってみずから省みて、全校の風紀を振粛しなければなりませ
399,特に、一般行政関係職員は３年連続の減少（３年間の累計九千七百七人の減）となっている。職員の部門別構成は、第四十五図にみられるとおり、教育関係職員が百三十一万二千四百十四人で全体で四十六．二％を占め最も
400,団体を含む。）若しくは指定協会に対して必要な事項に関し報告をさせ、又はその職員に、これらの者の事務所その他の事業場に立ち入り、その帳簿、書類その他
401,、警察の留置場も裁判所の調べ室も、お前たちスパイ容疑のジャップで満杯さ」移民局の職員が嘯いた。「よし、身体検査がすんだら、取調べは明日だ、ぶち込んでおけ
402,た町役場の職員は、こう語った。「噴火が役場に迫った時、職員の大半が、対策本部を解散して、逃げる準備を始めたんです。皆、動揺してい
403,及び都道府県警察に勤務する警察職員は，警察官，皇宮護衛官，事務職員，技術職員等で構成され，これらの職員が一体となって警察職務の遂行に当たっている。また，婦人警察官，婦人交通巡視員，婦人補導員等
404,、国際刑事警察機構（ＩＣＰＯ）を通じるなどして外国機関と積極的に情報交換を行っているほか、職員を外国機関へ派遣したり、外国機関関係者を招へいして国際会議を開催したりするなど、関係強化に努め
405,の中で、聞いてみたいこと調べたいことがあったら、まず図書館にお尋ねください。職員が調べ物のお手伝いをいたします。図書館で未知の世界の発見や夢を広げましょう
406,ぬ夜勤の看守が防弾ガラスの向こう側に座り、スピーカー越しに、冷たい、ひび割れた声で職員のＩＤを見せるよう求めてきた。シェリーは監視カメラの前を通り、静まり返った廊下
407,障害についての理解を広めたり、サンサ右京での啓発事業、事業所を超えた職員の学習会などを実施しています。また、イオングループの協力で「イオンモール京都・ハナ」３階に、福祉展示・情報コーナー
408,を入れることにした。そのために組織の改革が必要だが私は最初に職員の意識改革から始めた。私は彼らに「問題が起きないようにうまくやっ
409,は二十一万二千九百六十九円（平成二十年３月１日現在：二万七千八百八人で計算）議会費町議会議員の報酬各種負担金など三千八百三十一円総務費職員の給料や町の総括的な事務三万五千二百四十三円民生費高齢者福祉児童福祉など五万千九百六十一円衛生費保健、環境保全ごみ処理など
410,、６月以内で認められる休暇・育児休業３歳未満の子を養育する職員に認められる休業４職員の服装の状況（１）地方公務員法の規定により、次のような職務上の業務が
411,あるとき，２監査委員の勧告を受けた地方公共団体の議会，長その他の執行機関又は職員の措置に不服があるとき，３監査委員が住民監査請求に係る監査又は勧告を当該請求が
412,表面化したことで、三セクが事務局を置く町商工会には朝から、報道陣が詰め掛け、職員は相次ぐ電話などの対応に追われた。月内に合併協発議庄原圏６首長ら提案決定東城町の法定合併協議会
413,の分庁および指定管理者制度の導入など絶え間なく行政改革に取り組んでいます。平成二十年度は、「職員１人１改革」を目標に改革改善をより強力に進めるほか、総合計画に位置づけられるすべての
414,前身）があるだけだった。広島市立中央図書館でこの被爆状況を聞くと「さあ。当時の職員は一人もいないし（あたり前だ）、よくわからないのですよ」と誰も
415,０人免職０人合計３人５．職員の研修及び勤務成績の評定（１）職員の研修十日町市では公務の基礎知識から高度な行政運営能力を養うため、新潟県市町村総合事務組合など
416,の通所授産施設に特別の要件はなく，これに準ずることになった。ただし，施設長を含む職員の研修については必要であるとの見解で意見が一致し，厚生省としても予算面で努力する
417,、厚生労働大臣は、介護労働安定センターに対し、その役員を解任すべきことを命ずることができる。（役員及び職員の公務員たる性質）第二十六条給付金業務に従事する介護労働安定センターの役員及び職員は、刑法（明治
418,スプーンをとったりしながら会話も欠かさない。「この店は合理化を図って職員を減らしているからもうけている」といって、ティーバッグのお茶の袋を指さす。知識
