,0
215,、エフィーの写真を指差した。「じゃあ、これも買うよ」ボートの船員が早く乗るよう声をあげた。アラブ人の妾たちが走って来て、ボートに
216,の底辺で身を売って生きるしか道がなかったのであろう。シリアからの交易船の船員を相手に商いをする女性（テーベ私人墓百六十二）化粧をする若い娼婦（トリノ博物館）◆
217,した。行介が買ったのは、フランネルが多かった。それと、船員がシャツにするような綿ジャージィ、薄手の木綿、柔かい材質のデニム。布地の
218,た。それが船から船へと伝えられたのである。日本では大正初期に同じく船員が海外でボトルシップを見つけて作ったのが始まりと言われている。ボトルシップの
219,特別措置法第十四条第一項の規定により適用される場合を含む。以下同じ。）」と、「船員の労働関係」とあるのは「船員の労働関係（特別措置法第十四条第四項に規定する労働関係を含む
220,この法律は、国家公務員及び地方公務員並びに船員職業安定法（昭和二十三年法律第百三十号）第六条第一項に規定する船員については、適用しない。第二章介護雇用管理改善等計画（介護雇用管理改善等計画の策定）第六条厚生労働大臣は、介護労働者
221,気持ちは分かる気がする。坂下のような目つきの悪い男にうろうろされたら、船員も落ち着かないのだろう。ともかく、これ以上馬鹿にされないためにも、明日こそは
222,ヨーロッパ地図に指で示しながら。人のいない風景画に犬や人間、場合によっては船員を乗せたまま陰鬱な海に沈む船を描き入れて絵画の値段を上げる美術品ディーラー
223,の五階にあって、直通のエレベーターが通じている。早苗の夫は商船の船員で、早苗自身も何度か外国の地を踏んだことがあるらしい。「一度、お食事
224,酷使することによって苦悩をいやそうと考え、船乗りの世界に身を投じた。ロンドンで船員として雇われ、船は大西洋を南下、途中、寄港をくり返してアフリカ大陸の喜望峰を
225,。（妖怪です）そのあまりに美しく怪し気な魅力で船人を魅了し船を沈没させ船員を死に至らしめる、と言われています。昔、沈没事故が多くあったので何
226,。第二十条国は、他の法令の規定に基づき支給するものを除くほか、手帳所持者（船員となろうとする者に限る。以下この項において同じ。）がその有する能力に
227,があります。たとえば老齢年金の支給年齢も一般の人は六十歳ですが、坑内員や船員としての加入年数が十五年以上ある人の場合は、いまのところ五十五歳から支給されています
228,都道府県労働局長に委任された権限は、厚生労働省令で定めるところにより、公共職業安定所長に委任することができる。（船員に対する適用除外）第二十七条この章の規定は、船員職業安定法第六条第一項に規定する船員については、
229,）第一条この法律は、海上企業をめぐる経済事情及び国際環境の変化等により離職を余儀なくされる船員の数が増大していること等の状況にかんがみ、船員の雇用の促進に関し必要な
230,た。港を散歩しているうちつい足をのばしすぎ、危うく乗り遅れるところだったのである。船員のひとりがもやい綱を外していた。いまの女がその男と親しそうに話し
231,れても文句がいえない。自衛隊や米軍の物資の輸送に従事した商船、船員は相手国の武力攻撃を受ける危険がある。航空機と有事法制Ａ君ほかにはあるか
232,たから、船員を軽蔑し、優越感をもって振る舞った。陸兵と船員はつねに対立し、船員の士気が低かった。一方、イギリス海軍は船員が主役だった。砲戦の成否が
233,が昭和六十年十月にスタート。本県でも平成十一年十月、足摺岬沖でクレーン作業中に骨折した船員の処置のため医師が派遣されるなど、今年一月末までに延べ八百七十二人の派遣実績がある
234,これらの法律に基づいて発する命令の規定の適用については、船員法の適用を受ける船員とみなす。この場合において、必要な技術的読替えは、命令で定める。６第一項の
235,の状況にかんがみ、船員の雇用の促進に関し必要な措置を講ずることにより、船員の職業及び生活の安定に資することを目的とする。（定義）第二条この
236,。十隻超を短期間に集中廃棄するのは異例。廃棄する船舶はすべて償却を終えており、船員の人件費や、修繕費など固定費の低減につながる。世界同時不況で自動車の国際輸送は急減し
237,陸兵が戦闘の精華であったから、船員を軽蔑し、優越感をもって振る舞った。陸兵と船員はつねに対立し、船員の士気が低かった。一方、イギリス海軍は船員が主役だっ
238,のところである。明治三年からは検梅をうけて外国人に接したが、人買いの船員や博徒や外人ゆきの遊女たちの酔声がとびかうところだった。渡海の機会はいくらで
239,か？拘束した海賊をどうするのか？またすでに海賊がタンカーなどに乗り込んで船員を人質に取っている場合どう行動するのか？まして外国船が襲撃されている場合に駆けつけ
240,のトランクを抱えた船員を乱暴におしのけ、上甲板に走りこんだ。このため、船員はよろめき、あやうく彼女のトランクを落としそうになった。彼女はかっとなって一等航海士
241,の感じだった。彼女の前に、テーブルが置かれ、次に、四十代の船員が出て来て、その上に、ワインを置いた。（金次は、女連れ
242,に神戸を出港した日本郵船の日枝丸の乗船切符を入手していた。日枝丸は一万二千トン、船員百五十名、一日の航行費三千円という豪華客船で、米国のシアトルから帰航直後とあって食糧や
243,雑所得となります（基通三十五‐１）。２上記（１）の労働者及び船員の貯蓄金，すなわち，勤務先預け金の範囲は，現に雇用関係にある労働者又は船員の貯蓄金
244,法令の規定に基づき支給する給付金でこれに類するものとの関連を十分に参酌し、船員の就職が促進されるように配慮しなければならない。（譲渡等の禁止）第四条就職促進給付金の支給
245,には周囲四十間ほどの小島があった。そのうえに石造の建物があり、船員のひとりが万次郎に教える。「あれは灯台だよ。いちばん天辺にあるガラス
246,その間に北氷洋もかいまみている。そして二十五歳のとき、ベルギーの南極探検船「ベルジカ号」に船員として乗りくむ機会にめぐまれ、出帆の直前にその一等航海士に任ぜられる。隊長はベルギー人だ
247,航路再編成計画に基いた関連航路の再編成を具体的に進めていくとともに、関係機関等と協力して、船員に対する離職前職業訓練等円滑な転業・再就職のための対策を講じることとしている。３国内海上貨物輸送（
248,の述斎いらい、漂流民の問題、その救助の必要性を強調していた、日本人漂流民は廻船の船員か漁民で、士農工商の身分制度では最下位である。しかし彼らとて「我国之人」ではない
249,平成十三年度船員災害防止実施計画を作成し、自主的な船員災害防止体制の確立、船内作業の安全化等の労働災害防止対策を、船舶所有者、船員及び国の三者が一体となって強力に推進した。２漁船の海難、
250,ゴミひとつ落ちてない。喫煙室以外の場所で煙草を吸ってる奴もいないし、船員の服装もきちんとしたもんだ。ちらっと見ただけだが、勤務態度もよさそう
251,「おそらくこの船の中に、岡元が宮部家の力を借りて潜り込ませた船員がいるはずだ。そいつが手引きするんじゃないかと考えてる」「コメ袋のひとつや
252,が美しい。彼にローリーと名付けた。家族として何年生きるか。ここ数年、船員によってずいぶん多く日本に連れていかれたが、まだ寿命まで確認した話は聞い
253,で制度案をまとめることになった。案では、国際船舶にかかる固定資産税や登録免許税の免税や船員の育成費などの名目での補助金交付などが打ち出された。しかし、船会社の最大
254,意見を聞くなど精力的に行動した。使節船には薩摩の五代才助（友厚）が船員として乗り組んでいた。晋作が、彼から坂下門外の変についての情報を聞かされた
255,を促進するための措置に関し必要な情報提供、助言その他の援助を行うことができる。（船員となろうとする者に関する特例）第十八条船員職業安定法（昭和二十三年法律第百三十号）第六条第一項に
256,が開始されている。３船員の労働時間の短縮等と船員災害防止対策の推進（１）船員の労働時間の短縮等船員の確保を図るための魅力ある職場づくりを進めるとともに，ゆとりある
257,。すかさず床を転がってマカロフをかまえ、標的をさがす。ヘレンが襲いかかった黒髪の船員はすでにたたきのめされ、身をよじるようにして床に倒れていた。ソーンは
258,た。彼らは、あらゆる衝突を避ける努力をし、日本に向かう船舶にカトリック教徒の船員を雇ったりしないように気をつけた。一方、オランダの著述家が確信した
259,、踊り場の船員にむかって舷梯をはずすように手をふって合図した。船員は舷梯を踊り場からはずし、上甲板に移ると踊り場を持ちあげて手すりにくっつけ、止め金
260,が戦地に行かされる。まさに「ひめゆり部隊」の再現ではないのか？６建設労働者、船員、港湾、航空労働者と有事法制土木建築と有事法制Ａ君他に有事法制と関連する分野はあるか
261,情報を航行警報等により提供している。イ船舶の安全運航の確保（船員災害の防止対策等）船員に着目した安全対策としては，第５次船員災害防止基本計画（昭和六十三年３月公示）に基づき，労働環境の変化に
262,おり文字閉じ込めて海に還さんわが過去に持ちし望みよ大きなる船ありて船員の影暗く立つトンネルを出ずれば干魚の匂いしてこの山が東京との境い
