,0
105,各号に掲げる事業を行うものとする。一船員に係る求人の開拓その他船員の職域の開拓を行うこと。二船員職業紹介（船員職業安定法第六条第二項に規定する船員職業紹介をいう
106,船員の資質及び技能の向上（１）ＳＴＣＷ条約の発効と実施体制の強化船員の知識及び技能に関する国際的な最低基準の設定を内容とする「千九百七十八年の船員の訓練
107,を知ってるだろうが」「いいから、行って」女がとげとげしい声で船員にいった。船員はフェリーに飛び移ると、人を小馬鹿にした顔をこちら
108,踏まえて、この掃海作業というものが国際貢献に役立つ一つの方法ではないか。あるいは自国の船員の安全あるいは船舶の安全というものについて、これを政府として法的な面から見て
109,ことができる。一個人情報取扱事業者が行う個人情報の取扱いのうち雇用管理に関するものについては、厚生労働大臣（船員の雇用管理に関するものについては、国土交通大臣）及び当該個人情報取扱事業者が行う事業を所管する大臣等二個人情報取扱事業者
110,規定が設けられて以来四十年余が経過しているが，この間技術革新の進展等を背景に，船員の就労の態様が大きく変化するとともに，船員の労働条件の水準も労働協約の内容等に見
111,とし，下船中に休日を付与することを可能とするものであり，この制度により，船員の労働時間の短縮を段階的かつ着実に進めていくことが可能となる。今後は，
112,て帰って一番先に覚えたのは、親父の咳払い…」また、ある船員は、「ポッポ、ポッポ…。なんの真似だろう、と考えてみたら、どう
113,ほどの店が軒を並べて競い合っていた。遠洋漁業から帰ってきた漁師や船員、造船や船舶修理工場関係の人間、そしてその落す金を目当てに群がってきた種々雑多な商売人たち
114,な発展を促す見地から必要と認められる措置であつて国際航海に従事する日本船舶に係る船員の就業構造の変更その他の政令で定めるものに伴い離職を余儀なくされた者
115,日枝丸は最終的に、イランのバンダル・シャープール港まで行くことになっていた。が、当初、船員には台湾航路だと言ってあり、神戸を出港する時もひっそりとしていたそうな
116,飛んでいるのだという言い伝えや詩をもとにして建てられた、海難事故で亡くなった船員のための慰霊碑。大西洋と太平洋が合流するホーン岬周辺は、昔から危険な難所といわ
117,もすみませんでした」深々と頭を下げてから、顔を上げた梨沙に、船員が指し示した。「あそこ」桟橋の先端に直哉がいた。びしょぬれの
118,第十一条第一項ニ規定スル労務供給船員ヲ謂フ以下之ニ同ジ）ヲ含ム）」と、同法第十条中「船員」とあるのは「船員（労務供給船員ヲ含ム）」と、同法第十七条中「船員（
119,「反乱って？」「よくあるんですよ。こういう船では。いわゆる船員によるシージャックですね、はい」物知り顔にキットンが説明したが、「いや、
120,に基づいて発する命令の規定の適用については、それぞれ、同法第六条第一項第三号に規定する船員及び船舶所有者とみなす。この場合において、同号中「使用される者」とあるのは「
121,うちこんだアムンセンらしい、まことに用意周到な人生設計といえよう。船長の免状をとるためには船員としての実地経験が必要なので、アムンセンは三年間にわたって夏のあいだ帆船にのりこみ、水夫
122,六十二か所に設置された船員職業安定所において，就職あっせん，職業指導及び失業保険金の支給等を行うほか，「船員の雇用の促進に関する特別措置法」に基づく就職促進給付金を支給する等の措置を講ずるとともに，（財）日本船員福利雇用促進センター
123,第３節船員対策の推進１船員の雇用（１）船員雇用の現状外航海運における経営の合理化や国際的漁業規制の強化による
124,‐３‐十五表に示すとおりである。被保険者のうち，約五十％が汽船及び機帆船に乗り組む船員であり，約五十％が漁船船員である。第１‐３‐十五表被保険者数，被扶養者数及び船舶所有者数の推移
125,千九百九十二年十二月に完成したアホウドリの形をしたこの碑は、海で死んだ船員の魂はアホウドリになって空を飛んでいるのだという言い伝えや詩をもとにし
126,において、同法第四条ノ三第一項第四号中「船員」とあるのは「船員（労務供給船員（船員の雇用の促進に関する特別措置法（以下特別措置法ト称ス）第十一条第一項ニ規定スル労務供給船員ヲ謂フ以下之ニ
127,与える影響を、かつてないほど詳細になまなましく描写してみせた。マギーの報告は、船員から探鉱者となったパブロ・ヴァレンシアという四十歳の男性の経験をもとにしている。ヴァレンシアは
128,だな」坂下がバインダーを広げて葉山の方に差し出したが、葉山は船員の資格書類など見ても、何がなんだかさっぱり分からないので押し返した。船舶
129,者ⅲ監視又は断続的労働に従事する者で、行政官庁の許可を受けたものウ船員に対する特例船員法の適用を受ける職員については、同法の規定及び海上勤務の特殊性に
130,第３節船舶の安全な運航の確保１船員の資質及び技能の向上（１）ＳＴＣＷ条約の発効と実施体制の強化船員の
131,ほども気持ちを動かしはしなかった。そればかりか、女は早く行けとばかり船員を顎でうながした。「待ってくれといってるじゃないか。その船に
132,に向かっている。右近と同行した人々は右近と如安の一族ほかの人々で、船員を合わせ三百五十人と伝えられている。右近の一族は、妻のジュスタと娘一人、
133,、これからの船の世界はせちがろうなりますばい。すべてが合理化された海運界で船員だけが昔のままじゃ、すみまっせん。これからは船員費を抑えるため、東南アジア船員と
134,労働者及び船員の貯蓄金，すなわち，勤務先預け金の範囲は，現に雇用関係にある労働者又は船員の貯蓄金をいいます。したがって，勤務先に対する預け金であっても，労働者又は船員の家族
135,ゆえに不利益をこうむることのないよう必要に応じ援助を行つている。２．船員の犯罪及び事故出漁中の漁船及び外国航路の貨物船などの船員に係る殺人，傷害
136,そのあたりの中国船と同じ型であり、十四人いた乗組員はすべて中国人であった。船員のなかに海賊がいて、それを見た被害者が、水師に訴えて出
137,！やった、ついに大陸を発見したぞ！」コロンブス「（他の船員に耳打ちしながら）……おい、あとであの男をひそかに海に沈めてこい
138,同法第三十三条ノ十六ノ四第一項第一号中「該当スル船員」とあるのは「該当スル船員（労務供給船員ニシテ船員労務供給ノ役務ニ従事スル為使用セラルルモノヲ除ク）」と、
139,及び表示等の規制を受けることとなり，より詳細な輸送容器，運送方法及び放射能からの船員の保護等に関する規定は，国際海上危険物規定（ＩＭＤＧコード）で定められている。現在，ＩＭＯで
140,中で部屋に専用バスルームがあるのは、船長室とオーナー・ルームと医務室だけだ。残りの船員はそれぞれ、上級船員用か一般船員用のバスルームを共同で使うことになっていた。オーナー・ルームは、
141,生活の安定に資することを目的とする。（定義）第二条この法律において「船員」とは、船員職業安定法（昭和二十三年法律第百三十号）第六条第一項に規定する船員をいう。第二章
142,の新人賞に応募して二次予選で落ちた。虫歯を三本ぬいた。酔って北洋漁業の船員と大喧嘩した。社長の娘と見合いをした―」「へえ。ほんとに
143,ラルル場合ヲ除ク）ニ於ケル」と、同法第三十三条ノ十六ノ四第一項第一号中「該当スル船員」とあるのは「該当スル船員（労務供給船員ニシテ船員労務供給ノ役務ニ従事スル為使用
144,飛び出した無惨な射出口があった。後者はトゥマレフともみ合っているときに、黒髪の船員に背中を撃たれたものだった。ヘレンには、その弾が、もしコニエフ
145,ていた。そのためか小さな島に白菜を栽培し、キムチをつくりガロン缶に詰めて船員に配ったらしい。ロンドンからマドリッドに出張してスペインのワインでもお土産に持ち帰れ
146,それがいっそうきょうだいの絆を強くした。父親はワイン商で、七人の個性的な船員をまとめる寛大でユーモアのある船長だった。ヒトラーの登場以後家族が散り散りになって
147,かんれん【関連】○かかわること。かかわり。つながり。文例〈関連が深い〉父が船員だったので、船とは、子供のころから関連が深かった。♠〈関連
148,ことができる。（船員に対する適用除外）第二十七条この章の規定は、船員職業安定法第六条第一項に規定する船員については、適用しない。
149,のところ、確かなことは何ひとつわからない」そう言って、彼は死んだ船員の一人を爪先でつついた。「でも、このままのんびり埠頭まで歩いてもどれる
150,か微妙なところだ。「その中の何人かは、北から送り込まれた船員のはずだ」そうでなければ、ここまでやって来た意味がない。
151,（クラス委員長）の秋田くんの家に、木彫のフクロウ時計があった。秋田くんのおとうさんは船員で、めずらしいものがいっぱいあったが、なかでも、そのフクロウ時計がうらやましかった。
152,そのおかげで、小さな室の隅や、見えにくい個所から失神したり、骨折で立てない船員をさらに十名救い出せた。Ｕボート艦長は『まだか』と三度、いらだちながらうながした
153,まで働いてもらってきた協力者の職業をざっと挙げてみる。バーテンダー、ホステス、板前、船員、港湾労働者、ワッチマン、ストリッパー、ソープランド嬢、売春婦、運転手、暴力団組員、米国軍人、芸能関係者、ヒッピー
154,ケンカになったことがあった。そのときは、三せきの船の船員全部と、四せき目の船員の半分が大けがをした。その日から、その湖の名前は、デロン・ルーン湖から
155,するのである。橋にむかい進むハウランド号の前檣が橋桁に衝突するかと見えたとき、船員の一人が船首から橋へ飛び移った。「あれを見ろ」キャプテンがいう
156,くださる」彼女はみるからに重そうな膨れたトランクを船員におしつけた。船員が両手にそれを抱えてまごついているあいだに、彼女は作業員を押しのけ、ハイヒールを
157,日本船員の運航する日本船が一層重要な役割を果たすようにするため，技術革新に対応して船員がその能力を十分に発揮できるよう新しい職務体制，教育体制を整備する必要があり，運輸省で
158,アメリカ大陸発見を目指してがんばれ、コロンブス！マストの船員「（手をかざしながら）お！おーい！陸地が見えたぞ！
159,ない。一晩中、たえずいろいろな音がしていた。左側にいる男は―船員だろうと思うのだが―一時間に一回は目をさまして、悪口雑言をならべたあげく
160,のほか，外航海運においては，日本船舶への外国人船員の導入が拡大されるなど我が国の船員をめぐる雇用環境が変化していることを踏まえ，外国籍船への配乗を促進するなど日本人船員について海上職域を
161,た。（２）船員教育の充実船舶の航行の安全を確保するためには，船員に対する教育訓練を充実強化する必要がある。このため，海技大学校，海員学校及び航海訓練所の各船員教育機関では
162,押しのけ、ハイヒールをはいた足で舷梯を駆けのぼった。上甲板の踊り場では、船員が舷梯を取り外そうとしていたが、形相を変えてのぼってくる彼女に気づい
163,た。―昨夜射撃された線香虫といっしょに、汐留の倉庫にいた太ッちょの船員…。太ッちょは、喜美子と同じ方へ行く。―明らかに、喜美子を尾行
164,ノ三第四項中「該当スル場合ニ於ケル」とあるのは「該当スル場合（労務供給船員（船員の雇用の促進に関する特別措置法第十一条第一項ニ規定スル労務供給船員ヲ謂フ以下之ニ同ジ）ガ
165,適用する。この場合において、同法第四条ノ三第一項第四号中「船員」とあるのは「船員（労務供給船員（船員の雇用の促進に関する特別措置法（以下特別措置法ト称ス）第十一条第一項ニ規定スル労務供給船員ヲ
166,１海技大学校においては，上級の海技資格の取得等，船員の資質の向上のための船員の再教育を実施しているが，船員制度の近代化に対応した教育体制の整備・充実を図るため，
167,「職業訓練」とする。（給付金の支給等）第十九条国及び都道府県は、手帳所持者（船員となろうとする者を除く。以下この条において同じ。）がその有する能力に
168,トゥマレフを射殺するのに使った銃を取り上げた。トゥマレフに撃ち込んだ三発と黒髪の船員がコニエフに放った一発を合わせると、銃に残っている七．六二ミリ弾は弾倉内の三発と
169,をふりむき、「トランクよ！運んでくれたかしら」と叫んだ。船員がトランクを抱えて舷梯を登ってくる。それをみて彼女はほっとして表情
170,を受けることにより，自然，船，人との相互関係を通じて規律，指導力，忍耐力等の船員にとって不可欠のシーマンシップを体得する上で最適であることから再び帆船として建造されたものである。
171,原因は船員がみんな脚気で倒れてしまったことです。そのときは、とりあえず外国人の船員を雇って日本まで輸送してもらいました。なぜ、脚気にかかってしまったのか
172,万次郎は眼を見張った。船尾が橋を過ぎようとするとき、橋上の船員は滑車のハンドルをはなし、船に飛び乗る。滑車は反対に動き、橋板を
173,漁船もあったのだろうが、時代の流れで韓国、台湾さらにはフィリピン、中国と船員もかわっていった。私がロンドンにいた頃は韓国船員が多く、彼らは
174,舷梯を駆けのぼってくる。いっきに踊り場まで走りあがった青年は、彼女のトランクを抱えた船員を乱暴におしのけ、上甲板に走りこんだ。このため、船員はよろめき、あやうく彼女
175,。「この船はどこの船ですか？」「日本の船です。船員は休暇でみんな陸に上がっています」「そうですか」民生は彼女
176,となるべき若手船員の不足という状況も依然として懸念されている。また，船員の労働需給面をみてみると，有効求人数が３年４月には三千九十五人と対前年同月比三百四十九人（十一％）
177,たときは、その旨を官報で公示しなければならない。（船員雇用促進等事業）第八条船員雇用促進センターは、船員の雇用の促進等を図るため、次の各号に掲げる事業を行うものとする。
178,又は実習訓練により十分修得した船員を配乗させること等について指導を行った。３船員の労務管理体制の整備及び船員災害の防止船員災害防止活動の促進に関する法律（昭四十二法六十一）に
179,のような措置を講じた。１海技大学校においては，上級の海技資格の取得等，船員の資質の向上のための船員の再教育を実施しているが，船員制度の近代化に対応し
180,を図るための魅力ある職場づくりを進めるとともに，ゆとりある生活を実現するとの観点から，船員の労働条件等の一層の改善が求められており，必要に応じ，船員労務官による監査を活用し
181,一般の人と比べて、多少遅く設定してあります。なお、これらはすべて坑内員や船員としての実際の加入年数が十五年以上あることが条件で、男女の別はありません
182,で開ける。あんまりすぐに開けたもんだから、驚いたんだろう。緊張した顔の船員が目をまん丸に見開いてわたしたちを見つめていた。「ああ、ちょうどよかった
183,て覚えるのが特徴で、決して世に言う“オウム返し”ではない。ある船員が言っていた。「連れて帰って一番先に覚えたのは、親父
184,地方公務員，裁判官等について，関係法律の一部改正により，必要な措置を講じたところである。船員の育児や家族介護のための休業については，陸上労働者とは異なる特殊な事情を考慮し
185,実施するとともに，生存対策に関する講習会を開催するほか，船員労務官による監査，指導を行うことにより，船員の安全対策の強化を推進している。我が国の港に入港する外国船舶に対しては，「
186,が徴用され、終戦までに一万隻以上が敵の攻撃により失われた。記録されている船員の戦死者は約六万人で、商船船員の死亡率は三十．一四％。これは海軍軍人の死亡率二十一．一八％を大きく
187,含ム）」と、同法第十七条中「船員（以下船員ト称ス）」とあるのは「船員（労務供給船員ヲ含ム以下船員ト称ス）」と、同法第二十五条ノ二第一項中「船員法」とあるの
188,賤民廃止令）が出るまで、被差別部落のひとたちは漁業に従事することは許されなかった。船員として雇われることさえ、原則的には認められなかった。高知県内にある七十三部落のうち
189,ことです。和歌山県沖の海で，イギリスの商船ノルマントン号がちんぼつしました。このときイギリス人の船員は，全員ボートでのがれて助かりましたが，日本人の乗客は，全員がおぼれ
190,，海難防止に関する民間組織の充実強化を図る。第３節船舶の安全な運航の確保１船員の資質の向上（１）ＳＴＣＷ条約の実施体制の充実「千九百七十八年の船員の訓練
191,方、佐津子の方と若様を大坂から無事連れもどし、戸田の奥方や安針殿も、船員ともども連れ帰りたいと思っておりましたが、不運なことに、残念ながら、大坂で
192,。この場合において、同号中「使用される者」とあるのは「使用される者（船員の雇用の促進に関する特別措置法（以下「特別措置法」という。）第十一条第一項に規定する労務供給船員
193,内航海運においては，有効求人倍率に示されるとおり船員不足状況を呈しており，若年労働力を始めとした船員の確保が急務となっているが，必ずしも十分でなく船員全体の年齢構成も高くなってきている
194,を受けることその他その者の再就職を促進するために必要な事項を指示することができる。（船員となろうとする者に関する特例）第十八条船員職業安定法（昭和二十三年法律第百三十号）第六条第一項に
195,にされ、対岸の稲佐にある蔵に出帆まで保管されるので、武装解除された船員、マタロスたちは従順だ。しかし浦は、彼等の青い目のなかに、恐れを
196,太平洋が合流するホーン岬周辺は、昔から危険な難所といわれ、夥しい数の船や船員が海の犠牲になっている。地理にくわしいひとが、そこから右手に見える
197,安定を図るため，六十三年６月三十日までに離職した者に限るとされている「船員の雇用の促進に関する特別措置法」に基づく就職促進給付金の支給に関する特別措置を７年延長する改正を，また
198,の推進１船員雇用対策の推進（１）雇用環境の深刻化（低水準の有効求人倍率）船員をとりまく環境は，外航海運業にあっては長期不況に円高も加わりその状況が一層深刻化し，
199,が船首から橋へ飛び移った。「あれを見ろ」キャプテンがいう通り、船員は橋上に設けられた滑車のハンドルを手早く廻す。橋の一部分がたちまち後退し
200,ひとつそれに従って措置をさせていただきたいと思っております。○塚田委員坑内労働者及び船員の方々の泣き声が聞こえてくるような感じなんですけれども、今申し上げたように
201,にはいくつか娼館が並んでおり、その向かいの通りには酒場も数え切れない。船員はここで疲れを癒すのが常だった。飲んだくれた船員たちのだみ声や、
202,に、北朝鮮、いわゆる朝鮮民主主義人民共和国の警備艇に石川県のイカ釣り漁船が銃撃を受けて、負傷した船員が死亡するという事件がございました。この問題についてお尋ねいたします。非常に不幸な事件
203,このトランクを持ってくださる」彼女はみるからに重そうな膨れたトランクを船員におしつけた。船員が両手にそれを抱えてまごついているあいだに、彼女は作業員
204,をつけてくださいよ」一等航海士は彼女と青年にけわしい表情で注意すると、踊り場の船員にむかって舷梯をはずすように手をふって合図した。船員は舷梯を
205,わけだ。「中の様子はどうだ？」「なかなかいい船だ。船員もよく訓練されてる」「どこでそう判断できるんだ？」「船の中
206,をめぐる経済事情及び国際環境の変化等による事業の規模の縮小等に伴い離職を余儀なくされた船員であつて再び船員となろうとするもののうち政令で定める者の就職を容易
207,。陸兵と船員はつねに対立し、船員の士気が低かった。一方、イギリス海軍は船員が主役だった。砲戦の成否が、船をどのようにして砲撃に有利
208,一人残らず海中に放り出された。完全に停止し火災になると、操舵室からも船員が逃げ始める。また一発、対戦車ロケット弾が飛来、最上階の階段部分を直撃する。船体の一部
209,聞かして下さい。ねえ、今ひきゐてゐる兵力で以て、フランスの防備を切破り、船員を徴発した際に予期したゞけの成績が挙げ得られるだらうか？スクル大丈夫でござい
210,ニューヨークにおもむいた。港湾作業などに従事して働き、「タスケニ号」という蒸気船に船員として乗組み、大西洋を横断、イギリスのロンドンについた。その地で、初めて父あて
211,の遠山大介氏（五十八）は、商業捕鯨の経験もあり、「あのころは船も船員も多く、港も活気があった」と当時の活況ぶりを振り返る。「調査捕鯨
212,に飛び移ると、人を小馬鹿にした顔をこちらに向けてにやにや笑った。船員ばかりか、乗りこんでいる乗客全員が、珍奇なものでも見るような目を向けてい
213,科を新設し，部員の職員化の促進，さらには陸上でも活用できる訓練コースを充実する等，船員の職域拡大を図るための教育体制の整備を図った。また，航海訓練所では，船員制度近代化
214,。俺たちはあまり歓迎はされていないし、協力的な態度は望めないだろう。船員の行儀が良すぎるのはちょっと気になるが、単に船長が厳格なだけかもしれない。
