,0
0,。）、都道府県及び市町村」とする。２その地域内に居住する求職者のうち、船員となろうとする者の占める割合が相当程度のものである地域に係る地域雇用開発計画及び地域雇用創造計画
1,の本拠地に置くのが原則です。少ない例ですが、常に船舶内に住んでいる船員は、港（船舶の定けい港所在地）が住所になるんですよ。特集なるほどなっとく食中毒よく
2,この法律において「船員」とは、船員職業安定法（昭和二十三年法律第百三十号）第六条第一項に規定する船員をいう。第二章就職促進給付金（就職促進給付金）第三条政府は、他の法令の規定に
3,，船体に存在する欠陥による事故，積荷・属具等の積込み・荷卸し・積替え中にこれらの作業によって生じた事故，船員または水先人の故意または過失，修繕者または用船者の過失，原子核の分裂・融合等によって生じた有害
4,変化等による事業の規模の縮小等に伴い離職を余儀なくされた船員であつて再び船員となろうとするもののうち政令で定める者の就職を容易にし、及び促進する
5,れる。そこで、建設労働者らは真っ先に敵からの攻撃の危険に晒されるだろう。船員と有事法制Ａ君「輸送」についてはどうかな。Ｂ君まず、海上輸送の分野
6,、彼女も同時に身をひるがえして、タラップからここまで案内してきた黒髪の船員に飛びかかっていった。耳を聾する銃声が三発轟いた。たてつづけに二発、
7,「待ってくれ。その船に乗るんだ」大きな声でさけんだ。女と船員、ふたりがこちらを見たがそれだけのことだ。露ほども気持ちを動かし
8,（船員労務供給事業の実施に関する基本的事項）第十一条船員雇用促進センターが行う船員労務供給事業は、船員労務供給の対象となる船員（以下「労務供給船員」という。）として船員雇用促進センターが雇用する者について行う。ただし、その
9,漁業に従事していた者であつて船員職業安定法（昭和二十三年法律第百三十号）第六条第一項に規定する船員となろうとするものがその有する能力に適合する職業に就くことを容易にし、
10,の船が出入りすると言われるニューヨークに行くべきだ、と考えた。かれはふたたび船員として雇われ、メキシコ湾から大西洋に出て、ニューヨークにおもむいた。港湾作業などに
11,の促進等を図るため、次の各号に掲げる事業を行うものとする。一船員に係る求人の開拓その他船員の職域の開拓を行うこと。二船員職業紹介（
12,に関する特例）第十八条船員職業安定法（昭和二十三年法律第百三十号）第六条第一項に規定する船員（以下「船員」という。）となろうとする一般旅客定期航路事業等離職者に関しては、第十六条第一項中「公共職業安定所長」とあるのは
13,定めるところにより、公共職業安定所長に委任することができる。第六章罰則第二十六条第九条又は第二十条第三項において準用する船員の雇用の促進に関する特別措置法第六条の規定による報告をせず、又は虚偽の報告を
14,，複雑な運航管理形態を有するものや，我が国周辺海域の地形，気象，海象等に不案内な船員を配乗したもの，老朽化したもの等が増加する傾向がみられる。例えば，平成十年
15,は約十五万人と対前年比約八千人（５％）の減少となお厳しい船員雇用情勢となっている。さらに，船員の年齢構成をみてみると，一般に高年齢化の傾向は変わらず，海技伝承の受け皿と
16,。まず、厚生年金、第三種被保険者にかかわる事項でございます。これは、坑内労働者であるとか船員とかいうような、作業環境が極めて厳しく、他の産業に比べましても高い
17,，積付け及び表示等の規制を受けることとなる。より詳細な輸送容器，運送方法及び放射能からの船員の保護等に関する規定は，国際海上危険物規程（ＩＭＤＧコード）で定められている。現在，ＩＭＯで
18,による監査を活用しつつ，その推進を図ることとしている。なかでも，船員の労働時間の短縮は極めて重要な課題となっており，その意義，必要性について関係者の
19,なコマンドたちを少佐の思惑で危険にさらすことはできない。テロリストたちはすでにフレイア号の船員を一人、殺しているのだ。本省も明確に指示しているように、砲を使って
20,，操船，荷役等に関する特殊性及び就航する航路状況等に精通している者又は実習訓練により十分修得した船員を配乗させること等について指導を行った。３船員の労務管理体制の整備及び船員災害の
21,、呼びかけたりしている。「お乗りになるのですか」舷梯のそばにいる船員が彼女を抱きとめ、声をかけた。「そうよ。あなた、このトランクを
22,、幕末期の唐人貿易は、在唐荷主の経営力が弱体化したため、実際、多くの部分が船員（とくに下級船員）によって行われた。とすれば、貿易利益の相当な部分が船員個人
23,とおりかなりの改善が見られた。このため，船員中央労働委員会の答申を経て，船員についても船員法の改正により労働時間の短縮を図ることとした。その具体的内容は，
24,同条第八項に規定する船員労務供給及び同条第十一項に規定する船員派遣をいう。以下同じ。）その他船員の就職の奨励に関する事業を行うこと。三船員の知識又は技能の習得及び
25,基づいて発する命令の規定を適用する。この場合において、同法第四条ノ三第一項第四号中「船員」とあるのは「船員（労務供給船員（船員の雇用の促進に関する特別措置法（以下特別措置法ト
26,ている。２．船員の犯罪及び事故出漁中の漁船及び外国航路の貨物船などの船員に係る殺人，傷害，その他の刑事事件は七十七年中に十二件十四名であり，また死亡，
27,ているが，この基本計画を円滑かつ効果的に実施するため，昭和六十年度船員災害防止実施計画を作成し，船舶所有者，船員及び国が一体となって船員災害防止対策を推進した。４水先制度の充実水先制度と
28,に対し，助成を行った。（事業費二十四万九十四千円国費十八万千八百三十九千円）（４）船員の労働災害防止のための教育運輸省においては，日本短波放送により船員等に対し安全衛生指導を行った。
29,であり続けた。それにスペイン艦隊では、陸兵が戦闘の精華であったから、船員を軽蔑し、優越感をもって振る舞った。陸兵と船員はつねに対立し、船員の士気が
30,が，この間技術革新の進展等を背景に，船員の就労の態様が大きく変化するとともに，船員の労働条件の水準も労働協約の内容等に見られるとおりかなりの改善が見られた。
31,定めるもの２就職促進給付金の支給に関し必要な基準は、国土交通省令で定める。３船員の雇用の促進に関する特別措置法（昭和五十二年法律第九十六号）第四条から第六条までの規定は、
32,いうことも踏まえまして日本船主協会及び全日本海員組合から政府に対しまして、航行の安全及び船員の人命の安全という趣旨で政府に対する配慮要請というものが出されてきたと承知しており
33,は「鹿丸」（または「大鹿丸」）といい、船頭左太夫をはじめとする九人の船員が乗り組んでいた。運命の航海の始まりだった。新居というのは、今日
34,船員の資格証明に関する基準に適合しているかについての監督を実施している。このうち，特に船員の資格証明に関する監督については，全国一斉の集中的な監督を行い，その実効を期している
35,や呂宋へむかう明国のジャンクを捕獲して平戸に帰投する。だが、艦隊の経費や船員の給料に見合う利益は得られなかった。また平戸のイギリス商館は、松浦藩に多額
36,の変化等により離職を余儀なくされる船員の数が増大していること等の状況にかんがみ、船員の雇用の促進に関し必要な措置を講ずることにより、船員の職業及び生活の
37,船員の労働時間の短縮等と船員災害防止対策の推進（１）船員の労働時間の短縮等船員の確保を図るための魅力ある職場づくりを進めるとともに，ゆとりある生活を実現するとの観点
38,が麻痺していて味は感じなかった。「乗組員はどうだ？」「船員の資格書類も揃っているし…特に問題はなさそうだな」坂下がバインダーを
39,に大変だよね。風だとか海流だとかを見て、大勢の船員を指揮し、帆や舵を操るわけでしょ。並大抵の人じゃ勤まらない仕事だわ
40,。そのため、上陸するまで毎晩、演芸会をやっていました。日本からきた船員はいい服装をして、アコーディオンの伴奏に合わせて、最新の流行歌をうたったり
41,の訓練及び資格証明並びに当直の基準に関する国際条約」（ＳＴＣＷ条約）に規定されている航海当直及び船員の資格証明に関する基準に適合しているかについての監督を実施している。このうち，特に船員
42,開けて外のようすをチラッと見て、すぐにドアを閉めた。「船員だ。船員たちが武器を持って行ったり来たりしてる」「武器ですって
43,、当該勤務を命ぜられた時間をこれらの規定により割り振られた勤務時間とみなす。（船員の勤務時間の特例）第十一条各省各庁の長は、船舶に乗り組む職員（再任用短時間勤務職員を除く
44,ソ連当局に拿捕され、船長を始め船員全部がソ連当局に収容されたという。後に船員は全員釈放され、日本を経て帰国したが、船長だけは実刑を受け、
45,たとき帰省のため乗船していた陸軍幼年学校の生徒だけが靖国神社に祀られ、同乗していた船員や民間人は遭難死扱いでした。何故だか分かりますか、幼年学校の生徒は軍人
46,十七歳になっていたかれは体力に自信をもっていたので、肉体を駆使して船員として生活したいと考え、各国の船が出入りすると言われるニューヨークに行くべきだ、
47,？あいつ」「この方に助けてもらったみたいで」居合わせた年配の船員に、順平は軽く会釈した。船員は二人に向かって、話の続きをし始める
48,現在のタイ国のアユタヤには日本人町もあった。まだ幼い時、大きな船の船員をしていたという父の話の中に、今バタビアの風物などがあった
49,、艦隊を組んで太平洋を横断したものの日本に戻れなくなったのです。原因は船員がみんな脚気で倒れてしまったことです。そのときは、とりあえず外国人の船員を雇っ
50,の健康を保ち，長期化する職業生涯を充実させるため，リフレッシュ休暇制度の普及促進等勤労者リフレッシュ対策を推進している。船員については，平成元年から順次法定労働時間の短縮を図ってきたが，十三年度においては漁船員について
51,のは困難となっており，新しい近代化船のあり方について検討が開始されている。３船員の労働時間の短縮等と船員災害防止対策の推進（１）船員の労働時間の短縮等船員の
52,船員制度を円滑に実施するための体制の整備を行うとともに，ＳＴＣＷ条約に規定する外国船舶の当直体制及び船員の資格に係る監督の推進を図った。（２）船員教育の充実船舶
53,なろうとする者に関する特例）第十八条船員職業安定法（昭和二十三年法律第百三十号）第六条第一項に規定する船員（以下「船員」という。）となろうとする一般旅客定期航路事業等離職者に関しては、第十六条第一項中「公共職業安定所長」
54,入り、『大日本史』の編纂に従事した。千八百二十四（文政七）年、英国の船員が水戸領大津浜に無断で上陸した時、正志斎は筆談役として英人との交渉を通じて、彼ら
55,、第一班、猿股、パンティ、ソックス等下着メーカーおよび販売元を捜査する遺留品捜査班。第二班、暴力団関係者、テキ屋、船員、家庭状況の乱れている者、私生活の荒れている者、素行不良者、病院関係者、サウナ、
56,強化船員の知識及び技能に関する国際的な最低基準の設定を内容とする「千九百七十八年の船員の訓練及び資格証明並びに当直の基準に関する国際条約」（ＳＴＣＷ条約）は，昭和五十九年４月に
57,に祀った。これが媽祖信仰の起源であり、十一世紀前半には、この地域に多かった船員や水夫、航海業者たちの守護神と習合して、航海神となったというのである。媽祖以前
58,」「いいから、行って」女がとげとげしい声で船員にいった。船員はフェリーに飛び移ると、人を小馬鹿にした顔をこちらに向けてにやにや笑っ
59,者の行う技能訓練の援助を行うこと。四前三号に掲げるもののほか、船員の雇用の促進及び安定のために必要な事業を行うこと。（船員職業紹介事業についての
60,人は、炭鉱とか金属鉱山とかいろいろありますけれども、みんなやめますよ。船員だってそうです。一回やめるのです。これらの人は、なかなか過重な労働ですから
61,引き受けています。もともとＰすなわちＰｒｏｔｅｃｔｉｏｎとは，船主の第三者に対する責任と雇用主としての船員に対する責任の保護を，またＩすなわちＩｎｄｅｍｎｉｔｙとは，貨物の運送人としての船主の
62,十八か国が参加国となっている。）。パリＭＯＵは，海上人命安全条約（ＳＯＬＡＳ条約），千九百七十八年の船員の訓練及び資格証明並びに当直の基準に関する国際条約（ＳＴＣＷ条約）等の海事関係条約及び商船における最低基準
63,の陸上への受入れについては，閣議了解により原則として受け入れないこととされており，船員についてもこれを準用して日本船であって日本の船社が配乗権を有するものについては原則
64,について関係者の理解を深めるとともに，適切な指導等を行うことにより推進する必要がある。船員の労働時間は，船員法に基づき，現在，週平均四十八時間と定められているが，週平均四十時間制
65,も加入したものとする３３種十五年以上であった人は六十歳前から受給できる坑内員や船員、つまり第３種被保険者として厚生年金に加入した人に対しては、その特殊な労働環境に配慮して、
66,その仲仕になぐられたものと早とちりしたのがそもそもの事件の発端となり、船員と仲仕が総出で入り乱れての大乱闘となったまではよかったが、その途中
67,ジュゼッペ・ガリバルディは、当時四十二歳、傑出した才能をもつ遊撃隊司令官であった。船員の息子であった彼はニッツァ〔ニース〕に生まれたが、この地はナポレオンによって
68,要件等について新たな基準を設け，船舶職員法において海技免状の更新制度，免許講習制度等の導入を行い，船員の資質及び技能の向上並びに最新化を図った。昭和六十年度には，前年度に
69,大きな茶色のものが顔に向かってくる。ちゃんと目をあけて見ればそれは船員の足で、ベッドから突き出して、わたしの顔の真ん前まで来ていたのだった
70,助けてもらったみたいで」居合わせた年配の船員に、順平は軽く会釈した。船員は二人に向かって、話の続きをし始める。「本人は落っこちたなんて言っ
71,あり。船乗りがそう言われていたのは、昔のことだ。今は、船員もサラリーマン化してしまって、陸で働く人間と変わりなくなっている。それでも、家を長く空け
72,。以下同じ。）その他船員の就職の奨励に関する事業を行うこと。三船員の知識又は技能の習得及び向上のための訓練（以下「技能訓練」という。
73,に産業政策に影響する。通産省はいない、運輸省もいないけれども、海員だって船員だって同じだ。せっかく五十五歳というのを残してくれておるんだけれども、だんだん年金額が
74,作業に従事しない期間」とあるのは「第八十七条第一項本文又は第二項本文の規定によつて船員労務供給（船員の雇用の促進に関する特別措置法（以下「特別措置法」という。）第八条第二号に規定する船員労務供給
75,の哀感が切々と伝わってきた。花咲ガニがぎっしり入ったカニ籠を上げる美沙緒丸の船員（ユルリ・モユルリ島近海）二風谷有情沙流川は日勝峠を挟む日高山脈の熊見山と沙流岳を水源とし、
76,よう声をあげた。アラブ人の妾たちが走って来て、ボートに乗った。船員は客船の名を大声で叫び、これが最後のボートだと伝えた。
77,空けて、いろんな国に行く仕事だから、女性が出来てしまう人もいて、船員の妻が、母のところによく泣きついてきていた。子供の頃は、
78,のあいだ火をともして、海からやってくる船の目印とするんだ」船員は南手の陸地の先端の岩場を指さす。「あそこに大きな蔵があるだろう
79,家族介護のための休業については，陸上労働者とは異なる特殊な事情を考慮した上で，船員についても育児・介護休業の定着を図るよう努めている。第２‐６‐２表育児休業，介護休業等育児又は家族介護を
80,の強化を推進している。我が国の港に入港する外国船舶に対しては，「千九百八十七年の船員の訓練及び資格証明並びに当直の基準に関する国際条約」（ＳＴＣＷ条約）に規定されている航海当直及び
81,目の前の河向うは港に近いせいか、小家が密集し、そのなかには船員や町の男を相手にする女たちの店も沢山あると聞いていたが、
82,よくうたった記憶があります。引揚船に乗ってからは、日本からきた船員が、いま日本ではこういう歌が流行っているといって、『リンゴの唄
83,に関する特例）第十八条船員職業安定法（昭和二十三年法律第百三十号）第六条第一項に規定する船員（以下「船員」という。）となろうとする者に関しては、第四条第一項並びに同条第三項及び第四項
84,労働者又は船員の貯蓄金をいいます。したがって，勤務先に対する預け金であっても，労働者又は船員の家族の預け金，法人の役員の預け金，退職者の預け金等は利子所得でなく雑所得と
85,１船員の資質の向上（１）ＳＴＣＷ条約の実施体制の充実「千九百七十八年の船員の訓練及び資格証明並びに当直の基準に関する国際条約」（ＳＴＣＷ条約）を受けて，船舶職員の
86,を含む。以下同じ。）」と、「船員の労働関係」とあるのは「船員の労働関係（特別措置法第十四条第四項に規定する労働関係を含む。）」と、同法第百十三条中「労働協約
87,水夫長、運転士と漸次累進して、甲種船長の免状を持っており、日露戦争では御用船の船員として勲六等旭日章をもらっていた。白瀬は野村の採否は即答しなかったが、
88,之ニ同ジ）ヲ含ム）」と、同法第十条中「船員」とあるのは「船員（労務供給船員ヲ含ム）」と、同法第十七条中「船員（以下船員ト称ス）」とある
89,用意などしてこなかったので、防寒具にしろ食糧にしろ、これは大変な事態である。船員のうち二人が発狂した。ほとんどが壊血病になり、そのため三人が死んだ。
90,，平成３年度については，十月１日現在である。（船員教育機関の改善）近年の海運界における船員の需要構造の変化や若年層の生活意識の変化を踏まえて，社会的ニーズに的確に対応できるよう
91,時々来る奴の友達のフィリピンを今日本牧埠頭で見た。あいつはブラッドエバレットの船員だ。俺達の会社でその船の荷役をやっているんだが、このごろ税関の動きが
92,令２）。（１）労働基準法第十八条又は船員法第三十四条の規定により管理される労働者又は船員の貯蓄金（２）国家公務員共済組合法第九十八条，地方公務員等共済組合法第百十二条第１項に規定する組合に対する組合員の貯金又は
93,ものだ…もう飽きるほどやってきた。オランダを出発して以来、この航海だけで船員のために百回以上もやっている。とうとう生きているのは、バッカス、ヴァン・ネックと、坊や
94,、止め金で手すりに固定した。その間に彼女はトランクを運んできてくれた船員からトランクを受けとった。「ありがとう」彼女は礼を言った。ば
95,であり、気軽なハイキングになっているようだ。標高二百三十二メートルのダイヤモンド・ヘッドは、イギリスの船員がそこで見つけた石をダイヤモンドと勘違いしたことがその名の由来と言われ
96,船舶が行っているということは日本の関係の船会社なりあるいはそれに乗り組んでいる日本人の船員がそこにおるわけでございまして、そういうことも踏まえまして日本船主協会及び全日本海員組合
97,「船員」とあるのは「船員（労務供給船員ヲ含ム）」と、同法第十七条中「船員（以下船員ト称ス）」とあるのは「船員（労務供給船員ヲ含ム以下船員ト称ス）
98,新基準設定のための第１次討議が行われた。第六十二回（海事）総会では，「船員の雇用継続に関する条約」（第百四十五号）及び勧告（第百五十四号），「船員の有給休暇に関する条約
99,に引き続き，技術革新の進んだ近代化船に乗り組む運航士及び船舶技士の制度に対応した優秀な船員を確保するため，次のような措置を講じた。１海技大学校においては，上級
100,なろうとする者に関する特例）第十八条船員職業安定法（昭和二十三年法律第百三十号）第六条第一項に規定する船員（以下「船員」という。）となろうとする者に関しては、第四条第一項並びに
101,第八十七条第一項又は第二項の規定によつて作業に従事しなかつたこと」とあるのは、「船員の雇用の促進に関する特別措置法第十四条第一項の規定により読み替えて適用される船員法（昭和二十二年法律
102,１万三千三百円に据え置く。ハ厚生年金保険の費用負担保険料率を、今回の改正では、千分の百七十三．五（船員および坑内員については、千分の百九十一．五）に据え置く。９標準報酬の上下限の改定二千年十月
103,では，「船員の雇用継続に関する条約」（第百四十五号）及び勧告（第百五十四号），「船員の有給休暇に関する条約」（第百四十六号），「商船の最低基準に関する条約」（第百四十七号），
104,な事項は、命令で定める。３第一項の規定により厚生年金保険法第六条第一項第三号に規定する船員とみなされる労務供給船員は、国民年金法等の一部を改正する法律（昭和六十年法律第三十四号）（以下
