,0
0,従業員の忘年会は二日前にすんでいるし、仕事が上がった者から帰宅することになる。調理室の脇の通路で、エリ子は光沢浩一と鉢合わせをした。上板や中板という板前たち
1,９そば打ち日時：十一月６日・十三日（木）午前９時三十分〜午後１時場所：ハクレン館（調理室）費用：五百円（材料費受付時集金）定員：各三十人十閉講式・講演（市町村合併について）ほか
2,門前会館にエレベーターを設置するなどの工事を行っており、そこに公民館機能を集約する予定である。調理室の設置についても対応したいのでしばらく待って欲しい。・保育所の民営化について
3,口のなかでそう呟いた。彼は一階に降りると、調理室へ入った。調理室は、ごった返していた。ニンニクの臭い、油のこげる臭い。土間には、いたるところ
4,も！調理室とランチルームは、可動パーテーションで仕切ることもできます。【面積】・調理室百三ｍ２・ランチルーム五十五ｍ２【料金】１時間千円（営利宣伝利用五千円）【施設概要・備品
5,でうちはお菓子作りとベリーダンスをやった。友達も一緒って言ってたので、いざ調理室に行ったらいなくて（笑）うちだけ前半と後半のコースが逆だった
6,に変わります。白く塗られていない「紫外線灯」もあって、食品工場（給食の調理室でも）などで、殺菌用に使われたりしています。参考ＵＲＬのところで、
7,気配りロンドン市内の公立中学校「ノースウエストミンスターコミュニティースクール」。午前十時前、十人ほどの給食担当の職員が、調理室で準備に追われていた。その一人、ブレンダ・チェンバレンさん（五十七）は言う。牛肉
8,３人目）と入賞した生徒ら＝宜野湾市の沖縄カトリック中学迅速な連携を披露十一管など合同消火救助訓練「調理室から出火した！」船体中央から煙が上がり、救命胴衣を着た乗組員が続々脱出―
9,項目は、以下のようになります。○配食エリア、配食数に見合った、体制、調理室、食器が確保されているか○メニュー、衛生管理、食材の購入方法、特別食に関する対応の
10,ランチルームで！皆さんでうきうきランチタイム、いかがですか？もちろん、ディナーでも！調理室とランチルームは、可動パーテーションで仕切ることもできます。【面積】・調理室百三ｍ２
11,宿から５分のところに高野崎キャンプ場がある。食事は、以前の家庭科室がそのまま調理室として使われており、そこで調理ができる。新鮮な海の幸を存分に味わっ
12,くるのか、デッキにとどまっているのか？チューがチーク材の階段を無視して調理室に踊り込んできた。無線が雑音を立てている。チューはそれを壁からもぎ取った
13,４旅客機の調理室というのは、ひどく原始的なところで、冷蔵庫がありません。だからアイス・クリームのよう
14,言った。「そのほうが彼の体にもいい。さて、それじゃワインを調理室に運ばせてちょうだい。仕事に取りかかるから」
15,。「あれもらってこい」「これもらってこい」といわれてギャーリ（調理室）にオカズをもらいにいく。すると料理長にどやしつけられる。最初、「目玉焼きもらって
16,れ、ポンプで汲み上げた海水をホースでかけて海綿でこすられた。わたしは調理室に行き、調理人と炊事班に食事についての指示を出していると、足元の甲板が
17,）から来年３月末まで休館します。地域振興課☎（八百六十六）二千三十六鍋パーティーはいかが？アルヴェの調理室をご利用ください鍋物がおいしい季節になりました。今年の秋は、仲間と一緒
18,、地下鉄駅前のビルの二階という好立地。約四百六十平方メートルのフロアは、床暖房の入った保育室や調理室などに仕切られ、裸足の子どもたちが元気に走り回っている。全国初の企業経営の認可保育所「さくら保育園」
19,教室、特別教室、多目的スペース、屋内体育館、屋外プール、地域開放会議室、幼稚園二クラス、社会教育館では、多目的ホール、調理室、会議室、和室、温水プールがセットされている。学校は、ハード・ソフト両面から、地域の
20,「何があるか見てみよう」彼はサラのあとについて、船や飛行機の調理室のようなミニキッチンへ行った。彼女が上に手を伸ばして戸棚を開けた
21,、外を覗く。『寿太郎』の建物全体が、闇の中に沈んでいた。調理室の窓も、薄暗くなっている。用意しておいた手袋、ロープ、古いレインコートを持って
22,金）午後１時三十分〜４時※受け付けは午後１時十五分〜場所＝桜馬場地区ふれあいセンター調理室※駐車場なし定員＝十五人（申し込み多数の場合は抽選）参加費＝四百円持っ
23,家屋（区分所有建物についてはその人が区分所有する部分に限ります。）のうち居室、調理室、浴室、便所、洗面所、納戸、玄関、廊下の一室又は壁の全部について行う
24,２・ランチルーム五十五ｍ２【料金】１時間千円（営利宣伝利用五千円）【施設概要・備品】・調理室調理台７台（うち１台は昇降式で車椅子にも対応）、大型冷蔵庫、スチームオーブンレンジ、ミキサー
25,海の幸を存分に味わってみよう。その隣りには綺麗な食堂もある。調理室、食堂では、地元のおかあさんたちと交流でき、素朴で温かい雰囲気で食事も楽しくなる
26,で後ろに吹っ飛んだ。ハッチのへりにぶちあたり、ぶざまな格好で階段を転げ落ち、調理室へと転がりこんでいった。床に激突する。しかも、折れた指が体の下敷きに
27,巻きつけ、小さなタオルでターバン状に髪を包んだ。そしてどんな食べ物があるか調べに調理室へ下りていった。食料は宴会ができるくらい豊富にあった。スモークサーモンに
28,鍋物がおいしい季節になりました。今年の秋は、仲間と一緒にアルヴェの調理室で鍋料理などを作ってみませんか。アルヴェの調理室は、調理器具や食器、ＩＨクッキングヒーター
29,て眠る。大半は黒人かプエルトリコ人プエルトリコ系で、年七千ドルか一万ドルの給料をもらって、調理室や機関室のうだるような熱のなかで働く。隔離された十一の層を甲板下
30,魚のおろし方講習会日時＝十一月二十六日（水）午前十時〜午後１時／場所＝西公民館調理室／講師＝（社）長崎魚市場協会会員／定員＝二十五人（申し込み多数の場合は抽選）／受講料…百円
31,成長した２地理的にも近く、約四十万人のルーマニア出身ユダヤ人社会がある―からだ。レストランの調理室で働くコンスタンティンさん（二十六）のようにイスラエルに来てから１年という短期滞在者も多い。
32,、自転車、徒歩などさまざまです。配達方法も、区域内の何か所かに拠点を設け、調理室から拠点までは自動車で運び、そこから自転車や徒歩で運ぶなどいろいろと考えられ
33,、職員五人が負傷した。医師や看護婦、患者には被害はなかったものの、調理室、洗濯室、水道施設が破壊され、手術室をはじめ爆風をうけたすべての部屋の窓ガラスが
34,、ファースト・クラスの客席のなかへ運びだされました。ゴクウスが、裕美と一緒に調理室を出て様子を窺っておりますと、ハアーイのユッコが、かんだかい声で、
35,でも活用できるようにすることなど大いに検討していきたい。○学校施設・設備を開く（音楽室、調理室、集会所、和室等の特別教室、体育館、校庭、プール、クラブルーム等の体育施設、パソコン機器等の
36,：６月二十六日（木）、７月３日（木）午前９時三十分〜午後１時場所・ハクレン館（調理室）費用：五百円（材料費受付時集金）定員：各二十五人４人権学習（講話・ビデオ上映）日時：７月十日
37,や食器などは施設で貸し出してくれる。学習施設は図書室、研修室、談話室、体育館、調理室、食堂などがある。宿泊棟は宿泊室４室に浴室を完備している。グランドでは
38,別府市の学校給食▶調理方式…小学校（幼稚園含む）は、東山を除いて各校での調理室で（自校調理方式）、全中学校と東山幼・小は学校給食共同調理場で調理▶栄養の基準…１日に必要
39,使って「運動会成功パーティー」で、ホットケーキを作った。エプロンと三角巾を付けた。すぐ調理室に行って、準備室から必要な泡立て器などを持ってきた。その道具を水
40,はまことしやかに聞こえる。とくに新聞の活字になればなおさらだ。からのビール缶を調理室の流しめがけて放りなげ、立ちあがってそれを床から拾いあげにいくと、冷蔵庫からもう
41,た。大型のスパナは昼間のうちに、運転席の足元に置いてあった。調理室へ、忍び込んだ。調理室の入口の鍵は、会計係としてエリ子もスペアを預かっている
42,はここで食べたらきっと楽しい！▲親水広場▲なかよし広場お得情報調理室ガイド（動物の食事を作る調理室を案内してくれる）やクイズラリーなど、イベント有り所在地市川市大町二百八十四番地電話３３８‐１９６０アクセスＪＲ本八幡駅北口・ＪＲ大野駅
43,組み、「止むを得んな、最後の手だ」そういって、調理室のオーブンのほうをちらりと睨んだ。「カゲキ、このオーブン、四百度に温まる
44,きょとんとしている。ヘイタイ・チーフは咳ばらいをして、自分でワゴンを押して、調理室のほうに戻ってきました。ヘイタイ・チーフは、調理室に入るなり、「
45,などといって、岡本が譲った席にコアラをすわらせ、自分の食事を調理室から運んできた。「あらあ、このステーキ、なんか焼き過ぎみたいよねえ。
46,と鉢合わせをした。上板や中板という板前たちも、すでに調理室から出ていた。調理室では当番の中板をはじめ下板たち、パートの従業員たちが洗いものに精を出している。
47,て、映画の上映が始まりました。映画の上映が始まると、乗務員は調理室の横手、カーテンで仕切った、クルー用シートに集って食事をとります。ゴクウスは
48,については、事前登録が必要です。利用時間：午前９時〜午後９時調理室・ランチルーム調理室でお料理を。できたてをランチルームで！皆さんでうきうきランチタイム、いかがですか？
49,ん。（６）調理原則としてメニューにもとづき、配食サービス事業者が調理します。専用の調理室があればいいですが、そうでない場合は、施設が確実に利用できるようにしておか
50,昼間のうちに、運転席の足元に置いてあった。調理室へ、忍び込んだ。調理室の入口の鍵は、会計係としてエリ子もスペアを預かっている。調理室にはいり込むことは
51,としてエリ子もスペアを預かっている。調理室にはいり込むことは、いとも簡単である。広い調理室を、薄暗い常夜灯が照らしている。勝手知ったる調理場の中で、光沢浩一の柳刃包丁が
52,、忍び込んだ。調理室の入口の鍵は、会計係としてエリ子もスペアを預かっている。調理室にはいり込むことは、いとも簡単である。広い調理室を、薄暗い常夜灯が照らしている。
53,でワゴンを押して、調理室のほうに戻ってきました。ヘイタイ・チーフは、調理室に入るなり、「カゲキ、いったい、これが食い物か」お客をはばかって
54,、仲間と一緒にアルヴェの調理室で鍋料理などを作ってみませんか。アルヴェの調理室は、調理器具や食器、ＩＨクッキングヒーターやガスオーブンなど、調理設備が充実しています。準備するのは
55,。山城は、口のなかでそう呟いた。彼は一階に降りると、調理室へ入った。調理室は、ごった返していた。ニンニクの臭い、油のこげる臭い。土間
56,のレシピの中、いかに美味しく、楽しく料理を作るかを考えた教室です。調理室は、用途に合った食器・器具がそろっており、コンロも素人でもレシピにあった
57,通路で、エリ子は光沢浩一と鉢合わせをした。上板や中板という板前たちも、すでに調理室から出ていた。調理室では当番の中板をはじめ下板たち、パートの従業員たちが洗いものに
58,校務センター、理科のひろば、理科教室、社会のひろば、社会教室、葉っぱのひろば、しみんホール、調理室、家庭科室、木工金工室、機械工作室、美術室、メディアセンター、保健室、相談室２階国語のひろば、
59,ゆっくりサポートいたします。日時２月十六日（土）午前９時三十分〜正午場所浜名公民館調理室対象浜北区内在住の男性定員／費用二十五人（先着順）／五百円持物エプロン、三角巾
60,物があふれている時代だからこそ、みんなで工夫します。火は七輪でおこし、調理室は使いません。マッチは三本まで、水はペットボトル一本分しか使いません。宿泊中
61,テーブル・クロス拡げてくれ。そこにアイス・クリーム置くんだ」チーフに命じられ、裕美とゴクウスは調理室の床に、コチコチに凍ったアイス・クリームを置きました。「岡本、床に
