,0
242,ちなみに、うちの甥っ子の時は、一升餅を風呂敷に包んで背負わせました。近所の和菓子屋さんに注文しました。その時に、紅白饅頭をいくつか注文して、親戚に
243,先週の木曜日、会社の近所に「ぎょうざの満州」なるチェーン店がオープン＾＾当日は相当な混みようで、長蛇の
244,だったらなんで、あの顔が記憶のなかにあるのだろう。その週の日曜日、信子は近所の美容院に髪を切りに出かけた。信子としてはもっとお洒落なサロンへ行きたい
245,ありがとうございます。１番近所のガソリンスタンドのレギュラー価格が遂に百円台にっ！【百十七円】もう何もコワイモノはない
246,年に無農薬で米がとれてしまいました。もし、減農薬に取り組んでいなかったら、近所の百姓のように指導の通りに十回近く散布していたかもしれません。減農薬一年目は大変
247,参加しましたが結構面白いですよ。ジムカーナのＢ級ライセンスも取れますしね。（‐＿‐）ノ近所で走る前に一回参加してみては。公道でのスピード超過は違反ですよ（‐＿‐）ノ
248,生地である。しかもパーティ用のパンタロン・スーツなのだ。こんなにぐずぐずしていては、十一月三日の近所の結婚式にも間に合わない。道代はいらいらと不機嫌になった。「ばかだ
249,な匂いがするのですが、味はどうですか？↑○羽のダイエー？だったら近所ですね。最近は暑いせいか人が並んでいないです。でも本当に美味しいです
250,こと、などを下手な韓国語で説明した。ふっと周りに気が付くと、近所の人達が多勢取り巻いている。スパイが捕まったとでも思って集まってき
251,、こちらでは咲いていないと思っていました。しかし、下関考古博物館に行ったところ近所にたくさん咲いていました。今日も彼岸花と会話しながらの写真撮りです。やはり最大
252,家族５人での初詣は元旦に近所の神社へ。小さな神社なのに、駐車場から渋滞並んで参拝しました。両親
253,カモメの話ではそこでもみんな死に絶えてしまったそうだ。それから昔の島の近所に新しいペンギン鳥の島ができたそうだが、何でも平ったいつまらない所で、とても
254,が大好きロッテのクルクルキャンデーを求めてスーパーやコンビニなかなか無いのよね先日ババが近所のスーパーで見つけたのよその後が無くて、今日寄ったスーパーでも無かっ
255,を水曜に買い忘れたらキオスクでも無くて・・・そしたら木曜に近所の古本屋で百円で・・・息子と思わず買っちゃった！！四百五十円
256,ほかのことを考えている暇はないが、昼飯どきになって、昼飯のかわりに近所のそば屋へそばを食いに行くと、またしてもお縫のことが気に
257,いらっしゃってすっかり秋の公園の風情を堪能できた、素敵な午後でございました。近所の公園でも結構楽しめますなー３連休で紅葉の名所はさぞかし混雑しているのでしょうが我が家
258,時期のような気がします。言い方が悪いのですが、野暮ったく見えがちな時期。近所の女の子も高校に入ったらすごくきれいになって驚きました。山田花子さんも素直そう
259,のお子さんたちのばあいはどうですか。エジプト学校では友だちができますけれど、近所の子どもたちとは少し難しいようです。言葉がちがうので、話しかけても通じないと
260,こんな板どうしたのかと訊いた。「盗んできたんだよ」近所にちょうど取り壊し中のマンションともう一軒取り壊し中の木造の家があって、何日か前
261,小学校に入る直前まで、この山海に恵まれた漁師町で育った。実家はもちろん、近所の農家や自家菜園では桃、なし、ぶどうなどがたわわに実る光景は当たり前。
262,なければならないことを思うと、お母さんたちに申し訳なくて。だから、言えなかったの。もう近所の人など皆知ってるわ。校長先生からも、初めて私、奥さんと言われた
263,だいたい四時ごろには目的地について、宿に入りたい。シャワーを溶びて、ふらりと近所のパブに入る。とりあえず夕食前に黒ビールを一パイント飲む必要がある。このあたりの時間
264,その一つの押入の壁に大阪朝日新聞が貼ってあった。雨の日など、ここで近所の友達と角力をとったり、かくれん坊をしたものである。ある日、押入に
265,。本当は昨日撮ろうとしたら携帯のバッテリー残量が少ないってことでやめました。これは近所の公園のなのであまりいい写真じゃないので後で別のとこで改めて撮るつもりです
266,近所の子どもの同級生のご家族のことです。時々部下の方々を休日に呼んで庭で
267,方がより効果的だと思います。こういう男の子達って実際はどうなんでしょうね？近所のおばちゃんよりナンパ男ぶってるだけのオガキですよ。実際は何も出来ない童貞クンばかり
268,直後、周囲のおとなたちはあれは電気の事故だと言っていた。ちょうど家の近所に変電所があったので、そこで何か事故が起きたという程度に考えてい
269,よろしくお願いします。生協にもいろいろあるので一概には言えませんが、ウチの近所のコープ神○川は会員以外の方に普通に売っています。昔知らずに入っ
270,ニオイがする。この一週間でウチのウラ、廊下側から見下ろせる範囲つまり数軒先というか近所。火事が２軒あったのよね昼間に。ベランダ出るとものすごく焦げ臭くてＢＢＱどっ
271,朝早く、淡路に息子を迎えに来た父親第二名神の開通で近所にインターが出来、三重から１時間半で着いたようです（私に劣らず走り屋です
272,たけれども、それでもこのときはまだまだ気楽にかまえていた。ともだちの子どもや近所の子で、より子よりも小さくて麻疹や肺炎にかかって入院した子もいる
273,あります。事務用品のお店の方が種類も豊富で、安いですよ。うちの近所のお店は「○○パッケージ」「○○梱包」という名前です。
274,７皿食べた。それから足を伸ばして加西イオンに行き、欲しい物を買い、家の近所にない｛ミスタードーナッ」と［ケンターフライドチキン」でも買い物をした。火曜日は阪神タイガースの
275,うちでは電話がわりに使っています。たとえば料理の上手な友達がいても、近所に住んでいないかぎり、そういつもうかがうことはできません。でも、料理など
276,おばさんで、私、舅の両方に相談に乗るともちかけ、話を聞きだし面白おかしく近所にいいふらしていました。また、相手がこう言っていたとお互いにきかせるの
277,なんていいましたっけ？以前はなまるマーケットでやっていたんですが思い出せくて。近所では見つからないので都内のスーパーで売っているところも教えて下さい。「テンペ」の
278,近所で同姓の方へのメール便が間違って届きました。差出人に電話してみました
279,近所でそこそこ評判の整形外科にぎっくり腰で行ったのですがトラブルやミスが連続で
280,ば、パンは１個で満腹になります。もろみ味噌や、コチュジャンなんかもお勧めです。近所の居酒屋で出してるメニューです。
281,うまくやってくれるのではないかという気がした。ミチが言った。「この近所に、公園でもないのかね。ちょっとふたりで話でもしておいでよ」
282,筆者の同僚の一人は、支局勤務のとき、一緒に釣りに行ったことのある近所の顔役から、茶色い封筒を渡されて、投票を依頼されたそうである。そして
283,てあがなわねばならないことのようだった。水島が散歩の途中耳にした、近所の主婦の立ち話で思い出したのはそのほおずきのことだった。家へとっ
284,７月十三日午前５時半だった。近くに住む自治会長の福山幸男さん（六十八）は、６時から近所の草むしり作業に参加するため、普段より少し早めに起き、用足しを済ませたところだっ
285,あれば、なんとかなるのに」兄弟は、よくつぶやいた。そんな時、近所の親切な老人が「肋膜には、猫の干し肉が効く」と、漢方の
286,、どうやって欠席連絡をしていますか？普通は連絡帳に欠席理由を書いて、近所の（親同士が親しい）同じ学年の子に渡して、先生に届けてもらっているよう
287,コスモスポーツはロータリーなのに灯油で走ってたのですか？近所のオッちゃんとタクシーのオッちゃんが居酒屋で盛り上がってました。古き良き時代だったんです
288,れるまま順番待ちをし、やがて私の番になってブランコに座った。家の近所の公園でよく練習していたから、飛び降りは得意だ。ヒュンヒュン。私は
289,、商業ベースでなく家族の側に立って考えるコーディネータ役が必要だと思います。従来は近所の人がその役を行なったものですが、最近はよほどの地域連携があるところ
290,ウチ、栃木ですが、近所の百円ショップ３件でも確認しましたよ！きっとお宅の近所にも！！
291,。育児系サロンに顔を出したのは今回が２度目。娘が未就園児だった頃に近所のコミュニティセンターで催された時、１度だけ行った事があるのですが、既にママ友グループ
292,会社の近所の大地主から法人会を入会を誘われ迷ってます。会社に突然おこしになられ
293,の人を探し助け合いました。地域の人たちの団結で皆癒されました。近所の人たちが仲良くすることは大事なことです。３日間、生き抜くには、隣近所の
294,下取りで入ってきたバイクって自分の店では売りづらいんですよ。お客さんが近所の人だったりすると、「俺のバイクいくらで買い取ったのにいくらで売ってる
295,にする」お義父さんはいいはった。結納にはゴーカ結納かざりを、町内で結婚式を、近所の人を呼んで三百人披露宴を、と、ことごとく自分の要求が通らずここまでき
296,にうまくなってきた。乳酸発酵サイコー。夜どうしてもタイ料理が食べたくなって、実家の近所のタイ料理屋へ。タイ料理って、好きキライがはっきり分かれますね＾＾；。でも好きになったら
297,ところへ行ったのです。寺島町のあたりだったと思います。鳩の街の近所でした。その頃、そのあたりが、そういうモデル地区に東京都から指定されてい
298,済まされないわな。民間人も死にまくってるし。そんで、日本はそんな理不尽な、近所のイヂメッ子とそう変わらない論点で戦争しまくるアメリカにこれからも追従していくのでしょうか…
299,住宅金融公庫でローンを組んでおり、みずほ銀行が窓口になっています。近所にみずほの支店がなくなってしまって不便なため、引き落とし銀行を変更できるのでしょうか？できませ
300,思いますか？（デブ猫さんは別です）私の知る範囲では、ラグドールです。近所にいますが、オスで十一キロありますし、これで太ってはいません
301,、自分たちの社会の為に働いてるんやなあ偉いぞがんばってやでもうちの近所に巣は作らんといてな
302,、病院からの在宅医療・看護の先生が来てくださるような形でなくて、親しい先生を近所に持っておらねばならぬということを非常に感じました。ところが、この先生が、残念
303,いたしません」「おまへ、いつたい自分が幾つだと思つてゐるのだ。近所の手前だつてある。おまへの歳でこのやうな良い話があるのは、
304,のおかみさん（二十六）がカービン銃を発砲、一人が頭を撃たれて死んだ。近所の商店主たちは正当防衛を主張して、おかみさんを守る会をつくった。国民戦線はアラブ人排斥を
305,味わえたのです。いま思うと、これは幸せな体験だったといえます。近所に田んぼがありましたから、五月に田植えをし、青々としてきたら、
306,は依然健在で、今でも自分の家の前には小さな雑貨店を構え、近所の人を相手に商売をやっているようである。実は私が最後に住んでい
307,！」とか、「ストック消しなんて当然でしょ」てな感じで出来れば地区込みで！近所のパチンコ屋、「今日はストック消していません」ってイベントを時々やるんですけど・
308,靴で畳の上に踏み込んだ。恵美がそれを眺めているうちに、晴子が近所の人の知らせで駆け込んできて、真理もそれに続いた。兵隊は鋭い
309,、近くに大東映画っていうのがあったんです。その撮影所の大部屋の連中が、近所のアパートにいっぱい住んでた。それで仲良くなっちゃって、その時分は食い物が
310,も書いたように、身近なところでやっているスクールを探すには、まずは近所のショップに聞いてみるのが一番。本誌ではＭＴＢに力を入れている全国の
311,、かなりの「ダダっ子」であったらしい。イワシ漁が最盛期になる初冬の夕方、近所の子供たちと魚を「かっぱらう」ためよく浜へ行った。綿入れをはしょり、
312,のまわりでは、わりあいよく釣れるらしい。おかしかったのは、そのまわりに、近所の奥さんらしい婦人が三、四人あつまっていて、それを買っていることだった。
313,きました。元旦は７時半にいただくお神酒で、頭痛だけの一日でしたが、近所にある元善光寺と光善寺という２つのお寺に行ってきました。元善光寺：ｈｔｔｐ：／／ｗｗｗ．ｍｏｔｏｚｅｎｋｏｕｊｉ．ｏｒ．ｊｐ／２ｉｎｄｅｘ．ｈｔｍ光善寺
314,あそこの娘さん、お母さんおいてお嫁にいっちゃう」というような噂だって、近所でたたないとも言えないわけです。現代でもそういうことを気に
315,志ん朝師匠を張り扇でひっぱたいちゃった小沢私は東京の蒲田で育ったんですが、近所に御園会館という寄席があったんです。下が市場みたいになってて、二階が
316,。逃げ込んだ部屋にテレビやＣＤプレーヤーがあるなら、ボリュームを最大限にすれば、近所の人も騒音に気づいて駆けつけるでしょう。武器代わりになるさまざまな日用品場合によっては
317,近所の仲良しの人に代理で出品を頼まれて出品していますが、色々と良く
318,飲んだら昔の事を思い出して、夜になったら喧嘩になった。それは近所の人たちの話しから、私が母親に聞いたことだ。おとなしい働き者のおっちゃんが
319,の愛護及び管理に関する法律」で禁止されています。終生飼育は飼い主の義務です。近所のみなさんへ■野良猫にエサを与えないで！「かわいそう」と思った一時
320,がいいでしょうか？どっかで消防車（はしご車）の払い下げが売ってたぞ！近所のおばちゃんには「火事が起きても安心だわぁ」なんて喜ばれるでしょう、きっと
321,て背中あわせて戦うんは」「そういやそうだな。ガキの頃、近所の中坊連中とケンカした時以来か」「ほな、行くで！」「おう！
322,、よくわかります。「自由設計」、「自分のオリジナル」、「自分らしく」、「近所ではまず見ないデザイン」などついつい多くの方々は、「私の」という点
323,神奈川の桜の名所として有名な公園ですが、実は行った事なかったり…。近所なのにね。結構咲いてて、来週初め位には満開かな。
324,四両と着物一枚が盗まれていることが分った。片岡宅に同宿していた矢頭右衛門七が近所で小山田とすれ違っていたことから、小山田が犯人らしいと見られた。脱盟の上
325,不便な話はありません。たとえば、いままでホンダのクルマに乗っていて、近所の正直で腕がいい修理工場にいつも車検や修理を任せていた。しかし、
326,信号待ちが耐えられません。なので、距離表示がある周回路を必ず走ります。自宅の近所では、長居陸上競技場のある長居公園の周回路夜でも水銀灯で照明は文句なし、夜型ランナー
327,は、学生時代の友達ですよね。私も近くに誰もいませんが、近所の人や道行く人との会話も大切にしています。子供を連れている
328,のがとても嫌で、心細いのか淋しいのか、オカンにしがみついて号泣した。近所の人が毎日、そんなボクを見て笑うのでオカンは恥ずかしかったらしい。無理矢理
329,ずに黙っていた。「ヒサコがライセンスを取った！」ニュースは、近所をちょっと吹き荒れた。車の元持ち主レスとハリーンからは、さっそくお祝いのカードが届けられ
330,と「母」図４甲骨文字「妻」北京の「漢藏屋」最近わが家の近所にある美容院がリニューアルした。以前とは見ちがえるようにきれいになり、改装ととも
331,。もし、お勧め店が他にありましたら、そっちも行きますので。うちの近所のヤマダ電機３件は、どこも店員の質が悪い。接客態度もなってなければ商品知識
332,られたのです。そういえば以前から、路上などでもよく質問されました。近所の方に『どこに行ったら見つけられるの』と聞かれて、よくお店を
333,また何回入っても怒られないし。チャンも初めは私が居ないと、近所を捜して居たけれど、此の事が解ってからは、遅くなると松竹館の
334,人と話をするのは、友達の奥さんか家内の友人だけです。やはり、近所の旦那さんと立ち話は、世間に抵抗があるのですか？私が特別嫌われている
335,が伸びるとでも思っていたのか、いつもつま先で歩いていた。近所のワルガキたちにその歩き方をからかわれても、平然としてとにかくいつもつま先で
336,その後エンジンかかったのなら、完全に壊れてます。。ディーラーが嫌なら、近所の修理工場でも大丈夫ですし、買った所じゃないディーラーでも、取り扱い車種なら見て
337,の息子を持つ母です。主人の転勤で昨年岡山市に引っ越してきました。近所で２歳以下の子供を持つママ集団がいて、どうしてもその輪に入れずにいます
338,荒縄で縛られる（当時を知る人の話である）。曽祖母も、そばを通る近所の人も、縄を解いてやりたくたって曽祖父が怖くて手を出すことができない。
339,て、「この子にお乳をください」と泣きながら近所の家を頼み歩く。近所の家というのはすべてアイヌの家だった。アイヌたちは親切にこの若い母親の
340,最近ここに越して来た者ですが挨拶に来ました』と、いかにも「近所に引越しの挨拶に来ましたよ」みたいな事を言うセールス。私・・
341,よね。うちの庭も気付くとたまに知らない車が止まってることがあります。「近所に来てた」とか海が近いので海に行ってたり。見るからに
342,心配事も大きくなり自分の考えにいつも不安を抱えるようになったある日、近所の先輩ママさんに相談すると「子どもは大丈夫…。あなたが自信を持ちなさい！」とやっぱり
343,が、整形外科に行くべきか、整体に行くべきか悩みました。結局、近所の整体に行きました。ここは保険が利くし、上手いと評判な
344,手この手のイジメが始まる。住人は朝起きて窓を開けると、ひまな近所の年寄りが、いつもこちらを見張っているのに気づくことになる。出かけると尾行され、
345,華やかなあゆみおねえさんのコスチュームとは違い、ちかおねえさんは、中学生が日曜に友達と待ち合わせて近所のダイエーに買い物、といった感じの服装。ちかおねえさんにも、もっといい格好させて
346,ました。お世話になった小学校の先生方や、捜索に加わってくれたＰＴＡや近所の方々、そして私の職場、中学、高校、大学時代の友人・知人たちが次々と焼香してくれ
347,の店に行こうと決めたのだった。もし依然として閉まったままなら、近所の連中に尋ねてみよう。何かの手がかりはつかめるだろう。「シーラの店に
348,わけです。例えば、江戸時代から続いている老舗のせんべい屋などは、どんな状況でも、近所の人はみんなそこで買うわけです。しかし、事業というのはよほど体力がない
349,時からマイナーなパクリ行為と放置していたのでそのままになっているようですが、先日近所のスーパーで「かっぱえびせん」のニセモノが逆に輸入されているのを見て驚きまし
350,晴れ訪問介護の人が来てくれて「体変換」等をしてくれた。（＾＾）母は近所の友人宅へ遊びに行った。ε＝ε＝（＾∀＾）僕とモモは留守番。
351,ご指導いただきました通り、病院へ行くのをやめて、常にお世話になっています近所の医院に血液検査をお願いしています。おかげさまで、だんだん数値が増えてきました
352,サークルを渡りあるく人びとと親しくなった。そして、同じく会員仲間のジョン・ピリングズリーとトマス・デイヴィス―デイヴィスは近所のロングリートに領地をもつバース侯爵夫人の土地差配人を務めていた―は、ちょうどそのころ、
353,たれた様な感じでところどころにいくつもできていて落としたくて近所の数店のクリーニング店に出した所これは落ちない！って言われて
354,効果的という。マッサージのほか女性専用のエステサロンもあり、心身ともにリフレッシュ。昼は近所の年配者、夕方からは仕事帰りの客。終電に乗り遅れたらリクライニングラウンジで朝まで仮眠できる都会
355,つまり、夫は生前から妻とシュトルムの仲を疑っていたらしい。同じ疑いは近所の住民も同様だった。スタンガー夫人は証人として質問され、甚だ悪い印象を法廷
356,たいのなら、レンズを望遠側にして被写体との距離を調整すればバッチリです。近所の公園や家の中でも練習出来ますからモードを切り替えたり距離を変えてみて
357,ないというからお試しあれ。事実、彼のかつての腹デブ写真を見てほほぅ。さっそく近所のスーパーから普通の人参と林檎を買い込み実践すること１カ月。昼を普通に食した
358,から見えるのが嫌だから？大阪在住ですが、子供の頃から夕方になると近所のあちこちで雨戸が閉まっていくのが当たり前だったので、閉めない方が以外です
359,てすれ違った者があるので、振り返ると、やはり街へ出ていたのか、近所の吉兵衛さんが、自転車に風呂敷包みを載せて駈け去ってゆく長閑な後姿が見えた。
360,なじら（どうだ）ね」と聞かれることはたびたびある。そうでなくとも、近所の小作の女房たちは、やれ芹を摘んだから、つくしを取ったから、と
361,新幹線で田舎へと向かったのだ。幸い、父の病状は軽いもので、近所を散歩できる程度に回復していた。「ユッコ、わざわざ帰ってくれてありがとう」裕子
