,0
121,おかしいよりも、危ないと思いますよ。息子さんの名前がオークション画面に出てしまいます。近所の知り合いとか、幼稚園のお友達とかクチコミで、もらってくれそうな人を探し
122,は、垣根越しに見える二人に向ってタロオは長ながと悲しそうに吠え続けた。近所の飼犬共も、タロオなぞ眼中に無いらしかった。そのなかの親分格の犬なぞ
123,家の近所で、子供を虐待しているのではないかという程の、母親の怒り・わめき声、物音がし
124,で、ボタンが見ごろを迎えている。淡いピンクや赤など色とりどりの花が咲き、近所の人を楽しませている。世古さんの妻洋子さん（六十七）が庭で育てている。
125,今息子（６歳）がはじめてお友達のいえ（近所）に遊びに行っています。やっぱり初めて行った家なので十七時になったらお迎え
126,病院は沢山ありますよ。評判の良い病院は、時間とお金もかかります。近所でも（有名でなくても）貴方と気の合う先生がいるかも知れませ
127,が限度。旦那が長期出張とか単身赴任で、相手の自宅を利用したこともあるけど、近所にチクられたこともあるしね、Ｘ１だと堂々と出入りできて楽だけど、
128,始めたのは二千一年９月１日からである。その前から歩くことは好きだったので近所を散歩したりハイキングをしていた。ずいぶん長い期間ジョギングもしていた。前に住ん
129,マンション神奈川県■■■■さん門の前のわずかなスペースを活用してひな壇をつくりました。近所の方が「花のマンション」と名づけてくださり、満足しています。●配種、配色
130,カテ違いですみませんが、今日近所の簡易郵便局に定形外で発送しに行ったら、窓口の局員の態度がすんごい横柄！！
131,極端に少ないながらも近所に風呂がある家があった
132,壁に巨大な垂れ幕がかかっていた。黒布に黄色の文字が書いてあった。近所の人がかけたのだろうか。「“わたしたちは、それでも、国連を支持します
133,ご飯は手間とお金をあまりかけないで、なおかつ美味しく楽しく健康的にがモットーです。近所に遅くまで開いてるスーパーがあるともっといいのになぁ〜。魚介類をもっと食べ
134,→満室リホーム例です屋根の黒を→赤に、壁のグレーを→ピンク壁に変え☆近所に立て替えたのと言われた４海外のホテル内容→最高のホテルを体験して良い
135,、商売の都合上、トレーラー対応の大型秤を工場に据え付けています。その秤の上に近所の小中学生が乗って遊ぶのです。いくら危険だからと言って注意しても反省しませ
136,とうまくいっていないので、その寂しさからアルコール依存症になったようだ。最近は、近所の家に怒鳴りこんだりして問題になっているので、施設側でも家族と相談し
137,（笑）でね、その子がたまたま「ギョウチュウ検査」を出さなきゃいけなくて、近所の子に頼んだんです。その子が、夕方、連絡帳とか持って来てくれ
138,、夫、妻、兄弟、友人、恋人発生場所家庭、学校、会社、旅行、近所（３）年齢退行法被験者の得られる外界接触が、催眠者のもたらす刺激のみに制限さ
139,家でクサクサされて、その鬱憤で今の夫と不倫関係に陥った。あいつは近所のコンビニでバイトしてて、子供好きだったから上の子が先になつき、私
140,が出てしまったんです。それが自分でもびっくりするくらい大きな声で外にいた近所の人に聞かれてしまいました。とても恥かしかったし、二度と口にしない
141,。大量の塩をまくのが気に入ったみたい。夕食を一緒に、近所の居酒屋に食べに出る。『やきとり小松』でジャパニーズビジネスマン式ヤキトリナイトだ。宿で見かけた外国人
142,を求めた。と、さすが田舎である。あっさり見せてくれる。それをチョイと拝借し、近所のコンビニに駆け込み、コピーして、すぐにもどすという作戦を繰り返し、ほぼすべてのフェリー
143,戦闘三百十三飛行隊分隊長として戦死）とともに見事合格。この時、小学校時代の同級生で、家も近所であった林啓次郎少年（昭和二十年６月二十二日に『紫電改』戦闘機隊として名高い三百四十三空戦闘四百七飛行隊の、二代目『林』隊長
144,が本日から２点で百円になってましたよ♪でも今日行った近所の店舗ではその注意書きが、まさに天井付近に貼ってあってさ…すっごぃ見えにく
145,彼も起きていたんですねほんで、彼が『ラーメン食べたい』って言うので、近所のラーメン屋へ行ってきました（笑食事の後はコンビニに寄って帰宅
146,など、脚力の低下を感じて受講したという■■■■■さん（五十六・妻田在住）は「近所で開講されていて便利。教室で設定した週に三回、二十分間のウオーキングを実践し
147,庭は荒れ放題で、玄関口の横手は屋根が瓦の重みでごっそりと抜け落ち、近所の子供などは、「おさしあい屋敷」と呼んでいる。お差し合いとは、江戸俗語で差しつかえの
148,はいっても、そこで診察や投薬をしてくれるわけではなく、必要であれば、近所の病院を紹介してくれます。公的機関ですから、あの病院が評判がよいとか悪い
149,けど、もう一軒用足ししてから帰るといいましたね。公衆電話らしいとわかったし、近所とすれば、あの教会の横の電話ボックスじゃないか。そのあとこの店へ寄るつもり
150,■■■■■■■■■■■■■■☎■■■■■■■■■■■■営十時〜二十一時無休ＮＥＷＳ４近所のシューフィッターを探せ！「これからの靴選びを失敗しないためにも、できればシューフィッター
151,ていました」「事件当時、バールのようなものを持った不審な男が近所の住人に目撃されており、警察ではその男の行方を追っています」
152,。特に年配の方は大抵ラケットを握った経験をお持ちでしょう。私も以前、近所に卓球場ができ、家族や友人と散歩がてら寄っては“ピンポン”を楽しんだもの
153,誰なのか。前の生とはなんなのか。親類の年寄たちや近所のおかみさんたちがいう。「おきやばんな、前の生か、後の生じゃ、
154,ああ、やったことはあるよ」「おれと家内は毎週木曜日の晩に、近所の連中とブリッジをやってるんだ。きみはクリスチャンセン家の人たちを知ってるだろ？―
155,は、私だけではないようだ。私が炭を焼くようになって、近所の人がどんどん集まってくるようになったからだ。多くは地元のお年寄りだ
156,。やる意義すら？？？になってきてしまったよ。会場も暗黙の了解で近所にある結婚式場のような施設でパック料理。卒業式の当日の夕方に行われる「予定
157,きこえるからなにごとかと思ったら、雲が、うちの庭に遊びにきていた近所の猫の頭にスッポリかぶさって、からかっていた。となりの家に干してあっ
158,「でも、おかしな広告だな」と吉中君が言った。「猫を探すなら、近所の電柱にビラでも貼った方が早い。連れ去られでもしない限り、
159,普通に捨てるのは何だかまずいですよね？みなさんはどうされてますか？近所の保育園の保母さんに言ったら是非下さいとの事だったので貰って頂きましたよ
160,てキモい」と不評でしたが。写真１枚目は有名なヒキガエル。昔はうちの近所にも大量にいましたよ。巨体がいかんなく再現されております。デカいっす
161,ているのだと信じていた。「ある日、越野が訪ねてくれた。越野は近所に住んでいたばかりに、火事の手伝いから避難場まで引き受けて、ずいぶん面倒を見
162,おっさんや。西鉄ライオンズ（現西武）の合宿には、もっとごっつい奴がおった。近所の家の明りとりにのって、のぞいてましたんや。あんまり夢中でのぞいとっ
163,ていた号でした。関根恵子さん、好きでしたね。もう、二十六年前でしたか…近所の本屋で立ち読みしてたら関根さんのグラビアに目を奪われ即買いしたんですよそれから買い続け
164,私が育ったのと、あまり変っていない。家は神社の社務所で、近所に同い年ぐらいの遊び友達がなく、家庭ではじいさん、ばあさんが目の中に入れ
165,最近、五十一歳の母の様子がおかしいんです。家の前で近所の人達がおしゃべりしているだけなのに「私の悪口を言ってる！」とか
166,セミのヒグラシとカナカナ、同じものですか？川崎市に住んでいますが、近所で、ヒグラシって聞かないのですが、あれはどういうところに生息するのでしょう？ヒグラシ
167,でも私の身の回りでも多くなっているような気がします。これまでに近所のどんな小さな音が聞こえましたか？私は夜テレビを消した後、隣
168,昨年、就職した義息子は社会人になって丸１年が経ちます。近所に手ごろな物件があり、借家住まいよりいいのではと・・。月々３万弱の支払い
169,さ（笑）明日は今日休んだ甲斐あってふつーに走れますよーに。近所の気のいいにーちゃんが具合が悪くなって入院したとゆー。ひどいことに
170,。それでも、人の集まる場所であれば元が取れる商売なのでありましょうか。ウチの近所にも『温泉』があったのですが、残念ながら閉店してしまいました。やはり難しい
171,職場の職員用出入り口に近所のノラちゃんが数匹入れ替わり立ちかわりやってきます◎でもやっぱりノラはノラでなかなか懐い
172,事なんですが、ご近所の方といろいろ情報交換等しているのですが、うちの子は、近所のお子さんより１学期のテストは常にほとんどの科目の点数が良かったのに通知簿
173,人まで、黒猫の神秘の魅力にまいったのか、溺愛してくれちゃってます。近所の子供たちも「もも（愛猫の名前）見せて〜」って来ますよ。地域性
174,、３日間すっごくおとなしくしていて、みんなが感心したころ、突然元気に暴れ出し、近所のボスネコになりました。うち中で、ネコがネコをかぶっていた、と言い合い
175,ない。白黒テレビを見てもちっとも面白くない。そこで、ヒマな私は、近所のＢＡＲへしばしば出かけ、いちばん安いイタリア産のビールを飲みながら、バーテンをつかまえては
176,朝食メニューの代表例：パンとコーヒー、白飯、目玉焼き、焼き魚など午前の活動パターン・近所の川や海で釣り・庭の手入れ・友達または夫婦でゴルフ・インターネット・ショッピングセンター
177,、これならもう絶対に大丈夫だという確信を持つに至ったのです。そこで、近所の人や株の愛好者、また用事で家へくる人たちに、「この株は
178,位ですかですか？何か私とこ、高く思いまして・・・うちでは近所に激安の酒店がありそこまで自分で買いに行きます。重くて大変ですが
179,はありました。子供に恵まれなかった分、ひとさまの子供は大好きで、近所の人が赤ん坊を抱いているのに行き合おうものなら、必ず呼びとめて覗き込んでいました
180,落として言った。「まあね」「名前は？クロエんちの近所の女か？」クロエとは、一緒に学校に通った仲だが、
181,は彼岸の供養ととなえて、団子・萩の餅・精進すしなどをこしらえて、仏に供え、近所へも配っていました。また大変に六阿弥陀詣が流行りました。六阿弥陀
182,晩のかめ三といえば、例の人殺しとなにか掛かり合いでも？」近所で起きた人殺しである。手代もいろいろ耳にしているらしく、にわかに興を惹か
183,たくなるではないか。それでそのうち大庄屋まで買いにいこうと思っていると、先日近所のスーパー（天満屋ハピータウン）に行ったときに置いてあるのを見つけてしまった。
184,目から見ても、母の振舞いは奔放であった。尼となった後も近所の町人を集めて盛んに茶会を催し、塀を乗り越えて入ってくる近所の
185,勝ち取り、さらにそれ以上のものを得られた。彼はリディアの怒りをなだめ、近所の高級レストランの名を挙げ、さらに食事のあとに起こるかもしれない何かを
186,親戚の家から仕事を手伝うように頼まれて朝早く出掛けるというので、私は近所の伯母の家に預けられていた。朝の八時過ぎだったと思う。朝食
187,信号灯ほどだれもに見つめられる仕事はありません。だから、どの信号灯も、近所のすべての人の顔をよく知っていました。車を運転している人の顔
188,に帰っても今年はあまり写真を撮らなかったので、ネタがありませぬ〜近所の神社をちょっと散歩してきたときのショットです。小さな山の途中にあるので
189,か私の実家付近で元彼や今カノを見かけるようになり、今カノは私の家の近所みたいです。問題は、今カノと彼女の母親が何故か私が彼のストーカーを
190,をもらえる。競馬、競輪などは開催期日、時間が決まっているが、パチンコ店は住まいの近所にあり、午前から夜まで営業して気軽に行ける。玉は１個４円。１分間に
191,て説明書をみたら、使用電球百二十Ｖ四十ＷＥ十二レフランプと書いてありました。そこで近所で一番大きな電気屋に行ったのですが、該当しそうな電球がみつかりませんでした
192,の生産量日本一）埼玉で食べるネギラーメンはやはり美味い♪どうしても食べたくなったので、近所の「ラーメンくるまや」に行った。お昼が遅くてお腹ぺこぺこだったので、
193,のですが、経験のある方…こんな症状でしたか？五十歳ではありませんが、母や近所の叔母さんの話です。閉経はいきなりパッタリ無くなるのではなく、１ヶ月来なかったり昔は１週間
194,近所のスタバでのんびりタイム。ケーキ結構おいしいです。国によって色々違うんだな〜って！近所にスパがたくさんあります。フェイシャルとマッサージを受けたりしてリラックス！安いです☆
195,、お医者様を呼んでいます」と、貞子・グリームがソファの方へかがみ込む。「この近所ですから、すぐみえるでしょうけど…」貞子が来たので、ちょっと安心して、
196,１押しです。見学の後、ビールかジュースが２本のめます。毎年２〜３回行きます。近所のおじさんが自転車でよく来ているようでした。
197,こんこんちきの迷信だ。そんな迷信に罪がなかったのは、先輩だか近所のおじさんだか知らないが、ペニスの清潔の方法を教えてくれる人がいて
198,「ジムとプールでじっくりと汗を流すのがいつものコース。休日には近所のスポーツ大会などにも参加していますよ」と話してくれました。ボールを使っ
199,近所のボス猫とチワワが闘えば、どちらの飼い主が勝利の美酒に酔えますか？
200,入った柚子七味なのですが、今度ぜひやって見たいと思います。そういえば、近所のタコヤキ屋さんでは「七味かけていいですか」と聞きます。似たような
201,せてくれました。子どもの納金が急にあったりして不都合な時は、近所の人と相談し、やりくりしてでも持たせてくれました。このことは子どもで
202,、城田優もなかなかカッコイイねぇ〜♪なんて思いながら…木曜日。旦那１日休みだったので、近所に出来た有料遊びスペースへ。いつもは車だけど、ガソリン代も高いしＰ代も高い
203,そのやさしさに打たれた。その翌年のお正月、じいちゃんとオパアピイと進くんは、近所のお宮様に初詣に行った。進くんは喜んで、あっちへ跳ねこっちへ跳ねし
204,で帰ってくると、無言で食事を済ませる。そしてグラブとボールを持って近所の神社まで行くと、一人で投球練習をするのだ。石の鳥居にくくりつけた籠
205,あの世に行くように言われている」と言い残し、夫宛てに遺書も残していた。近所からは変わり者と見られていた。この女性は以前に「トラに食べられ
206,いままでの人生で走った記憶といえば、子どものころ、庭から逃げ出した近所の犬に追いかけられたときのことだけよ。あんまり必死になって走ったもの
207,。今は定職についているママがほとんどですから。９時４時というのはどこか近所のパートか自営業なのではないでしょうか。私も二人保育園に預けて十八時お迎えですが
208,サドルのところに「焼きたてパンの木村」と、白ペンキで書いてある。「おじさん、近所の人ですか」おじさんは、大久保通りの方向へ顎をしゃくった。「
209,同時に、精神障害的な犯罪も目立っている」「そういえば、以前、カラオケスナックの近所の住人が、原因不明の頭痛に襲われているというニュースを見た記憶があります
210,のすすめで三歳から習いはじめました。毎週水曜日は、母に手を引かれて、近所にあったピアノ教室におけいこに通います。ピアノ用の背が高いイスにすわると
211,回転すしで店が閉店後、回ってたすしはどう処分するんですか？私の近所の回転すし店では閉店時間に近づくとレーンに流れて来る寿司は殆どなくなりオーダー制に切り替え
212,近所のお宅には、収穫されたばかりのマメを干している。どこかの土地を
213,来週からなんです」羽山さんはうれしさを隠しきれないように言う。「お子さんは近所の方に預かってもらうということですけど、その方へのお礼は自分の収入から
214,最近うちの近所によくあたり屋注意の張り紙がしてありますが・・・あたり屋に当たられたことあり
215,が書いていた。会話量も、敏子のほうが盛夫よりはるかに多かった。近所の人も教会の信者たちも、盛夫のことを、「無口でおとなしい人や」
216,踏み込まれたくない一線があったのだろう。ある日いなくなったと思ったら、近所の寺の縁の下で死んでいた。砂が入ったのか、みおは目
217,我が家にはバーニーズの男の子がいます。近所のバニ君も我が家の犬同様思いっきりもたれかかってきて足の甲の上
218,・！（どんな目線で見てるんだ）カイルも男前に育っちゃってまー！！近所の悪がきくんに、少し見ないうちに身長を追い抜かれたような心境ですね！
219,削って生計をたてた。夫婦は、汚い二軒長屋に借家住まいであった。ふゆは近所の子供たちを集めて針仕事を教えている。清治は自身のことを「丁稚に出さ
220,最近では，こうした祭日を民族ごとに祝うだけでなく，職場の同僚や同級生，近所の住人などを招待する光景が見られる。▲１クアラルンプールのセントラルマーケット（千九百九十八年撮影）▶２
221,登校する日がふえ、終業式にも出席することができました。また、春休みに、すぐ近所に同じ学年の女子が転居してきて、この子と遊ぶようになりました。
222,、可哀相としか、思えません。こんなことをするのは日本人だけでしょうね？近所に色つきのプードルちゃんがいるんですけど、飼い主の自己満足としか思えませんね。カラーひよこ
223,徳島県の木であり，高知県の花でもあります。関東以南で自生する木だそうです。昨日近所を歩いていて，実が大きくなっているのを見かけました。もうそんな季節な
224,。僕は、自信ないなぁ。。。いかつい顔の髭面の一般人が、夜中に近所の公園で騒いでても、「羽目を外しただけじゃん」と笑って許せる
225,照十二歳の少年が、アメリカで銃殺された。仮装して、キャンデーをもらいに近所を回っていたそうだ。十六年前に、日本人の少年が同じように殺された
226,てあってね。勿論、反省したイオンだって始まっているんじゃないの？僕の近所のモールでは静かだったね。ヨーカドーは近所にないしね。円高還元セールで、
227,自分の好みの味を楽しく作れ、みんなで楽しく飲める心やすらぐ飲みものです。近所のスーパーで安売りしていたので、買いました。カルピスって、夏！！って感じ
228,おおた〉）という漢字をあてて、変えてしまった。こうした事情からすると大田の近所にあるセチョンという名称も日本人がつけた可能性があり、その場合にも細川の
229,とんでもねえ、あいつはまじめな人間なんだぞ。おめえ、そんな大きな声はよせ、近所となりの耳があらあ」武大は金蓮のそばを離れた。武松のところ
230,っていうのが食べてみたいんだけど今は売ってないのかしら？ウチの近所では見かけないんです。ないとなるとかえって食べてみたくなるんだよ
231,このような公的な場には女性は一切介入しないのである。結婚式には、近所に住んでいる農民による楽団が招かれ、哨吶（チャルメラの一種）、笙、打楽器
232,というぼくなりのアイディアを述べてみたい。ぼくが人生で最初に作った料理は近所の川で釣ったハヤという魚の空揚げであるが、その後、小学校の家庭科で
233,どうものすこです。今日も暖かいですね。ここ数日暖かかったから、近所の桜もすっかり散ってしまいました。今年は満開になったと思ったら、直ぐ
234,に数回の里帰りするだけです。それでも信じられないことがたくさんおきますよ。実家の近所の専業農家に嫁に来た方はその生活に耐えられずに子どもをおいて
235,中年男は会釈した。「まだ名刺は作っていないんですが…あれから、この近所の工事場で働いています」「川北です。川北一省」彼も一応自己紹介
236,要支援」と認定されましたから、家事のサービスをいまも受けてますよ。近所には次男の家族も住んでるし、何とかこうして元気で仕事していられる。
237,をみると、「備蓄準備が出来ていない」が五十六．〇％と最も高く、次いで、「近所の人と協力体制が出来ていない（自己防衛組織がないなど）」（五十五．二％）、「
238,きて行なうというのがふつうになり、かつては裏方の手伝いを担当してきた近所の女性たちは、専ら招待客として宴席にいならぶ側にかわってきている。なによりも昔はと
239,、僕にはまぶしく映った。ある時、父の友達が帰ったあと、近所に住む叔母が訪ねてきて「なんで銀行に戻らんかったね…恩給も
240,事は出来るでしょうか？私もダイハツのタントのＮＡを買いましたよ、ほとんど近所の移動と買い物位しか使わないのでこれで十分です、以前はワゴンＲのターボに
241,はそれ以来、カード払いは千円以上の時に使う、とマイルールを作りました。最近は近所のスーパーでも、クレジットカードの支払いができるようになって、マイルのポイント集めが少し
