,0
117,てカテーテルの手術を終え透析のやり方をマスターするまで１ヵ月くらいかかってしまいます。お年寄りなら退院まで２ヵ月かかることもあります。しかし高齢で１ヵ月も入院したら、体が弱ってしまい呆ける可能性
118,ママのために、洗濯物を溜めて置かないこと、ぐらいかな。もうすぐ、退院。楽しみですね。あんまり無理しないで気持ちをラクに育児を楽しんで下さい。
119,を担当するＩＭＧ関係者によると、出血は収まっているもようで、検査結果を見て週明けにも退院の見込み。左足裏にできたマメの影響で先週は数日間走れなかったそうで
120,！」哀れな悲鳴を残して彼は悶絶、睾丸が十倍にも腫れて退院までに２週間を要した。かくしてサムは、自分のクラブで自分のボールを
121,られないくらい美味いバゲット・レトロドールほか、甘いパンなんでも美味しい！乳腺が開くまでは低カロリー食退院１週間後の母子訪問でＯＫが出たので、それからは肉もけっこう食った。人
122,術眼当金（ガーゼなし）使用視力測定第２病日自己点眼指導，当金除去第７病日他眼手術（スケジュールは１回目と同様）第十〜十二病日退院退院１週間後外来にて診察（以後は約２〜３週間後，約１か月後と間隔をあけて状態を見る）
123,８月二十六日（火）♪もうい〜くつ寝ると〜などと・・・退院が近づき、ぽんこも私も指折り数える日々。歩く足取りもしっかりとスピードも上がって
124,治療ならではの“奇跡”と言えるかもしれません。１週間ほどして、ネコの退院の日が来ました。飼い主が、本当にうれしそうな顔で迎えに
125,出産費用のめどをつけてから妊娠しました。２人目は育児グッズもほとんどお下がりですませてしまい、退院のときの服１枚と授乳パットとか産褥ナプキンを買ったくらいでしたね。うちも
126,た。「もう大概にしたら？これで、確実にあと五日は、退院のびるョ」「もう、海、みえたもの。さっき、高速のとこから
127,パパママたち考えて下さいねっ！十一時三十分にはまた病院へ帰ります〜〜今週末には退院かな？？？と土曜日に先生が言ってくれました〜〜あ〜〜っ！
128,た。心臓の調整機能不全症候群と診断され、四月八日ペースメーカーを体内に埋め込む手術を行ない、無事退院にこぎつけた。とはいえ、はたして、塚本信夫に派閥を維持していく力が残っているだろう
129,の臓器に内膜症による癒着があれば、剝がすという内容。腹腔鏡下手術で行い、約１週間で退院。十二●全身麻酔でおへその下と下腹部２〜３か所に小さな穴を開けて、のう腫を
130,んですか？」「十万ばかりはいってた」「十万円！」「ちかく退院だといわれて、支払いの金をいれておいたんだ」それから大騒ぎになっ
131,傷む椿を咲かせていた日にはわたしの生のからだだけが落ちていた退院とはどういうことなのか（内臓に浮かぶ昏い月…）隣のベッドで
132,にこの半年間に入院になった五十二名の患者さんです。この中には、途中で退院あるいは転院になった患者さん、不幸にして不帰の転帰をたどった患者さんも含ま
133,なんだってさしだすはずだ！」ヴィルニクスは、どん欲な顔でつぶやいた。退院を待たんと病室からぬけだすと、ヴィルニクスはくずれかけた雨占師の塔にもどった。
134,退院しても通院が必要な方に退院おめでとうございます。というのはいけませんか？退院した後に通院が必要で
135,症状になったりして毎回点滴で栄養補給しながら絶食をし１週間ほど入院して治って退院を繰り返してきました。そして２年半前初めて病名がついたのが虚血性腸炎腸から突然出血する
136,不快でたまらないその後、すぐにシンタロウは病院から帰ってくるマサコは退院を許されず、父は医師から「血液検査」を言われ「貧血を甘くみ
137,移られますから。昨日はその手続きもしてゆかれました」「では、退院のときに来るでしょう？」「いえ。看護婦に付添いを頼んでましたから
138,のは無理とわかっているだけに苦しかった。十時にはＴ病院へ戻って、退院の荷物造りと手続きをする。たちまちに終了。土曜日とあって数少ない看護婦さんたちに、
139,ように「この際、ゆっくり休養を」ということはなく、問題がないとなれば直ちに退院となる。医療保険について正しく把握し、もしものときに備える緊急の場合は、
140,おまえの考えてることは、判ってる」おれは、収容されていた病院から退院を許され、真弓と腕を組んで、定禅寺通りを、散歩しながら言った。
141,じきに退院となる予定だった。しかしここで拒絶反応が起こったとなると、退院は延期せざるを得なくなる。吉住は麻理子のわからないという答を軽く受け流した。これ
142,に触れても感染する可能性は低いと読んでいたのだ。このままいけばじきに退院となる予定だった。しかしここで拒絶反応が起こったとなると、退院は延期せ
143,元気なうちに、横浜の病院に移ったらどうかとすすめた。社長の退院の日がやってきた。意外なことに、奥さんはさわやかな顔をし
144,でもし行くならその頃がいいかな。お祝いは入院中に持って行っても退院の時持って帰るのが辛かったので退院してからおうちに持っていくほうが
145,は無し。予防のため、化学療法を１クール実施する事に決定。抗がん剤治療１クールの後、退院。その後、３か月毎に検査。現在に至る。腎盂がんの特性、膀胱への転移
146,夢を持てるんだろう、それってすごいよねと。入院していて、まだ退院の予定も立っていなかったときに、「今一番心配なことは何ですか
147,おも湯や健康補助食品でも、平気になって、不思議に不満が消えました。退院の日には３．５キロ減っていました。退院したその日から、夜は好き
148,た。しかし、規則に従おうとしなかったんです。二年まえのことです。今回の退院は数日に限られていて、自分の部屋ではなく、更生のための施設で過ごす
149,暮らしを実現できるよう支援にとりくんでいた。退院の準備を一緒に進めるための面接、退院についての家族との話し合い、家庭訪問、早期退院を準備するために患者が病棟から仕事に通う
150,、アップル社の中枢にいる、いたずら好きの陽気なプログラマーたちは、動揺していた。ウォズが退院はしていたものの、いったい回復するのかどうかが分からなかったからである。ウォズ
151,姑が入院した。転んで足首を折ったのだが、たいしたことはなく二週間で退院。治療は無料、入院中の食費もなにも一切かからない。
152,！！スッキリ！今夜は手抜きでコンビニ弁当。食べ過ぎた、くるし〜！明日は早くも退院ですのでまたお迎えに行きます。↓ここからは、ちょっと寂しい独り言・・・
153,が退院だと思い、待っている。三月三十一日退院のため娘さん来院し、おやつ摂取後、退院となる。■治療方法この患者で、当初いちばん興味深かったのはくるくる回る発作が
154,の部」決勝戦。ｖｓこえ〜な（最近は勝ってるけど、油断は禁物。）退院の報告と、応援に。試合前、みんなから千羽鶴じゃなくて千六百羽鶴をもらった。
155,「空欄」とします。（２）入院した患者がその日のうちに退院あるいは死亡した場合も計上します。（３）在院中の患者が種別の異なる病床
156,のに。そうだ（前世記憶残存片弐）。まだヒトだったころ、「赤丸病院」むりやり退院の帰り路、淋しい霙にサンダルをつっかけた素足が濡れて凍えた。鼻緒が甲
157,と認める場合には退院の申請を，少年が処遇の最高段階に到達し，仮に退院を許すのが相当と認める場合には仮退院の申請を，地方更正保護委員会に対して行う。４
158,うえで、舌の形に整えて縫いつける。８時間以上かかる大手術だ。Ａさんは４週間で退院。９年たった現在、再発もなく元気だ。少し舌足らずの話し方になっ
159,は入院後半からご飯をやめて野菜をたくさん食べるように心がけました。七月二日に退院。同時に本をもう一冊購入して、パン焼き器、イオン整水器、ミキサー、自然塩、自然塩使用の
160,ん。祖母は現在、点滴と酸素吸入をしています。こんな状態でも転院か退院を迫られています。同じような経験をした方、アドバイスをいただけません
161,。まり子が、何を思ってか、彼女の白衣を引っ張った。「退院はいつになりますか」刑事に訊かれ、優希が答えると、まり子は
162,を飲むのなら、ここに居たほうがいい。君が禁酒を約束しなければ、退院は許されぬと思うよ」「そげんこと、他人が決めることでは
163,二千八年９月８日・月曜日の今日は、８番目の孫の退院を助けました。妻は、光が丘の都営住宅へ行って、１週間家事の支援をし
164,、ありがとうの気持ちでいっぱいです。そして私は苦しい治療に耐えて約半年後、無事に退院。進級もできました。今なにかで悩んでいる人へ。あなただけが苦しい
165,に生きようと思うと、待ったなしでした。でもわたしの場合、急にもう退院だといわれて、誤診だったのではないかと疑うこともあります。肉が削ら
166,、退院の日が決まったのです。千九百九十九年十月二十日芳行→睦美今日でとうとう退院だ。最初は、三ヶ月ぐらいだろうと言われていた入院生活も、半年近くになった
167,。午後からドラキッズがあるので、父母慶悟は午後からお出かけ。のちおじいちゃんのお見舞い。明日退院なのでおじいちゃんの機嫌はいい。母は今日のうちに入院費を精算。父は
168,が、本山参り、ご宝塔、献木、植樹などで数百万も寄進したがよくならず、退院―再発、入院―退院の繰り返しの年月だった。阿含に入信してすぐ
169,きかないため、早めに帰りますと電話あり。帰院後は落ち着く。三月二十二日今日が退院だと思い、待っている。三月三十一日退院のため娘さん来院し、おやつ摂取後、退院と
170,たりと、大活躍です。それからしばらくして、病院中の人氣者になったトミさんの退院が決まりました。迎えにきた息子、娘夫婦とともに、みんなに挨拶して
171,た。病棟の面接室に現われた彼は、椅子に座って黙りつづけた。筆者は退院を実現する方策を一緒に考えたいと伝えた。ついで、筆者が彼の家族と
172,帰りました。顔はムーンフェースと言われる、まん丸にむくんだ顔でしたが、退院は、やはりうれしいことでした。その夜、私のふとんに入ってきた次男
173,は、布団が自力でめくれないから剥いでくれ・・・というものだった。退院から３ヶ月ちょいが過ぎ、かなりのことが自力で出来るようになり子供達はすっかり家政婦代わりに嫁を
174,からも、どうぞよろしく！千九百九十九年十月二十日睦美→芳行今日は待ちに待った退院です。半年間、よくがんばりました。これからは毎日いっしょです。よろしくね
175,重さを知ることになる。病名を知るきっかけの一つは、抗ガン剤治療によるひどい副作用であった。退院三日後当たりから、帽子なしでは人前に出れないほど、抜け毛が激しくなる。「単に
176,から、急に寝たきりになってしまい、尿を出すための留置カテーテルをつけての退院となってしまいました。お通じのほうはポータブルトイレです。広子さんは一日中ベッドで過ごしており
177,が外泊している場合も，計上します。（３）入院してその日のうちに退院あるいは死亡した者は，計上しないでください。３月末在院患者数病床の種別ごとに，その
178,たという。国営放送の撮影スタッフはＨ教授から連絡を受け、患者が入院した翌日から退院の日までをカメラで追った。だが、この患者がダメージを負ったのは
179,の状態で帰ってきてもらっても困る」と言っていた。主治医は，退院のことが話せないためにまったくお手上げの状況であった。ソーシャルワーカーは，本人，
180,あの面接以降に考えるべきだったのは、これらのことであった。まずは、「退院を可能にする救済者」という幻想を自ら否定する必要があった。また、彼らの
181,感じ、何かをしてあげることができて、本当に幸せでした。退院おめでとう。新たな始まり〜穏やかな日々を取り戻すまで〜二人の生活の始まり両親
182,のに、「無事」などという言葉をつかうのはおかしいが、病院によってはなかなか退院を許さないまま、ずるずると寝たきり老人をつくっているところもあるから油断が
183,に，適切な場所に退院・退所を実現することではあるが，単に退院・退所先を見つけ出して退院を促せばいいわけではい。ソーシャルワーカーは，何より高齢者本人および家族の側に立ち，
184,親子三人が第三十代大統領カルヴィン・クーリッジの名を冠したプレジデント・クーリッジ号で日本に帰ったのは、夫の退院から一年目の千九百四十年であった。日本では神武天皇の即位以来、紀元二千六百年にあたるとし
185,でも計上します。（３）月の末日に入院し，その日のうちに退院あるいは死亡した者は計上しないでください。（４）この欄には，使用許可病床数にかかわらず
186,三十％以上をクリアしないと経営的に厳しい。高齢者の病態を考えても十七日以内で全快して退院となることは不可能である。看護職の役割として病院の経営の一端を担っている。
187,安定しているものの、退院できない患者が少なくなかった。入院期間の短い患者の多くはすでに退院を実現し、彼のような社会的入院患者、長期入院患者の退院支援が、病院の最重要課題になってい
188,安心の設計敬遠される長期入院診療報酬、九十日超で激減治らなくても退院“期限付きで”次へ高齢患者「行き場ない」医療が必要な高齢者が、
189,、焼き肉久しぶり〜〜ってお嬢も参加で女だらけの焼き肉パーチィ！昨日は父の退院・私は都大会終わってから合流父お昼お寿司が食べたい
190,にＮとｍ．来る。手続き（費用の支払い、締めて百九十五万円也）を終え退院。入院日数ちょうど三十日也。ｍ．の運転で帰宅、途中すし屋で昼食。
191,Ａ先生がいわれたことはみんな、夢か錯覚で、ほんとうに全快して二十一日に退院、と信じてしまうほどである。功、きっとそれはほんとうなのよ。二人で希望
192,も心配ないでしょう。若いから回復も早いと思いますよ。この分ですと、退院も近いでしょう」「先生、ありがとうございます」母は嗚咽を堪えながら、
193,眠ってちょうだい。そうすれば、朝、わたしを迎えに来る元気も出るでしょう。退院は八時の予定だから」長い沈黙があった。「今でもまだ、
194,今回の制度は「入院文化の変革」と東京医科歯科大病院の西岡清院長はいう。検査が終われば退院。治療方針が決まったら再入院し、治療が終わればまたすぐ退院、となることが想定さ
195,のベルケイド治療が始まりますので、この後の血液検査、マルク？！の結果次第では、退院もあるかしら・・・なんて勝手に想像しながら夫と話していました。
196,他術後看護のポイント「慢性硬膜下血腫患者の看護」の項（ｐ．二百六）に準ずる。◆退院に向けて知的障害などの機能的予後が問題となる。家族へシャント合併症の観察方法の指導を
197,医者に質問したりできないのかもしれなかった。そうこうしているうちに、十三日には退院ということに決まった。そのことを知らせてきた電話で、真理子が
198,たが、笑い声も出るようになった。入院生活は一週間で終わった。退院の前になると、フィジカル・セラピスト（身体調整士）が松葉杖を持ってきて、恢子に
199,の対応等についての議論を進めており，今後は，良質な医療を効率的に提供し，退院を促進する体制づくりや精神病床の基準病床数の算定式等について，具体的に検討することとしている。●
200,けどかゆくてたまらん様子。一日一日とリハビリの成果も順調に表れています。退院も決まり、ぽんこのブログ復帰も近いことなので、代筆の私の役目もクランクアップを
201,までの日数が明らかに違います。もちろん、すべてに感謝している患者さんのほうが、退院は早くなります。毎日感謝し、楽しい入院生活を送っていると、身体も喜び、病氣
202,と言います。病院へ入って（入院して）快復してその病院から退きます（退院）
203,。この場合も退院基準の例外の原則化により形成されていて，基準は前述した。退院についての求意見の制度まではないが，４月経過以降必要的に退院を検討することになっている。
204,主治医が家族に「９割９分９厘は脳死状態。最悪の植物状態となり、安定すれば退院も」と説明十一２回目の高気圧酸素療法実施。カルテに「あまり汚れないうちに終わりに
205,られるようになったら退院出来るでしょうね」とか「もっと元気に歩けるようになったら退院ね」とか言うと「御飯はおいしいし、さっさと元気に歩けるよ」とその
206,帰院後は落ち着く。三月二十二日今日が退院だと思い、待っている。三月三十一日退院のため娘さん来院し、おやつ摂取後、退院となる。■治療方法この患者で、当初いちばん
207,た。家に戻りたくて、リハビリ途中だが強引に退院許可をもらう。ヘルパー再派遣退院により停止していた訪問が再開。この時、ヘルパーの交替があり、私がＡ子さん
208,手術してもらうことになりました。これでおふくろも大丈夫やと思います。一ヶ月もしたら退院やて言うてますねんけど」「そらよかったな」「このたびは
209,女性は赤線で、それらの線の最後に転帰を示しています。家庭への退院が◎、老人ホームへの退院が○、同じような痴呆病棟や一般病院への退院は
210,ました。だから勝手に助けてこうなった自分が悪いと思って、泣きながら退院を待っています。今彼女と会ったら自分はなんて顔で会えばいいのでしょうか
211,は，おおむね２種類ないし２段階で行われる。１つは，救急・急性期患者のための一般病院からの退院のときであり，もう１つは，介護療養型医療施設および介護老人保健施設などの病状安定期ないし慢性期の患者のため
212,」は、個人ファイルに綴じ込み、金庫に保管する。十．様式個別の教育支援計画十四入院、退院、再入院等による転出入の多い、病気の児童生徒に対して一貫した個別の支援を行っている病弱養護学校
213,のは、秒針つきの時計。これぞ陣痛の友ですから」。赤ちゃんグッズＣＨＥＣＫ！退院のときの、ベビーキャリー（左）と肌着やおむつ（右）。寒いといけない
214,大いなる葛藤を表現していたのではないかと思う。抑えようとしても、溢れるようにわきあがってくる退院への希望があったからこそ、彼らはいっそう激しく夢を否定しようとしたのではない
215,ある。と、あなたが拘束の説明を求めると、こう答えると思います。先ず退院を決意してあげてください。私はケアマネなのですが、先日も、お婆ちゃんと同状態の
216,て現る。夕刻、アクセスのＡＹ・ＭＹの両君。７月６日（金）Ｈ医師と退院を十日（火）とする旨打ち合わせ。午後、浩志会のＹＳ・ＴＨ・ＹＴの諸氏、ｍ．
217,。心臓手術と聞くとやはり気になりますが、つぎにニュースにでるのは「退院」ではなく、大急ぎで活動にもどるマザー・テレサなのです。奇跡的な回復がつづくので
218,ようなことを続けていくうちに患者の興奮は徐々におさまりました。しかし、退院になるまで薬を飲んでもらえず、退院後も家族に薬を混ぜて食事を
219,帰るとさすがに嬉しかった。母親の喜美は赤飯をたき、御馳走を作り育江の退院を心から祝ってやるのだった。「退院おめでとう。よかった。本当によかった
220,が健在で羽振りがよかった大奥様の時代に戻ったかのようであった。「退院」の知らせが母に活力を注入したのであろう。私たちはまた苦笑した。けれど
221,なくてよくなる、あと三、四日経って、外光と音に対して反応しなければ、退院だ」一心の胸に深い感謝の思いがこみ上げて来た。「先生、
222,かなーって待っている子供たちもいますよ。点滴につながれた退院なんてほんとうの退院じゃない。きちんと手ぶらで両足で歩いていっぱい食べて帰ってらっしゃい！！！
223,中間的処分であるので除いている。）。保護観察処分少年で解除を受けた者は２万三千五百十七人，少年院仮退院者で退院の措置を受けた者が二百十一人，仮出獄者で不定期刑の終了を受けた者は十人
224,気にしながら申し上げておるのでありますが、いわゆる植物人間については治療手段がないとして退院を強要されるケースが多く見受けられるわけであります。そういう話もずいぶん持ち込まれて
225,て金具で血管を広げつまりかけていた所を直したそうです。とりあえず明日退院となりました。まだ安心はできませんがひどく心配しなくてもよいよう
226,回数が減ってきたが、じん不全を起こしかけて人工透析をうけた。幸い回復したが退院までに四十日もかかったそうだ。まさにコレラタケである。三十年ほど前には東京都
227,。もう、種差行だめだろうね？」「どうして？」「だって、早くって退院まで十四日だって。そのあと、二十日ぐらい無理がきかないんだって…。夏休みを
228,聞いたところでは、父親は脳腫瘍で入院し、摘出手術は無事成功した。しかし、退院の直前に病巣跡を確かめるための脳造影検査の最中に急変し、ショック死したのだった。「
229,なります。一定期間でタンを検査し、２ヶ月〜３ヶ月の間菌が検出されなければ退院でした。結核でなければいいですね。
230,献木、植樹などで数百万も寄進したがよくならず、退院―再発、入院―退院の繰り返しの年月だった。阿含に入信してすぐ、七十三歳になるご主人の
231,た。このときは３か月半のあいだ、腹腔内の膿みを出しながら輸血と点滴を行ない退院となりましたが、その後十一月ごろになってまた肝機能が低下して非常に危険
