,0
232,。６月７日には「完治。再発の恐れもない」というたいこ判を押されて退院。だが、業界ではソフトバンクは覇権的で横暴だ、という批判が高まりつつあった
233,痴呆が進んだかな？と思うようになったが驚くほどの回復力を見せ退院も近いかなと思っていたら今日先生から説明を受けた「こられたとき
234,私どもの経験では、一〜三か月のうちにほぼ日常生活に支障がなくなる方が多い。退院はこの状態でも遅くとも手術後四週間以内に可能である。現職の人は手術後四〜五日で
235,いう。検査が終われば退院。治療方針が決まったら再入院し、治療が終わればまたすぐ退院、となることが想定されるからだ。「患者さんにも新しい制度を理解していただかなけれ
236,か。ミスを怖がらずに積極的なプレーを心がけたい。大藤敏行監督滝公男監督亀谷選手が退院ベンチ入りはせず夏の高校野球選手権大会前に発熱で大阪市内の病院に入院し、一、二回戦を欠場し
237,ないで待ってるよ。で、ウマちゃん、奥さんは」「…ああ、三日後に退院だ」「あら、本当。よかったじゃない。おめでとう」彼女の屈託のない
238,退院身内以外にも、夫のことを心から心配してくれる人がいました。
