,0
0,。問五月十九日は何曜日か覚えているか。答わかりません。問野球場には入場料を払ってはいったのか。答そうではありません
1,書かれた詩です。ちょうどこの年に、東京ドームが完成しているようです。あの広い野球場に屋根をつけるなんてことは、当時はちょっと想像もつかないことでありました。
2,に行った。平日だからきっと空いているに違いないと思っていたところ、驚いたことに野球場は満員だった。「どうしてこんなに混んでいるのかしら」と隣に座っている観客
3,将来はないといえる。野球を楽しむ子供たち（フロリダ州セントピーターズバーグ）サッカー人気に押される野球野球場から消えてしまった少年たちは、いったい、どこへ行ったのか。テレビ・ゲーム、コンピューター・ゲームに
4,映画や観劇で、お煎餅をボリボリ大きな音を立てて食べられたら迷惑だし、野球場やその他のスポーツ観戦に於いても、熱くなったファンが空き瓶や缶を投げ入れては
5,ものア停車場の乗降場または荷物積卸場。ただし、上屋を有する部分に限る。イ野球場または競馬場の観覧席。ただし、屋根を有する部分に限る。ウガード下を利用して
6,の前に野球場や野球用具を選手以上に心を込めて手入れすることが重要です。野球場を愛し、大切にしていると、その日の土質や凸凹の程度、日当たりなど
7,・午後・夜間の３区分になっています。大規模施設と位置付けられる総合体育館や明神池運動公園の野球場、なゆたホール、文化センター大・小ホールは、今までと利用区分は変わりませんが、それ以外
8,電話申込制問ＮＰＯ法人アエス■■☎■■■■■■■■野球大会抽選会４月６日（日）から藤代スポーツセンター（野球場）と取手緑地運動公園で行われる、市民春季野球大会の抽選会を行います。〈日時〉３月二十三日（
9,）／サッカーＵ‐二十一チャンピオンカップ十五日（土）、十六日（日）／国体ブロック大会ラクビー競技●野球場二十一日（金）〜二十三日（日）、二十五日（火）〜三十日（日）
10,その後五年間はわずかな時間を見つけては練習し、毎夜、暗くなってからは野球場の照明の下でボールを打ちつづけた。ピートは二年とかからずにハンディキャップなしの
11,ず、自己もただひとつのものではない。百ヤード先の白い染みが見えるほど明るい、野球場のような照明がついた商店街を通って、ぼくたちは駅にもどった。パチンコ屋
12,二百円幼児無料安くて楽しいファミリープールグリーンラインと呼ばれる、緑あふれる道を行くと、野球場の照明塔が見えて、総合公園に到着。「小学生未満入園無料」のプールは何とも嬉しい
13,＋ハッピ−カラ−＋ハッピ−ほんのり一言！＞＞＞野球場・黄色緑色・なんてことないょ〜空を見ろッ！
14,野球場や野球用具を大切にすること監督やコーチは、練習や試合の前に野球場や野球用具を選手以上に心を込めて手入れすることが重要です。野球場を愛し、
15,千九百八十）三月にかけて、建設省環境整備事業とタイアップして犀川緑地公園を新設した。左岸上流側の第一緑地は野球場、サッカー場、テニスコート、芝生広場からなり、下流側の第二緑地は、野球場、テニスコート、馬場、
16,箇所数では三百五十箇所、面積では二百七十五万ｍ２それぞれ増加している。次に、公立の野球場を設置者別にみると、九十四．八％（前年同期九十四．一％）に当たる千八百七十六箇所（千五百三十二箇所）が市町村立であり
17,では狭いのではないでしょうか。。清原がライトスタンドぎりぎりにホームランを打つためには理想ですが、野球場としては疑問がつきます。あなたのおっしゃるとおり！むっちゃくちゃ狭いです。要するにホームランが出やすい
18,遊びに来るということにしておいた。この辺りは、東京オリンピックとやらで駒沢の野球場がオリンピック公園に変わった頃から住宅地として人気を集めたらしく、この頃に移り住んだ方々
19,、聞くほうにとって少しばかり差があるのも事実だ。女性の場合は、野球場のアナウンスをはじめ、「ウグイス嬢」などの愛称で好意的に迎えられがちだ。そこへいくと
20,さらには外野フェンスの有無や形などによるクッションボールの予測、イレギュラーの起こりやすい場所など、その野球場のコンディションをできるだけ多く把握することが可能になります。これらの情報をより多く
21,などにも配備の必要性が高いと想像される。また当然のことながら，競技場や野球場，国技館，ホールなど人の密集する場所への配備も進めることが望まれる。■
22,野球場でホームベースから１塁を結ぶラインの外側に、もう１本途中からラインが引かれています
23,利用者だけではなく、観客にも配慮され、さらに防災施設としての役割をも兼ね備えた新しい野球場のあり方として、非常に大きな可能性があるという評価から、特定事業者を選定しました。
24,６年」を適用できるものもあります。（参考法令等）耐通２‐３‐６（野球場，陸上競技場，ゴルフコース等の土工施設）二百七電動式横引シャッター【質問】当社は，中古車販売を業
25,＞遠い昔、日本海博覧会が開催された跡地に出来た広大な西部緑地公園です。野球場、競技場、パークゴルフ、サッカー４つの巨大催事場。こんな可愛いプロムナードも広がっています。
26,東に抜けると、古代人の生活ぶりをしのぶ「古墳・はにわ博物館」があり、南に回ると野球場などのスポーツ施設がある。コースは野球場の横（仁王門の下）から、南西に
27,は、監督１人で所属選手全てを指導するのは不可能です。また、監督が校務多忙などで野球場に毎日出られないような場合も、十分に選手を鍛えることは難しくなります
28,は橋の南側になるはずだった。こちらの北側には、約三十年前からユネスコ村や野球場などが造られていて、一般の民家は建っていなかった。車はまた
29,第一の「構築物」の「競技場用、運動場用、遊園地用又は学校用のもの」に掲げる「野球場、陸上競技場、ゴルフコースその他のスポーツ場の排水その他の土工施設」とは、野球場、
30,青山練兵場に建設が始まった。当時の代表的施設は、明治記念館（現在結婚式場）、聖徳記念絵画館、野球場、国立競技場である。青山通りから見事なイチョウ並木を抜けると正面に噴水があり、その奥
31,十九）１億七千百七十五万円▲鉄輪温泉地区の石畳化と駐車場整備（Ｈ十七〜Ｈ二十一）２億六百九十九万円▲実相寺中央公園内に野球場を建設（Ｈ十八〜Ｈ十九）２億七千八百七十五万円目的税別府市の市税のうち、都市計画税と
32,。左岸上流側の第一緑地は野球場、サッカー場、テニスコート、芝生広場からなり、下流側の第二緑地は、野球場、テニスコート、馬場、自由広場、ちびっ子広場、花壇などからなる河川運動場である。犀川・千曲川の河川敷
33,、大変大きなハウスがたくさんあるのですが、その渥美の人たちも行ってびっくりするぐらい、野球場が二つ入る、それが十五棟もあるという、大変なハウスがあるというので、
34,思ってた。でも《プリーズ・プリーズ・ミー》をみんなの前で歌ったときから変わった。野球場と相撲場で先生にいうべきことをいって騒ぎをおこしたり、学校でビートルズを
35,いきなり現われたり。半年前には他の警官たちとパーティーでばか騒ぎをしている最中に、野球場のピッチャーマウンドに発砲したとして、三十日間の停職処分を受けたと聞いている。私
36,プレパラートはまことにわずかな面積だが、そこで宇宙塵をみつけるのは、たとえれば野球場のスタンドから望遠鏡で、グラウンドにおちたビー玉を探すようなものだ。標本が
37,、都道府県立施設は七十箇所（前年同期六十七箇所）で、市町村立施設は七百五十四箇所（七百三十三箇所）である。ウ野球場昭和五十七年３月三十一日現在における公立野球場は二千九百九十九箇所（前年同期二千七百八十九箇所）で、その面積は四千百五十一万３千ｍ２
38,の住宅といい、基地内にあるプール、プライベート・ビーチ、ジム、教会、レストラン、ゴルフ場、野球場、ボウリング場、スロットマシンなどはすべて米軍経営で、地元沖縄当局の管轄権は一切及ばない。これこそ
39,と比べると、箇所数は三十一箇所、３．５％、面積は五十八万４千ｍ２、３．１％それぞれ増加している。野球場は三千五百三箇所（前年同期三千三百八十箇所）で、その面積は五千二百六十一万７千ｍ２（五千五十一ｍ２）となっている
40,舞台に熱戦繰り広げられる第二十三回高山市長旗・飛騨市長杯争奪社会人野球大会第二十三回高山市長旗・飛騨市長杯争奪社会人野球大会が８月８日、古川町下野のサンスポーツランドふるかわ野球場と、高山市の中山公園野球場で開催され、息の詰まる熱戦が繰り広げられました。
41,文化財保護法に基づく文化財の保護助成に要する経費の合計。７．公共スポーツ施設とは、陸上競技場、野球場、水泳プール、体育館等のうち、国または地方公共団体が設置し、直接管理・運営している施設または法令等に基づい
42,みるみる曇っていくにちがいありません。ポジティブな使い方をするには、たとえば、野球場やサッカー競技場などで興奮しながら観戦しているとき、パーティーや飲み会などで話が盛り上がっているとき
43,選手に伝えて入れば、そのチームの未来は輝かしいものになるはずです。●野球場や野球用具を大切にすること監督やコーチは、練習や試合の前に野球場
44,発育する芝生が開発される可能性はありますが、メンテナンスのコストを考えると、それを野球場に導入するのはかなり難しいでしょう。メジャーのセーフコーやバンクワンのように、屋根が移動する
45,。（フランクリン・ルーズベルト大統領が第二次世界大戦中に大リーグの試合続行を支持した「グリーン・ライト書簡」）●昨年は、野球場に行くより多くのアメリカ人がコンサートに行ったらしい。これはこの国にとって危機の
46,広告用のネオンサインは、「器具及び備品」の「看板及び広告器具」に該当する。（野球場、陸上競技場、ゴルフコース等の土工施設）（９）別表第一の「構築物」の「競技場用、
47,現役の頃の長嶋監督の話長嶋監督は野球場の食堂に用意されたバナナを食べる時癖がありました。バナナの皮を
48,当たる六十二箇所（六十箇所）が都道府県立である。ウ野球場昭和五十三年３月三十一日現在における公立の野球場は、第八十二図にみられるとおり、千九百七十八箇所（前年同期千六百二十八箇所）であり、その面積は二千八百三十八万ｍ２
49,も身に覚えのある現実生活に近いのかもしれない。以下にご紹介するのは、すべて野球場でのお話である。キャッチャーのシュローダーにメロメロになっているルーシーは、いまや世界的に
50,愛唱されている歌。一人が一回歌うことを１シンギングとして大まかに計算すると、一年間に野球場だけでのべ千万シンギング、道頓堀での合唱やカラオケなどを入れると、一億シンギングくらいになる
51,省令別表第一の「構築物」の「競技場用，運動場用，遊園地用又は学校用のもの」の「野球場，陸上競技場〜その他の土工施設」の耐用年数「三十年」を適用することとなります。また
52,となっており、春の開花時期の約１ｋｍにわたる桜のトンネルは壮観である。公園内には野球場、テニスコート等の総合運動場が併設されている。１千代田区富士見・九段北〜新宿区市ヶ谷本村町、本塩町十三
53,利用できます。櫛形総合体育館バレーをはじめ、バドミントン、卓球、バスケットボールなどいろいろなスポーツを楽しめます。野球場センター百二十ｍ、両翼九十一ｍ。メインスタンド及び、外野芝生スタンドを備え公式試合のできる野球場です。トレーニングルーム体力増進
54,・降雪が多い地域では、耐雪性のある構造のものを使用する。・テニスコートや野球場などのネットフェンスでは、フェンスの網目にボールが入らないように、網目の大きさ
55,を楽しめます。野球場センター百二十ｍ、両翼九十一ｍ。メインスタンド及び、外野芝生スタンドを備え公式試合のできる野球場です。トレーニングルーム体力増進へのアプローチとして、各年代に応じた自主トレーニングができる器具を備えてあり
56,椅子に座り直し、リトルリーグパーク上空で次々と演じられる華やかな光のショーを眺め続けた。その野球場は、私の家のちょうど真後ろの方向、松や楓の木が立ち並ぶ、背
57,を含みます。「もの」とは、施設と用具のことです。施設は野球場のことで、用具はグラブやユニホーム、スパイクなど身に着けているものから、ボール
58,もプロトコルである。グランドデザインＡ◆「ビルの一階の飾りつけじゃろ」Ｂ◆「野球場のグラウンドに、ホームチームのマークを描くこっちゃな」Ｃ◆「これはそんな
59,た。「まあな。陸幕調査隊…ってところか」陸上幕僚監部調査第二課別室、もしくは調別。野球場のような巨大レーダー基地を使って、軍事的脅威とされる近隣諸国の通信を傍受したり、やはり
60,ているのでしょうか。平成十九年、伏見桃山運動公園として、保存が決定しています。運動公園内には、野球場と、サッカーをターゲットとした、多目的運動場ができるようです。現在は工事中ですので
61,であり、残りの８．８％（９．０％）に当たる六十二箇所（六十箇所）が都道府県立である。ウ野球場昭和五十三年３月三十一日現在における公立の野球場は、第八十二図にみられるとおり、千九百七十八箇所（前年同期
62,でいるのではないかと不安になる。「ホームプレートを中心に、左右対称に広がる空間」という野球場の基本概念がまったく通用しないのだ。球場は全体に右側にひしゃげたような形を
63,「野球場、陸上競技場、ゴルフコースその他のスポーツ場の排水その他の土工施設」とは、野球場、庭球場等の暗きょ、アンツーカー等の土工施設をいう。（耐通２‐３‐６）注
64,に変えてみるのです。不思議と肩の力が抜けてラクになります。野球場でデートをしているのであれば「あのピッチャーはどんな選手なの？」こんな
65,駅名と、橋本くんの唇に残っていた口紅がもたらした効用であろう。中井の野球場をすぎたところで、ガードレールに並んで腰をおろした。自動販売機でコカコーラを買っ
66,、郡山市フロンティア大使の中畑清さんが、高校時代の思い出がたくさん詰まった開成山野球場を視察しました。野球場の改修については、「どうせやるなら、ここまでヤッパイ！という意気込みを持ち
67,備えており、１日多目的に遊べる広場です。ご利用料金○陸上競技場高校生以下百円一般二百円○野球場高校生以下五百円一般千円※単位は１時間です。○コミュニティープール（６月〜９月）幼児
68,への心配り。・部費を含めた野球部予算の管理。・対外試合の数と質、野球場を含めた野球関係施設（室内練習場、ブルペン、ウエイトトレーニング場など）の充実に対する気配り。監督の役割
69,なされていることに注目せねばならない。その他婦人教育施設や青少年教育施設等に加えて，野球場や屋外運動施設，プール等は生涯学習を可能とするための文化施設なのである。現在社会においては，
70,にも自慢できる立派な球場にしてほしい」との熱いメッセージをいただきました。野球場を含む「開成山地区の整備」は、十一月十五日にプロジェクトチームを結成しました。平成
71,支障が出るからで、必死に汗を流している感じがした。またレクリエーション施設も野球場、ボウリング場、テニスコート、アスレチッククラブと、ひたすら身体を鍛えるためのもので、ここに暮らして
72,、その雲が急激に頭上に張りだしてきたりするとき、いつまでも畑や野球場でぐずぐずしている癖がある。最初の大粒の雨がかたわらの緑色のペンキを塗っ
73,、全長二千三百ｍのゴーカート。おすすめの眺めは高さ約二十ｍの橋梁の上から右手にみえる野球場だ。●アトラクションデータ￥１人用九百円、２人用千所要時間／４〜５分※雨天中止ＭＡＰ
74,ピクニック広場は無料。問ハイランドハウス（☎九十六．二一一七）９岩木山総合公園ナイター設備を備えたテニスコートをはじめ、野球場、全面芝生の多目的グラウンド、体育館、野外ステージなどがあります。所百沢字裾野時午前
75,始業のチャイムは、もはや完全に忘れられていた。十五時三分。見原は懐かしい野球場のベンチに座っていた。今日は前日よりも忙しかった。なにしろ、途中で
76,リトルリーグの試合など何年も観に来ていなかった。町はずれにある野球場の駐車場に入って、球場のにおいや歓声を体いっぱいに吸い込んだジェイリッドは、なぜ
77,しのぶ「古墳・はにわ博物館」があり、南に回ると野球場などのスポーツ施設がある。コースは野球場の横（仁王門の下）から、南西に向かって延びている。しばらく田園の境
78,思い出の地で惨めに引きずり回しただけだった。で、彼女と初めて出会った野球場で、精魂尽きた。まあ、腕時計を見ればもう三時になっている。そろそろ
79,の床面積は、その上屋の占める部分の乗降場及び荷物積卸場の面積により計算する。３野球場、競馬場またはこれらに類する施設の観覧席は、屋根の設備のある部分の面積を
80,大判振る舞い●なんでも建設◆家族住宅１万千二百九十五戸（千九百七十九年度から）◆学校◆郵便局◆ゴルフ場◆体育館◆野球場◆プール◆テニスコート◆銀行◆ガソリンスタンド◆病院◆劇場◆教会◆対爆シェルター◆駐機場◆整備用格納庫◆空母用
81,を痛感したからである。現在、大学生協と組んだ全国各地の大学のほか、テークアウト店や野球場で利用されているとのこと。販売額は総売上高の１割程度ながら学生の環境問題への関心
