,0
0,―自分が王子様だったなんて！金の甲胄に身を固め、たくさんの騎士を従えて、白い馬を乗り回すあの王子様だったなんて！そして優しいお妃様が、
1,・・。男嫌いのジリオラと騎士の契約をするも、『一心同体』であるはずの騎士と剣には程遠く、まったく力を引き出せないまま戦いに挑み、敗れ去ってしまうが。
2,多くの人々がそこに立っているのを見た。彼らは驚いて逃げ去った。騎士は霊魂たちに守られたのだった。（二十一）マルティルデ・ハインによる印刷「哀れな
3,目を離さず、物柔らかだが芯の強い声で応じた。「兄上よ、騎士が跳ねて開き王手だ。二手で詰む。あいにくだったな」しかし、ハスジャール
4,があると」「ン…」フォイゾンは立って、控えの間でその騎士と短いやり取りをしてもどってきた。ドアの閉じる音が、パットフットに
5,どう見てもその姿を見れば、明らかに同じサーフ地方の出身であることがわかる騎士がいた。髭もたくわえ、体軀も大きい、だが、背が高くて、
6,、そのへんの事情は先にいって明らかにされるであろう。機知に富んだ騎士ドン・キホーテ・デ・ラ・マンチャ後篇第二十五章ここでは驢馬の鳴きまねの冒険の発端が語られ、次いで人形師
7,かは、もちろん勝手なのだが、オレが堂々たる戦いを挑んだと周囲の騎士、兵士に示すことが肝心なのだ。一太刀で決める。オレは十分に
8,個人的には今回のほうが好き。二十ｈアン・ドゥムルムステールの作品は映画『ジャンヌ・ダルク』の中世の騎士のよう。黒いラインの描き眉は今回も登場したけれど、この強い眉がデザイナーの
9,見た。中世文学における聖杯の寓話―ガウェイン卿と緑の騎士に関する論文「緑の騎士の寓話です」ラングドンは叫び返した。「だめね」ゲタムは言った。「
10,絵に近づいた。「下がれ、下賤のホラ吹きめ！下がりおろう、悪党め！」騎士は再び剣を握り、剣にすがって立ち上がろうとしたが、刃は深々と草地
11,その者でございましたか？」「うむ…」ダントン卿と呼ばれた騎士は、大きく頷いて虎王の側に寄った。「これは、虎王殿では
12,高くて、他のリンバーグの騎士たちに比べるとほっそりとした体型をしたその騎士は、年はもちろん、ジークにとって父と同じほどの年頃だったが、旅の
13,ドン・ロレンソが言った、「そんなに多くの美徳を身につけた遍歴の騎士が、はたしてこの世に存在したものか、また現在いるものかどうか大いに疑問だ
14,投げだし、そのまま、深い眠りにおちこみ、ひとつの夢を見ていた。昔の騎士になり、救いだした王女のテントの前で寝ずの番をしていた。
15,の騎士たちが守り続けた壮大な城郭建築や、攻防戦の様子をリアルに再現できる「レゴ騎士の王国」全十アイテムが発売された。この新製品は、城や砦、決戦場など
16,つきます．・ｈｅｌｍｅｔ：オートバイに乗る人やアメリカン・フットボールの選手がかぶるヘルメット．中世の騎士の鉄仮面など．・ｈａｒｄｈａｔ：工事現場で作業者がかぶる完全帽．建設現場で着用する
17,ことで勝てるはずもない。しかし、彼女はさすがに幾多の戦場を経験した騎士だった。慎重に言った。「わたしの力では到底切り伏せることがかなわない
18,本当だとも」「ほら、またそんなふうに言われると、あなたが白馬の騎士だと信じたくなってしまうわ」自制心が崩れていくのを感じながら、彼女は言っ
19,「幼児アーサーが生まれた瞬間から養育を任されたマーリンは、赤ん坊をエクターという騎士の手にゆだね、その妻がアーサーに乳を吸わせた」。面妖千万な
20,は、『黒騎士』の美しいユダヤ娘、エリザベス・テイラー（当時まだ二十歳だった！）が愛する騎士、ロバート・テイラーの命を救うために悪役のジョージ・サンダース（だったと思う）に身をまかせ
21,は成功させなければならない。それもシュタウフェンベルクを死なせることなく、だ。とまれ今は、騎士の役を演じることである。「さて、何処へ行こう？アンネッテ、君が
22,から、これからいいなずけの顔見てもラクチンだー”という保身ができるんですもの。騎士なら遊女の願いを聞き入れ、そのことは墓に入るまでいいなずけには言わず、
23,暗闇まんまとノットをだますことに成功したモルガナは、黒いマントの騎士を乗せた馬が闇のなかへ消えていくのを見届けると、意地悪く笑いながら
24,た。「だからこそ、流れているときにせめてだいじにしたいのは羽根飾。騎士が帽子につけてるあれよ。自分が恥をかいても他人には恥を
25,愛の前にすぐれた騎士道がなければならない。このためにも最もすぐれた騎士との間には友情と連帯が求められる。トリストラムはブランウェインを通しイゾルデの
26,城のテラスまで移動したんです。一瞬だけど、城内の様子が見えました。騎士の首が落ちていた。そこらじゅうに血が飛び散っていた。城の内側でも
27,結婚したことを聞くと、愛の裏切り行為に激怒し、これまでトリストラムを世界のどの騎士よりも愛していたが、今後は不俱戴天の敵として許さないと宣言する。このこと
28,のスペシャルカード円卓の騎士編に比べると相変わらずアルガス騎士団編は人気が高いですね〜。おそらく円卓の騎士だったら千円台・・・高くて二千円台だろうね。いったい何種あるのかはイマイチ把握出来
29,そそっかしい普通の青年でありますし、マーベル殿は、気はお強いようですが、とても優しい騎士で…」「その話はまただ。ピネガンは、死に急いでいる。そこ
30,→王族の姫（王子）十四〜十六→貴族の令嬢（御曹司）５〜十四→騎士１〜５→盗賊、魔術師騎士だ
31,（十四世紀、ブルターニュで行われた「トレントの戦い」やフランスとイタリア双方の十三人の騎士を戦わせた千五百三年の「バルレッタの決闘」）。たしかに、この礼儀正しい戦闘方法
32,んです。道をご存じありませんか？」「探求であったか！」騎士の怒りはとたんに消え去ったようだ。鎧をガチャつかせて立ち上がると、騎士
33,材料なのだ。名と武勇のすべてが身分を証覗する旗印に込められている。騎士の誇りに掛けても素姓を偽るようなことができるはずはなかった。
34,狼狽えたようにオレを見ながら、それでも構えだけは取った。オレは騎士の儀礼に則り、相手の剣とかるく刃を合わせた。その金属音で、
35,の主人で、あなたではありません―私はあなたの生まれ同様自由です、そしてどの騎士の美徳でもあなたと太刀打ちできます。あなたがその名を汚すときでも、私
36,のための犠牲と、妻と子のための配慮である。ゼムパッハの戦いで、騎士の槍を束ねて、それを己の胸に押しつける前に、彼はこう叫ぶ
37,考えではありません。ハーグで知りあったある才人のピエモンテ人、サルディニアの使節で騎士ルヴェルという人の考えです。彼の言うには、神、すなわち、われわれとわれわれ
38,てリンの国の騎士が虎王の前へ進み出た。「おお！」騎士が虎王を見て声を上げた。「ダントン卿より以前伺ったことのある
39,。連れ帰った竜の姿を見て、ザインの騎士たちは驚愕した。年配の騎士のなかには、その竜がクリシュの転生竜であることを知って、恐怖に震え
40,、辱めから王妃の名誉を守るためであったこと、その戦いの原因は不実な騎士の策略であったことなどを、王の前に堂々と釈明したのでした。
41,て通り過ぎた。子供たちが廊下に出たところで、ゲイルはデュークに言う。「騎士は嫌いでも、軍人は嫌いじゃないんだろう？戻ってこいよ。少し我慢すれ
42,つもりじゃないんだ」「それに…それに私、お姫さまなんかじゃないから。勝手に騎士やっても間抜けに見えるだけだわ」「そうだよ―こんな女はいくら
43,ダリア、すまないがゼア殿を迎えに行ってくれないか？」横にいた騎士が口を挟んだ。クロフォード教官の台詞から考えるに、セルヴィアス騎士団の団長なのだろう。
44,できるかよ」「君だって男じゃないか」「おれはいいんだ。騎士だからな」ミシェルはさっとエレインの手を引き、右の通路へ入る。
45,と思ったのだが、思うよりも先に―ジークは尋ねてしまっていた。騎士は、答えなかった。やはり、と思う。そうだろう、何らかの不都合な
46,ホリエモンがどんどん好きになってきました。腐敗した日本のマスコミ業界に、挑戦する白馬の騎士＝それがホリエモン。
47,、あの恐ろしい半人半馬の怪物、あの半人間、あの縞のついた虎、あの戦っている騎士、あの角笛を吹いている狩人、あれはいったいなんの目的のためのものなのだろう
48,世界最高の騎士の花がみな滅び尽くされることになる。それもすべて凶を招く二人の騎士の仕業である。二人とはガウェインの弟アグロヴェインとモルドレッドである。このアグロヴェインとモルドレッドはグィネヴィア王妃
49,たらどうするか」と聞くと、「戦いたい、しかし本当をいえば、あの騎士ほど気高い騎士はいない」と讃える。この後自分の宿舎に招き大歓待する。二人
50,うちに、ある妄想に取り付かれた。それは、自分が物語にあるような騎士であり、巨人や悪魔や魔法使いなどの悪をくじき、悪人にさらわれた王女を
51,騎士らしき人と主人公は兄妹だったような・・・それで魔女は魔女の騎士らしき人に「そういえばお前も人間だったねぇ・・」といってた
52,イメージの光力が増している。同じような方法で、ガイラー・フォン・カイザースベルクは、千五百八年、敬虔な騎士を褒め称えている。私たちは、墓地を通りかかるときには霊魂のために祈るある
53,が、全体を撮ってもあまり意味がないかと、気に入ったペガサスと騎士の精緻な部分を撮ってみました。やっぱり好きなレンブラントもいっぱいあって嬉しかった
54,の晩年期の兵力が記されている。この記載事項によると、下記の通りとなる。※騎士１人に従者が４人の本役の場合は、総計が、五万二千二十五人となる。※騎士
55,たいして権力の掌握を使嗾していた。ヤンがうなずけば、彼みずから配下の“薔薇の騎士”連隊を指揮して、高官たちの逮捕にのりだすかもしれない。ヤンは口を開いたが
56,映画のスターウォーズみたいに正義の騎士を育成して悪い奴らを合法的に抹殺できるようにしたらどうでしょうか？賛成。まず
57,ば、一旦ここは退却し装備を調えて再戦に臨んだかもしれない。しかし、彼は騎士―それも恐れを知らぬ“壊滅騎士”だった。躊躇なく得物のスイッチを入れる
58,音響装置に張りついていた。机の隅から、ロボットに似た薄気味悪い中世の騎士の模型がこちらを見つめていることを除けば、なかなか居心地がよい。ヘッドフォンをつけ
59,の頁を割いている。ラテンアメリカに五時間でショーニュは輝き、バルザールに小ジョッキ一杯でデュビーは騎士に叙せられる。厳かな耳にロンバルディアという単語を囁けば、ル＝ゴフは他人
60,「母君のことは覚えておられますか」ある時、サーフ地方出身と思われる騎士は、他の騎士たちがいない時に、そっと、ささやきかけてきたことがあった。
61,→騎士１〜５→盗賊、魔術師騎士だーーー！騎士といえば幻騎士ｗ
62,フォイゾンが声をかけた。「ハッ、ナゲーマンの巡察にいっていました騎士レトゥメ・クェッセグが、急ぎご報告したいことがあると」「ン…」フォイゾンは立っ
63,の音が通りに轟き渡った。というのは、裁判官の前後に整然と十二人の騎士が馬を駆り立てていたからである。暗殺者たちは驚いたが、夜の軍勢の後
64,のある、クリスタル・パレスの騎士の広場のあたりの光景であった。そこに残されて騎士の広場を守っている、ゼノン軍の金犬騎士団のすがたが見える。「ほうら…こうして
65,は、戦いを挑んで叫んだ。「偽りの裏切り者。あるときには円卓の騎士であったメルワスよ、出てきて戦え。われランスロット・ド・ラックが、あなたに戦いを挑む
66,世界のどんな花よりも！その花を踏み荒らすものがいれば俺は花を守る騎士になる！それが紅音也だ！ゆり〜愛しているぞぉ！！」音也、
67,のを許せなかった。彼はストロングボウを牽制するため千百七十一年十月、完全武装した一団の騎士、歩兵、射手の精鋭をみずから率いてウォーターフォードに上陸した。これをみてストロングボウ
68,ばかりではない。農奴や平民の犠牲にあぐらをかいて、ふんぞりかえっているのは、騎士の行いに非ずとも思うた」言葉の内容とは裏腹に、淡々と
69,十八歳で詩集『眩惑』に魅了されての〈アンナ体験〉以来、「アンナという貴婦人に仕える騎士」（フランシス・スティグミュラー）となったコクトーは、以後、彼女との青春期の思い出を胸中
70,も振る。（問題小説十二月号）イザベル藤田宜永（ふじた・よしなが）千九百五十年福井県生れ『鋼鉄の騎士』により日本推理作家協会賞、『愛の領分』により直木賞を受賞。近著―『流砂』『
71,非道卑劣な奴。おまえのような者が生を享けているのが残念至極。すぐれた騎士をみな殺そうとする人殺し。おまえの悪意と復讐狂が、この世の最もすぐれた気高い
72,がギムの国から逃がれて来たらしいのですが」促されてリンの国の騎士が虎王の前へ進み出た。「おお！」騎士が虎王を見て
73,われわれがひとたび認めた目的に兵士の態度をもって一直線に行軍することである。この革命の騎士の態度は、政治的兵士の態度と名づけてよいだろう。われわれは、「兵士的」という
74,な気分になることがある。／昨秋（千九百九十四年）来日したカルロス・クライバー指揮ウィーン国立歌劇場によるリヒャルト・シュトラウスの『ばらの騎士』の音楽は、ほんとうの夢以上に、いや、ほんとうの夢では不可能と思える
75,自意識はそういう緊張のなかで発展したのだった。教師と学生は市民、騎士、托鉢修道士と同じく、ラテン的ヨーロッパ社会の新しいタイプになった。新しい大学は当時の世界で
76,城や砦、決戦場などのミニフィギュアを駆使して迫力ある決戦シーンを再現できるジオラマセット５アイテムと、騎士の可動式組み立てフィギュア（高さ約二十センチ）５アイテム。さらに、新発売を記念してアメリカ・カリフォルニア州にある「レゴランド
77,戦いに泣くばかりである。片方の騎士（ランスロット）は「これほど見事な戦いぶりの騎士は初めてです。お名前を教えてほしい」といえば、もうひとりは「教えたくあり
78,、それに酔いしれているような暇はない。オレは周囲を取り巻く、ロマールの騎士、兵士たちを睨みつけながら、ゆっくりと剣を下げていった。不敵な笑みを口許
79,新宝島｜千九百四十七｜火の鳥｜千九百六十七｜ジャングル大帝｜千九百六十六｜ブラック・ジャック｜千九百八十二｜リボンの騎士｜千九百五十三｜
80,そのときその裁判官が疾走して行った、彼の前と後に六人の武装した騎士がいた。襲撃は行われなかった、そして三度目に暗殺者たちが十二人集まったとき
81,トリストラム卿は、全速力で駆けつけるとこう言った。「この悪辣な騎士め、すぐにその騎士から手を放せ」。そしてトリストラム卿は二人の騎士のうち一人を突き刺すと、相手
82,なんとも言えないような〜。いや・やっぱうれしいっ♪読む前に、妖精国の騎士を読みとおさねばかしらん。。。（何年か前に十巻くらいまで読んだっきりだ
83,近くの城の城主が彼女を救い自分の城にかくまう。この後パロミデスはこの騎士とも戦い、倒してイゾルデの居場所を開き出す。城門が閉ざされ、なかに入れ
84,ますね＾−＾まずは・・・エリアの騎士十四巻毎回楽しみにしているエリアの騎士ですが・・・発売されてるの知りませんでした（●￣▽￣●）ゞぽりぽり先月発売され
85,『オンディーヌ』の水の精のように出会った騎士に心を奪われ、そして騎士は彼女を妻にしたいと願っているのだ。しかし結婚は彼女が適応できるような
86,ＯｕｔｏｆＷｅａｋｎｅｓｓ）』というものであった。表紙の剣を持った二人の騎士のイラストにも心を引かれたが、何よりも題名が、私の日頃感じ
87,貫いた。「いろいろ出るのお」声に揶揄する調子はない。黒い騎士と白馬を月光が包み、秋の夜はさらに更けようとしていた。Ｄ
88,があなたを愛し、あなたも愛を返しているのですから。しかもこの世で最も卑劣な騎士、王があなたの夫であり、この世で最も憶病で非道な人間があなたの夫
89,遍歴の騎士としての資質を持っているかどうかのテストよ」「遍歴の騎士はふつう報酬をもらわない。するとぼくは金を受け取らずに純粋で高潔な同情から
90,ても、別の巨大な竜の首があらわれて、かっと開いて逃げようとする騎士の馬の足を口にくわえてふりちぎる。横転する馬から地面に叩きつけられた騎士
91,あるとき、突然、呪われた者たちが待ち伏せて、彼を打ち殺そうとした。騎士は逃げるように警告された。呪われた者たちは騎士の後を追った。
92,これからの物語に面白みを加えてくれるポイントになってきそうです。親子２代にわたる騎士と剣と姫の物語はまだまだ深い謎が隠されているようです。
93,は阿蘇博士といわれた松本唯一熊本大学名誉教授と古手の阿蘇測候所員。このときタジェフは中世の騎士が身につける兜のついたジュラルミン製の防護鎧を着用しており、用意のよさに感心し
94,ところにあり、たたかう自己意識は命がけのたたかいによってこの価値の存在をあかそうとする。騎士に出会ったら決闘をいどむことが武勇のあかしだとすれば、騎士道にあっては武勇
95,長髪が多いのはそこに理由がある。「相変わらず、騎士嫌いだな」「碌な騎士に会ったことがないからな。ここのノーザン公でも取れる騎士位なんてクソ食らえだ
96,対象として見られることを嫌がります。性の対象として見られることもイヤです。騎士のように自分を守ってもらいたいのです。当の本人は意識はしません
97,ところかららしいが、それがアルフヘイムに敬意を表す象徴として見なされ、よって騎士でなくとも長く伸ばすものが多い。長い髪など戦うのに邪魔でしかないだろうに
98,１〜５→盗賊、魔術師騎士だーーー！騎士といえば幻騎士ｗ
99,たあの方、いったい何者なんでしょうかね？名前も風貌も、またみずから遍歴の騎士と名乗っていることも、すべて僕と母さんを当惑させることばかりですからね。」
100,武者修行の騎士です、としかトリストラム卿は言わなかった。こうして卿はアーサー王の騎士に出会うまでは、王と一緒に行くことにした。それからしばらくして、エクター・ド・マリス卿
101,ドン・キホーテが答えた。「たしかに、世の大半の人びとは、この世に遍歴の騎士なんぞ存在しなかったという考えにとらわれている。そして天が何か奇跡的なやり方でもっ
102,のまま縛り上げられ寺院に監禁された。しかし縛られた手足を解き、監視の騎士を倒しながら窓から逃がれ、すでにハンセン病者の小屋に閉じ込められていたイゾルデを救出し森
103,の単位が五つで一分隊となり、五分隊が小隊と呼ばれる。つまり、七十五人の騎士、小姓という編成になる。ホークウッドの場合は、フランスの戦争以来、彼の威風
104,この手にもめげずに告白しない人間は、まれであった。なるほど、新入りの騎士をうけいれる儀式は、ふつう夜明け前に、会合室で、秘密裡におこなわれ、その部屋のまわり
105,おもにキリスト教徒の巡礼の保護などを目的とする武力をもった修道会のことで、騎士でありながら修道士でもあるそのメンバーたちは、新しい時代のエリート層ともいうべき人びとでし
106,せると、ある城の小塔に着いた。するとその城のなかで、一人の騎士が徒歩で二人の騎士と戦っていた。それでトリストラム卿がそれを見ていると
107,増すことなどを知り、早速に採用した。すでにウマイヤ朝のはじめには、アラブの騎士はこれを用いはじめていたもので、エジプトからジブラルタルまで数千キロの征服行をなしとげたの
108,。サクラはんちゅう渾名の、田中旭はんや。ほら、あのよう肥えた―」第十二章《リボンの騎士》に関して１「―いやあ、ひどい目に遭ったぜえ。警察の奴
109,たシャンパンのボトルが一本。「喉渇いただろう。…どうぞ」まるで、騎士が姫君の前で膝を折るように、優雅な所作で礼をとって彼
110,盲導犬』（再演）、十一月、蜷川幸雄演出、日生劇場＊☆。『電子城―背中だけの騎士』（再演）、十一月、目黒不動☆。千九百九十年（平成二年）五十歳小説『電気頭』
111,発せず、戦い続ける。それぞれの小姓はあまりに激しい戦いに泣くばかりである。片方の騎士（ランスロット）は「これほど見事な戦いぶりの騎士は初めてです。お名前を教えてほしい
112,までいますし。派遣村は、左翼による反政府活動だったいうことですね。転載元プロイセンの騎士ｈｔｔｐ：／／ｂｌｏｇｓ．ｙａｈｏｏ．ｃｏ．ｊｐ／ｔｈｅ＿ｋｎｉｇｈｔ＿ｏｆ＿ｐｒｕｓｓｉａ／２８５１９０３８．ｈｔｍｌ
113,「あら」彼女は扉から手を離してうなだれた。今夜、傷を負った騎士は残らず手当てしたのに、マルコムの手当てだけはしなかった。彼が私
114,騎士に恋をしてしまう。しかし上流社会に生きる人間の例に漏れず、この騎士は気まぐれだった。二人は結ばれるが、やがてオンディーヌの裏切り、恋人の死を
115,。彼らは、ローマの廃墟に佇んで、かつてコーラ・ディ・リエンツォが、近くでは雄弁な騎士にしてフィレンツェのカピターノ・デル・ポポロ（人民隊長）であったステーファノ・ポルカーリが成し遂げたような共和国的自由
116,試合で赤袖の騎士が大活躍したことを話すと、その騎士こそ自分の愛している騎士であり、楯を預っているという。ガウェインがその楯を見るとランスロットのものである
