,0
117,ていたのは、黒板を使って特殊クラスを教えている教師だけだった。光り輝く白い騎士は、使い潰され古びたがらくたの山になっていた」（アームストロング前掲書）教育そのもの
118,。今回はアーサー側と戦うつもりなので身元を隠すには好都合と考え承知する。しかし騎士が婦人のしるしを着けて戦うことは、その婦人に愛と奉仕を誓っている
119,ドッカリ座り込み、兜の前面を押し上げて汗まみれの顔を拭った。「あの」騎士が疲労困憊しているのに乗じて、ハリーが声をかけた。「僕たち、北塔
120,関係ありまへん―」「実はですね。星城氏の所からは、《リボンの騎士》や（双子の騎士》も盗まれているんです。まさか、それがそうでは
121,、このトリストラムの惨状を憂い「ひとりの婦人の愛のためにあれほどの気高い騎士がこのように傷つき狂気になるとは悲しい。会って慰めたい」とトリストラムの
122,・。この結果はちょっとキツイな・・・。同じく抽プレ品のパノラマキラ『九人の騎士』は相変わらずの人気なのに対してこちはら下落の一方の様です。５万円で売れ
123,書かれた名前から、観る者が素直にイメージできる場所を提供しているのだ。城／騎士の間城に入って一番初めに見た部屋が、本作ラストで、犯人との
124,サムライ（侍）とナイト（騎士）果たしてどっちが強いのか？？私がお答えしましょう。戦いにおいて、勝つというの
125,たんです」封印の冠を目指して突き進むミツルは、進路を阻む者すべてを、騎士であれ城の文官たちであれ、情け容赦なしに風の大魔法の刃で斬り捨てていったのだ。
126,戦士のような、グラディエーターに近い格好をしていたが。幻影の中の騎士は昼と夜とを越えて竜を駆り続け、やがて一つの町にたどり着く。
127,で、次回に戦う場所、日時を決めた。その日その場所にトリストラムはパロミデスらしき騎士がやってくるのを見る。二人は激しく戦うこと四時間、全く勝負はつかず
128,。アルカーヌムの月の魔法がつかわれる場所といったら、当然、このあたりでは騎士の墓ということになる。が、それでもこのせっぱつまったときに、そのようなひらめきの
129,命はアタラモ王にお預けいたそう」「と、言われると？」エルの国の騎士が聞いた。「リンの国へ連行する！黙りはアタラモ王の前で続け
130,甲胄をつけて戦いました。最初の一撃でアグラヴェインを殺し、あとの十二人の騎士も倒しました。ともに逃げたいという思いを王妃は胸に抑え、二人
131,にとらわれている。そして天が何か奇跡的なやり方でもって人びとに、遍歴の騎士は過去にもいたし現在もいるという真実を理解させないかぎり、説得のいかなる努力
132,ウルリーという。ある騎士と戦い、相手を殺すが、自らも傷つけられる。その騎士の母はこれを恨み、世界最高の騎士がその傷に触れない限り治らないという
133,しまおうとしたメルワスの計画は失敗した。今や彼は、たったひとりで世界最強の騎士と立ち向かわねばならなくなったのである。メルワスの臆病な心は、彼の胸
134,た歓待に心からの謝意を表したうえで、立ち去る許可を求めた。遍歴の騎士たる者が、いつまでも安閑として贅沢に身をゆだねていることはあまり望ましいこと
135,手塚治虫ＯｓａｍｕＴｅｚｕｋａ［千九百二十八―千九百八十九］▶十六歳頃から「鉄腕アトム」や「リボンの騎士」，「ジャングル大帝」など手塚治虫の描いた漫画は，発表されてから数十年後の今日
136,なりますか。クレティアン・ド・トロアの『ランスロ』だとか。宮廷風恋愛というのは女城主に騎士が言い寄り与えられた試練を乗りこえ、ハートを射止めるが、肉体関係にまでは行かない
137,信じられている。ミカエルは、ガブリエル、ラファエルと共に大天使である。宗教画では、騎士の姿で描かれている。ラ‐ヴェルナ山は千二百メートルほどの高さで、キュージの領主オルランド伯爵の
138,順番にひとりひとり名前をあげ、ある者には出自までも付け加えている。このように騎士のリストをあげるのは馬上槍試合にも見られるが、百十人全員の名をあげるのは
139,とすることあらば、カドガン卿を呼ぶがよい」「そりゃ、お呼びしますとも」騎士がいなくなってからロンが呟いた。「誰か変なのが必要
140,ところに出会う。トリストラムはその騎士を助け相手を次々と倒していくと、リーダーの騎士、あの卑劣なブルーズ・サン・ピテは自分の城に逃げ込んだ。助けたのがパロミデスであること
141,は、自分のほうにこそふさわしいと思っているふしがあった。戦闘能力の高い騎士として戦場にも何度も赴いたことがあるユハス王子だが、彼の戦い方は乱暴で、
142,冷たいものが走ったほどだ。とはいえ、脅迫されて引き下がったとなれば騎士の面目を失う。だがいち早くフィンデンが僚友の腕を摑んだ。「軍内部
143,見せてもらった子兎が珍しく、面白くて、つい、声をあげて笑うと、その騎士はしみじみとした口調で話しかけてきたこともあった。「あなたが、そんなふう
144,からなおさらである。ところがこの季節、五月というのにいまいましい暗い凶事がもち上がり、世界最高の騎士の花がみな滅び尽くされることになる。それもすべて凶を招く二人の騎士の仕業
145,明かりですら、夜空にまたたくかすかな星のようにしか見えなかった。「騎士の墓にかくれてみたって、なんにもならないわ」リーザが低くすがるような声
146,が『ウルリー卿の治癒』である。ソースは明らかではないが、不治の傷を負った騎士を連れている妹がアーサー宮廷にやってくる。騎士の名をウルリーという。ある
147,も思えませんが」伯爵が肩をぴくりと持上げた。ところが他の人達は騎士の回りへ寄って来た。やがて彼が教祖がかりの勿体ぶった口調で、先を
148,階段をあがって、フォイゾンの居室の区画にはいった。「では…」騎士が退出し、クワッサマが、居室づきの侍従長に、パットフットを預ける。「ご苦労さまでした
149,との争いのなかでどのようにすぐれたキリスト教徒としての騎士になるのか、騎士の婦人への愛とはなにか、このことについてのマロリーの新しい視点は、
150,バーナードの元に寄り、試合で赤袖の騎士が大活躍したことを話すと、その騎士こそ自分の愛している騎士であり、楯を預っているという。ガウェインがその楯を
151,預っているという。ガウェインがその楯を見るとランスロットのものである。娘にその騎士の名前を教え重傷を負っていることを話すと、娘は父の許しを得
152,三人は騎士を追って、鎧の音を頼りに廊下を急いだ。ときどき、騎士が前方の絵の中を走り抜けるのが見えた。「各々方ご油断召さるな
153,ているものでもある。「よくぞ、来てくれました。世界で最高にすぐれ気高い騎士と謳われている方よ、ようこそ。狩りにかけては第一等の人、竪琴
154,それからアーサー王のところに戻るとこう言った。「王よ、ここにあなたの騎士が一人いますが、あなたとともに行くでしょう。今日、わたしがあなたのため
155,たとえば『ルツィドール』や『アラベラ』や『薔薇の騎士』において。しかも『薔薇の騎士』では、男役を演ずる女優が娘に扮するという二重の形で、この変装
156,ゴロヴィーナ伯爵夫人は書いている。「スウェーデン国王は黒い服と肩にかかる髪のために、気高い騎士のような御姿に見えた…。」グリム宛の手紙を書くエカテリーナは、さらに積極的
157,が、不治の傷を負った騎士を連れている妹がアーサー宮廷にやってくる。騎士の名をウルリーという。ある騎士と戦い、相手を殺すが、自らも傷つけ
158,は国王に匹敵する経済的勢力をも獲得するにいたった。騎士団を構成したのは、騎士だけではない。土着民や解放奴隷や改宗回教徒から成る補助的なグループもあって、その頭目は
159,恨みを返すべきだと言うのだ。武器を持たぬ人間を殺すのはジェダイの騎士に外れた道。しかしアナキンはパルパティーンの言葉に耳を貸し、残虐にもドゥークー
160,弱そうな面構えをしていながらなかなかの策士ではないかと推察。赤と緑の騎士まず、主人公は王子だとか公子だとかいった身分の高い青少年である
161,にさだかならぬ記憶かたつむり日月遠くねむりたる薫風や打つべく口に入れし釘薫風や騎士のごと相摶ちし蜂南風のみよや一枝もためらはず驟雨くるくちなしの香を踏みにじり草矢高く
162,、王から大歓迎され、円卓騎士となる。アーサーの歓迎のことばはまた作者のこの騎士への共感を示しているものでもある。「よくぞ、来てくれました。世界
163,です」「母の…出自となった家のことはご存じですか」騎士は、さらにためらった。それから、うなずいた。「まさか…母の一族と関わり
164,戦いにおいて、勝つというのはいかに相手の隙をつくかによって決まるのです。侍と騎士の刀を比べて見ましょう。あきらかにナイトの方が重い剣ですね。対して
165,のある薬草を見分けるために本草学者である必要がある。傷を負うことの多い遍歴の騎士が、そのたびに手当てをしてくれる者を探し歩くわけにはいきませんからな
166,を斬って騎士を落馬させようとする。しかし、このとき、これまた心得のある騎士なら、みずから横っ飛びに鞍から飛んで、地上の徒士に襲いかかるのだ。とくに騎士
167,た。そして、才能はあるがまだ未熟な若者ルーク・スカイウォーカーを教え導く老師として、かつての騎士、超能力者ベン・ケノビがいる。ベンはルークにことあるごとに言います。「心の
168,武勇が知られるようになった。十年後、ポアティエの戦闘で、殊勲をあげ、騎士に任ぜられた。平和が成立すると、彼は、百人ばかりの部下を引きつれ
169,するとトリストラム卿は言った。「用意はできています。あなたが言うその立派な騎士をお助けしましょう」。「その方はまさしく」と湖の乙女は言った。
170,愛の結末ブレーメンの音楽隊―冴えない男たちの反乱人魚姫―浮気な王子とひたむきな騎士裸の王さま―詐欺と承知で家臣を試す幸福な王子―生身の王子を愛し
171,上に置いたのだった。出てきたのは、虫プロのテレビ・アニメ《リボンの騎士》のセル画数枚と、たくさんの《リボンの騎士》の単行本だった―星城家から
172,２人の関係は徐々に変わっていく。最後に、生まれ故郷の知人が扮した銀月の騎士に敗れたドン・キホーテは、約束どおり村へ帰る。そして、死ぬ間際に正気に戻り、
173,、二度とジークはそのことを母に聞くのをやめたのだ。髭面の騎士は、重く、うなずいて黙った。（サーフ地方の者たちは血族の絆が強固
174,廊下の向こうから呑気に手を振ってノーザン公が近づいてきた。厳格そうな騎士が一人、その後ろについてきているが、あまりの緊張感のなさに、カセル
175,でも、この王国を正しいほうへと導いてきたというのに。それに、騎士にとってもっとも大事なことのひとつは、信念に忠実であることであったはず。シド
176,の名において立っているのでなかったら、私はあなたに戦いを挑むでしょう、あなた自身、騎士の慣習に従って返答しなければならない。―そうだ。あなたの武装した騎馬兵に目くばせするが
177,見えてきたとき、三人はキラがどこにむかっているかに気づいた。「いま騎士の墓へいくのは危険だって、オレたちさっき話しあったばかりじゃないか―」ニールス
178,、ブノワ・カンブルラン（ティンパニ）ＤＤＶ二万四千百二十六￥千九百八十カミレッリ：管弦楽作品集（バレエ組曲「マルタの騎士」、コンチェルティーノ第４番「マルタの夏の夜」（２台のための）、４つの
179,ところに乗り込んで、殺しまた敗走させ、ランスロットの危機を救う。二人の最高の騎士の友情である。またガウェインを、落馬させ殺そうとしていた最も卑劣な騎士ブルーズ・サン・ピテから
180,「そうだよ」あっさりと肯定した。「だから、お礼なんて言われても騎士はとまどうだけだからね」冗談の声だった。「お礼なんて言うつもり
181,やって来たオンディーヌは、彼女の魅惑的な美しさに心を奪われた勇敢な騎士に恋をしてしまう。しかし上流社会に生きる人間の例に漏れず、この騎士
182,。中世に於ては戦争があると領邦君主は「封臣」、すなわち城の騎士や下僕を差し出した。しかし次第に傭兵を募るようになっていった。とはいえ領封等族、
183,瞳も紫ではなく、晴れ渡った空のように真っ青だったが、夏紀にはその騎士がラウレンティウスに見えてしかたなかった。もっとも彼は、騎士というよりは、まるで
184,の入団許可をあたえた。これは非常に名誉なことのはずだったが，新しく騎士に任ぜられたスペイン貴族たちは，まったくといっていいほど感謝の念をいだかなかった
185,，法律の制定や新課税には下院の承認が必要になった。イギリスでは騎士がはやくから軍事的性格を失って地方のジェントリ（郷紳）となり，州を代表して
186,が決まるや、すぐに有名な俳優アルフレッド・ラントが演出家に起用された。ファラーは当然騎士を演じることになる。こうした面々が決まって資金の調達も保証され、ニューヨークの
187,を絶するものがあった。全国の子供達がラジオにかじりついて聴いた「新諸国物語・白鳥の騎士」（原作北村寿夫）が放送を開始したのはテレビ開局一年前の昭和二十七年。あの、女湯
188,、一枚。胸元にあふれるフリル、スカートをななめに横切って流れ落ちるフリル。中世の騎士のように袖口だけにフリルを飾ったシンプルなブラウス。沖田行介の眼の中
189,騎士だな？」「はい、そうです、わたしはト‐リオン、ガダレスの騎士です」「申し出はありがたいがね、竜騎士、これは子供の熱病だ。ふつう
190,を褒め称えている。私たちは、墓地を通りかかるときには霊魂のために祈るある騎士の話を読んだ。騎士はそこで我らの父に祈り、霊魂たちを主なる
191,「良かった、百点満点の百二十点！」という出来。そして「ドン・キホーテ」。主人公の騎士のおかしくも、もの悲しい夢と生涯が、風格に満ちた堤さんのチェロと団員の
192,、稽古の時間がとれるのか心配になりますね。前回の舞台『リボンの騎士』では、半年以上を稽古中心にあてたことで、今までのハロー！の舞台
193,か？いきもの？！！・・・・・・チンク。（ＢＹリボンの騎士）これが浮かんだのはなぜ？？？？■キャラクターを考える時によく思いつく
194,には，政治的・宗教的理由によってアンヴェルスは衰退し，かわりにオランダのアムステルダムが台頭した。最後の騎士ブルゴーニュ公国には，かつて華やかな騎士文化が花を咲かせていた。その象徴が
195,エル・トボソ憧れの姫ドゥルシネーアが住む村。ドン・キホーテ図書館がある。◆プエルト・ラピセドン・キホーテがでたらめの騎士の称号を受けた宿のある村。◆モンテシーノス洞窟ドン・キホーテが探検する。◆ベルモンテ
196,千九百一年）、《サロメ》（千九百五年）、《エレクトラ》（千九百九年）、《ばらの騎士》（千九百十一年）、《ナクソス島のアリアドネ》（千九百十二年）。自然を扱った《アルプス交響曲
197,見ると、動物は白が好まれる場合が多い。ヨーロッパ中世騎士物語の主人公たちは「白馬の騎士」であり、神の使いは白鳩である。古代日本が師と仰いだ中国でも
198,見つめた。なにしろ刀が長過ぎて、一段と激しく振った拍子にバランスを失い、騎士は顔から先に草地に突んのめった。「大丈夫ですか？」ハリーは絵
199,‐リオンに鋭いまなざしを向けた。「きみはイースタン大巖洞のペルスランを手伝った青銅の騎士だな？」「はい、そうです、わたしはト‐リオン、ガダレスの騎士
200,（劇場？）なんですけど覚えてるのは、主人公が少女で魔女と魔女の騎士みたいな人がでて魔女が町の人々を次々とレゴブロックの人形みたいなの
201,身につまされる思いとオーヴァラップしているのではないか。またある時はトリストラムは、ひとりの騎士が十人がかりで襲われているところに出会う。トリストラムはその騎士を助け相手を次々と
202,たとえ同じ漢字でも、文化が違えば意味するところも違ってくるわけです。騎士と《真珠》の関係を、中世の騎士道精神の焼き直しだから無国籍とは言えない
203,の課題を担わされているわけだ。空想の世界で、弟をオオカミから救う騎士になるのは、現実からの逃避でもあるし、そうなりたいと願う、
204,動物にまで変身してしまうというものだった。もうすこし前には手塚治虫の「リボンの騎士」があった。これは男の子つまり王子様としてふるまわねばならないお姫さまの「変装」物語である
205,と同じように、神の愛の問題を重要な主題とした。すぐれた騎士、イゾルデを愛している騎士パロミデスがいつキリスト教徒となるのか。また原トリスタン系のもので
206,閉め、何者の侵入をも許さぬ構えだ。そこに、黒馬に跨った騎士の姿があった。仄かな街灯は、その巨軀をおずおずと照らし出し、身に
207,くるほど頭の悪い敵がいるとは思わなかったらしい。地響きをあげて迫る騎士の姿に、床から立ち上がった吸血鬼はわずかに驚いたように瞠目する―しかしそれ
208,も鎮圧されたが，領主層の窮乏はますます深刻になっていった。とくに中小領主である騎士のなかには，国王や大諸侯に領地を没収されるものが多かった。さらに十四〜十五世紀
209,…）明確な言葉ではなかったが、そんな答があった。将軍の護衛らしい騎士、兵士が、迫りくる竜の姿にあわてふためく。同時に、天幕が開いて、ひとり
210,は避けなければならない。後代の槍騎兵は、ふつうは四人だが、ホワイト・カンパニーでは三人、騎士、従者、徒歩の小姓という中世の伝統を守っている。この三人の単位が
211,九月二十三、二十四日、ミラノ近郊の都市パヴィーアで、イル・モーロ主催の馬上槍試合が行われた。パレードや騎士の衣装など、レオナルドはこの祭典の種々の美術面を担当した可能性が考えられる。
212,憎悪していたパロミデスは今度は必死に元気づけようとする。後に城主はこの黒楯の騎士の名前を明らかにし、残った息子二人と仲良くしてくれるという条件で釈放した
213,の者で、今、健在な者はいますか」ジークラードの問いに、騎士は考える顔になる。だが、慎重に言葉を選ぶようにして、話してくれ
214,からやってきた、金髪の姫と銀髪の少女。勘違いから、彼女たちの”騎士”にされてしまったサツキの運命は！？「ジリオラ！この方です
215,。それは歌声だった。「―アァ、青白い馬とォ、青っちろい騎士ィ―」ジィドが、逃走しながら歌を口ずさんでいるのである。ローテはかっとき
216,欲しいということです。これらの願望をひと言で言えば、下心のない勇敢な騎士に守られたい、ということです。こういう無条件で自分を守ってくれる騎士の存在
217,上での緊張をほぐしてくれる、とジークは思った。どうして、この護送の騎士のうちにこの者が加わることになったのかわからないが、ジークはその偶然を
218,の巣窟ともなっているのはそっちのほうなんです。というのも、有力な騎士や貴族の邸では、名だたるいかさま師たちも、おいそれとは得意の手を使いかねますから
219,グィネヴィア王妃に追放されたランスロットは、狂気となり二年余り放浪することとパラレルである。すぐれた騎士は愛を失ったと思うと、正気を失ってしまう、それほどに深い愛―
220,せたに違いないのです…」「違います、母親は全然関係がありません」騎士がはっきり言い放った。「それは違いますわ！あの親子は同じ一室に
221,のジリオラは男に戻ったボクを見てなんだかショックを受けてるし、敵の騎士は容赦なく勝負を挑んでくるし、同級生の笈也さんはなぜかぼくに女装ばかりさ
222,多くの作品で示してきた。たとえば『ルツィドール』や『アラベラ』や『薔薇の騎士』において。しかも『薔薇の騎士』では、男役を演ずる女優が娘に扮する
223,探しているところであったが、トリストラムと出会うと、現場に急行する。アーサー王が二人の騎士に倒され甲を脱がされて魔女により殺されるところに、トリストラムは現れ騎士二人を
224,の、黒い具足をつけた若い武将が槍をかざし、これを両側から七、八名の騎士がまもり、真っ先に川へ乗り入れて来た。そのうしろから、約五百の部隊
225,の前までは…」パットフットが馬車から降りたときに、侍従のクワッサマと騎士のあいだでそんなやり取りがされた。クワッサマにすれば、わずかでも、
226,街を歩いて私を送り届けてくれた渉が、多分、少女時代を思い出させる白馬の騎士か何かに見えたのだろう。彼女の強引さには、人を苦笑させると同時
227,低い梁を潜ると、天井の高い部屋に出た。壁面いっぱいにオレンジ系の鮮やかな騎士の絵が描かれている。馬にまたがるのはローマ軍の兵士だろうか。下の
228,『国交決闘』の騎士を探す為、こちら側の世界へやってきたのだが、騎士の剣であるジリオラは潔癖なまでの男嫌い、彼女が見つけた騎士様はなんと女装が
229,この悪辣な騎士め、すぐにその騎士から手を放せ」。そしてトリストラム卿は二人の騎士のうち一人を突き刺すと、相手は倒れ死んでしまった。そこでもう一人に向かって
230,がなかった。というのは彼の前にも後にも、三人の武装した騎士の姿が見られたからだ。騎士たちは皆、うなりをあげて疾走し通り過ぎて
231,桐ヶ谷亜喜：神谷浩史柴崇史：羽多野渉宮代琉一：寺島拓篤館石雅章：遊佐浩二他●黒豹の騎士〜美しき提督の誘惑〜●【キャスト】来栖牙：諏訪部順一ルロイ・カリウ：野島健児アーロン：
