265,取り組み,、「積極的にチャンスを生かす、チャレンジする」等、全般的に仕事に対する女子の前向きな取り組みを求めており、女子が職業人としての意識向上に一層努めることも期待される。第Ⅱ‐二十八図,"['、', '「', '積極', '的に', 'チャンス', 'を', '生かす', '、', 'チャレンジ', 'する', '」', '等', '、', '全般', '的に', '仕事', 'に', '対する', '女子', 'の', '前向きな', '取り組み', 'を', '求めて', 'おり', '、', '女子', 'が', '職業', '人', 'と', 'して', 'の', '意識', '向上', 'に', '一層', '努める', 'こと', 'も', '期待', 'さ', 'れる', '。', '第', 'Ⅱ', '‐', '二十八', '図']",['取り組み'],NO,取り組み,NO,NO
266,取り組み,、国際機関等すべての主体が参加して、公平な役割分担の下での連携・協働〔パートナーシップ〕による取り組みを行っていくことが必要です。前掲の環境教育等の推進や社会経済のグリーン化は、各主体それぞれ,"['、', '国際', '機関', '等', 'すべて', 'の', '主体', 'が', '参加', 'して', '、', '公平な', '役割', '分担', 'の', '下', 'で', 'の', '連携', '・', '協働', '〔', 'パートナーシップ', '〕', 'に', 'よる', '取り組み', 'を', '行って', 'いく', 'こと', 'が', '必要です', '。', '前掲', 'の', '環境', '教育', '等', 'の', '推進', 'や', '社会', '経済', 'の', 'グリーン', '化', 'は', '、', '各', '主体', 'それぞれ']",['取り組み'],NO,取り組み,NO,NO
267,取り組み,とどまっているが、ＳＣＭへの取り組みの第一歩といってよいだろう。このような取り組みを可能にしたのが、「情報共有」である。情報共有は、この事例で明らか,"['とどまって', 'いる', 'が', '、', 'ＳＣＭ', 'へ', 'の', '取り組み', 'の', '第', '一', '歩', 'と', 'いって', 'よい', 'だろう', '。', 'このような', '取り組み', 'を', '可能に', 'した', 'の', 'が', '、', '「', '情報', '共有', '」', 'である', '。', '情報', '共有', 'は', '、', 'この', '事例', 'で', '明らか']",['取り組み'],NO,取り組み,NO,NO
268,取り組み,とどまっているが、ＳＣＭへの取り組みの第一歩といってよいだろう。このような取り組みを可能にしたのが、「情報共有」である。情報共有は、この事例で明らか,"['とどまって', 'いる', 'が', '、', 'ＳＣＭ', 'へ', 'の', '取り組み', 'の', '第', '一', '歩', 'と', 'いって', 'よい', 'だろう', '。', 'このような', '取り組み', 'を', '可能に', 'した', 'の', 'が', '、', '「', '情報', '共有', '」', 'である', '。', '情報', '共有', 'は', '、', 'この', '事例', 'で', '明らか']",['取り組み'],NO,取り組み,NO,NO
269,取り組み,の最後ではなく、午後の最初に全校踊りとして位置付けていました。今日まで、その取り組みが継承されている訳として、次の３点が挙げられます。一つには、地域,"['の', '最後で', 'は', 'なく', '、', '午後', 'の', '最初に', '全校', '踊り', 'と', 'して', '位置付けて', 'い', 'ました', '。', '今日', 'まで', '、', 'その', '取り組み', 'が', '継承', 'さ', 'れて', 'いる', '訳', 'と', 'して', '、', '次の', '３', '点', 'が', '挙げ', 'られ', 'ます', '。', '一つには', '、', '地域']",['取り組み'],NO,取り組み,NO,NO
270,取り組み,十二年２月１日以前の１年間における開催集落の割合である。（地域住民が主体となった地域資源保全の取り組みの推進が必要である）農村には、現在でも農業生産活動に由来する伝統芸能、棚田等,"['十二', '年', '２', '月', '１', '日', '以前', 'の', '１', '年間', 'に', 'おける', '開催', '集落', 'の', '割合', 'である', '。', '（', '地域', '住民', 'が', '主体', 'と', 'なった', '地域', '資源', '保全', 'の', '取り組み', 'の', '推進', 'が', '必要である', '）', '農村', 'に', 'は', '、', '現在', 'でも', '農業', '生産', '活動', 'に', '由来', 'する', '伝統', '芸能', '、', '棚', '田', '等']",['取り組み'],NO,取り組み,NO,NO
271,取り組み,が、本県では「野生生物保護実績発表大会」、「学校関係緑化コンクール」等の開催、小・中学生の自主的な環境保全活動の取り組みである「こどもエコクラブ活動」の支援、小・中学生を対象に川や海の汚濁の原因が生活排水,"['が', '、', '本', '県', 'で', 'は', '「', '野生', '生物', '保護', '実績', '発表', '大会', '」', '、', '「', '学校', '関係', '緑化', 'コンクール', '」', '等', 'の', '開催', '、', '小', '・', '中学生', 'の', '自主', '的な', '環境', '保全', '活動', 'の', '取り組み', 'である', '「', 'こども', 'エコクラブ', '活動', '」', 'の', '支援', '、', '小', '・', '中学生', 'を', '対象', 'に', '川', 'や', '海', 'の', '汚濁', 'の', '原因', 'が', '生活', '排水']",['取り組み'],NO,取り組み,NO,NO
272,取り組み,（十九店舗）で、レジ袋の有料化が始まります。『飛騨市におけるレジ袋削減に向けた取り組みに関する協定』が９月十四日、飛騨市住民団体（飛騨市レジ袋削減協議会）と参加事業者、岐阜県ならびに飛騨市によって締結され,"['（', '十九', '店舗', '）', 'で', '、', 'レジ', '袋', 'の', '有料', '化', 'が', '始まり', 'ます', '。', '『', '飛騨', '市', 'に', 'おける', 'レジ', '袋', '削減', 'に', '向けた', '取り組み', 'に', '関する', '協定', '』', 'が', '９', '月', '十四', '日', '、', '飛騨', '市', '住民', '団体', '（', '飛騨', '市', 'レジ', '袋', '削減', '協議', '会', '）', 'と', '参加', '事業', '者', '、', '岐阜', '県', 'ならびに', '飛騨', '市', 'に', 'よって', '締結', 'さ', 'れ']",['取り組み'],NO,取り組み,NO,NO
273,取り組み,になって、地球規模の環境問題に関心が高まり、自然環境保全のために国境を越えた取り組みが求められるようになった。千九百九十四年時点でＥＵ域内の国境の総延長は約一万ｋｍに達し、,"['に', 'なって', '、', '地球', '規模', 'の', '環境', '問題', 'に', '関心', 'が', '高まり', '、', '自然', '環境', '保全', 'の', 'ため', 'に', '国境', 'を', '越えた', '取り組み', 'が', '求め', 'られる', 'ように', 'なった', '。', '千九百九十四', '年', '時点', 'で', 'ＥＵ', '域', '内', 'の', '国境', 'の', '総', '延長', 'は', '約', '一万', 'ｋｍ', 'に', '達し', '、']",['取り組み'],NO,取り組み,NO,NO
274,取り組み,に送り出してきた。「九十年前後、バイオブームが下火になって東レのバイオへの取り組みが一時的に停滞したこともありましたが、他社と共に蛋白工学研究所やバイオマテリアル研究所の設立に,"['に', '送り出して', 'きた', '。', '「', '九十', '年', '前後', '、', 'バイオブーム', 'が', '下火', 'に', 'なって', '東レ', 'の', 'バイオ', 'へ', 'の', '取り組み', 'が', '一時的に', '停滞', 'した', 'こと', 'も', 'あり', 'ました', 'が', '、', '他', '社', 'と', '共に', '蛋白', '工学', '研究', '所', 'や', 'バイオマテリアル', '研究', '所', 'の', '設立', 'に']",['取り組み'],NO,取り組み,NO,NO
275,取り組み,）排出を抑制することになり、地球温暖化の防止につながります。次のような取り組みを行い、生活習慣の見直しを図りましょう。●買い物には、マイバッグや風呂敷などを,"['）', '排出', 'を', '抑制', 'する', 'こと', 'に', 'なり', '、', '地球', '温暖', '化', 'の', '防止', 'に', 'つながり', 'ます', '。', '次', 'の', 'ような', '取り組み', 'を', '行い', '、', '生活', '習慣', 'の', '見直し', 'を', '図り', 'ましょう', '。', '●', '買い物', 'に', 'は', '、', 'マイ', 'バッグ', 'や', '風呂敷', 'など', 'を']",['取り組み'],NO,取り組み,NO,NO
276,取り組み,江戸前期の千七百十七（享保二）年から毎年行われているという。以前は青年による取り組みだったが、出場者減で千九百八十一年からは近隣の小中学校に参加を呼び掛けている。小学校,"['江戸', '前期', 'の', '千七百十七', '（', '享', '保', '二', '）', '年', 'から', '毎年', '行わ', 'れて', 'いる', 'と', 'いう', '。', '以前', 'は', '青年', 'に', 'よる', '取り組み', 'だった', 'が', '、', '出場', '者', '減', 'で', '千九百八十一', '年', 'から', 'は', '近隣', 'の', '小', '中学校', 'に', '参加', 'を', '呼び掛けて', 'いる', '。', '小学校']",['取り組み'],NO,取り組み,NO,NO
277,取り組み,セーフコミュニティで最も大切なものです。地域で積極的に勉強会セーフコミュニティは、地域での取り組みが何より重要です。市民の皆さんに理解を深め共に取り組んでもらうため市内の防犯団体,"['セーフコミュニティ', 'で', '最も', '大切な', 'もの', 'です', '。', '地域', 'で', '積極', '的に', '勉強', '会', 'セーフコミュニティ', 'は', '、', '地域', 'で', 'の', '取り組み', 'が', '何より', '重要です', '。', '市民', 'の', '皆さん', 'に', '理解', 'を', '深め', '共に', '取り組んで', 'もらう', 'ため', '市', '内', 'の', '防犯', '団体']",['取り組み'],NO,取り組み,NO,NO
278,取り組み,。行政と町民の協働関係をつくり、施策の点検、見直しを行い、今後の取り組みの方向性を検討するため、有識者、民間団体、関係行政機関の代表十六名からなる「壬生町男女共同参画推進委員会」並びに,"['。', '行政', 'と', '町民', 'の', '協働', '関係', 'を', 'つくり', '、', '施策', 'の', '点検', '、', '見直し', 'を', '行い', '、', '今後', 'の', '取り組み', 'の', '方向', '性', 'を', '検討', 'する', 'ため', '、', '有識', '者', '、', '民間', '団体', '、', '関係', '行政', '機関', 'の', '代表', '十六', '名', 'から', 'なる', '「', '壬生', '町', '男女', '共同', '参画', '推進', '委員', '会', '」', '並びに']",['取り組み'],NO,取り組み,NO,NO
279,取り組み,縁組みのことを牧之が問うたのに対し、市右衛門が「昔昔より聟も娵も取り組みは此秋山切りにて、里よりは迎えず。万一女抔が里へ出て里,"['縁組み', 'の', 'こと', 'を', '牧', '之', 'が', '問うた', 'の', 'に', '対し', '、', '市', '右', '衛', '門', 'が', '「', '昔', '昔', 'より', '聟', 'も', '娵', 'も', '取り組み', 'は', '此秋', '山', '切り', 'にて', '、', '里', 'より', 'は', '迎え', 'ず', '。', '万一', '女', '抔', 'が', '里', 'へ', '出て', '里']",['取り組み'],NO,取り組み,NO,NO
280,取り組み,位置づけ、直接的な関係組織の協力を得つつ、反対の国民世論の拡大に向けての取り組みを重視する。２独立行政法人の導入や公務員制度改悪反対、情報公開と行政の民主化を共通の課題,"['位置づけ', '、', '直接', '的な', '関係', '組織', 'の', '協力', 'を', '得', 'つつ', '、', '反対の', '国民', '世論', 'の', '拡大', 'に', '向けて', 'の', '取り組み', 'を', '重視', 'する', '。', '２', '独立', '行政', '法人', 'の', '導入', 'や', '公務', '員', '制度', '改悪', '反対', '、', '情報', '公開', 'と', '行政', 'の', '民主', '化', 'を', '共通の', '課題']",['取り組み'],NO,取り組み,NO,NO
281,取り組み,に、子どもたちのいたずら心、遊び心、創意性などが育っていくのです。第三は、この取り組みは、夕食会を企画・計画し、実際に準備していくことを二年生だけで話しあい、すすめていること,"['に', '、', '子ども', 'たち', 'の', 'いたずら', '心', '、', '遊び心', '、', '創意', '性', 'など', 'が', '育って', 'いく', 'のです', '。', '第', '三', 'は', '、', 'この', '取り組み', 'は', '、', '夕食', '会', 'を', '企画', '・', '計画', 'し', '、', '実際', 'に', '準備', 'して', 'いく', 'こと', 'を', '二', '年生', 'だけ', 'で', '話', 'しあい', '、', 'すすめて', 'いる', 'こと']",['取り組み'],NO,取り組み,NO,NO
282,取り組み,繰り返し使えるリユースカップが利用されたり、ホテルやレストランなどの生ごみをたい肥やバイオガスとして利活用する取り組みが進展するなど、あらゆるサービスにおいて環境への配慮が組み込まれます。給食サービス会社のＥ社,"['繰り返し', '使える', 'リユースカップ', 'が', '利用', 'さ', 'れたり', '、', 'ホテル', 'や', 'レストラン', 'など', 'の', '生ごみ', 'を', 'たい肥', 'や', 'バイオガス', 'と', 'して', '利', '活用', 'する', '取り組み', 'が', '進展', 'する', 'など', '、', 'あらゆる', 'サービス', 'に', 'おいて', '環境', 'へ', 'の', '配慮', 'が', '組み', '込ま', 'れ', 'ます', '。', '給食', 'サービス', '会社', 'の', 'Ｅ', '社']",['取り組み'],NO,取り組み,NO,NO
283,取り組み,」の検討を始めています。今回は、平成十八年度からの検討状況と今後の取り組みをお知らせします。※問い合わせ政策企画課（☎二千九百九十八‐九千二十七・ＦＡＸ２９９４‐０７０６）これまでの取り組み後期基本計画への,"['」', 'の', '検討', 'を', '始めて', 'い', 'ます', '。', '今回', 'は', '、', '平成', '十八', '年度', 'から', 'の', '検討', '状況', 'と', '今後', 'の', '取り組み', 'を', 'お', '知らせ', 'し', 'ます', '。', '※', '問い合わせ', '政策', '企画', '課', '（', '☎', '二千九百九十八', '‐', '九千二十七・', 'ＦＡＸ', '２９９４', '‐', '０７０６', '）', 'これ', 'まで', 'の', '取り組み', '後期', '基本', '計画', 'へ', 'の']",['取り組み'],NO,取り組み,NO,NO
284,取り組み,」の検討を始めています。今回は、平成十八年度からの検討状況と今後の取り組みをお知らせします。※問い合わせ政策企画課（☎二千九百九十八‐九千二十七・ＦＡＸ２９９４‐０７０６）これまでの取り組み後期基本計画への,"['」', 'の', '検討', 'を', '始めて', 'い', 'ます', '。', '今回', 'は', '、', '平成', '十八', '年度', 'から', 'の', '検討', '状況', 'と', '今後', 'の', '取り組み', 'を', 'お', '知らせ', 'し', 'ます', '。', '※', '問い合わせ', '政策', '企画', '課', '（', '☎', '二千九百九十八', '‐', '九千二十七・', 'ＦＡＸ', '２９９４', '‐', '０７０６', '）', 'これ', 'まで', 'の', '取り組み', '後期', '基本', '計画', 'へ', 'の']",['取り組み'],NO,取り組み,NO,NO
285,取り組み,は公用車の台数を年々統合整備し減らしていますが、なお一層の経費節減と環境への取り組みのため、公用バイクを１台導入し、７月十四日から使用を始めました。バイクは,"['は', '公用', '車', 'の', '台', '数', 'を', '年々', '統合', '整備', 'し', '減らして', 'い', 'ます', 'が', '、', 'なお', '一層', 'の', '経費', '節減', 'と', '環境', 'へ', 'の', '取り組み', 'の', 'ため', '、', '公用', 'バイク', 'を', '１', '台', '導入', 'し', '、', '７', '月', '十四', '日', 'から', '使用', 'を', '始め', 'ました', '。', 'バイク', 'は']",['取り組み'],NO,取り組み,NO,NO
286,取り組み,となるものです。めざすべき将来像・基本目標を設定し、その実現に向けて推進すべき基本的な取り組みを示しています。現在の第四次市総合計画は、「基本構想」、「基本計画」、「,"['と', 'なる', 'もの', 'です', '。', 'めざす', 'べき', '将来', '像', '・', '基本', '目標', 'を', '設定', 'し', '、', 'その', '実現', 'に', '向けて', '推進', 'す', 'べき', '基本', '的な', '取り組み', 'を', '示して', 'い', 'ます', '。', '現在', 'の', '第', '四', '次', '市', '総合', '計画', 'は', '、', '「', '基本', '構想', '」', '、', '「', '基本', '計画', '」', '、', '「']",['取り組み'],NO,取り組み,NO,NO
287,取り組み,に直接関わってくる深刻な問題」と述べております。さらに、温暖化防止の「第一の取り組みは、エネルギー効率の改善のための制度の整備です。二酸化炭素の削減のために厳格,"['に', '直接', '関わって', 'くる', '深刻な', '問題', '」', 'と', '述べて', 'おり', 'ます', '。', 'さらに', '、', '温暖', '化', '防止', 'の', '「', '第', '一', 'の', '取り組み', 'は', '、', 'エネルギー', '効率', 'の', '改善', 'の', 'ため', 'の', '制度', 'の', '整備', 'です', '。', '二', '酸化', '炭素', 'の', '削減', 'の', 'ため', 'に', '厳格']",['取り組み'],NO,取り組み,NO,NO
288,取り組み,、毎日十五分程度の散歩をする計画を立てる３３か月後、医療機関から手紙が届く。今後の取り組みのアドバイスを受ける４６か月後、再度医療機関を訪れ身体状況を確認。目標達成状況などを評価。体重,"['、', '毎日', '十五', '分', '程度', 'の', '散歩', 'を', 'する', '計画', 'を', '立てる', '３３', 'か月', '後', '、', '医療', '機関', 'から', '手紙', 'が', '届く', '。', '今後', 'の', '取り組み', 'の', 'アドバイス', 'を', '受ける', '４６', 'か月', '後', '、', '再度', '医療', '機関', 'を', '訪れ', '身体', '状況', 'を', '確認', '。', '目標', '達成', '状況', 'など', 'を', '評価', '。', '体重']",['取り組み'],NO,取り組み,NO,NO
289,取り組み,の建設に取り組みます廃棄物対策監■■■■これまで、ごみ問題について、各分野での取り組みや実情などさまざまな角度から掲載してきました。廃棄物（ごみ）は、古代,"['の', '建設', 'に', '取り組み', 'ます', '廃棄', '物', '対策', '監', '■■■■', 'これ', 'まで', '、', 'ごみ', '問題', 'に', 'ついて', '、', '各', '分野', 'で', 'の', '取り組み', 'や', '実情', 'など', 'さまざまな', '角度', 'から', '掲載', 'して', 'き', 'ました', '。', '廃棄', '物', '（', 'ごみ', '）', 'は', '、', '古代']",['取り組み'],NO,取り組み,NO,NO
290,取り組み,の建設に取り組みます廃棄物対策監■■■■これまで、ごみ問題について、各分野での取り組みや実情などさまざまな角度から掲載してきました。廃棄物（ごみ）は、古代,"['の', '建設', 'に', '取り組み', 'ます', '廃棄', '物', '対策', '監', '■■■■', 'これ', 'まで', '、', 'ごみ', '問題', 'に', 'ついて', '、', '各', '分野', 'で', 'の', '取り組み', 'や', '実情', 'など', 'さまざまな', '角度', 'から', '掲載', 'して', 'き', 'ました', '。', '廃棄', '物', '（', 'ごみ', '）', 'は', '、', '古代']",['取り組み'],NO,取り組み,NO,NO
291,取り組み,」を地域で守っていこう、と宮古上布の継承について、行政も一体となった取り組みもある。また、六十代以上の年配者らが健康づくりにと始めた琉球舞踊の講座や、若者ら,"['」', 'を', '地域', 'で', '守って', 'いこう', '、', 'と', '宮古', '上', '布', 'の', '継承', 'に', 'ついて', '、', '行政', 'も', '一体', 'と', 'なった', '取り組み', 'も', 'ある', '。', 'また', '、', '六十', '代', '以上', 'の', '年配', '者', 'ら', 'が', '健康', 'づくり', 'に', 'と', '始めた', '琉球', '舞踊', 'の', '講座', 'や', '、', '若者', 'ら']",['取り組み'],NO,取り組み,NO,NO
292,取り組み,ず経営の基本方針の柱の一つに環境対策を据えて、様々な環境保護に積極的な取り組みを行い社会に貢献している。また千九百九十六年に国際規格として発行されたＩＳＯ一万四千一の取得を,"['ず', '経営', 'の', '基本', '方針', 'の', '柱', 'の', '一', 'つ', 'に', '環境', '対策', 'を', '据えて', '、', '様々な', '環境', '保護', 'に', '積極', '的な', '取り組み', 'を', '行い', '社会', 'に', '貢献', 'して', 'いる', '。', 'また', '千九百九十六', '年', 'に', '国際', '規格', 'と', 'して', '発行', 'さ', 'れた', 'ＩＳＯ', '一万四千一', 'の', '取得', 'を']",['取り組み'],NO,取り組み,NO,NO
293,取り組み,運動を継続していかなければならない。ア検討会の取り組みの重要性検討会を重視しここでの取り組みに全力を尽くすべきである。現在，司法改革の諸課題は，推進本部事務局が検討会での,"['運動', 'を', '継続', 'して', 'いか', 'なければ', 'なら', 'ない', '。', 'ア', '検討', '会', 'の', '取り組み', 'の', '重要', '性', '検討', '会', 'を', '重視', 'し', 'ここ', 'で', 'の', '取り組み', 'に', '全力', 'を', '尽くす', 'べきである', '。', '現在', '，', '司法', '改革', 'の', '諸', '課題', 'は', '，', '推進', '本部', '事務', '局', 'が', '検討', '会', 'で', 'の']",['取り組み'],NO,取り組み,NO,NO
294,取り組み,運動を継続していかなければならない。ア検討会の取り組みの重要性検討会を重視しここでの取り組みに全力を尽くすべきである。現在，司法改革の諸課題は，推進本部事務局が検討会での,"['運動', 'を', '継続', 'して', 'いか', 'なければ', 'なら', 'ない', '。', 'ア', '検討', '会', 'の', '取り組み', 'の', '重要', '性', '検討', '会', 'を', '重視', 'し', 'ここ', 'で', 'の', '取り組み', 'に', '全力', 'を', '尽くす', 'べきである', '。', '現在', '，', '司法', '改革', 'の', '諸', '課題', 'は', '，', '推進', '本部', '事務', '局', 'が', '検討', '会', 'で', 'の']",['取り組み'],NO,取り組み,NO,NO
295,取り組み,企業会計方式を導入したり、本庁と出先機関を対象にＩＳＯ一万四千の認証を取得するなど効率行政の取り組みが目立っている。３位に入った神奈川県横須賀市（同七十六．三八、ＡＡ）も前回調査の,"['企業', '会計', '方式', 'を', '導入', 'したり', '、', '本庁', 'と', '出先', '機関', 'を', '対象', 'に', 'ＩＳＯ', '一万四千', 'の', '認証', 'を', '取得', 'する', 'など', '効率', '行政', 'の', '取り組み', 'が', '目立って', 'いる', '。', '３', '位', 'に', '入った', '神奈川', '県', '横須賀', '市', '（', '同', '七十六', '．', '三八', '、', 'ＡＡ', '）', 'も', '前回', '調査', 'の']",['取り組み'],NO,取り組み,NO,NO
296,取り組み,行い、省エネルギー対策に取り組む○高効率型の機器・設備を導入するなど、事業所・店舗の省エネルギー化に取り組む区民・事業者共通の取り組み○自動車を使用するときは、アイドリングストップ（停車時エンジン停止）などを心掛ける区の取り組み○区民・事業者が,"['行い', '、', '省', 'エネルギー', '対策', 'に', '取り組む', '○', '高', '効率', '型', 'の', '機器', '・', '設備', 'を', '導入', 'する', 'など', '、', '事業', '所', '・', '店舗', 'の', '省', 'エネルギー', '化', 'に', '取り組む', '区民', '・', '事業', '者', '共通の', '取り組み', '○', '自動車', 'を', '使用', 'する', 'とき', 'は', '、', 'アイドリングストップ', '（', '停車', '時', 'エンジン', '停止', '）', 'など', 'を', '心掛ける', '区', 'の', '取り組み', '○', '区民', '・', '事業', '者', 'が']",['取り組み'],NO,取り組み,NO,NO
