,compound unit,context,segmented,split units,the unit is split,compound unit form,unexpected segmentation,unexpected joining
0,取り組み,ない。全てＩＴでリアルタイムに決裁を行なう。一方で、スピードとクオリティを両立するための取り組みも盛ん。その典型例として「発散会議」と「収束会議」の二つがキヤノンにはある,"['ない', '。', '全て', 'ＩＴ', 'で', 'リアルタイム', 'に', '決裁', 'を', '行なう', '。', '一方', 'で', '、', 'スピード', 'と', 'クオリティ', 'を', '両立', 'する', 'ため', 'の', '取り組み', 'も', '盛ん', '。', 'その', '典型', '例', 'と', 'して', '「', '発散', '会議', '」', 'と', '「', '収束', '会議', '」', 'の', '二', 'つ', 'が', 'キヤノン', 'に', 'は', 'ある']",['取り組み'],NO,取り組み,NO,NO
1,取り組み,の発音をじっくり聴き取ったり、海外のドラマや映画を懸命に見たりといったさまざまな取り組みを行うチャンスが現代の日本にはあふれています。本気になればいくらでも,"['の', '発音', 'を', 'じっくり', '聴き', '取ったり', '、', '海外', 'の', 'ドラマ', 'や', '映画', 'を', '懸命に', '見たり', 'と', 'いった', 'さまざまな', '取り組み', 'を', '行う', 'チャンス', 'が', '現代', 'の', '日本', 'に', 'は', 'あふれて', 'い', 'ます', '。', '本気に', 'なれば', 'いくら', 'でも']",['取り組み'],NO,取り組み,NO,NO
2,取り組み,第１号被保険者の保険料を単独で減免する市町村も一部にみられ，再び，徴収に向けた取り組みが行われている。被保険者の負担能力を市町村民税で決めたことによる徴収額やサービス利用者負担額に不公平,"['第', '１', '号', '被', '保険', '者', 'の', '保険', '料', 'を', '単独', 'で', '減免', 'する', '市町村', 'も', '一部', 'に', 'み', 'られ', '，', '再び', '，', '徴収', 'に', '向けた', '取り組み', 'が', '行わ', 'れて', 'いる', '。', '被', '保険', '者', 'の', '負担', '能力', 'を', '市町村', '民', '税', 'で', '決めた', 'こと', 'に', 'よる', '徴収', '額', 'や', 'サービス', '利用', '者', '負担', '額', 'に', '不公平']",['取り組み'],NO,取り組み,NO,NO
3,取り組み,とわたしたち―環境との共生をめざして―なぜ取り組んだのかこれまでの取り組みの中で，先輩から後輩へ「人にやさしい環境」を考えるさまざまな活動が,"['と', 'わたし', 'たち', '―', '環境', 'と', 'の', '共生', 'を', 'めざして', '―', 'なぜ', '取り組んだ', 'の', 'か', 'これ', 'まで', 'の', '取り組み', 'の', '中', 'で', '，', '先輩', 'から', '後輩', 'へ', '「', '人', 'に', 'やさしい', '環境', '」', 'を', '考える', 'さまざまな', '活動', 'が']",['取り組み'],NO,取り組み,NO,NO
4,取り組み,高い取り組み割合を示しているのではないだろうか。図５‐二十一には、そのような取り組みを行った集落を地図上に示したものであるが、県の東部地域（周防地域）で,"['高い', '取り組み', '割合', 'を', '示して', 'いる', 'ので', 'は', 'ない', 'だろう', 'か', '。', '図', '５', '‐', '二十一', 'に', 'は', '、', 'そのような', '取り組み', 'を', '行った', '集落', 'を', '地図', '上', 'に', '示した', 'もの', 'である', 'が', '、', '県', 'の', '東部', '地域', '（', '周防', '地域', '）', 'で']",['取り組み'],NO,取り組み,NO,NO
5,取り組み,高い取り組み割合を示しているのではないだろうか。図５‐二十一には、そのような取り組みを行った集落を地図上に示したものであるが、県の東部地域（周防地域）で,"['高い', '取り組み', '割合', 'を', '示して', 'いる', 'ので', 'は', 'ない', 'だろう', 'か', '。', '図', '５', '‐', '二十一', 'に', 'は', '、', 'そのような', '取り組み', 'を', '行った', '集落', 'を', '地図', '上', 'に', '示した', 'もの', 'である', 'が', '、', '県', 'の', '東部', '地域', '（', '周防', '地域', '）', 'で']",['取り組み'],NO,取り組み,NO,NO
6,取り組み,の保育園・公立幼稚園をこども園として統一することなどが挙げられます。そこで、これらの主な取り組みを今号と３月十五日号で紹介します。地域子育て支援センター・子どもつどいの広場４月から、宮口こども園の開園に,"['の', '保育', '園', '・', '公立', '幼稚園', 'を', 'こども', '園', 'と', 'して', '統一', 'する', 'こと', 'など', 'が', '挙げ', 'られ', 'ます', '。', 'そこ', 'で', '、', 'これ', 'ら', 'の', '主な', '取り組み', 'を', '今', '号', 'と', '３', '月', '十五', '日', '号', 'で', '紹介', 'し', 'ます', '。', '地域', '子育て', '支援', 'センター', '・', '子ども', 'つどい', 'の', '広場', '４', '月', 'から', '、', '宮', '口', 'こども', '園', 'の', '開園', 'に']",['取り組み'],NO,取り組み,NO,NO
7,取り組み,も昨年、この問題については大変貴重な意見として伺っておきたい、これから具体的な取り組みの中でこの問題を検討するというお約束をいただいたのですけれども、その後の取り組み,"['も', '昨年', '、', 'この', '問題', 'に', 'ついて', 'は', '大変', '貴重な', '意見', 'と', 'して', '伺って', 'おき', 'たい', '、', 'これ', 'から', '具体', '的な', '取り組み', 'の', '中', 'で', 'この', '問題', 'を', '検討', 'する', 'と', 'いう', 'お', '約束', 'を', 'いただいた', 'のです', 'けれども', '、', 'その後', 'の', '取り組み']",['取り組み'],NO,取り組み,NO,NO
8,取り組み,も昨年、この問題については大変貴重な意見として伺っておきたい、これから具体的な取り組みの中でこの問題を検討するというお約束をいただいたのですけれども、その後の取り組み,"['も', '昨年', '、', 'この', '問題', 'に', 'ついて', 'は', '大変', '貴重な', '意見', 'と', 'して', '伺って', 'おき', 'たい', '、', 'これ', 'から', '具体', '的な', '取り組み', 'の', '中', 'で', 'この', '問題', 'を', '検討', 'する', 'と', 'いう', 'お', '約束', 'を', 'いただいた', 'のです', 'けれども', '、', 'その後', 'の', '取り組み']",['取り組み'],NO,取り組み,NO,NO
9,取り組み,また、「あらゆる形態の人種差別の撤廃に関する国際条約」批准など少数民族に関する国連での人権伸長に関する取り組みに、わが国の政府ももっと積極的に取り組んでいただきたいと願っております。「アイヌ文化,"['また', '、', '「', 'あらゆる', '形態', 'の', '人種', '差別', 'の', '撤廃', 'に', '関する', '国際', '条約', '」', '批准', 'など', '少数', '民族', 'に', '関する', '国連', 'で', 'の', '人権', '伸長', 'に', '関する', '取り組み', 'に', '、', 'わが国', 'の', '政府', 'も', 'もっと', '積極', '的に', '取り組んで', 'いただき', 'たい', 'と', '願って', 'おり', 'ます', '。', '「', 'アイヌ', '文化']",['取り組み'],NO,取り組み,NO,NO
10,取り組み,有意義に生かしながら、自らの知恵をしぼって農業や地域の振興に役立たせている取り組みがあります。１構造改革の波を農業に生かす構造改革の目玉として国が推し進める構造改革特区制度,"['有意義に', '生かし', 'ながら', '、', '自ら', 'の', '知恵', 'を', 'しぼって', '農業', 'や', '地域', 'の', '振興', 'に', '役立た', 'せて', 'いる', '取り組み', 'が', 'あり', 'ます', '。', '１', '構造', '改革', 'の', '波', 'を', '農業', 'に', '生かす', '構造', '改革', 'の', '目玉', 'と', 'して', '国', 'が', '推し進める', '構造', '改革', '特区', '制度']",['取り組み'],NO,取り組み,NO,NO
11,取り組み,という役職を預かっておりまして、学生の皆さんと接触しながら、今政治方面への啓蒙活動に取り組みをさせていただいております。昨年の暮れには、学生の皆さんとも大会を,"['と', 'いう', '役職', 'を', '預かって', 'おり', 'まして', '、', '学生', 'の', '皆さん', 'と', '接触', 'し', 'ながら', '、', '今', '政治', '方面', 'へ', 'の', '啓蒙', '活動', 'に', '取り組み', 'を', 'さ', 'せて', 'いただいて', 'おり', 'ます', '。', '昨年', 'の', '暮れ', 'に', 'は', '、', '学生', 'の', '皆さん', 'と', 'も', '大会', 'を']",['取り組み'],NO,取り組み,NO,NO
12,取り組み,にまで広げたうえでの貴重な提言といえよう。すでにこのような方向の取り組みが開始されている。ドイツでは、まず包装廃棄物について、九十一年に施行された「包装廃棄物規制令,"['に', 'まで', '広げた', 'うえ', 'で', 'の', '貴重な', '提言', 'と', 'いえよう', '。', 'すでに', 'このような', '方向', 'の', '取り組み', 'が', '開始', 'さ', 'れて', 'いる', '。', 'ドイツ', 'で', 'は', '、', 'まず', '包装', '廃棄', '物', 'に', 'ついて', '、', '九十一', '年', 'に', '施行', 'さ', 'れた', '「', '包装', '廃棄', '物', '規制', '令']",['取り組み'],NO,取り組み,NO,NO
13,取り組み,我が国の森林の基礎的データの整備に取り組む。（２）森林整備のための地域における取り組みに対する支援適切な森林整備を通じて森林の有する多面的機能の発揮を図る観点から、近年十分,"['我が国', 'の', '森林', 'の', '基礎', '的', 'データ', 'の', '整備', 'に', '取り組む', '。', '（', '２', '）', '森林', '整備', 'の', 'ため', 'の', '地域', 'に', 'おける', '取り組み', 'に', '対する', '支援', '適切な', '森林', '整備', 'を', '通じて', '森林', 'の', '有する', '多面', '的', '機能', 'の', '発揮', 'を', '図る', '観点', 'から', '、', '近年', '十分']",['取り組み'],NO,取り組み,NO,NO
14,取り組み,やリサイクルの推進につきましては、行政の取り組みだけではなく、市民の皆さん一人ひとりによる取り組みが大切であることから、皆さんのご協力をよろしくお願いします。産業・まちづくり３問田辺市の主要産業,"['や', 'リサイクル', 'の', '推進', 'に', 'つき', 'まして', 'は', '、', '行政', 'の', '取り組み', 'だけ', 'で', 'は', 'なく', '、', '市民', 'の', '皆さん', '一人ひとり', 'に', 'よる', '取り組み', 'が', '大切である', 'こと', 'から', '、', '皆さん', 'の', 'ご', '協力', 'を', 'よろしく', 'お', '願い', 'し', 'ます', '。', '産業', '・', 'まち', 'づくり', '３', '問', '田辺', '市', 'の', '主要', '産業']",['取り組み'],NO,取り組み,NO,NO
15,取り組み,やリサイクルの推進につきましては、行政の取り組みだけではなく、市民の皆さん一人ひとりによる取り組みが大切であることから、皆さんのご協力をよろしくお願いします。産業・まちづくり３問田辺市の主要産業,"['や', 'リサイクル', 'の', '推進', 'に', 'つき', 'まして', 'は', '、', '行政', 'の', '取り組み', 'だけ', 'で', 'は', 'なく', '、', '市民', 'の', '皆さん', '一人ひとり', 'に', 'よる', '取り組み', 'が', '大切である', 'こと', 'から', '、', '皆さん', 'の', 'ご', '協力', 'を', 'よろしく', 'お', '願い', 'し', 'ます', '。', '産業', '・', 'まち', 'づくり', '３', '問', '田辺', '市', 'の', '主要', '産業']",['取り組み'],NO,取り組み,NO,NO
16,取り組み,の向上に資するような体制を，国とも協力しつつ構築する。（３）国の取り組みのあり方事業・施設の安全確保として，加工事業者への定期検査の義務づけ，保安規定の遵守状況の検査,"['の', '向上', 'に', '資する', 'ような', '体制', 'を', '，', '国', 'と', 'も', '協力', 'し', 'つつ', '構築', 'する', '。', '（', '３', '）', '国', 'の', '取り組み', 'の', 'あり', '方', '事業', '・', '施設', 'の', '安全', '確保', 'と', 'して', '，', '加工', '事業', '者', 'へ', 'の', '定期', '検査', 'の', '義務づけ', '，', '保安', '規定', 'の', '遵守', '状況', 'の', '検査']",['取り組み'],NO,取り組み,NO,NO
17,取り組み,の活動を予定しています。環境問題には、市民や事業者の自発的な環境保全活動や取り組みが重要です。環境市民会議は、どなたでも自由に参加できます。ぜひ会議に参加して,"['の', '活動', 'を', '予定', 'して', 'い', 'ます', '。', '環境', '問題', 'に', 'は', '、', '市民', 'や', '事業', '者', 'の', '自発', '的な', '環境', '保全', '活動', 'や', '取り組み', 'が', '重要です', '。', '環境', '市民', '会議', 'は', '、', 'どなた', 'でも', '自由に', '参加', 'でき', 'ます', '。', 'ぜひ', '会議', 'に', '参加', 'して']",['取り組み'],NO,取り組み,NO,NO
18,取り組み,作成する地域水田農業ビジョンのなかで明示し、その実現に向けて地域の関係者が一体となった取り組みを推進した。ⅱこのような取り組みを推進するなかで、地域において水田農業を担う,"['作成', 'する', '地域', '水田', '農業', 'ビジョン', 'の', 'なか', 'で', '明示', 'し', '、', 'その', '実現', 'に', '向けて', '地域', 'の', '関係', '者', 'が', '一体', 'と', 'なった', '取り組み', 'を', '推進', 'した', '。', 'ⅱ', 'こ', 'の', 'ような', '取り組み', 'を', '推進', 'する', 'なか', 'で', '、', '地域', 'に', 'おいて', '水田', '農業', 'を', '担う']",['取り組み'],NO,取り組み,NO,NO
19,取り組み,作成する地域水田農業ビジョンのなかで明示し、その実現に向けて地域の関係者が一体となった取り組みを推進した。ⅱこのような取り組みを推進するなかで、地域において水田農業を担う,"['作成', 'する', '地域', '水田', '農業', 'ビジョン', 'の', 'なか', 'で', '明示', 'し', '、', 'その', '実現', 'に', '向けて', '地域', 'の', '関係', '者', 'が', '一体', 'と', 'なった', '取り組み', 'を', '推進', 'した', '。', 'ⅱ', 'こ', 'の', 'ような', '取り組み', 'を', '推進', 'する', 'なか', 'で', '、', '地域', 'に', 'おいて', '水田', '農業', 'を', '担う']",['取り組み'],NO,取り組み,NO,NO
20,取り組み,てくれました。地域を盛り上げ豊かな生涯現役社会を市では、生涯現役を目指す取り組みへの意欲が活発な校区を「生涯現役推進モデル校区」として指定。四月から一年間、八幡校区と,"['て', 'くれ', 'ました', '。', '地域', 'を', '盛り上げ', '豊かな', '生涯', '現役', '社会', 'を', '市', 'で', 'は', '、', '生涯', '現役', 'を', '目指す', '取り組み', 'へ', 'の', '意欲', 'が', '活発な', '校区', 'を', '「', '生涯', '現役', '推進', 'モデル', '校区', '」', 'と', 'して', '指定', '。', '四', '月', 'から', '一', '年間', '、', '八幡', '校区', 'と']",['取り組み'],NO,取り組み,NO,NO
21,取り組み,た参加型の保全・整備・利用活動を推進するとともに、市民参加によって森林整備と資源循環利用を一体的に進める等の新しい取り組みを推進する「里山林の新たな保全・利用推進事業」を実施します。森林の整備・保全は社会全体で,"['た', '参加', '型', 'の', '保全', '・', '整備', '・', '利用', '活動', 'を', '推進', 'する', 'と', 'ともに', '、', '市民', '参加', 'に', 'よって', '森林', '整備', 'と', '資源', '循環', '利用', 'を', '一体', '的に', '進める', '等', 'の', '新しい', '取り組み', 'を', '推進', 'する', '「', '里', '山林', 'の', '新たな', '保全', '・', '利用', '推進', '事業', '」', 'を', '実施', 'し', 'ます', '。', '森林', 'の', '整備', '・', '保全', 'は', '社会', '全体', 'で']",['取り組み'],NO,取り組み,NO,NO
22,取り組み,市町村で取り組んでいる、高齢者実態調査の全県とりまとめも九十八年度の仕事だ。ほかにも広域的な取り組みへの調整、保険給付、事業者と施設の指定、保険審査会の設置…など、法が,"['市町村', 'で', '取り組んで', 'いる', '、', '高齢', '者', '実態', '調査', 'の', '全県', 'とりまとめ', 'も', '九十八', '年度', 'の', '仕事', 'だ', '。', 'ほか', 'に', 'も', '広域', '的な', '取り組み', 'へ', 'の', '調整', '、', '保険', '給付', '、', '事業', '者', 'と', '施設', 'の', '指定', '、', '保険', '審査', '会', 'の', '設置', '…', 'など', '、', '法', 'が']",['取り組み'],NO,取り組み,NO,NO
23,取り組み,昼休みは執務室内を消灯する…と、課ごとに目標を掲げ、実践しています。各課の取り組みは、窓口前に掲示しています。「地球にいいこと」は小さな一歩から。,"['昼', '休み', 'は', '執務', '室', '内', 'を', '消灯', 'する', '…', 'と', '、', '課', 'ごと', 'に', '目標', 'を', '掲げ', '、', '実践', 'して', 'い', 'ます', '。', '各', '課', 'の', '取り組み', 'は', '、', '窓口', '前', 'に', '掲示', 'して', 'い', 'ます', '。', '「', '地球', 'に', 'いい', 'こと', '」', 'は', '小さな', '一', '歩', 'から', '。']",['取り組み'],NO,取り組み,NO,NO
24,取り組み,からの聞き取りによる。３）荒木［４］７〜十四頁。三つ目は、環境保全に関する取り組みである。浜中町は全国で三番目の面積をもつ霧多布湿原を有し、千九百九十三年にはラムサール条約登録地に,"['から', 'の', '聞き', '取り', 'に', 'よる', '。', '３', '）', '荒木', '［', '４', '］', '７', '〜', '十四', '頁', '。', '三', 'つ', '目', 'は', '、', '環境', '保全', 'に', '関する', '取り組み', 'である', '。', '浜中', '町', 'は', '全国', 'で', '三', '番', '目', 'の', '面積', 'を', 'もつ', '霧', '多', '布', '湿原', 'を', '有し', '、', '千九百九十三', '年', 'に', 'は', 'ラムサール', '条約', '登録', '地', 'に']",['取り組み'],NO,取り組み,NO,NO
25,取り組み,の認証取得が広がっているのもその表れと言えます。その一方で、環境に対する取り組みが企業のイメージを高め、社外から高い評価を受けることにつながる面もあります,"['の', '認証', '取得', 'が', '広がって', 'いる', 'の', 'も', 'その', '表れ', 'と', '言え', 'ます', '。', 'その', '一方', 'で', '、', '環境', 'に', '対する', '取り組み', 'が', '企業', 'の', 'イメージ', 'を', '高め', '、', '社', '外', 'から', '高い', '評価', 'を', '受ける', 'こと', 'に', 'つながる', '面', 'も', 'あり', 'ます']",['取り組み'],NO,取り組み,NO,NO
26,取り組み,二十年２月２日に、文化センターで推進運動の発表会と趣旨確認会を実施しました。今後、この取り組みに賛同し参加してみようと思われるグループや団体がありましたら、ぜひ、参画団体として申し出いただき,"['二十', '年', '２', '月', '２', '日', 'に', '、', '文化', 'センター', 'で', '推進', '運動', 'の', '発表', '会', 'と', '趣旨', '確認', '会', 'を', '実施', 'し', 'ました', '。', '今後', '、', 'この', '取り組み', 'に', '賛同', 'し', '参加', 'して', 'みよう', 'と', '思わ', 'れる', 'グループ', 'や', '団体', 'が', 'あり', 'ましたら', '、', 'ぜひ', '、', '参画', '団体', 'と', 'して', '申し出', 'いただき']",['取り組み'],NO,取り組み,NO,NO
27,取り組み,に有能な人）とも対等にディベイトできると言い切れるところにうかがえる。自分の生物に対する取り組みがあるからこそ，苦手なものもプラス思考にとらえることができた。自己有用感：自分が集団,"['に', '有能な', '人', '）', 'と', 'も', '対等に', 'ディベイト', 'できる', 'と', '言い', '切れる', 'ところ', 'に', 'うかがえる', '。', '自分', 'の', '生物', 'に', '対する', '取り組み', 'が', 'ある', 'から', 'こそ', '，', '苦手な', 'もの', 'も', 'プラス', '思考', 'に', 'とらえる', 'こと', 'が', 'できた', '。', '自己', '有用', '感', '：', '自分', 'が', '集団']",['取り組み'],NO,取り組み,NO,NO
28,取り組み,に方法はない。全国には厳しい環境の中で、独自に防災対策への取り組みを進めている自治体も少なくない。そうした先進事例の一部を第４章では紹介している,"['に', '方法', 'は', 'ない', '。', '全国', 'に', 'は', '厳しい', '環境', 'の', '中', 'で', '、', '独自に', '防災', '対策', 'へ', 'の', '取り組み', 'を', '進めて', 'いる', '自治', '体', 'も', '少なく', 'ない', '。', 'そうした', '先進', '事例', 'の', '一部', 'を', '第', '４', '章', 'で', 'は', '紹介', 'して', 'いる']",['取り組み'],NO,取り組み,NO,NO
29,取り組み,傾斜地で栽培されるものも多く，機械化が進みにくいうえに，消費者ニーズに対応した高品質化への取り組みに伴い，みかんのように摘果等の作業時間の増加による労働時間の増加がみられる品目,"['傾斜', '地', 'で', '栽培', 'さ', 'れる', 'もの', 'も', '多く', '，', '機械', '化', 'が', '進み', 'にくい', 'うえ', 'に', '，', '消費', '者', 'ニーズ', 'に', '対応', 'した', '高', '品質', '化', 'へ', 'の', '取り組み', 'に', '伴い', '，', 'みかん', 'の', 'ように', '摘果', '等', 'の', '作業', '時間', 'の', '増加', 'に', 'よる', '労働', '時間', 'の', '増加', 'が', 'み', 'られる', '品目']",['取り組み'],NO,取り組み,NO,NO
30,取り組み,ということについて、まずお聞かせいただきたいと思います。○谷津国務大臣先生御指摘のように、国民参加型の取り組みの推進が大事だというふうに私も思っておるわけであります。食料の自給率は,"['と', 'いう', 'こと', 'に', 'ついて', '、', 'まず', 'お', '聞か', 'せ', 'いただき', 'たい', 'と', '思い', 'ます', '。', '○', '谷', '津', '国務', '大臣', '先生', '御', '指摘', 'の', 'ように', '、', '国民', '参加', '型', 'の', '取り組み', 'の', '推進', 'が', '大事だ', 'と', 'いう', 'ふうに', '私', 'も', '思って', 'おる', 'わけであり', 'ます', '。', '食料', 'の', '自給', '率', 'は']",['取り組み'],NO,取り組み,NO,NO
31,取り組み,よう透明度の高い組織を作ること」と強調する。従来の自治体債を大きく打ち破る同市の取り組みは「進化する自治体」のあり方を示す―つのモデルだと言える。,"['よう', '透明', '度', 'の', '高い', '組織', 'を', '作る', 'こと', '」', 'と', '強調', 'する', '。', '従来', 'の', '自治', '体', '債', 'を', '大きく', '打ち破る', '同', '市', 'の', '取り組み', 'は', '「', '進化', 'する', '自治', '体', '」', 'の', 'あり', '方', 'を', '示す', '―', 'つ', 'の', 'モデル', 'だ', 'と', '言える', '。']",['取り組み'],NO,取り組み,NO,NO
32,取り組み,計画につなげる。図１「心とからだの健康づくり」の展開２．日常生活における取り組み働くことで生じた疲労やストレスを解消するためには，日常生活における余暇などの自由,"['計画', 'に', 'つなげる', '。', '図', '１', '「', '心', 'と', 'から', 'だの', '健康', 'づくり', '」', 'の', '展開', '２', '．', '日常', '生活', 'に', 'おける', '取り組み', '働く', 'こと', 'で', '生じた', '疲労', 'や', 'ストレス', 'を', '解消', 'する', 'ため', 'に', 'は', '，', '日常', '生活', 'に', 'おける', '余暇', 'など', 'の', '自由']",['取り組み'],NO,取り組み,NO,NO
33,取り組み,受けて同署は調査や必要に応じた支援を行うことができます。なお、この取り組みは全国的に広がっており、近隣の南丹市や亀岡市でも同様の協定を締結されてい,"['受けて', '同', '署', 'は', '調査', 'や', '必要に', '応じた', '支援', 'を', '行う', 'こと', 'が', 'でき', 'ます', '。', 'なお', '、', 'この', '取り組み', 'は', '全国', '的に', '広がって', 'おり', '、', '近隣', 'の', '南丹', '市', 'や', '亀岡', '市', 'でも', '同様の', '協定', 'を', '締結', 'さ', 'れて', 'い']",['取り組み'],NO,取り組み,NO,NO
