428,取り組み,を消していただくよう呼びかける「ＣＯ２削減／ライトダウンキャンペーン」を実施しています。皆さんもこの取り組みにぜひご協力ください。●期日６月二十一日（土）夏至の日と、７月７日（,"['を', '消して', 'いただく', 'よう', '呼びかける', '「', 'ＣＯ', '２', '削減', '／', 'ライトダウンキャンペーン', '」', 'を', '実施', 'して', 'い', 'ます', '。', '皆さん', 'も', 'この', '取り組み', 'に', 'ぜひ', 'ご', '協力', 'ください', '。', '●', '期日', '６', '月', '二十一', '日', '（', '土', '）', '夏至', 'の', '日', 'と', '、', '７', '月', '７', '日', '（']",['取り組み'],NO,取り組み,NO,NO
429,取り組み,十一年１月十一日開催の第二十四回国土審議会においては，国土審議会会長の互選，「二十一世紀の国土のグランドデザイン」策定後の主な取り組みの報告がなされるとともに，今後の調査審議事項としての計画の効果的な推進方策及び二十一世紀の,"['十一', '年', '１', '月', '十一', '日', '開催', 'の', '第', '二十四', '回', '国土', '審議', '会', 'に', 'おいて', 'は', '，', '国土', '審議', '会', '会長', 'の', '互選', '，', '「', '二十一', '世紀', 'の', '国土', 'の', 'グランド', 'デザイン', '」', '策定', '後', 'の', '主な', '取り組み', 'の', '報告', 'が', 'なされる', 'と', 'ともに', '，', '今後', 'の', '調査', '審議', '事項', 'と', 'して', 'の', '計画', 'の', '効果', '的な', '推進', '方策', '及び', '二十一', '世紀', 'の']",['取り組み'],NO,取り組み,NO,NO
430,取り組み,含む多くの意見がメールで寄せられているとして、今回の情報流出に対するＩＰＡの取り組みと考えを説明した。ＩＰＡでは情報流出が発覚して以来、理事長を本部長,"['含む', '多く', 'の', '意見', 'が', 'メール', 'で', '寄せ', 'られて', 'いる', 'と', 'して', '、', '今回', 'の', '情報', '流出', 'に', '対する', 'ＩＰＡ', 'の', '取り組み', 'と', '考え', 'を', '説明', 'した', '。', 'ＩＰＡ', 'で', 'は', '情報', '流出', 'が', '発覚', 'して', '以来', '、', '理事', '長', 'を', '本', '部長']",['取り組み'],NO,取り組み,NO,NO
431,取り組み,アドバイスを受けていただくことができます。いくつになってもいきいきと過ごそう！介護予防の取り組みは大切なことと知りながらも「どう取り組めばよいのか知らない」、「一人,"['アドバイス', 'を', '受けて', 'いただく', 'こと', 'が', 'でき', 'ます', '。', 'いく', 'つ', 'に', 'なって', 'も', 'いきいき', 'と', '過ごそう', '！', '介護', '予防', 'の', '取り組み', 'は', '大切な', 'こと', 'と', '知り', 'ながら', 'も', '「', 'どう', '取り組めば', 'よい', 'の', 'か', '知ら', 'ない', '」', '、', '「', '一', '人']",['取り組み'],NO,取り組み,NO,NO
432,取り組み,，食品の工業化や安全性問題，食料・農業問題や南北問題など，現代の消費社会をみなおすための幅ひろい取り組みも行われている。１主婦連合会，消費科学連合会，日本消費者連盟，全国消費者団体連絡会などの他，消費者運動を行う,"['，', '食品', 'の', '工業', '化', 'や', '安全', '性', '問題', '，', '食料', '・', '農業', '問題', 'や', '南北', '問題', 'など', '，', '現代', 'の', '消費', '社会', 'を', 'みなおす', 'ため', 'の', '幅ひろい', '取り組み', 'も', '行わ', 'れて', 'いる', '。', '１', '主婦', '連合', '会', '，', '消費', '科学', '連合', '会', '，', '日本', '消費', '者', '連盟', '，', '全国', '消費', '者', '団体', '連絡', '会', 'など', 'の', '他', '，', '消費', '者', '運動', 'を', '行う']",['取り組み'],NO,取り組み,NO,NO
433,取り組み,次の世代へ伝えていくために、一人ひとりができるところから、省エネなどの環境にやさしい取り組みを始めてみませんか。問都市環境政策課（☎七百二十四．六一八九、ＦＡＸ七百二十三．五五八一）太陽光発電に関する問い合わせ,"['次の', '世代', 'へ', '伝えて', 'いく', 'ため', 'に', '、', '一人ひとり', 'が', 'できる', 'ところ', 'から', '、', '省エネ', 'など', 'の', '環境', 'に', 'やさしい', '取り組み', 'を', '始めて', 'み', 'ませ', 'ん', 'か', '。', '問', '都市', '環境', '政策', '課', '（', '☎', '七百二十四', '．', '六一八九', '、', 'ＦＡＸ', '七百二十三', '．', '五五八一', '）', '太陽', '光', '発電', 'に', '関する', '問い合わせ']",['取り組み'],NO,取り組み,NO,NO
434,取り組み,農村部ではなお抑制への関心は薄いといったところである。その他、周辺部諸国における取り組みはさまざまであるが、社会的混乱から内乱、戦乱がアフリカを中心にいまなお各地に頻発し,"['農村', '部', 'で', 'は', 'なお', '抑制', 'へ', 'の', '関心', 'は', '薄い', 'と', 'いった', 'ところ', 'である', '。', 'その他', '、', '周辺', '部', '諸国', 'に', 'おける', '取り組み', 'は', 'さまざまである', 'が', '、', '社会', '的', '混乱', 'から', '内乱', '、', '戦乱', 'が', 'アフリカ', 'を', '中心', 'に', 'いまなお', '各地', 'に', '頻発', 'し']",['取り組み'],NO,取り組み,NO,NO
435,取り組み,複雑な仕組みを持った製品を計画的に製造できるようになるはずです。つまりＵＣＤの取り組みとは、ユーザーのことをきちんと考えてデザイン作業を行うという思想的な活動を指すと,"['複雑な', '仕組み', 'を', '持った', '製品', 'を', '計画', '的に', '製造', 'できる', 'ように', 'なる', 'はずです', '。', 'つまり', 'ＵＣＤ', 'の', '取り組み', 'と', 'は', '、', 'ユーザー', 'の', 'こと', 'を', 'きちんと', '考えて', 'デザイン', '作業', 'を', '行う', 'と', 'いう', '思想', '的な', '活動', 'を', '指す', 'と']",['取り組み'],NO,取り組み,NO,NO
436,取り組み,の「Ｇ三十行動」により、こみ量の削減が着実に進んでいます。今後はこの取り組みを地球温暖化対策にもつなげ、「ＣＯ‐ＤＯ三十」の取り組みを具体化させていく必要が,"['の', '「', 'Ｇ', '三十', '行動', '」', 'に', 'より', '、', 'こみ', '量', 'の', '削減', 'が', '着実に', '進んで', 'い', 'ます', '。', '今後', 'は', 'この', '取り組み', 'を', '地球', '温暖', '化', '対策', 'に', 'も', 'つなげ', '、', '「', 'ＣＯ', '‐', 'ＤＯ', '三十', '」', 'の', '取り組み', 'を', '具体', '化', 'さ', 'せて', 'いく', '必要', 'が']",['取り組み'],NO,取り組み,NO,NO
437,取り組み,の「Ｇ三十行動」により、こみ量の削減が着実に進んでいます。今後はこの取り組みを地球温暖化対策にもつなげ、「ＣＯ‐ＤＯ三十」の取り組みを具体化させていく必要が,"['の', '「', 'Ｇ', '三十', '行動', '」', 'に', 'より', '、', 'こみ', '量', 'の', '削減', 'が', '着実に', '進んで', 'い', 'ます', '。', '今後', 'は', 'この', '取り組み', 'を', '地球', '温暖', '化', '対策', 'に', 'も', 'つなげ', '、', '「', 'ＣＯ', '‐', 'ＤＯ', '三十', '」', 'の', '取り組み', 'を', '具体', '化', 'さ', 'せて', 'いく', '必要', 'が']",['取り組み'],NO,取り組み,NO,NO
438,取り組み,ている企業が増えてきており、企業が作成している環境報告書などの中で、こうした取り組みについて記述する例も出始めている。例えば、ある大手家電メーカーでは、平成３年から製品のＬＣＡ,"['て', 'いる', '企業', 'が', '増えて', 'きて', 'おり', '、', '企業', 'が', '作成', 'して', 'いる', '環境', '報告', '書', 'など', 'の', '中', 'で', '、', 'こうした', '取り組み', 'に', 'ついて', '記述', 'する', '例', 'も', '出', '始めて', 'いる', '。', '例えば', '、', 'ある', '大手', '家電', 'メーカー', 'で', 'は', '、', '平成', '３', '年', 'から', '製品', 'の', 'ＬＣＡ']",['取り組み'],NO,取り組み,NO,NO
439,取り組み,の居住地をどのように再生したり，問題の改善をはかればよいのか，それらの取り組みに居住者が積極的にかかわっていくことが大切である。また，居住地にどんな問題や課題,"['の', '居住', '地', 'を', 'どのように', '再生', 'したり', '，', '問題', 'の', '改善', 'を', 'はかれば', 'よい', 'の', 'か', '，', 'それ', 'ら', 'の', '取り組み', 'に', '居住', '者', 'が', '積極', '的に', 'かかわって', 'いく', 'こと', 'が', '大切である', '。', 'また', '，', '居住', '地', 'に', 'どんな', '問題', 'や', '課題']",['取り組み'],NO,取り組み,NO,NO
440,取り組み,配慮をきめ細かく行うとともに，国においては，地方公共団体等の先進的な取り組みの紹介や優れた取り組みの顕彰や，望ましい公開・活用の在り方を示すためのパイロット事業などを行うことが必要です。,"['配慮', 'を', 'きめ細かく', '行う', 'と', 'ともに', '，', '国', 'に', 'おいて', 'は', '，', '地方', '公共', '団体', '等', 'の', '先進', '的な', '取り組み', 'の', '紹介', 'や', '優れた', '取り組み', 'の', '顕彰', 'や', '，', '望ましい', '公開', '・', '活用', 'の', '在り', '方', 'を', '示す', 'ため', 'の', 'パイロット', '事業', 'など', 'を', '行う', 'こと', 'が', '必要です', '。']",['取り組み'],NO,取り組み,NO,NO
441,取り組み,配慮をきめ細かく行うとともに，国においては，地方公共団体等の先進的な取り組みの紹介や優れた取り組みの顕彰や，望ましい公開・活用の在り方を示すためのパイロット事業などを行うことが必要です。,"['配慮', 'を', 'きめ細かく', '行う', 'と', 'ともに', '，', '国', 'に', 'おいて', 'は', '，', '地方', '公共', '団体', '等', 'の', '先進', '的な', '取り組み', 'の', '紹介', 'や', '優れた', '取り組み', 'の', '顕彰', 'や', '，', '望ましい', '公開', '・', '活用', 'の', '在り', '方', 'を', '示す', 'ため', 'の', 'パイロット', '事業', 'など', 'を', '行う', 'こと', 'が', '必要です', '。']",['取り組み'],NO,取り組み,NO,NO
442,取り組み,られました。この計画は、平成二十年度から二十六年度までの、まちづくりの具体的な取り組みを示すもの。参加者からは「農業分野で、生産調整や販売戦略についての記述が,"['られ', 'ました', '。', 'この', '計画', 'は', '、', '平成', '二十', '年度', 'から', '二十六', '年度', 'まで', 'の', '、', 'まち', 'づくり', 'の', '具体', '的な', '取り組み', 'を', '示す', 'もの', '。', '参加', '者', 'から', 'は', '「', '農業', '分野', 'で', '、', '生産', '調整', 'や', '販売', '戦略', 'に', 'ついて', 'の', '記述', 'が']",['取り組み'],NO,取り組み,NO,NO
443,取り組み,を設けることで、子どもたちに食への興味をはぐくんでいます。▼学校での取り組み小・中学校では、給食を通して広く食育を学んでもらおうと、手稲区特産の大浜みやこかぼちゃを,"['を', '設ける', 'こと', 'で', '、', '子ども', 'たち', 'に', '食', 'へ', 'の', '興味', 'を', 'はぐくんで', 'い', 'ます', '。', '▼', '学校', 'で', 'の', '取り組み', '小', '・', '中学校', 'で', 'は', '、', '給食', 'を', '通して', '広く', '食育', 'を', '学んで', 'もらおう', 'と', '、', '手稲', '区', '特産', 'の', '大浜', 'みやこ', 'かぼちゃ', 'を']",['取り組み'],NO,取り組み,NO,NO
444,取り組み,新世紀道路整備ネットワーク事業」を新たに創設して、幹線道路や生活道路の整備に取り組んでいる。こうした取り組みを通じて平成二十一年度までには県内のすべての市町村役場（隠岐地域を除く）から高速道路のインターチェンジ,"['新', '世紀', '道路', '整備', 'ネットワーク', '事業', '」', 'を', '新たに', '創設', 'して', '、', '幹線', '道路', 'や', '生活', '道路', 'の', '整備', 'に', '取り組んで', 'いる', '。', 'こうした', '取り組み', 'を', '通じて', '平成', '二十一', '年度', 'まで', 'に', 'は', '県', '内', 'の', 'すべて', 'の', '市町村', '役場', '（', '隠岐', '地域', 'を', '除く', '）', 'から', '高速', '道路', 'の', 'インターチェンジ']",['取り組み'],NO,取り組み,NO,NO
445,取り組み,便益（生態系の維持保存、地球温暖化防止、水源の涵養、木材生産等）を踏まえ、違法伐採問題への取り組みを含め、森林の持続可能な経営を促進。（ニ）生物多様性：絶滅の危機に瀕する生物種,"['便', '益', '（', '生態', '系', 'の', '維持', '保存', '、', '地球', '温暖', '化', '防止', '、', '水源', 'の', '涵養', '、', '木材', '生産', '等', '）', 'を', '踏まえ', '、', '違法', '伐採', '問題', 'へ', 'の', '取り組み', 'を', '含め', '、', '森林', 'の', '持続', '可能な', '経営', 'を', '促進', '。', '（', 'ニ', '）', '生物', '多様', '性', '：', '絶滅', 'の', '危機', 'に', '瀕する', '生物', '種']",['取り組み'],NO,取り組み,NO,NO
446,取り組み,，観光施設の割引という特典は市や県が行うなど，官民一体となったまちづくりの取り組みとしても注目されている。松山市は，この「坂の上の雲」フィールドミュージアム構想を,"['，', '観光', '施設', 'の', '割引', 'と', 'いう', '特典', 'は', '市', 'や', '県', 'が', '行う', 'など', '，', '官民', '一体', 'と', 'なった', 'まち', 'づくり', 'の', '取り組み', 'と', 'して', 'も', '注目', 'さ', 'れて', 'いる', '。', '松山', '市', 'は', '，', 'この', '「', '坂の上の雲', '」', 'フィールドミュージアム', '構想', 'を']",['取り組み'],NO,取り組み,NO,NO
447,取り組み,進行将来都市像やまちづくりの目標を実現するため、行政経営の視点に立って、次の取り組みを展開します。・選択と集中による実効性ある施策を展開。限られた財源,"['進行', '将来', '都市', '像', 'や', 'まち', 'づくり', 'の', '目標', 'を', '実現', 'する', 'ため', '、', '行政', '経営', 'の', '視点', 'に', '立って', '、', '次の', '取り組み', 'を', '展開', 'し', 'ます', '。', '・', '選択', 'と', '集中', 'に', 'よる', '実効', '性', 'ある', '施策', 'を', '展開', '。', '限ら', 'れた', '財源']",['取り組み'],NO,取り組み,NO,NO
448,取り組み,再編・淘汰を迫られる状況にある中で、企業の経営基盤の強化に向けた様々な取り組みが円滑に進められるよう、行政が環境整備を進めることが重要である。行政の,"['再編', '・', '淘汰', 'を', '迫ら', 'れる', '状況', 'に', 'ある', '中', 'で', '、', '企業', 'の', '経営', '基盤', 'の', '強化', 'に', '向けた', '様々な', '取り組み', 'が', '円滑に', '進め', 'られる', 'よう', '、', '行政', 'が', '環境', '整備', 'を', '進める', 'こと', 'が', '重要である', '。', '行政', 'の']",['取り組み'],NO,取り組み,NO,NO
449,取り組み,日本独自の仕様により独自の世界を形成してきた傾向が強いため、世界標準に向けた取り組みが必要であることは確かである。●カード業界従来はクレジットカード業界を指していたが、最近,"['日本', '独自', 'の', '仕様', 'に', 'より', '独自の', '世界', 'を', '形成', 'して', 'きた', '傾向', 'が', '強い', 'ため', '、', '世界', '標準', 'に', '向けた', '取り組み', 'が', '必要である', 'こと', 'は', '確かである', '。●', 'カード', '業界', '従来', 'は', 'クレジットカード', '業界', 'を', '指して', 'いた', 'が', '、', '最近']",['取り組み'],NO,取り組み,NO,NO
450,取り組み,作られている．１医療保険制度の沿革明治末期に始まったわが国の医療保障への取り組みは，民間企業での仕組みづくりから始まり，千九百二十二（大正十一）年に健康保険法が制定され,"['作ら', 'れて', 'いる', '．', '１', '医療', '保険', '制度', 'の', '沿革', '明治', '末期', 'に', '始まった', 'わが国', 'の', '医療', '保障', 'へ', 'の', '取り組み', 'は', '，', '民間', '企業', 'で', 'の', '仕組み', 'づくり', 'から', '始まり', '，', '千九百二十二', '（', '大正', '十一', '）', '年', 'に', '健康', '保険', '法', 'が', '制定', 'さ', 'れ']",['取り組み'],NO,取り組み,NO,NO
451,取り組み,安全」と「安心」のギャップを埋めていく上でも重要であり、関係機関においてもさらなる取り組みが求められている。図１‐３‐４エネメイト事業における施設見学会図１‐３‐,"['安全', '」', 'と', '「', '安心', '」', 'の', 'ギャップ', 'を', '埋めて', 'いく', '上', 'でも', '重要であり', '、', '関係', '機関', 'に', 'おいて', 'も', 'さらなる', '取り組み', 'が', '求め', 'られて', 'いる', '。', '図', '１', '‐', '３', '‐', '４', 'エネメイト', '事業', 'に', 'おける', '施設', '見学', '会', '図', '１', '‐', '３', '‐']",['取り組み'],NO,取り組み,NO,NO
452,取り組み,や安全規則を守る，危険を予知してその原因をとりのぞくなど，働く人自身の積極的な取り組みも重要です。２職業病は，重い荷物をもち上げたり無理な姿勢を続けたり,"['や', '安全', '規則', 'を', '守る', '，', '危険', 'を', '予知', 'して', 'その', '原因', 'を', 'とりのぞく', 'など', '，', '働く', '人', '自身', 'の', '積極', '的な', '取り組み', 'も', '重要です', '。', '２', '職業', '病', 'は', '，', '重い', '荷物', 'を', 'もち', '上げたり', '無理な', '姿勢', 'を', '続けたり']",['取り組み'],NO,取り組み,NO,NO
453,取り組み,活動自体に対する支援の必要性のほか，研究開発の成果を実用化するための方策として，実利用を促進する取り組みの必要性などが挙げられている。本報告書を受け，総務省と厚生労働省は連携を図り,"['活動', '自体', 'に', '対する', '支援', 'の', '必要', '性', 'の', 'ほか', '，', '研究', '開発', 'の', '成果', 'を', '実用', '化', 'する', 'ため', 'の', '方策', 'と', 'して', '，', '実利', '用', 'を', '促進', 'する', '取り組み', 'の', '必要', '性', 'など', 'が', '挙げ', 'られて', 'いる', '。', '本', '報告', '書', 'を', '受け', '，', '総務', '省', 'と', '厚生', '労働', '省', 'は', '連携', 'を', '図り']",['取り組み'],NO,取り組み,NO,NO
454,取り組み,。こうした日韓間の成熟した関係づくりに向けて、日韓双方の経済協会では具体的な取り組みを開始している。いずれにしても、今の中国、韓国は、政治家に会っても,"['。', 'こうした', '日', '韓', '間', 'の', '成熟', 'した', '関係', 'づくり', 'に', '向けて', '、', '日', '韓', '双方', 'の', '経済', '協会', 'で', 'は', '具体', '的な', '取り組み', 'を', '開始', 'して', 'いる', '。', 'いずれ', 'に', 'して', 'も', '、', '今', 'の', '中国', '、', '韓国', 'は', '、', '政治', '家', 'に', '会って', 'も']",['取り組み'],NO,取り組み,NO,NO
455,取り組み,非常に長く、一言では収まらない。そこで、平成五年から現在までの主な取り組みを年表にしたものが、次ページの表である。豊後高田市では平成年代に入り、,"['非常に', '長く', '、', '一言', 'で', 'は', '収まら', 'ない', '。', 'そこ', 'で', '、', '平成', '五', '年', 'から', '現在', 'まで', 'の', '主な', '取り組み', 'を', '年表', 'に', 'した', 'もの', 'が', '、', '次', 'ページ', 'の', '表', 'である', '。', '豊後高田', '市', 'で', 'は', '平成', '年代', 'に', '入り', '、']",['取り組み'],NO,取り組み,NO,NO
456,取り組み,。「北陵中教育宣言」とは、あいさつ、授業・家庭学習、思いやりの心の３つを大切にする取り組みです。この中の思いやりの心を身に付けるために、本校の特色ある活動,"['。', '「', '北陵', '中', '教育', '宣言', '」', 'と', 'は', '、', 'あいさつ', '、', '授業', '・', '家庭', '学習', '、', '思いやり', 'の', '心', 'の', '３', 'つ', 'を', '大切に', 'する', '取り組み', 'です', '。', 'この', '中', 'の', '思いやり', 'の', '心', 'を', '身', 'に', '付ける', 'ため', 'に', '、', '本校', 'の', '特色', 'ある', '活動']",['取り組み'],NO,取り組み,NO,NO
457,取り組み,ため、内閣総理大臣を本部長とする食料・農業・農村政策推進本部を中心として、食料自給率の向上に向けた取り組みを始め、政府一体となって実効性のある施策の推進を図る。２施策の,"['ため', '、', '内閣', '総理', '大臣', 'を', '本', '部長', 'と', 'する', '食料', '・', '農業', '・', '農村', '政策', '推進', '本部', 'を', '中心', 'と', 'して', '、', '食料', '自給', '率', 'の', '向上', 'に', '向けた', '取り組み', 'を', '始め', '、', '政府', '一体', 'と', 'なって', '実効', '性', 'の', 'ある', '施策', 'の', '推進', 'を', '図る', '。', '２', '施策', 'の']",['取り組み'],NO,取り組み,NO,NO
458,取り組み,を回収・飼料化し、その飼料で育てられた畜産物を半年に１回、家庭に還元するなどの取り組みをしています。学校（給食）と協力したリサイクル作業（新潟県長岡市）（循環型社会基本計画第２章,"['を', '回収', '・', '飼料', '化', 'し', '、', 'その', '飼料', 'で', '育て', 'られた', '畜産', '物', 'を', '半年', 'に', '１', '回', '、', '家庭', 'に', '還元', 'する', 'など', 'の', '取り組み', 'を', 'して', 'い', 'ます', '。', '学校', '（', '給食', '）', 'と', '協力', 'した', 'リサイクル', '作業', '（', '新潟', '県', '長岡', '市', '）', '（', '循環', '型', '社会', '基本', '計画', '第', '２', '章']",['取り組み'],NO,取り組み,NO,NO
459,取り組み,を与える地球環境問題の解決のためには、各国ごとの努力に加え、グローバル及び地域的な取り組みが不可欠である。地球環境の破壊は、現時点では目に見えない場合でも、,"['を', '与える', '地球', '環境', '問題', 'の', '解決', 'の', 'ため', 'に', 'は', '、', '各国', 'ごと', 'の', '努力', 'に', '加え', '、', 'グローバル', '及び', '地域', '的な', '取り組み', 'が', '不可欠である', '。', '地球', '環境', 'の', '破壊', 'は', '、', '現', '時点', 'で', 'は', '目', 'に', '見え', 'ない', '場合', 'でも', '、']",['取り組み'],NO,取り組み,NO,NO
460,取り組み,５‐５母性保護・両立支援・介護休業を十点満点に補正した場合の平均値（産業別）ファミリーフレンドリー得点と労働組合の取り組み●ファミリーフレンドリー得点を左右する要因分析それでは、このファミリーフレンドリー得点はどのような要因で左右されるのだろうか,"['５', '‐', '５', '母性', '保護', '・', '両立', '支援', '・', '介護', '休業', 'を', '十', '点', '満点', 'に', '補正', 'した', '場合', 'の', '平均', '値', '（', '産業', '別', '）', 'ファミリーフレンドリー', '得点', 'と', '労働', '組合', 'の', '取り組み', '●', 'ファミリーフレンドリー', '得点', 'を', '左右する', '要因', '分析', 'それでは', '、', 'この', 'ファミリーフレンドリー', '得点', 'は', 'どのような', '要因', 'で', '左右さ', 'れる', 'のだろう', 'か']",['取り組み'],NO,取り組み,NO,NO
