134,取り組み,、鶴見小野駅周辺の再整備について検討調査を進めます。【都市整備局】鶴見区の防災の取り組みについては表面をご覧ください・防災キャラバン隊活動事業・災害時要援護者救援システムづくり事業・家具転倒防止器具取り付け事業・まるごとまちごとハザードマップｉｎ鶴見・（地域別）鶴見川洪水ハザードマップ作成事業,"['、', '鶴見', '小野', '駅', '周辺', 'の', '再', '整備', 'に', 'ついて', '検討', '調査', 'を', '進め', 'ます', '。', '【', '都市', '整備', '局', '】', '鶴見', '区', 'の', '防災', 'の', '取り組み', 'に', 'ついて', 'は', '表面', 'を', 'ご覧', 'ください', '・', '防災', 'キャラバン', '隊', '活動', '事業', '・', '災害', '時', '要', '援護', '者', '救援', 'システム', 'づくり', '事業', '・', '家具', '転倒', '防止', '器具', '取り付け', '事業', '・', 'まるごと', 'まち', 'ごと', 'ハザードマップ', 'ｉｎ', '鶴見', '・', '（', '地域', '別', '）', '鶴見', '川', '洪水', 'ハザードマップ', '作成', '事業']",['取り組み'],NO,取り組み,NO,NO
135,取り組み,が「重要伝統的建造群保存地区」として文化庁から指定されたことが、その後の内子町のさまざまな取り組みに大きな影響を及ぼした。第二に、内子町市街地の活性化を町周辺部の活性化に展開し,"['が', '「', '重要', '伝統', '的', '建造', '群', '保存', '地区', '」', 'と', 'して', '文化', '庁', 'から', '指定', 'さ', 'れた', 'こと', 'が', '、', 'その後', 'の', '内子', '町', 'の', 'さまざまな', '取り組み', 'に', '大きな', '影響', 'を', '及ぼした', '。', '第', '二', 'に', '、', '内子', '町', '市街', '地', 'の', '活性', '化', 'を', '町', '周辺', '部', 'の', '活性', '化', 'に', '展開', 'し']",['取り組み'],NO,取り組み,NO,NO
136,取り組み,」についても「そう思う」とする割合が高く（七十二．八％），土地の有効利用の取り組みへの参加については基本的に肯定的である。しかしながら，実際には，土地の有効利用,"['」', 'に', 'ついて', 'も', '「', 'そう', '思う', '」', 'と', 'する', '割合', 'が', '高く', '（', '七十二', '．', '八', '％', '）', '，', '土地', 'の', '有効', '利用', 'の', '取り組み', 'へ', 'の', '参加', 'に', 'ついて', 'は', '基本', '的に', '肯定', '的である', '。', 'しかしながら', '，', '実際', 'に', 'は', '，', '土地', 'の', '有効', '利用']",['取り組み'],NO,取り組み,NO,NO
137,取り組み,の世界的な発明も生まれています。創業のメッカを目指すものづくり都市として、さらに発展するための取り組みを紹介します。◆市政トピックスはままつ冬の蛍フェスタ二千七（十一／十七〜１／十四）消防出初式（１／５,"['の', '世界', '的な', '発明', 'も', '生まれて', 'い', 'ます', '。', '創業', 'の', 'メッカ', 'を', '目指す', 'もの', 'づくり', '都市', 'と', 'して', '、', 'さらに', '発展', 'する', 'ため', 'の', '取り組み', 'を', '紹介', 'し', 'ます', '。', '◆', '市政', 'トピックス', 'は', 'ま', 'まつ', '冬', 'の', '蛍', 'フェスタ', '二千七', '（', '十一', '／', '十七', '〜', '１', '／', '十四', '）', '消防', '出初式', '（', '１', '／', '５']",['取り組み'],NO,取り組み,NO,NO
138,取り組み,を出した。しかし，火山の有効な活用の方法について，住民全体で考え，その取り組みを実現させている。レポート例●資料１千九百九十一年台風第十九号の進路と家屋の被害千九百九十一年,"['を', '出した', '。', 'しかし', '，', '火山', 'の', '有効な', '活用', 'の', '方法', 'に', 'ついて', '，', '住民', '全体', 'で', '考え', '，', 'その', '取り組み', 'を', '実現', 'さ', 'せて', 'いる', '。', 'レポート', '例', '●', '資料', '１千九百九十一', '年', '台風', '第', '十九', '号', 'の', '進路', 'と', '家屋', 'の', '被害', '千九百九十一', '年']",['取り組み'],NO,取り組み,NO,NO
139,取り組み,製造現場における労働者の持つ技能や改善・提案の力であり、最近の国内生産回帰の動きや技能伝承・継承の取り組みは、こうした我が国の労働者が持つ能力への評価の現れである面も,"['製造', '現場', 'に', 'おける', '労働', '者', 'の', '持つ', '技能', 'や', '改善', '・', '提案', 'の', '力', 'であり', '、', '最近', 'の', '国', '内', '生産', '回帰', 'の', '動き', 'や', '技能', '伝承', '・', '継承', 'の', '取り組み', 'は', '、', 'こうした', '我が国', 'の', '労働', '者', 'が', '持つ', '能力', 'へ', 'の', '評価', 'の', '現れ', 'である', '面', 'も']",['取り組み'],NO,取り組み,NO,NO
140,取り組み,。事務用品を扱うＫ社では、環境に配慮した製品の開発のため様々な取り組みを進めています。その取り組みの一つとして、スギやヒノキ、カラマツなど間伐材を材料,"['。', '事務', '用品', 'を', '扱う', 'Ｋ', '社', 'で', 'は', '、', '環境', 'に', '配慮', 'した', '製品', 'の', '開発', 'の', 'ため', '様々な', '取り組み', 'を', '進めて', 'い', 'ます', '。', 'その', '取り組み', 'の', '一', 'つ', 'と', 'して', '、', 'スギ', 'や', 'ヒノキ', '、', 'カラマツ', 'など', '間伐', '材', 'を', '材料']",['取り組み'],NO,取り組み,NO,NO
141,取り組み,。事務用品を扱うＫ社では、環境に配慮した製品の開発のため様々な取り組みを進めています。その取り組みの一つとして、スギやヒノキ、カラマツなど間伐材を材料,"['。', '事務', '用品', 'を', '扱う', 'Ｋ', '社', 'で', 'は', '、', '環境', 'に', '配慮', 'した', '製品', 'の', '開発', 'の', 'ため', '様々な', '取り組み', 'を', '進めて', 'い', 'ます', '。', 'その', '取り組み', 'の', '一', 'つ', 'と', 'して', '、', 'スギ', 'や', 'ヒノキ', '、', 'カラマツ', 'など', '間伐', '材', 'を', '材料']",['取り組み'],NO,取り組み,NO,NO
142,取り組み,働き、暮らすことができる世田谷らしいワーク・ライフ・バランス推進のあり方について検討してまいります。地域活性化に向けた取り組み「地域の絆」の構築に向けて十一月にシンポジウムを開催し、地域の活性化,"['働き', '、', '暮らす', 'こと', 'が', 'できる', '世田谷', 'らしい', 'ワーク', '・', 'ライフ', '・', 'バランス', '推進', 'の', 'あり', '方', 'に', 'ついて', '検討', 'して', 'まいり', 'ます', '。', '地域', '活性', '化', 'に', '向けた', '取り組み', '「', '地域', 'の', '絆', '」', 'の', '構築', 'に', '向けて', '十一', '月', 'に', 'シンポジウム', 'を', '開催', 'し', '、', '地域', 'の', '活性', '化']",['取り組み'],NO,取り組み,NO,NO
143,取り組み,調査研究を行っています。第３節健やかに子供を育て・守るための環境づくり〜地域における取り組み〜１新子どもプランの推進平成十一年６月の生涯学習審議会答申「生活体験・自然体験が日本の子どもの心,"['調査', '研究', 'を', '行って', 'い', 'ます', '。', '第', '３', '節', '健やかに', '子供', 'を', '育て', '・', '守る', 'ため', 'の', '環境', 'づくり', '〜', '地域', 'に', 'おける', '取り組み', '〜', '１', '新', '子ども', 'プラン', 'の', '推進', '平成', '十一', '年', '６', '月', 'の', '生涯', '学習', '審議', '会', '答申', '「', '生活', '体験', '・', '自然', '体験', 'が', '日本', 'の', '子ども', 'の', '心']",['取り組み'],NO,取り組み,NO,NO
144,取り組み,申合せを行うこと等により農薬や化学肥料の削減に取り組んでいる事例がみられる。これらの取り組みを行っている集団を対象にした農林水産省「環境と調和した農業の推進に関する実態調査,"['申', '合せ', 'を', '行う', 'こと', '等', 'に', 'より', '農薬', 'や', '化学', '肥料', 'の', '削減', 'に', '取り組んで', 'いる', '事例', 'が', 'み', 'られる', '。', 'これ', 'ら', 'の', '取り組み', 'を', '行って', 'いる', '集団', 'を', '対象', 'に', 'した', '農林', '水産', '省', '「', '環境', 'と', '調和', 'した', '農業', 'の', '推進', 'に', '関する', '実態', '調査']",['取り組み'],NO,取り組み,NO,NO
145,取り組み,の売色風景をそのままに映したかのような情景で、陰子と客との取り組みを、廊下で遊女と客とが覗きながら一儀を働くといった図だ。廊下の,"['の', '売', '色', '風景', 'を', 'そのまま', 'に', '映した', 'か', 'の', 'ような', '情景', 'で', '、', '陰', '子', 'と', '客', 'と', 'の', '取り組み', 'を', '、', '廊下', 'で', '遊女', 'と', '客', 'と', 'が', '覗き', 'ながら', '一', '儀', 'を', '働く', 'と', 'いった', '図', 'だ', '。', '廊下', 'の']",['取り組み'],NO,取り組み,NO,NO
146,取り組み,機械設備のエネルギー利用効率が低いことも指摘されている。一方、環境保全のための行政の取り組み、規制等に関しては、環境監視及び管理に関する法・規制・制度や組織は整備されつつあるものの、管理や,"['機械', '設備', 'の', 'エネルギー', '利用', '効率', 'が', '低い', 'こと', 'も', '指摘', 'さ', 'れて', 'いる', '。', '一方', '、', '環境', '保全', 'の', 'ため', 'の', '行政', 'の', '取り組み', '、', '規制', '等', 'に', '関して', 'は', '、', '環境', '監視', '及び', '管理', 'に', '関する', '法', '・', '規制', '・', '制度', 'や', '組織', 'は', '整備', 'さ', 'れ', 'つつ', 'ある', 'もの', 'の', '、', '管理', 'や']",['取り組み'],NO,取り組み,NO,NO
147,取り組み,ついてお知らせしましたが、今月号は私たちにできる取り組みを紹介します。家庭でできる取り組みを考えるすぐできる十の取り組み私たちの生活を見直し、二酸化炭素の排出を減らすために,"['ついて', 'お', '知らせ', 'し', 'ました', 'が', '、', '今月', '号', 'は', '私', 'たち', 'に', 'できる', '取り組み', 'を', '紹介', 'し', 'ます', '。', '家庭', 'で', 'できる', '取り組み', 'を', '考える', 'すぐ', 'できる', '十', 'の', '取り組み', '私', 'たち', 'の', '生活', 'を', '見直し', '、', '二', '酸化', '炭素', 'の', '排出', 'を', '減らす', 'ため', 'に']",['取り組み'],NO,取り組み,NO,NO
148,取り組み,ついてお知らせしましたが、今月号は私たちにできる取り組みを紹介します。家庭でできる取り組みを考えるすぐできる十の取り組み私たちの生活を見直し、二酸化炭素の排出を減らすために,"['ついて', 'お', '知らせ', 'し', 'ました', 'が', '、', '今月', '号', 'は', '私', 'たち', 'に', 'できる', '取り組み', 'を', '紹介', 'し', 'ます', '。', '家庭', 'で', 'できる', '取り組み', 'を', '考える', 'すぐ', 'できる', '十', 'の', '取り組み', '私', 'たち', 'の', '生活', 'を', '見直し', '、', '二', '酸化', '炭素', 'の', '排出', 'を', '減らす', 'ため', 'に']",['取り組み'],NO,取り組み,NO,NO
149,取り組み,ついてお知らせしましたが、今月号は私たちにできる取り組みを紹介します。家庭でできる取り組みを考えるすぐできる十の取り組み私たちの生活を見直し、二酸化炭素の排出を減らすために,"['ついて', 'お', '知らせ', 'し', 'ました', 'が', '、', '今月', '号', 'は', '私', 'たち', 'に', 'できる', '取り組み', 'を', '紹介', 'し', 'ます', '。', '家庭', 'で', 'できる', '取り組み', 'を', '考える', 'すぐ', 'できる', '十', 'の', '取り組み', '私', 'たち', 'の', '生活', 'を', '見直し', '、', '二', '酸化', '炭素', 'の', '排出', 'を', '減らす', 'ため', 'に']",['取り組み'],NO,取り組み,NO,NO
150,取り組み,首相官邸の地球温暖化対策への取り組みに、政府内から不満の声が出ている。温暖化対策の推進役を果たしてきた関係４閣僚会合,"['首相', '官邸', 'の', '地球', '温暖', '化', '対策', 'へ', 'の', '取り組み', 'に', '、', '政府', '内', 'から', '不満の', '声', 'が', '出て', 'いる', '。', '温暖', '化', '対策', 'の', '推進', '役', 'を', '果たして', 'きた', '関係', '４', '閣僚', '会合']",['取り組み'],NO,取り組み,NO,NO
151,取り組み,として，河川や海岸に特有の自然と触れ合うことのできる機能を十分にいかした取り組みを推進するため，自然体験・環境教育の場等としての身近な水辺環境の整備等を実施している。警察,"['と', 'して', '，', '河川', 'や', '海岸', 'に', '特有の', '自然', 'と', '触れ合う', 'こと', 'の', 'できる', '機能', 'を', '十分に', 'いかした', '取り組み', 'を', '推進', 'する', 'ため', '，', '自然', '体験', '・', '環境', '教育', 'の', '場', '等', 'と', 'して', 'の', '身近な', '水辺', '環境', 'の', '整備', '等', 'を', '実施', 'して', 'いる', '。', '警察']",['取り組み'],NO,取り組み,NO,NO
152,取り組み,、「代表者の相談役」、「代表者の諫言役」の割合は低くなり、「新しい取り組みの担当」の割合が高くなっている（第３‐２‐十八図）。経営者と,"['、', '「', '代表', '者', 'の', '相談', '役', '」', '、', '「', '代表', '者', 'の', '諫言', '役', '」', 'の', '割合', 'は', '低く', 'なり', '、', '「', '新しい', '取り組み', 'の', '担当', '」', 'の', '割合', 'が', '高く', 'なって', 'いる', '（', '第', '３', '‐', '２', '‐', '十八', '図', '）', '。', '経営', '者', 'と']",['取り組み'],NO,取り組み,NO,NO
153,取り組み,情報の共有・発信をより早く行うことのできるシステムなどを備えるほか、地域の防災活動の取り組みなどを発信していきます。問危機管理室（☎三百二十二．六二三七、ＦＡＸ三百二十二．六〇三一）意見募集の方法▶閲覧場所,"['情報', 'の', '共有', '・', '発信', 'を', 'より', '早く', '行う', 'こと', 'の', 'できる', 'システム', 'など', 'を', '備える', 'ほか', '、', '地域', 'の', '防災', '活動', 'の', '取り組み', 'など', 'を', '発信', 'して', 'いき', 'ます', '。', '問', '危機', '管理', '室', '（', '☎', '三百二十二', '．', '六二三七', '、', 'ＦＡＸ', '三百二十二', '．', '六〇三一', '）', '意見', '募集', 'の', '方法', '▶', '閲覧', '場所']",['取り組み'],NO,取り組み,NO,NO
154,取り組み,、生涯学習の果たす役割はますます重要になってきています。生涯学習のあり方や地域社会の取り組みについて考えるため、多くの皆さんの積極的な参加をお待ちしています。問い合わせ,"['、', '生涯', '学習', 'の', '果たす', '役割', 'は', 'ますます', '重要に', 'なって', 'きて', 'い', 'ます', '。', '生涯', '学習', 'の', 'あり', '方', 'や', '地域', '社会', 'の', '取り組み', 'に', 'ついて', '考える', 'ため', '、', '多く', 'の', '皆さん', 'の', '積極', '的な', '参加', 'を', 'お', '待ち', 'して', 'い', 'ます', '。', '問い合わせ']",['取り組み'],NO,取り組み,NO,NO
155,取り組み,達成に向けた取り組みが進むよう促すとともに、国・地方公共団体等の特定事業主における社会全体の牽引役としての取り組みを促す。○結婚や出産後も育児をしながら働くことができるようにするための取り組み,"['達成', 'に', '向けた', '取り組み', 'が', '進む', 'よう', '促す', 'と', 'ともに', '、', '国', '・', '地方', '公共', '団体', '等', 'の', '特定', '事業', '主', 'に', 'おける', '社会', '全体', 'の', '牽引', '役', 'と', 'して', 'の', '取り組み', 'を', '促す', '。', '○', '結婚', 'や', '出産', '後', 'も', '育児', 'を', 'し', 'ながら', '働く', 'こと', 'が', 'できる', 'ように', 'する', 'ため', 'の', '取り組み']",['取り組み'],NO,取り組み,NO,NO
156,取り組み,達成に向けた取り組みが進むよう促すとともに、国・地方公共団体等の特定事業主における社会全体の牽引役としての取り組みを促す。○結婚や出産後も育児をしながら働くことができるようにするための取り組み,"['達成', 'に', '向けた', '取り組み', 'が', '進む', 'よう', '促す', 'と', 'ともに', '、', '国', '・', '地方', '公共', '団体', '等', 'の', '特定', '事業', '主', 'に', 'おける', '社会', '全体', 'の', '牽引', '役', 'と', 'して', 'の', '取り組み', 'を', '促す', '。', '○', '結婚', 'や', '出産', '後', 'も', '育児', 'を', 'し', 'ながら', '働く', 'こと', 'が', 'できる', 'ように', 'する', 'ため', 'の', '取り組み']",['取り組み'],NO,取り組み,NO,NO
157,取り組み,達成に向けた取り組みが進むよう促すとともに、国・地方公共団体等の特定事業主における社会全体の牽引役としての取り組みを促す。○結婚や出産後も育児をしながら働くことができるようにするための取り組み,"['達成', 'に', '向けた', '取り組み', 'が', '進む', 'よう', '促す', 'と', 'ともに', '、', '国', '・', '地方', '公共', '団体', '等', 'の', '特定', '事業', '主', 'に', 'おける', '社会', '全体', 'の', '牽引', '役', 'と', 'して', 'の', '取り組み', 'を', '促す', '。', '○', '結婚', 'や', '出産', '後', 'も', '育児', 'を', 'し', 'ながら', '働く', 'こと', 'が', 'できる', 'ように', 'する', 'ため', 'の', '取り組み']",['取り組み'],NO,取り組み,NO,NO
158,取り組み,を実現しようとする主張が力を増している。もちろん、千九百九十年代ＥＵのサステイナビリティへ向けた取り組みがまやかしだったということにはならない。都市と農村を統合的にとらえて、,"['を', '実現', 'しよう', 'と', 'する', '主張', 'が', '力', 'を', '増して', 'いる', '。', 'もちろん', '、', '千九百九十', '年', '代', 'ＥＵ', 'の', 'サステイナビリティ', 'へ', '向けた', '取り組み', 'が', 'まやかし', 'だった', 'と', 'いう', 'こと', 'に', 'は', 'なら', 'ない', '。', '都市', 'と', '農村', 'を', '統合', '的に', 'とらえて', '、']",['取り組み'],NO,取り組み,NO,NO
159,取り組み,努めます。今年度は、５施設で指定管理者による管理運営の開始と、導入施設の拡大の取り組みを進めます。また、ごみ収集業務の民間委託の拡大、市営バス事業の民間移譲に向けて取り組みます,"['努め', 'ます', '。', '今', '年度', 'は', '、', '５', '施設', 'で', '指定', '管理', '者', 'に', 'よる', '管理', '運営', 'の', '開始', 'と', '、', '導入', '施設', 'の', '拡大', 'の', '取り組み', 'を', '進め', 'ます', '。', 'また', '、', 'ごみ', '収集', '業務', 'の', '民間', '委託', 'の', '拡大', '、', '市営', 'バス', '事業', 'の', '民間', '移譲', 'に', '向けて', '取り組み', 'ます']",['取り組み'],NO,取り組み,NO,NO
160,取り組み,努めます。今年度は、５施設で指定管理者による管理運営の開始と、導入施設の拡大の取り組みを進めます。また、ごみ収集業務の民間委託の拡大、市営バス事業の民間移譲に向けて取り組みます,"['努め', 'ます', '。', '今', '年度', 'は', '、', '５', '施設', 'で', '指定', '管理', '者', 'に', 'よる', '管理', '運営', 'の', '開始', 'と', '、', '導入', '施設', 'の', '拡大', 'の', '取り組み', 'を', '進め', 'ます', '。', 'また', '、', 'ごみ', '収集', '業務', 'の', '民間', '委託', 'の', '拡大', '、', '市営', 'バス', '事業', 'の', '民間', '移譲', 'に', '向けて', '取り組み', 'ます']",['取り組み'],NO,取り組み,NO,NO
161,取り組み,な推進に努めている。また，各種の広報啓発活動や青少年育成国民運動の支援等を行い，国民的な取り組みの活性化を図っている。この章では，こうした内閣府が講じている施策など,"['な', '推進', 'に', '努めて', 'いる', '。', 'また', '，', '各種の', '広報', '啓発', '活動', 'や', '青少年', '育成', '国民', '運動', 'の', '支援', '等', 'を', '行い', '，', '国民', '的な', '取り組み', 'の', '活性', '化', 'を', '図って', 'いる', '。', 'この', '章', 'で', 'は', '，', 'こうした', '内閣', '府', 'が', '講じて', 'いる', '施策', 'など']",['取り組み'],NO,取り組み,NO,NO
162,取り組み,のための適切な対応への一層の充実を図ることができる。なお、以上の取り組みを行うに際しては、社内のシステム部門と法務部門との共同作業が不可欠になること,"['の', 'ため', 'の', '適切な', '対応', 'へ', 'の', '一層', 'の', '充実', 'を', '図る', 'こと', 'が', 'できる', '。', 'なお', '、', '以上', 'の', '取り組み', 'を', '行う', 'に', '際して', 'は', '、', '社', '内', 'の', 'システム', '部門', 'と', '法務', '部門', 'と', 'の', '共同', '作業', 'が', '不可欠に', 'なる', 'こと']",['取り組み'],NO,取り組み,NO,NO
163,取り組み,過去、そういったケースがあったのかなかったのか、あるいは今後どういう取り組みをされるのか、特に、南野法務大臣だから、この点についてお伺いをしたいと,"['過去', '、', 'そういった', 'ケース', 'が', 'あった', 'の', 'か', 'なかった', 'の', 'か', '、', 'あるいは', '今後', 'どういう', '取り組み', 'を', 'さ', 'れる', 'の', 'か', '、', '特に', '、', '南野', '法務', '大臣', 'だ', 'から', '、', 'この', '点', 'に', 'ついて', 'お伺い', 'を', 'し', 'たい', 'と']",['取り組み'],NO,取り組み,NO,NO
164,取り組み,ています。二千年７月の九州・沖縄サミット外相会合の際に、わが国は紛争予防のための開発協力による取り組みを「アクション・フロム・ジャパン」としてまとめました。そこでは紛争予防、紛争発生時の緊急人道支援、紛争後の,"['てい', 'ます', '。', '二千', '年', '７', '月', 'の', '九州', '・', '沖縄', 'サミット', '外', '相', '会合', 'の', '際', 'に', '、', 'わが国', 'は', '紛争', '予防', 'の', 'ため', 'の', '開発', '協力', 'に', 'よる', '取り組み', 'を', '「', 'アクション', '・', 'フロム', '・', 'ジャパン', '」', 'と', 'して', 'まとめ', 'ました', '。', 'そこ', 'で', 'は', '紛争', '予防', '、', '紛争', '発生', '時', 'の', '緊急', '人道', '支援', '、', '紛争', '後', 'の']",['取り組み'],NO,取り組み,NO,NO
165,取り組み,。昨年十二月二十四日に、企画課長を事務局長に十五人態勢で実施本部を設立。全国で最も早い取り組みという。【毎日新聞・大賀英作】,"['。', '昨年', '十二', '月', '二十四', '日', 'に', '、', '企画', '課長', 'を', '事務', '局長', 'に', '十五', '人', '態勢', 'で', '実施', '本部', 'を', '設立', '。', '全国', 'で', '最も', '早い', '取り組み', 'と', 'いう', '。', '【', '毎日新聞', '・', '大賀', '英', '作', '】']",['取り組み'],NO,取り組み,NO,NO
166,取り組み,を次代の社員に継承し、発展させる機会を提供することは今後欠かすことのできない取り組みだ。それには遺伝子をしっかりと認識し、継承・進化させるコミュニケーションの機会を持つことが,"['を', '次代', 'の', '社員', 'に', '継承', 'し', '、', '発展', 'さ', 'せる', '機会', 'を', '提供', 'する', 'こと', 'は', '今後', '欠かす', 'こと', 'の', 'でき', 'ない', '取り組み', 'だ', '。', 'それ', 'に', 'は', '遺伝子', 'を', 'しっかり', 'と', '認識', 'し', '、', '継承', '・', '進化', 'さ', 'せる', 'コミュニケーション', 'の', '機会', 'を', '持つ', 'こと', 'が']",['取り組み'],NO,取り組み,NO,NO
